title,url,source,date,language,state,district,search_term,full_text,relevance_score
"MP Weather: बदला मौसम का मिजाज, 24 घंटे में कई जिलों में बारिश, पारा 44 डिग्री, अगले 4 दिन आंधी-बारिश का अलर्ट - Amar Ujala",https://news.google.com/rss/articles/CBMi-AFBVV95cUxQVE1PamlHX29sLUxQdVE4NXNBVWo2Y3FFWkI0SmlTS3ZtOW5mSkhvaENiaTNMQnBrS1FGVVd6RURQTmZFVEdoYko1aHJ3MjNJcmJydHVzOUlkdE5NWFVhemNreUNRM3hza0pnT0IxRGFKVm14Qk1CZFpyYXBwQlNLeS1BWlVYQVM5d0tnTC1ud2FNMzRXQ25vc0R5REVYUThVM2lXbi1QWDdPZWFGZzc1MkhlRU5fNVA4c1ZNdTZMTGRuME9QTGlMLVhFM1lTcGNlRnB4TGQxSkFpSWtKR3NFSUZHd0dBbndtQjlPRENVLW4yWk5nQ0g3b9IB_gFBVV95cUxPc0E0Q3lZazdaQXVUY3pfeVJTVmp3NWpmVm1KczQ5ZG8zN25zZmdBRkRNa3NDQXlxQUpPNnFMZFVQWkUyUXROSGtQVXNWNEstcExWcm5jQzBXWEZack15SlZPRmw4b182WEdEMkhLMjc4aW1nSG9NX2JVMm9qajlZYm4zVU1KeXJXRGxvQ3Z2LVRhRXlyeE5tY05VanVzR0pwSHFFT01mZURVcWlxa2pSNmtST3pPby04YWtZaUVSQ3dHQ19jZUlSNjVGbl9RRTVRZlNhOGkxTVFURUpFNzRxREFLaVdKUnR5RzlBZXZEcloyamROc0hVRXh2S2ZuUQ?oc=5,Amar Ujala,2026-05-04T19:14:27+05:30,hi,Madhya Pradesh,,"(""हीट एक्शन प्लान"" OR ""गर्मी से राहत"" OR चेतावनी OR ""रेड अलर्ट"" OR ""ऑरेंज अलर्ट"" OR ""येलो अलर्ट"" OR एडवाइजरी OR ""राहत सामग्री"" OR ""राहत शिविर"" OR मुआवजा) Madhya Pradesh","{""_id"":""69f8a13e01026d7e040ddf72"",""slug"":""mp-weather-weather-takes-a-turn-rain-in-several-districts-within-24-hours-mercury-hits-44-degrees-storm-an-2026-05-04"",""type"":""story"",""status"":""publish"",""title_hn"":""MP Weather: एमपी में मौसम के दो मिजाज, कहीं आग उगल रहा सूरज तो कहीं बारिश से तरबतर हो रहे इलाके, चेतावनी जारी"",""category"":{""title"":""City & states"",""title_hn"":""शहर और राज्य"",""slug"":""city-and-states""}}
MP Weather: एमपी में मौसम के दो मिजाज, कहीं आग उगल रहा सूरज तो कहीं बारिश से तरबतर हो रहे इलाके, चेतावनी जारी
विज्ञापन
सार
मध्यप्रदेश में बीते 24 घंटों में कई जिलों में बारिश और आंधी का असर देखने को मिला। अगले चार दिनों तक प्रदेश में गरज-चमक, तेज हवाओं और कहीं-कहीं ओलावृष्टि के साथ मौसम ऐसा ही बना रहने की संभावना है, जहां बारिश राहत भी दे रही है और कुछ जगहों पर परेशानी भी बढ़ा रही है।
विज्ञापन
विस्तार
भीषण गर्मी के बीच मध्यप्रदेश में मौसम ने अचानक करवट ले ली है। पिछले 24 घंटों के दौरान प्रदेश के कई जिलों में आंधी, गरज-चमक और बारिश का दौर देखने को मिला। कई स्थानों पर तेज हवाओं के साथ हल्की से मध्यम बारिश दर्ज की गई, जिससे तापमान में गिरावट आई और लोगों को गर्मी से राहत मिली। मौसम विभाग के अनुसार, यह बदलाव पश्चिमी विक्षोभ और चक्रवाती परिसंचरण के सक्रिय होने के कारण हुआ है, जिससे वातावरण में नमी बढ़ी है और प्रदेश के अलग-अलग हिस्सों में अस्थिर मौसम बना हुआ है। वहीं सोमवार को अधिकतम तापमान 44 डिग्री तक पहुंच गया।
इन जिलों में दर्ज हुई बारिश और आंधी
बीते 24 घंटों में भोपाल, विदिशा, रायसेन, सीहोर, राजगढ़, सागर, दमोह, शहडोल, अनूपपुर, मंडला, सिवनी, रीवा, मऊगंज, डिंडोरी और आसपास के कई इलाकों में बारिश हुई। कुछ जिलों में तेज हवाओं के साथ बूंदाबांदी तो कहीं मध्यम बारिश दर्ज की गई। ग्रामीण इलाकों में आंधी के कारण पेड़ों की डालियां टूटने और बिजली आपूर्ति प्रभावित होने की खबरें भी सामने आई हैं।
कहीं राहत तो कहीं आफत बनी बारिश
जहां एक ओर बारिश से लोगों को गर्मी से राहत मिली, वहीं कुछ इलाकों में तेज आंधी और बारिश ने परेशानी भी बढ़ा दी। कई जगहों पर बिजली गुल होने, पेड़ गिरने और फसलों को नुकसान की स्थिति सामने आई है, जिससे किसानों की चिंता बढ़ गई है। मौसम विभाग ने संकेत दिए हैं कि आने वाले चार दिनों तक प्रदेश में मौसम इसी तरह बना रहेगा। अलग-अलग संभागों में अलग-अलग दिनों पर गरज-चमक, बारिश और तेज हवाओं की गतिविधियां जारी रहेंगी।
अगले 4 दिन तक जारी रहेगा मौसम का असर
तेज आंधी और ओलावृष्टि का अलर्ट
सीधी, अनूपपुर और नीमच के कुछ हिस्सों में 50 से 60 किलोमीटर प्रति घंटे की रफ्तार से तेज हवाएं चल सकती हैं। इसके साथ ही गरज-चमक और कहीं-कहीं ओलावृष्टि की भी संभावना जताई गई है। बारिश और बादलों के असर से प्रदेश के कई हिस्सों में तापमान में 2 से 4 डिग्री तक गिरावट दर्ज की गई है। हालांकि उमस के कारण कुछ इलाकों में अभी भी लोगों को परेशानी का सामना करना पड़ रहा है।

आज कहां कितना रहा तापमान
इन जिलों में तापमान में गिरावट
बारिश और बादलों के कारण ग्वालियर (-4.8°C), दतिया (-5.2°C), शिवपुरी (-3°C), टीकमगढ़ (-3.5°C), खजुराहो (-7.2°C) और सागर (-1.6°C) में तापमान में गिरावट दर्ज की गई है। इन इलाकों में मौसम बदलने से गर्मी से राहत मिली।

इन में बढ़ा तापमान
वहीं कुछ जिलों में तापमान बढ़ा भी है। नर्मदापुरम (+1.9°C), खंडवा (+0.4°C), खरगोन (+0.2°C), मंडला (+0.9°C) और जबलपुर (+0.8°C) में पारा बढ़ा है, जिससे यहां गर्मी का असर बरकरार है। मौसम विभाग ने लोगों को सतर्क रहने की सलाह दी है। तेज आंधी और बिजली गिरने की आशंका को देखते हुए खुले मैदान, पेड़ों और बिजली के खंभों से दूर रहने की अपील की गई है। किसानों को भी फसलों की सुरक्षा के लिए जरूरी कदम उठाने को कहा गया है।
Trending Videos
इन जिलों में दर्ज हुई बारिश और आंधी
बीते 24 घंटों में भोपाल, विदिशा, रायसेन, सीहोर, राजगढ़, सागर, दमोह, शहडोल, अनूपपुर, मंडला, सिवनी, रीवा, मऊगंज, डिंडोरी और आसपास के कई इलाकों में बारिश हुई। कुछ जिलों में तेज हवाओं के साथ बूंदाबांदी तो कहीं मध्यम बारिश दर्ज की गई। ग्रामीण इलाकों में आंधी के कारण पेड़ों की डालियां टूटने और बिजली आपूर्ति प्रभावित होने की खबरें भी सामने आई हैं।
विज्ञापन
विज्ञापन
कहीं राहत तो कहीं आफत बनी बारिश
जहां एक ओर बारिश से लोगों को गर्मी से राहत मिली, वहीं कुछ इलाकों में तेज आंधी और बारिश ने परेशानी भी बढ़ा दी। कई जगहों पर बिजली गुल होने, पेड़ गिरने और फसलों को नुकसान की स्थिति सामने आई है, जिससे किसानों की चिंता बढ़ गई है। मौसम विभाग ने संकेत दिए हैं कि आने वाले चार दिनों तक प्रदेश में मौसम इसी तरह बना रहेगा। अलग-अलग संभागों में अलग-अलग दिनों पर गरज-चमक, बारिश और तेज हवाओं की गतिविधियां जारी रहेंगी।
अगले 4 दिन तक जारी रहेगा मौसम का असर
- पहला दिन: भोपाल, विदिशा, रायसेन, सीहोर, राजगढ़, आगर, शाजापुर, सागर और दमोह में गरज-चमक के साथ हल्की बारिश और तेज हवाएं
- दूसरा दिन: रीवा, मऊगंज, शहडोल, अनूपपुर, डिंडोरी, मंडला, सिवनी और बालाघाट में बारिश और आंधी
- तीसरा दिन: जबलपुर, नरसिंहपुर, कटनी, उमरिया और छिंदवाड़ा में सक्रिय मौसम, गरज-चमक के साथ बारिश
- चौथा दिन: ग्वालियर-चंबल और मालवा-निमाड़ के जिलों जैसे नीमच, मंदसौर, धार, खरगोन और बड़वानी में आंधी और हल्की बारिश
तेज आंधी और ओलावृष्टि का अलर्ट
सीधी, अनूपपुर और नीमच के कुछ हिस्सों में 50 से 60 किलोमीटर प्रति घंटे की रफ्तार से तेज हवाएं चल सकती हैं। इसके साथ ही गरज-चमक और कहीं-कहीं ओलावृष्टि की भी संभावना जताई गई है। बारिश और बादलों के असर से प्रदेश के कई हिस्सों में तापमान में 2 से 4 डिग्री तक गिरावट दर्ज की गई है। हालांकि उमस के कारण कुछ इलाकों में अभी भी लोगों को परेशानी का सामना करना पड़ रहा है।

इन में बढ़ा तापमान
वहीं कुछ जिलों में तापमान बढ़ा भी है। नर्मदापुरम (+1.9°C), खंडवा (+0.4°C), खरगोन (+0.2°C), मंडला (+0.9°C) और जबलपुर (+0.8°C) में पारा बढ़ा है, जिससे यहां गर्मी का असर बरकरार है। मौसम विभाग ने लोगों को सतर्क रहने की सलाह दी है। तेज आंधी और बिजली गिरने की आशंका को देखते हुए खुले मैदान, पेड़ों और बिजली के खंभों से दूर रहने की अपील की गई है। किसानों को भी फसलों की सुरक्षा के लिए जरूरी कदम उठाने को कहा गया है।",1.0
