title,url,source,date,language,state,district,search_term,full_text,relevance_score
"आंधी-बारिश के साथ ओले गिरने की चेतावनी: 70 की स्पीड से हवा चलेगी; पारा 40 डिग्री के करीब, जानें- आगे कैसा र... - Dainik Bhaskar",https://news.google.com/rss/articles/CBMiwAFBVV95cUxQbDNwdE1ibUhkcFl5NkY5U2dJVy1LUXZxTE1ESU1MX0xQYzdYNEQwWVhmakVPc1UyVWVuOGtQZjloTVRXb3huZUhJcnFfTDhQUXRSVXFJdy0xMTdmTndZTzNpZzJaYm5xdGdaa0ZBVzVWQkc2bmZPbXJzU3hrWktzRktWN1h2OGRVNWxNZGlVZXRJbll4a1lJSWlScGJCTENPWDJNaVVoUmp4NlIwRkl1bUhneENfZTJCM3dic2ZVTzjSAcYBQVVfeXFMUGFsWl9pRjhEaXlFNGcxbk1pQjdCdmxjRENZMzJFWjBXZHVZaldIcnhITVBjLW1MeHpqNWZxdzZ3WjB6NWxzUWVCaWpWTFI2TDZmN0VXVThOTHVfeUJLRjc5clE0WjFfRUVqQlBkM1UtUl9UTjIzc2p5eVhOZzV3QnpzSGY1b3JYOVJVZ09DMkctLVY4WVYyT3hrM3lsa3dReUFtNS1ORjhvaXhGVFhtQU1WTkZuWkQzUXdYd010bDFpNXRWT253?oc=5,Dainik Bhaskar,2026-06-03T05:49:13+05:30,hi,Rajasthan,Ajmer,"(""हीट एक्शन प्लान"" OR ""गर्मी से राहत"" OR चेतावनी OR ""रेड अलर्ट"" OR ""ऑरेंज अलर्ट"" OR ""येलो अलर्ट"" OR एडवाइजरी OR ""राहत सामग्री"" OR ""राहत शिविर"" OR मुआवजा) Rajasthan","- Rajasthan Weather Rainfall Alert Photos Update; Jodhpur Ajmer Jaipur | Western Disturbance
उदयपुर में बारिश, 5 जिलों में आंधी-बरसात का अलर्ट:70 की स्पीड से हवा चलेगी; ओले भी गिर सकते हैं, जानें- कब तक रहेगा असर
- कॉपी लिंक
राजस्थान में एक नया वेस्टर्न डिस्टरबेंस एक्टिव होगा। मौसम विभाग ने 5 जिलों में आंधी-बारिश का ऑरेंज अलर्ट जारी किया है। वहीं, 5 जिलों में यलो अलर्ट है।
इस दौरान 70KM तक की स्पीड से हवा चल सकती है। जबकि कई इलाकों में ओले भी गिर सकते हैं। उदयपुर में बुधवार दोपहर बाद मौसम बदला और बारिश हुई।
पिछले 24 घंटे में मौसम साफ रहा। पश्चिमी राजस्थान के बीकानेर, श्रीगंगानगर, फलोदी, जैसलमेर में अधिकतम तापमान 40 से 43 डिग्री सेल्सियस के बीच रहा। शेष जिलों में 40 डिग्री सेल्सियस से नीचे दर्ज हुआ।
मौसम एक्सपर्ट के अनुसार बुधवार (3 जून) से एक्टिव नए सिस्टम का असर 6 जून तक रह सकता है। इस दौरान गर्मी कम रहेगी।
राजस्थान में मौसम की 3 तस्वीर…
ये शहर सबसे ज्यादा गर्म",1.0
