title,url,source,date,language,state,district,search_term,full_text,relevance_score
Maharashtra Heatwave Forces Class Schedule Changes in Nanded - Devdiscourse,https://news.google.com/rss/articles/CBMitgFBVV95cUxQUWp3bnhyblE2RldzNVk5LTRzcjV6RDRrcUZ6NUM1allLQ1ZldnB3YnlsZFVVNUE2cVhNN0VqT2dieHVVWDdsRzl4OWN1eVVGMkoxalhBZmNXMmtVdmJnSkJBUmVKODM3UkpvUFZLcnpuZXg2YWdmRVNrNXlEYVF0U25BMHR1dzQtMzNHR25oT2RMUUVDOUF4ZXBIbmowS2hZb0VUb2ppMG56SVY3aTZJNU9rS203Z9IBuwFBVV95cUxNV29IOHRrajZyVTM1TzBMdERvY1hTMkpxY3g2bEhERV9EU3BqUkdmR0t5Q29iSFJoUmdza1gwTVM4Mnh1LXZVMjJrWll4c3phWjhEY3dmLUFfYkt5T1BBZVhobm0walFHY1RCZHNlRjBLVWIxVzROVmdxZzY3WUVBaTBOQURUX2dQQ3FwTVRlYV9vUUl4b3hTOTZKME1MMU1UWlhfal9wRDNRWmtST3VCZkdUWkd6Z3hNdTZv?oc=5,Devdiscourse,2026-05-07T10:32:41+05:30,en,Maharashtra,Nanded,"(heatwave OR ""heat wave"" OR ""severe heatwave"" OR ""extreme heat"" OR ""heat spell"" OR ""scorching heat"" OR ""blistering heat"" OR ""sweltering heat"" OR ""hot winds"" OR loo OR ""hot loo winds"" OR ""intense heat"" OR ""unbearable heat"" OR ""deadly heat"" OR heat OR ""weather forecast"" OR ""weather update"" OR ""weather alert"" OR ""IMD forecast"" OR ""IMD prediction"" OR ""IMD alert"" OR IMD OR ""rising temperatures"" OR ""temperatures expected to rise"" OR ""relief from heat"" OR ""respite from heat"" OR ""heat respite"" OR ""respite from scorching heat"") Maharashtra","Maharashtra Heatwave Forces Class Schedule Changes in Nanded
In response to heatwave conditions, Nanded's district administration in Maharashtra has restricted private coaching institutes from holding in-person classes between noon and 4 pm. The directive, issued by District Collector Rahul Kardile, aims to protect students from the extreme heat by encouraging morning/evening or digital sessions.
In light of the sweltering heatwave conditions, Nanded district officials in Maharashtra have imposed restrictions on private coaching institutes, preventing them from conducting physical classes from noon to 4 p.m., officials reported.
Nanded, part of the Marathwada region, has experienced soaring temperatures in recent days. To prioritize student health and minimize heat exposure risks, District Collector Rahul Kardile issued an order on Wednesday, instructing coaching centers to shift classes to cooler morning and evening times or transition to online formats.
The directive also emphasizes the importance of staying informed through weather updates from the Meteorological Department and adhering to safety protocols, such as providing drinking water, shaded areas, and promoting health awareness among students. Non-compliance with the order will result in stern consequences for institutions.
(With inputs from agencies.)",0.8500000000000001
