title,url,source,date,language,state,district,search_term,full_text,relevance_score
Scorching Heatwave Engulfs Rajasthan: Temperatures Soar Above Normal - Devdiscourse,https://news.google.com/rss/articles/CBMizAFBVV95cUxPYklwUkUzWVpRYkkxU1pxaUVKTzZsRmtwblB5alNMTWtzMWFCMWR4Z2NlWnVhVk01bGZEaU5QZnhRdXN0cEEzaUxLLXJybnY4RTM1ci1pelpUemZHdXBsNWxodnBBX0F1R2tHOVlpVnJMcUdQcDZ1SFEtdmZaRzZWWnlhbHlyLWh6bU9XLURUZnQ1ZTJVMjJkTXZkN01XNUMwZjZ2bkViOVp1ZjVoMXFTM1QyU2pCbHl3OUhjdm52dUIzV0NwN2pQeDBzb1_SAdIBQVVfeXFMT0RqdnB1c3doSUY3d2UwNXU5SjJROUh1SThlSENWM2phUmpyS1NRTWVyTENNUTU0VlEtbmNpR3Z6Sy1hX3pLNlJDVEFWR2Z6Q1ZQWUhDclFZWERVN3IwUWhkTmVFOVhXdF9DSUVRdlhtajZCSDVLdGNrenBfanNJbVFfb0xvbWJGeEZ3dkZHQlBmR2hrZE1GSDVuTkZ3eWNfekM3c3ZBSEVBTHRiZURESmVhczVQMElTcGhxNVJzQ3h4NFZXd01SUzg3dWJseW8xeWVn?oc=5,Devdiscourse,2026-04-18T19:28:42+05:30,en,Rajasthan,Barmer,"(heatwave OR ""heat wave"" OR ""severe heatwave"" OR ""extreme heat"" OR ""heat spell"" OR ""scorching heat"" OR ""blistering heat"" OR ""sweltering heat"" OR ""hot winds"" OR loo OR ""hot loo winds"" OR ""intense heat"" OR ""unbearable heat"" OR ""deadly heat"" OR heat OR ""weather forecast"" OR ""weather update"" OR ""weather alert"" OR ""IMD forecast"" OR ""IMD prediction"" OR ""IMD alert"" OR IMD OR ""rising temperatures"" OR ""temperatures expected to rise"" OR ""relief from heat"" OR ""respite from heat"" OR ""heat respite"" OR ""respite from scorching heat"") Rajasthan","Scorching Heatwave Engulfs Rajasthan: Temperatures Soar Above Normal
Rajasthan experienced a relentless heatwave as temperatures surged across the state, with Churu recording the highest at 42.8°C. Other regions like Chittorgarh and Barmer also faced scorching heat, causing disruptions in daily life as residents took protective measures against the intense sun.
Rajasthan is gripped by a severe heatwave, with mercury levels rising well above normal in several areas on Saturday.
Churu led the temperature chart at 42.8 degrees Celsius, surpassing the norm by 3.1 degrees. Cities such as Chittorgarh, Barmer, and Kota followed closely, resulting in a heated weekend across the state.
This intense sunlight affected daily routines, as residents adopted various measures like using umbrellas to combat the oppressive heat, highlighting the broader impact of the soaring temperatures on communities.
(With inputs from agencies.)
- protection",1.0
