title,url,source,date,language,state,district,search_term,full_text,relevance_score
School timings changed in Jharkhand following IMD's heat wave warning - Vartha Bharati,https://news.google.com/rss/articles/CBMiqwFBVV95cUxNU1djSEQ5UUlDUW1vTXR2OVJJSC1XM3VicnNZZDJYV3RscTNFRVpWbW9wZUNCblRkNTFqSEpJMFRiajZxOGdNWjROczN3eDVjUDdDVnB6VlNMdUczWWhMaWM4YUpPU1c5QnhDNHRZdWdvQkJrbVVsWGNZTEs1QXI5TTVQVnBDMXNLN0tka1VEWlExSjJCTjBmMGxRXzFDV1FYZE1MWkhUN3BaWFU?oc=5,Vartha Bharati,2026-04-20T18:05:00+05:30,en,Jharkhand,Bokaro,"heatwave (Bokaro OR Chatra OR Deoghar OR Dhanbad OR Dumka OR ""East Singhbhum"" OR Garhwa OR Giridih OR Godda OR Gumla OR Hazaribag OR Jamtara OR Khunti OR Koderma OR Latehar OR Lohardaga OR Pakur OR Palamu OR Ramgarh OR Ranchi OR Sahibganj OR Seraikela-Kharsawan OR Simdega OR ""West Singhbhum"") Jharkhand","Ranchi (PTI): The Jharkhand government on Monday announced a change in school timings from April 21 in view of heat wave-like conditions across the state, an official said.
Under the new schedule, students from kindergarten to class 8 will attend schools from 7 am to 11.30 am, while senior pupils from class 9 to 12 will continue classes till noon, an order by the education department said.
This adjustment applies to all categories of government, aided, unaided, and private schools in the state till further orders. Schools earlier followed different timings that extended well beyond noon.
The India Meteorological Department (IMD) on Monday issued a 'yellow' alert (be updated) of heat wave from April 20 to April 22 for northwest, central and southern parts of Jharkhand.
The districts facing heat wave-like situations on Monday include Garhwa, Palamu, Chatra, Latehar, Bokaro and Dhanbad.
The districts likely to be affected by the heat wave on Tuesday include Garhwa, Palamu, Chatra, Latehar, Bokaro, Dhanbad, Simdega, Saraikela-Kharswan, and East and West Singhbhum, according to the weather bulletin issued by Ranchi Meteorological Centre.
Daltonganj recorded the state's highest maximum temperature at 43.9 degrees Celsius on Sunday evening, while Bokaro simmered at 43.1 degrees Celsius and Ranchi registered 39.3 degrees Celsius.
State Health and Disaster Management Minister Irfan Ansari on Sunday advocated for the change of school timings in view of the heat wave-like situation in the state.
Ansari directed all the officials of his department to remain alert and take necessary steps so that the people, especially children, are not affected by the heat wave.
The weather department has advised people to stay hydrated, wear light-coloured, loose-fitting cotton clothes, and cover their heads with a cloth, hat, or umbrella when outdoors.
Let the Truth be known. If you read VB and like VB, please be a VB Supporter and Help us deliver the Truth to one and all.
New Delhi (PTI): A wanted criminal carrying a Rs 15,000 reward was arrested following a brief exchange of fire near southeast Delhi's Amar Colony, police said on Tuesday.
According to the police, information was received that Mohammad Rizwan, who is wanted by Uttar Pradesh Police, was in Amar Colony area, and a trap was laid to intercept him.
However, when the police team attempted to apprehend Rizwan, he opened fire in a desperate bid to escape.
The team retaliated and Rizwan sustained a bullet injury in his right leg, and was subsequently overpowered by the police team, a senior officer said.
He was immediately taken into custody and provided medical assistance.
Police said Rizwan had come to Delhi with the intention of committing a crime, but was apprehended before he could execute his plan.
A case has been registered under relevant provisions, and further investigation is underway to ascertain his involvement in other criminal cases, the officer said.",1.0
