title,url,source,date,language,state,district,search_term,full_text,relevance_score
Delhi Weather Update: IMD Predicts 41°C+ Temperatures As Heatwave Conditions Continue Across NCR - Republic World,https://news.google.com/rss/articles/CBMi5gFBVV95cUxPQTNQTjA3ZjlqLWktUVFTMWlXV21ldVJhYzVQQVhnN3BMMDFNNjJmcUtzVjZBWWZaWURHejFld1RUUE03aFhoUndRU0FuQWota2NxbGRkU2x6Y044ME5XNlhKV01oV29saEZxV2lrM19KNDR4aDdoT181TTliajhyLUlRbnlxWGhSZVdVaFlDY2U1dU84V3UtUUVzM0lHN3V4d1IyWVlCQ09sTEJaTGNxNGRIMTVIcnZMTF9kQ1g1djFRcklJUEl5ZU5aajVIajdBVWplWkNVN010UDlKRGt6aXJIYS1YUdIB5gFBVV95cUxPQTNQTjA3ZjlqLWktUVFTMWlXV21ldVJhYzVQQVhnN3BMMDFNNjJmcUtzVjZBWWZaWURHejFld1RUUE03aFhoUndRU0FuQWota2NxbGRkU2x6Y044ME5XNlhKV01oV29saEZxV2lrM19KNDR4aDdoT181TTliajhyLUlRbnlxWGhSZVdVaFlDY2U1dU84V3UtUUVzM0lHN3V4d1IyWVlCQ09sTEJaTGNxNGRIMTVIcnZMTF9kQ1g1djFRcklJUEl5ZU5aajVIajdBVWplWkNVN010UDlKRGt6aXJIYS1YUQ?oc=5,Republic World,2026-05-14T10:03:16+05:30,en,Delhi,New Delhi,"""heatwave"" Delhi","IMD has warned that temperatures in Delhi-NCR may cross 41°C as heatwave-like conditions persist across the region this week. Residents are advised to stay hydrated, avoid afternoon sun exposure and take precautions amid rising heat levels.
New Delhi: After a brief spell of rain and thunderstorms brought temporary respite to residents, the national capital is once again staring at rising temperatures, with the India Meteorological Department (IMD) warning of heatwave-like conditions over the coming days.
Parts of Delhi-NCR witnessed gusty winds, light rain and hailstorms on Wednesday evening, leading to a sharp dip in temperatures by nearly 10 degrees Celsius in several areas.
Strong winds reaching up to 98 kmph swept across the city, disrupting traffic movement and delaying flights in some areas. However, the relief is expected to be short-lived.
According to IMD forecasts, maximum temperatures in Delhi are likely to climb steadily again, with the mercury expected to touch around 42 degrees Celsius in the next few days. Weather officials have also warned that dry and hot northwesterly winds could intensify heatwave conditions across the capital and adjoining NCR regions.
The IMD has simultaneously issued alerts for thunderstorms, lightning and gusty winds for parts of Delhi-NCR even as daytime temperatures continue to remain above normal. The fluctuating weather pattern is being linked to ongoing pre-monsoon activity affecting several northern states.
Several areas including Green Park, Dhaula Kuan, Uttam Nagar and Moti Bagh reported hailstorm activity during Wednesday night’s weather change. Residents across Noida, Gurugram and Ghaziabad also experienced rain accompanied by strong winds.
Meanwhile, authorities have stepped up preparedness measures amid concerns over extreme weather. Hospitals in parts of the NCR region have reportedly been directed to establish dedicated flood and heatwave control rooms to tackle emergencies linked to rising temperatures and sudden weather events.
Published By : Melvin Narayan
Published On: 14 May 2026 at 10:03 IST",1.0
Delhi government sets up cooling zones to ease heatwave impact - The News Mill,https://news.google.com/rss/articles/CBMimwFBVV95cUxQX0t3TmFQclFvY2V6Y3RtNW5jWkNYcHJZVVkwSUt4QmZNUWhROHJKNWREb2JmS18ySVM3d2FsaWJOdldkd2hTNS1aM1JpaEVxUDFrQ3RrT0o2MXF4TmlkYzk5NnBWbG9mSVI0cV9HR1pIaG03SV9JLTBib2hFX3BiR1J5elAxT2FKdmxTNU1UaVJRX252LThTMUlLQQ?oc=5,The News Mill,2026-05-14T05:02:13+05:30,en,Delhi,New Delhi,"""heatwave"" Delhi","Amid a severe heatwave affecting New Delhi, the Delhi Government has established ‘Cooling Zones’ in crowded locations such as bus stands and metro stations to offer relief to the public. These camps are managed with assistance from the Delhi Disaster Management Authority (DDMA) and Civil Defence volunteers to help people endure the intense summer heat.
“At these centres, ORS water, normal water and cold drinking water are available. We also have coolers and fans. Due to the extreme heat, the Delhi Government has set up these Cooling Zones, and we are assisting in their operation. People can sit here and rest for 10 to 15 minutes,” said Jeet Pal, a member of DDMA.
Civil Defence and Delhi Police personnel are overseeing the smooth operation of the sites. “This facility has been provided by the government for the public. We have caps, ORS and cold water available for people. All basic facilities are here so that anyone can sit and take rest,” stated Uzma, a member of Civil Defence.
Residents have welcomed the initiative as a timely measure during peak summer conditions. “This is a very good initiative. Delhi faces extreme heat and frequent heat waves. People are getting relief here with ORS, cold water and a place to sit for some time,” said local resident Rehan Ali.
Another commuter, Uttam Singh, added, “We were passing by and saw this Cooling Zone. It is very useful for the public. People travelling on the road can rest here comfortably in the heat.”
The initiative is becoming a public service example, offering immediate relief and essential first-aid support to those facing severe summer conditions in the city.",0.8500000000000001
