title,url,source,date,language,state,district,search_term,full_text,relevance_score
Siddharthnagar News: ड्राइवरों पर दोहरी मार... भीषण गर्मी और कमाई का दबाव - Amar Ujala,https://news.google.com/rss/articles/CBMiiAJBVV95cUxPTEo4bWUyalhvTk1DRmtJWk41eXV1SFZmWUVURUd6dVlFampEbFE0c2VESUhqRF9BNHBJTmt0VERGZnlHVGRodmxTbTRuRXBfQUFQSHpRQm80Y2RCM2hhU2pBdFotVmpBVzU5WW1nY2RndUN4QlltMC1pMlVQQnAxdEtTdEVNOVh4V21KX1JaVUhzSXdoS01kNXl1UFFUQzNlU1BiZ2hFdlVFWE5XVkdVSHVWbGo2cEpONFVzOVd4cXUzemdxa2lmZk9NcmpqdDVmdVRDRFgyQ3FScW1zY0tmS0FPY1c1VjQxdXkxejlOQ0dRQ2lsT0hjTTQwV2xNWnViSGdHdWNqeGHSAY4CQVVfeXFMT3Q1X004Qjl4Skg3VEtvNUVINHBHSng0cFBCaTU5S2VjYkJVNVN0bHh4aHBrSUZkSnhIWkRJb2lsNk1zb3JMM2tzZ2o3N2RtNVo3cFd4ZGFJVDQ5aVBTcWUtNjNWM3E5QmRSS3k0LWEzclNCNWZWSy16X2trcE96WjFZcG1xdGNmTVNadDVhVlAwOXh5VWRRcTFvUzFFSElHczlWQmdJajNWX0h2UzlHalpJNkdTdUsyelVjYVMtRXcwZFN5dXg0cV83X3lpNjRLVk5WWkJYZFdrYW9IdERURkF2WTJROWZhT3JJeEFIdS1iQUt6bHctLXZxOEZfT3lieVJHbXIxdnRCLUQ0MXhR?oc=5,Amar Ujala,2026-04-25T00:48:24+05:30,hi,Madhya Pradesh,Dhar,"(लू OR ""लू चलना"" OR ""भीषण गर्मी"" OR ""प्रचंड गर्मी"" OR ""कड़ी धूप"" OR ""तेज धूप"" OR ""गर्म हवा"" OR ""उष्ण लहर"" OR ""ताप लहर"" OR ""हीट वेव"" OR ""झुलसाने वाली गर्मी"" OR ""तपती गर्मी"" OR ""भयंकर गर्मी"" OR ""गर्मी का कहर"" OR ""गर्मी का प्रकोप"" OR ""अत्यधिक गर्मी"" OR मौसम OR ""मौसम अपडेट"" OR ""मौसम का हाल"" OR ""मौसम पूर्वानुमान"" OR ""मौसम अलर्ट"" OR आईएमडी OR ""आईएमडी पूर्वानुमान"" OR ""आईएमडी अलर्ट"" OR ""तापमान में बढ़ोतरी"" OR ""गर्मी से राहत"" OR ""गर्मी से निजात"") Madhya Pradesh","Siddharthnagar News: ड्राइवरों पर दोहरी मार... भीषण गर्मी और कमाई का दबाव
संवाद न्यूज एजेंसी, सिद्धार्थनगर
Updated Sat, 25 Apr 2026 12:48 AM IST
विज्ञापन
विज्ञापन
सिद्धार्थनगर। भीषण गर्मी के बीच जिले के ड्राइवर इन दिनों दोहरी मार झेल रहे हैं। एक ओर चिलचिलाती धूप में घंटों वाहन चलाना पड़ रहा है, वहीं दूसरी ओर गर्मी के कारण सवारियां कम निकलने से उनकी आमदनी पर भी असर पड़ा है। इससे न सिर्फ शारीरिक थकान बढ़ रही है, बल्कि मानसिक दबाव भी बढ़ता जा रहा है।
बस, ऑटो और टैक्सी चालकों का कहना है कि दोपहर के समय लोग घरों से कम निकल रहे हैं, जिससे सवारियां घट गई हैं। एक ऑटो चालक शकील ने बताया, पहले जहां दिनभर में अच्छी कमाई हो जाती थी, अब गर्मी के कारण सवारियां कम मिल रही हैं। ऐसे में ज्यादा समय तक सड़क पर रहना पड़ता है, जिससे थकान भी बढ़ती है।
वहीं एक बस चालक रामलाल ने कहा, गर्मी में यात्रियों की संख्या घट जाती है, लेकिन ड्यूटी उतनी ही लंबी रहती है। इससे कमाई और मेहनत का संतुलन बिगड़ जाता है। विशेषज्ञों के अनुसार गर्मी में लंबे समय तक काम करने से हीट स्ट्रेस की समस्या बढ़ जाती है। स्थानीय चिकित्सक डॉ. अजय सिंह बताते हैं कि शरीर में पानी की कमी, चक्कर, सिरदर्द और कमजोरी जैसे लक्षण ड्राइवरों के लिए खतरनाक हो सकते हैं। ऐसी स्थिति में वाहन चलाने पर प्रतिक्रिया समय कम हो जाता है, जिससे दुर्घटना का खतरा बढ़ जाता है।
गर्मी के कारण रात में भी पर्याप्त राहत नहीं मिल रही है। ऊंचा न्यूनतम तापमान ड्राइवरों की नींद को प्रभावित कर रहा है, जिससे अगले दिन उनींदापन और थकान बनी रहती है। लगातार काम और कमाई का दबाव उन्हें आराम करने का मौका भी नहीं देता।
परिवहन क्षेत्र से जुड़े लोगों का कहना है कि कम सवारियों के कारण कई ड्राइवर ज्यादा ट्रिप करने की कोशिश करते हैं, जिससे जल्दबाजी बढ़ती है और जोखिम भी बढ़ जाता है। ऐसे में सड़क सुरक्षा पर भी असर पड़ सकता है।
Trending Videos
बस, ऑटो और टैक्सी चालकों का कहना है कि दोपहर के समय लोग घरों से कम निकल रहे हैं, जिससे सवारियां घट गई हैं। एक ऑटो चालक शकील ने बताया, पहले जहां दिनभर में अच्छी कमाई हो जाती थी, अब गर्मी के कारण सवारियां कम मिल रही हैं। ऐसे में ज्यादा समय तक सड़क पर रहना पड़ता है, जिससे थकान भी बढ़ती है।
विज्ञापन
विज्ञापन
वहीं एक बस चालक रामलाल ने कहा, गर्मी में यात्रियों की संख्या घट जाती है, लेकिन ड्यूटी उतनी ही लंबी रहती है। इससे कमाई और मेहनत का संतुलन बिगड़ जाता है। विशेषज्ञों के अनुसार गर्मी में लंबे समय तक काम करने से हीट स्ट्रेस की समस्या बढ़ जाती है। स्थानीय चिकित्सक डॉ. अजय सिंह बताते हैं कि शरीर में पानी की कमी, चक्कर, सिरदर्द और कमजोरी जैसे लक्षण ड्राइवरों के लिए खतरनाक हो सकते हैं। ऐसी स्थिति में वाहन चलाने पर प्रतिक्रिया समय कम हो जाता है, जिससे दुर्घटना का खतरा बढ़ जाता है।
गर्मी के कारण रात में भी पर्याप्त राहत नहीं मिल रही है। ऊंचा न्यूनतम तापमान ड्राइवरों की नींद को प्रभावित कर रहा है, जिससे अगले दिन उनींदापन और थकान बनी रहती है। लगातार काम और कमाई का दबाव उन्हें आराम करने का मौका भी नहीं देता।
परिवहन क्षेत्र से जुड़े लोगों का कहना है कि कम सवारियों के कारण कई ड्राइवर ज्यादा ट्रिप करने की कोशिश करते हैं, जिससे जल्दबाजी बढ़ती है और जोखिम भी बढ़ जाता है। ऐसे में सड़क सुरक्षा पर भी असर पड़ सकता है।",1.0
