title,url,source,date,language,state,district,search_term,full_text,relevance_score
"हिमाचल प्रदेश में बारिश-बर्फबारी से लौटी ठंड, ताबो-कुकुमसेरी में माइनस तापमान, इस दिन फिर बदलेगा मौसम - News18 Hindi",https://news.google.com/rss/articles/CBMi9AFBVV95cUxQWnlINnQzUE4wUWFkZllkZjV3Z0JNck9CVnluYms3WU03SnMzMVF2Ml9DQlN4QkNuVWwyVU5EQ1FMVWpqYUNYYzY0MTZITXdMeU02dEVNc0ZmendvbmVZRlZMQ19vUG43V0lMc0pZLVBRTmFjU3M4VHVSR0thNk1BZGMxMVZZWW51MktjVTA5WG5HQU9QaHEyRWRqY0ZGa3RqalZhQ0FRYnBZZDN6cmo4ZnVGcUMyZVZwbDByZHFDZVdoaFp5V1p0b1BDRFZSRmdBaFhKWlpvMXhnV0tubGJOalQxS04yRDdJLVZTUS1FYTJJelpB0gH6AUFVX3lxTE9pU2lTVUt6TThlSWRhZVhQbGhUbXZnaFdkYVJ3VXhNXzU4Um1iZ3VVZ2cxaThwMzdLTkNQczBZWjRmV291Z040RWFNR0VkZ3hmTFlGWmxwbmN4YTBIcXpqOW5CUDNMTDBvemdTamtWWXp3VE5FdmFXOFFNM1JWby1UNlRqbTF6YUpFQkJ5ZkxYVWtNRUZTZy15MFZaazVWTlRCMHE2RktoM2pRUEp1TGozNVZFTDNJbm5CVnpsV0JiZHZNTmQybGt3MTdJdV9rSDd2aldKUVJ0QnF0QTY2b0tCcU1tRVUxV3U1dEhLQWc3eGhVQklzcU5qQWc?oc=5,News18 Hindi,2026-02-28T06:20:12+05:30,hi,Himachal Pradesh,,"(""पारा चढ़ा"" OR ""पारा पहुंचा"" OR तापमान OR ""तापमान बढ़ा"" OR ""रिकॉर्ड तोड़ गर्मी"" OR ""डिग्री सेल्सियस"" OR ""पारा उबला"" OR ""अधिकतम तापमान"") Himachal Pradesh","होमताजा खबरहिमाचल प्रदेशकुल्लू
हिमाचल प्रदेश में बारिश-बर्फबारी से लौटी ठंड, ताबो-कुकुमसेरी में माइनस तापमान
हिमाचल प्रदेश में बारिश-बर्फबारी से लौटी ठंड, ताबो-कुकुमसेरी में माइनस तापमान, इस दिन फिर बदलेगा मौसम
Last Updated:
हिमाचल प्रदेश के ऊपरी इलाकों में बर्फबारी से ठंड बढ़ी है. रोहतांग दर्रा, लाहौल और स्पीति व अटल टनल में हल्की बर्फबारी हुई. कुकुमसेरी में न्यूनतम -2.6°C और ऊना में अधिकतम 30.2°C दर्ज हुआ. शिमला व मनाली समेत कई क्षेत्रों में तापमान गिरा है. 2 मार्च को पश्चिमी विक्षोभ सक्रिय होने की संभावना है, हालांकि 5 मार्च तक मौसम साफ रहने का अनुमान है.
हिमाचल प्रदेश के ऊपरी इलाकों में मौसम बिगड़ने से अब प्रदेश में फिर हल्की ठंड बढ़ने लगी है. रोहतांग दर्रा, लॉल स्पीति और अटल टनल में शुक्रवार शाम को हल्की बर्फबारी होने से घाटी में अब फिर तापमान में हल्की गिरावट महसूस की जा रही है. इस दौरान कुल्लू में जहां सुबह मौसम साफ रहने से दोपहर तक मौसम में गर्मी रही, वहीं शाम के समय तेज़ तूफान चलने से अब कुल्लू मनाली में मौसम में बदलाव देखने को मिल रहा है. पांगी और भरमौर की ऊंची चोटियों पर भी शुक्रवार को ताजा बर्फबारी हुई है. साथ ही चंबा जिले के कई क्षेत्रों में हल्की बारिश भी दर्ज की गई. प्रदेश में सबसे कम न्यूनतम पारा कुकुमसेरी में माइनस -2.6 डिग्री सेल्सियस रहा. जबकि सबसे अधिक अधिकतम पारा ऊना में 30.2 डिग्री सेल्सियस रिकॉर्ड किया गया है. शिमला और सुंदरनगर में एक समान न्यूनतम पारा 8.5 डिग्री सेल्सियस दर्ज किया गया.
आगामी दिनों में मौसम को लेकर क्या रहेगा पूर्वानुमान
मौसम विज्ञान केंद्र शिमला के वैज्ञानिक संदीप शर्मा के अनुसार प्रदेश में फिर मौसम का मिजाज़ बिगड़ने वाला है. ऐसे में प्रदेश के ऊपरी इलाकों में जहां शुक्रवार को हल्की बर्फबारी हुई है. वहीं 2 मार्च को एक नया पश्चिमी विक्षोभ फिर प्रदेश में सक्रिय होने वाला है. जिसके प्रभाव से प्रदेश के तापमान में हल्का बदलाव देखने को मिल सकता है. हालांकि प्रदेश में 5 मार्च तक मौसम साफ बना रहने का पूर्वानुमान जताया गया है. ऐसे में प्रदेश में अगले 4 से 5 दिनों के दौरान राज्य के कई हिस्सों में न्यूनतम और अधिकतम तापमान में कोई बड़ा बदलाव नहीं होगा. हालांकि ऊंची चोटियों और मध्य पहाड़ी क्षेत्रों में 28 फरवरी के दौरान न्यूनतम और अधिकतम तापमान में 2 से 3 डिग्री की गिरावट आने की संभावना जताई गई है.
कितना रहा प्रदेश के शहरों में न्यूनतम तापमान
Advertisement
ऊपरी इलाको में हुई ताज़ा बर्फबारी के बाद अब प्रदेश के कई स्थानों में मौसम में ठंडक बढ़ने लगी है. ऐसे में शुक्रवार को राजधानी शिमला में 8.5 डिग्री सेल्सियस न्यूनतम पारा दर्ज किया गया. सुंदरनगर में 8.5 डिग्री, भुंतर में 7.6 डिग्री, कल्पा में 0.6 डिग्री, धर्मशाला में 10.2 डिग्री, ऊना में 10.6 डिग्री, नाहन में 11.3 डिग्री, पालमपुर में 9.0 डिग्री, सोलन में 6.8 डिग्री, मनाली में 3.5 डिग्री, कांगड़ा में 10.4 डिग्री, मंडी में 9.4 डिग्री, बिलासपुर में 11.5 डिग्री, जुब्बड़हट्टी में 9.2 डिग्री, कुकुमसेरी में माइनस -2.6 डिग्री, सेऊबाग में 5.3 डिग्री, बरठीं में 8.6 डिग्री, पांवटा साहिब में 13.0 डिग्री, सराहन में 6.3 डिग्री, देहरा गोपीपुर में 13.0 डिग्री, ताबो में माइनस -2.4 डिग्री और नेरी में 15.0 डिग्री सेल्सियस रहा.
कितना रहा शहरों का अधिकतम पारा
राजधानी शिमला में अधिकतम तापमान 17.5 डिग्री सेल्सियस रहा. सुंदरनगर में 26.8 डिग्री, भुंतर में 24.8 डिग्री, कल्पा में 14.5 डिग्री, धर्मशाला में 23.0 डिग्री, ऊना में 30.2 डिग्री, नाहन में 23.8 डिग्री, केलांग में 8.0 डिग्री, सोलन में 23 5 डिग्री, मनाली में 17.8 डिग्री, कांगड़ा में 27.0 डिग्री, मंडी में 27.2 डिग्री, डलहौजी में 15.6 डिग्री, जुब्बड़हट्टी में 20.8 डिग्री, बरठीं में 26.7 डिग्री, ताबो में 10.7 डिग्री और नेरी में 24.5 डिग्री सेल्सियस रिकॉर्ड किया गया है..
About the Author
Lalit Bhatt
पिछले एक दशक से अधिक समय से पत्रकारिता के क्षेत्र में सक्रिय हूं. 2010 में प्रिंट मीडिया से अपने पत्रकारिता करियर की शुरुआत की, जिसके बाद यह सफर निरंतर आगे बढ़ता गया. प्रिंट, टीवी और डिजिटल-तीनों ही माध्यमों म...और पढ़ें
और पढ़ें",0.0
"राजस्थान-MP में तापमान 35 डिग्री के पार: हरियाणा में आज बूंदाबांदी संभव; हिमाचल प्रदेश मौसम में बदला, अटल ट... - Dainik Bhaskar",https://news.google.com/rss/articles/CBMi7AFBVV95cUxPa1ZnOXQyal9FYzJVVjNSSmM5cGhUR1NXbVVhZkxLR1dIaUFuNUJJSnVkMTduSUdQeW5HN1ZOMF9iS3o4aXNtMjN6N1VOV0t0emFmdmJBbWZOYmJnUDFybnJYUzhoVWxjT0ZuVndaRllnZ0ZXM0Z2ME9hQWVtNUNhZGd0WXJpcHcyRVBsc2VQQ2ZCLWx4TDJVdV96YlhZTW14RXVmVmozdFNrRUp5eVJONWxXSHVxSVRiaVlCVHRhSWRMdmc3NTFJUWdZdHpwbldmV3dyeWx0Zjk0NDUyQWpld3c1WlMxZ2dGakFYbNIB8gFBVV95cUxQSEhaWFRZb3g5b2ZvSzdXZ05md1owRG5HWExkYm5mNURqWmZlUTdMWk9DRTg5d0hGdzg1aVp0SE9OWW1BX2N1SzVqeGFfZ1ZaUHJ3Y25tV3QtY01UY2h6VVdXSUxXVkxMUWFvVVUtRnZESEE1U2x1VC1hNDRmdHNTYWhUMHprQVo5OTZNWnVGY05sUWxjMVJCcEFkVUdWeGt3dHZ4Rzc3ejU2LTA4cXhCYjRLVWFUclZZWEhKXy1NaVZuQnZfWmQ1aUFHelJKbXlETWdyS2NxeG96SnFpdENyMzNRdER0c2hRWk1FRTc2cWNGZw?oc=5,Dainik Bhaskar,2026-02-28T05:00:00+05:30,hi,Himachal Pradesh,,"(""पारा चढ़ा"" OR ""पारा पहुंचा"" OR तापमान OR ""तापमान बढ़ा"" OR ""रिकॉर्ड तोड़ गर्मी"" OR ""डिग्री सेल्सियस"" OR ""पारा उबला"" OR ""अधिकतम तापमान"") Himachal Pradesh","राजस्थान-MP में तापमान 33°C के पार:हरियाणा में आज बूंदाबांदी संभव; हिमाचल प्रदेश मौसम में बदला, अटल टनल के पास बर्फबारी
- कॉपी लिंक
राजस्थान और मध्य प्रदेश में फरवरी के महीने में अप्रैल जैसी धूप निकल रही है। दोनों राज्यों के कई शहरों में गुरुवार को तापमान 33°C के पार दर्ज हुआ। राजस्थान के बाड़मेर में सबसे ज्यादा तापमान 36.5°C दर्ज हुआ।
इधर मध्य प्रदेश के खंडवा और खरगोन में तापमान 35.2°C रिकॉर्ड हुआ। हरियाणा में गर्मी लगातार बढ़ रही है। प्रदेश का अधिकतम तापमान 31°C के पार पहुंच गया है। हालांकि मौसम विभाग ने आज से राज्य के कई हिस्सों में बादल छाए रहने और बूंदाबांदी की संभावना जताई है।
वहीं पहाड़ों पर भी मौसम बदल गया है। शुक्रवार शाम हिमाचल प्रदेश के कुल्लू स्थित मनाली में ऊंचे इलाकों पर अचानक बर्फबारी हुई। रोहतांग स्थित अटल टनल पर बर्फबारी के कारण कुछ देर के लिए जाम की स्थिति रही।
मौसम विभाग ने उत्तराखंड के पांच जिलों में अगले कुछ दिनों में बारिश और ऊंचाई पर बर्फबारी की संभावना जताई गई है। पंजाब और चंडीगढ़ में धुंध और तेज हवा के बीच कुछ इलाकों में यलो अलर्ट भी जारी किया गया है। सड़क यात्रा करते समय सावधानी बरतने की सलाह दी गई है।
अगले 2 दिन मौसम का हाल
1 मार्च- पश्चिम बंगाल और सिक्किम में आंधी-तूफान के साथ बिजली गिरने की आशंका है। बारिश भी हो सकती है। उत्तराखंड और हिमाचल प्रदेश में बारिश या बर्फबारी हो सकती है।
2 मार्च- 2 से 4 मार्च के दौरान जम्मू-कश्मीर, उत्तराखंड और हिमाचल प्रदेश में बारिश या बर्फबारी की संभावना है।
राज्यों के मौसम का हाल…
मध्य प्रदेश: अगले चार दिन में बारिश की संभावना, चक्रवात-ट्रफ की वजह से बादल छाए
मध्य प्रदेश में अगले चार दिन में बारिश की संभावना है। मौसम विभाग के मुताबिक 2 मार्च से हिमालयी क्षेत्र में एक वेस्टर्न डिस्टरबेंस (पश्चिमी विक्षोभ) एक्टिव हो रहा है। यह एमपी में भी असर दिखा सकता है और ग्वालियर-चंबल हिस्से में मौसम बदला रहेगा। राज्य के खरगोन में शुक्रवार को तापमान 34°C रहा। पूरी खबर पढ़ें…
राजस्थान: 14 शहरों में अधिकतम तापमान 33°C रहा, आज बादल छाए, बारिश की संभावना
राजस्थान में गर्मी का दौर शुरू हो गया है। शुक्रवार को 14 शहरों में दिन का अधिकतम तापमान 33°C और उससे ज्यादा रहा। बीकानेर, चूरू समेत कई शहरों में दिन में सामान्य से ज्यादा गर्मी रही। जयपुर, अलवर, सीकर, पिलानी समेत अन्य शहरों में भी तापमान में 2°C तक बढ़ा। पूरी खबर पढ़ें…
उत्तराखंड: राज्य के 3 जिलों में बर्फबारी के आसार, मुनस्यारी में पारा -25.8°C, रुद्रप्रयाग में बारिश हुई
उत्तराखंड के 3 जिलों में आज बारिश-बर्फबारी की संभावना है। इनमें उत्तरकाशी, चमोली और पिथौरागढ़ शामिल हैं। शुक्रवार को रुद्रप्रयाग के केदारनाथ धाम सहित केदारघाटी और सोनप्रयाग में बारिश हुई। प्रदेश के 6 शहरों का तापमान -10°C से नीचे है। मुनस्यारी का न्यूनतम तापमान -25.8°C रहा। पूरी खबर पढ़ें…
हरियाणा: राज्य में आज बारिश की संभावना, 9 शहरों में दिन का तापमान 30°C से ज्यादा
हरियाणा में अधिकतम तापमान सामान्य से चल रहा है। हिसार में दिन का तापमान 32°C रहा। राज्य के 9 शहरों में दिन का तापमान 30°C रहा। मौसम विभाग के मुताबिक 4 मार्च के बाद वेस्टर्न डिस्टर्वेंस के असर से मौसम में बदलाव नजर आ सकते है। पूरी खबर पढ़ें…
ओवैसी बोले- मोदी की विचारधारा में इजराइल के लिए प्यार: हमने हिंदुओं पर अत्याचार के खिलाफ बोला, आपको इजराइली आतंकवाद पर बोलना चाहिए था
चीफ इलेक्शन कमीश्नर बोले-तमिलनाडु में एक फेज में चुनाव होगा: इसपर आखिरी फैसला जल्द करेंगे, SIR के बाद राज्य में 5.67 करोड़ वोटर बचे
NCERT की एडवाइजरी, आठवीं की बैन पुस्तक है तो लौटाएं: विवादित अध्याय पर ऑनलाइन पोस्ट भी हटाएं, सुप्रीम कोर्ट ने एक दिन पहले बैन लगाया था
TVK चीफ-एक्टर विजय की पत्नी ने तलाक याचिका दायर की: पति पर एक्ट्रेस से अफेयर का आरोप; शादी के 27 साल हुए, दो बच्चे भी",0.0
