title,url,source,date,language,state,district,search_term,full_text,relevance_score
"Weather Today [26 March, 2026]: Check IMD Forecast, Snow, Heat Across States & Rain Predictions for Delhi NCR, Mumbai, Chennai, Karnataka, Rajasthan, Jammu & Ahmedabad - The Sunday Guardian",https://news.google.com/rss/articles/CBMiowJBVV95cUxNWFR4SmFDOEJsQ3RBc1hmdm9HV2RUSXBkVnhVaDZGRThveU5Hc0RaOHNIdmJhWmNrMERjOUo0Z0xDUE45cG1FRHhuOFZhaFE0Q3NOZklULTlIVnNCQVpyX2swb2QzVWtVWWFESkFsMEh4aW8yNjhzRkpMMWVjMzVNN0tXS1U2TW51c0pEOURTZUxOSFdJWmd4WTR1WnZhRC1RMEpKbWJWSmNWTzcxcTlpclkyTjV5dHN4YVIzQjRZclRCRVZpSDFUajZZdDNveHlMTTBrU0liMnVOSk4zR3o3Tms1Z2ZRNXlVUkoteEhrTlNMMWpqX2hVaER3aGRJMFpMZXdqVXBNWU5uaFBMOXJTSXNXSjRzbjdtVktQeFYyVVhFNkE?oc=5,The Sunday Guardian,2026-03-26T00:42:31+05:30,en,Delhi,,"""heatwave"" Delhi","Weather Today (26 March 2026): India is witnessing a gradual transition from late winter to early summer with temperatures rising across several regions while northern plains are warming up, hill states may still experience snowfall and rain. However, central and southern India are heading toward hotter days with some regions expected to cross 40°C in the coming days.
Will it Rain or Snow in the Hills?
Hill regions including Jammu and Kashmir and parts of Himachal Pradesh may experience light snowfall and rain. Srinagar is expected to remain cold with Minimum at -1°C and Maximum at 6°C as cloud cover and light precipitation may continue for the next 48 hours.
Delhi-NCR Weather Today
Minimum: 23°C | Maximum: 34°C.
Skies will stay mostly clear while light winds around 4–5 km/h may bring mild relief and temperatures could rise to 36–37°C over the next few days.
Chennai Weather Today
Minimum: 26°C | Maximum: 35°C
Chennai is likely to experience hot and humid conditions where coastal winds may offer slight relief, but humidity levels are expected to remain high.
Mumbai Weather Today
Minimum: 27°C | Maximum: 31°C
Mumbai is expected to remain warm and humid with moderate sea breeze and partly cloudy skies may keep temperatures stable.
Hyderabad Weather Today
Minimum: 25°C | Maximum: 37°C
Hyderabad will see dry weather and dominate with temperatures expected to gradually increase toward 39°C in coming days.
Karnataka Weather Today
Minimum: 21°C | Maximum: 33°C
Karnataka including Bengaluru is expected to experience and mostly dry conditions with occasional cloud cover likely.
Uttar Pradesh Weather Today
Minimum: 22°C | Maximum: 38°C
Uttar Pradesh including Lucknow may witness with rising temperatures and dry winds expected.
Rajasthan Weather Today
Minimum: 23°C | Maximum: 34°C
Rajasthan including Jaipur will see light showers possible in northern districts like Sri Ganganagar and Churu.
Jammu and Kashmir Weather Today
Minimum: -1°C | Maximum: 6°C
Jammu and Kashmir remains cold with snowfall likely in higher altitudes.
Punjab Weather Today
Minimum: 20°C | Maximum: 33°C
Punjab including Chandigarh expected with clear skies.
Ahmedabad Weather Today
Minimum: 25°C | Maximum: 38°C
Ahmedabad to remain hot with heatwave conditions may develop soon.
City-Wise Sunrise & Sunset Timing
Key State Capitals Weather Today
How Will Rising Temperatures Impact?
Central and southern India may witness temperatures crossing 40°C soon and coastal regions may experience humidity while northern plains face dry heat conditions.
Delhi’s Air Quality Today – March 26, 2026
Delhi AQI expected in Moderate to Poor category around 160-190 with dust and pollution contributing to reduced air quality.
Major Cities Air Quality Across India
AQI Scale Guide:
FAQ’s: Weather Today Update
Are There Any Travel or Safety Warnings?
No major warnings, but heat precautions advised in central and southern India.
Will Temperatures Rise Across the Country?
Yes, gradual warming expected across most regions.
Will There Be Any Rain Today?
Light rain likely in Rajasthan and northeast India.
Where Will It Snow Today?
Snowfall expected in Jammu and Kashmir higher altitudes.
Is Heatwave Expected Soon?
Interior regions may see heatwave conditions within a few days.",0.8500000000000001
