title,url,source,date,language,state,district,search_term,full_text,relevance_score
"आज का मौसम 26 मार्च: यूपी-बिहार-दिल्ली समेत 22 राज्यों में आंधी-बारिश की चेतावनी, 70 की स्पीड से हवा; IMD अलर्ट - Navbharat Times",https://news.google.com/rss/articles/CBMirwJBVV95cUxPOEgwelZIQWF2TGF0OXhYUE1DUlZPSzNWTjZFRTktNjdlaDE4WTY5WkdieVZ2SU1Id1Jhd1BSNFRUZGMyWndKTnNaVXdmX2pwWVN3enR5bGJUUWxiYi1sMmxoR0hiaWN6RUIxYTVGekRjMjA1RmxjY0wtODRONlRMNjFnZTRNY3doc1pIdDdSei1FWEVzbmRSdGZVcWtma1FGbDZRTUl5eWlDV3lEbnVuaDh5Z2g2NUtqeEpabG9sU2hhYVBnV0lUT3hQMVB4cktxb3ByTXJGY3hDMUtnTXNPTmwxZUVxMXNMTWdFcVFXWEJmVXFwZTAtcVRhM1paUFE5UncwSGQ0ZTBmR1dtYjdiSUwyVmEzb2tQYjFBXzJmWnJJUGQ4eVB1MVlHYjIyTHPSAbQCQVVfeXFMTkhYenFFZHlkN25lMUNpdXF0ZkNpR0J2RE1YVEI3aHJzdTU5TzFDSVB0WXkyV3p2QWYyOWdjU2NKOHBCeklMRUNlOGZuemlQaFRVODJiYzdEWmkzLW9TT1BOU1JMUmZieDI3WDd3Y05YOUhBNzVLSmVlS1R5TWhscjdlMnpORDhMdTNxTDBNeHZYdFFTSG5EZTFrMzBTdThVcWZGOHhDWlM1eHNBVzRsRHJIeWFZWjQ5Vkpaa0R2NWxEUGJuY2g5blRWZ1E0STJuRUVhZk9naThvR0JQbTN0S1VtZ28xM0JNTkRGamJmVGpwN1pKQ1c3MXI2NUlILVJQTE1sUk9PdXhzX0xNV3BjdmQ4MjlPQ2ZCQVF6NTJCeVByby1fMkNpOWl0SEViRWxmNW5qMHU?oc=5,Navbharat Times,2026-03-26T06:46:11+05:30,hi,Delhi,,"(""हीट एक्शन प्लान"" OR ""गर्मी से राहत"" OR चेतावनी OR ""रेड अलर्ट"" OR ""ऑरेंज अलर्ट"" OR ""येलो अलर्ट"" OR एडवाइजरी OR ""राहत सामग्री"" OR ""राहत शिविर"" OR मुआवजा) Delhi","Weather Forecast: देशभर के 22 राज्यों में एक बार फिर मौसम बदलने वाला है। दो पश्चिमी विक्षोभों के सक्रिय होने के कारण उत्तर प्रदेश, बिहार, लद्दाख, जम्मू-कश्मीर में हल्की-बर्फबारी का IMD ने अलर्ट जारी किया है। इस दौरान उत्तर भारत के राज्यों में आंधी-तूफान का भी कहर देखने को मिल सकता है।
आज का मौसम 26 मार्च 2026: देश के कई राज्यों में एक बार फिर मौसम में बदलाव देखने को मिलेगा। भारत मौसम विभाग (IMD) ने देश के कई हिस्सों में आंधी-तूफान, बारिश और तेज हवाओं की संभावना जताई है। दो पश्चिमी विक्षोभों के सक्रिय होने के कारण उत्तर भारत समेत पूर्वोत्तर और मध्य भारत के 22 राज्यों में मौसम बदलने वाला है। हालांकि मौसम विभाग संभावना व्यक्त की है कि उत्तर-पश्चिम भारत में अगले दो दिनों तक तापमान 2 से 3 डिग्री तक बढ़ सकता है लेकिन इसके बाद फिर धीरे-धीरे तापमान में गिरावट आएगी।
IMD के अनुसार, 27 मार्च तक पश्चिमी हिमालयी क्षेत्रों में जम्मू-कश्मीर, लद्दाख, हिमाचल प्रदेश और उत्तराखंड में हल्की से मध्यम स्तर की बारिश-बर्फबारी हो सकती है। उत्तर-पश्चिमी भारत के मैदानी इलाकों में 31 मार्च तक छिटपुट से व्यापक वर्षा की संभावना है।
उत्तर भारत में आंधी-बारिश का अलर्ट
मौसम विभाग के अनुसार, पंजाब, हरियाणा, दिल्ली, राजस्थान और उत्तर प्रदेश में भी गरज-चमक के साथ झमाझम बारिश का दौर शुरू हो सकता है। इस दौरान 30 से 50 किलोमीटर प्रति घंटे की रफ्तार से हवाएं चलेंगी।
पूर्वोत्तर में भारी बारिश का अलर्ट
उत्तर भारत के अलावा पूर्वोत्तर और पूर्वी भारत में भारी बारिश का अलर्ट जारी किया गया है। मौसम विभाग ने अरुणाचल प्रदेश, असम, मेघालय, नागालैंड, मणिपुर, मिजोरम और त्रिपुरा में 25 से 29 मार्च के बीच व्यापक बारिश, बिजली गिरने और तेज हवाओं की चेतावनी जारी की है। उप-हिमालयी पश्चिम बंगाल और सिक्किम में कुछ स्थानों पर भारी वर्षा की संभावना है।
मध्य भारत में भीषण आंधी-तूफान का अलर्ट
पश्चिमी विक्षोभों के प्रभाव के कारण छत्तीसगढ़, मध्य प्रदेश और विदर्भ के क्षेत्रों में हल्की बारिश और आंधी-तूफान के आसार हैं। दक्षिण भारत के कई राज्यों तेलंगाना, आंध्र प्रदेश, कर्नाटक और केरल में अगले पांच दिनों तक गरज-चमक और तेज हवाएं चल सकती हैं।
तटीय महाराष्ट्र और केरल में 25 से 27 मार्च के दौरान कुछ क्षेत्रों में गर्म और आर्द्र मौसम रहने की संभावना है।
दिल्ली में आज कैसा रहेगा मौसम?
दिल्ली-एनसीआर में पिछले दो दिनों से बढ़ रहे तापमान में आज से ब्रेक लगेगा। मौसम विभाग के अनुसार, 26 मार्च की दोपहर या शाम तक गरज-चमक के साथ हल्की बारिश होने की संभावना है। इस दौरान राजधानी में 40 किलोमीटर प्रति घंटे की रफ्तार से हवाएं चलेंगी। तेज हवाओं के साथ बारिश का सिलसिला अब 30 मार्च तक जारी रहेगा। IMD ने 29 और 30 मार्च को बारिश-गरज के साथ 70 किलोमीटर प्रति घंटे की रफ्तार से आंधी चलने की संभावना जताई है।
जानें कल कितना रहेगा आपके शहर का तापमान?
उत्तर प्रदेश में आंधी-बारिश की चेतावनी
पश्चिमी विक्षोभों के सक्रिय होने के कारण उत्तर प्रदेश में आंधी-बारिश के साथ ओले गिरने का अलर्ट जारी किया गया है। 27 मार्च को गरज-चमक के साथ ही झमाझम बारिश होने की संभावना है। वहीं 29 मार्च से लेकर 31 मार्च तक राज्य के कई हिस्सों में झमामझ बारिश होने के आसार हैं। इस दौरान 30 से 50 किलोमीटर प्रति घंटे की रफ्तार से हवाएं चल सकती हैं।
बिहार में आज कैसा रहेगा मौसम?
उत्तर भारत के राज्यों में बिहार में सबसे ज्यादा पश्चिमी विक्षोभ का असर पड़ता दिखाई दे रहा है। राज्य में 27 मार्च को झमाझम बारिश के साथ ओले गिरने और आंधी आने की चेतावनी जारी की गई है। जबकि 28 मार्च को गरज के साथ बारिश होने की संभावना है। किसानों को सलाह दी गई है कि वे ओलावृष्टि से फसलों को बचाने के लिए हेल नेट का उपयोग करें और तैयार फसलों की तुरंत कटाई कर उन्हें सुरक्षित स्थान पर रखें ।
लेखक के बारे मेंअभिषेक पाण्डेयअभिषेक पाण्डेय नवभारत टाइम्स में डिजिटल में पत्रकार हैं। वे जुलाई- 2025 में टाइम्स ऑफ इंडिया ग्रुप के नवभारत टाइम्स, डिजिटल विंग से जुड़े। वह वर्तमान में नेशनल और दिल्ली डेस्क से जुड़ी खबरों को कवर करते हैं। पत्रकारिता में बतौर रिपोर्टर और डेस्क पर काम करने का 4 वर्षों का अनुभव है। नवभारत टाइम्स में जुड़ने से पहले वह दैनिक जागरण में सीनियर सब एडिटर के पद पर कार्यरत थे। अभिषेक ने 2022 में उत्तर प्रदेश विधानसभा चुनाव, लोकसभा चुनाव 2024, महाकुंभ 2025 को काफी करीब से कवर किया है। अभी वह राष्ट्रीय स्तर पर हो रही सियासी उथल-पुथल, सामाजिक परिवर्तन और क्राइम से जुड़ी खबरों पर बारीकी से नजर रखते हैं।
विशेषज्ञता
उत्तर भारत के राज्यों की सियासी व आपराधिक घटनाक्रम पर अच्छी पकड़, किताबों के जरिए इतिहास को वर्तमान के पन्नों में खंगालने की कोशिश।
पत्रकारिता अनुभव
रामा यूनिवर्सिटी से पत्रकारिता एवं जनसंचार में स्नातक की डिग्री हासिल करने के बाद अभिषेक पाण्डेय ने दैनिक जागरण जैसे प्रतिष्ठित संस्थान में पत्रकारिता का शुरुआती ज्ञान लिया। इसके बाद उन्होंने कई संस्थानों के लिए फ्रीलांसिग की। इस दौरान ग्रामीण क्षेत्रों में शौचालयों के लिए जारी होने वाली धनराशि में घोटाले का खुलासा, सरकारी राशन वितरकों द्वारा 'राशन चोरी' का भंड़ाफोड़ किया, साथ ही किसान आंदोलन की ग्राउंड रिपोर्टिंग की। इसके बाद साल 2022 में दैनिक जागरण के डिजिटल विंग में बतौर सब एडिटर के पद पर अपने करियर की औपचारिक शुरुआत की। यहां उन्होंने उत्तर प्रदेश और उत्तराखंड की डेस्क पर अपनी पकड़ मजबूत की। बेहतरीन लेखनी और कार्य के प्रति समर्पण को ध्यान में रखते हुए संस्थान ने उन्हें 2024 में वरिष्ठ उप संपादक के पद पर प्रमोट किया। दैनिक जागरण में रहते हुए उन्होंने, खबरों का संपादन, एक्सप्लेनर खबरों पर काम किया। इसके बाद अभिषेक पाण्डेय ने जुलाई 2025 में नवभारत टाइम्स के साथ अपनी पारी की शुरुआत की।
शिक्षा/पुरस्कार
मूल रूप से कानपुर से जुड़े अभिषेक पाण्डेय ने रामा यूनिवर्सिटी से मास कम्युनिकेशन एंड जर्नलिज्म में ग्रेजुएशन किया है। दैनिक जागरण में उन्हें तीन बार बेस्ट परफॉर्मर ऑफ द मंथ से सम्मानित किया गया था।... और पढ़ें
कन्वर्सेशन शुरू करें
Indiaकी ताजा खबरें, ब्रेकिंग न्यूज, अनकही और सच्ची कहानियां, सिर्फ खबरें नहीं उसका विश्लेषण भी। इन सब की जानकारी, सबसे पहले और सबसे सटीक हिंदी में देश के सबसे लोकप्रिय, सबसे भरोसेमंद Hindi Newsडिजिटल प्लेटफ़ॉर्म नवभारत टाइम्स पर",1.0
"Today Weather: दिल्ली-नोएडा में बारिश, यूपी में कहीं राहत तो कहीं गर्मी, भोपाल-इंदौर में झुलसाएगी तपिश - Asianet News Hindi",https://news.google.com/rss/articles/CBMi9gFBVV95cUxNaGdQQ3IxeGxRZm56YlZ1TnhxM1pIQXcyZ1BjWWJLNEFLYm9haDR4bE9Ialk2OGhnNmFwcWd3RXNYV2RCdTBpMTlBZXp6VDVwbmJTcV9UcHVQbzBNUmVsdkFraElWMFVmSDJ6MlhWcmZaSzZaQ1ZKaTZNVjhpaUdHd252cU1UNXAxYkpObUlHRTFFVTBlclFxWEZCWk14SEhseERLUDBPVlBrSDZtVkVuWl9IUzlweUdKeTJFYmpDaUxMWTgzbTNoUVJuSllWemRSQjlwbUNtZXZkSFpqRGFMdk5VSGVzNEJZQUctWENVdHU4dDJSU1HSAfsBQVVfeXFMT0lDNklKVkZTU2Fmbi1QbHBsSVhyZlhoVTBneldlREFYcEMyY1V0NmJpWFVpbUdjajhKS1FtcnFfQjJhRGJsSURnaVBueXk0dHlwTEpPSF9NdGZuRVV4V2VxV0ZoNi16ZmQ3ZmJQRF94bktDYm5kSVBxT1ZvN3htTWlpUER6Tlg1cG9DM0J3VmR3MC1rVURiSmNHOUtuMkE0bk1URUw3bDdpMkRHbHlCUzFIdjRmVUFERVlfeEZMNUtaUTYzNGIyakNMX3AyX25XeXprcWFoU3hZMXVzejJnVU1rVjFhZkhXeHlwUmoyY2tVRXNzblAyZ3RpVXc?oc=5,Asianet News Hindi,2026-03-26T05:00:17+05:30,hi,Delhi,,"""लू"" Delhi","Today Weather: दिल्ली-नोएडा में बारिश, यूपी में कहीं राहत तो कहीं गर्मी, भोपाल-इंदौर में झुलसाएगी तपिश
Weather Today: 26 मार्च 2026 के IMD वेदर रिपोर्ट के अनुसार कहीं बारिश तो कहीं भीषण गर्मी पड़ने की संभावना है। जानिए दिल्ली, यूपी के नोएडा, लखनऊ, आगरा, कानपुर, प्रयागराज और एमपी के भोपाल, इंदौर व उज्जैन में आज कैसा रहेगा मौसम, कितना बढ़ेगा तापमान।
26 मार्च को उत्तर भारत के मौसम में बड़ा बदलाव देखने को मिलेगा। दिल्ली-एनसीआर में बादल, बारिश और हल्की गरज के साथ मौसम सुहाना रहेगा, जबकि मध्य प्रदेश में तेज धूप और गर्मी का असर साफ दिखेगा। नोएडा और आगरा में हल्की बारिश के कारण तापमान में थोड़ी राहत मिलेगी। वहीं लखनऊ, कानपुर और प्रयागराज में आसमान साफ रहेगा और गर्मी धीरे-धीरे बढ़ती नजर आएगी। आने वाले दिनों में पारा 2-3 डिग्री तक और बढ़ सकता है।
दिल्ली में अधिकतम तापमान 34°C और न्यूनतम 18°C रहने का अनुमान है, जबकि नोएडा में 32°C / 20°C रहेगा। गुड़गांव में 31°C / 15°C के साथ हल्के बादल छाए रहेंगे। उत्तर प्रदेश के शहरों में लखनऊ (35°C), कानपुर (34°C), प्रयागराज (36°C) और आगरा (34°C) में गर्मी का असर रहेगा। मध्य प्रदेश में भोपाल 37°C, इंदौर और उज्जैन 36°C तक पहुंचेंगे, जो इस मौसम में गर्मी बढ़ने का संकेत है।
दिल्ली में गरज-चमक के साथ बारिश (Thunderstorm with rain) होने की संभावना है, जिससे मौसम ठंडा और सुहावना हो सकता है। नोएडा और आगरा में हल्की बारिश और बादल छाए रहेंगे। गुड़गांव में आंशिक बादल रहेंगे लेकिन बारिश की संभावना कम है। वहीं मध्य प्रदेश के भोपाल, इंदौर और उज्जैन में आसमान साफ रहेगा और बारिश का कोई संकेत नहीं है। यह बदलाव प्री-समर एक्टिविटी का हिस्सा माना जा रहा है।
उत्तर प्रदेश और मध्य प्रदेश के शहरों में गर्मी धीरे-धीरे तेज हो रही है। खासकर भोपाल, इंदौर और उज्जैन में तापमान 36-37°C तक पहुंच चुका है, जिससे दिन में तेज धूप और लू जैसे हालात बन सकते हैं। लखनऊ, कानपुर और प्रयागराज में भी गर्मी बढ़ने लगी है, हालांकि अभी लू की स्थिति नहीं है। दिल्ली-एनसीआर में बारिश के कारण अस्थायी राहत मिलेगी, लेकिन जल्द ही गर्मी फिर बढ़ेगी।
IMD के अनुसार, अगले 3-4 दिनों में उत्तर भारत के अधिकांश शहरों में तापमान 2 से 4 डिग्री तक बढ़ सकता है। दिल्ली में बारिश के बाद फिर से गर्मी लौटेगी और तापमान 36°C तक जा सकता है। मध्य प्रदेश में तापमान 38°C के करीब पहुंच सकता है। यूपी के शहरों में भी पारा 37°C तक जाने की संभावना है। अप्रैल की शुरुआत के साथ ही गर्मी अपने तेवर दिखाने लगेगी।
Asianet News Hindi पर पढ़ें देशभर की सबसे ताज़ा National News in Hindi, जो हम खास तौर पर आपके लिए चुनकर लाते हैं। दुनिया की हलचल, अंतरराष्ट्रीय घटनाएं और बड़े अपडेट — सब कुछ साफ, संक्षिप्त और भरोसेमंद रूप में पाएं हमारी World News in Hindi कवरेज में। अपने राज्य से जुड़ी खबरें, प्रशासनिक फैसले और स्थानीय बदलाव जानने के लिए देखें State News in Hindi, बिल्कुल आपके आसपास की भाषा में। उत्तर प्रदेश से राजनीति से लेकर जिलों के जमीनी मुद्दों तक — हर ज़रूरी जानकारी मिलती है यहां, हमारे UP News सेक्शन में। और Bihar News में पाएं बिहार की असली आवाज — गांव-कस्बों से लेकर पटना तक की ताज़ा रिपोर्ट, कहानी और अपडेट के साथ, सिर्फ Asianet News Hindi पर।",0.8
