title,url,source,date,language,state,district,search_term,full_text,relevance_score
"Delhi Temperature Today: IMD Warns Week-Long Heatwave; Check Weather Forecast, Temperature, Rain Prediction, Hotter Areas & More - The Sunday Guardian",https://news.google.com/rss/articles/CBMi_gFBVV95cUxNSHhpTm5UY1hiOElWMDhPU2hVZDdHXzYxVGk5RnNZVkh2eDRrcHN5MFg4cmQxWXVESmMwVVVvNjJIY09QTlVQLUxycjA0Y3dmdjFBQ28tYmQ5SFNOQjVGMEU0cndYVC03enIzQXlSSnI0TDV1Y3VtRmtOeXA5aGRWQ01TVnNoNjlpMXBYR0tGRzRBb0o1c0xLYnFWUDIwcVIyNGN6aFVfeXZ1XzBOaXdHSERBeEFpN2NnMURtaUFLTUlSMTJQQ3pYUVpGTFZHRXRkZ1VZMXNfUjFlMGhQRS1XZDA2S2RPUGktRW5mYWhRa0JjRG1ISWtJTlNNblR2QQ?oc=5,The Sunday Guardian,2026-05-20T13:51:37+05:30,en,Chandigarh,,"(heatwave OR ""heat wave"" OR ""severe heatwave"" OR ""extreme heat"" OR ""heat spell"" OR ""scorching heat"" OR ""blistering heat"" OR ""sweltering heat"" OR ""hot winds"" OR loo OR ""hot loo winds"" OR ""intense heat"" OR ""unbearable heat"" OR ""deadly heat"" OR heat OR ""weather forecast"" OR ""weather update"" OR ""weather alert"" OR ""IMD forecast"" OR ""IMD prediction"" OR ""IMD alert"" OR IMD OR ""rising temperatures"" OR ""temperatures expected to rise"" OR ""relief from heat"" OR ""respite from heat"" OR ""heat respite"" OR ""respite from scorching heat"") Chandigarh","Delhi Temperature Today: The current temperature in Delhi is 43°C under clear, sunny skies, with a scorching maximum temperature expected to reach 45.1°C later today. Severe heatwave conditions are prevailing across the capital city. Check Delhi weather forecast, temperature, rain prediction, hotter areas in Delhi, and more.
What is the Delhi Temperature Today?
In Delhi, the temperature feels like 43°C to 47°C depending on local humidity, with the wind speed of 6 to 10 mph blowing from the West.
However, the humidity is 19%, and the UV Index is 8.3, which is very high, and extreme caution is advised if stepping outdoors.
IMD Warning of Week-Long Heatwave in Delhi
The India Meteorological Department (IMD) has issued an official warning for a week-long heatwave in Delhi, with severe conditions expected to persist until at least May 25, 2026.
The weather agency has placed the national capital under an Orange/Yellow Alert, advising residents to brace for unrelenting daytime heat and uncomfortably warm nights.
Delhi Weather Forecast Today
Here is the hourly weather breakdown:
The evening weather forecast of Delhi today is expected to be an intense heat into the night, dropping only to a minimum of 35.3°C by early tomorrow morning.
Delhi Temperature Today: Rain Prediction
As of now, no rain or cloud relief is predicted. However, it is advised to stay hydrated and avoid direct sun exposure during peak afternoon hours to be safe from dehydration and other health issues.
Hotter Areas in Delhi
The Ridge area is currently the hottest location in the capital, recording a blistering maximum temperature of 46.5°C.
During severe heatwave spells, temperatures vary noticeably across Delhi due to incoming desert winds and localized urban conditions.
The hotter areas are:
How to Prevent Heatstroke & Dehydration?
Health officials strongly recommend the following measures due to the elevated risk of heat exhaustion, dehydration, and heatstroke:
-
Avoid Peak Sun Hours: Stay indoors between 11:00 AM and 4:00 PM when solar radiation is at its peak.
-
Stay Hydrate Continually: Drink plenty of fluids like water, buttermilk, lassi, or Oral Rehydration Salts (ORS) even if you do not feel thirsty.
-
Cover Up: If you must step outside, wear light-coloured, loose cotton clothing and protect your head with an umbrella, cloth, or cap.
Disclaimer: Weather forecasts are for guidance only. Conditions may change rapidly. Always check local authorities for emergencies and travel alerts.",1.0
भीषण गर्मी से बेहाल हुए चिड़ियाघर के बेजुबान; अलीपुर जू प्रशासन ने किया 'कूलिंग प्लान' और डाइट में बदलाव का एलान - IND24,https://news.google.com/rss/articles/CBMiqAFBVV95cUxNcXV5UEdVdmxRMW1OQVZtM1R2ZDJZRFpaRGp2NjlRY2JYSEtOQndNcTZSSFdpS0ZMVFdXRnoyNXJkVm83N3NQVWl1SDR2MGF1MVgyNDFTcjY1X1dRbGp4bzQyZF9lbndJWWRvZ2sxU01JcVhVYTZ3bDRIQl8tRkNvOGlSdFp2cFI5cEFzeVZHRTFnOEVWdkpVY0xsV0JUdkkwcnpCS05UbEM?oc=5,IND24,2026-05-20T14:26:59+05:30,hi,Chandigarh,,"(सूर्याघात OR तापाघात OR ""लू लगना"" OR ""लू से मौत"" OR ""गर्मी से मौत"" OR ""हीट स्ट्रोक"" OR ""सन स्ट्रोक"" OR ""लू से मरे"" OR निर्जलीकरण OR डिहाइड्रेशन OR ""अस्पताल में भर्ती"" OR ""गर्मी से बेहाल"" OR ""गर्मी से त्राहि-त्राहि"") Chandigarh","भीषण गर्मी से बेहाल हुए चिड़ियाघर के बेजुबान; अलीपुर जू प्रशासन ने किया 'कूलिंग प्लान' और डाइट में बदलाव का एलान
पशु-पक्षियों को राहत देने के लिए लगाए जा रहे हैं स्प्रिंकलर; शरीर में पानी की कमी रोकने के लिए तरबूज, तो मांसाहारी जीवों के मेन्यू से बीफ हटाकर चिकन-पॉर्क शामिल करने की तैयारी।
Sudip Naskar
9 Views
कोलकाता: पश्चिम बंगाल में पड़ रही रिकॉर्ड तोड़ गर्मी और दमघोंटू उमस ने न केवल इंसानों का जीना मुहाल कर रखा है, बल्कि चिड़ियाघर के बेजुबान जानवर भी इससे बुरी तरह तड़प रहे हैं। इंसानों के पास तो गर्मी से बचने के लिए ठंडे पेय पदार्थ या आइसक्रीम का विकल्प है, लेकिन पिंजरों में बंद इन वन्यजीवों के लिए विशेष देखभाल की जरूरत है। इसी स्थिति को देखते हुए कोलकाता के ऐतिहासिक अलीपुर चिड़ियाघर (Alipore Zoo) प्रशासन ने पशु-पक्षियों को लू और हीट स्ट्रोक से बचाने के लिए कई बड़े और अनोखे इंतजाम किए हैं।
स्प्रिंकलर और विशेष छांव की व्यवस्था
अलीपुर चिड़ियाघर की डायरेक्टर तृप्ति शाह ने बताया कि इस जानलेवा गर्मी में जानवरों के लिए पानी की किल्लत और डिहाइड्रेशन सबसे बड़ी चुनौती है। इससे निपटने के लिए प्रशासन निम्नलिखित कदम उठा रहा है:
वॉटर स्प्रिंकलर: जानवरों के बाड़ों (Enclosures) में पानी की बौछार करने वाले स्प्रिंकलर लगाए जा रहे हैं, ताकि वहां का तापमान कम रह सके और जानवरों को ठंडक मिले।
पर्याप्त पेयजल: चौबीसों घंटे पिंजरों में साफ और पर्याप्त ठंडे पानी की व्यवस्था की जा रही है।
दरमा की विशेष छांव: तेज धूप सीधे जानवरों पर न पड़े, इसके लिए बांस और कूस (दरमा) से बने विशेष शेड (छौनी) तैयार किए जा रहे हैं।
खान-पान में बड़ा बदलाव: तरबूज और फलों की बहार
गर्मी के मौसम में जानवरों के शरीर में पानी का स्तर बनाए रखने के लिए उनके खान-पान (डाइट चार्ट) में बदलाव किया गया है। शाकाहारी जीवों और भालू, बंदर जैसे जानवरों की थाली में पानी से भरपूर फल जैसे तरबूज, खीरा और अन्य मौसमी फल** बड़ी मात्रा में शामिल किए जा रहे हैं।
मांसाहारी जीवों के मेन्यू से हट सकता है बीफ, चिकन-पॉर्क पर विचार
सबसे महत्वपूर्ण और संवेदनशील बदलाव मांसाहारी तथा 'बिग कैट' प्रजाति के जीवों (जैसे शेर, बाघ, तेंदुए और लकड़बग्घे) के भोजन में करने की तैयारी चल रही है। आमतौर पर उच्च वसा (हाई फैट) और प्रोटीन की जरूरत को पूरा करने के लिए इनके दैनिक आहार में 'बीफ' (गोमांस) दिया जाता है। लेकिन अत्यधिक गर्मी में भारी मांस पचाना जानवरों के लिवर और स्वास्थ्य के लिए नुकसानदेह साबित हो सकता है।
इसलिए, चिड़ियाघर प्रशासन भविष्य में इनके मेन्यू से बीफ को हटाकर उसकी जगह हल्का और सुपाच्य चिकन (मुर्गे का मांस) और पॉर्क (सूअर का मांस) शामिल करने पर गंभीरता से विचार कर रहा है।
पशु चिकित्सकों से होगी चर्चा: इस संबंध में चिड़ियाघर की डायरेक्टर तृप्ति शाह ने स्पष्ट किया, ""गर्मियों में मांसाहारी वन्यजीवों के पाचन को ठीक रखने के लिए डाइट बदलने पर विचार चल रहा है। हालांकि, इस पर अंतिम फैसला चिड़ियाघर के विशेषज्ञ पशु चिकित्सकों (Veterinary Doctors) के साथ विस्तृत चर्चा और उनकी मंजूरी के बाद ही लिया जाएगा।""चिड़ियाघर प्रशासन की इन अग्रिम तैयारियों से उम्मीद जताई जा रही है कि पर्यटकों के आकर्षण का केंद्र रहने वाले इन बेजुबानों को इस साल बंगाल की भीषण गर्मी से काफी हद तक राहत मिल सकेगी।",1.0
"नौतपा से पहले तप रहा मध्य भारत! MP, राजस्थान में भीषण लू का रेड अलर्ट, छत्तीसगढ़ में बारिश के बाद चढ़ेगा पारा - The Sootr",https://news.google.com/rss/articles/CBMiowFBVV95cUxNV29XWHBzSWNnSVdVRWd1RHZVa3dHdnZWSDVfSXE5c2VjM2l5bkNwUEVtRkFoN2lncEVBUkdVZzFzTEprQmpOOEE3Tmg3Nld1NjFJUWdiNUs3M0FjeU9RMTBYYUNGYjJOcG5NYWV0cWVrU3EwUWx6QXNNS1Bodk9PRDZ4TmM1SjIta3kxSktzUG1fblFmOWFYS3ZNRk4wV3JMSktr?oc=5,The Sootr,2026-05-20T07:11:00+05:30,hi,Chandigarh,,"(""हीट एक्शन प्लान"" OR ""गर्मी से राहत"" OR चेतावनी OR ""रेड अलर्ट"" OR ""ऑरेंज अलर्ट"" OR ""येलो अलर्ट"" OR एडवाइजरी OR ""राहत सामग्री"" OR ""राहत शिविर"" OR मुआवजा) Chandigarh","Weather Update: मध्य भारत में मौसम के दो अलग रंग देखने को मिल रहे हैं। मध्यप्रदेश और राजस्थान में भीषण गर्मी ने लोगों का जीना मुहाल कर दिया है। नौगांव में पारा 47 डिग्री और चित्तौड़गढ़ में 46.3 डिग्री तक पहुंच चुका है। दोनों राज्यों में सूरज की तपिश और लू का कड़ा अलर्ट है।
दूसरी तरफ, छत्तीसगढ़ में बंगाल की खाड़ी के सिस्टम से राहत है। वहां रायपुर और बस्तर समेत कई जिलों में झमाझम बारिश हुई है। हालांकि, छत्तीसगढ़ में भी 20 मई के बाद गर्मी बढ़ने के आसार हैं। आने वाले दिनों में तीनों राज्यों में शुष्क मौसम और पारा चढ़ेगा। इसलिए फिलहाल धूप और लू से बचना बेहद जरूरी है।
मध्यप्रदेश मौसम रिपोर्ट - 20 मई 2026:
मध्यप्रदेश मौसम अपडेट (MP Weather Updates)
छत्तीसगढ़ मौसम अपडेट (CG Weather Update)
राजस्थान मौसम रिपोर्ट - 20 मई 2026:
राजस्थान मौसम अपडेट (Rajasthan Weather Update)
राजस्थान में गर्मी इस साल मई में ही अपने चरम पर है। नौतपा शुरू होने से पहले ही सूरज की तेज धूप और रिकॉर्ड तोड़ गर्मी ने लोगों का जीना मुश्किल कर दिया है। मौसम विज्ञान केंद्र जयपुर (IMD) ने राज्य में लगातार बढ़ रहे तापमान को देखते हुए कड़ा अलर्ट जारी किया है। राज्य के पूर्वी और पश्चिमी हिस्सों में सूरज की तपिश और लू का जोर बढ़ा हुआ है। पिछले 24 घंटों में कई जिलों में पारा 45 डिग्री पार करके 46 डिग्री के ऊपर पहुंच चुका है।
हवाओं ने बढ़ाई गर्मी की मार
IMD के मुताबिक, इस समय हवा में नमी सिर्फ 15 से 30 प्रतिशत है। इस वजह से हवाएं पूरी तरह शुष्क और बेहद गर्म लग रही हैं। दोपहर में सड़कों पर सन्नाटा छा जाता है और लोग घर से बाहर निकलने की हिम्मत नहीं जुटा पाते। पश्चिमी विक्षोभ तो जम्मू-कश्मीर के पास सक्रिय है, लेकिन मैदानी इलाकों में उसका असर नहीं दिख रहा। शुष्क उत्तर-पश्चिमी हवाओं ने पूरे मरुस्थल को एक तंदूर की तरह गर्म कर दिया है।
चित्तौड़गढ़: राजस्थान का सबसे गर्म शहर
पूर्वी राजस्थान का चित्तौड़गढ़ इस समय सबसे गर्म जगह बन चुका है। मौसम विभाग के ताजा आंकड़ों के अनुसार यहाँ का अधिकतम तापमान 46.3 डिग्री रिकॉर्ड किया गया है। सुबह 9 बजे से ही लू के थपेड़े शुरू हो जाते हैं और शाम 6 बजे तक लगातार चलते रहते हैं। बाजारों में सन्नाटा है और लोग ठंडे पेय और गन्ने के रस का सहारा ले रहे हैं। मौसम विशेषज्ञों का अनुमान है कि अगले 48 घंटों में तापमान में 1 डिग्री और बढ़ोतरी हो सकती है।
संगरिया और जालौर में रातें भी गर्म
राजस्थान के उत्तरी हिस्से संगरिया (हनुमानगढ़) और दक्षिणी हिस्से जालौर में भी गर्मी की मार लगातार जारी है। संगरिया में रात का न्यूनतम तापमान 34.1 डिग्री तक पहुंच गया है, जिससे रातें भी बेचैन हो गई हैं। जालौर में अधिकतम तापमान 40.5 डिग्री के ऊपर बना हुआ है और सापेक्षिक आर्द्रता 53 प्रतिशत दर्ज की गई, जिससे लोगों को उमस भरी गर्मी का सामना करना पड़ रहा है।
आगे का मौसम: बारिश की कोई उम्मीद नहीं
IMD का कहना है कि 22 से 25 मई तक पूरे राजस्थान में मौसम पूरी तरह शुष्क रहेगा। गर्मी बढ़ेगी और बारिश की कोई संभावना नहीं है। लोगों को अभी से ही धूप और लू से बचने के इंतजाम करने होंगे।
ये खबर भी पढ़िए...
MP-CG-Rajasthan Weather: अगले 4 दिन झुलसाएगी गर्मी, तीन राज्यों में हीटवेव अलर्ट!",1.0
"झुलसा देने वाली गर्मी से हरियाणा में लॉकडाउन जैसे हालात, लू से बचाव हेतु करें यह उपाय - Haryana E Khabar",https://news.google.com/rss/articles/CBMixwFBVV95cUxNc3d6blhickFHZFpScnZVYkQ3enRtZkZ1TUFtdGlZZkJyalNadjN4R2l0YW91ekUxbm0yVG12c3VmMTlhZDdnSFlGNHFBNjlPdzR2SzRUZlFyb0FDemhKX2lxQ2E2VWJfRV9wN1Jwb3UyRjRmODR1Nk5OYUVHV21lVm1fMEhaUFcwQ25UbmxJUVlPa2loMjBMcTF4RmpkdmtyeFNXY3M2YjRUQXlrb2JvbkplcmZqZXRQNTZFcmptT3VEX2ludnBR?oc=5,Haryana E Khabar,2026-05-20T08:41:32+05:30,hi,Chandigarh,,"""लू"" Chandigarh","चंडीगढ़ | हरियाणा में पश्चिमी गर्म शुष्क मरुस्थलीय हवाओं का कहर लगातार जारी है. दिनभर झुलसाने वाली तेज धूप और भीषण गर्मी के तेवर प्रचंड बने हुए है. दोपहर के समय चली लू के कारण सड़कों पर सन्नाटा छा गया है. भारतीय मौसम विज्ञान विभाग ने स्थिति को गंभीरता से लेते हुए 24 मई तक येलो अलर्ट जारी किया है.
हरियाणा तापमान अपडेट
राज्य में तापमान के आंकड़ों पर नजर डाले तो अधिकतम तापमान सामान्य से 2.6 डिग्री अधिक रहा है. सिरसा, फतेहाबाद, रोहतक, हिसार समेत कई जिलों में तापमान 44 डिग्री का आंकड़ा पार कर गया है. मौसम विभाग के अनुसार आने वाले दिनों में तापमान में ओर उछाल देखने को मिल सकता है. फिलहाल, गर्मी से राहत नहीं मिलने वाली है.
लू से बचने की सलाह
लू से बचने के लिए पानी, शिकंजी, नींबू पानी, छाछ और अन्य लिक्विड पदार्थों का सेवन ज्यादा से ज्यादा करें, ताकि शरीर में पानी की कमी न हो. दोपहर के समय तेज धूप में बाहर निकलने से बचे और यदि जरूरी हो तो सिर ढककर घर से निकलें. उल्टी- दस्त होने पर तुरंत ORS का घोल या तरल पदार्थ लें. बुजुर्गों और बच्चों को सुबह या शाम के समय ही बाहर निकलने दे. पर्याप्त पानी पिएं क्योंकि गर्मी में डिहाइड्रेशन होने से हीट स्ट्रोक का खतरा बढ़ जाता है.
चलेंगी धूलभरी हवाएं
मौसम विशेषज्ञ डॉ. चंद्रमोहन के अनुसार आने वाले एक सप्ताह तक मौसम पूरी तरह शुष्क रहेगा. पश्चिमी हवाओं ने हवा से नमी को पूरा सोख लिया है, जिसके कारण लू के थपेड़े और तीखे हो गए है. हरियाणा के पश्चिमी और दक्षिणी इलाकों में हीट वेव का प्रकोप ज्यादा बढ़ने की संभावना है. अगले 4 से 5 दिन इन क्षेत्रों में 20 से 30 किलोमीटर प्रति घंटे की रफ्तार से तेज धूलभरी हवाएं चलने की संभावना है और तापमान में भारी उछाल देखने को मिल सकता है.",1.0
