title,url,source,date,language,state,district,search_term,full_text,relevance_score
छत्तीसगढ़ और महाराष्ट्र में पारा 45 डिग्री के पार; उत्तर भारत में लू और बारिश का मौसम अपडेट - Dainik Times,https://news.google.com/rss/articles/CBMickFVX3lxTE55ZTA4c05zWWhXY3l1Q2JkQW1ERzNNdWh3bHBqNHM4RVg0YUZWVzB4aERNdW55ODJpaElMdzE0bExxendhMzV0b3FVMUhCN3g3V196a2ZoVTgyN0luVUtnT2dLczg2R3duNjJkbTBmZmJmdw?oc=5,Dainik Times,2026-05-20T03:47:08+05:30,hi,Chandigarh,,"""लू"" Chandigarh","भारत के कई हिस्सों में इस समय मौसम ने बेहद अजीब रंग दिखाना शुरू कर दिया है। छत्तीसगढ़ और महाराष्ट्र के कुछ क्षेत्रों में तापमान 45 डिग्री सेल्सियस को पार कर गया है। इस अत्यधिक गर्मी के कारण आम जनजीवन प्रभावित हो रहा है। वहीं, उत्तर भारत के कुछ हिस्सों में लू के थपेड़ों के साथ बारिश भी हो रही है, जिससे मौसम में अस्थिरता आ गई है।
छत्तीसगढ़ के रायपुर, बिलासपुर और महाराष्ट्र के नागपुर जैसे शहरों में पारा चढ़कर 45 डिग्री के पार पहुंच गया है। मौसम विभाग ने इन क्षेत्रों में हीट वेव का अलर्ट जारी किया है। इस गर्मी के कारण लोग गर्मी से राहत पाने के लिए अपने घरों से बाहर नहीं निकल पा रहे हैं।
वहीं दूसरी ओर, उत्तर भारत के कुछ हिस्सों में, जैसे दिल्ली और उत्तर प्रदेश में, लू का प्रकोप देखने को मिल रहा है। हालांकि, कुछ स्थानों पर अचानक बरसात ने मौसम को थोड़ा ठंडा कर दिया है। इससे लोगों को गर्मी से राहत मिली है, लेकिन यह भी चिंता का विषय है कि अचानक बारिश से बाढ़ का खतरा बढ़ गया है।
मौसम वैज्ञानिकों का कहना है कि यह स्थिति वायुमंडलीय दबाव में बदलाव और जलवायु परिवर्तन का परिणाम है। वैश्विक तापमान में वृद्धि के कारण इस प्रकार की चरम मौसम की घटनाएं बढ़ रही हैं। इसके अलावा, मानसून की शुरुआत में सामान्य से पहले की बारिश और गर्मी का मिलाजुला असर भी देखने को मिल रहा है।
इस गर्मी और बारिश के कारण आम लोगों की दिनचर्या पर गहरा असर पड़ रहा है। स्कूल, कॉलेजों और कार्यालयों में लोगों को कठिनाई का सामना करना पड़ रहा है। स्वास्थ्य विशेषज्ञों ने सलाह दी है कि लोग इस गर्मी में बाहर जाने से बचें और हाइड्रेटेड रहें।
जलवायु विशेषज्ञ डॉ. रवि कुमार ने कहा, “हमारे देश में मौसम में हो रहे इस बदलाव के पीछे जलवायु परिवर्तन की बड़ी भूमिका है। यह जरूरी है कि हम इसके प्रति सजग रहें और अपने पर्यावरण का संरक्षण करें।”
आगामी दिनों में तापमान में और वृद्धि की संभावना है। मौसम विभाग ने अगले सप्ताह भी गर्मी का अलर्ट जारी किया है। ऐसे में यह आवश्यक है कि लोग सावधानी बरतें और मौसम के प्रति जागरूक रहें।",1.0
