title,url,source,date,language,state,district,search_term,full_text,relevance_score
J’khand HC impleads CBI in Bokaro missing girl case; asks CBI to give tech support to CID | Hindustan Times - Hindustan Times,https://news.google.com/rss/articles/CBMi9AFBVV95cUxNbXdLWmZaVUhTbERkeVRQS093WVp6MGlVM3BrdDdKMmxydlo4Ql9ncG5UXzBFUUUxLWdjTWdYbnRPcU5qaGJ1OVdreENuRGh5X0d2VnJPNTdxenc4MkQyNkxMWWNYSWpzYjZjc0Flai1kVHVYZ1NFT3N1U0VmQlV3bm5vZlJfSlhPMUpDZnMxanlMa2poaXZZWG8wbFNHWFlaU1VrcHBRTHUxaHlUZjlwTDlFQ1VFb09TOVJONE1HSlNWNjk3MEx6dUlmcXpGbHlBQ3JhQ3hEYk1TUjd2NTFacnZVVmhwN3VOc19jMDVvNWtHem5N0gH0AUFVX3lxTE1td0taZlpVSFNsRGR5VFBLT3dZWnowaVUzcGt0N0oybHJ2WjhCX2dwblRfMEVRRTEtZ2NNZ1hudE9xTmpoYnU5V2t4Q25EaHlfR3ZWck81N3F6dzgyRDI2TExZY1hJanNiNmNzQWVqLWRUdVhnU0VPc3VTRWZCVXdubm9mUl9KWE8xSkNmczFqeUxramhpdllYbzBsU0dYWVpTVWtwcFFMdTFoeVRmOXBMOUVDVUVvT1M5Uk40TUdKU1Y2OTcwTHp1SWZxekZseUFDcmFDeERiTVNSN3Y1MVpydlVWaHA3dU5zX2MwNW81a0d6bk0?oc=5,Hindustan Times,2026-07-02T22:36:37+05:30,en,Jharkhand,Bokaro,"""heatwave"" Jharkhand","The Jharkhand High Court on Thursday took a major step in the long-pending case of a minor girl from Bokaro district for last six years.
A division bench comprising Justice Sujit Narayan Prasad and Justice Sanjay Prasad officially impleaded the Central Bureau of Investigation (CBI) as a respondent, directing the central agency to actively participate in the ongoing probe, an advocate close to the matter informed Hindustan Times.
“The order was passed during the hearing of a habeas corpus petition by the minor’s mother, Usha Jha. The court found it necessary to involve central authorities to break the deadlock. The HC has scheduled the next hearing for July 27 by which time the joint investigative teams are expected to present updated progress reports,” the advocate said.
Jha’s advocate Vincent R Marki confirmed the development. “The court directed the CBI and the state Crime Investigation Department (CID) to carry forward the investigation in close coordination. To ensure a seamless transition, the court instructed the Jharkhand government to provide all necessary technical and logistical assistance to the CBI as needed,” Marki said.
The case stems from the disappearance of a Class IX student from Kurma village, under Pindrajora police station in Bokaro district, on October 16, 2020.
The state police originally handled the case, but the investigation faced severe delays. Following intense scrutiny and reprimands from the HC regarding slow progress, the matter was transferred to the CID earlier this year.
{{/usCountry}}The state police originally handled the case, but the investigation faced severe delays. Following intense scrutiny and reprimands from the HC regarding slow progress, the matter was transferred to the CID earlier this year.
{{/usCountry}}Previous hearings revealed that out of four primary suspects identified in 2022, three underwent narco-analysis tests, while one was declared medically unfit, a status the court heavily questioned.",0.0
