title,url,source,date,language,state,district,search_term,full_text,relevance_score
"अचानक बदला MP के मौसम का मिजाज, तपती गर्मी और लू के बीच जोरदार बारिश, 50KM प्रति घंटे रफ्तार से चली आंधी - Zee News",https://news.google.com/rss/articles/CBMi1gFBVV95cUxPbFdnblNYU29RYkRGVDhJR0JpUTI2aTBReFpLVWpUYmNzUzdwdERfcmlOMjgxOF9CX1g2V3dpMmNoZXgyb2hLdGRJa0lxREtwVW8yNzRIaEpPUlFuLU4wSkpmZlNJdVZJZHNjVi1uY0dIM2NCNzQ1c0FVMjJLdkx6c3ZMOW1jSXlpYnJxS19WVEZaRHdoQjdKN2ZrMGNBSU0yRzBhaDY0d3g5MkhZTnhKMFI2Zm9TaXdiWUJScE1sbkU1Z1BFYXNlLVFrTWZkQVJpcjFzS0Jn0gHbAUFVX3lxTFBKczFOOGktbDZpQm1jdjY3b09XN3lrR2hzRXhOOUZNZHRoM2liLVo4Y05vbHh4TkdMZUd5SUxEUjlPcGE2TU5kVE4xYlUtS2lPRFF4Y095eVJuY2FST3djelVXYW9WSlh1MThVOG00MFRObXhFT0tMNlRtWTVpaHlJeWtObW9NNGhTRXRDWFZoMUQyblZSTXFQNXBadV9PbS1XczZWaFNDYk0xbDNramlJb1FyU2FkUHFBV3dVa0txSE8tWk9sMGhPb3U0TXlna1RSbG5mX1NUWUJwUQ?oc=5,Zee News,2026-05-02T18:37:48+05:30,hi,Madhya Pradesh,Bhopal,"(लू OR ""लू चलना"" OR ""भीषण गर्मी"" OR ""प्रचंड गर्मी"" OR ""कड़ी धूप"" OR ""तेज धूप"" OR ""गर्म हवा"" OR ""उष्ण लहर"" OR ""ताप लहर"" OR ""हीट वेव"" OR ""झुलसाने वाली गर्मी"" OR ""तपती गर्मी"" OR ""भयंकर गर्मी"" OR ""गर्मी का कहर"" OR ""गर्मी का प्रकोप"" OR ""अत्यधिक गर्मी"" OR मौसम OR ""मौसम अपडेट"" OR ""मौसम का हाल"" OR ""मौसम पूर्वानुमान"" OR ""मौसम अलर्ट"" OR आईएमडी OR ""आईएमडी पूर्वानुमान"" OR ""आईएमडी अलर्ट"" OR ""तापमान में बढ़ोतरी"" OR ""गर्मी से राहत"" OR ""गर्मी से निजात"") Madhya Pradesh","Mp Weather Update: भोपाल समेत मध्यप्रदेश के कई जिलों में मौसम ने अचानक करवट ली. भीषण गर्मी से परेशान लोगों को बारिश से राहत मिली. भोपाल के साथ नर्मदापुरम में भी घने बादल, तेज हवाएं और बारिश हुई, जिससे तापमान में गिरावट आई.
Trending Photos
Mp Weather Update: राजधानी भोपाल समेत मध्यप्रदेश के कई जिलों में मौसम ने एक बार फिर करवट ली है.भोपाल में तेज आंधी-तूफान के साथ बारिश शुरू हो गई, जिससे मौसम अचानक बदल गया. तेज हवाओं और बादलों की गड़गड़ाहट के बीच हुई बारिश से लोगों को गर्मी से राहत मिली. प्रदेश के कई इलाकों में जोरदार बारिश हुई, जिससे तापमान में गिरावट दर्ज की जा रही है. मौसम विभाग ने आने वाले घंटों में कुछ क्षेत्रों में तेज हवाओं और बारिश की संभावना जताई है.
नर्मदापुरम जिले में भी भीषण गर्मी और लू के बीच देर शाम मौसम ने अचानक करवट ले ली. शाम करीब 4 बजे आसमान में घने बादल छा गए और तेज हवाओं के साथ बारिश शुरू हो गई, जिससे तपती गर्मी से जूझ रहे लोगों को बड़ी राहत मिली. मौसम में आए इस बदलाव के चलते तापमान में भी गिरावट दर्ज की गई है और लोगों ने राहत की सांस ली है. मौसम विभाग ने पहले ही नर्मदापुरम सहित प्रदेश के कई जिलों में बारिश की चेतावनी जारी की थी. साथ ही 30 से 50 किलोमीटर प्रति घंटे की रफ्तार से तेज आंधी चलने की संभावना भी जताई गई थी.
वहीं पिछले आधा घंटे से जिले में लगातार बारिश का दौर जारी है, तेज आंधी और तूफान के कारण कई जगहों पर पेड़ बिजली के तारों पर गिर गए, जिससे विद्युत आपूर्ति बाधित हो गई. कई क्षेत्रों में बिजली गुल होने से लोगों को परेशानी का सामना करना पड़ा. इसी बीच मीनाक्षी चौक क्षेत्र में बड़ा हादसा होते-होते टल गया, जहां तेज आंधी के दौरान एक पेड़ ट्रैक्टर-ट्रॉली पर गिर गया. प्रत्यक्षदर्शियों के मुताबिक ट्रॉली में मजदूरों के सवार होने की आशंका जताई जा रही है, हालांकि फिलहाल किसी के हताहत होने की सूचना नहीं है. फिलहाल मौसम में उतार-चढ़ाव का दौर जारी है.

मध्य प्रदेश-छत्तीसगढ़ के नवीनतम अपडेट्स के लिए ज़ी न्यूज़ से जुड़े रहें! यहां पढ़ें MP Breaking News in Hindi हर पल की जानकारी । मध्य प्रदेश-छत्तीसगढ़ की हर ख़बर सबसे पहले आपके पास, क्योंकि हम रखते हैं आपको हर पल के लिए तैयार और जुड़े रहें हमारे साथ और बने रहें अपडेट",1.0
