title,url,source,date,language,state,district,search_term,full_text,relevance_score
"खुला महिला शौचालय, बाजार आने वाली महिलाओं को मिली राहत",https://www.livehindustan.com/bihar/lakhisarai/story-women-s-public-toilet-issue-resolved-in-lakhisarai-after-media-coverage-201771875331300.html,Live Hindustan,2026-02-24T01:05:33+05:30,hi,Bihar,,"लू (Katihar OR Khagaria OR Kishanganj OR Lakhisarai OR Madhepura OR Madhubani OR ""Munger (Monghyr)"" OR Muzaffarpur OR Nalanda OR Nawada OR Patna OR ""Purnia (Purnea)"" OR Rohtas OR Saharsa)","खुला महिला शौचालय, बाजार आने वाली महिलाओं को मिली राहत
बोले खबर का असर:खुला महिला शौचालय, नगर परिषद हरकत मेंखुला महिला शौचालय, नगर परिषद हरकत में
लखीसराय, हिन्दुस्तान संवाददाता। शहर में महिलाओं के लिए सार्वजनिक शौचालय की अनुपलब्धता को लेकर 21 फरवरी को हिन्दुस्तान अखबार के बोले लखीसराय कॉलम में ‘शहर में नहीं है महिला शौचालय, बुनियादी सुविधा से जूझ रही क्षेत्र की आधी आबादी’ शीर्षक से प्रकाशित खबर का असर दिखने लगा है। खबर प्रकाशित होने के तीसरे दिन ही नगर परिषद लखीसराय सक्रिय हुआ और शहर में बने सार्वजनिक शौचालय की सफाई कराते हुए उसमें लगे ताले को खुलवा दिया। उल्लेखनीय है कि लंबे समय से बाजार क्षेत्र में महिलाओं के लिए समुचित शौचालय सुविधा उपलब्ध नहीं थी। जो सार्वजनिक शौचालय बना हुआ था, वह भी बंद रहने व हमेशा उसमें ताला लगा रहने से उसका उपयोग सिर्फ दुकानदार ही कर रहे थे, आम लोगों को इसका लाभ नहीं मिल रहा था।
इससे बाजार आने वाली महिलाओं, खासकर ग्रामीण क्षेत्रों से खरीदारी के लिए पहुंचने वाली महिलाओं एवं पढ़ाई करने आने वाली छात्र-छात्राओं को काफी परेशानी का सामना करना पड़ता था। कई बार उन्हें असहज परिस्थितियों से गुजरना पड़ता था, जिससे शर्मिंदगी भी झेलनी पड़ती थी। समस्या को प्रमुखता से प्रकाशित किए जाने के बाद नगर परिषद के पदाधिकारी ने स्थल का निरीक्षण किया और तत्काल सफाईकर्मियों को लगाकर शौचालय की साफ-सफाई कराई। साथ ही बंद पड़े ताले को खुलवाकर आम उपयोग के लिए शौचालय को उपलब्ध करा दिया गया। नगर परिषद की इस त्वरित कार्रवाई से महिलाओं में संतोष देखा जा रहा है। क्षेत्र की महिलाओं ने हिन्दुस्तान के प्रति आभार जताते हुए कहा कि मीडिया की पहल से उनकी वर्षों पुरानी समस्या का समाधान संभव हो पाया है। उन्होंने नगर परिषद से नियमित सफाई और रखरखाव सुनिश्चित करने की भी मांग की, ताकि भविष्य में फिर से ऐसी स्थिति उत्पन्न न हो।",0.0
एआई समिट में ‘चायनीज कुत्ता’ प्रस्तुत कर देश की छवि को नुकसान : अमर सिंह,https://www.livehindustan.com/bihar/lakhisarai/story-congress-spokesperson-amar-singh-criticizes-chinese-dog-presentation-at-ai-summit-201771875328392.html,Live Hindustan,2026-02-24T01:05:30+05:30,hi,Bihar,,"लू (Katihar OR Khagaria OR Kishanganj OR Lakhisarai OR Madhepura OR Madhubani OR ""Munger (Monghyr)"" OR Muzaffarpur OR Nalanda OR Nawada OR Patna OR ""Purnia (Purnea)"" OR Rohtas OR Saharsa)","एआई समिट में ‘चायनीज कुत्ता’ प्रस्तुत कर देश की छवि को नुकसान : अमर सिंह
कांग्रेस के प्रवक्ता अमर सिंह ने एआई समिट में 'चायनीज कुत्ता' प्रस्तुत किए जाने पर कड़ी आपत्ति जताई। उन्होंने कहा कि इस तरह की प्रस्तुति से देश की अंतरराष्ट्रीय छवि को नुकसान हुआ है। उन्होंने सरकार से स्पष्टीकरण की मांग की और भविष्य में देश की गरिमा का ध्यान रखने की अपील की।
कजरा, एक संवाददाता। कांग्रेस राहुल-प्रियंका सेना के राष्ट्रीय प्रवक्ता अमर सिंह ने एआई समिट में ‘चायनीज कुत्ता’ प्रस्तुत किए जाने को लेकर कड़ी आपत्ति जताई है। उन्होंने कहा कि इस तरह की प्रस्तुति से अंतरराष्ट्रीय मंच पर देश की छवि को नुकसान पहुंचा है। अमर सिंह ने आरोप लगाया कि वैश्विक स्तर के कार्यक्रमों में देश की तकनीकी क्षमता और नवाचार को प्रदर्शित किया जाना चाहिए, न कि ऐसे प्रतीकों को जो भ्रम और विवाद उत्पन्न करें। उन्होंने कहा कि सरकार को इस मामले पर स्पष्टीकरण देना चाहिए कि आखिर किस उद्देश्य से इस तरह की प्रस्तुति दी गई। साथ ही उन्होंने मांग की कि भविष्य में अंतरराष्ट्रीय मंचों पर देश की गरिमा और प्रतिष्ठा का विशेष ध्यान रखा जाए, ताकि भारत की सकारात्मक और सशक्त छवि विश्व पटल पर बनी रहे।",0.0
इंटरमीडिएट वार्षिक परीक्षा मूल्यांकन हेतु सह परीक्षकों का नियुक्ति पत्र 24 तक लेना अनिवार्य,https://www.livehindustan.com/bihar/lakhisarai/story-district-education-department-issues-guidelines-for-intermediate-exam-evaluation-2026-201771875322352.html,Live Hindustan,2026-02-24T01:05:27+05:30,hi,Bihar,,"लू (Katihar OR Khagaria OR Kishanganj OR Lakhisarai OR Madhepura OR Madhubani OR ""Munger (Monghyr)"" OR Muzaffarpur OR Nalanda OR Nawada OR Patna OR ""Purnia (Purnea)"" OR Rohtas OR Saharsa)","इंटरमीडिएट वार्षिक परीक्षा मूल्यांकन हेतु सह परीक्षकों का नियुक्ति पत्र 24 तक लेना अनिवार्य
जिला शिक्षा विभाग ने इंटरमीडिएट वार्षिक परीक्षा 2026 की उत्तरपुस्तिकाओं के मूल्यांकन के लिए दिशा-निर्देश जारी किए हैं। सभी उच्च माध्यमिक विद्यालयों के प्रधानाध्यापकों को 24 फरवरी 2026 तक सह परीक्षकों का नियुक्ति पत्र प्राप्त करना अनिवार्य होगा। इसे जिला शिक्षा पदाधिकारी कार्यालय, लखीसराय से लिया जाएगा।
कजरा। इंटरमीडिएट वार्षिक परीक्षा 2026 की उत्तरपुस्तिकाओं के मूल्यांकन कार्य को लेकर जिला शिक्षा विभाग ने आवश्यक सूचना जारी की है। जारी निर्देश के अनुसार जिले के सभी उच्च माध्यमिक विद्यालयों के प्रधानाध्यापकों को सह परीक्षकों का नियुक्ति पत्र 24 फरवरी 2026 तक अनिवार्य रूप से प्राप्त करना सुनिश्चित करना होगा। जिला शिक्षा पदाधिकारी यदुवंश राम लखीसराय द्वारा जारी आदेश में कहा गया है कि इंटरमीडिएट वार्षिक परीक्षा 2026 की उत्तरपुस्तिकाओं के मूल्यांकन कार्य के लिए नियुक्त सह परीक्षकों का नियुक्ति पत्र जिला शिक्षा पदाधिकारी कार्यालय, लखीसराय से कार्यालय अवधि के दौरान प्राप्त किया जाएगा। निर्धारित तिथि तक नियुक्ति पत्र प्राप्त नहीं करने की स्थिति में संबंधित विद्यालय प्रधान की जिम्मेदारी तय की जाएगी।",0.0
"बोले लखीसराय : चेतावनी बेअसर, खुलेआम मांस-मछली की बिक्री, नियमों की उड़ रहीं धज्जियां",https://www.livehindustan.com/bihar/lakhisarai/story-lakhisarai-health-crisis-open-sale-of-meat-and-fish-violates-sanitation-laws-201771875265285.html,Live Hindustan,2026-02-24T01:04:27+05:30,hi,Bihar,,"लू (Katihar OR Khagaria OR Kishanganj OR Lakhisarai OR Madhepura OR Madhubani OR ""Munger (Monghyr)"" OR Muzaffarpur OR Nalanda OR Nawada OR Patna OR ""Purnia (Purnea)"" OR Rohtas OR Saharsa)","बोले लखीसराय : चेतावनी बेअसर, खुलेआम मांस-मछली की बिक्री, नियमों की उड़ रहीं धज्जियां
- डीएम के निर्देश व चेतावनी का जिले में नहीं दिख रहा असर- डीएम के निर्देश व चेतावनी का जिले में नहीं दिख रहा असर - - डीएम के निर्देश व चेतावनी का जिले
शहर में स्वच्छता और सार्वजनिक स्वास्थ्य से जुड़े नियमों की खुलेआम अनदेखी हो रही है। जिला प्रशासन और नगर प्रशासन की सख्त चेतावनी के बावजूद लखीसराय में सड़क किनारे खुले में मांस और मछली की बिक्री धड़ल्ले से जारी है। हालात ऐसे हैं कि प्रशासनिक आदेश कागजों तक सीमित नजर आ रहे हैं, जबकि जमीनी स्तर पर नियमों की लगातार धज्जियां उड़ रही हैं। शहर के प्रमुख जगह नया बाजार, पंजाबी मुहल्ला, अष्टघट्टी मोड़ और बाजार समिति के आसपासहर सुबह सड़क किनारे मांस और मछली की अस्थायी दुकानों की लंबी कतार लग जाती है। बिना लाइसेंस, बिना किसी स्वच्छता मानक और बिना निर्धारित स्थान के ये विक्रेता खुले में मांस काटते और बेचते नजर आते हैं।
सड़कों पर बहता खून, इधर-उधर फैला कचरा और उठती दुर्गंध न सिर्फ राहगीरों के लिए परेशानी बन रही है बल्कि आसपास के दुकानदारों और स्थानीय निवासियों के लिए भी गंभीर समस्या खड़ी कर रही है। पुरानी बाजार क्षेत्र की स्थिति भी इससे अलग नहीं है। यहां भी सुबह होते ही सड़क किनारे मांस-मछली की बिक्री शुरू हो जाती है। कई स्थानों पर तो स्कूल, मंदिर और आवासीय इलाकों के पास ही ये दुकानें लगाई जा रही हैं जिससे लोगों में आक्रोश बढ़ता जा रहा है। प्रशासन बिक्रेताओं को बार बार हिदायत दे रहे है बावजूद कोई बिक्रेता इसे मानने कों तैयार नहीं है। हाल ही में बिहार सरकार के उपमुख्यमंत्री विजय कुमार सिन्हा ने निर्देश दिया था कि बिना लाइसेंस के मांस और मछली की दुकानों का संचालन पूरी तरह प्रतिबंधित रहेगा और खुले में बिक्री पर सख्त रोक लगाई गई। इसके बावजूद लखीसराय में इन आदेशों का पालन नहीं होना प्रशासनिक उदासीनता और निगरानी की कमी को उजागर करता है। नगर प्रशासन द्वारा कुछ दिन पहले एक अभियान चलाया गया था जिसमें सड़क किनारे दुकान लगाने वाले कुछ विक्रेताओं को चेतावनी दी गई थी। हालांकि यह कार्रवाई महज औपचारिकता साबित हुई। न तो किसी पर जुर्माना लगाया गया और न ही स्थायी रूप से दुकानें हटाई गईं। परिणामस्वरूप कुछ ही दिनों में स्थिति फिर से पहले जैसी हो गई। स्थानीय नागरिकों का कहना है कि प्रशासन की कार्रवाई केवल दिखावे तक सीमित है। अगर सख्ती से कार्रवाई की जाए नियमित जांच हो और जुर्माना लगाया जाए तभी इस पर रोक लग सकती है। बता दें की खुले में मांस और मछली की बिक्री से संक्रमण फैलने का खतरा काफी बढ़ जाता है। बिना ढके मांस और मछलियों पर मक्खियों का बैठना साफ-सफाई का अभाव और गंदे पानी का इस्तेमाल कई तरह की बीमारियों को जन्म दे सकता है। गर्मी के मौसम में यह खतरा और अधिक बढ़ जायेगा जब बैक्टीरिया तेजी से पनपते हैं। ऐसे में यह केवल स्वच्छता का ही नहीं बल्कि जनस्वास्थ्य का भी गंभीर मुद्दा बन जाता है। नगर परिषद के नियमों के अनुसार, मांस और मछली की बिक्री के लिए निर्धारित स्थान, लाइसेंस और स्वच्छता मानकों का पालन अनिवार्य है। दुकानों में साफ-सफाई, कचरा निस्तारण और मांस को ढककर रखने की व्यवस्था जरूरी है। लेकिन शहर में इन नियमों का पालन कहीं भी नजर नहीं आता। अधिकांश विक्रेता बिना किसी पंजीकरण के ही कारोबार कर रहे हैं। इस पूरे मामले में नगर प्रशासन की भूमिका भी सवालों के घेरे में है। नियमित निरीक्षण और निगरानी के अभाव में स्थिति दिन-ब-दिन बिगड़ती जा रही है। अगर समय रहते ठोस कदम नहीं उठाए गए तो यह समस्या और विकराल रूप ले सकती है। शहरवासियों ने मांग की है कि प्रशासन सख्ती दिखाए, अवैध दुकानों को हटाए और नियमों का कड़ाई से पालन सुनिश्चित करे।इधर बिक्रेताओं का कहना है कि समस्या का समाधान केवल कार्रवाई से नहीं बल्कि वैकल्पिक व्यवस्था से भी जुड़ा है। नगर प्रशासन को चाहिए कि वह मांस और मछली विक्रेताओं के लिए निर्धारित बाजार स्थल विकसित करे जहां सभी आवश्यक सुविधाएं उपलब्ध हों। इससे न केवल विक्रेताओं को व्यवस्थित स्थान मिलेगा बल्कि शहर की स्वच्छता और स्वास्थ्य व्यवस्था भी बेहतर होगी। - प्रस्तुति: मनोज कुमार",0.0
