title,url,source,date,language,state,district,search_term,full_text,relevance_score
जिले के 1949 विद्यालयों के 6489 छात्र-छात्राओं का डाटा त्रुटिपूर्ण,https://www.livehindustan.com/bihar/araria/story-data-inaccuracy-affects-6489-students-in-araria-schools-urgent-correction-needed-201771871445683.html,Live Hindustan,2026-02-24T00:00:47+05:30,hi,Bihar,,"लू (Araria OR Arwal OR Aurangabad OR Banka OR Begusarai OR Bhagalpur OR Bhojpur OR Buxar OR Darbhanga OR ""East Champaran (Motihari)"" OR Gaya OR Gopalganj OR Jamui OR Jehanabad OR ""Kaimur (Bhabua)"")","जिले के 1949 विद्यालयों के 6489 छात्र-छात्राओं का डाटा त्रुटिपूर्ण
अररिया जिले के 1949 सरकारी विद्यालयों में 6489 छात्रों का डाटा त्रुटिपूर्ण है। जोकीहाट और पलासी प्रखंड में स्थिति गंभीर है। शिक्षा विभाग ने 28 फरवरी तक डाटा सुधार का अंतिम अल्टीमेटम दिया है। त्रुटिपूर्ण डाटा के कारण छात्र सरकारी योजनाओं का लाभ नहीं ले पा रहे हैं, जिससे उनके अधिकारों का हनन हो रहा है।
अररिया, वरीय संवाददाता अररिया जिले के 1949 सरकारी व सरकारी सहायता प्राप्त विद्यालयों में अध्ययनरत छह हजार 489 छात्र-छात्राओं का अब भी डाटा त्रुटिपूर्ण है। इसमें सबसे खराब स्थिति जोकीहाट व पलासी प्रखंड की है। जोकीहाट प्रखंड में 1456 तो वहीं पलासी प्रखंड के 1152 बच्चों का डाटा त्रुटिपूर्ण है। त्रुटिपूर्ण डाटा के कारण बच्चे सरकारी योजनाओं का लाभ लेने से वंचित हैं। शिक्षा विभाग ने इसे बच्चों के अधिकार का हनन बताया है। इस संबंध में प्राथमिक शिक्षा निदेशक सह डीबीटी के नोडल पदाधिकारी ने 28 फरवरी के भीतर ई शिक्षाकोष पोर्टल पर इंट्री करने अंतिम अल्टीमेटम दिया है। शिक्षा विभाग इस निर्देश को पूरा करने में जुटा है।
लेखा एवं योजना डीपीओ रोहित कुमार चौरसिया ने बताया कि 28 फरवरी के भीतर डेटा करेक्शन कर ई शिक्षा कोष एप पर इंट्री करने की एचएम व बीईओ चेतावनी दी गयी है। मामले की पुष्टि करते हुए लेखा एवं योजना डीपीओ रोहित कुमार चौरसिया ने बताया कि जिले के 1949 सरकारी व सरकारी सहायता प्राप्त विद्यालयों में अध्ययनरत छह हजार 489 छात्र-छात्राओं का डाटा त्रुटिपूर्ण है। इस कारण इन बच्चों को सरकारी योजनाओं का लाभ नहीं मिल रहा है। यह एक तरह से बच्चों के अधिकार हनन है। इसे नजरअंदाज नहीं किया जा सकता। बताया कि 45154 त्रुटिपूर्ण डाटा में से केवल 38 हजार 665 का ही करेक्शन हो सका है। कहा कि विभागीय निर्देश के आलोकें सबंधित बीईओ को निर्देश दिया गया है कि 28 फरवरी के भतीर ई शिक्षा कोष पोर्टल पर त्रुटिपूर्ण डाटा को सुधार करना सुनिश्चत करें अन्यथा जिन प्रखंड के छात्रों की त्रुटियों का निराकरण नहीं होगा या कम होगा उनके विरूद्ध आरोप पत्र गठित कर विभागीय कार्रवाई की अनुशंसा कर दी जाएगी। किस प्रखंड में कितने स्कूल के डाटा त्रुटिपूर्ण: शिक्षा विभाग से प्राप्त जानकारी के अनुसार जिले के जिन 1949 विद्यालयों में बच्चों का डाटा करेक्शन करना है उसमें अररिया सदर के 309, भरगामा के 191, फारबिसगंज के 244, जोकीहाट के 259, कुर्साकांटा 131, नरपतगंज 214, पलासी 185, रानीगंज 267 व सिकटी प्रखंड के 149 स्कूल शामिल हैं। किस प्रखंड के कितने बच्चों का डाटा त्रुटिपूर्ण: अररिया प्रखंड के 7332, भरगामा 5670, फारबिसगंज के 4791, जोकीहाट प्रखंड के 6347, कुर्साकांटा के 2683, नरपतगंज के 5300, पलासी प्रखंड के 3736, रानीगंज प्रखंड के 6310 व सिकटी प्रखंड के 2985 बच्चे। कितने बच्चों का किया गया डाटा सही: अररिया प्रखंड के 6380, भरगामा 4863, फारबिसगंज के 4335, जोकीहाट प्रखंड के 4891, कुर्साकांटा के 2467, नरपतगंज के 4584, पलासी प्रखंड के 2584, रानीगंज प्रखंड के 5942 व सिकटी प्रखंड के 2619 बच्चे। किस प्रखंड के कितने बच्चे का पेंडिंग: अररिया प्रखंड के 952, भरगामा के 807, फारबिसगंज के 456, जोकीहाट प्रखंड के 1456, कुर्साकांटा के 216, नरपतगंज के 716, पलासी प्रखंड के 1152, रानीगंज प्रखंड के 368 व सिकटी प्रखंड के 366 बच्चे। डाटा सुधार की जरूरत क्यों: लेखा एवं योजना डीपीओ रोहित कुमार चौरसिया ने बताया कि डाटा सुधार नहीं होने से सरकारी स्कूल में पढ़ने वाले छात्र-छात्राओं को डीबीटी यानी डायरेक्ट बेनिफिट ट्रांसफर के माध्यम से छात्रवृत्ति, साइकिल, पोशाक आदि योजनाओं के लाभ से वंचित हो जाएंगे। जिन छात्राओं के डाटा में सुधार नहीं होगा उन्हें सैनेटरी योजना का लाभ नहीं मिलेगा। कक्षा नौ के सभी छात्र-छात्राओं को साइकिल योजना के तहत साइकिल खरीदने के लिए तीन-तीन हजार रूपये डीबीटी के माध्यम से दी जाती है। कक्षा नौ से 12 तक की छात्राओं को पोशाक योजना के तहत प्रति छात्रा 15 सौ रूपये की राशि दी जाती है। मुख्यमंत्री किशोरी स्वास्थ्य योजना के तहत कक्षा सात से 12 तक की छात्राओं को सैनिटरी नैपकिन खरीदने के लिए उनके बैंक खाते में पैसे जाती है। डाटा सुधार नहीं होने पर ये लाभ नहीं मिलेंगे।",0.0
अधिवक्ता व व्यवसायी से बुलेट और नकदी लूटी,https://www.livehindustan.com/bihar/lakhisarai/story-armed-robbery-in-lakhisarai-lawyer-and-businessman-attacked-201771875343762.html,Live Hindustan,2026-02-24T01:05:45+05:30,hi,Bihar,,"लू (Katihar OR Khagaria OR Kishanganj OR Lakhisarai OR Madhepura OR Madhubani OR ""Munger (Monghyr)"" OR Muzaffarpur OR Nalanda OR Nawada OR Patna OR ""Purnia (Purnea)"" OR Rohtas OR Saharsa)","अधिवक्ता व व्यवसायी से बुलेट और नकदी लूटी
अशोक धाम बाईपास पर हथियारबंद अपराधियों का तांडवलखीसराय से खबर - 09 फोटो- 10 वीडियो- 02लखीसराय से खबर - 09 फोटो- 10 वीडियो- 02
लखीसराय, एक प्रतिनिधि। नगर थाना क्षेत्र के अशोक धाम बाईपास स्थित मुर्गी फार्म के समीप शनिवार की देर शाम हथियारबंद अपराधियों ने लूट की वारदात को अंजाम दिया। छह की संख्या में आए अज्ञात अपराधियों ने पिस्तौल के बल पर एक अधिवक्ता और व्यवसायी को रोककर उनकी बुलेट बाइक और नकद राशि लूट ली। घटना से इलाके में दहशत का माहौल है। जानकारी के अनुसार, बियाडा निवासी व्यवसायी सुमन कुमार और हसनपुर दुर्गा स्थान निवासी अधिवक्ता रविंद्र कुमार उर्फ मंटू पिता-बिनोद सिंह जखोर गांव में आयोजित तिलक फलदान कार्यक्रम में शामिल होकर बुलेट बाइक से लौट रहे थे। जैसे ही वे अशोक धाम बाईपास सड़क के पास मुर्गी फार्म के निकट पहुंचे, तभी दो बाइक पर सवार छह अपराधियों ने उन्हें घेर लिया।
सभी अपराधियों के हाथ में पिस्तौल थी। अपराधियों ने पहले दोनों को रोककर पिस्तौल सटा दी और जान से मारने की धमकी दी। विरोध करने पर सुमन कुमार के माथे पर पिस्तौल की बट से वार कर दिया, जिससे वे घायल हो गए। इसके बाद अपराधियों ने उनकी बुलेट बाइक, नकद पांच हजार रुपये तथा अन्य सामान लूट लिया और मौके से फरार हो गए। घटना के बाद पीड़ितों ने किसी तरह नगर थाना पहुंचकर लिखित आवेदन दिया। पुलिस ने मामला दर्ज कर जांच शुरू कर दी है। पुलिस द्वारा घटनास्थल के आसपास छानबीन की गई और संदिग्धों की तलाश में अभियान चलाया गया। जांच के क्रम में पुलिस ने एक बुलेट बाइक लावारिस अवस्था में बरामद की है, जिसे अपराधियों द्वारा छोड़कर भागने की आशंका जताई जा रही है। बरामद बाइक की पहचान पीड़ितों द्वारा की जा रही है। नगर थाना पुलिस का कहना है कि अपराधियों की पहचान के लिए आसपास के सीसीटीवी फुटेज खंगाले जा रहे हैं तथा संभावित ठिकानों पर छापेमारी की जा रही है। घायल सुमन कुमार का प्राथमिक उपचार कराया गया है और उनकी स्थिति खतरे से बाहर बताई जा रही है। इस घटना ने एक बार फिर बाईपास क्षेत्र में सुरक्षा व्यवस्था पर सवाल खड़े कर दिए हैं। स्थानीय लोगों ने पुलिस गश्ती बढ़ाने और अपराधियों की शीघ्र गिरफ्तारी की मांग की है। पुलिस ने आश्वासन दिया है कि जल्द ही अपराधियों को गिरफ्तार कर घटना का खुलासा किया जाएगा। थानाध्यक्ष अशोक कुमार ने बताया कि शिकायत मिली है, मामला दर्ज कर एक बुलेट बाइक को लावारिस अवस्था में बरामद किया गयाहै। पुलिस आगे की कार्रवाई कर रही है।",0.0
"होली नजदीक आते ही वाहनों में बजने लगे फूहड़ गीत, यात्रियों ने की कार्रवाई की मांग",https://www.livehindustan.com/bihar/lakhisarai/story-concerns-rise-over-obscene-songs-playing-in-public-vehicles-ahead-of-holi-festival-201771875340576.html,Live Hindustan,2026-02-24T01:05:43+05:30,hi,Bihar,,"लू (Katihar OR Khagaria OR Kishanganj OR Lakhisarai OR Madhepura OR Madhubani OR ""Munger (Monghyr)"" OR Muzaffarpur OR Nalanda OR Nawada OR Patna OR ""Purnia (Purnea)"" OR Rohtas OR Saharsa)","होली नजदीक आते ही वाहनों में बजने लगे फूहड़ गीत, यात्रियों ने की कार्रवाई की मांग
होली पर्व के नजदीक आते ही सड़कों पर चलने वाले वाहनों में अश्लील गीत बजाए जाने से महिलाएं और परिवार असहज महसूस कर रहे हैं। यात्रियों का कहना है कि इन गीतों के बोल आपत्तिजनक हैं। स्थानीय लोगों ने प्रशासन से कार्रवाई की मांग की है ताकि सार्वजनिक स्थलों पर मर्यादा बनी रहे।
कजरा, एक संवाददाता। होली पर्व नजदीक आते ही सड़कों पर चलने वाले कई निजी और सार्वजनिक वाहनों में तेज आवाज में फूहड़ और अशोभनीय गीत बजाए जाने लगे हैं। इससे विशेष रूप से महिलाओं और परिवार के साथ यात्रा कर रहे लोगों को असहज स्थिति का सामना करना पड़ रहा है। यात्रियों का कहना है कि इस तरह के गीतों के बोल न केवल आपत्तिजनक होते हैं, बल्कि सार्वजनिक मर्यादा के भी खिलाफ हैं। महिलाओं ने बताया कि आटो और अन्य वाहनों में सफर के दौरान ऐसे गीत बजने से उन्हें शर्मिंदगी झेलनी पड़ती है। कई अभिभावकों ने भी चिंता जताई कि छोटे बच्चों के साथ यात्रा करते समय उन्हें असुविधा होती है और उन्हें बार-बार बच्चों का ध्यान भटकाना पड़ता है।
स्थानीय लोगों और यात्रियों ने प्रशासन से इस पर ठोस कदम उठाने की मांग की है। उनका कहना है कि सार्वजनिक स्थलों और वाहनों में अश्लील गीत बजाने वालों पर सख्त कार्रवाई होनी चाहिए। प्रशासन से नियमित जांच और नियमों का कड़ाई से पालन सुनिश्चित कराने की अपील की गई है, ताकि त्योहार का माहौल मर्यादित और सौहार्दपूर्ण बना रहे।",0.0
"बच्चा चोर गिरोह की अफवाह से दहशत, स्कूलों में बच्चों की घटी उपस्थिति",https://www.livehindustan.com/bihar/lakhisarai/story-child-kidnapping-rumors-alarm-parents-in-local-area-201771875337423.html,Live Hindustan,2026-02-24T01:05:39+05:30,hi,Bihar,,"लू (Katihar OR Khagaria OR Kishanganj OR Lakhisarai OR Madhepura OR Madhubani OR ""Munger (Monghyr)"" OR Muzaffarpur OR Nalanda OR Nawada OR Patna OR ""Purnia (Purnea)"" OR Rohtas OR Saharsa)","बच्चा चोर गिरोह की अफवाह से दहशत, स्कूलों में बच्चों की घटी उपस्थिति
थाना क्षेत्र में बच्चा चोर गिरोह की सक्रियता की अफवाहों ने अभिभावकों और स्थानीय लोगों की चिंता बढ़ा दी है। स्कूलों में छात्रों की उपस्थिति में गिरावट आई है, और कई अभिभावक अपने बच्चों को स्कूल नहीं भेज रहे हैं। प्रशासन से ठोस कदम उठाने की मांग की जा रही है, जबकि पुलिस ने अफवाहों पर कार्रवाई की चेतावनी दी है।
कजरा,एक संवाददाता। थाना क्षेत्र में इन दिनों बच्चा चोर गिरोह के सक्रिय होने की चर्चा ने अभिभावकों और स्थानीय लोगों की चिंता बढ़ा दी है। क्षेत्र में फैल रही अफवाहों के कारण स्कूलों में छात्र-छात्राओं की उपस्थिति में लगातार गिरावट देखी जा रही है। कई अभिभावक अपने बच्चों को स्कूल भेजने से कतरा रहे हैं और खुद उन्हें लेने-छोड़ने जा रहे हैं। स्थानीय लोगों का कहना है कि पिछले कुछ दिनों से सोशल मीडिया और आपसी बातचीत के माध्यम से बच्चा चोरी की घटनाओं की चर्चाएं तेज हो गई हैं। हालांकि अभी तक थाना क्षेत्र में किसी भी बच्चे के गायब होने की आधिकारिक पुष्टि नहीं हुई है, लेकिन अफवाहों ने माहौल को भयभीत कर दिया है।
अभिभावकों को आशंका है कि कहीं उनके बच्चों को निशाना न बना लिया जाए। स्कूल प्रबंधन भी इस स्थिति को लेकर सतर्क हो गया है। कई विद्यालयों ने छुट्टी के समय विशेष निगरानी व्यवस्था की है और अभिभावकों से अपील की है कि वे अफवाहों पर ध्यान न दें तथा किसी भी संदिग्ध गतिविधि की सूचना तुरंत पुलिस को दें। वहीं स्थानीय नागरिकों ने प्रशासन से ठोस कदम उठाने की मांग की है। लोगों का कहना है कि क्षेत्र में गश्त बढ़ाई जाए और संदिग्ध व्यक्तियों पर नजर रखी जाए, ताकि भय का माहौल समाप्त हो सके। थाना प्रभारी ने आश्वासन दिया है कि पुलिस टीम सतर्क है और अफवाह फैलाने वालों पर भी कार्रवाई की जाएगी।",0.0
