title,url,source,date,language,state,district,search_term,full_text,relevance_score
दिनदहाड़े महिला से दो भर का चेन झपटकर फरार हुए बदमाश,https://www.livehindustan.com/bihar/jamui/story-daylight-theft-in-jamui-woman-robbed-of-gold-chain-near-gayatri-temple-201771874159101.html,Live Hindustan,2026-02-24T00:46:00+05:30,hi,Bihar,,"लू (Araria OR Arwal OR Aurangabad OR Banka OR Begusarai OR Bhagalpur OR Bhojpur OR Buxar OR Darbhanga OR ""East Champaran (Motihari)"" OR Gaya OR Gopalganj OR Jamui OR Jehanabad OR ""Kaimur (Bhabua)"")","दिनदहाड़े महिला से दो भर का चेन झपटकर फरार हुए बदमाश
दिनदहाड़े महिला से दो भर का चेन झपटकर फरार हुए बदमाश महिसौड़ी बस स्टैंड के पीछे गायत्री मंदिर के पास वारदात, सीसीटीवी में कैद हुई घटना जमुई। शहर क
जमुई। शहर के महिसौड़ी बस स्टैंड के पीछे स्थित गायत्री मंदिर के पास सोमवार को दिनदहाड़े बाइक सवार बदमाशों ने एक महिला से दो भर का सोने का चेन झपट लिया और फरार हो गए। घटना के बाद इलाके में अफरातफरी मच गई और मौके पर लोगों की भीड़ जुट गई। पीड़िता की पहचान हरनाहा गांव निवासी कंचन देवी के रूप में हुई है। बताया जाता है कि कंचन देवी केवाईसी कराने के सिलसिले में शहर आई थीं। वह गायत्री मंदिर के पास खड़ी होकर अपनी बेटी का इंतजार कर रही थीं। इसी दौरान बाइक पर सवार दो युवक अचानक पहुंचे और झपट्टा मारकर उनके गले से चेन छीन लिया।
वारदात को अंजाम देने के बाद दोनों बदमाश तेज रफ्तार से सिकंदरा रोड की ओर भाग निकले। कंचन देवी की बेटी श्वेता ने बताया कि घटना के समय वह अपनी मां के साथ ही थीं। उन्होंने बताया कि एक युवक ने काला शर्ट पहन रखा था और उसके बाल घुंघराले थे। बाइक की रफ्तार काफी तेज होने के कारण दूसरे युवक का चेहरा स्पष्ट रूप से नहीं देख पाए। श्वेता ने बताया कि उन्होंने कुछ दूर तक बदमाशों का पीछा भी किया, लेकिन वे उन्हें पकड़ नहीं सके। पीड़ित महिला कंचन देवी ने बताया कि घटना की जानकारी पुलिस को दे दिए हैं। घटना की सूचना मिलते ही जमुई थाना की पुलिस मौके पर पहुंची और मामले की जांच शुरू कर दी। यह पूरी घटना मोहल्ले में लगे सीसीटीवी कैमरों में पूरी घटना कैद हो गई है, जिसके आधार पर पुलिस आरोपियों की पहचान में जुटी है।",0.0
प्रखण्ड संसाधन केन्द्रों को क्रियाशील करने का निर्णय,https://www.livehindustan.com/bihar/jamui/story-non-residential-training-for-teachers-in-bihar-schools-initiated-by-scert-201771874148213.html,Live Hindustan,2026-02-24T00:45:49+05:30,hi,Bihar,,"लू (Araria OR Arwal OR Aurangabad OR Banka OR Begusarai OR Bhagalpur OR Bhojpur OR Buxar OR Darbhanga OR ""East Champaran (Motihari)"" OR Gaya OR Gopalganj OR Jamui OR Jehanabad OR ""Kaimur (Bhabua)"")","प्रखण्ड संसाधन केन्द्रों को क्रियाशील करने का निर्णय
प्रखण्ड संसाधन केन्द्रों को क्रियाशील करने का निर्णय शिक्षकों को दिया जाएगा गैर आवासीय प्रशिक्षण राज्य शिक्षा शोध एवं प्रशिक्षण परिषद पटना ने लिय
झाझा । नगर संवाददाता प्रखण्ड संसाधन केन्द्र पर गैर आवासीय प्रशिक्षण संचालित करने का निर्णय लिया गया है। प्रखण्ड संसाधन केन्द्रों को क्रियाशील किया जाएगा। सरकारी विद्यालयों में कार्यरत शिक्षकों को गैर आवासीय प्रशिक्षण दिया जाएगा। राज्य शिक्षा शोध एवं प्रशिक्षण परिषद पटना ने इस बाबत निर्णय लिया है। एससीईआरटी की संयुक्त निदेशक (प्रशासन) सुषमा कुमारी के हस्ताक्षर से आदेश जारी किया गया है। राज्य शिक्षा शोध एवं प्रशिक्षण परिषद ने राज्य के सरकारी विद्यालयों में कार्यरत शिक्षकों के गैर आवासीय प्रशिक्षण हेतु प्रखण्ड संसाधन केन्द्रों को क्रियाशील करने के संबंध में बीईपी-290 / 19.02.2026 के तहत कार्यालय पत्रांक- सी/11-टी/टी-2025/ 1014 पटना, दिनांक 18 फरवरी, 2026 के तहत बिहार शिक्षा परियोजना परिषद् के राज्य परियोजना निदेशक को राज्य के सरकारी विद्यालयों में कार्यरत शिक्षकों के गैर आवासीय प्रशिक्षण हेतु प्रखण्ड संसाधन केन्द्रों को क्रियाशील करने के संबंध में लिखा है।
अंकित किया है कि एनईपी-2020 के आलोक में राज्य के सरकारी विद्यालयों में कार्यरत सभी स्तर के शिक्षकों के सेवाकालीन क्षमता संवर्द्धन हेतू न्यूनतम 50 घंटे का प्रशिक्षण अनिवार्य है। सभी सरकारी अध्यापकों के लिए प्रशिक्षण संस्थानों में क्रमवार प्रशिक्षण संचालित है।",0.0
प्रभात फेरी निकाल दिया सुरक्षा और सतर्कता का दिया संदेश,https://www.livehindustan.com/bihar/jamui/story-bihar-police-week-awareness-campaign-and-activities-in-chakai-201771874139770.html,Live Hindustan,2026-02-24T00:45:41+05:30,hi,Bihar,,"लू (Araria OR Arwal OR Aurangabad OR Banka OR Begusarai OR Bhagalpur OR Bhojpur OR Buxar OR Darbhanga OR ""East Champaran (Motihari)"" OR Gaya OR Gopalganj OR Jamui OR Jehanabad OR ""Kaimur (Bhabua)"")","प्रभात फेरी निकाल दिया सुरक्षा और सतर्कता का दिया संदेश
प्रभात फेरी निकाल दिया सुरक्षा और सतर्कता का दिया संदेश प्रभात फेरी निकाल दिया सुरक्षा और सतर्कता का दिया संदेशप्रभात फेरी निकाल दिया सुरक्षा और सतर्क
चकाई । निज प्रतिनिधि बिहार पुलिस सप्ताह के तहत सोमवार को चकाई पुलिस द्वारा सोमवार को प्रभात फेरी निकाली गई। थानाध्यक्ष सर्वजीत कुमार के नेतृत्व में निकाली गई यह प्रभात फेरी थाना परिसर से शुरू होकर चकाई बाजार, जयप्रकाश चौक, मुख्य चौक, प्रखंड कार्यालय, पंचमुखी चौक और सहाना कॉलोनी का भ्रमण करते हुए वापस थाने पहुंची। इस दौरान पुलिस अधिकारियों व जवानों ने स्लोगन के माध्यम से लोगों को सामाजिक बुराइयों के खिलाफ ,सड़क सुरक्षा आदि को लेकर जागरूक किया। सड़क सुरक्षा को लेकर कहा कि सफर में कितनी भी कम हो दूरी, हेलमेट लगाना है जरूरी। इसके साथ ही वर्तमान समय में बढ़ते साइबर अपराधों को देखते हुए लोगों को सतर्क किया गया।
पुलिस ने अपील की कि सोशल मीडिया पर निजी फोटो और वीडियो साझा न करें। किसी भी प्रकार की साइबर ठगी होने पर तुरंत हेल्पलाइन नंबर 1930 पर कॉल करें। थानाध्यक्ष ने बताया कि यह अभियान 27 फरवरी तक जारी रहेगा, जिसके तहत विभिन्न गतिविधियों का आयोजन किया जाना है। 24 फरवरी को महिला उत्पीड़न के विरुद्ध जागरूकता अभियान। 25 फरवरी को शहीद पुलिसकर्मियों के परिजनों को सम्मानित किया जाएगा। 26 फरवरी को नशामुक्ति, साइबर जागरूकता और सड़क सुरक्षा विषय पर पेंटिंग प्रतियोगिता। 27 फरवरी को पुलिसकर्मियों द्वारा स्वैच्छिक रक्तदान के साथ सप्ताह का समापन होगा। पुलिस सप्ताह के पहले दिन रविवार को थाना परिसर में स्वच्छता अभियान चलाकर सफाई का संदेश दिया गया था। पुलिस का मुख्य उद्देश्य आम जनता को यह भरोसा दिलाना है कि पुलिस उनकी मित्र है और सुरक्षा के लिए सदैव तत्पर है। मौके पर अवर निरीक्षक प्रभात राय, आलो रानी, मंटू कुमार, नेहा कुमारी सहित पुलिस बल के दर्जनों सदस्य मौजूद रहे।",0.0
बुडको और स्मार्ट सिटी की खींचतान में फंसी स्मार्ट सड़क की सूरत,https://www.livehindustan.com/bihar/bhagalpur/story-baghpur-roads-in-disrepair-conflict-between-government-departments-delays-repairs-201771874136476.html,Live Hindustan,2026-02-24T00:45:38+05:30,hi,Bihar,,"लू (Araria OR Arwal OR Aurangabad OR Banka OR Begusarai OR Bhagalpur OR Bhojpur OR Buxar OR Darbhanga OR ""East Champaran (Motihari)"" OR Gaya OR Gopalganj OR Jamui OR Jehanabad OR ""Kaimur (Bhabua)"")","बुडको और स्मार्ट सिटी की खींचतान में फंसी स्मार्ट सड़क की सूरत
भागलपुर की स्मार्ट सड़कों पर चलने वाले राहगीरों को मुश्किलों का सामना करना पड़ रहा है। बुडको और स्मार्ट सिटी लिमिटेड के बीच सामंजस्य की कमी के कारण सड़कें मरम्मत के बिना हैं। पिछले दो महीने से पाइपलाइन मरम्मत का कार्य पूरा हो चुका है, लेकिन सड़क की मरम्मत अभी भी अधर में लटकी हुई है।
भागलपुर, वरीय संवाददाता। शहर की चमचमाती स्मार्ट सड़कों पर चलने वाले राहगीरों की मुश्किलें कम होने का नाम नहीं ले रही हैं। विडंबना यह है कि इन सड़कों की बदहाली का कारण कोई प्राकृतिक आपदा नहीं, बल्कि दो सरकारी विभाग बुडको और स्मार्ट सिटी लिमिटेड के बीच आपसी सामंजस्य की कमी और तकनीकी मानकों की लड़ाई है। पाइपलाइन की मरम्मत के नाम पर बुडको द्वारा खोदी गई सड़कों को अब तक दुरुस्त नहीं किया जा सका है, जिससे शहर के व्यस्ततम इलाकों में आवागमन जोखिम भरा हो गया है। बुडको द्वारा सड़कों की खुदाई कर किया जा रहा पाइपलाइन मरम्मत का कार्य करीब दो माह पूर्व ही पूरा कर लिया गया है।
लेकिन पिछले दो माह से इस सड़क को मरम्मत करने का कार्य दोनों विभागों के खींचतान में फंसा हुआ है। बता दें कि जलापूर्ति व्यवस्था को दुरुस्त करने के लिए बुडको ने मायागंज से लेकर आदमपुर के बीच चार प्रमुख स्थलों पर सड़कों की सूरत बिगाड़ दी थी। इसमें बड़ी खंजरपुर दुर्गा स्थान से अस्पताल चौक के बीच दो स्थानों पर खुदाई की गई, तो वहीं बड़ी खंजरपुर स्थित महाराज घाट रोड मोड़ के समीप भी सड़क को खोदने के बाद मिट्टी भरकर छोड़ दिया गया। इसके अतिरिक्त कोयला घाट रोड में आदमपुर चौक के समीप भी मरम्मत के लिए सड़क को खोदा गया था, इसमें भी मिट्टी की भराई कर छोड़ दिया गया है। कार्य पूरा होने के बाद इन गड्ढों को मानक के अनुरूप भरने के बजाय खानापूर्ति कर दी गई, जिस पर अब विवाद गहरा गया है। स्मार्ट सिटी लिमिटेड ने बुडको की इस कार्यशैली पर सख्त रुख अख्तियार किया है। स्मार्ट सिटी प्रबंधन ने बुडको और संवेदक को चेतावनी देते हुए कहा है कि इन सड़कों का निर्माण विशेष तकनीक और भारी लागत से हुआ है, और अब इनकी मरम्मत सामान्य तरीके से नहीं की जा सकती। विभाग ने चेतावनी दी है कि क्षतिग्रस्त हिस्से को पहले कटर मशीन से काटकर एकरूप किया जाए, ताकि सड़क की फिनिशिंग खराब न हो। इसके बाद बेस से लेकर ऊपरी परत तक निर्धारित मानकों के अनुसार ही निर्माण कार्य सुनिश्चित करना होगा। वर्तमान में सबसे बड़ी बाधा संसाधनों की कमी बनी हुई है। बताया जा रहा है कि बड़े कटर मशीन की खरीद अभी तक नहीं हो पाई है और इस मशीन के उपलब्ध होने तक मरम्मत का कार्य पूरी तरह से अधर में लटका हुआ है। स्थानीय लोगों की मानें तो विभागों की इस तकनीकी रार और प्रशासनिक सुस्ती के कारण मायागंज और आदमपुर जैसे संवेदनशील इलाकों में सड़क दुर्घटनाओं का खतरा बढ़ गया है। धूल और असमतल सड़कों ने स्थानीय दुकानदारों और राहगीरों यहां तक मरीजों को लेकर जाने आने वाले एंबुलेंस तक के लिए राह को मुश्किल कर दिया है। कोट: पाइपलाइन मरम्मत को लेकर आदमपुर चौक से अस्पताल चौक के बीच जिन जगहों पर सड़कें खोदी गई थी, उसको रिपेयर करने का कार्य शुरू किया गया था। पर स्मार्ट सिटी ने उक्त सड़क को कटर मशीन से समतल काट कर नीचे से ऊपर तक निर्धारित मानक के अनुसार ढलाई करने को कहा है। संवेदक द्वारा कटर मशीन मंगवा लिया गया है। जल्द ही रिपेयरिंग का कार्य फिर से शुरू किया जाएगा। - राजेश कुमार, परियोजना निदेशक सह कार्यपालक अभियंता, बुडको, भागलपुर।",0.0
