title,url,source,date,language,state,district,search_term,full_text,relevance_score
"आज का मौसम: 31.1°C पहुंचा कैमूर का तापमान, बिहार में फरवरी में ही गर्मी की एंट्री, गर्मी से आइसक्रीम-कोल्ड ... - News18 Hindi",https://news.google.com/rss/articles/CBMiiwJBVV95cUxNWGtseC01WFR6bTVXQ1ZHYjRNSk9Sd19rMTZDOHBLR3NtZlRNVE1idFUwMDFGRGRwREM0Um9od0J4M2c3MVI5QUFDYTdMRGJGSlc3eGZaU2lVS25ZZkZMVDluVkp6MF9naHpBT1FZRkt5dmFPT0lJVnJWdXRpdEI3M3RSdng2YWpTZEFITUlUbjN1MFM5aU9yVGxYajI2bWZXX28zNmVaV0QxeVE5RTVzYmRFbnUxVEpIeC1UZTBmbE1URkdRanpwM2lWY0dGN2diYzI2MmxzZGhwQ0cwR1JYWWFTajJCMzlZSnRpTmxSNGV3cTk4cEk0dFJzZTdHejJsWjU0eGs5WnFzSW_SAZACQVVfeXFMTktJSVpDcWdLMkJ0RFVWR2RhYWROYjU0S2RPMW5zUzN2M1RfQ0pvNnI2RE9pOEFXcjFmdkYzRkVldDByR1ZkSXVTMWpHMjFHbVg3TTV5M0s2TW1OSERtUTJWTmNLaklQUmJDOG1Tb3JfQWtib2JvSjYwMU9NUVg1X0NVa1FJUWxpNVAxMExibklRaUl1NmVlb1VJclJfcWZ3a1hwQ3NxRGFjOHBRaUw4YXRSVmtWYUczMDJGVXluRk5XdHBkb19Hdm1GYjMzWk5NN19wT056UG96RVhxOU12enpjRkM5Y285U2otWFlZVjg0ZFhmYmZyOWdzS1N6ODlIR3pIaDUzcnpUT2xYOS05bmE?oc=5,News18 Hindi,2026-02-24T06:23:09+05:30,hi,Bihar,,"(""पारा चढ़ा"" OR ""पारा पहुंचा"" OR तापमान OR ""तापमान बढ़ा"" OR ""रिकॉर्ड तोड़ गर्मी"" OR ""डिग्री सेल्सियस"" OR ""पारा उबला"" OR ""अधिकतम तापमान"") Bihar","आज का मौसम: 31.1°C पहुंचा कैमूर का तापमान, बिहार में फरवरी में ही गर्मी की एंट्री, गर्मी से आइसक्रीम-कोल्ड ड्रिंक की बढ़ी मांग
Last Updated:
Bihar Weather Today: पटना स्थित मौसम विज्ञान केंद्र के ताजा आंकड़ों के मुताबिक राज्य में तापमान सामान्य दायरे में है, लेकिन दिन और रात के तापमान के अंतर ने बाजार का ट्रेंड बदल दिया है. आने वाले दिनों में अधिकतम और न्यूनतम तापमान में बढ़ोतरी होने का पूर्वानुमान है.
पटना: बिहार के तापमान में इन दिनों कुछ खास बदलाव देखने को नहीं मिल रहा है. दिन और रात के तापमान में मामूली उतार-चढ़ाव दर्ज किया जा रहा है. सोमवार को भी यही स्थिति बनी रही. सुबह-शाम हल्की ठंड है, जबकि दोपहर चटक धूप के बीच आलस भरा मौसम बना हुआ है. हालांकि इसका असर लोगों की दिनचर्या और बाजार पर साफ दिखाई दे रहा है. दोपहर में हल्की गर्मी के कारण लोग गर्म कपड़ों को टाटा बाय बाय बोल चुके हैं. बाजार में आइसक्रीम-कोल्ड ड्रिंक की बिक्री बढ़ गई है, जबकि सुबह और शाम की हल्की ठंडक चाय की दुकानों पर भीड़ बढ़ा रही है.
पटना मौसम विज्ञान केंद्र के ताजा आंकड़ों के मुताबिक राज्य में तापमान सामान्य दायरे में है, लेकिन दिन और रात के तापमान के अंतर ने बाजार का ट्रेंड बदल दिया है. आने वाले दिनों में अधिकतम और न्यूनतम तापमान में बढ़ोतरी होने का पूर्वानुमान है.
बिहार में दिन का तापमान पहुंचा 32°C के पास
पटना मौसम विभाग के अनुसार 23 फरवरी को राज्य का सर्वाधिक अधिकतम तापमान 31.1°C कैमूर में दर्ज किया गया. इसके अलावा नालंदा (राजगीर) में 30.7°C, शेखपुरा में 30.1°C, डेहरी में 30.4°C और औरंगाबाद में 30.2°C तापमान रहा. राजधानी पटना का अधिकतम तापमान 29.6°C दर्ज हुआ. यह पिछले दिन की तुलना में 0.8 डिग्री अधिक है. उत्तर बिहार के जिलों में भी हल्की बढ़ोतरी देखी गई. मोतिहारी 31°C, सुपौल 29.3°C और पूर्णिया 29.6°C दर्ज किया गया. आज भी सुबह से आसमान बिल्कुल साफ और तेज धूप देखने को मिल रही है. दोपहर के समय तो पसीने भी निकलने लग रहो हैं.
Advertisement
जानें बिहार में रात का तापमान
दूसरी ओर राज्य का सबसे कम न्यूनतम तापमान 12.2°C सबौर (भागलपुर) में रिकॉर्ड किया गया. इसके अलावा जिरादेई में 12.4°C, समस्तीपुर में 13.1°C, वैशाली में 13.4°C, मुजफ्फरपुर में 13.4°C और शेखपुरा में 13.4°C तापमान दर्ज हुआ. पटना, कटिहार और कैमूर का न्यूनतम तापमान सबसे अधिक 18°C रहा. यह सामान्य से थोड़ा अधिक है. कई जगहों पर न्यूनतम तापमान में गिरावट भी दर्ज हुई. वैशाली में 1.8°C और मुजफ्फरपुर में 3.9°C की कमी देखने को मिली.
तापमान का यह अंतर है बदलते मौसम का असर
तापमान के इस अंतर का असर बाजार में साफ नजर आ रहा है. पटना के अशोक राजपथ और बोरिंग रोड इलाके के दुकानदारों का कहना है कि दोपहर 12 बजे के बाद कोल्ड ड्रिंक और आइसक्रीम की बिक्री अचानक बढ़ जाती है. जबकि सुबह मॉर्निंग वॉक करने वाले और शाम 6-9 बजे तक चाय और कॉफी की डिमांड ज्यादा रहती है. दुकानदारों के मुताबिक पिछले एक हफ्ते में ठंडे पीने वाले पदार्थों की बिक्री में लगभग 15 से 20% तक की बढ़ोतरी हुई है.
जानें आज कैसा रहेगा मौसम
मौसम वैज्ञानिकों का कहना है कि फिलहाल राज्य में मौसम स्थिर है. अगले कुछ दिनों तक तापमान में बड़े बदलाव की संभावना नहीं है. हालांकि हल्की बढ़ोतरी और गिरावट का सिलसिला जारी रह सकता है. आगे भी इसी तरह का मिश्रित मौसम बना रहेगा. अगले तीन से चार दिनों के बाद दिन और रात के तापमान में बढ़ोतरी होने का पूर्वानुमान है.
About the Author
Brijendra Pratap Singh
बृजेंद्र प्रताप सिंह डिजिटल-टीवी मीडिया में लगभग 4 सालों से सक्रिय हैं. मेट्रो न्यूज 24 टीवी चैनल मुंबई, ईटीवी भारत डेस्क, दैनिक भास्कर डिजिटल डेस्क के अनुभव के साथ 14 मई 2024 से News.in में सीनियर कंटेंट राइटर...और पढ़ें
और पढ़ें",0.0
"Bihar Weather Update: होली के बाद बिहार में बढ़ेगा गर्मी का तेवर, मार्च में ही होगा मई जैसा एहसास - Jagran",https://news.google.com/rss/articles/CBMirgFBVV95cUxNc0t5dHBsRklVQzV2a0M3TnEwSGVyVkdwNGRURi00aEdrcXJBUE5KMlFMUFd6ajgzT1NYR3FlUTdwWTBQT0NtVmRwM08wRU1KdUJIcUhkODh3RkpLcWM1Q09aVFBfQkZqX0Z3Xzg3dVY3TFM0R0pURTlTUmh2QmhRM2ljMXpZZXU0N2NTb0E3LUlDdjlla2k4M2dMTjhpLTJYcGcxX1AwMWRiZlNicXc?oc=5,Jagran,2026-02-24T07:31:00+05:30,hi,Bihar,,"(""पारा चढ़ा"" OR ""पारा पहुंचा"" OR तापमान OR ""तापमान बढ़ा"" OR ""रिकॉर्ड तोड़ गर्मी"" OR ""डिग्री सेल्सियस"" OR ""पारा उबला"" OR ""अधिकतम तापमान"") Bihar","Bihar Weather Update: होली के बाद बिहार में बढ़ेगा गर्मी का तेवर, मार्च में ही होगा मई जैसा एहसास
पछुआ हवाओं के कारण बिहार में मौसम शुष्क रहेगा, सुबह-शाम हल्की ठंड महसूस होगी। 28 फरवरी के बाद तापमान में वृद्धि होगी, और होली के बाद गर्मी का तेवर तीख ...और पढ़ें
समय कम है?
जानिए मुख्य बातें और खबर का सार एक नजर में
जागरण संवाददाता, पटना। पछुआ के कारण राज्य के मौसम शुष्क बने होने के साथ सुबह-शाम हल्की ठंड का प्रभाव रहेगा। तापमान में विशेष बदलाव के आसार नहीं है। मौसम विज्ञान केंद्र पटना के अनुसार, 28 फरवरी के बाद से तापमान में क्रमिक वृद्धि होने के साथ गर्मी का प्रभाव दिखने लगेगा।
बिहार में होली के बाद गर्मी के तेवर और अधिक तीखे होने के आसार हैं। मार्च में ही मई वाली जलन महसूस होगी। पश्चिमी विक्षोभ के इस बार कमजोर पड़ने के कारण मौसम में बदलाव की संभावना है।
होली के दौरान राज्य का अधिकतम तापमान 32-35 डिग्री सेल्सियस एवं न्यूनतम तापमान 20 डिग्री सेल्सियस के आसपास रहने का पूर्वानुमान है। इस बार पश्चिमी विक्षोभ का प्रभाव कम होने और वर्षा की कमी के कारण मार्च से गर्मी का प्रभाव दिखने लगेगा।
उत्तरी भागों की तुलना में दक्षिणी भाग अधिक गर्म रहेगा। सोमवार को राज्य का न्यूनतम तापमान 12.2 डिग्री सेल्सियस के साथ भागलपुर सबौर में दर्ज हुआ, जबकि पटना का न्यूनतम तापमान 18.0 डिग्री सेल्सियस दर्ज किया गया।
राज्य का न्यूनतम तापमान 12.2 डिग्री सेल्सियस से 18.0 डिग्री सेल्सियस के बीच दर्ज किया गया। राजधानी सहित आसपास इलाकों में मौसम शुष्क होने के साथ आंशिक रूप से बादल छाए रहे।
राजधानी का अधिकतम तापमान 29.6 डिग्री सेल्सियस एवं 31.1 डिग्री सेल्सियस के साथ कैमूर का सर्वाधिक तापमान दर्ज किया गया। राजधानी सहित राज्य के ज्यादातर भागों के अधिकतम तापमान में वृद्धि दर्ज की गई।
प्रमुख शहरों का तापमान
सबसे ठंडी रात: भागलपुर — 14.6°C
वर्तमान स्थिति: बिहार में तापमान में हल्की बढ़ोतरी। रात का न्यूनतम 14.6–18.0°C के बीच। कोहरा कम हुआ है, मौसम साफ और सुहावना।",0.0
"Bihar Weather: बिहार में मौसम का यू-टर्न! अचानक बढ़ा रिकॉर्ड तापमान, होली तक चलाने पड़ेंगे AC, अगले 48 घंटों रहे सावधान - News4Nation",https://news.google.com/rss/articles/CBMiugFBVV95cUxQWldHc0F0Q3NmVmphUWVVZU1tWlk0bm95X1FVZUlOSEVvbTU5cG90em55THJhSmNvdEY5aWpXcTV0ZVRaSWNxUUxjcEdRU2hPeTBFUDBPLTV0c2lPSzcxQms1U0xDOVlnalhzTlQ1X2dSMndyLUR1ZlFNMml1d3NJSV91YkpWeGRNcnlLdGRnYzNGUjYxSkVUZE9wMHIyWkJTUFFtYUpHX2xQWUJfenMtQUJWckM2Q24wYnfSAb8BQVVfeXFMUFRic1YwUm9Dd1h3Rl93aXk0cVRaNnViNEluTmxQbUVQVXh3MjFkWWdzeTZFaUZuT3N5ZHRHcmVXeHFsUlgyanZkZmI2eGJJalJrd0dUVnRJMkN1dVc0ZklrZ3kyMmhlZjhVTnlGTGJRTEVXaXphckZwbW80OHlpcUUzT25GNjZUZGREbFhqNmZBTUZuS2xzR2FFVlhuR1NuVEY3TG94SzF6bGJac1VTdGZ2NkZ5cDdLRU1yYk5oV2c?oc=5,News4Nation,2026-02-24T07:00:00+05:30,hi,Bihar,,"(""पारा चढ़ा"" OR ""पारा पहुंचा"" OR तापमान OR ""तापमान बढ़ा"" OR ""रिकॉर्ड तोड़ गर्मी"" OR ""डिग्री सेल्सियस"" OR ""पारा उबला"" OR ""अधिकतम तापमान"") Bihar","Bihar Weather: बिहार में मौसम का यू-टर्न! अचानक बढ़ा रिकॉर्ड तापमान, होली तक चलाने पड़ेंगे AC, अगले 48 घंटों रहे सावधान
Bihar Weather: बिहार के मौसम में बदलाव देखने को मिल रहा है। फरवरी में ही मई-जून सा एहसास हो रहा है। ऐसे में लोगों को अब ही एसी का सहारा लेना पड़ रहा है। मौसम विभाग ने अगले 48 घंटों में तापमान बढ़ने की संभावना जताई है।
Bihar Weather: बिहार में मौसम ने पूरी तरह करवट ले ली है। देर रात और सुबह हल्की ठंड महसूस हो रही है लेकिन इसका असर भी धीरे धीरे कम हो रहा है। दोपहर के समय तो तेज धूप ने गर्मी का एहसास बढ़ा दिया है। मौसम विभाग की मानें तो फरवरी में तापमान सामान्य से 1 से 2 डिग्री सेल्सियस अधिक है। तो वहीं आने वाले दिनों में भी पारा में रिकॉर्ड बढ़ोतरी देखने को मिल सकती है। होली के आसपास तापमान में इजाफा होगा।
24 फरवरी को शुष्क रहेगा मौसम
मौसम विभाग के मुताबिक मंगलवार यानी आज (24 फरवरी) को प्रदेशभर में मौसम शुष्क बना रहेगा और वर्षा की कोई संभावना नहीं है। अधिकतम तापमान 28 से 32 डिग्री सेल्सियस के बीच रहने का अनुमान है। राजधानी पटना में पारा 29 से 31 डिग्री सेल्सियस तक पहुंच सकता है, जबकि न्यूनतम तापमान 17 से 18 डिग्री के आसपास रहेगा। दक्षिण बिहार के दक्षिण-पश्चिमी और उत्तर बिहार के पूर्वी हिस्सों में न्यूनतम तापमान में हल्की गिरावट संभव है, लेकिन अधिकांश जिलों में रात के समय ज्यादा ठंड महसूस नहीं होगी।
कई जिलों में बढ़ा पारा
सोमवार (23 फरवरी) को राज्य के कुछ जिलों गया, कैमूर, बक्सर, सहरसा, बांका, अररिया (फारबिसगंज) और कटिहार में अधिकतम तापमान में 0.2 से 0.6 डिग्री सेल्सियस की मामूली गिरावट दर्ज की गई। वहीं अन्य जिलों में 0.2 से 1.7 डिग्री तक की बढ़ोतरी हुई। अरवल में सर्वाधिक 1.7 डिग्री और पटना में 0.8 डिग्री की वृद्धि रिकॉर्ड की गई। न्यूनतम तापमान की बात करें तो भागलपुर के सबौर में 12.2 डिग्री सेल्सियस के साथ राज्य का सबसे कम तापमान दर्ज हुआ। अधिकांश जिलों में न्यूनतम तापमान 14 से 16 डिग्री के बीच रहा, जबकि पटना, कैमूर और कटिहार में यह 18 डिग्री सेल्सियस रिकॉर्ड किया गया।
एक सप्ताह तक बारिश के आसार नहीं
मौसम विभाग ने स्पष्ट किया है कि अगले एक सप्ताह तक राज्य में वर्षा की कोई संभावना नहीं है। तीन से चार दिनों के भीतर अधिकतम और न्यूनतम तापमान में 2 से 4 डिग्री तक की और वृद्धि हो सकती है। एक मार्च से अधिकांश जिलों में अधिकतम तापमान 30 से 32 डिग्री और न्यूनतम 16 से 18 डिग्री सेल्सियस के बीच रहने का अनुमान है। पटना आईएमडी के अनुसार 26 फरवरी को पश्चिमी हिमालय क्षेत्र में एक कमजोर पश्चिमी विक्षोभ सक्रिय हो सकता है, लेकिन इसका बिहार के मौसम पर विशेष प्रभाव नहीं पड़ेगा। न तो तापमान में गिरावट की संभावना है और न ही वर्षा के आसार हैं।",0.0
