title,url,source,date,language,state,district,search_term,full_text,relevance_score
Severe Heatwave Grips AP; Civic Bodies on High Alert - Deccan Chronicle,https://news.google.com/rss/articles/CBMivwFBVV95cUxNdEtXTjZGYzF6NW1qS0ZBOHNKbWJTWTVKb00wQURvNGwxUWJHN240UG5iWUw3ZmtOQlZjbU9FQmhKTWI0QUN3cmRTSzB5REw4VzM3Ym1fQ1Qya1R5TDJXZi0xNmZYeWNMSFFFVDJFc0kzRFpRUXp4dmMyOXZOTmdDU0pXV2JHMFBFbm9MYTBpZ195YnpZVW50YzJqZEhUS3J2ZEtzM1NkVHRybTVmRDZUMU9KbXp6LUhyck9Jd3BsUdIBxAFBVV95cUxQZ1MzaldkcGN1YjRkN1l6akY0RVFzcW96SGtXZHdJUk1JOVk1THA4VkJDQVBEcTJ2a2VHZ2VWQkZtN1Awd2o1cUgwVjM1RUNwWllJSl92WmFXSDdNVWJWeERhWmpkMmlFTWlkTGxKZHV1c1otbnE4UWkzeWt6SEdKMDlzUEY4TzlPWmh2eHkyZFJrY0ZmRS1Hd3FtYk15cDc4Y2FTX0V5ZVlsOU1hYVZ6UFFBbkNhY0NoVGhlUGtaekhIRUl6?oc=5,Deccan Chronicle,2026-05-19T22:41:27+05:30,en,Andhra Pradesh,Anantapur,"(heatwave OR ""heat wave"" OR ""severe heatwave"" OR ""extreme heat"" OR ""heat spell"" OR ""scorching heat"" OR ""blistering heat"" OR ""sweltering heat"" OR ""hot winds"" OR loo OR ""hot loo winds"" OR ""intense heat"" OR ""unbearable heat"" OR ""deadly heat"" OR heat OR ""weather forecast"" OR ""weather update"" OR ""weather alert"" OR ""IMD forecast"" OR ""IMD prediction"" OR ""IMD alert"" OR IMD OR ""rising temperatures"" OR ""temperatures expected to rise"" OR ""relief from heat"" OR ""respite from heat"" OR ""heat respite"" OR ""respite from scorching heat"") Andhra Pradesh","Temporary water kiosks, chalivendrams, tanker supply arrangements and cooling shelters are to be set up on a priority basis, especially in vulnerable and water-scarce areas.
Vijayawada/Visakhapatnam: Andhra Pradesh is set to witness intensified heatwave conditions over the next few days, with temperatures likely to touch 47°C in several coastal districts on Wednesday, prompting the state government to place all Urban Local Bodies (ULBs) on high alert.
According to Andhra Pradesh State Disaster Management Authority (APSDMA) managing director Prakhar Jain, the highest temperature recorded on Tuesday was 45.6°C at Piduguralla in Palnadu district, followed by 44.9°C at Gudur in Nellore district and 44.5°C at Kankipadu in Krishna district.
The APSDMA said temperatures above 41°C were recorded in 233 mandals across 23 districts. Palnadu district reported the highest number of severely affected mandals at 26, followed by Nellore with 25, Prakasam with 23, Markapuram with 20, Krishna with 18 and Tirupati with 17 mandals.
Severe heatwave conditions are expected in Srikakulam, Visakhapatnam, Anakapalli, East Godavari, West Godavari, Guntur and Prakasam districts, where temperatures may range between 45°C and 47°C.
Meanwhile, temperatures between 43°C and 44°C are likely in parts of Nellore, Kurnool, Nandyal, Chittoor and Tirupati districts, while Rayalaseema districts including Anantapur, Sri Sathya Sai, YSR Kadapa and Annamayya may experience temperatures between 41°C and 43°C.
The APSDMA also warned that severe hot winds are likely in 71 mandals across Srikakulam, Vizianagaram, Anakapalli and Kakinada districts, while another 277 mandals may witness moderate heatwave conditions.
In view of the rising temperatures, the municipal administration and urban development department has directed municipal commissioners, particularly in central and north coastal Andhra districts, to strengthen field-level response systems between May 20 and 26.
Principal secretary Suresh Kumar instructed civic bodies to ensure uninterrupted drinking water supply, protect vulnerable sections and maintain essential civic services during the heatwave period. He also directed municipal commissioners to monitor preparedness on a daily basis.
ULBs have been asked to intensify public awareness campaigns through announcement systems, ward secretariats, social media, municipal vehicles, local cable television networks and electronic display boards.
Authorities have also been directed to establish drinking water facilities at bus stands, markets, hospitals, schools, labour congregation points, Anna Canteens and other public places.
Temporary water kiosks, chalivendrams, tanker supply arrangements and cooling shelters are to be set up on a priority basis, especially in vulnerable and water-scarce areas.
Special focus is being placed on sanitation workers, street vendors, outdoor labourers, homeless persons and elderly citizens, who are considered highly vulnerable to heat stress. Ward-level monitoring teams, in coordination with the health department, have been tasked with ensuring timely support and emergency assistance.
Officials advised people to remain indoors between 11 am and 4 pm unless absolutely necessary. Elderly persons, pregnant women, lactating mothers and people suffering from heart ailments, diabetes or blood pressure-related issues have been urged to take extra precautions.
Residents were advised to consume sufficient water, buttermilk, lemon water and coconut water to prevent dehydration.
The APSDMA further said a trough extending from Karnataka and Rayalaseema towards south coastal Andhra Pradesh may trigger scattered light rain accompanied by thunderstorms in parts of Rayalaseema over the next 24 hours.",1.0
"A.P. heat wave alert: Severe spell from May 21, orange alert for Eluru, West Godavari - The Hindu",https://news.google.com/rss/articles/CBMi6gFBVV95cUxONm14WkFEUkdzcUlpUzl3TlhuWjlyVHh1RTgtXzhZeEI3YWVLTWwxWWdOdjhwczh6M1A1LW9RT0I0NVZXVXpzNmJGVnQ1WVByXzZmYWhpSTAtZXI2QlBTYVdleEFvdHAxUTk4YTVCWUNQYWNrMmJxUXVQb002NXhWZVBQQllTWDd2YnEtZVhpc1JGbC02c0d4T25hSWxJd1RIcEtlOUpYLUNsaENFQTVaRXhQTUE1TC1JdDNielhob19BOVU5SnE1ZVczbFVMQ3NPaUNhaXUyeDY0VG5NM0pQa0x4bG5PalFlSkHSAfABQVVfeXFMT2VtSDFCUklWTERiZ1ZWaDUtbTRua05SVkhkYkxsRm9OMUpUMVk0RUZrSzFHMGNLY3doZGFRMWRuZDZ3RnQxWFFjaHp5cVlPUDE3bzgzNm9JSEY4Rnlvb1RpUjY5YXlsMjlhSHhRamVsdVdiZ0t4MHBqUmh4MVczbEZvUzBtbTF0cXVlYzk0aWt4N0l1eHp0eWIwY1RjUFBvTTliNXZySWRfS1liaEpZd280RkE1eFBsa09xUHdYR3haNWtBWjg4V3lWbGZ1anpjLXJfeWhmakRTZXFQR1dCSHREcTZlWGZDalBPMnRjSFZG?oc=5,The Hindu,2026-05-19T18:36:18+05:30,en,Andhra Pradesh,Anantapur,"(""heat advisory"" OR ""heat action plan"" OR ""heat alert"" OR ""IMD warning"" OR ""IMD alert"" OR ""red alert"" OR ""orange alert"" OR ""yellow alert"" OR ""NDMA advisory"" OR ""cooling shelter"" OR ""relief measures"" OR ""heat compensation"" OR ""severe weather warning"") Andhra Pradesh","The India Meteorological Department (IMD) has issued an orange alert for Eluru, West Godavari, East Godavari and Dr B.R. Ambedkar Konaseema districts, which are likely to experience severe heat wave conditions at isolated pockets from May 21 to May 23. The State government has placed all Urban Local Bodies on high alert and directed municipal commissioners to activate emergency preparedness measures from May 20 to May 26.
According to the seven-day district forecast issued by the IMD’s Amaravati centre on Tuesday (May 19, 2026), the heat wave spell will build across the north coastal districts and Yanam from May 20 and continue through May 26.
Visakhapatnam recorded a maximum of 34.8°C at 2.30 p.m. on Tuesday, the city forecast office said. Across the State, Anantapur recorded the day’s highest reading at 37.8°C, followed by Kurnool at 38°C, Nellore and Tirupathi at 37°C, and Amaravati-Gannavaram at 36°C.
In Eluru and West Godavari, the severe heat wave will set in on May 21 and persist for three days, the longest such spell forecast in the State. East Godavari and Konaseema will see one day of severe heat wave on May 22, preceded and followed by heat wave conditions.
Visakhapatnam and Anakapalli are likely to see heat wave conditions at isolated pockets from May 21 to May 25. Parvathipuram Manyam will face heat wave conditions from May 20 itself, which will continue till May 26, the longest spell forecast for any district. Srikakulam and Vizianagaram are likely to experience heat wave conditions for three days, from May 21 to May 23. Sri Alluri Sitharama Raju district, Kakinada and Yanam will also be affected.
South coastal Andhra Pradesh
NTR, Krishna, Palnadu, Guntur, Bapatla and Prakasam districts have also been placed under the orange alert, severe heat wave conditions likely on May 21 and May 22. Heat wave conditions are likely for the rest of the week.
Rayalaseema
The maximum temperatures are likely to range between 40°C and 43°C over the next five days, the IMD bulletin said. No formal heat wave warning has been issued for the region.
The IMD has also forecast thunderstorm activity accompanied by lightning and gusty winds of 50 to 60 kmph at isolated places in the north coastal districts and Rayalaseema over the next five days. Light to moderate rain or thundershowers are likely at one or two places in most coastal districts on May 21, 22 and 23.
The Andhra Pradesh State Disaster Management Authority (APSDMA) has advised people to remain indoors between 11 a.m. and 3 p.m., when the heat will be at its peak. Senior citizens, children, pregnant women, and people who have pre-existing illnesses have been asked to strictly avoid stepping outside during these hours.
Urban Local Bodies on high alert
Principal Secretary of the Municipal Administration and Urban Development (MA&UD) Department, S. Suresh Kumar, has directed municipal commissioners, particularly in Central and North Coastal Andhra Pradesh districts, to activate emergency preparedness measures between May 20 and May 26 to prevent heat-related illnesses and fatalities.
Urban Local Bodies (ULB) have been asked to intensify public awareness campaigns through ward secretariats, social media, local cable networks, municipal vehicles and public announcement systems. Heat wave advisories and ward-wise alerts are to be disseminated among residents.
The government has also directed ULBs to establish drinking water facilities at bus stands, hospitals, schools, markets, labour congregation points and Anna Canteens. Temporary water kiosks, cooling shelters and tanker supply arrangements are to be prioritised, especially in vulnerable and water-scarce areas.
The directive has placed special emphasis on protecting sanitation workers, outdoor labourers, street vendors, elderly citizens and homeless persons through ward-level monitoring and coordinated health support.
Mr. Suresh Kumar has directed municipal authorities to personally oversee preparedness measures daily, and said there should be “no slackness in field-level implementation” during the forecast period.
People in need of help, or information related to the heat wave can dial 1070, 112, or 18004250101.
Published - May 19, 2026 06:36 pm IST",1.0
