title,url,source,date,language,state,district,search_term,full_text,relevance_score
"मौसम अलर्ट: राजस्थान में अगले 5-6 दिन सक्रिय रहेगा मानसून, IMD का 23 जिलों के लिए चेतावनी जारी - ETV Bharat",https://news.google.com/rss/articles/CBMi3gFBVV95cUxOMnhQZDJ1SERpX05rZDAxM0NLQlJDUW9QUW9MZG1WWk9maDQ3cS1rYnlha1Z3X0JvSHVvc21PLVZ4Wm9HSHFPcVB1TzI5TVl5MlJKeTZzUHFqTWF5UHF1bnBqdGdQVEVIaVAzam1tUGR4aWxvRndqUFhoM0c3WEM5czNUTUtINlJTWE0xR0V3YlptY1JpNkJWdWJDZFJpVFJuZ3BOdWRRWW5RSTBPT3RRejg5VU1RSmtXMlJZazlxTVl1QmVFbTJYaGFDemYyUUc3eW5Ta1RQaEwzVlZnT1HSAeMBQVVfeXFMTVU3WkY3bnM2T212a19FVWp3TklLOXo5dVFCY015WmFocDVPb3N6cWpQRTdGY2pRZEdDNDNqVmlCc1M4cVdRMkN2WWd1cFV3OHBEemRTNGJSZGNTYmVEcVlNVU5aUUxyLU1rWDlxbFhucDh2R084bElUcW5OLXVMY1pWYnhvclVSUU11RkZsMjBfbWE5RXpXWENQZGY5RWxIREk1bXZvMXV1WTVNRWZiVzBqbmtBdnk1VnRscG1wZWpUSkdnYlVqbjIzMUlOV3J3QzNpY296Q0pCdEtlQWJod2xrVUk?oc=5,ETV Bharat,2026-07-06T09:58:39+05:30,hi,Rajasthan,,"(""हीट एक्शन प्लान"" OR ""गर्मी से राहत"" OR चेतावनी OR ""रेड अलर्ट"" OR ""ऑरेंज अलर्ट"" OR ""येलो अलर्ट"" OR एडवाइजरी OR ""राहत सामग्री"" OR ""राहत शिविर"" OR मुआवजा) Rajasthan","मौसम अलर्ट: राजस्थान में अगले 5-6 दिन सक्रिय रहेगा मानसून, IMD का 23 जिलों के लिए चेतावनी जारी
राजस्थान में मानसून सक्रिय होने के बाद जयपुर में देर रात झमाझम बारिश हुई. मौसमविभाग ने 23 जिलों में भारी बारिश का अलर्ट जारी किया.
जयपुर: राजस्थान में दक्षिण-पश्चिम मानसून अब पूरी तरह सक्रिय हो गया है. उत्तर-पश्चिम बंगाल की खाड़ी और ओडिशा तट पर बने कम दबाव के क्षेत्र के रविवार को डिप्रेशन में बदलने के बाद प्रदेश में बारिश की गतिविधियां तेज होने लगी हैं. राजधानी जयपुर में रविवार देर रात एक बजे तेज हवाओं के साथ झमाझम बारिश हुई, जिससे मौसम सुहावना हो गया और लोगों को उमस के साथ ही गर्मी से राहत मिली. हालांकि कई निचले इलाकों में जलभराव की स्थिति भी बन गई. मौसम विभाग ने 6 से 9 जुलाई के बीच प्रदेश के 23 जिलों में कहीं-कहीं भारी से अति भारी बारिश की चेतावनी जारी की है. इस बीच, भीलवाड़ा सहित कई जिलों में बुवाई भी शुरू हो गई है.
अगले 5-6 दिन सक्रिय रहेगा मानसून: मौसम विज्ञान विभाग के अनुसार उत्तर-पश्चिम बंगाल की खाड़ी और आसपास के ओडिशा तट पर बना कम दबाव का क्षेत्र अब गहरे होकर डिप्रेशन में बदल चुका है. यह तंत्र अगले 24 घंटों में उत्तरी ओडिशा और उत्तरी छत्तीसगढ़ की ओर बढ़ते हुए पश्चिम-उत्तर-पश्चिम दिशा में आगे बढ़ेगा. इसके प्रभाव से राजस्थान के पूर्वी और दक्षिण-पूर्वी हिस्सों में अगले पांच से छह दिन तक मानसून सक्रिय रहेगा. मौसम केंद्र जयपुर का अनुमान है कि 6 जुलाई से बारिश की गतिविधियों में और तेजी आएगी और कई जगह पर मूसलाधार बारिश हो सकती है.
23 जिलों में भारी बारिश का अलर्ट, पांच संभाग सबसे ज्यादा प्रभावित: मौसम विभाग ने 6 से 9 जुलाई के दौरान जयपुर, भरतपुर, कोटा, उदयपुर और अजमेर संभाग के कई जिलों में भारी से अति भारी बारिश की संभावना जताई है. विभाग ने सोमवार के लिए सिरोही और उदयपुर जिलों में ऑरेंज अलर्ट जारी किया है, जबकि जैसलमेर, बीकानेर, चूरू और हनुमानगढ़ को छोड़कर प्रदेश के अधिकांश जिलों में येलो अलर्ट घोषित किया गया है. विभाग ने चेतावनी दी है कि भारी बारिश के दौरान निचले इलाकों और अंडरपास में जलभराव, बरसाती नदियों और नालों में उफान, यातायात प्रभावित होने तथा दृश्यता कम होने जैसी परिस्थितियां बन सकती हैं. लोगों को आकाशीय बिजली और तेज बहाव वाले क्षेत्रों से दूर रहने की सलाह दी गई है.
देर रात बरसा जयपुर, कई इलाकों में जलभराव: राजधानी जयपुर में रविवार पूरे दिन तेज धूप और उमस रही. अधिकतम तापमान 38.4 डिग्री सेल्सियस और न्यूनतम तापमान 28.4 डिग्री सेल्सियस दर्ज किया गया. देर रात करीब एक बजे अचानक तेज हवाओं के साथ बारिश शुरू हुई, जो सुबह तक रुक-रुक कर जारी रही. झोटवाड़ा, सिविल लाइंस, सी-स्कीम, पीतल फैक्ट्री, प्रतापनगर, दुर्गापुरा, मालवीय नगर, सांगानेर, झालाना और परकोटा सहित शहर के अनेक इलाकों में अच्छी बारिश हुई. फुलेरा में 4 मिमी, नरैना में 3 मिमी और माधोराजपुरा में 7 मिमी वर्षा दर्ज की गई. बारिश से मौसम खुशनुमा हो गया, लेकिन कई निचले क्षेत्रों में जलभराव के कारण लोगों को परेशानी का सामना भी करना पड़ा.
वागड़-मेवाड़ में अच्छी बारिश, कई जिलों में बरसे मेघ: प्रदेश के दक्षिणी और दक्षिण-पूर्वी हिस्सों में भी मानसून का असर दिखाई दिया. प्रतापगढ़ में 40 मिमी बारिश दर्ज की गई, जबकि जोधपुर और अजमेर सहित कई जिलों में हल्की से मध्यम बारिश हुई. सवाई माधोपुर में करीब दो इंच तक बारिश दर्ज की गई. मौसम विभाग का कहना है कि अगले कुछ दिनों तक प्रदेश के अधिकांश हिस्सों में बारिश का सिलसिला जारी रहेगा.
अब तक सामान्य से अधिक बारिश, जयपुर सबसे आगे: राजस्थान में इस मानसून सीजन में अब तक सामान्य से अधिक वर्षा दर्ज की गई है. 5 जुलाई तक प्रदेश में सामान्य वर्षा 72.64 मिमी मानी जाती है, जबकि इस बार 78.86 मिमी बारिश हो चुकी है. यह सामान्य से 8.57 प्रतिशत अधिक है. राजधानी जयपुर में स्थिति और भी बेहतर है. यहां 5 जुलाई तक सामान्य वर्षा 82.25 मिमी के मुकाबले 111.39 मिमी बारिश दर्ज की गई है, जो सामान्य से 35.43 प्रतिशत अधिक है. इससे स्पष्ट है कि इस बार मानसून ने राजधानी में अच्छी शुरुआत की है.
बीसलपुर बांध में शुरू हुई पानी की आवक, बढ़ा जलस्तर: लगातार हो रही बारिश का असर प्रदेश के प्रमुख पेयजल स्रोत बीसलपुर बांध पर भी दिखाई देने लगा है. भीलवाड़ा और टोंक जिले के कैचमेंट क्षेत्रों में अच्छी बारिश के बाद बांध में पानी की आवक शुरू हो गई है. पिछले चार दिनों में बांध का जलस्तर 20 सेंटीमीटर बढ़कर 313.66 आरएल मीटर पर पहुंच गया है. वर्तमान में बांध अपनी कुल भराव क्षमता का लगभग 67 प्रतिशत भर चुका है. लगभग 28 हजार वर्ग किलोमीटर के विशाल कैचमेंट क्षेत्र से बांध में पानी पहुंचता है. जलस्तर में बढ़ोतरी से जयपुर, अजमेर और टोंक सहित कई शहरों की पेयजल व्यवस्था को राहत मिलने की उम्मीद है.
दिल्ली में खराब मौसम का असर, जयपुर में उतरे 12 विमान: दिल्ली में खराब मौसम और बारिश के कारण रविवार को विभिन्न शहरों से दिल्ली जा रही 12 उड़ानों को जयपुर एयरपोर्ट पर डायवर्ट करना पड़ा. इनमें बैंकॉक, अल्माटी, दुबई, जेद्दा, बेंगलुरु और अहमदाबाद सहित कई शहरों से आने वाली उड़ानें शामिल थीं. मौसम सामान्य होने के बाद इन विमानों को आगे के लिए रवाना किया गया.
बिजली गिरने से तीन किसानों की मौत: बारां जिले के केलवाड़ा और हरनावदाशाहजी क्षेत्र में आकाशीय बिजली गिरने से दो दिनों में तीन किसानों की मौत हो गई. मृतकों की पहचान सौरभ सहरिया (26), दिनेश मील (22) और कमल सिंह (40) के रूप में हुई है. तीनों खेत पर कार्य कर रहे थे, तभी वे बिजली की चपेट में आ गए. मौसम विभाग ने लोगों से खराब मौसम के दौरान खुले मैदानों और पेड़ों के नीचे खड़े नहीं होने की अपील की है.
अगले चार दिन सावधानी की जरूरत: मौसम विभाग के अनुसार 6 से 9 जुलाई तक प्रदेश में मानसून का प्रभाव चरम पर रह सकता है. खास तौर पर पूर्वी और दक्षिण-पूर्वी राजस्थान में कहीं-कहीं अति भारी बारिश की संभावना है. ऐसे में लोगों को जलभराव वाले क्षेत्रों से बचने, बरसाती नदियों और नालों को पार नहीं करने और आकाशीय बिजली के दौरान सुरक्षित स्थानों पर रहने की सलाह दी गई है. यदि वर्तमान मौसम प्रणाली सक्रिय बनी रही, तो प्रदेश के अधिकांश हिस्सों में अच्छी बारिश होने से कृषि, जलाशयों और पेयजल व्यवस्था को बड़ा लाभ मिलेगा.
भीलवाड़ा में बुवाई शुरू: मानसून की 2 दिन पहले हुई बारिश के बाद जिले के किसानों ने खरीफ फसल की बुवाई शुरू कर दी है. कृषि विभाग ने इसे बुवाई का उपयुक्त समय बताया है. संयुक्त निदेशक विनोद कुमार जैन ने बताया कि जिले में लगभग सभी जगह अच्छी बारिश हुई है. इस बार 3 लाख 98 हजार हेक्टेयर में खरीफ बुवाई का लक्ष्य है, जिसमें गर्मी में 60 हजार हेक्टेयर में बुवाई हो चुकी है. किसानों ने मूंग, उड़द, तिल, ग्वार, ज्वार, मक्का, बाजरा और सोयाबीन की बुवाई शुरू कर दी है. जिले में मक्का मुख्य फसल है.कृषि विभाग ने कहा कि खाद-बीज की कोई कमी नहीं है. जिले में 2500 टन डीएपी, 450 टन एसएसपी, 35 टन एनपीके और 11000 टन यूरिया उपलब्ध है. उन्होंने किसानों से अपील की कि खाद-बीज खरीदते समय बिल जरूर लें और नमी के अनुसार बुवाई करें. जुलाई के पहले सप्ताह में बारिश से उत्पादन बढ़ेगा.",1.0
"राजस्थान में मानसून का महाअलर्ट! 6 जुलाई से बदलेगा मौसम, इन संभागों में भारी से अति भारी बारिश की चेतावनी - Zee News",https://news.google.com/rss/articles/CBMilAJBVV95cUxOQk9DcUxEWkt6SDJSX1p2YU9lOFZaX0trUHpjSjNpOFNMaVV5aDlsM3lfY0Nyc21lSHBuN0lCMlNuYTZVUDAxYlhxWk5lNzE2STJ2X09mY3RfaE1uZzBiNzV1Q1Q2VDNwa2l5NllIc2JoZnM3YmVNYjNlT29Vd3RyallUdldGMlgwdnJGTXZJV1lheElTVTRwc1BtOVM3dUhscXRlNWhPQ3lLXzAxS0dJdjR1MmJjYVFGZEU2dmUwNFAtX2FIZFFTYkJyaGVrTTNId1RGMFA2dFhSLU5fQ21DRHdHQlQxdEFVbGVFNVdfNFNvWFlGX092YjJPSjBSckRzUHFBYmJfVFFlRXk0SldibF9DZmI?oc=5,Zee News,2026-07-06T05:49:00+05:30,hi,Rajasthan,,"(""हीट एक्शन प्लान"" OR ""गर्मी से राहत"" OR चेतावनी OR ""रेड अलर्ट"" OR ""ऑरेंज अलर्ट"" OR ""येलो अलर्ट"" OR एडवाइजरी OR ""राहत सामग्री"" OR ""राहत शिविर"" OR मुआवजा) Rajasthan","Rajasthan Weather Update: भारत मौसम विज्ञान विभाग (IMD) के मौसम विज्ञान केंद्र, जयपुर ने सोमवार को राजस्थान के लिए नाउकास्ट (Nowcast) मौसम चेतावनी जारी की है.
1/9
Rajasthan Weather Update:
विभाग के अनुसार राज्य के कई जिलों में अचानक मौसम बदल सकता है. कहीं तेज मेघगर्जन, बिजली चमकने, धूलभरी आंधी और हल्की से मध्यम बारिश की संभावना जताई गई है. मौसम विभाग ने लोगों से सतर्क रहने और आवश्यक सावधानियां बरतने की अपील की है.
2/9
Rajasthan Weather Update
मौसम विभाग ने नागौर, डीडवाना-कुचामन, सीकर, जयपुर, अजमेर और टोंक जिलों के लिए ऑरेंज अलर्ट जारी किया है. इन क्षेत्रों में कहीं-कहीं मध्यम से तीव्र मेघगर्जन, बिजली गिरने की आशंका, 40 से 60 किलोमीटर प्रति घंटे की रफ्तार से तेज हवाएं चलने तथा हल्की से मध्यम बारिश होने की संभावना व्यक्त की गई है.
3/9
Rajasthan Weather Update
विभाग का कहना है कि इन जिलों में मौसम अचानक खराब हो सकता है, इसलिए खुले स्थानों पर जाने से बचें और मौसम की गतिविधियों पर नजर बनाए रखें.
4/9
Rajasthan Weather Update
वहीं झुंझुनूं और चूरू जिलों के लिए येलो अलर्ट जारी किया गया है. इन इलाकों में कहीं-कहीं हल्के से मध्यम स्तर की मेघगर्जना, बिजली चमकने और 30 से 40 किलोमीटर प्रति घंटे की रफ्तार से तेज हवाएं चलने के साथ हल्की से मध्यम बारिश होने की संभावना है. हालांकि इन जिलों में खतरा ऑरेंज अलर्ट वाले क्षेत्रों की तुलना में कम माना गया है, फिर भी मौसम विभाग ने लोगों को सतर्क रहने की सलाह दी है.
5/9
Rajasthan Weather Update
मौसम विभाग के अनुसार ऑरेंज अलर्ट वाले क्षेत्रों में तेज हवाओं के कारण पेड़, बिजली के खंभे, कच्चे और कमजोर निर्माण, अस्थायी शेड तथा होर्डिंग्स प्रभावित हो सकते हैं. तेज हवा और बिजली गिरने की घटनाओं से जनजीवन पर असर पड़ सकता है.
6/9
Rajasthan Weather Update
वहीं येलो अलर्ट वाले जिलों में सामान्य रूप से कोई बड़ा प्रभाव अपेक्षित नहीं है, लेकिन स्थानीय स्तर पर तेज हवाओं और बारिश के कारण कुछ असुविधा हो सकती है.
7/9
Rajasthan Weather Update
आईएमडी ने लोगों से अपील की है कि मेघगर्जन और बिजली चमकने के दौरान पेड़ों के नीचे शरण न लें, खुले मैदानों, खेतों और ऊंचे स्थानों से दूर रहें तथा सुरक्षित भवनों के अंदर रहें. वाहन चलाने वाले लोगों को भी खराब दृश्यता और तेज हवाओं को देखते हुए सावधानी बरतने की सलाह दी गई है. किसानों को भी मौसम की स्थिति को देखते हुए खेतों में काम करने से पहले स्थानीय मौसम अपडेट पर नजर रखने की सलाह दी गई है.
8/9
Rajasthan Weather Update
मौसम विशेषज्ञों का कहना है कि प्रदेश में सक्रिय मौसमी प्रणाली के प्रभाव से आगामी घंटों में कई इलाकों में मौसम तेजी से बदल सकता है. ऐसे में नागरिकों से अपील है कि वे मौसम विभाग द्वारा जारी आधिकारिक चेतावनियों का पालन करें, अनावश्यक यात्रा से बचें और किसी भी आपात स्थिति में सुरक्षित स्थान पर रहें.
9/9
Rajasthan Weather Update
प्रशासन और संबंधित एजेंसियों को भी अलर्ट मोड पर रहने के निर्देश दिए गए हैं ताकि किसी भी संभावित स्थिति से समय रहते प्रभावी ढंग से निपटा जा सके.",1.0
