title,url,source,date,language,state,district,search_term,full_text,relevance_score
India Heatwave Action Plans Trigger New School Timings and Worker Safety Measures - Goodreturns,https://news.google.com/rss/articles/CBMiqAFBVV95cUxQRjl0d01GMlc4XzB2dV95a1NSRV9sRjFTcVhkWmdvUFFkbU54bTZNTzVEOFJRVHBBV29kY3FSSkM2Y19tbjRid0NROWotTTUwVTVlaTFpd1NiSlY1V2VuY0c5ODZlX0xNN0xmSzloWHVKR2VPc09lQXFOelp3VVBESkpnLU5CMHgxTkg4bU54dXhIZHdLZEFlQzhxVGNKUUtsV05HOEF6VkQ?oc=5,Goodreturns,2026-07-06T07:25:20+05:30,en,Rajasthan,,"""heatwave"" Rajasthan","As maximum temperatures push past 44°C in several pockets, states are rushing out heatwave action plans that touch daily routines most Indians depend on—school hours, drinking water access, and MGNREGA work shifts. Fresh India Meteorological Department (IMD) alerts this week have triggered new standard operating procedures meant to shield children, commuters and outdoor workers from dangerous heat stress across vulnerable districts.
From Vidarbha and Bundelkhand to parts of east and central India, administrations are balancing continuity of services with public safety. Orders issued since mid‑April show a clear trend: start earlier, stop before peak afternoon heat, and guarantee water and rest wherever crowds or labourers gather. These measures now sit alongside IMD’s warning of above‑normal heatwave days through April–June 2026.
IMD heat alerts drive new school timings and closures
With IMD flagging heatwave conditions in parts of Uttar Pradesh, Madhya Pradesh, Rajasthan and Maharashtra through April 23, education departments and district collectors have been among the first responders. Several orders cap classroom hours before noon or advance summer breaks where temperatures have stayed above 44°C for consecutive days, especially in interior Maharashtra and Bundelkhand.
In Nagpur, where day temperatures have hovered around 44°C, the district collector on Tuesday directed all schools, across boards, to close by 10.30 am for the remaining days of April. Neighbouring Chandrapur, which crossed 44°C earlier, had already ordered schools to shut by 11 am. Officials have warned they will act against institutions that ignore the curtailed schedule.
Uttar Pradesh has also trimmed timings in several districts under heat alerts. In Lucknow, government and private schools have been asked to run only till 12.30 pm, cutting exposure to the hottest part of the day while keeping teaching hours partially intact. Similar district‑level directives are being reported from eastern UP and Madhya Pradesh, where IMD expects heatwave conditions to persist for at least two more days.
Telangana, Odisha and Maharashtra activate heatwave action plans
Beyond school calendars, some states are leaning on pre‑drafted heatwave action plans that specify where water, shade and first‑aid must be available. Telangana’s plan, notified last week, requires “water bells” in schools to remind children to drink at regular intervals, shortens Anganwadi timings, and designates malls, religious places, panchayat offices and other public buildings as cooling centres open to anyone needing relief.
Odisha districts have started operationalising their Heat Action Plan 2026, which mandates morning office hours for field officials, village‑level awareness drives and strict instructions that every worksite under rural schemes must provide shade and drinking water. The Dhenkanal district document, updated this month, also calls for continuous scrolling alerts on local TV channels about heatwave risks and available facilities.
Maharashtra has combined long‑term policy with short‑term advisories. A state heatwave policy notified on April 18 introduces a mandatory 12 pm–4 pm break for outdoor workers in high‑risk urban areas, including Mumbai, while a parallel advisory asks that labour‑intensive work be scheduled between 6 am–11 am and 4 pm–8 pm in 15 heat‑sensitive districts across Vidarbha, Marathwada and Khandesh.
| State / Region | Key heatwave measures (April 2026) |
|---|
| Nagpur, Chandrapur (Maharashtra) | Schools to close by 10.30–11 am on heatwave days |
| Lucknow (Uttar Pradesh) | Schools restricted to morning shift till 12.30 pm |
| Telangana | Water bells, cooling centres, reduced Anganwadi hours |
| Maharashtra (urban, heat‑prone districts) | Mandatory 12–4 pm break; outdoor work shifted to cooler hours |
| Odisha districts | Morning offices, shaded worksites, TV scroll alerts |
What MGNREGA and outdoor workers should check on the ground
While the Centre’s rural jobs framework is being revamped under new legislation, many states continue to anchor protections for casual labourers in heat action plans and district orders. These typically require that MGNREGA worksites and similar schemes ensure potable water, temporary shade and first‑aid, with job cards and muster rolls reflecting adjusted work windows during red or orange heat alerts.
Workers can ask mates or panchayat officials whether local orders cap work between early morning and late evening, and whether pay is protected if shifts are shortened due to official heat advisories. Where written heat action plans exist, they often classify days with IMD alerts and spell out entitlements to drinking water points, oral rehydration solution kiosks and rest pauses near worksites, especially for women and older workers.
How residents can locate water points, ORS camps and helplines
In cities such as Hyderabad, Mumbai and parts of Gujarat, municipal corporations are mapping public water kiosks and temporary cooling spaces along busy commuter corridors. State disaster management departments often share locations through district websites, local language advertisements and, increasingly, QR codes at bus stops or railway stations that list nearby shade shelters, ORS camps and emergency contact numbers.
Health experts advise residents to treat IMD’s daily bulletins as a practical planning tool rather than background noise. On days flagged as heatwave or “hot and humid,” parents may want to confirm revised school timings, commuters can identify refill points before long journeys, and outdoor workers should verify whether their employers or gram panchayats have shifted shifts in line with the latest state orders. Staying informed can now meaningfully reduce heat‑related risk.
Share This Article
Story first published: Wednesday, April 22, 2026, 13:57 [IST]",1.0
