title,url,source,date,language,state,district,search_term,full_text,relevance_score
अभी कई दिनों तक गर्म मौसम जारी रहेगा। - Vietnam.vn,https://news.google.com/rss/articles/CBMib0FVX3lxTFBiNkYzYUZqazVxaGp5MXB1VE5JMllvWWpyeVdDaDc4Tk4wSExFOWNyN2cxNHY0NFM4dHVFV2FlZzUyNklVLWRvRnpuSEJVdzVrR1hQSWhDeC13NjFBczNRYmwwSWR1Z0JxdzNMRC1CZw?oc=5,Vietnam.vn,2026-04-08T07:10:37+05:30,hi,Madhya Pradesh,,"""लू"" Madhya Pradesh","राष्ट्रीय मौसम विज्ञान एवं जल विज्ञान पूर्वानुमान केंद्र का अनुमान है कि 8 और 9 अप्रैल को व्यापक क्षेत्र में लू जारी रहेगी। थान्ह होआ से दा नांग तक का क्षेत्र और क्वांग न्गाई से डाक लक तक के प्रांतों के पूर्वी भाग में भीषण गर्मी का प्रकोप जारी रहेगा, कुछ क्षेत्रों में असाधारण रूप से भीषण गर्मी पड़ेगी, जहां तापमान आमतौर पर 37-39 डिग्री सेल्सियस के बीच रहेगा और कुछ स्थानों पर 40 डिग्री सेल्सियस से भी अधिक हो सकता है।
उत्तर-पश्चिमी क्षेत्र में भीषण गर्मी जारी है, जहां अधिकतम तापमान आमतौर पर 36-38 डिग्री सेल्सियस के बीच रहता है और कुछ क्षेत्रों में 38 डिग्री सेल्सियस से भी अधिक हो जाता है। उत्तरी डेल्टा के दक्षिणी भाग, मध्य उच्चभूमि और दक्षिणी क्षेत्र में भी गर्मी बनी हुई है, जहां तापमान आमतौर पर 35-36 डिग्री सेल्सियस के बीच रहता है और कुछ क्षेत्रों में 36 डिग्री सेल्सियस से भी अधिक हो जाता है।
मौसम एजेंसी ने चेतावनी दी है कि लू की लहर कई और दिनों तक जारी रहने की संभावना है। मौसम पूर्वानुमान ऐप के आंकड़ों के अनुसार, 8 से 12 अप्रैल तक हनोई में अधिकतम तापमान आमतौर पर 36-38 डिग्री सेल्सियस रहेगा, जिसके बाद धीरे-धीरे गिरावट आने की संभावना है। हो ची मिन्ह सिटी में भी अधिकतम तापमान लगातार कई दिनों तक 35-37 डिग्री सेल्सियस के आसपास बना रहेगा।
कल, 7 अप्रैल को, देश भर के कई क्षेत्रों में व्यापक लू चली, जिसमें मध्य क्षेत्र में तीव्र गर्मी पड़ी, और कुछ स्थानों पर असाधारण रूप से भीषण गर्मी पड़ी।
अवलोकन आंकड़ों से पता चलता है कि 7 अप्रैल को कुछ स्थानों पर उच्चतम तापमान 40 डिग्री सेल्सियस से अधिक हो गया, जैसे कि ताई हिएउ स्टेशन (न्घे आन) पर 41.9 डिग्री सेल्सियस; हा तिन्ह में 40.8 डिग्री सेल्सियस; और तिन्ह जिया (थान्ह होआ) में 40.3 डिग्री सेल्सियस।
7 अप्रैल को शाम 8 बजे तक के तापमान का सारांश। स्रोत: राष्ट्रीय मौसम विज्ञान और जल विज्ञान पूर्वानुमान केंद्र।
स्रोत: https://www.sggp.org.vn/nang-nong-con-keo-dai-nhieu-ngay-toi-post846828.html",1.0
