title,url,source,date,language,state,district,search_term,full_text,relevance_score
"यूपी में भीषण गर्मी के बीच सड़क पर रेंगते हुए मंत्री का आवास घेरने पहुंचे 69,000 भर्ती - ABP News",https://news.google.com/rss/articles/CBMiwgFBVV95cUxPS0dvM2c1VjNYeWR1UDNLaXRkSmNWdXRzeENUSndoRkFZLWt3OEFYYTI4VFRTaVNvMUFSY3lrRGdTSmpPNFY3Y21EVFlsbDZMN2trbHU0Zy1MMml2U196S3ZJd0UycW5EbU1adEQtaHgtRU9OWDZZbEllQ3hfNUpFUDExbG9kMVY1Mk1VMHZ6bWIyRlJrMW5pYmIxVVByQmdWazctT2llZ1VfMWRDTW5HQWU1M29WeWpRVnE0eGNOd25KZ9IBxwFBVV95cUxObDNadE9mbHR3MktHYTNIUVJ6VEZHWDJiaVhLQS1JYXRfU0poVnVMTVA5b0lqTEg3TU5JaHpSbXMya0hqaTcwMzAwalgydU90TVp2NkRtRnpEdkxYS1dWUHFHZVBKeURuTm5Zd1p6RWt6QTBjQWJ2eGxPYzBsdThBU1RDUkVrOFZCclVSUWZVajZCelBSdjNTVTM2Si1iUG5KbHh0WXRJY2pxTVJ6TjI4ZnRSVkloVV9QQjhGay1Oc3UtbWM4cWFZ?oc=5,ABP News,2026-05-18T11:20:13+05:30,hi,Uttar Pradesh,Lucknow,"(लू OR ""लू चलना"" OR ""भीषण गर्मी"" OR ""प्रचंड गर्मी"" OR ""कड़ी धूप"" OR ""तेज धूप"" OR ""गर्म हवा"" OR ""उष्ण लहर"" OR ""ताप लहर"" OR ""हीट वेव"" OR ""झुलसाने वाली गर्मी"" OR ""तपती गर्मी"" OR ""भयंकर गर्मी"" OR ""गर्मी का कहर"" OR ""गर्मी का प्रकोप"" OR ""अत्यधिक गर्मी"" OR मौसम OR ""मौसम अपडेट"" OR ""मौसम का हाल"" OR ""मौसम पूर्वानुमान"" OR ""मौसम अलर्ट"" OR आईएमडी OR ""आईएमडी पूर्वानुमान"" OR ""आईएमडी अलर्ट"" OR ""तापमान में बढ़ोतरी"" OR ""गर्मी से राहत"" OR ""गर्मी से निजात"") Uttar Pradesh","यूपी में भीषण गर्मी के बीच सड़क पर रेंगते हुए मंत्री का आवास घेरने पहुंचे 69,000 भर्ती के अभ्यर्थी, कहा- कल तारीख है लेकिन...
UP News: उत्तर प्रदेश की 69 हजार शिक्षक भर्ती मामले में अभ्यर्थियों का प्रदर्शन एक बार फिर तेज हो गया है. अभ्यर्थियों ने इस बार अनोखा तरीका अपनाया और रेंगते हुए प्रदर्शन किया.
उत्तर प्रदेश में 69,000 शिक्षक भर्ती के मामले में 31वीं तारीख के बीच अभ्यर्थियों ने भीषण गर्मी में रेंगते हुए प्रदर्शन किया. अभ्यर्थी, राज्य के बेसिक शिक्षा मंत्री का आवास घेरने जा रहे थे हालांकि पुलिस ने उन्हें आगे जान से रोक दिया.
सोमवार,18 मई को बड़ी संख्या में अभ्यर्थी राजधानी लखनऊ में बेसिक शिक्षा मंत्री के आवास की ओर सड़क पर रेंगते हुए पहुंचे और विरोध जताया. भीषण गर्मी के बीच अभ्यर्थियों ने अनोखे तरीके से प्रदर्शन करते हुए सरकार पर उनकी मांगों की अनदेखी का आरोप लगाया. प्रदर्शन कर रहे अभ्यर्थियों का कहना है कि मामले की अगली सुनवाई 31 मई को है, लेकिन अब तक उनकी ओर से अदालत में प्रभावी पैरवी नहीं की जा रही है. उनका आरोप है कि सरकार और संबंधित विभाग उनके मुद्दों को गंभीरता से नहीं उठा रहे हैं. अभ्यर्थियों ने मांग की कि कोर्ट में मजबूती से पक्ष रखा जाए और भर्ती प्रक्रिया से जुड़े विवाद का जल्द समाधान निकाला जाए.
'हमारे पास कोई ऑप्शन नहीं...'
#BREAKING | लखनऊ में शिक्षक भर्ती अभ्यर्थियों का प्रदर्शन@romanaisarkhan | @vivekraijourno https://t.co/smwhXUROiK#UP #LucknowPolice #Protest #YogiAdityanath #Education #ABPNews pic.twitter.com/7rhG6vRfS9
— ABP News (@ABPNews) May 18, 2026
यह पूछे जाने पर कि वह रेंगते हुए क्यों जा रहे हैं, अभ्यर्थियों में से एक ने कहा कि हमारी हालत कीड़े मकड़ों से ज्यादा बुरी हो गई है, इसलिए हमने यह कदम उठाया.
अभ्यर्थियों का आरोप है कि उनके मामले की सही से पैरवी नहीं हुई है. एबीपी न्यूज़ से बात करते हुए एक अभ्यर्थी ने कहा कि हम आग्रह करने आए हैं कि हम लोगों की हालत देखी जाए. हम लोग मजबूर हैं. पिछले 6 सालों से हमारा आंदोलन चल रहा है. अब गर्मी, सर्दी, बारिश, कुछ फर्क नहीं पड़ता. हम लोग मजबूर हैं. हमारे पास कोई ऑप्शन नहीं है.
टॉप हेडलाइंस
Source: IOCL",0.5166666666666666
"UP Weather News: भीषण गर्मी की चपेट में यूपी, 33 जिलों में लू की चेतावनी; लखनऊ में झुलसाने वाली गर्मी का अलर्ट - Amar Ujala",https://news.google.com/rss/articles/CBMi3AFBVV95cUxONGVYNnJhcmVCQVBSSmRiX0syNndrVmtiSVVHODRmYmZOSWVGd2VhOHpSaS03YUJkc2JYbDk0TEJZLVdXMi1lU3NMSHg4SEtWTUNLd2JVUmVoaUNiREVaZW5yN29oTm5Pa1RLOEpuWTc1bnZZcndBSFdmUkd6SUw3dW5JbDlfaWk2RDRFcjgyWWN6U1dzQUpKN3BLeC12R2tBUGg4eGZkdUVYWU5rS3ByMnlOY0V3REt4NlZuaTVNc0FtOWU5VWxHN1FIUUN2OVhpdHYxOU90aEo1ZktU0gHiAUFVX3lxTE96SzAtYVRXVm9fcDhkUEJYajFvSExJRk1sc3lEeElac3Jnazl2RmRVOFduQ3hsYllpUi12bnBEanBnMjhRVndJa1JFbVdsZ0FVT1hjM3BJUHhoZTVpSWhQM01GbFYxSk0xeHdBZmxmemZvYXRfaUNHRmczM2lVTVRWdE9EUmFTbnhnSWZsbzVTclhDQXFlNlFqNXZNUUROSmk0OGdzT0ppd0lvdkMzMlhTZnk4OEExem1kNXFHb19iTGJhU1l5LUhPV012d2VEellYSVFocDZrQXVkZmRBcG82YUE?oc=5,Amar Ujala,2026-05-18T08:04:37+05:30,hi,Uttar Pradesh,Lucknow,"(""हीट एक्शन प्लान"" OR ""गर्मी से राहत"" OR चेतावनी OR ""रेड अलर्ट"" OR ""ऑरेंज अलर्ट"" OR ""येलो अलर्ट"" OR एडवाइजरी OR ""राहत सामग्री"" OR ""राहत शिविर"" OR मुआवजा) Uttar Pradesh","UP Weather News: भीषण गर्मी की चपेट में यूपी, 33 जिलों में लू की चेतावनी; लखनऊ में झुलसाने वाली गर्मी का अलर्ट
UP Weather Update: यूपी भीषण गर्मी की चपेट में है। 33 जिलों में लू चलने की चेतावनी जारी की गई है। वहीं लखनऊ में झुलसाने वाली गर्मी का अलर्ट है। आगे पढ़ें पूरा अपडेट...
खबरें लगातार पढ़ने के लिए अमर उजाला एप डाउनलोड करें
या
वेबसाइट पर पढ़ना जारी रखने के लिए वीडियो विज्ञापन देखें
अगर आपके पास प्रीमियम मेंबरशिप है तो
विस्तार
सोमवार के लिए प्रदेश के 33 जिलों में लू चलने की चेतावनी जारी की गई है। रविवार को बांदा 46.4 डिग्री सेल्सियस तापमान के साथ प्रदेश का सबसे गर्म शहर दर्ज किया गया। इसके अलावा झांसी, प्रयागराज और हमीरपुर में भी लू का असर बेहद तीखा रहा। तेज धूप और गर्म हवाओं ने लोगों को बेहाल कर दिया।
आंचलिक मौसम विज्ञान केंद्र, लखनऊ के वरिष्ठ वैज्ञानिक अतुल कुमार सिंह ने बताया कि फिलहाल प्रदेश में मौसम शुष्क बना रहेगा। अगले कुछ दिनों तक तापमान में लगातार बढ़ोतरी होने के आसार हैं।
इन जिलों में है लू चलने की चेतावनी
बांदा, चित्रकूट, कौशांबी, प्रयागराज, फतेहपुर, प्रतापगढ़, सोनभद्र, मिर्ज़ापुर, चंदौली, वाराणसी, भदोही, जौनपुर, गाजीपुर, आजमगढ़, मऊ, बलिया, कन्नौज, कानपुर देहात, कानपुर नगर, उन्नाव, रायबरेली, अमेठी, सुल्तानपुर, आगरा, फिरोजाबाद, मैनपुरी, इटावा, औरैया, जालोन, हमीरपुर, महोबा, झांसी, ललितपुर व आसपास के क्षेत्र।
झुलसाने वाली गर्मी के लिए रहिए तैयार
रविवार को तेज धूप और गर्मी ने लोगों को बेहाल कर दिया। सुबह से ही चिलचिलाती धूप का असर दिखाई दिया। दोपहर में लू जैसे हालात बनने से सड़कें सूनीं नजर आईं। शाम में धूप ढलने के बाद भी हवा में तपिश महसूस की गई। बाजारों और सार्वजनिक स्थानों पर भी सामान्य दिनों की तुलना में भीड़ कम नजर आई।आंचलिक मौसम विज्ञान केंद्र के वरिष्ठ वैज्ञानिक अतुल कुमार सिंह के अनुसार अगले कुछ दिनों में गर्मी के तेवर और तल्ख होंगे। तापमान में लगातार बढ़ोतरी होने के आसार हैं। अगले तीन दिन में अधिकतम तापमान 44 डिग्री सेल्सियस तक पहुंच सकता है। रविवार को अधिकतम तापमान 1.6 डिग्री सेल्सियस की बढ़त के साथ 41.6 डिग्री सेल्सियस दर्ज किया गया, जबकि न्यूनतम तापमान 26.6 डिग्री सेल्सियस रहा।
घर से निकलने पर इन बातों का रखें ध्यान
- दोपहर में अनावश्यक रूप से बाहर निकलने से बचें।
- थोड़ी-थोड़ी देर पर पर्याप्त मात्रा में पानी का सेवन करें।
- एसी-कूलर वाले कमरे से अचानक धूप में न जाएं।
- यात्रा के दौरान बीच-बीच में छांव में कुछ देर रुकें।
- लू लगने पर तत्काल चिकित्सकीय परामर्श लें।
Get all India News in Hindi related to live update of politics, sports, entertainment, technology and education etc. Stay updated with us for all breaking news from India News and more news in Hindi.",1.0
"यूपी में भीषण गर्मी का ऑरेंज अलर्ट, एक्शन में योगी सरकार ..अस्पतालों और बिजली-पानी व्यवस्था पर विशेष नजर - amritvichar.com",https://news.google.com/rss/articles/CBMixwJBVV95cUxPZ040OTVlS0c4c3pjQU1tSTRsdU5odWE5MG0tcWR1b0R0VHBDMkR2MTZjS0dWTkZTMWRxb09pbTU5eGFLeGxuck91dWcwcWlNamttckNuMG5FQVpoMS14WGJYVk9QRWk5Z05lam9DR0gtQzBFUkdXM09vQUY3NDNRZVdrQWp0cWQ5LUYta3MwQ2NicXVQZGsxVjQtc25SaDIwYnRNOTBJeHZja0dNWlpsNDByWmtYSk15VFpvNzV2NDg4WDZGcTYwOXIxbWNPN1d5eXduU000ZmhlUjgzVElUeXpoYnRmdlN5S0xUalRQaXl4R1pQOGc1RXJ5ZHZhTHRoN2FOU1J3NWY2YlhkVHBJYU9JcUY5T0NzLTAyWDRQSE5lNVhKYmVwMUpWMUYwc2hyTUZqQ0RaMktGbl91RXBzMF9lLXA5Rlk?oc=5,amritvichar.com,2026-05-18T13:13:25+05:30,hi,Uttar Pradesh,Lucknow,"(""हीट एक्शन प्लान"" OR ""गर्मी से राहत"" OR चेतावनी OR ""रेड अलर्ट"" OR ""ऑरेंज अलर्ट"" OR ""येलो अलर्ट"" OR एडवाइजरी OR ""राहत सामग्री"" OR ""राहत शिविर"" OR मुआवजा) Uttar Pradesh","यूपी में भीषण गर्मी का ऑरेंज अलर्ट, एक्शन में योगी सरकार ..अस्पतालों और बिजली-पानी व्यवस्था पर विशेष नजर
लखनऊ, अमृत विचार: प्रदेश में लगातार बढ़ रही भीषण गर्मी और लू के खतरे को देखते हुए मुख्यमंत्री योगी आदित्यनाथ ने प्रशासनिक मशीनरी को अलर्ट मोड पर रहने के निर्देश दिए हैं। भारतीय मौसम विज्ञान विभाग की ओर से ऑरेंज अलर्ट जारी होने के बाद मुख्यमंत्री ने सभी जिलाधिकारियों, स्वास्थ्य विभाग, बिजली विभाग और राहत एजेंसियों को पूरी सतर्कता बरतने को कहा है।
मुख्यमंत्री ने निर्देश दिया है कि संवेदनशील जिलों में विशेष निगरानी रखी जाए और किसी भी आपात स्थिति से निपटने के लिए सभी विभाग समन्वय के साथ काम करें। सरकारी अस्पतालों में हीट स्ट्रोक वार्ड तैयार रखने, पर्याप्त दवाएं उपलब्ध कराने और डॉक्टरों की तैनाती सुनिश्चित करने के निर्देश दिए गए हैं। साथ ही एंबुलेंस सेवाओं को भी सक्रिय रखने को कहा गया है, ताकि जरूरत पड़ने पर तत्काल राहत उपलब्ध कराई जा सके।
सीएम योगी ने पेयजल संकट और बिजली आपूर्ति बाधित न होने पर भी विशेष जोर दिया है। उन्होंने कहा कि सार्वजनिक स्थानों पर पेयजल की पर्याप्त व्यवस्था सुनिश्चित की जाए। बिजली विभाग को निर्देश दिए गए हैं कि गर्मी के दौरान अनावश्यक कटौती से बचा जाए और खराब ट्रांसफॉर्मरों को तत्काल बदला जाए।
मुख्यमंत्री ने प्रदेशवासियों से भी सावधानी बरतने की अपील की है। उन्होंने कहा कि लोग दोपहर के समय अनावश्यक रूप से घरों से बाहर न निकलें। बच्चों, बुजुर्गों और बीमार लोगों को विशेष सतर्कता बरतने की सलाह दी गई है। प्रशासन की ओर से लोगों को अधिक पानी पीने, हल्के सूती कपड़े पहनने और धूप में निकलते समय सिर ढककर रखने की सलाह दी जा रही है।
19 से 21 तक चलेगी अति उष्ण लहर
मौसम विभाग के अनुसार, 19 से 21 मई के बीच प्रदेश के कई जिलों में अति उष्ण लहर चलने की संभावना है। इस दौरान तापमान में तीन से चार डिग्री सेल्सियस तक वृद्धि हो सकती है। इसे देखते हुए सरकार ने सभी जिलों को राहत और बचाव की तैयारियां समय रहते पूरी करने के निर्देश दिए हैं। प्रशासन को यह भी कहा गया है कि सार्वजनिक स्थलों, बस स्टैंड, रेलवे स्टेशन और बाजारों में छायादार स्थानों और पानी की उपलब्धता सुनिश्चित की जाए। स्कूलों और निर्माण स्थलों पर काम करने वाले श्रमिकों के लिए भी सावधानी संबंधी दिशा-निर्देश जारी करने को कहा गया है।
सीएम के प्रमुख निर्देश
• अस्पतालों में हीट स्ट्रोक वार्ड तैयार रखें
• दवाओं, बेड और डॉक्टरों की पर्याप्त व्यवस्था
• एंबुलेंस सेवाएं रहें पूरी तरह सक्रिय
• बिजली और पेयजल आपूर्ति बाधित न हो
• सार्वजनिक स्थानों पर पानी की व्यवस्था बढ़े
• जिलाधिकारी संवेदनशील क्षेत्रों पर रखें नजर",1.0
