title,url,source,date,language,state,district,search_term,full_text,relevance_score
"MCB जिले में 42 डिग्री के पार पहुंचा तापमान, दोपहर में सड़कों और बाजारों में सन्नाटा, डॉक्टर ने दिए लू से बचने के टिप्स - ETV Bharat",https://news.google.com/rss/articles/CBMiuAFBVV95cUxOaTZCdTlyNG1HVFp3ZUdpMnlMYVpWcmJyNVFVbnV5OTBHYm94TEEzSll0dVNpYTRKVGozOXBsTmRMWUY4SXpvNkhuX3ZOWUtraWFfTEJnVlkyMFBTelF0UjlRX3F0TkkyMTBEWUsyWWtsc1NVWHMwbndKSU1TMWprbm53RjBYWnN2bFJGNzJ3bnd4UkNHR0V4bGFuS3U2dGpGc0pkQTlMdGZYdzZUUWZXdlpqZHA4WS1r0gG-AUFVX3lxTE1uZTBnNHhtTTllUFVoNXlWRWliMXlyUWJGQzlLNmhiSVQzdUljMVlWMHVlN2hEWEVzZnhzaEx1b2VpZTlHUVFGdUg4MHJQcTNuc0xGN01XOUlENi1zblVzSXg3U0hjbXNSWnVNbHBUNVMyX0lGa3pYS3N1SXljdHJ4NURKZzA1SGpQLXhpamVzamhlYVBxWTFPcC1PVDZVdVVnRGxxcS1fZU8zZDU1X3hoTXV0NE9uY3ZncGlINHc?oc=5,ETV Bharat,2026-05-23T18:36:17+05:30,hi,Andaman and Nicobar Islands,,"(लू OR ""लू चलना"" OR ""भीषण गर्मी"" OR ""प्रचंड गर्मी"" OR ""कड़ी धूप"" OR ""तेज धूप"" OR ""गर्म हवा"" OR ""उष्ण लहर"" OR ""ताप लहर"" OR ""हीट वेव"" OR ""झुलसाने वाली गर्मी"" OR ""तपती गर्मी"" OR ""भयंकर गर्मी"" OR ""गर्मी का कहर"" OR ""गर्मी का प्रकोप"" OR ""अत्यधिक गर्मी"" OR मौसम OR ""मौसम अपडेट"" OR ""मौसम का हाल"" OR ""मौसम पूर्वानुमान"" OR ""मौसम अलर्ट"" OR आईएमडी OR ""आईएमडी पूर्वानुमान"" OR ""आईएमडी अलर्ट"" OR ""तापमान में बढ़ोतरी"" OR ""गर्मी से राहत"" OR ""गर्मी से निजात"") Andaman and Nicobar Islands","MCB जिले में 42 डिग्री के पार पहुंचा तापमान, दोपहर में सड़कों और बाजारों में सन्नाटा, डॉक्टर ने दिए लू से बचने के टिप्स
भीषण गर्मी और लू से बचने के लिए लोग बिना जरूरत घरों से बाहर न निकलें. पर्याप्त मात्रा में पानी पिएं
मनेन्द्रगढ़ चिरमिरी भरतपुर: जिले में इन दिनों भीषण गर्मी ने लोगों का जीना मुश्किल कर दिया है. लगातार बढ़ते तापमान ने जनजीवन को पूरी तरह प्रभावित किया है. जिले में तापमान 42 डिग्री सेल्सियस के पार पहुंच चुका है, जिसके चलते दोपहर के समय शहर की सड़कें और बाजार लगभग सूने नजर आ रहे हैं. एक तरफ मौसम विभाग हीटवेव का अलर्ट जारी कर रहा है तो दूसरी तरफ स्वास्थ्य विभाग भी गर्मी में सेहत ठीक रखने की सलाह दे रहा है.
सड़कों पर आवाजाही कम
आम दिनों में जहां बाजारों और चौक-चौराहों पर चहल-पहल रहती थी, वहीं अब गर्म हवाओं और तेज धूप के कारण सन्नाटा पसरा दिखाई दे रहा है. मौसम विभाग से जारी हीट वेव अलर्ट के बाद लोगों ने एहतियात बरतना शुरू कर दिया है. तेज लू और चिलचिलाती धूप के कारण लोग बेहद जरूरी काम होने पर ही घरों से बाहर निकल रहे हैं. गर्मी का असर छोटे व्यापारियों और दैनिक कामकाज पर भी साफ देखने को मिल रहा है.
सतर्क रहने की अपील
इधर स्वास्थ्य विभाग ने भी लोगों को सतर्क रहने की अपील की है. सिविल अस्पताल मनेन्द्रगढ़ के अधीक्षक डॉ. स्वप्निल तिवारी ने कहा है कि भीषण गर्मी और लू से बचाव के लिए लोग बिना जरूरत घरों से बाहर न निकलें. खासकर बच्चों, बुजुर्गों और पहले से बीमार लोगों को विशेष सावधानी बरतने की जरूरत है.
पर्याप्त मात्रा में पानी पीएं, हल्के और सूती कपड़े पहनें और धूप में निकलते समय सिर ढंककर ही निकलें. शरीर में पानी की कमी से बचने के लिए ORS घोल, नींबू पानी और बाकी तरल पदार्थों का अधिक सेवन करें- डॉक्टर स्वप्निल तिवारी, अधीक्षक, सिविल अस्पताल मनेन्द्रगढ़
ये लक्षण दिखें तो डॉक्टर से करें संपर्क
स्वास्थ्य विभाग ने चेतावनी दी है कि यदि किसी व्यक्ति को चक्कर आना, उल्टी होना, तेज बुखार, अत्यधिक कमजोरी या सांस लेने में परेशानी जैसी समस्या महसूस हो तो तुरंत डॉक्टर से संपर्क करें. लगातार बढ़ती गर्मी ने लोगों की दिनचर्या को भी प्रभावित करना शुरू कर दिया है और आने वाले दिनों में तापमान में और बढ़ोतरी की संभावना जताई जा रही है.",1.0
भीषण गर्मी पर सीएम गंभीर: सरकारी दफ्तर और सार्वजनिक स्थल पर पेयजल व्यवस्था के निर्देश - ETV Bharat,https://news.google.com/rss/articles/CBMi3gFBVV95cUxPS2hRQldTR2FmRXhjLTctVzBJVEZ5Z1JmUFhtekZJcGg5UlRZUDZFRFN2MnhnTjRmenphbVBWV3BGV2RtT0dhWjBUeEFtakdsMG40dHFlOGVKZUU3YXpJd0hfb1VzNUxtX0FpbG96dFRGV3FOM19DTER4NDRkLThFYWl1dkYtaG1jTExCSDRzdXVJMjVpdzc0SHZQaUpuU3BEa0UySlU5ZWRxRkJuV2d4bjc2eUQxNmcwTmk4TktaRFVhYklzWl9mb0RETExKZlcxNmFsaFpMYk12eDF3emfSAeMBQVVfeXFMTWNZOGJsemRqdmVwODZyblUtQjduNkdzX2pRZi02aFR4X3BjU1drNHdrb3pjLXA4aVJ5SWthUm1YVnVGZGVoakdJZVlCdTQ5U1BNdF95UGZhMlNESk12QnU1XzhIZExXNUZNd1VKVHNKWUVrTXdKX0ZnLVlGUDMyNXI1dmJIbWdNX0xBMU5mQzZ5TTE0UlN0VGNxN0FGUFJTdjlZSUNuRGR1blk1MW12Q0gtNE9ucW9uOTUxVnRjSEJyMzBZZkQycHdfT2JvVzIxd3dSWHQ0Z3pGekdlT0NQOXJDUlk?oc=5,ETV Bharat,2026-05-23T16:28:35+05:30,hi,Andaman and Nicobar Islands,,"(लू OR ""लू चलना"" OR ""भीषण गर्मी"" OR ""प्रचंड गर्मी"" OR ""कड़ी धूप"" OR ""तेज धूप"" OR ""गर्म हवा"" OR ""उष्ण लहर"" OR ""ताप लहर"" OR ""हीट वेव"" OR ""झुलसाने वाली गर्मी"" OR ""तपती गर्मी"" OR ""भयंकर गर्मी"" OR ""गर्मी का कहर"" OR ""गर्मी का प्रकोप"" OR ""अत्यधिक गर्मी"" OR मौसम OR ""मौसम अपडेट"" OR ""मौसम का हाल"" OR ""मौसम पूर्वानुमान"" OR ""मौसम अलर्ट"" OR आईएमडी OR ""आईएमडी पूर्वानुमान"" OR ""आईएमडी अलर्ट"" OR ""तापमान में बढ़ोतरी"" OR ""गर्मी से राहत"" OR ""गर्मी से निजात"") Andaman and Nicobar Islands","भीषण गर्मी पर सीएम गंभीर: सरकारी दफ्तर और सार्वजनिक स्थल पर पेयजल व्यवस्था के निर्देश
झारखंड में गर्मी और हीटवेव को लेकर मुख्यमंत्री ने प्रशासनिक अमले को अलर्ट रहने का निर्देश दिया है.
रांचीः झारखंड में लगातार बढ़ रही गर्मी और हीटवेव को लेकर सरकार भी चिंतित नजर आ रही है. इसको लेकर मुख्यमंत्री हेमंत सोरेन ने प्रशासनिक अमले को अलर्ट मोड में रहने का निर्देश दिया है.
मुख्यमंत्री ने राज्य के सभी उपायुक्तों, पुलिस अधीक्षकों, थाना प्रभारियों, सीओ, बीडीओ, पंचायत प्रतिनिधियों और सरकारी कार्यालयों को निर्देश दिया है कि कार्यालयों के बाहर और सार्वजनिक स्थलों पर आम लोगों के लिए पेयजल की समुचित व्यवस्था सुनिश्चित की जाए. साथ ही वहां स्पष्ट सूचना बोर्ड भी लगाए जाएं, ताकि राहगीरों और जरूरतमंद लोगों को राहत मिल सके.
चापाकलों की मरम्मत और वैकल्पिक व्यवस्था पर जोर
मुख्यमंत्री हेमंत सोरेन ने यह भी कहा है कि जिन इलाकों में जल संकट की स्थिति बन रही है, वहां तत्काल टैंकरों के जरिए पानी पहुंचाया जाए. खराब पड़े चापाकलों की मरम्मत कराने और वैकल्पिक जल व्यवस्था करने के भी निर्देश दिए गए हैं. उन्होंने साफ कहा है कि किसी भी गांव, टोला या मोहल्ले में पेयजल की कमी से लोगों को परेशानी नहीं होनी चाहिए.
राहत पहुंचाना पहली प्राथमिकता- सीएम
ग्रामीण इलाकों में हालात और चुनौतीपूर्ण होते जा रहे हैं. कई जगह जलस्तर नीचे जाने से चापाकल जवाब देने लगे हैं. महिलाएं और बच्चे सुबह से ही पानी भरने के लिए लाइन में लग रहे हैं. कुछ इलाकों में बिजली कटौती ने लोगों की परेशानी और बढ़ा दी है. भीषण गर्मी के बीच मुख्यमंत्री हेमंत सोरेन ने प्रशासन को संवेदनशीलता और मानवीय दृष्टिकोण के साथ काम करने का निर्देश देते हुए कहा है कि आम लोगों को राहत पहुंचाना इस समय सबसे बड़ी प्राथमिकता होनी चाहिए.
ये लोग सबसे ज्यादा झेल रहे हैं गर्मी की मार
गर्मी का सबसे ज्यादा असर रोज कमाने-खाने वाले लोगों पर दिखाई दे रहा है. दिहाड़ी मजदूर, रिक्शा चालक, सड़क किनारे काम करने वाले श्रमिक और ट्रैफिक ड्यूटी में तैनात पुलिसकर्मी तेज धूप में काम करने को मजबूर हैं. दोपहर के समय बाजारों और सड़कों पर लोगों की आवाजाही कम हो रही है. अस्पतालों में डिहाइड्रेशन, चक्कर, उल्टी और हीट स्ट्रोक की शिकायत लेकर पहुंचने वाले मरीजों की संख्या भी बढ़ रही है.
झारखंड में प्रचंड गर्मी से लोगों का हाल बेहाल
झारखंड इस समय भीषण गर्मी की मार झेल रहा है. पलामू, गढ़वा, चतरा और कोल्हान क्षेत्र के कई जिलों में तापमान लगातार 40 डिग्री सेल्सियस के ऊपर बना हुआ है. डालटनगंज जैसे इलाकों में पारा 45 डिग्री सेल्सियस को पार चुका है. राजधानी रांची में भी दोपहर के समय तेज धूप और गर्म हवाओं ने लोगों की मुश्किलें बढ़ा दी है.
इसे भी पढ़ें- बढ़ते तापमान को देखते हुए अस्पताल में बनाया गया हीट केयर सेंटर, रोज आ रहे 25 से 30 मरीज
इसे भी पढ़ें- झारखंड में प्रचंड गर्मी से हाल बेहाल, पांच जिलों का पारा 40 डिग्री के पार, डाल्टनगंज सबसे गर्म
इसे भी पढ़ें- झारखंड में गर्मी का प्रचंड असर, डाल्टनगंज का पारा 45 डिग्री के पार, इन इलाकों में राहत के आसार",1.0
"कई राज्यों में भारी बारिश और भीषण गर्मी का अलर्ट, मौसम विभाग ने जारी की सूची | आईएमडी का पूरा बुलेटिन देखने के लिए | Inshorts - Inshorts",https://news.google.com/rss/articles/CBMiuwRBVV95cUxQVl91bVJLSG9acFNFMHJDMWNVcTJnYzZyMjlJVmxBRWFEMk1oTWhsb1ZxNXQ2RDNVVkktOHFXWFRNSF90N0pKRk9IZ2djcXB4SGw0R2Q1Wm5wUHRSOWpwM2hsemFDWVJ6QUVFZk9iRUJ4YXE4eFBzSllPaEtaRTJYMGVsc2VISjVCVlVEaW1tYXZjdXZWY3dMbjN6QkdFS0dXMW9CbENuTnFRR1huZzY0c0tFOUJ6WVA1WUhIYS1yQkJ1SlpRR19YQURoX0pSMWtlU0J4anFtZlA5bkFrZlpWZjVneTQ4SnBJczhYZk5OZmI5Zm8xQm02cUl3RDN4RERudDRCcTBPZ0RPeXBNcV90UHc1c2poZDJZUUNDZ0ZKMmVzMU9YVS1ReHpSMklFNjZmd21ma3RFc1RaSnhmenE1R29aYWJJUS05SXBQWFVPSHdlUllzc3ZsdVhRZW5iOTg0ODZabmlUWjFKVzJiZVhIN1paVHJkQXhJcnVWbHVaT3IyenNMTmlaeXJwd1Z5NE13MUFGamV0LVp1a2JkSlVSWGd0bmIxOVAwVWpuVVdBcTlEWlRySjUzMTV1aU1hRFRpYnVwakZybV9LRUUyaUpQbTdTSWlhdW85T05faHJlYTgxN1QtM0lwOUlEcjdUdm5YRnBlY1B1aE55Qlk0Z05hOVZJUzk5UVhOdGw0ZzJEdFRLX3Vud0pVWEg2c1dLbXRUeXRmOFMxVTVFbml4YkthdWI1RTNubzlxUVNv0gHABEFVX3lxTFBDQ29RaUxXT18tZ3RhV29DZWs2RlJkVDZZQmRkTG1wT1c5TW5JYWktalMtX2xfUExtZ0hQMzJRdHJxZy1SYkNLbGx5Uzd1cnlwcXYxeTRqMGJ5d1VyMF9YSTdsZnFaZDhzNmJjek1ienozYVlfUmtOQ2JSUGx5Vk5UWXREcXprUkN1anBQSVlmYUZjcGk3SmNVbWE0cHZORFUxcHBKZVF2S21yUXM0MVE2c25zbEZ0R2xjNXVKX2l5MFNjSTZFa0M4VFg0Z052S0xmOFI2eXJBMzl1WEt4Ti1sR0Zxdjd6ekJXQ0R6akFCakV4M2tZZXNWalFod19SMGFfR0xBVHJOd0FHOGk4S2tpelBRZ09xZHdXNkhnUUVFazZOM2Y0N1Q5b3BxZnZjN0Qzalp2U3M4QUV5aGJGZzJtTzZwdHptQUluSWZ4bXFYU0FzSkt5NGl4Q2h6cWVoRmowQ0gwUWo0clNwNDlJU0F0WmI3QnFLSU9SSDZDQlVYeXFQODFWUTlscEZSM0hmUVBSdWNCOGs1SjFlbXlsNElIWkU5R1BrYkthNE9WRW53YlFhZHl4OWU4a1lld3FJSUJLbWlaZjJ2djVlYXFidkYwb2NGRXp4Wk5DYXV6UHQwSWdrUTRkXzRQWDFMU213NmhQaEl6cFJJTUJXQnI4S2FLa3JRTXZZQ2l1dDAwM3J5bGlxWkxBUWZtZFNBNjNuZHFuSVlsTVhkZUozQThGSWJOOWZha3REaVRINS0xQzlieA?oc=5,Inshorts,2026-05-23T23:35:42+05:30,hi,Andaman and Nicobar Islands,,"(लू OR ""लू चलना"" OR ""भीषण गर्मी"" OR ""प्रचंड गर्मी"" OR ""कड़ी धूप"" OR ""तेज धूप"" OR ""गर्म हवा"" OR ""उष्ण लहर"" OR ""ताप लहर"" OR ""हीट वेव"" OR ""झुलसाने वाली गर्मी"" OR ""तपती गर्मी"" OR ""भयंकर गर्मी"" OR ""गर्मी का कहर"" OR ""गर्मी का प्रकोप"" OR ""अत्यधिक गर्मी"" OR मौसम OR ""मौसम अपडेट"" OR ""मौसम का हाल"" OR ""मौसम पूर्वानुमान"" OR ""मौसम अलर्ट"" OR आईएमडी OR ""आईएमडी पूर्वानुमान"" OR ""आईएमडी अलर्ट"" OR ""तापमान में बढ़ोतरी"" OR ""गर्मी से राहत"" OR ""गर्मी से निजात"") Andaman and Nicobar Islands","IMD ने रविवार के लिए अरुणाचल प्रदेश, असम, मेघालय, केरल, लक्षद्वीप, नागालैंड, मणिपुर, मिजोरम, त्रिपुरा, कर्नाटक, पश्चिम बंगाल, सिक्किम और तमिलनाडु में भारी से बहुत भारी बारिश का अलर्ट जारी किया है। वहीं, बिहार, छत्तीसगढ़, आंध्र प्रदेश, राजस्थान, झारखंड, ओडिशा, तेलंगाना, मध्यप्रदेश, उत्तर प्रदेश, हरियाणा, चंडीगढ़, दिल्ली, पंजाब और महाराष्ट्र में लू व भीषण गर्मी की चेतावनी दी गई है।",1.0
