title,url,source,date,language,state,district,search_term,full_text,relevance_score
"Extreme Heat Expected, Take Safety Precautions - League City (.gov)",https://news.google.com/rss/articles/CBMiZEFVX3lxTE0xRTJGdVFpejBKYXJPdnVRazdISnpYYmI0bFdCVWdDaS1vQ3F2VDZRRklxLURsZTZmbTNFX2RjaGhSVV9ULXU0LUtJS0FhQ2l4Rm1ORjV5dDlGVDRQeDlac1BXaGE?oc=5,League City (.gov),2026-07-22T01:27:58+05:30,en,Andaman and Nicobar Islands,,"(heatwave OR ""heat wave"" OR ""severe heatwave"" OR ""extreme heat"" OR ""heat spell"" OR ""scorching heat"" OR ""blistering heat"" OR ""sweltering heat"" OR ""hot winds"" OR loo OR ""hot loo winds"" OR ""intense heat"" OR ""unbearable heat"" OR ""deadly heat"" OR heat OR ""weather forecast"" OR ""weather update"" OR ""weather alert"" OR ""IMD forecast"" OR ""IMD prediction"" OR ""IMD alert"" OR IMD OR ""rising temperatures"" OR ""temperatures expected to rise"" OR ""relief from heat"" OR ""respite from heat"" OR ""heat respite"" OR ""respite from scorching heat"") Andaman and Nicobar Islands","With high temperatures expected throughout the week, including an Extreme Heat Warning issued by the National Weather Service for Wednesday, July 22, dangerously hot conditions are forecast for the League City area.
High temperatures are expected to range from 100°F to 104°F, with heat index values reaching 115°F.
Residents are encouraged to take precautions to reduce the risk of heat-related illness, which can develop quickly during periods of extreme heat and high humidity.
Heat Safety Tips
- Drink plenty of water and stay hydrated throughout the day.
- Stay indoors or in air-conditioned spaces whenever possible.
- Limit outdoor activities, especially during the hottest part of the day.
- Ensure pets have access to fresh water and shade, and avoid walking them on hot pavement.
- Check on elderly neighbors, family members, and others who may be more vulnerable to extreme heat.
- Never leave children or pets unattended in a vehicle. Car interiors can reach deadly temperatures within minutes, even with the windows cracked.
- If you must be outdoors, wear lightweight, light-colored clothing, take frequent breaks in the shade, and watch for signs of heat exhaustion or heat stroke.
Stay informed by monitoring local weather forecasts and following guidance from the National Weather Service.",1.0
"Extreme heat could cost Italy over $13B annually, business group warns - Anadolu Ajansı",https://news.google.com/rss/articles/CBMixAFBVV95cUxNem9sUDRKbktTNUU1RDRPc0t2NFNRam4wcmczVnlGZ2hXOUhsSnlzdTBLY0ZabFFJNllKaTFFanVNbWl0eHIwU2pUVDFJbmdLaDlRbEh2ZXRleWM0WklHZzVPLVVLOWhtSUJzam82cDZiN2haX3h1RzVRTXY2MDBya0U1UnhfMkdUSGpKQ1gwX3NVcEtrOUdfTUhTSU5vSmYzZl9BdmU5cFhVNGwwSE5nWGIzWlFlbVlSY0M5ZGdpOVpVc2dK?oc=5,Anadolu Ajansı,2026-07-22T14:24:43+05:30,en,Andaman and Nicobar Islands,,"(heatwave OR ""heat wave"" OR ""severe heatwave"" OR ""extreme heat"" OR ""heat spell"" OR ""scorching heat"" OR ""blistering heat"" OR ""sweltering heat"" OR ""hot winds"" OR loo OR ""hot loo winds"" OR ""intense heat"" OR ""unbearable heat"" OR ""deadly heat"" OR heat OR ""weather forecast"" OR ""weather update"" OR ""weather alert"" OR ""IMD forecast"" OR ""IMD prediction"" OR ""IMD alert"" OR IMD OR ""rising temperatures"" OR ""temperatures expected to rise"" OR ""relief from heat"" OR ""respite from heat"" OR ""heat respite"" OR ""respite from scorching heat"") Andaman and Nicobar Islands","Extreme heat could cost the Italian economy between €6 billion ($7 billion) and €12 billion ($13.8 billion) annually, equivalent to 0.2% to 0.4% of gross domestic product (GDP), the Italian business association Confesercenti warned on Saturday.
The group said increasingly frequent periods of intense heat are driving up energy costs, reducing productivity, forcing businesses to make additional investments and cutting turnover in sectors most exposed to high temperatures, Italian news agency ANSA reported.
""Living with 30 to 60 days of intense heat every year can weigh on the Italian economy by between €6 billion and €12 billion,"" Confesercenti said.
The estimate includes the combined impact of higher energy consumption, lower labor productivity, compulsory investments to adapt to rising temperatures and weaker consumer spending.
Confesercenti President Nico Gronchi described extreme heat as ""a real climate tax"" that has become a structural economic factor.
""It affects investments, productivity, spending and consumer habits, including tourism,"" Gronchi said.
He warned that the economic impact of rising temperatures could not be addressed solely by individual households and businesses.
""It is a challenge that cannot be overcome by leaving the problem to the initiative of individual families and businesses. Structural interventions are needed,"" he said.",0.8500000000000001
6 killed as wildfires sweep Algeria amid heat wave - Xinhua,https://news.google.com/rss/articles/CBMifEFVX3lxTE10M0RlbU12RVQ2UnVoSGZaSkFYWTBCUWQ0cG84UTBmOHdUU21XYzg1a0l3WUF3S3BaZmZsYlUxX21yYlNlakVNWjBtSXpqX1BWVGVLOGFIdTQzc200bmpmMVJ4Z0F3eGhBSTAzb20xd2g0NWFxblI5TWdxdlc?oc=5,Xinhua,2026-07-22T02:46:00+05:30,en,Andaman and Nicobar Islands,,"(heatwave OR ""heat wave"" OR ""severe heatwave"" OR ""extreme heat"" OR ""heat spell"" OR ""scorching heat"" OR ""blistering heat"" OR ""sweltering heat"" OR ""hot winds"" OR loo OR ""hot loo winds"" OR ""intense heat"" OR ""unbearable heat"" OR ""deadly heat"" OR heat OR ""weather forecast"" OR ""weather update"" OR ""weather alert"" OR ""IMD forecast"" OR ""IMD prediction"" OR ""IMD alert"" OR IMD OR ""rising temperatures"" OR ""temperatures expected to rise"" OR ""relief from heat"" OR ""respite from heat"" OR ""heat respite"" OR ""respite from scorching heat"") Andaman and Nicobar Islands","A firefighter works to put out a wildfire on a mountain in El Hachimia, northern Algeria, on July 21, 2026. Six people have been killed in wildfires sweeping across northern Algeria as a prolonged heat wave continues to fuel forest and vegetation fires in several provinces, the Algerian Ministry of the Interior, Local Authorities and Transports said Tuesday. (Photo by Billel Bensalem/Xinhua)
ALGIERS, July 21 (Xinhua) -- Six people have been killed in wildfires sweeping across northern Algeria as a prolonged heat wave continues to fuel forest and vegetation fires in several provinces, the Algerian Ministry of the Interior, Local Authorities and Transports said Tuesday.
Nassim Bernaoui, spokesperson for Algeria's Civil Protection Department, said 1,460 wildfires have been recorded nationwide since the beginning of July.
Speaking to state radio, Bernaoui said Civil Protection teams have contained between 85 and 90 percent of the blazes through operations conducted in coordination with the army, the General Directorate of Forests, local authorities, other relevant institutions, and volunteers.
Firefighting efforts are continuing to extinguish the remaining fires and prevent them from spreading in the provinces of Annaba, Bejaia, Guelma, El Tarf, Khenchela, Mila, Bouira, Medea and Mascara, he said.
Bernaoui said Algeria has recorded a total of 3,719 wildfires since the beginning of May, compared with 1,501 during the same period last year.
According to the General Directorate of Forests, the fires have destroyed more than 1,666 hectares of vegetation, up from 467 hectares burned during the same period in 2025. ■
Firefighters work against a wildfire on a mountain in El Hachimia, northern Algeria, on July 21, 2026. Six people have been killed in wildfires sweeping across northern Algeria as a prolonged heat wave continues to fuel forest and vegetation fires in several provinces, the Algerian Ministry of the Interior, Local Authorities and Transports said Tuesday. (Photo by Billel Bensalem/Xinhua)
Firefighters work against a wildfire on a mountain in El Hachimia, northern Algeria, on July 21, 2026. Six people have been killed in wildfires sweeping across northern Algeria as a prolonged heat wave continues to fuel forest and vegetation fires in several provinces, the Algerian Ministry of the Interior, Local Authorities and Transports said Tuesday. (Photo by Billel Bensalem/Xinhua)",1.0
Heat wave ends but drought risk climbs quickly - MPR News,https://news.google.com/rss/articles/CBMijAFBVV95cUxQdkpZRVAwNTZCQjdGTkhpc0hSbnpEZnliMHhJOVFnc2JkUWtoRk1jSlpwSDA3WWlib2MxbWpWQ0RRY2UyRzZQbG5GUFhvQjMxUDlFcDVtdm5aRDhjbXdZdnVMZU1nOXpiUFRiM0xPeGxZLWZzOWwzZld1SkRxcGRtNGhxTWt6RmF3MENNRg?oc=5,MPR News,2026-07-22T02:50:00+05:30,en,Andaman and Nicobar Islands,,"(heatwave OR ""heat wave"" OR ""severe heatwave"" OR ""extreme heat"" OR ""heat spell"" OR ""scorching heat"" OR ""blistering heat"" OR ""sweltering heat"" OR ""hot winds"" OR loo OR ""hot loo winds"" OR ""intense heat"" OR ""unbearable heat"" OR ""deadly heat"" OR heat OR ""weather forecast"" OR ""weather update"" OR ""weather alert"" OR ""IMD forecast"" OR ""IMD prediction"" OR ""IMD alert"" OR IMD OR ""rising temperatures"" OR ""temperatures expected to rise"" OR ""relief from heat"" OR ""respite from heat"" OR ""heat respite"" OR ""respite from scorching heat"") Andaman and Nicobar Islands","Create an account or log in to save stories.
Thanks for liking this story! We have added it to a list of your favorite stories.
Create an account or log in to save stories.
Thanks for liking this story! We have added it to a list of your favorite stories.",1.0
How extreme heat is changing life across the South - The Augusta Chronicle,https://news.google.com/rss/articles/CBMiygFBVV95cUxQOERkSjg4ZWFQRE1qb0JzbDRoTXRVUlp0S0VQeHBOdUY1NnBzU1M5OHpCNzFlNkd6YVlaYVFBNWl6Nzl3bjNhd1pyVkQ5SDJvSlFpeEtXR3R3b1V2NnpidkFQbkdfdHFtVTA4RHB3WTJRYTNscVVfT2U4eVBvNmRvQmg3THc4MVdLRHI1bG1Vb2pRd1hSTE1YZHN2VUdLNGZjdWJjQllMNl9QajJwRWZid3ZhRWtSR25mdm40OWE4TWV6RzRIcjRwdzVB?oc=5,The Augusta Chronicle,2026-07-22T13:36:00+05:30,en,Andaman and Nicobar Islands,,"(heatwave OR ""heat wave"" OR ""severe heatwave"" OR ""extreme heat"" OR ""heat spell"" OR ""scorching heat"" OR ""blistering heat"" OR ""sweltering heat"" OR ""hot winds"" OR loo OR ""hot loo winds"" OR ""intense heat"" OR ""unbearable heat"" OR ""deadly heat"" OR heat OR ""weather forecast"" OR ""weather update"" OR ""weather alert"" OR ""IMD forecast"" OR ""IMD prediction"" OR ""IMD alert"" OR IMD OR ""rising temperatures"" OR ""temperatures expected to rise"" OR ""relief from heat"" OR ""respite from heat"" OR ""heat respite"" OR ""respite from scorching heat"") Andaman and Nicobar Islands","How extreme heat is changing life across the South
From higher utility bills to changes in work schedules and outdoor activities, extreme heat is affecting daily life across the South. Experts say the impacts are expected to grow as heat waves become more frequent, longer and more intense. Here's what extreme heat means, how it's affecting communities and steps people can take to stay safe.
What counts as extreme heat?
Extreme heat is generally defined as a period of unusually high temperatures and humidity lasting at least two to three days, with temperatures above 90 degrees.
According to Ready.gov, prolonged periods of extreme heat can affect daily routines and increase health risks. The Centers for Disease Control and Prevention warns that heat-related illnesses can become serious and that extreme heat is expected to become more common as the climate changes.
How extreme heat is affecting daily life
Many people are adjusting when and how they spend time outdoors to avoid the hottest parts of the day.
Common changes include:
- Moving outdoor work, exercise and errands to the early morning or evening hours.
- Spending less time walking, biking or using public transportation.
- Driving more often to reduce time in direct sunlight.
- Using more electricity and water to keep homes cool.
Ready.gov notes that prolonged periods of heat can influence everyday habits and routines, particularly during the summer months.
The impact on infrastructure, agriculture and schools
Extreme heat can affect roads, utilities, farms and school activities.
According to Ready.gov and other public sources:
- High temperatures can damage infrastructure, including roads and highways.
- Increased electricity use during heat waves can place additional strain on power grids.
- Heat stress can affect agricultural production by increasing irrigation needs and contributing to crop losses.
- Dairy cows can produce less milk during prolonged periods of extreme heat.
- Concrete and asphalt absorb heat during the day and release it at night, contributing to hotter urban areas.
- Some cities are expanding tree-planting initiatives to help reduce heat buildup in neighborhoods.
- Schools and athletic programs may adjust outdoor activities and practice schedules to avoid the hottest parts of the day.
How to stay safe during extreme heat
Ready.gov recommends taking the following precautions during periods of extreme heat:
- Never leave people or pets in a parked vehicle.
- Stay in air-conditioned spaces when possible or locate a cooling center.
- Drink plenty of water and other fluids to stay hydrated.
- Wear loose-fitting, lightweight and light-colored clothing.
- Avoid strenuous outdoor activities during the hottest part of the day.
- Seek shade when outdoors and wear a wide-brimmed hat.
- Take cool showers or baths.
- Use ovens and other heat-producing appliances less when possible.
- Check on older adults, family members and neighbors.
- Watch for signs of heat cramps, heat exhaustion and heat stroke.
- Make sure pets have access to shade and fresh water. Hot pavement can burn their paws.
As temperatures continue to rise during the summer months, officials encourage people to monitor local weather forecasts and take precautions to reduce the risk of heat-related illness.
This reporting content is supported by a partnership with Journalism Funding Partners.
Erica Van Buren is the climate change reporter for The Augusta Chronicle, part of the USA TODAY Network. Connect with her atEVanBuren@usatodayco.com or on X: @EricaVanBuren32.
This story was created with the assistance of Artificial Intelligence (AI). Journalists were involved in every step of the information-gathering, reporting, editing and publishing process. Learn more.",1.0
Extreme heat during pregnancy raises risk to newborns in India: Study | 'Heat isn't a background condition in pregnancy' | Inshorts - Inshorts,https://news.google.com/rss/articles/CBMisgFBVV95cUxNUVFueUhxZmZObHBuckFoMExlc0VDZVdpT3NYRmFQZkR5QnFTbFdPVlF6clBPOUdSeHZaOUhRYjF2c3JiOGNuOHM2U2k5dVBxaHR2bVFBOWVNbDcyTjExanYtdzdEX2kzWWlzWFZFR0JRcEZFdTFqZ1V4cmdab3dERkdCM3ZoUkJrX0lESlhHU3dfQjVWR1F2dzFjdjBxSDVLN29yeTBZRTREX0JTY2hTYU9n0gG3AUFVX3lxTE1MWmRCR0dTUjJkN2tyalIySlBlOWpSN1habHI4VUZLVm5QbFFLS3lGWTRUdGZYWXQ2RUxGRHR6bUNOaENWa0o2T3BIclZ4Rlg2LUlyc0d1RExVTGFHVkJselhWb09fZVduaE0zVEw2Slp2UXpkYnZwdGpVX0JkWmpTZndHVU9kZGN0ajJsVXQ1WmwxeV9QX1Qxd1RaZ29nRkw4TlhMa2p1WElJTnZ2MlJEaFBGSF9tRQ?oc=5,Inshorts,2026-07-22T10:33:45+05:30,en,Andaman and Nicobar Islands,,"(heatwave OR ""heat wave"" OR ""severe heatwave"" OR ""extreme heat"" OR ""heat spell"" OR ""scorching heat"" OR ""blistering heat"" OR ""sweltering heat"" OR ""hot winds"" OR loo OR ""hot loo winds"" OR ""intense heat"" OR ""unbearable heat"" OR ""deadly heat"" OR heat OR ""weather forecast"" OR ""weather update"" OR ""weather alert"" OR ""IMD forecast"" OR ""IMD prediction"" OR ""IMD alert"" OR IMD OR ""rising temperatures"" OR ""temperatures expected to rise"" OR ""relief from heat"" OR ""respite from heat"" OR ""heat respite"" OR ""respite from scorching heat"") Andaman and Nicobar Islands","Sustained spells of extreme heat are associated with an increased risk of low birth weight, pre-term birth and stillbirth, with the impact depending on when during pregnancy the heat occurred, according to a new study. Researchers analysed 2,09,266 births recorded in India's National Family Health Survey between 2015 and 2020. The study was published in Environmental Research Communications.",0.6833333333333333
Yellow heatwave alert continues across the French Riviera and Var - Riviera Radio,https://news.google.com/rss/articles/CBMisgFBVV95cUxQV2MzdjZ0X1Q2dXJUWjVYd2QxcHdyRi1VbXpzMXlRU1B3Z2JwYnBIXy1Oc2xtcUpFbzBYU3k5eVFwMEFHcUVBTUhaZUk3NHJXd2FGemwwaGdzOFZPN1AtUmUzWGxvSXlEMUN0ODVXcEhkMkpPdVA1MGttVDBrRXJUVUFnMGdVd1NqOXZkcFZrUDdnZ0tZTW5tU2RiYm5sTmZjNXdIVmVucnhKMlQyY0JGalZB?oc=5,Riviera Radio,2026-07-22T11:51:20+05:30,en,Andaman and Nicobar Islands,,"(heatwave OR ""heat wave"" OR ""severe heatwave"" OR ""extreme heat"" OR ""heat spell"" OR ""scorching heat"" OR ""blistering heat"" OR ""sweltering heat"" OR ""hot winds"" OR loo OR ""hot loo winds"" OR ""intense heat"" OR ""unbearable heat"" OR ""deadly heat"" OR heat OR ""weather forecast"" OR ""weather update"" OR ""weather alert"" OR ""IMD forecast"" OR ""IMD prediction"" OR ""IMD alert"" OR IMD OR ""rising temperatures"" OR ""temperatures expected to rise"" OR ""relief from heat"" OR ""respite from heat"" OR ""heat respite"" OR ""respite from scorching heat"") Andaman and Nicobar Islands","Yellow heatwave alert continues across the French Riviera and Var
The Alpes-Maritimes and Var remain under a yellow heatwave alert, with temperatures climbing to 36°C inland and the hot, dry conditions continuing to increase the risk of wildfires.
The Alpes-Maritimes and Var remain under a yellow heatwave alert on Wednesday 22 July, with high temperatures expected to persist across much of the region.
Listen to this article
According to Météo-France, the alert is in place until at least midnight and could be extended into Thursday if the hot weather continues.
Overnight temperatures remained particularly high, especially along the French Riviera, where they stayed above 25°C in many coastal areas.
The hottest conditions are forecast inland, with temperatures reaching 36°C in Barjols and 35°C in Brignoles.
Along the coast, highs of 33°C are expected in Antibes, 32°C in Menton, Saint-Tropez and Fréjus, while Nice and Toulon should reach around 30°C.
Sunny skies will dominate throughout the day, with only a slight chance of isolated showers around Tende during the afternoon.
The persistent heat continues to create difficult conditions for firefighters in the Var, where crews are tackling several wildfires after a series of blazes broke out across the department in recent days.",0.6833333333333333
Over 260 rushed to hospitals in Tokyo as heat wave persists - Japan Wire by Kyodo News,https://news.google.com/rss/articles/CBMiWkFVX3lxTFBjMlQzaVJIUkRyT1gxUkVFc2dyc2tYQU1NbTFaUnVKMkJHVHlib0FtQjAwU3RuUGUxYkZKNUU2T3dNalUyYUlKRGxPY3NHdGJaeWZLMGNralpuZw?oc=5,Japan Wire by Kyodo News,2026-07-22T14:00:00+05:30,en,Andaman and Nicobar Islands,,"(heatwave OR ""heat wave"" OR ""severe heatwave"" OR ""extreme heat"" OR ""heat spell"" OR ""scorching heat"" OR ""blistering heat"" OR ""sweltering heat"" OR ""hot winds"" OR loo OR ""hot loo winds"" OR ""intense heat"" OR ""unbearable heat"" OR ""deadly heat"" OR heat OR ""weather forecast"" OR ""weather update"" OR ""weather alert"" OR ""IMD forecast"" OR ""IMD prediction"" OR ""IMD alert"" OR IMD OR ""rising temperatures"" OR ""temperatures expected to rise"" OR ""relief from heat"" OR ""respite from heat"" OR ""heat respite"" OR ""respite from scorching heat"") Andaman and Nicobar Islands","TOKYO - A provisional total of 261 people were taken to hospital for suspected heat stroke on Tuesday, according to the Tokyo Fire Department, as a heat wave persisted across the nation.
The figure reflected the daily total as of 9 p.m. but was already the highest for a single day since comparable data became available in 2022, the fire department said Wednesday.
The number of emergency dispatches also reached a record high on Tuesday with a preliminary total of 3,454, the highest since figures were first compiled in 1963.
The number of people reporting heat exhaustion symptoms including fever and headaches also began rising sharply last weekend due to higher temperatures, the department said.
Among the 261 heat stroke emergencies, people in their 80s accounted for the largest portion at 55, followed by those in their 70s, at 53, and those in their 50s, at 27.
According to the Japan Meteorological Agency, the temperature rose to 36.4 C on Tuesday in central Tokyo.
The heat also apparently proved fatal on Tuesday, with an 84-year-old man in the eastern Japan city of Otawara in Tochigi Prefecture dying of suspected heat stroke.
According to the local fire department, the man was found collapsed inside a plastic greenhouse at around 2:15 p.m. Tuesday by his son and later pronounced dead at a hospital.
Wednesday marked the second consecutive day that temperatures reached 40 C or higher in parts of the country, as a high-pressure system continued to cover much of the Japanese archipelago
The heat also hit sports, with a minor league baseball game starting at noon in Saitama, near Tokyo, called off due to extreme heat.
The farm-team game between the Lotte Marines and the Orix Buffaloes was halted and declared a no-game in the middle of the fourth inning, the Marines said.
The weather agency continued urging the public to take measures against heat-related illness.",1.0
Orange warning for extreme heat in effect from noon today - Philenews,https://news.google.com/rss/articles/CBMikwFBVV95cUxPVUw0ZzdPeVBhSUVCeTc2eHFMOHJjNlRRU0wxMW5iRVpCWVhTbktaR0JEUmpzaGVUYjJIU1RoYnFrVmE5b3JXYjlZSC1ZeUVoLVl6UGx6ZFdnSHpPOHpvR1JfSm5fNGpFN2M4TGJQbXQyTDF6MUJCVGNkaEUwaWlWVGYta1R3Y3ZiYVhOOEV6SElqSjQ?oc=5,Philenews,2026-07-22T12:03:17+05:30,en,Andaman and Nicobar Islands,,"(heatwave OR ""heat wave"" OR ""severe heatwave"" OR ""extreme heat"" OR ""heat spell"" OR ""scorching heat"" OR ""blistering heat"" OR ""sweltering heat"" OR ""hot winds"" OR loo OR ""hot loo winds"" OR ""intense heat"" OR ""unbearable heat"" OR ""deadly heat"" OR heat OR ""weather forecast"" OR ""weather update"" OR ""weather alert"" OR ""IMD forecast"" OR ""IMD prediction"" OR ""IMD alert"" OR IMD OR ""rising temperatures"" OR ""temperatures expected to rise"" OR ""relief from heat"" OR ""respite from heat"" OR ""heat respite"" OR ""respite from scorching heat"") Andaman and Nicobar Islands","Seasonal low pressure is affecting the area, and the weather today will be particularly hot. From 12:00, an orange warning for extremely high temperatures will come into effect, lasting until 17:00.
According to the Department of Meteorology’s forecast, today, after local fog and low cloud clear, the weather will become mostly clear.
Winds will blow mainly south-westerly to north-westerly, light to moderate, 3 to 4 Beaufort, locally reaching strong, 4 to 5 Beaufort, in the afternoon. The sea will be slight to moderate.
Temperatures will rise to 43 degrees inland, 33 on the western coast, around 36 on the rest of the coast, and 32 degrees in the higher mountain areas.
On Thursday, the weather will be mostly clear. On Friday and Saturday, the weather will remain mostly clear, though locally increased cloud will appear at times.
Temperatures on Thursday are not expected to show any notable change, while on Friday and Saturday they will gradually and noticeably drop, settling close to average climatic values.
Read more:",0.6833333333333333
