title,url,source,date,language,state,district,search_term,full_text,relevance_score
Plastic Note: क्या तेज धूप या जेब की गर्मी से पिघल जाते हैं प्लास्टिक के नोट? जानिए क्या है सच - ABP News,https://news.google.com/rss/articles/CBMiygFBVV95cUxOTkduQzhOV2F4N0k1V2hPazRTSExSbWI3TUhTUEtBLVI1ZTh1ZVRMMVB6bGtVOFRRLUZUTnJ4N2RNa2dBTU5jOVNrSHU3ZHhNaVJ6bld1UVFtS3JHcTZfaXhBYnpKaGNJZ1lHN2FsN0wyN2F0d0YySG5tVE9iaWtkR0tjUXBuQ1N0RlRSQUxkRW9vRkg2VUlIb3lkSDZQdGdfYzl0YXQ2VUNNWC05UW9KUnRyTTNYLTF4UWUwVmxzRkh2WFh3Q3JwVmdn0gHPAUFVX3lxTE5WQ0V1cUw0cFA1em1nTUY1T0ZhSHhGT1NJb01vY001WlQyX1BQVm1JQU1kaEZ4dDJYc0o1U29YRWNDaVRudmE2UnJJWVBMd2VBSm82ZVp2RlBTdm5Pd1V0cENlSVpQNlpkaHNpYnlYRW1TbUtXT0VJd0Q3V3dmOFh5cGJQRUhwY1JFWTJLV1lPNnRsaFVjcHhsUmZ4akhuRzlOVy1mM2s0elg5ZHNUTUh3bk5naGtXdllZTnZFYV82SGstUkp4NmNfZDA0SHJUbw?oc=5,ABP News,2026-07-22T09:53:09+05:30,hi,Andaman and Nicobar Islands,,"(लू OR ""लू चलना"" OR ""भीषण गर्मी"" OR ""प्रचंड गर्मी"" OR ""कड़ी धूप"" OR ""तेज धूप"" OR ""गर्म हवा"" OR ""उष्ण लहर"" OR ""ताप लहर"" OR ""हीट वेव"" OR ""झुलसाने वाली गर्मी"" OR ""तपती गर्मी"" OR ""भयंकर गर्मी"" OR ""गर्मी का कहर"" OR ""गर्मी का प्रकोप"" OR ""अत्यधिक गर्मी"" OR मौसम OR ""मौसम अपडेट"" OR ""मौसम का हाल"" OR ""मौसम पूर्वानुमान"" OR ""मौसम अलर्ट"" OR आईएमडी OR ""आईएमडी पूर्वानुमान"" OR ""आईएमडी अलर्ट"" OR ""तापमान में बढ़ोतरी"" OR ""गर्मी से राहत"" OR ""गर्मी से निजात"") Andaman and Nicobar Islands","Plastic Note: क्या तेज धूप या जेब की गर्मी से पिघल जाते हैं प्लास्टिक के नोट? जानिए क्या है सच
Plastic Note: अब जल्द ही प्लास्टिक के नोट आने वाले हैं. लेकिन अब सवाल ये है कि क्या प्लास्टिक यानी पॉलिमर के नोट तेज धूप या जेब की गर्मी से नहीं पिघल जाएंगे? यहां से आप इस सवाल का जवाब ले सकते हैं.
Plastic Note: ऑस्ट्रेलिया समेत कई देशों में प्लास्टिक यानी पॉलिमर के नोट चलन में हैं. हाल ही में भारत में भी प्लास्टिक नोटों को लेकर चर्चा तेज हुई है. ऐसे में कई लोगों के मन में सवाल है कि अगर ये नोट प्लास्टिक के बने होते हैं तो क्या तेज धूप, गर्मी या जेब में रखने से ये पिघल सकते हैं? आइए जानते हैं इसका जवाब.
पिघल जाते हैं प्लास्टिक के नोट?
नहीं, प्लास्टिक के नोट गर्मी या धूप में नहीं पिघलते हैं. ये खास तरह के पॉलिमर से बनाए जाते हैं, जो आम प्लास्टिक से काफी अलग और ज्यादा मजबूत होता है. इसे इस तरह डिजाइन किया जाता है कि ये रोज के इस्तेमाल, नमी, बारिश और गर्म मौसम को आसानी से झेल सके.
जेब की गर्मी से होगा नुकसान?
कई लोग सोचते हैं कि अगर प्लास्टिक का नोट लंबे समय तक जेब में रखा जाए तो शरीर की गर्मी से खराब हो सकता है. लेकिन ऐसा नहीं होता. इंसान के शरीर का तापमान करीब 37 डिग्री सेल्सियस होता है, जबकि पॉलिमर नोट इससे कहीं ज्यादा तापमान सह सकता रखते हैं. इसलिए जेब, पर्स या बैग में रखने से इन्हें कोई नुकसान नहीं होता है.
कितनी गर्मी तक सुरक्षित रहते हैं?
पॉलिमर नोट मौसम और तेज धूप में भी सुरक्षित रहते हैं. हालांकि, अगर इन्हें बहुत अधिक तापमान वाली जगह, जैसे जलती आग, गैस स्टोव, इस्त्री या किसी औद्योगिक हीट सोर्स के संपर्क में रखा जाए, तब ये खराब हो सकते हैं. यानी रोज की गर्मी से इन्हें कोई खतरा नहीं होता है.
कागज के नोटों से ज्यादा टिकाऊ
पॉलिमर नोटों का सबसे बड़ा फायदा यही है कि ये कागज के नोटों की तुलना में ज्यादा मजबूत होते हैं. ये जल्दी फटते नहीं हैं, पानी से खराब नहीं होते और इनकी उम्र भी अधिक होती है. यही वजह है कि कई देशों ने इन्हें अपनाया है.
नकली नोट रोकने में भी मदद
प्लास्टिक के नोटों में पारदर्शी विंडो, खास सुरक्षा फीचर और आधुनिक प्रिंटिंग तकनीक का इस्तेमाल किया जाता है. इससे नकली नोट बनाना काफी मुश्किल हो जाता है. यही कारण है कि कई केंद्रीय बैंक इन्हें अधिक सुरक्षित मानते हैं.
क्या है स्थिति?
फिलहाल भारत में बड़े पैमाने पर प्लास्टिक नोट जारी नहीं किए गए हैं. हालांकि, समय-समय पर इन्हें लेकर चर्चा होती रही है. अगर भविष्य में भारतीय रिजर्व बैंक पॉलिमर नोट लाने का फैसला करता है, तो वे भी सामान्य गर्मी और धूप में सुरक्षित रहेंगे. अगर भविष्य में भारत में प्लास्टिक के नोट आते हैं, तो तेज धूप, जेब की गर्मी या गर्म मौसम से घबराने की जरूरत नहीं होगी.",1.0
"दिल्ली-एनसीआर में मौसम हुआ सुहाना, हल्की बारिश और तेज हवाओं के चलते गर्मी से राहत - bhaskarhindi.com",https://news.google.com/rss/articles/CBMixwFBVV95cUxQdDZsZGNXckU3d0liQ1owalhnT25LRWxIZDdiWXZFV24xZUtkT0plUWxLWkFxYzBKNmJFOFZ5eHdsVHdXQkZGOFExVXpzWjA1UzZTNElwVElvRjdOWkEwN2JCQVM3UnhMdXBKSkdCV3VtSHRQWWRtU1VUVkx3U1BnSThxcVRKU2FiUEJvLS01QTFtUmhETmJsbDlQdW1fQkxIN0F2UWZuQTJhSTU3TjltanUtX2UyUnJ5Yk5xSzVzLWEtMURhVk93?oc=5,bhaskarhindi.com,2026-07-22T09:32:23+05:30,hi,Andaman and Nicobar Islands,,"(लू OR ""लू चलना"" OR ""भीषण गर्मी"" OR ""प्रचंड गर्मी"" OR ""कड़ी धूप"" OR ""तेज धूप"" OR ""गर्म हवा"" OR ""उष्ण लहर"" OR ""ताप लहर"" OR ""हीट वेव"" OR ""झुलसाने वाली गर्मी"" OR ""तपती गर्मी"" OR ""भयंकर गर्मी"" OR ""गर्मी का कहर"" OR ""गर्मी का प्रकोप"" OR ""अत्यधिक गर्मी"" OR मौसम OR ""मौसम अपडेट"" OR ""मौसम का हाल"" OR ""मौसम पूर्वानुमान"" OR ""मौसम अलर्ट"" OR आईएमडी OR ""आईएमडी पूर्वानुमान"" OR ""आईएमडी अलर्ट"" OR ""तापमान में बढ़ोतरी"" OR ""गर्मी से राहत"" OR ""गर्मी से निजात"") Andaman and Nicobar Islands","दिल्ली-एनसीआर में मौसम हुआ सुहाना, हल्की बारिश और तेज हवाओं के चलते गर्मी से राहत
By - |22 July 2026 9:32 AM IST
दिल्ली समेत पूरे राष्ट्रीय राजधानी क्षेत्र (एनसीआर) में मौसम ने एक बार फिर करवट ले ली है। बीते 24 घंटों के दौरान आसमान पर काले घने बादलों का डेरा, कई इलाकों में हल्की बारिश और तेज हवाओं के चलते लोगों को उमस और भीषण गर्मी से बड़ी राहत मिली है।
नोएडा, 22 जुलाई (आईएएनएस)। दिल्ली समेत पूरे राष्ट्रीय राजधानी क्षेत्र (एनसीआर) में मौसम ने एक बार फिर करवट ले ली है। बीते 24 घंटों के दौरान आसमान पर काले घने बादलों का डेरा, कई इलाकों में हल्की बारिश और तेज हवाओं के चलते लोगों को उमस और भीषण गर्मी से बड़ी राहत मिली है।
पिछले कई दिनों से लगातार पड़ रही तेज धूप और गर्म हवाओं के बाद मौसम में आए इस बदलाव ने लोगों को राहत की सांस लेने का मौका दिया है। हालांकि, जिस तेज और भारी बारिश का इंतजार पूरा एनसीआर कर रहा था, फिलहाल उसकी संभावना कम नजर आ रही है।
भारतीय मौसम विभाग (आईएमडी) के ताजा पूर्वानुमान के अनुसार आने वाले पूरे सप्ताह तक मौसम का मिजाज लगभग ऐसा ही बना रहेगा। आसमान में बादल छाए रहेंगे और बीच-बीच में हल्की बारिश या बूंदाबांदी देखने को मिल सकती है। अच्छी बात यह है कि अगले सात दिनों के लिए किसी भी प्रकार की मौसम संबंधी चेतावनी जारी नहीं की गई है।
22 जुलाई को अधिकतम तापमान 32 डिग्री सेल्सियस और न्यूनतम 25 डिग्री सेल्सियस रहने का अनुमान है। इस दिन मध्यम बारिश के साथ सामान्यतः बादल छाए रहने की संभावना जताई गई है। 23 जुलाई को अधिकतम तापमान 33 डिग्री और न्यूनतम 24 डिग्री सेल्सियस रहने का अनुमान है। मौसम विभाग के अनुसार सामान्यतः बादल छाए रहेंगे और हल्की बारिश हो सकती है।
24 जुलाई को भी मौसम में कोई बड़ा बदलाव नहीं होगा। अधिकतम तापमान 33 डिग्री और न्यूनतम 25 डिग्री सेल्सियस रहने की संभावना है। पूरे दिन सामान्यतः बादल छाए रहेंगे तथा हल्की बारिश या बूंदाबांदी देखने को मिल सकती है। इसके बाद 25 जुलाई को अधिकतम तापमान 33 डिग्री और न्यूनतम 26 डिग्री सेल्सियस रहने की संभावना है।
मौसम विभाग ने केवल सामान्यतः बादल छाए रहने का पूर्वानुमान जारी किया है। 26 जुलाई को अधिकतम तापमान 34 डिग्री और न्यूनतम 26 डिग्री सेल्सियस रहने का अनुमान है। मौसम सामान्यतः बादलों से घिरा रहेगा तथा आर्द्रता 80 प्रतिशत से 70 प्रतिशत के बीच बनी रहेगी। 27 जुलाई को भी अधिकतम तापमान 34 डिग्री और न्यूनतम 25 डिग्री सेल्सियस रहने की संभावना है। पूरे दिन बादलों की आवाजाही बनी रहेगी और आर्द्रता 80 प्रतिशत से 70 प्रतिशत के बीच रहने का अनुमान है।
मौसम विशेषज्ञों का कहना है कि बादलों की मौजूदगी और बीच-बीच में होने वाली हल्की बारिश के कारण फिलहाल भीषण गर्मी से राहत बनी रहेगी। हालांकि, भारी और लगातार बारिश की संभावना फिलहाल कम दिखाई दे रही है। ऐसे में लोगों को उमस से आंशिक राहत तो मिलेगी, लेकिन मौसम में लगातार बदलाव बना रहेगा।
अस्वीकरण: यह न्यूज़ ऑटो फ़ीड्स द्वारा स्वतः प्रकाशित हुई खबर है। इस न्यूज़ में BhaskarHindi.com टीम के द्वारा किसी भी तरह का कोई बदलाव या परिवर्तन (एडिटिंग) नहीं किया गया है| इस न्यूज की एवं न्यूज में उपयोग में ली गई सामग्रियों की सम्पूर्ण जवाबदारी केवल और केवल न्यूज़ एजेंसी की है एवं इस न्यूज में दी गई जानकारी का उपयोग करने से पहले संबंधित क्षेत्र के विशेषज्ञों (वकील / इंजीनियर / ज्योतिष / वास्तुशास्त्री / डॉक्टर / न्यूज़ एजेंसी / अन्य विषय एक्सपर्ट) की सलाह जरूर लें। अतः संबंधित खबर एवं उपयोग में लिए गए टेक्स्ट मैटर, फोटो, विडियो एवं ऑडिओ को लेकर BhaskarHindi.com न्यूज पोर्टल की कोई भी जिम्मेदारी नहीं है|",1.0
"22 जुलाई के लिए मौसम का पूर्वानुमान: मध्य वियतनाम में भीषण गर्मी, उत्तरी वियतनाम में दोपहर और शाम के बाद गरज के साथ बारिश। - Vietnam.vn",https://news.google.com/rss/articles/CBMipgFBVV95cUxNdTVpOWIwSUdwNFhCdXVJWHBqblcxT3hlM09Zd1V0c3FLQ1NkMm4yTEoxOHBrYVNsOE9wVXFkbEF6Tm0wYzRiUW0ya29xMFFSa1RzME10OFlPZmQzZFdaV2JSVzQ5TXpkQmhQaXdOaEVjdDUxb0N2UjBIWVB1RWNjWk85Y09hQVVORUViSHIwcVUtQ3ZEc2dMNHEwR1RtX2JqOU5JYzZn?oc=5,Vietnam.vn,2026-07-22T06:00:05+05:30,hi,Andaman and Nicobar Islands,,"(लू OR ""लू चलना"" OR ""भीषण गर्मी"" OR ""प्रचंड गर्मी"" OR ""कड़ी धूप"" OR ""तेज धूप"" OR ""गर्म हवा"" OR ""उष्ण लहर"" OR ""ताप लहर"" OR ""हीट वेव"" OR ""झुलसाने वाली गर्मी"" OR ""तपती गर्मी"" OR ""भयंकर गर्मी"" OR ""गर्मी का कहर"" OR ""गर्मी का प्रकोप"" OR ""अत्यधिक गर्मी"" OR मौसम OR ""मौसम अपडेट"" OR ""मौसम का हाल"" OR ""मौसम पूर्वानुमान"" OR ""मौसम अलर्ट"" OR आईएमडी OR ""आईएमडी पूर्वानुमान"" OR ""आईएमडी अलर्ट"" OR ""तापमान में बढ़ोतरी"" OR ""गर्मी से राहत"" OR ""गर्मी से निजात"") Andaman and Nicobar Islands","राष्ट्रीय मौसम विज्ञान और जल विज्ञान पूर्वानुमान केंद्र का अनुमान है कि 22 जुलाई को उत्तरी क्षेत्र में दिन के दौरान धूप खिली रहेगी; दोपहर और शाम के बाद छिटपुट गरज के साथ बारिश होने की संभावना है, और कुछ क्षेत्रों में भारी बारिश हो सकती है।
दक्षिणी वियतनाम और अन्य क्षेत्रों में धूप खिली रहेगी; दोपहर और शाम के बाद छिटपुट बारिश और गरज के साथ तूफान आने की संभावना है।
देश के सभी क्षेत्रों के लिए मौसम का पूर्वानुमान।
हनोई : दिन में धूप खिली रहेगी, कुछ इलाकों में गर्मी रहेगी; शाम और रात में छिटपुट बारिश और गरज के साथ तूफान आने की संभावना है; न्यूनतम तापमान 26-28 डिग्री सेल्सियस और अधिकतम तापमान 32-35 डिग्री सेल्सियस रहेगा, कुछ इलाकों में तापमान 35 डिग्री सेल्सियस से अधिक हो सकता है।
उत्तर-पश्चिमी क्षेत्र: दिन में धूप खिली रहेगी, शाम और रात में छिटपुट बौछारें और गरज के साथ बारिश होगी, कुछ क्षेत्रों में भारी बारिश भी हो सकती है; न्यूनतम तापमान 21-24 डिग्री सेल्सियस और अधिकतम तापमान 31-34 डिग्री सेल्सियस रहेगा, कुछ क्षेत्रों में तापमान 35 डिग्री सेल्सियस से अधिक भी हो सकता है।
पूर्वोत्तर वियतनाम: कुछ क्षेत्रों में बौछारें और गरज के साथ बारिश, दिन में धूप, कुछ स्थानों पर गर्मी, शाम और रात में छिटपुट बौछारें, कुछ स्थानीय क्षेत्रों में भारी बारिश; न्यूनतम तापमान 26-29 डिग्री सेल्सियस, अधिकतम तापमान 31-34 डिग्री सेल्सियस, कुछ स्थानों पर 35 डिग्री सेल्सियस से ऊपर।
थान्ह होआ से ह्यू तक: दिन में धूप और गर्मी रहेगी, कुछ क्षेत्रों में भीषण गर्मी होगी; शाम और रात में छिटपुट गरज के साथ बारिश होगी; न्यूनतम तापमान 26-29 डिग्री सेल्सियस और अधिकतम तापमान 35-38 डिग्री सेल्सियस रहेगा, कुछ स्थानों पर तापमान 38 डिग्री सेल्सियस से अधिक हो सकता है।
दक्षिण मध्य तट: दिन में धूप और गर्मी रहेगी, शाम और रात में छिटपुट गरज के साथ बारिश हो सकती है; न्यूनतम तापमान 26-29 डिग्री सेल्सियस और अधिकतम तापमान 36-38 डिग्री सेल्सियस रहेगा, कुछ क्षेत्रों में तापमान 38 डिग्री सेल्सियस से अधिक भी हो सकता है।
मध्य हाइलैंड्स: दिन में धूप खिली रहेगी, शाम और रात में छिटपुट बारिश और गरज के साथ तूफान आने की संभावना है; न्यूनतम तापमान 20-23 डिग्री सेल्सियस, अधिकतम तापमान 30-33 डिग्री सेल्सियस, कुछ स्थानों पर 33 डिग्री सेल्सियस से अधिक रहेगा।
दक्षिणी वियतनाम: दिन में धूप खिली रहेगी, शाम और रात में छिटपुट बारिश और गरज के साथ तूफान आने की संभावना है; न्यूनतम तापमान 25-28 डिग्री सेल्सियस, अधिकतम तापमान 32-35 डिग्री सेल्सियस रहेगा, कुछ क्षेत्रों में 35 डिग्री सेल्सियस से अधिक तापमान भी रह सकता है।
हो ची मिन्ह सिटी: दिन में धूप और गर्मी रहेगी, शाम और रात में कभी-कभार बारिश और गरज के साथ बौछारें पड़ेंगी; न्यूनतम तापमान 25-27 डिग्री सेल्सियस और अधिकतम तापमान 33-35 डिग्री सेल्सियस रहेगा, कुछ क्षेत्रों में तापमान 35 डिग्री सेल्सियस से अधिक भी हो सकता है।
स्रोत: https://giaoducthoidai.vn/du-bao-thoi-tiet-227-trung-bo-nang-nong-gay-gat-bac-bo-mua-dong-ve-chieu-toi-post785585.html",1.0
