title,url,source,date,language,state,district,search_term,full_text,relevance_score
"Shahjahanpur News: अधिकतम तापमान में उछाल, बारिश के बन रहे आसार - Amar Ujala",https://news.google.com/rss/articles/CBMi3gFBVV95cUxNbVd3dm1WRkxwMHhfQkV1Q2VQTkQ3ZFROWFFVX3lUZ25ZdENTaFIxVG4zYWpNd2xCMjFFMmpkVm1YbkhrVkZ6NDNYTGZWT3NLNXNmYkVWS2FycE5fNF9Yb2tNVkd4STNZWnVvNjJkSmtDTmI2a0RBd0F5QTI0UjN4eTdoX1JmamVfXzd5MXhxYVpWZU1YV2ZRWGs3LU9QX2RtMEJiYUtERUVMOXlLUW1jZENJM3o4SWIycE1qek44X0xLcWVQNzBndDhraFoyeEJ0VnREY2RLYTVoVmJaY3fSAeMBQVVfeXFMTkdIZ29jVXluOWhhQzdnWjZHeE5sUmZXMWx0b1pmdDF4eU9YNEVlVWVJSUlQdWVkNHA3R09BY0NMUXFKZVNHQkM5cWM2TEVMSUtFZjdWV0JidTFOMHdOVGtnRTFzZWVmQzRhaC1OdXhMdi1IVHRmMl9KT3JMek05eGlKb3VSV2FjUW9yaDFqbVhSVUl4aG1kMnJGVy1pRkJzRy14Q1Y1U25uNk1MMDZWM0UtamRrYXdrT29fUXNfejRJby1NRmhxak5JcFRldEV6RWh2U2Fqd05vNENYdGRTUWZtSFU?oc=5,Amar Ujala,2026-07-22T01:17:39+05:30,hi,Andaman and Nicobar Islands,,"(""पारा चढ़ा"" OR ""पारा पहुंचा"" OR तापमान OR ""तापमान बढ़ा"" OR ""रिकॉर्ड तोड़ गर्मी"" OR ""डिग्री सेल्सियस"" OR ""पारा उबला"" OR ""अधिकतम तापमान"" OR ""तापमान 40 पार"" OR ""तापमान 45 पार"" OR ""तापमान बढ़ने की संभावना"") Andaman and Nicobar Islands","{""_id"":""6a5fccdb32bde5492a044299"",""slug"":""spike-in-maximum-temperature-rain-likely-shahjahanpur-news-c-122-1-spn1002-179640-2026-07-22"",""type"":""story"",""status"":""publish"",""title_hn"":""Shahjahanpur News: अधिकतम तापमान में उछाल, बारिश के बन रहे आसार"",""category"":{""title"":""City & states"",""title_hn"":""शहर और राज्य"",""slug"":""city-and-states""}}
Shahjahanpur News: अधिकतम तापमान में उछाल, बारिश के बन रहे आसार
विज्ञापन
खबरें लगातार पढ़ने के लिए अमर उजाला एप डाउनलोड करें
या
वेबसाइट पर पढ़ना जारी रखने के लिए वीडियो विज्ञापन देखें
अगर आपके पास प्रीमियम मेंबरशिप है तो
शाहजहांपुर। दिनभर बादल छाए रहने के बाद भी उमस का असर कम नहीं हुआ। अधिकतम तापमान में वृद्धि हुई और न्यूनतम तापमान में गिरावट आई। मौसम विभाग की ओर से तेज बारिश का अलर्ट जारी किया गया गया है। वायुदाब गिरा होने और बारिश के अनुकूल हवा चलने से बारिश होने की संभावना बनी हुई है।
गन्ना शोध संस्थान के मौसम वैज्ञानिक डॉ.मनमोहन सिंह के मुताबिक मंगलवार को अधिकतम तापमान 31.4 डिग्री और न्यूनतम तापमान 24 डिग्री सेल्सियस दर्ज किया गया। सोमवार को अधिकतम तापमान 27 डिग्री और न्यूनतम तापमान 25 डिग्री सेल्सियस रहा था।
अधिकतम तापमान में 4.4 डिग्री की वृद्धि और न्यूनतम तापमान में एक डिग्री की गिरावट आई। उन्होंने बताया कि वायुदाब 13 मिलीबार गिरा हुआ है। पूर्वी और दक्षिणी हवा चल रही है। आर्द्रता 85 फीसदी होने से वातावरण में नमी बनी हुई है। इसके असर से तेज बारिश होने के आसार बन रहे हैं। संवाद
विज्ञापन
विज्ञापन
गन्ना शोध संस्थान के मौसम वैज्ञानिक डॉ.मनमोहन सिंह के मुताबिक मंगलवार को अधिकतम तापमान 31.4 डिग्री और न्यूनतम तापमान 24 डिग्री सेल्सियस दर्ज किया गया। सोमवार को अधिकतम तापमान 27 डिग्री और न्यूनतम तापमान 25 डिग्री सेल्सियस रहा था।
विज्ञापन
अधिकतम तापमान में 4.4 डिग्री की वृद्धि और न्यूनतम तापमान में एक डिग्री की गिरावट आई। उन्होंने बताया कि वायुदाब 13 मिलीबार गिरा हुआ है। पूर्वी और दक्षिणी हवा चल रही है। आर्द्रता 85 फीसदी होने से वातावरण में नमी बनी हुई है। इसके असर से तेज बारिश होने के आसार बन रहे हैं। संवाद
विज्ञापन",1.0
Cruelly hot days ahead: Japan sounds alert for heat exceeding 40°C - India Today,https://news.google.com/rss/articles/CBMiwwFBVV95cUxNU1ZJZGtfMGJUcWY5YWJWQk1TczBVeVBleFplMTA3b2RIbThoQVlDR3FDdVB5dzlhSkd5bmVNVWFRNDhXUm1rVEJGN1ZESFFyZTA4bWM2Ti1ZLU1LVGF3Y2Z2R1F0RHRXVjMwSmRnWkNsRkx6LS1yRUhDTVpmNzYwdGM2ODRuME5SWW1YMHJicTNCZ1BZUmZjdGE0bm1Kd1dBcS1BeGIwQjd1Q2tmM0Q3emRvUUNIX0RwcGM0YU84bmdKajjSAcMBQVVfeXFMTVNWSWRrXzBiVHFmOWFiVkJNU3MwVXlQZXhaZTEwN29kSG04aEFZQ0dxQ3VQeXc5YUpHeW5lTVVhUTQ4V1Jta1RCRjdWREhRcmUwOG1jNk4tWS1NS1Rhd2NmdkdRdER0V1YzMEpkZ1pDbEZMei0tckVIQ01aZjc2MHRjNjg0bjBOUlltWDByYnEzQmdQWVJmY3RhNG5tSndXQXEtQXhiMEI3dUNrZjNEN3pkb1FDSF9EcHBjNGFPOG5nSmo4?oc=5,India Today,2026-07-22T13:15:57+05:30,en,Andaman and Nicobar Islands,,"(heatwave OR ""heat wave"" OR ""severe heatwave"" OR ""extreme heat"" OR ""heat spell"" OR ""scorching heat"" OR ""blistering heat"" OR ""sweltering heat"" OR ""hot winds"" OR loo OR ""hot loo winds"" OR ""intense heat"" OR ""unbearable heat"" OR ""deadly heat"" OR heat OR ""weather forecast"" OR ""weather update"" OR ""weather alert"" OR ""IMD forecast"" OR ""IMD prediction"" OR ""IMD alert"" OR IMD OR ""rising temperatures"" OR ""temperatures expected to rise"" OR ""relief from heat"" OR ""respite from heat"" OR ""heat respite"" OR ""respite from scorching heat"") Andaman and Nicobar Islands","Cruelly hot days ahead: Japan sounds alert for heat exceeding 40°C
Japan has issued heatstroke alerts across most of the country as temperatures approach or cross 40°C. Authorities have called the extreme heat a disaster as hospitalisations and deaths raise concern.
Japanese cities are experiencing ""cruelly hot days"", a new meteorological term devised this year to warn people of intense heat above 40°C, with heatstroke alerts issued across almost the whole country.
Three central cities on Tuesday logged scorching heat above the threshold, called ""kokushobi"" which translates to ""cruelly hot day"", according to the Japan Meteorological Agency.
On Wednesday, swathes of other areas, including the central hub of Nagoya and communities near Tokyo in the east, were enduring temperatures approaching or exceeding 40°C. The agency has issued heatstroke alerts in 41 out of Japan's 47 prefectures, urging the public -- especially the many elderly -- to take steps to stay cool.
In the rural Tochigi region, north of Tokyo, an 85-year-old man was found collapsed inside the greenhouse of his farm on Tuesday. He was later confirmed dead, a local fire spokeswoman told AFP.
""The greenhouse was extremely hot inside,"" she said.
The Fire and Disaster Management Agency on Wednesday urged the public to regard the extreme heat as a ""disaster"".
""Temperatures have been rising since mid-July, and severe heat is expected to continue nationwide,"" the agency said.
""It is no exaggeration to call this extreme heat a 'disaster' with many people being rushed to hospitals or even dying as a result of heatstroke,"" it said.
Scientists say human-induced climate change is increasing the frequency and intensity of extreme heat events in Japan and elsewhere. Last year, the country sweltered through its hottest summer on record.
Japan's highest recorded temperature was recorded on August 5, 2025 when it hit 41.8°C in Isesaki north of Tokyo.
Japanese cities are experiencing ""cruelly hot days"", a new meteorological term devised this year to warn people of intense heat above 40°C, with heatstroke alerts issued across almost the whole country.
Three central cities on Tuesday logged scorching heat above the threshold, called ""kokushobi"" which translates to ""cruelly hot day"", according to the Japan Meteorological Agency.
On Wednesday, swathes of other areas, including the central hub of Nagoya and communities near Tokyo in the east, were enduring temperatures approaching or exceeding 40°C. The agency has issued heatstroke alerts in 41 out of Japan's 47 prefectures, urging the public -- especially the many elderly -- to take steps to stay cool.
In the rural Tochigi region, north of Tokyo, an 85-year-old man was found collapsed inside the greenhouse of his farm on Tuesday. He was later confirmed dead, a local fire spokeswoman told AFP.
""The greenhouse was extremely hot inside,"" she said.
The Fire and Disaster Management Agency on Wednesday urged the public to regard the extreme heat as a ""disaster"".
""Temperatures have been rising since mid-July, and severe heat is expected to continue nationwide,"" the agency said.
""It is no exaggeration to call this extreme heat a 'disaster' with many people being rushed to hospitals or even dying as a result of heatstroke,"" it said.
Scientists say human-induced climate change is increasing the frequency and intensity of extreme heat events in Japan and elsewhere. Last year, the country sweltered through its hottest summer on record.
Japan's highest recorded temperature was recorded on August 5, 2025 when it hit 41.8°C in Isesaki north of Tokyo.
Japanese cities are experiencing ""cruelly hot days"", a new meteorological term devised this year to warn people of intense heat above 40°C, with heatstroke alerts issued across almost the whole country.
Three central cities on Tuesday logged scorching heat above the threshold, called ""kokushobi"" which translates to ""cruelly hot day"", according to the Japan Meteorological Agency.
On Wednesday, swathes of other areas, including the central hub of Nagoya and communities near Tokyo in the east, were enduring temperatures approaching or exceeding 40°C. The agency has issued heatstroke alerts in 41 out of Japan's 47 prefectures, urging the public -- especially the many elderly -- to take steps to stay cool.
In the rural Tochigi region, north of Tokyo, an 85-year-old man was found collapsed inside the greenhouse of his farm on Tuesday. He was later confirmed dead, a local fire spokeswoman told AFP.
""The greenhouse was extremely hot inside,"" she said.
The Fire and Disaster Management Agency on Wednesday urged the public to regard the extreme heat as a ""disaster"".
""Temperatures have been rising since mid-July, and severe heat is expected to continue nationwide,"" the agency said.
""It is no exaggeration to call this extreme heat a 'disaster' with many people being rushed to hospitals or even dying as a result of heatstroke,"" it said.
Scientists say human-induced climate change is increasing the frequency and intensity of extreme heat events in Japan and elsewhere. Last year, the country sweltered through its hottest summer on record.
Japan's highest recorded temperature was recorded on August 5, 2025 when it hit 41.8°C in Isesaki north of Tokyo.",1.0
"Japan is selling a “human refrigerator” for extreme heat, a walk-in cooling booth that can cool the body - The Times of India",https://news.google.com/rss/articles/CBMitgJBVV95cUxONF9ETi13MTYzWWMycE92SnJieFRZY0hXa2pCSWlncUI3WDA1VFVOclZ4dFJSalRHZ1VYdDVjb050TVhXMVdwQkJpR2M3U3ZJQjNnUUMyY2owdWpyZEd4QXY1dTdiQi1jOF9KcmtwUTZHa09RMDkxalVhMHVLZ0lCcU9IREl1Y0VUQWZnS2hCQ0NyY1ZkRnhMYVNvVGdFNDhtT1NTQWZsRTFFSXNlc2J4Y3gxRVdVbmpacWRwb3dIVGVPY09qUllCd1BkRTloSGI5MUU0bXRKZkVrWjQ5TmdfUzN5YW9CVHk0Q3c2MTI0dXBhbDFuQXRVOUFaTXBLYU1qbTdxWk5xeERXMG5FbVYtNGtCb0FGcHhpaVJ0cTNZVS0xTTQyazBaT2dpZFZ0TXExSFNPUWhn0gG7AkFVX3lxTE5ZYWxkb0F4bVZnU25aWWFSY1NrZVpOS2t4OHN6blBpM1prMjF3UUpIcGpJdXZWX055T3pNV1FuamdnbmltaV9CcGZZRDh0ZF9NLWh0TFF6NjJHUEpTbktLNWxZX2EwTExrMUwyMWtOZTRnX2F6VWoyMl80NmNhR1g5LUJSR1lIOWg3TDJXeWpaTUo1YlZLMDhaZ2ZMeFpWMldfaTd5eEt6RkVPOEZ1c01Cc3NFVEtWVFc5eEkxRmNhNjkza2tqbG5IRElzOXJkOE9nVGFtTFRYUk02NmhHc29zdkFYMDBkT2g3SjFGYXRtZU5PUzA5S0JSd2JoZmpITWhnYVZWNXJqN0gtdlBKNkxLVkplR2JZMUt1aXZEUjh3QS1kQ1pSSXZwV0FkWEdjYXZVZVE2cHY2UlNjcw?oc=5,The Times of India,2026-07-22T06:04:00+05:30,en,Andaman and Nicobar Islands,,"(heatwave OR ""heat wave"" OR ""severe heatwave"" OR ""extreme heat"" OR ""heat spell"" OR ""scorching heat"" OR ""blistering heat"" OR ""sweltering heat"" OR ""hot winds"" OR loo OR ""hot loo winds"" OR ""intense heat"" OR ""unbearable heat"" OR ""deadly heat"" OR heat OR ""weather forecast"" OR ""weather update"" OR ""weather alert"" OR ""IMD forecast"" OR ""IMD prediction"" OR ""IMD alert"" OR IMD OR ""rising temperatures"" OR ""temperatures expected to rise"" OR ""relief from heat"" OR ""respite from heat"" OR ""heat respite"" OR ""respite from scorching heat"") Andaman and Nicobar Islands","As heat waves become more frequent and intense around the globe, new cooling technologies are being developed to keep people safe. While many of us are still stuck with air-conditioners, a company in Japan has come up with a quirky solution to cool you down quickly in extreme heat: the walk-in cooling booth dubbed the “human refrigerator,” which works in just a few minutes. According to reports, Japanese refrigeration and vending machine manufacturer SDRS developed the Do Hiemon Box, designed to help people cool down quickly after long exposure to high temperatures. The booth, which takes its cue from Japan's refrigerated vending machines, is already drawing notice for its practical approach to preventing heat-related illness.
How does this human refrigerator works
According to the report, the Do Hiemon box is a small refrigerated booth, large enough for one person at a time. Inside there is a chair where users can sit comfortably as the cooling process starts. The booth has an internal temperature of 15°C. Once a person is seated, chilled air at 5°C is blown towards the head, neck, shoulders and back—areas important for regulating body temperature. This directed airflow allows the body to cool down quickly and provides almost instant relief from heat. According to the company, it takes as little as five minutes to cool the body, making it a fast option for those exposed to high temperatures outdoors.
Engineered to beat heat stress
The cooling booth is for those suffering the physical effects of extreme heat, including the early symptoms of heat exhaustion. As per the company, spending around 10 minutes inside the booth can lower body temperature significantly and help alleviate the discomfort of prolonged heat exposure. This makes the technology especially useful for employees who spend long hours outdoors, such as those on construction sites, in warehouses, factories, logistics centers and industrial facilities. It is said to help avoid medical expenses related to severe heatstroke.
Energy efficient and easy to move
According to reports, it offers cooling and is also energy efficient. SDRS says its system uses about half the electricity of a conventional spot air conditioner. The booth offers three cooling and airflow settings to customize the level of intensity to your liking. It automatically turns off after 20 minutes for safety to help prevent overcooling.
Is it being used by public
The company claims that they have installed the machine at various public places nationwide since it went on sale in April. Another example is the Maebashi City Hall in Gunma Prefecture, where visitors can use the cooling booth for free.
Cost and availability
It is available in its standard variant and costs approximately 1.5 million Japanese yen or about Rs 9 lakh (pre-tax).",1.0
Ma Vie en Rouge: Paris in a Red-Alert Heat Wave - newyorker.com,https://news.google.com/rss/articles/CBMiiAFBVV95cUxPOVlmbEJvSTFuNUM5TGQtcV9kaXNnQXlpNGdqLV9GWG1nZUtFdnVqRUg5cEpuMlJ1ZnhvbVJ3M29GN3Bwd2VLSG15WU5xekNISU9KTnhNck1xaDgxU2kzZTZVX3FkanVlRlhMVjcxY3JnMmhBWk9nNmw2eVdwdTYtOUl3aVRPeTdp?oc=5,newyorker.com,2026-07-22T13:47:26+05:30,en,Andaman and Nicobar Islands,,"(heatwave OR ""heat wave"" OR ""severe heatwave"" OR ""extreme heat"" OR ""heat spell"" OR ""scorching heat"" OR ""blistering heat"" OR ""sweltering heat"" OR ""hot winds"" OR loo OR ""hot loo winds"" OR ""intense heat"" OR ""unbearable heat"" OR ""deadly heat"" OR heat OR ""weather forecast"" OR ""weather update"" OR ""weather alert"" OR ""IMD forecast"" OR ""IMD prediction"" OR ""IMD alert"" OR IMD OR ""rising temperatures"" OR ""temperatures expected to rise"" OR ""relief from heat"" OR ""respite from heat"" OR ""heat respite"" OR ""respite from scorching heat"") Andaman and Nicobar Islands","New Yorker Favorites
Did an experienced alpinist leave his girlfriend to die at the top of a mountain?
How “Gone with the Wind” shaped American myths about slavery and Southern women.
A scientist with a Ph.D. from Harvard fatally shot three of her colleagues. Then revelations about her family history came to light.
Why some people thrive on four hours of sleep.
Laura Park is a cartoonist and an illustrator. She currently lives in France.",0.6833333333333333
"Short Spells of Extreme Heat During Pregnancy May Increase Low Birth Weight Risk, Finds UQIDAR and IIT Delhi Study - IndiaMedToday",https://news.google.com/rss/articles/CBMi1wFBVV95cUxQVTBEZGNENVhRbWxNdXZTVVVfakI1SHVESUFYR1VWMTdfb2VaYlUtWURVRjZqYV9jSjlGM0hzVWo3Z2ZHUnU4ay1kTi1wWkdBQ2xJcGpJZm92OWNWWFl2bjdvQ2hPdWo5andQNDd5MmRnZkQtOW9sb1hYNW5Vc1JSazNSM0paZHQ0M0diRklQM3JQbkFwTVV4WUgteThaMkpmVVB1T3I5MkJ5NzVGMFJkcG9haHg4dVd1UFB3Sld0N1FYMVVzdl83OFBPY0lXT214enpfeUtLYw?oc=5,IndiaMedToday,2026-07-22T13:51:12+05:30,en,Andaman and Nicobar Islands,,"(heatwave OR ""heat wave"" OR ""severe heatwave"" OR ""extreme heat"" OR ""heat spell"" OR ""scorching heat"" OR ""blistering heat"" OR ""sweltering heat"" OR ""hot winds"" OR loo OR ""hot loo winds"" OR ""intense heat"" OR ""unbearable heat"" OR ""deadly heat"" OR heat OR ""weather forecast"" OR ""weather update"" OR ""weather alert"" OR ""IMD forecast"" OR ""IMD prediction"" OR ""IMD alert"" OR IMD OR ""rising temperatures"" OR ""temperatures expected to rise"" OR ""relief from heat"" OR ""respite from heat"" OR ""heat respite"" OR ""respite from scorching heat"") Andaman and Nicobar Islands","Exposure to just three to four consecutive days of extreme heat during pregnancy may increase the risk of delivering a low-birth-weight baby, according to a national study led by researchers from the University of Queensland-IIT Delhi Academy of Research (UQIDAR), IIT Delhi and the University of Queensland.
Published in the peer-reviewed journal Environmental Research Communications, the study analysed 209,266 births recorded across India between 2015 and 2020 to examine how exposure to extreme heat at different stages of pregnancy affected birth outcomes.
The researchers found that exposure to three to four consecutive “sweltering” days during pregnancy was associated with a statistically significant increase in the risk of low birth weight. Heat exposure during the first trimester was linked to a higher risk of preterm birth, while exposure during the second trimester was associated with low birth weight.
The findings are particularly relevant for states such as Andhra Pradesh and Telangana, where prolonged summers are frequently marked by recurring periods of intense heat.
Unlike previous studies that relied on average or peak temperatures, the researchers assessed heat exposure using consecutive “sweltering” days, defined as days when the India Heat Index exceeded the 90th percentile of the local long-term climate. This approach allowed them to better capture the impact of sustained heat exposure during pregnancy.
The analysis showed that each additional consecutive sweltering day during pregnancy increased the odds of low birth weight by about one per cent after adjusting for other influencing factors.
Lead author Vineetha Vincent from UQIDAR said that although the increase associated with each additional day of heat exposure appeared modest, its cumulative impact across India’s large population could become a significant public health concern.
“While the per-day increase is small, it compounds over a long, hot pregnancy and affects a very large population, making it a meaningful public health concern in a country where extreme heat is becoming more common,” Vincent said.
The study also highlighted significant social disparities in heat-related pregnancy outcomes. Mothers with no formal education or only primary education were more likely to have a low-birth-weight baby or experience a stillbirth as heat exposure increased, compared with women who had higher levels of education.
According to Sagnik Dey, Professor at IIT Delhi and co-author of the study, climate adaptation strategies must account for these inequalities.
“The mothers most exposed to extreme heat are often those with the fewest resources to cope with it: the poorest, the least educated and the undernourished. Any adaptation response that ignores this social gradient will miss the women who need protection most,” Dey said.
The researchers said the findings highlight the need to recognise pregnant women as a priority group in India’s heat action plans, particularly as climate change contributes to more frequent and intense heat events. They added that targeted interventions, including improved access to cooling, hydration, antenatal counselling and community awareness, could help reduce heat-related risks during pregnancy.
The findings were published in the peer-reviewed journal Environmental Research Communications.",0.8500000000000001
Japan Faces 'Brutally Hot Day' as Extreme Heat Intensifies - Devdiscourse,https://news.google.com/rss/articles/CBMivgFBVV95cUxOS1p0a3hCU0NkTVoxMWZfX1hwd2FBd3o5NlhuZ0VHWVB2UWV4TGs3WHZ1SDMwRUtxX1lBa2JJa0VNaXEwSHZTSm9MRlF6MVVQcDRQOF9qeHVjb2c4cURybEVZSUlnZHpoVWdHWHdjMlFldmJiNjdpaVB1WjR3R2ZTajN4V1ItdHBNQ3NYcjBHZHFJVTRYV3d5WVR0bDEtREZBSmgycmNDeGFKLXFETEIwZTQtbXBJeGRESlBKcFZ30gHDAUFVX3lxTE1JY25ESW4wbWhkWWRLZFRmUEMzUlpwaHU5T016dFd3UlRTWjl4QkVjdmF6Vnh3eVIzMUwxcFBhQnRrMXZsNmg2cEFIVWdKTUw2aklIS0g1WEpJLV9vdTI5QldRMFpFNkRZQlItcVlJSTNoeHlSM005Uk5Eb05QLTBRU250VldvOTI3YnNfdTdlZHQwYm5jUmwxSUQwS3U1bFNwZ181UEZxWTIxQWxhNmNHd2dxaUxNeUFOdkw1ZUVYYkdQdw?oc=5,Devdiscourse,2026-07-22T07:44:55+05:30,en,Andaman and Nicobar Islands,,"(heatwave OR ""heat wave"" OR ""severe heatwave"" OR ""extreme heat"" OR ""heat spell"" OR ""scorching heat"" OR ""blistering heat"" OR ""sweltering heat"" OR ""hot winds"" OR loo OR ""hot loo winds"" OR ""intense heat"" OR ""unbearable heat"" OR ""deadly heat"" OR heat OR ""weather forecast"" OR ""weather update"" OR ""weather alert"" OR ""IMD forecast"" OR ""IMD prediction"" OR ""IMD alert"" OR IMD OR ""rising temperatures"" OR ""temperatures expected to rise"" OR ""relief from heat"" OR ""respite from heat"" OR ""heat respite"" OR ""respite from scorching heat"") Andaman and Nicobar Islands","Japan Faces 'Brutally Hot Day' as Extreme Heat Intensifies
Japan grappled with dangerously high temperatures expected to surpass 40 degrees Celsius, prompting the government to declare it a 'brutally hot day.' Heat stroke alerts were issued as residents were advised to stay hydrated and indoors. The new 'kokushobi' category highlights the rising occurrence of extreme heat.
Japan is reeling under perilously high temperatures, with forecasts predicting heat exceeding 40 degrees Celsius in several areas on Wednesday, marking it as a 'brutally hot day' as per the government's new designation.
Heat stroke alerts were announced nationwide, as the mercury was set to reach 40 C in Kumagaya and Nagoya, urging residents to stay indoors, stay hydrated, and use air conditioning.
This comes amid a trend of harsher summers, with last year's records reaching 41.8 C and more recent hospitalizations reaching alarming numbers, showcasing the intensifying pattern of extreme weather.
(With inputs from agencies.)",1.0
