title,url,source,date,language,state,district,search_term,full_text,relevance_score
हिमाचल में 4 दिन मौसम रहेगा बेकाबू! मौसम विभाग ने जारी किया येलो अलर्ट - Zee News,https://news.google.com/rss/articles/CBMi3gFBVV95cUxQVGhMTUN6cU9sbmw3Y0R0UjhHWkFsRVZWaW4wVGRHdlpVUkg3WjJpUjZpNGxKeVdYWmJXTlA5TE9iRk9NTS1oSl9uNU1tUXp6ZzVEV3c4UG5DVHdWVVBuYUNmUEVPTzdwQjZ3ZXF5Z0RaZkRHbmxjclh4NXVrcExwZFZsdERCUEdlRndRTUZJNGN3RllWcXZ3ZnE4ZHRnaWhWT195SC1sLWFXVWxSMnNYV2lpLVIxOVdYSkRDVU5HM0g0M3BTR292eGlKTWtMSFd4RDRZdFE1eGFqTXdwaEHSAeMBQVVfeXFMT1RHdTFWN04xbHhqcm0yWnVYRnYwRkNyMnJlMjFSMjJJVzRubXlTSnBkWk1DVDFVbDh0Y0xaMHB0SUQ2dzdRcDdGWTVJdmRqbkpiaUIzTEFkTkFHNGVSYUhJLW1obXd6T2FBcE0wYktJUmJmQk5wX1drMGk2amlKd1h1UHFxZThuNWs5VDJYSGwzLUFWZjQ4S1VRamRhN2lIY2hlblZLdUV4aF9yYWdyalhkT3J5QUJrNmRjTE9nMmt6MnNHZXpBZDZLQ1UwMHh5QnRXZjF5aDQtcHlsOVIwb2dVbnc?oc=5,Zee News,2026-06-01T12:30:59+05:30,hi,Himachal Pradesh,,"(""हीट एक्शन प्लान"" OR ""गर्मी से राहत"" OR चेतावनी OR ""रेड अलर्ट"" OR ""ऑरेंज अलर्ट"" OR ""येलो अलर्ट"" OR एडवाइजरी OR ""राहत सामग्री"" OR ""राहत शिविर"" OR मुआवजा) Himachal Pradesh","Himachal Weather Update: हिमाचल प्रदेश में मौसम ने करवट ली है. 6 जून तक बारिश, गरज-चमक और तेज हवाओं का पूर्वानुमान है. 3 से 6 जून के बीच अधिकांश जिलों में अंधड़ का येलो अलर्ट जारी किया गया है. रोहतांग की ऊंची चोटियों पर ताजा बर्फबारी से तापमान में भी गिरावट दर्ज हुई है.
Trending Photos
Himachal Weather: हिमाचल प्रदेश में मौसम का मिजाज पूरी तरह बदल गया है. पिछले कुछ दिनों से पड़ रही भीषण गर्मी के बीच अब लोगों को राहत मिली है. मौसम विभाग के अनुसार प्रदेश में 1 जून से 6 जून तक मौसम खराब बना रह सकता है. इस दौरान कई क्षेत्रों में बारिश, गरज-चमक और तेज हवाएं चलने की संभावना है. 3 से 6 जून के बीच अधिकांश जिलों के लिए अंधड़ और तेज हवाओं का येलो अलर्ट जारी किया गया है.
रविवार को प्रदेश के कई हिस्सों में बादलों की आवाजाही रही, जबकि राजधानी शिमला में हल्की बूंदाबांदी दर्ज की गई. वहीं रोहतांग दर्रे से सटी ऊंची चोटियों पर ताजा बर्फबारी भी हुई, जिससे पहाड़ी इलाकों में ठंडक बढ़ गई है.
गर्मी से मिली राहत, तापमान में आई गिरावट
कुल्लू, मंडी, चंबा और कांगड़ा सहित कई जिलों में दिनभर बादल छाए रहे. ऊना में भी सुबह के समय मौसम अपेक्षाकृत ठंडा रहा. मौसम में आए बदलाव का असर तापमान पर भी देखने को मिला है. प्रदेश के कई हिस्सों में अधिकतम तापमान सामान्य से करीब 8 डिग्री सेल्सियस तक नीचे दर्ज किया गया, जिससे मैदानी क्षेत्रों में भी गर्मी का असर कम हुआ है.
पर्वतीय क्षेत्रों में बढ़ी ठंडक
मध्य और उच्च पर्वतीय इलाकों में सुबह और शाम के समय ठंडक महसूस की जा रही है. शिमला, मनाली, कुफरी, कल्पा और केलांग जैसे क्षेत्रों में न्यूनतम तापमान में गिरावट दर्ज की गई है, जिससे मौसम काफी सुहावना हो गया है.
मई में सामान्य से कम हुई बारिश
मौसम विभाग के आंकड़ों के अनुसार मई महीने में प्रदेश में सामान्य से 18 प्रतिशत कम वर्षा रिकॉर्ड की गई. 1 से 31 मई के बीच जहां 63.3 मिलीमीटर बारिश सामान्य मानी जाती है, वहीं इस बार केवल 52.2 मिलीमीटर वर्षा दर्ज हुई.
हालांकि कुछ जिलों में सामान्य से अधिक बारिश भी हुई. ऊना में 125 प्रतिशत, बिलासपुर में 58 प्रतिशत, शिमला और सिरमौर में 47 प्रतिशत तथा हमीरपुर में 33 प्रतिशत अधिक वर्षा रिकॉर्ड की गई. दूसरी ओर चंबा, किन्नौर, लाहौल-स्पीति, कुल्लू और सोलन में सामान्य से कम बारिश दर्ज की गई.
अगले कुछ दिन सतर्क रहने की सलाह
मौसम विभाग ने 3 से 6 जून के दौरान तेज हवाओं और अंधड़ की संभावना को देखते हुए लोगों को सतर्क रहने की सलाह दी है. विशेष रूप से पहाड़ी और संवेदनशील क्षेत्रों में रहने वाले लोगों को मौसम अपडेट पर नजर रखने और खराब मौसम के दौरान अनावश्यक यात्रा से बचने की सलाह दी गई है.",1.0
