title,url,source,date,language,state,district,search_term,full_text,relevance_score
"Stay cool, stay safe: AIIMS doctors issue heatwave advisory for children - The New Indian Express",https://news.google.com/rss/articles/CBMivwFBVV95cUxQNFByOUR4d05EcUlwejFYMndMdDZpMV9mWmlLTVFOSl96R3Y4RHRWQ1JPZHdZa0hPQkV1Zmc5MlVNZ0FoakZQbTNTT00wTTZrV1BUTjBLendwOXJtWGRzaXBxNklsMnZMeVR1UXJqT1NmcDBJeTlKd0NHT09uVXo0Z0RyMjV4dVFFbWY4Q05TcmxsMFVGWjlOeHZrbjg3UElrdXVCcVdaMm1QaDlpLXJxTW9nU280MHBnYnBvalkzTdIBzAFBVV95cUxOeDhtWnIxdWI0MmJLLTd6WHhvbzlGenpoSjhONU5oTTdDWENRVlQ0Y3BjRmhZbmtlVkhMTEFUalhRX1M1ck5IaDJmLVVSNXhLNENCUEFwNTU4YWxXTURtV0JTb1hqYWdjcWEyVlVGVzhnSFczNFBuSVkxQXZHd2ZOQ1ZiV1N2RW13NWYtd2NycU1PZHJncnItellGbmZMeDlyb3VSTGtCaERxWk5wWFF3SVRXVjdHOU9halRyNngtZUlVWTZyd2RsTlAyUTI?oc=5,The New Indian Express,2026-04-30T13:19:55+05:30,en,Chandigarh,Chandigarh,"(heatwave OR ""heat wave"" OR ""severe heatwave"" OR ""extreme heat"" OR ""heat spell"" OR ""scorching heat"" OR ""blistering heat"" OR ""sweltering heat"" OR ""hot winds"" OR loo OR ""hot loo winds"" OR ""intense heat"" OR ""unbearable heat"" OR ""deadly heat"" OR heat OR ""weather forecast"" OR ""weather update"" OR ""weather alert"" OR ""IMD forecast"" OR ""IMD prediction"" OR ""IMD alert"" OR IMD OR ""rising temperatures"" OR ""temperatures expected to rise"" OR ""relief from heat"" OR ""respite from heat"" OR ""heat respite"" OR ""respite from scorching heat"") Chandigarh","Amid rising temperatures across parts of India, paediatric experts are urging parents to take extra precautions to protect children from the dangers of heatwaves, warning that young bodies are particularly susceptible to heat-related illnesses.",0.8500000000000001
"पंजाब और चंडीगढ़ में गर्मी का सितम: 2 जिलों का तापमान 44.3 डिग्री पहुंचा, आज हीट वेव का यलो अलर्ट; कल से बा... - Dainik Bhaskar",https://news.google.com/rss/articles/CBMitAFBVV95cUxQUUg3SXlJUGxiLS1aeWpvYlM2cmJTVkt5ZTF5VGJ0ekRBQnMyWmZLekw1VVZFN0lEckdkZUNuRzhwV2RibXF1cDRnRURyQ0Y5TFphdWp2OHZ6R3RBalJtSFJrbjRwaDBjMUlNcGR0NjZLN01XUHBGc1pldFp0N3JPelB2YjZTemxtR3luNTA4Mkx4eVIzcXhHOUJDb3Q1dEJkN2dDZUI0dHg1dnBxR3otN0NaR1_SAboBQVVfeXFMUDkyc2p5dFV6VUVvWkZybC1MWFRuaWZMdG9ZbWgwYU4yc3pqd1AwRlhMT2NCRXFNOG5ZSjhDRC1vR2lsN05tRU05VlJvUTRKcFZjVHp0YVRHclpRNUJZamNPMGtUOW96YmI0aGU2Vl9iTGdWcjRuZi13cG5POHJXWlE0RmhVQnlWSUdxVF9KVDZUT0VsSDBhM1o3M1I4ck4xMHFzNXQtOHJqMkVlRkd6bFlNNF9zSDQ1VkxR?oc=5,Dainik Bhaskar,2026-04-30T09:14:12+05:30,hi,Chandigarh,Chandigarh,लू (Chandigarh) Chandigarh,"पंजाब और चंडीगढ़ में गर्मी का सितम:2 जिलों का तापमान 44.3 डिग्री पहुंचा, आज हीट वेव का यलो अलर्ट; कल से बारिश के आसार
- कॉपी लिंक
पंजाब और चंडीगढ़ में इस समय भीषण गर्मी पड़ रही है। बठिंडा और फरीदकोट में अधिकतम तापमान 44.3 डिग्री, जबकि चंडीगढ़ में 41.0 डिग्री दर्ज किया गया है। शुक्रवार की तुलना में तापमान में 0.5 डिग्री की बढ़ोतरी हुई है। यह सामान्य से पांच डिग्री अधिक रहा है।
मौसम विज्ञान केंद्र चंडीगढ़ ने आज के लिए पंजाब और चंडीगढ़ में हीट वेव का यलो अलर्ट जारी किया है। चंडीगढ़ में इस दौरान वार्म नाइट रहने की संभावना है। वहीं कल यानी 26 से 30 अप्रैल तक बारिश और आंधी का अलर्ट जारी किया गया है।
आज मुख्य रूप से 10 जिलों मोगा, फिरोजपुर, फरीदकोट, फाजिल्का, बरनाला, मुक्तसर, बठिंडा, मानसा, संगरूर और पटियाला में कुछ स्थानों पर हीट वेव की स्थिति बन सकती है। वहीं अमृतसर, तरनतारन, फिरोजपुर, फरीदकोट, फाजिल्का, बरनाला और लुधियाना में कुछ जगहों पर वार्म नाइट रहने की संभावना है। इसके अलावा फाजिल्का, मुक्तसर और बठिंडा में कहीं-कहीं हल्की से मध्यम बारिश हो सकती है।
सात जिलों का तापमान 40 डिग्री से अधिक
पंजाब में गर्मी का असर साफ दिख रहा है। आंकड़ों के अनुसार 7 जिलों में तापमान 40 डिग्री से ऊपर दर्ज किया गया। इनमें चंडीगढ़ (सिटी) 41.0 डिग्री, अमृतसर 40.3 डिग्री, लुधियाना 42.4 डिग्री, पटियाला 42.4 डिग्री, बठिंडा 42.5 डिग्री (एयरपोर्ट पर 44.3 डिग्री), फरीदकोट 44.3 डिग्री और रूपनगर (भाखड़ा डैम) 41.3 डिग्री शामिल हैं। वहीं 6 जिलों में तापमान 35 से 40 डिग्री के बीच रहा।
जिनमें फाजिल्का 39.9 डिग्री, फिरोजपुर 39.2 डिग्री, होशियारपुर 38.4 डिग्री, एसबीएस नगर 39.6 डिग्री, मोगा 39.4 डिग्री और पठानकोट 38.6 डिग्री दर्ज किया गया। बाकी जिलों में तापमान 35 डिग्री के आसपास या उससे कम दर्ज किया गया। इनमें गुरदासपुर 38.0 डिग्री, रोपड़ (रूपनगर मुख्यालय) 39.0 डिग्री, पटियाला (AWS) 39.9 डिग्री, चंडीगढ़ (एयरपोर्ट) 40.0 के करीब और कुछ अन्य स्थानों पर तापमान 37 से 39 डिग्री के बीच रहा, जबकि किसी भी जिले में बारिश दर्ज नहीं की गई।
रात को 26 डिग्री तक तापमान
पूरे हफ्ते राज्य में बारिश की खास उम्मीद नहीं है। दिन का तापमान 38 से 42 डिग्री के बीच रहेगा और आम से ज्यादा गर्मी महसूस होगी। रात का तापमान 22 से 26 डिग्री के बीच रहेगा, यानी रातें भी सामान्य से थोड़ी ज्यादा गर्म रहेंगी। इस समय पश्चिमी विक्षोभ ऊपर की हवाओं में सक्रिय है और उत्तर दिशा की तरफ बना हुआ है। वहीं उत्तर हरियाणा और आसपास के इलाकों में करीब 1.5 किलोमीटर ऊंचाई पर हवा का हल्का सा चक्रवाती सिस्टम भी बना हुआ है, जिसका असर आसपास के मौसम पर पड़ सकता है।
कल से आंधी और बारिश की संभावना
मौसम विज्ञान केंद्र चंडीगढ़ के डायरेक्टर सुरेंद्र पाल बताते हैं कि राज्य में 26 से 30 तारीख के बीच कुछ स्थानों पर हल्की बारिश होने की संभावना है। अगले चार दिनों तक दिन के तापमान में कोई बड़ा बदलाव नहीं होगा। इसके बाद तापमान में 2 से 4 डिग्री तक गिरावट आ सकती है।
25 तारीख को कुछ जगहों पर लू चलने और वार्म नाइट रहने की संभावना है। वहीं 26 से 30 तारीख के दौरान कुछ इलाकों में गरज-चमक के साथ बारिश और 30 से 40 किमी प्रति घंटे की रफ्तार से तेज हवाएं चल सकती हैं।
अगले तीन दिन के मौसम का अनुमान
26 अप्रैल - फाजिल्का, मुक्तसर, बठिंडा और मानसा में कुछ स्थानों पर गरज-चमक के साथ बारिश और 30 से 40 किमी प्रति घंटे की रफ्तार से तेज हवाएं चलने की संभावना है। वहीं इन जिलों में कहीं-कहीं हल्की से मध्यम बारिश भी हो सकती है।
27 अप्रैल - पठानकोट, गुरदासपुर, होशियारपुर, फाजिल्का, मुक्तसर, बठिंडा और मानसा में कुछ स्थानों पर गरज-चमक के साथ बारिश और 30 से 40 किमी प्रति घंटे की रफ्तार से तेज हवाएं चलने की संभावना है। वहीं इन सभी जिलों में कहीं-कहीं हल्की से मध्यम बारिश भी हो सकती है।
28 अप्रैल -पठानकोट, गुरदासपुर, होशियारपुर, अमृतसर, तरनतारन, नवांशहर, कपूरथला, जालंधर, फतेहगढ़ साहिब, रूपनगर, पटियाला और मोहाली में कुछ स्थानों पर गरज-चमक के साथ बारिश और 30 से 40 किमी प्रति घंटे की रफ्तार से तेज हवाएं चलने की संभावना है। वहीं पठानकोट, गुरदासपुर और होशियारपुर में कुछ जगहों पर हल्की से मध्यम बारिश हो सकती है।
अमृतसर, तरनतारन, नवांशहर, कपूरथला, जालंधर, फिरोजपुर, फाजिल्का, फरीदकोट, मुक्तसर, मोगा, बठिंडा, लुधियाना, बरनाला, मानसा, संगरूर, फतेहगढ़ साहिब, रूपनगर, पटियाला और मोहाली में कहीं-कहीं हल्की से मध्यम बारिश होने की संभावना है।",1.0
"भीषण गर्मी से हल्की राहत; चंडीगढ़-पंजाब में सुबह-सुबह तेज आंधी से बदला मौसम, बारिश की बौछारों से तापमान में गिरावट, बादल छाए हुए - Arth Parkash",https://news.google.com/rss/articles/CBMimAFBVV95cUxQWmhjd1FiODFHallCcVd4MFd3YmpqdnJrMlBDZ24ydHdZMHRsMXBLWTNUVEkzUUptSFpmTDdvY2FwZEwwYTZiOUQwMHlTbkxHM0pLbHJJS1BNN3NrSWVCTXkybjE1VV9MYlJxY2RQU0JnQjFUVms2Vm9pRFNaSkYwVy1pR3VSX3dIandkZElsTm5yZzZKZzZvcg?oc=5,Arth Parkash,2026-04-30T00:51:00+05:30,hi,Chandigarh,Chandigarh,लू (Chandigarh) Chandigarh,"भीषण गर्मी से हल्की राहत; चंडीगढ़-पंजाब में सुबह-सुबह तेज आंधी से बदला मौसम, बारिश की बौछारों से तापमान में गिरावट, बादल छाए हुए
Weather Today Update Relief From Heat Wave Chandigarh Punjab Rain
Weather Today Update: इस बार अप्रैल महीने में ही पूरे उत्तर भारत में भीषण गर्मी का कहर जारी है। आसमान से आग बरस रही है। इस बीच आज (28 अप्रैल) को पंजाब-चंडीगढ़ समेत उत्तर भारत के कई हिस्सों में तेज आंधी के साथ मौसम बदल गया है। नए पश्चिमी विक्षोभ के सक्रिय होने से बारिश की बौछारों से तापमान में गिरावट देखी जा रही है। तेज झोंकेदार हवाओं के साथ बारिश की फुहारें पड़ने से लोग चिलचिलाती गर्मी से हल्की राहत महसूस कर रहे हैं। लगातार कई दिनों से गर्मी ने लोगों को बेहाल कर रखा था।
आसमान में बादल छाए हुए
अभी भी पंजाब-चंडीगढ़, हरियाणा समेत उत्तर भारत के कई हिस्सों में आसमान में बादल छाए हुए देखे जा रहे हैं। मौसम विभाग के मुताबिक कुछ हिस्सों में 28 से 30 अप्रैल और कुछ जगहों पर 2 मई तक मौसम का मिजाज बिगड़ा हुआ रह सकता है। ऐसे में कुछ जगहों पर गरज चमक के साथ बारिश हो सकती है। इस दौरान मेघ गर्जन के साथ बिजली गिरने और 40-50 किमी की रफ़्तार से तेज झोंकेदार हवाएं चलने की चेतावनी दी गई है। बारिश की वजह से तापमान में भी कमी आएगी। चंडीगढ़ का अधिकतम तापमान इस समय 34 डिग्री सेल्सियस दर्ज किया जा रहा है। जो कि 40 डिग्री पार कर गया था।
गर्म लू के थपेड़े जारी रहेंगे
हालांकि उत्तर भारत के सभी हिस्सों में अभी लोगों को भीषण गर्मी से राहत नहीं मिलने वाली है। मौसम विभाग के मुताबिक जहां दिल्ली, उत्तर प्रदेश, मध्य प्रदेश और राजस्थान के कई हिस्सों में आज बारिश हो सकती हैं तो वहीं कुछ हिस्सों में अभी भी भीषण गर्मी और लू के थपेड़े जारी रहेंगे। लोगों को सलाह दी गई है कि वह 11 बजे से शाम 4 बजे तक घर से बाहर धूप में न निकलें। ज्यादा से ज्यादा पानी या नीबू पानी पिएं और हल्के कपड़े पहने।",1.0
