title,url,source,date,language,state,district,search_term,full_text,relevance_score
Penang JPN Enhances Preparedness Of 398 Schools To Face Heat Wave - bernama,https://news.google.com/rss/articles/CBMicEFVX3lxTE5IRHVlMEtHSWRBTkVuQU0wOEF3UXlBcXFVNzdxdjcxWURjczJjeEFVTVhvRC1qdzczbVN4VV9zRmRXVHB2MmRza2NNbnNGZkV1ZWYzUlQwWjVSV09HTjR5ekpxeklacGZ0dzdYODFwdG4?oc=5,bernama,2026-03-30T12:45:06+05:30,en,Assam,,"(heatwave OR ""heat wave"" OR ""severe heatwave"" OR ""extreme heat"" OR ""heat spell"" OR ""scorching heat"" OR ""blistering heat"" OR ""sweltering heat"" OR ""hot winds"" OR loo OR ""hot loo winds"" OR ""intense heat"" OR ""unbearable heat"" OR ""deadly heat"" OR heat OR ""weather forecast"" OR ""weather update"" OR ""weather alert"" OR ""IMD forecast"" OR ""IMD prediction"" OR ""IMD alert"" OR IMD OR ""rising temperatures"" OR ""temperatures expected to rise"" OR ""relief from heat"" OR ""respite from heat"" OR ""heat respite"" OR ""respite from scorching heat"") Assam","GEORGE TOWN, March 30 (Bernama) -- The Penang State Education Department (JPN) is taking proactive steps by strengthening the preparedness of schools throughout the state in the face of the current heat wave.
State Education director Mohamad Dziauddin Mat Saad said this included holding an engagement session with all headmasters, principals and the District Education Office (PPD) to ensure that all 398 schools make preparations before the school session reopens, based on guidelines issued by the Ministry of Education (MOE).
He said that as a result of the engagement last Friday, schools had taken immediate action by informing parents in advance about the adjustment of schedules and students' needs during the hot weather period, including giving schools autonomy to determine more comfortable clothing.
“Parents have also been informed about this preparation to give confidence that the school will ensure that the three main things, namely the health, welfare and safety of students, are always taken care of.
“That is why we can see that on the first day of school opening today, children came wearing T-shirts, carrying water supplies, mini fans and the school even took the initiative to provide water supplies in the canteen,” he told reporters after conducting a survey at Sekolah Kebangsaan (SK) Sungai Gelugor here today.
Commenting further, Mohamad Dziauddin said JPN was also paying attention to the school infrastructure aspects, especially involving fans, windows and ventilation systems to ensure that the learning environment remains conducive.
In this regard, he said the Infrastructure and Procurement Sector had been instructed to immediately review any issues related to the facilities so that repair work could be carried out immediately.
He also said that outdoor activities such as sports and co-curricular activities could still continue with certain adjustments, including being carried out in covered areas or early in the morning to avoid exposure to hot weather.
Although Penang is not in the level on the current situation, Mohamad Dziauddin said that monitoring is being carried out continuously and his party is always in close contact with the Malaysian Meteorological Department (MetMalaysia) to obtain the latest weather information to be distributed to schools.
He informed that so far, there is no need to implement Teaching and Learning at Home (PdPR) and school sessions will continue to be held face-to-face.
In addition, he said that as part of the educational approach, schools are also encouraged to perform the Istisqa’ sunnah prayer to pray for rain.
-- BERNAMA
BERNAMA provides up-to-date authentic and comprehensive news and information which are disseminated via BERNAMA Wires; www.bernama.com; BERNAMA TV on Astro 502, unifi TV 631 and MYTV 121 channels and BERNAMA Radio on FM93.9 (Klang Valley), FM107.5 (Johor Bahru), FM107.9 (Kota Kinabalu) and FM100.9 (Kuching) frequencies.
Follow us on social media :
Facebook : @bernamaofficial, @bernamatv, @bernamaradio
Twitter : @bernama.com, @BernamaTV, @bernamaradio
Instagram : @bernamaofficial, @bernamatvofficial, @bernamaradioofficial
TikTok : @bernamaofficial",0.6833333333333333
