title,url,source,date,language,state,district,search_term,full_text,relevance_score
"चंडीगढ़ में बदला माैसम: ऑरेंज व येलो अलर्ट जारी, पांच दिन तक रहेगा बादलों का डेरा; तेज हवाएं चलने के आसार - Amar Ujala",https://news.google.com/rss/articles/CBMinwFBVV95cUxNcUItcG9NWEp2ZWdua0lQN1VaQlRHX0M5SFFBSEY0cDRXc1hycEsxXzRWQmxmUldHMVJ1eXR1WG56Zjlrd3dxVl9PVXVlU3o5b1E0Q3ZDTHlOMkZBYzVMNFJvQ3NHM1g4QkppcU5tZFA5Wk1wNjZvek1FZk4waTAwUDdLWmV4SF9jTnFHc1V1RXhoVDUzUnZuMU1seGVWWEXSAaQBQVVfeXFMTUo4RUtxelZrdFlqTG5XRFZQcnVneHNrelRXeWZWbVM4YkI4TkkyOTdNbVR4bkJpN21SbnU2M2hfOEFsSU9rTGQxZmVDZzk1WDdsTmJldHQ5OFBUTmFzVklxcXIzbDNpbEdwamdNeFpDV09yb2NWVDZ4c1ZuOHpfN2NkNzg5MlJBMXZFTE42d0d1NHZMa2o3MUdJSnozbFlyalFuTHA?oc=5,Amar Ujala,2026-04-04T09:35:03+05:30,hi,Chandigarh,Chandigarh,"(""हीट एक्शन प्लान"" OR ""गर्मी से राहत"" OR चेतावनी OR ""रेड अलर्ट"" OR ""ऑरेंज अलर्ट"" OR ""येलो अलर्ट"" OR एडवाइजरी OR ""राहत सामग्री"" OR ""राहत शिविर"" OR मुआवजा) Chandigarh","चंडीगढ़ में बदला माैसम: ऑरेंज व येलो अलर्ट जारी, पांच दिन तक रहेगा बादलों का डेरा; तेज हवाएं चलने के आसार
मौसम विभाग ने शहर के कई हिस्सों के लिए 4 अप्रैल को ऑरेंज अलर्ट जबकि 7 और 8 अप्रैल के लिए येलो अलर्ट जारी किया है। विभाग के अनुसार, अगले कुछ दिनों तक 30 से 40 किलोमीटर प्रति घंटे की रफ्तार से तेज हवाएं चल सकती हैं।
विस्तार
शुक्रवार को हुई अचानक बारिश ने जहां लोगों को चिलचिलाती गर्मी से राहत दिलाई, वहीं पूरे शहर का मिजाज भी बदल गया। मौसम केंद्र, चंडीगढ़ के अनुसार आने वाले दिनों में भी राहत का यह सिलसिला जारी रहने की संभावना है। शुक्रवार को अधिकतम तापमान 31.7 डिग्री सेल्सियस और न्यूनतम तापमान 19.9 डिग्री सेल्सियस दर्ज किया गया। बारिश और बादलों की वजह से तापमान में गिरावट जारी रह सकती है।
मौसम विभाग ने शहर के कई हिस्सों के लिए 4 अप्रैल को ऑरेंज अलर्ट जबकि 7 और 8 अप्रैल के लिए येलो अलर्ट जारी किया है। विभाग के अनुसार, अगले कुछ दिनों तक 30 से 40 किलोमीटर प्रति घंटे की रफ्तार से तेज हवाएं चल सकती हैं। इसके साथ ही गरज-चमक और बिजली गिरने की भी संभावना जताई गई है। शनिवार और रविवार को आसमान में आंशिक रूप से बादल छाए रहने का अनुमान है, जिससे तापमान में और गिरावट दर्ज हो सकती है।
रहें हर खबर से अपडेट, डाउनलोड करें Android Hindi News App, iOS Hindi News App और Amarujala Hindi News APP अपने मोबाइल पे|
Get all India News in Hindi related to live update of politics, sports, entertainment, technology and education etc. Stay updated with us for all breaking news from India News and more news in Hindi.",1.0
"बारिश से भीगा चंडीगढ़, गर्मी से राहत - Amar Ujala",https://news.google.com/rss/articles/CBMihAFBVV95cUxPOExwZWVKNmJjdFZTQ2xSZlBUUXZMYmJJbmJ1Nk9DcjMzX1dOUENrQVNNYVEwem8tTmI5QW85VHJLTzBqVFFKVTE2ZXhyOVoxOXhSN3NINWJlUU1TaTZlNFQwdnZUOGhjbDVTTC1WSmVlUzZEMTh5N2N5QldVVWZsWVhvUVbSAYoBQVVfeXFMTm1GOGt6QUpHLV9ncXg3akZaeVM2c0txb0NCbHozN1VKeHJHa09wYXVfT2JzeVVlLXJTYlFVV2JKRC1ZOFV1bnVjblZKcUpsN0lvbHAxQ3g2RXF6ek53T3NucEJfS2hnUWdoT3RGMi05ODJ1djNoUjdmVERIMnNGbmN4UkJXUW9qM3Jn?oc=5,Amar Ujala,2026-04-04T08:17:56+05:30,hi,Chandigarh,Chandigarh,"(""हीट एक्शन प्लान"" OR ""गर्मी से राहत"" OR चेतावनी OR ""रेड अलर्ट"" OR ""ऑरेंज अलर्ट"" OR ""येलो अलर्ट"" OR एडवाइजरी OR ""राहत सामग्री"" OR ""राहत शिविर"" OR मुआवजा) Chandigarh","{""_id"":""69d07bdc3aef0febdb05439b"",""slug"":""video-rain-in-chandigarh-2026-04-04"",""type"":""video"",""status"":""publish"",""title_hn"":""बारिश से भीगा चंडीगढ़, गर्मी से राहत"",""category"":{""title"":""City & states"",""title_hn"":""शहर और राज्य"",""slug"":""city-and-states""}}
चंडीगढ़ के मौसम ने एक बार फिर करवट ले ली है। शुक्रवार को हुई अचानक बारिश ने जहां लोगों को चिलचिलाती गर्मी से राहत दिलाई, वहीं पूरे शहर का मिजाज भी बदल गया। मौसम केंद्र, चंडीगढ़ के अनुसार आने वाले दिनों में भी राहत का यह सिलसिला जारी रहने की संभावना है। शुक्रवार को अधिकतम तापमान 31.7 डिग्री सेल्सियस और न्यूनतम तापमान 19.9 डिग्री सेल्सियस दर्ज किया गया। बारिश और बादलों की वजह से तापमान में गिरावट जारी रह सकती है।
मौसम विभाग ने शहर के कई हिस्सों के लिए 4 अप्रैल को ऑरेंज अलर्ट जबकि 7 और 8 अप्रैल के लिए येलो अलर्ट जारी किया है। विभाग के अनुसार, अगले कुछ दिनों तक 30 से 40 किलोमीटर प्रति घंटे की रफ्तार से तेज हवाएं चल सकती हैं। इसके साथ ही गरज-चमक और बिजली गिरने की भी संभावना जताई गई है। शनिवार और रविवार को आसमान में आंशिक रूप से बादल छाए रहने का अनुमान है, जिससे तापमान में और गिरावट दर्ज हो सकती है।
एड फ्री अनुभव के लिए अमर उजाला प्रीमियम सब्सक्राइब करें
अमर उजाला प्रीमियम वीडियो सिर्फ सब्सक्राइबर्स के लिए उपलब्ध है
प्रीमियम वीडियो
सभी विशेष आलेख
फ्री इ-पेपर
सब्सक्राइब करें
Next Article
Disclaimer
हम डाटा संग्रह टूल्स, जैसे की कुकीज के माध्यम से आपकी जानकारी एकत्र करते हैं ताकि आपको बेहतर और व्यक्तिगत अनुभव प्रदान कर सकें और लक्षित विज्ञापन पेश कर सकें। अगर आप साइन-अप करते हैं, तो हम आपका ईमेल पता, फोन नंबर और अन्य विवरण पूरी तरह सुरक्षित तरीके से स्टोर करते हैं। आप कुकीज नीति पृष्ठ से अपनी कुकीज हटा सकते है और रजिस्टर्ड यूजर अपने प्रोफाइल पेज से अपना व्यक्तिगत डाटा हटा या एक्सपोर्ट कर सकते हैं। हमारी Cookies Policy, Privacy Policy और Terms & Conditions के बारे में पढ़ें और अपनी सहमति देने के लिए Agree पर क्लिक करें।",1.0
