title,url,source,date,language,state,district,search_term,full_text,relevance_score
"उत्तराखंड में 2 मई को बजेगा आपदा अलर्ट का सायरन, मोबाइल पर आएगा चेतावनी का संदेश! - ABP News",https://news.google.com/rss/articles/CBMizAFBVV95cUxQWEk5VHBXbVREMVRyZlZ2bmtvX3VVRUZJbWFVRHcwUXc4SzVVLXlGcmVtdnpJSDJUeWhEWjlEdERvM29zUVFXQ0oxSUY1YVB5UnpEQmNCYjBjdTBQcVdmSUhtSF9NbEJwMWJ2dUNGdzYya0F5dklZUVdBeGs1akpMbHhIODhjU1RIQjFoanZlS284cWNTZldyTHVORTJ4TVk1RE4zemMyQ2g1UGctTG13YWFQTHZWQUU5eExNWHB6aTdyaVVVUE9sSVdhcEbSAdIBQVVfeXFMT0N0VEw3YmhGdWgzcUxXZ09mRnRQVkh6VzFlUF8wRWpRMzV0S0pxM1puVkhIX0xyMWpYNWxHVUZZMG1EQVlUc0hSZC1nc3VZWUZHeXpvU2VudjZGbTFvbUp1TDN1MnhxcDRRNVlhaXQ2MDJtMXpIMVhmaC0tbEJrZzRUWG5xZkRnNXFTUHptV1NURDVoT0xRYVNKNUF2SzNBM2dSd2xZVHRiN3RZZ1JuN3BvUTRGdkdheTVHdnAxc3V2SnVCblNmNFpCaF9VbmdCTndB?oc=5,ABP News,2026-05-01T12:00:40+05:30,hi,Uttarakhand,,"(""हीट एक्शन प्लान"" OR ""गर्मी से राहत"" OR चेतावनी OR ""रेड अलर्ट"" OR ""ऑरेंज अलर्ट"" OR ""येलो अलर्ट"" OR एडवाइजरी OR ""राहत सामग्री"" OR ""राहत शिविर"" OR मुआवजा) Uttarakhand","उत्तराखंड में 2 मई को बजेगा आपदा अलर्ट का सायरन, मोबाइल पर आएगा चेतावनी का संदेश!
Uttarakhand Disaster Alert: उत्तराखंड में बाढ़, भूस्खलन, भूकंप और बादल फटने जैसी आपदाएं आम हैं. अब सरकार चाहती है कि किसी भी वास्तविक संकट से पहले लोगों तक चेतावनी समय पर और प्रभावी ढंग से पहुंचे.
उत्तराखंड में अगर 2 मई 2026 को आपके मोबाइल पर अचानक कोई चेतावनी संदेश आए और फोन जोर से बजने लगे, तो घबराइए मत. यह कोई वास्तविक आपदा की सूचना नहीं, बल्कि सरकार का एक नियोजित परीक्षण है. उत्तराखंड राज्य आपदा प्रबंधन प्राधिकरण (USDMA) ने बुधवार को एक प्रेस नोट जारी कर यह जानकारी दी कि राष्ट्रीय आपदा प्रबंधन प्राधिकरण (NDMA), भारत सरकार के सहयोग से 2 मई को राज्यभर में सेल ब्रॉडकास्टिंग सिस्टम (CBS) के माध्यम से एक परीक्षण अलर्ट भेजा जाएगा.
उत्तराखंड पहाड़ी और आपदा-संवेदनशील राज्य है. बाढ़, भूस्खलन, भूकंप और बादल फटने जैसी आपदाएं यहां आम हैं. ऐसे में सरकार चाहती है कि किसी भी वास्तविक संकट से पहले लोगों तक चेतावनी समय पर और प्रभावी ढंग से पहुंचे. USDMA का कहना है कि इस परीक्षण का मकसद यह जांचना है कि आपातकालीन सूचना प्रसारण तंत्र कितना दुरुस्त है. संदेश सही समय पर पहुंच रहा है या नहीं, किन इलाकों में नेटवर्क कमजोर है, और किन क्षेत्रों में सुधार की जरूरत है.
किसे मिलेगा यह अलर्ट?
यह परीक्षण संदेश राज्य के विभिन्न दूरसंचार सेवा प्रदाताओं (Telecom Service Providers) के नेटवर्क पर आने वाले सभी मोबाइल उपयोगकर्ताओं को मिल सकता है. संदेश अंग्रेजी और हिंदी दोनों भाषाओं में भेजा जाएगा. अंग्रेजी में संदेश कुछ इस प्रकार होगा, ""India launches Cell Broadcast using indigenous technology for instant disaster alerting service for its citizens... This is a test message. Ministry of Home Affairs."" हिंदी में लिखा होगा भारत द्वारा स्वदेशी तकनीक का उपयोग करते हुए अपने नागरिकों के लिए त्वरित आपदा चेतावनी सेवा हेतु सेल ब्रॉडकास्ट का शुभारंभ...यह एक परीक्षण संदेश है.
क्या करें जब अलर्ट आए?
USDMA ने स्पष्ट किया है कि इस परीक्षण अलर्ट पर किसी भी प्रकार की कोई कार्रवाई करने की जरूरत नहीं है. न घर छोड़ें, न भागें, न अफवाह फैलाएं. बस इसे एक तकनीकी परीक्षण समझें और सामान्य जीवन जारी रखें.
असली अलर्ट आए तो?
प्राधिकरण ने यह भी स्पष्ट किया है कि भविष्य में जब भी कोई वास्तविक आपदा का खतरा होगा, तब भी इसी प्रणाली से अलर्ट जारी किया जाएगा. लेकिन उसमें ""परीक्षण संदेश"" नहीं लिखा होगा. ऐसे किसी भी वास्तविक अलर्ट को गंभीरता से लेना होगा और प्रशासन के निर्देशों का तत्काल पालन करना होगा.
USDMA का यह कदम राज्य की आपदा तैयारी को एक नए स्तर पर ले जाने की कोशिश है. CBS प्रणाली के जरिए आपातकाल में प्रशासन और जनता के बीच बेहतर तालमेल बन सकेगा. अधिकारियों का कहना है कि समय-समय पर ऐसे जागरूकता कार्यक्रम चलाए जाते रहेंगे, ताकि जब जरूरत पड़े तो कोई भी नागरिक अनजान न रहे.
टॉप हेडलाइंस
Source: IOCL",0.5166666666666666
"पश्चिमी यूपी में आंधी-बारिश और ओलावृष्टि के बाद लू से मिली राहत, आज 40 जिलों में भारी बारिश का अलर्ट, जानें बरेली का हाल - Zee News",https://news.google.com/rss/articles/CBMijwJBVV95cUxQM2VDaHUyQVFyQTVEV1R0akY5blJFLTZXaTFWWFA2a0RKRFpYZWtVRUFIVXgxNHkyYTNMYU0zcmFOdVlwTExQcGJxMGNxRWZrMEhqck1FQjVUMGRqNi01VjBtMlVDMDdreE1VakVrZndHdjJzNEtScEd4WmpUX3puMWNVQ04wbXlmRDBoWEk5QkFZNXlRTGFWVERPX3NZOWhRSTBOYjN6bUs3V0Rhczc2OVJpR3lUYXZ1Ym9RMWxMazJaVXFObE56M0NJVUJBQnlWSWRNSE9ZWS1CUjR2UnpNRFpBR3RXTmpSWk1HdVR2Y1FnSGlyX2NWck53Wm53c01fdVNtNVE0VnNVWGN0OE4w?oc=5,Zee News,2026-05-01T09:42:05+05:30,hi,Uttarakhand,,"""लू"" Uttarakhand","Bareilly Weather Rain Alert: उत्तर प्रदेश में मौसम का मिजाज बदल गया है. प्रदेश में आंधी-तूफान और बारिश का दौर शुरू हो गया है. आगे भी ज्यादातर जिलों में बारिश को लेकर एक बार फिर मौसम विभाग ने चेतावनी जारी की है. ऐसे में आइये जानते है बरेली, मुरादाबाद और संभल में आज मौसम कैसा रहेगा और AQI कितना है ?
पश्चिमी यूपी में मौसम का मिजाज बदल गया है. हम बात कर रहे हैं. शुक्रवार यानी आज बरेली के मौसम के बारें में. आपको बता दे कि आज न्यूनतम तापमान 24.7 डिग्री सेल्सियस पाया गया वही अधिकतम तापमान 38.2 डिग्री सेल्सियस तक पहुंचने की संभावना दर्ज किया जा रहा हैं.वायु गुणवत्ता को लेकर मौसम विभाग का अपडेट आया हैं. बरेली में आज हवा की गति 19.1 किमी प्रति घंटा दर्ज की गई है. AQI कि बात करें तो वर्तमान वायु गुणवत्ता सूचकांक 73 स्वस्थ स्तर है.
संभल में शुक्रवार यानी आज संभल के मौसम के बारें में.आपको बता दे कि आज न्यूनतम तापमान 26 डिग्री सेल्सियस पाया गया वही अधिकतम तापमान 40.8 डिग्री सेल्सियस तक पहुंचने की संभावना दर्ज किया जा रहा हैं.वायु गुणवत्ता को लेकर मौसम विभाग का अपडेट आया हैं.संभल में आज हवा की गति 16.6 किमी प्रति घंटा दर्ज की गई है. AQI कि बात करें तो वर्तमान वायु गुणवत्ता सूचकांक 90 स्वस्थ स्तर है.
हम बात कर रहे हैं. शुक्रवार यानी आज मुरादाबाद के मौसम के बारें में. आपको बता दे कि आज न्यूनतम तापमान 24.8डिग्री सेल्सियस पाया गया वही अधिकतम तापमान 38.3 डिग्री सेल्सियस तक पहुंचने की संभावना दर्ज किया जा रहा हैं. वायु गुणवत्ता को लेकर मौसम विभाग का अपडेट आया हैं.मुरादाबाद में आज हवा की गति 19.1 के आसपास रहेगी. AQI कि बात करें तो वर्तमान वायु गुणवत्ता सूचकांक 74 स्वस्थ स्तर है.
मौसम विभाग के अनुसार, आज यूपी के 40 से ज्यादा जिलों में आंधी, तेज हवाओं और बारिश का अलर्ट जारी किया है. जिससे लोगों को चिलचिलाती धूप और प्रचंड गर्मी से बड़ी राहत मिलेगी. साथ ही लोगों को सतर्क रहने की सलाह दी गई है. आंधी-बारिश का ये दौर मई के पहले हफ्ते तक जारी रहेगा.
मौसम विभाग ने यूपी के लिए राहत का नया अपडेट जारी किया है.उत्तर प्रदेश के लगभग 40 जिलों में मौसम तेजी से करवट लेने वाला है. मौसम विभाग के अनुसार राज्य के कई हिस्सों में तेज धूल भरी आंधी के साथ बारिश होगी और कुछ जगहों पर ओलावृष्टि की भी संभावना है.
उत्तर प्रदेश में 1 मई से 4 मई तक भारी बारिश-आंधी की चेतावनी जारी की गई है. जो जिले भारी बारिश की चपेट में रहेंगे वो हैं, सहारनपुर, मेरठ, नोएडा, मुजफ्फरनगर, गाजियाबाद, अलीगढ़, मथुरा, आगरा, बलरामपुर, कानपुर, झांसी, प्रयागराज, गोरखपुर, सोनभद्र और मऊ. वहीं, लखनऊ में 1 मई को अधिकतम तापमान 34 डिग्री सेल्सियस तो न्यूनतम तापमान 24 डिग्री सेल्सियस रहेगा.
लेख में दी गई ये जानकारी सामान्य स्रोतों से इकट्ठा की गई है. इसकी प्रामाणिकता की जिम्मेदारी हमारी नहीं है.एआई के काल्पनिक चित्रण का जी यूपीयूके हूबहू समान होने का दावा या पुष्टि नहीं करता.",1.0
