title,url,source,date,language,state,district,search_term,full_text,relevance_score
"झारखंड में गर्मी से हाल बेहाल, कई जिलों में लू और आंधी-बारिश का अलर्ट - Prabhat Khabar",https://news.google.com/rss/articles/CBMisAFBVV95cUxNZUlveEw0RXVyQWx1eHJLbU5CUVpRQjRiWlNQbGpMcXI3clVJVGJnWl9GSkxfQWJ5WFM1N0ZJcWt3Y01rbWNtanNRRm9JNVpUVVZXN0lsbzByVlR2MTBwMjM4ZGVHc1o2Y0Z3NFliSnZ1RjVHcGx0bjBrYmtoMlhhUWFPZ1R5bHc5S3d3WGVCdjdkZUpydV9OcDRTbFN3SG5DczFETEJIYmUtYTkwak9BdtIBtgFBVV95cUxNaExUdU5ramlPYUV5NjFPSkpmdFdCMlhkc2dQVndCR2Y4bGJRWkliOGpDNDAwV0MzRXVWY0VkeFViekgtb0dSbUxyenF2anRscEhVdlVodThaOHNtRnNPQkVSeXZ4eXlhLWdfVE5YZnppUV8wWFNfZV8wanVBUUxFRFF4Nm5QRzU3WWo3YkpYVTZOXzhxWGhrUGhRNmo2S0UtcERXUUp4RVhfbnloUUF0SDhTdlJsUQ?oc=5,Prabhat Khabar,2026-05-24T08:18:55+05:30,hi,Jharkhand,,"""लू"" Jharkhand","झारखंड में गर्मी से हाल बेहाल, कई जिलों में लू और आंधी-बारिश का अलर्ट
Jharkhand Weather : झारखंड में तेज धूप और बढ़ते तापमान ने लोगों की मुश्किलें बढ़ा दी हैं. कई जिलों में दिन का तापमान सामान्य से काफी ऊपर पहुंच गया है. इससे जुड़ी खबर खबर नीचे पढ़ें.
Jharkhand Weather : झारखंड में मई महीने की भीषण गर्मी ने लोगों का जनजीवन प्रभावित कर दिया है. कई जिलों में तापमान 45 डिग्री सेल्सियस के करीब पहुंच गया है, जबकि कुछ इलाकों में लू चलने की चेतावनी जारी की गई है. मौसम विभाग ने कई जिलों में आंधी, बारिश और वज्रपात का ऑरेंज अलर्ट जारी किया है. वहीं मुख्यमंत्री हेमंत सोरेन ने अधिकारियों को पेयजल व्यवस्था दुरुस्त रखने और खराब चापाकलों की मरम्मत कराने के निर्देश दिए हैं.
सीएम हेमंत सोरेन ने अधिकारियों को दिए निर्देश
भीषण गर्मी को देखते हुए मुख्यमंत्री हेमंत सोरेन ने सभी प्रशासनिक अधिकारियों को सतर्क रहने का निर्देश दिया है. उन्होंने कहा है कि सभी सरकारी कार्यालयों और सार्वजनिक स्थलों पर लोगों के लिए पीने के साफ पानी की व्यवस्था सुनिश्चित की जाए. साथ ही किसी भी गांव, टोले या मोहल्ले में पानी की कमी नहीं होनी चाहिए.
खराब चापाकलों की मरम्मत के आदेश
सीएम ने बंद पड़े चापाकलों की जल्द मरम्मत कराने और ग्रामीण इलाकों में वैकल्पिक जल व्यवस्था दुरुस्त करने का निर्देश दिया है, जिससे लोगों को पानी के लिए परेशानी का सामना न करना पड़े.
इस साल मई में बढ़ी गर्मी, कई जिलों में बारिश और आंधी का अलर्ट
मौसम विभाग ने 24 और 25 मई को रांची, कोडरमा, हजारीबाग, रामगढ़ और बोकारो में दोपहर बाद तेज हवा चलने और गरज के साथ कहीं-कहीं हल्की बारिश होने की संभावना जताई है. जबकि गिरिडीह, धनबाद, देवघर, दुमका, पाकुड़, गोड्डा व साहिबगंज में 50 से 60 किलोमीटर प्रतिघंटा की रफ्तार से आंधी चलने, वज्रपात होने और गरज के साथ कहीं-कहीं बारिश होने की संभावना है. इसे देखते हुए मौसम विभाग ने उक्त जिलों के लिए ऑरेंज अलर्ट जारी किया है. मौसम विभाग के अनुसार, 26 मई को राज्य के उत्तर-पूर्व, दक्षिणी (पूर्वी सिंहभूम, पश्चिमी सिंहभूम, सरायकेला-खरसावां) और निकटवर्ती मध्य भागों में कहीं-कहीं गरज के साथ तेज हवा और वज्रपात होने की संभावना है. यह स्थिति 29 मई तक बनी रह सकती है. इस बीच शनिवार को भी राज्य में सबसे गर्म जिला मेदिनीनगर रहा, जहां अधिकतम तापमान 44.8 डिग्री सेल्सियस दर्ज किया गया.
अंडमान पहुंचा मॉनसून, झारखंड में 7 से 10 जून तक एंट्री
भारत मौसम विज्ञान विभाग के अनुसार दक्षिण-पश्चिम मॉनसून अंडमान-निकोबार पहुंच चुका है. इसके 26 मई तक केरलम पहुंचने की संभावना है. वहीं झारखंड में मॉनसून 7 से 10 जून के बीच संताल परगना के रास्ते प्रवेश कर सकता है.

प्रभात खबर डिजिटल टॉप स्टोरी
प्रिया गुप्ता प्रभात खबर डिजिटल में जूनियर कंटेंट राइटर के रूप में कार्यरत हैं. उन्हें कंटेंट राइटिंग के क्षेत्र में एक वर्ष से अधिक का अनुभव है. वर्तमान में वह झारखंड बीट पर काम कर रही हैं, जहां वह खबरों को आसान भाषा में लिखती हैं. इससे पहले वह लाइफस्टाइल बीट पर काम कर चुकी हैं, जहां उन्होंने हेल्थ, रेसिपी, मेहंदी डिजाइन और फैशन से जुड़ी खबरों पर काम किया. इसके अलावा, उन्होंने नेशनल प्रिंटर और लोकल चैनलों में भी काम किया है. उन्होंने ग्रेजुएशन की पढ़ाई डॉ. श्यामा प्रसाद मुखर्जी विश्वविद्यालय से और मास्टर की पढ़ाई एमिटी यूनिवर्सिटी झारखंड से पूरी की है.
Prabhat Khabar App :
देश, एजुकेशन, मनोरंजन, बिजनेस अपडेट, धर्म, क्रिकेट, राशिफल की ताजा खबरें पढ़ें यहां. रोजाना की ब्रेकिंग हिंदी न्यूज और लाइव न्यूज कवरेज के लिए डाउनलोड करिए",1.0
झारखंड: मुख्यमंत्री ने भीषण लू के बीच पेयजल उपलब्धता सुनिश्चित करने के निर्देश दिए - deshbandhu.co.in,https://news.google.com/rss/articles/CBMi3gFBVV95cUxQanE2TS1IMU5WN0FKZ3FFZW9uZ1BMbXNuN1kzQ2hpM1FwaV9VbVh2YkpST2Y3YXNQb3BUUU91Z19uSG1CTHBkd0p3cWZtM3Y2bXhoTEFlZHFOVG9ya3lyM3Itcl82WnZ5OFptcXdvUUFlRGIwZ0ZMUWlUaXBuaUlGbW9fOWV2Wk1DNDFKVWxhQnhWUEhlWUhsMFhwQU5zRzNtR3J3QUhwWk9aMTFfZDNvZ2lpWGpjM0duUWJlVVNPVnRiVGhPLU5naHdnLTVNNGVac2k0WS1UOENYZ2hZSEHSAd4BQVVfeXFMUGpxNk0tSDFOVjdBSmdxRWVvbmdQTG1zbjdZM0NoaTNRcGlfVW1YdmJKUk9mN2FzUG9wVFFPdWdfbkhtQkxwZHdKd3FmbTN2Nm14aExBZWRxTlRvcmt5cjNyLXJfNlp2eThabXF3b1FBZURiMGdGTFFpVGlwbmlJRm1vXzlldlpNQzQxSlVsYUJ4VlBIZVlIbDBYcEFOc0czbUdyd0FIcFpPWjExX2Qzb2dpaVhqYzNHblFiZVVTT1Z0YlRoTy1OZ2h3Zy01TTRlWnNpNFktVDhDWGdoWUhB?oc=5,deshbandhu.co.in,2026-05-24T08:00:17+05:30,hi,Jharkhand,,"""लू"" Jharkhand","झारखंड: मुख्यमंत्री ने भीषण लू के बीच पेयजल उपलब्धता सुनिश्चित करने के निर्देश दिए
झारखंड में भीषण लू के बीच मुख्यमंत्री हेमंत सोरेन ने राज्य भर के जिला प्रशासनों और सरकारी अधिकारियों को जनता के लिए निर्बाध पेयजल उपलब्धता सुनिश्चित करने का निर्देश दिया।;
रांची। झारखंड में भीषण लू के बीच मुख्यमंत्री हेमंत सोरेन ने शनिवार को राज्य भर के जिला प्रशासनों और सरकारी अधिकारियों को जनता के लिए निर्बाध पेयजल उपलब्धता सुनिश्चित करने का निर्देश दिया।
मुख्यमंत्री ने उपायुक्तों, पुलिस अधीक्षकों, थाना अधिकारियों, सर्कल अधिकारियों, ब्लॉक विकास अधिकारियों, पंचायत प्रतिनिधियों और सभी सरकारी कार्यालयों को सार्वजनिक स्थानों और सरकारी प्रतिष्ठानों के बाहर पेयजल की पर्याप्त व्यवस्था करने का निर्देश दिया।
सोरेन ने सोशल मीडिया प्लेटफॉर्म एक्स पर एक पोस्ट में कहा कि झारखंड में लगातार बढ़ती गर्मी और लू की स्थिति को देखते हुए, सभी अधिकारियों को आम जनता के लिए पेयजल की उचित व्यवस्था सुनिश्चित करनी चाहिए और सुविधाओं के बारे में जानकारी प्रमुखता से प्रदर्शित करनी चाहिए ताकि पैदल चलने वालों और अन्य नागरिकों को राहत मिल सके।
मुख्यमंत्री ने अधिकारियों को प्रभावित क्षेत्रों में पानी की कमी की समस्या का तुरंत समाधान करने के लिए पानी के टैंकर भेजने, खराब हैंडपंपों की मरम्मत करने और जहां आवश्यक हो वहां वैकल्पिक व्यवस्था करने का भी निर्देश दिया।
उन्होंने कहा कि साथ ही, सभी उपायुक्त यह सुनिश्चित करेंगे कि जहां भी जल संकट हो, वहां टैंकरों के माध्यम से तत्काल जल आपूर्ति, हैंडपंपों की मरम्मत और अन्य वैकल्पिक व्यवस्थाएं की जाएं।
भीषण गर्मी के दौरान मानवीय और त्वरित प्रशासनिक प्रतिक्रिया की आवश्यकता पर जोर देते हुए सोरेन ने कहा कि किसी भी गांव, बस्ती या मोहल्ले को पीने के पानी की कमी का सामना नहीं करना चाहिए।
उन्होंने आगे कहा कि किसी भी गांव, बस्ती या मोहल्ले को पीने के पानी की कमी के कारण परेशानी नहीं होनी चाहिए – यह हमारी सामूहिक जिम्मेदारी है। इस भीषण गर्मी के दौरान प्रशासन को पूरी संवेदनशीलता, तत्परता और मानवीय दृष्टिकोण के साथ काम करना चाहिए। जनहित सर्वोपरि है।
झारखंड में पिछले कुछ दिनों से भीषण लू चल रही है, कई जिलों में तापमान 40 डिग्री सेल्सियस से ऊपर बना हुआ है।",1.0
