title,url,source,date,language,state,district,search_term,full_text,relevance_score
IMD issues red and orange alerts as heatwave persists across India with Banda at 48.2°C - The News Mill,https://news.google.com/rss/articles/CBMiuwFBVV95cUxPbFk3Y2VyWmdNOVdwNVoxVk1sUlo4d0piWVgwS0dPeUlQWktGTDJNRjJJM0FWdE03clFBZzNYYTF4WWp1Q0lFYUp5amhNYWdaNXlGczMzZWgxS1BCNHJ5bFdtUTdhZGJsQk8ySDhwd3VuSG9Nck1RWV9nd1pieUpPZldpS2FicnF4ZDVEZ2hqOHV1VFhKZ2JfMWt5czVtRG5pWnBHRzNXNU4taGxObFJNMnZOSFRpb0pweUpB?oc=5,The News Mill,2026-06-18T09:57:12+05:30,en,Bihar,Aurangabad,"""heatwave"" Bihar","Large areas of India continued to experience severe heatwave conditions on Thursday, with temperatures exceeding 45 degrees Celsius in multiple regions. The India Meteorological Department (IMD) issued red and orange weather alerts for several states as hospitals, civic authorities, and local administrations intensified their preparations to address heat-related health issues.
From Delhi, Uttar Pradesh, Bihar, and Rajasthan to Maharashtra, Telangana, and Gujarat, residents faced extreme heat, water shortages, and hot winds. Medical professionals urged people to remain indoors during peak afternoon hours and to maintain proper hydration.
IMD scientist Naresh Kumar informed that heatwave conditions are expected to last for at least another week throughout large sections of Northwest, Central, and East India. “We anticipate that heatwave conditions will persist across parts of Northwest, Central, and most of East India for the next 6 to 7 days. We have issued an ‘Orange Alert’ for Punjab, Haryana, NCR-Delhi region, Uttar Pradesh, Madhya Pradesh, Vidarbha, Coastal Andhra Pradesh and Odisha,” he stated. “We have also issued a ‘Red Alert’ for East Uttar Pradesh, East Madhya Pradesh and certain parts of Vidarbha for the next three days,” Kumar added.
Temperatures in the Delhi-NCR region remain above 45 degrees Celsius, with similar conditions predicted to continue throughout the week. Following the city’s first major heatstroke case of the season—a 24-year-old man from West Bengal was admitted unconscious to Dr Ram Manohar Lohia Hospital—authorities have heightened heatwave preparedness. Dr Ajay Chauhan described the patient’s condition as “still very serious,” emphasising that “heat stroke is a very life-threatening condition.” The patient began vomiting, felt extremely tired, and experienced loose motions during travel by train.
Delhi Chief Minister Rekha Gupta confirmed that the government was operating in “mission mode” to protect citizens. “13 mobile heat relief units are continuously reaching crowded areas to provide cold and clean drinking water, ORS packets, first aid, cotton gamchhas and caps,” she said on X.
AIIMS Delhi professor Neeraj Nishchal warned of the risks of dehydration and electrolyte imbalance. “As the heat increases, the sweating process in the body increases. This leads to dehydration. Along with sweat, electrolytes, especially sodium, begin to decrease. Alcohol should be completely avoided,” he advised.
Severe heatwave conditions persisted in Uttar Pradesh, particularly in Lucknow, Banda, Prayagraj, and Bundelkhand. Lucknow Civil Hospital established a special cold room and heat stress ward. Chief Medical Superintendent Devesh Chandra Pandey stated, “We have made a ward of 10 beds. We have set up a cold room area, which encapsulates three rooms where the AC is continuously on. We have stocked up on ORS and ice packs.”
IMD scientist Mohammed Danish explained that hot winds from Rajasthan and the absence of cloud cover contributed to the worsening situation. “Bundelkhand, Prayagraj and Agra are hotter than Lucknow. Banda has recorded 46-48 degrees Celsius, among the highest in the country,” he noted. Banda remained the hottest location in India for the third consecutive day with temperatures reaching 48.2 degrees Celsius.
Locals attributed the extreme heat to deforestation and illegal mining. Resident Puneet Saxena commented, “It is a sort of ‘Agni Pariksha’ for Banda residents. I believe the reason for this rise in temperature is trees being cut down and illegal mining.” Another resident, Syed Imran Ali, added, “The biggest reason is illegal cutting down of trees to make roads. All the old huge trees that caused cooling due to their shadows have ceased to exist here.”
Medical professionals in Banda reported a significant rise in heat-related illnesses, with hospitals seeing increased cases of fever, dizziness, dehydration, and vomiting. In Moradabad, paediatrician Veer Singh remarked on increasing dehydration among children, saying, “With the rise in temperature, the number of patients has also increased because people get dehydrated at a time like this.”
In Bihar, heatwave conditions affected Patna and several western districts. IMD scientist Anand Shankar reported temperatures above 40 degrees Celsius in districts including Kaimur, Rohtas, Bhojpur, and Gaya. “The discomfort level is quite high. Warm night conditions may also prevail in districts such as Kaimur, Rohtas and Aurangabad,” he said. Patna District Magistrate ordered revised school timings; classes up to standard 5 were suspended, with classes for standards 6 to 8 limited to 10:30 am from May 22 to May 26.
Maharashtra’s Vidarbha region sustained severe heatwave conditions. Meteorologist Pravin Kumar reported that Wardha recorded 47.1 degrees Celsius and Nagpur exceeded 46 degrees Celsius. “Red Alerts have been issued for Akola, Amravati and Wardha. Temperatures are likely to touch 47 degrees Celsius,” he said.
In Telangana, Government General Hospital official B V Naga Mohan Rao noted that 10 to 15 per cent of daily admissions related to heatstroke symptoms. “Temperatures are hovering around 45 to 46 degrees Celsius. I strongly advise children and elderly individuals to refrain from stepping outside during peak hours,” he stated.
Contextual forecasts from IMD meteorologist GNRS Srinivasa Rao indicated that heatwave conditions are expected to expand further across Telangana. “These high temperatures are likely to continue for the next four to five days across eastern and northern Telangana. Gradually, central Telangana districts—including Warangal, Hanumkonda, Mahabubabad, Nalgonda and Suryapet—are also expected to experience heatwave conditions over the next three to four days,” Rao said. “For the last four to five days, Hyderabad has been recording maximum temperatures ranging from 39 to 41 degrees Celsius. Yesterday, Khammam district recorded the highest temperature in the state, while Adilabad district recorded the highest last week,” he added.
Regarding the monsoon, Rao stated, “The monsoon is expected to make landfall over Kerala between May 25 and May 28. From there, it typically takes another week to reach Telangana.”
In Gujarat’s Valsad district, villagers have descended into wells over 45 feet deep using ropes and ladders to collect water due to shortages. A villager remarked, “There is a lot of water scarcity in the village and we have to take a lot of risk to get water.” Another resident said, “The water in our well has dried up. Climbing down the well and extracting water from the bottom is very risky.”
Heatwave conditions have also affected tourism in Rajasthan’s Udaipur. Restaurant owner Hemant Soni stated, “This time tourism has been greatly affected because the heat has prevented tourists from coming.” A tourist guide reported a sharp decline in foreign tourist arrivals attributed to the intense heat.
In Jharkhand’s Ranchi, Sadar Hospital established a dedicated heatstroke ward. Deputy Medical Superintendent Bimlesh Kumar Singh said, “We have made all the arrangements for heat stroke. Patients will not face any problem.”
Meteorological officials in Himachal Pradesh forecast some temporary relief from light rainfall and cloud cover. Head of the Meteorological Department Shobhit Katiyar said, “Heatwave conditions are being observed throughout Himachal Pradesh. We are likely to get very light rain tomorrow, which may provide temporary relief.” However, he cautioned that temperatures were expected to rise again after May 24.
Authorities across affected states urged the public to avoid direct sunlight exposure, remain hydrated with regular consumption of Oral Rehydration Salts and fluids, and limit outdoor activities during afternoon hours as the country confronts one of the harshest heatwave spells of the season.",1.0
"औरंगाबाद में भीषण गर्मी का प्रकोप : आज तेज लू चलने की संभावना, तापमान 39° पहुंचने का अनुमान - Prabhat Khabar",https://news.google.com/rss/articles/CBMingFBVV95cUxOQWhrMnk1Z3c0VVpCN0xfU3hSMTZ4UXltRGJSS0pKOVRvcVcxakpoV0dQaGRhdkdhdWlRRTVaQnkwUXVVWGdfMC1MN25PM2QwMGYtUHplZXlfUjJTYzZzb25aUVdYMHhDUmxrbE51bFdjaFhfSTlDRW9RclJQVkFFaUxEV1ZaTURYTHhUeE9FOGhER1NrU3Zwc2dqQ1ZHQdIBowFBVV95cUxNWlgtQXA4Qy1EWFlqcFpFdEVsS3V5ODNQeWZoZ19GYVNBMlA5ajdKMUtLa2FMOFlZZG9hck5faktwUzJHVkUyS3JjTS1UaHJhTW1sR0wtNkx2azdubTZFSkJWU3lqMlBicDVsQU9SVjlLbHU4VGNvNHU1MzlEUm1ZNUNEWGJod1loUFkxcUZQT3FqdTJtSmdwWVlUd3Q3a3M4V01r?oc=5,Prabhat Khabar,2026-06-18T06:00:27+05:30,hi,Bihar,Aurangabad,"""लू"" Bihar","औरंगाबाद में भीषण गर्मी का प्रकोप : आज तेज लू चलने की संभावना, तापमान 39° पहुंचने का अनुमान
AURANGABAD NEWS:गुरुवार को जिले मौसम में गर्मी का तेज असर देखने को मिलेगा. दिन में तेज लू चलने की संभावना है. मौसम विभाग के अनुसार अधिकतम तापमान 39 डिग्री सेल्सियस तक पहुंच सकता है, जबकि न्यूनतम तापमान 29 डिग्री सेल्सियस रहने का अनुमान है, जिससे लोगों को भीषण गर्मी का सामना करना पड़ेगा.
AURANGABAD NEWS: औरंगाबाद : गुरुवार को जिले मौसम में गर्मी का तेज असर देखने को मिलेगा. दिन में तेज लू चलने की संभावना है. मौसम विभाग के अनुसार अधिकतम तापमान 39 डिग्री सेल्सियस तक पहुंच सकता है, जबकि न्यूनतम तापमान 29 डिग्री सेल्सियस रहने का अनुमान है, जिससे लोगों को भीषण गर्मी का सामना करना पड़ेगा.हवा की रफ्तार लगभग 15 किलोमीटर प्रति घंटे रहने की संभावना है. आर्द्रता 46 प्रतिशत से 62 प्रतिशत के बीच रहने के कारण उमस भी अधिक महसूस होगी.मौसम वैज्ञानिक डॉ अनूप चौबे ने बताया कि दिन में तेज धूप रहेगी और लू का असर ज्यादा रहेगा, इसलिए लोगों को विशेष सावधानी बरतने की जरूरत है. उन्होंने कहा कि उमस का स्तर अधिक रहने से स्थिति और असहज हो सकती है.मौसम विभाग ने लोगों से दिन के समय अनावश्यक बाहर निकलने से बचने और पर्याप्त पानी पीने की सलाह दी है.
मुख्य बिंदु
अधिकतम तापमान: 39 डिग्री सेल्सियस
न्यूनतम तापमान: 29 डिग्री सेल्सियस
मौसम: दोपहर में लू चलने की संभावना
हवा: 15 किलोमीटर प्रति घंटा
आर्द्रता: 46 प्रतिशत से 62 प्रतिशत
प्रभात खबर डिजिटल टॉप स्टोरी
Prabhat Khabar App :
देश, एजुकेशन, मनोरंजन, बिजनेस अपडेट, धर्म, क्रिकेट, राशिफल की ताजा खबरें पढ़ें यहां. रोजाना की ब्रेकिंग हिंदी न्यूज और लाइव न्यूज कवरेज के लिए डाउनलोड करिए",1.0
