title,url,source,date,language,state,district,search_term,full_text,relevance_score
"Heatwave Intensifies in Telangana, Nizamabad Tops at 44.4°C - Deccan Chronicle",https://news.google.com/rss/articles/CBMixAFBVV95cUxNa3FjN2hMcDI2V0ZZLXR1SjVmYnc2cmxVcHZIS3dPRnY4T1BJR2xZUnBHdlV3aVFwb3FGQ3hOM0NDenkwTGJuaWRmVmFJWExkMUNILWRxWlZuSlE0VzN6MHczdGNOek1YMnZ2eTNpWmtsNFo1LXgzMWdhT3hpY1FsTGZCcFFsME5aSmRvQldjRHZuX0Y4OXhlWlo1ZHFJalBEV0JsaUNpellWOGhLOGd4eGI4b1JoSzQ0ZVZ0dnFyczBLT2NR0gHEAUFVX3lxTE1rcWM3aExwMjZXRlktdHVKNWZidzZybFVwdkhLd09GdjhPUElHbFlScEd2VXdpUXBvcUZDeE4zQ0N6eTBMYm5pZGZWYUlYTGQxQ0gtZHFaVm5KUTRXM3owdzN0Y056TVgydnZ5M2laa2w0WjUteDMxZ2FPeGljUWxMZkJwUWwwTlpKZG9CV2NEdm5fRjg5eGVaWjVkcUlqUERXQmxpQ2l6WVY4aEs4Z3h4YjhvUmhLNDRlVnR2cXJzMEtPY1E?oc=5,Deccan Chronicle,2026-04-26T12:36:03+05:30,en,Telangana,Adilabad,"""heatwave"" Telangana","Heatwave Intensifies in Telangana, Nizamabad Tops at 44.4°C
State records average maximum of 41.8°C, temperatures remain above normal across districts
Hyderabad: Telangana continued to reel under intense summer heat with several districts recording above-normal temperatures and heatwave-like conditions prevailing across the state.
According to official data, the state’s average maximum temperature stood at 41.8°C, which is 0.8°C above normal. Nizamabad recorded the highest temperature of 44.4°C at Mendora, making it the hottest location in the state for the day.
Other districts also witnessed soaring temperatures, with Jagtial registering 44.3°C, Kamareddy and Mancherial touching 44.2°C each. Several northern and central districts including Nirmal, Peddapalli, and Adilabad also reported temperatures above 44°C.
Even districts in southern and eastern parts of the state experienced high temperatures, with Nalgonda and Bhadradri Kothagudem recording around 44°C.
In the capital, Hyderabad registered a maximum temperature of 41.6°C, slightly above the normal for this time of the year.",1.0
"Amid heatwave, four Telangana cities rank in world’s 100 hottest places - The Siasat Daily",https://news.google.com/rss/articles/CBMiowFBVV95cUxQT1Q4eU9fT3N5RFl4V2pfWkhuSVBjdk9jOUpFM2ZzNXpBMl9TWjB5a0NPUnF4UENRcDQ0RFYwLWtMYnJWSjFEdG5uam9GNXJ6dWtkOXlWdnFOU2RyQmV6R1kxT0N0ZU11Z2pHR1FDV2NzRWZXalpsdWIwU3VrakJkZWdfbVp0UDZSQ0FnTm5xbXRVYlY5WHlMTXFWU25UMDVhaVlz0gGoAUFVX3lxTFA1NU9NWlk0ZUtwZGduZ0lFdFJjY0JmWm9LUTVCRlRBcFFjX21qUmZKRmgzYVBZcU1KRXlSWTVHelZ1NzlhQmNpYzVPaWs2X2J3OGxwNzg1a0lNUXcwRG9RckIyM1kwTXhXdnFsbmZRUDUzejJJeVh5TUhrWWxFZG91bURKUVQyUzdCUUdPTmg1LUhkSE4tOHpGa2VURVhnYzVCeVdXUmRKZA?oc=5,The Siasat Daily,2026-04-26T09:33:00+05:30,en,Telangana,Adilabad,"(heatwave OR ""heat wave"" OR ""severe heatwave"" OR ""extreme heat"" OR ""heat spell"" OR ""scorching heat"" OR ""blistering heat"" OR ""sweltering heat"" OR ""hot winds"" OR loo OR ""hot loo winds"" OR ""intense heat"" OR ""unbearable heat"" OR ""deadly heat"" OR heat OR ""weather forecast"" OR ""weather update"" OR ""weather alert"" OR ""IMD forecast"" OR ""IMD prediction"" OR ""IMD alert"" OR IMD OR ""rising temperatures"" OR ""temperatures expected to rise"" OR ""relief from heat"" OR ""respite from heat"" OR ""heat respite"" OR ""respite from scorching heat"") Telangana","Hyderabad: Four locations in Telangana – Ramagundam, Mancherial, Kothapet and Adilabad – have featured among the top 100 hottest places in the world, as heatwave conditions intensify, with temperatures in the region ranging between 43 and 44 degrees Celsius.
At the national level, the hottest cities on Saturday, April 25, included Banda in Uttar Pradesh, followed by Akola, Bhusawal and Jalgaon in Maharashtra, and Jaisalmer in Rajasthan.
The rankings fluctuate throughout the day as fresh temperature data is updated.
Meteorological experts said the high temperatures in northern Telangana districts such as Adilabad and Mancherial are not unusual, given their proximity to the heat-prone Vidarbha region of Maharashtra.
India Meteorological Department (IMD) scientist Dharma Raju told Times of India that the region falls in a “heat core zone,” where persistent dry northerly winds, low humidity, minimal vegetation and clear skies combine to significantly raise surface temperatures.
In the case of Ramagundam in Peddapalli district, experts attribute the elevated heat partly to its industrial profile, including the presence of National Thermal Power Corporation (NTPC) infrastructure, which contributes to localised heat generation.
Urban areas are facing an equally pressing challenge. Kothapet in Hyderabad, situated along the Musi River, acts like a basin that traps and retains heat, urban biodiversity researcher G Sailu told Times of India, adding that declining groundwater levels further limit the land’s natural ability to regulate temperature.
Environmental experts warned that more places in Telangana could feature in such rankings if ecological degradation and loss of water bodies continue unchecked.",1.0
Telangana Heatwave Alert as Temps Near 45C - INDToday,https://news.google.com/rss/articles/CBMid0FVX3lxTE9YVXBjT3lKLXhoS3lpUkpfUmVQTVVOV3U0REZ4eExROWhJdnA0YWZGc1FTUmdpYjRidEwteHhOZEsyUm5PRlVmSGV0a00wVHJ1VUliaVlxSjU1anZWU19nYWp6dGhEYjRFNEZUNUxXNFRBc2NsLXc0?oc=5,INDToday,2026-04-26T09:38:22+05:30,en,Telangana,Adilabad,"(heatwave OR ""heat wave"" OR ""severe heatwave"" OR ""extreme heat"" OR ""heat spell"" OR ""scorching heat"" OR ""blistering heat"" OR ""sweltering heat"" OR ""hot winds"" OR loo OR ""hot loo winds"" OR ""intense heat"" OR ""unbearable heat"" OR ""deadly heat"" OR heat OR ""weather forecast"" OR ""weather update"" OR ""weather alert"" OR ""IMD forecast"" OR ""IMD prediction"" OR ""IMD alert"" OR IMD OR ""rising temperatures"" OR ""temperatures expected to rise"" OR ""relief from heat"" OR ""respite from heat"" OR ""heat respite"" OR ""respite from scorching heat"") Telangana","Telangana Heatwave Alert | Hyderabad, April 26: Telangana will face severe heat for the next three days. Weather experts warned that temperatures will rise sharply from April 26 to April 28.
North Telangana districts will see the worst conditions. Temperatures may touch 45°C in several places.
Officials named Adilabad, Kumuram Bheem Asifabad, Nirmal, Mancherial, and Nizamabad among the hottest districts.
People in these areas may face strong heat and dry winds.
Telangana Heatwave Alert in Hyderabad
Hyderabad will also see intense summer heat.
Some parts of the city may record up to 43°C during the next three days. Hot winds may increase discomfort across the capital.
Officials urged people to stay indoors during peak afternoon hours. They asked citizens to avoid travel between 12 noon and 4 pm unless necessary.
People should drink enough water and wear light clothes. Doctors also advised people to watch for signs of heatstroke.
Children, senior citizens, and people with health issues should take extra care. However, relief may arrive from April 28.
Rain with thunder may start first in south and west Telangana. Later, showers may spread to Hyderabad and other districts.
These rains may lower temperatures and ease the heatwave. Emergency teams are watching the weather closely.
Officials asked citizens to follow updates and stay safe during the next few days.
Now you can get the latest stories from Indtoday on Telegram every day. Click the link to subscribe. Click to follow Indtoday’s Facebook page, Twitter, and Instagram. For all the latest Hyderabad News updates and Follow us on GoogleNews",1.0
"Telangana Heatwave: Red Alert in Adilabad as Temperatures Hit 46°C, Thunderstorms Expected - Telangana Tribune",https://news.google.com/rss/articles/CBMivgFBVV95cUxNMm1Ya3BGbGdIUUlJSV8tT0pHREhRM0F4R1Uya1lYXzFfZ0ZzRTVBcjg1Y3YySE5VbTJJQlgwN2Q5VkxvMm1wTTlkaFh6djJZOFZQT090QWZ6QXhReUFCRjhhYjNRZWdtTS1IQ2VDRzZfbk45VXdnRmt5NjBZV3N2eTYwOF9jTTRqeVd6T2RJd1ZRSnJHZnBlanUtQlpmT1RrT1NfZHNtRlRmbXZuNExndGR1SkhMaFFMQjMtNTh3?oc=5,Telangana Tribune,2026-04-26T12:02:52+05:30,en,Telangana,Adilabad,"(""heat advisory"" OR ""heat action plan"" OR ""heat alert"" OR ""IMD warning"" OR ""IMD alert"" OR ""red alert"" OR ""orange alert"" OR ""yellow alert"" OR ""NDMA advisory"" OR ""cooling shelter"" OR ""relief measures"" OR ""heat compensation"" OR ""severe weather warning"") Telangana","Telangana is experiencing an intense heatwave with several districts recording extreme temperatures between 44°C to 46°C. The India Meteorological Department has issued a Red Warning for eight districts in the state, including Adilabad, Asifabad, Nirmal, Nizamabad, Jagitial, Mancherial, Bhupalapally, and Mulugu. These areas are facing severe dry heat conditions, posing significant health risks to residents. Authorities have advised people to stay indoors during peak afternoon hours and take necessary precautions to avoid heat-related illnesses.
An Orange Alert has been issued for multiple districts where temperatures are expected to range between 43°C to 45°C. The affected areas include Karimnagar, Peddapalli, Kamareddy, Sircilla, Nalgonda, Suryapet, Warangal, Hanmakonda, Gadwal, Wanaparthy, and Nagarkurnool. Additionally, humid heat conditions are prevailing in Khammam, Bhadradri, Suryapet, and Mahabubabad, where actual temperatures are around 42°C but the real feel temperature reaches 44°C to 45°C due to high humidity levels.
The state capital Hyderabad and surrounding districts including Medchal, Rangareddy, Sangareddy, Medak, Siddipet, Yadadri-Bhongir, Mahabubnagar, and Narayanpet are under a Yellow Alert. These areas are recording temperatures between 42°C to 43°C. Residents in the capital city have been experiencing sweltering conditions, with power consumption reaching peak levels as people rely heavily on air conditioning and cooling systems to cope with the extreme heat.
Weather forecasters have indicated that April 30 will mark the last day of the current heatwave spell. Relief is expected to arrive from April 27 or 28 when thunderstorms are likely to develop across southern, western, and eastern parts of Telangana. The anticipated weather change is expected to bring down temperatures significantly and provide much-needed respite to the heat-affected population across the state.
Health officials have urged citizens to drink plenty of water, avoid direct sun exposure between 11 AM to 4 PM, and watch for symptoms of heat exhaustion including dizziness, nausea, and excessive sweating. Agricultural activities have been particularly affected by the extreme heat, with farmers advised to schedule outdoor work during early morning or late evening hours. The state government has directed district administrations to ensure adequate availability of drinking water and set up temporary relief centers in severely affected areas.",1.0
