title,url,source,date,language,state,district,search_term,full_text,relevance_score
అదృష్టం అంటే వీరిదే..జలపాతంలో కొట్టుకుపోతూ బతికేశారు! - Vidhaatha,https://news.google.com/rss/articles/CBMiqgFBVV95cUxQMUdDcnhOUnRtc0p5ZVBHeFp0eTVnN09BRlhQZ1prVGFqWFhPbGg2UU14ZUxNYV9GR3NUcmx0dVoxNk9zb29VV1VMU3RsSjdTcFV3NWVMdS1zckhIb3EzZ0hRd3lvSzYzcEJFbTNadWJJQ2RWc0ZxVl9qbFVXVzN4T1JuYU92a0pvMHQzeFRycUFVaDN1ZFJtTkk3VkVsb29wMmNNd0p5UG9uUdIBrwFBVV95cUxPVTlnSHRCcGxPSnBPVVpKMFVWdXYyUUR1MlhhOXg5QXp5cENHMk5TZVRWbVltVHpuZjhuVTFzdFBrQjlEaEoyakdYZ3dkYUc3Z2RUclJMZzdSOF9uZUdnOWpBUXItU2g0dW5adEk4TXFTSkg1VUVfbTNOeXlpSVZnX0VucXpQUzdvc3hFei11eDRMWXlwZkgyb3A4MkFyX0ZZZXpVdWVKal8tTHJPZmJN?oc=5,Vidhaatha,2026-07-07T16:35:20+05:30,te,Andhra Pradesh,,"(హెచ్చరిక OR ""సహాయ చర్యలు"" OR ""రెడ్ అలర్ట్"" OR ""ఆరెంజ్ అలర్ట్"" OR ""ఎల్లో అలర్ట్"" OR ""హీట్ యాక్షన్ ప్లాన్"" OR ""సహాయ శిబిరం"" OR నష్టపరిహారం) Andhra Pradesh","భూమిపై నూకలుంటే ఎన్ని ప్రాణ గండాలైన దాటేస్తారనడానికి జలపాతం వరద ఉదృతిలో చిక్కిన ఇద్దరు యువకుల అదృష్ట ఘటన నిదర్శనంగా నిలుస్తుంది. కర్ణాటకలోని మల్లల్లి జలపాతం వద్ద హెచ్చరిక సంకేతాలను విస్మరించి రక్షణ కంచెను దాటిన ఓ ఇద్దరు ఇంజనీరింగ్ విద్యార్థులు అద్భుతంగా ప్రాణాలతో బయటపడిన వీడియో వైరల్ గా మారింది.
సోమవార్పేట తాలూకాలోని మల్లల్లి జలపాతం వద్ద ప్రవహిస్తున్న నదీ ప్రవాహంలోకి ఆంధ్రప్రదేశ్కు చెందిన గణేష్ నాయక్ (21), సంతోష్ కుమార్ (23) అనే ఇద్దరు ఇంజనీరింగ్ విద్యార్ధులు దిగారు. అదే సమయంలో మల్లలి జలపాతం సమీపంలోని జలవిద్యుత్ కేంద్రం నుండి అకస్మాత్తుగా వచ్చిన నీటి ప్రవాహంతో పెరిగిన జలపాతం వరద ఉదృతిలో వారిద్దరు చిక్కుకుపోయారు. గంటసేపు ఉధృతంగా ప్రవహిస్తున్న ప్రవాహం నుంచి జలపాతంలోని దిగువకు కొట్టుకపోకుండా కొండరాళ్లను పట్టుకున్నారు. వారు ఉన్న చోట కొంత వరద ఉదృతి తక్కువగా ఉండి..వారి చుట్టు మాత్రం వరద ఉదృతి దిగువకు భయంకరంగా దూసుకెలుతుండటం చూస్తుంటే వారు బతకడం అసాధ్యం అనిపించకమానదు.
మల్లల్లి జలపాతంలో ఇద్దరు యువకులు చిక్కుకున్న సమాచారాన్ని అందుకున్న ‘టూరిస్ట్ మిత్ర’ నాగేంద్ర నేతృత్వంలోని అగ్నిమాపక, అత్యవసర సేవల సిబ్బంది ఘటన స్థలానికి చేరుకుని, స్థానికుల సహాయంతో బరువైన తాడులను ఉపయోగించి వారిని సురక్షితంగా బయటకు లాగారు. శక్తివంతమైన ఉధృత ప్రవాహంలో వారు కొట్టుకపోకుండా కాపాడారు. ఈ సంఘటన జలపాతాల వద్ద ఎదురయ్యే ప్రమాదాలను ఎత్తి చూపుతోంది. జలపాతాలు, కొండలు, నది ప్రాంతాలు, సముద్ర తీరాల వద్ద భద్రతా నియమాలను పాటించకుండా ఇష్టా రాజ్యంగ వ్యవహరించే వారికి ఈ ఘటన ఓ హెచ్చరిక వంటిదని నెటిజన్లు కామెంట్లు చేస్తున్నారు.
DRAMATIC RESCUE AT MALLALLI FALLS: Two tourists from Andhra Pradesh, Ganesh Naik (21) & Santosh Kumar (23), had a miraculous escape after getting stranded in raging river currents at Mallalli Falls, Somwarpet taluk. 🧵👇#MallalliFalls #Somwarpet #CoorgTourism #KarnatakaTourism… pic.twitter.com/sO93KmVAze
— Akshay Gowda (@akshay_gowda_pv) July 6, 2026",0.31666666666666665
