title,url,source,date,language,state,district,search_term,full_text,relevance_score
"ఆంధ్రప్రదేశ్, తెలంగాణలో రాబోయే 5 రోజులు వర్షాలు.. ఐఎండీ అలెర్ట్! | Hindustan Times Telugu - Hindustan Times",https://news.google.com/rss/articles/CBMi7wFBVV95cUxQczdab1A1XzFPOU5pUEZEWHU1bkM0SnQ1Vjg0eHRZMVhJTkE0Rkg5SXZvbk1ZWnVrVS1yNElBX2k5Y0xHTmFFc2FUYVpxZ0k4eVRpbmRRalZ4R0NXM1VfaEF0OXlyYW9hV1hQeV8zSC00Qzg0M2RUejc1SkYxSmpIVjZZQ0phM0d4QXctQ1ZsR1NWbjJPVTNUdm9rTWcyUDhrM0ctYjV3VEpxYkIwNlpBNWgyT1B6d202LTYxUDQ3WW9oVEtUX0ZCWV9KeUYxMEtkVEJwdHlYbHdpVVM1d1FoeWJxSnhSLUZXdWZ1OHFOQdIB7wFBVV95cUxQczdab1A1XzFPOU5pUEZEWHU1bkM0SnQ1Vjg0eHRZMVhJTkE0Rkg5SXZvbk1ZWnVrVS1yNElBX2k5Y0xHTmFFc2FUYVpxZ0k4eVRpbmRRalZ4R0NXM1VfaEF0OXlyYW9hV1hQeV8zSC00Qzg0M2RUejc1SkYxSmpIVjZZQ0phM0d4QXctQ1ZsR1NWbjJPVTNUdm9rTWcyUDhrM0ctYjV3VEpxYkIwNlpBNWgyT1B6d202LTYxUDQ3WW9oVEtUX0ZCWV9KeUYxMEtkVEJwdHlYbHdpVVM1d1FoeWJxSnhSLUZXdWZ1OHFOQQ?oc=5,Hindustan Times,2026-07-07T16:47:54+05:30,te,Andhra Pradesh,,"(""వడ గాలులు"" OR ""ఎండ వేడి"" OR ""భారీ ఎండలు"" OR ""హీట్ వేవ్"" OR ""ఉష్ణ తరంగం"" OR ""కడ ఎండలు"" OR మండుటెండ OR ""ఎండల తీవ్రత"" OR ""అసాధారణ ఎండలు"" OR ""తీవ్ర ఎండలు"") Andhra Pradesh","నైరుతి రుతుపవనాల ప్రభావం, బంగాళాఖాతంలో ఏర్పడిన వాతావరణ పరిస్థితుల కారణంగా రాబోయే ఐదు రోజుల పాటు ఆంధ్రప్రదేశ్, తెలంగాణ రాష్ట్రాల్లో తేలికపాటి నుండి మోస్తరు వర్షాలు కురిసే అవకాశం ఉందని భారత వాతావరణ శాఖ (IMD) వెల్లడించింది. వర్షంతో పాటు గంటకు 50 నుండి 60 కిలోమీటర్ల వేగంతో బలమైన ఈదురు గాలులు వీచే ప్రమాదం ఉందని వాతావరణ అధికారులు హెచ్చరించారు.
తెలంగాణ రాష్ట్రంలో విస్తారంగా కాకుండా అక్కడక్కడా మాత్రమే వర్షాలు కురిసే అవకాశం ఉందని ఐఎండీ తెలిపింది. రాబోయే ఐదు రోజుల్లో రాష్ట్రంలోని పలు జిల్లాల్లో ఉరుములు, మెరుపులతో కూడిన తేలికపాటి నుండి మోస్తరు వర్షాలు పడవచ్చు. ముఖ్యంగా వరంగల్, హన్మకొండ, ఖమ్మం, నల్గొండ, సూర్యాపేట, హైదరాబాద్ పరిసర జిల్లాల్లో సాయంత్రం లేదా రాత్రి సమయాల్లో ఈదురు గాలులతో కూడిన జల్లులు పడే అవకాశం ఉంది. బలమైన గాలుల పట్ల ప్రజలు, రైతులు అప్రమత్తంగా ఉండాలని అధికారులు సూచించారు.
ఆంధ్రప్రదేశ్ రాష్ట్ర విపత్తు నిర్వహణ సంస్థ తెలిపిన వివరాల ప్రకారం.. కోస్తాంధ్ర, రాయలసీమ ప్రాంతాల్లో మోస్తరు వర్షాలు కురిసే అవకాశం ఉంది. ఉత్తర కోస్తాలోని శ్రీకాకుళం జిల్లాతో పాటు విజయనగరం, పార్వతీపురం మన్యం, అల్లూరి సీతారామరాజు జిల్లాల్లోని కొన్ని ప్రాంతాల్లో తేలికపాటి నుండి మోస్తరు వర్షాలు కురుస్తాయని అధికారులు స్పష్టం చేశారు. అలాగే, దక్షిణ కోస్తా, రాయలసీమ జిల్లాల్లో ఎండ తీవ్రతతో పాటు సాయంత్రానికి వాతావరణం చల్లబడి ఉరుముల జల్లులు పడే అవకాశం ఉంది.
నైరుతి రుతుపవనాల కదలికల వల్ల తీరం వెంబడి గాలుల తీవ్రత ఎక్కువగా ఉంటుంది. అందువల్ల మత్స్యకారులు సముద్రంలోకి వేటకు వెళ్లవద్దని, జనాలు పిడుగులు పడే సమయంలో చెట్ల కింద, విద్యుత్ స్తంభాల వద్ద ఆశ్రయం పొందకూడదని విపత్తు నిర్వహణ శాఖ హెచ్చరించింది.",0.31666666666666665
తెలంగాణకు వాతావరణ శాఖ 'ఎల్లో అలర్ట్'..రాబోయే 3 గంటల్లో వర్షం! - NewsMeter Telugu,https://news.google.com/rss/articles/CBMiuAFBVV95cUxPWmhRUTBtX1BVZnczckVudWx1QkhvdmVZOF9IUUdKbVpYMlJveVNNSlA2ajRnbTU4Q3gyR2F2YzhxMFVubDB5ajdXZ3RsZkU4aHdLUzZBaWJNY3RjTHFGVFhhQ181VU1IeUFpNFRheU5hRWxpSDVLWFVYUFEyWWNtaW1XZ2tUYktYVkdyMEg4NzBMSjhhX2I0WVhaS0FyUElsT3ZTTkN6eXNvUzZhakFEZFdFVUNERGFq?oc=5,NewsMeter Telugu,2026-07-07T17:26:44+05:30,te,Andhra Pradesh,,"(హెచ్చరిక OR ""సహాయ చర్యలు"" OR ""రెడ్ అలర్ట్"" OR ""ఆరెంజ్ అలర్ట్"" OR ""ఎల్లో అలర్ట్"" OR ""హీట్ యాక్షన్ ప్లాన్"" OR ""సహాయ శిబిరం"" OR నష్టపరిహారం) Andhra Pradesh","తెలంగాణకు వాతావరణ శాఖ 'ఎల్లో అలర్ట్'..రాబోయే 3 గంటల్లో వర్షం!
హైదరాబాద్తో పాటు తెలంగాణలోని పలు జిల్లాలకు భారత వాతావరణ శాఖ (IMD) ఎల్లో అలర్ట్ జారీ చేసింది. రాబోయే మూడు గంటల్లో గంటకు 5 మిల్లీమీటర్ల వరకు తేలికపాటి వర్షాలు కురిసే అవకాశం ఉందని హెచ్చరించింది.
హైదరాబాద్, మేడ్చల్-మల్కాజ్గిరి, రంగారెడ్డి, వికారాబాద్, సిద్దిపేట, మెదక్, జనగాం, వరంగల్, హన్మకొండ, మహబూబాబాద్, కరీంనగర్, పెద్దపల్లి, రాజన్న సిరిసిల్ల, మహబూబ్నగర్, నాగర్కర్నూల్ జిల్లాల్లో ఈ వర్షాలు కురిసే అవకాశం ఉందని వాతావరణ కేంద్రం తెలిపింది.
వర్షాల కారణంగా లోతట్టు రహదారులు జలమయం కావడం, దృశ్యమానత (విజిబిలిటీ) తగ్గడం వంటి సమస్యలు ఎదురయ్యే ప్రమాదం ఉన్నందున, ప్రయాణాలు చేసేటప్పుడు ప్రజలు అప్రమత్తంగా ఉండాలని అధికారులు సూచించారు. మారుతున్న వాతావరణ పరిస్థితులకు అనుగుణంగా ఎప్పటికప్పుడు తాజా సమాచారాన్ని గమనిస్తూ ఉండాలని వాతావరణ శాఖ కోరింది.",0.8333333333333333
El Nino: ఎల్-నినో ప్రభావంపై ఏపీ హై అలర్ట్.. ‘జీరో లాస్’ లక్ష్యంతో అన్ని శాఖలు అప్రమత్తం! - AndhraPravasi,https://news.google.com/rss/articles/CBMiywFBVV95cUxOWE8wd3UtTUNTUFNvcXRCVTBNNGp4Z0NsUkVuRS1tUFNxZk4yZWlqdXBHUV9BVmFfcmtjcmJueWxiNnV6NC1ZYVhpNDZmWFdqcXBCUWxlMGI4SDhmQ2Zqay01cTJLNnoyRGduNVZUSGhpWGxtRXpWaWhCZ3V1UWY2RExmRHRIOE5rWmFXLWdsenpmU2NMd0phNnIyVGdiWmdOOFpaQ25NUWZtMVN1b0Q3ejBNcWppQ19kZlBKVkRBUDV6ZDNYSkxPS1dibw?oc=5,AndhraPravasi,2026-07-07T19:38:00+05:30,te,Andhra Pradesh,,"(హెచ్చరిక OR ""సహాయ చర్యలు"" OR ""రెడ్ అలర్ట్"" OR ""ఆరెంజ్ అలర్ట్"" OR ""ఎల్లో అలర్ట్"" OR ""హీట్ యాక్షన్ ప్లాన్"" OR ""సహాయ శిబిరం"" OR నష్టపరిహారం) Andhra Pradesh","వర్షాభావం, విపత్తుల ముప్పు.. రాష్ట్ర యంత్రాంగానికి హై అలర్ట్..
ప్రజల ప్రాణాలు, జీవనోపాధి రక్షణే ప్రథమ ప్రాధాన్యం: మంత్రి వంగలపూడి అనిత..
అమరావతి: ఎల్-నినో ప్రభావంతో ఈ ఏడాది నైరుతి రుతుపవనాల కాలంలో వర్షాభావం, ప్రకృతి విపత్తులు ఎదురయ్యే అవకాశాల నేపథ్యంలో రాష్ట్ర ప్రభుత్వం అన్ని శాఖలను అప్రమత్తం చేసింది. ప్రజల ప్రాణాలు, జీవనోపాధి రక్షణే ప్రభుత్వ అత్యున్నత ప్రాధాన్యత అని రాష్ట్ర హోం, విపత్తుల నిర్వహణ శాఖ మంత్రి వంగలపూడి అనిత స్పష్టం చేశారు. వాతావరణ హెచ్చరికల ఆధారంగా ముందస్తు చర్యలు తీసుకుని ‘జీరో లాస్’ లక్ష్యంతో పనిచేయాలని అధికారులను ఆదేశించారు.
మంగళవారం అమరావతిలోని ఆంధ్రప్రదేశ్ రాష్ట్ర విపత్తుల నిర్వహణ సంస్థ (APSDMA) కార్యాలయంలో జరిగిన ఉన్నతస్థాయి సమీక్ష సమావేశంలో మంత్రి పాల్గొన్నారు. ఈ సమావేశంలో APSDMA మేనేజింగ్ డైరెక్టర్ ప్రఖర్ జైన్, ఎగ్జిక్యూటివ్ డైరెక్టర్ కౌసర్ బానోతో పాటు వివిధ శాఖల ఉన్నతాధికారులు పాల్గొన్నారు. నైరుతి రుతుపవనాల పరిస్థితులు, వర్షపాతం లోటు, కరవు ముప్పు, విపత్తు నిర్వహణ చర్యలపై సమగ్రంగా చర్చించారు.
విపత్తులు సంభవించిన తర్వాత స్పందించడం కంటే ముందుగానే చర్యలు తీసుకోవడం ఎంతో ముఖ్యమని మంత్రి అన్నారు. రాష్ట్ర, జిల్లా స్థాయిలో 24 గంటలూ పనిచేసే కంట్రోల్ రూమ్లు సిద్ధంగా ఉండాలని, భారత వాతావరణ శాఖ (IMD), RTGS, APSDMA అందించే హెచ్చరికల ఆధారంగా వెంటనే స్పందించాలని ఆదేశించారు.
CAP, SMS, వాట్సాప్, సోషల్ మీడియా, ఎలక్ట్రానిక్ మీడియా వంటి అన్ని వేదికల ద్వారా ప్రజలకు వాతావరణం, వరదలు, పిడుగులపై హెచ్చరికలు వేగంగా చేరేలా చర్యలు తీసుకోవాలని సూచించారు.
ప్రతి జిల్లా కలెక్టర్ వ్యక్తిగతంగా సన్నద్ధత చర్యలను పర్యవేక్షించాలని మంత్రి స్పష్టం చేశారు. నైరుతి రుతుపవనాల కోసం రూపొందించిన ప్రామాణిక కార్యాచరణ విధానాలను (SOPs) అన్ని శాఖలు తప్పనిసరిగా అమలు చేయాలని, ప్రతిరోజూ చేపట్టిన చర్యలపై నివేదికలను APSDMAకు సమర్పించాలని ఆదేశించారు. పోలీసు, రెవెన్యూ, ఫైర్ సర్వీసులు, జలవనరులు, ఆరోగ్యం, విద్యుత్, పంచాయతీరాజ్, మున్సిపల్ శాఖలు పరస్పర సమన్వయంతో పనిచేయాలని సూచించారు.
ఈ ఖరీఫ్ సీజన్లో రాష్ట్రంలోని 688 మండలాల్లో 105 మండలాలు తీవ్రంగా, మరో 208 మండలాలు మధ్యస్థ స్థాయిలో కరవు ప్రభావానికి గురయ్యే అవకాశం ఉందని అధికారులు వివరించారు.
శ్రీ సత్యసాయి, అనంతపురం, అన్నమయ్య జిల్లాల్లో తీవ్ర ప్రభావం ఉండే అవకాశం ఉందని, కర్నూలు, నంద్యాల, చిత్తూరు, వైఎస్సార్ కడప, తిరుపతి, ప్రకాశం, మార్కాపురం, నెల్లూరు జిల్లాల్లో మధ్యస్థ ప్రభావం ఉండొచ్చని తెలిపారు.
వ్యవసాయ శాఖ రైతులకు ప్రత్యామ్నాయ పంటలపై అవగాహన కల్పించాలని, అవసరమైన విత్తనాలు, ఎరువులు అందుబాటులో ఉంచాలని మంత్రి ఆదేశించారు. డైరెక్ట్ సీడెడ్ రైస్ (DSR), సిస్టమ్ ఆఫ్ రైస్ ఇంటెన్సిఫికేషన్ (SRI), APCNF పద్ధతులను ప్రోత్సహించాలని సూచించారు. ఉద్యానవన శాఖ డ్రిప్ ఇరిగేషన్, మల్చింగ్ వంటి నీటి పొదుపు పద్ధతులను విస్తృతంగా అమలు చేయాలని చెప్పారు.
పశుసంవర్ధక శాఖ పశుగ్రాసం, దాణా, తాగునీటి ఏర్పాట్లు ముందుగానే పూర్తి చేయాలని, అత్యవసర పశువైద్య బృందాలు సిద్ధంగా ఉంచాలని మంత్రి సూచించారు.
మత్స్యశాఖ సముద్ర వాతావరణ హెచ్చరికలను ప్రతి మత్స్యకార గ్రామానికి వెంటనే చేరవేయాలని, సముద్రం అల్లకల్లోలంగా ఉన్న సమయంలో చేపల వేటను నిలిపివేయాలని ఆదేశించారు. ప్రతి పడవలో భద్రతా పరికరాలు, కమ్యూనికేషన్ వ్యవస్థలు తప్పనిసరిగా ఉండాలని చెప్పారు.
గ్రామీణ తాగునీటి శాఖ సమస్యాత్మక గ్రామాల్లో నీటి సరఫరా నిరంతరాయంగా జరిగేలా చూడాలని, పనిచేయని పథకాలను 48 గంటల్లో పునరుద్ధరించాలని, అవసరమైతే ట్యాంకర్ల ద్వారా నీరు సరఫరా చేయాలని సూచించారు.
గ్రామాల్లో డ్రైన్లు, కాలువలు, చెరువుల పూడికతీత పనులు పూర్తి చేయాలని పంచాయతీరాజ్ శాఖకు సూచించారు. పట్టణాల్లో వర్షపు నీటి కాలువలను శుభ్రం చేసి, డీ-వాటరింగ్ పంపులు, అత్యవసర యంత్రాలను సిద్ధంగా ఉంచాలని మున్సిపల్ శాఖను ఆదేశించారు. దోమల నివారణ చర్యలు, సురక్షిత తాగునీటి సరఫరాపై ప్రత్యేక దృష్టి పెట్టాలని చెప్పారు.
రిజర్వాయర్లు, నదుల నీటిమట్టాలను 24 గంటలూ పర్యవేక్షించాలని, బలహీనమైన కరకట్టలను బలోపేతం చేయాలని జలవనరుల శాఖకు సూచించారు. దిగువ ప్రాంతాలకు ముందస్తు వరద హెచ్చరికలు జారీ చేయాలని ఆదేశించారు.
దెబ్బతిన్న రహదారులను వెంటనే మరమ్మతు చేయాలని, జేసీబీలు, క్రేన్లు సిద్ధంగా ఉంచాలని రోడ్లు & భవనాల శాఖకు చెప్పారు. విద్యుత్ శాఖ ఆసుపత్రులు, తాగునీటి పథకాలకు నిరంతర విద్యుత్ సరఫరా ఉండేలా చూడాలని, అంతరాయం ఏర్పడితే వెంటనే పునరుద్ధరించాలని ఆదేశించారు.
మందులు, ORS, IV ఫ్లూయిడ్స్, అత్యవసర వైద్య సామగ్రి నిల్వ ఉంచాలని వైద్య ఆరోగ్య శాఖకు సూచించారు. అంబులెన్సులు, ర్యాపిడ్ మెడికల్ బృందాలు సిద్ధంగా ఉండాలని చెప్పారు.
పోలీసు, అగ్నిమాపక, APSDRF, NDRF బృందాలు 24 గంటలూ సిద్ధంగా ఉండాలని, వరద ముప్పు ఉన్న ప్రాంతాల్లో పడవలు, రక్షణ పరికరాలు, కమ్యూనికేషన్ వ్యవస్థలను ముందుగానే మోహరించాలని ఆదేశించారు. శాఖల మధ్య సమన్వయం కోసం మాక్ డ్రిల్లులు నిర్వహించాలని సూచించారు.
సమావేశంలో అధికారులు వెల్లడించిన వివరాల ప్రకారం, రాష్ట్ర విపత్తు ప్రతిస్పందన నిధి (SDRF/NDRF) కింద 2025–26లో రూ.277.63 కోట్లు, 2026–27లో రూ.479.01 కోట్లు విడుదల చేశారు.
2024 జూన్ నుంచి 2026 జూన్ వరకు పిడుగుపాటుతో మరణించిన 141 మంది కుటుంబాలకు రూ.5.61 కోట్ల ఎక్స్గ్రేషియా, పశువుల నష్టానికి రూ.30.81 లక్షల ఆర్థిక సాయం అందించారు.
దీర్ఘకాలిక విపత్తు ఉపశమన ప్రాజెక్టుల కోసం రాష్ట్ర విపత్తు ఉపశమన నిధి కింద రూ.521.17 కోట్లు కేటాయించగా, ఇటీవల మరో రూ.83.70 కోట్లకు ఆమోదం లభించింది. కేంద్రానికి రూ.531.33 కోట్ల విలువైన ప్రాజెక్టు ప్రతిపాదనలు కూడా పంపినట్లు అధికారులు తెలిపారు.
కమ్యూనిటీ ఆధారిత విపత్తు నిర్వహణను బలోపేతం చేయడానికి ఈ ఏడాది 1,214 మంది యువ ఆపదమిత్ర వాలంటీర్లకు శిక్షణ ఇచ్చారు. వీరిలో 1,114 మంది NCC, 100 మంది NSS వాలంటీర్లు ఉన్నారు. మరో 52 మంది మాస్టర్ ట్రైనర్లకు శిక్షణ పూర్తయింది. జూలై నుంచి సెప్టెంబర్ మధ్య చిత్తూరు, తిరుపతి, వైఎస్సార్ కడప జిల్లాల్లో మరో 300 మంది NCC వాలంటీర్లకు శిక్షణ ఇవ్వనున్నారు.
రాష్ట్రంలో జూన్ నెలలో 25 శాతం, జూలైలో ఇప్పటివరకు 41 శాతం వర్షపాతం లోటు నమోదైనట్లు అధికారులు వెల్లడించారు. నవంబర్ వరకు కొనసాగే నైరుతి రుతుపవనాల కాలంలో మొత్తం 27 శాతం వర్షపాతం లోటు ఉండే అవకాశం ఉందని అంచనా వేశారు.
రాష్ట్రవ్యాప్తంగా 1,161 రైతు సేవా కేంద్రాలను అధిక ముప్పు ప్రాంతాలుగా గుర్తించామని, పోలవరం, శ్రీశైలం నీటి లభ్యతపై ప్రత్యేక అంచనాలు రూపొందిస్తూ కాలువల నిర్వహణకు ఆధునిక నిర్ణయ సహాయక వ్యవస్థ (DSS)ను ఉపయోగిస్తున్నట్లు అధికారులు వివరించారు.
సమావేశం ముగింపులో మంత్రి వంగలపూడి అనిత మాట్లాడుతూ, నైరుతి రుతుపవనాల కాలం ముగిసే వరకు ప్రతి శాఖ హై అలర్ట్లో ఉండాలని పునరుద్ఘాటించారు. ప్రజల ప్రాణాలు, జీవనోపాధి రక్షణతో పాటు అత్యవసర సేవలను వేగంగా పునరుద్ధరించడం ప్రభుత్వ ప్రధాన బాధ్యత అని పేర్కొంటూ, అన్ని శాఖలు సమన్వయంతో పనిచేసి ప్రజలకు ఎలాంటి ఇబ్బందులు కలగకుండా చూడాలని అధికారులను ఆదేశించారు.",0.31666666666666665
