title,url,source,date,language,state,district,search_term,full_text,relevance_score
ગુજરાતમાં ગરમીનો પ્રકોપ: અમદાવાદમાં હીટસ્ટ્રોક અને પાણીજન્ય રોગોના કેસમાં ચિંતાજનક વધારો - Mumbai Samachar,https://news.google.com/rss/articles/CBMilwFBVV95cUxQVHBNaWZTOUpwUGNZT28ydGVITWE1TkZGZXMyNXdKZ1dyZUZQX2h6RnBBaU1vSTYzU1UzM0VEOGx1Qm5LeTdmQmFfQ0pXY29DR0I3cWs1N0k0Rk85cGd4b2FtRl8zUzhMWWZCZ3dlMFlpV0VWdDZzN3dna3VJcU8xLVpMLXRzdTdzc2w2aTl2RXRqaUhiU3hJ?oc=5,Mumbai Samachar,2026-05-14T11:49:36+05:30,gu,Gujarat,Ahmedabad,"(""ભારે ગરમી"" OR ""આકરી ગરમી"" OR લૂ OR હીટવેવ OR ""ઉષ્ણ મોજું"" OR ""ગરમીનો પ્રકોપ"" OR તાપ OR ""આકરો તાપ"" OR ""અસહ્ય ગરમી"" OR ""ભયાનક ગરમી"") Gujarat","(અમારા પ્રતિનિધિ તરફથી)
અમદાવાદઃ ગુજરાતમાં અમદાવાદ-રાજકોટમાં ઉનાળાની આકરી ગરમીની પડવાના શરૂઆત થતા નાગરિકો હેરાન પરેશાન થઈ ગયા છે. અમદાવાદની સાથે રાજકોટમાં ભયાનક ગરમી પડી રહી છે, જેનાથી રાજ્યની સિવિલ હોસ્પિટલમાં હીટસ્ટ્રોક સહિત અન્ય કિસ્સામાં વધારો થઈ રહ્યો છે. અમદાવાદની સોલા સિવિલ હોસ્પિટલમાં પાણીજન્ય રોગોના કેસોમાં ચિંતાજનક વધારો જોવા મળ્યો હતો. છેલ્લા એક મહિનામાં ડાયેરિયા (ઝાડા-ઉલટી)ના કુલ 143 કેસ નોંધાતા આરોગ્ય તંત્ર દોડતું થયું હતું.
હોસ્પિટલની સ્થિતિ અંગે વિગતો આપતા તંત્રએ જણાવ્યું કે, ગત અઠવાડિયામાં ઓપીડીનો આંકડો 11,000 સુધી પહોંચ્યો હતો, જેમાંથી 1,100 દર્દીઓને દાખલ કરીને સારવાર આપવામાં આવી હતી.
ગરમીના કારણે વધતા ડિહાઇડ્રેશનના કેસને પહોંચી વળવા માટે હોસ્પિટલમાં પૂરતો સ્ટાફ, જરૂરી દવાઓ, ઓઆરએસ પેકેટ અને સ્પેશિયલ બેડ રિઝર્વ રાખવામાં આવ્યા છે. આરોગ્ય વિભાગે લોકોને તડકામાં બહાર નીકળતી વખતે સાવચેતી રાખવા અને સ્વાસ્થ્ય પ્રત્યે વિશેષ કાળજી લેવા સૂચના આપી હતી.
હોસ્પિટલના મેડિકલ ઓફિસરના જણાવ્યા અનુસાર, ગરમીમાં ખોરાક અને પાણી જલ્દી દૂષિત થતા હોવાથી આ રોગો વકરી રહ્યા છે. જોકે, રાહતની વાત છે કે મેલેરિયા, ડેન્ગ્યુ કે ચિકનગુનિયાના કેસમાં કોઈ વધારો થયો નથી. તબીબોએ ખાસ કરીને નાગરિકોને પાણી ઉકાળીને પીવાની સાથે બહારનું ખાવાપીવાનું ટાળવા ખાસ અપીલ કરી હતી.
મનપાએ પણ ગરમી કે લૂ ન લાગે તે માટે લોકોને સાવચેતી વર્તવા ખાસ માર્ગદર્શિકા બહાર પાડી હતી. અત્રે ઉલ્લેખનીય છે કે અમદાવાદમાં ગરમીનો પારો 40 આસપાસ જ રહે છે અને માત્ર દિવસે જ નહીં રાત્રે પણ સખત બફારો અને અકડામણનો અનુભવ થાય છે. હજુ આવનારા દિવસોમાં ગરમીનો પ્રકોપ રહેવાનો હોવાથી લોકોએ વિશેષ ધ્યાન રાખવાની જરૂર છે, તેમ ડોક્ટોએ જણાવ્યું હતું.",0.8500000000000001
"ગુજરાતમાં હજુ 48 કલાક હીટવેવનો કહેર, અમદાવાદ 44.1 ડિગ્રી સાથે રાજ્યનું સૌથી ગરમ શહેર - નવજીવન ન્યૂઝ",https://news.google.com/rss/articles/CBMihgFBVV95cUxPU0QwR0ZnbVB2N1ZhczFfX0taN0F5Z2pqbW8xWm04ZGZBRWZZRFg4ckQ5dElmQVlrTnZsMXJCaFBVcmczbGNjNFItdFBDelZkWjF1ZXBQaDNYMkVoSG1vWkR2U09ZSXVRbWdKMnBkcUp0X2V2NWFIUDNTbjNUWnFSelJiZW4tZw?oc=5,નવજીવન ન્યૂઝ,2026-05-14T12:15:09+05:30,gu,Gujarat,Ahmedabad,"(તાપમાન OR ""તાપમાન વધ્યું"" OR ""પારો ચઢ્યો"" OR ""ડિગ્રી સેલ્સિયસ"" OR ""મહત્તમ તાપમાન"" OR ""વિક્રમી તાપમાન"") Gujarat","નવજીવન ન્યૂઝ.અમદાવાદઃ ગુજરાતમાં ઉનાળાની આગઝરતી ગરમીથી જનજીવન ત્રસ્ત બન્યું છે. હવામાન વિભાગે આગામી 48 કલાક સુધી રાજ્યના અનેક વિસ્તારોમાં હીટવેવની સ્થિતિ યથાવત રહેવાની શક્યતા વ્યક્ત કરી છે. બુધવારે અમદાવાદ 44.1 ડિગ્રી સેલ્સિયસ સાથે રાજ્યનું સૌથી ગરમ શહેર બન્યું હતું, જ્યારે સુરતમાં એક જ દિવસમાં તાપમાનમાં નોંધપાત્ર 8 ડિગ્રીનો ઘટાડો નોંધાયો હતો. રાજ્યના 10 શહેરોમાં તાપમાન 42 ડિગ્રીથી વધુ નોંધાતા ગરમીનો પ્રકોપ સ્પષ્ટ જોવા મળ્યો હતો.
હવામાન વિભાગ દ્વારા 13 મે 2026ના રોજ જાહેર કરાયેલા પૂર્વાનુમાન અનુસાર, આગામી 48 કલાક દરમિયાન મહત્તમ તાપમાનમાં કોઈ મોટો ફેરફાર થવાની શક્યતા નથી. જોકે ત્યારબાદ તાપમાનમાં ધીમે ધીમે 2થી 4 ડિગ્રી સેલ્સિયસ સુધી ઘટાડો થઈ શકે છે. આગામી બે દિવસ દરમિયાન રાજ્યના કેટલાક વિસ્તારોમાં તાપમાન 41થી 45 ડિગ્રી વચ્ચે રહેવાની શક્યતા છે.
હવામાન વિભાગના અનુમાન મુજબ આજે અમદાવાદ, ગાંધીનગર, રાજકોટ અને વડોદરામાં મહત્તમ તાપમાન 44 ડિગ્રી આસપાસ રહેવાની શક્યતા છે. અમરેલીમાં 45 ડિગ્રી સુધી પારો પહોંચી શકે છે, જ્યારે ભૂજમાં 42 ડિગ્રી અને ડીસામાં 44 ડિગ્રી તાપમાન નોંધાઈ શકે છે. સુરતમાં તાપમાન 34 ડિગ્રી આસપાસ રહેવાની સંભાવના છે.
અમદાવાદમાં આજે પણ આકાશ મુખ્યત્વે સ્વચ્છ રહેવાની શક્યતા છે. બુધવારે શહેરનું મહત્તમ તાપમાન 44.1 ડિગ્રી નોંધાયું હતું, જે સામાન્ય કરતાં 2.5 ડિગ્રી વધુ હતું. દિવસ દરમિયાન અને મોડી રાત સુધી 14 કિલોમીટર પ્રતિ કલાકની ઝડપે ગરમ પવન ફૂંકાતા લોકોને લૂ જેવી સ્થિતિનો સામનો કરવો પડ્યો હતો. શહેરનું રાત્રિ તાપમાન પણ 30 ડિગ્રીની આસપાસ રહ્યું હતું, જેના કારણે ગરમીમાંથી રાહત મળી નહોતી.
હવામાન વિભાગે જણાવ્યું છે કે 14 અને 15 મે દરમિયાન સૌરાષ્ટ્ર-કચ્છના કચ્છ અને સુરેન્દ્રનગર જિલ્લાઓમાં તેમજ ઉત્તર અને મધ્ય ગુજરાતના બનાસકાંઠા, પાટણ, ગાંધીનગર, અમદાવાદ અને વડોદરા જિલ્લાઓમાં છૂટાછવાયા સ્થળોએ હીટવેવની સ્થિતિ ચાલુ રહી શકે છે. આ સિવાય રાજકોટ, અમરેલી, દ્વારકા અને બોટાદ જિલ્લાઓમાં પણ ગરમીનો પ્રકોપ યથાવત રહેવાની શક્યતા છે.
હીટવેવની ગંભીરતાને ધ્યાનમાં રાખીને કચ્છ અને સુરેન્દ્રનગર માટે ઓરેન્જ એલર્ટ જાહેર કરવામાં આવ્યું છે. જ્યારે દ્વારકા, રાજકોટ, અમરેલી, બોટાદ, અમદાવાદ, વડોદરા, ગાંધીનગર, પાટણ અને બનાસકાંઠા જિલ્લામાં યલો એલર્ટ જાહેર કરવામાં આવ્યું છે.
હવામાન વિભાગના અનુમાન મુજબ આગામી 20 મે સુધી સમગ્ર ગુજરાત, સૌરાષ્ટ્ર-કચ્છ તેમજ દીવ, દમણ અને દાદરા નગર હવેલીમાં હવામાન મુખ્યત્વે સૂકું રહેવાની પ્રબળ શક્યતા છે.
ગરમીના વધતા પ્રકોપ વચ્ચે લોકોને બિનજરૂરી બહાર નીકળવાનું ટાળવા, પૂરતું પાણી પીવા અને ખાસ કરીને બપોરના સમયે સાવચેતી રાખવા સલાહ આપવામાં આવી છે.",0.8
