title,url,source,date,language,state,district,search_term,full_text,relevance_score
Heatwave Warnings Issued Across Andhra Pradesh and Telangana - The Hans India,https://news.google.com/rss/articles/CBMisgFBVV95cUxPNHJFV09FNGdJZ1JkY1pvME12UzJUb2dJOHRNRVhMZlV4MkhNSm44eGZQU19xejNjVHVjenAyZkUxeUExdWlsRzF6QWZ2LW1nM0hLczB0SGFaNUo5SDZabktsVnhVZWhFakVpQ2ZYcV9XcmJiVzlPSWJRN1EydllpSUVUejQ0bTNfRVlfQUFHdXB1clNKWWxTb2k0MklWazNFWFVmVmU1bmFhZ1JTcTB4N2d30gG3AUFVX3lxTFBCUHN2ZFVKSnpaTlExRkpWaXNsWGlkM0tObllFejBFSXNXeGpFeHY5V2hYZ19HTlQtc1lMNDlRVklVN1Q3WnhwdGpGRnVvU2ttRkUwUlYwZDZfUGotZlVNOVN6RWZESE9pdmtESzV2UGhUYS1sT0tmSFNzcWhaZV9nMmhYYUxwMVVzMkN5UHM2MWVmaHBDSnBnb2tjU0dSSXNNcHBobGlzZUJ4YUsxSXNITTNlWGVZOA?oc=5,The Hans India,2026-04-14T10:56:48+05:30,en,Telangana,Hyderabad,"""heatstroke"" Telangana","Heatwave Warnings Issued Across Andhra Pradesh and Telangana
Andhra Pradesh: As temperatures soar across the state, the Andhra Pradesh State Disaster Management Authority has issued urgent warnings, advising people to avoid outdoor activities between 12:00 PM and 4:00 PM. Record-high temperatures and intensifying heatwaves have led authorities to urge vigilance, with the scorching sun already affecting daily life from as early as 8:00 AM.
The Meteorological Department predicts that on 14 April, several districts in Rayalaseema and Coastal Andhra will experience severe heatwave conditions. In particular, 33 mandals across Eluru, Polavaram, Vizianagaram, Srikakulam, Parvathipuram Manyam, and Alluri Sitarama Raju districts are expected to face extreme heat, with moderate conditions in another 44 mandals. Specific mandals in Polavaram, Srikakulam, Vizianagaram, and Parvathipuram Manyam districts are forecast to endure the worst of the heat.
On Monday, Kadapa recorded a maximum temperature of 44.4°C, with Sanjamala in Nandyal district reaching 44°C. Durgi in Palnadu district and Nuliveedu in Annamayya district registered 42.8°C and 42°C respectively. The Meteorological Department advised residents to wear hats or carry umbrellas when outdoors and to stay well-hydrated, emphasising the increased risk of heatstroke.
Meanwhile, in Telangana, the Hyderabad Meteorological Department warned that the heatwave is likely to continue throughout the week, with temperatures expected to rise by 2 to 3 degrees. On Monday, four fatalities due to heatstroke were reported in the state. Nizamabad recorded a maximum temperature of 43.2°C, while Hyderabad’s temperature exceeded 40°C. City streets are largely deserted during the afternoons, as residents avoid the intense heat, which is expected to persist for several more days.",1.0
Heat Wave Alert in Telangana as Temperatures Set to Rise Over Next 5 Days - Deccan Chronicle,https://news.google.com/rss/articles/CBMi1gFBVV95cUxNRlkta0RmdE9GLTl6cXE4QmpsZ2s0Q0JqS3UtOUdIbkg3Tk5vbUw4ZUVUNnA5Vk95anVRMnVMWTdLQWNyTWlfN0ZJRHRvV25iM1IzNUhQU0IwdHF5NjBPUTdHdzJsVFc0Y1pJQlgzS0YxZXV5WGxITVJWeWxJbDNIR1FtWHFCUGRJbzA2WWtpSGpkdzRON2d1RWlhMFd6RmRDd0ZZOU8wdFlVVXpZOGdBZmdyZDdYbEozNTl3dTdOV0E3bENkR1A4aFAxZ21NRU1LYWVfRzdn0gHbAUFVX3lxTE9LS0NBckNObF9hZm82TlJYVkM2Uk94Wm92RWxucEJVT19ha0YtbnY2bEJjaGkzbkdYQjQ5aHJGX2xMVXJBOFA5QXdUSHJwX1BqVnVhcnBtc3J4WFJxZ3l6bVRTdHlBbXhrdWc4Q282VU5HZXh4MnBIVDlwcG1BOFhZeDdRc3JJV0prWWFPNHcxT3RGM0xvWFZyaWV2RVJVdm5CR0VJTzBwQzVMVHVyaDlUZk9CSTZLQ0hIdlIxUG5zQTJOb1BsNXgtR041WXpMWUxXYXhDY0pxTUV2VQ?oc=5,Deccan Chronicle,2026-04-14T11:35:00+05:30,en,Telangana,Hyderabad,"(heatwave OR ""heat wave"" OR ""severe heatwave"" OR ""extreme heat"" OR ""heat spell"" OR ""scorching heat"" OR ""blistering heat"" OR ""sweltering heat"" OR ""hot winds"" OR loo OR ""hot loo winds"" OR ""intense heat"" OR ""unbearable heat"" OR ""deadly heat"" OR heat OR ""weather forecast"" OR ""weather update"" OR ""weather alert"" OR ""IMD forecast"" OR ""IMD prediction"" OR ""IMD alert"" OR IMD OR ""rising temperatures"" OR ""temperatures expected to rise"" OR ""relief from heat"" OR ""respite from heat"" OR ""heat respite"" OR ""respite from scorching heat"") Telangana","14 April 2026 11:35 AM IST14 April 2026 11:35 AM IST
IMD forecasts dry weather across state; heat wave conditions likely in isolated areas from April 15 onwards
x
Women cover their heads with shawls to shield themselves from the heat.
The India Meteorological Department (IMD) has forecast dry weather conditions across Telangana for the next five days, with temperatures expected to rise gradually.
According to the latest seven-day forecast issued from the Meteorological Centre in Hyderabad on April 14, maximum temperatures are likely to increase by 2–3°C over the next three days.
While no warnings have been issued for Day 1, the IMD has cautioned that heat wave conditions are very likely to prevail in isolated pockets of the state from Day 2 (April 15) through Day 5 (April 19).
Officials have advised residents, especially farmers and those exposed to outdoor conditions, to take necessary precautions to cope with rising temperatures and potential heat wave impacts.",0.8500000000000001
Telangana heatwave intensifies; officials urge caution - Hyderabad Mail,https://news.google.com/rss/articles/CBMigAFBVV95cUxOSnNtZDBBU3g0QkktYUpxQjNYTWU2SERWN3FSZWljRG5jRWo3LS1NYWpqWUtNWkJxaXh6OW1MWVk4RnpXLTNnQ2lfUmVCdlk3Q2gxY21MTVBTT2ZyN0tHbXpvTWhkSThlZTFHMkNLQ1p0aEZGRTVkZHFXaVJWQ2ZNSg?oc=5,Hyderabad Mail,2026-04-14T12:59:54+05:30,en,Telangana,Hyderabad,"(heatwave OR ""heat wave"" OR ""severe heatwave"" OR ""extreme heat"" OR ""heat spell"" OR ""scorching heat"" OR ""blistering heat"" OR ""sweltering heat"" OR ""hot winds"" OR loo OR ""hot loo winds"" OR ""intense heat"" OR ""unbearable heat"" OR ""deadly heat"" OR heat OR ""weather forecast"" OR ""weather update"" OR ""weather alert"" OR ""IMD forecast"" OR ""IMD prediction"" OR ""IMD alert"" OR IMD OR ""rising temperatures"" OR ""temperatures expected to rise"" OR ""relief from heat"" OR ""respite from heat"" OR ""heat respite"" OR ""respite from scorching heat"") Telangana","Telangana : Telangana is witnessing a sharp rise in heatwave conditions, with temperatures crossing 42°C in several districts, according to the Hyderabad Meteorological Department.
The intensity of the heat has increased over the past two days, with strong hot winds adding to discomfort. Even indoors, elderly people, children, pregnant women and those with chronic illnesses are facing difficulties.
Officials said the heatwave is likely to persist for a few more days.
Hot winds raise health risks, especially for outdoor workers
The Meteorological Department has urged people to remain alert and avoid stepping out unless necessary. Those who must go outdoors have been advised to take precautions.
Authorities warned that the intensity of hot winds poses serious health risks, particularly for small traders and outdoor workers. They advised frequent intake of drinking water to prevent dehydration.
Overall, officials said “danger conditions” are likely to continue in Telangana for the next few days.",1.0
Telangana sizzles as temperatures cross 43°C; all 33 districts record above 41°C - The Hindu,https://news.google.com/rss/articles/CBMi3wFBVV95cUxQakxvQnhYZ1VocEJVazFiTzBBb2w2d3V0WEREWXdROUNVNXk5cDU4WExvdFJWSW5VWnZ2ZUlTQUdrdXZwMDNvc09hWnNVdVdWMk4wU05HNms1SFZRM2YtTU1hN3MxNlZjZDJQbFBNd2NMWTR1YUdCYmJDdEtwWDZJcEdaM1Q3akZNMWM1NW1aTVZYZWNNOGZYU0Fwa0RSdVEtS25BUzhJczkzSTJYSHZyVGFtZ1VuN016Q0gxcEVmNC1vOFpGWUhfMUZobU1HemJRTzlKcF9wcGdJb0RZV2dv0gHmAUFVX3lxTE92VERhRE9HYXVETGdKcVJzMWphd3hYbTJzVTNJajBTWTNTdWF6M3dWLVRWLUlPQnN0SHk3SWs0cHBMZUFDSFVfMnN1VWxZYnVMa2pWZzRwVUFSQ2htRHUyT0U3RjFWbF9iaVZXXzBnWTNhOGgzUDJ5dHZ3d3BGaVhVRUlsUGhvblhJMlk5ZThxRXgxVmZDRE8yMWhKNS1LTmN2YzhrVElBYXMwR09qbUFibUZ5Nk9MWHpYTlZXOHlYNDlnZ25pS2Q3ampDVWxkdS1RRGkxcnhBRGNUODBraXdUSmJkOEFB?oc=5,The Hindu,2026-04-14T12:45:16+05:30,en,Telangana,Hyderabad,"""heatwave"" Telangana","Telangana is in the grip of an intense heatwave, with maximum temperatures crossing 43°C in two districts and remaining above 41°C across all districts on Monday (April 13, 2026). Data from the Telangana Development Planning Society (TGDPS) showed that 22 districts recorded temperatures above 42°C, while the remaining 11 districts saw temperatures between 41°C and 42°C. The lowest maximum temperature recorded anywhere in the State was 41°C in Hyderabad.
Aloor in Nizamabad district emerged as the hottest location in the State, recording a maximum temperature of 43.2°C. This was closely followed by Gudipally in Nalgonda district at 43.1°C. In Hyderabad, Nampally recorded a maximum temperature of 41°C.
Published - April 14, 2026 12:45 pm IST",0.6333333333333333
"Hyderabad heatwave raises risk of heatstroke, diarrhoeal diseases - Dailyhunt",https://news.google.com/rss/articles/CBMi9wFBVV95cUxQeVRXRDc4TXUwLUhEM2tLYzN3V0xnLWZXVEhjcFJ0VjdKbEtOa3VxbXBwME1LQkxPNGMyVU11SWJHbF9fdVc3ZzdaVmRYNWpwQUVSWWxMLWRjMm1HbkZILTlReTRONXRIZnZQMktwLTdpYzVIM3g3aDZ4RE1JQWpzdDJXOGVxN2JBRlIwMEQ5TnVoeldTSmlBZF8tdmJYZEdwWmpQMVlJSGdqOWQzMzBLa3hDcWJaVGNiMWQxWXJJUkJEcDhjRmxPdHN6TVVXcmVhSkY2RHo2VzVaTTRmcXpjSlJPNy1yclRqR2I4Skc4ODBoTEhxa2NF?oc=5,Dailyhunt,2026-04-14T06:45:37+05:30,en,Telangana,Hyderabad,"""heatwave"" Telangana","Hyderabad: The two months of severe summer in Hyderabad are upon us, and with it comes the danger of falling sick with summer-related ailments.
As temperatures consistently climb to 40 degree Celsius and above, the risk of heat strokes and dehydration becomes a daily reality for not only people in Hyderabad but also in districts.
Already, the local clinics, nursing homes, and small-to-medium hospitals, as well as major tertiary care centres, including Fever Hospital, have gradually started registering a significant change in the profile of patients arriving for treatment.
Commenting on the present scenario, District public health officials in Hyderabad said ""Weather is changing significantly but the body needs to acclimatise. By evening, in Hyderabad, we are witnessing thunderstorms and cool but gusty winds. By afternoon, the temperatures are touching 40 degree Celsius. Due to these changes, Area Hospital and private health care facilities will witness both heat-related exhaustion and water-borne infections"".
The fluctuating weather conditions create a breeding ground for ailments like acute diarrhoeal disease and dehydration as the extreme heat causes food to spoil faster and residents struggle to maintain consistent hydration, doctors said. Vulnerable groups, particularly children and those with pre-existing conditions, remain at the highest risk during this transition period.
In addition to the threat of heatstroke, there is a marked rise in acute diarrheal disease (ADD) linked to the consumption of contaminated water and food that spoils quickly in the rising heat.
Senior doctors in Hyderabad have urged families to focus on vulnerable groups in the family, including infants, young children, pregnant women, and individuals with underlying conditions like heart disease or high blood pressure, who must be particularly vigilant during these peak months.",1.0
మండే ఎండలు! - Andhrajyothy,https://news.google.com/rss/articles/CBMi4gFBVV95cUxQODRMazIyRE9lWGJCS3A3WkI4MExxa2cyZWh4RkRLRnlObzVIQmJKa25uZHR3cGs1aC1nZ3E0VVVKNHBVazV2cFc4cjZaN1hndTc2VkVMVmkyQzN5NkxiOEg5OUxVU3JMR2MteV83V21PZDRta19jbWFkaHV4V1k4X3RscFRyTTJtazNQT2JRZldYWlgwNXZJY3hEeTlaN1R2ZnJOcHZZbFpRTFNwVTh2aURqSVJfZy12M2k1VERMTjI1QWVUNDZaWnkxbVI5ZF96QUtRYjlaN0VfdlViaDBOejBn?oc=5,Andhrajyothy,2026-04-14T04:38:11+05:30,te,Telangana,Hyderabad,"(""వడ గాలులు"" OR ""ఎండ వేడి"" OR ""భారీ ఎండలు"" OR ""హీట్ వేవ్"" OR ""ఉష్ణ తరంగం"" OR ""కడ ఎండలు"" OR మండుటెండ OR ""ఎండల తీవ్రత"" OR ""అసాధారణ ఎండలు"" OR ""తీవ్ర ఎండలు"") Telangana","మండే ఎండలు!
రోహిణి కార్తె రాకమునుపే రోకళ్లు పగిలేలా ఎండ దంచికొడుతోంది. ఉదయం 10 నుంచి సాయంత్రం నాలుగింటిదాకా మాడు పగిలేలా ఎండ కొడుతోంది.
రాష్ట్రంలో భానుడి భగభగ, ఉక్కబోత
నేటి నుంచి వారం పాటు భారీ ఎండలు
హైదరాబాద్, ఏప్రిల్ 13 (ఆంధ్రజ్యోతి): రోహిణి కార్తె రాకమునుపే రోకళ్లు పగిలేలా ఎండ దంచికొడుతోంది. ఉదయం 10 నుంచి సాయంత్రం నాలుగింటిదాకా మాడు పగిలేలా ఎండ కొడుతోంది. రాష్ట్రంపై భానుడి నిప్పులు చిమ్ముతున్నాడు. నేటి నుంచి వారం పాటు ఎండ తీవ్రత మరింత పెరగనుంది. అన్ని జిల్లాల్లో పగటిపూట ఉష్ణోగ్రతలు 42-45 డిగ్రీల మధ్య నమోదయ్యే అవకాశం ఉందని హైదరాబాద్ వాతావరణ కేంద్రం హెచ్చరించింది. ఉష్ణోగ్రతలకు సంబంధించి అన్ని జిల్లాలకు ఆరెంజ్ అలెర్ట్ జారీ చేసింది. ప్రధానంగా ఆదిలాబాద్, ఆసిఫాబాద్, నిర్మల్, నిజామాబాద్, జగిత్యాల, మంచిర్యాల, కరీంనగర్, భూపాలపల్లి, ములుగు, నల్లగొండ, సూర్యాపేట, గద్వాల జిల్లాల్లో భారీగా ఉష్ణోగ్రతలు నమోదవుతాయని హెచ్చరించింది. మిగతా జిల్లాల్లోనూ 41-43 మధ్య నమోదయ్యే అవకాశం ఉందని పేర్కొంది. హైదరాబాద్లో 40-42 డిగ్రీల మధ్య ఉష్ణోగ్రతలు నమోదవుతాయని వెల్లడించింది. సోమవారం ఆదిలాబాద్ జిల్లా తలమడుగులో అత్యధికంగా 41.8 డిగ్రీల గరిష్ట ఉష్ణోగ్రతలు నమోదైనట్లు తెలిపింది.",0.31666666666666665
ఎండ.. ప్రచండ సిటీలో 40.1 డిగ్రీలు - Namasthe Telangana,https://news.google.com/rss/articles/CBMi-AFBVV95cUxNRXY5eWozemVCT09WQzdkYm9zSHp3elFiNk1EdjJjWWp2TTQ0TF9qNnZSMmNDUzh6MFkyeE4tcFBrWm9fRDNQemlDZVkyMGxTR1c3Y1JIOVEtRlY3RHlfRXlORXQyenJibkROd2FNel9rWDIzWWZ0ZkJUUV82WE5TaU4zdW5fOTd4RUkxLW1wVnJyVXlWNC0tYkJzSzk1X2RNXzVxZVM4QU85OG1RSHFVNHprR2QwQlhOZFpEWldTdUhjU1ZiX2xrZXJtVm9GU0xWT0J6R04wVHk3ZzE0VW00dk80WUNoYzItekxzZzVpdWZVTFdfRkNaVQ?oc=5,Namasthe Telangana,2026-04-14T00:22:11+05:30,te,Telangana,Hyderabad,"(""ఉష్ణోగ్రత పెరుగుదల"" OR ""డిగ్రీల సెల్సియస్"" OR ""పాదరసం పెరిగింది"" OR ""గరిష్ట ఉష్ణోగ్రత"" OR ""రికార్డు ఉష్ణోగ్రత"") Telangana","సిటీబ్యూరో, ఏప్రిల్ 13 (నమస్తే తెలంగాణ): గ్రేటర్లో ఉష్ణోగ్రతలు ఠారెత్తిస్తున్నాయి. పగటి ఉష్ణోగ్రతలు 40 డిగ్రీలు దాటి నమోదవుతుండడంతో మధ్యాహ్నం సమయంలో జనం బయటకు రావడానికి జంకుతున్నారు. సోమవారం ఉదయం నుంచి రాత్రి వరకు నగరంలో గరిష్ఠం 40.1, కనిష్ఠం 26.9 డిగ్రీల సెల్సియస్, గాలిలో తేమ 35శాతంగా నమోదైనట్లు హైదరాబాద్ వాతావరణ కేంద్రం అధికారులు వెల్లడించారు. ఈ సంవత్సరం ఏప్రిల్ మాసంలో పగటి ఉష్ణోగ్రతలు 40 డిగ్రీలు దాటడం ఇదే తొలిసారి.",0.31666666666666665
