title,url,source,date,language,state,district,search_term,full_text,relevance_score
"Chandigarh News: सुबह राहत, दिनभर आफत... भीषण गर्मी से तपा चंडीगढ़ - Amar Ujala",https://news.google.com/rss/articles/CBMihAJBVV95cUxOYWxBa2tJSmZRZWhYaG02UEFQWUJKWk5qUW5NYkZjTmxJUHZld3B0Y1NSeFBjZWM4SThCWlpyWWhpcm1kWklIQWdZTHN2V2NEZ281SFNteW1wcjYzQlZGR1BRWFM0ckNOQy1zX0Z5VTAzLVVvVVBVRzN3M1hwXzB5UUxBQUVHMHc2aVV0cER3WnNNd284OGkzemJoMXQ1RVZvMlQ2V2ZTZzRZcXpiaWRDQWdDcEpqaVJwVnN2Qmp4TEluS053M056dkRhY0pUNjVZX0J0R05iYTN0WWR5dzY3NXVYSTRUR0dGRlhUYzZOdVA5cUVFenk3STF0Qm9oNkgtNHlYVtIBigJBVV95cUxQT0c4VDNwQXJiSkhwYWdidWo3djh1dGNqZHItZ1VEQVVZMUwweFNqckdoUE44eEtqQUphS2c4U2ZSSGNWbnRsallqOEcwMjhWWUZSanM2VzNReG90Ynk5VG8xazZVWG5mdjE0RldfQk0tSVNPd1VURGhLNzVYOEFJSXNzdjEwQTBvOHlULWtBS2pLc0VzRHNWVlNCa2l4Yl83bWZUZi01cWVhMVF1UDdmVENIWTA5eDJWTGRldVRHTU1rZDdkQVUtMjdJd25idUxRbEFRRDByLXBXbFFsb3U5QkJJUUM3eXlUdmtNTzZSdTBXZnNDUmtseUlIdTltdUdnVnFscjYyNTJCdw?oc=5,Amar Ujala,2026-05-23T01:45:45+05:30,hi,Chandigarh,Chandigarh,लू (Chandigarh) Chandigarh,"{""_id"":""6a10b97110ba00cafe0d9627"",""slug"":""relief-in-the-morning-trouble-all-day-long-chandigarh-sweltering-under-the-scorching-heat-chandigarh-news-c-16-pkl1079-1026354-2026-05-23"",""type"":""story"",""status"":""publish"",""title_hn"":""Chandigarh News: सुबह राहत, दिनभर आफत... भीषण गर्मी से तपा चंडीगढ़"",""category"":{""title"":""City & states"",""title_hn"":""शहर और राज्य"",""slug"":""city-and-states""}}
Chandigarh News: सुबह राहत, दिनभर आफत... भीषण गर्मी से तपा चंडीगढ़
विज्ञापन
खबरें लगातार पढ़ने के लिए अमर उजाला एप डाउनलोड करें
या
वेबसाइट पर पढ़ना जारी रखने के लिए वीडियो विज्ञापन देखें
अगर आपके पास प्रीमियम मेंबरशिप है तो
विज्ञापन
चंडीगढ़। शहर में भीषण गर्मी का असर लगातार बढ़ता जा रहा है। शुक्रवार को चंडीगढ़ का अधिकतम तापमान 44.2 डिग्री सेल्सियस दर्ज किया गया जो सामान्य से 4.5 डिग्री अधिक रहा। हालांकि पिछले 24 घंटों के दौरान अधिकतम तापमान में 0.2 डिग्री सेल्सियस की मामूली गिरावट दर्ज की गई लेकिन गर्मी की तीव्रता में कोई खास कमी महसूस नहीं हुई। तेज धूप और गर्म हवाओं के कारण दिनभर लोग बेहाल रहे।
सुबह के समय मौसम ने कुछ राहत जरूर दी। सुबह छह से आठ बजे के बीच शहर में बादल छाए रहे और तेज हवाएं चलती रहीं। वहीं सुबह 8:10 बजे से 8:30 बजे तक शहर के कुछ हिस्सों में हल्की बूंदाबांदी दर्ज की गई। करीब 20 मिनट तक चली हल्की बूंदाबांदी और ठंडी हवाओं से लोगों को गर्मी से थोड़ी राहत मिली। हालांकि सुबह 10 बजे के बाद धूप तेज होने लगी और पारा लगातार बढ़ता गया। इसके बावजूद बीच-बीच में चल रही तेज हवाएं कुछ राहत देती रहीं।
मौसम विभाग के अनुसार शहर का न्यूनतम तापमान 26.2 डिग्री सेल्सियस रिकॉर्ड किया गया, जो सामान्य से 0.7 डिग्री अधिक रहा। बीते 24 घंटों में न्यूनतम तापमान में 0.5 डिग्री सेल्सियस की बढ़ोतरी दर्ज की गई। मौसम विज्ञान केंद्र के वैज्ञानिकों का कहना है कि पश्चिमी विक्षोभ के कमजोर प्रभाव और स्थानीय मौसमी गतिविधियों के कारण सुबह हल्की ठंडी हवाएं चलीं लेकिन आने वाले दिनों में तापमान में बड़ी गिरावट की संभावना नहीं है। विभाग ने अगले कुछ दिनों तक अधिकतम तापमान 43 से 45 डिग्री सेल्सियस के बीच बने रहने का अनुमान जताया है।
विज्ञापन
मौसम विभाग के अनुसार 23 मई को अधिकतम तापमान 40 डिग्री और न्यूनतम 24 डिग्री सेल्सियस रहने की संभावना है। 24 मई को अधिकतम तापमान 41 डिग्री और न्यूनतम 23 डिग्री सेल्सियस रह सकता है। इसी तरह 25 मई को अधिकतम तापमान 42 डिग्री और न्यूनतम 24 डिग्री, जबकि 26 मई को अधिकतम तापमान 43 डिग्री और न्यूनतम 23 डिग्री सेल्सियस रहने का अनुमान है।
मौसम विशेषज्ञों ने लोगों को दोपहर 12 बजे से शाम चार बजे तक अनावश्यक रूप से घर से बाहर न निकलने की सलाह दी है। पर्याप्त मात्रा में पानी पीने, हल्के सूती कपड़े पहनने और धूप में निकलते समय सिर ढकने को कहा गया है। बच्चों, बुजुर्गों और बीमार लोगों को विशेष सावधानी बरतने की सलाह दी गई है।
बढ़ती गर्मी के चलते निजी और एडेड स्कूल बंद
23 मई से लागू होंगी समर वेकेशन, 9वीं से 12वीं तक ऑनलाइन क्लास की अनुमति
भीषण गर्मी और लगातार बढ़ते तापमान को देखते हुए प्रशासन ने बड़ा फैसला लिया है। शहर के सभी सरकारी सहायता प्राप्त (एडेड) और मान्यता प्राप्त निजी स्कूलों में 23 मई से समर वेकेशन लागू कर दी गई है। प्रशासन का कहना है कि कई निजी और एडेड स्कूलों में अभी भी फिजिकल क्लासेस चल रही थीं जबकि बढ़ती गर्मी बच्चों की सेहत के लिए खतरा बनती जा रही है।
बच्चों की सुरक्षा और स्वास्थ्य को ध्यान में रखते हुए स्कूल बंद करने के आदेश जारी किए गए हैं। हालांकि पढ़ाई प्रभावित न हो, इसके लिए नौवीं से 12वीं कक्षा तक के विद्यार्थियों के लिए आवश्यकता पड़ने पर ऑनलाइन क्लास लगाने की अनुमति दी गई है। वहीं आठवीं तक के विद्यार्थियों के लिए पूरी तरह छुट्टियां रहेंगी और उन्हें किसी भी तरह की ऑनलाइन या ऑफलाइन कक्षाओं में नहीं बुलाया जाएगा। प्रशासन ने सभी स्कूलों को आदेशों का सख्ती से पालन सुनिश्चित करने के निर्देश दिए हैं।
सुबह के समय मौसम ने कुछ राहत जरूर दी। सुबह छह से आठ बजे के बीच शहर में बादल छाए रहे और तेज हवाएं चलती रहीं। वहीं सुबह 8:10 बजे से 8:30 बजे तक शहर के कुछ हिस्सों में हल्की बूंदाबांदी दर्ज की गई। करीब 20 मिनट तक चली हल्की बूंदाबांदी और ठंडी हवाओं से लोगों को गर्मी से थोड़ी राहत मिली। हालांकि सुबह 10 बजे के बाद धूप तेज होने लगी और पारा लगातार बढ़ता गया। इसके बावजूद बीच-बीच में चल रही तेज हवाएं कुछ राहत देती रहीं।
विज्ञापन
विज्ञापन
मौसम विभाग के अनुसार शहर का न्यूनतम तापमान 26.2 डिग्री सेल्सियस रिकॉर्ड किया गया, जो सामान्य से 0.7 डिग्री अधिक रहा। बीते 24 घंटों में न्यूनतम तापमान में 0.5 डिग्री सेल्सियस की बढ़ोतरी दर्ज की गई। मौसम विज्ञान केंद्र के वैज्ञानिकों का कहना है कि पश्चिमी विक्षोभ के कमजोर प्रभाव और स्थानीय मौसमी गतिविधियों के कारण सुबह हल्की ठंडी हवाएं चलीं लेकिन आने वाले दिनों में तापमान में बड़ी गिरावट की संभावना नहीं है। विभाग ने अगले कुछ दिनों तक अधिकतम तापमान 43 से 45 डिग्री सेल्सियस के बीच बने रहने का अनुमान जताया है।
Trending Videos
मौसम विभाग के अनुसार 23 मई को अधिकतम तापमान 40 डिग्री और न्यूनतम 24 डिग्री सेल्सियस रहने की संभावना है। 24 मई को अधिकतम तापमान 41 डिग्री और न्यूनतम 23 डिग्री सेल्सियस रह सकता है। इसी तरह 25 मई को अधिकतम तापमान 42 डिग्री और न्यूनतम 24 डिग्री, जबकि 26 मई को अधिकतम तापमान 43 डिग्री और न्यूनतम 23 डिग्री सेल्सियस रहने का अनुमान है।
मौसम विशेषज्ञों ने लोगों को दोपहर 12 बजे से शाम चार बजे तक अनावश्यक रूप से घर से बाहर न निकलने की सलाह दी है। पर्याप्त मात्रा में पानी पीने, हल्के सूती कपड़े पहनने और धूप में निकलते समय सिर ढकने को कहा गया है। बच्चों, बुजुर्गों और बीमार लोगों को विशेष सावधानी बरतने की सलाह दी गई है।
बढ़ती गर्मी के चलते निजी और एडेड स्कूल बंद
23 मई से लागू होंगी समर वेकेशन, 9वीं से 12वीं तक ऑनलाइन क्लास की अनुमति
भीषण गर्मी और लगातार बढ़ते तापमान को देखते हुए प्रशासन ने बड़ा फैसला लिया है। शहर के सभी सरकारी सहायता प्राप्त (एडेड) और मान्यता प्राप्त निजी स्कूलों में 23 मई से समर वेकेशन लागू कर दी गई है। प्रशासन का कहना है कि कई निजी और एडेड स्कूलों में अभी भी फिजिकल क्लासेस चल रही थीं जबकि बढ़ती गर्मी बच्चों की सेहत के लिए खतरा बनती जा रही है।
बच्चों की सुरक्षा और स्वास्थ्य को ध्यान में रखते हुए स्कूल बंद करने के आदेश जारी किए गए हैं। हालांकि पढ़ाई प्रभावित न हो, इसके लिए नौवीं से 12वीं कक्षा तक के विद्यार्थियों के लिए आवश्यकता पड़ने पर ऑनलाइन क्लास लगाने की अनुमति दी गई है। वहीं आठवीं तक के विद्यार्थियों के लिए पूरी तरह छुट्टियां रहेंगी और उन्हें किसी भी तरह की ऑनलाइन या ऑफलाइन कक्षाओं में नहीं बुलाया जाएगा। प्रशासन ने सभी स्कूलों को आदेशों का सख्ती से पालन सुनिश्चित करने के निर्देश दिए हैं।",1.0
"चंडीगढ़ के स्कूलों में 23 मई से 39 दिन की गर्मी की छुट्टियां, शिक्षा विभाग ने जारी किया अवकाश कैलेंडर - Arth Parkash",https://news.google.com/rss/articles/CBMipwFBVV95cUxOOGdnSVVnMkszWUo4X0JKT1NDUUJvdzRScHVhLVIwU0owNWxJZkJHNEdTX1REc3Q5blRHYjRRX2NtRElYc191QUdZdW56NC04cm9MYS1FYzVGQlZCSm5NQ2ZMUkVvcFk1YVhRdWRmTXNKSjhDQWN6ODZOb2FhbjlBY3dnSjV5X0hmR2VneThCRHdlTlpodUVWRFlYOGlxRlh5a3pTNXU1UQ?oc=5,Arth Parkash,2026-05-23T03:05:55+05:30,hi,Chandigarh,Chandigarh,लू (Chandigarh) Chandigarh,"चंडीगढ़ के स्कूलों में 23 मई से 39 दिन की गर्मी की छुट्टियां, शिक्षा विभाग ने जारी किया अवकाश कैलेंडर
Chandigarh schools to have 39-day summer vacation from
चंडीगढ़, 20 मई (साजन शर्मा)यूटी चंडीगढ़ के सरकारी और सरकारी सहायता प्राप्त स्कूलों में 23 मई से ग्रीष्मकालीन अवकाश शुरू होने जा रहे हैं। जिला शिक्षा कार्यालय द्वारा जारी वर्ष 2026 के अवकाश कैलेंडर के अनुसार शहर के सभी सरकारी एवं एडेड स्कूलों में 23 मई से 30 जून 2026 तक गर्मी की छुट्टियां रहेंगी। इस दौरान विद्यार्थियों को कुल 39 दिनों का अवकाश मिलेगा, जबकि 29 और 30 जून को शिक्षकों के लिए कार्य दिवस निर्धारित किए गए हैं।
शिक्षा विभाग द्वारा जारी आदेश में वर्षभर के अन्य अवकाशों की भी जानकारी दी गई है। आदेश के अनुसार शरदकालीन अवकाश 7 नवंबर से 11 नवंबर 2026 तक रहेगा, जबकि शीतकालीन अवकाश 26 दिसंबर 2026 से 7 जनवरी 2027 तक घोषित किया गया है।
स्थानीय अवकाशों के तहत 28 अगस्त को रक्षाबंधन और 29 अक्टूबर को करवा चौथ की छुट्टी रहेगी। इसके साथ ही स्कूलों के प्राचार्यों और प्रधानाचार्यों को वर्ष के दौरान एक अतिरिक्त स्थानीय अवकाश घोषित करने का अधिकार भी दिया गया है।
शिक्षा विभाग ने आदेश में स्पष्ट किया है कि यूटी चंडीगढ़ के सभी सरकारी और सहायता प्राप्त स्कूलों में प्रत्येक माह का दूसरा शनिवार अवकाश रहेगा। यह आदेश शिक्षा सचिव प्रेरणा पुरी की ओर से जारी किया गया है।",0.31666666666666665
