title,url,source,date,language,state,district,search_term,full_text,relevance_score
IMD issues ‘Orange’ alert for heatwave across Central India: What travellers need to know before planning - The Times of India,https://news.google.com/rss/articles/CBMingJBVV95cUxOWFJ6QWIwTUExa01mdHNZbUs4Wmd2eFNhc3pqOWR0VVJ5YVRSZXhDYmtQU1BNbkxzUkxjZnlMbDVjQ0JLZFhsc1M4VWpqLVQ0MUU0MzNxR1QxaE5pRHVPN0hhLUZ6ekJYX2dNaGhTU3RkTkVyYVV4bnJvQXBWUHNGdkozUFhHSGw0M3VacmtGWTZWcFUxbmN3dW8zZXVkclpZSUNNNG1QclhST1M4VFh6U21ycmkzcjlZOGl4UThFdXRFMTU0dzNlT0g5M3dNTTR3cjdCTEtyY0xFUEd5M0dFak5PMGFZQ19wRC11WlNBbUV5OEdwNGRKMFBjWVpnbllnMlY5emwwbzJhR0VGei1UNG9hODJUZzZtNUhPZkJB0gGjAkFVX3lxTE5xRUhkTUZHOThCbExVM095dUFaNU5GbHlNQk1CYnJQeTBvMXEzR05hWFVXVHpRVDdVRDdyZVdsdFFxNFBSWmJId2VyX25Sam9yMTUtb3pBcXQ5Q1A0NjN4UlpHUDJmNHM4UkdDRDFEazNsaEZXNmxpdG5VUmE3bmJ0REl0MEREODFJSENYWWRwNEdGMmQ4eDZCN3JSMHY4cmpSLXF5OERfdk5IVF9zX2dBSk9GQl9IU1FVal9fdXp3ck1SN1p2c0gxdEJ0V1lQOHFISU9MOHlsakNudE9jUTZkWG44OGRPVll0eWdKVkFlSjdXdWRETmFhdm1ZakwyUm42TWhyV3dkV3lIUktPN0RXaXFpUmRFMzAtXzdlbEptOVMwdw?oc=5,The Times of India,2026-05-24T09:21:00+05:30,en,Andhra Pradesh,,"(heatwave OR ""heat wave"" OR ""severe heatwave"" OR ""extreme heat"" OR ""heat spell"" OR ""scorching heat"" OR ""blistering heat"" OR ""sweltering heat"" OR ""hot winds"" OR loo OR ""hot loo winds"" OR ""intense heat"" OR ""unbearable heat"" OR ""deadly heat"" OR heat OR ""weather forecast"" OR ""weather update"" OR ""weather alert"" OR ""IMD forecast"" OR ""IMD prediction"" OR ""IMD alert"" OR IMD OR ""rising temperatures"" OR ""temperatures expected to rise"" OR ""relief from heat"" OR ""respite from heat"" OR ""heat respite"" OR ""respite from scorching heat"") Andhra Pradesh","In a current update, the
India Meteorological Department (IMD) has issued orange alerts for several states across the country for severe heatwaves. The department has warned that heatwave conditions are likely to persist across central India till month-end. The weather agency’s latest bulletins and official updates on X indicate that temperatures across several cities are expected to remain above normal, with some regions crossing the dangerous 45°C mark.
India Meteorological Department on X posted:
“Severe heat wave conditions likely over parts of East MP, East UP & Vidarbha, with heat wave alerts across Bihar, Rajasthan, Telangana, Jharkhand, Odisha, Chhattisgarh and more. Warm nights and hot-humid conditions will add to the discomfort in several regions.
Stay hydrated 💧
Avoid peak afternoon exposure ☀️
Take care of children, elderly & pets 🐾”
According to the
IMD’s official heatwave bulletin, severe heatwave conditions are likely to continue between May 24 and May 29. These conditions are expected in isolated to many pockets across northwest and central India.
The department also stated that the temperatures are expected to remain “appreciably above normal,” with departures of 3°C to 5°C above seasonal averages.
It also added that there is a “high likelihood of heat illness symptoms” for those exposed to direct sunlight for prolonged time. Kids, infants, elderly people, and those with chronic illnesses should avoid going out in the sun.
The weather agency also confirmed that temperatures in several regions of central India, adjoining Uttar Pradesh, Haryana, and among others have already reached 45°C to 47°C.
What it means for travellersFor travellers, this means extra precaution, high SPF, and other summer essentials. The heatwave could affect summer travel plans across central and north India including in Delhi, Jaipur, Lucknow, Nagpur, Bhopal, Prayagraj, and to name a few. All these cities are dotted with iconic tourist attractions. However, harsh daytime conditions can make outdoor sightseeing difficult during afternoon hours. Popular destinations including Jaipur, Agra, and Khajuraho may see reduced tourist activity as daytime temperatures soar.
Advisory for travellersAvoid direct heat exposure between 12 PM and 4 PM
Stay hydrated
Wear light cotton clothing
Avoid strenuous outdoor activity
Plan early morning trips
Keep monitoring the weather updates
Carry oral hydration solutions
Hats, sunscreens, umbrellas
With the heatwave expected to continue till the end of May, travel experts are advising tourists to avoid unnecessary daytime exposure.",1.0
Andhra Pradesh Chief Minister reviews heatwave measures and directs relief efforts - The News Mill,https://news.google.com/rss/articles/CBMitgFBVV95cUxOWWc0WDBUTlV3d2dZdkJHcUN4c3dJQmI5SG5kYXdDVUtSMTVkZ1VuTjJGNV9NR1V6elhCdUlNNmw2MXQwY3RwQ3pzb2hLc2RjVFVzSHVyNGRVY2hmLWdRUDN4MUtONjlqMk95UVpQNEFBaG8yaGZmcEJSTmlxV3V2T1o4TGJTUmM0dFJvYnVyeWhuV09oVUtQQ0hZV0JVSHpHdHNpYzhvTmtqRnpST3o4VHpkdmtydw?oc=5,The News Mill,2026-05-24T01:42:34+05:30,en,Andhra Pradesh,,"""heatwave"" Andhra Pradesh","Andhra Pradesh Chief Minister N Chandrababu Naidu reviewed the state’s preparedness measures on January 31, 2026, to protect residents from extreme temperatures and heatwave conditions.
To address the heatwave, the Chief Minister instructed officials to provide tents, cooling shelters, cold drinking water, buttermilk, and ORS packets at various locations. He also advised authorities to consider declaring local holidays in areas experiencing severe temperatures and stressed the importance of uninterrupted drinking water supply in both rural and urban regions.
District Collectors were directed to conduct media briefings to raise public awareness regarding heat intensity and necessary precautions. The review meeting was attended by Chief Secretary Sai Prasad and senior officials from the Disaster Management, Health, Municipal Administration, and Panchayat Raj departments.
This directive follows a rise in temperatures across much of India, with several regions experiencing severe heatwaves. The India Meteorological Department (IMD) has issued Red and Orange alerts in multiple states.
Dr Shalini Tyagi, Director of Paediatric Care at Medanta, Noida, advised parents on January 30 to take extra precautions for children amid rising heatwave conditions, highlighting children’s greater vulnerability to dehydration, heat stress, and related infections during extreme weather.
Regarding the impact of heat on children’s health, Dr Tyagi stated, “Every weather change affects children more than it affects adults. If you look at it, children have a larger body surface area relative to their weight, meaning they absorb more heat. Additionally, their thermoregulation system is not as well-developed as it is in adults.”
The IMD has issued an orange alert for heatwave conditions in Delhi, Haryana, and Chandigarh, with similar alerts expected in Madhya Pradesh, Punjab, Uttar Pradesh, Bihar, Rajasthan, Telangana, Odisha, and Uttarakhand.",1.0
Summer Effect : హీట్ వేవ్స్ నుంచి బయటపడేదెలా? బెంబేలెత్తుతున్న జనం - Telugu Post,https://news.google.com/rss/articles/CBMikwFBVV95cUxPRktfdGVhLTdyZjdTc1VsZ2pSZlZCVjhVSG92bWdITTVsdnVoc2psc3VwRk9WbjNYWmhUelZmZUxCV21MT0Qwa2dYX2hGX3ctcDBPZEpLb2VxZ0p0UTR2T0xBR3hOQ2lzX0xMOFNKbWlOeGZkMXZYVmJzWENWMUdWZHZQendGVi00azhhWmMzX3hQcTDSAZgBQVVfeXFMTXlHckd6bWJkVDlaR19ieGN4NUoyX1UzLVVCOG5HMF9pUTI0UnNLTWM0VlB6ekR5bW9VNnc1X25kYUV5Z1VDOFlFblV2SlY5TVJGYzgtbU9jem9YVmhlY1dUR29ZQ3Q0dE1TaGdRMzNnc1NkYUIxNEJ6d3ZLa19xNlZJbi0zeE5sQ1JTaWs3dGdVNWZpbk9iOFY?oc=5,Telugu Post,2026-05-24T09:32:09+05:30,te,Andhra Pradesh,,"(""వడ గాలులు"" OR ""ఎండ వేడి"" OR ""భారీ ఎండలు"" OR ""హీట్ వేవ్"" OR ""ఉష్ణ తరంగం"" OR ""కడ ఎండలు"" OR మండుటెండ OR ""ఎండల తీవ్రత"" OR ""అసాధారణ ఎండలు"" OR ""తీవ్ర ఎండలు"") Andhra Pradesh","Summer Effect : హీట్ వేవ్స్ నుంచి బయటపడేదెలా? బెంబేలెత్తుతున్న జనం
ఆంధ్రప్రదేశ్, తెలంగాణ రాష్ట్రాల్లో భారీ ఉష్ణోగ్రతలు నమోదవుతున్నాయి.
ఆంధ్రప్రదేశ్, తెలంగాణ రాష్ట్రాల్లో భారీ ఉష్ణోగ్రతలు నమోదవుతున్నాయి. రోజురోజుకూ ఎండల తీవ్రత నమోదవుతుంది. గరిష్టంగా ఉష్ణోగ్రతలు నమోదవుతుండటంతో ప్రజలు పగటి వేళ బయటకు వచ్చేందుకు భయపడిపోతున్నారు. రెండు తెలుగు రాష్ట్రాల్లో 46 డిగ్రీలకు మించి ఉష్ణోగ్రతలు నమోదవుతున్నాయి. వేడిగాలుల ఉధృతి కూడా ఎక్కువగా ఉంది. సెగ గాలులతో అనేక మంది వడదెబ్బకు గురవుతున్నారు. ఆసుపత్రి పాలవుతున్నారు. జ్వరం, వడదెబ్బ వంటి వ్యాధుల బారిన పడి రోగులతో ఆసుపత్రులన్నీ కిటకిటలాడుతున్నాయి. ఎన్ని హెచ్చరికలు జారీ చేసినప్పటికీ ప్రజలు తమ అవసరాల నిమిత్తం బయటకు వచ్చి వడదెబ్బకు గురవుతున్నారు.",0.31666666666666665
Weather Update : ఎండల తీవ్రతకు రెండు రోజుల్లోనే 40 మంది మృతి.. రాబోయే ఐదు రోజులు జాగ్రత్త - hmtvlive.com,https://news.google.com/rss/articles/CBMi1gFBVV95cUxQU1U0YV9xRFFhUmhZRF9ERTIwZGxfQmRMN3JRTlhfQ29lMXcxOHJBME9JQXJzTUNZel9NQlhEWGFqSGx0V2FsT1N5TVowR1duV2J3d2k3WkpWbldqdlhYTFNSbzRKOVp4RjNJcnNta3o3SnBXc09kUDg2NjJLSy1PTFQ2TlZzTEZtZkw2TkZBS1VNcENFMUo0N0hJYXBXVnV5SU9KakVxdXNnNmJuREZwUTFOX0gydDhSZ252TzZhbEwyNnhwZm9EVzl4RUk4TGx2NzltYVBn?oc=5,hmtvlive.com,2026-05-24T07:10:21+05:30,te,Andhra Pradesh,,"(""వడ గాలులు"" OR ""ఎండ వేడి"" OR ""భారీ ఎండలు"" OR ""హీట్ వేవ్"" OR ""ఉష్ణ తరంగం"" OR ""కడ ఎండలు"" OR మండుటెండ OR ""ఎండల తీవ్రత"" OR ""అసాధారణ ఎండలు"" OR ""తీవ్ర ఎండలు"") Andhra Pradesh","Weather Update : ఎండల తీవ్రతకు రెండు రోజుల్లోనే 40 మంది మృతి.. రాబోయే ఐదు రోజులు జాగ్రత్త
Weather Update : తెలుగు రాష్ట్రాల్లో ఎండలు ముంచెత్తుతున్నాయి. తీవ్ర వడగాలుల కారణంగా గత రెండు రోజుల్లోనే 40 మంది మృతి చెందగా, మరో 5 రోజుల పాటు వాతావరణ శాఖ రెడ్ అలర్ట్ ప్రకటించింది.
Weather Update : ఆంధ్రప్రదేశ్, తెలంగాణ రాష్ట్రాల్లో భానుడు తన ప్రచండ రూపాన్ని చూపిస్తున్నాడు. ఆకాశం నుంచి నిప్పులు కురుస్తున్నాయా అన్నట్లుగా ఎండల తీవ్రత పెరిగిపోవడంతో ఉష్ణోగ్రతలు రికార్డు స్థాయికి చేరుకున్నాయి. గత రెండు రోజుల్లోనే తెలుగు రాష్ట్రాల్లో వడదెబ్బ కారణంగా దాదాపు 40 మంది ప్రాణాలు కోల్పోవడం పరిస్థితి తీవ్రతకు అద్దం పడుతోంది. ఎండలతో పాటు వీస్తున్న వేడి గాలులు తోడవడంతో సామాన్య ప్రజలు, రోడ్డు పక్కన వ్యాపారాలు చేసుకునేవారు ఉక్కిరిబిక్కిరి అవుతున్నారు. గాలిలో తేమ శాతం పూర్తిగా పడిపోవడం వల్లే ఈ స్థాయిలో వడదెబ్బ మరణాలు సంభవిస్తున్నాయని నిపుణులు చెప్తున్నారు. పరిస్థితిని గమనించిన వాతావరణ శాఖ రాబోయే ఐదు రోజుల పాటు రెండు రాష్ట్రాల్లోనూ 'రెడ్ అలర్ట్' ప్రకటించి, ప్రజలంతా అప్రమత్తంగా ఉండాలని హెచ్చరించింది.
తెలంగాణలో పెరుగుతున్న మరణాల సంఖ్య
తెలంగాణ రాష్ట్రంలో ఎండల తీవ్రత ఊహించని స్థాయికి చేరింది. గడిచిన రెండు రోజుల్లోనే ఇక్కడ దాదాపు 30 మంది వడదెబ్బతో మృతి చెందారు. ముఖ్యంగా ఉమ్మడి వరంగల్ జిల్లాలోనే రెండు రోజుల్లో 16 మంది ప్రాణాలు కోల్పోగా, గురువారం తొమ్మిది మంది, శుక్రవారం ఏడుగురు మరణించారు. జయశంకర్ భూపాలపల్లి జిల్లా కాళేశ్వరంలో జరుగుతున్న సరస్వతి అంత్య పుష్కరాలకు వచ్చిన ఒక భక్తుడు కూడా ఎండ తాళలేక వడదెబ్బతో చనిపోయాడు. ఉమ్మడి ఖమ్మం జిల్లా కూడా నిప్పుల కుంపటిని తలపిస్తోంది. ఇక్కడ వడగాలుల తాకిడికి 12 మంది మృతి చెందగా, జిల్లాలోని అనేక ప్రాంతాల్లో ఉష్ణోగ్రతలు 46 డిగ్రీలు దాటాయి. ఖమ్మం రూరల్ మండలం పల్లీగూడెంలో అత్యధికంగా 46.3 డిగ్రీల ఉష్ణోగ్రత నమోదైంది. కేవలం మనుషులే కాకుండా పశువులు కూడా ఈ వేడికి తట్టుకోలేక చనిపోతున్నాయి.
ఏపీలోనూ వడదెబ్బ సెగలు
ఆంధ్రప్రదేశ్ లోనూ ఎండల తీవ్రత ఘోరంగా ఉంది. విజయవాడ నగరంలో వివిధ పోలీస్ స్టేషన్ల పరిధిలోనే వడదెబ్బ కారణంగా 10 మంది ప్రాణాలు కోల్పోయినట్లు వైద్యులు ధృవీకరించారు. మరణించిన వారిలో ఐదుగురు రోజువారీ కూలీలు, ప్రైవేట్ ఉద్యోగులు కాగా, మిగిలిన వారు యాచకులుగా గుర్తించారు. వన్టౌన్, గవర్నర్పేట, మాచవరం, న్యూ రాజేశ్వరీపేట పరిధిలో ఈ మరణాలు సంభవించాయి. నగరంలోని ప్రధాన కూడళ్లలో చలివేంద్రాలు, నీడ సౌకర్యాలు కల్పించినప్పటికీ మరణాలు ఆందోళన కలిగిస్తున్నాయి. దీనితో అప్రమత్తమైన పోలీస్ యంత్రాంగం, విపత్తు నిర్వహణ శాఖ ప్రజలను కాపాడేందుకు ప్రత్యేక చర్యలు చేపడుతోంది.
వాతావరణ శాఖ తీవ్ర హెచ్చరికలు
ఈ భయంకరమైన హీట్ వేవ్ తెలుగు రాష్ట్రాల్లో మరో ఐదు రోజుల పాటు ఇలాగే కొనసాగుతుందని వాతావరణ కేంద్రం స్పష్టం చేసింది. ఈ నేపథ్యంలో తెలంగాణలోని కరీంనగర్, పెద్దపల్లి, సూర్యాపేట, నల్గొండ, హనుమకొండతో పాటు హైదరాబాద్ నగరానికి కూడా హెచ్చరికలు జారీ చేశారు. అటు ఏపీలోని పల్నాడు, నంద్యాల, కర్నూలు జిల్లాల యంత్రాంగాన్ని అధికారులు పూర్తిగా అప్రమత్తం చేశారు. ప్రభుత్వ ఆసుపత్రుల్లో తగినన్ని మందులు, ఓఆర్ఎస్ ప్యాకెట్లను సిద్ధంగా ఉంచాలని కలెక్టర్లు ఆదేశించారు. మధ్యాహ్నం 11 గంటల నుంచి సాయంత్రం 4 గంటల వరకు అత్యవసరమైతే తప్ప వృద్ధులు, గర్భిణీలు, పిల్లలు బయటకు రావద్దని, ఎక్కువగా మజ్జిగ, నీరు తీసుకోవాలని వైద్యులు సూచిస్తున్నారు.",1.0
