title,url,source,date,language,state,district,search_term,full_text,relevance_score
Weather Update: ఈ జిల్లాల్లో ఉరుములు మెరుపులతో వర్షాలు.. మరోపక్క మండే ఎండలు.. ఎల్లో అలర్ట్ ! - Asianet News Telugu,https://news.google.com/rss/articles/CBMi0wFBVV95cUxPSmhqT25NUERaRmlDM194LXJHSUdiYTYyRDhEVG5zLWstdzh4anFMRWx3U01DTXo1TU00X0ZhSUlTb0EzRUtiR2swV21ma0lLNDZ5ZWJubWcyZlFqNXBPTEdDTTc0VWlqY0FBQUhRZ1ZjNnVUNkJKdHp1VnlxNkl5YTdOWG54a2pCaWdtYXRyekpMYTNaUlA0b0lRZUFFd013ZldSV0QwYjZrR2steE4yTmYtVzhwNHpwQVNpRHp5MGs1UVpjYWtsY3JqNF9nNDNYUzc40gHYAUFVX3lxTE5qUG9zamJwb3ZwSldMcGNxU0h3a19kZmNXQ2tUb21jV2lGVTBkdzVWWW9MWjZrMTVsT1FBSlZad3BRcVdBT1A4OWtMbVU0Ulgza2xKT3pHVEhfdGtTNmRJbHV4S3JoUVR6X0NURjhleEhUWE1odmw4U05iWFJUWi1jRFNSYmFNTmc4OV9keUpfVTRTbklGdEJITmpuYVM5ZmRBakdFUWdOVXZBeTYwS3A5MjlyVld4ajVoaVVEeGhDZE83bHdIb1RVbXVEWFpqSHh1dTN4d0VLTg?oc=5,Asianet News Telugu,2026-05-24T08:19:36+05:30,te,Andhra Pradesh,,"(హెచ్చరిక OR ""సహాయ చర్యలు"" OR ""రెడ్ అలర్ట్"" OR ""ఆరెంజ్ అలర్ట్"" OR ""ఎల్లో అలర్ట్"" OR ""హీట్ యాక్షన్ ప్లాన్"" OR ""సహాయ శిబిరం"" OR నష్టపరిహారం) Andhra Pradesh","Weather Update: ఈ జిల్లాల్లో ఉరుములు మెరుపులతో వర్షాలు.. మరోపక్క మండే ఎండలు.. ఎల్లో అలర్ట్ !
Weather Update: తెలుగు రాష్ట్రాల్లో భానుడి భగభగలతో పాటు అకాల వర్షాలు, పిడుగుల బీభత్సం సాగుతోంది. ఆంధ్రప్రదేశ్, తెలంగాణలొని పలు ప్రాంతాల్లో మండే ఎండలతో పాటు వర్షాలు దంచికొడుతాయని వాతావరణ శాఖ హెచ్చరించింది.
నిప్పుల కుంపటిలా మారిన తెలుగు రాష్ట్రాలు.. రికార్డ్ బ్రేక్ ఉష్ణోగ్రతలు
తెలుగు రాష్ట్రాల్లో సమ్మర్ హీట్ నెక్స్ట్ లెవెల్కు వెళ్ళిపోయింది. మే నెలలో భానుడు తన ప్రతాపాన్ని చూపిస్తూ జనాన్ని ముప్పితిప్పలు పెడుతున్నాడు. ఆంధ్రప్రదేశ్, తెలంగాణ అనే తేడా లేకుండా ప్రతి ఊరు నిప్పుల కుంపటిలా మారుతోంది. ఆంధ్రప్రదేశ్ రాష్ట్ర విపత్తుల నిర్వహణ సంస్థ (APSDMA) మేనేజింగ్ డైరెక్టర్ ప్రఖర్ జైన్ తెలిపిన వివరాల ప్రకారం, రాష్ట్రంలో ఎండలు రికార్డు స్థాయికి చేరుకున్నాయి.
ఇప్పటికే ఏపీలోని 13 జిల్లాల్లోని సుమారు 95 మండలాల్లో ఉష్ణోగ్రతలు 42 డిగ్రీల సెల్సియస్ దాటాయి. రాబోయే రోజుల్లో మరో 21 మండలాల్లో తీవ్ర వడగాల్పులు, 214 మండలాల్లో సాధారణ వడగాల్పులు వీచే ఛాన్స్ ఉందని అధికారులు హెచ్చరించారు.
ఏపీలో 46 డిగ్రీల ఉష్ణోగ్రతలు
ఆంధ్రప్రదేశ్లోని కోస్తా, దక్షిణ కోస్తాంధ్ర జిల్లాల పరిస్థితి మరీ ఘోరంగా ఉంది. ఏలూరు, కృష్ణా, ఎన్టీఆర్, గుంటూరు, బాపట్ల, పల్నాడు, ప్రకాశం, నెల్లూరు జిల్లాల్లో కొన్ని చోట్ల ఏకంగా 45 నుండి 46 డిగ్రీల వరకు టెంపరేచర్ నమోదవుతోంది. గడిచిన 24 గంటల్లో కృష్ణా జిల్లా కానుమోలులో హయ్యస్ట్గా 45.8°C రికార్డైంది.
ఇటు తెలంగాణలో కూడా పెద్దపల్లి, సూర్యాపేట జిల్లాల్లో 46.5 డిగ్రీల సెల్సియస్ ఎండతో జనం అల్లాడిపోతున్నారు. హైదరాబాద్, రంగారెడ్డి పరిసర ప్రాంతాల్లో 43 డిగ్రీల వరకు వేడి ఉంటోంది. మధ్యాహ్నం 1 గంట దాటిందంటే చాలు, జనం బయటకు రావడానికి భయపడుతుండటంతో రోడ్లన్నీ కర్ఫ్యూను తలపిస్తున్నాయి.
ఒకవైపు ఎండలు.. ఇంకోవైపు గాలివాన బీభత్సం
ఇదిలా ఉంటే, వాతావరణంలో జరుగుతున్న విచిత్ర మార్పులు జనాలను మరింత బెంబేలెత్తిస్తున్నాయి. తీవ్రమైన ఎండల మధ్యే హఠాత్తుగా వాతావరణం మారిపోయి గాలివాన బీభత్సం సృష్టిస్తోంది. ఈ అకాల వర్షాలు, పిడుగుల కారణంగా వేర్వేరు ప్రమాదాల్లో నలుగురు ప్రాణాలు కోల్పోయారు. అనకాపల్లి జిల్లా నక్కపల్లి, పాయకరావుపేట మండలాల్లో అరగంట పాటు వీచిన తుపాను లాంటి గాలులకు వందలాది విద్యుత్ స్తంభాలు, భారీ వృక్షాలు నేలకూలాయి.
మరో కొన్ని గంటల్లో భారీ వర్షాలు..
హైదరాబాద్ వాతావరణ కేంద్రం (HMD) రాబోయే కొద్ది గంటల్లో తెలంగాణలోని పలు జిల్లాల్లో ఉరుములు, మెరుపులతో కూడిన భారీ వర్షాలు కురిసే అవకాశం ఉందని లేటెస్ట్ వార్నింగ్ ఇచ్చింది.
ముఖ్యంగా మహబూబ్నగర్, వనపర్తి, నాగర్కర్నూల్, నారాయణపేట్, గద్వాల, రంగారెడ్డి, నల్గొండ జిల్లాల్లో వాన పడేందుకు వాతావరణం అనుకూలంగా ఉందని అంచనా వేసింది. వర్షం పడే సమయంలో గంటకు 40 కిలోమీటర్ల వేగంతో బలమైన ఈదురు గాలులు వీచే ప్రమాదం ఉందని చెప్తూ అధికారులకు, ప్రజలకు ఎల్లో అలర్ట్ జారీ చేశారు.
ద్రోణి ప్రభావంతో వర్షాలు
చత్తీస్గఢ్, ఒడిశా మీదుగా ఉత్తరాంధ్ర వరకు ఒక వాతావరణ ద్రోణి కొనసాగుతోందని వాతావరణ శాఖ తెలిపింది. దీని ప్రభావంతో తెలుగు రాష్ట్రాల్లో ఈ మార్పులు జరుగుతున్నాయి. దీని వల్ల రాయలసీమలోని నంద్యాల, అనంతపురం, కడపతో పాటు ఉత్తరాంధ్రలోని కొన్ని జిల్లాల్లో అక్కడక్కడా పిడుగులతో కూడిన లైట్ టు మోడరేట్ వర్షాలు పడే ఛాన్స్ ఉందని అధికారులు చెప్తున్నారు.
ప్రజలు, ముఖ్యంగా రైతులు ఈ ఉరుములు, మెరుపుల సమయంలో చెట్ల కింద ఉండకుండా జాగ్రత్తగా ఉండాలని వాతావరణ శాఖ సూచించింది.",1.0
"Weather Alert: నిప్పుల కుంపటిలా మారిన ఏపీ, తెలంగాణ.. పిట్టల్లా రాలుతున్న జనం.. మరో 5 రోజులు రెడ్... - tv9telugu.com",https://news.google.com/rss/articles/CBMi5gFBVV95cUxNZUhhY1BUX0hPTVpUT1F5RE82WHNXcEZpalVMM2M1VXVDSWJac1lnX05EUENHZVg0MnQ5aktJOGpwWDNCeDQ4NG1KLXNOMHVHUDUwOTBGUkVyTldlVGF0enlOLWR0YndXUVh5TFkyTHdtZWFVMG42emctWkNnaXQyc19taUttRFRydEM0ZkRGQVFBb24tSVlDOG9yVmV6X2syeDF4N0hzV1FQaGNldXQxZklydkZFZllzcmZNYzlGVnV5NVdQQWc4QS1HUnJuM0Nud19yb2ZISHFBMzZHSDBybWZPYzZSZ9IB6wFBVV95cUxPM0dJVkN5SlkzR19uZFlWLUFsLWU3eERUdG4tQlItNlZLcFB1dmVKdjdlUGlCc0NaTTN6cENBbk9Ra3hpRmQyZThJZjc5OWJLcm1OSlNxWk0zQmExUERhTklHX0w5ZXZicXBwQ1lWLV9qRFRWOWlTbGM4eGpyTG5mdXR1LUR0SmpNT0JwUWdFM2duRnNQbkZNQVhtdk5CZ09rdXViN3ViS0Q4R2FidFJyUFFQT05Dc1oxTUJORmJKREZ6SUh2U3YteEtETHcyajBCZnJpRVpEY0VUZzIwSEtZNVFOUjVWb1NTZEw4?oc=5,tv9telugu.com,2026-05-24T06:25:37+05:30,te,Andhra Pradesh,,"(హెచ్చరిక OR ""సహాయ చర్యలు"" OR ""రెడ్ అలర్ట్"" OR ""ఆరెంజ్ అలర్ట్"" OR ""ఎల్లో అలర్ట్"" OR ""హీట్ యాక్షన్ ప్లాన్"" OR ""సహాయ శిబిరం"" OR నష్టపరిహారం) Andhra Pradesh","Weather Alert: నిప్పుల కుంపటిలా మారిన ఏపీ, తెలంగాణ.. పిట్టల్లా రాలుతున్న జనం.. మరో 5 రోజులు రెడ్ అలర్ట్..
తెలుగు రాష్ట్రాల్లో ఎండలు భగ్గుమంటున్నాయి. రికార్డు స్థాయిలో నమోదవుతున్న ఉష్ణోగ్రతలు, తీవ్ర వడగాలులతో ప్రజలు ఉక్కిరిబిక్కిరి అవుతున్నారు. గడిచిన రెండు రోజుల్లో ఏపీ, తెలంగాణలో కలిపి దాదాపు 40 మంది వడదెబ్బతో మృతి చెందడం ఆందోళన కలిగిస్తోంది. మరో ఐదు రోజుల పాటు హీట్ వేవ్ కొనసాగుతుందని అధికారులు రెడ్ అలర్ట్ జారీ చేశారు. ప్రజలు అత్యవసరమైతే తప్ప బయటకు రావొద్దని, ఎక్కువగా నీరు, మజ్జిగ, ఓఆర్ఎస్ తీసుకోవాలని సూచిస్తున్నారు.
తెలుగు రాష్ట్రాల్లో సూర్యుడు ప్రచండ రూపం చూపిస్తున్నాడు. ఎండ తీవ్రతతో వడగాలులు ప్రాణాంతకంగా మారుతున్నాయి. ఇప్పటికే రెండు రాష్ట్రాల్లోనూ వడదెబ్బ మరణాల సంఖ్య ఆందోళన కలిగిస్తుంటే… రాబోయే రోజుల్లో ఈ సెగలు మరింత తీవ్రం కానున్నాయని అధికారులు హెచ్చరిస్తున్నారు. గత కొన్ని రోజుల నుంచి తెలుగు రాష్ట్రాల్లో భానుడు భగభగలాడుతున్నాడు. రికార్డు స్థాయి ఉష్ణోగ్రతలకు తోడు తీవ్రమైన వడగాలులు తోడవడంతో జనం ఉక్కిరిబిక్కిరి అవుతున్నారు. గాలిలో తేమ శాతం పూర్తిగా పడిపోవడంతో వడదెబ్బ రూపంలో మృత్యువు ముంచుకొస్తోంది. గడిచిన రెండు రోజుల్లోనే ఆంధ్రప్రదేశ్, తెలంగాణ రాష్ట్రాల్లో కలిపి దాదాపు 40 మంది ప్రాణాలు కోల్పోవడం పరిస్థితి తీవ్రతకు అద్దం పడుతోంది. తెలంగాణలోనే 30 మంది మృతి చెందారు. ఉమ్మడి వరంగల్ జిల్లాలో ఎండల తీవ్రతకు రెండు రోజుల వ్యవధిలోనే 16 మంది వడదెబ్బతో బలి అయ్యారు. గురువారం తొమ్మిది మంది మృతి చెందగా, శుక్రవారం మరో ఏడుగురు ప్రాణాలు కోల్పోయారు. మరోవైపు జయశంకర్ భూపాలపల్లి జిల్లా కాళేశ్వరంలో జరుగుతున్న సరస్వతి అంత్య పుష్కరాలకు వచ్చిన ఒక గుర్తుతెలియని వ్యక్తి ఇప్పల్ బోరు సమీపంలో వడదెబ్బతో మృతి చెందాడు. అలాగే కాటారం మండలం రేగులగూడెంలో జేసీబీ డ్రైవర్గా పనిచేస్తున్న జార్ఖండ్ రాష్ట్రానికి చెందిన భూయాన్ వినోద్ కూడా వడదెబ్బ తాకిడికి ప్రాణాలు కోల్పోయాడు.
ఉమ్మడి ఖమ్మం జిల్లా నిప్పుల కుంపటిలా మారడంతో వడదెబ్బ తగిలి ప్రజలు పిట్టల్లా రాలిపోతున్నారు. ఈ తీవ్రమైన వేడిగాలుల కారణంగా జిల్లా వ్యాప్తంగా 12 మంది వడదెబ్బతో మృతి చెందారు. జిల్లాలోని అన్ని ప్రాంతాల్లో ఉష్ణోగ్రతలు 46 డిగ్రీలు దాటగా, ఖమ్మం రూరల్ మండలం పల్లీగూడెంలో అత్యధికంగా 46.3 డిగ్రీలు నమోదైంది. పశువులు కూడా ఎండ వేడికి తాళలేక మృత్యువాత పడుతున్నాయి. మెదక్ జిల్లా తూప్రాన్లో ఎండల తీవ్రతకు ఒక ఎద్దు వడదెబ్బ తగిలి మృతి చెందింది.
ఇటు ఏపీలోనూ వడదెబ్బ మరణాలు ఆందోళన కలిగిస్తున్నాయి. విజయవాడ నగరంలోని వివిధ పోలీస్ స్టేషన్ల పరిధిలో వడదెబ్బ కారణంగా 10 మంది ప్రాణాలు కోల్పోయినట్లు వైద్యులు నిర్ధారించారు. మృతి చెందిన వారిలో ఐదుగురు రోజువారీ కూలీలు, ప్రైవేట్ ఉద్యోగులు కాగా, మిగిలిన వారిని యాచకులుగా గుర్తించారు. వన్ టౌన్ పరిధిలో ముగ్గురు, గవర్నర్ పేటలో ముగ్గురు, మాచవరం పరిధిలో ఇద్దరు, న్యూ రాజేశ్వరీ పేటలో ఒకరు, ప్రభుత్వ ఆసుపత్రిలో చికిత్స పొందుతూ మరొకరు మరణించారు. కూడళ్లలో ఉపశమన చర్యలు చేపట్టినా మరణాలు సంభవించడంతో అన్ని పోలీస్ స్టేషన్లను అధికారులు అప్రమత్తం చేశారు.
మరో ఐదు రోజులు రెడ్ అలర్ట్..
ఈ హీట్ వేవ్ తెలుగు రాష్ట్రాల్లో మరో ఐదు రోజులు కంటిన్యూ అవుతోందని అధికారులు హెచ్చరించారు. దీంతో పల్నాడు జిల్లా యంత్రాంగాన్ని పూర్తిగా అప్రమత్తం చేశారు ఇంచార్జి జిల్లా కలెక్టర్ సంజనా సింహ. వడదెబ్బ బాధితుల కోసం ప్రభుత్వ ఆసుపత్రుల్లో తగినన్ని మందులు, ఓఆర్ఎస్ ప్యాకెట్లను సిద్ధంగా ఉంచాలని కలెక్టర్ ఆదేశించారు. రాబోయే మరో ఐదు రోజుల పాటు తీవ్రమైన వడగాలులు వీచే అవకాశం ఉందని… కూలీలు, నిర్మాణ కార్మికులు అప్రమత్తంగా ఉండాలని సూచించారు.
మరోవైపు తెలంగాణలోనూ వాతావరణ శాఖ రాబోయే నాలుగు రోజుల పాటు వివిధ జిల్లాలకు ‘హీట్ వేవ్’, ‘రెడ్ అలర్ట్’ హెచ్చరికలను జారీ చేసింది. ఆదివారం కరీంనగర్, పెద్దపల్లి, జయశంకర్ భూపాలపల్లి, ములుగు, ఖమ్మం, నల్గొండ, సూర్యాపేట, వరంగల్, హనుమకొండ తదితర జిల్లాల్లో తీవ్రమైన వడగాలులు వీచే అవకాశం ఉందని తెలిపింది. సోమవారం ఖమ్మం, నల్గొండ, సూర్యాపేట, మహబూబాబాద్, వరంగల్, హనుమకొండ జిల్లాల్లో ఈ వడగాల్పులు ఇలాగే కొనసాగుతాయని వెల్లడించింది. హైదరాబాద్ సైతం ఈ సెగలకు మినహాయింపు ఏమీ కాదని స్పష్టం చేసింది.",1.0
