title,url,source,date,language,state,district,search_term,full_text,relevance_score
Heat wave alert : ప్చ్.. నెల చివరి వరకు నో రిలీఫ్​! ఈ ప్రాంతాలకు ఐఎండీ హీట్​వేవ్​ అలర్ట్.. | Hindustan Times - Hindustan Times,https://news.google.com/rss/articles/CBMizwFBVV95cUxPYWhuUEdLZFdNa1hJNUhmTjVSU2tnYThnbl96dE5pcnJaVDY5bUM2MFRUdmxLcUc4UzVuQVZRVE1WOEM1YTNhVWE2dnh6c2l0a3ltQmxmczdhS1NsTmJ6eHpQYjlpMG5weE80QWdZc25yWW5ZSXp2dVZlVEFmdzZwZEpwLU5GcGxjcGgzVE1fcDBPbjBRUnVZMmJpVVRzcE5KOVdxeFFIUWNXMEhEOWR3TmtXOXVzcFdCZlBpWEtYMlQ1MnJEaDFGZGVsaU81WknSAc8BQVVfeXFMT2FoblBHS2RXTWtYSTVIZk41UlNrZ2E4Z25fenROaXJyWlQ2OW1DNjBUVHZsS3FHOFM1bkFWUVRNVjhDNWEzYVVhNnZ4enNpdGt5bUJsZnM3YUtTbE5ienh6UGI5aTBucHhPNEFnWXNuclluWUl6dnVWZVRBZnc2cGRKcC1ORnBsY3BoM1RNX3AwT24wUVJ1WTJiaVVUc3BOSjlXcXhRSFFjVzBIRDlkd05rVzl1c3BXQmZQaVhLWDJUNTJyRGgxRmRlbGlPNVpJ?oc=5,Hindustan Times,2026-05-24T10:01:00+05:30,te,Andhra Pradesh,,"(హెచ్చరిక OR ""సహాయ చర్యలు"" OR ""రెడ్ అలర్ట్"" OR ""ఆరెంజ్ అలర్ట్"" OR ""ఎల్లో అలర్ట్"" OR ""హీట్ యాక్షన్ ప్లాన్"" OR ""సహాయ శిబిరం"" OR నష్టపరిహారం) Andhra Pradesh","Heat wave alert : ప్చ్.. నెల చివరి వరకు నో రిలీఫ్! ఈ ప్రాంతాలకు ఐఎండీ హీట్వేవ్ అలర్ట్..
Andhra Pradesh heatwave : దేశంలో ఎండలు మునుపెన్నడూ లేని విధంగా మండిపోతున్నాయి. ఈ నేపథ్యంలోనే వాతావరణశాఖ కీలక హెచ్చరికలు జారీచేసింది. నెల చివరి వరకు ఇదే పరిస్థితులు ఉంటాయని వెల్లడించింది. ప్రాంతాల వారీగా రెడ్, ఆరెంజ్ అలర్ట్లు ఇచ్చింది.
భారతదేశంలో ఒకవైపు నైరుతి రుతుపవనాలు వేగంగా దూసుకొస్తుండగా, మరోవైపు దేశంలోని మెజారిటీ రాష్ట్రాలను తీవ్ర వడగాల్పులు వణికిస్తున్నాయి. ఈ క్రమంలోనే ఎండలకు అల్లాడిపోతున్న దేశ ప్రజలకు భారత వాతావరణశాఖ చేదు వార్త ఇచ్చింది. మే నెలాఖరు వరకు మధ్య, వాయువ్య, తూర్పు భారతదేశంలో భానుడి ప్రతాపం ఇలాగే కొనసాగుతుందని భారత వాతావరణ శాఖ హెచ్చరించింది. పలు రాష్ట్రాలకు వాతావరణ శాఖ 'రెడ్', 'ఆరెంజ్' అలర్ట్లను జారీ చేసింది.
అయితే, ఊరట కలిగించే విషయంగా మే 26 నాడే కేరళలోకి రుతుపవనాలు ప్రవేశించే అవకాశం ఉందని ఐఎండీ అంచనా వేసింది.
ఎండ తీవ్రత.. ఎక్కడెక్కడ ఏ అలర్ట్?
వాతావరణ శాఖ డైరెక్టర్ జనరల్ ఎం. మహాపాత్ర తెలిపిన వివరాల ప్రకారం.. వెస్టర్న్ డిస్టర్బెన్స్ ప్రభావం కేవలం హిమాలయాల పైభాగాలకే పరిమితం కావడంతో మైదాన ప్రాంతాల్లో వేడి గాలులు, ధూళి తుపానులు కొనసాగుతాయి.
రెడ్ అలర్ట్ : ఉత్తరప్రదేశ్, మధ్యప్రదేశ్, వాటి పరిసర ప్రాంతాలకు తదుపరి రెండు రోజుల పాటు 'రెడ్ అలర్ట్' జారీ చేశారు. ఈ ప్రాంతాల్లో అన్ని వయసుల వారికి వడదెబ్బ తగిలే ప్రమాదం చాలా ఎక్కువగా ఉంది.
ఆరెంజ్ అలర్ట్ : వాయువ్య, మధ్య భారత దేశంలోని పెద్ద ప్రాంతాలకు రాబోయే ఐదు రోజుల పాటు ఆరెంజ్ అలర్ట్ ఇచ్చారు. ఎండలో ఎక్కువసేపు ఉండేవారు, శారీరక శ్రమ చేసేవారు జాగ్రత్తగా ఉండాలి.
రాష్ట్రాల వారీగా అంచనా (మే 29 వరకు): పంజాబ్, హరియానా, దిల్లీ, రాజస్థాన్, యూపీ, మధ్యప్రదేశ్, విదర్భలలో తీవ్ర వడగాల్పులు వీస్తాయి. తెలంగాణలో మే 26 వరకు, ఛత్తీస్గఢ్, ఒడిశా లోపలి ప్రాంతాల్లో మే 27 వరకు వడగాల్పుల ప్రభావం ఉంటుంది. కోస్తా ఆంధ్రప్రదేశ్, యానాంలలో మే 24న ఉక్కపోత ఎక్కువగా ఉంటుంది.
ఎల్ నినో భయం: జూన్, జులై, ఆగస్టు కాలంలో 'ఎల్ నినో' పరిస్థితులు ఏర్పడటానికి 90% కంటే ఎక్కువ అవకాశం ఉందని యూఎస్ ఏజెన్సీ ఎన్ఓఏఏ అంచనా వేసింది. భారతదేశంలో ఎల్ నినో వస్తే వేసవి తీవ్రత పెరగడమే కాకుండా, రుతుపవనాలు బలహీనపడే ప్రమాదం ఉంది.
ప్రజలకు ఆరోగ్య సూచనలు..
{{/usCountry}}ఎల్ నినో భయం: జూన్, జులై, ఆగస్టు కాలంలో 'ఎల్ నినో' పరిస్థితులు ఏర్పడటానికి 90% కంటే ఎక్కువ అవకాశం ఉందని యూఎస్ ఏజెన్సీ ఎన్ఓఏఏ అంచనా వేసింది. భారతదేశంలో ఎల్ నినో వస్తే వేసవి తీవ్రత పెరగడమే కాకుండా, రుతుపవనాలు బలహీనపడే ప్రమాదం ఉంది.
ప్రజలకు ఆరోగ్య సూచనలు..
{{/usCountry}}చిన్న పిల్లలు, వృద్ధులు దీర్ఘకాలిక వ్యాధులు ఉన్నవారు ఎండ తగలకుండా జాగ్రత్తపడాలని ఐఎండీ సూచించింది. శరీరంలో నీటి శాతం తగ్గకుండా నిరంతరం ద్రవపదార్థాలు తీసుకోవాలని హెచ్చరించింది.
కేరళకు ముందే రానున్న రుతుపవనాలు..
{{/usCountry}}చిన్న పిల్లలు, వృద్ధులు దీర్ఘకాలిక వ్యాధులు ఉన్నవారు ఎండ తగలకుండా జాగ్రత్తపడాలని ఐఎండీ సూచించింది. శరీరంలో నీటి శాతం తగ్గకుండా నిరంతరం ద్రవపదార్థాలు తీసుకోవాలని హెచ్చరించింది.
కేరళకు ముందే రానున్న రుతుపవనాలు..
{{/usCountry}}ఎండలు మండిపోతున్న వేళ రుతుపవనాలపై వాతావరణ శాఖ కీలక విషయం వెల్లడింంచింది. సాధారణంగా జూన్ 1న భారత గడ్డను తాకాల్సిన నైరుతి రుతుపవనాలు.. ఈసారి ఐదు రోజుల ముందే, అంటే మే 26 నాడే కేరళలోకి ప్రవేశించే అవకాశం ఉంది (దీనికి ±4 రోజుల మోడల్ ఎర్రర్ ఉంటుంది) అని వివరించింది.
{{/usCountry}}ఎండలు మండిపోతున్న వేళ రుతుపవనాలపై వాతావరణ శాఖ కీలక విషయం వెల్లడింంచింది. సాధారణంగా జూన్ 1న భారత గడ్డను తాకాల్సిన నైరుతి రుతుపవనాలు.. ఈసారి ఐదు రోజుల ముందే, అంటే మే 26 నాడే కేరళలోకి ప్రవేశించే అవకాశం ఉంది (దీనికి ±4 రోజుల మోడల్ ఎర్రర్ ఉంటుంది) అని వివరించింది.
{{/usCountry}}ప్రస్తుతం రుతుపవనాలు నైరుతి అరేబియా సముద్రం, కామోరిన్ ప్రాంతం, అండమాన్ సముద్రం, బంగాళాఖాతంలోని మెజారిటీ ప్రాంతాలకు విస్తరించాయి. రాబోయే 3-4 రోజుల్లో ఇవి మరింత ముందుకు సాగడానికి పరిస్థితులు అనుకూలంగా ఉన్నాయి. దీని ప్రభావంతో కేరళ, లక్ష్వద్వీప్, తమిళనాడు, ఈశాన్య భారత రాష్ట్రాలలో రాబోయే 4-5 రోజుల్లో భారీ నుంచి అతి భారీ వర్షాలు కురిసే అవకాశం ఉంది.
{{/usCountry}}ప్రస్తుతం రుతుపవనాలు నైరుతి అరేబియా సముద్రం, కామోరిన్ ప్రాంతం, అండమాన్ సముద్రం, బంగాళాఖాతంలోని మెజారిటీ ప్రాంతాలకు విస్తరించాయి. రాబోయే 3-4 రోజుల్లో ఇవి మరింత ముందుకు సాగడానికి పరిస్థితులు అనుకూలంగా ఉన్నాయి. దీని ప్రభావంతో కేరళ, లక్ష్వద్వీప్, తమిళనాడు, ఈశాన్య భారత రాష్ట్రాలలో రాబోయే 4-5 రోజుల్లో భారీ నుంచి అతి భారీ వర్షాలు కురిసే అవకాశం ఉంది.
{{/usCountry}}",1.0
