title,url,source,date,language,state,district,search_term,full_text,relevance_score
"IMD issues red alert for severe heatwave conditions over MP, UP & Vidarbha - News On AIR",https://news.google.com/rss/articles/CBMingFBVV95cUxNREFJVG5jSzBtMzNLN0ZVeC00dDdTSmRfTHJYYUxnNFZkMWRZSF85U1FpWkxPcjRZcXRfTHpHazRuVldXVzhvMFBqN3VSRndzXzZpYUc4bzI5MUxJU3hrNjVZaU41ckZmN1R0VkJyempoVFJ6SkZkTl8yWlZFNlNHWXZjYzRVeEQ5WU1MLTBsVVpnZkFmOGY2S3lOcnJ0UQ?oc=5,News On AIR,2026-06-02T04:55:53+05:30,en,Chhattisgarh,,"(""heat advisory"" OR ""heat action plan"" OR ""heat alert"" OR ""IMD warning"" OR ""IMD alert"" OR ""red alert"" OR ""orange alert"" OR ""yellow alert"" OR ""NDMA advisory"" OR ""cooling shelter"" OR ""relief measures"" OR ""heat compensation"" OR ""severe weather warning"") Chhattisgarh","The India Meteorological Department (IMD) has issued a red alert predicting heatwave to severe heatwave conditions over Madhya Pradesh, Uttar Pradesh and Vidarbha tomorrow. The weather agency has also forecast heatwave conditions over Delhi, Haryana, Chandigarh, Punjab, Rajasthan, Chhattisgarh, Coastal Andhra Pradesh, Himachal Pradesh, Jammu and Kashmir, Ladakh, Jharkhand, Odisha, Telangana and Uttarakhand for the next two to three days. The IMD has also predicted hot and humid weather conditions over Gangetic West Bengal, Konkan, Goa, Odisha, Saurashtra, Kutch, Tamil Nadu, Puducherry and Karaikal during the next two to three days.
The Met Department has also predicted heavy rainfall over Bihar, interior Karnataka and the north-eastern region till Sunday. According to the Met Department, thunderstorms accompanied by lightning and gusty winds are likely over Kerala, Mahe, Lakshadweep, Madhya Maharashtra, Marathwada, Rayalaseema, South Interior Karnataka, Tamil Nadu, Puducherry, Karaikal, Telangana and parts of the North East during the next three to four days. Similar weather conditions are expected over the Andaman and Nicobar Islands, Arunachal Pradesh and Coastal Karnataka till tomorrow.",1.0
"भीषण गर्मी के बीच राहत की खबर: मौसम विभाग ने जारी की चेतावनी, इन जिलों में आंधी-बारिश का अलर्ट - News Power Game",https://news.google.com/rss/articles/CBMirwFBVV95cUxOMjYtMlo0N0tKdGpQLU41VXlQMm5pMGluY2dpazNKQ0tGdTc1WVk5aGpKVjRfSzd5Ykw1OWg2UzN1UlJQb1lPei1SLTJvcGlNWG1xWHQ2RkQ1bHdpVlhfbDhzOGZzZEVxaGFMRmd6Y3pFblJKa0lfbUgwaHE1U1ZKMS1iV2wxVzBjMDlabHZ2MnN3MHNvRnB4MkM0UXE2M1JiekVmZjZGYkxYTGhHZ0VB0gG0AUFVX3lxTE42eG9tbi1DYzVOOFczWDNzTEwxS09wNUxneVgydGtaNTk5THA3dU55Smc3cnRMQXp6VTA2d2lORnFKSGZjdDRfaGZxZUkxNHZlN1hId3lFQzJMWDA3MlNPbDY0eGhTRk8tQW5YV2xOSW5yYmJtaGJNUUFaYXEzQmFUWXd4RDV6N0NMbENTaTRkMThZeU9sZ2RCYzhDUnlfNWpzajJJX2NOUmF2bzVYRXNkY21EWQ?oc=5,News Power Game,2026-06-02T07:43:03+05:30,hi,Chhattisgarh,,"(""हीट एक्शन प्लान"" OR ""गर्मी से राहत"" OR चेतावनी OR ""रेड अलर्ट"" OR ""ऑरेंज अलर्ट"" OR ""येलो अलर्ट"" OR एडवाइजरी OR ""राहत सामग्री"" OR ""राहत शिविर"" OR मुआवजा) Chhattisgarh","छत्तीसगढ़ में भीषण गर्मी और लू (Heatwave) के बीच मौसम विभाग ने बड़ी राहत की खबर दी है। जानिए कब से शुरू होगी प्री-मानसून बारिश और किन इलाकों में चलेगा अंधड़?
CG Weather Update: पूरा भारत इस समय सूरज के तीखे तेवरों से झुलस रहा है। छत्तीसगढ़ में भी भीषण गर्मी पड़ रही है। नौतपा की शुरुआत के साथ ही प्रदेश में सुबह से ही गर्म हवाएं और चिलचिलाती धूप लोगों को परेशान करने लगती है। दोपहर होते-होते सड़कों पर सन्नाटा पसर जाता है। हालात यह है कि राज्य के लगभग सभी जिलों में पारा 40 डिग्री पार कर चुका है, जिससे आम जनता का हाल बेहाल है।
रायपुर में रिकॉर्ड तोड़ गर्मी
राजधानी रायपुर की बात करें तो यहां गर्मी अपने चरम पर है। हाल ही में यहां का अधिकतम तापमान 44.5 डिग्री सेल्सियस रिकॉर्ड किया गया है। दिन में चलने वाली लू (Heatwave) और शाम को होने वाली भारी उमस ने लोगों की रात की नींद भी उड़ा दी है। कूलर और एसी भी इस भीषण गर्मी के सामने बेअसर साबित हो रहे हैं, जिससे लोग मानसून का बेसब्री से इंतजार कर रहे हैं।
मौसम विभाग की भविष्यवाणी
इस भीषण तपिश के बीच मौसम विभाग (IMD) ने एक राहत भरी खबर दी है। वैज्ञानिकों के मुताबिक, छत्तीसगढ़ के आसमान में अब बादलों की आवाजाही शुरू होने वाली है। प्रदेश के मौसम का मिजाज जल्द ही करवट लेने वाला है, जिससे तपते हुए शहरों को थोड़ी ठंडक मिल सकती है। कुछ चुनिंदा इलाकों में हल्की बूंदाबांदी की उम्मीद जताई जा रही है, जो इस सीजन की पहली बड़ी राहत होगी।
प्री-मानसून की एंट्री और तेज अंधड़ की चेतावनी
मौसम विशेषज्ञों के अनुसार, राज्य में प्री-मानसून एक्टिविटीज (Pre-Monsoon) शुरू होने वाली हैं। इसके चलते आने वाले दिनों में 40 से 50 किलोमीटर प्रति घंटे की रफ्तार से तेज धूलभरी आंधी (अंधड़) चलने की आशंका है। इसके साथ ही कुछ जगहों पर गरज-चमक के साथ हल्की बारिश हो सकती है। इस बदलाव से तापमान में 2 से 4 डिग्री सेल्सियस की गिरावट आने की उम्मीद है।
हल्की राहत तो मिलेगी, लेकिन लू से रहें सावधान
हालांकि, इस प्री-मानसून बारिश से गर्मी से पूरी तरह निजात नहीं मिलने वाली है। मौसम विभाग ने साफ किया है कि भले ही तापमान थोड़ा गिरे, लेकिन उमस और लू का असर कुछ हिस्सों में बना रहेगा।
जरूरी सावधानियां:
• दोपहर में निकलने से बचें: दोपहर 12 बजे से शाम 4 बजे के बीच, जब धूप सबसे तेज होती है, तब बहुत जरूरी काम न होने पर घर से बाहर निकलने से परहेज करें।
• बॉडी को रखें फुल हाइड्रेटेड: प्यास न लगने पर भी लगातार पानी, नींबू पानी, छाछ, लस्सी या ओआरएस (ORS) का घोल पीते रहें ताकि शरीर में पानी की कमी न हो।
• सही कपड़ों का चुनाव: बाहर निकलते समय हमेशा हल्के रंग के, ढीले-ढाले और सूती (cotton) कपड़े पहनें ताकि शरीर को हवा मिलती रहे।
• धूप से सुरक्षा के इंतजाम: जब भी बाहर जाना हो, अपने साथ छाता, सनग्लासेस (धूप का चश्मा) जरूर रखें और सिर व चेहरे को सूती कपड़े या टोपी से ढककर रखें।
• खाली पेट बाहर न जाएं: घर से कभी भी खाली पेट न निकलें। धूप में निकलने से पहले कुछ हल्का खाकर और पानी पीकर ही बाहर कदम रखें।
प्रियांशी नर्मदा ने गुरु घासीदास सेंट्रल यूनिवर्सिटी से जर्नलिज्म एंड मास कम्युनिकेशन (JMC) में ग्रेजुएशन किया है। फिलहाल वह IGNOU, दिल्ली से मास्टर्स कर रही हैं। कई मीडिया संस्थानों में इंटर्नशिप के बाद उन्होंने 2024 में 'TV 24' न्यूज़ चैनल से बतौर कॉपी एडिटर अपने करियर की शुरुआत की। वर्तमान में प्रियांशी NPG News से बतौर कंटेंट राइटर जुडी हैं।",1.0
"उत्तर-छत्तीसगढ़ में हीटवेव का अलर्ट, अधिकतम तापमान 42 डिग्री: लू के थपेड़ों ने झुलसाया, 5 दिनों तक तापमान बढ़न... - Dainik Bhaskar",https://news.google.com/rss/articles/CBMiwwFBVV95cUxQamVzXzVjMnRNZXNodk0xbFFzdkJMazhJcTlfT1VoNmxYY1ZyRlMzOEs4Y1RjU3dUSDNJWldoZ3VoWWh4Ul9EbmpOZEVfd1FTVURxbmV5THVzLU1tV3JxTGlxSnFlOG9EQkxsUW1tcEVkRnhISzN0Z0lLdU5xbWRZejJHM3lFYnc0a1JlYXkxYXc2aExjWWpfa1lIYnBtLUJpOXZqc1NPSHQ0VlZaNkwxanVEU3M5YXV2UjM3V3ZyU3VRajjSAcgBQVVfeXFMTzRMUVk3QVBYeFY1YVRoSUZBZFlkVVYyeEl3bXdBMG9XWjA1d2ZCeFB5MjhKeXd0WTROdkdJUnJXMDRBMXg2bEd0T2xTN3VYOXZYRmFqVHBVU0NjTUZTUml6WlE4SWxxZTY3dFBoRE93NzZ5YXA5WkhhVmt3cU9SYmF3TVBrbGVPTUxZUXl0emZaRWVDTHpwZTlfb3lCSV9sanZ6QmxuUUFOQ3hvNk9KbGpPSE5TTnFaTWpPbGU4d1NTaXA1V3l2Qmk?oc=5,Dainik Bhaskar,2026-06-02T03:06:44+05:30,hi,Chhattisgarh,,"""लू"" Chhattisgarh","- North Chhattisgarh Heatwave Alert: Max Temp 42 Degrees, 5 Day Forecast
उत्तर-छत्तीसगढ़ में हीटवेव का अलर्ट, अधिकतम तापमान 42 डिग्री:लू के थपेड़ों ने झुलसाया, 5 दिनों तक तापमान बढ़ने का पूर्वानुमान
- कॉपी लिंक
उत्तर छत्तीसगढ़ में पिछले दो दिनों से अधिकतम तापमान लगातार 42 डिग्री के आसपास बना हुआ है। मौसम साफ होने के बाद राजस्थान से आ रही गर्म लू के थपेड़ों के कारण भीषण गर्मी पड़ रही है। मौसम विभाग ने अगले पांच दिनों तक हीटवेव का अलर्ट जारी किया है। इस दौरान अध
उत्तर छत्तीसगढ़ में मई के दूसरे पखवाड़े में भीषण गर्मी पड़ रही है। इस साल मई के पहले पखवाड़े में बादलों ने राजस्थान से आ रही गर्म हवाओं को रोक दिया था। मौसम साफ होने के साथ ही अब गर्मी झुलसाने लगी है।
मंगलवार के बाद बुधवार को भी अंबिकापुर का अधिकतम तापमान 42 डिग्री दर्ज किया गया है। वहीं न्यूनतम तापमान में भी लगातार बढ़ोत्तरी हुई है। तेज गर्मी के कारण दोपहर होते ही सड़कों पर सन्नाटा पसरने लगा है। पिछले 24 घंटों में न्यूनतम तापमान भी बढ़कर 24 डिग्री पहुंच गया है। आगामी दिनों में न्यूनतम तापमान में 2 डिग्री तक की बढ़ोत्तरी हो सकती है।
पांच दिनों तक हीटवेव का अलर्ट
मौसम विभाग ने आगामी पांच दिनों तक उत्तर छत्तीसगढ़ में हीटवेव का अलर्ट जारी किया है। मौसम विज्ञानी एएम भट्ट ने बताया कि 21 व 22 मई को सूर्य कर्क रेखा में आ जाता है। इसके कारण सूर्य की रौशनी सीधे पड़ रही हैं।
मौसम के साथ रहने के कारण राजस्थान से आ रही गर्म हवाएं तेजी से प्रवेश कर रही हैं। पांच आगामी पांच दिनों में अधिकतम और न्यूनतम तापमान में बढ़ोत्तरी का पूर्वानुमान है।
लगातार बढ़ रही गर्मी और लू को देखते हुए स्वास्थ्य विभाग ने अलर्ट जारी किया है। लोग भीषण गर्मी के कारण लू की चपेट में आकर बीमार पड़ रहे हैं। सीएमएचओ डा.पीएस मार्को ने लोगों को लू से बचने की अपील की है। लू से बचने के लिए सिर ढंककर ही बाहर निकलने एवं पर्याप्त मात्रा में पानी पीने की सलाह दी गई है।",1.0
"छत्तीसगढ़ में अगले 5 दिन बारिश-आंधी के आसार: गरज-चमक के साथ तेज हवाएं चलेंगी, 24 घंटे बाद बढ़ेगा तापमान; लू... - Dainik Bhaskar",https://news.google.com/rss/articles/CBMi0gFBVV95cUxObFE4RlJlc1N3QVhUSUtVU3V1ejRSN3dJVW1fUFpzT20ybTNrbkNsb0RXTmxGVUxQMjBRWm5WZzVKS2hxSi1wTVJ0RXdNTFp3Z191U05FQzJJbnRkY3FJZTg3czlkTVE3X2Z3bXlmSkRQT1NBRTh0ekxzSmdzMzdTM0tZR0tZeF8zX3c4RnhKUWFZTTYyWm5sQzJtMTZzcFZCY0xJVHphTm5uUHdlU1E4elZCMExTUF9zYlAxVFVhVmJVcUFFQjZXTzcyZFhZa1RMRmfSAdcBQVVfeXFMTnhmUUNIRjRzaGIzaTQ0bXhPNjFMVTF0TWJMYzhhX0kyeF9OOU1jNi02SkF1YVFoek9IdXFHVnhUd3F1cGRKZFl3SkVYZnRiOTZqZGp3Rm83VExGUXU2TjBOc1d0NmVZcFNaMHFwTS1CSlp2Q3ZTQmNTV0NkaXBrbEhFNlRnQ3A4U1dVQjBBQkZmUFJkRVhWOEFoUDN4SEtqT3FRUlQ1ZDEtcE9KRF9ocWpiM3RLUVhjTUtTY092X25WZE0wcEl5emNuY01zaDZpTGhDU1A5V1k?oc=5,Dainik Bhaskar,2026-06-02T08:43:39+05:30,hi,Chhattisgarh,,"""लू"" Chhattisgarh","- Chhattisgarh Weather Alert: Rain, Thunderstorm, High Winds; Temp Rise Soon
छत्तीसगढ़ में अगले 5 दिन बारिश-आंधी के आसार:गरज-चमक के साथ तेज हवाएं चलेंगी, 24 घंटे बाद बढ़ेगा तापमान; लू से भालू की मौत
- कॉपी लिंक
छत्तीसगढ़ में अगले पांच दिन अंधड़, बारिश का अलर्ट है। मौसम विभाग के मुताबिक, इस दौरान प्रदेश के अलग-अलग इलाकों में गरज-चमक और तेज हवाओं के साथ बारिश होने की संभावना है।
हालांकि, अगले 24 घंटों में तापमान में कोई खास बदलाव नहीं होगा, लेकिन इसके बाद अधिकतम तापमान 1 से 2 डिग्री सेल्सियस तक बढ़ सकता है।
इस बीच, मरवाही वनमंडल के पिपरिया गांव से लगे जंगल में भीषण गर्मी और लू के कारण एक मादा भालू की मौत हो गई। ग्रामीणों की सूचना पर वन विभाग की टीम मौके पर पहुंची।
अगर पिछले 24 घंटों के मौसम की बात करें, तो प्रदेश के कई हिस्सों में हल्की से मध्यम बारिश दर्ज की गई है। इसमें सबसे अधिक 30 मिलीमीटर बारिश गरियाबंद जिले में रिकॉर्ड हुई, जबकि सुकमा और सूरजपुर के रामानुजनगर में 20-20 मिलीमीटर वर्षा दर्ज की गई।
इसके अलावा बस्तर के तोकापाल और जगदलपुर समेत कुछ अन्य क्षेत्रों में भी पानी गिरा है। सोमवार को राज्य में सबसे अधिक तापमान 42 डिग्री सेल्सियस राजनांदगांव में, जबकि सबसे कम न्यूनतम तापमान 20.4 डिग्री सेल्सियस पेंड्रा रोड में दर्ज किया गया।
मौसम की डिटेल नीचे बताएंगे, उससे पहले गर्मी में सेहत का ख्याल रखने का तरीका बताने वाली ये खबर पढ़ लीजिए...
जरूरत की खबर- गर्मियों में लें नेचुरल कूलिंग हर्ब्स: बॉडी टेंपरेचर करे कंट्रोल, डिटॉक्स में मददगार, जानें किन्हें नहीं लेना चाहिए
गर्मियों में पसीना, थकान और डिहाइड्रेशन जैसे लक्षण बताते हैं कि शरीर लगातार हीट हो रहा है। इससे बचने लिए इंडियन किचन में कुछ नेचुरल कूलिंग हर्ब्स हमेशा मौजूद रहते हैं। इसलिए आज ‘जरूरत की खबर’ में जानेंगे कि- कूलिंग हर्ब्स शरीर को कैसे फायदा पहुंचाते हैं? इन्हें डाइट में कैसे शामिल करें? पढ़ें पूरी खबर...
रायपुर में चलेगी धूलभरी आंधी
रायपुर के लिए जारी पूर्वानुमान के अनुसार आज बादल छाए रह सकते हैं। शहर में बारिश, गरज-चमक या धूलभरी आंधी की संभावना है। अधिकतम तापमान 40 डिग्री और न्यूनतम तापमान 27 डिग्री सेल्सियस के आसपास रहने का अनुमान है।",1.0
