title,url,source,date,language,state,district,search_term,full_text,relevance_score
"Arwal News: पछुआ हवा और लू से लोग घरों में कैद, सड़कों पर पसरा सन्नाटा - Prabhat Khabar",https://news.google.com/rss/articles/CBMi4gFBVV95cUxNQVlubVBmejNUdmVVTmpqVUNoWFpFc2E3d1BFamdFVWNvWm9uZVJ1VEd2TWR3YjR3Y0xZOGtOOGZwclc5YVFibzVHTHUxQVZ1cURDTGVqYWp1ck82UUVtd3BlbldzVHA2d0JVVk0wQVBzVXFHMG9nNlNIbEg4U0ZuLTdRems5N1l0N2ZjN0hjRHEwckVDNDJDeDhCQ3U2MEp4eHJBWkRQYTdsVklQQnZuRVdLUWNmam42WTRPMy1pRGpzNXhRU3VPeXNRQWkyWnJZMHNzbEIwTHZLN3c0TUJEUk1R0gHnAUFVX3lxTFBiWDd5VkYwbzJkRnB5SXA3NDBRdmtTaWQwU1h4bjdPc0djZTgxM0RDcjV1d3lJZzFhbFI2c3ZseDdHSGJuWURGZTZYc3VSZGphbmdYNTJKQzhwbmNBSUdkOWozZTlYdTQ4ZFJGaTlKemJlWndOalNDSEJQcUt6Ui0yUFl5WUhrakptMTZnY3p0Rk4zbTVfTldKOFJZUG5mSUpKZUpzU1VPQUtFQVZLWlY4ZGVmdWdaQXZoazJXYUNiTHpQY2Jnc05GbXExU012VnhOOEZYMTFabVIxMnVnN3FvM3dKZlNjaw?oc=5,Prabhat Khabar,2026-05-17T16:20:36+05:30,hi,Bihar,Arwal,"लू (Araria OR Arwal OR Aurangabad OR Banka OR Begusarai OR Bhagalpur OR Bhojpur OR Buxar OR Darbhanga OR ""East Champaran (Motihari)"" OR Gaya OR Gopalganj OR Jamui OR Jehanabad OR ""Kaimur (Bhabua)"" OR Katihar OR Khagaria OR Kishanganj OR Lakhisarai OR Madhepura OR Madhubani OR ""Munger (Monghyr)"" OR Muzaffarpur OR Nalanda OR Nawada OR Patna OR ""Purnia (Purnea)"" OR Rohtas OR Saharsa OR Samastipur OR Saran OR Sheikhpura OR Sheohar OR Sitamarhi OR Siwan OR Supaul OR Vaishali OR ""West Champaran"") Bihar","Arwal News: पछुआ हवा और लू से लोग घरों में कैद, सड़कों पर पसरा सन्नाटा
Arwal News: अरवल में जेठ की गर्मी ने बढ़ाई परेशानी, 41 डिग्री पहुंचा तापमान जानिए कैसा रहने वाला हैं आज और कल का दिन.
Arwal News: (निशिकांत) अरवल जिले में इन दिनों सूरज आग उगल रहा है. पछुआ हवा के साथ भीषण गर्मी ने आम जनजीवन को बुरी तरह प्रभावित कर दिया है. रविवार को अधिकतम तापमान 41 डिग्री सेल्सियस दर्ज किया गया. सुबह 8 बजे के बाद ही सूरज की तपिश और लू का असर महसूस होने लगता है जिससे दोपहर तक सड़कों पर सन्नाटा छा जाता है.
जरूरी काम सुबह या शाम में निपटा रहे लोग
लोग जरूरी कामों को सुबह-सुबह निपटाने की कोशिश करते हैं या शाम के बाद ही बाहर निकलते हैं. जेठ की इस झुलसाती गर्मी में लोग घरों में पंखों और कूलरों के सहारे दुबके रहने को मजबूर हैं. खासकर वृद्ध, बच्चे और बीमार लोगों के लिए यह मौसम किसी चुनौती से कम नहीं है.
स्कूल से लौटते बच्चों की हालत खराब
स्कूल जाने वाले बच्चों को सबसे अधिक परेशानी झेलनी पड़ रही है. दोपहर में जब वे स्कूल से लौटते हैं तो उनके चेहरे गर्मी से तपे हुए और थके नजर आते हैं. गांवों में छोटे-छोटे तालाब और पोखर सुख चुके है जंगली पशुओं और पक्षियों के लिए भी इसमें पानी नहीं बचा है जिससे पशु और पक्षी बेहाल हैं। वहीं आवारा कुता ठंडक पाने के लिए नाली के पानी में पड़े रहते हैं.
शीतल पेय पदार्थों की मांग में उछाल
जेठ की इस भयंकर गर्मी ने बेल का शर्बत, सत्तू शर्बत, नींबू पानी, गन्ने का रस, तरबूज और खीरे की मांग बढ़ा दी है. बाजार में इन वस्तुओं की बिक्री में भारी उछाल आया है. दुकानदारों का कहना है कि सुबह 10 बजे से लेकर देर रात तक ग्राहकों की भीड़ लगी रहती है. आइसक्रीम और ठंडे पेयों की दुकानें भी गुलजार हैं. सदर अस्पताल के चिकित्सक डॉ पंकज कुमार ने कहा कि जेठ की गर्मी में लू लगना आम बात है. इससे बचने के लिए लोगों को धूप में बाहर निकलने से परहेज करना चाहिए. शरीर में पानी की कमी से बचने के लिए पर्याप्त मात्रा में पानी, ओआरएस, नींबू पानी, नमक-चीनी का घोल और मौसमी फलों का सेवन करना जरूरी है.
प्रभात खबर डिजिटल टॉप स्टोरी
विवेक पाण्डेय टीवी चैनल के माध्यम से पिछले 6 सालों से पत्रकारिता में एक्टिव हूं . करियर की शुरुआत Network 10 National News Channel से की. अभी प्रभात खबर डिजिटल बिहार टीम में काम कर रहा हूं. देश और राज्य की राजनीति, कृषि और शिक्षा में रुचि रखते हैं.
Prabhat Khabar App :
देश, एजुकेशन, मनोरंजन, बिजनेस अपडेट, धर्म, क्रिकेट, राशिफल की ताजा खबरें पढ़ें यहां. रोजाना की ब्रेकिंग हिंदी न्यूज और लाइव न्यूज कवरेज के लिए डाउनलोड करिए",1.0
