title,url,source,date,language,state,district,search_term,full_text,relevance_score
IMD Issues Rain Alert For 17 States Amid Intense Heatwave Conditions Across India - ABP News,https://news.google.com/rss/articles/CBMizgFBVV95cUxPVGd6d3dMZllwbXZKcEd6VXhXYzh5M1pYel9aT011aDFsOVlsUzAzR1lnNlZ0UUxOLTZ2TDNaWklZeVh0U0hOeXh2LTdjZHpTNEVaYnFzR3VVdXF2Zld0NEhCSjFpNHNKOTVNaEhzalp6b2lKYzVZeVlmZTRZM1ZuWVZwUjlFUGN3Q0Fra3Jfby1EYjhMT0NMWFpBTlo0bnVhc18yQkZaYTJicVhnQUZ4OU1YZ1dTOG1qRWU3WUJ3ZWk0b212NTNvS0VPd0F4d9IB0wFBVV95cUxQVjVtRlZWR3lMdlRJdV9hdWxId3J4bUlBNGMyNW9FWHdoSlZmcTNPX3RZaW1QaDlaNkk3R2tFbVk2dEo0UkJ0bEQ5QTVIa1ludV81LURCNldJUmpMdXI4a2gyMlRTTFpfVEF4TU83U054T1BscFNOS0x3WEVjTm5JTWctd2h4YTh3RERxc3lVcU1BeXdPenRaMTExSC1xUnhSZlBrSjI5bHFxWEdXclV4U1hwX1hhamdJWmRxT0tRVWJDcllHWU4wTEFWY1FqX2JBX1BB?oc=5,ABP News,2026-06-08T12:00:31+05:30,en,Bihar,Banka,"""heatwave"" Bihar","IMD Issues Rain Alert For 17 States Amid Intense Heatwave Conditions Across India
According to the weather agency, light to heavy rainfall is likely in at least 17 states on Monday, including Bihar, Uttar Pradesh, Assam, Kerala, Maharashtra, Nagaland and West Bengal.
Even as large parts of India continue to reel under scorching temperatures, the India Meteorological Department (IMD) has forecast widespread rainfall across several states in the coming days.
According to the weather agency, light to heavy rainfall is likely in at least 17 states on Monday, including Bihar, Uttar Pradesh, Assam, Kerala, Maharashtra, Nagaland and West Bengal. The IMD has also predicted heavy rainfall over parts of Kerala, Karnataka, Tamil Nadu and the Northeast during the next seven days.
Heavy Rain Forecast for South and Northeast India
The IMD said isolated areas of Karnataka could receive heavy rainfall between June 8 and June 10. In the Northeast, wet weather is expected to persist from June 8 to June 13.

Arunachal Pradesh, Assam, Meghalaya, Nagaland, Manipur, Mizoram and Tripura are likely to witness heavy to very heavy rainfall at several places during this period, prompting weather warnings for the region.
Delhi Braces For More Heat
While rain is expected in many parts of the country, Delhi is likely to remain dry. The national capital is expected to witness clear skies on Monday, accompanied by winds blowing at speeds of 20-30 kmph.
Temperatures could climb to around 42 degrees Celsius during the day. Similar weather conditions are forecast for June 9 and 10, with maximum temperatures hovering between 40 and 42 degrees Celsius. The IMD has warned that heatwave-like conditions may develop in several parts of the city.
Rain and Thunderstorm Alert In UP
Several districts in Uttar Pradesh are expected to receive rainfall accompanied by thunderstorms on Monday. The weather department has issued an orange alert for Saharanpur, Muzaffarnagar, Meerut, Bijnor, Ghaziabad, Hapur, Gautam Buddha Nagar, Aligarh, Mathura and Agra.
Strong winds are also likely in these areas. Meanwhile, heatwave conditions are expected to prevail across western and eastern Uttar Pradesh between June 9 and June 11. Rainfall activity is likely to increase in eastern Uttar Pradesh between June 10 and June 14.
Yellow Alert In Bihar
Neighbouring Bihar is also expected to witness a change in weather conditions. The IMD has issued a yellow alert for several districts, including West Champaran, Khagaria, Banka, Munger, Jamui, Katihar, Madhepura and Supaul.
Rainfall is likely at multiple locations across the state on June 10 and 11, accompanied by gusty winds reaching speeds of 50-60 kmph.
Rajasthan Faces Heatwave, Dust Storm Warning
In Rajasthan, the IMD has issued a yellow alert for thunderstorms and rain in six districts, while warning of heatwave conditions in two others.
Daytime temperatures in Sri Ganganagar, Phalodi, Jaisalmer, Barmer and adjoining areas are expected to remain between 44 and 45 degrees Celsius. Hot and dry winds are likely to intensify discomfort, prompting authorities to advise people to avoid prolonged exposure to the sun, especially during afternoon hours.",1.0
"भीषण गर्मी और लू से बेहाल चांदन, बाजार और बस स्टैंड पर पसरा सन्नाटा - Prabhat Khabar",https://news.google.com/rss/articles/CBMipwFBVV95cUxQTFo5OEdFNFU2S1R6Qk9vY09lRHpRMkJHakROcmZZb2hGeVR0MWczTnJuMldkenJnZHJvUjR6SGtmMHJsZ2hEUXlsbTV2RWdtTUdydVFneHpkUS15ektHcUhURW0yaU8tQ0JxZDhUUndhSDVaTkVXdDlZTjFTcDdHcXJEM1hUN2N4Nk40RE40T3dQcXRaYTBRVUZaV2JidUNSNmZuYU84a9IBpwFBVV95cUxQTFo5OEdFNFU2S1R6Qk9vY09lRHpRMkJHakROcmZZb2hGeVR0MWczTnJuMldkenJnZHJvUjR6SGtmMHJsZ2hEUXlsbTV2RWdtTUdydVFneHpkUS15ektHcUhURW0yaU8tQ0JxZDhUUndhSDVaTkVXdDlZTjFTcDdHcXJEM1hUN2N4Nk40RE40T3dQcXRaYTBRVUZaV2JidUNSNmZuYU84aw?oc=5,Prabhat Khabar,2026-06-08T13:52:25+05:30,hi,Bihar,Banka,"लू (Araria OR Arwal OR Aurangabad OR Banka OR Begusarai OR Bhagalpur OR Bhojpur OR Buxar OR Darbhanga OR ""East Champaran (Motihari)"" OR Gaya OR Gopalganj OR Jamui OR Jehanabad OR ""Kaimur (Bhabua)"" OR Katihar OR Khagaria OR Kishanganj OR Lakhisarai OR Madhepura OR Madhubani OR ""Munger (Monghyr)"" OR Muzaffarpur OR Nalanda OR Nawada OR Patna OR ""Purnia (Purnea)"" OR Rohtas OR Saharsa OR Samastipur OR Saran OR Sheikhpura OR Sheohar OR Sitamarhi OR Siwan OR Supaul OR Vaishali OR ""West Champaran"") Bihar","भीषण गर्मी और लू से बेहाल चांदन, बाजार और बस स्टैंड पर पसरा सन्नाटा
Banka News : चांदन प्रखंड क्षेत्र में लगातार पड़ रही भीषण गर्मी और हीटवेव ने जनजीवन पूरी तरह प्रभावित कर दिया है. सुबह से ही तेज धूप के कारण लोग घरों में कैद रहने को मजबूर हैं, जबकि सड़कों और बाजारों में वीरानी का माहौल देखा जा रहा है.
चांदन (बांका) से अमरेंद्र पांडेय की रिपोर्ट
Banka News : चांदन प्रखंड क्षेत्र में कई दिनों से लगातार पड़ रही प्रचंड धूप और उमस भरी गर्मी के कारण आम जनजीवन अस्त-व्यस्त हो गया है. सुबह आठ बजे के बाद ही तेज धूप का असर इतना बढ़ जा रहा है कि लोग घरों से बाहर निकलने से परहेज कर रहे हैं. बहुत जरूरी काम होने पर ही लोग गमछा, छाता और चेहरे को ढककर बाहर निकल रहे हैं.
सड़कों पर पसरा सन्नाटा
भीषण गर्मी का असर बाजार क्षेत्र की मुख्य सड़कों, हाट-बाजार और सार्वजनिक स्थलों पर साफ देखा जा रहा है. आम दिनों की तुलना में लोगों की आवाजाही काफी कम हो गई है. प्रखंड मुख्यालय, बस स्टैंड, रेलवे स्टेशन, बैंक और अस्पतालों में भी लोगों की उपस्थिति सामान्य दिनों से बेहद कम दर्ज की जा रही है.
हीटवेव की चपेट में लोग, अस्पतालों में बढ़ी भीड़
तेज गर्मी और लू के कारण लोग लगातार बीमार हो रहे हैं. दस्त, उल्टी, सिर दर्द, बुखार, चक्कर और कमजोरी जैसी समस्याओं से ग्रसित मरीजों की संख्या में बढ़ोतरी हुई है. कई मरीजों को लू-वार्ड में भर्ती कर इलाज किया जा रहा है. स्वास्थ्य विभाग लगातार लोगों को सतर्क रहने की सलाह दे रहा है.
जलसंकट ने बढ़ाई मुश्किलें
गर्मी के कारण क्षेत्र में चापाकल और कुओं का जलस्तर काफी नीचे चला गया है. वहीं कई जगहों पर जलमीनार से पानी की सप्लाई बाधित रहने से लोगों को गंभीर पेयजल संकट का सामना करना पड़ रहा है. ग्रामीण क्षेत्रों में पानी के लिए हाहाकार जैसी स्थिति बन गई है.
चिकित्सकों की सलाह
चांदन सीएचसी के प्रभारी चिकित्सा पदाधिकारी डॉ आशीष कुमार ने लोगों से अपील की है कि अत्यधिक धूप में बाहर निकलने से बचें. उन्होंने कहा कि सफेद गमछा और धूप चश्मा का उपयोग करें तथा पर्याप्त मात्रा में पानी पीते रहें. साथ ही उन्होंने फास्ट फूड से परहेज और ओआरएस के सेवन की सलाह दी है ताकि लू और डिहाइड्रेशन से बचाव हो सके.
प्रशासन ने सतर्क रहने की अपील की
स्वास्थ्य विभाग और प्रशासन ने लोगों से अपील की है कि वे हीटवेव को हल्के में न लें और पूरी सावधानी बरतें. विशेषकर बच्चों, बुजुर्गों और बीमार व्यक्तियों का अधिक ध्यान रखने की जरूरत बताई गई है.",1.0
