title,url,source,date,language,state,district,search_term,full_text,relevance_score
"Severe heatwave over northwest and central India, warns IMD | India News - Hindustan Times",https://news.google.com/rss/articles/CBMiwwFBVV95cUxQdm4ycnRyNGpBT0VGSkFRdThwVjlYUVpQZW5sY3RhbG8wUmRNS2hqX0ZSejhFQV9iMGVSa2V0ckM5b3hCQlZRWGR4cUU4T3NMV2lKOXY2QVBmRmpSb3liTnctQnE3OU5PdzljR3lNd3N5b3NiUTBJbDlNS0FWVFY1NndlZ0E3Uk1KMlJ4T0daZ0FqU3pfeUZxU0VwUHR4emRLTnltbzAtWWlkNVJCcHIxUk43dFZMVHRQRDhwZ2NhdFA5czDSAcMBQVVfeXFMUHZuMnJ0cjRqQU9FRkpBUXU4cFY5WFFaUGVubGN0YWxvMFJkTUtoal9GUno4RUFfYjBlUmtldHJDOW94QkJWUVhkeHFFOE9zTFdpSjl2NkFQZkZqUm95Yk53LUJxNzlOT3c5Y0d5TXdzeW9zYlEwSWw5TUtBVlRWNTZ3ZWdBN1JNSjJSeE9HWmdBalN6X3lGcVNFcFB0eHpkS055bW8wLVlpZDVSQnByMVJON3RWTFR0UEQ4cGdjYXRQOXMw?oc=5,Hindustan Times,2026-05-18T17:58:25+05:30,en,Himachal Pradesh,,"""heatwave"" Himachal Pradesh","Severe heatwave over northwest and central India, warns IMD
Heat wave to severe heat wave conditions are likely over a few pockets of west Uttar Pradesh till May 24, IMD warned
Heat wave to severe heat wave conditions are likely to prevail over the plains of northwest India and central India during the week, the India Meteorological Department (IMD) warned on Monday.
IMD also warned of severe, large-scale heat waves over Uttar Pradesh during the week. So far, this summer, heat episodes over northwest India dissipated quickly due to intermittent thunderstorms over the region.
Southwest monsoon further advanced into more parts of the southeast Arabian Sea, some parts of Comorin area, more parts of the southwest and southeast Bay of Bengal, most parts of Andaman Sea, the entire Andaman & Nicobar Islands and some parts of the east-central Bay of Bengal.
However, hot conditions are likely to impact most of north India.
On Sunday, maximum temperatures were markedly above normal (5.1 to 6°C) at few places over east and west Madhya Pradesh and Gujarat; at isolated places over Bihar, east Uttar Pradesh, west Uttar Pradesh, Himachal Pradesh, Jammu-Kashmir Ladakh-Gilgit-Baltistan, Muzaffarabad and east Rajasthan; appreciably above normal (3.1°C to 5.0°C) at a few places over Saurashtra & Kutch, Madhya Maharashtra and Vidarbha; at isolated places over Gangetic West Bengal, Uttarakhand and Marathwada.
“We are not expecting any weather system to bring rain immediately. We can expect severe, large-scale heat waves over Uttar Pradesh. Over surrounding areas also we can expect scattered heat waves. People should be prepared and take necessary precautions,” said M Mohapatra, director general, IMD.
{{/usCountry}}“We are not expecting any weather system to bring rain immediately. We can expect severe, large-scale heat waves over Uttar Pradesh. Over surrounding areas also we can expect scattered heat waves. People should be prepared and take necessary precautions,” said M Mohapatra, director general, IMD.
{{/usCountry}}Also Read:Delhi temperature set to rise over next two days, IMD issues yellow alert for heatwave
{{/usCountry}}Also Read:Delhi temperature set to rise over next two days, IMD issues yellow alert for heatwave
{{/usCountry}}Heat wave conditions are likely to prevail over Jammu-Kashmir-Ladakh and central Maharashtra on Monday and Tuesday; Punjab, Haryana, Chandigarh, Delhi and Madhya Pradesh until May 24; Vidarbha until May 23; Chhattisgarh; coastal Andhra Pradesh and Yanam from May 20 to 24; Bihar, Marathawada and Telangana until Wednesday.
{{/usCountry}}Heat wave conditions are likely to prevail over Jammu-Kashmir-Ladakh and central Maharashtra on Monday and Tuesday; Punjab, Haryana, Chandigarh, Delhi and Madhya Pradesh until May 24; Vidarbha until May 23; Chhattisgarh; coastal Andhra Pradesh and Yanam from May 20 to 24; Bihar, Marathawada and Telangana until Wednesday.
{{/usCountry}}Heat wave to severe heat wave conditions are likely over a few pockets of west Uttar Pradesh till May 24, IMD warned.
{{/usCountry}}Heat wave to severe heat wave conditions are likely over a few pockets of west Uttar Pradesh till May 24, IMD warned.
{{/usCountry}}Heat wave conditions over a few pockets likely to prevail over East Uttar Pradesh on Monday with heat wave to severe heat wave conditions over few pockets in east Uttar Pradesh during May 19 and 20, over isolated pockets till May 24. Warm night conditions are in isolated pockets likely to prevail over west Uttar Pradesh on May 19.
Hot and humid conditions are likely in isolated pockets over Odisha till May 22; coastal Andhra Pradesh and Yanam on May 19.
Scattered to isolated light to moderate rainfall with thunderstorm, lightning and gusty winds (speed reaching 40-50 kmph) will be limited to higher reaches over Jammu-Kashmir during May 19 and 22; Uttarakhand during May 20 to 22; with thunderstorm, lightning and gusty winds (speed reaching 30-40 kmph) likely over Himachal Pradesh on May 21 and 22. Strong surface winds (speed reaching 20-30 kmph gusting to 40 kmph) over Punjab, Haryana Chandigarh & Delhi, Uttar Pradesh till May 24.
IMD issued an orange alert for large parts of northwest and central India for the next three days. It also warned of increased likelihood of heat illness symptoms in people who are either exposed to sun for a prolonged period or doing heavy work.
There is high health concern for vulnerable people, including infants, elderly, people with chronic diseases.
In its agromet advisory, IMD advised for Punjab to apply light and frequent irrigation to vegetable, moong fruit plants, orchards and onion nurseries. In Haryana it asked to maintain adequate irrigation in standing sugarcane, cotton and summer fodder crops. It also advised complete paddy nursery preparation with assured irrigation facilities and adopt mulching/moisture conservation practices to reduce water stress in newly sown crops.
In Uttar Pradesh, it asked to provide frequent irrigation and mulching for standing crops such as maize, green gram, black gram, sugarcane, sunflower, vegetables, and fruit plants such as mango, banana, and papaya.",1.0
Heatwave Alert: IMD Issues Warning for Severe Heatwave Across Northwest and Central India as Temperatures - LatestLY,https://news.google.com/rss/articles/CBMijAJBVV95cUxNcE5IZnpOUXFzd2czSGRZYk9fLVdKTG1tVGpESkpNT2tnSzZrbFhXNkhPQWdWZk9DTE43dzFGQVpzNl9pbGRyZGwwX2Rjc1MyZkV5X2JaV2J0T3pLREFvYXZqaDZZbmZZRVN1ZzhwbndMS0h5LUtJZVBxM1VhZVNKY3V1VXotS25xN2pDOWNYQjVfajhMb3lTVmFCbmdKNjJFcEI0Z2tyNkhza1VfTkNzWlptMUE5SVJUVVNYX3hBQlZjRGUzcXZkeXNrQnV0bzU2Qk9WNTFySUJqTmllYlZNLUY2Vm5UX0JBVE9rV3VkVndXSVZPaVl4alNfRU81T01NeEpkSVctdVZla0k40gGSAkFVX3lxTE9hbHNGY0JkZ1NfSk1jQ3dBcmtMRVhub1R0NjNkbzBfbWtORS0ySDlsamZ3eUh0ZHFNQmNGZDdDdkI5dklkZG1mTDFlNEJXZUt0aUhIaHFZRWRvb1dnQ2hLQVJoTUdTZ1lzYlZMelVtdDhjNTRXeFFlNS10TjRYRzRjR0ozNHhvbHZJakxWWVVCMzMtYnlmZlpJSUtxTS14eHVvY0JVMUd3dGVLS0Z5ZGF0cnk1Z3FtYk5BWWlld0Q3UnZYTW9aRHI3cElNTHBKajQ5cmtxNjRnSEltWTFQUTcxZHlMT004cl93dkF6WXpWekpPMTlpbUstMmxKSFhGWU9CQ1kxNE9uM1F2SkxpYWota1E?oc=5,LatestLY,2026-05-18T18:41:56+05:30,en,Himachal Pradesh,,"""heatwave"" Himachal Pradesh","Heatwave Alert: IMD Issues Warning for Severe Heatwave Across Northwest and Central India as Temperatures May Hit 45 Degrees Celsius
The India Meteorological Department (IMD) has issued a heatwave warning across several parts of the country, cautioning that maximum temperatures could rise up to 45 degrees Celsius in the coming days, with dry and hot conditions likely to persist for at least a week.
New Delhi, May 18: The India Meteorological Department (IMD) has issued a heatwave warning across several parts of the country, cautioning that maximum temperatures could rise up to 45 degrees Celsius in the coming days, with dry and hot conditions likely to persist for at least a week. Speaking to ANI on Monday, IMD scientist Akhilesh Shrivastav said, ""Today, the regions of Northwest India, along with Central India and the nearby areas, are expected to experience heatwave conditions. These conditions are likely to persist over the coming week--that is, for the next 7 days.""
He further detailed the state-wise alert zones, saying, ""Heatwave warnings have been issued for Punjab, Haryana, Uttar Pradesh, Madhya Pradesh, Rajasthan, as well as the Vidarbha, Central Maharashtra, and Marathwada regions of Maharashtra."" Highlighting severity in certain regions, he added, ""In Western Rajasthan and Western Uttar Pradesh, a 'warm night' warning has been issued, and due to this, an 'orange alert' has also been issued. In Madhya Pradesh and Vidarbha, severe heatwave conditions may prevail, for which an 'orange alert' has also been issued."" Heatwave Alert: IMD Issues Heatwave Warning for Northwest and Central India; These States Will Experience Warm Nights.
He also warned of humid conditions in eastern and southern regions, saying, ""In Odisha, hot and humid weather conditions are expected over the next 3-4 days. In coastal Andhra Pradesh, heatwave conditions may arise in the next 3-4 days."" For Delhi-NCR, he said temperatures are already high and expected to rise further. ""Maximum temperatures recorded yesterday were between 42-43 degrees Celsius. Our estimate is that over the next week, temperatures in Delhi could remain between 42-44 degrees Celsius. In the next 3 days, temperatures could even reach 45 degrees, and isolated heatwave conditions are also expected in Delhi. An 'orange alert' has been issued for Delhi for the next two days."" Heat Wave Alert: IMD Issues Warning for Multiple States As Temperatures Rise, Check Full List.
On rainfall patterns, Shrivastav added, ""Northwest India will remain largely dry, which will lead to a rise in temperatures. However, Kerala, Karnataka, and Tamil Nadu are expected to receive rainfall. A heavy to very heavy rainfall warning has been issued for Kerala. Karnataka may also see hailstorm activity, while Northeast India is expected to receive heavy to very heavy rainfall.""",1.0
46 डिग्री पार पहुंचा पारा! IMD ने दिल्ली-UP सहित 9 राज्यों में जारी किया भीषण लू का अलर्ट - Patrika News,https://news.google.com/rss/articles/CBMiwAFBVV95cUxOQkgxdmJzWDFGQ2JKdm9DOGZZWHhNa1lXMFFJNVQxNzNmZS12U3JGaUNpQXgzQXFuNEZZTHZheU50bzJONnZNdU9CcEgtRWpRQ2ZvUnotb1dxZ1N6MDRkczRMQmVGZ053WGJRUncxbWo1X1hpZjlxV3lhaV81eHpsU1lyeGUySUV0djBQbzdYaDlGWEFISjFJNkswRmVlbVZIS1A5MGY4UTZsVkYtUFJ3ZHg0VnNKdnNYdFdoYVI0ZE7SAcYBQVVfeXFMTlR4YmN3VU1jMU05Y294VVBGODk0S1JINTRDdnVXZXJsQ0NaSDJhcjlsZG95QU1STk9Qd21tQm9fdnhXNTU3ZEZzbG8zVU54SGpQMVBFR081eWRxWVVsQWpXV3dlVjdSbjQ4bm9FREQwcUQ5VEdkLVhDdThQZi1HakhPbjkyUWh4UVRvTUpKNTkxWXU4Tk44TkQ5ZlJNRlRaMlhueXZDV1BSeWFUaHczQTdnTjROM0tzSEtlX1BMYm0yZGIzVkVn?oc=5,Patrika News,2026-05-18T19:48:03+05:30,hi,Himachal Pradesh,,"""लू"" Himachal Pradesh","IMD Heat wave Alert: भारत मौसम विज्ञान विभाग (IMD) ने देश के कई हिस्सों में तेज गर्मी और लू (Heat Wave) को लेकर बड़ा अलर्ट जारी किया है। 18 से 24 मई तक राजस्थान, पंजाब, हरियाणा, दिल्ली, उत्तर प्रदेश, मध्य प्रदेश, विदर्भ, छत्तीसगढ़ और आंध्र प्रदेश के तटीय इलाकों में लू की स्थिति बनी रहेगी। कुछ जगहों पर गंभीर लू (Severe Heat Wave) का खतरा भी है।
IMD के अनुसार, 18 मई को बिहार, हरियाणा, चंडीगढ़, दिल्ली, जम्मू-कश्मीर-लद्दाख, महाराष्ट्र, पंजाब, राजस्थान और उत्तर प्रदेश के कुछ इलाकों में लू पड़ने की संभावना है। मध्य प्रदेश में कहीं-कहीं गंभीर लू की स्थिति बन सकती है। 19 मई को मराठवाड़ा, तेलंगाना और विदर्भ भी इसकी चपेट में आएंगे। 20 से 24 मई तक छत्तीसगढ़, मध्य प्रदेश, पंजाब, राजस्थान, तेलंगाना, विदर्भ, हरियाणा-दिल्ली और आंध्र प्रदेश के तटीय क्षेत्रों में लू जारी रहने की संभावना है।
उत्तर प्रदेश में सबसे ज्यादा खतरा
पश्चिमी उत्तर प्रदेश में 19 से 24 मई तक गंभीर लू की स्थिति रहने की चेतावनी है, जबकि पूर्वी उत्तर प्रदेश में 19-20 मई को गंभीर लू और उसके बाद भी लू बनी रहेगी। राजस्थान में 18 से 21 मई तक गर्म रातों (Warm Nights) का सिलसिला चलेगा।
तापमान में बढ़ोतरी
17 मई को बांदा (उत्तर प्रदेश) में अधिकतम तापमान 46.4 डिग्री सेल्सियस दर्ज किया गया। पश्चिमी मध्य प्रदेश और हिमाचल प्रदेश में तापमान सामान्य से 5.1 डिग्री से ज्यादा ऊपर रहा। न्यूनतम तापमान में भी कई राज्यों में 3 से 5 डिग्री की बढ़ोतरी दर्ज की गई, जिससे रातें भी असहनीय हो रही हैं।
गर्म और नम मौसम का प्रकोप
ओडिशा (18-22 मई), गुजरात और आंध्र प्रदेश के तटीय इलाकों में गर्म व नम (Hot & Humid) मौसम बना रहेगा, जिससे लोगों को सांस लेने में तकलीफ हो सकती है।
समुद्री चेतावनी
अरब सागर और बंगाल की खाड़ी में तेज हवाएं चल रही हैं। केरल, कर्नाटक तट, लक्षद्वीप, कोमोरिन क्षेत्र और सोमालिया तट पर 40-65 किमी प्रति घंटे की रफ्तार से हवाएं चलने का अनुमान है। मछुआरों को समुद्र में न जाने की सलाह दी गई है।
लोगों को सावधानी बरतने की अपील
स्वास्थ्य विशेषज्ञों ने कहा है कि दोपहर 12 बजे से 4 बजे के बीच बाहर निकलने से बचें, खूब पानी पिएं, हल्के रंग के ढीले कपड़े पहनें और बुजुर्ग, बच्चों व बीमार लोगों का खास ध्यान रखें। लू लगने पर तुरंत चिकित्सकीय मदद लें।",1.0
