title,url,source,date,language,state,district,search_term,full_text,relevance_score
"UP Heatwave Red Alert : यूपी के 22 जिलों में लू का अलर्ट, 26 अप्रैल से एक नया पश्चिमी विक्षोभ सक्रिय होने से गिरेगा पारा - hindi.pardaphash.com",https://news.google.com/rss/articles/CBMikAJBVV95cUxNUGVTay0yQjAyRm5XbXljZGFnbnoyb3lsR0NnRVhKTlpLOWR1NnFOVThUaWNyRjFUcWRGUktGTnNnVWk2andETmpNMDRjZ193QlpNSGd1RmpjanUwS1ZQcUg4M2JNdWRhWllfMlNlMndETHdBeXF5ZjRyUmFRaGUtbjRQM2YyMHhoSHhPU3N5VVBaQ004cTY1bnAwRGZ1dG44OFh4SDkzSWdydWpQWXpXYjdZMHA1NVNQMENXdjBsMWNnbDZNcmFGbjZWcE04cXhpcjQ0SDJKQlVTLWd6M1hIQmkzMlF0Z0RNTjQ3OHYxTjJSdVg2MnAzMm5Mbm9uWjRvYzhXZlNuR0pvcnk0LWxTV9IBlgJBVV95cUxOTHpDVDk3STIzUzFYc3A0QnIyWGZRRE9JeUZUSUYzcmdNVl9rLS15c3F0dWNOX2pqR2ZzRkJVemRaSjAyTjFhVDlnN0RJUFRyMW1UdUlMTlhDdkFVUGw0andKT3NtQnJLSVZxRFA0bnB6NlZMQ256Z1NOdzR2Y2dvUllJdFE0S1hlMDAtUlhOSmR0R1N0RnRUOHpUQlVSZU9hMl9DUEozWmhCeHFCSzl1cVZJSWt6RTZNM2dEa09ncnZXNVlJakZXdE8wRnAtcjJ3NW94ZEJ0eTV1NzZQY0lUNnkxMlVoZTU5SWVvR0NEQk1iNHFwa2ZIcnVscGRPdXFHVkQ2TURfeDVydUlQRUZUZHZQdnRyQQ?oc=5,hindi.pardaphash.com,2026-04-23T12:15:10+05:30,hi,Uttar Pradesh,Lucknow,"(""हीट एक्शन प्लान"" OR ""गर्मी से राहत"" OR चेतावनी OR ""रेड अलर्ट"" OR ""ऑरेंज अलर्ट"" OR ""येलो अलर्ट"" OR एडवाइजरी OR ""राहत सामग्री"" OR ""राहत शिविर"" OR मुआवजा) Uttar Pradesh","यूपी में भीषण गर्मी और तपिश का प्रकोप लगातार जारी है। माैसम विभाग (Meteorological Department) ने बताया कि 25 अप्रैल तक पूरे प्रदेश में तापमान में बढ़ोतरी दर्ज होगी और लू से प्रभावित क्षेत्रों का दायरा बढेगा। फिलहाल अगले दो दिनों तक इस प्रचंड गर्मी से राहत मिलने की उम्मीद नहीं है।
लखनऊ। यूपी में भीषण गर्मी और तपिश का प्रकोप लगातार जारी है। माैसम विभाग (Meteorological Department) ने बताया कि 25 अप्रैल तक पूरे प्रदेश में तापमान में बढ़ोतरी दर्ज होगी और लू से प्रभावित क्षेत्रों का दायरा बढेगा। फिलहाल अगले दो दिनों तक इस प्रचंड गर्मी से राहत मिलने की उम्मीद नहीं है।
गुरुवार के लिए यूपी के 22 जिलों में लू की चेतावनी जारी की गई है। बुधवार को बांदा में अधिकतम तापमान 43.8 डिग्री सेल्सियस दर्ज हुआ। वहीं वहीं 43.7 डिग्री के साथ प्रयागराज प्रदेश में दूसरे नंबर पर रहा। आंचलिक माैसम विज्ञान केंद्र लखनऊ (Regional Meteorological Centre, Lucknow) के वरिष्ठ वैज्ञानिक अतुल कुमार सिंह (Senior Scientist Atul Kumar Singh) ने बताया कि 26 अप्रैल से एक नए विक्षोभ सक्रिय (New Western Disturbance) होने से प्रदेश भर में बादलों की सक्रियता बढ़ेगी और पश्चिमी यूपी, तराई आदि में बूंदाबांदी से पारे में गिरावट के संकेत हैं।
इन जिलों में लू का अलर्ट
24 और 25 अप्रैल को लखनऊ में चलेगी लू
यूपी की राजधानी लखनऊ में बुधवार को भी लोगों को भीषण गर्मी का सामना करना पड़ा। झुलसा देने वाली धूप के साथ दिन में पछुआ हवाओं ने आग में घी का काम किया। अधिकतम तापमान में भी बढ़त दर्ज की गई।
आंचलिक माैसम विज्ञान केंद्र लखनऊ (Regional Meteorological Centre, Lucknow) के वरिष्ठ वैज्ञानिक अतुल कुमार सिंह (Senior Scientist Atul Kumar Singh) ने बताया कि लखनऊ में फिलहाल तीन दिन तक तापमान का बढ़ना जारी रहेगा। 24 व 25 अप्रैल को राजधानी में लू चलने की चेतावनी है। इसके बाद 26 अप्रैल से एक नया पश्चिमी विक्षोभ (New Western Disturbance) सक्रिय हो रहा है। इसके प्रभाव से बादलों की सक्रियता बढ़ने और थोड़ी राहत मिलने की उम्मीद है। बुधवार को अधिकतम तापमान 0.9 डिग्री की बढ़त के साथ 41.1 डिग्री सेल्सियस दर्ज हुआ। वहीं रात का न्यूनतम तापमान 0.9 डिग्री की बढ़त के साथ 24.5 डिग्री सेल्सियस दर्ज हुआ।",1.0
