title,url,source,date,language,state,district,search_term,full_text,relevance_score
"यूपी का 5वां सबसे गर्म शहर वाराणसी: अगले 48 घंटे के लिए मौसम विभाग ने रेड अलर्ट जारी किया,काशी विश्वनाथ मंद... - Dainik Bhaskar",https://news.google.com/rss/articles/CBMiwgFBVV95cUxQM2RMUTFfYnExMWJUa2w5RkRQYjVSeWtUN3h0S3BFWFVpcjhwb1RuZk05ekJpZkdLYTdncHRTd1FVc29XNWNraGFTdEZYZjFWQmp4V1FPY1BEVWplWnRiamNuQzdmSG5mdWZPNTBfZDExdE93eVpLOFNDY3NxYXl0d0JxdnJPaWgtMUZwSHpyc2NnWW1RYVpZQTJRWkFFOHJQbHhUaktPS1VHYmxDVWo2S3RYUkNkdVNVOUJlUkQ3d1F3QdIBxwFBVV95cUxObDh2S2JMY3ZCd3FIcHl2VzFhMEF6TmhITkxQTHFvcnJwZi03VXZ1cUxqRFpsMWY1aGo3TUhGOV9NaGxhbkxYemw1LUtDZFNvYk9KMTNSak1HWWxOcW1rMUNMNFc3UEZtQkRxOEVKVXhUU284cjhudDhnZUY3akloazZCNVR0ZHBhQld3Qmh5bjE5SXlPcmR0LUJYSlhTc0Q4Uy1ZZkI3QnZyeHJGemtVejZkRnpIeWloS3RieFRtNTNIcEEyOHk0?oc=5,Dainik Bhaskar,2026-05-23T15:15:20+05:30,hi,Uttar Pradesh,Varanasi,"(""हीट एक्शन प्लान"" OR ""गर्मी से राहत"" OR चेतावनी OR ""रेड अलर्ट"" OR ""ऑरेंज अलर्ट"" OR ""येलो अलर्ट"" OR एडवाइजरी OR ""राहत सामग्री"" OR ""राहत शिविर"" OR मुआवजा) Uttar Pradesh","- Varanasi Red Alert Heatwave | Kashi Vishwanath Temple Mats Amidst UPs Hottest City
यूपी का 5वां सबसे गर्म शहर वाराणसी:अगले 48 घंटे के लिए रेड अलर्ट, काशी विश्वनाथ मंदिर में फर्श पर बिछाया गया मैट
- कॉपी लिंक
काशी में भीषण गर्मी और लू का प्रकोप लगातार बढ़ता जा रहा है। शनिवार को तापमान में मामूली गिरावट जरूर दर्ज की गई, लेकिन लोगों को तपिश से राहत नहीं मिली। भीषण गर्मी का असर गंगा घाटों पर भी दिखाई दिया, जहां आम दिनों की तुलना में सन्नाटा पसरा रहा। शहर का
वही,मौसम विभाग ने 24 से 26 मई तक लू का रेड अलर्ट जारी किया है। इस दौरान 30 से 40 किलोमीटर प्रति घंटे या उससे अधिक रफ्तार से गर्म पछुआ हवाएं चलने की संभावना जताई गई है। हालांकि मजबूत पुरवा हवाओं ने गर्म पछुआ हवाओं की तीव्रता को कुछ हद तक नियंत्रित किया है, लेकिन गर्मी का असर लगातार बना हुआ है।
देखें तस्वीर…
पछुआ हवाओं का असर नही दिखा
मौसम वैज्ञानिक डॉ. अतुल कुमार सिंह के अनुसार अगले सप्ताह तक मौसम से राहत मिलने के संकेत नहीं हैं। उन्होंने बताया कि फिलहाल पछुआ हवाओं का सबसे ज्यादा असर बुंदेलखंड क्षेत्र में दिख रहा है, लेकिन पूर्वांचल में भी अगले एक-दो दिनों में इसका प्रभाव तेजी से बढ़ेगा। रेड अलर्ट समाप्त होने के बाद भी अगले सप्ताह तक यलो अलर्ट जारी रहने की संभावना है।
30 मई को काशी में होगी बारिश
इधर, 25 मई से शुरू होने वाले नौतपा को लेकर भी लोगों की चिंता बढ़ गई है। नौतपा दो जून तक रहेगा। मौसम संबंधी वेबसाइट एक्यूवेदर के अनुसार अगले पांच दिनों तक भीषण गर्मी का दौर जारी रहेगा। 30 मई से तापमान में कुछ गिरावट के संकेत हैं। उस दिन तापमान 37 डिग्री सेल्सियस तक पहुंच सकता है, जबकि उसके बाद अगले चार-पांच दिनों तक एक-दो डिग्री का उतार-चढ़ाव बना रह सकता है।
राम-जानकी मंदिर में लगा कूलर
भीषण गर्मी को देखते हुए मंदिरों में भी विशेष इंतजाम किए जा रहे हैं। लोहटिया स्थित राम-जानकी मंदिर में भगवान राम दरबार के सामने लगातार कूलर चलाया जा रहा है। मंदिर खुलने से लेकर बंद होने तक शीतल वातावरण बनाए रखने की व्यवस्था की गई है। मूर्तियों को सूती वस्त्र पहनाए गए हैं और भोग-प्रसाद में ठंडी सामग्री व फल अर्पित किए जा रहे हैं। मंदिर के पुजारी देवेंद्रनाथ चौबे ने बताया कि जिस प्रकार इंसानों को मौसम का एहसास होता है, उसी तरह भगवान को भी होता है। इसी भावना के तहत सभी व्यवस्थाएं की गई हैं।
मंदिर के फर्श पर लगा मैट
वहीं मंदिर प्रशासन की ओर से श्रद्धालुओं की सुविधा के लिए भी व्यापक इंतजाम किए गए हैं। एसडीएम शंभू शरण ने बताया कि श्रद्धालुओं के पैरों को गर्म फर्श से बचाने के लिए पूरे परिसर में जूट मैट बिछाई गई है। दर्शन पथ पर छाया के लिए जर्मन हैंगर और टेंसाइल स्ट्रक्चर लगाए गए हैं। गर्मी से राहत देने के लिए मिस्ट फैन की व्यवस्था की गई है। साथ ही आपात स्थिति से निपटने के लिए आरोग्य केंद्र, एंबुलेंस और प्रशिक्षित कर्मियों की तैनाती भी सुनिश्चित की गई है।",1.0
