title,url,source,date,language,state,district,search_term,full_text,relevance_score
Heatwave Alert: Delhi Nears 46 Degrees Celsius as Extreme Heat Grips North India - outlookbusiness.com,https://news.google.com/rss/articles/CBMijAFBVV95cUxNTFh0MEx1OHR0UlBCV2RieGZsNm5HU2ZadHF5YmtzVnNGaklRbkFacGQyR3E3bzBqWWVxTllMRHl1c3M0MV9VRmdRVWdiMkpOZVNyTWZlVEZHSmJfOEdEOEJrMkNNekwyNk5NZFY3dC1HbzByeDgyaGxMNGp5LW9jelRyNTF4b096YTlOaNIBmgFBVV95cUxPVGpCZUx5czMybGZ1VW1LNUxpNU1ScU5oY0xKeEJEdlROLThfSDlWUm5tdXNVVUJ0TDdNNFBsRWVRbVJqQzRmdER4eGNiYXdvRlBkOTBxVnh1Y21GWTlzQXBNTTJUNFREVWVEMnE0MjFyalRYRjMxUlhRZm4tNU11TnMweHNGSDhZekl1Mm1ncnpEdjlRYmtfWlJR?oc=5,outlookbusiness.com,2026-05-27T13:43:47+05:30,en,Chandigarh,Chandigarh,"(heatwave OR ""heat wave"" OR ""severe heatwave"" OR ""extreme heat"" OR ""heat spell"" OR ""scorching heat"" OR ""blistering heat"" OR ""sweltering heat"" OR ""hot winds"" OR loo OR ""hot loo winds"" OR ""intense heat"" OR ""unbearable heat"" OR ""deadly heat"" OR heat OR ""weather forecast"" OR ""weather update"" OR ""weather alert"" OR ""IMD forecast"" OR ""IMD prediction"" OR ""IMD alert"" OR IMD OR ""rising temperatures"" OR ""temperatures expected to rise"" OR ""relief from heat"" OR ""respite from heat"" OR ""heat respite"" OR ""respite from scorching heat"") Chandigarh","Delhi temperatures may reach 46 degrees amid intensifying heatwave conditions across northern India.
IMD issued yellow alert warning residents about prolonged extreme heat and warm nights.
PM Modi urged citizens staying hydrated and recognising signs of heat exhaustion symptoms.
Residents of Delhi, north and central India continued to experience intense heatwave conditions, according to the India Meteorological Department (IMD). The met department further warned that temperatures are expected to increase further over the next few days.
According to IMD’s weather bulletin, heatwave conditions are likely to continue in isolated pockets of Punjab, Haryana, Chandigarh and Delhi, Uttar Pradesh, Rajasthan, Madhya Pradesh, Vidarbha, Jammu and Kashmir, Uttarakhand, Jharkhand, Himachal Pradesh, Chhattisgarh, Odisha, Coastal Andhra Pradesh and Yanam, and Telangana.
The weather department has also forecast hot and humid conditions over parts of West Bengal, Konkan, coastal areas of Saurashtra and Kutch, Tamil Nadu, Odisha and Andhra Pradesh. Warm night conditions are also expected to persist in isolated areas of Punjab, Haryana, Chandigarh and Delhi over the coming days.
In addition, the IMD has issued a yellow alert for heatwave conditions for the national capital. The weather department predicted mainly clear skies along with heatwave conditions at isolated places. Strong surface winds with speeds of 20-30 kmph, gusting up to 40 kmph during the day, are also expected. Delhi’s maximum temperature is likely to touch 46 degrees Celsius, while the minimum temperature is expected to lie around 29 degrees Celsius.
PM Modi Issues Public Appeal
Meanwhile, PM Narendra Modi urged citizens in a post on X on May 27 to remain cautious and take necessary precautions during the ongoing heatwave. He advised citizens to stay hydrated while stepping outdoors.
“Different parts of India are witnessing soaring temperatures and the challenges that come with it. This heat is harsh on all of us and I urge you all to take as many precautions as possible. Please stay hydrated, keep water with you when stepping out. Offer a glass of water to others. In weather like this, such kindness goes a long way,” PM Modi wrote in a post on X.
In another post on X, PM Modi asked citizens to watch for signs of heat exhaustion like dizziness, nausea or extreme fatigue. “If someone around you feels unusually unwell, weak or develops a headache, it is best to help move them to a cool and shaded place immediately. Ensure they get water, ORS etc. that helps them,” he wrote.",1.0
"Severe Heatwave Grips Punjab, Chandigarh; Rain and Hail Likely From May 28 - Punjab Newsline",https://news.google.com/rss/articles/CBMirAFBVV95cUxORmhGeWNKYUlya1J3YjlpQjhQR09xR0EwUkt6c0dXMW9IOG9aWTFQRHFEVjEyX1h2VG52U0YwNkxJUUFUUnNhMHVCYjl3UDB6T3UySzU5eHJnQkExczRoMlYyYW9Ca3A5dS1Ga3BLVVNnRmg0eGJvU3pNUlltclJNd2hXWEkzeV9KTE1DVGw2Nk95bDhqNmNuemM5aWN0R1BvMGZTSjJWT2Q3c29T?oc=5,Punjab Newsline,2026-05-27T10:17:36+05:30,en,Chandigarh,Chandigarh,"""heatwave"" Chandigarh","Punjab Newsline | Chandigarh
Punjab and Chandigarh are reeling under intense heat as the Meteorological Centre in Chandigarh has issued a severe heatwave alert for Wednesday. However, weather conditions are expected to change from May 28 onward, bringing chances of rain and hailstorms across the region.
According to the weather department, Punjab witnessed completely dry weather during the last 24 hours. Bathinda recorded the highest temperature in the state at 45.8 degrees Celsius.
The department has also predicted that the southwest monsoon is likely to reach Punjab between June 28 and July 5, which is close to the state’s normal monsoon arrival date of June 30.
Meanwhile, a fresh western disturbance is expected to become active over Punjab from Thursday. Due to its impact, weather conditions are likely to remain unstable for four days, with rain and strong winds expected in several districts.
The weather is predicted to worsen particularly on Thursday and Friday, when thunderstorms with wind speeds of 60 to 70 kmph, along with hailstorms and rainfall, may occur in many areas.",1.0
"IMD forecasts heatwave conditions over Chandigarh, Delhi, Haryana, UP | Akashvani News - News On AIR",https://news.google.com/rss/articles/CBMihAFBVV95cUxOUlVvYTBPNjVFdEhtVDNuVTNDc3ItSWpqVzNIc0RvRmstZWpjek9hQnBQcTF4RElmVmwwSFluU01JVWpFbkI2VW5mdmVUbkRpaDg3dHhhaGVBbDJmbGN6TnRhQ2h6bHRGdXBnSTBTT3lpakl2ODQ1eHJaUHFzOU42QXlORmw?oc=5,News On AIR,2026-05-27T15:00:20+05:30,en,Chandigarh,Chandigarh,heatwave (Chandigarh) Chandigarh,"The India Meteorological Department (IMD) has forecast heatwave conditions over Chandigarh, Delhi, Haryana, East Rajasthan, Uttar Pradesh, Chhattisgarh, Jharkhand, Gangetic West Bengal, Punjab and Vidarbha for the next two days. The weather agency has predicted heavy to very heavy rainfall at isolated places over Arunachal Pradesh tomorrow. According to IMD, Coastal Andhra Pradesh, Gangetic West Bengal, Kerala, Mahe, Tamil Nadu, Puducherry and Karaikal will experience hot and humid weather conditions for the next two days.",0.6833333333333333
"भीषण गर्मी के कारण, स्वास्थ्य मंत्रालय लोगों को सुबह लगभग 10 बजे से शाम 4 बजे के बीच घर से बाहर निकलने को सीमित करने की सलाह देता है। - Vietnam.vn",https://news.google.com/rss/articles/CBMirgFBVV95cUxOYkRJZDBLRHB0QzZsTF9ISDZ1LWVWTi1zQ0RJVTEtemZTZWVqbVVHZlRWTmdVTXpjY1B1WGdfT2trOGpXbWFrOWlVM01jc0tsYnlLbVM4WlVxNWVuZEhHTVd6Ry1FZ0hWVmxLa2EtNDBVUkVUNDViVGo2bU1QeGVWSUR1S3ZrNXJBSkFxVmpCZXhfMWRLWlhJR0tHdFpTSlVjSXN5Q1ViVk1wVjIzRmc?oc=5,Vietnam.vn,2026-05-27T08:58:11+05:30,hi,Chandigarh,Chandigarh,"(लू OR ""लू चलना"" OR ""भीषण गर्मी"" OR ""प्रचंड गर्मी"" OR ""कड़ी धूप"" OR ""तेज धूप"" OR ""गर्म हवा"" OR ""उष्ण लहर"" OR ""ताप लहर"" OR ""हीट वेव"" OR ""झुलसाने वाली गर्मी"" OR ""तपती गर्मी"" OR ""भयंकर गर्मी"" OR ""गर्मी का कहर"" OR ""गर्मी का प्रकोप"" OR ""अत्यधिक गर्मी"" OR मौसम OR ""मौसम अपडेट"" OR ""मौसम का हाल"" OR ""मौसम पूर्वानुमान"" OR ""मौसम अलर्ट"" OR आईएमडी OR ""आईएमडी पूर्वानुमान"" OR ""आईएमडी अलर्ट"" OR ""तापमान में बढ़ोतरी"" OR ""गर्मी से राहत"" OR ""गर्मी से निजात"") Chandigarh","भीषण गर्मी के कारण, स्वास्थ्य मंत्रालय लोगों को सुबह लगभग 10 बजे से शाम 4 बजे के बीच घर से बाहर निकलने को सीमित करने की सलाह देता है।
स्वास्थ्य मंत्रालय के रोग निवारण विभाग ने हाल ही में प्रांतों और शहरों के स्वास्थ्य विभागों को लू, सूखे और खारे पानी के घुसपैठ के प्रभावों से सार्वजनिक स्वास्थ्य और श्रमिकों की रोकथाम और सुरक्षा के संबंध में एक दस्तावेज भेजा है।
Báo Đại biểu Nhân dân•27/05/2026
गर्म मौसम के दौरान ध्यान रखने योग्य स्वास्थ्य संबंधी समस्याएं।
राष्ट्रीय जल-मौसम विज्ञान पूर्वानुमान केंद्र के अनुसार, अल नीनो घटना के प्रभाव के कारण, 2026 की शुरुआत में ही गर्म और शुष्क परिस्थितियाँ दिखाई देने लगी हैं, गर्म दिनों की संख्या में वृद्धि हुई है, और बहु-वर्षीय औसत की तुलना में अधिक बार और तीव्र लू चलने की संभावना है।
वर्ष की शुरुआत से लेकर अप्रैल के मध्य तक देशभर में वर्षा में 10% से 40% तक की भारी कमी देखी गई; कई नदी घाटियों में जल प्रवाह और जलस्तर इसी अवधि के दौरान दर्ज किए गए सबसे निचले स्तर पर पहुंच गए। इसे सूखे के खतरे, दैनिक जीवन के लिए स्वच्छ जल की कमी और लोगों एवं श्रमिकों के स्वास्थ्य पर पड़ने वाले प्रभाव का प्रारंभिक चेतावनी संकेत माना जा रहा है।
गर्मी के मौसम में सार्वजनिक स्वास्थ्य की रक्षा करने और बीमारियों को रोकने के लिए, रोग निवारण विभाग ने हाल ही में समुदाय और श्रमिकों के लिए गर्मी के मौसम के दौरान स्वास्थ्य देखभाल के लिए दिशानिर्देश विकसित किए हैं।
गर्म मौसम में, लू लगना, गर्मी लगना या गर्मी से होने वाला स्ट्रोक जैसी कई आम स्वास्थ्य समस्याएं हो सकती हैं। इनके मुख्य कारण गर्म, उच्च तापमान वाले वातावरण में लंबे समय तक रहना या काम करना, या परिवेश के तापमान में अचानक परिवर्तन होना है।
कुछ उच्च जोखिम वाले समूहों में शामिल हैं: बुजुर्ग, छोटे बच्चे और गर्भवती महिलाएं; वे लोग जो लंबे समय तक धूप में या गर्म वातावरण में बाहर काम करते हैं या ज़ोरदार व्यायाम करते हैं: कृषि श्रमिक, ईंट भट्टों में काम करने वाले और लोहा एवं इस्पात कारखानों में काम करने वाले। साथ ही, पुरानी बीमारियों, उच्च रक्तचाप, क्रॉनिक ऑब्सट्रक्टिव पल्मोनरी डिजीज, अस्थमा और मधुमेह से पीड़ित लोग भी जोखिम में हैं।
रोग निवारण विभाग ने कहा कि गर्म मौसम के दौरान होने वाली आम स्वास्थ्य समस्याओं के लक्षण गर्मी के संपर्क में रहने की अवधि और शरीर के तापमान में वृद्धि की मात्रा पर निर्भर करते हैं।
हल्के लक्षणों में शामिल हैं: थकान, प्यास, चक्कर आना, सिर हल्का महसूस होना, हृदय गति बढ़ना, श्वसन दर बढ़ना, धड़कन तेज होना और मांसपेशियों में ऐंठन। गंभीर लक्षणों में शामिल हैं: तेज सिरदर्द, सांस लेने में लगातार बढ़ती तकलीफ, मतली या उल्टी, शरीर के एक हिस्से में कमजोरी या लकवा, दौरे पड़ना, बेहोशी या कोमा, हृदय संबंधी विफलता (तेज धड़कन, निम्न रक्तचाप आदि) और संभावित रूप से मृत्यु।
सनस्ट्रोक या हीटस्ट्रोक का इलाज कैसे करें
स्वास्थ्य मंत्रालय सलाह देता है कि गर्मी के कारण स्वास्थ्य समस्याओं का अनुभव होने पर, लक्षणों की गंभीरता के आधार पर, तुरंत उचित उपाय किए जाने चाहिए। पीड़ित को तुरंत ठंडी, हवादार जगह पर ले जाएं। पीड़ित के बाहरी कपड़ों को ढीला करें या उतार दें। फिर, पीड़ित के शरीर को ठंडे तौलिए से पोंछें या उस पर ठंडा पानी डालें और फिर सुखाएं। शरीर का तापमान तेजी से कम करने में मदद के लिए बगल, जांघों और गर्दन के किनारों जैसे क्षेत्रों पर ठंडे पानी या बर्फ में भीगे हुए तौलिए रखें।
यदि पीड़ित व्यक्ति पी सकता है, तो उसे थोड़ा-थोड़ा ठंडा पानी पिलाएँ। आदर्श रूप से, उसे नमक और खनिजों से युक्त पानी पिलाएँ, जैसे कि निर्देशों के अनुसार तैयार किया गया ओरेसोल घोल। यदि पीड़ित व्यक्ति को मांसपेशियों में ऐंठन हो, तो प्रभावित मांसपेशी क्षेत्र की धीरे-धीरे मालिश करें।
विशेष रूप से, पीड़ित के आसपास बहुत अधिक लोगों को इकट्ठा न होने दें। लगभग 10-15 मिनट के बाद, लक्षण धीरे-धीरे कम हो जाएंगे।
यदि पीड़ित में गंभीर लक्षण दिखाई दें, तो तुरंत आपातकालीन सेवाओं (115) को कॉल करें या पीड़ित को शीघ्रता से निकटतम चिकित्सा केंद्र ले जाएं। परिवहन के दौरान पीड़ित को बार-बार ठंडी सिकाई करना न भूलें।
रोग निवारण विभाग लोगों को सलाह देता है कि वे गर्म दिनों में, विशेषकर सुबह 10 बजे से शाम 4 बजे के बीच, धूप में बाहर कम निकलें। कम तापमान वाले वातानुकूलित कमरों में रहने वालों को अचानक धूप में नहीं निकलना चाहिए; उन्हें अपने शरीर को बाहरी वातावरण के अनुकूल होने के लिए समय देना चाहिए। इसके लिए वे वातानुकूलन का तापमान बढ़ा सकते हैं या बाहर जाने से पहले छाया में आराम कर सकते हैं।
गर्म मौसम में हल्के रंग के, हवादार और पसीना सोखने वाले कपड़े पहनें; हरी सब्जियों और फलों का सेवन बढ़ाएं और अपने दैनिक भोजन में सूप को शामिल करें। प्रतिदिन कम से कम 1.5-2 लीटर पानी पीना विशेष रूप से महत्वपूर्ण है। दिन भर में थोड़ी-थोड़ी मात्रा में पानी पिएं, एक बार में अधिक मात्रा में पीने से बचें।
इसके अलावा, शारीरिक व्यायाम से गर्म मौसम की स्थितियों के प्रति प्रतिरोधक क्षमता और सहनशीलता बढ़ाने में मदद मिलती है। बाहर काम करते समय, शरीर, विशेषकर गर्दन और कंधों को धूप से बचाएं।
जिन लोगों को गर्म मौसम में काम करना पड़ता है, उनके लिए रोग निवारण विभाग ठंडे समय में काम करने की सलाह देता है, जैसे कि सुबह जल्दी या देर दोपहर। उच्च तापमान वाले वातावरण में काम करने का समय सीमित करें। यदि ऐसे वातावरण में काम करना अपरिहार्य हो, तो लंबे समय तक तीव्र गर्मी और ज़ोरदार शारीरिक गतिविधि से बचें।
हर 45 मिनट से 1 घंटे के काम के बाद ठंडी, हवादार जगह पर 15-20 मिनट का नियमित ब्रेक लेने की सलाह दी जाती है। धूप से बचें, खासकर गर्दन और कंधों को। धूप में बाहर काम करते समय उचित व्यक्तिगत सुरक्षा उपकरण जैसे सुरक्षात्मक कपड़े, टोपी और धूप का चश्मा पहनें। ढीले, हवादार और पसीना सोखने वाले कपड़े पहनें। सनस्क्रीन का भी इस्तेमाल किया जा सकता है।
यह ध्यान रखना महत्वपूर्ण है कि गर्म मौसम में शराब का सेवन न करें और पूरे दिन नियमित रूप से पानी पीते रहें। काम के दौरान पसीना बहाने वालों के लिए ओरेसोल जैसे नमक और खनिज पदार्थों की पूर्ति करने वाले तरल पदार्थ पीना विशेष रूप से महत्वपूर्ण है। पानी पीते समय निर्माता के निर्देशों का पालन करें।
साथ ही, कार्यस्थल को ठंडा रखने के लिए शामियाना, ऊष्मा-परावर्तक पैनल, इन्सुलेशन सामग्री, स्प्रिंकलर सिस्टम, मिस्टिंग सिस्टम, एयर कंडीशनिंग सिस्टम लगाना और उपयुक्त वेंटिलेशन पंखे जैसे उपाय लागू करें।",1.0
