title,url,source,date,language,state,district,search_term,full_text,relevance_score
"चंडीगढ़ में प्रचंड गर्मी में पार्किंग स्लिप काट रही महिलाएं, बोलीं-""तपती धूप में आने लगते हैं चक्कर, लेकिन ड्यूटी करना मजबूरी"" - ETV Bharat",https://news.google.com/rss/articles/CBMi9wFBVV95cUxOUm8wOVN4Y05iSC1JcDR5UTJWN3NEbkxzMWZ6WGUteE5ZTXlDbHk2cmY0UlotbXJMM0xYTFR2NHlZQ25kUmxTSmpHaHhVNUdrM0ZIcmFDVFF1Q1RNakFXaVpGWjBMbUZaSlhQalZ1WnQwekYxNGtVLUJ5bkY5bWlTUzk2QVNXSHp1b1NTRGZpbWRtQ1d6SGpmbUdHTDIxVHlqMGltaWQyUmZWVVlUUWhUM0ZaSlh4eVV5bmJRSE9wX1p2X3BscjJiX1paRWZ2bGtCMlRtZ1VOTWl0RlFkRkZmVnRmei1odnU5UXM0YS11WW5aWFBlN0Fz0gH3AUFVX3lxTE5SbzA5U3hjTmJILUlwNHlRMlY3c0RuTHMxZnpYZS14TllNeUNseTZyZjRSWi1tckwzTFhMVHY0eVlDbmRSbFNKakdoeFU1R2szRkhyYUNUUXVDVE1qQVdpWkZaMExtRlpKWFBqVnVadDB6RjE0a1UtQnluRjltaVNTOTZBU1dIenVvU1NEZmltZG1DV3pIamZtR0dMMjFUeWowaW1pZDJSZlZVWVRRaFQzRlpKWHh5VXluYlFIT3BfWnZfcGxyMmJfWlpFZnZsa0IyVG1nVU5NaXRGUWRGRmZWdGZ6LWh2dTlRczRhLXVZblpYUGU3QXM?oc=5,ETV Bharat,2026-05-27T11:51:18+05:30,hi,Chandigarh,Chandigarh,लू (Chandigarh) Chandigarh,"चंडीगढ़: चंडीगढ़ में लगातार बढ़ रही गर्मी अब लोगों के लिए बड़ी चुनौती बनती जा रही है. दोपहर के समय तापमान 43 से 44 डिग्री सेल्सियस तक पहुंच रहा है और सड़कें आग उगलती दिखाई दे रही हैं. इस भीषण गर्मी का सबसे ज्यादा असर उन लोगों पर पड़ रहा है जो खुले आसमान के नीचे घंटों काम करने को मजबूर हैं. खासकर पार्किंग स्थलों पर स्लिप काटने और वाहनों की व्यवस्था संभालने वाली महिलाएं.. ये हर दिन कठिन परिस्थितियों में ड्यूटी कर रही हैं.
धूप में घंटों खड़े रहना मजबूरी: शहर के कई बाजारों और पार्किंग स्थलों पर महिलाएं सिर पर दुपट्टा बांधकर और हाथ में पानी की बोतल लेकर काम करती नजर आ रही हैं. सुबह से लेकर शाम तक तेज धूप और गर्म हवाओं के बीच उनका काम लगातार जारी रहता है. कई जगहों पर उनके लिए छांव की पर्याप्त व्यवस्था तक नहीं है. इसके बावजूद परिवार की जिम्मेदारियों के कारण उन्हें हर हाल में काम पर आना पड़ता है.
""धूप इतनी तेज कि आने लगते हैं चक्कर"": सेक्टर-17 की एक पार्किंग में काम कर रही महिला कर्मचारी ने ईटीवी भारत से अपनी परेशानी बताते हुए कहा कि, ""दोपहर के समय हालात सबसे ज्यादा मुश्किल हो जाते हैं. धूप इतनी तेज होती है कि कई बार चक्कर जैसा महसूस होने लगता है, लेकिन मजबूरी में काम करना पड़ता है. अगर कुछ देर छांव में बैठ जाएं तो काम रुक जाता है. लगातार धूप में रहने से शरीर कमजोर पड़ने लगता है. ऐसे में काम करना और मुश्किल हो जाता है.""
स्वास्थ्य पर पड़ रहा गंभीर असर: डॉक्टरों के मुताबिक लंबे समय तक तेज धूप में रहने से डिहाइड्रेशन, हीट स्ट्रोक, सिर दर्द और कमजोरी जैसी समस्याएं हो सकती हैं. स्वास्थ्य विशेषज्ञ बाहर काम करने वाले लोगों को लगातार पानी पीने, सिर ढककर रखने और धूप से बचाव करने की सलाह दे रहे हैं. हालांकि कई महिलाओं का कहना है कि काम के दौरान उन्हें पर्याप्त आराम या ठंडे पानी जैसी सुविधाएं तक नहीं मिल पातीं.
""पानी भी हो जाता है गर्म"": एक अन्य महिला कर्मचारी ने कहा कि, ""लगातार धूप में रहने की वजह से सिर दर्द, कमजोरी और थकान बढ़ जाती है. कई बार पानी भी गर्म हो जाता है और आसपास छांव की सुविधा भी नहीं मिलती. घर की जिम्मेदारियों और बच्चों की पढ़ाई के कारण यह काम करना पड़ता है. मौसम चाहे कितना भी खराब क्यों न हो, नौकरी छोड़ना हमारे लिए आसान नहीं है.""
कम वेतन में परिवार चलाना चुनौती: इसके अलावा सेक्टर-17 के एक शोरूम में सफाई का काम करने वाली बिमला ने ईटीवी भारत से कहा कि, ""मैं पिछले 20 सालों से सफाई कर्मचारी के तौर पर काम कर रही हूं. इतने सालों से काम करने के बावजूद मुझे सिर्फ 4000 रुपये मिलते हैं. परिवार का पूरा खर्च मैं ही चलाती हूं, क्योंकि मेरे पति लंबे समय से बेरोजगार हैं. नौकरी दिलाने के नाम पर कई जगह लाखों रुपये मांगे जाते हैं, जिसके कारण गरीब परिवारों के लिए रोजगार पाना और भी कठिन हो जाता है. अगर मैं काम पर नहीं आऊंगी तो मेरा परिवार भूखा मर जाएगा. आज के समय में नौकरी मिलना बहुत मुश्किल है. इसलिए धूप में मिलने वाला कोई भी काम हमें करना पड़ता है. परिवार की जिम्मेदारियां हमें हर परिस्थिति में काम करने के लिए मजबूर करती हैं.""
सुविधाओं के नाम पर सिर्फ प्लास्टिक का शेड:इसके अलावा सेक्टर-17 की पार्किंग में काम करने वाली सुनीता ने ईटीवी भारत से कहा कि, ""पार्किंग कर्मचारियों के लिए मूलभूत सुविधाओं का भी अभाव है. हमें सिर्फ एक प्लास्टिक का शेड दिया गया है, जो इस गर्मी में किसी काम का नहीं है. पानी पीने के लिए भी कई बार दूसरों पर निर्भर रहना पड़ता है. तेज धूप और बारिश दोनों में लगातार खड़े रहना उनकी सेहत पर असर डाल रहा है. अगर किसी ग्राहक से बहस हो जाए तो कोई हमारा साथ नहीं देता. पूरा दिन धूप में खड़े रहने के अलावा कई बार हमें गाड़ियों को धक्का लगाकर जगह बनानी पड़ती है. धूप से बचने के लिए महिलाएं कई तरह के जुगाड़ करती हैं, लेकिन भीषण गर्मी के सामने वे उपाय भी बेअसर साबित हो रहे हैं.""
कर्मचारियों की सुरक्षा पर उठ रहे सवाल:चंडीगढ़ शहर में लगातार बढ़ती गर्मी के बीच अब यह सवाल उठने लगा है कि खुले में काम करने वाले कर्मचारियों के लिए बेहतर सुविधाएं और सुरक्षा उपाय कितने जरूरी हैं. सामाजिक संगठनों और स्थानीय लोगों का मानना है कि पार्किंग और सफाई कर्मचारियों के लिए छांव, ठंडे पानी, आराम और स्वास्थ्य सुविधाओं की उचित व्यवस्था की जानी चाहिए ताकि भीषण गर्मी में उनकी परेशानियां कुछ कम हो सकें.",1.0
"आ गया बारिश का अलर्ट; चंडीगढ़-पंजाब और हरियाणा में लोगों को भीषण गर्मी से मिलेगी राहत, तेज हवा के साथ ओले भी गिर सकते - Arth Parkash",https://news.google.com/rss/articles/CBMinwFBVV95cUxPUVl1R1Q2clRPTWhnYlp3eXltMVB2QkJMS0o4MFFZa21SOVA5RE1pS3hWSGs5a3Fmbmp4eXlqSy1IN0VqMHBCclc5T1hPUC1VRkc0OGkzdXNYaFFYTVhWTW1lY0lLV3RBMGlpS3N0bjFZdHlGVGhDMVJLWlJpT3hSc2ZtZG0zdkhzSU1SRzNBVjRkNGtlQ3dfQTNQOXJPelE?oc=5,Arth Parkash,2026-05-27T03:17:00+05:30,hi,Chandigarh,Chandigarh,लू (Chandigarh) Chandigarh,"आ गया बारिश का अलर्ट; चंडीगढ़-पंजाब और हरियाणा में लोगों को भीषण गर्मी से मिलेगी राहत, तेज हवा के साथ ओले भी गिर सकते
IMD Rain Alert in Chandigarh Punjab Haryana Relief From Excessive Heat
IMD Weather Update: उत्तर भारत में भीषण गर्मी और गर्म लू के थपेड़ों ने लोगों को त्रस्त कर रखा है। वहीं 25 मई से नौतपा शुरू होते ही गर्मी का पारा और चढ़ गया है। इस बीच पंजाब, हरियाणा और चंडीगढ के लोगों के लिए मौसम विभाग ने एक राहत भरी खबर दी है। मौसम विभाग की मानें तो 29 मई से तापमान में गिरावट आ सकती है और लोगों को गर्मी से राहत मिलने की उम्मीद है। दरअसल मौसम विभाग ने मौसम के करवट लेने और तेज हवा के साथ बारिश होने की जानकारी दी है। बारिश के साथ ओले गिरने का भी अलर्ट जारी किया गया है।
2 दिन सीवियर हीटवेव का अलर्ट
मौसम विभाग ने बताया कि 27 और 28 मई के दौरान पंजाब, हरियाणा और चंडीगढ़ में हीट वेव से लेकर बहुत ज़्यादा हीट वेव की स्थिति बनी रहेगी। यानि सीवियर हीटवेव (भीषण लू) का अलर्ट जारी किया गया है। वहीं 28 मई रात से मौसम में बदलाव की संभावना है और 28 से 31 मई के दौरान पंजाब, हरियाणा और चंडीगढ़ में गरज-चमक के साथ बारिश होगी। इस दौरान 60 से 70 किलोमीटर प्रति घंटे की रफ्तार से तेज हवा चलेगी। साथ ही कई जगहों पर ओले भी गिर सकते हैं।
42 डिग्री तापमान में तप रहा चंडीगढ़
पंजाब, हरियाणा, चंडीगढ़ समेत उत्तर भारत के अलग-अलग हिस्सों में पिछले करीब 10 दिनों से तापमान में बढ़ोतरी देखी जा रही है। कहीं-कहीं तापमान 45 डिग्री को भी पार कर गया है। वहीं चंडीगढ़ इस समय 42 डिग्री तापमान में तप रहा है। भयंकर तेज धूप के साथ गर्म सूखी हवाओं के थपेड़ों ने लोगों को बेहाल कर दिया है। चंडीगढ़ स्वास्थ्य विभाग ने 19 मई को हेल्थ एडवाइजरी भी जारी की थी। जिसमें लोगों को दोपहर 12 बजे से 3 बजे के बीच सीधे धूप के संपर्क में आने से सावधान रहने को कहा गया था क्योंकि वह गर्मी और लू से हीट स्ट्रोक का शिकार हो सकते हैं। साथ ही लोगों को यह भी बताया गया कि उन्हें किस तरह का खाना-पीना लेना है।
चंडीगढ़ में मानसून कब आएगा?
चंडीगढ़ में जून के लास्ट सप्ताह में मानसून के आगमन के साथ बारिश शुरू होने की संभावना है। हालांकि इससे पहले, जून के तीसरे सप्ताह तक प्री-मानसून बौछारें पड़ने की उम्मीद है। शुरुआती जून और बीच में गर्मी और उमस के साथ छुटपुट गरज के साथ बारिश के छींटे पड़ सकते हैं। बता दें कि केवल पंजाब, हरियाणा, चंडीगढ़ ही भीषण गर्मी में नहीं जल रहा बल्कि इसी तरह उत्तर प्रदेश, दिल्ली, बिहार, राजस्थान, मध्य प्रदेश समेत देश के अन्य राज्यों में भी लोग गर्मी से त्राहि-त्राहि बोल रहे हैं। यूपी के कई हिस्सों में तो पारा 45 डिग्री को पार कर गया है। यहाँ बांदा में तापमान 47.6 डिग्री तक पहुंच गया है। वहीं राजधानी दिल्ली भी गर्मी में उबल रही है।",1.0
Today New Chandigarh Weather Report: भीषण गर्मी में होगी छक्कों की बारिश! कैसा रहेगा न्यू चंडीगढ़ के मौसम का ह - Times Now Navbharat,https://news.google.com/rss/articles/CBMi6wFBVV95cUxNWE5iR2YyODJtQWJyOE1HMVpveGdGMnN3bnE0Ul9ZRXZZMjh3YWZZXzFvRjJWUGZzTHhGVmlablMtcHlxWkJyUW5ieWIzbDhiR0czcjVmZDBMQ0xaVkVKSUw1SEJTNEhLNE1reEQxQVliX3hZSWNsTnFVZkNIWnh4NUNLZ2F2d1RZUE80SzRrWmRDeFFvTDdaNnU0M01qVGVOR25IazFyWXNESmJfLUhacjFtT200YU5Wb254WUlvRzUybmIycUJ4Y2duNXBJWmw0WHp3OXpRZ0QzMjlRdjBJT1picHRtbDh2SlJV0gHwAUFVX3lxTFAwLU5UUGt3bTdlcWNkZWZPZ0ExQVdZdS1pSThlaW1kb0ppQ0gyREc4Z3BtM2lxRG9CeWRkdU5PMDhzZmFaN3JiZVU1WFRTdHFaY2xtaHl0MC1tLVRYeElGVWsxZ3RFbHJEdlNJQWRlN1FzQVg1Wnc0WFBDWlBDTUtDTjViQVpnclZzT0k5bG5PS19sOGJLcGRreEVrZFVEWE5haHEyWFVYX2hrZDZ5R19SakJ4NDdibzJJOEM3TlBhV3JPYWFsbTNFeGFNVmVvVEszMmJnUDFVdHlCbkVkVFl6OFgybEc5dmtMUVJEN01YeQ?oc=5,Times Now Navbharat,2026-05-27T07:01:36+05:30,hi,Chandigarh,Chandigarh,लू (Chandigarh) Chandigarh,"New Chandigarh Weather Report: आईपीएल 2026 का एलिमिनेटर मुकाबला बुधवार (27 मई) को राजस्थान रॉयल्स (RR) और सनराइजर्स हैदराबाद (SRH) के बीच न्यू चंडीगढ़ में खेला जाएगा। हैदराबाद की टीम ने अंक तालिका में तीसरे स्थान पर समाप्त किया था और राजस्थान की टीम ने चौथे स्थान के साथ प्लेऑफ में जगह बनाई थी। अब इन दोनों टीमों के बीच एलिमिनेटर मुकाबला होगा। जीतने वाली टीम को पहले क्वालीफाय-1 में हारने वाली टीम से एक बार फिर भिड़ना होगा। वहीं जो भी टीम इस मैच को हारेगी, उसके लिए टूर्नामेंट यहीं पर समाप्त हो जाएगा।
इस मैच में छक्कों की बरसात देखने को मिल सकती है, क्योंकि दोनों ही टीमों के पास ऐसे बल्लेबाज मौजूद हैं जो लंबे-लंबे छक्के लगाने में माहिर हैं। हैदराबाद के पास अभिषेक शर्मा, ट्रेविस हेड, ईशान किशन और हेनरिक क्लासेन हैं। अभिषेक ने इस सीजन अभी तक 43 छक्के लगाए हैं, जिसमें से उनके 29 छक्के पावरप्ले में आए हैं। जबकि हेड ने इस सीजन 22 छक्के लगाए हैं। वहीं, किशन भी कुल 29 छक्के लगा चुके हैं। हेनरिक क्लासेन भी 30 छक्के अभी तक लगा चुके हैं। कुल मिलाकर हैदराबाद के चारों ही बल्लेबाज लंबे-लंबे छक्के लगाने में माहिर हैं।
छक्कों की हो सकती है बारिश
वहीं, राजस्थान के पास वैभव सूर्यवंशी हैं जो अकेले इन बल्लेबाजों पर भारी पड़ सकते हैं। वो अभी तक कुल मिलाकर 77 छक्के आईपीएल में लगा चुके हैं, जिनमें से 53 छक्के उनके इस सीजन आए हैं। सूर्यवंशी हर पांचवीं गेंद पर छ्क्का लगाते हैं। उन्होंने पावरप्ले में अभी तक 35 छक्के लगाए हैं। इससे साफ पता चलता है कि अगर सूर्यवंशी चले तो फिर वो अकेले ही छक्के लगाने के मामले में बाकी बल्लेबाजों से आगे निकल सकते हैं। यशस्वी जायसवाल भी कम नहीं हैं। वह अभी तक 18 छक्के लगा चुके हैं।
हैदराबाद बनाम राजस्थान न्यू चंडीगढ़ के मौसम का हाल (SRH vs RR Today New Chandigarh Weather Report)
हैदराबाद और राजस्थान के बीच का एलिमिनेटर मुकाबला न्यू चंडीगढ़ के मुल्लांपुर में खेला जाएगा। न्यू चंडीगढ़ में इन दिनों भीषण गर्मी पड़ रही है। नौतपा को देखते हुए येलो अलर्ट जारी किया गया है। आज भी न्यू चंडीगढ़ में भीषण गर्मी पड़ सकती है। एक्यूवेदर के अनुसार, दिन में 45 डिग्री तक तापमान रह सकता है। हालांकि, शाम होते ही तापमान में गिरवाट आ सकती है। रात में तापमान 27 डिग्री तक रह सकता है। मैच के दौरान बारिश की कोई संभावना नहीं है। फैंस को पूरे मैच का आनंद मिलेगा।
क्रिकेट की ताजा ख़बरें (Cricket News in Hindi )पढ़ें हिंदी में और देखें छोटी बड़ी सभी न्यूज़ Times Now Navbharat Sports पर. और आईपीएल 2026 अंक तालिका, ऑरेंज कैप और पर्पल कैप की ताजा समाचार के लिए जुड़े रहे Times Now Navbharat से।",1.0
