title,url,source,date,language,state,district,search_term,full_text,relevance_score
भीषण गर्मी जारी है; चरम समय के दौरान बाहर निकलने से बचने की सलाह दी जाती है। - Vietnam.vn,https://news.google.com/rss/articles/CBMiqgFBVV95cUxPLVFtb2FKcktrb3Y5NUQxbjhvclk1YU84THlqNUJXN2RPWUpZWGt1YjBpUVpzMk9UNEVQeU9CWlg5TTJlSGNjdk5hQzBpbnJZMXc2TXA3MTBnQXdSQjluTi1vcWJpOU1keVYzS2NnWHZXN3dnZUxjUFhfSlVmLXI1Q25PRVFjeDJDQzBuYWtpcjZqb1pDeFBnNVQ2bU13elgzREJFZUZTeF9RZw?oc=5,Vietnam.vn,2026-05-27T05:12:11+05:30,hi,Chandigarh,Chandigarh,"(लू OR ""लू चलना"" OR ""भीषण गर्मी"" OR ""प्रचंड गर्मी"" OR ""कड़ी धूप"" OR ""तेज धूप"" OR ""गर्म हवा"" OR ""उष्ण लहर"" OR ""ताप लहर"" OR ""हीट वेव"" OR ""झुलसाने वाली गर्मी"" OR ""तपती गर्मी"" OR ""भयंकर गर्मी"" OR ""गर्मी का कहर"" OR ""गर्मी का प्रकोप"" OR ""अत्यधिक गर्मी"" OR मौसम OR ""मौसम अपडेट"" OR ""मौसम का हाल"" OR ""मौसम पूर्वानुमान"" OR ""मौसम अलर्ट"" OR आईएमडी OR ""आईएमडी पूर्वानुमान"" OR ""आईएमडी अलर्ट"" OR ""तापमान में बढ़ोतरी"" OR ""गर्मी से राहत"" OR ""गर्मी से निजात"") Chandigarh","भीषण गर्मी जारी है; चरम समय के दौरान बाहर निकलने से बचने की सलाह दी जाती है।
एसकेडीएस - 27 मई को भीषण गर्मी (38-40 डिग्री सेल्सियस) जारी रहेगी, और 28 मई से तापमान में धीरे-धीरे कमी आने लगेगी। मौसम विभाग ने लोगों को सुबह 9 बजे से शाम 5 बजे के बीच घर से बाहर न निकलने और आग से बचाव के उपाय करने की सलाह दी है।
Báo Sức khỏe Đời sống•26/05/2026
राष्ट्रीय मौसम विज्ञान और जल विज्ञान पूर्वानुमान केंद्र के अनुसार, कल (26 मई) उत्तरी क्षेत्र और थान्ह होआ से दा नांग शहर तक के क्षेत्र, क्वांग न्गाई से डाक लक और खान्ह होआ प्रांतों के पूर्वी हिस्सों में भीषण और असाधारण रूप से भीषण गर्मी पड़ी, जहां दैनिक अधिकतम तापमान आमतौर पर 38-40 डिग्री सेल्सियस के बीच रहा, और कुछ स्थानों पर 40 डिग्री सेल्सियस से भी अधिक हो गया, जैसे: फो रंग (लाओ काई) 40.7 डिग्री, बाक मे (तुयेन क्वांग) 40.3 डिग्री, विन्ह येन (फू थो) 40.5 डिग्री, लैंग ( हनोई ) 41.1 डिग्री, होई ज़ुआन (थान्ह होआ) 40.8 डिग्री, डो लुओंग (न्घे आन) 41.1 डिग्री, डोंग होई (क्वांग त्रि) 40.2 डिग्री, तुय होआ (डाक लक) 40.0 डिग्री… न्यूनतम सापेक्ष आर्द्रता आमतौर पर 45-50% थी।
27 मई को उत्तरी डेल्टा क्षेत्र, फु थो प्रांत और थान्ह होआ से ह्यू शहर तक के क्षेत्र में भीषण और असाधारण रूप से भीषण गर्मी पड़ी, जिसमें अधिकतम तापमान आमतौर पर 38-40 डिग्री सेल्सियस के बीच रहा और कुछ स्थानों पर 40 डिग्री सेल्सियस से भी अधिक हो गया; न्यूनतम सापेक्ष आर्द्रता आमतौर पर 40-45% के बीच थी।
उत्तरी वियतनाम और दक्षिण मध्य तटीय क्षेत्र के अन्य इलाकों में भीषण गर्मी पड़ रही है, कुछ स्थानों पर असाधारण रूप से भीषण गर्मी पड़ रही है, जहां अधिकतम तापमान आमतौर पर 37-39 डिग्री सेल्सियस के बीच रहता है, और कुछ स्थानों पर 40 डिग्री सेल्सियस से भी अधिक हो जाता है; न्यूनतम सापेक्ष आर्द्रता आमतौर पर 45-50% के बीच रहती है।
28 मई को, थान्ह होआ से ह्यू शहर तक के क्षेत्र में भीषण गर्मी पड़ी, कुछ स्थानों पर तो असाधारण रूप से भीषण गर्मी रही। अधिकतम तापमान आमतौर पर 37-39 डिग्री सेल्सियस रहा, कुछ क्षेत्रों में यह 39 डिग्री सेल्सियस से भी अधिक था; न्यूनतम सापेक्ष आर्द्रता आमतौर पर 45-50% थी।
उत्तरी वियतनाम के मध्य और निचले इलाकों तथा दक्षिण मध्य तटीय क्षेत्र में गर्म मौसम रहेगा, कुछ क्षेत्रों में भीषण गर्मी पड़ेगी। अधिकतम तापमान आमतौर पर 35-37 डिग्री सेल्सियस के बीच रहेगा, कुछ स्थानों पर यह 37 डिग्री सेल्सियस से अधिक भी हो सकता है; न्यूनतम सापेक्ष आर्द्रता आमतौर पर 50-55% के बीच रहेगी। 29 मई से उत्तरी वियतनाम में व्यापक लू समाप्त हो जाएगी, जबकि मध्य वियतनाम में लू धीरे-धीरे कम हो जाएगी। प्राकृतिक आपदा जोखिम स्तर: स्तर 1।
27 मई की रात और 28 मई के दिन उत्तरी क्षेत्र के लिए पूर्वानुमान है कि छिटपुट बारिश और गरज के साथ बौछारें पड़ेंगी, कुछ क्षेत्रों में भारी बारिश होगी (बारिश दोपहर और रात के बाद केंद्रित रहेगी)। मध्य और निचले इलाकों में दिन के दौरान गर्म मौसम रहेगा, कुछ स्थानों पर भीषण गर्मी पड़ेगी।
मध्य वियतनाम में 27 मई की रात और 28 मई के दिन छिटपुट बारिश और गरज के साथ तूफान आने की संभावना है; दिन में धूप खिली रहेगी और गर्मी रहेगी, हालांकि कुछ इलाकों में भीषण गर्मी पड़ सकती है, खासकर थान्ह होआ से ह्यू शहर तक के क्षेत्र में। दक्षिण मध्य तटीय क्षेत्र के दक्षिणी भाग में, 28 मई की दोपहर और शाम को छिटपुट बारिश और गरज के साथ तूफान आने की आशंका है। मध्य उच्चभूमि और दक्षिणी वियतनाम में दोपहर और शाम को छिटपुट बारिश और गरज के साथ तूफान आने की संभावना है; 28 मई से आगे, दोपहर और शाम को बारिश और छिटपुट गरज के साथ तूफान आने की आशंका है, साथ ही कुछ क्षेत्रों में भारी बारिश भी हो सकती है। तूफान के दौरान बवंडर, बिजली गिरने, ओले पड़ने और तेज हवा के झोंके आने की भी संभावना है।
उत्तरी वियतनाम में, 28 से 30 मई की रात तक, छिटपुट बारिश और गरज के साथ बौछारें पड़ेंगी, कुछ क्षेत्रों में भारी बारिश भी हो सकती है; लगभग 1 मई से, मध्य और निचले इलाकों में व्यापक लू चलने की संभावना है।
29 से 31 मई तक, थान्ह होआ से ह्यू शहर तक और दक्षिण मध्य तटीय क्षेत्र में स्थानीय लू चलने की संभावना है; 1 जून से, थान्ह होआ से ह्यू शहर तक के क्षेत्र में व्यापक लू चलने की संभावना है; दक्षिण मध्य तटीय क्षेत्र में देर दोपहर और शाम को छिटपुट बारिश और गरज के साथ तूफान आने की उम्मीद है।
मध्य उच्चभूमि और दक्षिणी वियतनाम: दोपहर और शाम के दौरान हल्की बारिश और छिटपुट गरज के साथ बौछारें पड़ने की संभावना है, कुछ क्षेत्रों में भारी बारिश भी हो सकती है। गरज के साथ बौछारों के दौरान बवंडर, बिजली गिरने, ओले पड़ने और तेज हवा के झोंके चलने की भी संभावना है।
27 मई को देशभर के सभी क्षेत्रों के लिए मौसम का पूर्वानुमान:
हनोई शहर
न्यूनतम तापमान 28-30 डिग्री सेल्सियस, अधिकतम तापमान 39-40 डिग्री सेल्सियस रहेगा, कुछ क्षेत्रों में यह 40 डिग्री सेल्सियस से भी अधिक हो सकता है। आसमान में बादल छाए रहेंगे, दिन में असाधारण रूप से गर्मी और धूप रहेगी, दोपहर और शाम के बाद छिटपुट बारिश और गरज के साथ तूफान आने की संभावना है। तूफान के दौरान बवंडर, बिजली, ओले और तेज हवा के झोंके चलने की आशंका है। हवा दक्षिण-पश्चिम से दक्षिण की ओर 2-3 की तीव्रता से चलेगी।
उत्तर-पश्चिमी वियतनाम
न्यूनतम तापमान 24-27 डिग्री सेल्सियस, कुछ स्थानों पर 23 डिग्री से नीचे; अधिकतम तापमान 37-39 डिग्री सेल्सियस, कुछ स्थानों पर 40 डिग्री से ऊपर। दिन में बादल छाए रहेंगे और भीषण गर्मी पड़ेगी, कुछ क्षेत्रों में असाधारण रूप से गर्मी होगी, शाम और रात में भी बादल छाए रहेंगे और छिटपुट बारिश और गरज के साथ बौछारें पड़ेंगी, कुछ स्थानों पर भारी बारिश भी हो सकती है। हवा हल्की रहेगी। गरज के साथ बौछारों के दौरान बवंडर, बिजली, ओले और तेज हवा के झोंके आने की संभावना है।
पूर्वोत्तर वियतनाम
न्यूनतम तापमान 26-29 डिग्री सेल्सियस, अधिकतम तापमान 37-40 डिग्री सेल्सियस रहेगा, कुछ क्षेत्रों में तापमान 40 डिग्री सेल्सियस से भी अधिक हो सकता है। आसमान में बादल छाए रहेंगे, दिन बेहद गर्म रहेंगे, कुछ क्षेत्रों में असाधारण रूप से गर्मी रहेगी; विशेष रूप से मैदानी इलाकों और फु थो प्रांत में, भीषण गर्मी और असाधारण रूप से गर्मी रहेगी; शाम और रात में छिटपुट बौछारें और गरज के साथ बारिश होगी, कुछ स्थानों पर भारी बारिश भी हो सकती है। हवाएं दक्षिण-पश्चिम से दक्षिण की ओर 2-3 ब्यूफोर्ट स्केल पर चलेंगी। गरज के साथ बारिश के दौरान बवंडर, बिजली, ओले और तेज हवा के झोंके आने की संभावना है।
थान्ह होआ से ह्यू
न्यूनतम तापमान 28-31 डिग्री सेल्सियस और अधिकतम तापमान 38-40 डिग्री सेल्सियस रहेगा, कुछ क्षेत्रों में यह 40 डिग्री सेल्सियस से भी अधिक हो सकता है। आसमान में बादल कम रहेंगे, दिन बेहद गर्म और धूप से भरे रहेंगे, और शाम और रात में छिटपुट बारिश और गरज के साथ तूफान आने की संभावना है। दक्षिण-पश्चिम दिशा से 2-3 तीव्रता की हवाएं चलेंगी। गरज के साथ तूफान के दौरान बवंडर, बिजली, ओले और तेज हवा के झोंके आने की संभावना है।
दक्षिण मध्य तट
न्यूनतम तापमान 25-28 डिग्री सेल्सियस और अधिकतम तापमान 36-39 डिग्री सेल्सियस रहेगा, कुछ क्षेत्रों में यह 39 डिग्री सेल्सियस से भी अधिक हो सकता है। आसमान में बादल छाए रहेंगे, दिन भर तेज धूप रहेगी, कुछ क्षेत्रों में असाधारण गर्मी होगी और शाम व रात में छिटपुट बारिश और गरज के साथ तूफान आ सकता है। दक्षिण-पश्चिम से दक्षिण की ओर 2-3 की गति से हवाएं चलेंगी। गरज के साथ तूफान के दौरान बवंडर, बिजली, ओले और तेज हवा के झोंके आने की संभावना है।
मध्य उच्चभूमि
न्यूनतम तापमान 20-23 डिग्री सेल्सियस, अधिकतम तापमान 31-34 डिग्री सेल्सियस। दिन में बादल छाए रहेंगे, धूप निकलेगी, दोपहर और शाम को छिटपुट बारिश और गरज के साथ बौछारें पड़ेंगी, रात में कुछ क्षेत्रों में बारिश और गरज के साथ बौछारें पड़ेंगी। दक्षिण-पश्चिम दिशा से 2-3 तीव्रता की हवा चलेगी। गरज के साथ बौछारों के दौरान बवंडर, बिजली, ओले और तेज हवा के झोंके आने की संभावना है।
दक्षिणी वियतनाम
न्यूनतम तापमान 25-28 डिग्री, अधिकतम तापमान 32-35 डिग्री रहेगा। दोपहर और शाम को बादल छाए रहेंगे, छिटपुट बारिश और गरज के साथ बौछारें पड़ेंगी, कुछ क्षेत्रों में भारी बारिश हो सकती है। दक्षिण-पश्चिम दिशा से 2-3 तीव्रता की हवा चलेगी। गरज के साथ बौछारों के दौरान बवंडर, बिजली, ओले और तेज हवा के झोंके आने की संभावना है।
हो ची मिन्ह सिटी
न्यूनतम तापमान 25-27 डिग्री सेल्सियस और अधिकतम तापमान 33-35 डिग्री सेल्सियस रहेगा। आसमान में बादल छाए रहने की संभावना है, दोपहर और शाम को छिटपुट बारिश और गरज के साथ बौछारें पड़ेंगी, और कुछ क्षेत्रों में भारी बारिश हो सकती है। दक्षिण-पश्चिम दिशा से 2-3 तीव्रता की हवाएं चलेंगी। गरज के साथ बौछारों के दौरान बवंडर, बिजली गिरने, ओले पड़ने और तेज हवा के झोंके आने की संभावना है।",1.0
