title,url,source,date,language,state,district,search_term,full_text,relevance_score
Chandigarh Administration : आईएएस हरप्रीत सिंह सूदन को चार अहम जिम्मेदारियां,https://www.dainiktribuneonline.com/news/chandigarh/harpreet-singh-sudan-assigned-four-key-charges-chandigarh-administration/,Dainik Tribune,2026-07-22T23:31:25+05:30,hi,Chandigarh,Chandigarh,"(लू OR ""लू चलना"" OR ""भीषण गर्मी"" OR ""प्रचंड गर्मी"" OR ""कड़ी धूप"" OR ""तेज धूप"" OR ""गर्म हवा"" OR ""उष्ण लहर"" OR ""ताप लहर"" OR ""हीट वेव"" OR ""झुलसाने वाली गर्मी"" OR ""तपती गर्मी"" OR ""भयंकर गर्मी"") Chandigarh","Chandigarh Administration : आईएएस हरप्रीत सिंह सूदन को चार अहम जिम्मेदारियां
सामाजिक कल्याण, महिला एवं बाल विकास विभाग के सचिव समेत नगर निगम में विशेष आयुक्त का प्रभार, अनूराधा चगती को श्रम एवं रोजगार विभाग की अतिरिक्त जिम्मेदारी
Chandigarh Administration : चंडीगढ़ प्रशासन ने आईएएस अधिकारी हरप्रीत सिंह सूदन के कार्यभार ग्रहण करने के बाद वरिष्ठ अधिकारियों के प्रभारों में फेरबदल किया है। मुख्य सचिव एच. राजेश प्रसाद की ओर से जारी आदेश के अनुसार सूदन को सामाजिक कल्याण, महिला एवं बाल विकास विभाग सहित चार अहम जिम्मेदारियां सौंपी गई हैं।
आदेश के अनुसार हरप्रीत सिंह सूदन को सचिव, सामाजिक कल्याण एवं महिला एवं बाल विकास विभाग, चाइल्ड एंड वूमेन डेवलपमेंट कॉरपोरेशन के चेयरमैन, एससी, बीसी एवं माइनॉरिटीज फाइनेंशियल एंड डेवलपमेंट कॉरपोरेशन के चेयरमैन तथा नगर निगम में विशेष आयुक्त का प्रभार दिया गया है। इन पदों का कार्यभार पहले अनूराधा एस. चगती और आईएएस अधिकारी प्रदीप कुमार के पास था।
वहीं, अनूराधा एस. चगती को उनके मौजूदा दायित्वों के अतिरिक्त सचिव, श्रम एवं रोजगार विभाग का प्रभार सौंपा गया है। यह जिम्मेदारी पहले आईएएस अधिकारी दिप्रवा लाकड़ा के पास थी। आदेश सक्षम प्राधिकारी की मंजूरी के बाद जारी किया गया है।",0.0
