title,url,source,date,language,state,district,search_term,full_text,relevance_score
"दिल्ली-NCR में मौसम ने ली करवट, बारिश और तेज हवाओं के बाद गर्मी से राहत IMD ने दी ये सलाह - ABP News",https://news.google.com/rss/articles/CBMi0gFBVV95cUxNVW1oc25nWVRIc0N6QjloRkpEYmY5Ym1QZGJUaHNyOElVWWM3dFpDcFFidVdBZkhUd2xPMGhxbW9kVnJFU3VLWkxOdTdpSnZHcTl1MXkwbGd6Z0JPVTd6bFBNOHZRSGdIOEdJZ3A1U1BULXdXZkE0QUtObzdsUC1WQ2ZZaFN6aFJzNHpfTFRSLW1Db21JUVBjaUpPcWgtbVItMFJFV0U1Q0VtNXdacjFTd1lqZEsxVU5rdEs4MzdURXJ0QUI3enJqYmM3NWFFWkFSREHSAdcBQVVfeXFMTWtCcU9vbW0zMW03allRSjVuLUJGRGp6UTV3X3NjNkFsN0ozLXVrbnBBb3E0V0dnZ1JUc085MkRYMzJzQlZJbGVXall2UU1WUXk0TXdGZEo5TEhRQ0ZNR1dpRVdqVmxtOWFlclMwX25KaVR0UWlWQl9IODdYb0pWTjBZMXlkVFlUYVlMemVIVkNmUjEtWVRlcFY5Z3I0a2dHQkd4RC1LNEc0T3pLQi16QUswbHZGcWxxbzFhX1F3bjhmWk1IdFhUMGFQbkpBZjBQRlY5TEItQkE?oc=5,ABP News,2026-06-13T06:51:51+05:30,hi,Delhi,,"(""हीट एक्शन प्लान"" OR ""गर्मी से राहत"" OR चेतावनी OR ""रेड अलर्ट"" OR ""ऑरेंज अलर्ट"" OR ""येलो अलर्ट"" OR एडवाइजरी OR ""राहत सामग्री"" OR ""राहत शिविर"" OR मुआवजा) Delhi","दिल्ली-NCR में मौसम ने ली करवट, बारिश और तेज हवाओं के बाद गर्मी से राहत; IMD ने दी ये सलाह
Delhi-NCR Weather Update: दिल्ली-एनसीआर में शुक्रवार के लिए बारिश, गरज-चमक और तेज हवाओं का अलर्ट जारी किया था. विभाग के अनुसार अधिकतम तापमान में करीब 7 डिग्री सेल्सियस की गिरावट दर्ज की गई है.
दिल्ली-एनसीआर में मौसम का मिजाज लगातार बदल रहा है. भीषण गर्मी और लू से परेशान लोगों को अब राहत मिलने लगी है. पिछले कुछ दिनों से हो रही बारिश, तेज हवाओं और बादलों की आवाजाही के कारण तापमान में गिरावट देखी गई है. दिल्ली-एनसीआर में 60 से 80 किलोमीटर प्रति घंटे की रफ्तार से हवाएं चलने की संभावना जताई गई है. बिगड़ते मौसम को देखते हुए नागरिकों से खुले स्थानों, पेड़ों के आसपास से दूर रहने की सलाह दी गई है.
मौसम विभाग (आईएमडी) ने शुक्रवार (12 जून) के लिए बारिश, गरज-चमक और तेज हवाओं का अलर्ट जारी किया था. विभाग के अनुसार अधिकतम तापमान में करीब 7 डिग्री सेल्सियस की गिरावट दर्ज की गई है, जिससे लोगों को गर्मी से बड़ी राहत मिली है. आईएमडी के स्थानीय मौसम पूर्वानुमान के अनुसार 12 जून को अधिकतम तापमान 35 डिग्री सेल्सियस और न्यूनतम तापमान 24 डिग्री सेल्सियस रहने की संभावना जताई गई थी.
दिल्ली-एनसीआर में आज का मौसम (Delhi-NCR Weather Today)
दिल्ली-एनसीआर में आज का मौसम सुबह से ही ठंडा नजर आ रहा है. सुबह 6 बजे दिल्ली-एनसीआर में तापमान 26 डिग्री के करीब बना हुआ है. आसमान साफ नजर आ रहा है लेकिन धूप खिली हुई है. मौसम में 78 प्रतिशत नमी रहने की संभावना है. इलाके में 8 किलोमीटर प्रति घंटे की रफ्तार से हवाएं चलने की उम्मीद है.
मौसम विभाग के सात दिवसीय पूर्वानुमान के अनुसार शनिवार (13 जून) को भी मौसम का रुख नरम बना रहेगा. इस दिन अधिकतम तापमान 36 डिग्री और न्यूनतम तापमान 24 डिग्री सेल्सियस रहने का अनुमान है. पूरे दिन गरज के साथ बारिश की संभावना जताई गई है, हालांकि शनिवार को किसी विशेष चेतावनी की घोषणा नहीं की गई है.
वहीं 14 जून को अधिकतम तापमान 38 डिग्री और न्यूनतम तापमान 25 डिग्री सेल्सियस रहने का अनुमान है. मौसम विभाग के अनुसार आंशिक रूप से बादल छाए रहेंगे तथा कुछ स्थानों पर गरज-चमक की स्थिति विकसित हो सकती है. इस दिन भी कोई विशेष चेतावनी जारी नहीं की गई है.
अगले कुछ दिन कैसा रहेगा दिल्ली-एनसीआर का मौसम
वहीं 15 जून को अधिकतम तापमान 38 डिग्री और न्यूनतम तापमान 26 डिग्री सेल्सियस रहने की संभावना है. मौसम मुख्य रूप से साफ रहने का अनुमान है, जिससे तापमान में हल्की बढ़ोतरी देखने को मिल सकती है. मौसम विशेषज्ञों का कहना है कि पश्चिमी विक्षोभ और बंगाल की खाड़ी से आ रही नमी के प्रभाव से उत्तर भारत के मौसम में यह बदलाव देखने को मिल रहा है.
लगातार बदल रहे मौसम के कारण एनसीआर के लोगों को फिलहाल भीषण गर्मी और लू से राहत मिलेगी. अगले कुछ दिनों तक तापमान सामान्य से नीचे रहने की संभावना है, जिससे लोगों को सुहावने मौसम का अनुभव होगा. फिलहाल बारिश और बादलों की मौजूदगी ने एनसीआर में गर्मी का असर काफी हद तक कम कर दिया है और पूरे सप्ताह राहत का माहौल बने रहने की उम्मीद है.",1.0
"दिल्ली-एनसीआर में मौसम हुआ सुहाना, चार दिनों तक गर्मी से राहत के आसार; येलो अलर्ट जारी - bhaskarhindi.com",https://news.google.com/rss/articles/CBMizAFBVV95cUxNUDRra1BpRVdPYzM3S2ZKei1UY09ZVnJjX2VaX2pBVHJtb2sxT3RZTDdmVW5lWmg1dmxwdmxwM29GSGlKZVJFemFjX2hFMXdKN19neHllVzN4cS1xR3NqV1ZUTFE0MTZGRGo3LUNreHJHbHAzR2g1dXR0MC05VG5meERXMWVhWklYNDJYcDNBVXM5SVcxNFNGdkoxaWp0YlJXbHRmTjkwc1lMUklLVW4xcmRTQjJCWU9RN2JyaUgtNngwSkI5Y3llbGFkamE?oc=5,bhaskarhindi.com,2026-06-13T12:06:26+05:30,hi,Delhi,,"(""हीट एक्शन प्लान"" OR ""गर्मी से राहत"" OR चेतावनी OR ""रेड अलर्ट"" OR ""ऑरेंज अलर्ट"" OR ""येलो अलर्ट"" OR एडवाइजरी OR ""राहत सामग्री"" OR ""राहत शिविर"" OR मुआवजा) Delhi","दिल्ली-एनसीआर में मौसम हुआ सुहाना, चार दिनों तक गर्मी से राहत के आसार; येलो अलर्ट जारी
By - |13 Jun 2026 12:06 PM IST
दिल्ली समेत पूरे राष्ट्रीय राजधानी क्षेत्र में मौसम का मिजाज लगातार बदला हुआ है। भारतीय मौसम विभाग ने शुक्रवार 13 जून के लिए येलो अलर्ट जारी करते हुए दिल्ली, नोएडा, ग्रेटर नोएडा, गाजियाबाद, गुरुग्राम और फरीदाबाद समेत पूरे एनसीआर में तेज हवाओं, गरज-चमक, आंधी और हल्की बारिश की संभावना जताई है।
नई दिल्ली, 13 जून (आईएएनएस)। दिल्ली समेत पूरे राष्ट्रीय राजधानी क्षेत्र में मौसम का मिजाज लगातार बदला हुआ है। भारतीय मौसम विभाग ने शुक्रवार 13 जून के लिए येलो अलर्ट जारी करते हुए दिल्ली, नोएडा, ग्रेटर नोएडा, गाजियाबाद, गुरुग्राम और फरीदाबाद समेत पूरे एनसीआर में तेज हवाओं, गरज-चमक, आंधी और हल्की बारिश की संभावना जताई है।
मौसम विभाग के पूर्वानुमान के अनुसार, अगले चार दिनों तक मौसम अपेक्षाकृत सुहावना बना रहेगा, जिससे लोगों को भीषण गर्मी और लू से राहत मिलेगी। मौसम विभाग के स्थानीय पूर्वानुमान के अनुसार, 13 जून को अधिकतम तापमान 37 डिग्री सेल्सियस और न्यूनतम तापमान 23 डिग्री सेल्सियस रहने का अनुमान है। दिन और शाम के समय हल्की से मध्यम बारिश, गरज-चमक तथा 40 से 50 किलोमीटर प्रति घंटे की रफ्तार से तेज हवाएं चल सकती हैं। इसके बाद, 14 जून को अधिकतम तापमान 38 डिग्री और न्यूनतम 24 डिग्री सेल्सियस रहने का अनुमान है।
मौसम विभाग ने इस दिन आंशिक रूप से बादल छाए रहने तथा गरज-चमक विकसित होने की संभावना जताई है। 15 जून को तापमान 39/25 डिग्री सेल्सियस रहने का अनुमान है। इस दिन आसमान में आंशिक बादल छाए रहेंगे और कोई विशेष चेतावनी जारी नहीं की गई है। वहीं, 16 जून को अधिकतम तापमान 40 डिग्री तथा न्यूनतम 26 डिग्री सेल्सियस रहने का अनुमान है। इस दिन भी बादलों के बीच कहीं-कहीं गरज-चमक की गतिविधियां देखने को मिल सकती हैं।
इसी तरह, 17 और 18 जून को भी अधिकतम तापमान 40 डिग्री तथा न्यूनतम तापमान 27 डिग्री सेल्सियस रहने का अनुमान है। दोनों दिनों में मौसम विभाग ने आंशिक रूप से बादल छाए रहने की संभावना जताई है और फिलहाल किसी प्रकार की चेतावनी जारी नहीं की गई है। मौसम में आए बदलाव का सकारात्मक असर वायु गुणवत्ता पर भी देखने को मिल रहा है।
केंद्रीय प्रदूषण नियंत्रण तंत्र के ताजा आंकड़ों के अनुसार, दिल्ली-नोएडा के अधिकांश मॉनिटरिंग स्टेशनों पर एक्यूआई ग्रीन और संतोषजनक श्रेणी में दर्ज किया गया है। दिल्ली के प्रमुख स्टेशनों में अलीपुर 61, आनंद विहार 100, अशोक विहार 80, बवाना 92, बुराड़ी क्रॉसिंग 78, कैंटोनमेंट एरिया 71, चांदनी चौक 85, कॉमनवेल्थ स्पोर्ट्स कॉम्प्लेक्स 67, सीआरआरआई मथुरा रोड 71 और डॉ. कर्णी सिंह शूटिंग रेंज 54 एक्यूआई दर्ज किया गया।
वहीं, नोएडा के चारों सक्रिय स्टेशनों पर भी वायु गुणवत्ता काफी बेहतर रही। सेक्टर-125 में एक्यूआई 73, सेक्टर-62 में 72, सेक्टर-1 में 81 और सेक्टर-116 में 73 दर्ज किया गया। ये सभी आंकड़े संतोषजनक श्रेणी में हैं।
लगातार हो रही बारिश, तेज हवाओं और वातावरण में नमी बढ़ने के कारण प्रदूषण के स्तर में उल्लेखनीय गिरावट आई है। विशेषज्ञों का कहना है कि फिलहाल एनसीआर के अधिकांश क्षेत्रों में हवा की गुणवत्ता सामान्य से कहीं बेहतर है और लोगों को पहाड़ी इलाकों जैसी अपेक्षाकृत स्वच्छ हवा का अनुभव हो रहा है।
मौसम विभाग का कहना है कि अगले कुछ दिनों तक मौसम का यही रुख बना रह सकता है। ऐसे में एनसीआर के निवासियों को फिलहाल भीषण गर्मी और लू से राहत मिलने की पूरी संभावना है। हालांकि, विभाग ने लोगों को गरज-चमक, बिजली गिरने और तेज हवाओं के दौरान खुले स्थानों पर जाने से बचने तथा आवश्यक सावधानी बरतने की सलाह दी है।
अस्वीकरण: यह न्यूज़ ऑटो फ़ीड्स द्वारा स्वतः प्रकाशित हुई खबर है। इस न्यूज़ में BhaskarHindi.com टीम के द्वारा किसी भी तरह का कोई बदलाव या परिवर्तन (एडिटिंग) नहीं किया गया है| इस न्यूज की एवं न्यूज में उपयोग में ली गई सामग्रियों की सम्पूर्ण जवाबदारी केवल और केवल न्यूज़ एजेंसी की है एवं इस न्यूज में दी गई जानकारी का उपयोग करने से पहले संबंधित क्षेत्र के विशेषज्ञों (वकील / इंजीनियर / ज्योतिष / वास्तुशास्त्री / डॉक्टर / न्यूज़ एजेंसी / अन्य विषय एक्सपर्ट) की सलाह जरूर लें। अतः संबंधित खबर एवं उपयोग में लिए गए टेक्स्ट मैटर, फोटो, विडियो एवं ऑडिओ को लेकर BhaskarHindi.com न्यूज पोर्टल की कोई भी जिम्मेदारी नहीं है|",1.0
"Delhi weather Update: दिल्ली में आज आंधी-तूफान और बारिश का 'येलो अलर्ट', तेज हवाओं के साथ गर्मी से मिलेगी राहत - LatestLY",https://news.google.com/rss/articles/CBMi5AFBVV95cUxNMklYZDl1T0t6WFd4ZEVDbWtobWZNcTM3TVlJTlN4RUllZHBXbkZjYnlqTUVFWWh1bTZvWUJ6c3NlM3psV2hnZ1J5aDdrWVBQTDBwY016dTFiMmF1RW44Q2dyVFJpZ2VOaEd5Zk9zNVM0QlFpNDl3VmY5ejBPRExXVzBoaThzMF9sUHk0VlJmanNjeElwc0V2VzB1a2hqSVprcGNSX0UzNnlWMVA3ZUxMX0VmaC1mSDJuMkQ0OTc0NTQyejhUM3Z0MHZvazBmcFo2aS1ZQzFXTGFaMDRoT3l5T1lVT20?oc=5,LatestLY,2026-06-13T08:35:20+05:30,hi,Delhi,,"(""हीट एक्शन प्लान"" OR ""गर्मी से राहत"" OR चेतावनी OR ""रेड अलर्ट"" OR ""ऑरेंज अलर्ट"" OR ""येलो अलर्ट"" OR एडवाइजरी OR ""राहत सामग्री"" OR ""राहत शिविर"" OR मुआवजा) Delhi","नई दिल्ली, 13 जून: दिल्ली (Delhi) और आसपास के राष्ट्रीय राजधानी क्षेत्र (NCR) में मौसम का मिजाज एक बार फिर बदल गया है. भारत मौसम विज्ञान विभाग (India Meteorological Department) (IMD) ने शनिवार को दिल्ली के लिए 'येलो अलर्ट' (Yellow Alert) जारी किया है. मौसम विभाग के अनुसार, आज दोपहर या शाम को दिल्ली-एनसीआर के कई इलाकों में गरज-चमक के साथ आंधी चलने, धूल भरी तेज हवाएं चलने और हल्की बारिश होने की संभावना है. इस दौरान हवा की रफ्तार 40 से 50 किलोमीटर प्रति घंटा तक पहुंच सकती है. यह भी पढ़ेंं: Weather Forecast Today: भीषण गर्मी के बीच दिल्ली में बारिश-आंधी की चेतावनी, जानें मुंबई-चेन्नई समेत बड़े शहरों के मौसम पर IMD का ताजा अपडेट
दिनभर कैसा रहेगा मौसम का हाल
मौसम विभाग के पूर्वानुमान के मुताबिक, शनिवार को दिल्ली में आमतौर पर आंशिक रूप से बादल छाए रहेंगे. हालांकि सुबह के समय धूप खिली रही, लेकिन दोपहर बाद मौसम में बदलाव आने की उम्मीद है. आज दिल्ली का अधिकतम तापमान 37 डिग्री सेल्सियस और न्यूनतम तापमान 23 डिग्री सेल्सियस के आसपास रहने का अनुमान है, जो पिछले दिनों की तुलना में काफी राहत भरा है.
पश्चिमी विक्षोभ का असर
आईएमडी के अनुसार, उत्तर-पश्चिम भारत में सक्रिय हुए एक नए पश्चिमी विक्षोभ (Western Disturbance) के कारण मौसम में यह बदलाव आया है. इस मौसमी सिस्टम की वजह से क्षेत्र में नमी और वायुमंडलीय अस्थिरता बढ़ गई है, जिससे गरज-चमक के साथ बारिश की अनुकूल स्थितियां बनी हैं. मौसम वैज्ञानिकों का कहना है कि मानसून से पहले के इस दौर में पश्चिमी विक्षोभ अक्सर मौसम में इस तरह के उतार-चढ़ाव का कारण बनते हैं.
पिछले 24 घंटों में तापमान में भारी गिरावट
इससे पहले शुक्रवार को भी दिल्ली के लोगों को भीषण गर्मी से बड़ी राहत मिली थी. गुरुवार रात हुई बारिश के बाद शुक्रवार सुबह आसमान में बादल छाए रहे और ठंडी हवाएं चलीं. दिल्ली की मुख्य वेधशाला सफदरजंग ने न्यूनतम तापमान 22.8 डिग्री सेल्सियस दर्ज किया, जो इस सीजन के सामान्य औसत से 5.2 डिग्री सेल्सियस कम था. यह तापमान इससे पिछले दिन (गुरुवार) के मुकाबले 7.2 डिग्री सेल्सियस कम रिकॉर्ड किया गया था.
प्रशासन की सलाह और आगे का अनुमान
पिछले कई दिनों से लगातार चल रही भीषण लू (Heatwave) और अत्यधिक तापमान के बाद, इस नए वेदर सिस्टम से अगले कुछ दिनों तक मौसम के सुहावना बने रहने की उम्मीद है. मौसम विभाग स्थिति पर लगातार नजर रख रहा है. आईएमडी ने निवासियों को सलाह दी है कि वे तेज हवाओं और आंधी के दौरान सावधानी बरतें और मौसम के ताजा अपडेट्स से जुड़े रहें, क्योंकि दिन के दौरान स्थितियां तेजी से बदल सकती हैं.",1.0
