title,url,source,date,language,state,district,search_term,full_text,relevance_score
"NHRC urges states, Delhi to strengthen heatwave relief measures amid rising temperatures - News On AIR",https://news.google.com/rss/articles/CBMiswFBVV95cUxNRWViVXVuYVZPNFlQZVoyamxGaTJ0VTE0RU1qYmVON216Z2EycGxFUW5wTDBBZTZHMC01aEZkOWJlUzFJaXJYdC1ackdGV1pFQUpoQThVVlBtV2hfY1lWTjh3OUNLd2dONlNRNW5yX2FhQUwxQTZZMFdQOV9Bb3VmM3hBbmd0RVA0SkVBXzRTQVp3RTU0VENfM3Y1SFlaOEMtQWpnNFdfOGNpYnVVVFd3NGhkSQ?oc=5,News On AIR,2026-06-13T00:44:13+05:30,en,Delhi,,"""heatwave"" Delhi","The National Human Rights Commission (NHRC) has issued letters to the Chief Secretaries of 21 States and the Union Territory of Delhi, urging them to take advance action and implement relief measures to protect vulnerable populations during heatwaves in the country. The Commission has also sought action-taken reports to mitigate the impact of heatwaves and prevent casualties, in line with existing guidelines issued by the National Disaster Management Authority.
The NHRC said that the rising frequency, duration, and intensity of heatwaves affect marginalised and economically weaker sections, outdoor workers, and the homeless due to a lack of adequate shelter and resources. It stressed that the elderly, children, infants, and newborns are especially vulnerable to the health impacts of extreme heat, adding that heatwaves can also lead to loss of livelihoods and an increased risk of fire accidents.
Highlighting National Crime Records Bureau data on the reported death of over 3,712 people in India due to heat or sunstroke between 2019 and 2023, the Commission emphasised the urgent need for integrated and inclusive measures.",1.0
Delhi-NCR Gets Respite From Scorching Heat As Rain And Strong Winds Cool Region - ABP News,https://news.google.com/rss/articles/CBMivgFBVV95cUxOYVNaSkc2TXd0QndSaEdKOGtWOFlYdXFvUWphQWZTV0p1MWFpSFVqQTl0U0x5NnJVTHRSSzJEVzFwSEJ5c0Y3bm9JY3RTdzdWbV9BYllici16UF9JYUo2XzQzVGFQbHBkTlhmODY1MGpSNUtZTWFxRkZjTUpnamJjVktPTEljbVpIMFJ2R3NwUnZ2ZVJfc21DNHh3WXM0SkJ1dUFqX3piRWV1RDFSQm9jZTZvbEpFQTYybTl0eGxn0gHDAUFVX3lxTE12cURPX2tNMkxYc2JtT0NLVHJkSHVuVWtabUFrVWZVWTZiZkpObGZsaU1fZzhnWGxKaHBsWVZsTFZ4QklpUU1ZZkxRQTh1eUloN2N1RlZCR2p5RHc2RVBXLURQNFpjM1RQWVhoQVlzSWhFcGtYMnl5S1VZNnl5LWtCS2lNRW1sSS12bWNQM0ZOZTB4bnNRbEZZZnRyeGJtRjhxcjRLcTNta0tLVWJMX3dXS1F6cUpTZTV4YjBsM0UwTDV0WQ?oc=5,ABP News,2026-06-13T08:06:12+05:30,en,Delhi,,"""heatwave"" Delhi","The weather change is attributed to a western disturbance and moisture-laden winds from the Bay of Bengal. These systems created favorable conditions for rainfall, cloud formation, and thunderstorms across the region.
Delhi-NCR Gets Respite From Scorching Heat As Rain And Strong Winds Cool Region
Rainfall, cloud cover and strong winds have caused temperatures to drop by nearly 7 degrees Celsius, according to the India Meteorological Department (IMD).
- Delhi-NCR residents found relief from extreme summer heat.
- Rain, strong winds caused temperatures to drop seven degrees.
- IMD forecasts pleasant weather, rain for coming days.
- Western disturbance, Bay of Bengal winds caused this shift.
Residents across Delhi-NCR have finally received much-needed relief from the intense summer heat as changing weather conditions continue to bring cooler temperatures, rain and strong winds to the region.
After days of battling soaring temperatures and heatwave conditions, people are experiencing a noticeable shift in the weather. Recent rainfall, cloud cover and gusty winds have contributed to a significant drop in temperatures, making outdoor conditions far more comfortable.
The India Meteorological Department (IMD) had issued an alert for rain, thunderstorms and strong winds on Friday, June 12. According to the weather agency, the maximum temperature dropped by nearly 7 degrees Celsius, providing substantial relief from the oppressive heat.
Strong Winds and Rain Keep Temperatures in Check
The IMD had warned that wind speeds across Delhi-NCR could reach between 60 and 80 kilometres per hour. In view of the changing weather conditions, authorities advised residents to avoid open spaces and stay away from trees and other vulnerable structures during periods of strong winds.
As per the local weather forecast, the maximum temperature on June 12 was expected to settle around 35 degrees Celsius, while the minimum temperature was likely to remain near 24 degrees Celsius.
The sharp decline in temperatures has significantly eased heat-related discomfort, offering residents a welcome break from the prolonged spell of extreme summer conditions.

How Is the Weather in Delhi-NCR Today?
Delhi-NCR woke up to relatively cool weather conditions on Saturday morning. At around 6 a.m., temperatures hovered close to 26 degrees Celsius.
While the sky appeared largely clear, sunshine was visible across several parts of the region. Humidity levels are expected to remain around 78 per cent, while winds may blow at a speed of approximately 8 kilometres per hour.
According to the IMD's seven-day forecast, weather conditions are expected to remain pleasant on June 13. The maximum temperature is likely to reach 36 degrees Celsius, while the minimum temperature may stay around 24 degrees Celsius. Rain accompanied by thunderstorms is expected during the day, although no specific weather warning has been issued.
Forecast for the Coming Days
The weather department has forecast a maximum temperature of 38 degrees Celsius and a minimum of 25 degrees Celsius for June 14. Partly cloudy skies are expected, and isolated thunderstorm activity may develop in some areas.
No weather warning has been issued for June 14. However, changing atmospheric conditions are expected to keep temperatures under control compared with the severe heat experienced earlier in the season.
On June 15, the maximum temperature is likely to remain around 38 degrees Celsius, while the minimum temperature may rise slightly to 26 degrees Celsius. Weather conditions are expected to remain largely clear, which could lead to a marginal increase in temperatures.

Why Is the Weather Changing?
Weather experts attribute the recent change in conditions to the influence of a western disturbance and moisture-laden winds arriving from the Bay of Bengal.
These systems have helped create favourable conditions for rainfall, cloud formation and thunderstorms across parts of North India, including Delhi-NCR.
For now, residents are expected to remain free from severe heatwave conditions. With temperatures likely to stay below normal over the next few days, the region could continue to experience relatively pleasant weather. The presence of clouds and intermittent rainfall has already reduced the impact of the summer heat, and relief is expected to continue through the week.
Before You Go
MEENAKSHI NOMINATION ROW: Supreme Court Dismisses Meenakshi Natarajan’s Plea, No Relief on Rajya Sabha Nomination
Frequently Asked Questions
What caused the recent change in weather conditions in Delhi-NCR?
What were the weather conditions on Friday, June 12?
On June 12, the India Meteorological Department had issued an alert for rain, thunderstorms, and strong winds. The maximum temperature dropped by approximately 7 degrees Celsius, settling around 35 degrees Celsius.
What is the weather forecast for Delhi-NCR in the coming days?
For June 13, rain and thunderstorms are expected with a maximum of 36°C. June 14 will see partly cloudy skies and isolated thunderstorms, while June 15 is predicted to be largely clear.
How has the recent weather change impacted Delhi-NCR residents?
The changing weather has brought significant relief from intense summer heat and heatwave conditions. Temperatures have dropped, making outdoor conditions far more comfortable for residents.",1.0
"Delhi Weather Today June 13: Rain And Thunderstorms Bring Relief From Heatwave, IMD Predicts Pleasant Weekend - The Sunday Guardian",https://news.google.com/rss/articles/CBMi5wFBVV95cUxOcFp6VGQzRTN3UW5uSjNicXpWSmE4NVNZSGNZRUt0WjgwQi0tWGhCMzZYTUQ4VUNCQmhsN1BnaXoxWDBRNjFZZm5xcDRrODV0OVI5T0paVG9RTEV0d1lQWVRtS3dRejJ3emQycE4wSW9XaWNRMVdpWmh4TWZsd2RGVUQ3UmR5S2FCSWw2X0ZSNllZN21jYzgwRjIzejRZV2tTb3p0OWdxdmlSVF9lUnYzRkhQcFdtRFRiTnVsTTY2MzZ4SV9NcHFQWmxNN2ZKSVRUNzBYblAtRXNBWjk1MUc3VVF4ZVNsRjjSAewBQVVfeXFMUFRtY00yWjF4Tk1ONTd2Z0p5WWtKZWdVU0FGQ0dHNmFsVVRXTjIwY3g2a1I2akRESlN5djB2LUVrVVV0RUIwTklEa3RvSFo4T1o3UkRsZGlkeUptMXhJNVNJbEN4YTRqR3RPTXh4N0I4U0VmR1ljUWdzaGlrbjNTVHVIcEs0V0Vwcnp0NWw5cS1YRHRrTDBfdVF2MXY2eXE4TWI3SWsxZ0pUQ2JTN25rWmxvdmYtTXIyeUZsMnpUcFR2UWdMdS1SVGpPNW1hM0hGejdDUXVCWWVHVDhESTd6YjU3YWZ2em5GVWVoYWM?oc=5,The Sunday Guardian,2026-06-13T07:41:18+05:30,en,Delhi,,"""heatwave"" Delhi","Delhi Weather Today June 13: Delhi-NCR residents continued to enjoy relief from the intense summer heat on Saturday as cooler temperatures, cloud cover, and intermittent rain transformed weather conditions across the region. The India Meteorological Department (IMD) has said the recent rain and high winds has helped to bring down temperatures, breaking the heatwave scenario in the national capital in the past few weeks. The hottest temperature experienced has fallen by almost 7 degrees from previous readings, thus relieving millions. The weather department has issued an alert on the possibility of the wind gusts ranging from 60 to 80 kmph in parts of Delhi-NCR, urging people not to go to open space or construction sites and stay away from trees during the strong wind and thunderstorm hours.
Delhi Weather Today June 13: Check Current Temperature
The current temperature of Delhi is 27°C. Highest temperature is predicted to be around 33°C and lowest 26°C. Relative humidity values were in the vicinity of 78 per cent and light winds prevailed over the area. The IMD has predicted that the all-India high of 36 degree Celsius and low of 24 degree Celsius will occur on 13th June. Scattered rainfall or thunderstorms will occur during the day which will keep weather relatively comfortable. No major weather warning has been issued directly to those in the path of the weather, but meteorologists are still closely watching the atmosphere’s shifts.
Delhi Weather Today June 13: Monsoon Impact
The positive effect of western disturbance and moisture supply from Bay of Bengal has contributed significantly to the improvement in weather over North India. The recent wet weather has slowed the rise in temperatures during the day, and it is unlikely to get near to the June normal. Consequently, residents have cooler mornings, less oppressive afternoons and more comfortable evenings. Precipitation in the last several days has also been beneficial to air quality in some areas and a respite from high dust levels sometimes experienced during the height of summer in the region.
Delhi Weather Today June 13: What About Next 7-Days?
In the coming days, the IMD forecast relatively mild weather, adding that it could become slightly cooler in the coming seven days. Partly cloudy skies with isolated thunderstorms are possible as the maximum temperature is expected to be 38°C on June 14. There are similar expectations on June 15 with temperatures possibly reaching 38°C but also being close to seasonal averages. Although the heat is expected to rise in the coming days, Delhi-NCR will not get into severe heatwave conditions anytime soon, according to weather experts. The week will be a more pleasant weather pattern with cloudiness, scattered rain and moderate temperatures forecast for the area.",1.0
