title,url,source,date,language,state,district,search_term,full_text,relevance_score
"पंजाब-चंडीगढ़ में खत्म हुआ बारिश का दौर, कल से झुलसाएगी भयंकर गर्मी; अगले 5 दिनों के लिए हीट वेव का अलर्ट जारी - punjablivenews.in",https://news.google.com/rss/articles/CBMirAFBVV95cUxNNEN0RDhnNE0xVENPTkV5NUI0Nl9SMnhxUmNSYjEwaTZfRU0zX2ZNbTZDc21LdjNiRkFLN01BdGstMlRmek9RY2l4MHpxV2ZHQUIwc2hsQWVza3ozckRzSHdRRGVGazRfRVIyUjljbHlEeE5NOXZmMG9DTzdwSlA1YnhsaDZiMlVXNkU5UW1TTC1qbTFIQXNFbjF3SXpncDBuYnlMeGVIWThBMGJ5?oc=5,punjablivenews.in,2026-05-16T17:11:48+05:30,hi,Chandigarh,Chandigarh,"(""हीट एक्शन प्लान"" OR ""गर्मी से राहत"" OR चेतावनी OR ""रेड अलर्ट"" OR ""ऑरेंज अलर्ट"" OR ""येलो अलर्ट"" OR एडवाइजरी OR ""राहत सामग्री"" OR ""राहत शिविर"" OR मुआवजा) Chandigarh","चंडीगढ़: पंजाब और चंडीगढ़ में मौसम ने एक बार फिर करवट ले ली है और अब बारिश का दौर पूरी तरह से खत्म हो गया है। शनिवार (16 मई) को मौसम शुष्क रहने के आसार हैं और बारिश की कोई संभावना नहीं है। मौसम विज्ञान केंद्र चंडीगढ़ के अनुसार, अब लोगों को भीषण गर्मी का सामना करने के लिए तैयार रहना होगा। विभाग ने चेतावनी दी है कि 17 मई से अगले पांच दिनों तक पूरे इलाके में लू (हीट वेव) का प्रकोप रहेगा, जिससे लोगों को भारी परेशानी का सामना करना पड़ सकता है।
तापमान में मामूली गिरावट, लेकिन गर्मी से राहत नहीं
बेशक आने वाले दिनों में भीषण गर्मी पड़ने वाली है, लेकिन शुक्रवार की तुलना में अधिकतम तापमान में हल्की राहत जरूर देखने को मिली है। अधिकतम तापमान में दो डिग्री की गिरावट दर्ज की गई है, जिसके बाद अब यह सामान्य से 1.8 डिग्री नीचे आ गया है। हालांकि, सबसे अधिक तापमान अभी भी 41 डिग्री सेल्सियस के करीब बना हुआ है, जो लोगों को झुलसाने के लिए काफी है। इस बढ़ती गर्मी और आने वाली हीट वेव से खुद को कैसे सुरक्षित रखना है, इसे लेकर प्रशासन की तरफ से अप्रैल के अंत में ही एक विस्तृत एडवाइजरी जारी कर दी गई थी।
चक्रवाती सिस्टम पड़ा कमजोर, नहीं बरसेंगे बादल
मौसम विभाग की जानकारी के मुताबिक, दक्षिण-पश्चिम मानसून के अंडमान-निकोबार और दक्षिण बंगाल की खाड़ी की तरफ आगे बढ़ने के लिए अनुकूल परिस्थितियां बन रही हैं। दूसरी ओर, पश्चिमी विक्षोभ भी सक्रिय अवस्था में है। वर्तमान में एक सिस्टम पाकिस्तान की तरफ और दूसरा जम्मू-उत्तर पाकिस्तान के आसपास बना हुआ है। इन प्रणालियों के कारण उत्तर भारत के मौसम में कुछ बदलाव जरूर देखने को मिल सकता है, लेकिन पश्चिम उत्तर प्रदेश के ऊपर बना चक्रवाती सिस्टम अब पूरी तरह से कमजोर पड़ चुका है। ऐसे में फिलहाल पंजाब और चंडीगढ़ में बारिश की कोई उम्मीद नहीं है और लोगों को तीखी धूप और गर्म हवाओं का ही सामना करना पड़ेगा।
Spell of Rain Ends in Punjab and Chandigarh; Scorching Heat to Return Tomorrow",1.0
"day heatwave alert for Punjab, Haryana, Chandigarh from May 18",https://www.tribuneindia.com/news/chandigarh/imd-issues-five-day-heatwave-alert-for-punjab-haryana-chandigarh-from-may-18/,The Tribune,2026-05-16T19:26:15+05:30,en,Chandigarh,Chandigarh,"(heatwave OR ""heat wave"" OR ""severe heatwave"" OR ""extreme heat"" OR ""heat spell"" OR ""scorching heat"" OR ""blistering heat"" OR ""sweltering heat"" OR ""hot winds"" OR loo OR ""hot loo winds"") Chandigarh","IMD issues five-day heatwave alert for Punjab, Haryana, Chandigarh from May 18
A yellow heat alert — advising residents to stay updated and take precautions — is in force from Monday onward
The pre-monsoon storm season is firmly behind the region and the heatwave is now officially at the door. India Meteorological Department (IMD) on Saturday issued a formal alert, declaring heat wave conditions likely over Punjab, Haryana and Chandigarh from Monday (May 18) through Friday (May 22) — five continuous days of heat wave alert. A yellow heat alert — advising residents to stay updated and take precautions — is in force from Monday onward. No rain, no thunderstorm and no gusty winds are expected across the entire region for at least seven days from Saturday, with every day in the week ahead forecast to be completely dry.
Underlining that the heat has already begun establishing itself, Mohali recorded the warmest night in Punjab on Friday night — its minimum temperature of 25.6°C was the highest minimum in the state. Chandigarh’s maximum temperature on Saturday hit 39.0°C, landing exactly at the seasonal normal for this date — the first time in this active season that the city’s daytime high has reached the normal mark after weeks of below-normal readings driven by western disturbance activity.
IMD’S HEATWAVE WARNING
IMD focuses the sharpest heat warning on the southern and south-western districts of Punjab and Haryana, where isolated heat wave conditions are forecast to develop from Monday. The northern and eastern parts of Punjab and Haryana — including Chandigarh — are also expected to record above-normal maximum temperatures through this period, without necessarily meeting the formal heat wave threshold. IMD projects a gradual rise of 4 to 5 degrees Celsius in maximum temperatures over the next five days, and mainly dry weather is forecast to continue over Chandigarh, Punjab and Haryana through the next five to six days with no weather relief on the horizon.
WHAT IS YELLOW HEAT ALERT
The yellow heat alert means heat wave conditions will affect isolated pockets on at least two days. While the heat is described as tolerable for the general public, IMD has flagged a moderate health concern for vulnerable groups — infants, the elderly and those with chronic illnesses.
ADVISORY: WHAT YOU SHOULD DO
IMD has advised residents to avoid prolonged sun exposure, particularly during the peak afternoon hours; drink plenty of water even when not thirsty; wear lightweight, light-coloured and loose cotton clothes; and cover the head with a cloth, hat or umbrella when stepping out. For farmers, IMD has specifically advised that irrigation be done in the evening or early morning hours to minimise heat stress on standing crops.
FIVE-DAY TRICITY FORECAST: UNRELENTING HEAT
The five-day forecast for Chandigarh, Mohali and Panchkula leaves little doubt about what lies ahead. Sunday (May 17) will see mainly clear skies with a maximum of 39°C and minimum of 23°C. Monday (May 18) pushes to 41°C maximum and 23°C minimum. Tuesday (May 19) holds at 41°C maximum and 24°C minimum. Wednesday (May 20) stays at 41°C maximum and 24°C minimum. Thursday (May 21) touches 42°C maximum with a minimum of 24°C. Every single day carries mainly clear skies — not a cloud, not a drop of rain, no respite from the sun.
SEVEN-DAY WARNING: ALL DRY, ALL HEAT
The seven-day weather outlook for both Punjab and Haryana and Chandigarh shows no rain at all from Saturday through Friday (May 16-22). Saturday and Sunday carry no weather warning. From Monday (May 18) through Friday (May 22), a heat wave warning at isolated places is in force for both states and Chandigarh, sustained for five days in a row.
PAST 24 HOURS DRY ACROSS BOTH STATES
The 24-hour period ending Saturday morning was completely dry across both Punjab and Haryana — the first entirely dry 24-hour spell in over a week. After the sustained stormy spell driven by the western disturbance that brought rain, thunderstorm and gusty winds to the region repeatedly between May 10 and 14, the atmosphere has settled, the clouds have cleared and the heat is now building unimpeded.
PUNJAB TEMPERATURES: HEAT BUILDING FROM SOUTH
Across Punjab, the average maximum temperature rose by 2.1°C on Saturday and is now near normal. Faridkot recorded the highest maximum in Punjab at 42.6°C and followed by Bathinda at 42.3°C — the Malwa belt is already running hot. Abohar (Fazilka) registered the highest single-day rise at 3.7°C to reach 39.0°C, while Amritsar rose 3.6°C to 38.2°C and Ludhiana climbed 3.0°C to 39.8°C. Average minimum temperatures rose by 0.7°C and are near normal. Mohali’s minimum of 25.6°C was the warmest night reading in Punjab, while Bhakra Dam in Ropar recorded the coolest minimum in the state at 20.2°C.
HARYANA TEMPERATURES: ROHTAK LEADS THE HEAT
In Haryana, the average maximum temperature rose by 1.3°C and remained near normal. Rohtak recorded the highest maximum at 42.1°C, followed by Sirsa at 42.0°C, Narnaul at 41.5°C, Nuh at 41.4°C and Hisar at 40.9°C — a wide arc of the state is now touching or crossing 40°C. Average minimum temperatures in Haryana showed no change on Saturday and remained 1.6°C below normal. Rohtak recorded the lowest minimum in the state at 20.4°C. Among other stations, Ambala logged a maximum of 39.8°C and minimum of 25.5°C; Karnal 39.6°C and 22.2°C; Jind 40.6°C and 23.7°C.
CHANDIGARH STAYS NORMAL
At Chandigarh’s weather observatory on Saturday, the maximum temperature was 39.0°C — exactly at the seasonal normal, with zero departure — while the minimum was 22.4°C, three degrees below normal. Maximum relative humidity was 63 per cent and minimum 43 per cent. No rainfall was recorded during the day. Chandigarh’s cumulative seasonal rainfall from March 1 stands at 105.0 mm, now 124.4 per cent above the seasonal normal.",1.0
"With steep rise in temperatures ahead, heatwaves likely to grip Punjab, Haryana from May 18 - The Indian Express",https://news.google.com/rss/articles/CBMi7AFBVV95cUxPSHlrdXRiX3ltYUVRaFlRVVdrWXR2dTR6WWZJTE5kaFhzTmtyNHFMOFpINTl5SV85TkY3RHlSU0luSUEtQlMwUDVRcjZpWnRoLWNJMHROVzlGd0lUeEhuNEJVbUpyYURXWXhRS1dOdVN1c05OU0lxNW5mVkJHVGx6a2RwclBLX296ckJ1dmZ1RTV0aUhRZW1OQmhHd2tGOFlTOGdfYnJDRnE1LWd6VzR0eV9BN01sRGNuRmxMQU04UkVWY25MVnJHRFRDSGhRTzhlNGJoMzdMOFQ5NVJjZTkxaGxmN0V6bVlIVWtKLdIB7AFBVV95cUxPSHlrdXRiX3ltYUVRaFlRVVdrWXR2dTR6WWZJTE5kaFhzTmtyNHFMOFpINTl5SV85TkY3RHlSU0luSUEtQlMwUDVRcjZpWnRoLWNJMHROVzlGd0lUeEhuNEJVbUpyYURXWXhRS1dOdVN1c05OU0lxNW5mVkJHVGx6a2RwclBLX296ckJ1dmZ1RTV0aUhRZW1OQmhHd2tGOFlTOGdfYnJDRnE1LWd6VzR0eV9BN01sRGNuRmxMQU04UkVWY25MVnJHRFRDSGhRTzhlNGJoMzdMOFQ5NVJjZTkxaGxmN0V6bVlIVWtKLQ?oc=5,The Indian Express,2026-05-16T20:50:20+05:30,en,Chandigarh,Chandigarh,"""heatwave"" Chandigarh","After days of relatively mild weather, Punjab and Haryana are likely to witness a sharp rise in temperatures beginning May 18, with the India Meteorological Department (IMD) warning of isolated heatwave conditions in several districts till May 22.
According to the latest weather forecast issued by the Meteorological Centre, Chandigarh, mainly dry weather conditions are expected to prevail across Punjab, Haryana, and Chandigarh over the next five to six days. The IMD has forecast a gradual increase of 4-5 degrees Celsius in maximum temperatures during this period, particularly affecting southern and south-western parts of both states.
The weather office said isolated heatwave conditions are likely to develop between May 18 and May 22 in districts located in the southern belt of Punjab and Haryana, while northern and eastern regions, including Chandigarh, are also expected to record above-normal temperatures.
On Friday, Bathinda in Punjab recorded the highest maximum temperature in the state at 41°C, while Rohtak in Haryana registered 40.8°C, the highest in Haryana.
Despite the rising mercury, the IMD noted that maximum temperatures in Haryana currently remain within the normal range, with departures between minus 1.5°C and plus 1.5°C. In Punjab, however, temperatures are still below normal by 1.6°C to 3°C, though a steady increase is expected over the coming days.
Meteorologists said the absence of any major western disturbance and continued dry conditions are contributing to the anticipated temperature rise across the region.
The IMD has also outlined the likely impact of the heatwave and issued advisory alerts for vulnerable populations.
Under a Yellow Alert, which signals that people should “be updated,” moderate heat conditions may persist for two consecutive days in isolated areas. While heat remains tolerable for the general public, the weather department warned that infants, elderly citizens, and people suffering from chronic illnesses may face moderate health risks.
An Orange Alert, categorised as “be prepared,” indicates high temperatures and an increased likelihood of heat-related illnesses among people exposed to the sun for prolonged periods or involved in strenuous outdoor activities.
The weather department has urged people to avoid direct exposure to the sun, especially during afternoon hours when temperatures peak. Residents have been advised to stay hydrated, wear loose cotton clothes, and cover their heads using caps, cloth, or umbrellas while stepping outdoors.
Health experts say prolonged exposure to extreme heat can lead to dehydration, heat exhaustion, dizziness, and heatstroke, particularly among outdoor workers, children, and senior citizens.
The IMD also issued a specific advisory for farmers, recommending irrigation of crops either in the evening or early morning hours to minimise heat stress on standing crops.
Agricultural experts noted that sudden temperature spikes during the pre-monsoon period can affect moisture retention in fields and place stress on vegetables, fodder crops, and summer maize in several districts.
Officials said district-wise forecasts and warnings have been circulated to local administrations for preparedness measures in view of the expected heatwave conditions over the coming week.",1.0
