title,url,source,date,language,state,district,search_term,full_text,relevance_score
"उन्हाळ्यात लहान मुलांना डिहायड्रेशन, उष्माघाताचा धोका - Pudhari News",https://news.google.com/rss/articles/CBMixwFBVV95cUxNN2dNN1dwU09TUWRGMDYzNkpXSy1SZ05vbHp1R3JHa0RncU94TXVCNVphRDVNcHdWQ3J1SHREdGFvYzZOTmxiejJfWS1NdnptSi1UT1Y3YWc4alZoOVJvMnp5NkNjaHg5d2JDUTQxTHp4ZV9Halg2bWt5Z3phTXMyT2ZOMlJkS2xuYk5CTElVRDlOLUtPdlkyLVozZV9JVUc4aE55d01HdGpJcHpJdzV1SnRzWjNkNTFlUVRnb3A1dXU5c1ZMQTRv0gHUAUFVX3lxTE42am9oVUZfaVBIazFZZUl6eW9mSVpQekdnblVjNG84OGpQZmpvR296bm4yZ01wejd2S3k5eTJKajBGWkFXVmN0TndnTl9XeDdvNVJRWnZLMmI0MTlxWDFXYkF0RUk1bTNId2JkZ2t3WFY5QXFGR25HTlRpQmNfZC0yVU9WYXhKV1A3SGw0TjFaUktsMUdVaENHcnpBNW5RUFgyNldYVjNldDRMTk55RWpKeFFZQUd6Z2lLcUQzOXVpbmlTaXdkVDdHaFEyVjRuM1hCTktm?oc=5,Pudhari News,2026-04-23T10:36:39+05:30,mr,Maharashtra,Aurangabad,"""उष्माघात"" Maharashtra","छत्रपती संभाजीनगर : उन्हाळ्यात लहान मुलांना डिहायड्रेशन, उष्माघात (हीट स्ट्रोक), तसेच विविध संसर्गजन्य आजारांचा धोका अधिक असतो. त्यामुळे पालकांनी या दिवसांत लहान मुलांच्या आहार, पाण्याचे प्रमाण आणि दैनंदिन सवयींकडे विशेष लक्ष देणे गरजेचे असल्याचे बालरोग तज्ज्ञांनी सांगितले.
याबाबत मेडिकव्हर हॉस्पिटलमधील बालरोग तज्ज्ञ डॉ. राहुल गोसावी म्हणाले, वाढत्या उन्हाळ्याच्या पार्श्वभूमीवर लहान मुलांच्या आरोग्याची विशेष काळजी घेणे अत्यावश्यक आहे. मुलांना वारंवार पाणी व द्रवपदार्थ देणे आवश्यक आहे.
दुपारच्या कडक उन्हात (सकाळी ११ ते दुपारी ४ या वेळेत) मुलांना बाहेर जाणे टाळावे. हलके, सुती कपडे वापरावेत आणि स्वच्छतेकडे विशेष लक्ष द्यावे. उष्माघात, उलट्या, चक्कर येणे किंवा ताप यांसारखी लक्षणे दिसल्यास त्वरित डॉक्टरांचा सल्ला घ्यावा, असेही त्यांनी सांगितले.
""वाढत्या उन्हाच्या पार्श्वभूमीवर नागरिकांनी काळजी घ्यावी. लहान मुलांच्या आरोग्याची विशेष दक्षता बाळगावी,"" असे आवाहन हॉस्पिटलचे सेंटर हेड डॉ. विशाल कुटे यांनी केले.
दिवसभर पुरेसे पाणी आणि द्रवपदार्थ द्या
दुपारी बाहेर खेळणे टाळा
हलके व सैल सुती कपडे परिधान करा
ताजे फळे व घरगुती आहार द्या
स्वच्छता राखा आणि हात धुण्याची सवय लावा
मुलांना बंद गाडीत एकटे सोडू नका.",0.6833333333333333
