title,url,source,date,language,state,district,search_term,full_text,relevance_score
"Heatwave Forces Suspension Of CM’s Public Grievance Hearings On May 18, 25 - Ommcom News",https://news.google.com/rss/articles/CBMirAFBVV95cUxQbnBYalFianYwTWs1YTBqVERVUmNFYTgzMFZMMXQ3SUFJcDRJTHVpSDZnSDNGNEZSallXb1ZTRUhfdURGVklseHEydi1USGNScktGV2xOZndnTDFlRUhVblR6bXd1SEk4S3BMTmZSVVVkT2Vkc1Yyc0FpWTRrbjRPTldsY0xHNjR0VFlEeld0dE5QU1ZJS0dqSXBOUDRuQzNCZk1rZ3pmUUp6YUlo?oc=5,Ommcom News,2026-05-15T18:36:38+05:30,en,Andaman and Nicobar Islands,,"(heatwave OR ""heat wave"" OR ""severe heatwave"" OR ""extreme heat"" OR ""heat spell"" OR ""scorching heat"" OR ""blistering heat"" OR ""sweltering heat"" OR ""hot winds"" OR loo OR ""hot loo winds"" OR ""intense heat"" OR ""unbearable heat"" OR ""deadly heat"" OR heat OR ""weather forecast"" OR ""weather update"" OR ""weather alert"" OR ""IMD forecast"" OR ""IMD prediction"" OR ""IMD alert"" OR IMD OR ""rising temperatures"" OR ""temperatures expected to rise"" OR ""relief from heat"" OR ""respite from heat"" OR ""heat respite"" OR ""respite from scorching heat"") Andaman and Nicobar Islands","Bhubaneswar: The Odisha government has suspended Chief Minister Mohan Charan Majhi’s “Jan Abhiyog Sunani” (Public Grievance Hearing) programme scheduled for May 18 and May 25 in view of the prevailing heatwave conditions across the state.
According to a statement issued by the General Administration and Public Grievance Department on Friday, the public grievance hearing programme, usually conducted on Mondays, will remain closed on both dates due to the intense summer heat.
The department said the decision was taken keeping in mind the prevailing heatwave situation and public convenience.
It further stated that the date for the next “Jan Abhiyog Sunani” programme will be announced later through newspapers and other mass media platforms.
The Chief Minister’s grievance hearing programme is a key public outreach initiative through which citizens directly submit complaints and grievances to the state administration.",0.6833333333333333
"IMD monsoon update: Southwest monsoon to enter India early amid intense heatwave conditions, likely to hit by...; Check forecast here - news24online.com",https://news.google.com/rss/articles/CBMiggJBVV95cUxORXJfVllRSHg5SHVkZ1ItZXNDUUpZMGZWOG1ETE43eTZjSlVIc1Jpa05HbmpJOUhCTTExd0g3M1duVlZmaWsyRDcxOEdqZVVuRi10bGhqMGkxWUpjQjZvMjFSUFRlLXFqejdaYUFULXh4RFdHaXlGRUNaYkhvSllPRHh2UHlkYVNsb2V0a3NDRVpuMUxxZDBxcnJ0bl9rbVJEbXR6c1JKQURTcWdnTG5XUE1TXzBmaXdrSXI5MjJlWHFZR0FZMkdOTGx5UUVOR3lBb1ROd0FYVDFjazRaNTVBOUVVbkFnY1A2TE0yNktYMGlfeUY3RlBueThIUnBwSXNBcmc?oc=5,news24online.com,2026-05-15T15:47:56+05:30,en,Andaman and Nicobar Islands,,"(heatwave OR ""heat wave"" OR ""severe heatwave"" OR ""extreme heat"" OR ""heat spell"" OR ""scorching heat"" OR ""blistering heat"" OR ""sweltering heat"" OR ""hot winds"" OR loo OR ""hot loo winds"" OR ""intense heat"" OR ""unbearable heat"" OR ""deadly heat"" OR heat OR ""weather forecast"" OR ""weather update"" OR ""weather alert"" OR ""IMD forecast"" OR ""IMD prediction"" OR ""IMD alert"" OR IMD OR ""rising temperatures"" OR ""temperatures expected to rise"" OR ""relief from heat"" OR ""respite from heat"" OR ""heat respite"" OR ""respite from scorching heat"") Andaman and Nicobar Islands","IMD monsoon update: Southwest monsoon to enter India early amid intense heatwave conditions, likely to hit by…; Check forecast here
The arrival of India’s crucial southwest monsoon may come earlier than usual this year.In a press release dated May 15, the India Meteorological Department (IMD) predicted that the monsoon is likely to reach Kerala on May 26, about six days ahead of its typical onset date of June 1.
The arrival of India’s crucial southwest monsoon may come earlier than usual this year.In a press release dated May 15, the India Meteorological Department (IMD) predicted that the monsoon is likely to reach Kerala on May 26, about six days ahead of its typical onset date of June 1.
Possible Early Arrival with Margin of Error
The IMD has said the southwest monsoon may reach Kerala on May 26, which is about six days earlier than usual. However, there is a margin of error of plus or minus 4 days, so it could arrive anytime between May 22 and May 30.
Relief Amid Severe Heatwave
The announcement comes at a time when many parts of India are facing intense heat. Rajasthan’s Barmer recently recorded a high of 47.3 degree celcius on May 11, while heatwave warnings continue in states like Maharashtra, Gujarat, Madhya Pradesh, and parts of southern India.
Why Kerala’s Monsoon Matters
Kerala is the first state to receive the southwest monsoon every year. Its arrival marks the end of the hot pre-summer season and signals the start of rainfall moving north across India, usually covering the country by mid-July.
How IMD Makes the Forecast
Since 2005, the IMD has used a statistical model to predict the monsoon’s arrival in Kerala. The model studies six key factors, including wind patterns, ocean conditions, temperature changes, and radiation levels. It has been mostly accurate over the years, missing only in 2015.
Track Record and Importance
Recent years show the model has been reliable. In 2024 and 2025, the monsoon arrived close to or slightly earlier than predicted. Early arrivals in recent years suggest a trend of timely or early monsoons, which is important for farming, water supply, and daily life in India.
---Advertisement---
Live News
-
14:33 (IST) 16 May 2026
Gold price in Ahmedabad
-
13:39 (IST) 16 May 2026
Gold price in Chennai
-
12:43 (IST) 16 May 2026
Gold price in Bengaluru
SHORTS
View All Shorts
---Advertisement---",0.8500000000000001
