title,url,source,date,language,state,district,search_term,full_text,relevance_score
Heatwave clashes with turbulent thunderstorms - thehitavada.com,https://news.google.com/rss/articles/CBMimgFBVV95cUxNY2hMcW1xcnRFRThOUmFiWE8wcmJCam9pNUF6MkFoNGc3czFjR2c5ZTVJa0FJWTQ1ZG5JcE5EN3JqRHlTWVFiZnhnNVg0cmIzY2s5dV9KcTlKZUJreWloQm1zdUFHWThmdzFqOGVNdmgwYms2NVlqcUo5T09qeFZOVXZNNEpOd0NCYXAwcUkzNUVlU1dGS2ZDM3l3?oc=5,thehitavada.com,2026-05-29T12:40:40+05:30,en,Chhattisgarh,,"(heatwave OR ""heat wave"" OR ""severe heatwave"" OR ""extreme heat"" OR ""heat spell"" OR ""scorching heat"" OR ""blistering heat"" OR ""sweltering heat"" OR ""hot winds"" OR loo OR ""hot loo winds"" OR ""intense heat"" OR ""unbearable heat"" OR ""deadly heat"" OR heat OR ""weather forecast"" OR ""weather update"" OR ""weather alert"" OR ""IMD forecast"" OR ""IMD prediction"" OR ""IMD alert"" OR IMD OR ""rising temperatures"" OR ""temperatures expected to rise"" OR ""relief from heat"" OR ""respite from heat"" OR ""heat respite"" OR ""respite from scorching heat"") Chhattisgarh","Heatwave clashes with turbulent thunderstorms
| Date :29-May-2026 |
Staff Reporter :
A dramatic atmospheric showdown is unfolding across Madhya Pradesh as punishing summer heatwaves collide with sudden, volatile thunderstorms. The Meteorological Centre, Bhopal, reports a striking environmental contrast where blistering, sun-scorched afternoons are being directly disrupted by high-velocity evening winds and lightning. While the vast majority of the state continues to bake under exceptionally dry conditions, isolated pockets in the Jabalpur and Sagar divisions have broken the pattern with unexpected downpours and raging windstorms.
The State’s peak temperature reached a blinding 46.5°C at Khajuraho while Nowgong, Damoh, Malajkhand recorded 45.5°C and Datia recorded 45.7°C. Meanwhile, the high-altitude escape of Pachmarhi stood as the state’s lone cooling zone, tracking the lowest minimum temperature at a comfortable 20.0°C.
Mercury redlines beyond
seasonal norms: Daytime temperatures across the state have refused to back down, consistently redlining well above normal seasonal benchmarks. Thermometer readings pushed 1.8°C to 2.8°C higher than average across the Bhopal, Gwalior, Jabalpur, and Sagar divisions. Nighttime offers virtually no relief to citizens as minimum temperatures mirror this upward spike. Night readings stayed elevated by 1.7°C to 2.4°C across the Gwalior, Chambal, Jabalpur, Shahdol, and Sagar divisions, triggering a suffocating warm night phenomenon in Chhindwara and Guna. In Bhopal, the night-time deviation was particularly aggressive, climbing 3.1°C above normal recording 30.8°C.
The highest minimum thresholds were recorded in Raisen and Guna at 32.0°C, closely followed by Vidisha at 31.5°C.
Cyclonic Chaos: High-speed gales intercept the heat: Behind this sudden weather volatility is a network of active atmospheric systems. A western disturbance is currently lingering as an upper air cyclonic circulation over northern Pakistan, while a prominent weather trough stretches cleanly from northwest Uttar Pradesh down to coastal Andhra Pradesh. This combination has unleashed localised chaos, triggering fierce gales that clocked peak speeds of 46 km/h in Jabalpur, 43 km/h in Sagar, 37 km/h in Shahdol, and 35 km/h in Narsinghpur.
These turbulent winds brought severe thunderstorms, sharp lightning strikes, and rain to parts of Sagar, Damoh, Jabalpur, Seoni, and Shahdol. Deori measured the highest localised rainfall at 3.0 mm, followed by Jabalpur-New at 2.6 mm. Concurrently, the Northern Limit of Monsoon is maintaining a steady march, with favourable oceanic parameters indicating further advancement into the Arabian Sea and Bay of Bengal over the next 48 to 72 hours.
Capital Pulse: Bhopal’s scorching matrix: The capital city remained locked in an intense,
dry thermal pocket over the last 24 hours. Bhopal registered a maximum daytime peak of 43.8°C on Thursday, surpassing its seasonal average by 2.3°C, and a heavy night-time low of 30.8°C.
Light precipitation is expected strictly at isolated places covering the northern, central, and south-eastern belts—including districts like Neemuch, Mandsaur, Guna, Sagar, Damoh, Chhindwara, Seoni, Balaghat, Mandla, Dindori, Anuppur, Satna, Panna, Rewa, Mauganj, Sidhi, Singrauli, Shivpuri, Sheopur, Morena, Bhind, Gwalior, Datia, Tikamgarh, and Niwari. In stark contrast, a vast portion of western and south-central Madhya Pradesh, including Bhopal, Indore, Ujjain, and Jabalpur, is slated to remain completely dry. Simultaneously, the department has issued widespread alerts due to an overlapping threat of a heatwave, thunderstorms, lightning, and high-speed gusty winds measuring up to 40-50 KMPH. An orange alert advisory spans across northern districts such as Sheopur, Morena, Bhind, Gwalior, Datia, and Niwari, stretching down to central and southeastern pockets including Chhatarpur, Chhindwara, Seoni and Balaghat.",1.0
Chhattisgarh Weather Update: छत्तीसगढ़ में हीटवेव का ऑरेंज और येलो अलर्ट; जानें आपके शहर का तापमान - Rashtriya Khabar,https://news.google.com/rss/articles/CBMiS0FVX3lxTE4tc3RoaDdxMFc2bW5ZWE1Ud1VST05fSWdURW84MUlxd1BPYVQ4UmVMVkxVR1ZGMHdjWFFvQy04T3ZjSTAxRHN6WEJrTQ?oc=5,Rashtriya Khabar,2026-05-29T17:17:16+05:30,hi,Chhattisgarh,,"(""हीट एक्शन प्लान"" OR ""गर्मी से राहत"" OR चेतावनी OR ""रेड अलर्ट"" OR ""ऑरेंज अलर्ट"" OR ""येलो अलर्ट"" OR एडवाइजरी OR ""राहत सामग्री"" OR ""राहत शिविर"" OR मुआवजा) Chhattisgarh","रायपुर: छत्तीसगढ़ में भीषण गर्मी और लू (Heatwave) का दौर जारी है। मौसम विभाग ने अगले 24 घंटों के लिए प्रदेश के कई जिलों में ऑरेंज और येलो अलर्ट जारी किया है। गुरुवार को रायपुर के माना (Mana) में अधिकतम तापमान 44.4 डिग्री सेल्सियस दर्ज किया गया, जो प्रदेश में सबसे अधिक रहा। अन्य जिलों में भी पारा 40 से 43 डिग्री के बीच बना हुआ है।
⚠️ ऑरेंज और येलो अलर्ट वाले जिले
मौसम विभाग के वैज्ञानिक एसके अवस्थी के अनुसार, तापमान सामान्य से 2 से 3 डिग्री अधिक बना हुआ है।
-
ऑरेंज अलर्ट: बिलासपुर और मुंगेली जिले के कुछ इलाकों में लू चलने की प्रबल आशंका है।
-
येलो अलर्ट: दुर्ग, बालोद, खैरागढ़-छुईखदान-गंडई, राजनांदगांव और मानपुर-मोहला-अंबागढ़ चौकी जिलों में ग्रीष्म लहर की स्थिति बनी हुई है।
🌡️ गुरुवार का अधिकतम तापमान (डिग्री सेल्सियस में)
🌦️ राहत की खबर: 3 दिन बाद हो सकती है बारिश
गर्मी से परेशान लोगों के लिए एक राहत भरी खबर है। हालांकि अगले 24 घंटों तक तापमान में कोई बड़ा बदलाव नहीं दिखेगा, लेकिन मौसम विभाग का अनुमान है कि तीन दिनों के बाद अधिकतम तापमान में 2 से 4 डिग्री तक की गिरावट आ सकती है।
मौसम के जानकारों के अनुसार, उत्तरी झारखंड में बने साइक्लोनिक सर्कुलेशन और द्रोणिका (Trough) के प्रभाव से प्रदेश के कुछ हिस्सों में मेघ गर्जन के साथ हल्की से मध्यम बारिश हो सकती है। इसके साथ ही कहीं-कहीं ओलावृष्टि, तेज हवाएं चलने और आकाशीय बिजली गिरने की भी चेतावनी दी गई है।
सावधानी: लू से बचने के लिए दोपहर में घर से बाहर निकलने से बचें, अधिक से अधिक पानी पिएं और खुद को धूप से सुरक्षित रखें।",1.0
Chhattisgarh Weather: कब मिलेगा भीषण गर्मी से राहत? छत्तीसगढ़ मानसून पर आया नया अपडेट | News Track in... - newstrack.com,https://news.google.com/rss/articles/CBMiuwFBVV95cUxPaWJDV3ZjcmgxUzAxbEJvM0dvRzhlUlVUcTdNZFQ5bTYtQXlFN2h6UUtMN3dJdGtSbW1UZ05ha293cHZfNEt6ekduRlBIc1FGV1p4X2ZzakpJSnZWNVQ2RUZQZzVoWm9rR3R2ZF9pb2gyMTJCb2pMQWtPaDdxZzBCV1JDa3JSU2NselBONWEwMDBpQnVxWW1OUEFwQVMyTTJ1YXZUWElpVURoMkdZYnBEVDNOcVZkdGozU3lJ0gHAAUFVX3lxTE1pekZTaEI0alJNdGZLdW5YRTFLdm5wdjFoZkhyOWVXRDJESjBRekNsSzNfZ1gyTVRXM293YlRhQWNnc3BpY2JSMjJYeFhBcWd5ZDFRODkxb0RuWWIxZ0J3R2lldW1KREJpejc4MzlTMEJlUktqR0Z1Z2wtQ2xuMHk1S2ZoSnVvamQ3ci16Qm9oWlFhVzJmbHdjdC1HcWE0R21Ddzg5YVhULXFkU0dHc1ZBYkpUVzl3aVc3a1J6WUlpVQ?oc=5,newstrack.com,2026-05-29T12:36:02+05:30,hi,Chhattisgarh,,"(""हीट एक्शन प्लान"" OR ""गर्मी से राहत"" OR चेतावनी OR ""रेड अलर्ट"" OR ""ऑरेंज अलर्ट"" OR ""येलो अलर्ट"" OR एडवाइजरी OR ""राहत सामग्री"" OR ""राहत शिविर"" OR मुआवजा) Chhattisgarh","TRENDING TAGS :
Chhattisgarh Weather: कब मिलेगा भीषण गर्मी से राहत? छत्तीसगढ़ मानसून पर आया नया अपडेट
Chhattisgarh Weather: छत्तीसगढ़ में भीषण गर्मी और लू का असर जारी है। तापमान 45 डिग्री पार है, जबकि मौसम विभाग ने आंधी-बारिश और मानसून का अपडेट दिया है।
Chhattisgarh Weather: छत्तीसगढ़ इन दिनों भीषण गर्मी और तेज लू की चपेट में है। राज्य के कई जिलों में तापमान 45 डिग्री सेल्सियस के पार पहुंच चुका है, जिससे जनजीवन प्रभावित हो रहा है। लगातार बढ़ते तापमान के कारण लोग घरों में रहने को मजबूर हैं और सभी को अब मानसून का बेसब्री से इंतजार है। राज्य में नौतपा का असर भी जारी है, जो 2 जून तक रहने की संभावना है।
नौतपा के बीच मौसम में हल्का बदलाव (Chhattisgarh Heatwave)
नौतपा के दौरान जहां एक ओर गर्मी अपने चरम पर है, वहीं दूसरी ओर कुछ इलाकों में मौसम ने अचानक करवट ली है। पिछले कुछ दिनों में सूरजपुर और अंबिकापुर जैसे क्षेत्रों में तेज हवाओं के साथ बारिश दर्ज की गई है। इसके अलावा रायगढ़ और सुकमा में भी आंधी-तूफान की स्थिति देखने को मिली, जिससे लोगों को कुछ हद तक गर्मी से राहत मिली।
मौसम विभाग के अनुसार अगले दो दिनों तक राज्य के कई जिलों में आंधी और बारिश का अलर्ट जारी किया गया है। इस दौरान हवाओं की रफ्तार 60 किलोमीटर प्रति घंटे तक पहुंच सकती है। रायपुर में भी धूल भरी आंधी चलने की संभावना जताई गई है, जिससे तापमान में मामूली गिरावट आ सकती है।
लू से झुलस रहा है छत्तीसगढ़ (Chhattisgarh Weather Update)
फिलहाल राज्य के अधिकांश हिस्सों में लू का प्रभाव बना हुआ है। कई जिलों में तापमान 40 से 47 डिग्री सेल्सियस के बीच दर्ज किया जा रहा है। तेज धूप और गर्म हवाओं के कारण दिन के समय बाहर निकलना मुश्किल हो गया है। मौसम विभाग ने एक जून तक कुछ स्थानों पर हल्की बारिश की संभावना जताई है, लेकिन इससे गर्मी में बड़ी राहत मिलने की उम्मीद नहीं है।
कब पहुंचेगा मानसून? (Chhattisgarh Monsoon)
छत्तीसगढ़ के लोगों के लिए राहत की सबसे बड़ी उम्मीद अब मानसून है। भारत में मानसून की शुरुआत आमतौर पर केरल से होती है, जहां इसकी सामान्य तिथि 1 जून मानी जाती है। केरल में मानसून पहुंचने के लगभग 8 से 10 दिन बाद छत्तीसगढ़ में इसका आगमन होता है। मौसम विभाग के अनुसार, राज्य में मानसून के पहुंचने की सामान्य तिथि 12 जून है। यदि मौसम की परिस्थितियां अनुकूल रहीं तो मानसून समय पर या उससे थोड़ा पहले भी पहुंच सकता है। हालांकि, इसमें 5 से 7 दिनों की देरी की संभावना भी बनी रहती है।
लोगों को राहत का इंतजार
लगातार बढ़ती गर्मी और लू ने आम लोगों की परेशानी बढ़ा दी है। ग्रामीण और शहरी दोनों क्षेत्रों में दिन के समय गतिविधियां प्रभावित हो रही हैं। ऐसे में सभी की नजर अब मानसून पर टिकी है, जिससे तापमान में गिरावट और मौसम में ठंडक आने की उम्मीद है। मौसम विशेषज्ञों का कहना है कि जब तक मानसून राज्य में प्रवेश नहीं करता, तब तक गर्मी और लू से पूरी तरह राहत मिलना मुश्किल है। इसलिए लोगों को फिलहाल सावधानी बरतने और गर्मी से बचाव के उपाय अपनाने की सलाह दी गई है।",1.0
