title,url,source,date,language,state,district,search_term,full_text,relevance_score
"पटना के फुलवारी शरीफ में लू से संदिग्ध मौत, सड़क किनारे मिला 25 वर्षीय युवक का शव - Prabhat Khabar",https://news.google.com/rss/articles/CBMiwwFBVV95cUxPUUd4bFNCX3NtZkFtS3RzQjNNSE1GTmc4MlBPUWRzai1HbDMwdFhNYWFKVHNuZEpwaHZrVlRhNFhKRzNQOVhvbjZxYmR4RVAzUDJMUzl3aHhaelpvZ1BZWkhJS2tWLWtfU243T3IxMjI1M05vNTdZUnlMNUVzc0dlOExmZUY4bWxwV1hfVXlwcFY0MFB3NktxV2UwdUdEa0JYbUk1MkJQenJFelM0UnNXOUlJZmV3V2p6dWRoX2x2OEw2LWvSAcMBQVVfeXFMT1FHeGxTQl9zbWZBbUt0c0IzTUhNRk5nODJQT1Fkc2otR2wzMHRYTWFhSlRzbmRKcGh2a1ZUYTRYSkczUDlYb242cWJkeEVQM1AyTFM5d2h4Wnpab2dQWVpISUtrVi1rX1NuN09yMTIyNTNObzU3WVJ5TDVFc3NHZThMZmVGOG1scFdYX1V5cHBWNDBQdzZLcVdlMHVHRGtCWG1JNTJCUHpyRXpTNFJzVzlJSWZld1dqenVkaF9sdjhMNi1r?oc=5,Prabhat Khabar,2026-06-04T08:43:52+05:30,hi,Bihar,Patna,"""लू"" Bihar","Patna News (Phulwari Sharif): पटना के फुलवारी शरीफ थाना क्षेत्र के आलमीजान नगर के पास भीषण गर्मी के बीच एक अज्ञात युवक की संदिग्ध परिस्थितियों में मौत हो गई. युवक का शव सड़क किनारे मिलने से इलाके में हड़कंप मच गया.
सड़क किनारे बेसुध मिला युवक
स्थानीय लोगों के अनुसार दोपहर में एक युवक को सड़क किनारे बेसुध हालत में देखा गया था. देर शाम तक वह वहीं पड़ा रहा, जिसके बाद पुलिस को सूचना दी गई.
मौके पर पहुंची पुलिस, शव को भेजा पोस्टमार्टम
सूचना मिलने पर पुलिस मौके पर पहुंची और शव को कब्जे में लेकर पोस्टमार्टम के लिए भेज दिया. मृतक के पास से कोई पहचान पत्र नहीं मिला, जिससे उसकी पहचान नहीं हो सकी है.
लू लगने से मौत की आशंका
पुलिस के अनुसार प्रथम दृष्टया मौत का कारण भीषण गर्मी और लू लगना माना जा रहा है. हालांकि वास्तविक कारण पोस्टमार्टम रिपोर्ट आने के बाद स्पष्ट होगा.
पहचान में जुटी पुलिस, इलाके में हड़कंप
मृतक की उम्र लगभग 25 वर्ष बताई जा रही है. पुलिस उसकी पहचान करने में जुटी है. घटना के बाद पूरे इलाके में दहशत और हड़कंप का माहौल बना हुआ है.",1.0
Patna residents consume sattu as temperatures rise above 45 degrees Celsius in Bihar heatwave - The News Mill,https://news.google.com/rss/articles/CBMixAFBVV95cUxPZXJ6T1NnbWl5aW9KdzBURGZVdS1xSkRDTndHeEVNQzgyWXJla1ZRS21PTFB5eXBUT0pCMEVFM1hSd2xyaW4xNXBYQWZQSGpJUWJQcjN0a2V5M2R0SUtGQ0hjTEp4ajlzOUN6SWZuMHJFYTR6WkVubTRGY1lvSlV4eDhFR0c5Wlp0cld1bmFXODJDdWFvUTlyNHNGVjlSRGx5dGJGVzZKblJIUEZ0eHZQUll6d3NFOHN6c1lCcVhrYkRtdFVt?oc=5,The News Mill,2026-06-04T03:52:11+05:30,en,Bihar,Patna,"""heatwave"" Bihar","As a severe heatwave continues to affect Bihar, residents of Patna are turning to the traditional summer drink ‘Sattu’ to combat the high temperatures, with mercury levels consistently around 45 degrees Celsius in the state capital.
While many opt for expensive soft drinks and packaged beverages during the summer, Sattu—made primarily from roasted gram flour—has become a preferred and affordable choice for cooling down and restoring energy amid the intense heat. Stalls selling Sattu in Patna are experiencing large crowds as locals seek relief.
Residents noted that it is essential to consume cooling drinks that help the body cope with extreme weather. They added that Sattu not only cools the stomach but also provides the stamina needed for outdoor activities in the blazing sun.
Speaking to ANI, Sattu vendor Sudheer Kumar said, “Not less than 5,00 customers come here per day, even though today is Sunday. If it were Monday, it would be even more. The benefit of drinking Sattu is that it keeps the stomach cool and gives some energy. It has a high lemon content. Customers are here from morning till evening. It has reached 40-45 degrees. People’s feedback is that they are getting relief after drinking it. Come to Biscomaun and drink Sattu; we are providing it for only 15 rupees a glass with RO water. This stall is famous by the name of Bhola ji. I am his son. My name is Sudheer Kumar.”
Local resident Munna Sharma described Sattu as highly beneficial during extreme weather. He said, “It’s very necessary for the body; it works like glucose. The heat is increasing so much; everyone should drink it. The body will remain healthy, and the stomach will remain cool. Many people faint due to the heat, so one should keep drinking watery substances.”
Another customer, Raja, urged people to avoid unnecessary travel during the heatwave. He said, “The heat is so much; it’s 45 degrees in Patna right now. One should go outside only if necessary. Sattu is very beneficial because it increases the water level in the body and gives relief from the heat.”",1.0
