title,url,source,date,language,state,district,search_term,full_text,relevance_score
Odisha to Install Four More Doppler Radars Soon: Minister,https://www.outlookindia.com/national/odisha-to-install-four-more-doppler-radars-soon-minister-2,Outlook India,2026-07-03T14:58:53+05:30,en,Odisha,Balasore,"(heatwave OR ""heat wave"" OR ""severe heatwave"" OR ""extreme heat"" OR ""heat spell"" OR ""scorching heat"" OR ""blistering heat"" OR ""sweltering heat"" OR ""hot winds"" OR loo OR ""hot loo winds"") Odisha","The Odisha government has decided to install four more Doppler radars in the state soon, a minister said.
Doopler radars will help in the forecast of natural calamities like cyclones, floods, and rainfall, the minister said.
The decision to install the radars was taken at a high-level review meeting presided over by Odisha Revenue and Disaster Management minister Suresh Pujari on Thursday.
Pujari said the new Doppler radars will soon be commissioned at Bhubaneswar, Sambalpur, Puri and Paradip. The state presently has two active Doppler radars at Paradip and Gopalpur.
""The installation of the Doppler Weather Radar at Sambalpur is nearly complete and will be inaugurated shortly,"" the minister said, adding that similar facility at Balasore, Bhubaneswar, and Puri are to be commissioned within the current year.
Doppler radar is a scientific equipment that tracks the frequency of reflected radio wave changes and facilitates meteorologists to map wind speeds, track storms, and predict severe weather like cyclones and heavy rain.
Pujari directed all concerned departments to expedite the implementation of projects under the State Disaster Mitigation Fund (SDMF) and National Disaster Mitigation Fund (NDMF), ensuring their completion well before the stipulated timelines.
While reviewing the progress of the construction of Multipurpose Flood and Cyclone Centres, the minister instructed the concerned departments to identify the proposed sites in various districts at the earliest, ensure effective inter-departmental coordination, and expedite the construction of these centres.
The minister also directed departments that the proposed heatwave centres in the identified vulnerable districts be completed and made operational before the onset of the next summer season.
The meeting also reviewed the state's preparedness in view of the potential impact of El Niño. It was decided that close coordination would be maintained with the Water Resources Department to ensure optimum utilisation of reservoirs, irrigation projects and water storage facilities for irrigation purposes, an official statement said.
The meeting was attended by senior state government officials and IMD.",0.4833333333333333
