title,url,source,date,language,state,district,search_term,full_text,relevance_score
Sunsites community faces water outage amid record heat wave - KVOA,https://news.google.com/rss/articles/CBMi4AFBVV95cUxQcWRPc3JVdDNvUVViYXo0dXhLcjVwZURJVkRCOG93XzQ4azFYVVBtY0M4aUlpOEN4bm9yYVpEYW4xTWE0U1k2Vjd4azJRTDB2bGdYRmpuc09nalZzUDZxZER5UlBJWEN1NFhKdjVxTnZJbmtSLXFXQ0phdE5KNU9yYWJQaGlGNWhPTFZuSHFGbTRMTnVocVozSmVfckQ5cFNWVUZ5SVkteXctSnEwOTF6OEh4WEwwQzBYczJTQ19jSXBzWENvZkF2LWgyaEJEak1kcnB6QXhNWjI2NlpsUGZ1cw?oc=5,KVOA,2026-03-22T01:59:00+05:30,en,Andaman and Nicobar Islands,,"(heatwave OR ""heat wave"" OR ""severe heatwave"" OR ""extreme heat"" OR ""heat spell"" OR ""scorching heat"" OR ""blistering heat"" OR ""sweltering heat"" OR ""hot winds"" OR loo OR ""hot loo winds"" OR ""intense heat"" OR ""unbearable heat"" OR ""deadly heat"" OR heat OR ""weather forecast"" OR ""weather update"" OR ""weather alert"" OR ""IMD forecast"" OR ""IMD prediction"" OR ""IMD alert"" OR IMD OR ""rising temperatures"" OR ""temperatures expected to rise"" OR ""relief from heat"" OR ""respite from heat"" OR ""heat respite"" OR ""respite from scorching heat"") Andaman and Nicobar Islands","SUNSITES, Ariz. (KVOA) - Amid the intense heat, residents in Sunsites, a community in Cochise County, faced a water shortage for several hours.
Customers of Hope Water Company experienced an outage that began last night and continued into Friday.
Sulphur Springs Electric Cooperative stepped in to assist by delivering cases of water to the Sunsites Community Center.
The community center, located at 1216 Treasure Road in Pearce, is currently serving as a cooling center and a place where residents can pick up bottled water.
Efforts are underway by the water company to restore basic water service by getting backfill water up and running.",0.8500000000000001
