title,url,source,date,language,state,district,search_term,full_text,relevance_score
"Rain, Hail & Dust Storm Alert Across Rajasthan; Heatwave Triggers Scooter Fire in Kota, Phalodi Hottest - Connect Gujarat",https://news.google.com/rss/articles/CBMi1gFBVV95cUxOLVJzLUpzYzMzalA3QnI5Tjdwb3ZDNlNfaE9oTW9tYkw0MHdaaEhDQUVkMnJMdXg0VmE3TUl0TXlNX2Rxa0NHSG9aXzNDd1BhQ3VtZk5sV2xydkI5dlVqQkMydVNsSlJqQUlOcWZFMHhySmpZVU10RlpLLWlhMjllVWpIMWEzZ1ZJcEJ4SDR5dkNOdnZRenl3Ym8wSklocTZUb3BneE9xdmlLRlJTVWkwTGdlUklSM3BrcW5yTm5lNnlMQzBLclNBblM1UTZTNjBOMHFsWHh3?oc=5,Connect Gujarat,2026-04-29T15:29:16+05:30,en,Rajasthan,Alwar,"""heatwave"" Rajasthan","Rajasthan Weather Alert: Rain, Hail & Dust Storms | Heat Triggers Scooter Fire in Kota
Rajasthan witnessed a sudden change in weather due to an active Western Disturbance, bringing rain, hail, and dust storm alerts across 15 districts.
Light showers and gusty winds were reported in Jaipur, while Dausa experienced hailstones, and Alwar saw intermittent rainfall since morning. The shift in weather led to a drop of up to 5°C in several regions, including Jaisalmer and Nagaur, offering temporary relief from the ongoing heatwave.
However, extreme temperatures continued to pose risks, as a scooter caught fire in Kota due to intense heat. Phalodi recorded the highest temperature in the last 24 hours.
The meteorological department has issued a yellow alert for strong sunshine, afternoon dust storms, and light rain in parts of the state over the next few days. While some regions may see slight temperature drops, heatwave conditions are expected to persist in southwestern Rajasthan, especially in early May, alongside ongoing thunderstorms and wind activity.",1.0
