title,url,source,date,language,state,district,search_term,full_text,relevance_score
"West Bengal Weather Update: আজই ভ্যাপসা গরম থেকে মুক্তি দেবে ঝড়বৃষ্টি, কোন কোন জেলা ভিজবে? আবহাওয়ার আপডেট - AajTak Bangla",https://news.google.com/rss/articles/CBMi3gFBVV95cUxNMlFZUF9qUlNRcWJJRmM3cnd0amV0X0drZ29sRnZoTkYxY2pvSThWcThmank5RG11a1JicllMQlZKSExlR1d5MURER21KOVc5YXkxT0VsOG8zTkRSSi1pOU40MjRHRkJuMjdIeHJmaVptbWpDcTZndGIxSTJTRUdlTXBIV3IxeXNVTlJXTHZJUENBSEU2QXNEQk05X24zTjVTc3MyUnpGY0pscFhPSm9ya002RzVGZE55VDMteTJyUUp6UGpWeC1xQzgyUW82VlFWbXhsWFFlQUNwbnQzVUHSAeMBQVVfeXFMUGFNel8wSXYzalN0M2NWbDVfbEM2ejBSN21XemJCdF9BMTMwWUF5Vk9UWExoLV9HWkJ6RTlUbnZwWmtuTFk5MnJBRTYtZnFub0Njeno2SkVtSDNoQzRuQWowQmkwR3JCa1BSLWlKSnVzd0FKM1liZ2JEZEhlUjRRYjZMMjhZV2NDS1M3dGdpdkRUNk1Pd19jbldVZGI0YW9WY3VlMnM1WGkyWENuTTE2YWk3N195akwya3FULWpDMDhjQXBWbWdfMzlDNGoxdGx0Q0d2WDJ6RE4teXFUeFRabVBsSVk?oc=5,AajTak Bangla,2026-06-04T07:27:55+05:30,bn,West Bengal,Kolkata,"(দাবদাহ OR তাপপ্রবাহ OR ""প্রচণ্ড গরম"" OR ""তীব্র গরম"" OR ""ঝলসানো গরম"" OR ""লু হাওয়া"" OR ""গরমের দাপট"" OR দাবানল OR ""অসহ্য গরম"" OR ""হিট ওয়েভ"" OR ""অত্যধিক গরম"" OR ""ভয়াবহ গরম"") West Bengal","সকাল থেকেই ভ্যাপসা গরম। একটু হাঁটাচলা করলেই অস্বস্তি চরমে উঠছে। ঘেমে যাচ্ছে শরীর। এমন পরিস্থিতিতে অনেকেই চাতকের মতো চেয়ে রয়েছেন বৃষ্টির দিকে। আর সেই বিষয়েই ভাল খবর দিয়েছে আবহাওয়া দফতর। তাঁদের দাবি, আজ কলকাতা এবং পার্শ্ববর্তী অঞ্চলে বৃষ্টিপাতের একটা সম্ভাবনা রয়েছে। পাশাপাশি বজ্রবিদ্যুৎ সহ ঝোড়ো হাওয়া বয়ে যাওয়ার পূর্বাভাসও রয়েছে।
কেমন থাকবে আবহাওয়া?
আজ কলকাতা এবং পার্শ্ববর্তী অঞ্চলে আকাশ মেঘলা থাকার সম্ভাবনা প্রবল। তবে দিনে কিছু সময় রোদও দেখা যেতে পারে। পাশাপাশি বৃষ্টিপাতের একটা সম্ভাবনা রয়েছে। সেই সঙ্গে বজ্রবিদ্যুতের দাপট থাকতে পারে। এছাড়া বয়ে যেতে পারে ঝোড়ো হাওয়া।
যদিও কলকাতার সর্বোচ্চ তাপমাত্রা আজও অনেকটাই বেশির দিকে থাকতে পারে। বৃহস্পতিবার রাজ্যের রাজধানীর সর্বোচ্চ তাপমাত্রা পৌঁছে যেতে পারে ৩৬ ডিগ্রি সেলসিয়াসের কাছাকাছি। আর সর্বনিম্ন হতে পারে ২৮ ডিগ্রির কাছাকাছি। তাই ঝড়বৃষ্টি যতই হোক না কেন, গরম যে আজ থাকবে, এই কথা তো বলাই বাহুল্য।
দক্ষিণবঙ্গের কী খবর?
আবহাওয়া দফতর জানিয়েছে, দক্ষিণবঙ্গের বিস্তীর্ণ এলাকায় বর্তমানে মৌসুমি আবহাওয়ার পূর্বাভাস স্পষ্ট। গাঙ্গেয় পশ্চিমবঙ্গের একাধিক জেলায় মেঘের আনাগোনা বাড়ছে। দিনের বিভিন্ন সময়ে স্থানীয়ভাবে বৃষ্টির পরিস্থিতি তৈরি হতে পারে। বিশেষ করে বিকেল ও সন্ধ্যার দিকে বজ্রগর্ভ মেঘ তৈরি হওয়ার অনুকূল পরিবেশ রয়েছে। যার ফলে বৃষ্টিপাত হতে পারে। তবে তার জন্য গরম খুব একটা কমবে না।
উত্তরে বৃষ্টিপাতের প্রবল সম্ভাবনা...
উত্তরবঙ্গ ও সিকিমে ৪ জুন সকাল থেকে ৫ জুন সকাল পর্যন্ত উপ-হিমালয় একটি বিশেষ সতর্কতা জারি করা হয়েছে। আর তাতেই পরিষ্কার যে উত্তরবঙ্গে বৃষ্টির সম্ভাবনা প্রবল।
এ দিন দার্জিলিং থেকে শুরু করে জলপাইগুড়ি, কালিম্পং, আলিপুরদুয়ার ও কোচবিহারে হালকা থেকে মাঝারি বৃষ্টিপাত হতে পারে। একই ধরনের আবহাওয়া থাকবে সিকিমেও। এছাড়া উত্তরবঙ্গের অন্যান্য জেলাতেও আজ বৃষ্টিপাতের প্রবল সম্ভাবনা রয়েছে।
আবহাওয়া দফতর জানিয়েছে, আজ উত্তরবঙ্গের অধিকাংশ জেলায় ৪০ থেকে ৫০ কিমি বেগে ঝোড়ো হাওয়া বয়ে যেতে পারে। পাশাপাশি ভারী বৃষ্টির সম্ভাবনা রয়েছে জলপাইগুড়ি এবং আলিপুরদুয়ারের দুই-এক জায়গায়। এই সব জায়গায় ৭ থেকে ১১ সেমি পর্যন্ত বৃষ্টি হতে পারে।
তাই এই সব জেলার অধিবাসীরা অবশ্যই সঙ্গে রাখুন ছাতা। আর যাঁরা উত্তরবঙ্গ ঘুরতে গিয়েছেন, তাঁরাও অবশ্যই ছাতা নিয়েই বেরন। নইলে অহেতুক ভিজতে হবে।",1.0
