title,url,source,date,language,state,district,search_term,full_text,relevance_score
"दिल्ली में फिलहाल भीषण गर्मी से राहत, तापमान सामान्य से कम, इस हफ्ते कैसा रहेगा मौसम?",https://www.abplive.com/states/delhi-ncr/delhi-weather-recorded-maximum-temperature-of-37-7-degrees-celsius-imd-prediction-rainfall-3139276,ABP News,2026-06-02T22:37:07+05:30,hi,Delhi,,"(लू OR ""लू चलना"" OR ""भीषण गर्मी"" OR ""प्रचंड गर्मी"" OR ""कड़ी धूप"" OR ""तेज धूप"" OR ""गर्म हवा"" OR ""उष्ण लहर"" OR ""ताप लहर"" OR ""हीट वेव"" OR ""झुलसाने वाली गर्मी"" OR ""तपती गर्मी"" OR ""भयंकर गर्मी"") Delhi","दिल्ली में फिलहाल भीषण गर्मी से राहत, तापमान सामान्य से कम, इस हफ्ते कैसा रहेगा मौसम?
Delhi Weather Today: दिल्ली के बेस स्टेशन सफदरजंग में मंगलवार को अधिकतम तापमान 37.7 डिग्री सेल्सियस और न्यूनतम तापमान 26.8 डिग्री सेल्सियस दर्ज किया गया.
राष्ट्रीय राजधानी का मौसम मंगलवार (02 जून) को सुहावना बना रहा. भीषण गर्मी से लोगों को राहत रही. दिल्ली में अधिकतम तापमान 37.7 डिग्री सेल्सियस दर्ज किया गया, जो सामान्य से 2.3 डिग्री कम था. भारतीय मौसम विज्ञान विभाग (आईएमडी) के अनुसार, सभी निगरानी केंद्रों पर तापमान सामान्य से कम रहा. बुधवार को बादल छाए रहने की संभावना जताई गई है.
बेस स्टेशन सफदरजंग में अधिकतम तापमान 37.7 डिग्री सेल्सियस और न्यूनतम तापमान 26.8 डिग्री सेल्सियस दर्ज किया गया. पालम में अधिकतम तापमान 35.9 डिग्री सेल्सियस, लोधी रोड पर 36 डिग्री, रिज पर 37.2 डिग्री और आयानगर में 36.1 डिग्री सेल्सियस रहा, जो इस मौसम के सामान्य तापमान से 2.5 से 5 डिग्री कम था.
दिल्ली में किसी भी प्रमुख स्टेशन पर बारिश दर्ज नहीं की गई
इन चारों स्टेशनों पर न्यूनतम तापमान 24 से 25.7 डिग्री सेल्सियस के बीच रहा, जो मौसमी सामान्य से थोड़ा कम था. आंकड़ों के अनुसार, मंगलवार को किसी भी प्रमुख स्टेशन पर बारिश दर्ज नहीं की गई. मौसम वैज्ञानिकों का कहना है कि आने वाले सप्ताह में मौसम अनुकूल रहने की संभावना है, जिससे जून के पहले सप्ताह में लू चलने की आशंका कम हो जाएगी.
दिल्ली में 3 जून को कैसा रहेगा मौसम?
भारतीय मौसम विज्ञान विभाग ने दिल्ली में बुधवार (03 जून) के लिए मौसम की भविष्वाणी की है. आईएमडी के मुताबिक राष्ट्रीय राजधानी में आंशिक रूप से बादल छाए रहने और कुछ जगहों पर गरज के साथ हल्की बारिश की संभावना जताई गई है. अधिकतम और न्यूनतम तापमान क्रमशः 38 डिग्री सेल्सियस और 27 डिग्री सेल्सियस के आसपास रहने की संभावना है.
दिल्ली में क्या रहा AQI का स्तर?
केंद्रीय प्रदूषण नियंत्रण बोर्ड (सीपीसीबी) के आंकड़ों के अनुसार, मंगलवार को शाम 4 बजे दिल्ली की वायु गुणवत्ता 106 के साथ 'मध्यम' बनी रही. सीपीसीबी 0 से 50 के बीच AQI को 'अच्छा', 51 से 100 को 'संतोषजनक', 101 से 200 को 'मध्यम', 201 से 300 को 'खराब', 301 से 400 को 'अत्यंत खराब' और 401 से 500 को 'गंभीर' श्रेणी में रखता है.
Source: IOCL",1.0
"Delhi Heatwave Alert: राजधानी दिल्ली में हीट एक्शन प्लान लागू, सरकार ने 4.7 लाख लोगों तक पहुंचाई राहत सामग्री",https://navbharatlive.com/delhi/delhi-governments-heat-relief-drive-reaches-over-470000-people-amid-heatwave-1771786.html,Navabharat,2026-06-02T21:03:42+05:30,hi,Delhi,,"(लू OR ""लू चलना"" OR ""भीषण गर्मी"" OR ""प्रचंड गर्मी"" OR ""कड़ी धूप"" OR ""तेज धूप"" OR ""गर्म हवा"" OR ""उष्ण लहर"" OR ""ताप लहर"" OR ""हीट वेव"" OR ""झुलसाने वाली गर्मी"" OR ""तपती गर्मी"" OR ""भयंकर गर्मी"") Delhi","- Delhi Governments Heat Relief Drive Reaches Over 470000 People Amid Heatwave
Delhi Heatwave Alert: राजधानी दिल्ली में हीट एक्शन प्लान लागू, सरकार ने 4.7 लाख लोगों तक पहुंचाई राहत सामग्री
Delhi Heatwave Alert: दिल्ली की मुख्यमंत्री रेखा गुप्ता ने अत्यधिक गर्मी में अनावश्यक रूप से घर से बाहर ना निकलने की अपील करते हुए जानकारी दी है कि अब तक 4.7 लाख लोगों तक राहत सामग्री पहुंचाई गई है।
Delhi Government Action On Delhi Heatwave: जहां एक तरफ भीषण गर्मी और लू से उत्तर भारत समेत कई राज्यों के लोग झुलस रहे हैं। तो वहीं राजधानी दिल्ली की मुख्यमंत्री रेखा गुप्ता ने दिल्लीवासियों से अपील करते हुए कहा कि अनावश्यक घर से बाहर ना निकले, पर्याप्त मात्रा में पानी पीते रहें, ORS का उपयोग करें और हीट वेव से बचाव के लिए सभी सावधानियों का पालन करें। साथ ही सीएम रेखा ने भीषण गर्मी और हीट वेव के दौरान नागरिकों को सुरक्षित रखने के लिए दिल्ली सरकार द्वारा राजधानी के सभी 13 जिलों में व्यापक राहत अभियान के बारें में जानकारी सांझा की।
मोबाइल हीट रिलीफ यूनिट, कूलिंग जोन और अस्थायी शेड स्थापित
मुख्यमंत्री रेखा गुप्ता ने बताया कि भीषण गर्मी और हीट वेव से राहत के लिए चलाए गए अभियान के अंतर्गत मोबाइल हीट रिलीफ यूनिट बनाए गए। साथ ही कूलिंग जोन और अस्थायी शेड स्थापित कर लोगों को पीने का पानी, ओआरएस, गमछे और अन्य आवश्यक सुविधाएं उपलब्ध कराई जा रही हैं।
सीएम रेखा ने बताया कि 6 मई से संचालित मोबाइल हीट रिलीफ यूनिटों के माध्यम से अब तक दिल्ली में 4,70,089 लोगों तक राहत पहुंचाई गई है। जिसमें 1,84,021 लीटर पेयजल वितरण, 2,43,945 ओआरएस पैकेट, 67,431 गमछे और 49,434 कैप लोगों को उपलब्ध कराई गई।
सम्बंधित ख़बरें
मोबाइल हीट रिलीफ यूनिट ने पहुंचाई राहत
मुख्यमंत्री रेखा गुप्ता ने बताया कि मोबाइल हीट रिलीफ यूनिटों के माध्यम से उत्तर-पूर्व दिल्ली में 83,703 लोगों को लाभ मिला है। इसके अलावा पूर्वी जिले में 66,964, नई दिल्ली में 41,667, सेंट्रल नॉर्थ में 41,600, पश्चिम जिले में 39,875, दक्षिण जिले में 37,870, दक्षिण-पश्चिम जिले में 30,915, दक्षिण-पूर्व जिले में 26,695, मध्य जिले में 24,890, बाहरी उत्तर जिले में 21,900, पुरानी दिल्ली में 19,405, उत्तर-पश्चिम जिले में 18,385 तथा उत्तर जिले में 16,220 लोगों को राहत पहुंचाई गई है। नई दिल्ली जिले में 32,974.3 लीटर पीने का पानी वितरण किया गया, जबकि सेंट्रल नॉर्थ जिले में 71,625 ओआरएस पैकेट बांटे गए। दक्षिण जिले की जनता को 7,860 गमछे और 5,240 कैप वितरण किए गए।

मुख्यमंत्री रेखा ने बताया कि लोगों को तेज धूप से बचाने के लिए मेट्रो स्टेशनों, बस अड्डों और प्रमुख बाजारों में अस्थायी शेड स्थापित किए जा रहे हैं। जहां अस्थायी शेड स्थापित हो चुके हैं वहां लोगों को तत्काल राहत मिल रही है। इन शेडों के माध्यम से अब तक 5,475 लोगों को लाभ मिला है। जिन्हें 2,100 लीटर पानी और 375 ओआरएस पैकेट वितरित किए गए हैं। पश्चिम जिले में 920 लोगों को लाभ मिला है तथा 340 लीटर पानी और 100 ओआरएस पैकेट बांटे गए। दक्षिण जिले में 900 लोगों को 350 लीटर पानी और 150 ओआरएस पैकेट दिया गया। उत्तर-पूर्व जिले में 120 लोग 300 लीटर पानी और 150 ओआरएस पैकेट से लाभान्वित हुए।
आवश्यकतानुसार राहत सुविधाओं का होगा विस्तार
सीएम रेखा गुप्ता ने कहा कि कुछ स्थानों पर कूलिंग जोन और अस्थायी शेड स्थापना और विस्तार का कार्य प्रगति पर है। सरकार लगातार स्थिति की जानकारी ले रही है और आवश्यकतानुसार राहत सुविधाओं का और विस्तार किया जाएगा। दिल्ली की सीएम ने कहा कि दिल्ली सरकार का संकल्प है कि भीषण गर्मी के दौरान राजधानी का कोई भी नागरिक राहत और सहायता से वंचित न रहे।",1.0
"‘हीट वेव’ पर दिल्ली सरकार का प्रहार, 4.70 लाख लोगों तक पहुंची राहत सामग्री - bhaskarhindi.com",https://news.google.com/rss/articles/CBMivwFBVV95cUxPN1J3eEI1WVJ3QmJvRTVKMW9fUzA1SHg1RWd2a2FrbWxrelhjX2taSVdzRG43N0RnVVRSaEs5N1pqUTRURHhhWVZkWkIxZ1NlWDc5a193aFh2SEdXUGpJb2prakJiTFRxTml6TXJaNUJXS3ZGVEVNRE1YTDlfc0ctR1NMU0JTaDFiQVVjYjFzbVVtSnloR09wSmdPRXY3OVJIbkVWRTV2aEl3LVpRXzE3QlRna2ljcHZuUHRaRW9IZw?oc=5,bhaskarhindi.com,2026-06-02T19:24:46+05:30,hi,Delhi,,"(""हीट एक्शन प्लान"" OR ""गर्मी से राहत"" OR चेतावनी OR ""रेड अलर्ट"" OR ""ऑरेंज अलर्ट"" OR ""येलो अलर्ट"" OR एडवाइजरी OR ""राहत सामग्री"" OR ""राहत शिविर"" OR मुआवजा) Delhi","‘हीट वेव’ पर दिल्ली सरकार का प्रहार, 4.70 लाख लोगों तक पहुंची राहत सामग्री
By - |2 Jun 2026 7:24 PM IST
दिल्ली की मुख्यमंत्री रेखा गुप्ता ने कहा कि भीषण गर्मी और हीट वेव की चुनौती से नागरिकों को सुरक्षित रखने के लिए दिल्ली सरकार द्वारा राजधानी के सभी 13 जिलों में व्यापक राहत अभियान चलाया जा रहा है। इस अभियान के अंतर्गत मोबाइल हीट रिलीफ यूनिट, कूलिंग जोन और अस्थायी शेड स्थापित कर लोगों को पीने का पानी, ओआरएस, गमछे, कैप और अन्य आवश्यक सुविधाएं उपलब्ध कराई जा रही हैं।
नई दिल्ली, 2 जून (आईएएनएस)। दिल्ली की मुख्यमंत्री रेखा गुप्ता ने कहा कि भीषण गर्मी और हीट वेव की चुनौती से नागरिकों को सुरक्षित रखने के लिए दिल्ली सरकार द्वारा राजधानी के सभी 13 जिलों में व्यापक राहत अभियान चलाया जा रहा है। इस अभियान के अंतर्गत मोबाइल हीट रिलीफ यूनिट, कूलिंग जोन और अस्थायी शेड स्थापित कर लोगों को पीने का पानी, ओआरएस, गमछे, कैप और अन्य आवश्यक सुविधाएं उपलब्ध कराई जा रही हैं।
सीएम रेखा गुप्ता ने बताया कि 6 मई से संचालित मोबाइल हीट रिलीफ यूनिटों के माध्यम से अब तक 4,70,089 लोगों को राहत पहुंचाई गई है। इस दौरान 1,84,021 लीटर पेयजल वितरित किया गया है। साथ ही 2,43,945 ओआरएस पैकेट, 67,431 गमछे और 49,434 कैप लोगों को उपलब्ध कराई गई हैं।
उन्होंने बताया कि मोबाइल हीट रिलीफ यूनिटों के माध्यम से उत्तर-पूर्व जिले में सर्वाधिक 83,703 लोगों को लाभ मिला है। इसके अलावा पूर्वी जिले में 66,964, नई दिल्ली में 41,667, सेंट्रल नॉर्थ में 41,600, पश्चिम जिले में 39,875, दक्षिण जिले में 37,870, दक्षिण-पश्चिम जिले में 30,915, दक्षिण-पूर्व जिले में 26,695, मध्य जिले में 24,890, बाहरी उत्तर जिले में 21,900, पुरानी दिल्ली में 19,405, उत्तर-पश्चिम जिले में 18,385 तथा उत्तर जिले में 16,220 लोगों को राहत प्रदान की गई है। विभिन्न जिलों में मोबाइल हीट रिलीफ यूनिटों द्वारा उल्लेखनीय कार्य किया गया है। नई दिल्ली जिले में सर्वाधिक 32,974.3 लीटर पीने का पानी वितरित किया गया है, जबकि सेंट्रल नॉर्थ जिले में सर्वाधिक 71,625 ओआरएस पैकेट वितरित किए गए हैं। दक्षिण जिले में सर्वाधिक 7,860 गमछे और 5,240 कैप वितरित की गई हैं।
मुख्यमंत्री ने कहा कि लोगों को तेज धूप से बचाने के लिए मेट्रो स्टेशनों जैसे- नांगलोई, रोहिणी, पीरागढ़ी आदि, बस अड्डों और प्रमुख बाजारों में अस्थायी शेड स्थापित किए जा रहे हैं। जहां अस्थायी शेड स्थापित हो चुके हैं वहां लोगों को तत्काल राहत मिल रही है। मध्य जिले में इन शेडों के माध्यम से अब तक 5,475 लोगों को लाभ मिला है और 2,100 लीटर पानी और 375 ओआरएस पैकेट वितरित किए गए हैं।
उन्होंने कहा कि पश्चिम जिले में 920 लोगों को लाभ मिला है तथा 340 लीटर पानी और 100 ओआरएस पैकेट वितरित किए गए हैं। दक्षिण जिले में 900 लोगों को लाभान्वित करते हुए 350 लीटर पानी और 150 ओआरएस पैकेट वितरित किए गए हैं। उत्तर-पूर्व जिले में 120 लोगों को लाभ पहुंचाते हुए 300 लीटर पानी और 150 ओआरएस पैकेट वितरित किए गए हैं।
सीएम रेखा गुप्ता ने कहा कि कुछ स्थानों पर कूलिंग जोन और अस्थायी शेड पूर्ण रूप से संचालित हो चुके हैं, जबकि कुछ स्थानों पर स्थापना और विस्तार का कार्य प्रगति पर है। सरकार लगातार स्थिति की समीक्षा कर रही है और आवश्यकता के अनुसार राहत सुविधाओं का और विस्तार किया जाएगा।
उन्होंने नागरिकों से अपील की कि वे अत्यधिक गर्मी के समय अनावश्यक रूप से घर से बाहर निकलने से बचें, पर्याप्त मात्रा में पानी पीते रहें, ओआरएस का उपयोग करें और हीट वेव से बचाव संबंधी सभी सावधानियों का पालन करें। दिल्ली सरकार का संकल्प है कि भीषण गर्मी के दौरान राजधानी का कोई भी नागरिक राहत और सहायता से वंचित न रहे।
अस्वीकरण: यह न्यूज़ ऑटो फ़ीड्स द्वारा स्वतः प्रकाशित हुई खबर है। इस न्यूज़ में BhaskarHindi.com टीम के द्वारा किसी भी तरह का कोई बदलाव या परिवर्तन (एडिटिंग) नहीं किया गया है| इस न्यूज की एवं न्यूज में उपयोग में ली गई सामग्रियों की सम्पूर्ण जवाबदारी केवल और केवल न्यूज़ एजेंसी की है एवं इस न्यूज में दी गई जानकारी का उपयोग करने से पहले संबंधित क्षेत्र के विशेषज्ञों (वकील / इंजीनियर / ज्योतिष / वास्तुशास्त्री / डॉक्टर / न्यूज़ एजेंसी / अन्य विषय एक्सपर्ट) की सलाह जरूर लें। अतः संबंधित खबर एवं उपयोग में लिए गए टेक्स्ट मैटर, फोटो, विडियो एवं ऑडिओ को लेकर BhaskarHindi.com न्यूज पोर्टल की कोई भी जिम्मेदारी नहीं है|",1.0
