title,url,source,date,language,state,district,search_term,full_text,relevance_score
"Weather Updates: उत्तर भारत में बदलेगा मौसम का मिजाज, दिल्ली-हरियाणा समेत इन राज्यों में भारी बारिश का अलर्ट, IMD ने जारी किया बड़ा अपेडट - Khabar Fast",https://news.google.com/rss/articles/CBMiugFBVV95cUxNaDVHTkJPdW1LU1NPSVFTdTVYbzAzdnNLX1ZfdjFBVGxEeE9TMnpiUlVsajByT0dndUFrZ2VtbFIwX3dQTjRhVG1iMVhoUnZTU1R4bWZIbXNmQV9pb2VIOVA0MW0wOVNYUWZ1RE8yRlhxWnBCRE5LTmtzT2tOWTFRcERVRW5jUnFtUTR3aTNfa3Fka0d2TzBmUnRLaUY4UnlaSG4wUHc1Uk51XzNBSjhjOG00NFMtX3ZXX1E?oc=5,Khabar Fast,2026-06-29T16:39:00+05:30,hi,Haryana,,"""लू"" Haryana","Weather Updates: इन दिनों राजधानी दिल्ली समेत उत्तर भारत के कई हिस्सों में सूरज आग उगल रहा है। साथ ही लू ने लोगों को जीन बेहाल कर दिया है। इसी बीच में मौसम विभाग ने एक बड़ा अपडेट देते हुए लोगों को बड़ी राहत दी है। (IMD) के अनुसार, एक नया पश्चिम विक्षोभ सक्रिय हो रहा है, जो उत्तर-पश्चिम भारत को प्रभावित करेगा। इसके साथ ही मौसम का मिजाज भी बदलेगा और बारिश की संभावना भी बढ़ेगी।
मौसम विभाग के मुताबिक, इसक असर दिल्ली, हरियाणा, पंजाब, उत्तर प्रदेश, राजस्थान, उत्तराखंड और आसपास के इलाके में देखने को मिलेगा। जिससे तापमान में गिरावट आएगी और लोगों को प्रचंड गर्मी से राहत मिलेगी। IMD के मुताबिक, 2 और 3 जुलाई को जम्मू-कश्मीर, हिमाचल प्रदेश, उत्तराखंड और हरियाणा में भारी वर्षा की संभावना जताई गई है। पश्चिमी विक्षोभ के असर से दक्षिण-पूर्वी और पूर्वी राजस्थान के कई हिस्सों में 2 जुलाई से बारिश की गतिविधियों में बढ़ोतरी होने की पूरी संभावना जताई गई है।
मौसम विभाग के अनुसार 3 से 5 जुलाई के दौरान पूर्वी राजस्थान के कुछ और हिस्सों में भी बारिश का दौर तेज हो सकता है, जहां कहीं-कहीं मध्यम से भारी बारिश होने की संभावना है। इसके साथ ही इस सप्ताह की शुरुआत में जोधपुर और बीकानेर संभाग के कुछ क्षेत्रों में अधिकतम तापमान 42 से 44 डिग्री सेल्सियस तक रहने का अनुमान है, जिससे लोगों को उमस भरी गर्मी का सामना करना पड़ेगा।

मॉनसून को लेकर बड़ा अपडेट
मॉनसून को लेकर मौलम विभाग ने अपड़ेट दिया है। IMD के मुताबिक, दक्षिण-पश्चिम मॉनसून की उत्तरी सीमा वर्तमान में गुजरात, मध्य प्रदेश, झारखंड और बिहार के कुछ हिस्सों से होकर गुजर रही है और इसके आगे बढ़ने के लिए मौसम की परिस्थितियाँ पूरी तरह अनुकूल बनी हुई हैं। अगले 2 से 3 दिनों के भीतर मॉनसून के गुजरात, मध्य प्रदेश, छत्तीसगढ़, झारखंड, बिहार, उत्तर प्रदेश और उत्तराखंड के कुछ और हिस्सों में पहुंचने की संभावना है। इसके बाद अगले 5 से 6 दिनों में इसके हिमाचल प्रदेश, जम्मू-कश्मीर, लद्दाख और दक्षिण-पूर्वी राजस्थान के शेष क्षेत्रों को भी कवर करने की उम्मीद जताई गई है, जिससे पूरे उत्तर भारत में बारिश की गतिविधियां और तेज हो सकती हैं।",1.0
"हरियाणा में भीषण गर्मी का कहर: भिवानी 45°C के साथ सबसे गर्म, कई जिलों में राहत की बारिश; 1 जुलाई से बदलेगा मौसम - lalluram.com",https://news.google.com/rss/articles/CBMizwFBVV95cUxQcHJqZkpZV21rR3l5am1MTXRfNDFrTlM0Szc2U3dnSHludXJkN0p0ZUdCeFZ2LTZJaGFqXzhhLUNIVDJydHlWMy0wWkhBWHZzMHFoUnJrNUw2WUJHVnppaWhNTm1BNkFhbWg5RlJpSTk0SDhkNWtlLWpnZkM4VF9WdWRWNkllMUtDR0NHRlRlLVNoRkotaW5DeFpvbXhQNlpXekdNQkJZZ2duMlphakxvVDNKUWxlZFFUWXFEMXZVbHd1V2FIQUx3b1Foak9tazA?oc=5,lalluram.com,2026-06-29T08:54:17+05:30,hi,Haryana,,"""लू"" Haryana","हिसार। हरियाणा में मौसम लगातार करवट ले रहा है। रविवार को प्रदेश भीषण गर्मी की चपेट में रहा, जहां राजस्थान सीमा से सटे भिवानी जिले का अधिकतम तापमान 45 डिग्री सेल्सियस दर्ज किया गया। हालांकि दोपहर बाद मौसम ने अचानक करवट ली और भिवानी, बहादुरगढ़ व रोहतक समेत कई क्षेत्रों में हल्की बारिश होने से लोगों को गर्मी से कुछ राहत मिली।
भारत मौसम विज्ञान विभाग (IMD) के अनुसार, प्रदेश में इन दिनों दक्षिण-पश्चिमी हवाओं के प्रभाव से गर्म और शुष्क हवाएं चल रही हैं, जिसके कारण तापमान में लगातार बढ़ोतरी हो रही है। भिवानी के अलावा फरीदाबाद में 44.2 डिग्री सेल्सियस तापमान दर्ज किया गया, जबकि अधिकांश जिलों का पारा 40 डिग्री के पार पहुंच गया।
कई जिलों में चली लू भरी हवाएं
दिनभर चली लू और तेज धूप के कारण लोगों को भारी परेशानी का सामना करना पड़ा। गर्मी बढ़ने के साथ ही बिजली की मांग में भी उल्लेखनीय इजाफा दर्ज किया गया। वहीं, रविवार शाम को भिवानी और महम के आसपास हुई हल्की बारिश से मौसम में कुछ ठंडक महसूस की गई।
मौसम विभाग ने रविवार शाम कुछ जिलों के लिए बारिश और तेज हवाओं का अलर्ट भी जारी किया था। हालांकि विभाग का कहना है कि आने वाले कुछ दिनों तक दक्षिण-पश्चिमी हवाओं के कारण लू चलने और तापमान में और वृद्धि की संभावना बनी रहेगी।
1 जुलाई से प्री मानसून के संकेत
मौसम वैज्ञानिकों के अनुसार 1 जुलाई के बाद मौसम में बदलाव देखने को मिल सकता है। जुलाई की शुरुआत में होने वाली बारिश प्री-मानसून गतिविधियों का हिस्सा हो सकती है। इस दौरान प्रदेश में आंशिक बादल छाने, तेज हवाएं चलने, वातावरण में नमी बढ़ने और कई स्थानों पर हल्की से मध्यम बारिश होने की संभावना जताई गई है।",1.0
"Delhi NCR Weather: दिल्ली-NCR में इस दिन से बदलेगा मौसम का मिजाज, आंधी-तूफान के साथ होगी बारिश - Zee News",https://news.google.com/rss/articles/CBMi7wFBVV95cUxPeFZWc09vbnhFeVJpRGZJaEp6d1ZaOFE3QVl0c2FJVmtxQ0JQaXBDbnRDcC1uVmJVN3hYSnl1SDV1UVpISHRTTVl2cjNMY1dCTjdtZGNOc0pvaUNSNjZJTThrSnR5a3pRT3ctdGNvVWFxWUZ5NkxEYVRMcWljM21Hc3ZBVWdxRDV1V2tPeE5kR3RnbHFhYTJSTGVtZVRJaS1yVVJJakZ5UmVMMFk4d0lBRFpDYnJ4MVFpSS1jRDhqQ3pMRnYwTW9hNDI1cHlPLXJJNUVSbnZOWG82X3lhOUtCY29nZ1dWTzQ4bkpWUWJ1QdIB7wFBVV95cUxPeFZWc09vbnhFeVJpRGZJaEp6d1ZaOFE3QVl0c2FJVmtxQ0JQaXBDbnRDcC1uVmJVN3hYSnl1SDV1UVpISHRTTVl2cjNMY1dCTjdtZGNOc0pvaUNSNjZJTThrSnR5a3pRT3ctdGNvVWFxWUZ5NkxEYVRMcWljM21Hc3ZBVWdxRDV1V2tPeE5kR3RnbHFhYTJSTGVtZVRJaS1yVVJJakZ5UmVMMFk4d0lBRFpDYnJ4MVFpSS1jRDhqQ3pMRnYwTW9hNDI1cHlPLXJJNUVSbnZOWG82X3lhOUtCY29nZ1dWTzQ4bkpWUWJ1QQ?oc=5,Zee News,2026-06-29T06:44:38+05:30,hi,Haryana,,"""लू"" Haryana","Delhi NCR Weather: दिल्ली-NCR में इस दिन से बदलेगा मौसम का मिजाज, आंधी-तूफान के साथ होगी बारिश
दिल्ली-एनसीआर में भीषण गर्मी और उमस से परेशान लोगों को जल्द राहत मिलने वाली है. मौसम विभाग ने मंगलवार और बुधवार के लिए आंधी, हल्की बारिश और तेज हवाओं का येलो अलर्ट जारी किया है, जिससे तापमान में 5 डिग्री सेल्सियस तक गिरावट आ सकती है. रविवार को इस महीने की पहली लू दर्ज हुई, जबकि जून की सबसे गर्म रात भी रिकॉर्ड की गई.
Delhi NCR Weather: चिलचिलाती धूप और उमस की मार झेल रहे दिल्ली और आसपास के लोगों के लिए मौसम विभाग ने एक बहुत ही राहत भरी खबर दी है. बस एक दिन के इंतजार के बाद मौसम का मिजाज पूरी तरह से बदलने वाला है और दिल्लीवालों को इस झुलसाने वाली गर्मी से निजात मिलने की पूरी उम्मीद है.
मंगलवार से बदलेगा मौसम का मिजाज
मौसम विभाग के पूर्वानुमान के मुताबिक सोमवार के बाद से मौसम में साफ बदलाव नजर आने लगेगा. मंगलवार और बुधवार को दिल्ली और उससे सटे विशाल क्षेत्र में गरज के साथ आंधी आने की संभावना है. इस दौरान धूल भरी हवाओं के साथ हल्की बौछारें भी पड़ सकती हैं. बारिश और तेज हवाओं की वजह से अधिकतम तापमान में पांच डिग्री सेल्सियस से भी ज्यादा की गिरावट आ सकती है. मौसम विभाग ने स्थिति को देखते हुए मंगलवार और बुधवार के लिए येलो अलर्ट भी जारी किया है. सबसे अच्छी बात यह है कि इस बारिश के बाद दोबारा भीषण लू लौटने के आसार काफी कम हैं, जिससे लोगों को गर्मी से लगातार राहत मिलती रहेगी.
रविवार को दर्ज हुई इस महीने की पहली लू
राहत मिलने से ठीक पहले रविवार का दिन दिल्लीवासियों के लिए काफी मुश्किल भरा साबित हुआ. सुबह से ही तेज चमकदार धूप निकली हुई थी और उमस के कारण सुबह दस बजे के बाद ही लोगों का घरों से बाहर निकलना दुश्वार हो गया था. दिल्ली का औसत अधिकतम तापमान 41.8 डिग्री सेल्सियस दर्ज किया गया, जो सामान्य तापमान से 4.6 डिग्री ज्यादा था. वहीं, दिल्ली के रिज इलाके में गर्मी का प्रकोप सबसे ज्यादा देखने को मिला, जहां पारा 42.6 डिग्री सेल्सियस तक पहुंच गया। बढ़ते तापमान और गर्म हवाओं के कारण इस महीने में यह पहली बार था जब दिल्ली में आधिकारिक तौर पर लू जैसे हालात महसूस किए गए.

मानसून में देरी से रातें भी हुईं बेहद गर्म
राजधानी में मानसून के आने में हो रही देरी का असर न सिर्फ दिन के तापमान पर, बल्कि रातों पर भी साफ तौर पर देखने को मिल रहा है. दिन भर की तेज धूप और हवा की धीमी रफ्तार ने उमस को इतना बढ़ा दिया है कि रात में भी लोगों को चैन नहीं मिल रहा है. पिछले महज चार दिनों में ही न्यूनतम तापमान में करीब छह डिग्री का बड़ा उछाल दर्ज किया गया है. रविवार की रात सफदरजंग वेधशाला में न्यूनतम तापमान 31.1 डिग्री सेल्सियस रिकॉर्ड किया गया, जो सामान्य से 3.2 डिग्री अधिक है. यह पिछले दो सालों में जून महीने की सबसे गर्म रात साबित हुई है. इससे पहले साल 2024 में जून के आखिरी हफ्ते में इतनी गर्म रात दर्ज की गई थी.
शाम के समय चली तेज धूल भरी आंधी
रविवार को दिन भर भीषण गर्मी और उमस के बाद शाम के समय राजधानी के कई हिस्सों में अचानक तेज धूल भरी हवाएं चलीं. इस आंधी ने शाम के वक्त मौसम में काफी हलचल पैदा कर दी। दिल्ली के पालम मौसम केंद्र में शाम के समय हवा की रफ्तार सबसे ज्यादा सत्तर किलोमीटर प्रति घंटा तक दर्ज की गई. इसके अलावा पूसा, जाफरपुर और इग्नू जैसे इलाकों में भी हवाओं की गति काफी तेज रही, जहां पचास से साठ किलोमीटर प्रति घंटे की रफ्तार से धूल भरी आंधी चली.",1.0
