title,url,source,date,language,state,district,search_term,full_text,relevance_score
"""कूलिंग स्टेशन"" लोगों को भीषण गर्मी के मौसम से राहत दिलाने में मदद करते हैं। - Vietnam.vn",https://news.google.com/rss/articles/CBMimwFBVV95cUxPYWRuUVNNQ2YyVVZUZnEtWlpWLVFWb2R1SG91T2hSeHBzZHdEXzFiUG1qYUlRczNmaXZWN0lNcjlVdk5vM29nSjNRLUh0WEphOEFKby1ndmxjU2dfQWNkN2VzLUQ1V0ZoS2Q4MXE5dHk2ZUZmN3UycXhvQjRKSEctakZyTmlqV1M1bFRDRVhlMlpmb0hvTTFhU1ZIYw?oc=5,Vietnam.vn,2026-06-29T00:18:17+05:30,hi,Haryana,,"(लू OR ""लू चलना"" OR ""भीषण गर्मी"" OR ""प्रचंड गर्मी"" OR ""कड़ी धूप"" OR ""तेज धूप"" OR ""गर्म हवा"" OR ""उष्ण लहर"" OR ""ताप लहर"" OR ""हीट वेव"" OR ""झुलसाने वाली गर्मी"" OR ""तपती गर्मी"" OR ""भयंकर गर्मी"" OR ""गर्मी का कहर"" OR ""गर्मी का प्रकोप"" OR ""अत्यधिक गर्मी"" OR मौसम OR ""मौसम अपडेट"" OR ""मौसम का हाल"" OR ""मौसम पूर्वानुमान"" OR ""मौसम अलर्ट"" OR आईएमडी OR ""आईएमडी पूर्वानुमान"" OR ""आईएमडी अलर्ट"" OR ""तापमान में बढ़ोतरी"" OR ""गर्मी से राहत"" OR ""गर्मी से निजात"") Haryana","देशभर में 1,000 से अधिक शीतलन स्टेशनों की तैनाती के साथ, लॉन्ग चाउ फार्मेसी और टीकाकरण प्रणाली दवा आपूर्ति केंद्रों से लेकर लोगों के निकट स्वास्थ्य केंद्रों तक फार्मेसियों की भूमिका का विस्तार कर रही है, जिससे अग्रिम मोर्चे से ही सामुदायिक स्वास्थ्य की रक्षा में योगदान मिल रहा है।
हर गर्मी के मौसम में , लगातार उच्च तापमान के साथ-साथ, चिकित्सा सुविधाओं में कई घंटों तक बाहर काम करने के बाद थकावट, लू लगने, गर्मी से होने वाली थकावट और यहां तक कि तीव्र गुर्दे की विफलता के कई मामले सामने आते हैं।
चिलचिलाती धूप में काम करके जीविका चलाने वालों के लिए, जैसे कि राइड-हेलिंग ड्राइवर, डिलीवरी वर्कर, निर्माण श्रमिक या स्ट्रीट वेंडर, स्वास्थ्य समस्याओं का खतरा हमेशा बना रहता है। काम के दबाव के कारण, कई लोग थकान, चक्कर आना, सिरदर्द या निम्न रक्तचाप जैसे शारीरिक चेतावनी के लक्षण दिखने पर भी अपना काम जारी रखते हैं।
|
| भीषण गर्मी के दिनों में, सड़कों की भीड़भाड़ के बीच, ठंडे पानी की एक बोतल, रक्तचाप की जांच या समय पर प्राथमिक उपचार किसी के स्वास्थ्य में बड़ा अंतर ला सकता है। |
स्वास्थ्य विशेषज्ञों के अनुसार, अत्यधिक गर्मी न केवल लू लगने और थकावट का खतरा बढ़ाती है, बल्कि हृदय रोग, उच्च रक्तचाप, मधुमेह और अन्य पुरानी बीमारियों को भी बढ़ा सकती है। विशेष रूप से, जो श्रमिक लंबे समय तक बाहर काम करते हैं, उन्हें समय पर पता लगाकर इलाज न कराने पर लू लगने सहित स्वास्थ्य संबंधी जटिलताओं का उच्च जोखिम होता है।
इस संदर्भ में, यात्रा के दौरान जलपान, स्वास्थ्य जांच और चिकित्सा सलाह के लिए अतिरिक्त विश्राम स्थल बनाना पहले से कहीं अधिक व्यावहारिक है।
इस वास्तविकता को ध्यान में रखते हुए, 20 जून से लॉन्ग चाऊ फार्मेसी और टीकाकरण प्रणाली ने देशभर की फार्मेसियों में 1,000 से अधिक शीतलन केंद्रों के साथ ""लॉन्ग चाऊ कूलिंग मैप"" कार्यक्रम शुरू किया है। इन केंद्रों पर लोगों को मुफ्त ठंडा पानी, रक्तचाप मापन, स्ट्रोक के जोखिम की जांच और गर्मी से होने वाले स्वास्थ्य जोखिमों से बचाव के लिए सलाह प्रदान की जा रही है।
आपको यह भी पसंद आ सकता है
इस कार्यक्रम की उल्लेखनीय विशेषता न केवल इसका व्यापक विस्तार है—देश भर में फैले 1,000 से अधिक राहत केंद्र—बल्कि निवारक स्वास्थ्य देखभाल के लिए इसका समुदाय-आधारित दृष्टिकोण भी है। 34 प्रांतों और शहरों में फैले फार्मेसियों के नेटवर्क का लाभ उठाते हुए, ये राहत केंद्र घनी आबादी वाले क्षेत्रों में रणनीतिक रूप से स्थित हैं, जिससे जरूरत पड़ने पर निवासियों के लिए ये आसानी से सुलभ हो जाते हैं।
पीने का पानी उपलब्ध कराने और स्वास्थ्य संकेतकों की जांच करने के अलावा, लॉन्ग चाउ ने 22,000 से अधिक फार्मासिस्टों को हीटस्ट्रोक के मामलों की पहचान करने और प्रारंभिक उपचार प्रदान करने का प्रशिक्षण भी दिया। फार्मासिस्टों की यह टीम समुदाय में त्वरित प्रतिक्रिया बल के रूप में काम करेगी और मरीजों को विशेष चिकित्सा सुविधाओं में स्थानांतरित करने से पहले ""गोल्डन आवर"" के दौरान प्राथमिक उपचार में सहायता प्रदान करेगी।
प्रत्यक्ष सहायता प्रदान करने के अलावा, यह प्रणाली लू लगने से बचाव, प्राथमिक चिकित्सा कौशल पर मार्गदर्शन, खतरनाक लक्षणों की पहचान और गर्मी के दौरान स्वास्थ्य की सुरक्षा के तरीकों के बारे में जानकारी साझा करने को भी बढ़ावा देती है। इन सामग्रियों को डॉक्टरों की एक टीम के सहयोग से संकलित किया गया है, जिससे लोगों को सटीक चिकित्सा ज्ञान प्राप्त करने में मदद मिलती है जिसे व्यवहार में आसानी से लागू किया जा सकता है।
इस कार्यक्रम की एक नई विशेषता है सुगमता बढ़ाने के लिए प्रौद्योगिकी का उपयोग। लॉन्ग चाउ ऐप पर मौजूद ""लॉन्ग चाउ कूलिंग मैप"" सुविधा के माध्यम से लोग निकटतम कूलिंग स्टेशन आसानी से ढूंढ सकते हैं।
इस परियोजना में ग्रैब कंपनी भी शामिल है जो राइड-हेलिंग ड्राइवरों के समुदाय को ईंधन भरने वाले स्टेशनों के बारे में जानकारी प्रदान करेगी, यह एक ऐसा समूह है जो अक्सर लंबे समय तक गर्म मौसम में बाहर काम करता है।
व्यवसाय या पृष्ठभूमि की परवाह किए बिना, सभी नागरिक विश्राम करने, शरीर में पानी की कमी पूरी करने और मुफ्त स्वास्थ्य जांच कराने के लिए शीतलन केंद्रों पर जा सकते हैं। यह एक मानवीय पहल है जो चरम मौसम के कारण होने वाले स्वास्थ्य जोखिमों को कम करने में मदद करती है और समुदाय में स्वास्थ्य देखभाल के प्रति जागरूकता को बढ़ावा देती है।
लॉन्ग चाउ फार्मेसी और टीकाकरण प्रणाली के प्रतिनिधियों ने कहा कि स्वास्थ्य सेवा का उद्देश्य केवल दवाइयाँ उपलब्ध कराना नहीं है; इसे व्यावहारिक कार्यों के माध्यम से जारी रखना होगा, यानी ज़रूरत के समय लोगों के साथ खड़े रहना होगा। ""लॉन्ग चाउ कूलिंग मैप"" कार्यक्रम, साथ ही देशभर में 1,000 से अधिक सहायता केंद्र, समुदाय को सहयोग देने और यह सुनिश्चित करने की उनकी प्रतिबद्धता का हिस्सा हैं कि स्वास्थ्य सेवा से वंचित न रह जाएँ।
हाल ही में, लॉन्ग चाऊ ने देशभर में 2,678 फार्मेसियों का मील का पत्थर हासिल किया है, जो लगभग 33 मिलियन ग्राहकों को सेवा प्रदान करती हैं। शहरी से लेकर ग्रामीण क्षेत्रों तक फैला यह व्यापक नेटवर्क न केवल दवाओं और स्वास्थ्य सेवाओं तक बेहतर पहुंच में योगदान देता है, बल्कि कई सामुदायिक स्वास्थ्य देखभाल कार्यक्रमों, रोग निवारण पहलों और जन जागरूकता अभियानों के कार्यान्वयन को भी सुगम बनाता है।
जलवायु परिवर्तन के कारण बढ़ती आवृत्ति के साथ होने वाली अत्यधिक गर्मी की लहरों के संदर्भ में, ""लॉन्ग चाउ कूलिंग मैप"" जैसे समुदाय-आधारित स्वास्थ्य सहायता मॉडल प्राथमिक स्वास्थ्य देखभाल नेटवर्क में फार्मेसियों की बढ़ती प्रमुख भूमिका को प्रदर्शित करते हैं।
दवाइयाँ उपलब्ध कराने के अलावा, फार्मेसियाँ धीरे-धीरे स्वास्थ्य सेवा तक पहुँच का प्राथमिक केंद्र बनती जा रही हैं, जो प्रारंभिक जोखिम पहचान, प्रारंभिक उपचार सहायता और लोगों के लिए निवारक स्वास्थ्य सेवा क्षमता में सुधार में योगदान दे रही हैं। यह पार्टी और राज्य की जमीनी स्तर पर स्वास्थ्य सेवा को मजबूत करने, निवारक चिकित्सा विकसित करने और जनता को केंद्र में रखने की प्रमुख नीतियों के अनुरूप है।
स्रोत: https://baodautu.vn/tram-giai-nhiet-tiep-suc-nguoi-dan-vuot-qua-mua-nang-nong-khac-nghiet-d629118.html",1.0
