title,url,source,date,language,state,district,search_term,full_text,relevance_score
Kal Ka Mousam : यूपी-हरियाणा समेत 21 राज्यों में तेज आंधी-बारिश की चेतावनी ! देखें कल का मौसम पूर्वानुमान - UdaipurTimes.com,https://news.google.com/rss/articles/CBMiqgFBVV95cUxQN0ZPaEN4Znh5Q2hUbkFCS2xUdEE5MW5NbkF6QjNLMWtyT005QjhfaW9BbWJoRkVUbGhyUHlVZUN1bjdod3pqaGFPTE9QSlV2dUNHMHBWXzdCeG1CQmc2eHhuV3p0QS1tTXZOZkh2dnh3bVNleVhfMjd3OW9hVDljR3NKaUFSNUlIN2NZbWp4ZzA4MkFYd1BtQTU4UEZ5S0VSam1ueUpVb0l5UQ?oc=5,UdaipurTimes.com,2026-06-29T16:49:29+05:30,hi,Haryana,,"(""हीट एक्शन प्लान"" OR ""गर्मी से राहत"" OR चेतावनी OR ""रेड अलर्ट"" OR ""ऑरेंज अलर्ट"" OR ""येलो अलर्ट"" OR एडवाइजरी OR ""राहत सामग्री"" OR ""राहत शिविर"" OR मुआवजा) Haryana","Kal Ka Mousam : यूपी-हरियाणा समेत 21 राज्यों में तेज आंधी-बारिश की चेतावनी ! देखें कल का मौसम पूर्वानुमान
Kal Ka Mausam 30 June 2026, कल का मौसम, कल 30 जून का मौसम : देश के सभी राज्यों में मौसम पूरी तरह से करवट ले चुका है और कई राज्यों में मानसुन के कारण बारिश का दौर भी शुरू हो गया है। भीषण गर्मी के बीच आज हरियाणा-राजस्थान और यूपी-दिल्ली NCR समेत कई जगहों पर बारिश का अलर्ट जारी किया गया है। देशभर में मौसम का मिजाज कल एक बार फिर से करवट लेगा जिससे देश के कई राज्यों में जमकर बारिश देखने मिलने वाली है।
हाल ही में मौसम विभाग ने ताजा रिपोर्ट जारी करते हुए बताया है की देशभर में कल एक बार फिर से बदलेगा जिससे कई जगहों पर भारी बारिश-तूफान आने वाला है तो कुछ जगहों पर मौसम साफ रहने से गर्मी पड़ने वाली है। Kal Ka Mousam 30 June
मौसम विभाग ने नई रिपोर्ट जारी करते हुए कल के लिए कई राज्यों में भारी तूफान बारिश के आसार जताएं है तो वहीं कुछ जगहों पर मौसम साफ रहने के आसार लगाए है और साथ ही लू चलने का अलर्ट जारी किया है। Kal Ka Mousam
कल 30 जून मंगलवार को मौसम कैसा रहेगा...
मौसम विभाग के मुताबिक कल यानी 30 जून को यूपी, बिहार समेत 21 राज्यों के लिए बारिश-आंधी की चेतावनी जारी की गई है। इस दौरान 70 से 75 किलोमीटर प्रति घंटे की स्पीड से तेज हवा चलेगी।
इस बीच कुछ राज्यों में बड़े-बड़े ओले गिरने की भी चेतावनी है। इस दौरान लोग घर से निकलने से बचें। मध्य क्षोभमंडल स्तर पर एक पश्चिमी विक्षोभ ट्रफ के रूप में दिखाई दे रहा है। Kal Ka Mausam
21 राज्यों में भारी बारिश-आंधी की चेतावनी
मौसम विभाग के पूर्वानुमान के मुताबिक कल यानी 30 जून को देश के 21 राज्यों में भारी बारिश-आंधी की चेतावनी है जिसमे यूपी, दिल्ली, बिहार, हरियाणा, राजस्थान, झारखंड, पंजाब, छत्तीसगढ़, हिमाचल, मध्य प्रदेश, जम्मू-कश्मीर, उत्तराखंड, लद्दाख, पश्चिम बंगाल, ओडिशा, सिक्किम, महाराष्ट्र, त्रिपुरा, नागालैंड, तमिलनाडु और कर्नाटक शामिल हैं।
दिल्ली में कल का मौसम
मौसम विभाग के अनुमान के मुताबिक दिल्ली में कल यानी 30 जून को भारी बारिश और आंधी की चेतावनी जारी की गई है। इस दौरान हवा की रफ्तार 50 से 60 किलोमीटर प्रति घंटे तक रहने की चेतावनी है। Kal Ka Mausam
यूपी में कल का मौसम
मेरठ, गौतमबुद्ध नगर, अलीगढ़, मुजफ्फरनगर, मथुरा, आगरा, अलीगढ़, गोंडा, सुल्तानपुर, जौनपुर, गाजीपुर, चंदौली, महोबा, एटा, मैनपुरी, ज्योतिबाफुले नगर,महामाया नगर, कानपुर, गोरखपुर, वाराणसी और प्रयागराज में भारी बारिश और आंधी की चेतावनी जारी की गई है। Kal Ka Mausam
बिहार में कल का मौसम
पटना, नवादा, गया, औरंगाबाद, सिवान, भोजपुर, शेखपुरा, लखीसराय, बक्सर, समस्तीपुर, दरभंगा, मधुबनी, पूर्णिया, कटिहार, किशनगंज, भागलपुर और मुंगेर में भारी बारिश और आंधी की चेतावनी जारी की गई है। इस दौरान 65 से 70 किलोमीटर प्रति घंटे की स्पीड से आंधी चलने की चेतावनी है।
झारखंड में कल का मौसम
रांची, सिमडेगा, पश्चिमी सिंहभूम, पूर्वी सिंहभूम, बोकारो, देवघर, जमशेदपुर, हजारीबाग, धनबाद और पलामू में भारी बारिश और आंधी का अलर्ट जारी किया गया है। इस दौरान 80 से 90 किलोमीटर प्रति घंटे की स्पीड से तूफान चलेगा। Kal Ka Mausam
उत्तराखंड में कल का मौसम
30 जून-2 जुलाई : नैनीताल, पिथौरागढ़, चमोली, हरिद्वार, बागेश्वर, ऋषिकेश,अल्मोड़ा और रुद्रप्रयाग में बारिश-तूफानी हवा की चेतावनी जारी की गई है। इस दैरान 70 से 80 किलोमीटर प्रति घंटे की रफ्तार से तेज हवा के झोंके चलेंगे।
हिमाचल में कल का मौसम
30 जून-1 जुलाई : सिरमौर, कुल्लू,कांगड़ा, ऊना, बिलासपुर, किन्नौर, सोलन, हमीरपुर और शिमला में भारी बारिश और आंधी का अलर्ट जारी किया गया है। इस दौरान 60 से 65 किलोमीटर प्रति घंटे की रफ्तार से तेज आंधी चलेगी। Kal Ka Mausam
जम्मू-कश्मीर में कल का मौसम
जम्मू, पुंछ, कुपवाड़ा, कुलगाम, उधमपुर, कठुआ, रियासी, अनंतनाग और गांदरबल में भारी बारिश-आंधी की चेतावनी जारी की गई है।
पश्चिम बंगाल में कल का मौसम
बांकुड़ा, जलपाईगुड़ी, कालिम्पोंग, अलीपुर द्वार, कोलकाता, हावड़ा, मालदा, मुर्शिदाबाद और बीरभूम में भारी बारिश और आंधी की चेतावनी जारी की गई है। इस दौरान 55 से 60 किलोमीटर प्रति घंटे की रफ्तार से तेज हवा चलेगी। Kal Ka Mausam
पंजाब में कल का मौसम
बठिंडा, अमृतसर, बरनाला, पठानकोट, लुधियाना, फरीदकोट, कपूरथला, मोगा और फिरोजपुर में भारी बारिश और आंधी की चेतावनी जारी की गई है। इस दौरान 50 से 55 किलोमीटर प्रति घंटे की रफ्तार से हवा चलेगी।
राजस्थान में कल का मौसम
30 जून-2 जुलाई : जयपुर, हनुमानगढ़, अलवर, बूंदी, कोटा, भरतपुर, करौली, सवाई माधोपुर, चुरू, सीकर, चित्तौड़गढ़, बाड़मेर, अजमेर, जोधपुर और भीलवाड़ा में मध्यम से भारी बारिश का येलो अलर्ट जारी किया गया है। इस दौरान 60 से 65 किलोमीटर प्रति घंटे की रफ्तार से तेज आंधी चलने की संभावना है। Kal Ka Mausam
मध्य प्रदेश में कल का मौसम
30 जून-2 जुलाई : भोपाल, राजगढ़, शाजापुर,देवास, श्योपुर, नीमच, मंदसौर, विदिशा, बालाघाट, सिवनी, खांडवा, होशंगाबाद, शिवपुरी और छतरपुर में भारी बारिश और आंधी की चेतावनी जारी की गई है। इस दौरान 60 से 65 किलोमीटर प्रति घंटे की रफ्तार से आंधी चलने का अलर्ट है।",1.0
"हरियाणा मौसम: 30 जून तक लू का प्रकोप, 1 जुलाई से आंधी-बारिश का अलर्ट, भिवानी में पारा 45°C, 11 जिलों में हीटवेव की चेतावनी - Hari Bhoomi",https://news.google.com/rss/articles/CBMiogFBVV95cUxPN251VlRmNVBtTk9GOFZ2TXJaa09oNjk2ZC1NbFZKdVkyb2g2WVI0Zl9pTzVmaG5qcjY2Z1VteE9aLTJtWWNfZno5cm9IMFZ0ekRCS2F2UVE0cVJSS0NzRDRLVDNvcjBQMWE5MkUxLVFuWjZTMkt1YkkzaGJJdC1MTVdVYmt2MGNBczU1OXY5enVpU29rX1hqRFN4U3dyNmRIVEE?oc=5,Hari Bhoomi,2026-06-29T10:34:00+05:30,hi,Haryana,,"(""हीट एक्शन प्लान"" OR ""गर्मी से राहत"" OR चेतावनी OR ""रेड अलर्ट"" OR ""ऑरेंज अलर्ट"" OR ""येलो अलर्ट"" OR एडवाइजरी OR ""राहत सामग्री"" OR ""राहत शिविर"" OR मुआवजा) Haryana","हरियाणा मौसम: हरियाणा में अगले कुछ दिन मौसम के दो बिल्कुल अलग रूप देखने को मिलेंगे। एक तरफ जहां प्रदेश के कई जिलों में 30 जून तक भीषण गर्मी और लू (Heatwave) का कहर जारी रहेगा, वहीं दूसरी तरफ जुलाई की शुरुआत के साथ ही मॉनसून की गतिविधियां तेज होने वाली हैं। मौसम विभाग (IMD) ने 2 और 3 जुलाई को प्रदेश के कई हिस्सों में भारी बारिश का अलर्ट जारी किया है।
भिवानी रहा सबसे गर्म, सामान्य से 4.1 डिग्री बढ़ा पारा
भारतीय मौसम विज्ञान विभाग (IMD) चंडीगढ़ के अनुसार, पिछले 24 घंटों में राज्य के औसत अधिकतम तापमान में 0.4 डिग्री सेल्सियस की बढ़ोतरी दर्ज की गई है, जो सामान्य से 4.1 डिग्री अधिक है। रविवार को भिवानी 45 डिग्री सेल्सियस तापमान के साथ प्रदेश का सबसे गर्म शहर रहा।
इसके अलावा अन्य प्रमुख शहरों का अधिकतम तापमान
फरीदाबाद (बोपानी): 44.2°C
नूंह: 42.1°C
हिसार: 41.7°C
नारनौल व चरखी दादरी: 41.5°C
आज इन 11 जिलों में हीटवेव का 'ऑरेंज अलर्ट'
मौसम विभाग ने आज (29 जून) को प्रदेश के 11 जिलों में अलग-अलग स्थानों पर तीव्र लू (Heatwave) चलने की चेतावनी दी है। इन जिलों में शामिल हैं-अंबाला, कुरुक्षेत्र, करनाल, पानीपत, सोनीपत, रोहतक, झज्जर, गुरुग्राम, फरीदाबाद, नूंह (मेवात) और पलवल। प्रशासन ने लोगों को दोपहर के समय बिना जरूरी काम के धूप में न निकलने और शरीर में पानी की कमी न होने देने के लिए पर्याप्त मात्रा में तरल पदार्थ लेने की सलाह दी है।
आज कुछ हिस्सों में बूंदाबांदी
गर्मी और उमस के बीच राहत की बात यह है कि आज पंचकूला, अंबाला, यमुनानगर, कुरुक्षेत्र, कैथल, करनाल, महेंद्रगढ़, रेवाड़ी, झज्जर, गुरुग्राम, नूंह, पलवल, फरीदाबाद और चरखी दादरी में कुछ स्थानों पर गरज-चमक के साथ हल्की से मध्यम बारिश हो सकती है।
जुलाई की शुरुआत में झमाझम बारिश
मौसम वैज्ञानिकों के अनुसार, 1 जुलाई से राज्य में बारिश की गतिविधियों में तेजी आएगी। 1 जुलाई को 40 से 50 किलोमीटर प्रति घंटे की रफ्तार से तेज हवाएं चलने, बिजली गिरने और गरज-चमक की संभावना है। इसके बाद 2 और 3 जुलाई को हरियाणा के कई इलाकों में भारी बारिश का पूर्वानुमान है, जिससे तापमान में भारी गिरावट आएगी और लोगों को उमस भरी गर्मी से पूरी तरह निजात मिलेगी।
हरियाणा के जिले, कस्बे और गांवों की खबरों के लिए हरिभूमि का ""ई-पेपर"" पढ़ें। यहां क्लिक करें epaper haribhoomi या शानदार अनुभव के लिए प्लेस्टोर से ""हरिभूमि हिंदी न्यूज़"" App डाउनलोड करें।",1.0
"Yamuna Nagar News: गर्मी का कहर, लू और उमस ने सताया - Amar Ujala",https://news.google.com/rss/articles/CBMi5wFBVV95cUxQZkljV2l2WXlqMUoxSGZBWlExNFlhRXE1VDl4S0oyWFFmdWtJNjNnWjlsTFVEdHJ3WlJ3ekxoUUFDWV82MVdoSEkxM29KWkVBMTF4dlp4VFhNVVQzZXU3djlqRGtUbzFzeGFja3ZZbXU5TEVMYS1VRWJZV1doS1FmSWc3dXpSRzZDazhzaW5BTnlkWWQ3Q0NZVm5MYnFybGJYTmxTVGQyWkkwOXQ3VW1rdFZBRW5LT3RpSmZfSWg5Nk5WWXloVWREeGUwUE1JcS0tSlpoNS15cGN1bkdYUl84cHRZOGpxUEXSAewBQVVfeXFMT0gzY3BuM0t6Yl9pOUR2cTNxdUx5Wk1uZlBCNTZOd3VkWHptUmJrUmltSE14aGIwREFhZjR2QWlNMnkyREhSc3g0d3ZkVkVEU1JyQXE2TXppOWt1OV8yXzVFLTJxNlBmOWZxaFlaalItajFUNTAyUmRHdkkzQVRXNTl0WmMtYy1pUjc3ZWp1dUZrN3lYeTh4Z1E4SE1fNDNTS0htOGhpeDdtMkhzRFFVUlNMWEExeUE2Y0twR0FlY1k4a2xwVkowaTdTVGt3RUtnQzlGRHFSRXUwdDBvYmFkWUVvTUpSdWhuXzh1T0o?oc=5,Amar Ujala,2026-06-29T00:37:31+05:30,hi,Haryana,,"""लू"" Haryana","{""_id"":""6a4170f38ede3d494709cbd5"",""slug"":""scorching-heat-heatwave-and-humidity-take-their-toll-yamuna-nagar-news-c-246-1-sknl1020-158584-2026-06-29"",""type"":""story"",""status"":""publish"",""title_hn"":""Yamuna Nagar News: गर्मी का कहर, लू और उमस ने सताया"",""category"":{""title"":""City & states"",""title_hn"":""शहर और राज्य"",""slug"":""city-and-states""}}
Yamuna Nagar News: गर्मी का कहर, लू और उमस ने सताया
संवाद न्यूज एजेंसी, यमुना नगर
विज्ञापन
खबरें लगातार पढ़ने के लिए अमर उजाला एप डाउनलोड करें
या
वेबसाइट पर पढ़ना जारी रखने के लिए वीडियो विज्ञापन देखें
अगर आपके पास प्रीमियम मेंबरशिप है तो
संवाद न्यूज एजेंसी
जगाधरी। जिले में प्रचंड गर्मी का असर लगातार बढ़ता जा रहा है। शनिवार को अधिकतम तापमान 39.5 डिग्री सेल्सियस तक पहुंच गया। वहीं न्यूनतम तापमान 28.6 डिग्री सेल्सियस रहा, जो दो वर्ष में सबसे अधिक न्यूनतम तापमान है। तेज धूप, उमस और लू के कारण लोगों का घरों से बाहर निकलना मुश्किल हो गया। मौसम विभाग के अनुसार इस सप्ताह बारिश की संभावना है, जिससे लोगों को गर्मी से कुछ राहत मिलने की उम्मीद है।
दिनभर करीब 16 किलोमीटर प्रतिघंटा की रफ्तार से लू चलती रहीं। दोपहर को सूरज की तपिश इतनी तेज रही कि खुले में निकलना लोगों के लिए चुनौती बन गया। त्वचा झुलसा देने वाली धूप और उमस ने लोगों को खासा परेशान किया। सुबह 10 बजे के बाद ही सड़कों और बाजारों में लोगों की आवाजाही कम हो गई। आवश्यक कार्य होने पर ही लोग घरों से बाहर निकले।
गर्मी के चलते शहर के प्रमुख बाजारों और सार्वजनिक स्थानों पर दिनभर सन्नाटा पसरा रहा। भीषण गर्मी के कारण ग्राहकों की संख्या में भारी कमी आई। शाम को धूप का असर कम होने के बाद ही लोग खरीदारी और अन्य जरूरी कामों के लिए घरों से बाहर निकले, जिससे बाजारों में कुछ चहल-पहल दिखाई दी।
विज्ञापन
विज्ञापन
जगाधरी। जिले में प्रचंड गर्मी का असर लगातार बढ़ता जा रहा है। शनिवार को अधिकतम तापमान 39.5 डिग्री सेल्सियस तक पहुंच गया। वहीं न्यूनतम तापमान 28.6 डिग्री सेल्सियस रहा, जो दो वर्ष में सबसे अधिक न्यूनतम तापमान है। तेज धूप, उमस और लू के कारण लोगों का घरों से बाहर निकलना मुश्किल हो गया। मौसम विभाग के अनुसार इस सप्ताह बारिश की संभावना है, जिससे लोगों को गर्मी से कुछ राहत मिलने की उम्मीद है।
दिनभर करीब 16 किलोमीटर प्रतिघंटा की रफ्तार से लू चलती रहीं। दोपहर को सूरज की तपिश इतनी तेज रही कि खुले में निकलना लोगों के लिए चुनौती बन गया। त्वचा झुलसा देने वाली धूप और उमस ने लोगों को खासा परेशान किया। सुबह 10 बजे के बाद ही सड़कों और बाजारों में लोगों की आवाजाही कम हो गई। आवश्यक कार्य होने पर ही लोग घरों से बाहर निकले।
विज्ञापन
गर्मी के चलते शहर के प्रमुख बाजारों और सार्वजनिक स्थानों पर दिनभर सन्नाटा पसरा रहा। भीषण गर्मी के कारण ग्राहकों की संख्या में भारी कमी आई। शाम को धूप का असर कम होने के बाद ही लोग खरीदारी और अन्य जरूरी कामों के लिए घरों से बाहर निकले, जिससे बाजारों में कुछ चहल-पहल दिखाई दी।
विज्ञापन",1.0
