title,url,source,date,language,state,district,search_term,full_text,relevance_score
"“राजस्थान में पश्चिमी विक्षोभ ने मचाई हलचल! 9 जिलों में ऑरेंज, 16 में येलो अलर्ट जारी” - sachbedhadak.com",https://news.google.com/rss/articles/CBMilgFBVV95cUxQaVBvOXJUR25qM3A4WDQ1aHZpNjlwTVc1RjZVODNFVU5yMUI4TVZncXNRZmVNd0FrZmZka0hreUdPYUZmaFNmamlXTzQxYXJCaktOdlVHS2hvcXcwemdzU2NndXh4NzIwQUJYTDJxVjFUaXNiMEtSbjFxZURadXhaNFoxSS1zMUx2bzdqVkVSNUQxTV80NVE?oc=5,sachbedhadak.com,2026-03-20T14:30:33+05:30,hi,Rajasthan,,"(""हीट एक्शन प्लान"" OR ""गर्मी से राहत"" OR चेतावनी OR ""रेड अलर्ट"" OR ""ऑरेंज अलर्ट"" OR ""येलो अलर्ट"" OR एडवाइजरी OR ""राहत सामग्री"" OR ""राहत शिविर"" OR मुआवजा) Rajasthan","Rajasthan Heavy Rain Alert: राजस्थान में पश्चिमी विक्षोभ का असर लगातार दिख रहा है। मौसम विभाग ने पहले ही 20 मार्च को लेकर भारी बारिश का अलर्ट जारी किया था, और इसके बाद कई जिलों में लगातार बारिश दर्ज की जा रही है। तापमान में भारी गिरावट के साथ ठंड का अहसास फिर से बढ़ गया है।
बाड़मेर और अलवर में रिकॉर्ड बारिश
बाड़मेर में सबसे अधिक 16 मिमी बारिश हुई, जबकि अलवर में 13 मिमी से ज्यादा बारिश दर्ज की गई। राजधानी जयपुर में भी सुबह 3 बजे से बारिश का दौर जारी है। शहर के कई इलाकों में रुक-रुक कर हल्की बरसात हो रही है और आसमान में बादल छाए होने से सूरज की तपिश से लोगों को राहत मिली है।
9 जिलों में ऑरेंज अलर्ट
मौसम विभाग ने जयपुर, नागौर, अजमेर, सीकर, टोंक, झुंझुनू, अलवर, दौसा और आसपास के जिलों में ऑरेंज अलर्ट जारी किया है। इन क्षेत्रों में तेज बारिश और तूफानी हवाओं की संभावना जताई गई है।
16 जिलों में येलो अलर्ट
सवाई माधोपुर, बूंदी, धौलपुर, भीलवाड़ा, बारां, कोटा, जोधपुर, पाली, चूरू, बीकानेर, उदयपुर, झालावाड़, चित्तौड़गढ़, राजसमंद, डूंगरपुर, बांसवाड़ा जिलों में येलो अलर्ट जारी किया गया है। इन जिलों में आंधी, बारिश और ओलावृष्टि का असर देखा जा रहा है।
ओलावृष्टि और तापमान में गिरावट
सीकर, कोटपूतली और आसपास के इलाकों में ओले गिरे। कई शहरों में आंधी-बारिश और ओलावृष्टि से तापमान में लगभग 11 डिग्री तक गिरावट आई है। जबकि आमजन को मौसम से राहत मिली है, वहीं फसलों पर बारिश और ओले का असर पड़ा है, जिससे किसानों की चिंता बढ़ गई है।",1.0
