title,url,source,date,language,state,district,search_term,full_text,relevance_score
Heat exposure raises risk of child dehydration – health officials - The Morning,https://news.google.com/rss/articles/CBMiZkFVX3lxTE5nbG95UjlXcEJqeXZESXdKVG5nQ2RzOXJCLU01M1dsc3p4NnJaeVdnLTBGMVlDZk11bFk1LW10V3NVXzllb1hyZlVlczM0Y2loY3ByM19iWU1EN1ZubDZ2NlpxSHFXZw?oc=5,The Morning,2026-03-23T10:06:09+05:30,en,Andaman and Nicobar Islands,,"(heatstroke OR ""heat stroke"" OR sunstroke OR ""heat exhaustion"" OR ""heat-related death"" OR ""heat casualty"" OR ""heat fatality"" OR ""suspected heat death"" OR dehydration OR ""heat cramps"" OR ""heat illness"") Andaman and Nicobar Islands","Health officials have urged parents to protect children from dehydration amid prevailing extreme heat conditions.
Consultant Paediatrician Dr. Deepal Perera of the Lady Ridgeway Hospital for Children, Colombo, stated children should be given plenty of water and natural fluids.
He noted symptoms such as drowsiness, loss of appetite and body aches require increased fluid intake.
Dr. Perera further stated hot weather raises the risk of skin rashes and infections, advising children be bathed at least twice daily.
He warned children taking part in school sports are at higher risk of dehydration and heatstroke without proper hydration, which can lead to serious complications, including death.",1.0
