title,url,source,date,language,state,district,search_term,full_text,relevance_score
15-Year-Old Tribal Girl’s Body Left In 41°C Heat After Post-Mortem In MP’s Ashoknagar; Family Forced To Carry Her-VIDEO,https://www.freepressjournal.in/bhopal/15-year-old-tribal-girls-body-left-in-41c-heat-after-post-mortem-in-mps-ashoknagar-family-forced-to-carry-hervideo,Free Press Journal,2026-05-04T17:24:00+05:30,en,Madhya Pradesh,Ashoknagar,"(heatwave OR ""heat wave"" OR ""severe heatwave"" OR ""extreme heat"" OR ""heat spell"" OR ""scorching heat"" OR ""blistering heat"" OR ""sweltering heat"" OR ""hot winds"" OR loo OR ""hot loo winds"") Madhya Pradesh","Bhopal (Madhya Pradesh): A15-year-old girl’s body was left in extreme heat for hours outside hospital in Ashoknagar on Monday.
The body was simply handed back to them in the clothes they had brought from home. They did not even get a stretcher or a ward boy to help carry the body out of the hospital.
A disturbing video has surfaced on social media, in which the family members can be seen carrying the body rapped in a cloth and moving along the street.
Watch the video below :
After waiting for hours, the family had to carry the body themselves. They placed the body by the roadside and began pleading with private vehicle drivers in nearly 41°C heat.
According to information, the girl from Bahadurpur area was found hanging inside her house. Her family took her body to a local health centre the same night. But they say they received no proper support and had to stay there overnight without basic help or arrangements.
After the post-mortem was completed the next morning, the family claims they were not given a stretcher, cloth, or vehicle. They were forced to carry the body themselves and wait on the roadside in nearly 41°C heat for about two hours.
During this time, no official transport was provided. Even private vehicles did not agree to help, the family said.
Later, a social worker stepped in and arranged transport to take the body to their village.
Locals have questioned how a minor’s body could be left unattended after post-mortem.
Officials said that usually police or other arrangements are used for body transport, but delays can happen due to unavailability of vehicles.",0.6833333333333333
