title,url,source,date,language,state,district,search_term,full_text,relevance_score
"Una News: बारिश के बाद जिले का मौसम हुआ सुहावना, 18 एमएम वर्षा दर्ज - Amar Ujala",https://news.google.com/rss/articles/CBMi7gFBVV95cUxNaWpSWGNsYzFINndKZzN1SThzWFU5NkNQYmkyYU10YnpyT05LcnV0WTQ0TEFnUkdzb2YxWngtTFg2M0k0TlBFYUtNTTVMY3ZsV3dVMzdQellIc1VzSXBlYXBQUUFLbmpLckVyZEw5SHEwZ2FJUERjdXMzYzRuQW8yNTd4ZnA2Q050eDZTN0VwbHc3bm50VTVSYlVYMktNcWxRWkRNS0dRRHZac2xCZDFfM3dsSENrZEtGWVAtZ1RaVmlCUUZKZ3V1THJrSHFla1lmc3hRcFBlTUYwTnhtYmQ2c2t5X1dSbU9JVmhQbGtn0gHzAUFVX3lxTE5wcXJUV1JFZTlteTJER04xMk1TSGh3bjhuU3k5N2FRQ0hETkpjZ19wRUh0ODJJXzZrU3RUOXN6UlRYejRWSzFLenRQWmFmUkppWDAtQ3p0UWoyOE1BcTdNTnY4cnhfNGZaNmtBQ0NWN0p2Yy13TFRseUlmQ1l6SjI2emhKYVZtN3Nlb29LbHdkeWxJXzdhT1ZzN0lTdm9pQlpUNFdPaGh3dFM3cmZaVG5VVlJZazYwRHQ0LTJZSGJjVlFlUGs1N3BuTlA3MElTbU5lUEpyajhFU2JRVWEtZFZza3JRUkZIMGMtd3FrUjZYNXkxZw?oc=5,Amar Ujala,2026-07-24T00:33:56+05:30,hi,Himachal Pradesh,Una,"लू (Bilaspur OR Chamba OR Hamirpur OR Kangra OR Kinnaur OR Kullu OR ""Lahaul and Spiti"" OR Mandi OR Shimla OR ""Sirmaur (Sirmour)"" OR Solan OR Una) Himachal Pradesh","{""_id"":""6a62659c81b7ca674b02ce29"",""slug"":""districts-weather-turns-pleasant-after-rain-18-mm-rainfall-recorded-una-news-c-93-1-ssml1047-199690-2026-07-24"",""type"":""story"",""status"":""publish"",""title_hn"":""Una News: बारिश के बाद जिले का मौसम हुआ सुहावना, 18 एमएम वर्षा दर्ज"",""category"":{""title"":""City & states"",""title_hn"":""शहर और राज्य"",""slug"":""city-and-states""}}
Una News: बारिश के बाद जिले का मौसम हुआ सुहावना, 18 एमएम वर्षा दर्ज
संवाद न्यूज एजेंसी, ऊना
विज्ञापन
खबरें लगातार पढ़ने के लिए अमर उजाला एप डाउनलोड करें
या
वेबसाइट पर पढ़ना जारी रखने के लिए वीडियो विज्ञापन देखें
अगर आपके पास प्रीमियम मेंबरशिप है तो
ऊना। वीरवार सुबह हुई बारिश के बाद जिला ऊना का मौसम पूरी तरह बदल गया। बारिश से तापमान में गिरावट दर्ज की गई और पिछले कई दिनों से उमस व गर्मी से परेशान लोगों को राहत मिली। सुबह से आसमान में बादल छाए रहे। इस दौरान जिले भर में बारिश होने से मौसम सुहावना बना रहा।
मौसम विभाग के अनुसार जिले में 18 एमएम बारिश रिकॉर्ड की गई। बारिश के कारण अधिकतम तापमान 31.2 डिग्री सेल्सियस दर्ज किया गया। लंबे समय से बारिश का इंतजार कर रहे लोगों के चेहरों पर भी राहत दिखाई दी। विभाग के अनुसार जिले में बादल छाए रहने के साथ कुछ स्थानों पर हल्की से मध्यम बारिश की संभावना बनी हुई है। ऐसे में लोगों को फिलहाल भीषण गर्मी से राहत मिलने के आसार हैं। मौसम विभाग के समन्वयक विनोद कुमार ने बताया कि आगामी दिनों में भी बारिश होने की संभावना है।
विज्ञापन
मौसम विभाग के अनुसार जिले में 18 एमएम बारिश रिकॉर्ड की गई। बारिश के कारण अधिकतम तापमान 31.2 डिग्री सेल्सियस दर्ज किया गया। लंबे समय से बारिश का इंतजार कर रहे लोगों के चेहरों पर भी राहत दिखाई दी। विभाग के अनुसार जिले में बादल छाए रहने के साथ कुछ स्थानों पर हल्की से मध्यम बारिश की संभावना बनी हुई है। ऐसे में लोगों को फिलहाल भीषण गर्मी से राहत मिलने के आसार हैं। मौसम विभाग के समन्वयक विनोद कुमार ने बताया कि आगामी दिनों में भी बारिश होने की संभावना है।
विज्ञापन",1.0
