title,url,source,date,language,state,district,search_term,full_text,relevance_score
Odisha to swelter as temperatures likely hit 40°C mark soon - Kalinga TV,https://news.google.com/rss/articles/CBMikgFBVV95cUxOMFdEbGIwbXQwRUh0ZUx2dXFEWUk0aGtMX25zOEVVandQc0dDUVZkSHhPUjlSNk1IWXlEUlVhVTMwYm1YaUVLN1QwQ1JIUk10dWt0UWNFel9QVmMzbldLMVJmYVVkYm52R1R0T1JYVUUwNEZvSWx5Q0NOUHBSdVZlVkRXRWt1b1dGTUZWaWNsQkM0QQ?oc=5,Kalinga TV,2026-03-04T18:01:09+05:30,en,Odisha,Cuttack,"(""mercury soars"" OR ""mercury crosses"" OR ""temperature soars"" OR ""record temperature"" OR ""all-time high"" OR ""degrees Celsius"" OR ""maximum temperature"" OR ""hottest day"") Odisha","Odisha to swelter as temperatures likely hit 40°C mark soon
Maximum temperature in Bhubaneswar was 36.8 degrees Celsius and the minimum was 19.2 degrees Celsius yesterday
Bhubaneswar: The heat is increasing in the state of Odisha as the temperature is rising these days. The day temperature may touch 40 degrees Celsius soon.
In the last 24 hours, the maximum temperature in Jharsuguda was 39 degrees Celsius and the minimum temperature in Rourkela was 13.7 degrees Celsius.
The maximum temperature in the capital city Bhubaneswar was 36.8 degrees Celsius and the minimum was 19.2 degrees Celsius, while 34.8 and 18 degrees Celsius were recorded in Cuttack.
The heat will continue throughout the state despite no significant change in temperature in the next 6 to 7 days, predicted the MeT Department.
In Cuttack, the day temperature is likely to be between 35 and 36 degrees, while the night temperature may remain between 20 and 23 degrees.
Similarly, in the capital Bhubaneswar, the day temperature is expected to increase and reach 36 to 39 degrees Celsius. Night temperatures will range between 21 and 24 degrees.
Watch the video here:",0.4833333333333333
