title,url,source,date,language,state,district,search_term,full_text,relevance_score
"From March 1 to May 26, state records 270 heatstroke cases & 17 deaths - The Times of India",https://news.google.com/rss/articles/CBMi1gFBVV95cUxONFBURmVmREYzeWRYcVZIck5BV3RvVGtoT0ZIMGVUangxWnJya1BlaXdqbTFJMWdBdnRwVi1kRHd5VnVScFNmX012ZGNwX1BSVnhQZDIyTDR3OGdvNVhfejA2ak04WUFSYzJQN19iTnUxYzREbU9lSDRpd3lCVnZPYW01UjhmclpLMnRnMFNoZE5wSFhpX096ekUzRVNzQjlsWHRKZS02eW12cjc2SHotQUYtdVZnbmN0T05VQnp2UlNUNk5NSzZqSlpWOXNYcXIyS3RSa2dB0gHbAUFVX3lxTE5NRFJvcGlibEVobGdLT3NhQU1RWmE0YW1TVk9iYlBSSUJTd1VQWlAwdDFzVzRfeGZRMzVnSi00b09KbDJ5TVBzUkRTeGVqYm5NbkR3dXkyaVN4TWRWMVBuMDhBTl9TM0NoVmw3dW1MeUNzTHBNSkFlSHhXQzBaZmdGd3JXell2VTlIM0dMTHlOcHJocFE1S0FlTGJjXzhvQnRjZ290RkNhdG5lQ2s0S2xTbl95dXZGYXlCdHhIakRaWENheGR2R0JfeFJlQmtobXlyOU5OQlJFVVFsTQ?oc=5,The Times of India,2026-05-29T00:41:00+05:30,en,Maharashtra,Akola,"""heatstroke"" Maharashtra","Pune: The state health department has reported 270 heatstroke cases and 17 deaths across
Maharashtra between March 1 and May 26 this year, with Chhatrapati Sambhajinagar emerging as the worst-affected district, recording 50 cases and two fatalities.
According to official data, of the 17 total deaths, 12 have been classified as suspected, while five have been confirmed.
District-wise figures showed that Chhatrapati Sambhajinagar reported the highest number of cases (50), followed by Nandurbar (26), Nashik (20) and Gadchiroli (19). Wardha and Buldhana recorded 18 cases each. Among the 12 suspected deaths, two each were reported from Chhatrapati Sambhajinagar, Akola, Latur and Jalgaon, while Yavatmal, Solapur, Nagpur and Gadchiroli reported one case each. Of the five confirmed deaths, two were reported in Akola, and one each in Latur, Gadchiroli and Jalgaon.
Dr Sandeep Sangale, joint director, health services, Maharashtra, said, “In case of heatstroke, the central health ministry’s advisory recommends immediate first aid measures, including moving the person to an open and well-ventilated place, removing unnecessary clothing and trying to bring the body temperature below 101°F.
Use a fan while wetting the person’s skin with water using a sponge or towel. The advisory warns against applying ice packs or immersing a newborn or baby in water, as it may cause hypothermia.”
Extreme heat can affect the body in multiple ways, ranging from dehydration and exhaustion to severe heatstroke, which can be life-threatening. “During the peak heat period, there is a noticeable increase in patients reporting dizziness, weakness, headaches and low blood pressure. With the recent weather change, these cases are now declining. The recent rain spell and resultant drop in temperatures have reduced stress on the body, especially among the elderly, children and outdoor workers,” Dr Mahendra Dadke, consultant in internal medicine at Jupiter Hospital, said.
Doctors said though the recent spell of rainfall and the drop in temperatures provided much-needed relief from heat, sudden weather changes could bring their own set of health challenges. Dr Aparna Kodre, senior consultant in the medicine department at Noble Hospitals and Research Centre, highlighted an increase in airborne infections. “The sudden weather fluctuations have resulted in more cases of flu, pharyngitis, enteritis, as well as flare-ups of asthma and COPD. If fever persists for more than 48 hours, patients should consult a doctor. Post-rain humidity can also lead to fatigue and discomfort, making it important to stay adequately hydrated,” she said.
Health experts emphasised that simple precautions like maintaining proper hydration, avoiding contaminated food and drinks, and following basic hygiene practices could help prevent both heat-related illnesses and infections during this transitional period.",1.0
Red alert issued for severe heatwave in parts of Maharashtra till Tuesday - Newsonair,https://news.google.com/rss/articles/CBMioAFBVV95cUxQT3ZpUjZRc1N2UnduTzRvd1llbk5UVFR4V1kwWU0tYXZ0RHg1TW1ZQzI0X1pybDUwblJzYmhNOTRYME5kS1J6TjI5QWJOZjZMWGxXNmJzYjY0aGJLMldjb1ZHZzBlQTA0cVk1V1hhMmZvZE4xZGtEV19JSWQ2NWxUNDRLLTFKZkluZ01GT1NKaXZocmlNNTQxbFAzQ3BaOGVv?oc=5,Newsonair,2026-05-29T12:40:05+05:30,en,Maharashtra,Akola,"(""heat advisory"" OR ""heat action plan"" OR ""heat alert"" OR ""IMD warning"" OR ""IMD alert"" OR ""red alert"" OR ""orange alert"" OR ""yellow alert"" OR ""NDMA advisory"" OR ""cooling shelter"" OR ""relief measures"" OR ""heat compensation"" OR ""severe weather warning"") Maharashtra","In Maharashtra, a red alert for severe heatwave conditions has been issued for Amravati, Wardha and Chandrapur districts till Tuesday. An Orange Alert has also been sounded for Akola, Nagpur and Gadchiroli districts during the same period.
The Regional Meteorological Department has forecast continued high temperatures across most parts of Vidarbha, except Buldhana and Washim districts.
Meanwhile, Amravati has been witnessing intense heatwave conditions since April. According to the District General Hospital administration, 15 patients with heatstroke-like symptoms were admitted for treatment. All of them have since been discharged after receiving medical care.",1.0
"Maharashtra Weather LATEST Update: Nagpur Swelters at 46.4°C, Heatwave Persists Across Vidarbha - Asianet Newsable",https://news.google.com/rss/articles/CBMi3wFBVV95cUxPSktZRVJEQ3JEcHZrcXVZNmVPR0g1djZLa0tYSXkwbnJzRUZFSXk1aUl6eUNBcWtPWGRkeWtnMDE4UERnUlJiaHhldDN1Z3NEbFR3STZYMXp5dGRTLVpEaDRqdUR2cFN2SGQ1WDRfWWxhTVZEeElLdUg5dTZDMmlsR0xDX2NHWUhBVUJ0cy1UM3U5UHViQTRNalhnQl9DVFVUSm8wLUhKUDg2SkRyc1JfaERTcHE2OGlPRGloaVAtMFhxcG5SMHZzWDdWTmRudXhVRVN0OWIyTmttYnRaZ3VR0gHkAUFVX3lxTFA2aXBmWjBCZFZlV0FGcGxtZGptejlUeXRFbjlHVDZ1dXhxeF9BWTdid2N5MF90Wk11QURrSmVWWmxUYWcwc2xYTGFocGxjcGNWaTRRQ01hQXJFX2tsWlhkZnplalRhVzNzUFZMUWx6NDdpYXZLOGFtVGVLa0pCbVpZYzc5SUVwSHMtZHRuNlRGY05pWFZqVmZ1NUFwaXJIWlFWN0FNVlNaeGRfZ3RPZ3BXSkpiRUJLQkphelpTWnA4ZXVITU9QWkZEN2UxWTlnV3pLMkpIWmFoVTVIaUk3V0ctTHV3eA?oc=5,Asianet Newsable,2026-05-29T08:17:45+05:30,en,Maharashtra,Akola,"""heatwave"" Maharashtra","Maharashtra Weather LATEST Update: Nagpur Swelters at 46.4°C, Heatwave Persists Across Vidarbha
Maharashtra Weather LATEST Update: A brief spell of rain in parts of Nagpur failed to bring lasting relief as the city continued to reel under intense heat. Temperatures remained dangerously high across Vidarbha, with health concerns rising sharply
Nagpur Remains Scorching Despite Rainfall
Nagpur witnessed light showers in a few areas during the afternoon, raising hopes of cooler weather among residents. However, the relief was short-lived as strong sunshine returned soon after, keeping humidity and discomfort levels high throughout the day.
The city recorded a maximum temperature of 46.4 degrees Celsius on Thursday, making it one of the hottest cities in the country. Nearby Wardha registered an even higher temperature of 46.8 degrees Celsius, the highest in the region. Other districts including Gondia, Chandrapur, Amravati and Brahmapuri also crossed the 45-degree mark.
By evening, areas such as Besa and Nandanvan received mild rainfall accompanied by pleasant winds, offering temporary comfort to citizens battling the oppressive weather.
Yellow Alert Issued Across Vidarbha
The India Meteorological Department has issued a yellow alert for several districts in Vidarbha, including Nagpur, Wardha, Chandrapur, Gadchiroli, Yavatmal, Amravati and Gondia. Only Akola, Washim and Bhandara have been excluded from the warning.
Weather officials have predicted thunderstorms, rainfall and a gradual drop in temperatures beginning Friday and continuing over the next four days. Authorities are hopeful that the changing weather pattern may finally provide relief from the prolonged heatwave conditions affecting the region.
Due to the extreme temperatures, roads and public places in Nagpur remained relatively less crowded during afternoon hours. Meanwhile, cold drink stalls, juice shops and ice cream vendors witnessed increased demand from residents trying to beat the heat.
Heatstroke Death Toll Raises Serious Concern
The ongoing heatwave has triggered serious health concerns in the city. According to reports, 22 people have reportedly died from suspected heatstroke over the last five days in Nagpur.
Police officials stated that on Thursday morning, a 45-year-old man was found dead beneath a bridge on Rambhaji Road under the Tehsil police station limits. In another incident, a 35-year-old man was discovered dead on the first floor of an under-construction building near Parshuram Chowk in Bhilgaon under Yashodhara Nagar police limits. The identities of both individuals are yet to be confirmed.
Authorities suspect that rising temperatures and harsh weather conditions may have contributed to the deaths. Police records also indicate that between May 24 and May 27, nearly five deaths were reported daily in the city, with heatstroke being considered a possible cause in many of the cases.
Stay updated with the Breaking News Today and Latest News from across India and around the world. Get real-time updates, in-depth analysis, and comprehensive coverage of India News, World News, Indian Defence News, Kerala News, and Karnataka News. From politics to current affairs, follow every major story as it unfolds. Get real-time updates from IMDon major cities weather forecasts, including Rain alerts, Cyclonewarnings, and temperature trends. Download the Asianet News Official App from the Android Play Store and iPhone App Store for accurate and timely news updates anytime, anywhere.",1.0
Maharashtra Reports 17 Heatstroke Deaths And Over 300 Cases Between March And May - PUNE PULSE,https://news.google.com/rss/articles/CBMirwFBVV95cUxQYjVLekJ3ZkVJM29xTkNoSl9JQUdRZklwaTZEd0Z3a3JEZHBEeEE0eS1MUHB1MFpLa0pNZnlkMXN2T29yQklRa3kzQUJraXVfNXl5Z0NEZTdtM19admg2Qzl3a1F4SnRCRWw0OW5aQ2N1bzFwNVlTRVFtYVE1Vy1IcWFIQVppODNucGZtcGRoczRQNHdfSk5uRXdqZjE3RHpRZnBSOWx6bTI0UUJkLXRN?oc=5,PUNE PULSE,2026-05-29T12:33:29+05:30,en,Maharashtra,Akola,"""heatstroke"" Maharashtra","Staff Reporter
Pune, 29 May 2026: Maharashtra has reported several heatstroke-related illnesses and deaths this summer as intense heat conditions continue to affect different parts of the state. According to health department data, a total of 17 deaths linked to heat-related complications have been recorded so far. Out of these, five deaths have been officially confirmed as caused by heatstroke, while 12 others are still under investigation.
The highest number of heat-related cases was reported from Chhatrapati Sambhajinagar. Other badly affected districts include Nandurbar with 26 cases, Nashik with 20, Gadchiroli with 19, and Wardha and Buldhana with 18 cases each.
Among the suspected deaths, Chhatrapati Sambhajinagar, Akola, Latur, and Jalgaon reported two cases each, while Yavatmal, Solapur, Nagpur, and Gadchiroli recorded one suspected death each. Confirmed heatstroke deaths were reported from Akola, Latur, Gadchiroli, and Jalgaon.",1.0
