title,url,source,date,language,state,district,search_term,full_text,relevance_score
"आज का जिले का मौसम : औरंगाबाद में आज पारा 36 डिग्री रहने की संभावना, लू का अलर्ट - Prabhat Khabar",https://news.google.com/rss/articles/CBMinwFBVV95cUxNOHNqVDRWMzhidWV3TkFnTW5JLTVPMlJHaXozM0VWTEhkZENLcnRmeTlKWUh0VHJabTZfTElKV3pmMG9vcW5QZ3FuaDNWM2ZwaHFrRnJfYnVsQUVodEdpell1cExBWTNiaXRCanQwYU9oRk9XckRhRWltbkFOa1RITHA5clllTVJQRk02Z2tkaTlfRTdZeXRrUW53WTFzQm_SAZ8BQVVfeXFMTThzalQ0VjM4YnVld05BZ01uSS01TzJSR2l6MzNFVkxIZGRDS3J0Znk5SllIdFRyWm02X0xJSld6ZjBvb3FuUGdxbmgzVjNmcGhxa0ZyX2J1bEFFaHRHaXpZdXBMQVkzYml0Qmp0MGFPaEZPV3JEYUVpbW5BTmtUSExwOXJZZU1SUEZNNmdrZGk5X0U3WXl0a1Fud1kxc0Jv?oc=5,Prabhat Khabar,2026-07-04T06:30:02+05:30,hi,Bihar,Aurangabad,"""लू"" Bihar","Aurangabad News : (सुधीर सिन्हा की रिपोर्ट) औरंगाबाद जिले में शनिवार (4 जुलाई 2026) को भीषण गर्मी का असर देखने को मिलेगा. दिन में लू चलने की संभावना है. जिले का अधिकतम तापमान 36 डिग्री सेंटीग्रेट तक पहुंच सकता है, जबकि न्यूनतम तापमान 27 डिग्री सेंटीग्रेट रहने का अनुमान है. इससे लोगों को गर्मी और उमस दोनों का सामना करना पड़ सकता है. मौसम वैज्ञानिक डॉ. अनूप चौबे ने बताया कि दिन में तेज धूप रहेगी और दोपहर के समय लू चलने की संभावना है. उन्होंने लोगों को अनावश्यक रूप से धूप में बाहर निकलने से बचने तथा लू से बचाव के लिए आवश्यक सावधानी बरतने की सलाह दी है. उन्होंने कहा कि आर्द्रता का स्तर अधिक रहने के कारण उमस भी लोगों को परेशान करेगी.
मौसम का पूर्वानुमान
अधिकतम तापमान : 36 डिग्री सेंटीग्रेट
न्यूनतम तापमान : 27 डिग्री सेंटीग्रेट
मौसम : दोपहर में लू चलने की संभावना
हवा की रफ्तार : 15 किमी प्रति घंटा
आर्द्रता : 64 से 79 प्रतिशत",1.0
"अचानक कलेक्ट्रेट पहुंची औरंगाबाद डीएम, गायब मिले 149 अधिकारियों का वेतन रोका, 24 घंटे में मांगा जवाब - Prabhat Khabar",https://news.google.com/rss/articles/CBMisgFBVV95cUxNNVR0Y0dERXI1TnBZRjV0bUdWRW5vWkNSdllDa0h4YlVVUl9adjV5bmxiTGRlQUk4cU9HcEZneUFaTlBsUWt6WXNZWHZTZG95VmExQU1BSGV3MWlzZ1NVWGxjalF4ZEExNk0tYmJXbExxVVg2MllrS3lsd3ZFUkhBMUZhcnVrRnlWOXhfZ0RPLXlFMEp5NWNhY0ktYlo5ZllpZzdMQ3JaRmJkUFVrQWs1TVd30gGyAUFVX3lxTE01VHRjR0RFcjVOcFlGNXRtR1ZFbm9aQ1J2WUNrSHhiVVVSX1p2NXlubGJMZGVBSThxT0dwRmd5QVpOUGxRa3pZc1lYdlNkb3lWYTFBTUFIZXcxaXNnU1VYbGNqUXhkQTE2TS1iYldsTHFVWDYyWWtLeWx3dkVSSEExRmFydWtGeVY5eF9nRE8teUUwSnk1Y2FjSS1iWjlmWWlnN0xDclpGYmRQVWtBazVNV3c?oc=5,Prabhat Khabar,2026-07-04T07:07:41+05:30,hi,Bihar,Aurangabad,"""लू"" Bihar","औरंगाबाद से सुजीत की रिपोर्ट
Aurangabad DM Action: औरंगाबाद में सरकारी कार्यालयों में समयपालन को लेकर जिला प्रशासन ने बड़ी कार्रवाई की है. जिला पदाधिकारी अभिलाषा शर्मा के औचक निरीक्षण में समाहरणालय के विभिन्न कार्यालयों से 149 अधिकारी और कर्मचारी अनुपस्थित मिले. डीएम ने सभी से 24 घंटे के भीतर स्पष्टीकरण मांगा है और संतोषजनक जवाब मिलने तक उनका वेतन स्थगित करने का आदेश दिया है.
Aurangabad DM Action: अचानक समाहरणालय पहुंची डीएम
जिला पदाधिकारी अभिलाषा शर्मा ने 2 जुलाई की सुबह करीब 10:15 बजे समाहरणालय परिसर के विभिन्न कार्यालयों का औचक निरीक्षण किया. निरीक्षण के दौरान 146 कर्मचारी और तीन जिला स्तरीय पदाधिकारी अपने कार्यालयों से अनुपस्थित पाए गए. डीएम ने इसे गंभीर प्रशासनिक लापरवाही मानते हुए तत्काल कार्रवाई के निर्देश दिए.
Aurangabad News: 24 घंटे में मांगा गया स्पष्टीकरण
अनुपस्थित पाए गए सभी अधिकारी और कर्मचारियों को 24 घंटे के भीतर अपना स्पष्टीकरण देने का निर्देश दिया गया है. जिला प्रशासन ने स्पष्ट किया है कि संतोषजनक जवाब मिलने तक संबंधित सभी का वेतन स्थगित रहेगा. यदि जवाब संतोषजनक नहीं पाया गया तो विभागीय कार्रवाई भी की जाएगी.
Aurangabad DM News: कई महत्वपूर्ण शाखाओं में अनुपस्थित मिले कर्मचारी
निरीक्षण के दौरान जिला सामान्य शाखा, भू-अर्जन, राजस्व, कोषागार, भविष्य निधि, स्थापना, योजना, सांख्यिकी, लोक शिकायत निवारण, बाल संरक्षण इकाई, सामाजिक सुरक्षा, विधि शाखा, अनुमंडल कार्यालय, कल्याण, आपूर्ति, नजारत, निर्वाचन, डाक शाखा, आपदा प्रबंधन और सूचना एवं जनसंपर्क सहित कई महत्वपूर्ण शाखाओं में बड़ी संख्या में कर्मचारी अनुपस्थित मिले.
तीन जिला स्तरीय अधिकारियों से भी जवाब तलब
डीएम ने केवल कर्मचारियों पर ही नहीं, बल्कि तीन जिला स्तरीय अधिकारियों से भी स्पष्टीकरण मांगा है. इनमें जिला कला एवं संस्कृति पदाधिकारी कुमार पप्पू राज, सहायक आपदा पदाधिकारी अंतर्रा कुमारी और आईटी प्रबंधक प्रदीप कुमार शामिल हैं.
समयपालन और कार्य संस्कृति पर प्रशासन सख्त
जिला प्रशासन का कहना है कि सरकारी कार्यालयों में समयपालन, जवाबदेही और कार्य संस्कृति को मजबूत करना प्राथमिकता है. इसी उद्देश्य से औचक निरीक्षण किए जा रहे हैं और लापरवाही मिलने पर नियमानुसार कार्रवाई की जाएगी.",0.0
