title,url,source,date,language,state,district,search_term,full_text,relevance_score
"Monsoon advances in Telangana, but heatwave grips northern districts - Hyderabad Mail",https://news.google.com/rss/articles/CBMilgFBVV95cUxNYTFtd3dRSk1jUWlWWEZvQmlMcjZTTDZrZTE1UlljTk9EcTN6aDdETTIxaDhOTWI3T25JR0ZSbXIzNVNFa3RCVURhQkRmU3EwZDJLOEpGUzZQMnQzbFktS2pJeTdEaldkZE83ek4tbDE4dmdIcnBKU2R2ZjcxblVrY0VQdzBxWV9OLUMxZmVDNWdSdFZULUE?oc=5,Hyderabad Mail,2026-06-12T09:12:06+05:30,en,Andhra Pradesh,Kurnool,"(heatwave OR ""heat wave"" OR ""severe heatwave"" OR ""extreme heat"" OR ""heat spell"" OR ""scorching heat"" OR ""blistering heat"" OR ""sweltering heat"" OR ""hot winds"" OR loo OR ""hot loo winds"" OR ""intense heat"" OR ""unbearable heat"" OR ""deadly heat"" OR heat OR ""weather forecast"" OR ""weather update"" OR ""weather alert"" OR ""IMD forecast"" OR ""IMD prediction"" OR ""IMD alert"" OR IMD OR ""rising temperatures"" OR ""temperatures expected to rise"" OR ""relief from heat"" OR ""respite from heat"" OR ""heat respite"" OR ""respite from scorching heat"") Andhra Pradesh","HYDERABAD: The southwest monsoon has advanced further into Telangana, but large parts of the state continue to experience heatwave conditions, with temperatures remaining above 40°C.
The India Meteorological Department (IMD) said conditions were favourable for the monsoon to cover the remaining parts of Telangana within the next two to three days.
Despite the monsoon’s progress, northern districts continued to record some of the highest temperatures in the state. Data from the Telangana Development Planning Society (TGDPS) showed that Mancherial and Peddapalli recorded a maximum temperature of 42.9°C.
Adilabad, Jagtial, Kumuram Bheem Asifabad, Mulugu, Nalgonda, Nirmal, Warangal and Rajanna Sircilla registered temperatures between 42.8°C and 42.2°C. The state’s average maximum temperature stood at 40.3°C.
Heatwave conditions were reported in Jainoor and Lingapur mandals of Kumuram Bheem Asifabad district, while Sirpur-U recorded severe heatwave conditions.
Hyderabad remained relatively cooler, with an average maximum temperature of about 39°C. The highest temperature of 39.9°C was recorded in Bandlaguda, Charminar, Amberpet, Secunderabad and Yousufguda. Most Greater Hyderabad Municipal Corporation (GHMC) circles reported temperatures between 38.5°C and 39.5°C.
Uneven rainfall pattern
Rainfall remained uneven across Telangana. Bhadradri Kothagudem recorded the highest cumulative rainfall surplus since June 1, followed by Khammam and Mulugu. Hyderabad also remained in the excess rainfall category.
The IMD has forecast light to moderate rain and thundershowers across Telangana over the next three days.
Heavy rain is likely at isolated places in Nalgonda, Suryapet, Mahabubabad and Nagarkurnool districts. Thunderstorms accompanied by lightning and gusty winds of 40-50 kmph are expected in Hyderabad and several neighbouring districts.
For Hyderabad, partly cloudy skies and evening or night thundershowers are likely over the next few days. According to TGDPS forecasts, maximum temperatures could ease to around 36°C to 37°C by the weekend.",1.0
