title,url,source,date,language,state,district,search_term,full_text,relevance_score
"Delhi NCR Weather: दिल्ली-NCR में पड़ेगी भीषण गर्मी, जानें बारिश होगी या नहीं, जानें क्या कहता है IMD का अनुमान - Zee News",https://news.google.com/rss/articles/CBMi7gFBVV95cUxPSWhLUjk2OEVOVWR0MTZ0bkdjZ1d3Zm4wOWJpbFFfS3dpa1RuRmRsRDJCNmxvQlZ2cm0wU2tYSzZIeGRTVkhRakFPSTBWNFZHa3dKNGdrc0lleHRqdDVGcXpiWVpnQzRnWWpNOTRyU29Qc19MaC13SzBOSUxYNVZmaE5OVmZtMkNvVm9HNFdYbWx1QnN4Y200aGw5dk9PeHhuX2twQjlOOGxPVzlwU0t3LUZvM1BFVGdib1VJVVYtV1FsT0daMG1aem5Va3pzeTJkZlA5UWNvREdWdXp5eDBMUTY5UC16NFV6Q1puaUN3?oc=5,Zee News,2026-04-09T06:17:04+05:30,hi,Uttar Pradesh,,"(लू OR ""लू चलना"" OR ""भीषण गर्मी"" OR ""प्रचंड गर्मी"" OR ""कड़ी धूप"" OR ""तेज धूप"" OR ""गर्म हवा"" OR ""उष्ण लहर"" OR ""ताप लहर"" OR ""हीट वेव"" OR ""झुलसाने वाली गर्मी"" OR ""तपती गर्मी"" OR ""भयंकर गर्मी"" OR ""गर्मी का कहर"" OR ""गर्मी का प्रकोप"" OR ""अत्यधिक गर्मी"" OR मौसम OR ""मौसम अपडेट"" OR ""मौसम का हाल"" OR ""मौसम पूर्वानुमान"" OR ""मौसम अलर्ट"" OR आईएमडी OR ""आईएमडी पूर्वानुमान"" OR ""आईएमडी अलर्ट"" OR ""तापमान में बढ़ोतरी"" OR ""गर्मी से राहत"" OR ""गर्मी से निजात"") Uttar Pradesh","Zee Delhi-NCR-HaryanaPhotosDelhi NCR Weather: दिल्ली-NCR में पड़ेगी भीषण गर्मी, जानें बारिश होगी या नहीं, जानें क्या कहता है IMD का अनुमान
photoDetails0hindihindi0
Delhi NCR Weather: दिल्ली-NCR में पड़ेगी भीषण गर्मी, जानें बारिश होगी या नहीं, जानें क्या कहता है IMD का अनुमान
पिछले कुछ हफ्तों से दिल्ली-एनसीआर के लोगों को जिस खुशनुमा मौसम की आदत पड़ गई थी, वह अब बदलने वाला है. मार्च के मध्य से लगातार आ रहे पश्चिमी विक्षोभ के कारण बारिश, आंधी और ठंडी हवाओं का दौर जारी था.
भारतीय मौसम विज्ञान विभाग के अनुसार, आज से दिल्ली और इसके आस-पास के इलाकों में मौसम पूरी तरह साफ हो जाएगा. आज के दिन अधिकतम तापमान 32°C और न्यूनतम तापमान 17°C के आसपास रहने का अनुमान है.
2/5
आज सुबह से ही तेज धूप खिलेगी. हवा की रफ्तार 10 से 20 किलोमीटर प्रति घंटे रह सकती है. आसमान में कुछ हल्के बादल आ-जा सकते हैं, लेकिन इससे बढ़ती गर्मी पर कोई खास लगाम नहीं लगेगी. हालांकि, अभी तक मौसम विभाग ने 'लू' को लेकर कोई अलर्ट जारी नहीं किया है.
3/5
IMD के नए अपडेट के अनुसार, अगले कुछ ही दिनों में पारे में भारी उछाल देखने को मिलेगा. 10 से 14 अप्रैल के बीच दिन का अधिकतम तापमान तेजी से बढ़कर 38°C तक जा सकता है. रात का न्यूनतम तापमान भी बढ़कर 22°C के करीब पहुंचने की संभावना है.
4/5
14 अप्रैल के बाद का कोई आधिकारिक अलर्ट अभी नहीं है, लेकिन मौसम विशेषज्ञों का मानना है कि इसके बाद मौसम पूरी तरह से शुष्क हो जाएगा और तेज, चुभने वाली धूप निकलेगी.
5/5
स्काईमेट वेदर के वरिष्ठ मौसम विज्ञानी डॉ. महेश पालावत के अनुसार, पश्चिमी विक्षोभ का असर अब मैदानी इलाकों से खत्म होकर केवल पहाड़ों तक सिमट रहा है. इसका असर देशभर में कुछ इस तरह दिखेगा.
By clicking “Accept All Cookies”, you agree to the storing of cookies on your device to enhance site navigation, analyze site usage, and assist in our marketing efforts.",1.0
ह्यू राज्य ने लू के खतरे के अलर्ट स्तर को बढ़ाकर स्तर 2 कर दिया है। - Vietnam.vn,https://news.google.com/rss/articles/CBMihwFBVV95cUxOZ3d2dGhMcE5ZVkwyWW9RcHZCQlp1TnZYczdkdFpibFdfZlFUaU0zZk0ySHk0RmZ4OW1WSS1lQjlLQVAtS1ZCM1ZrWkRXc2lwZ1hQSnVSOFFEMEFTUnVkalBrZmo5R2xPbzNwVEdaWU0wY2lVMWFsSFV5Tkx2Nm5ncjJ6RlRqYkk?oc=5,Vietnam.vn,2026-04-09T09:02:20+05:30,hi,Uttar Pradesh,,"""लू"" Uttar Pradesh","इस स्तर की गर्मी को सीधे तौर पर चिंताजनक रूप से गर्म माना जा सकता है, जिसके लिए लोगों को दोपहर के समय, विशेष रूप से सुबह 10 बजे से शाम 4 बजे के बीच, बाहर निकलने से बचना चाहिए; लोगों को पर्याप्त पानी पीना चाहिए और अपने स्वास्थ्य की रक्षा करनी चाहिए।
ह्यू शहर में अगले 24 से 48 घंटों (9-10 अप्रैल) के लिए पूर्वानुमान यह दर्शाता है कि एक विस्तृत क्षेत्र में तीव्र और अत्यधिक तीव्र गर्मी जारी रहेगी, जिसमें अधिकतम तापमान आमतौर पर 38.0 से 40.0 डिग्री सेल्सियस के बीच रहेगा और कुछ स्थानों पर 40.0 डिग्री सेल्सियस से अधिक हो जाएगा; न्यूनतम आर्द्रता 30-40% रहेगी।
चेतावनी: अगले 72 से 120 घंटों (11-13 अप्रैल) के दौरान, ह्यू शहर में व्यापक रूप से भीषण गर्मी जारी रहेगी, कुछ क्षेत्रों में असाधारण रूप से भीषण गर्मी पड़ेगी। अधिकतम तापमान 37.0 से 40.0 डिग्री सेल्सियस तक पहुंच जाएगा और न्यूनतम आर्द्रता 30 से 45% रहेगी। भीषण गर्मी का यह दौर कई और दिनों तक जारी रहने की संभावना है।
पिछले 24 घंटों में, ह्यू शहर के एक बड़े क्षेत्र में भीषण और असाधारण रूप से भीषण लू चली है। कल (8 अप्रैल) सभी स्थानों पर उच्चतम तापमान 2025 के उच्चतम तापमान से अधिक रहा, और न्यूनतम आर्द्रता का स्तर ऐतिहासिक रिकॉर्ड तोड़ गया।
विशेष रूप से, ह्यू स्टेशन पर मापा गया तापमान 39.8°C था (जो 2025 में 38.7°C से अधिक था), और न्यूनतम आर्द्रता 28% थी (जो अप्रैल के ऐतिहासिक मान 32% से अधिक थी); नाम डोंग स्टेशन पर तापमान 40.0°C था (जो 2025 में 38.8°C से अधिक था), और न्यूनतम आर्द्रता 32% थी; और ए लुओई स्टेशन पर तापमान 37.0°C था (जो 2025 में 36.1°C से अधिक था), और न्यूनतम आर्द्रता 29% थी (जो अप्रैल के ऐतिहासिक मान 32% से अधिक थी)।
स्रोत: https://huengaynay.vn/kinh-te/hue-nang-muc-do-canh-bao-rui-ro-do-nang-nong-len-cap-2-164480.html",1.0
