title,url,source,date,language,state,district,search_term,full_text,relevance_score
"धार: भीषण गर्मी के बीच नर्मदा घाटों पर बढ़ी रौनक, स्नान और मौज-मस्ती के बीच सुरक्षा नियमों की अनदेखी पड़ सकती है भारी - Nai Dunia",https://news.google.com/rss/articles/CBMinwJBVV95cUxQRm1MaEpYRF80dU02TFZmMjRzXzF0SDV5ajNNUDA3LXlYR0cwWVRvX19kYmI3NTZUV3FaSmtRTW5oX0RXaUZlREdwTDZLcFFLZ09EOHA2Q2pjSmYtVUw4RW9LOVpIanBJY0NJejVROTB3MVZ1TGxDUEQtOFJUa1UxNl9ocHh1NGhSVjFhYTBPZWo2NDZaWktfa1cweWpNdmNCNnVTWFhncXlZMVpDTDlIdnZiUmtUSzBCWE93eS0zWFhZRGxlTkMtU2Nabm8xVDdMQlNTOFJZbmNzbmMySTRXbF9nLVBvS0RIWXJrSENwa3JCVXRLMndTOFY2TldLVXZIV0xoZDVIaEo4by1JcHB2ZFh5WnJOX1duNUlLdWxwYw?oc=5,Nai Dunia,2026-05-17T12:47:44+05:30,hi,Madhya Pradesh,Dhar,"(लू OR ""लू चलना"" OR ""भीषण गर्मी"" OR ""प्रचंड गर्मी"" OR ""कड़ी धूप"" OR ""तेज धूप"" OR ""गर्म हवा"" OR ""उष्ण लहर"" OR ""ताप लहर"" OR ""हीट वेव"" OR ""झुलसाने वाली गर्मी"" OR ""तपती गर्मी"" OR ""भयंकर गर्मी"" OR ""गर्मी का कहर"" OR ""गर्मी का प्रकोप"" OR ""अत्यधिक गर्मी"" OR मौसम OR ""मौसम अपडेट"" OR ""मौसम का हाल"" OR ""मौसम पूर्वानुमान"" OR ""मौसम अलर्ट"" OR आईएमडी OR ""आईएमडी पूर्वानुमान"" OR ""आईएमडी अलर्ट"" OR ""तापमान में बढ़ोतरी"" OR ""गर्मी से राहत"" OR ""गर्मी से निजात"") Madhya Pradesh","धार: भीषण गर्मी के बीच नर्मदा घाटों पर बढ़ी रौनक, स्नान और मौज-मस्ती के बीच सुरक्षा नियमों की अनदेखी पड़ सकती है भारी
दिन चढ़ने के साथ घाटों पर भीड़ बढ़ती जाती है और यह सिलसिला शाम तक जारी रहता है। बढ़ती भीड़ और उत्साह के बीच एक गंभीर चिंता भी सामने आ रही है। ...और पढ़ें
नर्मदा तट चिड़िया संगम पर बड़ी संख्या में पहुंच रहे हैं लोग। (नईदुनिया प्रतिनिधि)
HighLights
दिन चढ़ने के साथ घाटों पर भीड़ बढ़ती जाती है और यह सिलसिला शाम तक जारी रहता है
बढ़ती भीड़ और उत्साह के बीच एक गंभीर चिंता भी लगातार सामने आ रही है
नर्मदा घाटों पर स्नान के दौरान लोगों की बढ़ती लापरवाही हादसों को न्योता दे रही है
नईदुनिया न्यूज, टवलाई (धार)। भीषण गर्मी के साथ ही नर्मदा घाटों पर लोगों की आवाजाही बढ़ने लगी है। सुबह की पहली किरण के साथ ही लोग नदी किनारे पहुंचने लगते हैं। कोई स्नान के लिए आता है, कोई बच्चों के साथ समय बिताने, तो कोई दोस्तों संग ठंडे पानी में राहत तलाशने। दिन चढ़ने के साथ घाटों पर भीड़ बढ़ती जाती है और यह सिलसिला शाम तक जारी रहता है। इस बढ़ती भीड़ और उत्साह के बीच एक गंभीर चिंता भी लगातार सामने आ रही है। नर्मदा घाटों पर स्नान के दौरान लोगों की बढ़ती लापरवाही हादसों को न्योता दे रही है।
पिछले कुछ वर्षों में गर्मी के मौसम में नर्मदा नदी में डूबने और दुर्घटनाओं की कई घटनाएं सामने आ चुकी हैं। अधिकांश मामलों में सुरक्षा नियमों की अनदेखी ही मुख्य कारण बनती है। घाटों पर अक्सर युवा गहरे पानी तक जाने की कोशिश करते दिखाई देते हैं। कई बार तैराकी पूरी तरह नहीं आने के बावजूद नदी के बीच तक पहुंचने की होड़ लगी रहती है। कुछ युवक ऊंचे पत्थरों से छलांग लगाकर रोमांच तलाशते हैं, तो कई लोग इंटरनेअ मीडिया के लिए वीडियो बनाने के दौरान खतरे को नजरअंदाज कर देते हैं।
हर घाट पर बहाव एक जैसा नहीं होता
लोगों के अनुसार नर्मदा का बहाव हर घाट पर एक जैसा नहीं होता। कई स्थानों पर पानी ऊपर से शांत दिखाई देता है, लेकिन कुछ कदम आगे बढ़ते ही गहराई अचानक बढ़ जाती है। कई घाटों पर फिसलन भरे पत्थर हैं, जबकि कुछ जगह तेज बहाव संतुलन बिगाड़ देता है। गोताखोरों का कहना है कि अधिकांश हादसों में लोग मदद के लिए तब आवाज लगाते हैं, जब स्थिति पूरी तरह नियंत्रण से बाहर हो चुकी होती है। गर्मी की छुट्टियों के दौरान बड़ी संख्या में बच्चे परिवार के साथ घाटों पर पहुंचते हैं। ऐसे में अभिभावकों की थोड़ी-सी असावधानी भी बच्चों को खतरे के करीब पहुंचा सकती है। घाटों पर मौजूद लोगों का कहना है कि बच्चों को अकेले पानी में उतरने देना सबसे बड़ा जोखिम साबित हो सकता है।
जागरूकता और सतर्कता ही बचाव का उपाय
सुरक्षा से जुड़े लोगों का मानना है कि नदी में स्नान को लेकर लोगों की सोच बदलने की जरूरत है। नर्मदा को केवल मौज-मस्ती का स्थान मानना खतरनाक हो सकता है। नदी में उतरते समय यह समझना जरूरी है कि पानी की गहराई, बहाव और सतह का अंदाजा हमेशा आंखों से नहीं लगाया जा सकता। विशेषज्ञों के अनुसार लोगों को केवल निर्धारित सुरक्षित क्षेत्रों में ही स्नान करना चाहिए। चेतावनी वाले स्थानों से दूर रहना और समूह में सतर्कता बनाए रखना बेहद जरूरी है।
This website uses cookie or similar technologies, to enhance your browsing experience and provide personalised recommendations. By continuing to use our website, you agree to our Privacy Policy and Cookie Policy.",1.0
