title,url,source,date,language,state,district,search_term,full_text,relevance_score
ગુજરાતમાં અંગ દઝડાતી ગરમી વચ્ચે અંબાલાલ પટેલે શું કરી મોટી આગાહી? - Mumbai Samachar,https://news.google.com/rss/articles/CBMipwFBVV95cUxOUHNTclJuY19DOV9pSjBUT0hsRFVTVGFFbEJZeHFxQXM4WGlsZDRVTjlsNWs4dGlldVk2VWlOMnNyb1lMNDZYSURhdEc1S0FTTDQyRUlEN0M5YnpqR25RLWtkRnItMzFmenRtNkxlWjM5RFFtZUhfdlloRGlaOV9XNTd0SHNxVklrVm5xUDgtdTNsb1h1dnViUnRlUVVPakVYYW5qV0ZnQQ?oc=5,Mumbai Samachar,2026-06-09T11:12:51+05:30,gu,Gujarat,Ahmedabad,"(""ભારે ગરમી"" OR ""આકરી ગરમી"" OR લૂ OR હીટવેવ OR ""ઉષ્ણ મોજું"" OR ""ગરમીનો પ્રકોપ"" OR તાપ OR ""આકરો તાપ"" OR ""અસહ્ય ગરમી"" OR ""ભયાનક ગરમી"") Gujarat","અમદાવાદઃ રાજ્યમાં હાલ અંગ દઝાડતી ગરમી પડી રહી છે. ઘણા શહેરોમાં તાપમાન 40 ડિગ્રી સેલ્સિયસને પાર પહોંચી ગયું છે. અમદાવાદમાં હીટવેવનો અનુભવ થઈ રહ્યો છે. રાજ્યમાં પડી રહેલી કાળઝાળ ગરમી વચ્ચે જાણીતા હવામાન શાસ્ત્રી અંબાલાલ પટેલે મોટી આગાહી કરી છે. જે મુજબ ગુજરાતમાં થોડા દિવસો ગરમીનો પ્રકોપ યથાવત્ રહેશે, પરંતુ મે મહિનામાં કુદરતનો અલગ જ મિજાજ જોવા મળી શકે છે.
અંબાલાલ પટેલે શું કરી મોટી આગાહી
અંબાલાલ પટેલની આગાહી મુજબ, 6થી 10 મે દરમિયાન ગુજરાત સહિત દેશભરના હવામાનમાં પલટો આવશે અને પ્રી-મોન્સૂન એક્ટિવિટી શરૂ થઈ શકે છે. જ્યારે 11થી 20 મે દરમિયાન રાજ્યમાં ભારે પવન અને વંટોળ ફૂંકાશે. આ ગાળા દરમિયાન વાવાઝોડા જેવો માહોલ સર્જાવાની શક્યતા છે, જેમાં પવનની ગતિ 25 કિમી પ્રતિ કલાક કે તેથી વધુ રહી શકે છે. આ કુદરતી આફતને કારણે કાચા મકાનો અને પતરાં ઉડવાની ભીતિ સેવાઈ રહી છે. આ ઉપરાંત 23 મે દરમિયાન ફરી એકવાર હવામાન અણધાર્યો વળાંક લેશે. ગરમી અને વંટોળની સાથે સમુદ્રી હલચલ પણ વધશે. 15 મે પછી બંગાળની ખાડીમાં ચક્રવાત સર્જાવાની શક્યતા છે, જે જૂનની શરૂઆત સુધી સક્રિય રહી શકે છે. તેવી જ રીતે, અરબી સમુદ્રમાં પણ 15 જૂન સુધી વાવાઝોડાની ગતિવિધિઓ જોવા મળી શકે છે. અંડમાન-નિકોબારમાં 12 મેથી વરસાદની શરૂઆત થઈ જશે અને 28 મે બાદ ત્યાં ભારે વરસાદની આગાહી છે.
અમદાવાદમાં 44 ડિગ્રી તાપમાન રહેવાની શક્યતા
સમગ્ર રાજ્યમાં ઉનાળાએ આકરું સ્વરૂપ ધારણ કર્યું હોય તેમ આકાશમાંથી અગનગોળા વરસી રહ્યાં છે. બપોરના સમયે તો ચામડી બાળી નાખતી ગરમીનો અહેસાસ થઇ રહ્યો છે. વામાન વિભાગની આગાહી મુજબ, આગામી ત્રણ દિવસ દરમિયાન રાજ્યના આંતરિક વિસ્તારોમાં પારો 40થી 44 ડિગ્રીની વચ્ચે રહેવાની શક્યતા છે. જોકે, રાહતના સમાચાર એ છે કે આગામી ચાર દિવસમાં મહત્તમ તાપમાનમાં 2થી3 ડિગ્રીનો ધીમેધીમે ઘટાડો થઈ શકે છે. જ્યારે બુધવારે અમદાવાદનું તાપમાન 44 ડિગ્રીની આસપાસ રહેવાની શક્યતા છે.
અમદાવાદમાં મહત્તમ તાપમાન 43.2 નોંધાયું હતું, જે સામાન્ય કરતા 1.6 ડિગ્રી વધારે હતું. જ્યારે 43.6 ડિગ્રી સાથે રાજકોટ રાજ્યનું સૌથી હોટ શહેર બન્યું હતું. રાજ્યના અન્ય ભાગોમાં પણ કાળઝાળ ગરમી યથાવત રહી હતી ત્યારે હવામાન વિભાગે આગાહી કરતા જણાવ્યું છે કે, સૌરાષ્ટ્ર-કચ્છના દરિયાકાંઠાના વિસ્તારોમાં ગરમ અને ભેજવાળા પવનોને કારણે અસ્વસ્થતા વધશે. આ વિસ્તારો માટે હવામાન વિભાગ દ્વારા ‘યલો એલર્ટ’ જાહેર કરવામાં આવ્યું છે. અમરેલીમાં 42.9 ડિગ્રી, વડોદરામાં 41.6 ડિગ્રી, ભાવનગરમાં 39.7 ડિગ્રી, ભુજમાં 40 ડિગ્રી, દાહોદમાં 38.3 ડિગ્રી, દમણમાં 36.8 ડિગ્રી, ડીસામાં 41.8 ડિગ્રી, દીવમાં 32.5 ડિગ્રી, દ્વારકામાં 33.5 ડિગ્રી, ગાંધીનગરમાં 42.8 ડિગ્રી, કંડલામાં 39.0 ડિગ્રી, નલીયામાં 37.8 ડિગ્રી, ઓખામાં 36.0 ડિગ્રી, પોરબંદરમાં 35.1 ડિગ્રી, સુરતમાં 35.2 ડિગ્રી, વેરાવળમાં 32.4 ડિગ્રી તાપમાન નોંધાયું હતું.
દેશના અન્ય રાજ્યોમાં કેવું રહેશે હવામાન
દિલ્હી, હરિયાણા અને ઉત્તર પ્રદેશના કેટલાક વિસ્તારમાં ભયાનક ગરમીથી પરેશાન લોકોને આજે રાહત મળી હતી. આંધી અને વરસાદના કારણે મોસમનો મિજાજ બદલાયો હતો. તાપમાનનો પારો ગગડતાં લોકોએ રાહતનો શ્વાસ લીધો હતો. પૂર્વોત્તર ભારતમાં વરસાદની સાથે ગાજવીજ થશે. તેમજ 40 - 60 કિમી પ્રતિ કલાકની ઝડપે પવન ફૂંકાશે. બિહાર અને રાજસ્થાનમાં પણ વરસાદનું એલર્ટ આપવામાં આવ્યું છે. મિઝોરમના 9 જિલ્લામાં ભારે વરસાદનું એલર્ટ છે. જમ્મુ-કાશ્મીરમાં મધ્યમથી ભારે વરસાદની સંભાવના છે.",0.8
"Gujarat Weather Forecast 10 June | આવતીકાલનું હવામાન: ગુજરાતમાં આગામી 7 દિવસ આકરી ગરમીનો પ્રકોપ યથાવત, જાણો 15 જૂન સુધી કયા જિલ્લાઓમાં છે વરસાદની આગાહી? - Gujarati Jagran",https://news.google.com/rss/articles/CBMi5AFBVV95cUxNS0Y1R3VCOWwzSV9CZE50X1VteTdQZjBWSU1JcXA1am5nZ2JKTVNYZ0YwSm9ZUm1hVXlCd05QV0Y2VE1tRVlrb1dhMUZwdERxUWdjaXhDbVl3c0dGRnc2VFF5dkpqdWszcVRWajFVMkNkaFFfdVBacG1qT0hTSlZXb2JrclFITUJpRUltYi1TZkFDdkdBVG9CczBvU0pBRnBJaC1paDl1YUowSkVSVTBhZDBWaWxCTE9kQ2p5Sk8xeU9PQ0hVU0RhYlp0ZGRiQW14bnBFTk5kVl9KaDNldW5NWGQtZ2E?oc=5,Gujarati Jagran,2026-06-09T15:20:00+05:30,gu,Gujarat,Ahmedabad,"(""ભારે ગરમી"" OR ""આકરી ગરમી"" OR લૂ OR હીટવેવ OR ""ઉષ્ણ મોજું"" OR ""ગરમીનો પ્રકોપ"" OR તાપ OR ""આકરો તાપ"" OR ""અસહ્ય ગરમી"" OR ""ભયાનક ગરમી"") Gujarat","Gujarat Weather Forecast 10 June | આવતીકાલનું હવામાન: ગુજરાતમાં કાળઝાળ ગરમી યથાવત છે. અમદાવાદ સહિતના શહેરોમાં ગરમીનો પારો 40 ડિગ્રીથી ઉપર નોંધાઇ રહ્યો છે. ચોમાસું ગુજરાત તરફ આગળ વધી રહ્યું છે. જેની અસર આગામી દિવસોમાં સૌરાષ્ટ્ર્ અને દક્ષિણ ગુજરાતનના કેટલાક ભાગોમાં જોવા મળી શકે છે. જેના પગલે હવામાન વિભાગે આગામી 15 જૂન સુધી રાજ્યમાં ખાસ કરીને દક્ષિણ ગુજરાત, સૌરાષ્ટ્ર અને મધ્ય ગુજરાતના કેટલાક ભાગોમાં છૂટાછવાયા સ્થળોએ હળવોથી મધ્યમ વરસાદ થવાની શક્યતા વ્યક્ત કરી છે.
રાજ્યમાં કેવો રહેશે ગરમીનો પ્રકોપ
હવામાન વિભાગ અનુસાર આગામી સાત દિવસ દરમિયાન રાજ્યના તાપમાનમાં કોઇ મોટો ફેરફાર થવાની શક્યતા નથી. એટલે કે અમદાવાદ, વડોદરા, સુરત, રાજકોટ, ડીસા, સુરેન્દ્રનગર સહિત રાજ્યના વિવિધ ભાગોમાં હાલ જે પ્રકારની ગરમીનો અનુભવ થઇ રહ્યો છે તેવી જ ગરમી આગામી સમયમાં પણ યથાવત રહી શકે છે.
9થી 12 જૂન આ જિલ્લાઓમાં જોવા મળી શકે મેઘાવી માહોલ
હવામાન વિભાગ અનુસાર, આજે 9 જૂનથી 12 જૂન દરમિયાન દક્ષિણ ગુજરાતના કેટલાક જિલ્લાઓમાં મેઘાવી માહોલ જોવા મળી શકે છે. ખાસ કરીને નવસારી, તાપી, ડાંગ અને વલસાડ જિલ્લામાં છૂટાછવાયા સ્થળોએ ગાજવીજ સાથે હળવોથી મધ્યમ વરસાદ થઇ શકે છે.
13 જૂનના રોજ ક્યાં થઇ શકે છે વરસાદ
13 જૂન 2026ના રોજ સૌરાષ્ટ્ર અને દક્ષિણ ગુજરાતમાં વરસાદની શક્યતા છે. ગીર સોમનાથ, અમરેલી, ભાવનગર, સુરત, તાપી, નવસારી, વલસાડ, ડાંગ, નર્મદા અને છોટા ઉદેપુર જિલ્લામાં છૂટાછવાયા સ્થળોએ હળવોથી મધ્યમ વરસાદ થઇ શકે છે.
14 અને 15 જૂનના રોજ ક્યાં થઇ શકે છે વરસાદ
14 અને 15 જૂનના રોજ મધ્ય ગુજરાત, દક્ષિણ ગુજરાત અને સૌરાષ્ટ્રમાં વરસાદ થઇ શકે છે. મહીસાગર, પંચમહાલ, દાહોદ, વડોદરા, નર્મદા, છોટા ઉદેપુર, ભરૂચ, સુરત, તાપી, ડાંગ, નવસારી, વલસાડ, ગીર સોમનાથ, અમરેલી, ભાવનગર જિલ્લામાં છૂટાછવાયા સ્થળોએ હળવોથી મધ્યમ વરસાદ થઇ શકે છે.
કેટલે પહોંચ્યું ચોમાસું
નૈઋત્યનું ચોમાસું દેશના ઉત્તર-પૂર્વીય રાજ્યો અને પશ્ચિમ બંગાળમાં આગળ વધી રહ્યું છે, જેના પગલે આગામી દિવસોમાં ગુજરાતના વાતાવરણમાં પણ પલટો આવવાની શક્યતા છે. નૈઋત્યના ચોમાસાએ 9 જૂન સુધીમાં ઉત્તર-પૂર્વના બાકીના તમામ રાજ્યો, સમગ્ર સિક્કિમ અને પશ્ચિમ બંગાળના કેટલાક ભાગોમાં પોતાની પકડ મજબૂત કરી લીધી છે. હવામાન વિભાગના મતે આગામી 4 થી 5 દિવસમાં મહારાષ્ટ્ર, કર્ણાટક, તેલંગાણા, આંધ્રપ્રદેશ અને ઓડિશાના વધુ વિસ્તારોમાં વરસાદી પવન પહોંચવા માટે સ્થિતિ સાનુકૂળ છે. આ ફેરફારોની સાથે જ 11 જૂનથી હિમાલયના પશ્ચિમ ભાગોમાં એક નવા વેસ્ટર્ન ડિસ્ટર્બન્સની અસર જોવા મળે તેવી શક્યતા છે.",0.8500000000000001
"Ahmedabad Weather Forecast, 9 June: અમદાવાદમાં આજે પણ આકરી ગરમી અનુભવાશે, જાણો હવામાન વિભાગની લેટેસ્ટ આગાહી - Gujarati Jagran",https://news.google.com/rss/articles/CBMi4AFBVV95cUxNZVROc3NCdEllLVRtUE5PZGpsaWQ3emxEY0R2MVJIcG5pUmV3Mm1KdDRtRzJfQzhqbF9hQkowbm41T0cxNmR3azVSSUtCSVFXWjZmVWM1S2wwY1Z4VlAxUWZiOW0yUmUtb3UtT3NadGZjcFBHWWktenJwbEF0SF9KNzNKbnZ1Y2hKeFlTTWw0ak45U1N1TTVON3pmY1lzUmNaZFQwME5laXhzczY3OVFNR28wUU1uQmtDN0ZlRzl0Q0E2M3lMUm9HR09hYVpqSWlndGg4aGxIT1FoLWd5Yld3Rg?oc=5,Gujarati Jagran,2026-06-09T06:30:00+05:30,gu,Gujarat,Ahmedabad,"(""ભારે ગરમી"" OR ""આકરી ગરમી"" OR લૂ OR હીટવેવ OR ""ઉષ્ણ મોજું"" OR ""ગરમીનો પ્રકોપ"" OR તાપ OR ""આકરો તાપ"" OR ""અસહ્ય ગરમી"" OR ""ભયાનક ગરમી"") Gujarat","Ahmedabad Weather Forecast, 9 June: ગુજરાતમાં વાદળછાયા વાતવરણ વચ્ચે ગરમીનો પ્રકોપ યથાવત છે. દક્ષિણ ગુજરાત સહિતના વિસ્તારોમાં હવામાન વિભાગ દ્વારા વરસાદી ઝાપટાંની આગાહી કરવામાં આવી છે. જોકે અમદાવાદમાં ગઇકાલની જેમ આજે પણ આકરી ગરમી અનુભવાશે. હવામાન વિભાગ અનુસાર આજે પણ અમદાવાદમાં ગરમીનો પારો 42 ડિગ્રી કે તેથી વધુ નોંધાઇ શકે છે.
હવામાન વિભાગની શું છે આગાહી
હવામાન વિભાગ અનુસાર, અમદાવાદ શહેરમાં આજે આંશિક રીતે વાદળછાયું વાતાવરણ જોવા મળી શકે છે. મહત્તમ તાપમાન 42 ડિગ્રી રહી શકે છે. જ્યારે લઘુત્તમ તાપમાન 30 ડિગ્રી રહેવાની શક્યતા છે. અમદાવાદ શહેરમાં ગઇકાલે મહત્તમ તાપમાન 42.2 ડિગ્રી રહ્યું હતું. જ્યારે લઘુત્તમ તાપમાન 29.9 ડિગ્રી નોંધાયું હતું.
આ જિલ્લાઓમાં વરસાદની શક્યતા
ચોમાસાની ઉત્તરીય સીમા હાલમાં હરનાઈ, સોલાપુર અને કુર્નૂલ થઈને પસાર થઈ રહી છે. આગામી 2 થી 3 દિવસમાં મહારાષ્ટ્ર, કર્ણાટક, તેલંગાણા અને છત્તીસગઢના વધુ ભાગોમાં ચોમાસું આગળ વધવા માટે સાનુકૂળ સંજોગો છે. બંગાળની ખાડીમાં પણ ચોમાસું ઝડપથી આગળ વધી રહ્યું છે, જેની અસર આગામી અઠવાડિયામાં મધ્ય ભારત પર જોવા મળશે. 14 જૂન સુધીના સમયગાળા દરમિયાન પોરબંદર, જૂનાગઢ, ગીર સોમનાથ, અમરેલી, ભાવનગર, અરવલ્લી, મહીસાગર, પંચમહાલ, દાહોદ, વડોદરા, છોટા ઉદેપુર, ભરૂચ, નર્મદા, સુરત, તાપી, નવસારી, ડાંગ, વલસાડ જિલ્લામાં છૂટાછવાયા સ્થળોએ હળવોથી મધ્યમ વરસાદ થઇ શકે છે.",1.0
ગુજરાતમાં આગામી 7 દિવસ કેવું રહેશે હવામાન? જાણો લેટેસ્ટ આગાહી - Mumbai Samachar,https://news.google.com/rss/articles/CBMiuAFBVV95cUxPMnpSUjFDcVZxNFM5RHhBUXlnZk5UQ1Q4eU9ROFZtRGFXUUR2RXh2Y3l2dGVzNno4Z3V4aDRsV01lMGtyYk9DQkpQNWN1NmhvTzE2S1pMdGVReEc4T01idF9hVFV4c0J1YXJNN0hQZG93OXdKbTg1VS1QOC1BRnRiWl8yM25URUhLV2p2WTNEWXJSanhRTW5Lb21wT2piVzlURVVYNHo1bXdNNjFSRHRPMFdKZFhjMXdI?oc=5,Mumbai Samachar,2026-06-09T03:53:58+05:30,gu,Gujarat,Ahmedabad,"(તાપમાન OR ""તાપમાન વધ્યું"" OR ""પારો ચઢ્યો"" OR ""ડિગ્રી સેલ્સિયસ"" OR ""મહત્તમ તાપમાન"" OR ""વિક્રમી તાપમાન"") Gujarat","અમદાવાદઃ ગુજરાતમાં આવતીકાલે સ્થાનિક સ્વરાજ્યની ચૂંટણીનું મતદાન યોજાશે. હવામાન વિભાગ દ્વારા તા. 02-05-2026 સુધીનું પૂર્વાનુમાન જાહેર કરવામાં આવ્યું છે. જે મુજબ આગામી બે દિવસ દરમિયાન મહત્તમ તાપમાનમાં ધીમે ધીમે 2-3 ડિગ્રી સેલ્સિયસનો વધારો થશે. ત્યારબાદ રાજ્યમાં 2-3 ડિગ્રી સેલ્સિયસનો ઘટાડો થશે. આગામી બે દિવસ રાજ્યના અંતરિયાળા વિસ્તારોના છૂટાછવાયા ભાગોમાં મહત્તમ તાપમાન 41 ડિગ્રી થી 44 ડિગ્રી સેલ્સિયસની રેન્જમાં અને દરિયાકાંઠાના વિસ્તારોના છૂટાછવાયા ભાગોમાં 35 થી 40 ડિગ્રી સેલ્સિયસની રેન્જમાં રહેવાની સંભાવના છે. આગામી 7 દિવસ સુધી રાજ્યના તમામ જિલ્લાઓ, સૌરાષ્ટ્ર-કચ્છ અને દીવ, દમણ, દાદરા નગર હવેલીમાં હવામાન શુષ્ક રહેવાની સંભાવના છે.
અમદાવાદમાં કેવું રહેશે હવામાન
અમદાવાદ અને તેની આસપાસના વિસ્તારમાં આવતીકાલે આકાશ સ્વચ્છ રહેવાની શક્યતા છે. મહત્તમ તાપમાન 43 ડિગ્રી સેલ્સિયસ રહેવાની શક્યતા છે. એટલે કે આવતીકાલે અમદાવાદમાં સ્થાનિક સ્વરાજ્યની ચૂંટણીના મતદાન વખતે મતદારોએ ગરમીનો સામનો કરવો પડી શકે છે.
હવામાન વિભાગે ગરમ અને ભેજવાળી પરિસ્થિતિના કારણે નાગરિકોને સાવચેત રહેવા અપીલ કરી છે. જે મુજબ સામાન્ય લોકો માટે મધ્યમ તાપમાન અને ગરમી સહન કરી શકાય છે પરંતુ નબળા લોકો જેમકે શિશુઓ, વૃદ્ધો, ક્રોનિક રોગ ધરાવતા લોકો માટે મધ્યમ સ્વાસ્થ્ય ચિંતાનો વિષય છે. આવા લોકોએ ગરમીના સંપર્કમાં આવવાનું ટાળવું જોઈએ. હળવા-આછા રંગના, ઢીલા, સુતરાઉ કપડાં પહેરવા જોઈએ. બહાર નીકળતી વખતે માથાને ઢાંકવું જોઈએ. ટોપી અને છત્રીનો ઉપયોગ કરવો જોઈએ.
અંબાલાલ પટેલે શું કરી છે આગાહી
અંબાલાલ પટેલે પણ મતદાનના દિવસે એટલે કે 26 એપ્રિલ રવિવારના દિવસે આકરી ગરમીની આગાહી કરી છે. હવામાન નિષ્ણાત અંબાલાલ પટેલ મુજબ આવતીકાલે એટલે કે 26 એપ્રિલે તાપમાનનો પારો ઉંચે જશે. મોટાભાગના વિસ્તારમાં તાપમાન 40 ડિગ્રીને પાર થશે, જેથી લોકો અગનવર્ષાનો અનુભવ કરશે. અંબાલાલ પટેલે જણાવ્યું કે, રવિવારે ગરમીનો પારો 43થી 44 ડિગ્રી પહોંચવાનું અનુમાન છે. નડિયાદ, આણંદ, કપડવંજમાં ગરમીનો પારો 43થી 44 ડિગ્રી પહોંચી શકે છે. 25થી 28 એપ્રિલ સુધી કાળઝાળ ગરમી પડવાની આગાહી છે. મે મહિનામાં પણ ગરમીનો પારો 45 ડિગ્રી સુધી પહોંચી શકે છે. આવતીકાલે અમદાવાદમાં ગરમીનો પારો 43 ડિગ્રી સુધી પહોંચી શકે છે.",0.65
