title,url,source,date,language,state,district,search_term,full_text,relevance_score
"Delhi Weather Today: दिल्ली में बारिश से मौसम हुआ सुहाना, लोगों को मिली गर्मी से राहत, IMD ने जारी किया ऑरेंज अलर्ट - Moneycontrol Hindi",https://news.google.com/rss/articles/CBMiwAFBVV95cUxOZFQ4aGVhQkFIVHZtUGh1RGFiczNIbFdwQi1lanRVRzNBMFdsamQzNGhuNlYtdzRLODBMbVlJXzZ2aDZveFdkVkc5SWRPY3JfZ1VoalRkZkJDQjk5cHBfOTJNaENpU0dMVzIxb2E0M3ZrU21MZm9fRlYtdEdmYjF1VzI4RU9JVVl0ZUkzbTc3SlBOcnlCcDJVTUxtQnVfdmJZcEN1UVRQV2JyMmFsS1E4LW9vTTRJTWpnZWNGMHk5SUzSAcYBQVVfeXFMT2kxdVZQRWN4cjcyZzFpS0l4UVlBV011MTN6MlhSQTE3R3Qwa2p1ZWNwY2JyRWQwbUU4TmZJcTVGbVNwWG9YcU5sZVltTnpGdXFhWFY2QVl4WjFad3FydVcxclpOY1ByMlc2el9YalFuZnFEUGg4YlQ3UzhVNnR5WGdoNkkxampvTW51SGJVWkJlcEo0bjlnaU9td3dQelFBV01JbjBWTUZRNW8ybTJHbGRmZkVmcGdWZE82ZGZhckxRQlUtSGZB?oc=5,Moneycontrol Hindi,2026-04-07T07:31:25+05:30,hi,Delhi,,"(""हीट एक्शन प्लान"" OR ""गर्मी से राहत"" OR चेतावनी OR ""रेड अलर्ट"" OR ""ऑरेंज अलर्ट"" OR ""येलो अलर्ट"" OR एडवाइजरी OR ""राहत सामग्री"" OR ""राहत शिविर"" OR मुआवजा) Delhi","Delhi Weather Today: मंगलवार सुबह दिल्लीवासियों को ठंडी हवा का सामना करना पड़ा क्योंकि राष्ट्रीय राजधानी के कई इलाकों में बारिश हुई। भारत मौसम विज्ञान विभाग (IMD) ने आज गरज के साथ हल्की बारिश की चेतावनी जारी की है, जिसके चलते शहर में दिन भर और बारिश होने की आशंका है।
IMD ने मंगलवार, 7 अप्रैल के लिए ऑरेंज अलर्ट जारी किया है, जिसमें गरज के साथ हल्की बारिश और तेज हवाओं का पूर्वानुमान है। बारिश बुधवार तक जारी रहने की संभावना है।
मौसम विभाग ने बुधवार, 8 अप्रैल के लिए येलो अलर्ट जारी किया है, जिसमें गरज के साथ हल्की बारिश और तेज हवाओं का पूर्वानुमान है।
इसके अलावा, मौसम एजेंसी ने मंगलवार और बुधवार को दिल्ली में छिटपुट ओलावृष्टि की संभावना जताई है।
PTI की रिपोर्ट के अनुसार, मौसम में यह बदलाव हवा के पैटर्न में परिवर्तन और पश्चिमी विक्षोभ के प्रभाव के कारण हुआ है। इस विक्षोभ के कारण राष्ट्रीय राजधानी क्षेत्र में रुक-रुक कर बादल छाए रहेंगे और छिटपुट बारिश हो सकती है।
बारिश के इस नए दौर से राजधानी में तापमान में गिरावट आने की संभावना है, जिससे अधिकतम तापमान लगभग 31 डिग्री सेल्सियस और न्यूनतम तापमान लगभग 20 डिग्री सेल्सियस तक पहुंच जाएगा।
हालांकि, 10 अप्रैल से तापमान में फिर से वृद्धि होने की संभावना है।
दिल्ली भर में न्यूनतम तापमान सामान्य से नीचे रहने की संभावना है। मंगलवार सुबह सफदरजंग में तापमान 20.6 डिग्री सेल्सियस दर्ज किया गया।
मौसम विज्ञान विभाग (IMD) के अनुसार, मंगलवार को दिल्ली में अधिकतम और न्यूनतम तापमान क्रमशः 30°C से 32°C और 19°C से 21°C के बीच रहने की संभावना है। न्यूनतम तापमान सामान्य के करीब (-1.5°C से 1.5°C) रहेगा, जबकि अधिकतम तापमान सामान्य से काफी कम (-3.1°C से -5.0°C) रहेगा।
मौसम विभाग ने चेतावनी जारी करते हुए कहा है कि शहर में गरज, बिजली और तेज हवाओं के साथ धूल भरी हवाओं की गति अस्थायी रूप से 60 किमी प्रति घंटे तक पहुंच सकती है, और निवासियों से एहतियाती उपाय करने का आग्रह किया है।",1.0
गर्मी से राहत या नई मुसीबत?दिल्ली में गर्मी के बीच अचानक क्यों मंडराने लगे आंधी-बारिश के बादल? - pratahkal.com,https://news.google.com/rss/articles/CBMiqgFBVV95cUxPbzVjazAyQkJlSXNPY1BhVFUtVTd1WkJIRjRXb1pFQ1ZlRHlKcS1mYU5YVmtfODdtanp5YVN5dmdqM1BhQXd0RUkwbHFrQVdnMEg1a3N5cURnU3E1d1N4NG94VmYyUGczRlVTa2hlM0dCMjdONnpmRVdUWEZXZVZyMnFEMnJMRkpvaUR0VDU4b1ZyQ2U4Q29NbFE3RDRrTTVKVE1fbzR2QVBLUdIBrwFBVV95cUxOYzJxTGgtcGUzVXpkZkRSeVhoR1c0SlNPU1d1TERvX25RdkFrQ3h4Y1A3aDRKamRRLTZzUmNJUzh0UXV0SDNNbnVleVNJUzJGQ3pUSmtWOGRfMWFwQnRBdXdqMVVmQnVieU9kbFBTUFQ4OFI4UF9OOUp3M3FlWExoTWRaVHF4c2ZCYnpMMERSRDZVYUltQ3dneWYxenR5SkxOOVpDUU5xMEs4cjNaY0lZ?oc=5,pratahkal.com,2026-04-07T05:20:54+05:30,hi,Delhi,,"(""हीट एक्शन प्लान"" OR ""गर्मी से राहत"" OR चेतावनी OR ""रेड अलर्ट"" OR ""ऑरेंज अलर्ट"" OR ""येलो अलर्ट"" OR एडवाइजरी OR ""राहत सामग्री"" OR ""राहत शिविर"" OR मुआवजा) Delhi","गर्मी से राहत या नई मुसीबत?दिल्ली में गर्मी के बीच अचानक क्यों मंडराने लगे आंधी-बारिश के बादल?
By Lalita RajputPublished on 7 April 2026 5:20 AM IST
पश्चिमी विक्षोभ के सक्रिय होने से दिल्ली-एनसीआर में धूल भरी आंधी और बारिश की संभावना, मौसम विभाग ने जारी किया अलर्ट।
x
राष्ट्रीय राजधानी दिल्ली और इसके आसपास के इलाकों में एक बार फिर प्रकृति की करवट देखने को मिल रही है। पिछले कुछ दिनों से बढ़ रही तपिश के बीच मौसम विभाग ने एक बार फिर राहत और चेतावनी का मिला-जुला संदेश जारी किया है। दिल्ली की फिजाओं में अचानक आया यह बदलाव उत्तर-पश्चिम भारत में सक्रिय हो रहे एक नए पश्चिमी विक्षोभ का परिणाम माना जा रहा है। विशेषज्ञों की मानें तो अगले 48 घंटों के भीतर दिल्ली की सड़कों पर धूल भरी आंधी और गरज के साथ बौछारें पड़ने की प्रबल संभावना है, जो अप्रैल की शुरुआती गर्मी से जूझ रहे दिल्लीवासियों को अस्थायी राहत प्रदान करेगी।
मौसम विज्ञान केंद्र के नवीनतम आंकड़ों के अनुसार, 7 अप्रैल की सुबह से ही बादलों की आवाजाही का सिलसिला शुरू हो जाएगा। विभाग ने विशेष रूप से गरज-चमक के साथ बिजली गिरने की चेतावनी जारी की है। इस मौसमी बदलाव के पीछे का मुख्य कारक एक सशक्त पश्चिमी विक्षोभ है, जो हिमालयी क्षेत्रों से होते हुए मैदानी इलाकों को प्रभावित कर रहा है। इसके प्रभाव से हवा की गति में काफी तेजी आएगी, जो 30 से 40 किलोमीटर प्रति घंटे की रफ्तार तक पहुंच सकती है।
तापमान के मोर्चे पर भी महत्वपूर्ण फेरबदल की उम्मीद जताई गई है। दिल्ली का अधिकतम तापमान, जो पिछले सप्ताह 35 डिग्री सेल्सियस के पार जाने लगा था, अब गिरकर 28 से 32 डिग्री सेल्सियस के बीच रहने का अनुमान है। वहीं, न्यूनतम तापमान में भी गिरावट दर्ज की जाएगी, जिसके 18 से 22 डिग्री सेल्सियस के दायरे में रहने की संभावना है। यह गिरावट रात और सुबह के समय वातावरण में एक सुखद ठंडक का अहसास कराएगी, हालांकि आंधी के कारण उड़ने वाली धूल वाहन चालकों और सांस के रोगियों के लिए चुनौतियां खड़ी कर सकती है।
कानूनी और प्रशासनिक स्तर पर, दिल्ली आपदा प्रबंधन प्राधिकरण और नागरिक निकायों को सतर्क रहने की सलाह दी गई है। तेज हवाओं के कारण जर्जर भवनों और अस्थायी ढांचों को नुकसान पहुंचने की आशंका को देखते हुए प्रशासन ने पहले ही एहतियाती निर्देश जारी कर दिए हैं। मौसम विभाग (IMD) ने नागरिकों से अपील की है कि वे गरज के साथ बारिश के दौरान ऊंचे पेड़ों और बिजली के खंभों से दूर रहें। हवाई अड्डों और रेलवे को भी मौसम की स्थिति पर नजर रखने को कहा गया है ताकि परिचालन में होने वाली किसी भी देरी या बाधा को नियंत्रित किया जा सके।
अंततः, अप्रैल माह का यह अप्रत्याशित बदलाव जलवायु परिवर्तन के उन संकेतों की ओर भी इशारा करता है, जहां बेमौसम बारिश और तापमान में तेजी से उतार-चढ़ाव अब एक सामान्य प्रक्रिया बनती जा रही है। हालांकि, दिल्ली के लिए यह बारिश केवल धूल और प्रदूषण के स्तर को कम करने का एक जरिया नहीं है, बल्कि यह भीषण गर्मी के आगामी दौर से पहले प्रकृति द्वारा दिया गया एक छोटा सा विराम है। अब देखना यह होगा कि यह मौसमी बदलाव कृषि और स्थानीय जनजीवन पर किस तरह का गहरा प्रभाव छोड़ता है।
Lalita Rajput
इन्हें लेखन क्षेत्र में लगभग 5 वर्षों का अनुभव है। इस दौरान इन्होंने फाइनेंस, कैलेंडर और बिज़नेस न्यूज़ को गहराई से कवर किया है। इनकी शैक्षणिक पृष्ठभूमि वित्त से जुड़ी है—इन्होंने एमबीए (फाइनेंस) किया है और वर्तमान में फाइनेंस में पीएचडी कर रही हैं। जनवरी 2026 से ये दै. प्रातःकाल में कार्यरत हैं, जहाँ बिज़नेस, फाइनेंस, मौसम और भारतीय सीमाओं से जुड़े समाचार सरल, सटीक और व्यवस्थित ढंग से प्रस्तुत करती हैं।",1.0
"आसमान से बरसीं राहत की बूंदें, पर हो जाइए सावधान! IMD ने दी ये बड़ी चेतावनी, जानें कब से शुरू होगा गर्मी का टॉर्चर - Punjab Kesari",https://news.google.com/rss/articles/CBMiwwFBVV95cUxOVjBlTzd2N1JPZ3ZUTkkweWNDLUtYZExyZVpEbW9WSnBBb2FkTjFiUzZ2YVBCbG5UQkFMVnRfUmgxcV9yRml6Tnh2UkNKdUxrUWpzdEVXay1qblhhRnBQWFRXWlpUbmFnbnIxWmtlWTZ0b05ITXlhM2pkbEFTOXdyMGVTNlUtRXVRdlpIZmpjNkJxT1ZtS3YteXZOQ1BnUEN3ZW43aHVuLTJVc0dENnVJbmJYR012dld2cGRwclZJUkgtVjDSAcYBQVVfeXFMTlp5VVFWX0ppMHFjeXJYc0szdUlkNXdUOTNLMUFMSnNTRnZTUG5RTlpuYk45dzd0dU1LekpqV0lFVnVYRVdjMmFrblh6YldNNm1BVDR0dkRGamV1dHc1QVo3YzA5eURtUXdpVFpEZUcwZkU5V1JybGpRQV95UmNUQkYwTEh6VjlUWlJBYTB5bko1bFJoTG5vSDNscm11ZzlwTUU5TVFzemgzQ3Fld0ktdWhSWnhJeTlMRVJoaDBkN1g1Z1JCV2RB?oc=5,Punjab Kesari,2026-04-07T08:38:11+05:30,hi,Delhi,,"""लू"" Delhi","Edited By Rohini Oberoi,Updated: 07 Apr, 2026 08:49 AM
कहने को तो अप्रैल का महीना शुरू हो चुका है लेकिन दिल्ली-NCR वालों को फिलहाल फरवरी जैसी ठंडक का अहसास हो रहा है। मंगलवार, 7 अप्रैल की सुबह राजधानी दिल्ली समेत नोएडा, गाजियाबाद और फरीदाबाद के कई इलाकों में तेज हवाओं के साथ हुई बारिश ने मौसम सुहावना...
Delhi NCR Rain Yellow Alert : कहने को तो अप्रैल का महीना शुरू हो चुका है लेकिन दिल्ली-NCR वालों को फिलहाल फरवरी जैसी ठंडक का अहसास हो रहा है। मंगलवार, 7 अप्रैल की सुबह राजधानी दिल्ली समेत नोएडा, गाजियाबाद और फरीदाबाद के कई इलाकों में तेज हवाओं के साथ हुई बारिश ने मौसम सुहावना बना दिया है। हालांकि मौसम विभाग (IMD) की मानें तो यह राहत बस कुछ ही घंटों की मेहमान है।
अगले 48 घंटे: 'येलो अलर्ट' और धूल भरी आंधी
भारत मौसम विज्ञान विभाग ने दिल्ली-NCR के लिए 7 और 8 अप्रैल को 'येलो अलर्ट' जारी किया है। अगले दो दिनों तक 40 से 50 किमी/घंटा की रफ्तार से धूल भरी आंधी चलने की संभावना है। आंधी के साथ-साथ रुक-रुक कर हल्की बूंदाबांदी का दौर जारी रहेगा, जिससे तापमान में गिरावट बनी रहेगी।
क्यों बदला मौसम का मिजाज?
मौसम वैज्ञानिकों के अनुसार 15 मार्च से लेकर अब तक एक के बाद एक कई पश्चिमी विक्षोभ (Western Disturbance) सक्रिय हुए हैं। इन्हीं 'वेदर सिस्टम्स' की वजह से दिल्ली-NCR को अब तक भीषण गर्मी और 'लू' (Heatwave) से राहत मिली हुई है।
9 अप्रैल से शुरू होगा असली अप्रैल का वार
अगर आप सोच रहे हैं कि यह सुहावना मौसम बना रहेगा तो आप गलत हैं। मौसम विभाग ने चेतावनी दी है कि गुरुवार 9 अप्रैल से आसमान पूरी तरह साफ हो जाएगा और तेज धूप खिलेगी। 9 से 12 अप्रैल के बीच दिन का तापमान 37 डिग्री सेल्सियस के पार जा सकता है। इस दौरान तेज धूप के कारण दिल्ली-NCR में गर्मी का प्रकोप तेजी से बढ़ेगा और लोग पसीने से बेहाल होने लगेंगे।
सावधानी बरतने की सलाह
प्रशासन ने आंधी और धूल भरी हवाओं को देखते हुए लोगों को सतर्क रहने की सलाह दी है। तेज हवाओं के दौरान कमजोर पेड़ों या होर्डिंग्स से दूर रहने को कहा गया है।",1.0
