title,url,source,date,language,state,district,search_term,full_text,relevance_score
Maharashtra Records 226 Heat Stroke Cases Since March Amid Intensifying Heatwave Conditions - Free Press Journal,https://news.google.com/rss/articles/CBMizwFBVV95cUxNNWVWS0xJS3Y5STRaclJfaXl6N294ZGN3VGdfNlRmZEV0aDJhbUpEa2xnU1ZIRFgzREZpQW9kOG5wSF9YSjE4ZGZqdWNmaHZtd3pmQlRIRnZ2MWhuNnVMbzVuUWRtcVZYaDZSSDd0bnhnX2ZudUpjeUhjNUkzVGVyclE4NUJYYkhsYUt1R1Rqcno1UUN4Z1N3WjcyQWV3YkJsR1g3UVBCQmhkcVRFRVFaS3A4cEQxdm15bTBDYXllZ3ZCZzJTU3lrenNQYjNDNW_SAc8BQVVfeXFMTTVlVktMSUt2OUk0WnJSX2l5ejdveGRjd1RnXzZUZmRFdGgyYW1KRGtsZ1NWSERYM0RGaUFvZDhucEhfWEoxOGRmanVjZmh2bXd6ZkJUSEZ2djFobjZ1TG81blFkbXFWWGg2Ukg3dG54Z19mbnVKY3lIYzVJM1RlcnJRODVCWGJIbGFLdUdUanJ6NVFDeGdTd1o3MkFld2JCbEdYN1FQQkJoZHFURUVRWktwOHBEMXZteW0wQ2F5ZWd2QmcyU1N5a3pzUGIzQzVv?oc=5,Free Press Journal,2026-05-22T19:11:46+05:30,en,Maharashtra,Ahmednagar,"""heatwave"" Maharashtra","Maharashtra Records 226 Heat Stroke Cases Since March Amid Intensifying Heatwave Conditions
Maharashtra has reported 226 heat stroke cases and six suspected heatwave-related deaths between March and May 20 amid rising temperatures across the state. Aurangabad recorded the highest number of cases, while health experts warned of dehydration, heat exhaustion and long-term health complications caused by extreme heat.
Mumbai, May 22: Maharashtra is witnessing a severe heatwave, with health officials reporting a sharp rise in heat-related illnesses across the state. Between March and May 20, the total number of heat stroke cases recorded in the state has risen to 226.
Sharp rise in cases during May
During the third week of May alone, 171 people suffered heat stroke in just four days, highlighting the growing impact of the intense summer conditions.
Authorities have also reported six suspected heatwave-related deaths. Final confirmation, however, will be made by the Death Review Committee.
The worst-affected district is Aurangabad, where 41 cases have been reported. Other districts with high numbers include Nandurbar (24), Nashik (19), Buldhana (17), Amravati (16) and Wardha (14).
Despite soaring temperatures, Mumbai has not recorded any heat stroke cases so far. Nearby regions such as Raigad reported three cases, while Palghar and Thane recorded two and one cases respectively.
Heat-related deaths have been reported from Ahmednagar, Latur, Akola and Solapur.
Doctors advise precautions
Doctors have warned residents against prolonged exposure to direct sunlight, especially during afternoon hours. Dr Anish Pillai, Lead Consultant – Neonatology and Paediatrics, Motherhood Hospitals, Kharghar, said rising heat and humidity in Mumbai are leading to an increase in dehydration, skin problems, infections and heat exhaustion among children.
He explained that heat stroke can result in dangerously high body temperature, dehydration and damage to vital organs, particularly the kidneys. Common symptoms include headaches, dizziness and confusion.
Health experts have advised elderly citizens and people with pre-existing illnesses to avoid outdoor activities during peak heat hours and stay adequately hydrated.
Experts warn of long-term health impact
Doctors also cautioned that the ongoing heatwave could have long-term health effects. Dr Sneha Sathe, Clinical Director and Fertility Specialist, Nova IVF Fertility, Chembur, noted that extreme heat, dehydration and physical stress may affect couples undergoing fertility treatments such as IVF.
Also Watch:
According to experts, prolonged exposure to high temperatures can temporarily impact sperm quality in men, particularly among those who spend long hours outdoors, wear tight clothing or frequently take hot baths.
To get details on exclusive and budget-friendly property deals in Mumbai & surrounding regions, do visit: https://budgetproperties.in/
RECENT STORIES
-
Telangana TS POLYCET Result 2026 Declared At polycet.sbtet.telangana.gov.in; Download Rank Card Here -
'It's Probably For My Birthday': Novak Djokovic's Witty Remark Draws Laughs As Journalist's Phone... -
SpaceX Launches Biggest-Ever Starship V3 Rocket For NASA Artemis Moon Missions -
NEET UG 2026 Refund Process Underway; NTA Asks Candidates To Submit Bank Details By May 27 -
Indian Army Major Abhilasha Barak Awarded 2025 UN Military Gender Advocate Of The Year Award",1.0
"Heatwave in India: Andhra reports over 300 cases, Maharashtra over 200 cases of suspected heatstroke",https://www.businesstoday.in/india/story/heatwave-in-india-andhra-reports-over-300-cases-maharashtra-over-200-cases-of-suspected-heatstroke-532894-2026-05-22,Business Today,2026-05-22T15:27:41+05:30,en,Maharashtra,Ahmednagar,"(heatwave OR ""heat wave"" OR ""severe heatwave"" OR ""extreme heat"" OR ""heat spell"" OR ""scorching heat"" OR ""blistering heat"" OR ""sweltering heat"" OR ""hot winds"" OR loo OR ""hot loo winds"") Maharashtra","Heatwave in India: Rising cases of heatstroke have been reported from several parts of India as high temperatures and heatwave conditions continue to affect daily life and public health. In Andhra Pradesh, the state health department said more than 300 suspected heat-related illness cases were recorded from the start of March to mid-May, while Maharashtra has reported 226 heatstroke cases and at least two confirmed deaths since March.
The rise in cases has come as the India Meteorological Department forecast ""heatwave to severe heatwave conditions"" in Delhi and large parts of northern India between May 22 and 27. State and district authorities in different parts of the country have issued advisories, while hospitals have also seen patients with heat-related problems, dehydration and diarrhoea.
According to the Andhra Pradesh health department, the state reported 325 suspected heatstroke cases between March 1 and May 19, with roughly a third of them reported since the start of May. State authorities advised people to avoid going outdoors between 11 am and 4 pm as ""heatwaves and extreme temperatures are at their peak"".
Heatstroke is a medical emergency caused by the body overheating. It can trigger confusion, dizziness, nausea, seizures, loss of consciousness and organ failure if not treated promptly.
In Maharashtra, state health department data showed 226 heatstroke cases and at least two confirmed deaths since March. The deaths were reported from Akola and Latur, while six other suspected heatstroke deaths are under investigation in Ahmednagar, Akola, Latur and Solapur.
District-wise figures in Maharashtra showed the highest number of heatstroke cases in Aurangabad at 41, followed by Nandurbar at 24, Nashik at 19, Buldhana at 17, Amravati at 16 and Wardha at 14. Cases were also reported from Palghar, Raigad and Thane. Across states, the rise in heatstroke cases, hospital visits and official advisories has coincided with continuing heatwave conditions and high temperatures.
In Delhi, two heatstroke patients were admitted to the state-run, RML Hospital and were critical, according to local media reports. Severe heat has also led to patients with diarrhoea and dehydration lining up at hospitals in some parts of the country and has triggered water shortages in Gujarat, visuals from news agency ANI showed.
The IMD declares a heatwave when the maximum temperature is at least 40 degrees Celsius in the plains and 30 degrees Celsius in hilly regions, and is 4.5 degrees Celsius to 6.4 degrees Celsius above normal, or touches 45 degrees Celsius. Local media said the highest maximum temperature recorded so far this year was 48 degrees Celsius in Banda in Uttar Pradesh this week.
HOW TO PREVENT HEATSTROKE?
You can follow these simple measures to prevent heatstroke:",1.0
