title,url,source,date,language,state,district,search_term,full_text,relevance_score
India Weather Alert: Delhi’s Heatwave vs. Southern Rains—Is Your Travel Plan Safe? - NativePlanet,https://news.google.com/rss/articles/CBMiwwFBVV95cUxQeDluLUlhbkQzYTBuM1dOT0h5bC1yTG9qU2d4VDRvOEhMaURJTWFTc25lSVl5bVJxSGNLdEhZUWU0blk1OXhnNWt5ajlWRFhaYVZzTDd5MTc0NU1CTVZCNjFBWncwMDZGYjlwcXBkOUhwam1tOU1IVDJRV1NOSlNZb3BqZlFBWW1ickJpSE00Y3hOeXBaNlRvdV81cGp4YlR0UElBMC1TUDBMSGtDWmdTSzFBUVJlZ0d5ZEhJVE9jd2dITEU?oc=5,NativePlanet,2026-05-08T08:17:51+05:30,en,Haryana,,"(heatwave OR ""heat wave"" OR ""severe heatwave"" OR ""extreme heat"" OR ""heat spell"" OR ""scorching heat"" OR ""blistering heat"" OR ""sweltering heat"" OR ""hot winds"" OR loo OR ""hot loo winds"" OR ""intense heat"" OR ""unbearable heat"" OR ""deadly heat"" OR heat OR ""weather forecast"" OR ""weather update"" OR ""weather alert"" OR ""IMD forecast"" OR ""IMD prediction"" OR ""IMD alert"" OR IMD OR ""rising temperatures"" OR ""temperatures expected to rise"" OR ""relief from heat"" OR ""respite from heat"" OR ""heat respite"" OR ""respite from scorching heat"") Haryana","Today, India faces two very different weather patterns across the country. The weather office warns of a major heatwave in Delhi and NCR. Meanwhile, Bengaluru and Kerala prepare for heavy rain and thunderstorms. These changes will likely disrupt travel and daily plans for citizens. Check timings for your commute to stay safe from the conditions.
The India Meteorological Department expects very high temperatures in North India today. Warm winds from the west are raising the mercury in Delhi. This heatwave will make outdoor activities difficult during peak daylight hours. Residents must take precautions to avoid heatstroke and remain hydrated. Staying indoors during the afternoon is the best way to stay safe.
Heatwave in Delhi-NCR Impacts Summer Travel
The intense heat in the capital is due to dry air currents. These winds arrive from the deserts, raising the ground temperature quickly. People working outdoors should find shade during the harsh afternoon. Local authorities suggest drinking plenty of water during the entire day. Proper care is needed for children and the elderly in this weather.
Travelers arriving at Delhi airports might notice very warm terminal areas. High heat can impact ground handling and daily transport services. Taxis and buses could face minor delays as engines get hot. it is wise to plan your trips for the cooler morning hours. Always carry a water bottle when moving around the city today.
Thunderstorms and Heavy Rain in Bengaluru and Kerala
While the north boils, Bengaluru and Kerala prepare for thunderstorms. The weather office predicts gusty winds and lightning across the south. These rains offer relief from the heat but cause urban flooding. Commuters should prepare for slow traffic and wet roads later today. Wind speeds might reach forty kilometers per hour in some spots.
Kerala districts are now under a yellow alert for heavy rain. Nearby regions might see similar storms due to strong moisture levels. Flight operations at big airports could see some weather delays. Travelers should check with airlines before leaving for their flights today. Safety remains the main concern for those using maritime transport too.
The diverging weather patterns require careful planning for many travelers. Flights and trains between major cities may face schedule changes. High heat in the north and rain in south create issues. Slower train speeds are common when tracks get very hot. Check your travel status before leaving for the station today.
| Region | Weather Alert | Main Risks |
| Delhi-NCR | Extreme Heatwave | Health and Taxis |
| Bengaluru | Thunderstorms | Traffic and Winds |
| Kerala | Heavy Rainfall | Flights and Floods |
Managing Today’s Heatwave and Thunderstorms Risks
Atmospheric changes are driving these sharp differences between major cities. A high-pressure system over Rajasthan pushes dry air toward the capital. Southwards, a cyclonic circulation brings moisture to the southern coast. This creates a unique weather story for the entire country today. Understanding these patterns helps people prepare for sudden climate shifts.
In Bengaluru, the cooling rains are a welcome change for many. However, lightning and strong winds may cause power cuts tonight. Public transport users should keep umbrellas ready for sudden rain. The weather office advises caution while standing under trees or poles. Stay away from open fields during any severe lightning today.
Both regions should stay alert as weather conditions change tonight. Safety is the top priority for everyone moving through these states. Monitoring the latest official weather news is helpful for all travelers. Planning ahead keeps you safe during heatwaves and big storms. Stay informed to make your travel as smooth as possible.
Get best deals on travel, receive travel tips and travel stories instantly Subscribe to Nativeplanet.",1.0
