title,url,source,date,language,state,district,search_term,full_text,relevance_score
New Timings for Punjab Schools and Offices Effective From May 25; CM Says Decision Taken Due to Heatwave - Punjab Newsline,https://news.google.com/rss/articles/CBMi0AFBVV95cUxQZEYtTERpLXNnMlpUZi1VWHpYS1MyNEZHR0czMUlnVmhmaE9HWUNXUUVNYnBmTzVpbi1GalhlVy1BWUJYUlRsd25qWDk0SWE3SFl4SGV5X2lFek1Lc3AzdjZzVjNNanFMR21QbFZwTmxZZDlzZ1haT1NzQ0FzU1Boa21RLXdoeHdkRzBSSU9pWmtJN3JmMV9xWkRYWUJyaU5mUGJIQXp3U251dV9SR1lQSDZyeERNcTFiM3F5NWpvWVYwUmdDNUhRUF80T01qR3hP?oc=5,Punjab Newsline,2026-05-22T16:18:00+05:30,en,Punjab,Jalandhar,"""heatwave"" Punjab","Punjab Newsline | Chandigarh
The Punjab government has changed the timings of government schools and offices in view of the intense summer heat across the state. The new schedule will come into effect from May 25.
Under the revised timings, government schools and offices will function from 7:30 AM to 1:30 PM. Punjab Chief Minister Bhagwant Mann said the decision was taken to protect students and employees from the severe heatwave conditions.
Meanwhile, the weather changed suddenly on Friday morning in several parts of Punjab. Rainfall was reported from cities including Jalandhar, Ludhiana and Pathankot, leading to a noticeable drop in temperature.
In Jalandhar and Pathankot, strong winds accompanied the rain, bringing temporary relief from the scorching heat. Weather officials expect similar conditions to continue in some areas over the next few hours.",0.8500000000000001
