title,url,source,date,language,state,district,search_term,full_text,relevance_score
"Jharkhand Weather: रांची समेत 15 जिलों में बारिश का येलो अलर्ट, हीटवेव से झुलसेंगे उत्तर-पूर्वी झारखंड के ज... - Zee News",https://news.google.com/rss/articles/CBMi9gFBVV95cUxQYkVzRmg2SlJ6QXBwYTRPM044dGNza3pSVWJZSzNzZ2lfdUtNYVFtV0pfdjVsam43RnlYa19ObTRtVnhpX3lnRHZHWkZmeVNJQ0VhTzJrSFNtb3ZaaU1NSjFFODFTQUtTbi1EeHhVSWhRajFBU2lwd2dfZlZUeWZuUGJMcE5xd0dpY0MzZldaVW5GdmpfR3pjdERSSjdrY0VRSVdUOVdhZTZSSUpIMmloNThoYzlnMkVQa0xmdG11VFFEQkxCdWNUZFJLaEhTQ1JQLTVsQ1ozT3hSd0M4bFI5bENrQW1KRG12RFU1QThWbGtTM25mTWfSAfYBQVVfeXFMUGJFc0ZoNkpSekFwcGE0TzNOOHRjc2t6UlViWUszc2dpX3VLTWFRbVdKX3Y1bGpuN0Z5WGtfTm00bVZ4aV95Z0R2R1pGZnlTSUNFYU8ya0hTbW92WmlNTUoxRTgxU0FLU24tRHh4VUloUWoxQVNpcHdnX2ZWVHlmblBiTHBOcXdHaWNDM2ZXWlVuRnZqX0d6Y3REUko3a2NFUUlXVDlXYWU2UklKSDJpaDU4aGM5ZzJFUGtMZnRtdVRRREJMQnVjVGRSS2hIU0NSUC01bENaM094UndDOGxSOWxDa0FtSkRtdkRVNUE4VmxrUzNuZk1n?oc=5,Zee News,2026-06-04T10:19:35+05:30,hi,Jharkhand,,"(""हीट एक्शन प्लान"" OR ""गर्मी से राहत"" OR चेतावनी OR ""रेड अलर्ट"" OR ""ऑरेंज अलर्ट"" OR ""येलो अलर्ट"" OR एडवाइजरी OR ""राहत सामग्री"" OR ""राहत शिविर"" OR मुआवजा) Jharkhand","Jharkhand Weather: रांची समेत 15 जिलों में बारिश का येलो अलर्ट, हीटवेव से झुलसेंगे उत्तर-पूर्वी झारखंड के जिले! देखें IMD रिपोर्ट
Jharkhand Aaj Ka Mausam: आज (गुरुवार, 4 जून) को राजधानी रांची समेत 15 जिलों में गरज-चमक के साथ हल्की से मध्यम बारिश होने की संभावना जताई गई है. वहीं, उत्तर-पूर्वी झारखंड के देवघर, दुमका, गिरिडीह, गोड्डा, जामतारा, पाकुड़, साहेबगंज, कोडरमा और धनबाद जिलों में मौसम पूरी तरह से शुष्क रहेगा.
Jharkhand Weather Report Today: झारखंड के मौसम में उलटफेर का दौर लगातार जारी है. मौसम विभाग (IMD) ने आज (गुरुवार, 4 जून) को राजधानी रांची समेत प्रदेश के अधिकांश जिलों में मौसम का मिजाज सुहावना रहने का पूर्वानुमान जताया है. मौसम वैज्ञानिकों के मुताबिक, पश्चिमी विक्षोभ और चक्रवाती परिसंचरण के चलते झारखंड के मौसम में प्री-मानसून की गतिविधियां देखने को मिल सकती हैं. बंगाल की खाड़ी से आ रही नम हवाओं और स्थानीय मौसमी सिस्टम के प्रभाव से राज्य के अधिकांश हिस्सों में आज बादल छाए रहेंगे.
आज (गुरुवार, 4 जून) को राजधानी रांची समेत कई जिलों में गरज-चमक के साथ हल्की से मध्यम बारिश होने की संभावना जताई गई है. इसके साथ ही 40 से 60 किलोमीटर प्रति घंटे की रफ्तार से तेज हवाएं चलने का भी अनुमान जताया गया है. मौसम वैज्ञानिकों ने राजधानी रांची समेत प्रदेश के 15 जिलों में आंधी-बारिश का येलो अलर्ट जारी किया है. कुछ हिस्सों में ठनका (वज्रपात) की आशंका भी जताई गई है. इससे लोगों को सावधान किया गया है. कुछ मिलाकर आज पिछले कुछ दिनों से लगातार बढ़ते तापमान और उमस से परेशान लोगों के लिए यह बदलाव राहत भरा साबित हो सकता है.
हालांकि, उत्तर-पूर्वी झारखंड के सभी जिलों में अभी भी लोगों को गर्मी से जूझना पड़ेगा. रांची आईएमडी के अनुसार, उत्तर-पूर्वी झारखंड के देवघर, दुमका, गिरिडीह, गोड्डा, जामतारा, पाकुड़, साहेबगंज, कोडरमा और धनबाद जिलों में मौसम पूरी तरह से शुष्क रहेगा. इन जिलों के लिए कोई चेतावनी जारी नहीं की गई है. इन जिलों में अधिकतम तापमान 39 से 41 डिग्री सेल्सियस तक पहुंच सकता है. हालांकि, हीटवेव को लेकर कोई अलर्ट जारी नहीं किया गया है.",1.0
"Weather Alert:झारखंड वासियों को आज भीषण गर्मी से राहत की उम्मीद, इन जिलों में बारिश और तेज हवा का अलर्ट - thenewspost.in",https://news.google.com/rss/articles/CBMikAJBVV95cUxNQTNKRUFsc2lVQk4wbW5yeEJLQmhpZkJjUGVWMmRxWGZmQzB6TEdmRHFsaFowZWpBWG9sTkQwSFFCUXRFcU5wZVItcERBQlI0U0tBc3RsUmw1M1FvLWJSeFdvekJVS1pxaURrZExSTmNSeS04NDVUUmY4OTd5ZkFab0syWXo5dHMwNmFfYTVWNmVCZ2JMMWt5Mk1EM294UTQyN1ZEcDFaTEluMFRMblR1S09acnBWdHdUOU5pdTFwUG96MGV0OFVlb2RkVUpRNkdFeVV0Q0d4NXoya1ZwcXdDZmhVeGdpekpwVGNiYUpGUzZTOGpBc29aSnpPYUg1Z01zdVhCeFQ0Mk1fMGFQbFlLbg?oc=5,thenewspost.in,2026-06-04T07:39:59+05:30,hi,Jharkhand,,"(""हीट एक्शन प्लान"" OR ""गर्मी से राहत"" OR चेतावनी OR ""रेड अलर्ट"" OR ""ऑरेंज अलर्ट"" OR ""येलो अलर्ट"" OR एडवाइजरी OR ""राहत सामग्री"" OR ""राहत शिविर"" OR मुआवजा) Jharkhand","टीएनपी डेस्क (TNP DESK):झारखंड में पिछले कई दिनों से पड़ रही भीषण गर्मी ने लोगों का जीना मुश्किल कर दिया है.खासकर कोल्हान और संथाल परगना के जिलों में तेज धूप और उमस से लोग परेशान है.दिन में गर्म हवाएं चल रही है, तो रात में भी लोगों को राहत नहीं मिल रही है.हालांकि अब मौसम विभाग की ओर से राहत भरी खबर सामने आई है.विभाग का कहना है कि गुरुवार से राज्य के कई हिस्सों में मौसम का मिजाज बदल सकता है. बारिश और तेज हवाओं की वजह से लोगों को गर्मी से राहत मिलने की उम्मीद है.
इन जिलों में बारिश और तेज हवाओं का अलर्ट
मौसम विभाग के अनुसार आज गुरुवार को बंगाल की खाड़ी से आ रही नमी और सक्रिय मौसमी सिस्टम के कारण झारखंड के अधिकांश इलाकों में बादल छाए रहेंगे. राजधानी रांची समेत कई जिलों में गरज-चमक के साथ हल्की से मध्यम बारिश होने की संभावना है.रांची, खूंटी, गुमला, सिमडेगा, लोहरदगा, पश्चिमी सिंहभूम, पूर्वी सिंहभूम, सरायकेला-खरसावां, बोकारो, रामगढ़, हजारीबाग, गिरिडीह, देवघर, दुमका, जामताड़ा, गोड्डा, साहिबगंज और पाकुड़ में बारिश होने के आसार है. कुछ जगहों पर तेज बौछारें भी पड़ सकती है.इसके साथ ही 40 से 60 किलोमीटर प्रति घंटे की रफ्तार से तेज हवाएं चलने का अनुमान है. मौसम विभाग ने लोगों को बारिश और आंधी के दौरान सतर्क रहने की सलाह दी है.
कई जिलों में वज्रपात को लेकर भी चेतावनी
वहीं उत्तर-पूर्वी और मध्य झारखंड के कई जिलों में वज्रपात को लेकर भी चेतावनी जारी की गई है.जहां देवघर, दुमका, जामताड़ा, गोड्डा, साहिबगंज, पाकुड़, गिरिडीह और हजारीबाग में बिजली गिरने की आशंका जताई गई है.मौसम विभाग ने लोगों से अपील की है कि खराब मौसम के दौरान खुले मैदान, बड़े पेड़ों और बिजली के खंभों से दूर रहें.बारिश के समय सुरक्षित स्थान पर शरण लें और मोबाइल फोन का सीमित इस्तेमाल करें.
इन जिलों में आज भी गर्मी पड़ेगी
हालांकि राज्य के सभी जिलों को राहत नहीं मिलेगी. पलामू, गढ़वा और चतरा में गर्मी का असर अभी भी बना रह सकता है.इन जिलों में अधिकतम तापमान 39 से 41 डिग्री सेल्सियस तक पहुंचने की संभावना है. यहां बारिश की संभावना कम है, लेकिन फिलहाल हीटवेव को लेकर कोई अलर्ट जारी नहीं किया गया है.
पढ़े अपने जिले का तापमान
रांची का अधिकतम तापमान 35 डिग्री सेल्सियस और न्यूनतम 26 डिग्री सेल्सियस रहने की संभावना है. जमशेदपुर में अधिकतम तापमान 39 डिग्री और न्यूनतम तापमान 28 डिग्री सेल्सियस रह सकता है. धनबाद में अधिकतम तापमान 39 डिग्री और न्यूनतम 28 डिग्री रहेगा. डाल्टनगंज में अधिकतम 38 डिग्री और न्यूनतम 28 डिग्री, जबकि देवघर में अधिकतम 38 डिग्री और न्यूनतम तापमान 28 डिग्री सेल्सियस रहने की संभावना है. वहीं मेदिनीनगर का अधिकतम तापमान 39 डिग्री सेल्सियस और न्यूनतम तापमान 29 डिग्री सेल्सियस रह सकता है. मैक्लूसकीगंज का अधिकतम तापमान 37 डिग्री और न्यूनतम तापमान 26 डिग्री सेल्सियस तक जा सकता है.",1.0
"नेशनल हाइवे पर मिले शव की पहचान, लू लगने से हुई थी मौत - Dainik Bhaskar",https://news.google.com/rss/articles/CBMi4wFBVV95cUxQVk83eFNrWnc4VWEtUWVBYXMwQW82S0NMUVVxcFU0N05WMW9WR0NfOE1FcllnZ1gxUm5CbF9qYlRqREFhWmVxbHVzOWQzN3ZhXzNqQmx6Z0hITVgwSHVrOE1vUGJWN0xiOUJHaHF1NFBpRU50eFZMZnFEVFFBWlhvU1RSQUExM1lWdjVCZERBR2hsTHgzT2staUI0ZTNaNWJuRkxNQ3VDeHlZY0s2QV9TQjRrYXk4WFVLeGJGTHFJSXVibFRVWXBWd1p1VjlzaEhvLXdHUzFfSEtzcVJuVmFRNUdaQdIB6AFBVV95cUxQODVDTEhiTXRGUEtZY3RyN0lfTXRmZVFOcHNMOVVKQnk0eG5SUDQwOTR5LWlnMmNjVFQ1QllkWmtQRno0VE5nU2hfbXY0QU1EM0NPWndKMUN6NDVYWWVQaUFRbTZ5ajhxQzhQT2JoZVliRXZDSTc0RGl0a05SRlNBbER5dHV3YzZhWHJqQ1B6SGJpMVFWUU1LYzBrX21vekV3ejZYeUZrUGFjSnRIUDh0Q2xfYVpzYTNqVERFeDFNNFI3WkZJdS1YdFRfMWVObVVGaWxQZmtpbm01Wl9xcW8xYUhWM2c3TnZH?oc=5,Dainik Bhaskar,2026-06-04T04:21:14+05:30,hi,Jharkhand,,"""लू"" Jharkhand","- Body Found On National Highway Identified, Death Due To Heat Stroke
नेशनल हाइवे पर मिले शव की पहचान, लू लगने से हुई थी मौत
- कॉपी लिंक
भास्कर न्यूज | गालूडीह
गालूडीह थाना क्षेत्र अंतर्गत एनएच पर बीते दिनों मिले अज्ञात शव की पहचान कर ली गई है। मृतक की पहचान जमशेदपुर के एमजीएम थाना क्षेत्र स्थित धर्मबांध लाइन नंबर-5, शिव मंदिर के समीप निवासी दुखु बांगा (36 वर्ष) के रूप में हुई है। प्राप्त जानकारी के अनुसार, 25 मई को गालूडीह थाना क्षेत्र के एनएच-33 किनारे दुखु बांगा बेहोशी की हालत में पड़े हुए मिले थे। स्थानीय लोगों की नजर पड़ने के बाद तुरंत इसकी सूचना पुलिस को दी गई। सूचना मिलते ही गालूडीह पुलिस मौके पर पहुंची और स्थानीय लोगों की मदद से उन्हें इलाज के लिए एमजीएम अस्पताल भेजा गया। अस्पताल में डॉक्टरों ने जांच के बाद उन्हें मृत घोषित कर दिया। चिकित्सकों के अनुसार, अत्यधिक गर्मी और लू लगने के कारण उनकी मौत हुई है। मंगलवार शाम को परिजनों ने अस्पताल पहुंचकर शव की पहचान की। इसके बाद बुधवार को पोस्टमार्टम की प्रक्रिया पूरी कर शव परिजनों को सौंप दिया गया। घटना के बाद परिवार में मातम का माहौल है। इधर, लगातार बढ़ती गर्मी और तेज धूप को देखते हुए स्वास्थ्य विभाग ने लोगों से दोपहर के समय अनावश्यक बाहर नहीं निकलने, पर्याप्त मात्रा में पानी पीने और गर्मी से बचाव करने की अपील की है। पिछले कुछ दिनों से क्षेत्र में तापमान लगातार बढ़ रहा है, जिससे परेशानी का सामना करना पड़ रहा है।",1.0
"Patna Weather: पटना में आज सूर्य देव दिखाएंगे रौद्र रूप, भीषण गर्मी के बीच 40 डिग्री तक पहुंच सकता है तापमा... - Zee News",https://news.google.com/rss/articles/CBMi-AFBVV95cUxPZkdvZVllNEkzTDhFVDZURkc3MmthZDlsZDNxNktIWFFkVzhWbWZVczZiajd5Q1NtbzAySVR0X21rdk81NHZ1c21YV1RRb3JKd0JwTlZaY0dURjcyNENHa2lJZXhKRHM0b3puUGpRSlo1SVlGanhZcWViVlVhSGFPcEJwenpLZncyRTNublpVV1d5UmszTWdqcVpoVzFQRWRJOTdLb2NSQVFNb1ZzZXViaEhhUmt5Q1g5dG1LMExCQXhTczBDbDFhN0lFVXU4ODlSNE1taEtSd29zZUVCb0tWVE1QMWM0Y21POWQ1UE5malMwd1VFdUU1S9IB-AFBVV95cUxPZkdvZVllNEkzTDhFVDZURkc3MmthZDlsZDNxNktIWFFkVzhWbWZVczZiajd5Q1NtbzAySVR0X21rdk81NHZ1c21YV1RRb3JKd0JwTlZaY0dURjcyNENHa2lJZXhKRHM0b3puUGpRSlo1SVlGanhZcWViVlVhSGFPcEJwenpLZncyRTNublpVV1d5UmszTWdqcVpoVzFQRWRJOTdLb2NSQVFNb1ZzZXViaEhhUmt5Q1g5dG1LMExCQXhTczBDbDFhN0lFVXU4ODlSNE1taEtSd29zZUVCb0tWVE1QMWM0Y21POWQ1UE5malMwd1VFdUU1Sw?oc=5,Zee News,2026-06-04T10:58:19+05:30,hi,Jharkhand,,"""लू"" Jharkhand","Patna Weather: पटना में आज सूर्य देव दिखाएंगे रौद्र रूप, भीषण गर्मी के बीच 40 डिग्री तक पहुंच सकता है तापमान
Patna Weather: पटना में गुरुवार को मौसम शुष्क रहने का अनुमान है। मौसम विभाग ने बारिश, आंधी और वज्रपात की कोई चेतावनी नहीं दी है. तेज धूप के बीच अधिकतम तापमान 40 डिग्री सेल्सियस तक पहुंच सकता है, जिससे लोगों को गर्मी और लू का सामना करना पड़ सकता है.
Patna Weather: राजधानी पटना में गुरुवार (4 जून) को मौसम शुष्क बने रहने की संभावना है. मौसम विभाग के अनुसार आज बारिश, आंधी या वज्रपात को लेकर कोई चेतावनी जारी नहीं की गई है. ऐसे में पटना के लोगों को तेज धूप और बढ़ती गर्मी का सामना करना पड़ सकता है. सुबह से आसमान साफ रहने और धूप तेज होने के कारण तापमान में बढ़ोतरी देखने को मिल सकती है.
मौसम विभाग का कहना है कि दिन के समय तापमान लगातार बढ़ सकता है. विशेषकर दोपहर के समय गर्मी का असर अधिक महसूस होगा. तेज धूप के कारण बाहर निकलने वाले लोगों को परेशानी हो सकती है. विशेषज्ञों ने दोपहर में अनावश्यक रूप से बाहर जाने से बचने की सलाह दी है.

आज पटना और आसपास के इलाकों में न्यूनतम तापमान 28 से 30 डिग्री सेल्सियस के बीच रहने का अनुमान है, जबकि अधिकतम तापमान 38 से 40 डिग्री सेल्सियस तक पहुंच सकता है. गर्म हवाओं और तेज धूप के कारण उमस और गर्मी दोनों का असर देखने को मिल सकता है. ऐसे मौसम में शरीर में पानी की कमी होने का खतरा भी बढ़ जाता है.
मौसम विभाग के मुताबिक अगले दो दिनों तक मौसम में किसी बड़े बदलाव की संभावना नहीं है. फिलहाल बारिश के संकेत नहीं हैं, जिससे तापमान में और बढ़ोतरी हो सकती है. मौसम विभाग ने लोगों से पर्याप्त पानी पीने, धूप से बचने और लू से बचाव के उपाय अपनाने की अपील की है. बच्चों, बुजुर्गों और बीमार लोगों को विशेष सावधानी बरतने की सलाह दी गई है.",1.0
Jharkhand CM Hemant Soren orders drinking water provision amid heatwave - The News Mill,https://news.google.com/rss/articles/CBMipwFBVV95cUxOdllnWHJVV0x1N2tlcU9tbU9rVFVRQ1h2RW5KZVlISEdWV2JoZjQ3RGtNbmJnVVJ4emVlYThhOFZOTDBEYmNtQlVaaFlhMjdrOUQ4MG0wRkNaQ2xsUUhGSFFxUTN2YTJjcXhnZWhGTkhLUDU1RlFReGN6SDYySHR2QUpWcTQ5U1p1N3ZubnJjbVV1MmhVcWF4azBiM1lteGZOMTVpTlBMOA?oc=5,The News Mill,2026-06-04T03:52:11+05:30,en,Jharkhand,,"""heatwave"" Jharkhand","Jharkhand Chief Minister Hemant Soren has directed state officials and district administrations to ensure the availability of drinking water for the public as several areas of the state experience intense heatwave conditions.
On January 31, the Chief Minister instructed all Deputy Commissioners (DCs), Superintendents of Police (SPs), and local administration officials to establish drinking water facilities outside government offices and at public squares.
“In view of the continuously rising heat and heatwaves in Jharkhand, all Deputy Commissioners, Superintendents of Police, Station House Officers, Circle Officers, Block Development Officers, Panchayat representatives, and all government offices are directed to ensure proper arrangements for drinking water for the general public outside their offices and at public places, and to prominently display clear information about the same, so that pedestrians and the general public can get relief,” CM Soren said.
He further instructed district heads to guarantee that no locality faces water shortages. “At the same time, all Deputy Commissioners shall ensure that wherever there is a water crisis, immediate water supply through tankers, repair of hand pumps, and other alternative arrangements are made. No village, hamlet, or neighbourhood should face hardship due to a shortage of drinking water – this is our collective responsibility,” he added.
Stressing a “humane approach” during the weather crisis, the Chief Minister emphasised that the administration must prioritise public interest. “In this period of intense heat, the administration must work with complete sensitivity, promptness, and a humane approach. Public interest is paramount,” he said.
The India Meteorological Department (IMD) forecast isolated to scattered light to moderate rainfall with thunderstorms, lightning, and gusty winds reaching 40-50 km/h across Jharkhand on January 31 and again between February 3 and 6.
Similar weather is expected over Gangetic West Bengal from February 1 to 6. Bihar may experience these conditions on February 1, 5, and 6, while Odisha is likely to see rainfall and thunderstorms between February 1 and 4 due to the current meteorological system affecting the region.",1.0
