title,url,source,date,language,state,district,search_term,full_text,relevance_score
"Delhi records maximum temperature of 34.8 deg C, light rain likely during night - ThePrint",https://news.google.com/rss/articles/CBMiswFBVV95cUxOVU1kXzdIOTRGWXJkc1ZRZjZ5bE0wUThRUWJYY2VGSktOcU5mcFd0MVhldkFnM1hEb25tRzktQXNtZ21lQnk1bENmMGIySmhTWHU5NjRYU3JTc2Y4Y1MxQjYxMW91SVQtZFJycXc0OGxMS2FrUXNmTEVtdlVWTDVwMlBMMGxMRFdEY0F0VHZQN3VKUlMwdk9QaTloQjlkQzB3MWVGMHBKX0tfdTJCeFJxTVJYZ9IBuAFBVV95cUxNaUtQLTZGMHE5bWxqWFJEeEVmOWRsaGlkWE83N2VQLXJjR255VFU0UFZsSmNUSjJReERWWHBJbWVoRW53QkFBVkxYY1FYVWNWWk5tNVJhbnVVX1hLOVdkeHdnbldsZlgybVVVdThQNVl3dWNjdUFpT3B3UXh5TXFWbHgwWUs0SThFdUxaTFRGeWZIQlIwTWJNQ1VIeUtJY0tacjRKdEdsRFdMcVlhTjVFQ1diME5nVWNU?oc=5,ThePrint,2026-03-26T19:22:49+05:30,en,Delhi,New Delhi,"(""mercury soars"" OR ""mercury crosses"" OR ""temperature soars"" OR ""record temperature"" OR ""all-time high"" OR ""degrees Celsius"" OR ""maximum temperature"" OR ""hottest day"" OR ""temperature crosses 40"" OR ""temperature crosses 45"" OR ""temperature likely to rise"") Delhi","New Delhi, Mar 26 (PTI) Delhi on Thursday recorded a maximum temperature of 34.8 degrees Celsius, 3.3 notches above the season’s average, according to the India Meteorological Department (IMD).
The minimum temperature settled at 19.2 degrees Celsius.
A spell of very light rain or drizzle accompanied by thunderstorm, lightning and winds with speeds between 20-30 kmph and 40 kmph are likely during the evening to night, the IMD said.
The national capital is likely to witness a thunderstorm with rain. The minimum temperature is expected to be settle at 20 degrees Celsius and the maximum at 30 degrees Celsius, the weather department said.
Delhi’s Air Quality Index (AQI) stood at 185, in the ‘moderate’ category, according to Central Pollution Control Board (CPCB) data.
According to the CPCB, an AQI between zero and 50 is considered ‘good’, 51 to 100 ‘satisfactory’, 101 to 200 ‘moderate’, 201 to 300 ‘poor’, 301 to 400 ‘very poor’, and 401 to 500 ‘severe’. PTI BM DIV DIV
This report is auto-generated from PTI news service. ThePrint holds no responsibility for its content.",1.0
"Delhi sees warm day as Met forecasts patchy rain and temperature fall, issues yellow alert for Sunday - The Times of India",https://news.google.com/rss/articles/CBMi2gFBVV95cUxOMWp6SWxDZmtycnFiaXB0bmRjd3dWWHBZaFp4TTBoOWlIVzI1LUtadzg1TUpLVmVMMTlZZERnUkt2N0xaZUpWYW1Ga0hzVXExaW9kNlVIYVIxYVN5ZWlsMTFxMngyeHpEU2hTakpWWkU0cnNXQmlIMjIzVFRRRFZzV1cycVVkeTVibHh0dnNHLXcyTm1Hc3RuemNmczYyZFFrQ0lVejlnbXZQRUVnbm45d0dsbVVsRnludDBMa3FRcGhCaVNjaFduZy1xMWNjdnJwZE1kaGNCcEo2QdIB3wFBVV95cUxObnpXRHdJNFdUUjBFUTVid1dCS01uMldYSWRMa181MEk5TktjcWs3WjZZUTRJUHVoeUZGeUNOVm5SZHFrSThvUk1IQXVLSlVuLVV0UjM1TnhjMC1FRW96dzZSOTQxT1dvd3l0ZWZnVUpYM3JXRjJKOUlLRVpZUVdmWHhQUlVYd0FVTmJqakZ1eFpWam1jWWJEVTRhUWgzMllZc0VNclZPY2NKa3JQTHpfTjVUT05ESWoya0ZBa0lyUzROYUtsZ0NPTHN4Y1BNMk96eFZCTVhmR1ozS0FvTTdn?oc=5,The Times of India,2026-03-26T23:28:00+05:30,en,Delhi,New Delhi,"(""heat advisory"" OR ""heat action plan"" OR ""heat alert"" OR ""IMD warning"" OR ""IMD alert"" OR ""red alert"" OR ""orange alert"" OR ""yellow alert"" OR ""NDMA advisory"" OR ""cooling shelter"" OR ""relief measures"" OR ""heat compensation"" OR ""severe weather warning"") Delhi","NEW DELHI: City saw a warm afternoon with a spike in the maximum temperature, while the overcast sky towards late afternoon led to respite by evening, even as the Met expected patchy rain on Thursday and Friday.
No area, however, received rain by late Thursday evening, with Met extending the forecast for light to very light rain and gusty winds for Friday as well. A yellow alert for rain and thunderstorms has been issued for Sunday under the influence of a western disturbance.
On Thursday, the maximum temperature at the base station Safdarjung was recorded at 34.8 degrees Celsius, three notches above normal, against 33.5 degrees Celsius a day earlier.
The minimum temperature was recorded at 19.2 degrees Celsius, two notches above normal, against 16.4 degrees Celsius a day earlier.
According to India Meteorological Department (IMD), the maximum and minimum temperatures on Friday are likely to hover around 29-31 degrees and 19-21 degrees Celsius, respectively.
IMD expects the temperature to be above normal for another 24 hours and subsequently fall.
“Another western disturbance is likely to affect northwest India from the night of March 28.
Rise in maximum temperature by 1-2°C during the next 24 hours, fall by 3-4°C during the subsequent 24 hours, and rise by 2-3°C on March 28 and 29 and fall by 2-3°C thereafter. They will be above normal during the next 24 hours and below normal on March 27, 30 and 31, and normal on the rest of the days over Delhi. A spell of very light rain accompanied by thunderstorm and gusty winds speed 20-30 kmph gusting 40 kmph during morning to forenoon, and another spell of very light rain accompanied by lightning and gusty winds speed 20-30 kmph gusting 40 kmph during afternoon to evening on March 27,” stated IMD.
It added that very light to light rain accompanied by thunderstorms and gusty winds 30-40 kmph during morning hours, and another spell of very light to light rain accompanied by thunderstorms/lightning and gusty winds 30-40 kmph during forenoon to afternoon on March 29. Subsequently, on March 30, there is a possibility of very light to light rain.
Meanwhile, the air quality remained moderate. On Thursday, the 24-hour air quality index (AQI) at 4 pm, on a scale of 0 to 500, was 186 against 185 a day earlier – both moderate. As per the forecast, the AQI is likely to stay within the moderate category over the next seven days.",1.0
