title,url,source,date,language,state,district,search_term,full_text,relevance_score
Chittoor and Sri Sathya Sai districts issue heatwave advisory - The Hindu,https://news.google.com/rss/articles/CBMi1wFBVV95cUxNdk5ZMUZRYlNOd2xlNmlyNGk3VXZlOG9PTWt4RHN2aVNnSFNhYXhYeXJoVWdRRWV1WUxfa19mUWl0MUlvdTNjRDVoZ3hPYlBwY28xbmlraFhfd2hpN2JxanF1bFAtbWRVbUw3TnZpaF9EcDljZ2hwZlZEb2pXSUVNRFUzWGRXajhGNjA4a2lGRW1tY0gwWE50TUVaZTdzMHQ0NjhzakxzZkpCVEh0eXdlMFhkWXBoeTNmUnVRQ2hwc3J2cHNmSkl1T0xDeXJfcXRDeDNmYWpmWdIB1wFBVV95cUxNdk5ZMUZRYlNOd2xlNmlyNGk3VXZlOG9PTWt4RHN2aVNnSFNhYXhYeXJoVWdRRWV1WUxfa19mUWl0MUlvdTNjRDVoZ3hPYlBwY28xbmlraFhfd2hpN2JxanF1bFAtbWRVbUw3TnZpaF9EcDljZ2hwZlZEb2pXSUVNRFUzWGRXajhGNjA4a2lGRW1tY0gwWE50TUVaZTdzMHQ0NjhzakxzZkpCVEh0eXdlMFhkWXBoeTNmUnVRQ2hwc3J2cHNmSkl1T0xDeXJfcXRDeDNmYWpmWQ?oc=5,The Hindu,2026-04-19T19:01:53+05:30,en,Andhra Pradesh,Chittoor,"""heatwave"" Andhra Pradesh","The Sri Sathya Sai and Chittoor district administrations have issued a heatwave advisory on Sunday (April 19, 2026), cautioning people about severe conditions ahead.
Sri Sathya Sai district Collector A. Shyam Prasad appealed to residents to follow the basic precautions issued by the State government and disaster management authorities. He stressed simple yet essential habits such as wearing light cotton clothing, staying hydrated with buttermilk and coconut water, and avoiding direct sun exposure during the peak afternoon hours.
“Stepping out between 12 noon and 4 p.m. should be avoided,” he noted, adding that children, elderly, and pregnant women should be careful.
Chittoor district Collector Sumit Kumar said that temperatures are already touching 38°-40° Celsius. “A few mandals — including Gangavaram, Ramakuppam, Nagari, and Vijayapuram — are recording even higher readings. While a formal heatwave has not been declared yet, officials say the situation could tighten over the next week or so,” he said.
Officials pointed out that staying out in the heat for long, without enough water, can quickly lead to exhaustion and other heat-related problems.
The India Meteorological Department forecasted that rainfall this season may be below normal due to El Niño conditions, though some showers are likely in May.
Authorities said that they arranging drinking water through borewells and tankers where needed, and keeping field staff on alert in vulnerable pockets.
Published - April 19, 2026 07:01 pm IST
This is a premium article, available exclusively to subscribers.
The Hindu delivers independent, credible journalism that explains events with depth, context, and perspective.
*This offer is only for first-time subscribers.",0.6833333333333333
