title,url,source,date,language,state,district,search_term,full_text,relevance_score
"Indore News: इंदौर में पारा पहुंचा 44 पार, अस्पतालों में बढ़े लू के मरीज, 40 हीट स्ट्रोक क्लिनिक बने - Amar Ujala",https://news.google.com/rss/articles/CBMixwFBVV95cUxOTE9YS2lyRy0xaldmeUVQeVU0TVFUUTdKN0EzdWJoUl94dTRCWVZuWXIxYjg1Ny04M2trRTZMVXJSV0VnT2tjY2V1Y1Mtc3RFc2JKM0NYb19SWU5nMXFZRFJOVEkxSnFtZWplcHFTa19ISktEcnNpNHdhNk82N2o4T0hQeTYzQXZjMHZrZ1lKX25fN052UFZpbm8zdDgyT0JzQ1BlbmVOazBEbGRKSW9hUjFiUUxoM0NUT1BZV3didnFqckd4OWpn0gHMAUFVX3lxTE9ZdEVPV1g0Z1hCWVB0TTJWcklxWGtWZUVfZk5oVi1pN1E5Q0IzMXR2T3BaU0d6eUVSTmtUdTNYYm8wLVQxcl9mbDctcXo1YTl6ZFlCbEs2ZkdITVV2MlJrQ3NhZkp5MXNHRF9qMHI2OGxycURRNkY5LVhUTEV5Z25UZi1PR1hKeEVTS2hMWEMtM29TZkxYUm5udF9yVWNjbXNBb1V2ZFhNdmNHOGttRlBsS0JaOUxjS2stN1g2M1owOTNETjNnWExURmdPSg?oc=5,Amar Ujala,2026-05-18T20:33:52+05:30,hi,Madhya Pradesh,Indore,"""लू"" Madhya Pradesh","Indore News: इंदौर में पारा पहुंचा 44 पार, अस्पतालों में बढ़े लू के मरीज, 40 हीट स्ट्रोक क्लिनिक बने
Indore News: इंदौर में दो दिनों की राहत के बाद गर्मी का प्रकोप फिर बढ़ गया है और सोमवार को अधिकतम तापमान 44.3 डिग्री सेल्सियस दर्ज किया गया। तेज धूप और लू के कारण डिहाइड्रेशन और बुखार के मरीजों की संख्या में 20 फीसदी की बढ़ोतरी हुई है।
खबरें लगातार पढ़ने के लिए अमर उजाला एप डाउनलोड करें
या
वेबसाइट पर पढ़ना जारी रखने के लिए वीडियो विज्ञापन देखें
अगर आपके पास प्रीमियम मेंबरशिप है तो
विस्तार
मौसम वैज्ञानिकों का अनुमान है कि आने वाले दिनों में सूर्य के तेवर और कड़े हो सकते हैं जिससे गर्मी का प्रकोप और बढ़ेगा। सोमवार को सुबह से दिनभर चली गर्म हवाओं और लू के थपेड़ों ने नागरिकों को बेहाल कर दिया और लोग पसीने से तरबतर नजर आए। इससे पहले रविवार को अवकाश का दिन होने के बाद भी लोगों को घरों के भीतर राहत नहीं मिल सकी और स्थिति यह रही कि पंखे भी गर्म हवा फेंक रहे थे।
अस्पतालों में बढ़ी मरीजों की संख्या
तेज धूप और अत्यधिक गर्मी के कारण शहर में लू लगने और शरीर में पानी की कमी यानी डिहाइड्रेशन के मामलों में तेजी से बढ़ोतरी होने लगी है। शासकीय महाराजा यशवंतराव चिकित्सालय के अधीक्षक डॉ. अशोक यादव ने बताया कि अस्पताल की बाह्य रोगी विभाग में डिहाइड्रेशन, बदन दर्द और तेज बुखार की शिकायतों के साथ आने वाले मरीजों की संख्या में 15 से 20 प्रतिशत तक का इजाफा हुआ है। उन्होंने जानकारी दी कि बढ़ता तापमान लोगों के स्वास्थ्य पर सीधा असर डाल रहा है, जिसके कारण नागरिकों को अचानक चक्कर आना, उल्टी होना और गंभीर सिरदर्द जैसी स्वास्थ्य समस्याओं का सामना करना पड़ रहा है।
40 हीट स्ट्रोक क्लिनिक स्थापित किए
मुख्य चिकित्सा एवं स्वास्थ्य अधिकारी डॉ. माधव हसानी ने जानकारी दी कि डिहाइड्रेशन के बढ़ते मामलों को देखते हुए जिले में 40 हीट स्ट्रोक क्लिनिक स्थापित किए जा चुके हैं। इसके साथ ही जिला स्तर के सभी अस्पतालों में गर्मी से जनित आपातकालीन स्थितियों से निपटने के लिए विशेष वार्ड संचालित करने के सख्त निर्देश जारी किए गए हैं। चिकित्सा विशेषज्ञों का कहना है कि पांच वर्ष से कम उम्र के बच्चों और 60 वर्ष से अधिक आयु के बुजुर्गों को इस मौसम में विशेष देखभाल की आवश्यकता है। इसके अलावा अस्थमा, हृदय रोग और डायबिटीज जैसी गंभीर बीमारियों से पहले से पीड़ित व्यक्तियों के लिए भी यह मौसम अधिक जोखिम भरा साबित हो रहा है। प्रशासन ने आम जनता को सलाह दी है कि वे दोपहर 11 बजे से शाम 5 बजे के बीच सीधे धूप में निकलने से बचें। ग्रामीण और शहरी क्षेत्रों में जल संकट को रोकने तथा डिहाइड्रेशन से बचाव के लिए हैंडपंपों को सुधारने और शुद्ध पेयजल की व्यवस्था करने के निर्देश दिए गए हैं। स्वास्थ्य विभाग ने अपील की है कि अत्यधिक कमजोरी या मुंह सूखने जैसे लक्षण दिखने पर तुरंत डॉक्टर से संपर्क करें।
बचाव के लिए जरूरी सावधानियां
इस भीषण गर्मी में खुद को स्वस्थ रखने के लिए चिकित्सकों ने कुछ महत्वपूर्ण उपाय साझा किए हैं। नागरिकों को प्रतिदिन कम से कम 3 से 4 लीटर पानी पीने और शरीर में इलेक्ट्रोलाइट्स की मात्रा बनाए रखने की सलाह दी गई है। इसके लिए नारियल पानी, नींबू पानी और छाछ का सेवन बेहद फायदेमंद साबित हो सकता है। खान-पान में बदलाव करते हुए मौसमी फल, हरी सब्जियां, दाल और चावल जैसे सुपाच्य एवं हल्के भोजन को प्राथमिकता देनी चाहिए। इस मौसम में तले-भुने, अधिक मसालेदार और जंक फूड के सेवन से पूरी तरह बचना चाहिए। घर से बाहर निकलते समय हमेशा ढीले, हल्के रंग के सूती कपड़ों का चयन करें और धूप से सुरक्षा के लिए टोपी, चश्मे या छाते का प्रयोग अवश्य करें।
Get all India News in Hindi related to live update of politics, sports, entertainment, technology and education etc. Stay updated with us for all breaking news from India News and more news in Hindi.",1.0
