title,url,source,date,language,state,district,search_term,full_text,relevance_score
"Heatwave alert: IMD issues scorching heat warning for several states; check latest forecast for Delhi, UP, - The Economic Times",https://news.google.com/rss/articles/CBMiqAJBVV95cUxONHhKN3hJZTBpWk5IZ21iWFlsY2RxZ1J2dG1UZ2kwTHgzdC1hR0dlNXJ1blhxSy1DUkwxczViLV9kLTBXYkU1dVlhejFfNnIyVVZ1LXZ3bGlJd2MxQVRmeW9lcF9WcDZOU1Z2Mm51aXNXVF81RFQzbGlFZEpUMzh1Z05RQlJ1NTdRT0lUNjdXY21UV3U3YmM2S1ZTeDdOeVN1aFRCMngwWG9oSHFQTHM4WW1NYTNLYlgzUnkzcXlzNlNVeU0zUGc5NEJlZzlOLXlQcXFtaGhQVGNWcFFlbWNDUkE4MzZHMzhIZUpBX0FLOUtYN2NNVXM1b1JLdkVhZHZLMUZhRGYwd2FWZXFFOWgtT3BScWRQM1NGUWJHdDVxb3ZoQmZZWmFBZtIBrgJBVV95cUxORHVJYTNUVE5kTkFHNlhTSXRDajFQYlN4X2NLbTh2RjJ5azkzelhqX1kwNjVzVWZocUlGdkw1MmppNzJ3ZkZnODk3c3dyb3ZVUDNSYXRCQWtiSkJwUnJjQVhwOEUwQ0hWbEpCbzNuYzQxZHlNVUJGOFk2NzFjdWJmaGlJSDFDVnJOeEN5UmhFdi1HNXJRQmo1WHBnem5NY0xqZHZsWVcyb1I1eGVlZE5POGNfN0VaeTJqOGh1Yk02b1V3dFgzMTBrLXJ2Y0RqNE1td0JYRV9CaTVhX1ZYZ1dIc3YxMnl3b0MxZjFFX3o3NFhTcGhwZjl6X3RBX2dCNHR4c0R0cDdIdmlNSjdrRWVQWW1CM1hKU09UUG16d05QVDJhX3puWW0zTWlaOTJudw?oc=5,The Economic Times,2026-04-25T09:27:09+05:30,en,Rajasthan,Sri Ganganagar,"(heatwave OR ""heat wave"" OR ""severe heatwave"" OR ""extreme heat"" OR ""heat spell"" OR ""scorching heat"" OR ""blistering heat"" OR ""sweltering heat"" OR ""hot winds"" OR loo OR ""hot loo winds"" OR ""intense heat"" OR ""unbearable heat"" OR ""deadly heat"" OR heat OR ""weather forecast"" OR ""weather update"" OR ""weather alert"" OR ""IMD forecast"" OR ""IMD prediction"" OR ""IMD alert"" OR IMD OR ""rising temperatures"" OR ""temperatures expected to rise"" OR ""relief from heat"" OR ""respite from heat"" OR ""heat respite"" OR ""respite from scorching heat"") Rajasthan","Heat tightens grip across north and central India
According to the IMD, Rajasthan is likely to remain under prolonged heatwave conditions, with isolated pockets expected to stay affected till April 29. Other regions will also see intense heat, though for shorter periods. Madhya Pradesh may experience heatwaves till April 27, while Bihar could see similar conditions till April 25. Chhattisgarh, Vidarbha and Uttar Pradesh are expected to face rising temperatures between April 24 and April 27.Northwest India is not spared either. Punjab, Haryana, Chandigarh and Delhi are expected to see heatwave conditions during the early part of this forecast window. The IMD has also indicated isolated heatwave conditions in Odisha, Jharkhand and even Kerala.
The highest temperature recorded in the plains on April 23 stood at 44.5°C in Sri Ganganagar, Rajasthan. Temperatures across northwest and central India are likely to climb further by 2 to 3 degrees Celsius in the coming days.
Delhi Weather Forecast
“Heatwave conditions are likely to continue in isolated areas on Saturday as well. During the day, surface winds are expected to blow at 15–25 kmph, with gusts reaching up to 35 kmph,” an IMD official said.The IMD added that skies may turn cloudy by Monday, with a chance of very light rain or drizzle on Tuesday.
Mahesh Palawat, vice-president of private weather forecasting company Skymet, told PTI, “This was the season's first heat wave, and similar weather conditions might continue till Sunday. However, very light rain might be observed from Monday due to the formation of a cyclonic circulation.”
Northeast prepares for days of heavy rain
While the north battles heat, northeastern states are heading into a wet spell. The IMD has forecast widespread rainfall, thunderstorms, lightning and strong winds across Assam, Meghalaya, Arunachal Pradesh, Nagaland, Manipur, Mizoram and Tripura.Arunachal Pradesh is expected to receive very heavy rainfall between April 25 and April 29. Assam and Meghalaya may witness heavy to very heavy showers from April 26 to April 29. Other northeastern states are likely to see intense rainfall towards the latter half of the forecast period.
Strong winds will add to the concern. The IMD has warned of thundersqualls with wind speeds reaching 50–60 kmph, gusting up to 70 kmph, over Assam and Meghalaya between April 25 and April 27.
Thunderstorms, lightning to impact eastern states
Eastern India is also likely to see unstable weather from April 24 onwards. Bihar, Jharkhand, Odisha, Gangetic West Bengal and Sub-Himalayan West Bengal and Sikkim are expected to witness thunderstorms accompanied by lightning and gusty winds through the week.There is also a possibility of hailstorms in Jharkhand on April 26 and April 27. Sub-Himalayan West Bengal and Sikkim may receive heavy rainfall between April 25 and April 27, which could disrupt transport and reduce visibility in several areas.
Western Himalayas under western disturbance influence
Weather activity is expected in the western Himalayan region as well. Jammu & Kashmir, Ladakh, Himachal Pradesh and Uttarakhand are likely to see scattered rain or snowfall, along with thunderstorms and strong winds, till April 29. This is being driven by a western disturbance moving across the region.South India to see mix of rain and humidity
Southern states are likely to experience a mix of rainfall and humid conditions. Kerala, Karnataka, Coastal Andhra Pradesh, Telangana, Rayalaseema and Tamil Nadu are expected to receive scattered to moderate rainfall, accompanied by thunderstorms and lightning.At the same time, hot and humid conditions are likely to persist in coastal Andhra Pradesh, coastal Karnataka, Tamil Nadu, Odisha, Gangetic West Bengal and Konkan and Goa. Coastal Gujarat may also see muggy weather intermittently.
Western India may see brief relief from rain
Parts of western India, including Konkan and Goa, Madhya Maharashtra and Marathwada, are likely to receive scattered rainfall with thundershowers till April 25. Hailstorms are also possible in Madhya Maharashtra and Marathwada during the early phase of this forecast period.Hilly regions, particularly in the northeast and Himalayan belt, may see landslides or mudslides in vulnerable zones.",1.0
