title,url,source,date,language,state,district,search_term,full_text,relevance_score
സംസ്ഥാനത്ത് വരും ദിവസങ്ങളിലും ശക്തമായ മഴ തുടരും: ഇന്ന് 4 ജില്ലകളിൽ യെല്ലോ അലർട്ട് | Kerala Weather Update - timeskerala.com,https://news.google.com/rss/articles/CBMipgFBVV95cUxPdnNkb3UwWnNoMktMR2w3RFFfQ1pxYWk3a2hoU1dyTzBGeVBrR3F0SXY4d1lSVVRuNlVjemxxcmhOOGNaUlYzc1JRNjFkc0JCV3J4MzRfSHVBd3NWZmdtZjNuS2c0ZWJaOXZCd2VoVnQyNkZHLURPcVVnM0JnYUFhNWdNN3BmdFpiaDRKVXNGa3dCWllfNVZnc2Jnc3gxNFBtMUwtNFhR?oc=5,timeskerala.com,2026-07-24T08:11:54+05:30,ml,Kerala,Kannur,"(ദുരിതാശ്വാസം OR മുന്നറിയിപ്പ് OR ""റെഡ് അലര്‍ട്ട്"" OR ""ഓറഞ്ച് അലര്‍ട്ട്"" OR ""യെല്ലോ അലര്‍ട്ട്"" OR ""ദുരിതാശ്വാസ ക്യാമ്പ്"" OR നഷ്ടപരിഹാരം) Kerala","തിരുവനന്തപുരം: സംസ്ഥാനത്ത് വരുന്ന ദിവസങ്ങളിൽ ശക്തമായ മഴയ്ക്ക് സാധ്യതയുള്ളതായി കേന്ദ്ര കാലാവസ്ഥാ വകുപ്പിന്റെ പ്രവചനം. ഇതിന്റെ അടിസ്ഥാനത്തിൽ വിവിധ ജില്ലകളിൽ യെല്ലോ അലർട്ട് പ്രഖ്യാപിച്ചു.(Kerala Weather Update, IMD Issues Yellow Alert For Four Kerala Districts)
ഇന്ന് കോഴിക്കോട്, വയനാട്, കണ്ണൂർ, കാസറഗോഡ് എന്നീ ജില്ലകളിലാണ് യെല്ലോ അലർട്ട് നിലവിലുള്ളത്. ഒറ്റപ്പെട്ടയിടങ്ങളിൽ 24 മണിക്കൂറിൽ 64.5 മില്ലിമീറ്റർ മുതൽ 115.5 മില്ലിമീറ്റർ വരെ ലഭിക്കാവുന്ന ശക്തമായ മഴയ്ക്കാണ് സാധ്യത പ്രവചിക്കപ്പെട്ടിരിക്കുന്നത്. മഴയോടൊപ്പം മണിക്കൂറിൽ 30 മുതൽ 40 കിലോമീറ്റർ വരെ വേഗതയിൽ ശക്തമായ കാറ്റിനും ഇടിമിന്നലിനും സാധ്യതയുണ്ടെന്നും മുന്നറിയിപ്പിൽ പറയുന്നു.
കേരള – ലക്ഷദ്വീപ് തീരങ്ങളിൽ ഇന്ന് മത്സ്യബന്ധനത്തിന് തടസ്സമില്ല. എന്നാൽ, കർണാടക തീരത്ത് ഇന്ന് മത്സ്യബന്ധനത്തിന് പോകാൻ പാടില്ലെന്ന് കേന്ദ്ര കാലാവസ്ഥാ വകുപ്പ് അറിയിച്ചു. കർണാടക തീരങ്ങളിൽ മണിക്കൂറിൽ 40 മുതൽ 50 കിലോമീറ്റർ വരെയും ചില അവസരങ്ങളിൽ 60 കിലോമീറ്റർ വരെയും വേഗതയിൽ ശക്തമായ കാറ്റിനും മോശം കാലാവസ്ഥയ്ക്കും സാധ്യതയുണ്ട്.
Story Summary
The India Meteorological Department (IMD) issued a yellow alert for four northern districts of Kerala — Kozhikode, Wayanad, Kannur, and Kasaragod — predicting isolated heavy rainfall accompanied by squally winds and lightning. Fishing has been prohibited along the Karnataka coast due to rough weather conditions, while Kerala and Lakshadweep coasts remain safe.",1.0
