title,url,source,date,language,state,district,search_term,full_text,relevance_score
"हिमाचल के इन 10 जिलों में आज भारी बारिश की चेतावनी, झमाझम बारिश से इस दिन तक नहीं मिलने वाली राहत - ETV Bharat",https://news.google.com/rss/articles/CBMi5AFBVV95cUxOSkFHdzA0NkpqSUw3QU9SbmhZcUlpZTRRQS1hUXZCWGJWQmVpdzNlNkpnN3ZoLXcyTkZrejljRUF1dVpBbkVabzBEMElGWVlhN0g2THNuMGtFalprcm5jNlFTbWpSQnBQT3ZKeTNxY0pldzVtb0EyeWRXTTBtcUpqQTQ4TzYyc0JZYmJSOFZKcW5PdHhpOG9QbGxZVkNLRHZfczB4ckFScE9HOVdKVTV6X29fT1Z1QW1KWHc1LWJRX05PTVRRTlhiRmY4bEdTTGIzWG1zYnNGTF9ZWW9FNkJSMWlXYzPSAeoBQVVfeXFMUFgyeXIwd0RFZlRKS0lVUTlIX1hlNy1KU2JaZ094a1d6amxGeEc1dE0xejQ2SG1uZEF4QUNEUW1qampUWXhYSG5FSmdiQjBIeVN3dkJnTS1fNmpDSUNhRDF4YlcxQ1FOUDJONjNZbUhFZGRvYWdZdlhuNkFXUVNTbnJ5dld0TW5IdkQ4Skc5Z25YMFhUT24ySDNXT2FENXhDS0otZkUtNE1EUlQ3QXhaaU9haXowelViU3hyNHpqOVhKRnYtUEM1d055ZGxVaXZ0TWpXWGxBNk90OVVDTVlnYjFBdkUzVzUtNDNR?oc=5,ETV Bharat,2026-07-23T08:24:24+05:30,hi,Arunachal Pradesh,,"(""हीट एक्शन प्लान"" OR ""गर्मी से राहत"" OR चेतावनी OR ""रेड अलर्ट"" OR ""ऑरेंज अलर्ट"" OR ""येलो अलर्ट"" OR एडवाइजरी OR ""राहत सामग्री"" OR ""राहत शिविर"" OR मुआवजा) Arunachal Pradesh","हिमाचल के इन 10 जिलों में आज भारी बारिश की चेतावनी, झमाझम बारिश से इस दिन तक नहीं मिलने वाली राहत
मौसम विभाग ने हिमाचल के 10 जिलों में भारी बारिश का येलो अलर्ट जारी किया है. इन जिलों में मानसून आफत बनकर बरस रहा है.
शिमला: हिमाचल प्रदेश के विभिन्न जिलों में मानसून इनदिनों कहर बनकर बरस रहा है. भारी बारिश, बादल फटने फ्लैश फ्लड और लैंडस्लाइड ने भयंकर तबाही मचाई है. पिछले 24 घंटों के दौरान प्रदेश के ज्यादातर जगहों पर हल्की से मध्यम बारिश दर्ज की गई है, जबकि एक-दो जगहों पर भारी बारिश से जनजीवन अस्त-व्यस्त हो गया है. मौसम विभाग ने आज (मंगलवार, 23 जुलाई को) प्रदेश के 10 जिलों में भारी बारिश का येलो अलर्ट जारी किया है.
भारी बारिश का येलो अलर्ट
मौसम विभाग ने आज (गुरुवार, 23 जुलाई को) हिमाचल प्रदेश के 10 जिलों में भारी बारिश का येलो अलर्ट जारी किया है. मौसम विभाग के अनुसार, ऊना, बिलासपुर, हमीरपुर, चंबा, कांगड़ा, कुल्लू, मंडी, शिमला, सोलन और सिरमौर जिले में एक-दो स्थानों पर मध्यम से भारी बारिश की संभवना है. किन्नौर और लाहौल स्पीति जिले में किसी तरह की कोई चेतावनी जारी नहीं की गई है. प्रदेश में नदी-नाले उफान पर होने के कारण मौसम विभाग ने लोगों से नदी-नालों से दूर रहने की अपील की है.
इस दिन तक भारी बारिश की चेतावनी
हिमाचल प्रदेश में मानसून अपने सबसे आक्रामक दौर में है. मौसम विभाग के अनुसार, अगले 24 घंटे तक प्रदेश के 10 जिलों में भारी बारिश होने के आसार हैं. 28 जुलाई तक प्रदेश में विभिन्न जिलों में एक-दो जगहों पर भारी बारिश होने की संभावना है. 28 जुलाई तक किन्नौर और लाहौल स्पीति जिले में 30-40 किलोमीटर प्रति घंटे की रफ्तार से तेज हवाएं चलने की संभावना है. इस दौरान कम ऊंचाई और मध्यम ऊंचाई वाले पहाड़ी इलाकों में कुछ स्थानों परआंधी-तूफान/बिजली कड़कने और 30-40 किलोमीटर प्रति घंटे की रफ्तार से तेज हवाएं चलने की संभावना है.
कहां कितनी बारिश?
मौसम विभाग के अनुसार, शिमला जिले में मशोबरा में 12 सेमी, बिलासपुर के श्री नैना देवी में 11 सेमी, ऊना जिले के नंगल बांध में 9 सेमी, बिलासपुर के मालरौण में 8 सेमी, सिरमौर जिले के जत्तन बैराज में 7 सेमी, कुफरी में 7 सेमी, शिमला में 7 सेमी, बिलासपुर के काहू में 6, बिलासपुर एडब्ल्यूएस, बिलासपुर सदर, धर्मशाला, श्री रेणुका जी/दाधौ, बिलासपुर के ओलिन्दा और चंबा जिले के जोत में 5 सेमी, बिलासपुर के घाघस में 4 सेमी, मंडी जिले के स्लेपर, कसौली, अंब, पालमपुर, रामपुर बुशहर, धौलाकुआं एडब्ल्यूएस, शिमला एयरो, धर्मपुर, पंडोह, ऊना, सुजानपुर टीरा, रोहड़ू और जोगिंदरनगर में 3 सेमी, सुंदरनगर, पांवटा साहिब, ऊना जिले के रायपुर मैदान, बरठीं, मुरारी देवी, भरमौर और मनाली में 2 सेमी बारिश दर्ज की गई है. वहीं, मंडी, नगरोटा सूरियां, सैंज एडब्ल्यूएस, ऊना जिले के भरवाईं और शिमला जिले के सराहन में 1 सेमी बारिश दर्ज की गई है.
भारी बारिश से बढ़ सकती है परेशानी
मौसम विभाग ने इन जिलों में भारी बारिश के बाद भूस्खलन और नदी-नालों का जलस्तर बढ़ने के कारण लोगों से बेहद सावधानी बरतने की अपील की है.
- भारी बारिश से बागवानी और खेती को आंशिक नुकसान की संभावना.
- भारी बारिश के चलते प्रदेश के निचले इलाों में जलदजमाव की समस्या.
- फिसलन भरी सड़कों और कम विजिबिलिटी की वजह से गाड़ियां फिसल सकती हैं.
- भारी से अति भारी बारिश के चलते सड़क मार्ग बाधित होने के चलते ट्रैफिक जाम होने की संभावना.
- भारी बारिश की वजह से जरूरी सेवाएं और रोजाना के बाहरी काम कुछ समय के लिए प्रभावित हो सकते हैं.
जनता से प्रशासन की अपील
- भूस्खलन, फ्लैश फ्लड और जमीन धंसने वाले संभावित क्षेत्रों से दूर रहें.
- भारी बारिश के दौरान वाहन चालक ट्रैफिक नियमों का विशेष रूप से पालन करें.
- बरसात के मौसम में संवेदनशील क्षेत्रों में जाने से बचें.
- नदी-नाले उफान पर होने के कारण पानी वाली जगहों से सुरक्षित दूरी बनाए रखें.
- प्रदेश सरकार द्वारा जारी गाइडलाइन का पालन जरूर करें.",1.0
"हिमाचल के तीन जिलों में 5 घंटे भारी बारिश की चेतावनी, 31 तक राहत नहीं देगा मानसून; पर्यटकों के लिए एडवायजरी - Jagran",https://news.google.com/rss/articles/CBMixAFBVV95cUxQMHpFZmFXUDZWR0xvY1B3SWlGdGJYc3lYTDJtN1JnRzVLR2ZkUXVqc2w3R1lIWUJPYlhITHItUUN6R3ZTVlM4TWtVVlZENnhrdnpRYjhXV1pSYjl0WHgyWmFJeTh1UG9vRDBvN1pIUTVvb2NGT2ZHQXdkbmpMbU56T3pWdDdwNjlNeTdua0tldDBiaWNRT1BEbkYxRUVJd3FZRGF6c3J6N1g0YmNkLVhSdExwUThnZ2YyRHhOTmxUaEFYZmN0?oc=5,Jagran,2026-07-23T13:07:00+05:30,hi,Arunachal Pradesh,,"(""हीट एक्शन प्लान"" OR ""गर्मी से राहत"" OR चेतावनी OR ""रेड अलर्ट"" OR ""ऑरेंज अलर्ट"" OR ""येलो अलर्ट"" OR एडवाइजरी OR ""राहत सामग्री"" OR ""राहत शिविर"" OR मुआवजा) Arunachal Pradesh","हिमाचल के तीन जिलों में 5 घंटे भारी बारिश की चेतावनी, 31 तक राहत नहीं देगा मानसून; पर्यटकों के लिए एडवायजरी
मानसून 31 जुलाई तक हिमाचल में सक्रिय रहेगा, शिमला, सोलन और सिरमौर में अगले 5 घंटों में भारी वर्षा की चेतावनी है। लगातार बारिश से 100 सड़कें बंद हैं। ...और पढ़ें
HighLights
31 जुलाई तक हिमाचल में सक्रिय रहेगा भारी मानसून।
शिमला, सोलन, सिरमौर में अगले 5 घंटे भारी वर्षा।
भूस्खलन से 100 सड़कें बंद, यात्रा से बचें।
राज्य ब्यूरो, शिमला। हिमाचल प्रदेश में 31 जुलाई तक भारी वर्षा से राहत मिलने का आसार नहीं हैं। इस दौरान मानसून अधिक सक्रिय रहेगा। मौसम विज्ञान केंद्र शिमला द्वारा जारी किए गए ताजा पूर्वानुमान के अनुसार शिमला, सोलन और सिरमौर में आगामी पांच घंटों के दौरान भारी वर्षा की संभावना है। इस कारण कुछ स्थानों पर भूस्खलन और आंधी की संभावना जताई गई है।
वीरवार को सुबह से वर्षा का क्रम जारी है। प्रदेश में लगातार वर्षा और भूस्खलन के कारण यातायात व्यवस्था प्रभावित है, करीब 100 सड़कें यातायात के लिए बंद हैं, जिन्हें बहाल करने का काम युद्धस्तर पर जारी है।
पर्यटकों के लिए एडवायजरी
राज्य आपदा प्रबंधन ने नागरिकों व पर्यटकों से नदी-नालों, खड्डों और भूस्खलन के प्रति संवेदनशील क्षेत्रों से दूर रहने तथा केवल अति-आवश्यक होने पर ही यात्रा करने की सलाह दी है।
शिमला सहित प्रदेशभर में भूस्खलन की घटनाएं
शिमला सहित प्रदेश में कई स्थानों पर भूस्खलन हुआ है। इस कारण यातायात व्यवस्था पर असर हुआ है। नदियों में जलस्तर बढ़ा है। ऐसे में बांधों से पानी लगातार छोड़ा जा रहा है।
तापमान में विशेष बदलाव नहीं
लगातार वर्षा के बीच न्यूनतम तापमान में कोई विशेष बदलाव नहीं आया है। एक डिग्री से भी कम का अंतर दर्ज किया गया है।
प्रदेश में श्रीनयनादेवी जी में सबसे अधिक वर्षा
प्रदेश में बीते 24 घंटों के दौरान बिलासपुर के श्रीनयनादेवी जी में 56.2 मिलीमीटर सबसे ज्यादा वर्षा हुई। इसके अलावा मनाली में 35, रामपुर में 30.3, सराहन में 28.7, नाहन में 28, रोहड़ू में 20 मिलीमीटर वर्षा दर्ज की गई है।",1.0
