title,url,source,date,language,state,district,search_term,full_text,relevance_score
Odisha Announces Early Summer Vacation As Heatwave Intensifies,https://www.deccanchronicle.com/nation/odisha-announces-early-summer-vacation-as-heatwave-intensifies-1952531,Deccan Chronicle,2026-04-24T20:34:28+05:30,en,Odisha,Angul,"(heatwave OR ""heat wave"" OR ""severe heatwave"" OR ""extreme heat"" OR ""heat spell"" OR ""scorching heat"" OR ""blistering heat"" OR ""sweltering heat"" OR ""hot winds"" OR loo OR ""hot loo winds"") Odisha","The decision comes amid a sharp rise in temperatures across several districts, prompting the government to prioritise the safety and well-being of students: Reports
BHUBANESWAR: The Odisha government on Friday announced early summer vacation for all schools across the state in view of the prevailing heatwave conditions. Chief Minister Mohan Charan Majhi said all educational institutions will remain closed from April 27.
The decision comes amid a sharp rise in temperatures across several districts, prompting the government to prioritise the safety and well-being of students. Officials said the early closure is a precautionary step to shield children from prolonged exposure to extreme heat.
Odisha is currently experiencing an intense heatwave, with multiple regions recording unusually high temperatures. The India Meteorological Department (IMD) has issued heatwave warnings for six districts—Khordha, Keonjhar, Angul, Sambalpur, Jharsuguda, and Bolangir—advising people to avoid direct sun exposure during peak hours.
In addition, a yellow warning has been sounded for 17 districts due to hot and humid conditions, further aggravating discomfort levels. The weather office has also forecast thunderstorms and rainfall in six districts, indicating a possible shift in weather patterns over the next few days.
On Thursday, Jharsuguda and Talcher recorded the highest temperatures in the state at a scorching 44 degree Celsius. Overall, 24 urban centres reported temperatures above 40 degrees Celsius, reflecting the widespread severity of the heatwave. On Friday also, many places in the state also recorded temperature over 43 degrees Celsius.
The extreme weather has significantly disrupted daily life, with residents limiting outdoor activities during the day. Health experts have advised people to stay hydrated, wear light clothing, and take adequate precautions, particularly for vulnerable groups such as children, the elderly, and those engaged in outdoor work.
Meanwhile, there are indications of some relief ahead. The IMD has predicted increased thunderstorm and rainfall activity from April 26, which could lead to a gradual drop in temperatures across parts of the state.
Authorities continue to monitor the situation closely and have urged citizens to follow official advisories as Odisha grapples with one of the harshest heat spells of the season.",1.0
"Odisha Prepone Summer Vacation 2026 Amid Severe Heatwave, Schools to Close from April 27",https://www.timesnownews.com/education/odisha-prepone-summer-vacation-2026-amid-severe-heatwave-schools-to-close-from-april-27-article-154156712,Times Now,2026-04-24T13:53:44+05:30,en,Odisha,Angul,"(heatwave OR ""heat wave"" OR ""severe heatwave"" OR ""extreme heat"" OR ""heat spell"" OR ""scorching heat"" OR ""blistering heat"" OR ""sweltering heat"" OR ""hot winds"" OR loo OR ""hot loo winds"") Odisha","Keeping in mind the rising temperatures across the state, the Odisha government has preponed the 2026 summer vacation for all government, government-aided, and private schools to April 27, 2026. This decision was announced by the I & PR Department of the state on behalf of Chief Minister Shri Mohan Charan Majhi. This decision has been taken with the aim of ensuring that students are protected from severe heatwave conditions across the state.
""Chief Minister Shri Mohan Charan Majhi has announced an early summer vacation keeping in view the severe heatwave currently sweeping through the state. Keeping the safety of children in mind, the Chief Minister has taken this decision. The Chief Minister has approved the related proposal from the School and Mass Education Department,"" the official tweet by I & PR Department read. ""According to this decision, all government, government-aided, and private schools in the state will remain closed from April 27. However, previously scheduled examinations, census work, and other office tasks will continue as before.""
Several districts of Odisha have been experiencing extreme heatwave conditions with temperatures soaring to even 44° in some cities. As per reports, as many as 24 cities recorded temperatures above 40°C, underscoring the widespread intensity of the heatwave. For Friday, the India Meteorological Department (IMD) has issued a heatwave warning for six districts, Khordha, Keonjhar, Angul, Sambalpur, Jharsuguda, and Bolangir. Additionally, local reports suggest that a yellow warning has been issued for 17 districts.
While some reports are claiming that a thunderstorm is predicted for April 26, the government is worried that making students travel to school in such rising temperatures may have a negative impact on students' health.
Before announcing early summer vacation, the Odisha government had revised school timings in several districts to ensure children reached home safely before the maximum temperatures of the day were recorded. On March 20, the Odisha government had announced that starting April 2, the classes will be conducted in morning shift due to the prevailing heatwave conditions. Even Anganwadi centres were told to operate from 7 am to 9 am during the summer.",0.8500000000000001
