title,url,source,date,language,state,district,search_term,full_text,relevance_score
Morocco issues ‘red’ alert for forest fires in 20 provinces - Anadolu Ajansı,https://news.google.com/rss/articles/CBMipAFBVV95cUxOam5GRGxDNnNHX2VRN3RJWTl1SFFJMVBzLU56aG5hVWN4VjlEVUdLLWY1UWo3d0UxZThWbkdaWFZVZXRPTkR6TEJxc0NHS2QxNUFRYmxqNjcwWjBzbU1ZMW9ITHh3ek1JbkZ5QS1KZXBpTmI3WHdRT3JnS1YtdG5xTXdwVmVSRHFCNHdSdF9uZTMzRTVhTUFOX0dZeXh3cGVHTWl6WQ?oc=5,Anadolu Ajansı,2026-07-01T02:57:49+05:30,en,Himachal Pradesh,Una,"(""heat advisory"" OR ""heat action plan"" OR ""heat alert"" OR ""IMD warning"" OR ""IMD alert"" OR ""red alert"" OR ""orange alert"" OR ""yellow alert"" OR ""NDMA advisory"" OR ""cooling shelter"" OR ""relief measures"" OR ""heat compensation"" OR ""severe weather warning"") Himachal Pradesh","Morocco issues ‘red’ alert for forest fires in 20 provinces
Authorities urge residents living near forested areas to exercise caution until July 8
Ahmad Bentaher
01 July 2026•Update: 01 July 2026
RABAT, Morocco
Morocco on Tuesday urged residents living near forested areas in 20 provinces to exercise caution starting Wednesday until July 8 amid a heat wave, raising the risk level for forest fires to the highest ""red” alert.
Forests cover 12% of Morocco’s territory and are affected every year by fires of varying intensity depending on weather conditions and human activity.
The provinces include Rabat, Sale, Skhirat–Temara, Sidi Slimane, Essaouira, Agadir Ida Ou Tanane, Taroudant, Kenitra, Sidi Kacem, Khemisset, Fahs-Anjra, Larache, Ouezzane, Tangier–Assilah, Taza, Taounate, Ifrane, Sefrou, Meknès and El Hajeb, the National Agency for Water and Forests said in a statement.
The agency urged citizens living near forest areas, forest workers, as well as tourists and visitors, to remain highly vigilant.
There is a “high risk of forest fires” in 12 other provinces, including Al Hoceima, Chefchaouen, Tetouan, M’diq–Fnideq, Berkane, Nador, Azilal, Beni Mellal, and Khénifra, Benslimane, Casablanca and Mohammedia, it warned.
It urged anyone to immediately report any smoke or suspicious activity to authorities and to avoid any behavior that could trigger fires.
Morocco uses an early warning system to assess forest fire risk, managed by the National Agency for Water and Forests, which issues regular updates based on weather conditions and vegetation status.
The “red” alert indicates an extreme fire risk, while an “orange” level indicates high risk, requiring heightened caution and avoidance of any activity that could ignite fires.
The warnings are typically issued during the summer season, while lower risk levels -- yellow and green -- remain internal and are not publicly announced.
In 2025, fires burned around 1,728 hectares of forest in Morocco, with shrubs and seasonal vegetation accounting for 45% of the affected areas.
The fire risk warning comes alongside a weather alert issued by the General Directorate of Meteorology regarding a heat wave from Tuesday through Thursday, with temperatures reaching up to 46 °C (115 °F) in some regions of the country.
*Writing by Serdar Dincel in Istanbul
Morocco issues ‘red’ alert for forest fires in 20 provinces",1.0
"Heavy Rain Lashes Parts of Punjab, Yellow Alert Issued as Monsoon Likely in 2–3 Days - Punjab Newsline",https://news.google.com/rss/articles/CBMiuwFBVV95cUxNRzFIczdOUFozMUJKcDhXVHN4bzhKWnliRUpOdTJieGRmallMdlAxbDJlSHdZdkFab1dCLUdGSG8tTGVUNzJvV3FoRnNLc29HdlZsNUJJOUtBMHFNZV85QkR1OXBxWlFxalRFcThnSGNTakxLMFdMUUE4Y3RvUGdUcnlDLVNCTXpNcTZFY3dXN2ZuQUEzV2gwNHRuQXNEQnlpbTFoVEJqbGpCbDNMcnZQRHFXV3JjQjRidEdZ?oc=5,Punjab Newsline,2026-07-01T12:38:41+05:30,en,Himachal Pradesh,Una,"(""heat advisory"" OR ""heat action plan"" OR ""heat alert"" OR ""IMD warning"" OR ""IMD alert"" OR ""red alert"" OR ""orange alert"" OR ""yellow alert"" OR ""NDMA advisory"" OR ""cooling shelter"" OR ""relief measures"" OR ""heat compensation"" OR ""severe weather warning"") Himachal Pradesh","Punjab Newsline | Mohali
Heavy rainfall lashed parts of Punjab, including Mohali, Pathankot and Gurdaspur, on Wednesday, bringing much-needed relief from the scorching heat. Chandigarh also witnessed light showers, while cool winds swept across Mohali and Jalandhar, with cloudy skies prevailing in several parts of the state.
In Pathankot, heavy rain on the very first day of schools reopening disrupted normal life, with many students unable to reach school in the morning due to waterlogged roads. The city received nearly five hours of continuous rainfall, leaving several roads submerged under 3 to 4 feet of water. The Khaddi Nallah also overflowed, causing water to flow over a bridge and affecting traffic movement.
In Jalandhar, strong winds uprooted a eucalyptus tree on Court Road, which fell onto parked vehicles, damaging two cars.
The India Meteorological Department (IMD) has issued a yellow alert for the entire Punjab and Chandigarh region, warning of thunderstorms, lightning and strong winds with speeds of 40 to 50 kmph. Rain has also been forecast for Chandigarh and the Tricity region until noon on Wednesday.
The weather department said the southwest monsoon is expected to arrive in Punjab within the next two to three days. It has also predicted heavy rainfall at isolated places across Punjab on July 2, 3, 4 and 6, while Chandigarh is likely to witness heavy rain at some locations between July 2 and July 6.
Meanwhile, Punjab's average maximum temperature dropped by 1.6 degrees Celsius, although it still remains 2.3 degrees above normal. On Tuesday, Faridkot was the hottest district in the state, recording a maximum temperature of 43.8 degrees Celsius",1.0
