title,url,source,date,language,state,district,search_term,full_text,relevance_score
No respite from heat in Maharashtra: Vidarbha districts record temperatures above 40 degrees Celsius - Mid-day,https://news.google.com/rss/articles/CBMi8AFBVV95cUxQX2s2ZWFZbXAwZ21TRV84alRnblQ1MzlRVy1ybnkyRFpPY2lENTMzRm5yVnVRaUoyUkJuYmhXbk03RXZ0LTZBSVZJU29lbzF2WE9helU5ZnZLREpNNDA2a2JvcG1Sa1l0YTRpY3BxbXNRVFEtVXhyVkJGdHhrbjM0THRPUDZpTzZqdGw2UEZBeTVrVTlmeHlQZC1WSjExdmtXUVpxU0Nsa2R4eFZNQlIwbUZielNNM3I2VXpJZjc4Y1pQcjNBYTNER21RbEl1VlliUmg4ZnlPakVncTNaeGdRRmtxXzdyUXZuS1o2OWtYMkvSAfYBQVVfeXFMUGRudXdJX1ZlRXdZTV91T3JNOWFpOVNGMUpOZ0NBdnpVOGxkUlpCalJ0SWtON04xZlhQc2NsWktXSFUtZVBEYVoxSFNLY1VTUVJudFRkcDcyY25hYks5OEpMMXluajIyaUUwa0RyVmJyOGh1WUdQY05ORkQwQUMtMnRwM2Y1Skg3aUlGNlNULXRJRGM4N2NzbkY3a2g2Y0IyaXFhb1ZsQ0RFSkZjUjVkLUozSU1ydEtsQWRDNVozbGVoaFlSV2NHeTl4c0hfS191QkRHbmRrd3NNNE1Ec0ZzNmo0dlZzR1puaFBFY1J2WmtnaVlrN2hB?oc=5,Mid-day,2026-06-04T21:13:00+05:30,en,Maharashtra,Akola,"""heatwave"" Maharashtra","No respite from heat in Maharashtra: Vidarbha districts record temperatures above 40 degrees Celsius
Nagpur recorded 42.6 degrees Celsius, while Wardha and Akola saw temperatures ranging between 42.5 degrees Celsius and 42.9 degrees Celsius. Amravati also hovered close at around 42.9 degrees Celsius
Mumbai recorded 35.6 degrees Celsius temperature on Thursday. File pic
Brahmapuri in Chandrapur district sizzled at 44.2 degrees Celsius on Thursday, making it the hottest place in Maharashtra. Several parts of Vidarbha also reported temperatures above 40 degrees Celsius, signalling widespread heatwave-like conditions across the region.
Vidarbha belt remains the hottest region
Nagpur recorded 42.6 degrees Celsius, while Wardha recorded 42.5 degrees Celsius. The mercury reached 42.9 degrees Celsius in. Gondia and Yavatmal crossed 41 degrees Celsius. Chandrapur also remained extremely hot, touching 41 degrees Celsius. Washim and Buldhana stayed close to the 39–40 degrees Celsius mark as heat intensified across eastern Maharashtra.",1.0
