title,url,source,date,language,state,district,search_term,full_text,relevance_score
CM Reddy orders heatwave preparedness as temperatures soar in Telangana,https://www.devdiscourse.com/article/health/3915312-cm-reddy-orders-heatwave-preparedness-as-temperatures-soar-in-telangana,Devdiscourse,2026-05-20T16:32:50+05:30,en,Telangana,Jagtial,"(heatwave OR ""heat wave"" OR ""severe heatwave"" OR ""extreme heat"" OR ""heat spell"" OR ""scorching heat"" OR ""blistering heat"" OR ""sweltering heat"" OR ""hot winds"" OR loo OR ""hot loo winds"") Telangana","CM Reddy orders heatwave preparedness as temperatures soar in Telangana
Telangana Chief Minister A Revanth Reddy has directed officials to take measures to deal with rising mercury levels, ensuring public safety and availability of essential supplies during the summer.
With mercury levels rising sharply across the state during the current summer, Telangana Chief Minister A Revanth Reddy on Wednesday directed officials to take measures, including preparedness in hospitals and the setting up of drinking water distribution centres, to deal with the situation.
Reddy asked officials to ensure the availability of Oral Rehydration Salt (ORS) packets, drinking water, and uninterrupted power supply, a press release said.
He instructed Chief Secretary K Ramakrishna Rao to continuously monitor the situation in the districts and issue necessary guidelines to district collectors to ensure public safety during the summer.
He also suggested establishing free drinking water centres in urban areas and appealed to people to avoid travelling during the afternoon hours.
According to the Telangana State Development Planning Society, Ailapur in Jagtial district recorded 45.9 degrees Celsius, followed by 45.8 degrees Celsius in Kattangoor (Nalgonda district) and Dasturabad (Nirmal district).
Several other places in the state also recorded temperatures well above 40 degrees Celsius.
In its forecast, the India Meteorological Department's Meteorological Centre here predicted a gradual rise in maximum temperatures by one to two degrees Celsius over the next two days.
(This story has not been edited by Devdiscourse staff and is auto-generated from a syndicated feed.)
- According to the Telangana State Development Planning
- degrees Celsius",0.8333333333333333
