title,url,source,date,language,state,district,search_term,full_text,relevance_score
CM Rekha Gupta outlines heatwave measures as Delhi reels under extreme temperatures - WION,https://news.google.com/rss/articles/CBMizAFBVV95cUxOOXA3bC1vLThWelFlSzg3WTZnZHdOWGdLUUc3U1lXNFNYUDhSZG5YTGR2Q1NsNXpBS3RIRHZZaEtxOE9NcURubVBVX0kza19HdVZPVDhyX1pJdjJRZTNJRXlFbU5zY241Y3Q4V2tjMkFxR2ROOVZYLXpFMlhIdUJ2TGtLSk1ULV9UTzJxZS16SVBDQWZzdjA1U29JdnR1OVowRXU4b3RPV2pBcWRvcE1HUUZsWUdoNjFrUUNQOEw4OERMbmE2d3R5N2E2MDTSAdIBQVVfeXFMTlF2Qnd5aGhVY0tERnJwZWh0Wmc3RS1PTTZHN2xDNy0xdkdJekdsV1l4NTZScTBZckRzWi1LMHJkLUpyYlQyOFlWanZSaHllVWkxRUtoSk5EUWp2cGkxY2w2ME5OLVlkeTVCajhYNG1NZDluTHRBOTRYVUhSM1ZfWGFuSjdoR3IzcEIxREd1azdIaC1HQUcyd0FmVmo1SlRKbkFsWlVfUFJSQVhISVJsdHFIOUZLSExlR2ktV2FidWxLSV9fVjh6QUZKeHBieGFtSmhn?oc=5,WION,2026-05-02T21:58:00+05:30,en,Punjab,,"(heatwave OR ""heat wave"" OR ""severe heatwave"" OR ""extreme heat"" OR ""heat spell"" OR ""scorching heat"" OR ""blistering heat"" OR ""sweltering heat"" OR ""hot winds"" OR loo OR ""hot loo winds"" OR ""intense heat"" OR ""unbearable heat"" OR ""deadly heat"" OR heat OR ""weather forecast"" OR ""weather update"" OR ""weather alert"" OR ""IMD forecast"" OR ""IMD prediction"" OR ""IMD alert"" OR IMD OR ""rising temperatures"" OR ""temperatures expected to rise"" OR ""relief from heat"" OR ""respite from heat"" OR ""heat respite"" OR ""respite from scorching heat"") Punjab","Delhi Chief Minister Rekha Gupta on Saturday (May 02) reviewed measures taken to tackle the ongoing heatwave in the national capital, as temperatures continue to breach 45°C in several parts of the city.
She said heatwaves affect everyone but hit labourers and outdoor workers the hardest, especially those exposed to direct sunlight. The government has directed that all workers, in both public and private sectors, must be given rest between 1 PM and 4 PM to reduce heat exposure.
The Chief Minister said arrangements have been made to provide drinking water for commuters, particularly in DTC buses. Volunteers have been deployed at bus shelters to distribute water and oral rehydration salts (ORS) to help people cope with extreme heat.
Add WION as a Preferred Source Hospitals across the city have been equipped with essential medicines and facilities to treat heat-related illnesses. Cooling areas are being set up within hospitals, while schools have ensured the availability of drinking water and ORS for students.
These measures come as Delhi continues to reel under an intense heatwave, with temperatures consistently crossing 45°C, prompting authorities to mobilise emergency resources to prevent heat-related casualties. The regional meteorological department has issued a “Red Alert” for the coming week, warning that dry westerly winds will sustain the harsh conditions.
The administration has intensified its Heat Action Plan, deploying mobile health vans to densely populated areas and construction sites to monitor vulnerable groups. Medical experts have advised residents to watch for early symptoms of heat exhaustion, including dizziness, excessive thirst and muscle cramps. Health centres are stocking electrolytes and essential nutrients, while in severe cases, doctors may recommend Vitamin B1 to support recovery after extreme dehydration.
Related Stories",1.0
