title,url,source,date,language,state,district,search_term,full_text,relevance_score
ഇന്നും നാളെയും കേരളത്തിൽ ഉഷ്ണതരംഗ മുന്നറിയിപ്പ് : മൂന്ന് ജില്ലകളിൽ അതീവ ജാഗ്രത - metbeatnews.com,https://news.google.com/rss/articles/CBMiwgFBVV95cUxORkIxdzUyRGtON1d3Q1BGUnhLeUdaOTJZM05LaHNJTDRnUEctcFBIdmlOMWFoUDc4QzZvYzQxQ1dYT2tqczhnWVdYaHdUTmlTcnRxZ1Zmc0pEcENXZkd1WUFhWV9TVXFlTDVpM3ZKOVdZYlctZGVTOEwwbFk1X2REUjNKN2ctZkk1cTFuUjZ2MmhkZXJBdUR0WWFpQlcycGJ3NnhxeHgwSWpTTVpacXAtdndBdG5fTENVUGRlbGFENGFYZw?oc=5,metbeatnews.com,2026-04-23T17:12:15+05:30,ml,Kerala,Kozhikode,"(സൂര്യാഘാതം OR ""ഹീറ്റ് സ്ട്രോക്ക്"" OR ""ചൂടേറ്റ് മരണം"" OR ""വെയിലേറ്റ് മരണം"" OR നിര്‍ജലീകരണം OR ""ആശുപത്രിയില്‍ പ്രവേശിപ്പിച്ചു"" OR ""ചൂടുമൂലം അസുഖം"") Kerala","ഇന്നും നാളെയും കേരളത്തിൽ ഉഷ്ണതരംഗ മുന്നറിയിപ്പ് : മൂന്ന് ജില്ലകളിൽ അതീവ ജാഗ്രത
സംസ്ഥാനത്ത് ഉയർന്ന താപനില (High Temperature) തുടരുന്ന സാഹചര്യത്തിൽ സൂര്യാഘാതം (Sunstroke), സൂര്യാതപം (Heat Exhaustion), നിർജലീകരണം (Dehydration) തുടങ്ങിയ ഗുരുതര ആരോഗ്യ പ്രശ്നങ്ങൾ വർധിക്കാനുള്ള സാധ്യതയുണ്ടെന്ന് ആരോഗ്യ വകുപ്പ് മുന്നറിയിപ്പ് നൽകി.
source on Google
Maneesha Prasoon
Maneesha Prasoon is a dedicated journalist at Metbeat News, specializing in weather reporting, climate trends, and environmental issues. She brings a solid academic and professional foundation to her role, holding a BA in Sociology and a PG Diploma in Television Journalism from the Keltron Knowledge Centre in Kozhikode.",1.0
"Kerala Heatwave Young man Death : കണ്ണൂരിൽ സൂര്യാഘാതമേറ്റ് യുവാവ് മരിച്ചു, നാല് വയസ്സുകാരിക്കും, അങ്കണവാടി ജീവനക്കാരിക്കും സൂര്യാഘാതമേറ്റു - metbeatnews.com",https://news.google.com/rss/articles/CBMisgFBVV95cUxPNkM2dUIzOHI4WFM0RkxVLTJDMkR1cWR1WjN0VWhYXzIxbEphNDVFMjZzbDVMdEtmV2RvWTBTTzFrei1TRGdlSjQ5cTFiMEE1Z2laM1ZDYjBxalVkNU5iWFRlWXdSZm5lZmh3ZGRXWGdvNkltSDhSenhZN2ZDS2FzWjI3VFJVb0JWMDAxaVUxUzl0MVpiVDR2UDY5RkFFdmdJS0MwOHRES3RtQVI0b3lMN19n?oc=5,metbeatnews.com,2026-04-23T15:42:08+05:30,ml,Kerala,Kozhikode,"(സൂര്യാഘാതം OR ""ഹീറ്റ് സ്ട്രോക്ക്"" OR ""ചൂടേറ്റ് മരണം"" OR ""വെയിലേറ്റ് മരണം"" OR നിര്‍ജലീകരണം OR ""ആശുപത്രിയില്‍ പ്രവേശിപ്പിച്ചു"" OR ""ചൂടുമൂലം അസുഖം"") Kerala","കണ്ണൂരിൽ സൂര്യാഘാതമേറ്റ് യുവാവ് മരിച്ചു, നാല് വയസ്സുകാരിക്കും, അങ്കണവാടി ജീവനക്കാരിക്കും സൂര്യാഘാതമേറ്റു
ശക്തമായ ചൂടിനിടെ ജോലിയിൽ ഏർപ്പെട്ടിരുന്നപ്പോൾ തലചുറ്റൽ (dizziness), ക്ഷീണം (fatigue), ശരീരതാപനില ഉയരുന്നത് (body temperature rise) തുടങ്ങിയ ലക്ഷണങ്ങൾ പ്രകടമായി. സഹപ്രവർത്തകർ ഉടൻ തന്നെ അദ്ദേഹത്തെ സമീപത്തെ ആശുപത്രിയിൽ പ്രവേശിപ്പിച്ചു.
source on Google
Maneesha Prasoon
Maneesha Prasoon is a dedicated journalist at Metbeat News, specializing in weather reporting, climate trends, and environmental issues. She brings a solid academic and professional foundation to her role, holding a BA in Sociology and a PG Diploma in Television Journalism from the Keltron Knowledge Centre in Kozhikode.",0.5166666666666666
