title,url,source,date,language,state,district,search_term,full_text,relevance_score
তীব্র গরমের মাঝে স্বস্তি! আজ বিকেলেই ভিজতে পারে দক্ষিণবঙ্গের এসব জেলা - TheWall,https://news.google.com/rss/articles/CBMi2AFBVV95cUxQOERtMklnYVA5SzdNUXBMLVBsY3pMbWFvR1hCRlBMU1ZXR2xVZTRaWnRnTlpxdUpPSHlGdVBBbmJ4X0ZKS0tJc2VSVTN2ejZfZktCc0hackhSMm1VMUlsUGJPaE5vMHlnSk1PQVdOWDJnQ3lFT2R4c05fbGptVFZhZkc3SXgzWjdwWUdJckNEZ21QbGxtQk4wN1VZdHFORFcyMHIwSHBNUnp1V09TUkRPTWFPZ3VGZ3NwVjFrVy1qX0IwT2NGSlZ1Z0kyeno1Q2tpMnlMZ0MyWVjSAd4BQVVfeXFMUG1iVlhBdGF6eDU0T0E3OFdxVmQ5NHFUMzJCajd3MWJOMHQ5S0ZaaDhZdTdIdk1wQlBfS09HSmRGeW5maXVZYW4yU2o2ZkkybFZfUloySl9zbk1GZ2Q5UW9ucU1qN0kwN3hJNDIxdlNUVDlMOE1Fb0xuTmlLTkJSOGpBWUYtajUxQy1sYXRqNW5PejBicDd6dERNUW9QeDhUZXl1Q1hjTWhWRVdGUVJlSllhbWU2UWtFV0hJZ1l5SGJ1eVptTlQ4ZDVObmF3NUwzUGpmamdTZmx0M2JfdExR?oc=5,TheWall,2026-04-19T10:28:55+05:30,bn,West Bengal,Birbhum,"(দাবদাহ OR তাপপ্রবাহ OR ""প্রচণ্ড গরম"" OR ""তীব্র গরম"" OR ""ঝলসানো গরম"" OR ""লু হাওয়া"" OR ""গরমের দাপট"" OR দাবানল OR ""অসহ্য গরম"" OR ""হিট ওয়েভ"" OR ""অত্যধিক গরম"" OR ""ভয়াবহ গরম"") West Bengal","কলকাতা-সহ দক্ষিণবঙ্গে তীব্র গরমের মাঝে স্বস্তির খবর। বিকেলের পর বীরভূম, মুর্শিদাবাদ, পশ্চিম বর্ধমান-সহ একাধিক জেলায় বজ্রবিদ্যুৎ-সহ বৃষ্টির পূর্বাভাস। হলুদ সতর্কতা জারি।
শেষ আপডেট: 19 April 2026 10:31
দ্য ওয়াল ব্যুরো: কলকাতা-সহ দক্ষিণবঙ্গের একাধিক জেলায় তীব্র গরমের দাপটে জনজীবন কার্যত নাজেহাল হয়ে উঠেছে। শহরে সর্বোচ্চ তাপমাত্রা প্রায় ৩৫ ডিগ্রির কাছাকাছি পৌঁছালেও পশ্চিম বর্ধমানের পানাগড়ে তা ৪০ ডিগ্রির গণ্ডি ছাড়িয়ে গিয়েছে। তবে এই হাঁসফাঁস করা পরিস্থিতির মাঝে রবিবার কিছুটা স্বস্তির বার্তা দিয়েছে আবহাওয়া দফতর। সারা দিন প্রচণ্ড গরম অনুভূত হলেও বিকেলের পর দক্ষিণবঙ্গের বীরভূম, মুর্শিদাবাদ, পশ্চিম বর্ধমান, পুরুলিয়া, ঝাড়গ্রাম, বাঁকুড়া ও পশ্চিম মেদিনীপুরের মতো জেলাগুলিতে হালকা থেকে মাঝারি বজ্রবিদ্যুৎ-সহ বৃষ্টির সম্ভাবনা রয়েছে।
দক্ষিণবঙ্গের বাকি জেলাগুলিতে আবহাওয়া মূলত শুষ্ক থাকলেও পশ্চিম মেদিনীপুর, পুরুলিয়া, বাঁকুড়া, ঝাড়গ্রাম ও পশ্চিম বর্ধমানে দিনের বেলা গরম ও আর্দ্র অস্বস্তি বজায় থাকবে। আমজনতাকে এই পরিস্থিতি নিয়ে সতর্ক করতে হাওয়া অফিসের পক্ষ থেকে ওই জেলাগুলিতে হলুদ সতর্কতা জারি করা হয়েছে। এদিকে উত্তরবঙ্গের আবহাওয়া দক্ষিণবঙ্গের তুলনায় কিছুটা আলাদা।
আজ দার্জিলিং, জলপাইগুড়ি, কালিম্পং, আলিপুরদুয়ার ও কোচবিহারের বেশ কিছু জায়গায় হালকা থেকে মাঝারি বৃষ্টির পূর্বাভাস দেওয়া হয়েছে। বৃষ্টির পাশাপাশি এই জেলাগুলিতে বজ্রপাত এবং ঘণ্টায় ৪০–৫০ কিমি বেগে দমকা হাওয়া বা ঝড় বয়ে যাওয়ার সম্ভাবনা রয়েছে বলে জানিয়েছে আবহাওয়া দফতর। সব মিলিয়ে রাজ্যের এক অংশে যেমন বৃষ্টির সম্ভাবনা তৈরি হয়েছে, অন্য অংশে তেমনই আর্দ্রতাজনিত অস্বস্তি বজায় থাকবে।",1.0
