title,url,source,date,language,state,district,search_term,full_text,relevance_score
Delhi logs season’s hottest day at 34.4°C; warm morning continues - The New Indian Express,https://news.google.com/rss/articles/CBMiyAFBVV95cUxPNFlXeHRYRFF4cUYzUy1HY0ptQ3NNdDFFZnppc3JjOGRpSDdqeER5ZzZzMDMyYTdQNmRIMXVkYmdQUTFTQ1cxR1I2UGtfWTlJR2hVV0g2ZThmZ3h4OTk1SnEwRXJZVkQwN0VaT3VhYkpKRDhhY28tSWYtbFFrSzFndlNMV0RiMHFrUzRyS2JLMWdGaWJBWUpPUENHcE9WclFlZ2VHMm04RGl5M25WR1BybWZmbkZmZ2huT3BFaVVieUxnRjRfX09jONIByAFBVV95cUxPNFlXeHRYRFF4cUYzUy1HY0ptQ3NNdDFFZnppc3JjOGRpSDdqeER5ZzZzMDMyYTdQNmRIMXVkYmdQUTFTQ1cxR1I2UGtfWTlJR2hVV0g2ZThmZ3h4OTk1SnEwRXJZVkQwN0VaT3VhYkpKRDhhY28tSWYtbFFrSzFndlNMV0RiMHFrUzRyS2JLMWdGaWJBWUpPUENHcE9WclFlZ2VHMm04RGl5M25WR1BybWZmbkZmZ2huT3BFaVVieUxnRjRfX09jOA?oc=5,The New Indian Express,2026-03-07T09:37:00+05:30,en,Delhi,New Delhi,"(""mercury soars"" OR ""mercury crosses"" OR ""temperature soars"" OR ""record temperature"" OR ""all-time high"" OR ""degrees Celsius"" OR ""maximum temperature"" OR ""hottest day"") Delhi","NEW DELHI: The capital woke up to a warm morning on Friday with a minimum temperature of 17 degrees Celsius, 3.6 degrees above the season’s normal, the weather office said. As the maximum temperature settled at 34.4 degrees Celsius, Friday marked the hottest day of the season so far in the capital, while the the air quality remained in the ‘moderate’ category.
The maximum temperature is expected to settle at 34 degrees Celsius on Saturday, with a forecast of mainly clear skies.
In the first five days of March, Delhi recorded its highest average minimum temperature in three years. Thursday also marked the hottest day of the season so far, with a minimum temperature of 18.2 degrees Celsius and a maximum temperature of 34.3 degrees Celsius.
Station-wise data showed on Friday that Palam recorded a minimum temperature of 17.5 degrees Celsius, 4.9 degrees above normal. Lodhi Road recorded 16.3 degrees Celsius, 4.3 degrees above normal, while Ridge logged 17.8 degrees Celsius, 3.7 degrees above normal.
However, Delhi’s air quality was in the ‘moderate’ category with an AQI reading of 151",0.8500000000000001
"दिल्ली-एनसीआर में इस सीजन का अब तक का सबसे गर्म दिन रहा शुक्रवार, जानिए अगले दो दिन के मौसम का हाल - ETV Bharat",https://news.google.com/rss/articles/CBMi7AFBVV95cUxNZ2F2RE50dGVSbnhrdnctUTNaeVoyMGFEV2E5ZUlWZVJhb05KXzNnSkwycVRuVl9yT01SQnh6YTZXOHAxT2dwQmg2Z29iQndVbzZralhoemRMNThZZHo0NTlCMmZRZEZkMDlKYmV3R1VycEpGQWFvbGRzSG50bEI3a3BiRWhKcVZ6cmVuRUZ6Q25xVlpDdTEwbk9ZenFCcHNfd1BCNF9uMjg4MmFoWmlvMWZXcjYtTGFPWlM0czctRjA2WXczdXM3bkgwSW4wOGs3YWFNN1ZFb3RXM0dfZHctLXFYR21tTDVWaHdMatIB8gFBVV95cUxPcU5qT2N2X2RGdk5rQTJlekwxanN4REhabEdIZkRIQ1ZoOXVPSWtlOXpTMXVod0JJSkcxeGhHYUttODRlTlRURWd4TkJVTTdtQngtV3d5aHJoOTVRYWprSms1WGlPMEF4LUUxTnNCbHgtM0xHeXpiTjVWa0JvaXJycGM3LS1fcTI1SlFNQkxCTTlDT09lRWZ6TTJNTGV6RTFQZVBPY0N5dVZWUHByYlZIOFRqWjRTZFBPTWZEWFBQNUpSLV9XalFONEpoRFp2NW00VDV4cGtKSmI3cmlqQ1ZoRlJJdHM0R1M4U2NkRVFmRFRWUQ?oc=5,ETV Bharat,2026-03-07T07:55:08+05:30,hi,Delhi,New Delhi,"(""पारा चढ़ा"" OR ""पारा पहुंचा"" OR तापमान OR ""तापमान बढ़ा"" OR ""रिकॉर्ड तोड़ गर्मी"" OR ""डिग्री सेल्सियस"" OR ""पारा उबला"" OR ""अधिकतम तापमान"") Delhi","दिल्ली-एनसीआर में इस सीजन का अब तक का सबसे गर्म दिन रहा शुक्रवार, जानिए अगले दो दिन के मौसम का हाल
दिल्ली-एनसीआर में गर्मी शुक्रवार को और तेज हो गई है. अगले हफ्ते से तापमान 36 डिग्री के स्तर को छू सकता है.
नई दिल्ली: राजधानी दिल्ली में शुक्रवार को अधिकतम तापमान 34.4 डिग्री सेल्सियस दर्ज किया गया, जो इस मौसम का अब तक का सबसे गर्म दिन रहा. अधिकतम तापमान सामान्य से 7 डिग्री अधिक रहा और गुरुवार को दर्ज अधिकतम तापमान 34.3 डिग्री सेल्सियस को पार कर गया.
बढ़ेगा गर्मी का एहसास
मौसम विभाग ने अपने पूर्वानुमान में कहा कि शनिवार और रविवार को आसमान साफ रहेगा. अधिकतम तापमान 35 डिग्री सेल्सियस और न्यूनतम तापमान 17 डिग्री सेल्सियस के आसपास रह सकता है. आईएमडी ने कहा कि दिल्ली-एनसीआर में अगले दो दिनों (7 और 8 मार्च) में मौसम मुख्य रूप से साफ और शुष्क रहेगा. अधिकतम तापमान सामान्य से काफी ऊपर बना रहेगा, जबकि न्यूनतम तापमान भी सामान्य से ऊपर रहेगा. गर्मी का एहसास बढ़ रहा है और दिन में हल्की गर्म हवाएं चल सकती हैं.
अलग-अलग इलाकों का न्यूनतम तापमान
शुक्रवार को शहर में वायु गुणवत्ता सूचकांक 171 दर्ज किया गया. सफदरजंग में न्यूनतम तापमान सामान्य से 3.6 डिग्री अधिक 17 डिग्री सेल्सियस दर्ज किया गया जबकि लोदी रोड स्टेशन पर यह सामान्य से 4.3 डिग्री अधिक 16.3 डिग्री सेल्सियस रहा. रिज स्टेशन पर न्यूनतम तापमान 17.8 डिग्री सेल्सियस और आयानगर में न्यूनतम तापमान 17.6 डिग्री सेल्सियस दर्ज किया गया.
जानिए अलग-अलग एरिया का अधिकतम तापमान
स्टेशनवार आंकड़ों के अनुसार, रिज में अधिकतम तापमान सामान्य से 6.7 डिग्री अधिक 34.7 डिग्री सेल्सियस, जबकि लोदी रोड में सामान्य से सात डिग्री अधिक 34 डिग्री सेल्सियस तापमान दर्ज किया गया, वहीं, पालम में अधिकतम तापमान सामान्य से 5.5 डिग्री अधिक 32.5 डिग्री सेल्सियस और आयानगर में सामान्य से 7.4 डिग्री अधिक 34.5 डिग्री सेल्सियस तापमान दर्ज किया गया.
'स्काईमेट' के मौसम विज्ञान एवं जलवायु परिवर्तन विभाग के उपाध्यक्ष महेश पलावत ने कहा, 'आने वाले दिनों में आसमान के साफ रहने और तेज धूप निकलने के संकेत हैं, जिससे सुबह और शाम दोनों समय तापमान में धीरे-धीरे वृद्धि हो सकती है. आने वाले दिनों में हवा की गति भी बढ़ने की संभावना है.'",0.0
