title,url,source,date,language,state,district,search_term,full_text,relevance_score
"Weather Update: दिन में लू और रातें गर्म, दिल्ली में इस हफ्ते गर्मी से नहीं मिलेगी राहत, जानें देशभर का मौसम - AajTak",https://news.google.com/rss/articles/CBMi1wFBVV95cUxOdndsM2h2bFpzTlhrOU56YTZHNEFHOVEyQmdsM0F1dml4UnVKVzhwd3dCQUhyUk5kUXRORU1nTWVtZ3VhMlBQTHJJcEFyUUpoSWdUdDlWRVdDeGNLOXczNEdNYUpWU1Frck1iNUxfaG14YWlVN3VSOF9TY3d0VWpvNlhBMER3UnpyalVCcXpORktaeXBCcUVQeWx5TFhIelRyaGFVUk1CZFFuSVV3alNNS2V2NmZiU0ZWR1BmYXlfN2M5NVJ3OUVSMjBYYWltMzFJM3o2LUQ4UdIB1wFBVV95cUxOdndsM2h2bFpzTlhrOU56YTZHNEFHOVEyQmdsM0F1dml4UnVKVzhwd3dCQUhyUk5kUXRORU1nTWVtZ3VhMlBQTHJJcEFyUUpoSWdUdDlWRVdDeGNLOXczNEdNYUpWU1Frck1iNUxfaG14YWlVN3VSOF9TY3d0VWpvNlhBMER3UnpyalVCcXpORktaeXBCcUVQeWx5TFhIelRyaGFVUk1CZFFuSVV3alNNS2V2NmZiU0ZWR1BmYXlfN2M5NVJ3OUVSMjBYYWltMzFJM3o2LUQ4UQ?oc=5,AajTak,2026-04-23T07:02:06+05:30,hi,Delhi,,"""लू"" Delhi","Weather Update: दिन में लू और रातें गर्म, दिल्ली में इस हफ्ते गर्मी से नहीं मिलेगी राहत, जानें देशभर का मौसम
मौसम विभाग के अनुसार अगले कुछ दिनों तक दिल्ली समेत देश के कई हिस्सों में तापमान सामान्य से काफी ऊपर बना रहेगा, जिससे दिन में लू और तेज गर्मी के साथ-साथ रातों में भी राहत की उम्मीद नहीं है और लोगों को लगातार गर्म हवाओं व बढ़ते पारे का सामना करना पड़ेगा.
अप्रैल के आखिरी हफ्ते में देशभर में गर्मी का असर तेज़ होता जा रहा है. दिल्ली-एनसीआर में भी हालात चुनौतीपूर्ण हैं, दिन में लू और रात में भी गर्मी से राहत मिलने के आसार नहीं हैं. मौसम विभाग के ताज़ा अनुमान के मुताबिक अगले कुछ दिनों तक तापमान सामान्य से काफी ऊपर बना रहेगा.
दिल्ली में 23 अप्रैल को आसमान साफ रहेगा और तापमान 40 से 42 डिग्री सेल्सियस तक पहुंच सकता है, जो सामान्य से 3 से 5 डिग्री ज्यादा है. रात का तापमान भी 23 से 25 डिग्री के बीच रहेगा, यानी न्यूनतम तापमान भी सामान्य से ऊपर रहेगा. 24 अप्रैल को गर्मी और बढ़ेगी और अधिकतम तापमान 42 से 44 डिग्री तक जा सकता है. इसी दिन से लू का असर शुरू हो जाएगा. 25 अप्रैल को हल्के बादल रह सकते हैं, लेकिन गर्मी से राहत नहीं मिलेगी और लू का प्रकोप जारी रहेगा. इन दिनों में रातें भी असामान्य रूप से गर्म रहेंगी, जिससे लोगों को 24 घंटे गर्मी का सामना करना पड़ेगा.
Advertisement
देश के बाकी हिस्सों की बात करें, तो उत्तर-पश्चिम भारत में 26 अप्रैल तक तापमान में 3 से 5 डिग्री तक बढ़ोतरी होने की संभावना है. इसके बाद 27-28 अप्रैल को हल्की गिरावट दर्ज की जा सकती है. मध्य भारत में भी 26 अप्रैल तक 2 से 4 डिग्री तापमान बढ़ेगा, जबकि पूर्वी भारत में 25 अप्रैल तक ज्यादा बदलाव नहीं और 26 से 28 अप्रैल के बीच हल्की गिरावट हो सकती है.
महाराष्ट्र में 25 अप्रैल तक तापमान 2-3 डिग्री तक बढ़ सकता है, जबकि गुजरात में 24 से 27 अप्रैल के बीच गर्मी और तेज होगी. नॉर्थ-ईस्ट भारत में 23 अप्रैल तक तापमान बढ़ने के बाद स्थिति स्थिर रहने की संभावना है.
लू की बात करें तो पंजाब, हरियाणा, चंडीगढ़ और दिल्ली में 24-25 अप्रैल को लू चलने की संभावना है. पश्चिमी उत्तर प्रदेश में 23 और 25 अप्रैल, पूर्वी उत्तर प्रदेश में 22 से 26 अप्रैल तक, राजस्थान में 24 से 26 अप्रैल, मध्य प्रदेश में 23 से 26 अप्रैल और विदर्भ-छत्तीसगढ़ में 24 से 27 अप्रैल के बीच हीटवेव का असर रहेगा. बिहार, झारखंड और गंगीय पश्चिम बंगाल में भी 22-23 अप्रैल को लू का खतरा है.
Advertisement
इसके अलावा, ओडिशा, आंध्र प्रदेश के तटीय इलाके, तमिलनाडु, केरल और कर्नाटक के तटीय क्षेत्रों में गर्म और उमस भरा मौसम बना रहेगा. वहीं हरियाणा, दिल्ली, ओडिशा और कोंकण-गोवा में ‘वॉर्म नाइट’ यानी गर्म रातों की स्थिति भी बनी रहेगी.",1.0
"Delhi Weather Today: दिल्ली-NCR में भीषण गर्मी का कहर जारी, 43°C तक पहुंच सकता है तापमान, IMD ने जारी किया येलो अलर्ट - Moneycontrol Hindi",https://news.google.com/rss/articles/CBMi8wFBVV95cUxQU2VVT3hGeUVfRzM4MmFEcWpON1pEanlkb2hUTXYwTGlXRWowaTM0aEtXendxeVhSRFZZdjBvWXBJVWJBYUZINzlET0R3WHZUUXEyaVN3MlNRN2Ytb2ZzbzFNNU9ScGxlNExVdVlCQ3VueUlGaThhRFNXR0J5TzByeHJuVFlCeE1WX1E2TmlTYnJ5Wl95ZEZTNmhnS2lYNm1sdVRLd19yTlRjOUkzMU5lMHdKZzdoWVladUttQmE3U0FPMTVrSUJPN2pDeU5fOGhUY2ktS1pwX1dGSl9wNWZBV2VENllNNVZYdkFjRmNGTW5INFXSAfgBQVVfeXFMTzBybGZEaDFack9EUmV5VW1TQUFEMUZ5YjVqV09mY09xMHhXTE1EY0h0SVBYSzhzUV85Z3NULWNOYUNTVC00aGtMRTZJc1B0ejA1SWtzNlVNYVNTMXBSU0FEenJfYnFOcVc0dXVZcUZ6R2VhaHgyVVpOLVpTcG44QzVqSW10d2tuWTd0RVNGQ2xUdEtPMXpncTdKZnZKRUxucllRMmRxMzJtY0pSTllfWng2dXplbWhMM0RYUFdUUjN1djFDR1M0UkUyNFJ3bkRqWVJZUFB3OW9tMlVROGZ1amw5STc4UmMxNFVTT1NIYlc0Rzc2Yl9wb2Q?oc=5,Moneycontrol Hindi,2026-04-23T06:48:40+05:30,hi,Delhi,,"(""हीट एक्शन प्लान"" OR ""गर्मी से राहत"" OR चेतावनी OR ""रेड अलर्ट"" OR ""ऑरेंज अलर्ट"" OR ""येलो अलर्ट"" OR एडवाइजरी OR ""राहत सामग्री"" OR ""राहत शिविर"" OR मुआवजा) Delhi","Delhi Weather Today: दिल्ली में तेजी से तापमान में हो रही बढ़ोतरी के कारण पूरे इलाके में भीषण गर्मी पड़ रही है। भारत मौसम विभाग (IMD) ने 21 अप्रैल से दिल्ली-एनसीआर के लिए लू की चेतावनी जारी की है और अनुमान है कि 24 अप्रैल तक स्थिति गंभीर बनी रहेगी। साफ आसमान और तेज धूप के कारण दिन में बाहर निकलना मुश्किल हो रहा है, जबकि पारा सामान्य मौसम के स्तर से ऊपर बना हुआ है।
दिल्ली का आज का मौसम: दिल्ली-NCR में लू की स्थिति
मौसम विभाग के अनुसार, दिल्ली के अधिकांश हिस्सों, जिनमें उत्तर, दक्षिण, पश्चिम, पूर्व, मध्य दिल्ली, नई दिल्ली और आसपास के एनसीआर शहर जैसे गुरुग्राम, नोएडा, गाजियाबाद और फरीदाबाद शामिल हैं, में लू चलने की संभावना है। दिन भर आसमान ज्यादातर साफ रहेगा और तेज धूप खिली रहेगी।
अधिकतम तापमान 41°C से 43°C के बीच रहने की उम्मीद है, जबकि न्यूनतम तापमान 21°C से 23°C के बीच रह सकता है। पिछले 24 घंटों में, सफदरजंग में तापमान 39.5°C दर्ज किया गया, जो सामान्य से 2.7°C अधिक है, जबकि रिज क्षेत्र में तापमान 41.3°C तक पहुंच गया।
अपडेट में कहा गया है कि लू (हीटवेव) की स्थिति को देखते हुए मौसम विभाग ने दिल्ली-एनसीआर के कई इलाकों के लिए येलो अलर्ट जारी किया है।
दिल्ली का आज का मौसम: बढ़ती गर्मी और हेल्थ एडवाइजरी
मौसम वैज्ञानिकों ने चेतावनी दी है कि आने वाले दिनों में गर्मी और बढ़ सकती है। अनुमान के मुताबिक, “आने वाले दिनों में अधिकतम तापमान में 1-2 डिग्री तक की बढ़ोतरी हो सकती है, जिससे लू की स्थिति और गंभीर हो जाएगी।”
लोगों को सलाह दी गई है कि वे इस तेज गर्मी में सावधानी बरतें, क्योंकि ज्यादा तापमान के संपर्क में आने से डिहाइड्रेशन, हीट एक्सॉशन (थकावट) और अन्य स्वास्थ्य समस्याएं हो सकती हैं। इसके अलावा, एडवाइजरी में कहा गया है कि दोपहर के समय बाहर जाने से बचें, ज्यादा से ज्यादा पानी पिएं और हल्के, सूती कपड़े पहनें।
अधिकारियों ने कहा, ""दिल्ली के उत्तर-पश्चिम, दक्षिण-पश्चिम, पूर्वी और शाहदरा सहित अधिकतर जिलों में लू की स्थिति जारी रहने की संभावना है।""
दिल्ली का आज का मौसम: 25 अप्रैल के बाद राहत मिलने की उम्मीद
अगले कुछ दिन भीषण गर्मी रहेगी, लेकिन 25 अप्रैल के बाद कुछ राहत मिलने की उम्मीद है। आंशिक रूप से बादल छाए रहने से तापमान में थोड़ी गिरावट आ सकती है, जिससे अधिकतम तापमान 40°C से 42°C के आसपास पहुंच जाएगा। हालांकि, तुरंत ज्यादा राहत मिलने की संभावना नहीं है।
तब तक, दिल्ली-एनसीआर के लोगों को भीषण गर्मी का सामना करना पड़ेगा। पानी की मांग बढ़ सकती है, कूलिंग सिस्टम का ज्यादा इस्तेमाल होगा और गर्मी से जुड़ी बीमारियों के मामले भी बढ़ सकते हैं।
मौसम विभाग ने लोगों से सावधानी बरतने और रोजाना मौसम अपडेट पर नजर रखने की अपील की है।",1.0
"आज का मौसम, 23 अप्रैल 2026: बिहार में आंधी-तूफान, दिल्ली में लू का येलो अलर्ट, जानिए यूपी समेत आज देशभर का वेदर अपडेट - Mint",https://news.google.com/rss/articles/CBMi-wFBVV95cUxNaEpIb0YwUF9xYk9rOE03dUlpOGlhN09lX1FFZ0lWTzlEb3JSeDRGdEJUbzJsdFlJV0RqTUVGREM4VGtUWk9pUTl3NkE1Zmpnb19fM0FxZFBOaDRLcWlabzR5djM1TXlNYk5DQ29YOVVmVmxGalRZN0NpS1VUNlA4ZXp6RHBUYVhieVhfSi05RlhLU0VkNi1wOG8wY3NsQnJpQW5wMk5fMlpWeVdWdUxXakdYTV91cGt0QVQxelg3Q2xuZHp5QlFObHMxWXhoYnZoSWlSeTg2c2wwNlo0VldVaHd5aElLc0lRYlplZnJwM1gzczJHX3k1bUxhUdIBgAJBVV95cUxNSzI3RUdmMkxZWktpVXBnc2hwMlc1dGhxMlhLOGZJR2R5NTlsWGZIUlNiWG9SNFA2T2xVNlp5Z1Z2aUZudmNaSUFGM29pbkJrM0JiU0pQV3hnZ2lGdGxMRDRHUlhSVmhGTXpvcjdXZkdGXzZfVEppTEhzVjdhYjJvbHd2VTZpbk93QzVNamZQQnRCTWJqT3k2MC12Ukw0NUFOdER1OGQ4SWViTDVuSmxWd1FhZ0p2TFNOTDJpaUtDNUlVem1pcWM0dFNDZU9Dejk1ZVVuOTg2RXZtdUczYmVVQTNxVC1wT01NMXRaWDBuVm94YmtyYm16aHFDYll6TVg1?oc=5,Mint,2026-04-23T06:47:23+05:30,hi,Delhi,,"(""हीट एक्शन प्लान"" OR ""गर्मी से राहत"" OR चेतावनी OR ""रेड अलर्ट"" OR ""ऑरेंज अलर्ट"" OR ""येलो अलर्ट"" OR एडवाइजरी OR ""राहत सामग्री"" OR ""राहत शिविर"" OR मुआवजा) Delhi","आज का मौसम, 23 अप्रैल 2026: दिल्ली-एनसीआर समेत पूरे उत्तर भारत में गर्मी का प्रकोप जारी है। मौसम विभाग ने आज यूपी-पंजाब समेत कई राज्यों में लू की चेतावनी जारी की है और तापमान बढ़ने की संभावना जताई है। सूरज की बढ़ती गर्मी के बीच IMD ने कुछ राज्यों में आंधी-बारिश का भी अलर्ट जारी किया है। IMD के अनुसार, आज हिमाचल प्रदेश, उत्तराखंड, असम, मेघालय, अरुणाचल प्रदेश, नागालैंड, मिजोरम, त्रिपुरा, झारखंड, पश्चिम बंगाल और ओडिशा में बारिश देखने को मिल सकती है।
दिल्ली-NCR में आज लू का येलो अलर्ट जारी किया गया है। दिन में चलने वाली लू की वजह से आज पारा 42 डिग्री तक जा सकता है। मौसम विभाग ने आने वाले दिनों में हीटवेव की भी चेतावनी दी है। मौसम के इस बदलते रूख पर मौसम विभाग ने लोगों से सावधान रहने की अपील की है।
दिल्ली ही नहीं यूपी में भी भीषण गर्मी पड़ रही है। पूर्वी यूपी से लेकर पश्चिमी यूपी तक कई जिले लू की चपेट में है। मौसम विभाग के अनुसार 23-26 अप्रैल तक गर्मी के प्रकोप में कोई राहत मिलने की संभावना नहीं है। लू की वजह से लखनऊ, कानपुर, प्रयागराज, वाराणसी, गोरखपुर, आगरा और मेरठ में गर्म हवाएं चलेंगी। मौसम विभाग ने लोगों को दोपहर के वक्त घर में ही रहने की सलाह दी है।
भले ही दिल्ली-यूपी में बारिश की कोई संभावना नहीं है, लेकिन बिहार में मौसम विभाग ने आंधी-तूफान का अलर्ट जारी किया है। IMD के अनुसार आज बिहार में लू का अलर्ट है, लेकिन शाम से मौसम करवट बदलेगा और कल से यहां आंधी-बारिश होने की संभावना है। मौसम विभाग के अनुसार अगले तीन दिनों तक आंधी-बारिश का अलर्ट है। आंधी-बारिश की वजह से राज्य के तापमान में कमी आएगी।
जम्मू कश्मीर में मौसम विज्ञान विभाग ने अगले कई दिनों तक जम्मू-कश्मीर में सूखे मौसम का अनुमान लगाया है। अप्रैल के अंत तक रुक-रुक कर हल्की वर्षा और गरज के साथ बौछारें पड़ने का अनुमान है। IMD के अनुसार आज मौसम शुष्क रहने की उम्मीद है, जबकि दोपहर के बाद कुछ स्थानों पर कुछ समय के लिये हल्की वर्षा हो सकती है।
भारत मौसम विभाग ने झारखंड के चार जिलों में आज के लिए लू का अलर्ट जारी किया है। इसके अलावा आईएमडी ने राज्य के कई क्षेत्रों में 24 अप्रैल से तीन दिनों तक हल्की से मध्यम बारिश का पूर्वानुमान व्यक्त किया है। आईएमडी ने कहा कि राज्य के उत्तर पूर्वी भाग में स्थित चार जिलों दुमका, जामताड़ा, धनबाद और बोकारो में आज लू की चेतावनी दी है। इसके बाद 24, 25 और 26 अप्रैल को हल्की से मध्यम बारिश, 30-50 किमी प्रति घंटा की रफ्तार से तेज हवाएं, आंधी-तूफान की संभावना है।
अनुज श्रीवास्तव ने पत्रकारिता में अपनी पहचान बनाई है। साल 2019 में CCS University से मास कम्युनिकेशन की पढ़ाई पूरी करने के बाद उन्होंने पंजाब केसरी ग्रुप से अपने करियर की शुरुआत की। यहां उन्हें खबरों की जमीनी समझ और फील्ड वर्क का शुरुआती अनुभव मिला। इसके बाद वन इंडिया हिंदी में उन्हें डिजिटल कंटेंट को नए एंगल से पेश करने का मौका मिला,जिसने उनके लेखन को नई धार दी। डिजिटल मीडिया में काम करते हुए अनुज ने बीते 7 वर्षों में कंटेंट की बदलती दुनिया को बेहद करीब से देखा है। ट्रेंड्स को पढ़ना, टोन को पकड़ना और खबरों को दिलचस्प अंदाज में पेश करना उनका सबसे मजबूत पक्ष बन चुका है। इसके बाद उन्होंने नवभारतटाइम्स.कॉम में 3 साल तक बतौर डिजिटल कंटेंट प्रोड्यूसर काम किया,जहां उनका फोकस राजनीति वायरल और ट्रेंडिंग खबरों पर रहा। इस दौरान अनुज ने न सिर्फ तेजी से बदलते डिजिटल ट्रेंड्स को पहचाना,बल्कि खबरों को ज्यादा प्रभावशाली और पाठकों से जुड़ाव भरा बनाने की कला में भी निपुणता हासिल की। हमेशा नयेपन की तलाश में रहते हुए अनुज अपने नाम को सार्थक करने की कोशिश जारी रखे हुए हैं। मई 2025 से अनुज Mint Hindi में राजनीति, बिजनेस, ट्रेंडिंग खबरों को कवर कर रहे हैं और डिजिटल पत्रकारिता को नई दिशा देने में सक्रिय भूमिका निभा रहे हैं।",1.0
