title,url,source,date,language,state,district,search_term,full_text,relevance_score
"Limit outdoor movement of children, elderly amid heat wave: experts - Bangladesh Sangbad Sangstha (BSS)",https://news.google.com/rss/articles/CBMiU0FVX3lxTE9YR2xabUk1T011ZURrVnRfenZVWEg1RFNidUU1TXJ2OEJWRnB4X3NQWDcwdEdLUW5Xbkp5M19UYmNDZGNKWUpOY19CSE12S09URkhv?oc=5,Bangladesh Sangbad Sangstha (BSS),2026-04-23T10:38:59+05:30,en,Delhi,,"(heatstroke OR ""heat stroke"" OR sunstroke OR ""heat exhaustion"" OR ""heat-related death"" OR ""heat casualty"" OR ""heat fatality"" OR ""suspected heat death"" OR dehydration OR ""heat cramps"" OR ""heat illness"") Delhi","Limit outdoor movement of children, elderly amid heat wave: health experts
DHAKA, April 23, 2026 (BSS) - Health experts have strongly advised people to avoid taking children and elderly family members outdoor unless absolutely necessary during heat wave.
Extreme temperature significantly increases the risk of dehydration and heat-related illnesses, they said urging people for heightened awareness and careful monitoring to protect the high-risk groups.
Experts said children and the elderly people are particularly vulnerable to extreme heat as their bodies cannot regulate temperature effectively, making them prone to heatstroke and dehydration.
Physicians recommend ensuring regular intake of water and fluids for children, rather than relying on their sense of thirst. Hydrating options such as coconut water, lemon-based drinks and homemade fruit juices are especially beneficial in maintaining electrolyte balance.
They also advised avoiding direct exposure to sunlight, particularly between 11:00am and 4:00pm, when temperatures are usually at their peak. If going outside is unavoidable, individuals should use umbrellas or hats and wear loose-fitting, light-coloured cotton clothing.
“Children frequently suffer from heat-related conditions such as heatstroke, fever, diarrhoea, vomiting and dehydration during prolonged hot weather,” said Dr Md Abdul Kader, Associate Professor of the pediatrics department of Dhaka Medical College Hospital (DMCH).
He said children often cannot clearly communicate their discomfort, making it essential for parents and caregivers to remain alert to early warning signs.
He further advised maintaining a cool and comfortable indoor environment for both children and the elderly, using fans or air coolers where necessary, but avoiding prolonged exposure to direct cold air.
Symptoms such as dizziness, nausea, unusual fatigue and excessive body heat may indicate approaching heatstroke and should prompt immediate medical consultation, he added.",1.0
"Do not wait until thirsty, hydrate frequently: Govt gives essential safety tips for India’s 2026 heatwave - NewsMeter",https://news.google.com/rss/articles/CBMi1wFBVV95cUxPZTdqVk85NXhUOVh2Wl9jblBPdDhBSXR5Smg1X3p5Sm1vSUhxeTVGcHZWM2hpck1DWXRmaWJUMGRZWGVVRW1DMkdmVlh2MEY2bG10N1JfLVJDWmd3dDhjMExBWXhRWWJQSjdpRmRtOEJVOU9YMFZ6QXoyQko0LS1lbndoUV9oZV82NW9KSjNELTNzWW5MQUljcm5vbXR2WVpYS2hFMjRxY3lxYVNoTjdCNGREZnFsOXp1ZWwxbU9MMUY2dHJvby1SQlgxV0gtaXJMbTVNblR0RQ?oc=5,NewsMeter,2026-04-23T13:30:00+05:30,en,Delhi,,"(heatwave OR ""heat wave"" OR ""severe heatwave"" OR ""extreme heat"" OR ""heat spell"" OR ""scorching heat"" OR ""blistering heat"" OR ""sweltering heat"" OR ""hot winds"" OR loo OR ""hot loo winds"" OR ""intense heat"" OR ""unbearable heat"" OR ""deadly heat"" OR heat OR ""weather forecast"" OR ""weather update"" OR ""weather alert"" OR ""IMD forecast"" OR ""IMD prediction"" OR ""IMD alert"" OR IMD OR ""rising temperatures"" OR ""temperatures expected to rise"" OR ""relief from heat"" OR ""respite from heat"" OR ""heat respite"" OR ""respite from scorching heat"") Delhi","Do not wait until thirsty, hydrate frequently: Govt gives essential safety tips for India’s 2026 heatwave
The most effective defense against the sun is maintaining internal hydration and limiting exposure.
By Newsmeter NetworkRepresentative Image
Hyderabad: As temperatures across India begin to climb to record-breaking levels this season, GHMC authorities have officially triggered a Heatwave Action Plan. With extreme weather conditions expected to persist, staying informed and prepared is the best way to safeguard your health and that of your family.
Stay Hydrated and Protected
The most effective defense against the sun is maintaining internal hydration and limiting exposure. Health experts suggest the following daily habits:
Drink consistently: Do not wait until you are thirsty; drink water at regular intervals throughout the day.
Opt for electrolytes: Supplement your water intake with coconut water, lemon juice, buttermilk, or ORS.
Dress smart: Stick to light-colored, loose-fitting cotton clothing and always use a hat or an umbrella when heading out.
Watch your diet: Eat water-rich fruits like watermelon and cucumber; avoid heavy proteins, alcohol, and excessive caffeine.
Timing matters: Avoid all non-essential outdoor work between 12:00 PM and 4:00 PM, when the sun's intensity is at its peak.
Home Cooling Strategies
Your home can quickly become a heat trap if not managed correctly. Simple changes to your daily routine can keep indoor temperatures significantly lower:
Reflective surfaces: Apply white reflective paint to your roof to keep the heat out; this can lower indoor temperatures by 3–5°C.
Strategic ventilation: Keep curtains drawn during the day to block direct sunlight and open windows at night to encourage cross-ventilation.
Emergency readiness: Every household should maintain a ""Heat-Proof"" kit containing ORS, a thermometer, bottled water, and clean, damp cloths.
Medical Emergencies and Community Care
Understanding the difference between heat exhaustion and heat stroke can save lives. If you notice signs of dizziness, extreme weakness, or nausea, move to a cool place and rehydrate immediately.
However, if a person displays signs of heat stroke, such as a body temperature above 103°F (40°C), confusion, or dry skin, it is a medical emergency. In such cases, contact the 108 ambulance service immediately while working to cool the individual down with water.
Advisory
Remember to be the eyes and ears of your community. The elderly, pregnant women, and small children are at the highest risk. Most importantly, never leave children or pets inside a parked vehicle, as the cabin temperature can rise to fatal levels in minutes. Stay updated with IMD alerts and make use of your nearest public cooling centers. By taking these proactive steps, we can ensure a safer summer for everyone.",1.0
Delhi-NCR weather update: More heat wave till April 26 as IMD issues yellow alert - Zee News,https://news.google.com/rss/articles/CBMiwwFBVV95cUxPV1pYVmhMZ0tOY3VfMi1WV0JoMDVxbkp2dnNhYmFSdGZPQ0xFZDlaUkxmU3FBaHI4b2VFLUdhMTNwcUpQN0MtX05Ea3RYQUhoTHlsaXJpdE5xRG1xVjZrMEd1QnpYNmJPa1YwSUZ4WFB4R05qVGlxNGlpejBWVHVFUXNrX2VmM2owaUlWMHNGZGZuUUozSTFwaXlPc2hrX3ByMzZJZi0wT1VhMVFLQ2JyaTBRM0dIeHVwd0FhUG1USmM2WW_SAcgBQVVfeXFMTlVsaUFCNHJqYlNWcHd0LWE0QTF2QlRyZ3VIeEN6TjJBcnBOM0hxY3lyeW9hZzNXa240NHVaR3htTWZkV2FqNHpQaEhDSGdfc3FTNWw0YU9MaEVHeEh1bUNaVm5SUjg0Z0Q5cGtoS3BsVnUzN09fV21kbXI5TTAwaW9Geml3eFBVNEo2S2NYUUx2Wm9Dc0RhM0ZHdE41MUhmTE9jejJZUVlTa3Rxckg4Q1Y0STlMb0ZuVTlMcHFkaGJ1MGZ4NTlKN2s?oc=5,Zee News,2026-04-23T10:27:04+05:30,en,Delhi,,"(heatwave OR ""heat wave"" OR ""severe heatwave"" OR ""extreme heat"" OR ""heat spell"" OR ""scorching heat"" OR ""blistering heat"" OR ""sweltering heat"" OR ""hot winds"" OR loo OR ""hot loo winds"" OR ""intense heat"" OR ""unbearable heat"" OR ""deadly heat"" OR heat OR ""weather forecast"" OR ""weather update"" OR ""weather alert"" OR ""IMD forecast"" OR ""IMD prediction"" OR ""IMD alert"" OR IMD OR ""rising temperatures"" OR ""temperatures expected to rise"" OR ""relief from heat"" OR ""respite from heat"" OR ""heat respite"" OR ""respite from scorching heat"") Delhi","Delhi-NCR weather update: More heat wave till April 26 as IMD issues yellow alert
Delhi-NCR weather update: A yellow heat wave warning is in place for Haryana, Uttar Pradesh, Madhya Pradesh, Bihar, and Jharkhand, where extremely high temperatures are expected through Wednesday. West Bengal has been placed under a more serious orange warning.
Trending Photos
Delhi-NCR weather update: The India Meteorological Department has issued heat wave alerts covering large swathes of the country's plains on 23 April, a day after Odisha's Jharsuguda recorded a scorching 44.6°C and Maharashtra's Wardha followed close behind at 44.2°C. The IMD has warned that such conditions are likely to persist over the next three to four days.
Yellow and Orange alerts across multiple states
A yellow heat wave warning is in place for Haryana, Uttar Pradesh, Madhya Pradesh, Bihar, and Jharkhand, where extremely high temperatures are expected through Wednesday. West Bengal has been placed under a more serious orange warning. Across a wide band of states, from Himachal Pradesh and Haryana in the north to Meghalaya, Kerala, and Tripura in the east and south, maximum temperatures were recorded at 5°C above normal on Wednesday. Jammu and Kashmir saw its mercury sitting 5.1°C above the seasonal average.
Residents in affected areas have been urged by the Meteorological Department to stay well hydrated, avoid stepping out during peak afternoon hours, and take precautions against heat stroke.
State-wise heatwave forecast
The IMD's latest bulletin sets out a detailed picture of what is coming. Heat wave conditions are very likely in isolated pockets across a number of states over the coming days, Punjab, Haryana, Chandigarh and Delhi on 24 and 25 April; West Uttar Pradesh on 23 and 25 April; East Uttar Pradesh from 22 to 26 April; Rajasthan from 24 to 26 April; Madhya Pradesh from 23 to 26 April; Vidarbha and Chhattisgarh from 24 to 27 April; and Gangetic West Bengal, Bihar and Jharkhand on 23 April.
Hot and humid conditions, a different but equally draining combination, are expected in isolated pockets of Odisha, Coastal Andhra Pradesh, and Yanam until 26 April, and in Gangetic West Bengal until 25 April. Tamil Nadu, Puducherry, and Kerala can expect similar weather through 24 April, while Gujarat braces for it over the next two days and Coastal Karnataka faces it today.
Heat Wave Alert!
Heat wave conditions likely over major parts of plains of Northwest, Central India and East India during next 4-5 days.
Stay hydrated, avoid direct sun exposure during peak hours, and take necessary precautions.#HeatWaveAlert #StayHydrated #HeatSafety… pic.twitter.com/iFizK0Gyux — India Meteorological Department (@Indiametdept) April 22, 2026
Warm nights will compound the discomfort in several regions. The IMD has flagged warm night conditions for Haryana, Chandigarh, and Delhi from 23 to 25 April, Odisha from 24 to 26 April, and Konkan and Goa from 23 to 25 April.
Northwest India is staring at a gradual rise of 3 to 5°C in maximum temperatures that is expected to hold until 26 April, before a modest easing of 2 to 3°C arrives on 27 and 28 April. Central India faces a rise of 2 to 4°C through 26 April, with little change expected over the following two days.
The IMD bulletin noted that Maharashtra will see maximum temperatures climb by 2 to 3°C until 25 April, with conditions stabilising between 26 and 28 April. Gujarat can expect a rise of 2 to 3°C between 24 and 27 April, while Northeast India was already seeing temperatures 2 to 4°C above normal through 23 April before conditions level off.
Live Tv",1.0
No Deliveries Between 12 And 3 pm? Delhi Gig Workers Urge Govt Action As Heatwave Intensifies - ABP News,https://news.google.com/rss/articles/CBMi2wFBVV95cUxPWEFLcDhjNFByX1JOb2NXYU1PZUxfUWtFX0JBSHRfVEw4OWFuM2xINzdWUGFuV2JXYXRtR1E4b1ZBbHUwelFrbzdEN285MjhTSElWY24wZGNLdWhLeEpQUVkwZ3FfSGJ0VFZVZzNVQ2dnZ3owaTA1U3pIeTQ3OS1IRjMwSXNiUmFXQkdkOFRoVk5yQzl1V1hmODdFak9ob2xrOFhkRHJnQXFzZmhIOXQwcWlrQWVDaDBCaWdoNHd4YktzaXh3dWtBUHhLRWdqMm5feU9Pa29NUEtQcmvSAeABQVVfeXFMTUR2dHh1UzlhV0JLMjdGV192U2JoV2kxa0tHTUVrX2Y4Vk9DUUNZNW1TSWhiYkFZVFJEMkV2TXpyOG96OTRCdUxRSkFURldCU0tTenJsYXBZY253U3dtQUVVZ3A0M0dkNzhreVVHY2hjUFplSzNHMnlNTnQ4andLQ1ZWbzR4ZFhBZVZFSnRHOEF6RjlKNThMTEIxRXR5clc2SHp2ai1JWGtaS29NckJ4emhuWXM3NHpweDBlZmRUdUhVckJIY0dNZnRocW90bU4wdF9xSTJSdF9LMzZuaHBVRHQ?oc=5,ABP News,2026-04-23T09:51:14+05:30,en,Delhi,,"(heatwave OR ""heat wave"" OR ""severe heatwave"" OR ""extreme heat"" OR ""heat spell"" OR ""scorching heat"" OR ""blistering heat"" OR ""sweltering heat"" OR ""hot winds"" OR loo OR ""hot loo winds"" OR ""intense heat"" OR ""unbearable heat"" OR ""deadly heat"" OR heat OR ""weather forecast"" OR ""weather update"" OR ""weather alert"" OR ""IMD forecast"" OR ""IMD prediction"" OR ""IMD alert"" OR IMD OR ""rising temperatures"" OR ""temperatures expected to rise"" OR ""relief from heat"" OR ""respite from heat"" OR ""heat respite"" OR ""respite from scorching heat"") Delhi","Gig and platform workers face increased risks of heat exhaustion, dehydration, and heatstroke due to long working hours on the streets without adequate rest or protection in soaring temperatures.
No Deliveries Between 12 And 3 pm? Delhi Gig Workers Urge Govt Action As Heatwave Intensifies
The Gig and Platform Service Workers Union (GIPSWU) has urged the Delhi government to introduce relief measures, including halting work between 12 pm and 3 pm during peak heat hours.
- Delhi-NCR heatwave intensifies, posing risks to outdoor gig workers.
- Workers face health dangers from high temperatures and humidity.
- Union demands midday work pause and basic facilities for workers.
- Calls for protective gear and accountability from app-based companies.
The early onset of intense summer heat in Delhi-NCR has begun to take a toll, with soaring temperatures making outdoor work increasingly difficult, especially during peak afternoon hours.
As the capital reels under sweltering conditions, concerns are mounting for lakhs of gig and platform workers who continue to work on the streets despite the risks. With the India Meteorological Department forecasting temperatures crossing 44 degrees Celsius in the coming days, the situation is expected to become even more challenging.
Workers Flag Health Risks as Heat Intensifies
The Gig and Platform Service Workers Union (GIPSWU) has written to the Delhi government, highlighting that temperatures are already hovering between 40°C and 42°C. Combined with humidity, the “feels like” temperature is significantly higher, worsening conditions for those working outdoors.
According to the union, delivery partners, cab drivers and other app-based workers are being forced to remain on the roads for long hours without adequate rest or protection. This has sharply increased the risk of heat exhaustion, dehydration and heatstroke, conditions that can prove life-threatening.
Demand for Midday Work Pause, Basic Facilities
In response, the union has urged the government to suspend work for gig workers between 12 pm and 3 pm, when the heat is at its peak. It argued that continuing operations during these hours poses serious health risks.
The letter also called for the creation of shaded rest areas across the city, along with access to drinking water and emergency medical facilities. The union further pressed for the swift implementation of provisions announced in the Delhi Budget, including rest facilities and Atal canteens, to offer immediate relief.
Additionally, the union emphasised the need to hold companies accountable, asking app-based platforms to provide workers with cotton clothing or protective gear suited for extreme heat. Special provisions for women workers, including safe and hygienic rest areas, sanitation facilities and emergency support, were also highlighted.
Related Video
ECONOMY: $120 Oil and Global Food Shortages—Why the London Talks Are a ""Must-Win""
Frequently Asked Questions
What are the main concerns for gig and platform workers due to the intense summer heat in Delhi-NCR?
What measures are being demanded by the Gig and Platform Service Workers Union (GIPSWU) to address the heat crisis?
GIPSWU has requested a suspension of work for gig workers between 12 pm and 3 pm, the establishment of shaded rest areas with drinking water, and the implementation of budget provisions for worker facilities.
What responsibilities are being pushed for app-based companies by the union?
The union wants companies to be accountable for providing workers with suitable cotton clothing or protective gear for extreme heat. They also advocate for special provisions for women workers.
What is the 'feels like' temperature for workers in Delhi-NCR?
The 'feels like' temperature is significantly higher than the actual recorded temperatures of 40-42°C due to the humidity, exacerbating the harsh conditions for outdoor workers.",1.0
Heatwave Emergency Guide: What to Do When Someone Suddenly Collapses from Heatstroke - Times Now,https://news.google.com/rss/articles/CBMi0wFBVV95cUxPV1Z3aDBGSVVEWEZiUXF3elJsT043cXhWYUxJNVlmZWRJdmY5RGdJWk9RbkxfOVhtdmdZOEcxcmpjb2dZVTZiRjNyVnJacFh6OHFmNTQ3VnNEenFPQ1MxMWozVXBjT2pZMDBhRmNRSjJyZ2NwblRPLVZpd3ltdjlMSnhuQ216cmV4WUpwb1V0LXVjc0d1TWp3MjlxZmlva1RiLURyRFpOeVhQNnh1eV9oa0RYVjc0VkdHb1lTMU0tZUxPTVJTOFl0VElLaVU4ZHNKVFBz0gHYAUFVX3lxTFBRY1NCcE9CTnduQ1RIbGk1R0pwUTlKWndkeUlzbHFYMDN1MWo1ZkFHbkwwMjZUZ2UzdnR6N0NTU0xoblYyaEg3azEySkY0V1p3OWZiWUFFb0lyRVYtNzJ6aEhVbGh1ZmtQLWFTVHV2X1prWXIxUTlNZTFuSEhFX0kwMXYwb0tRWlpURGRwNTVaNkpmVFRGNGFtb3FWT05qRURLVEdLWU1QQWN1d3JkOHFPR1dKYjZKQjlJVkNYWTRoMUU5OHNTN0djWGpGaDQzZV9taWlfZ2hCVw?oc=5,Times Now,2026-04-23T12:05:00+05:30,en,Delhi,,"(heatwave OR ""heat wave"" OR ""severe heatwave"" OR ""extreme heat"" OR ""heat spell"" OR ""scorching heat"" OR ""blistering heat"" OR ""sweltering heat"" OR ""hot winds"" OR loo OR ""hot loo winds"" OR ""intense heat"" OR ""unbearable heat"" OR ""deadly heat"" OR heat OR ""weather forecast"" OR ""weather update"" OR ""weather alert"" OR ""IMD forecast"" OR ""IMD prediction"" OR ""IMD alert"" OR IMD OR ""rising temperatures"" OR ""temperatures expected to rise"" OR ""relief from heat"" OR ""respite from heat"" OR ""heat respite"" OR ""respite from scorching heat"") Delhi","As temperatures and humidity surge across Indian cities, hospitals are reporting a worrying rise in heatstroke cases, with people collapsing in public places, homes, and workplaces. Doctors warn that the first few minutes after a heat-related collapse are critical, often determining whether a person survives and how well they recover.
Why Heatstroke Is So Dangerous?
Heatstroke is the most severe form of heat-related illness, occurring when the body’s temperature regulation fails. Core body temperature can rise rapidly above 40°C, leading to brain damage, organ failure, and even cardiac arrest if not treated immediately. High humidity makes it worse by preventing sweat from evaporating, reducing the body’s natural cooling mechanism.
“When someone collapses in the heat, immediate action is critical. The first step is to move the person to a shaded or cooler environment and lay them flat. Elevating the legs slightly can help improve blood circulation. Tight or restrictive clothing should be loosened, and active cooling must begin right away - this can include sprinkling water on the body, applying wet cloths, or fanning to bring down the body temperature,” explains Dr. Purusatyam Chakraborty, Consultant - Head Emergency and Triage, CK Birla Hospitals.
Immediate first aid for heatstroke collapse
If someone suddenly collapses due to extreme heat, quick and calm action can save a life:
Move to a cooler place
Shift the person to a shaded or air-conditioned area immediately.
Position the body
Lay them flat and slightly elevate the legs to improve blood circulation.
Loosen clothing
Remove tight or heavy clothing to help the body cool faster.
Start rapid cooling
Use water, wet cloths, or fanning to reduce body temperature. Focus on areas like the neck, armpits, and groin for faster cooling.
Prompt cooling is the most important step in preventing complications.
Hydration: Do it safely
Hydration plays a key role in treating heat exhaustion and heatstroke, but it must be handled carefully.
If the person is conscious and alert, offer small sips of water or an oral rehydration solution (ORS). “If the person is conscious and able to swallow, offer small sips of water or an oral rehydration solution. However, fluids should never be forced if the individual is drowsy, confused, or semi-conscious, as this can increase the risk of choking,” said Dr. Chakraborty.
Avoid giving fluids if the person is confused, drowsy, or unconscious, as this can lead to choking.
Hydration is a must to prevent heatstroke
Recognising a medical emergency
Not all heat-related collapses are the same. Some cases escalate rapidly into life-threatening emergencies. These symptoms indicate severe heatstroke complications and require urgent medical attention. Watch for these danger signs:
Unresponsiveness or fainting
When to start CPR?
Extreme heat and dehydration can sometimes trigger cardiac arrest, especially in people with underlying health conditions. If the person is not breathing normally or has no pulse, begin cardiopulmonary resuscitation (CPR) immediately:
- Place your hands at the centre of your chest
Push hard and fast (100–120 compressions per minute)- Call emergency services without delay
Prevention is the key during heatwaves
With climate change driving more frequent and intense heatwaves, prevention is just as important as response. Stay hydrated, avoid direct sun exposure during peak hours, wear light clothing, and check on vulnerable individuals such as the elderly and children.
Heatstroke is a medical emergency that demands immediate action. Knowing basic first aid, recognising warning signs, and acting quickly can mean the difference between life and death. In today’s extreme heat conditions, bystander awareness is not optional – it is lifesaving.",1.0
