title,url,source,date,language,state,district,search_term,full_text,relevance_score
"दिल्ली का मौसम (23 April 2026) Delhi Weather Today: दिल्लीवासी 3 दिन झेलेंगे लू के थपेड़े, झुलसाने वाली गर्मी - Times Now Navbharat",https://news.google.com/rss/articles/CBMiqAJBVV95cUxOX3NKUFRBa3F3QzUwTUNMTmY2TURMamJrM3o3OUZwZk1oVHRoQlhSWUtWRGcyMXRKNUJQcFpjWk5OQ3QxQ2FwWU8xRlFZWGtYdkEzbkNFN2hwS1F0TmdSRWlJZzJLQ2cwN2Q5WU8wRS1CeExRNVB5cUdlbGlzMGlMVVRMbmZXdFBUcWZkdzFKMThuVlBXYm5FeDJ3ci0yY0hMYktvRzUwN3h5bG1ab0FDYzV0Q2NfQTctelVEMlBqQmRIbk5ENnBGeXFFVmxwbVJmS0l4bWZ0SjJEZzl3MnlhWkRXeU5Mb0c1YkphU050dUp2aFUwZUxBN2toM2RKYzUzRm5kUlgxSHExenRTQWk5SEItZmJJZUNlX0kzSFAtYjFCYklFUkhEUtIBrgJBVV95cUxQNjZLZGFibGcxTmducDZQeHNKR2xCNlROTDFnT0o1NXhrS2w5MmJXcFRIc2UtV2EwcEx6SlJGRzdEcTREY0RKcHJWNGxVQzhRWXJOd2Y3MmFOQzkzTWhaUlJTVERYM2VJVldwTjQzR2hlSTlHWmRfUDhkVzMyS2NFVGFPcnVsUUVrYWtpU1dreE5iR2xFamZHc3ZTSml4QWFzbUVUTnBmVVBFSXJ4RkZtQmZnYm0zNFcxNnJUc24zcG5UcHg1NDNQNTdVeXpISWJOaWJpU2F6ZjBfSkhxbVZQTG9DM0psMDhDd3ZDMlJ3VzRRNUJfSW9DdFRVR2tOaVRYTXJHRmVsN1EzV0xQZmMySmhMMEZkQld3bnNZdkhmR3RMcmJHTHNYczF5VEJIUQ?oc=5,Times Now Navbharat,2026-04-23T11:22:17+05:30,hi,Delhi,,"""लू"" Delhi","दिल्ली में आज का मौसम (23 April 2026): दिल्ली-एनसीआर में भीषण गर्मी और गर्म हवाओं के थपेड़े लोगों को परेशान कर रहे हैं। दिन में सूरज के भी तीखे तेवर देखने को मिल रहे हैं। आज से राजधानी में लू का प्रकोप भी झेलना पड़ सकता है। मौसम विभाग ने आज से अगले तीन दिनों के लिए दिल्ली-NCR में लू को लेकर अलर्ट जारी किया है। बुधवार को भी हीटवेव का अलर्ट जारी हुआ था। लेकिन लू नहीं चली, हालांकि दिन भर गर्म हवाओं के चलते लोगों को झुलसाने वाली गर्मी का सामना करना पड़ा।
दिल्ली में 23 अप्रैल को कैसा रहेगा मौसम
मौसम विभाग के अनुसार, दिल्ली में आज अधिकांश इलाकों में लू चलने की संभावना है। इस दौरान अधिकतम तापमान 42 डिग्री और न्यूनतम तापमान 25 डिग्री सेल्सियस के बीच दर्ज किया जा सकता है। आज नोएडा, गाजियाबाद, गुरुग्राम और फरीदाबाद में भी हीटवेव का अलर्ट जारी किया गया है। इस दौरान दिन में बाहर निकलने से बचने की सलाह दी गई है। राजधानी में 24 और 25 अप्रैल को भी लू को लेकर चेतावनी जारी की गई है। इस दौरान अधिकतम तापमान 43 डिग्री और न्यूनतम तापमान 25-26 डिग्री सेल्सियस के बीच रह सकता है।
दिल्ली में रिज रहा सबसे गर्म इलाका
बुधवार को दिल्ली में इस सीजन का दूसरा सबसे गर्म दिन दर्ज किया गया। इस दौरान अधिकतम तापमान 40.7 डिग्री सेल्सियस दर्ज किया गया। वहीं न्यूनतम तापमान 21.6 डिग्री सेल्सियस रहा। इससे पहले 17 अप्रैल को दिन का पारा 41 डिग्री सेल्सियस दर्ज हुआ था। बुधवार को रिज एरिया में 42.1 डिग्री तापमान रहा, जो राजधानी का सबसे गर्म इलाका रहा। इसके अलावा आया नगर में 41.4 डिग्री, लोधी रोड इलाके में 40.8 डिग्री और पालम में 40.2 डिग्री सेल्सियस अधिकतम तापमान दर्ज किया गया।
कब होता है हीटवेव का अलर्ट
मौसम विभाग के अनुसार, जब अधिकतम तापमान सामान्य से 4.5 या 6.4 डिग्री सेल्सियस अधिक हो जाता है, या वास्तविक तापमान 45 डिग्री सेल्सियस के ऊपर चला जाता है, तो लू की घोषणा की जाती है।",1.0
Delhi Heat Wave Alert: दिल्ली में लू का प्रहार! 43°C के साथ अगले 2 दिन बनेंगे आफत - Asianet News Hindi,https://news.google.com/rss/articles/CBMi4wFBVV95cUxPN19JMXY2ZUtLY0dsU21jbmoxYVQ4QXVOZXlVNF9FQmpramoyMXJMeXc0NlowREY1aThFNnF5TUVaX1MxcUtfdU1aVktiRmhsZ19UdlgzOC0yd0FEQjZCbzI1UzE3UGszTXhTMkJ5cUU5c2Y5bDdmUFBIakY5bXdVSGlqNFdnMmJrSWY4TXQteTFLTXAzSFJWTUx6WDU2LV9td08wc01KelZ3M2xnbWh0RVpEQXVqTUUyLWtFT190c0tjSXppMkJhcFY2VGhjZUxJZXR6N2xsalBjY2ZuN1VidV9lb9IB4wFBVV95cUxPN19JMXY2ZUtLY0dsU21jbmoxYVQ4QXVOZXlVNF9FQmpramoyMXJMeXc0NlowREY1aThFNnF5TUVaX1MxcUtfdU1aVktiRmhsZ19UdlgzOC0yd0FEQjZCbzI1UzE3UGszTXhTMkJ5cUU5c2Y5bDdmUFBIakY5bXdVSGlqNFdnMmJrSWY4TXQteTFLTXAzSFJWTUx6WDU2LV9td08wc01KelZ3M2xnbWh0RVpEQXVqTUUyLWtFT190c0tjSXppMkJhcFY2VGhjZUxJZXR6N2xsalBjY2ZuN1VidV9lbw?oc=5,Asianet News Hindi,2026-04-23T05:00:28+05:30,hi,Delhi,,"""लू"" Delhi","दिल्ली में 23 अप्रैल 2026 को मौसम मुख्य रूप से साफ रहने वाला है, लेकिन इस साफ आसमान के पीछे भीषण गर्मी का खतरा छिपा हुआ है। दिनभर तेज धूप रहेगी, जिससे बाहर निकलना मुश्किल हो सकता है। हवा शुष्क रहेगी और नमी का स्तर कम होने से गर्मी और ज्यादा चुभने वाली महसूस होगी। IMD के अनुसार आज किसी तरह की चेतावनी नहीं है, लेकिन तापमान सामान्य से काफी ऊपर रहेगा। ऐसे में लोगों को सतर्क रहने की जरूरत है, खासकर दोपहर के समय।",1.0
