title,url,source,date,language,state,district,search_term,full_text,relevance_score
"Delhi Heatwave 2026: दिल्ली में भीषण गर्मी का कहर! तापमान पहुंचा 42°C के पास, अगले 3 दिन लू का अलर्ट जारी - Moneycontrol Hindi",https://news.google.com/rss/articles/CBMizgFBVV95cUxPRmtCTkV6VjBXQm1BRDVlTEVRMkRhWG9uRDNRUkJaOVJORWs2ajBjdlFLSXE3UndQR29zdmdTRVFvMGJDamtYOFFRaEkyeGo0ZERqeGVfbF9EaFRnSDE0M1MxemFhWnotalZtRGg4RWl5alJ2dzVaSmRnUGYxTGgyeWhjVnY5M0VrSVdNQ0steVY0UlJ2cGFpU0pMeXN3VUlLdDN2VjZCZ3dHYTU5SWtDNDI3YUFIbFJjcVkwbVZULS0tOWpqY21BMVZGcmNGZ9IB0wFBVV95cUxOSGdrYW1lVzJxelc1U3gxd2ZHRGw0c3pqXzlibFc3TnBqSnNoZ2ZmQlBZZFJjbU0tRVRWNXE1Y2M1S2NROHl6QWE1LWFLcFVDWFBpeF9OeEpVeE9EbmFPWFEwUjZEWUdZcTF5RUxwQldrbXItZmlRdWtJb1pHUlZidXFIOEdCZFBqX0hpNGs4SG94YUFLLUhMbEtwZGVSZ0lZa09jcFRDcDBRUHphTnBhX2ZQMmtsZncxNkJvWXNJcFJWZzlHZ2ZvLUpBallLeW16M3I4?oc=5,Moneycontrol Hindi,2026-04-23T11:31:54+05:30,hi,Delhi,,"""लू"" Delhi","Delhi Heatwave 2026: गुरुवार की सुबह दिल्ली में हल्की हवाएं चलने से मौसम सुहाना रहा। न्यूनतम तापमान 25.4 डिग्री सेल्सियस के आसपास रहा, जबकि सुबह 8 बजे तक तापमान बढ़कर लगभग 33 डिग्री सेल्सियस हो गया था। भारतीय मौसम विभाग (IMD) के अनुसार, शहर में गुरुवार, शुक्रवार और शनिवार को लू चलने की संभावना है, जिस वजह से दिन का अधिकतम तापमान 42 डिग्री सेल्सियस तक जा सकता है।
लू तब चलती है, जब तापमान सामान्य से 4.5°C से 6.4°C अधिक हो जाए, या असली तापमान 45°C से ऊपर चला जाए।
एक दिन पहले, बुधवार को, दिल्ली में भीषण गर्मी पड़ी, जहां कई मौसम केंद्रों पर तापमान 42 डिग्री सेल्सियस से ऊपर पहुंच गया। सबसे अधिक अधिकतम तापमान रिज में 42.1 डिग्री सेल्सियस दर्ज किया गया, जो सामान्य से 3.7 डिग्री अधिक था। आयानगर में 41.4 डिग्री सेल्सियस तापमान दर्ज किया गया, जबकि सफदरजंग वेधशाला के बेस स्टेशन पर 40.7 डिग्री सेल्सियस तापमान दर्ज किया गया, जो सामान्य से लगभग तीन डिग्री अधिक था। लोदी रोड पर तापमान 40.8 डिग्री सेल्सियस तक पहुंच गया, और पालम में 40.2 डिग्री सेल्सियस दर्ज किया गया।
न्यूनतम तापमान भी ज्यादा रहा
दिल्ली के ज्यादातर इलाकों में न्यूनतम तापमान सामान्य से अधिक या उसके आसपास रहा। पालम में सबसे अधिक न्यूनतम तापमान 24.6 डिग्री सेल्सियस दर्ज किया गया, इसके बाद आयानगर में 23.5 डिग्री सेल्सियस और रिज में 23.4 डिग्री सेल्सियस रहा। सफदरजंग में न्यूनतम तापमान 21.6 डिग्री सेल्सियस दर्ज किया गया, जबकि लोदी रोड पर 20.6 डिग्री सेल्सियस तापमान रहा।
24 अप्रैल से लू चलने की संभावना
मौसम विभाग ने 23 अप्रैल को आसमान साफ रहने का पूर्वानुमान लगाया है, जिसमें तापमान 24 डिग्री सेल्सियस से 42 डिग्री सेल्सियस के बीच रहने की उम्मीद है। लू की स्थिति 24 अप्रैल से शुरू होने की संभावना है, और आने वाले दिनों में तापमान और बढ़कर 43 डिग्री सेल्सियस तक पहुंच सकता है।
एयर क्वालिटी खराब बनी रही
केंद्रीय प्रदूषण नियंत्रण बोर्ड (CPCB) के आंकड़ों के अनुसार, गुरुवार सुबह 9 बजे राजधानी की वायु गुणवत्ता 'मध्यम' श्रेणी में दर्ज की गई। वहीं, एयर क्वालिटी इंडेक्स (AQI) 191 रहा।
CPCB के अनुसार, AQI यानी एयर क्वालिटी इंडेक्स को अलग-अलग श्रेणियों में बांटा जाता है। 0 से 50 के बीच AQI अच्छा माना जाता है, 51 से 100 के बीच ‘संतोषजनक’, 101 से 200 के बीच ‘मध्यम’, 201 से 300 के बीच ‘खराब’, 301 से 400 के बीच ‘बहुत खराब’ और 401 से 500 के बीच ‘गंभीर’ श्रेणी में रखा जाता है",1.0
लू से लोहा लेने के लिए NDMA ने देशभर के लिए बनाए 300 हीट एक्शन प्लान; 100 योजनाएं पाइपलाइन में - Jagran,https://news.google.com/rss/articles/CBMiwwFBVV95cUxPV0ZJS1JJc1dySGpkWmt2dUtoZGVYMmhNNXgtZmxpcEZQZlZZU3FJYnBTUGc4bGx4RE9mVEp5eHplOHdpcXZScGF4ZEFpVVR2MFpFLUVsWnRZZHNtanp4LXBtbkxQdGJoVkhLaHBuc2loZVowTkJ0Q3V5aVJjWVFLV1h3NlpRVHJHbHdjdmRQdXFVOHZRN3Q3YllXTGluZXdxOVBqeUl1bXZLWnFpYmV5WjF4SU1jdm94X09SNndrdmZvVzg?oc=5,Jagran,2026-04-23T11:47:00+05:30,hi,Delhi,,"""लू"" Delhi","लू से लोहा लेने के लिए NDMA ने देशभर के लिए बनाए 300 हीट एक्शन प्लान; 100 योजनाएं पाइपलाइन में
एनडीएमए ने देश में बढ़ती गर्मी और लू से निपटने के लिए 300 हीट एक्शन प्लान तैयार किए हैं, और 100 नए प्लान पाइपलाइन में हैं। इन योजनाओं में स्थानीय चुनौ ...और पढ़ें
समय कम है?
जानिए मुख्य बातें और खबर का सार एक नजर में
राज्य ब्यूरो, नई दिल्ली। देश में बढ़ते तापमान एवं लू के खतरों को देखते हुए राष्ट्रीय आपदा प्रबंधन प्राधिकरण (एनडीएमए) ने कमर कस ली है। एनडीएमए का लक्ष्य अब राज्य, जिला और शहर, हर स्तर पर 'हीट एक्शन प्लान' (एचएपी) तैयार करना है ताकि स्थानीय स्तर पर लोगों को भीषण गर्मी से राहत दी जा सके।
स्थानीय चुनौतियों के आधार पर बनेंगे प्लान
भारत मंडपम में दो दिवसीय ग्लोबल हीट एंड कूलिंग फोरम के दौरान एनडीएमए के अध्यक्ष कृष्ण वत्स ने मीडिया से बातचीत में बताया कि हर शहर और जिले की अपनी अलग चुनौतियां होती हैं। इसलिए एक ही राष्ट्रीय योजना हर जगह काम नहीं कर सकती। लिहाजा अब तक लगभग 300 हीट एक्शन प्लान तैयार किए जा चुके हैं। 100 नए प्लान बनाने की प्रक्रिया जारी है। इनमें पानी की व्यवस्था, हरियाली बढ़ाना, 'कूल रूफ' (ठंडी छतें) और शेल्टर होम बनाना शामिल है।
श्रमिकों की आर्थिक सुरक्षा के लिए 'पैरामेट्रिक इंश्योरेंस'
भीषण गर्मी का सबसे बुरा असर उन लोगों पर पड़ता है जो बाहर रहकर शारीरिक श्रम करते हैं, जैसे निर्माण श्रमिक, रेहड़ी-पटरी वाले और किसान। गर्मी के कारण जब काम के घंटे बदले जाते हैं, तो उनकी आय पर सीधा असर पड़ता है।
इस नुकसान की भरपाई के लिए सरकार पैरामेट्रिक इंश्योरेंस पर चर्चा कर रही है। कृष्ण वत्स ने बताया, 'यह थोड़ा जटिल है क्योंकि इसमें 'ट्रिगर' (तापमान का स्तर या दिनों की संख्या) तय करना चुनौतीपूर्ण है। इसके बावजूद देश के विभन्न हिस्सों में इस तरह के बीमा पर विचार किया जा रहा है ताकि श्रमिकों की आजीविका प्रभावित न हो।'
लू से होने वाली मौतों में आई कमी
लू से होने वाली मौतों पर बात करते हुए उन्होंने कहा कि पिछले पांच वर्षों में मौतों के आंकड़ों में कमी आई है। इसका श्रेय बेहतर प्रबंधन और स्वास्थ्य सेवाओं को जाता है। अस्पतालों व प्राथमिक स्वास्थ्य केंद्रों को विशेष अलर्ट पर रखा गया है। स्वास्थ्य विभाग द्वारा जारी दिशा-निर्देशों के आधार पर डाॅक्टरों और स्टाफ को विशेष ट्रेनिंग दी गई है। गर्मी से प्रभावित मरीजों के इलाज के लिए बेहतर इंतजाम किए गए हैं।
सीडीआरआई से लिया सहयोग
गौरतलब है कि ग्लोबल हीट एंड कूलिंग फोरम मंगलवार को खत्म हो गया। इसमें सरकारी अधिकारियों, वैज्ञानिकों और उद्योग जगत के दिग्गजों ने बढ़ती गर्मी और 'सस्टेनेबल कूलिंग' (सतत शीतलन) के समाधानों पर मंथन किया। इस कार्यक्रम का आयोजन प्राकृतिक संसाधन रक्षा परिषद (एनआरडीसी), एनडीएमए, विज्ञान एवं प्रौद्योगिकी विभाग और सीडीआरआई के सहयोग से किया गया।",1.0
"दिल्ली मौसमः गर्म हवा के थपेड़ों ने झुलसाया, 2 दिन लू चलने की संभावना; 44 डिग्री तक पहुंचेगा पारा - Live Hindustan",https://news.google.com/rss/articles/CBMizwFBVV95cUxPcnl1cmVNSU5DRVlZUTFLYnVtUHpCSnZ3N0NLVHpTMjhMVVZsSUFsTEVMaHpoZFlPV0lwejlkc2xyZVV3bVBWRVhiQ1VPUkNLNUNHN0NoZmIxejNxNnBpcU0tNGhNbzNKdHZFV2ZNcVFFZUZ3UnlwS3g2bXNnNDNNeXd3WkZRTVI4bEJLeUdkUEpobXlzVHhPUC1RcnozekY2R2NvLU1ZZkZkM3cxZmVCb2hQZkhfZkladEl6YXN6WXI1RklaR29XX2ZFX0tDMEHSAdQBQVVfeXFMUDR0eE5vd3hqRzllS1JlTGJtckQxV2dvR0xnUzRva3hFVW9ocm9oTFg3WEZKb0hjQXNRbG5PMVR5U05JeXpwUkhSamtRZEYyeWhhQXRtVEtLUDN3UVBEU3ZyN2FVSUVzRl9WcUprdEZQeHFqMXdLVmZ2RXhMTVpmby02MnZSdmg0TTFFRmNCZDFYZ3RhNlFMMTR1RWw1LXN5T0kzU21vRExFb2RJUlhOWFR6T1N1aUE2U3ZuZWF5M0M2X2xVOFc0VkFKaXEzdnZnVXJNOXk?oc=5,Live Hindustan,2026-04-23T07:27:50+05:30,hi,Delhi,,"""लू"" Delhi","दिल्ली मौसमः गर्म हवा के थपेड़ों ने झुलसाया, 2 दिन लू चलने की संभावना; 44 डिग्री तक पहुंचेगा पारा
दिल्ली के लोग बुधवार को दिनभर गर्म हवा के थपेड़ों से परेशान रहे। कड़ी धूप और सूखी हवाओं के चलते लोगों को अब झुलसाने वाली गर्मी का सामना करना पड़ रहा है। मौसम विभाग का अनुमान है कि शुक्रवार और शनिवार को लू की स्थिति बन सकती है। इस दौरान अधिकतम तापमान 44 डिग्री तक पहुंचने की आशंका है।
राजधानी दिल्ली के लोग बुधवार को दिनभर गर्म हवा के थपेड़ों से परेशान रहे। कड़ी धूप और सूखी हवाओं के चलते लोगों को अब झुलसाने वाली गर्मी का सामना करना पड़ रहा है। दिल्ली की मानक वेधशाला सफदरजंग में बुधवार को अधिकतम तापमान सामान्य से तीन डिग्री ज्यादा दर्ज किया गया। मौसम विभाग का अनुमान है कि शुक्रवार और शनिवार को लू की स्थिति बन सकती है। इस दौरान अधिकतम तापमान 44 डिग्री तक पहुंचने की आशंका है।
बुधवार को दिल्ली के ज्यादातर इलाकों में सुबह से ही धूप निकली रही। दिन चढ़ने के साथ धूप और तेज होती गई। कड़ी धूप के चलते दिन में 11 बजे के बाद घर से बाहर निकले लोगों को काफी परेशानियों का सामना करना पड़ा। दोपहर में हवा की रफ्तार 15 से 20 किलोमीटर प्रति घंटे दर्ज की गई। तापमान बढ़ने के चलते हवा बेहद गर्म और सूखी हो गई है। इससे लोगों को लू जैसा अहसास हुआ।
सफदरजंग में दिन का अधिकतम तापमान 40.7 डिग्री सेल्सियस रिकार्ड किया गया। यह सामान्य से 3 डिग्री सेल्सियस ज्यादा है। न्यूनतम तापमान 21.6 डिग्री रहा। यह सामान्य से 1.1 डिग्री सेल्सियस कम है। दिल्ली के रिज इलाके का अधिकतम तापमान सबसे ज्यादा 42.1 रिकार्ड किया गया। यह सामान्य से 3.7 डिग्री ज्यादा है। यहां पर आर्द्रता का स्तर 18 से 69 फीसदी तक रहा।
फिलहाल राहत के आसार नहीं
मौसम विभाग का अनुमान है कि गुरुवार को अधिकतम तापमान 41 से 43 डिग्री और न्यूनतम तापमान 23 से 25 डिग्री सेल्सियस के बीच रह सकता है। इस दौरान हवा की गति पांच से 15 किलोमीटर प्रति घंटे तक रहने के आसार हैं। मौसम विभाग के मुताबिक, दिल्लीवालों को फिलहाल गर्मी से राहत मिलने के आसार नहीं हैं, क्योंकि अभी कोई ऐसा सिस्टम नहीं बन रहा है।
तापमान में मामूली इजाफा होते ही लू का खतरा
मौसम विभाग ने बुधवार के लिए लू का अलर्ट जारी किया था। हालांकि, यह अलर्ट सटीक नहीं बैठा है। बुधवार को लोगों ने झुलसाने वाली गर्मी का तो सामना किया, लेकिन अभी लू की स्थिति नहीं बनी है। पता हो कि अधिकतम तापमान सामान्य से साढ़े चार डिग्री ज्यादा होने पर ही उसे लू की स्थिति माना जाता है।
इससे पहले मौसम विभाग ने मंगलवार के लिए भी लू का अलर्ट जारी किया था। यह अनुमान भी सटीक नहीं साबित हुआ। अब मौसम विभाग का अनुमान है कि शुक्रवार और शनिवार को दिल्ली के अलग-अलग इलाकों में लू की स्थिति बन सकती है। इस दौरान अधिकतम तापमान 44 डिग्री तक पहुंचने की आशंका है।
लापरवाही बिगाड़ सकती है सेहत
राजधानी में लगातार बढ़ रही गर्मी ने लोगों की परेशानियां बढ़ा दी हैं। गर्मी के कारण दिल्ली के अस्पतालों में बुखार, डिहाइड्रेशन, उल्टी-दस्त और पेट दर्द के मरीजों की संख्या में तेजी से इजाफा हुआ है। डॉक्टरों का कहना है कि बढ़ती गर्मी में लापरवाही की तो बीमार हो सकते हैं। मौसम विभाग के मुताबिक, आने वाले दिनों में पारा और चढ़ेगा। दो-तीन दिनों में दिल्लीवालों को लू का सामना करना पड़ सकता है। ऐसे में बचाव करना जरूरी है।
हवा के साथ उड़ रही धूल से बढ़ा प्रदूषण
राजधानी की हवा में प्रदूषण का स्तर एक बार फिर से बढ़ने लगा है। तेज हवा के साथ उड़ रही धूल के कारण बुधवार को दिल्ली का औसत वायु गुणवत्ता सूचकांक खराब श्रेणी में पहुंच गया। दिल्ली की हवा में प्रदूषण स्तर मानकों से सवा दोगुना से ज्यादा दर्ज किया गया। केन्द्रीय प्रदूषण नियंत्रण बोर्ड के मुताबिक, बुधवार को दिल्ली का औसत वायु गुणवत्ता सूचकांक 216 दर्ज किया गया। इस स्तर की हवा को खराब श्रेणी में रखा जाता है। एक दिन पहले यह सूचकांक 177 था।",1.0
