title,url,source,date,language,state,district,search_term,full_text,relevance_score
"गोरखपुर में उमस भरी गर्मी से लोग परेशान: अगले कुछ दिन बढ़ेगा तापमान, मानसून की दस्तक से मिलेगी राहत - Dainik Bhaskar",https://news.google.com/rss/articles/CBMiuAFBVV95cUxQejhJWUFYQTB1SVQ1TWpQTXVJOXZoYUk5VVB6NlJZWmp4cGFmc1FTVU5BaExmUlpTZ2J2TkQwYjJXT3dNOVJnTU9mNy00dWwwemEtSlNRLVRaajlNclFFMTBwakVUaTM0V1dSd0VKVTJOQk9JLWkxTjZrR1BPRTJxNkxTWHRybElSclQyRjN3ZTByRVlUNTJmYkhVYTFGV1dlVl84SlhCQ29ubmVmMVhTLU55d1padnNk0gG-AUFVX3lxTE9rc2dqbmhCbVBaVzVXdVh5WG1hR3l6WmVwS0gySG9JWVZqVVJaaDM5UHYyeW1oVzNoTlAtS1JuaVVGNW5Bd1c4aDI0TVFRY1dIQlpaeXBfSVhUZTIwUUJ2ZUFqLUY5dDBVZzlrUGR4eHZoNy1nTHBxdHhNbjBiSjc3TWdCR3kyVzlEQzFUa01zeUJGREZBTjZpQWxxZ2VqN1JmempSM0E4UG1yU1dkeGNTaU5tUkhKZmxtM004Q2c?oc=5,Dainik Bhaskar,2026-06-15T13:31:16+05:30,hi,Uttar Pradesh,Gorakhpur,"(""पारा चढ़ा"" OR ""पारा पहुंचा"" OR तापमान OR ""तापमान बढ़ा"" OR ""रिकॉर्ड तोड़ गर्मी"" OR ""डिग्री सेल्सियस"" OR ""पारा उबला"" OR ""अधिकतम तापमान"" OR ""तापमान 40 पार"" OR ""तापमान 45 पार"" OR ""तापमान बढ़ने की संभावना"") Uttar Pradesh","गोरखपुर में उमस भरी गर्मी से लोग परेशान:अगले कुछ दिन बढ़ेगा तापमान, मानसून की दस्तक से मिलेगी राहत
- कॉपी लिंक
गोरखपुर में रविवार को तेज धूप और उमस ने लोगों की परेशानी बढ़ा दी। सुबह से ही आसमान साफ रहा और धूप का असर तेज देखने को मिला। हवा में नमी 55 फीसदी से ज्यादा होने के कारण लोग चिपचिपी गर्मी से परेशान रहे। दिन चढ़ने के साथ तापमान बढ़ा और गर्मी का असर और तेज महसूस हुआ।
मौसम विभाग के मुताबिक, रविवार को शहर का अधिकतम तापमान करीब 37 डिग्री सेल्सियस और न्यूनतम तापमान 27 डिग्री सेल्सियस रहने का अनुमान है। दिन में 15 से 20 किलोमीटर प्रति घंटे की रफ्तार से हवा चल सकती है, लेकिन नमी ज्यादा होने के कारण लोगों को गर्मी से ज्यादा राहत नहीं मिलेगी।
अभी जारी रहेगा गर्मी और उमस का दौर
मौसम विशेषज्ञों के अनुसार, फिलहाल कुछ दिनों तक मौसम में बड़ा बदलाव होने की संभावना कम है। तेज धूप के साथ हवा में नमी बनी रहेगी, जिससे दिन के साथ सुबह और शाम भी उमस महसूस होगी। आने वाले दिनों में तापमान बढ़ने से गर्मी का असर और ज्यादा हो सकता है।
पूर्वी उत्तर प्रदेश में 19 जून के बाद मौसम का मिजाज बदल सकता है। मानसून की गतिविधियां बढ़ने के साथ आसमान में बादल छाने लगेंगे। गरज-चमक के साथ हल्की बारिश की संभावना बन रही है। बारिश शुरू होने के बाद तापमान में गिरावट आएगी और लोगों को गर्मी और उमस से राहत मिलेगी।
जून की शुरुआत से ही गोरखपुर में गर्मी का असर तेज रहा है। शुरुआती 10 दिनों में अधिकतम तापमान कई बार 39 डिग्री सेल्सियस के करीब दर्ज किया गया। हालांकि 11 और 12 जून को तापमान में थोड़ी गिरावट आई, लेकिन हवा में नमी बढ़ने से लोगों को राहत महसूस नहीं हुई।",1.0
