title,url,source,date,language,state,district,search_term,full_text,relevance_score
"Rainfall In Karnataka Likely Over Next 3 Days; Check IMD’s Weather Forecast For Telangana, Kerala And Bihar",https://www.newsx.com/regionals/rainfall-in-karnataka-likely-over-next-3-days-check-imds-weather-forecast-for-telangana-kerala-and-bihar-216167/,NewsX,2026-05-09T16:34:07+05:30,en,Bihar,,"(heatwave OR ""heat wave"" OR ""severe heatwave"" OR ""extreme heat"" OR ""heat spell"" OR ""scorching heat"" OR ""blistering heat"" OR ""sweltering heat"" OR ""hot winds"" OR loo OR ""hot loo winds"") Bihar","Rainfall in Karnataka is expected to bring some much-needed relief over the next few days as the India Meteorological Department (IMD) predicted light to moderate rain, thunderstorms and gusty winds across several southern states. While parts of India continue to struggle with intense heatwave conditions, especially in Telangana and Andhra Pradesh where temperatures have crossed 40 degrees Celsius, the latest weather forecast has raised hopes of cooler conditions. The IMD said Rainfall in Karnataka, especially in South Interior Karnataka, is likely till tomorrow under the influence of a weather system stretching from Madhya Pradesh to the Comorin region. The agency also issued alerts for thunderstorms, lightning and strong winds in several areas as unstable weather conditions continue across southern India.
IMD predicts rainfall in Karnataka along with thunderstorms and lightning
Reports say that, according to the IMD, thunderstorms and lightning conditions are very likely over Odisha, Rayalaseema, Telangana, and South Interior Karnataka till tomorrow. The weather department also forecast heavy rainfall over Kerala, Lakshadweep, Tamil Nadu, Puducherry, Karaikal and South Karnataka during the next two to three days. Rainfall in Karnataka is being linked to a trough extending from Madhya Pradesh to the Comorin region at around 0.9 km above sea level.
The Hyderabad Meteorological Centre explained that this weather system stretches through the Marathwada region, Karnataka coast, North Interior Karnataka and Central Maharashtra. As per reports, the system is also connected to a surface cyclonic circulation over the Southeast Arabian Sea and the Lakshadweep region. Because of these developments, Rainfall in Karnataka is expected to increase in isolated places over the coming days.
Heatwave continues across Telugu states even as rain chances rise
Even as rain predictions offer some relief, Telangana and Andhra Pradesh are still witnessing severe heatwave conditions. Temperatures in many places have crossed 40 degrees Celsius, while high humidity has made conditions even more uncomfortable for residents. The IMD also warned about hot and humid weather at isolated places over Konkan and Goa. However, rainfall activity is expected to provide temporary relief from the scorching weather.
According to reports, the Hyderabad Meteorological Centre said Telangana is likely to receive light to moderate rain at isolated places on Saturday and Sunday. Dry weather is expected on Monday. Rainfall in Karnataka and neighbouring states is also likely to be accompanied by gusty winds reaching speeds of 30 to 40 kmph along with thunderstorms and lightning.
Andhra Pradesh forecast includes gusty winds and scattered rainfall
The Amaravati Meteorological Centre said northeasterly and southerly winds are currently prevailing over Andhra Pradesh and Yanam in the lower troposphere. As a result, scattered light to moderate rains and thunderstorms are expected across several regions over the next three days. North Coastal Andhra Pradesh and Yanam may witness rain or thundershowers at one or two places.
The IMD also warned of lightning and gusty winds with speeds between 40 and 50 kmph in some areas. Similar weather conditions are likely over South Coastal Andhra Pradesh and Rayalaseema. Authorities said isolated lightning strikes may also occur during thunderstorm activity.
Red alert issued for Bihar as weather turns extreme in several states
Apart from Rainfall in Karnataka and southern India, the IMD also issued a red-coloured warning for Bihar. The alert warned of thunderstorms with wind speeds reaching between 60 and 80 kmph. Meanwhile, isolated heatwave conditions are likely over Gujarat and West Rajasthan.
Despite the heat continuing in many parts of the country, weather experts believe the incoming rainfall activity across Karnataka and nearby regions could help reduce temperatures slightly over the coming days. The IMD further said maximum temperatures across Coastal Andhra Pradesh, Yanam and Rayalaseema are expected to remain mostly steady during the next five days with no major change predicted immediately.
Khalid Qasid is a media enthusiast with a strong interest in documentary filmmaking. He holds a Master’s degree in Convergent Journalism from AJK MCRC. He has also written extensively on esports at Sportsdunia. Currently, he covers world and general news at NewsX Digital.",1.0
"IMD Weather Update: Western Disturbance To Bring Rain In Delhi, UP, And Bihar; Heatwave Alert For Rajasthan, Gujarat - The Daily Jagran",https://news.google.com/rss/articles/CBMi7gFBVV95cUxNdEJ5Qy1EeUZqSGVJeXJ5OExnSUd1YmVWTWJNRzFObzJmYXBrSklKd0wxUU9kaGJkNWtZckMwcTZSY3hEdmhiOVhLVHh2Ylk2ajRzaVNKVmtKTXIxM2VtNFExLV9oN0RqN2RGa2VMQS1EeHRFYTdqR2NleW82aEJJX0pZRHpyZTZpVmotWE9UeDN1a0UwWl9DUUFfZDlsZGRfQzZXM0MxWVZkLWlOVzhhejBydW9SOUtjMjRyWE5MNE1VNkRsUjUwNkdMYjROWGg0ZkdYcDhyOXF2dTduZnBGZFhQTFk0WUhodGQ1QWxB?oc=5,The Daily Jagran,2026-05-09T20:46:00+05:30,en,Bihar,,"""heatwave"" Bihar","Weather Update: A fresh western disturbance is likely to affect the western Himalayan region starting Sunday. According to the India Meteorological Department (IMD), this system will bring thunderstorms, hailstorms, and heavy rain to the mountains, while the plains are likely to experience light to moderate rain accompanied by gusty winds.
Western Disturbance To Bring Rain, Thunderstorms
According to the weather office, a fresh western disturbance will reach the mountain regions on Sunday, with its effects gradually spreading across Punjab, Haryana, Delhi, Rajasthan, and western Uttar Pradesh over the following three to four days.
While daytime temperatures across the national capital and adjoining areas are expected to rise beforehand, the IMD does not anticipate a widespread heatwave. However, Rajasthan, Gujarat and western Madhya Pradesh are expected to feel intense heat during this period.
Heatwave Likely In Rajasthan And Gujarat
According to the latest forecast, Rajasthan and Gujarat are expected to experience heatwave conditions for the next five to six days. Additionally, hot winds are likely to affect parts of western Madhya Pradesh on May 12 and May 13.
Weather Outlook
The weather across eastern India is expected to remain active, with the IMD forecasting clouds, strong winds, and scattered rain for Bihar, Jharkhand, Odisha, and West Bengal over the next few days. According to the weather agency, moisture and local weather activity have led to continued rain and thunderstorms.
In eastern Uttar Pradesh, districts such as Gorakhpur and Deoria are also expected to experience cloudy skies and scattered rain.
Meanwhile, pre-monsoon activity remains strong in Kerala, Tamil Nadu, Karnataka and surrounding states due to moisture from the Arabian Sea and the Bay of Bengal.
Monsoon To Arrive On Time
According to a report by Jagran.com, citing a meteorologist, the monsoon is expected to arrive in Kerala on time this year due to the increased activity in the Indian Ocean and the Bay of Bengal. This system is expected to reach the Andaman and Nicobar Islands by May 22, after which it will gradually advance towards Kerala.",0.8500000000000001
लू से बचाव के बारे में बच्चों को किया गया जागरूक - Hindustan Hindi News,https://news.google.com/rss/articles/CBMizgFBVV95cUxObU9fa3UxY2k3VjFoZWZnM24zMTJMSUFEcHdXMG9jTG43UkZtV1BwNGFHMGNiR0xWTFU4Q0dCUDhqUWNfalBpb0UyOHRlRW5NMXJVS2h0Ti1pNFRzU3dIU1d0V0tGWnd5YUdCYUVxcVdzdW5vWFR4enNSVzJfWXpEeXc0WmJuTThzYmZkQVhyYlo2N3VsUXFvU2FFVnJqbnd6UEZVOVQycDN2bS1jb2h1Sm5aMlduZ0ZVNDcxV0xYMDlwaWZkN1poOWc1d3Fkd9IBzgFBVV95cUxObU9fa3UxY2k3VjFoZWZnM24zMTJMSUFEcHdXMG9jTG43UkZtV1BwNGFHMGNiR0xWTFU4Q0dCUDhqUWNfalBpb0UyOHRlRW5NMXJVS2h0Ti1pNFRzU3dIU1d0V0tGWnd5YUdCYUVxcVdzdW5vWFR4enNSVzJfWXpEeXc0WmJuTThzYmZkQVhyYlo2N3VsUXFvU2FFVnJqbnd6UEZVOVQycDN2bS1jb2h1Sm5aMlduZ0ZVNDcxV0xYMDlwaWZkN1poOWc1d3Fkdw?oc=5,Hindustan Hindi News,2026-05-09T20:10:47+05:30,hi,Bihar,,"""लू"" Bihar","खोदावन्दपुर, निज प्रतिनिधि। मुख्यमंत्री विद्यालय सुरक्षा कार्यक्रम के तहत मई माह के दूसरे शनिवार को प्रखंड में सुरक्षित शनिवार का आयोजन किया गया। इस विशेष कार्यक्रम का मुख्य विषय गर्मी एवं लू के खतरे और उससे बचाव की जानकारी थी। जिसके अंतर्गत प्रखंड के सभी विद्यालयों में छात्रों को गर्मी के मौसम के दौरान सावधानियों और लू के चपेट में आने के बाद प्राथमिक उपचार के तरीकों की विस्तारपूर्वक जानकारी दी गई।
कार्यक्रम का उद्देश्य छात्रों में लू के खतरे और उससे बचाव की जानकारी के प्रति चेतना जागृत करना और उन्हें आपातकालीन स्थिति में आवश्यक कदम उठाने के लिए तैयार करना था। गर्मी के मौसम में अक्सर बच्चे और आम लोग असावधानीवश लू के शिकार हो जाते हैं। इसे ध्यान में रखते हुए, इस जागरूकता अभियान के जरिए यह समझाया गया कि थोड़ी सी सतर्कता जान के जोखिम से बचा सकती है।
कार्यक्रम के दौरान छात्रों को बताया गया कि गर्मी के मौसम में अधिक लू चलने पर घर से बाहर निकलने व बाहर खेलने से बचना चाहिए। कड़ी धूप में अनावश्यक सफर न करें और दूसरों को भी ऐसा करने से मना करें। बच्चों को यह भी बताया गया कि अगर कोई व्यक्ति गर्मी की चपेट में आकर लू का शिकार हो जाए तो प्राथमिक उपचार कैसे देना है, इसकी भी जानकारी दी गई। शिक्षकों ने बताया कि इस तरह की स्थितियों में घबराना नहीं चाहिए, बल्कि शांत रहकर त्वरित कार्रवाई करना जरूरी होता है।
कार्यक्रम के एक महत्वपूर्ण हिस्से में ‘क्या करें और क्या न करें’ पर विशेष रूप से ध्यान दिया गया। शिक्षकों ने बताया कि गर्मी के मौसम में लू से बचाव के उपाय जैसे दोपहर में बाहर न निकलना, अधिक पानी पीना और सिर को ढककर रखना चाहिए। यदि किसी छात्र को चक्कर आए या बुखार हो, तो तुरंत शिक्षक को सूचना देने की आदत विकसित की जाए। साथ ही बच्चों को प्राथमिक उपचार और ओआरएस घोल बनाने की विधि भी सिखाया गया। जिससे वे आपात स्थिति में सही निर्णय ले सकें।
शिक्षकों ने बताया कि मुख्यमंत्री विद्यालय सुरक्षा कार्यक्रम के तहत विद्यार्थियों को सुरक्षा के प्रति जागरूक बनाना, स्वास्थ्य संबंधी सही आदतों का विकास करना, आपात स्थिति में सही प्रतिक्रिया देना व सिखाना, जीवनोपयोगी कौशल विकसित करने से उनमें आत्मविश्वास बढता है। प्राथमिक उपचार की समझ विकसित होती है व आत्मनिर्भरता और जिम्मेदारी की भावना बढ़ती है। सुरक्षित और स्वस्थ जीवनशैली अपनाने की प्रेरणा मिलती है। लू की चपेट में आए व्यक्ति को प्राथमिक उपचार के लिए निकटतम अस्पताल में ले जाएं। इस जागरूकता अभियान में विभिन्न विद्यालयों के शिक्षकगणों की सराहनीय भूमिका रही।",0.8500000000000001
स्कूली बच्चों को लू से बचाव की दी जानकारी - Prabhat Khabar,https://news.google.com/rss/articles/CBMiqAFBVV95cUxNSVFhSFFvd0I0Vm9sclRwUXhLVUwzWDQ1enIwaWFpQ0FiSEZTVThBSDJTU2hPbFlMUlluWWZWZ0NScVpqeFhkTzBOUFozZGgyTmNzcW9KM3BjQkt4R0pMTHg4MHJkU2h1OC1yN01hZU5PMFh1S2NwN01PS1VMZlAtQ05HaUZxbnZ2U29XaDFUOTBLS0lyQk5rWlRkMzZENGpLTnY3SGJJVVrSAagBQVVfeXFMTUlRYUhRb3dCNFZvbHJUcFF4S1VMM1g0NXpyMGlhaUNBYkhGU1U4QUgyU1NoT2xZTFJZbllmVmdDUnFaanhYZE8wTlBaM2RoMk5jc3FvSjNwY0JLeEdKTEx4ODByZFNodTgtcjdNYWVOTzBYdUtjcDdNT0tVTGZQLUNOR2lGcW52dlNvV2gxVDkwS0tJckJOa1pUZDM2RDRqS052N0hiSVVa?oc=5,Prabhat Khabar,2026-05-09T17:55:13+05:30,hi,Bihar,,"""लू"" Bihar","सिकटी. मुख्यमंत्री विद्यालय सुरक्षा कार्यक्रम के तहत शनिवार को प्रखंड के विभिन्न विद्यालयों में लू के खतरे व बचाव विषय पर छात्रों को विस्तृत जानकारी दी. निर्धारित वार्षिक सारणी के अनुसार आयोजित इस कार्यक्रम में फोकल शिक्षक व बाल प्रेरकों ने सक्रिय रहे. प्रधानाध्यापक आदर्श मध्य विद्यालय बरदाहा राजेश कुमार मिश्र के नेतृत्व में फोकल शिक्षक ने कार्यक्रम के दौरान बच्चों को बताया कि अत्यधिक गर्मी व तेज धूप के कारण लू लगने की संभावना बढ़ जाती है, जिससे शरीर पर गंभीर दुष्प्रभाव पड़ सकता है. छात्रों को लू के लक्षणों की पहचान करने के साथ-साथ इससे बचाव के उपायों की जानकारी दी गयी. जैसे दोपहर में बाहर न निकलना, पर्याप्त पानी पीना व हल्के कपड़े पहनना. शिक्षकों ने लू लगने की स्थिति में किए जाने वाले प्राथमिक उपचार के बारे में भी विस्तार से बताया. साथ ही बच्चों को ओआरएस घोल बनाने की विधि व उसके सही उपयोग का व्यावहारिक प्रशिक्षण दिया गया, ताकि आपात स्थिति में तुरंत सहायता मिल सके.",0.8500000000000001
