title,url,source,date,language,state,district,search_term,full_text,relevance_score
സംസ്ഥാനത്ത് കടുത്ത ചൂട് തുടരുന്നു: 12 ജില്ലകളിൽ യെല്ലോ അലർട്ട് | Severe heat - Times Kerala,https://news.google.com/rss/articles/CBMingFBVV95cUxPM2RoWThOaVM0b3NNY0ctU3VHR1VBYmtnajVPR24tdUFSSlVnYTlGSW9BTjVqWGVzZ0Z3enNpUkJCSVd1OXFSdmVKN1JPUVZmU09CczFCUDBiOTQ4OGZfLXo3a0E2c1I3NGRUZFVYN2dFanNZdWQwMVE3QWVjMzg1dXpjS2I4NTZhbElZZ1pvS3VaZWptNmpEUk8tdWdsUQ?oc=5,Times Kerala,2026-04-22T09:59:26+05:30,ml,Kerala,,"(""ഉഷ്ണ തരംഗം"" OR ""ചൂട് തരംഗം"" OR ""കടുത്ത ചൂട്"" OR ""കൊടും ചൂട്"" OR ""ഹീറ്റ് വേവ്"" OR ""വെയിലിന്റെ കാഠിന്യം"" OR ""ചൂടിന്റെ കാഠിന്യം"" OR ""അസഹനീയ ചൂട്"" OR ""ഭീകര ചൂട്"") Kerala","തിരുവനന്തപുരം: കേരളത്തിൽ വേനൽ കടുക്കുന്നു. വയനാട്, ഇടുക്കി ഒഴികെയുള്ള 12 ജില്ലകളിൽ കേന്ദ്ര കാലാവസ്ഥാ വകുപ്പ് യെല്ലോ അലർട്ട് പ്രഖ്യാപിച്ചു. അന്തരീക്ഷതാപനില സാധാരണയേക്കാൾ 2 മുതൽ 4 ഡിഗ്രി സെൽഷ്യസ് വരെ ഉയരാൻ സാധ്യതയുള്ളതിനാൽ ജനങ്ങൾ ജാഗ്രത പാലിക്കണമെന്ന് ദുരന്ത നിവാരണ അതോറിറ്റി നിർദ്ദേശിച്ചു.(Severe heat continues in the state, Yellow alert in 12 districts)
പാലക്കാട്: 40°C വരെ, കൊല്ലം: 39°C വരെ, കോട്ടയം: 38°C വരെ, ആലപ്പുഴ, പത്തനംതിട്ട, എറണാകുളം, തൃശൂർ, മലപ്പുറം, കോഴിക്കോട്, കണ്ണൂർ, കാസർകോട്: 37°C വരെ, തിരുവനന്തപുരം: 36°C വരെ എന്നിങ്ങനെയാണ് താപനില.
സോഷ്യൽ മീഡിയ വഴി പ്രചരിക്കുന്ന “ഏപ്രിൽ 29 മുതൽ മെയ് 12 വരെ താപനില 45°C മുതൽ 55°C വരെ ഉയരും” എന്ന സന്ദേശം പൂർണ്ണമായും വ്യാജമാണെന്ന് കേരള സംസ്ഥാന ദുരന്ത നിവാരണ അതോറിറ്റി വ്യക്തമാക്കി. ഇത്തരത്തിൽ ഒരു ഔദ്യോഗിക മുന്നറിയിപ്പും കാലാവസ്ഥാ വകുപ്പ് നൽകിയിട്ടില്ല. ഇത്തരം തെറ്റായ വിവരങ്ങൾ പ്രചരിപ്പിക്കുന്നത് നിയമവിരുദ്ധമാണെന്നും അധികൃതർ ഓർമ്മിപ്പിച്ചു.",1.0
"കേരളം ചുട്ടുപൊള്ളുന്നു; 12 ജില്ലകളിൽ യെല്ലോ അലർട്ട്, താപനില 45 ഡിഗ്രി കടക്കുമെന്ന് മുന്നറിയിപ്പ്! - Express Kerala",https://news.google.com/rss/articles/CBMi2wFBVV95cUxPNWdxYXlIQ1BPZndBZlljX1c2ZzBBQjRVdnd5UnNTODN1MDZsek5hSG1WT2dnNy1uSDBzekdmQWsyRFltZjczNnUxbFROZGRFdkZWamozSWhHbTdQMzVvbGZoNEpGWXpseC1mWm1FOFBSaDlxVEJ5aHJLelNNQ2NrRDBtMm8yZFdMYnZ0NURFLUtBVnBWLUJhNE41TDFSUnlMU2lRbzZZR04wTnVKQ3FsUGFVS01yUXFRSkFCQk8yR2g5azRhU2NNYWl6VlNfVUd2T2ZXVTVwQzZ1em8?oc=5,Express Kerala,2026-04-22T10:34:19+05:30,ml,Kerala,,"(താപനില OR ""താപനില ഉയര്‍ന്നു"" OR ""ഡിഗ്രി സെല്‍ഷ്യസ്"" OR ""പരമാവധി താപനില"" OR ""റെക്കോര്‍ഡ് താപനില"") Kerala","സംസ്ഥാനത്ത് ചൂട് റെക്കോർഡുകൾ ഭേദിച്ച് മുന്നേറുകയാണ്. വയനാടും ഇടുക്കിയും ഒഴികെയുള്ള 12 ജില്ലകളിൽ കേന്ദ്ര കാലാവസ്ഥാ വകുപ്പ് യെല്ലോ അലർട്ട് പ്രഖ്യാപിച്ചു. വരും ദിവസങ്ങളിൽ താപനില ക്രമാതീതമായി ഉയരുമെന്ന സൂചനകളാണ് കാലാവസ്ഥാ റിപ്പോർട്ടുകൾ നൽകുന്നത്.
പാലക്കാട് ജില്ലയിൽ താപനില 40 ഡിഗ്രി സെൽഷ്യസ് വരെ ഉയരാൻ സാധ്യതയുണ്ട്. കൊല്ലത്ത് 39 ഡിഗ്രിയും കോട്ടയത്ത് 38 ഡിഗ്രിയും താപനില രേഖപ്പെടുത്തിയേക്കാം. ആലപ്പുഴ, പത്തനംതിട്ട, എറണാകുളം, തൃശൂർ, മലപ്പുറം, കോഴിക്കോട്, കണ്ണൂർ, കാസർഗോഡ് ജില്ലകളിൽ 37 ഡിഗ്രി വരെയും തിരുവനന്തപുരത്ത് 36 ഡിഗ്രി വരെയും ചൂട് കൂടാൻ സാധ്യതയുണ്ടെന്ന് അധികൃതർ അറിയിച്ചു.
ഏപ്രിൽ 29 മുതൽ മേയ് 12 വരെയുള്ള കാലയളവിൽ ചൂട് അതിന്റെ അത്യുന്നതങ്ങളിൽ എത്തിയേക്കാം. താപനില 45 ഡിഗ്രി സെൽഷ്യസ് മുതൽ 55 ഡിഗ്രി വരെ ഉയരാൻ സാധ്യതയുണ്ടെന്ന ഞെട്ടിക്കുന്ന മുന്നറിയിപ്പാണ് കാലാവസ്ഥാ വകുപ്പ് നൽകുന്നത്. അതുകൊണ്ട് തന്നെ വരും ആഴ്ചകളിൽ അതീവ ജാഗ്രത പാലിക്കേണ്ടതുണ്ട്.
സൂര്യാഘാത സാധ്യത കണക്കിലെടുത്ത് രാവിലെ 10 മണി മുതൽ ഉച്ചകഴിഞ്ഞ് 3 മണി വരെ നേരിട്ട് വെയിൽ ഏൽക്കുന്ന സാഹചര്യങ്ങൾ ഒഴിവാക്കണം. കുട്ടികൾ, പ്രായമായവർ, ഗർഭിണികൾ, മറ്റു ഗുരുതര രോഗങ്ങളുള്ളവർ എന്നിവർ ഈ സമയങ്ങളിൽ പ്രത്യേകം കരുതൽ എടുക്കണം. പുറംജോലികളിൽ ഏർപ്പെടുന്നവർ ജോലിസമയം ക്രമീകരിക്കേണ്ടതാണ്. കട്ടികൂടിയ വസ്ത്രങ്ങൾ ഒഴിവാക്കി ലഘുവായ വസ്ത്രങ്ങൾ ധരിക്കാനും ധാരാളം വെള്ളം കുടിക്കാനും ശ്രദ്ധിക്കണം. ശാരീരിക അസ്വസ്ഥതകൾ അനുഭവപ്പെട്ടാൽ ഉടൻ തന്നെ വൈദ്യസഹായം തേടണമെന്നും നിർദ്ദേശമുണ്ട്.",0.8333333333333333
