title,url,source,date,language,state,district,search_term,full_text,relevance_score
"Delhi Weather Today: IMD Issues Yellow Alert; Predicts Rain, Thunderstorm Till July 9; El Nino Weakens Monsoon - Goodreturns",https://news.google.com/rss/articles/CBMi2wFBVV95cUxPa2x2SGpLN2drOE95dmhHdFd5bks5STRPQzlSR3Q5R09ScDlHT2RwdGR2d2N5NjNSLUhmaGJBRkptbGQtTVdiSjF3Y2ppUDdRa1Q3WmxQU2l2UXdiUFZTNlZUM3Y2TlZSNDRqQ1l0QW16aUpaLXZHdC1fMjBGeWtNbjM0c3RNS1ZlS1VncGJBeFh1TW5jM3FzWDhNM0FTWGxTb2NfenlPUzI3UFRnM2Z6V3RsSm44Uk5McWRTX2hFajBiLUxUcUxTekQxZVlrMXNybXhCTVJTUnc0Z1E?oc=5,Goodreturns,2026-07-04T16:19:12+05:30,en,Andhra Pradesh,,"(""heat advisory"" OR ""heat action plan"" OR ""heat alert"" OR ""IMD warning"" OR ""IMD alert"" OR ""red alert"" OR ""orange alert"" OR ""yellow alert"" OR ""NDMA advisory"" OR ""cooling shelter"" OR ""relief measures"" OR ""heat compensation"" OR ""severe weather warning"") Andhra Pradesh","Delhi Weather Today: IMD Issues Yellow Alert; Predicts Rain, Thunderstorm Till July 9; El Nino Weakens Monsoon
After a prolonged spell of hot and humid weather, Delhi is finally seeing signs of sustained rainfall. The India Meteorological Department (IMD) has forecast intermittent rain, thunderstorms and gusty winds across the national capital over the coming days, with wet weather likely to persist until July 9.
While the showers are expected to bring temporary relief from the sticky conditions that have gripped the city, weather experts say a bigger concern continues to loom over the rest of the monsoon season. El Nino conditions are strengthening, raising fresh questions over whether rainfall could remain below normal in many parts of the country despite the recent improvement.
Delhi Weather Today: IMD Issues Yellow Alert as Rain, Thunderstorms and Gusty Winds Begin in Noida, Gurugram & Across NCR
Several areas of Delhi received light rainfall on Saturday afternoon, bringing a brief respite from the oppressive humidity. However, the relief remained limited as moisture levels stayed high, making conditions uncomfortable for much of the day.
According to the IMD, the city's morning humidity was recorded at 77%, while cloudy skies dominated throughout the day.
The weather department has issued a Yellow Alert, warning of light to moderate rain accompanied by thunderstorms, lightning and gusty winds across Delhi.
Which Areas of Delhi May Receive Rain?
The IMD expects rain activity to be fairly widespread, covering most parts of the capital.
Areas likely to receive showers include:
South-East Delhi
East Delhi
Shahdara
Central Delhi
North-East Delhi
South Delhi
New Delhi
South-West Delhi
West Delhi
North-West Delhi
North Delhi
During thunderstorms, winds are expected to blow at 30-40 kmph, with gusts touching 50 kmph in some areas.
Delhi Weather Forecast Till July 9; Check Date-wise Temperature Prediction
According to the latest IMD forecast, Delhi is likely to experience a series of wet days over the next week, with temperatures remaining below the seasonal peak due to persistent cloud cover.
Delhi Weather Tomorrow on July 5 (Sunday)
The IMD expects generally cloudy skies with very light to light rainfall, accompanied by thunderstorms, lightning and gusty winds of 30-40 kmph, which could briefly increase to 50 kmph during the morning and forenoon. Temperatures are likely to remain between 32°C and 34°C, with minimum temperatures around 27-29°C.
Delhi Weather Prediction July 6 (Monday)
Cloudy conditions are expected to continue. The forecast indicates another spell of very light to light rain, while isolated locations could witness moderate showers. Thunderstorms and lightning are likely both during the morning and again towards the evening. Maximum temperatures may settle around 31-33°C, while minimum temperatures could range between 26°C and 28°C.
Delhi Temperature & Weather Prediction on July 7 (Tuesday)
The weather is expected to remain cloudy with light rain and thunderstorms, mainly during the forenoon and afternoon. Daytime temperatures are likely to stay between 30°C and 32°C, with nighttime temperatures around 25-27°C.
Delhi Rains on July 8 (Wednesday)
The IMD forecasts generally cloudy skies along with very light to light rainfall, particularly during the afternoon and evening hours. Temperatures are expected to remain between 30°C and 32°C, while minimum temperatures may range from 24°C to 26°C.
July 9 (Thursday) Weather Prediction for Delhi
Cloud cover is expected to persist, with the possibility of very light rain, thunderstorms and lightning during the forenoon and afternoon. Maximum temperatures are likely to remain between 30°C and 32°C, while minimum temperatures could dip slightly to 23-25°C, making it one of the coolest mornings of the week.
Delhi Rain Brings Relief, But Humidity May Continue
Although rainfall is expected to reduce daytime temperatures, residents may not experience complete relief immediately.
Weather experts say intermittent showers often increase atmospheric moisture, keeping humidity levels elevated even as temperatures decline. This can make outdoor conditions feel warmer than the thermometer indicates until heavier and more sustained rainfall arrives.
El Nino Could Be the Biggest Threat to India's Monsoon This Year?
The improving weather in Delhi comes against the backdrop of a challenging monsoon season nationally.
Meteorologists note that for the first time since 2021, the southwest monsoon's advance slowed significantly during July as El Nino began influencing atmospheric circulation. At the same time, a summer western disturbance interacted with the advancing monsoon, creating unusual rainfall patterns across parts of north India.
The IMD has indicated that El Nino conditions are expected to strengthen further during the season, a development that often suppresses rainfall over large parts of the Indian subcontinent. Because of this, the department has projected below-normal seasonal rainfall, estimating precipitation at around 90% of the long-period average.
Fifth Direst June After 125 Years Since 1901 in India
The impact of weak monsoon activity is already evident in rainfall data.
June 2026 became India's fifth-driest June since 1901, with nationwide rainfall ending the month 39% below normal.
Delhi also experienced a noticeable shortfall. The Safdarjung Observatory, the city's primary weather station, recorded only 41.8 mm of rainfall during June, well below the normal 74.1 mm expected for the month.
The deficit has delayed the build-up of soil moisture in several regions and increased concerns for agriculture if rainfall does not improve during the core monsoon months.",1.0
MoS Bhupathiraju Srinivasa Varma Unveils Alluri Sitarama Raju Statue in Andhra Pradesh - News On AIR,https://news.google.com/rss/articles/CBMisgFBVV95cUxPZTktenRqLTl2NFJOMXM3djVIM1Y0bkdOVEZGQ0VCaERJZnZ5Sm52UHVJZU1fSXVjT2JxUmpCRXB6bU9JS0N0a1pnZTVzODhZbWQ1MDdzcUlzZVN1aXVQQ0QyNmZqNnpnNEs3S1NCWks1T0pxaUNZa0VNRnlma1hJN0wwTnNlSVpiY3E5bHY0Y0VTQ0R3OWQ3Q3k4VEtPcjk5eGViXzJFbUM2R0F3aHpBbGN3?oc=5,News On AIR,2026-07-04T22:24:00+05:30,en,Andhra Pradesh,,"""heatwave"" Andhra Pradesh","Union Minister of State for Heavy Industries Bhupathiraju Srinivasa Varma unveiled a seven-foot bronze statue of Alluri Sitarama Raju at Gogannamatham village of Ambedkar Konaseema district in Andhra Pradesh today.
Addressing the gathering, the Union Minister described Alluri as a legendary freedom fighter who shook the British Empire and dedicated his life to the nation at a young age. He said, it was a matter of pride that the revolutionary leader hailed from the region and remembered his struggle for the rights of tribal communities.",0.0
"ఎండ వేడిని తగ్గిస్తోన్న ""తుంపర మేఘాలు"" - ఎలా పనిచేస్తాయో తెలుసా? - ETV Bharat",https://news.google.com/rss/articles/CBMi3AFBVV95cUxNQXlkYU05Zm9kZE02OHRDM21oVXoxVFhLR2pleWlfUFZJX0w2R3Jhd3p5bG9GNXQzLUZXY3BxMjJSRXE2RnlYQkJvUjJPZmJlZVRIZzF6WVNlR001Yi1Qd3FNalhVNnVyaGlvdzhDZzRicjFNa0RxLUw3TTVUUGJLWEM2cEhNYUxId1M1MGNHM1pJM3dqSlFuUlBKYUEwQ1VCdFpHaUItYTNoNW9tRWV3b280STFBSUhlU1ZOdUtncXdURWR3RVRqOTF1dkIwT01TenBOV01MZ1RyMUdy0gHcAUFVX3lxTE1BeWRhTTlmb2RkTTY4dEMzbWhVejFUWEtHamV5aV9QVklfTDZHcmF3enlsb0Y1dDMtRldjcHEyMlJFcTZGeVhCQm9SMk9mYmVlVEhnMXpZU2VHTTViLVB3cU1qWFU2dXJoaW93OENnNGJyMU1rRHEtTDdNNVRQYktYQzZwSE1hTEh3UzUwY0czWkkzd2pKUW5SUEphQTBDVUJ0WkdpQi1hM2g1b21FZXdvbzRJMUFJSGVTVk51S2dxd1RFZHdFVGo5MXV2QjBPTVN6cE5XTUxnVHIxR3I?oc=5,ETV Bharat,2026-07-04T16:57:28+05:30,te,Andhra Pradesh,,"(""వడ గాలులు"" OR ""ఎండ వేడి"" OR ""భారీ ఎండలు"" OR ""హీట్ వేవ్"" OR ""ఉష్ణ తరంగం"" OR ""కడ ఎండలు"" OR మండుటెండ OR ""ఎండల తీవ్రత"" OR ""అసాధారణ ఎండలు"" OR ""తీవ్ర ఎండలు"") Andhra Pradesh","Chinas Rooftop Misting System:ప్రపంచంలో చాలా చోట్ల భానుడు నిప్పులు కురిపిస్తున్నాడు. ఇక ఎండ వేడిని తట్టుకునేందుకు చాలా మంది ఏసీలను ఆశ్రయిస్తున్నారు. అయితే సూర్యుడి సెగలను తగ్గించడానికి ఏసీలే పరిష్కారం కాదని, జేబుకు చిల్లు పడకుండానే చౌకైన పద్ధతుల్లో, అది కూడా పర్యావరణానికి నష్టం జరగకుండా చూసేందుకు ప్రపంచం కొత్తదారులు వెతుకుతోంది. ఇందులో భాగంగానే చైనా ఎండ వేడి నుంచి సాంత్వన పొందేందుకు ఏకంగా 'తుంపర మేఘాల' సాంకేతికత తీసుకొచ్చింది. దీని ద్వారా చౌకగా చల్లదనాన్ని పొందే ప్లాన్ చేసింది. ఈ చైనా ప్రయోగం ఇప్పుడు తెగ వైరల్ అవుతోంది. ఇంతకీ ఈ తుంపర మేఘాల కథ ఏంటో ఈ స్టోరీలో చూద్దాం.
ఏమిటీ వ్యవస్థ?: కొత్త కొత్త ప్రయోగాలను చేయడంలో చైనా ఎప్పుడూ ముందే ఉంటుంది. తాజాగా ఈ విషయం మరోసారి నిరూపణ అయ్యింది. సెగరేపుతున్న వేడి వాతావరణంపై పోరాటం చేసేందుకు రూఫ్టాప్మిస్టింగ్ వ్యవస్థలను తీసుకొచ్చింది. చైనాలోని షాంగ్సీ ప్రావిన్స్లో ఉన్న యుంచెంగ్ నగరంలోని ఎత్తైన భవనాలపై దీనిని ప్రయోగించారు. ఇది అతి సూక్ష్మమైన నీటి తుంపర్లను గాల్లోకి విడుదల చేస్తుంది. దీనివల్ల ఉష్ణోగ్రతలు తగ్గుతాయి. ప్రపంచవ్యాప్తంగా చాలాచోట్ల అధిక వేడి పరిస్థితులు ఉన్న నేపథ్యంలో ఈ పద్ధతి అనేక నగరాల దృష్టిని ఆకర్షిస్తోంది. ఇలాంటి తుంపర వ్యవస్థలు చైనాలోని అనేక నగరాలు, పార్కులు, కూడళ్లు, పాదచారుల మార్గాలు, బస్టాప్ల్లో అందుబాటులో ఉన్నాయి.
ఈ వ్యవస్థ ఎలా పనిచేస్తుంది: ఈ తరహా శీతల వ్యవస్థను ఎవాపరేటివ్ కూలింగ్ అంటారు. అంటే మన శరీరానికి పట్టిన చెమట ఆవిరి అయ్యే సమయంలో చల్లదనం ఎలా లభిస్తుందో, ఈ వ్యవస్థ కూడా అదే సూత్రంపై పనిచేస్తుంది. ఇందులో భాగంగా హై-ప్రెజర్ నాజిల్స్ను ఇళ్లపై ఏర్పాటు చేస్తారు. దీంతో నాజిల్స్ నుంచి రిలీజ్ అయిన సూక్ష్మ తుంపర్లు ఆవిరైనప్పుడు సమీపంలోని గాలి నుంచి వేడిని అబ్సార్బ్ చేసుకుంటాయి. దీనివల్ల ఉపరితల ఉష్ణోగ్రతలు దాదాపు 10 డిగ్రీల సెల్సియస్ తగ్గుతుంది.
ప్రజలకు ఇబ్బంది ఉండదా: అయితే ఈ వ్యవస్థ వల్ల ప్రజలకు ఇబ్బంది ఉండదా అంటే.. ఉండదట! ఎందుకంటే ఈ తుంపర్లు చాలా చిన్నగా ఉండటం వల్ల గాల్లో స్ప్రే చేయడం వల్ల కింద పడటానికి ముందే వేడి వాతావరణం నడుమ త్వరగా ఆవిరవుతాయట. దీంతో రోడ్లు, పాదచారులు తడిసి ముద్దయ్యే పరిస్థితి ఉండదంటున్నారు. సంప్రదాయ ఏసీలతో పోలిస్తే ఈ వ్యవస్థ వల్ల విద్యుత్ వినియోగం తక్కువని, దీనికి నీరు, పంప్లు, హై ప్రెజర్ నాజిల్స్ ఉంటే చాలట.
చైనాలో ఎందుకీ పరిస్థితి?: గత కొన్ని సంవత్సరాలుగా చైనాలో తరచూ అసాధారణ వేడి పరిస్థితులు ఉంటున్నాయి. దీనికి వాతావరణ మార్పులే కారణమని శాస్త్రవేత్తలు చెబుతున్నారు. నగరాల్లో భవనాలు, రోడ్లు, కాంక్రీటు వేడిని గ్రహించడం వల్ల ఉత్పన్నమయ్యే అర్బన్ ఐలాండ్ ఎఫెక్ట్ కూడా దీనికి దోహదపడుతోంది.
నిపుణుల ఆందోళనలు: వేడిని తగ్గించడానికి ఉపయోగించే ఈ తుంపర వ్యవస్థ వల్ల నీరు ఎక్కువగా అవసరమవుతాయని నిపుణులు ఆందోళన చెందుతున్నారు. పైగా నీటి కొరత ఎక్కువగా ఉన్న ప్రాంతాల్లో ఇది ఇబ్బందికరమని అంటున్నారు. అయితే దీనివల్ల తక్కువ పరిమాణంలోనే నీరు ఖర్చవుతుందని ఇంకొందరు వాదిస్తున్నారు. ఏదేమైనా కానీ ప్రస్తుతం చైనా అనుసరిస్తోన్న ఈ విధానం చాలా మంది ఆకర్షిస్తోంది.",1.0
AP Weather Alert: ఏపీలో మూడు రోజుల పాటు భారీ వర్షాల హెచ్చరిక.. ఈ జిల్లాలు అప్రమత్తం! - NTV Telugu,https://news.google.com/rss/articles/CBMirgFBVV95cUxPZHUyczdwMTBuQnp6elVyZkVuUGQxZHAxVUQ0TnNCa0pMT1B5b1lONi1mSzNKX2hvcDdCWnplWXBxU1BDZkVIQUt4SUtxcW5FeHQ4WTJFNHZ6VTBsWWhZeU1RMHg4ZUNSLVNVc3JKOG5JbGl4OEdvQTc2OTRuVWpiWjJjT0c1NVdrd3A1dTBKVDhtX0NqVk5XeXBvbWVYckU0NnplUkltQzR4NGpjMlHSAbMBQVVfeXFMTXAtT1B0bEU1eFcwbGRKTlh6R2IzMGZ5dlJBRHBCdEw5SThyMlJnUzBLMFJkQW1maFpSMHl5T0oxc1ZzMDJWbUtDdzBSQlY4VlJuUnRiOHV2R2djQ0p4MVA2enFhc21WLVJzYVVvUmlmX0lERVdnUHVMTWxfQ1lqMlhjWjJhenA5blJmQllGb3dybXFsV29CdW1BQWRUdl9kX0tkUFR6ZjFuZDFEVW4taEhSWVE?oc=5,NTV Telugu,2026-07-04T16:28:12+05:30,te,Andhra Pradesh,,"(హెచ్చరిక OR ""సహాయ చర్యలు"" OR ""రెడ్ అలర్ట్"" OR ""ఆరెంజ్ అలర్ట్"" OR ""ఎల్లో అలర్ట్"" OR ""హీట్ యాక్షన్ ప్లాన్"" OR ""సహాయ శిబిరం"" OR నష్టపరిహారం) Andhra Pradesh","AP Weather Alert: ఏపీలో మూడు రోజుల పాటు భారీ వర్షాల హెచ్చరిక.. ఈ జిల్లాలు అప్రమత్తం!
Andhra Pradesh Weather Alert: బంగాళాఖాతంలో ఏర్పడిన అల్పపీడన ప్రభావంతో ఆంధ్రప్రదేశ్లో మూడు రోజుల పాటు వాతావరణం మారనుంది. వాయువ్య బంగాళాఖాతంలో బలపడిన అల్పపీడనం ప్రస్తుతం భూ ఉపరితలంపై ప్రవేశించిందని, ఇది పశ్చిమ వాయువ్య దిశగా కదులుతూ ఒడిశా, ఛత్తీస్గఢ్ వైపు పయనించే అవకాశం ఉందని విశాఖ తుఫాను హెచ్చరికల కేంద్రం డైరెక్టర్ పి.ఎల్.ఎన్. మూర్తి వెల్లడించారు. దీనికి తోడు రాజస్థాన్ నుంచి మధ్యప్రదేశ్, ఛత్తీస్గఢ్, ఒడిశా మీదుగా సదరు అల్పపీడనం వరకు నైరుతి రుతుపవన ద్రోణి కొనసాగుతోందని, దీనికి అనుబంధంగా ఉపరితల ఆవర్తనం కూడా విస్తరించి ఉందని వివరించారు. ఈ వాతావరణ మార్పుల కారణంగా రాష్ట్రవ్యాప్తంగా వచ్చే మూడు రోజుల పాటు తేలికపాటి నుంచి ఓ మోస్తరు వర్షాలు కురిసే అవకాశం ఉంది. ముఖ్యంగా శ్రీకాకుళం, విజయనగరం, పార్వతీపురం మన్యం, అల్లూరి సీతారామరాజు, ఏలూరు జిల్లాలలో కొన్నిచోట్ల భారీ వర్షాలు కురిసే అవకాశం ఉందని వాతావరణ శాఖ హెచ్చరించింది. కాగా, గత 24 గంటల్లో శ్రీకాకుళం జిల్లా ఇచ్చాపురంలో అత్యధికంగా 5 సెంటీమీటర్ల వర్షపాతం నమోదైంది. తీరం వెంబడి గంటకు 40 నుంచి 50 కిలోమీటర్ల వేగంతో బలమైన ఈదురుగాలులు వీచే అవకాశం ఉన్నందున, రానున్న నాలుగు రోజుల పాటు ఉత్తర కోస్తా తీర ప్రాంత మత్స్యకారులు ఎవరూ చేపల వేటకు వెళ్లకూడదని అధికారులు స్పష్టం చేశారు. అల్పపీడన తీవ్రత దృష్ట్యా కళింగపట్నం నుంచి మచిలీపట్నం వరకు ఉన్న అన్ని ప్రధాన ఓడరేవులలో 3వ నెంబర్ ప్రమాద హెచ్చరికను కొనసాగిస్తున్నట్లు తుఫాను హెచ్చరికల కేంద్రం పేర్కొంది. తీర ప్రాంత ప్రజలు, ప్రయాణికులు అప్రమత్తంగా ఉండాలని అధికారులు సూచించారు.

- Govt Hikes Price: ఉల్లి రైతులకు భారీ శుభవార్త.. రైతుల పంట పండినట్లే..
- Parliament: పార్లమెంట్ వర్షాకాల సమావేశాల షెడ్యూల్ వచ్చేసింది.. ఎప్పటినుంచంటే..!
- PM Modi: ‘వాళ్లంతా తప్పుదోవ పట్టించారు’.. అయినా ఇంధన సంక్షోభాన్ని జయించాం",0.8333333333333333
