title,url,source,date,language,state,district,search_term,full_text,relevance_score
బంగాళాఖాతంలో అల్పపీడనం.. ఈ జిల్లాలలో భారీ వర్షాలు.. వాతావరణ శాఖ హెచ్చరిక - Samayam Telugu,https://news.google.com/rss/articles/CBMi9gFBVV95cUxOZFJ0Sl9nWVBjM05sWVRGZVBMN2ctcU53R20za3lSZHF5dlNVRk5hRndfLUtXd0YzbUpNTkFVRGJFR0hUOXZpbGdMbzJTYnRBekRBak1McHVzMnMtS2RlQXNad2hTWDUxb3dCeWd2NUFfajljZXRnRXFYOS1LYlBSeTJCYmx2U0l4aWtDaGl4T1Q4LWVyZmlTRVdLUTZKX2pkYmpPaHBoTnVhdmVqTUhzdGw2cFJsTVdXUW9nV1U4SkdZV2VMQjY0blpWUGpCMTZtSDlJS1ExMXMxS2tRRWtWeFVIbXVtay1ieW40dm1BWWtVWXpvSWfSAfYBQVVfeXFMTmRSdEpfZ1lQYzNObFlURmVQTDdnLXFOd0dtM2t5UmRxeXZTVUZOYUZ3Xy1LV3dGM21KTU5BVURiRUdIVDl2aWxnTG8yU2J0QXpEQWpNTHB1czJzLUtkZUFzWndoU1g1MW93QnlndjVBX2o5Y2V0Z0VxWDktS2JQUnkyQmJsdlNJeGlrQ2hpeE9UOC1lcmZpU0VXS1E2Sl9qZGJqT2hwaE51YXZlak1Ic3RsNnBSbE1XV1FvZ1dVOEpHWVdlTEI2NG5aVlBqQjE2bUg5SUtRMTFzMUtrUUVrVnhVSG11bWstYnluNHZtQVlrVVl6b0ln?oc=5,Samayam Telugu,2026-07-04T18:52:51+05:30,te,Andhra Pradesh,,"(హెచ్చరిక OR ""సహాయ చర్యలు"" OR ""రెడ్ అలర్ట్"" OR ""ఆరెంజ్ అలర్ట్"" OR ""ఎల్లో అలర్ట్"" OR ""హీట్ యాక్షన్ ప్లాన్"" OR ""సహాయ శిబిరం"" OR నష్టపరిహారం) Andhra Pradesh","Low Pressure In The Bay Of Bengal Imd Predicts Rains In Andhra Pradesh Coming Two Days
బంగాళాఖాతంలో అల్పపీడనం.. ఈ జిల్లాలలో భారీ వర్షాలు.. వాతావరణ శాఖ హెచ్చరిక
ఏపీ ప్రజలకు అలర్ట్.. రాష్ట్రంలో మరో రెండు రోజుల పాటు వర్షాలు కురవనున్నాయి. ఒకట్రెండు చోట్ల భారీ వర్షాలు కురిసేందుకు అవకాశాలు ఉన్నట్లు విశాఖ తుపాను హెచ్చరికల కేంద్రం అధికారులు వెల్లడించారు. మరోవైపు ఆదివారం రోజున ఒకటి, రెండు చోట్ల భారీ వర్షాలు, పోలవరం, అల్లూరి జిల్లాల్లో తేలికపాటి నుంచి మోస్తరు వర్షాలు కురిసే అవకాశం ఉందని ఏపీ విపత్తుల నిర్వహణ సంస్థ అంచనా వేసింది. మిగతా జిల్లాల్లో తేలికపాటి వర్షాలు కురుస్తాయని.. ఈదురుగాలుల నేపథ్యంలో ప్రజలు అప్రమత్తంగా ఉండాలని సూచించింది.
ఆంధ్రప్రదేశ్ ప్రజలకు ముఖ్య గమనిక. బంగాళాఖాతంలో అల్పపీడనం బలపడినట్లు వాతావరణ శాఖ తెలిపింది. ప్రస్తుతం ఈ అల్పపీడనం పశ్చిమ వాయవ్య దిశగా కదులుతున్నట్లు వెల్లడించింది. వచ్చే రెండు, మూడు రోజుల్లో అల్పపీడనం ఒడిశా, ఛత్తీస్ గఢ్ వైపుగా పయనించే అవకాశాలు ఉన్నాయని వాతావరణ శాఖ అధికారులు అంచనా వేశారు. వచ్చే రెండు రోజులు ఆంధ్రప్రదేశ్పై ఈ ప్రభావం కొనసాగుతోందని విశాఖ తుపాను హెచ్చరికల కేంద్రం అధికారులు తెలిపారు. మరోవైపు రాజస్థాన్ నుంచి మధ్యప్రదేశ్ వరకూ విస్తరించి ఉన్న నైరుతి రుతుపవన ద్రోణి.. వచ్చే 3 రోజులలో ఒడిశా, ఛత్తీస్ఘఢ్ రాష్ట్రం వైపు కొనసాగుతుందని వెల్లడించారు.
రుతుపవన ద్రోణి ప్రభావంతో అల్లూరి జిల్లా, ఏలూరు, విజయనగరం, శ్రీకాకుళం, విశాఖపట్నం జిల్లాలలో భారీ వర్షాలు కురిసేందుకు అవకాశం ఉందని వాతావరణ శాఖ అధికారులు అంచనా వేశారు. రాష్ట్రంలో మరికొన్ని చోట్ల ఉరుములు, మెరుపులతో వర్షం కురవవచ్చని తెలిపారు. తీరం వెంబడి 40 నుంచి 50 కిలోమీటర్ల వేగంతో ఈదురుగాలులు వీచే అవకాశం ఉందని, ప్రజలు అప్రమత్తంగా ఉండాలని సూచించారు. అల్పపీడనం నేపథ్యంలో మరో నాలుగు రోజులు మత్య్సకారులు సముద్రంలోకి చేపల వేటకు వెళ్లొద్దని వాతావరణ శాఖ అధికారులు హెచ్చరించారు. మూడో నంబర్ ప్రమాద హెచ్చరిక జారీ చేశారు. వర్షాల నేపథ్యంలో రెండు రోజులు అప్రమత్తంగా ఉండాలని ప్రజలను విశాఖ తుపాను హెచ్చరికల కేంద్రం హెచ్చరించింది.
ఆదివారం ఈ జిల్లాలలో వానలు..
మరోవైపు ఆంధ్రప్రదేశ్ వ్యాప్తంగా ఆదివారం రోజున మేఘావృతమైన వాతావరణం ఉంటుందని ఏపీ విపత్తుల నిర్వహణ సంస్థ తెలిపింది. ఒకట్రెండు చోట్ల భారీ వర్షాలు కురిసే అవకాశం ఉందని హెచ్చరించింది. అల్లూరి, పోలవరం జిల్లాల్లో కొన్నిచోట్ల తేలికపాటి నుంచి మోస్తరు వర్షాలు కురుస్తాయని ఏపీ విపత్తుల నిర్వహణ సంస్థ ఎండీ ప్రఖర్ జైన్ వెల్లడించారు.
మిగతా జిల్లాల్లో అక్కడక్కడ తేలికపాటి వర్షాలు కురిసే అవకాశం ఉందని తెలిపారు. గంటకు 40-50 కిమీ వేగంతో ఈదురుగాలులు వీచే అవకాశం ఉందని హెచ్చరించారు. ఈదురుగాలులు, ఉరుములతో వర్షం పడే సమయంలో ప్రజలు చెట్ల క్రింద, భారీ హోర్డింగ్స్ వద్ద నిలబడవద్దని ప్రఖర్ జైన్ సూచించారు.
రచయిత గురించివంకం వెంకటరమణవంకం వెంకటరమణ సమయం తెలుగులో డిజిటల్ కంటెంట్ ప్రొడ్యూసర్గా పని చేస్తున్నారు. ఆయనకు జర్నలిజంలో 9 సంవత్సరాలకు పైగా అనుభవం ఉంది. 2022లో సమయం తెలుగులో చేరిన వెంకటరమణ.. ఆంధ్రప్రదేశ్కు సంబంధించిన తాజా వార్తలు, ప్రభుత్వ పథకాల సమాచారం, మౌలిక సదుపాయాల కల్పనకు సంబంధించిన కథనాలు, రాజకీయ వార్తలతోపాటు ప్రత్యేక కథనాలు అందిస్తున్నారు. స్పోర్ట్స్, జాతీయ, అంతర్జాతీయ కథనాలు, తెలంగాణ వార్తలు అందిస్తున్నారు. సంవత్సరానికి పైగా సమయం వీడియో టీమ్లో పనిచేసిన అనుభవం వెంకటరమణకు ఉంది. గూగుల్ ఫ్యాక్ట్ చెక్ ప్రాజెక్టు కోసం ఆయన పని చేశారు. 2024 ఆంధ్రప్రదేశ్ అసెంబ్లీ ఎన్నికల సమయంలో వెంకటరమణ ఆసక్తికర కథనాలు, స్పెషల్ ఆర్టికల్స్ రాశారు. ఉత్తమ పనితీరు కనబర్చినందుకు గానూ 2025, ఫిబ్రవరిలో వెంకటరమణ టైమ్స్ ఇంటర్నెట్ నుంచి వావ్ అవార్డును అందుకున్నారు. వెంకటరమణ ఈనాడు జర్నలిజం స్కూలులో టీవీ జర్నలిజం కోర్సును పూర్తి చేశారు. అనంతరం ఈటీవీలో ఐదేళ్ల పాటు పనిచేశారు. ఏపీ, తెలంగాణతో పాటుగా నేషనల్, ఇంటర్నేషనల్, స్పోర్ట్స్, పొలిటికల్ న్యూస్, ఇతర రంగాలకు సంబంధించి వార్తలు రాశారు. ఖాళీ సమయాల్లో పుస్తకాలు చదవటం, పాటలు వినడం, క్రికెట్ ఆడటం చేస్తుంటారు.... ఇంకా చదవండి
By continuing, you agree to the Terms listed here. In case you want to opt out, please click ""Do Not Sell or Share My Personal Information"" link in the footer of this page.
Opt out of the sale or sharing of personal information
We won't sell or share your personal information to inform the ads you see. You may still see interest-based ads if your information is sold or shared by other companies or was sold or shared previously.",0.8333333333333333
Weather Report: ఏపీ వాసులకు బిగ్‌ అలర్ట్.. 3రోజుల పాటు భారీ వర్షాలు.. ఈ జిల్లాలో జాగ్రత్త - tv9telugu.com,https://news.google.com/rss/articles/CBMi2wFBVV95cUxNMExqcU5tMFVCOVo4SzJvUjV6dDR5NU8ydThRYlhBWmtmMDUtRDJXX0J2QVdGd1h1UzdVSUhMSFZ3VDVDQXUwcTdPTUhVWXVHbXM5UDNNOFdGeTR0M1ZRSXhTYnc0b3N6cW9sd0lrTWlSdWZYUzZuLWdLVTdJdDR3bHdJVkdLUXFJMkxpWGxWUHJBVzhtZ2l6OFZqNkMzT1hwT29FZFVUMm5pYWJhcDR0N0NSd1hIOVNMWjgzQXc0NUxiVkIxdjJqbGtrZTZjbkZsdDFrbDVtaFVoMTTSAeABQVVfeXFMT2o3MEJlcXB5UHZvTWRKUC1KRW1oOTd5aVlyaDN0blhDVXRBYUU1SXl3R21lNldWUVhxYUlFQmJFWktBaGlaU0h4WnI0QkFiLXJON25PUHppRWlxUEtkeWR2MlpKOUxaRWZUYkNoRzFGSHJXSllvR1daZHR1djhiRFdtaDZja09mcVRwVjFvdjV2c19heGYxYlRJdWZ6d2pINnNxZ3FWdnRHYkNSbGxsSVBpTFFWSDNJZ0I4QVViN19TSjMxRzJxTTZFTWJDOUgxcXJNYjlTZS0xbUl3M1NRWkM?oc=5,tv9telugu.com,2026-07-04T17:25:27+05:30,te,Andhra Pradesh,,"(హెచ్చరిక OR ""సహాయ చర్యలు"" OR ""రెడ్ అలర్ట్"" OR ""ఆరెంజ్ అలర్ట్"" OR ""ఎల్లో అలర్ట్"" OR ""హీట్ యాక్షన్ ప్లాన్"" OR ""సహాయ శిబిరం"" OR నష్టపరిహారం) Andhra Pradesh","నిన్నటి వాయువ్య బంగాళాఖాతం, దానిని ఆనుకుని ఉన్న ఉత్తర ఒడిశా-పశ్చిమ బెంగాల్ తీరాలపై ఏర్పడిన అల్పపీడనం.. అదే ప్రాంతంలో కొనసాగుతోండగా దీని అనుబంధ ఉపరితల ఆవర్తనం సగటు సముద్ర మట్టానికి 9.4 కిలోమీటర్ల ఎత్తు వరకు విస్తరించి, ఎత్తు వెళ్ళేకొలది కొద్దీ నైరుతి దిశగా వంగి ఉంది. ఇది రాగల 3 రోజుల్లో పశ్చిమ-వాయువ్య దిశగా ఉత్తర ఒడిశా, ఉత్తర ఛత్తీస్గఢ్ మీదుగా ప్రయాణించే అవకాశం ఉందని వాతావరణ శాఖ తెలిపింది.",0.0
బంగాళాఖాతంలో అల్పపీడనం - ఏపీలో రేపు వర్షాలు - ETV Bharat,https://news.google.com/rss/articles/CBMinwFBVV95cUxNQ2I2dXJNWGhlYnVDLXJUUE1uNHNKU0VEOGNxRW9HVFc5cjUxMkRyVm9ZQVc2N1ZmLUYyT29kWXViRF95ZzJpdlNfczBGMnRESVJ2aklWcW5kVWxBenRSdVl1ZnlPNEVOUm82RlVSTGJpZHU5SVBhNl83RHJXWGt0UE5ONlMwUVZfUjJuNzJyMVo5UFlhSjV6QmdmWEJkTEnSAaQBQVVfeXFMTmhvb2JiTDRSN1V1eDR2S2tuU0QyX0xQZGF6NlN6ZHpaY3Y5YVRZNjk3c0hpZWtwTFIwVUJJNUxEYkFxcUYwVzJPbE5ZaDJ3RXBlYno3bjNka3o1SmpYZ0Q4RnBkZ00zWGxIaE1ZaUpDdm4zNnNyWHJwSnFNbjZlZDlVUkxtY0JORXJkeEo0eXhqdWNHNXVOS0JsM3Exa3BnSVN0WWs?oc=5,ETV Bharat,2026-07-04T22:09:26+05:30,te,Andhra Pradesh,,"(హెచ్చరిక OR ""సహాయ చర్యలు"" OR ""రెడ్ అలర్ట్"" OR ""ఆరెంజ్ అలర్ట్"" OR ""ఎల్లో అలర్ట్"" OR ""హీట్ యాక్షన్ ప్లాన్"" OR ""సహాయ శిబిరం"" OR నష్టపరిహారం) Andhra Pradesh","బంగాళాఖాతంలో అల్పపీడనం - ఏపీలో రేపు వర్షాలు
వాయవ్య బంగాళాఖాతంలో కొనసాగుతున్న అల్పపీడనం - రేపు రాష్ట్రవ్యాప్తంగా మేఘావృతమైన వాతావరణం - రాష్ట్రంలో ఒకటి, రెండు చోట్ల దంచికొట్టనున్న వానలు - చెట్లు, హోర్డింగుల కింద నిలబడొద్దని అధికారుల హెచ్చరిక
AP Rain Alert : వాయవ్య బంగాళాఖాతంలో ఏర్పడిన అల్పపీడనం స్థిరంగా కొనసాగుతోంది. దీని ప్రభావంతో రేపు (ఆదివారం) రాష్ట్రమంతటా ఆకాశం మేఘావృతమై ఉంటుందని రాష్ట్ర విపత్తుల నిర్వహణ సంస్థ తెలిపింది. పలు చోట్ల వర్షాలు పడతాయని అంచనా వేసింది. రాష్ట్రంలో ప్రధానంగా ఒకటి, రెండు ప్రాంతాల్లో భారీ వర్షాలు కురిసే అవకాశం ఉందని అధికారులు వెల్లడించారు. అల్లూరి సీతారామరాజు, పోలవరం జిల్లాల్లోని పలు ప్రాంతాల్లో తేలికపాటి నుంచి మోస్తరు వానలు పడతాయని అధికారులు తెలిపారు. మిగిలిన జిల్లాల్లో అక్కడక్కడా తేలికపాటి జల్లులు కురుస్తాయని విపత్తుల నిర్వహణ సంస్థ వివరించింది.
కాగా, ఇవాళ రాష్ట్రంలో అత్యధికంగా పప్పల లింగాలవలసలో 3.6 సెంటీమీటర్ల వర్షపాతం నమోదైంది. వర్షాలు, ఈదురు గాలుల పట్ల ప్రజలు అప్రమత్తంగా ఉండాలని అధికారులు హెచ్చరించారు. వర్షం పడే సమయంలో ఎవరూ కూడా చెట్లు, భారీ హోర్డింగుల కింద నిలబడరాదని రాష్ట్ర విపత్తుల నిర్వహణ సంస్థ ప్రజలకు కీలక సూచనలు చేసింది.",0.31666666666666665
IMD Alert: తీరప్రాంత జిల్లాల్లో ఈదురుగాలుల బీభత్సం.. అప్రమత్తమైన వాతావరణ శాఖ! గంటకు 50 కిమీ వేగంతో గాలులు... - AndhraPravasi,https://news.google.com/rss/articles/CBMirAFBVV95cUxQRnhORDZDUlRhX1hmNXRCX1dQcGV1RFlqcHhhZTFHVmQtT1JjTHI0NTFoZUN3YTYwcHAwaHVYdGJVai13d3B6UlBJOFZVQ2tSUzEyQW9XYVd4X3RfVGxGekdGbXk0a2p4ZUozU0F0eU9QVjBLNHpQUko4MzBYQXpfYVMwZUhtVlpNTmVPanc3dmlrVGpqZDR0cWh2aGlnX1h1SHhpT3JkM09QbE5D?oc=5,AndhraPravasi,2026-07-04T16:55:00+05:30,te,Andhra Pradesh,,"(హెచ్చరిక OR ""సహాయ చర్యలు"" OR ""రెడ్ అలర్ట్"" OR ""ఆరెంజ్ అలర్ట్"" OR ""ఎల్లో అలర్ట్"" OR ""హీట్ యాక్షన్ ప్లాన్"" OR ""సహాయ శిబిరం"" OR నష్టపరిహారం) Andhra Pradesh","ఏపీలోని ప్రధాన పోర్టుల్లో 3వ నంబర్ ప్రమాద హెచ్చరికలు జారీ!
ఉత్తర కోస్తాకు భారీ ముప్పు.. ఉరుములు, మెరుపులతో కూడిన వర్షాలు!
మత్స్యకారులకు ఐఎండీ అత్యవసర హెచ్చరిక: నాలుగు రోజుల పాటు వేటపై నిషేధం!
IMD Alert: బంగాళాఖాతంలో ఏర్పడిన బలమైన అల్పపీడన ప్రభావంతో ఆంధ్రప్రదేశ్లో రాబోయే రెండు రోజుల పాటు వాతావరణం పూర్తిగా మారిపోనుంది. అమరావతి వాతావరణ కేంద్రం తెలిపిన వివరాల ప్రకారం, సముద్రంలో ఏర్పడిన ఉపరితల ఆవర్తనం మరియు ద్రోణి కారణంగా రాష్ట్రవ్యాప్తంగా విస్తారంగా వర్షాలు కురిసే అవకాశం ఉంది. ఇప్పటికే కోస్తాంధ్ర తీర ప్రాంతాల్లో ఆకాశం మేఘావృతమై ఉండటంతో పాటు, పలుచోట్ల వాతావరణం చల్లబడింది. రాబోయే 48 గంటల్లో ఈ అల్పపీడన వ్యవస్థ మరింత తీవ్రం కానుందని అధికారులు అంచనా వేస్తున్నారు.
ముఖ్యంగా ఉత్తర కోస్తాంధ్రలోని పలు జిల్లాలకు వాతావరణ శాఖ భారీ వర్ష సూచన జారీ చేసింది. శ్రీకాకుళం, విజయనగరం, పార్వతీపురం మన్యం, అల్లూరి సీతారామరాజు, కాకినాడ, అనకాపల్లి జిల్లాల్లో అక్కడక్కడా అత్యంత భారీ వర్షాలు కురిసే అవకాశం ఉందని పేర్కొంది. ఈ వర్షాలతో పాటు గంటకు 40 నుండి 50 కిలోమీటర్ల వేగంతో బలమైన ఈదురుగాలులు వీస్తాయని, ప్రజలు అప్రమత్తంగా ఉండాలని హెచ్చరించింది. పిడుగులు పడే ప్రమాదం కూడా ఉన్నందున ఉరుములు, మెరుపులు వచ్చే సమయంలో చెట్ల కింద లేదా బహిరంగ ప్రదేశాల్లో ఉండరాదని సూచించింది.
మరోవైపు దక్షిణ కోస్తాంధ్ర మరియు రాయలసీమ ప్రాంతాల్లో రాబోయే ఐదు రోజుల పాటు వాతావరణం ఇలాగే కొనసాగే అవకాశం ఉంది. కృష్ణా, గుంటూరు, ప్రకాశం, నెల్లూరు జిల్లాలతో పాటు రాయలసీమలోని అన్ని జిల్లాల్లో రాబోయే ఐదు రోజులు తేలికపాటి నుండి మోస్తరు వర్షాలు కురిసే అవకాశం ఉంది. కొన్ని ప్రాంతాలలో బలమైన గాలులతో కూడిన జల్లులు పడవచ్చు. ఈ వర్షాలు సాగు పనులకు కొంతమేర కలిసివచ్చినప్పటికీ, అకస్మాత్తుగా వీచే ఈదురుగాలుల పట్ల రైతులు, ప్రజలు తగిన జాగ్రత్తలు తీసుకోవాలని అధికారులు స్పష్టం చేశారు.
సముద్రం తీవ్రంగా అలజడిగా మారనుండటంతో తీర ప్రాంత వాసులను అధికారులు అప్రమత్తం చేశారు. రాష్ట్రంలోని ప్రధాన ఓడరేవులైన కళింగపట్నం, భీమునిపట్నం, విశాఖపట్నం, గంగవరం, కాకినాడ, మచిలీపట్నం రేవులలో 3వ నంబర్ ప్రమాద హెచ్చరికను జారీ చేశారు. సముద్రపు అలలు ఉవ్వెత్తున ఎగసిపడే అవకాశం ఉన్నందున రేవులలో ఉన్న పడవలు, నౌకల రక్షణకు ముందస్తు చర్యలు చేపట్టారు. తీరం వెంబడి గాలుల తీవ్రత ఎక్కువగా ఉంటుందని వాతావరణ కేంద్రం వెల్లడించింది.
ప్రస్తుత విపత్కర పరిస్థితులను దృష్టిలో ఉంచుకుని మత్స్యకారులకు ప్రభుత్వం ఖచ్చితమైన ఆదేశాలు జారీ చేసింది. జూలై 4వ తేదీ నుండి జూలై 7వ తేదీ వరకు ఎవరూ కూడా సముద్రంలోకి వేటకు వెళ్లరాదని వాతావరణ శాఖ స్పష్టం చేసింది. ఇప్పటికే వేటకు వెళ్లిన మత్స్యకారులు వెంటనే సురక్షిత తీరాలకు చేరుకోవాలని అధికారులు హెచ్చరించారు. తీర ప్రాంత రక్షణ సిబ్బంది నిరంతరం పరిస్థితిని సమీక్షిస్తూ ప్రజలను సురక్షిత ప్రాంతాలకు తరలించేందుకు సిద్ధంగా ఉన్నారు.",1.0
