title,url,source,date,language,state,district,search_term,full_text,relevance_score
"अथरी चौर में मिला अज्ञात व्यक्ति का शव: लू लगने से मौत की आशंका, ग्रामीण घटनास्थल पर जुटे - Dainik Bhaskar",https://news.google.com/rss/articles/CBMiwgFBVV95cUxOQ1lvdXIwZ25JNGJiODk2cm5wbGFCWEZPdXUxQkJ1Y0s0eUJfVXhPMy1xNng3MTRlTWdvcENOTWpQUTE4V0J3U2hTUS1icUFLejJKWk01UGh1Z3o1MXhEd0MzTEVaY01XOFV2R0NEWm1oemxZRFZGeGhxeHNCdUxWTEZqdFZVZWtnZXQzNXN1Q0FsQjZzOTE2MDVLdlg4dXphS0pCYjFOQVZjUDFNRkxUX3ZGQnd1SFF3X0x5c2NreEFaUdIBxwFBVV95cUxOR3lyV1pweWU3R0pOUzB6OVJNdXppSnRRdjZheXFYeEhEZlZUZXRqbW1tWE9LQlRCU2FGM3plcVBkMktyZkZ6eWN4bTR0OXU3aDl4ZFZiRi1mRGdXa1RKUzIxaVhtUEwyU19NZW4zVjBHUmQ5dmZZTnFQVEF2V1ViZUFqQzRRZVpra19OeEJjdkk5eXI1NmFGOF92bjJFUHk1YkM3c3V1RnJCMUZZc201T1NpbW41ZEZtQUg0TnBaZHRudld5bVNB?oc=5,Dainik Bhaskar,2026-06-15T21:35:51+05:30,hi,Bihar,,"""लू"" Bihar","- Bihar: Unknown Man Death Suspected Heatstroke | Rural Gatherings
अथरी चौर में मिला अज्ञात व्यक्ति का शव:लू लगने से मौत की आशंका, ग्रामीण घटनास्थल पर जुटे
- कॉपी लिंक
सीतामढ़ी जिले के रुन्नीसैदपुर थाना क्षेत्र के माधोपुर अथरी चौर में सोमवार शाम एक अज्ञात अधेड़ व्यक्ति का शव लावारिस हालत में मिलने से इलाके में सनसनी फैल गई। शव मिलने की सूचना पर बड़ी संख्या में ग्रामीण घटनास्थल पर जुट गए।
एक दिन पहले सड़क किनारे घूमता देखा गया था व्यक्ति
ग्रामीणों ने बताया कि रविवार सुबह रुन्नीसैदपुर-बेलसंड मुख्य मार्ग पर रामपुर गांव के पास उक्त व्यक्ति को हाथ में छड़ी लिए अर्धनग्न अवस्था में घूमते देखा गया था। सोमवार देर शाम जब कुछ लोग अथरी माधोपुर चौर की ओर गए तो वही व्यक्ति मृत अवस्था में पड़ा मिला।
सूचना पर पहुंची पुलिस, शुरू की जांच
घटना की जानकारी मिलते ही रुन्नीसैदपुर थाना पुलिस मौके पर पहुंची। एसआई छोटू कुमार ने पुलिस बल के साथ घटनास्थल का निरीक्षण किया और शव को कब्जे में लेकर जांच शुरू कर दी।
पुलिस ने मृतक की पहचान के लिए आसपास के लोगों से पूछताछ शुरू कर दी है। हालांकि खबर लिखे जाने तक शव की शिनाख्त नहीं हो सकी थी।
लू लगने से मौत की आशंका
थानाध्यक्ष ललित कुमार ने बताया कि ग्रामीणों द्वारा लू लगने से मौत की आशंका जताई जा रही है। हालांकि मृत्यु के वास्तविक कारणों की पुष्टि पोस्टमार्टम रिपोर्ट आने के बाद ही हो सकेगी।
पोस्टमार्टम के लिए भेजा गया शव
पुलिस ने शव को पोस्टमार्टम के लिए सीतामढ़ी सदर अस्पताल भेज दिया है। साथ ही मृतक की पहचान और मौत के कारणों का पता लगाने के लिए मामले की जांच जारी है।",0.8333333333333333
"Schools closed news: All CBSE, ICSE, private, govt schools to remain shut in Delhi, Noida, Gurugram, UP, Bihar, MP, Rajasthan, Punjab, Haryana till…, due to…, check state-wise school reopening dates - news24online.com",https://news.google.com/rss/articles/CBMivAJBVV95cUxNUzI2NEJRcE5vUFo4SU45aVYtcTFNVXN4STNzUlltVk1DY2MxVkh2MkhVbTRtMk5WWHNQaTdlSXlEX1c0Q0lUZ1NvQW82X2Rjcnh0Wi1ldTJwVnZtUjRqc0tnS09lRklIbU4yMmRkNXhCT1hFUlUwRExOOWUzRUh4NXBRV2o0TlZiWDFvZDdSd0h1VWc1NS03ZnY0UnhiRlU2NFl2ZkVmS1gxUlpvNUxLUklNN3l5bURubU1paWlmbGNzaHo3bWNuNlF1ckhWbnRkVzBQOFhpckxEWFJPTDNCV2UwcXdUUmJPUThaMXZKOWI4Wk9tY3lmTzZ4aGlEcGI5NGpLYi04eGdpZXJhbnVQVHRsVFdTTnoxMXl4OF8tWjFsdzFlTE52bjBoOC1kVkFHdHNCdWVyTVJlbjBo?oc=5,news24online.com,2026-06-15T23:01:56+05:30,en,Bihar,,"""heatwave"" Bihar","Schools closed news: All CBSE, ICSE, private, govt schools to remain shut in Delhi, Noida, Gurugram, UP, Bihar, MP, Rajasthan, Punjab, Haryana till…, due to…, check state-wise school reopening dates
Schools across India are reopening after summer holidays, though some states have extended breaks due to heatwaves. Reopening dates vary, with classes resuming between June and July.
As the summer holidays draw to a close, many schools across India are preparing to reopen for the new academic year. However, some states have extended the break due to ongoing heatwave conditions. Students and parents are advised to check with their schools directly, as reopening dates may differ depending on the state and education board.
Chhattisgarh Schools to Reopen on 16 June
Officials have confirmed that all government and private schools in Chhattisgarh will reopen on 16 June as originally planned. The clarification came after a fake government letter claiming an extension of the holidays was widely shared on WhatsApp and other social media platforms.
Madhya Pradesh Academic Session Begins
In Madhya Pradesh, summer holidays were scheduled from 1 May to 15 June. Schools across the state are expected to reopen on 16 June for regular classes. ALSO READ: UP Weather news, June 16: 70 km wind, rain, thunderstorm and…, alert in over 20 districts including Noida, Ghaziabad, Hapur, Meerut, Mathura, Agra for…; When will monsoon reach Uttar Pradesh?
Heatwave Leads to Holiday Extensions
Several state governments have extended summer holidays because of the intense heatwave affecting many parts of the country. To ensure student safety, authorities in some districts have also revised school timings.
Delhi-NCR Schools to Resume in July
Most schools in Noida, Greater Noida and Gurugram are currently observing summer holidays. Regular classes are expected to resume between 1 July and 15 July. In Delhi, schools will begin regular academic classes from 1 July.
Reopening Dates in Other States
- Uttar Pradesh: Schools are scheduled to reopen on 16 June.
- Haryana: Summer holidays were observed from 25 May to 30 May, although reopening dates may vary by district.
- Punjab: Regular classes will resume from 1 July 2026.
- Rajasthan: Schools are expected to reopen on 21 June.
- Jammu and Kashmir: Reopening dates may vary depending on the region.
Parents Advised to Check School Updates
As reopening schedules continue to change in some areas, parents and students should stay updated through official school notices and local education department announcements.
---Advertisement---
Live News
-
16:54 (IST) 16 Jun 2026
Akhilesh Yadav reaffirms support for INDIA alliance, says attempts are being made to help BJP
-
16:22 (IST) 16 Jun 2026
PM Modi arrives in Evian for G7 Summit, welcomed by G7 Secretary General Jean-Pierre Asvazadourian
-
15:08 (IST) 16 Jun 2026
PM Modi arrives in Geneva, receives warm welcome from Swiss President ahead of G7 Summit
SHORTS
View All Shorts
---Advertisement---",0.8333333333333333
