title,url,source,date,language,state,district,search_term,full_text,relevance_score
ગુજરાતીઓ સાવધાન! આ વર્ષે કાળઝાળ ગરમી તોડશે રેકોર્ડ: IMDએ કરી આગાહી I - Mumbai Samachar,https://news.google.com/rss/articles/CBMimAFBVV95cUxOT3hJdFRTZXlvYjJsUll3VzVZR0w0czdabmZScExXV0ZyU0RpRlVXU2NkX1B2NnB2dlJxd0EyRnZObjZLZ1IyblhBVGxaVm84RjI0TWVUZWp2dWlGUjVES2V5b3Jubk1VZzNCOWJTV3dIbEswWWtjamh4Xy1aNWEwUlc0b2NhRkctYXBLR1ZocW84VzZfX1BMQg?oc=5,Mumbai Samachar,2026-07-18T17:51:02+05:30,gu,Gujarat,,"(""ભારે ગરમી"" OR ""આકરી ગરમી"" OR લૂ OR હીટવેવ OR ""ઉષ્ણ મોજું"" OR ""ગરમીનો પ્રકોપ"" OR તાપ OR ""આકરો તાપ"" OR ""અસહ્ય ગરમી"" OR ""ભયાનક ગરમી"") Gujarat","નવી દિલ્હી: માર્ચ મહિનાની શરૂઆત થઇ ગઈ છે, સવારે હલકી ઠંડી બાદ બપોરે સૂર્ય તપવા લાગાવ્યો છે. એવામાં ભારતીય હવામાન વિભાગ (IMD) એ શનિવારે માર્ચ થી મે મહિના સુધી હવામાનની આગાહી કરી છે. હવામાન વિભાગના જણાવ્યા મુજબ માર્ચ મહિનામાં સામાન્ય ગરમી પડશે, પરંતુ મે મહિના સુધી દેશના મોટાભાગના ભાગોમાં આકારો તાપ પડશે.
એક નિવેદનમાં હવામાન વિભાગે જણાવ્યું કે માર્ચ થી મે મહિના દરમિયાન પૂર્વ અને પૂર્વ મધ્ય ભારતના મોટાભાગના ભાગો, દક્ષિણપૂર્વ દ્વીપકલ્પના મોટાભાગના વિસ્તારો, ઉત્તરપશ્ચિમ અને પશ્ચિમ મધ્ય ભારતના કેટલાક ભાગોમાં હીટવેવના દિવસે સામાન્ય કરતા વધુ રહેવાની શક્યતા છે.
ગુજર્તીઓ સાવધાન:
માર્ચ મહિના દરમિયાન ગુજરાત અને આંધ્રપ્રદેશના અલગ અલગ પ્રદેશોમાં હીટવેવના દિવસોની સંખ્યા સામાન્ય કરતા વધુ રહેવાની શક્યતા છે. દેશના બાકીના ભાગોમાં હીટવેવના દિવસોની સંખ્યા સામાન્ય રહેવાની શકયતા છે.
હીટવેવના દિવસો વધશે:
આગાહી મુજબ આ વર્ષે ઉનાળામાં હરિયાણા, પંજાબ, રાજસ્થાન, પશ્ચિમ બંગાળ, બિહાર, ઓડિશા, આંધ્રપ્રદેશ, ઉત્તર પ્રદેશના કેટલાક ભાગોમાં હીટવેવના દિવસોની સંખ્યા સામાન્ય કરતાં વધુ રહેશે. આ રાજ્યોમાં હીટવેવના દિવસો સામાન્ય કરતાં 3 થી 15 દિવસ વધુ હોઈ શકે છે.
જનજીવનને થશે માંથી અસર:
હવામાન વિભાગની આગાહી મુજબ માર્ચ-એપ્રિલ-મે સીઝન દરમિયાન, હીટવેવના દિવસો વધવાને કારણે જાહેર આરોગ્યને ગંભીર અસર થઇ શકે છે. પાણીના સ્ત્રોતો સુકાઈ શકે છે, વીજળીની માંગ વધી શકે અને આવશ્યક સેવાઓની માંગમાં વધારો થઇ શકે છે.
નિવેદન મુજબ ખાસ કરીને વૃદ્ધો, બાળકો, ખુલ્લામાં કામ કરતા કામદારો અને પહેલાથી જ તબીબી સમસ્યામાંથી પસાર થઇ રહેલા લોકોના સ્વાસ્થ્યને વધુ અસર થઇ શકે છે. વધુ તાપમાનને કારણે લોકોને ગરમી સંબંધિત બીમારીઓ થઈ શકે છે, માળખાગત સુવિધાઓ પર દબાણ વધી શકે છે.
જ્યારે દેશના મેદાની વિસ્તારોમાં દિવસનું મહત્તમ તાપમાન 45 ડિગ્રી સેલ્સિયસ સુધી પહોંચે અથવા જ્યારે દિવસનું તાપમાન સામાન્ય કરતા 4.5 ડિગ્રી વધી જાય, ત્યારે હવામાન વિભાગ તેને હીટવેવ જાહેર કરે છે.",1.0
"ગુજરાતમાં કાળઝાળ ગરમી વચ્ચે અંબાલાલ પટેલે કરી મોટી આગાહી, રાહત થશે કે નહીં? - Mumbai Samachar",https://news.google.com/rss/articles/CBMimwFBVV95cUxNN1hycW8zZEJiMUoyOWE4VEFBSzJSR0dleGR2SkEwV1JVRWllWHBXTmR3YUpPRDhDYXZRQ3NvTks4ZnNhbGc1X3hiMVlucTlYVjZIZ01pQWlwQUtNdV9RMnhsMDcxd25zME1fdnRXUE9NRDh4RmIyRXJERl8zRGFRVzRTZ0M1Szlzd2l6Q3NYTkgwM0NlcU8xUDVURQ?oc=5,Mumbai Samachar,2026-07-18T15:34:47+05:30,gu,Gujarat,,"(તાપમાન OR ""તાપમાન વધ્યું"" OR ""પારો ચઢ્યો"" OR ""ડિગ્રી સેલ્સિયસ"" OR ""મહત્તમ તાપમાન"" OR ""વિક્રમી તાપમાન"") Gujarat","ગુજરાતમાં ગરમીનો પારો સતત ઉપર જઈ રહ્યો છે. ગુજરાતના અનેક જિલ્લાઓમાં આજે પર ગરમીનો ભારે હાઈ રહ્યો હતો. દેશના 10 સૌથી ગરમ શહેરોમાં ગુજરાતના આઠ શહેરો સામેલ થયા હોવાનું જાણવા મળ્યું છે. હીટ વેવની સ્થિતિ વચ્ચે 'બાબા વેંગા' જેવી ભવિષ્યવાણી કરતા અંબાલાલ પટેલે ફરી એકવાર ચોંકાવનારી ભવિષ્યવાણી કરી છે. ચાલો જાણીએ ગરમી અંગે અંબાલાલ પટેલ શું કહે છે....
ઉત્તર ગુજરાત અને કચ્છમાં વરસાદની આગાહી
અંબાલાલ પટેલની આગાહી પ્રમાણે આગામી દિવસોમાં ગુજરાતનું હવામાન બદલાશે. ખાસ કરીને ઉત્તર ગુજરાત અને કચ્છના કેટલાક ભાગોમાં વરસાદ થવાની પણ આગાહી કરવામાં આવી છે. અંબાલાલ પટેલની હવામાન આગાહી મોટાભાગે સચોટ સાબિત થાય છે. પરંતુ આ વખતે વધતી ગરમી વચ્ચે વરસાદની આગાહી કરવામાં આવી તેના કારણે લોકો આશ્ચર્યચકિત થઈ ગયાં છે. જોકે, અંબાલાલ દ્વારા વરસાદની આગાહી પાછળનું કારણ પણ જણાવ્યું છે.
અંબાલાલ પટેલની આગાહી પ્રમાણે આગામી 48 કલાકમાં રાહત મળવાની શરૂઆત થશે.
IMD ના ડેટા અનુસાર ગુરુવારે દેશમાં સૌથી વધુ તાપમાન મધ્ય મહારાષ્ટ્રના નંદુરબાર 42.4 ડિગ્રી સેલ્સિયસ માં નોંધાયું હતું. ગુજરાતની વાત કરવામાં આવે તો, વલ્લભ વિદ્યાનગર 42.3 ડિગ્રી સેલ્સિયસ સાથે દેશમાં બીજા ક્રમે રહ્યું છે. તે પછી રાજકોટ 41.9 ડિગ્રી સેલ્સિયસ સાથે ત્રીજા ક્રમે રહ્યું છે. ગરમીમાં ટોપ-10 ની યાદીમાં ગુજરાતના અનેક શહેરો જેમાં ક્રમશઃ વડોદરામાં 41.6 ડિગ્રી સેલ્સિયસ, સુરેન્દ્રનગરમાં 41.5 ડિગ્રી સેલ્સિયસ, અમદાવાદમાં 41.4 ડિગ્રી સેલ્સિયસ, સુરતમાં 41.0 ડિગ્રી સેલ્સિયસ, કેશોદમાં 40.7 ડિગ્રી સેલ્સિયસ અને ડીસામાં 40.7 ડિગ્રી સેલ્સિયસ તાપમાન નોંધાયું હતું.
14 માર્ચથી 18 માર્ચ વચ્ચે ગુજરાતનું વાતાવરણ બદલાશે
અંબાલાલ પટેલની આગામી પ્રમાણે 14 માર્ચથી 18 માર્ચ વચ્ચે ગુજરાતના વાતાવરણમાં બદલાવ આવશે. વેસ્ટર્ન ડિસ્ટરબન્સ સક્રિય થશે. 19 માર્ચથી 25 માર્ચ સુધી તેનો પ્રભાવ રહેશે. ખાસ કરીને ઉત્તર ગુજરાત અને કચ્છમાં વરસાદ થવાની સંભાવનાઓ છે. વેસ્ટર્ન ડિસ્ટરબન્સના કારણે ગુજરાતના કેટલાક વિસ્તારોમાં વરસદા થવાની સંભાવનાઓ અંબાલાલ પટેલ દ્વારા વ્યક્ત કરવામાં આવી છે.",1.0
"ગુજરાતમાં વધશે ઉકળાટ, 24 કલાકમાં 10 રાજ્યોમાં વરસાદ-વાવાઝોડાનું એલર્ટ - Mumbai Samachar",https://news.google.com/rss/articles/CBMikwFBVV95cUxPVXZoVVdZUHFub2VHeVdqcHVGMi0taHZCbGJBRUlqdktmWnFlZUxLQVY2eGF0VWpGS0NCaUtnaExJRlllcnNoSU5odUlOUnJvWmZNNWZBTXFoYTRkbFpmTW5GWjhqemE2SDlwbzFaRVFWTnFGWXZaLWFNUE9wTTVZWHdqR3NVNnlKR0w5MTBIdzQ2SFE?oc=5,Mumbai Samachar,2026-07-18T18:41:06+05:30,gu,Gujarat,,"(તાપમાન OR ""તાપમાન વધ્યું"" OR ""પારો ચઢ્યો"" OR ""ડિગ્રી સેલ્સિયસ"" OR ""મહત્તમ તાપમાન"" OR ""વિક્રમી તાપમાન"") Gujarat","અમદાવાદ-નવી દિલ્હીઃ હવામાન વિભાગ પ્રમાણે વાતાવરણમાં ફરી એક વખત પલટો આવશે. 10 રાડ્યોમાં વાવાઝોડા સાથે વરસાદનું એલર્ટ છે. હવામાન વિભાગના કહેવા પ્રમાણે, આ દરમિયાન 80 કિમીની ઝડપે પવન ફૂંકાઈ શકે છે. દિલ્હી, યુપી, બિહાર, રાજસ્થાન સહિત ઉત્તર ભારતના મોટા ભાગના રાજ્યો ભીષણ ગરમીની ઝપેટમાં છે ત્યારે આસામમાં 23 હજાર લોકો પૂરથી પ્રભાવિત થયા છે.
ગુજરાતમાં વધશે ઉકળાટ
ગુજરાતમાં છેલ્લા કેટલાક દિવસોથી પડી રહેલી આકરી ગરમી વચ્ચે હવામાન વિભાગે મહત્વની આગાહી કરી છે. હવામાન વિભાગના જણાવ્યા અનુસાર, આજે રાજ્યના મોટાભાગના શહેરોમાં મહત્તમ તાપમાનમાં 1 થી 2 ડિગ્રીનો ઘટાડો નોંધાઈ શકે છે. જો કે, તાપમાન ઘટવા છતાં વાતાવરણમાં ભેજનું પ્રમાણ વધારે રહેવાના કારણે ઉકળાટ અને બફારામાં વધારો થશે, જેથી લોકોને ગરમીની તીવ્રતા વધુ અનુભવાશે.
દેશના અન્ય રાજયમાં કેવું રહેશે હવામાન
દિલ્હી-એનસઆરમાં આજે વાદળછાયું વાતાવરણ રહી શકે છે. 30 કિમીની ઝડપે પવન ફૂંકાઈ શકે છે. જોકે આગામી ત્રણથી ચાર દિવસમાં તાપમાનમાં 43 ડિગ્રી સેલ્સિયસ સુધી પહોંચી શકે છે. મધ્ય પ્રદેશનમાં આંધી-તોફાન જોવા મળશે. અનેક જિલ્લામાં ભીષણ ગરમી પડી શકે છે.
રાજસ્થાનના અનેક ભાગમાં આગામી 24 કલાકમાં આંધી અને છૂટાછવાયા વરસાદના કારણે તાપમાનમાં ઘટાડો થઈ શકે છે. જોકે રાજ્યના અનેક વિસ્તારમાં ભીષણ ગરમી પડી રહી છે. ઉત્તર પ્રદેશના અનેક વિસ્તારમાં વરસાદ-આંધીની ચેતવણી છે. આ દરમિયાન 60 થી 65 કિમીની ઝડપે પવન ફૂંકાઈ શકે છે.
બિહારમાં પણ ભારે વરસાદ અને વાવાઝોડાનું એલર્ટ છે. 80 કિમી પ્રતિ કલાકની ઝડપે આંધી ફૂંકાઈ શકે છે. ઝારખંડમાં 60 કિમી પ્રતિ કલાકની ઝડપે પવન ફૂંકાઈ શકે છે અને વરસાદની આગાહી છે. ઉત્તરાખંડમાં 60 થી 70 કિમી પ્રતિ કલાકની ઝડપે પવન ફૂંકાઈ શકે છે. હિમાચલ પ્રદેસમાં ભારે વરસાદ અને આંધીનું એલર્ટ છે. પંજાબમાં ભારે વરસાદ અને વાવાઝોડાનું એલર્ટ છે. 60 કિમી પ્રતિ કલાકની ઝડપે પવન ફૂંકાશે.
દક્ષિણ-પશ્ચિમ ચોમાસું 26 મેના રોજ કેરળમાં સમય કરતાં વહેલું દસ્તક દઈ શકે છે. સામાન્ય રીતે કેરળમાં ચોમાસાની શરૂઆત 1 જૂનની આસપાસ થાય છે, જે ત્યારપછી ઉત્તર તરફ આગળ વધતા દેશના બાકીના ભાગોમાં પહોંચે છે. આ સાથે જ દેશમાં ચોમાસાની ઋતુ (જૂનથી સપ્ટેમ્બર)ની શરૂઆત માનવામાં આવે છે. ગયા વર્ષે ચોમાસાની શરૂઆત 24 મેના રોજ થઈ હતી. જો કે, હવામાન વિભાગનું કહેવું છે કે ચોમાસું ચાર દિવસ વહેલું કે ચાર દિવસ મોડું પણ પહોંચી શકે છે.",0.8
