title,url,source,date,language,state,district,search_term,full_text,relevance_score
Sattu Demand Rises Across Bihar As Heatwave Intensifies - Patna Press,https://news.google.com/rss/articles/CBMiaEFVX3lxTE9BTDZ5alhVVlhjMVp4LVNMcDAyMlliVlpQMERHZS0zREFzUGxqYlV3N3Y4S1Utd1NXcEF1dTE0Y0tKMHVOdGwxVlJyeDF3UDNxZlhKa2VMbWR3Slo3a1BDbzBNNlhjM3hR?oc=5,Patna Press,2026-05-25T10:26:59+05:30,en,Bihar,Patna,"""heatwave"" Bihar","Patna: With temperatures in Bihar hovering around 41°C, demand for the traditional drink sattu has increased sharply across Patna and other parts of the state as residents seek relief from the ongoing heatwave.
Crowds have been gathering at sattu stalls from morning until evening, particularly in busy market areas and roadside locations. Many consumers are opting for the drink as a low-cost alternative to packaged cold beverages and soft drinks.
Made primarily from roasted gram, sattu is widely consumed during summer in Bihar and eastern India. Vendors and health practitioners say the drink helps maintain hydration and provides energy during extreme heat conditions.
Vendors Report Higher Footfall
Kaushal Kishore, who runs a sattu stall near Raja Bazaar in Patna, said customer numbers have increased significantly in recent weeks.
He said sattu helps cool the stomach and provides energy during hot weather. According to him, adding lemon and spices to the drink makes it more effective in reducing discomfort caused by heat and dehydration.
Local residents said they have increasingly turned to sattu during the heatwave, describing it as a natural energy drink that helps reduce weakness and prevents dehydration.
Ayurvedic Experts Highlight Health Benefits
Vaidya Dr Shivaditya Thakur, superintendent of the Government Ayurvedic College and Hospital, said adequate intake of water, oral rehydration solution (ORS), and traditional summer beverages remains essential during extreme heat.
He said sattu has emerged as a preferred choice because of its nutritional value and accessibility. According to him, the drink is commonly prepared by mixing sattu with water, salt, sugar, cumin seeds, and roasted ajwain powder.
Dr Thakur added that sattu contains protein and can support hydration during summer months, when dehydration becomes common due to excessive heat exposure.
Sales Rise By Up To 40%
Ajay Gupta, president of the Bihar State Traders Association, said sales of gram-based sattu have increased by up to 40% with the rise in temperatures across the state.
He said sattu is currently being sold at prices between Rs 140 and Rs 160 per kilogram. Alongside packaged products, locally milled sattu is also witnessing strong demand from consumers.
Traders said the combination of affordability, availability, and perceived health benefits has contributed to the surge in sales during the summer season.",1.0
"बिहार में भीषण गर्मी के बीच बढ़ी 'सत्तू' की डिमांड, लू भगाने के साथ ऊर्जा देने में लाभकारी - Jagran",https://news.google.com/rss/articles/CBMisgFBVV95cUxNNm9UcUVZclNVLUxQZ25VQWh4WkU5MUY5X2p2eGE0dEdYS3Vja1dhOXJjRzdISmY2akw1ZTJpUzhqNXdZbXdhZnIyTkpSTlJFSUM3MDZUMzhZNEJ1N1FPcER4ME1UeEdWa05wRjFYelF2MmFFeXJTVEJQakJtd2w0WUYtRFV1YUp6OUJubFhMbmJtZjJwMWdHZm5JMnh2bklNS2ttOGk2XzA3ajVwbnlfRVln?oc=5,Jagran,2026-05-25T04:55:00+05:30,hi,Bihar,Patna,"""लू"" Bihar","बिहार में भीषण गर्मी के बीच बढ़ी 'सत्तू' की डिमांड, लू भगाने के साथ ऊर्जा देने में लाभकारी
भीषण गर्मी और बढ़ते तापमान के कारण पटना में पारंपरिक पेय सत्तू की मांग में तेजी से वृद्धि हुई है। यह सस्ता, पौष्टिक और शरीर को ठंडक देने वाला विकल्प ह ...और पढ़ें
समय कम है?
जानिए मुख्य बातें और खबर का सार एक नजर में
जागरण संवाददाता, पटना। भीषण गर्मी और लगातार बढ़ते तापमान के बीच राजधानी में पारंपरिक पेय सत्तू की मांग तेजी से बढ़ गई है। राज्य में तापमान 41 डिग्री सेल्सियस के आसपास पहुंचने के बाद लोग गर्मी से राहत पाने के लिए सत्तू का सहारा ले रहे हैं। शहर के विभिन्न इलाकों में सत्तू की दुकानों पर सुबह से शाम तक लोगों की भीड़ उमड़ रही है।
महंगे कोल्ड ड्रिंक्स और पैकेज्ड पेयों के मुकाबले सत्तू लोगों के लिए सस्ता, पौष्टिक और शरीर को ठंडक देने वाला विकल्प बनकर उभरा है। भुने चने से तैयार होने वाला यह पारंपरिक पेय शरीर में पानी की कमी दूर करने के साथ ऊर्जा भी देता है।
राजाबाजार के पास सत्तू बेचने वाले कौशल किशोर ने बताया कि गर्मी के दिनों में उनके स्टाल पर प्रतिदिन काफी लोग सत्तू पीने पहुंच रहे हैं। उन्होंने कहा कि सत्तू पेट को ठंडक देता है और शरीर को ऊर्जा प्रदान करता है।
नींबू और मसालों के साथ तैयार किया गया सत्तू लोगों को लू और डिहाइड्रेशन से राहत देने में मदद कर रहा है। स्थानीय लोगों का कहना है कि बढ़ती गर्मी में सत्तू किसी प्राकृतिक एनर्जी ड्रिंक की तरह काम कर रहा है।
खबरें और भी
लोगों ने बताया कि तेज धूप और उमस के बीच सत्तू पीने से शरीर में पानी की कमी नहीं होती और कमजोरी भी कम महसूस होती है।
आयुर्वेद के अनुसार सत्तू के लाभ
राजकीय आयुर्वेद कॉलेज एवं अस्पताल के अधीक्षक वैद्य डॉ. शिवादित्य ठाकुर ने बताया कि गर्मी के मौसम में पर्याप्त पानी, ओआरएस और पारंपरिक पेय पदार्थों का सेवन शरीर को हाइड्रेट रखने में सहायक होता है।
ऐसे में सत्तू एक सुलभ और स्वास्थ्यवर्धक विकल्प के रूप में लोगों की पहली पसंद बनता जा रहा है। उन्होंने कहा कि सत्तू का जल के साथ निर्माण होता है। इसे दो-तीन प्रकार से लेते है। इसमें नमक, शक्कर, जीरा, जमाइन का भुना हुआ पाउडर के साथ लेने से यह काफी लाभदायी होता है।
इसमें काफी प्रोटीन भरा होता है। इस गर्मी के मौसम में शरीर में जल का अभाव हो जाता है, ऐसे में सत्तू खाने या पीने के बाद बार-बार पानी पीने की इच्छा होती है। इससे यह काफी लाभदायी माना जाता है।
सत्तू की बिक्री में 40 प्रतिशत तक वृद्धि
बिहार राज्य व्यावसायिक संघ के अध्यक्ष अजय गुप्ता ने बताया कि गर्मी के बढ़ने के साथ ही चने की सत्तू की बिक्री में 40 प्रतिशत तक वृद्धि दर्ज की गई है। सत्तू 140 से 160 रुपये प्रति किलो मिल रहे हैं। ज्यादातर लोग अपने पास वाले के मिल से भी खरीदारी कर रहे हैं। इसके अतिरिक्त पैकेट वाले सत्तू की भी बिक्री हो रही है।",1.0
