title,url,source,date,language,state,district,search_term,full_text,relevance_score
"Kollam swelters as temperatures soar, yellow alert issued - The Hindu",https://news.google.com/rss/articles/CBMivwFBVV95cUxOeFdfa3RLX0NfUGhDdnNXYW5lQk9YUUh3b2R2eWFsellnRVZCTHpoZjhBRGowSHp4dGhudURINXpPYTMxVzNVdHhma0RzVktPSUV0NkhHTFRUUDNPODVrcWk4d1oxWS1YNzJEREtCMkJoSHpDUk9WV09ySzJ1Q19uTnFPY09Wc1hXb3FTY196dFJTQmZ1VU83a0FqZDJxY3FicVlHNVpPNk5FejRnd3o2eDhkcXVOelRqOU5SZ0hCNNIBxgFBVV95cUxPNk14SzV2TDJFYTA2cE5RTGRXLWh4Q0h2bTV6TzJlakh6WWZUbXE3QjQ1QlBJTHBpaWhhWlpRTGtnSjdHUG1lZGNudm9qblpDMUVlSDhTYmY0aWNSV0Rpbm4tcG5aazRjeUp2WktZdkJ3VXJfdnhoTWptTjl1aDZLWk1CTDRjQXhJcVB6OTBnNHB4S1IwQmN6QzAyeWFET2pKRExIbVNwWXNaRXZUR25RRjIzM0pVclAzWkJMZzRxTjdpWjVOM2c?oc=5,The Hindu,2026-04-17T19:25:22+05:30,en,Kerala,Kollam,"(""heat advisory"" OR ""heat action plan"" OR ""heat alert"" OR ""IMD warning"" OR ""IMD alert"" OR ""red alert"" OR ""orange alert"" OR ""yellow alert"" OR ""NDMA advisory"" OR ""cooling shelter"" OR ""relief measures"" OR ""heat compensation"" OR ""severe weather warning"") Kerala","The residents of Kollam are grappling with an unrelenting summer on the heels of a gruelling week where temperatures consistently breached the 37°C threshold. With the India Meteorological Department (IMD) forecasting that the mercury could climb as high as 39°C through April 19, a yellow alert has been officially issued for the district, signalling a period of heightened heat risk.
The intense heat, combined with the humidity levels has turned daily commutes and outdoor labour into gruelling tasks. Many citizens have reported physical exhaustion and heat-related discomfort, as the cooling effect of the evening breeze remains elusive. The usual hustle of the city markets has noticeably dimmed during the midday hours, with people preferring to stay indoors to escape the stinging rays of the sun.
Published - April 17, 2026 07:25 pm IST",1.0
Kerala weather update: IMD issues yellow alert amid rising temperatures - Mathrubhumi English,https://news.google.com/rss/articles/CBMiwAFBVV95cUxQQ3NDeEVqS2IyUnVMeXBaNVBjS3l5S2w0ejVWNW9nU1JXMWF6d01BREFfaVdGT3VBdWhGcjd3Z2FsMktIN0ZZYzhUbTkzd08tdTBZa0tWUi01UzJQbDRIMER1WW5LN0drUTdRQWxaRnZVbXd1dVZMcjZLWE9xOEcxUEJtelE4ZC1fOU5kVmNnckpLZVo1dmFFZXpEZDVqWkdPdWxrT0xSdUZWVks4bGJndldfYVRpUGsxTm8tRmxuX2jSAcYBQVVfeXFMUDdMRVNnVUhsc2VVUHI4aXNGT0NXMzIydFR4dm1QWlI5MGpsWXU5UGFISVJCcE9id0tKY0JXNDN4NWYxRTBkS09qal9abE9LcURyUWFnRDNtMVQ4c19FZ015R2ptWkRMMWtyRldnTWtqVkt6V3RkNklyVW9HUGdIVGstVVhKTmxhVFE5SU9qaVJQSlRZWXd0MjEzSkNvNk1NQU9ZMVc0eTR5d1Z6MW9KeEJLQVAzTFVtQjM5aXRzc0hWVUtsUDF3?oc=5,Mathrubhumi English,2026-04-17T20:53:41+05:30,en,Kerala,Kollam,"(""heat advisory"" OR ""heat action plan"" OR ""heat alert"" OR ""IMD warning"" OR ""IMD alert"" OR ""red alert"" OR ""orange alert"" OR ""yellow alert"" OR ""NDMA advisory"" OR ""cooling shelter"" OR ""relief measures"" OR ""heat compensation"" OR ""severe weather warning"") Kerala","Kerala is on a yellow alert through April 19 as temperatures are expected to soar to 40 degree Celsius in some districts.
Thiruvananthapuram: On Friday, the India Meteorological Department officially announced a yellow alert for several districts in Kerala. This warning is in response to a steady climb in temperatures and will stay in effect until April 19.
According to the Kerala State Disaster Management Authority, this yellow alert is a signal for the public to stay cautious as the state faces moderate heatwave conditions.
District-wise heat forecast
The latest data shows that Palakkad is expected to see the highest temperatures, reaching around 40 degree Celsius. Other areas like Kollam and Kottayam are likely to hit 39 degree Celsius and 38 degree Celsius. In most other districts, including Thiruvananthapuram and Kozhikode, the mercury is predicted to reach 37 degree Celsius. The IMD has confirmed that these temperatures are 2 to 3 degree Celsius above normal for this time of year.
Prevailing weather conditions
Outside of the hilly regions, the entire state is expected to experience very ""hot and humid weather conditions"" during this period. The disaster management authority has advised people to be careful as the combination of high heat and moisture continues. The alert remains active through the weekend to ensure everyone is prepared for these intense summer conditions.
(With PTI inputs)",1.0
