title,url,source,date,language,state,district,search_term,full_text,relevance_score
"Mumbai Weather LATEST Update: Heatwave, Unseasonal Rain Alert Issued; Check Forecast - Asianet Newsable",https://news.google.com/rss/articles/CBMi0gFBVV95cUxNcGh2VF9zMVJHY2c5dzJrU3hPQ3dVYW5QQWtpYWRJTGdIN3FIVkkzQl9xcERYQTRRRnIzSWR4RDQtY0k4TzFxM2llNkpkRExMdWROQ3pzUzJtUU9LOFd2SEhtdFJMcTkwNmVydlNMR0ZfeTUtbVF6U0dVekxMTGs2cllSVlZMTlRMZWpVeDFpc24zMzdfQUdYV2ExYmhQM3JveExidWpuU0M2X3NMMklZYnZOMmx4S2lpQUN6Z3lNX0dZa3NlTXZPVWRfQnZxbmxHd0HSAdcBQVVfeXFMT3R0RWxTVjl0aXgyQ0JvbFAxcTNxS2F3TkUzaTZLSElyd1U2Mk9BZFF4U3Utcklkc2Z2V2pTbVBLaXpmeGlLeTc2T3NDdFRCNHUzME5GaXNKQy1ITW9tSEg5XzVlYUVBNXk0QWg2N0JaZ3lmZU5hNFlST1ZyZDExUkkyb0Y2Q0tJdUhlc1Ywc0RIay1PQnBXZ3R2TXRlLUg3OFd5RnlJVWpYdDFaV0pyNWhzZjM0V1RoRE9ZSWhJbnYxYmR1OWFpdTg0SzhzTDdqblpoX2lWYWs?oc=5,Asianet Newsable,2026-04-09T08:28:06+05:30,en,Maharashtra,Dhule,"(heatwave OR ""heat wave"" OR ""severe heatwave"" OR ""extreme heat"" OR ""heat spell"" OR ""scorching heat"" OR ""blistering heat"" OR ""sweltering heat"" OR ""hot winds"" OR loo OR ""hot loo winds"" OR ""intense heat"" OR ""unbearable heat"" OR ""deadly heat"" OR heat OR ""weather forecast"" OR ""weather update"" OR ""weather alert"" OR ""IMD forecast"" OR ""IMD prediction"" OR ""IMD alert"" OR IMD OR ""rising temperatures"" OR ""temperatures expected to rise"" OR ""relief from heat"" OR ""respite from heat"" OR ""heat respite"" OR ""respite from scorching heat"") Maharashtra","Mumbai Weather LATEST Update: Heatwave, Unseasonal Rain Alert Issued; Check Forecast
Mumbai Weather LATEST Update: The weather department has predicted a heatwave for the Vidarbha region, while Marathwada in Western Maharashtra are likely to get unseasonal rain with thunderstorms; Check Forecast
Double trouble for Maharashtra! Heatwave and rain at the same time
Where will it be hot and where will it rain?
Western Maharashtra: Rain likely in Solapur-Sangli
Western Maharashtra: Rain likely in Solapur-Sangli The weather department has issued a rain warning for Solapur and Sangli districts in Western Maharashtra. Here, clouds are expected to gather suddenly in the afternoon, leading to showers. Temperature: Min 23°C to 25°C | Max 33°C to 35°C.
Vidarbha: The sun will be blazing!
Vidarbha: The sun is going to be fierce! There are no signs of rain in Vidarbha; instead, the heat is set to intensify. Due to the dry weather, residents will have to bear the brunt of the scorching sun. Temperature: Min 24°C to 26°C | Max 36°C to 39°C.
Konkan: A double whammy of heat and humidity
Konkan: A double whammy of heat and humidity The Konkan coast has a low chance of rain, but high humidity will make it feel extremely hot and stuffy. Temperature: Min 25°C to 27°C | Max 32°C to 34°C.
North Maharashtra: Dry weather
North Maharashtra: Dry weather ahead The weather in areas like Nashik, Jalgaon, and Dhule will remain mostly dry. The sky might be partly cloudy, but there won't be any major drop in temperature.
Important advisory and precautions for citizens
Stay updated with the Breaking News Today and Latest News from across India and around the world. Get real-time updates, in-depth analysis, and comprehensive coverage of India News, World News, Indian Defence News, Kerala News, and Karnataka News. From politics to current affairs, follow every major story as it unfolds. Get real-time updates from IMDon major cities weather forecasts, including Rain alerts, Cyclonewarnings, and temperature trends. Download the Asianet News Official App from the Android Play Store and iPhone App Store for accurate and timely news updates anytime, anywhere.",0.6833333333333333
