title,url,source,date,language,state,district,search_term,full_text,relevance_score
കേരളത്തിൽ വരും ദിവസങ്ങളിൽ താപനില ഉയരാൻ സാധ്യത - keralaonlinenews,https://news.google.com/rss/articles/CBMie0FVX3lxTFBwbGhjZ1d1WXFDcmxQMkJtRGVBdmxoOGxFaS0xSkpCd3RHNnllc2xraVctM0plWFVIUVBIRjRoQ2NyMmpqbjdsMVlHRTZmb0UyM0x4dUxlMzJFZTdSLUZDQzllNjZ5UnRBMjRFLUxERmxLamFjb2t5MjItQQ?oc=5,keralaonlinenews,2026-04-08T18:39:19+05:30,ml,Kerala,,"(സൂര്യാഘാതം OR ""ഹീറ്റ് സ്ട്രോക്ക്"" OR ""ചൂടേറ്റ് മരണം"" OR ""വെയിലേറ്റ് മരണം"" OR നിര്‍ജലീകരണം OR ""ആശുപത്രിയില്‍ പ്രവേശിപ്പിച്ചു"" OR ""ചൂടുമൂലം അസുഖം"") Kerala","കേരളത്തിൽ വരും ദിവസങ്ങളിൽ താപനില ഉയരാൻ സാധ്യത
കേരളത്തിലെ വിവിധ ജില്ലകളിൽ വരും ദിവസങ്ങളിൽ താപനില 38 ഡിഗ്രി സെൽഷ്യസ് വരെ ഉയരുമെന്ന് കേന്ദ്ര കാലാവസ്ഥ വകുപ്പിന്റെ മുന്നറിയിപ്പ്. ഏപ്രിൽ 09 വരെ പാലക്കാട് ജില്ലയിൽ ഉയർന്ന താപനില 38 ഡിഗ്രി സെൽഷ്യസ് വരെയും കൊല്ലം, കോട്ടയം, തൃശൂർ ജില്ലകളിൽ ഉയർന്ന താപനില 37 ഡിഗ്രി സെൽഷ്യസ് വരെയും ഉയരാൻ സാധ്യതയുള്ളതായി കേന്ദ്ര കാലാവസ്ഥ വകുപ്പ് അറിയിച്ചു.
ഈ ദിവസങ്ങളിൽ തിരുവനന്തപുരം, പത്തനംതിട്ട, ആലപ്പുഴ, എറണാകുളം ജില്ലകളിൽ ഉയർന്ന താപനില 36 ഡിഗ്രി സെൽഷ്യസ് വരെയും ഉയരാൻ (സാധാരണയെക്കാൾ 2 മുതൽ 3 ഡിഗ്രി സെൽഷ്യസ് വരെ കൂടുതൽ) സാധ്യതയെന്ന് കാലാവസ്ഥ വകുപ്പ് അറിയിച്ചു. ഉയർന്ന താപനിലയും ഈർപ്പമുള്ള വായുവും കാരണം ഈ ജില്ലകളിൽ, മലയോര മേഖലകളിലൊഴികെ 09 വരെ ചൂടും അസ്വസ്ഥതയുമുള്ള കാലാവസ്ഥയ്ക്ക് സാധ്യതയുണ്ട്.",0.8333333333333333
Kerala Weather: ചുട്ടുപൊള്ളി കേരളം; താപനില 38 ഡിഗ്രി സെൽഷ്യസ് വരെ; മഞ്ഞ അലർട്ട് - Indian Express - Malayalam,https://news.google.com/rss/articles/CBMilgFBVV95cUxOYklKaDgxeG9mYU9KVjNwdTdLaTBNNHBMNzN1T1YtcHAzR0UwN1RRNmNIVGZBWkZscG9Mdk5wbElYSUdsREh1ZEM1Ulk2blpYc09wQ3pxVEI3UXowQl9hLXNVekNWSHZwRWNmaG5ld1VHOGJJVmxuSmN6eElHblVGRkRmcy13U0lhZ3A1c0V3OFhUU3hBSnfSAZYBQVVfeXFMTmJJSmg4MXhvZmFPSlYzcHU3S2kwTTRwTDczdU9WLXBwM0dFMDdUUTZjSFRmQVpGbHBvTHZOcGxJWElHbERIdWRDNVJZNm5aWHNPcEN6cVRCN1F6MEJfYS1zVXpDVkh2cEVjZmhuZXdVRzhiSVZsbkpjenhJR25VRkZEZnMtd1NJYWdwNXNFdzhYVFN4QUp3?oc=5,Indian Express - Malayalam,2026-04-08T14:49:03+05:30,ml,Kerala,,"(താപനില OR ""താപനില ഉയര്‍ന്നു"" OR ""ഡിഗ്രി സെല്‍ഷ്യസ്"" OR ""പരമാവധി താപനില"" OR ""റെക്കോര്‍ഡ് താപനില"") Kerala","തിരുവനന്തപുരം: കേരളത്തിലെ വിവിധ ജില്ലകളില് വരും ദിവസങ്ങളിൽ താപനില 38 ഡിഗ്രി സെൽഷ്യസ് വരെ ഉയരുമെന്ന് കേന്ദ്ര കാലാവസ്ഥ വകുപ്പിന്റെ മുന്നറിയിപ്പ്. ഇന്നും നാളെയും പാലക്കാട് ജില്ലയിൽ ഉയർന്ന താപനില 38 ഡിഗ്രി സെൽഷ്യസ് വരെയും, കൊല്ലം, കോട്ടയം, പത്തനംതിട്ട ജില്ലകളിൽ ഉയർന്ന താപനില 37 ഡിഗ്രി സെൽഷ്യസ് വരെയും ഉയരാൻ സാധ്യതയെന്ന് കേന്ദ്ര കാലാവസ്ഥ വകുപ്പ് അറിയിച്ചു.
തിരുവനന്തപുരം, ആലപ്പുഴ, എറണാകുളം, തൃശൂർ ജില്ലകളിൽ ഉയർന്ന താപനില 36 ഡിഗ്രി സെൽഷ്യസ് വരെയും ഉയരാൻ സാധ്യതയുണ്ട്. ഉയർന്ന താപനിലയും ഈർപ്പമുള്ള വായുവും കാരണം ഈ ജില്ലകളിൽ, മലയോര മേഖലകളിലൊഴികെ ഇന്നും നാളെയും ചൂടും അസ്വസ്ഥതയുമുള്ള കാലാവസ്ഥയ്ക്കും സാധ്യതയുണ്ട്.

സംസ്ഥാനത്ത് ഉയർന്ന ചൂട് റിപ്പോർട്ട് ചെയ്യപ്പെടുന്ന സാഹചര്യത്തിൽ പൊതുജനങ്ങൾക്കായി സംസ്ഥാന ദുരന്ത നിവാരണ അതോറിറ്റി ജാഗ്രത നിർദേശം പുറപ്പെടുവിച്ചു. ഈ ജില്ലകളിൽ മഞ്ഞ അലർട്ട് നിലവിലുണ്ട്. ഉയർന്ന ചൂട് സൂര്യാഘാതം, സൂര്യാതപം, നിർജലീകരണം തുടങ്ങി നിരവധി ഗുരുതരമായ ആരോഗ്യപ്രശ്നങ്ങൾക്ക് കാരണമാകും. ആയതിനാൽ പൊതുജനങ്ങൾ ജാഗ്രത നിർദേശങ്ങൾ പാലിക്കേണ്ടതാണ്.
പകൽ 11 മുതല് വൈകീട്ട് 3 വരെയുള്ള സമയത്ത് നേരിട്ട് ശരീരത്തിൽ കൂടുതൽ സമയം തുടർച്ചയായി സൂര്യപ്രകാശം ഏൽക്കുന്നത് ഒഴിവാക്കുക. ദാഹമില്ലെങ്കിലും വെള്ളം കുടിക്കുന്നത് തുടരുക. പരമാവധി ശുദ്ധജലം കുടിക്കുക. നിർജലീകരണമുണ്ടാക്കുന്ന മദ്യം, കാപ്പി, ചായ, കാർബണേറ്റഡ് സോഫ്റ്റ് ഡ്രിങ്കുകൾ തുടങ്ങിയ പാനീയങ്ങള് പകല് സമയത്ത് ഒഴിവാക്കുക.

അയഞ്ഞ, ഇളം നിറത്തിലുള്ള കോട്ടൺ വസ്ത്രങ്ങള് ധരിക്കുക. പുറത്തിറങ്ങുമ്പോൾ പാദരക്ഷകൾ ധരിക്കുക. കുടയോ തൊപ്പിയോ ഉപയോഗിക്കുന്നത് നല്ലതായിരിക്കും. പഴങ്ങളും പച്ചക്കറികളും ധാരാളമായി കഴിക്കുക. ഒആർഎസ് ലായനി, സംഭാരം തുടങ്ങിയവയുടെ ഉപയോഗം പ്രോത്സാഹിപ്പിക്കുക. മാർക്കറ്റുകൾ, കെട്ടിടങ്ങൾ, മാലിന്യശേഖരണ-നിക്ഷേപ കേന്ദ്രങ്ങൾ (ഡംപിങ് യാർഡ്) തുടങ്ങിയ ഇടങ്ങളിൽ തീപിടുത്തങ്ങൾ വർധിക്കാനും വ്യാപിക്കാനുമുള്ള സാധ്യത കൂടുതലാണ്. ഫയർ ഓഡിറ്റ് നടത്തേണ്ടതും കൃത്യമായ സുരക്ഷാ മുൻകരുതൽ സ്വീകരിക്കുകയും ചെയ്യേണ്ടതാണ്. ഇവയോട് ചേർന്ന് താമസിക്കുന്നവരും സ്ഥാപനങ്ങൾ നടത്തുന്നവരും പ്രത്യേകം ജാഗ്രത പാലിക്കുക.
Read More: കേരള നിയമസഭാ തിരഞ്ഞെടുപ്പ് 2026: പോളിങ് തീയതി, സമയം, വോട്ട് ചെയ്യേണ്ട രീതി",1.0
