title,url,source,date,language,state,district,search_term,full_text,relevance_score
"उत्तर भारत में मौसम लेगा करवट : लू के बाद आंधी और बारिश का अलर्ट, गर्मी से मिलेगी राहत... - GaonJunction",https://news.google.com/rss/articles/CBMi5wFBVV95cUxQel80T2RaOTltYm5FbFRZN240WGpqTnpiVWhQNWdEVWp3WEFOZktybXg1bVJjcENxWkpsNDdLUEdsaER1M3prT3IzY3V3NkItaUo1YzVBSENSZk1RR3FQbXJHMndzVVhMYXYzRnNTdGhEZTN0WHpYT2VXWU1ycHViOFhEVGJDSW1kSkNIaXcyTmR6VzhwMEI1d2dST21iNEpxNVhHekl3VjdhRGczMmc5bUpuTXdRWXJFeFItWVNFOFA1cXpXQTQybkRRalE1RTJMaUwwa2pFNlVLV25yRTRFZ1duTVR5OGs?oc=5,GaonJunction,2026-04-26T08:37:19+05:30,hi,Himachal Pradesh,,"""लू"" Himachal Pradesh","उत्तर भारत के राज्यों में अगले कुछ दिनों तक मौसम में बड़ा बदलाव देखने को मिलेगा। 26 अप्रैल से पहाड़ी और मैदानी दोनों ही इलाकों में गर्मी और लू के साथ साथ तेज हवाओं और बारिश का दौर शुरू होने वाला है। हाल ही में जारी एक सरकारी बुलेटिन में यह पूरी जानकारी दी गई है जिससे आम लोगों और किसानों को सतर्क रहने में मदद मिलेगी।
उत्तर भारत के राज्यों में अगले कुछ दिनों तक मौसम में बड़ा बदलाव देखने को मिलेगा। 26 अप्रैल से पहाड़ी और मैदानी दोनों ही इलाकों में गर्मी और लू के साथ साथ तेज हवाओं और बारिश का दौर शुरू होने वाला है। हाल ही में जारी एक सरकारी बुलेटिन में यह पूरी जानकारी दी गई है जिससे आम लोगों और किसानों को सतर्क रहने में मदद मिलेगी।
अगले दो दिन सताएगी भीषण लू और गर्मी
रिपोर्ट के अनुसार उत्तर प्रदेश, पंजाब, हरियाणा, चंडीगढ़, दिल्ली, हिमाचल प्रदेश और जम्मू कश्मीर के कुछ हिस्सों में 26 और 27 अप्रैल को भीषण लू चलने की चेतावनी है। राजस्थान में 26 अप्रैल को लू का काफी असर रहेगा। दिन के अलावा रातें भी काफी गर्म रहने वाली हैं।
26 और 27 अप्रैल को हरियाणा, चंडीगढ़ और दिल्ली में रात के समय भी भयंकर गर्मी का अहसास होगा जबकि उत्तर प्रदेश और पंजाब में 26 अप्रैल को रातें गर्म रहेंगी। 27 अप्रैल तक अधिकतम तापमान में कोई खास बदलाव नहीं होने वाला है इसलिए लोगों को धूप से बचने की जरूरत है।
पहाड़ों पर बारिश और बर्फबारी के आसार
पहाड़ी इलाकों के मौसम में जल्द ही काफी हलचल रहने वाली है। जम्मू कश्मीर, लद्दाख और आसपास के पहाड़ी इलाकों में 26 से 28 अप्रैल के बीच 30 से 50 किलोमीटर प्रति घंटे की रफ्तार से तेज हवाएं चलेंगी और साथ ही गरज के साथ हल्की से मध्यम बारिश या बर्फबारी होने की पूरी संभावना है।
इसके अलावा हिमाचल प्रदेश में 28 से 30 अप्रैल तक और उत्तराखंड में 26 अप्रैल के साथ साथ 28 से 30 अप्रैल के बीच पानी गिरने का अनुमान है। उत्तराखंड के कुछ इलाकों में 28 और 29 अप्रैल को ओले भी गिर सकते हैं।
चिलचिलाती गर्मी और लू के बाद मैदानी इलाकों में रहने वाले लोगों को बारिश से थोड़ी राहत मिलने की उम्मीद है। 27 से 30 अप्रैल के बीच पंजाब, हरियाणा और चंडीगढ़ में 30 से 40 किलोमीटर प्रति घंटे की रफ्तार वाली तेज हवाओं के साथ बिजली चमकने और हल्की बारिश होने की संभावना है।
राजस्थान में भी 27 से 29 अप्रैल तक ऐसा ही मौसम रहेगा। पश्चिमी उत्तर प्रदेश में 28 से 30 अप्रैल और पूर्वी उत्तर प्रदेश में 28 अप्रैल से 1 मई के बीच आंधी और बारिश देखने को मिलेगी।
गर्मी से मिलेगी राहत और गिरेगा पारा
मौसम की इस ताजा रिपोर्ट के अनुसार 27 अप्रैल के बाद आम जनता को भीषण गर्मी से थोड़ी राहत मिलेगी। 28 अप्रैल से 1 मई के बीच उत्तर भारत के मैदानी इलाकों में अधिकतम तापमान में 2 से 4 डिग्री सेल्सियस तक की कमी आएगी।
इसी तरह पश्चिमी हिमालय के क्षेत्रों यानी पहाड़ी इलाकों में भी इसी दौरान तापमान 2 से 3 डिग्री सेल्सियस तक नीचे गिर जाएगा। बदलते मौसम को देखते हुए सभी को सावधानी बरतने और जरूरत पड़ने पर ही तेज धूप में बाहर निकलने की सलाह दी गई है।",1.0
