title,url,source,date,language,state,district,search_term,full_text,relevance_score
Masuuliyiin ka Tirsan Dowladda Hoose ee Burco oo Musuqmaasuq Loo Xidhay - hiiraan.com,https://news.google.com/rss/articles/CBMic0FVX3lxTE55cEl4eGNUclhtclFTblRMQW9GelpnWG1ycjlkUXQyUENnR1BWbWRMenRpSkx3SWR3b2xwM3d3MnlYdXVzeEVYanhCSGZBTGJ1SWhrR3l3ZU00a1pkNmsyOXROQ0ttWjB1TERPcjFEdUJwTlE?oc=5,hiiraan.com,2026-02-12T13:42:39+05:30,en,Andaman and Nicobar Islands,,"(heatwave OR ""heat wave"" OR ""severe heatwave"" OR ""extreme heat"" OR ""heat spell"" OR ""scorching heat"" OR ""blistering heat"" OR ""sweltering heat"" OR ""hot winds"" OR loo OR ""hot loo winds"" OR ""intense heat"" OR ""unbearable heat"" OR ""deadly heat"") Andaman and Nicobar Islands","Khamiis, Febraayo 12, 2026 (HOL) - Xafiiska Hantidhawrka Guud ee Somaliland ayaa xabsi dhexe ee magaalada Burco u taxaabay toddoba masuul oo ka tirsan Dawladda Hoose ee Degmada Burco, kuwaas oo lagu eedeeyey lunsi hantiyeed.
Masuuliyiinta la xidhay oo uu magacyadooda baahiyay Xafiiska Hanti Dhawrka Guud ayaa kala ah:
1. Amiin Cabdillaahi Yaasiin – Xoghayaha Fulinta Dawladda Hoose Degmada Burco
2. Diiriye Sugaal Rooble – Madaxdii Jaangoynta Dhulka. 3. Cabdillaahi Muuse Maxamed – Xisaabiyihii Dawladda Hoose Burco. 4. Maxamed Xaaji Muuse Shire – Joomitir. 5. Faarax Muuse Siciid – Joomitir
6. Cabdicasiis Jaamac Ismaaciil – Madaxa Iibka Dawladda Hoose Burco. 7. Maxamed Cali Xirsi – Joomitir.
Wararka ayaa sheegaya in dhammaan masuuliyiintan uu Xafiiska Hantidhawrka Guud ku eedeeyey ku lug lahaansho falal la xidhiidha musuqmaasuq iyo lunsi hantiyeed kadib baadhitaanno uu xafiisku sameeyey.
Ilaa hadda ma jiro war rasmi ah oo ka soo baxay masuuliyiinta la xidhay ama qareennadooda oo ku saabsan eedaha loo jeediyey. Sidoo kale, Xafiiska Hantidhawrka Guud si faahfaahsan ugama hadlin xaddiga lacageed ama hantida lagu tuhunsan yahay inay lunsadeen.
Kiiskan ayaa imanaya xilli xafiisku uu kordhiyeen dadaallada lagula dagaallamayo musuqmaasuqa iyo ku takri-falka hantida dadweynaha, iyadoo marar kala duwan la shaaciyey tallaabooyin sharci oo laga qaaday masuuliyiin lagu eedeeyey falal la mid ah.
Dacwadda masuuliyiintan ayaa la filayaa in la horkeeno maxkamadda awoodda u leh, si sharcigu go’aan uga gaadho eedaha loo haysto.",0.5166666666666666
Madaxweyne Deni oo guddoomiye Aadan Madoobe ku eedeeyay inuu Baarlamaanka ka wado howlo ka baxsan shaqadii loo igmaday - hiiraan.com,https://news.google.com/rss/articles/CBMic0FVX3lxTFBaMXFtWDFjTy1fc0VJSE1yN1d4Q0FRdlF4bVF0YndLbFhNbDRPNnEtd0JwYUhld201bm5OR2c5YjBFa0tlbkJ0VzFDdVNVVng1UEdmdlgyakN0aHQ3MDZ6eU5QQWVPRXFxNGxpUUFJaUhBSjA?oc=5,hiiraan.com,2026-02-12T14:33:25+05:30,en,Andaman and Nicobar Islands,,"(heatwave OR ""heat wave"" OR ""severe heatwave"" OR ""extreme heat"" OR ""heat spell"" OR ""scorching heat"" OR ""blistering heat"" OR ""sweltering heat"" OR ""hot winds"" OR loo OR ""hot loo winds"" OR ""intense heat"" OR ""unbearable heat"" OR ""deadly heat"") Andaman and Nicobar Islands","Arbaco, Febraayo 11, 2026 (HOL) - Madaxweynaha Puntland, Siciid Cabdullaahi Deni, ayaa ku eedeeyay Guddoomiyaha Golaha Shacabka, Aadan Madoobe, inuu Baarlamaanka ka dhex wado hawlo ka baxsan shaqadii loo igmaday.
Sidoo kale, wuxuu u mahad celiyay xildhibaannada maalmahan waday kacdoonka ee ka hor yimid wax ka beddelka dastuurka, kuwaas oo uu ku tilmaamay in ay gudanayaan waajibaadkooda dastuuriga ah.
Madaxweyne Deni ayaa ku boorriyay xildhibaanada in ay sii wadaan ilaalinta mas’uuliyadda loo doortay. Wuxuu sheegay in waxa hadda ka socda Baarlamaanka aysan ahayn shaqadii loo igmaday, isla markaana loo baahan yahay isla xisaabtan dhab ah iyo in si furan looga wada hadlo jihada siyaasadeed ee uu dalku u socdo.
Hadalkaan ayuu madaxweyne Deni ka jeediyay kulan caawa lagu soo dhoweynayay isaga iyo Madaxweynaha Jubbaland, Axmed Madoobe, kaas oo ay soo qaban qaabiyeen Golaha Mustaqbalka Soomaaliya, kana dhacay magaalada Muqdisho.
Deni ayaa sheegay in dalka uu si degdeg ah ugu baahan yahay doorasho loo dhan yahay, isagoo tilmaamay in marxaladda hadda la joogo aysan ku filnayn hadal iyo dood aan miro dhal ahayn.
Wuxuu xusay in loona baahan yahay in la ilaaliyo xeerarka iyo shuruucda lagu heshiiyay.
“Dalka waxa keliya ee ka dhiman waa in doorasho la qabto; wixii kale waa iska hadal,” ayuu yiri Deni.
Dhanka kale, Madaxweyne Deni wuxuu caddeeyay inay diyaar u yihiin wada-hadal ay la yeeshaan Madaxweynaha Dowladda Federaalka Soomaaliya.
Deni waxa uu ku celiyay inay ka go’an tahay ilaalinta midnimada iyo wadajirka dalka, ayna u yimaadeen Muqdisho sidii loo gaari lahaa heshiis dhab ah oo dan u ah ummadda Soomaaliyeed.",0.5166666666666666
