title,url,source,date,language,state,district,search_term,full_text,relevance_score
"फरवरी में ही तेज धूप और चढ़ रहा पारा, उत्तराखंड में समय से पहले गर्मी का दिखने लगा असर - Hindustan",https://news.google.com/rss/articles/CBMi9wFBVV95cUxNQzJXUVF5YlozakdmRVE4ZTRHaDIybnlVN0RYU2lzUksxYU03aVI0dE1mdkdiZGR5dEtiSzZGT3JnODV2MTdiZG1fZGEwRkIxWFhUZFRmLWtLeGhiSWdaY09NUjlPU3BWUjlmY1FfV1lFU1Fxd1Y5OG5jd1hWTU0xOXhhTFNSX3AyV294RlJZRzAxcklGTU50Q0NKZ3VGRTlXMjNNUjFYZkdtejFxNzBMNWZBa0R6a0lacmlyQlhvMkRtUm5hcXhRTE5hb2FLUXY4VkN0M2pSTnloRnBKYWxXOVNnQUYzUmluYlFzdUVPejdMMjRGUjNR0gH8AUFVX3lxTE0wUHNMM21CbF9DaExLd25LaGJWSlNwaGpFcy1Cczd4OXQ5WG1wdXdXU1VTUFRwcUM5U3d2N1cxZjY1WHo2TUFJVjVCYWJNUnE0WXlaMUNwQmo3cFJ6SWJhX2NxV0RaS1BFUXp6anMzX21PbVN6VGE1UlFmTXA4VnZDV3pjUVNvUVMyakkxRXFfQWRzWVV0TWZPR1NzVXV4c0pnU3lST21QVEZUTXRLTnBaMjM1a0hlZnhtVUlQdk5iVjlKeWpoeElWOUhMVFlQd1d0dl91bnVwd0NnQlJLVUtRQ1RwQnoxZlBGM1V4WjBZNURWU1FTanlYSTc3YQ?oc=5,Hindustan,2026-02-12T10:07:41+05:30,hi,Andaman and Nicobar Islands,,"(लू OR ""लू चलना"" OR ""भीषण गर्मी"" OR ""प्रचंड गर्मी"" OR ""कड़ी धूप"" OR ""तेज धूप"" OR ""गर्म हवा"" OR ""उष्ण लहर"" OR ""ताप लहर"" OR ""हीट वेव"" OR ""झुलसाने वाली गर्मी"" OR ""तपती गर्मी"" OR ""भयंकर गर्मी"" OR ""गर्मी का कहर"" OR ""गर्मी का प्रकोप"" OR ""अत्यधिक गर्मी"") Andaman and Nicobar Islands",,0.0
"दिल्ली-एनसीआर में तेज धूप ने चढ़ा दिया पारा, अब विदा हो रही सर्दी; जानें आज कैसा रहेगा मौसम - ETV Bharat",https://news.google.com/rss/articles/CBMi0wFBVV95cUxPcGUyV0NIdTVHbEJmN2IzYTdhQXRCTG96bGJOTDJKcTdTM1ZXTElrdmxFOWprQzV3MWU4eE9iWFJwQU9xRGs4MHA3Z1dpclBtd19BRTFoOEJyRVROM3JWVGdtNWtXaTV4LUZoaXl0NkVaQWJ2Zk11MEk3cXFoLU5pWkt3dzh1ZFdEZzZPWTZrVFNwRUlUY1c4YUZhbGlqc093bnNFNERtRnpKTVZBREY0VUJJcnk4TTRsOG0yTmtfdklBcUVuZXlCWTBIX1Y5Zjk5T1FB0gHYAUFVX3lxTFAwelVKZnFLOUlibkYwc0FMeDlCUTFwb25uYWxCaXRjSjlBM1FtV0ZwWVJ5VUlxbk42UEFmNXhtamZjZC1JaXcwRjlXVDRubmdqbDhkQ251Y01SeWVZbmdfZFhKd2xxQXotTmRwLVliUFYweWZGekMtSnpoRGNCVFVpcmxydzlMTjhCeEFlZU1ONWU4TGdBdFpsekxhUFd0S1FVb1dYeGJlc2ZGN0xZQU1UNTdhZzFsRkllWEhhVGkzbnlsckdnMC0zQUswdjBzZXFTUFRNQnRLcg?oc=5,ETV Bharat,2026-02-12T07:34:31+05:30,hi,Andaman and Nicobar Islands,,"(लू OR ""लू चलना"" OR ""भीषण गर्मी"" OR ""प्रचंड गर्मी"" OR ""कड़ी धूप"" OR ""तेज धूप"" OR ""गर्म हवा"" OR ""उष्ण लहर"" OR ""ताप लहर"" OR ""हीट वेव"" OR ""झुलसाने वाली गर्मी"" OR ""तपती गर्मी"" OR ""भयंकर गर्मी"" OR ""गर्मी का कहर"" OR ""गर्मी का प्रकोप"" OR ""अत्यधिक गर्मी"") Andaman and Nicobar Islands","दिल्ली-एनसीआर में तेज धूप ने चढ़ा दिया पारा, अब विदा हो रही सर्दी; जानें आज कैसा रहेगा मौसम
दिल्ली में तेज धूप के कारण तापमान में लगातार बढ़ोतरी हो रही है, जिससे अब ठंड का असर कम होने लगा है.
नई दिल्ली: दिल्ली एनसीआर में ठंड की अब धीरे-धीरे विदाई हो रही है और गर्मी बढ़ती जा रही है. दिल्ली के सफदरजंग में अधिकतम तापमान 27.5 डिग्री सेल्सियस रिकॉर्ड किया गया. यह सामान्य से 4.1 डिग्री सेल्लियस जायादा है. वहीं, न्यूनतम तापमान 13.2 डिग्री रहा, जो सामान्य से तीन डिग्री सेल्लियस ज्यादा है. बुधवार को सुबह हल्की धुंध देखने को मिली और हल्के बादल भी छाए रहे, लेकिन दिन चढ़ने के साथ ही धुंध साफ हो गई और तेज धूप निकल आई.
तापमान में धीरे-धीरे बढ़ोतरी
मौसम विभाग का कहना है कि सुबह के वक्त न्यूनतम तापमान बढ़ते हुए 17 फरवरी तक 13 से 15 डिग्री सेल्सियस तक पहुंच जाएगा. जबकि अधिकतम तापमान भी 27 से बढ़कर 29 डिग्री तक पहुंच जाने से शाम के वक्त गर्मी और बढ़ेगी. आज तेज धूप खिलने से दिल्ली में अधिकतम तापमान सामान्य से ज्यादा रहेगा. गुरुवार को अधिकतम तापमान 25 से 27 डिग्री सेल्सियस और न्यूनतम तापमान 11 से 13 डिग्री सेल्सियस के बीच रहने की उम्मीद है.हालांकि अब सुबह के वक्त बादल छाए रहने के दौरान धुंध का माहौल रहेगा. लेकिन बारिश होने की संभावना नहीं है. जबकि 15 फरवरी के बाद आंधी और बारिश की भी चेतावनी दी गई है. आसमान अधिकतर साफ रहेगा, लेकिन सुबह के समय धुंध बने रहने की संभावना है.
मौसम विभाग का कहना है कि दिल्ली-एनसीआर में अब सर्दी काफी हद तक कम हो जाएगी. अब गर्मी बढ़ना शुरू हो जाएगी. अधिकतम और न्यूनतम तापमान सामान्य से अधिक रह सकते हैं, जिस वजह से लोगों को अब गर्मी का एहसास होने लगेगा. आने वाले दिनों में मौसम में और भी कई बदलाव देखने को मिल सकते हैं. पूरे देश भर में अभी मौसम ठंडा है लेकिन दिल्ली एनसीआर में गर्मी ने दस्तक दे दी है.
#WATCH दिल्ली: राष्ट्रीय राजधानी के कई इलाकों में स्मॉग की एक परत छाई हुई है।
— ANI_HindiNews (@AHindinews) February 12, 2026
CPCB के अनुसार, इंडिया गेट और कर्तव्य पथ के पास AQI 209 है, जिसे 'खराब' कैटेगरी में रखा गया है। pic.twitter.com/Y3wdOT2KYq
दिल्ली में प्रदूषण की स्थिति
केंद्रीय प्रदूषण नियंत्रण बोर्ड CPCB के अनुसार राजधानी दिल्ली में गुरुवार सुबह 7:15 बजे तक औसतन वायु गुणवत्ता सूचकांक 209 अंक बना हुआ है. जबकि दिल्ली एनसीआर के शहर फरीदाबाद में 222, गुड़गांव में 218, गाजियाबाद में 212, ग्रेटर नोएडा में 205 और नोएडा में 208 अंक बना हुआ है. राजधानी दिल्ली के अधिकांश इलाकों में AQI लेवल 200 से ऊपर और 300 के बीच में बना हुआ है. जबकि कुछ इलाकों में AQI लेवल 300 से ऊपर और 400 के बीच में बना हुआ है.
ये भी पढ़ें:",0.0
"CG Weather Update: छत्तीसगढ़ में गर्मी की आहट तेज, दिन और रात के तापमान में बढ़ा अंतर - Amar Ujala",https://news.google.com/rss/articles/CBMi1wFBVV95cUxNYzFhRVhQYWx1TDRJRUNmdWdnaXQ0MmZqeTUtMVQwODdxSWtGUkpKMHFSVE5NSGUzV3hGNFl0UTI4bThDM0U0Zkh5b182QWNnbHBHeTBEUk1EYm9MenQtU19YTmw0OEM5SVlsYllfNXpXX3VteHFTUVBWU1d0ek5aV3hiNUVoMm1Senp0T2JwdkRXSXVIQkpxVFVSbkx0cWVXNjlleVpKeEdVeDZ5czJoMVVaT3NXQzdHTmZoWTFyYXRWbnVrR3JITUdoSUthR2VkNDVIMUcxUdIB3AFBVV95cUxQZ202YjVOdlIybl9qcGZyVXByeTlWNnpkcFBiczVONThkdnRBanhiZVlZZHRLUGsxRGdoRUx3T3FiUzFPd19HTy1wUC1vRUJMLWxYSHRkbGtJaldhbXJZVWxEeVhPblNYSHJMR0ViSWxzd1ZGbTYyNFBBYm1DeDJvbmJYZnE4RFJvOUtUakdMcTZqOEtZN0x1ZWxQWnVKbW9YNV80amVBeWZvaUtrT2FUZHFIMEFkZFNVWUxVUnJETnBBbUNITTlMalVRZTVBMnVQUV82X2JMVzFhWHE5?oc=5,Amar Ujala,2026-02-12T10:24:39+05:30,hi,Andaman and Nicobar Islands,,"(लू OR ""लू चलना"" OR ""भीषण गर्मी"" OR ""प्रचंड गर्मी"" OR ""कड़ी धूप"" OR ""तेज धूप"" OR ""गर्म हवा"" OR ""उष्ण लहर"" OR ""ताप लहर"" OR ""हीट वेव"" OR ""झुलसाने वाली गर्मी"" OR ""तपती गर्मी"" OR ""भयंकर गर्मी"" OR ""गर्मी का कहर"" OR ""गर्मी का प्रकोप"" OR ""अत्यधिक गर्मी"") Andaman and Nicobar Islands","{""_id"":""698d5d07ba6275a03d0f1933"",""slug"":""heat-wave-intensifies-in-chhattisgarh-difference-between-day-and-night-temperatures-widens-2026-02-12"",""type"":""story"",""status"":""publish"",""title_hn"":""CG Weather Update: छत्तीसगढ़ में गर्मी की आहट तेज, दिन और रात के तापमान में बढ़ा अंतर"",""category"":{""title"":""City & states"",""title_hn"":""शहर और राज्य"",""slug"":""city-and-states""}}
CG Weather Update: छत्तीसगढ़ में गर्मी की आहट तेज, दिन और रात के तापमान में बढ़ा अंतर
विज्ञापन
सार
छत्तीसगढ़ में मौसम ने करवट ले ली है। वातावरण में नमी बढ़ने से दिन के तापमान में उल्लेखनीय बढ़ोतरी दर्ज की जा रही है, जबकि रातें अपेक्षाकृत ठंडी बनी हुई हैं। इसका असर यह है कि कई शहरों में दिन का तापमान रात की तुलना में लगभग दोगुना महसूस हो रहा है।
विज्ञापन
विस्तार
छत्तीसगढ़ में मौसम ने करवट ले ली है। वातावरण में नमी बढ़ने से दिन के तापमान में उल्लेखनीय बढ़ोतरी दर्ज की जा रही है, जबकि रातें अपेक्षाकृत ठंडी बनी हुई हैं। इसका असर यह है कि कई शहरों में दिन का तापमान रात की तुलना में लगभग दोगुना महसूस हो रहा है।
मौसम वैज्ञानिक एच.पी. चंद्रा ने बताया कि 77 डिग्री पूर्व देशांतर और 30 डिग्री उत्तर अक्षांश के आसपास मध्य एवं ऊपरी क्षोभमंडल में एक पश्चिमी विक्षोभ सक्रिय है। हालांकि इसका प्रदेश के मौसम पर तत्काल कोई विशेष प्रभाव नहीं पड़ेगा। 12 फरवरी से न्यूनतम तापमान में भी खास परिवर्तन की संभावना नहीं जताई गई है।
मौसम विभाग के अनुसार रायपुर, बिलासपुर, दुर्ग, जगदलपुर, अंबिकापुर और पेंड्रा में दिन का तापमान सामान्य से लगभग 2 डिग्री अधिक रहा। फिलहाल मौसम शुष्क बना रहने की संभावना है और अगले सात दिनों में किसी बड़े बदलाव के संकेत नहीं हैं।
बीते 24 घंटों में रायपुर प्रदेश का सबसे गर्म शहर रहा, जहां अधिकतम तापमान 32.8 डिग्री सेल्सियस दर्ज किया गया। वहीं, अंबिकापुर में न्यूनतम तापमान 8.4 डिग्री सेल्सियस रहा, जो राज्य में सबसे कम रहा। इस दौरान प्रदेश में कहीं भी वर्षा दर्ज नहीं की गई।
राजधानी रायपुर में गुरुवार को सुबह के समय हल्की धुंध रह सकती है। दिन का अधिकतम तापमान लगभग 32 डिग्री सेल्सियस और न्यूनतम तापमान 16 डिग्री सेल्सियस के आसपास रहने का अनुमान है। कुल मिलाकर आने वाले दिनों में प्रदेश में शुष्क और सामान्य से थोड़ी गर्म स्थिति बनी रह सकती है।
Trending Videos
मौसम वैज्ञानिक एच.पी. चंद्रा ने बताया कि 77 डिग्री पूर्व देशांतर और 30 डिग्री उत्तर अक्षांश के आसपास मध्य एवं ऊपरी क्षोभमंडल में एक पश्चिमी विक्षोभ सक्रिय है। हालांकि इसका प्रदेश के मौसम पर तत्काल कोई विशेष प्रभाव नहीं पड़ेगा। 12 फरवरी से न्यूनतम तापमान में भी खास परिवर्तन की संभावना नहीं जताई गई है।
विज्ञापन
विज्ञापन
मौसम विभाग के अनुसार रायपुर, बिलासपुर, दुर्ग, जगदलपुर, अंबिकापुर और पेंड्रा में दिन का तापमान सामान्य से लगभग 2 डिग्री अधिक रहा। फिलहाल मौसम शुष्क बना रहने की संभावना है और अगले सात दिनों में किसी बड़े बदलाव के संकेत नहीं हैं।
बीते 24 घंटों में रायपुर प्रदेश का सबसे गर्म शहर रहा, जहां अधिकतम तापमान 32.8 डिग्री सेल्सियस दर्ज किया गया। वहीं, अंबिकापुर में न्यूनतम तापमान 8.4 डिग्री सेल्सियस रहा, जो राज्य में सबसे कम रहा। इस दौरान प्रदेश में कहीं भी वर्षा दर्ज नहीं की गई।
राजधानी रायपुर में गुरुवार को सुबह के समय हल्की धुंध रह सकती है। दिन का अधिकतम तापमान लगभग 32 डिग्री सेल्सियस और न्यूनतम तापमान 16 डिग्री सेल्सियस के आसपास रहने का अनुमान है। कुल मिलाकर आने वाले दिनों में प्रदेश में शुष्क और सामान्य से थोड़ी गर्म स्थिति बनी रह सकती है।",0.0
This Microphone Made of Glass Can Survive Extreme Heat and Electromagnetic Chaos - SciTechDaily,https://news.google.com/rss/articles/CBMiqgFBVV95cUxQSm9HNXh3dGxES29NRkw0cEQwVVRWYjg5ZWp6VEIwbUVacVpUSExrbmhzOFlZTmFXbDFzay0xQ2VRYldYdEVmWUI5NGhsNWxtRm80U0s3NWFnVjZHNGttb1Rkc1BTcl9rNnRuQjRMaTJPYVJvVV9iT085Y2NGaTZURzBEQWNPVHJ0WU1pOU8ydi1QUi10Mnh0R2g3Y1FuakpFdVhnOE9kalNYZw?oc=5,SciTechDaily,2026-02-12T04:52:31+05:30,en,Andaman and Nicobar Islands,,"(heatwave OR ""heat wave"" OR ""severe heatwave"" OR ""extreme heat"" OR ""heat spell"" OR ""scorching heat"" OR ""blistering heat"" OR ""sweltering heat"" OR ""hot winds"" OR loo OR ""hot loo winds"" OR ""intense heat"" OR ""unbearable heat"" OR ""deadly heat"") Andaman and Nicobar Islands",,0.5166666666666666
