title,url,source,date,language,state,district,search_term,full_text,relevance_score
Football in sun and without shadow: How extreme heat puts tomorrow’s stars at risk - Eco-Business,https://news.google.com/rss/articles/CBMitgFBVV95cUxQWnk4WFJMRG95TEZkSFhqUF9pSFdySjJ3SFM5a3IxWHNuXzBCQVhqX2hQTVNfZ1VxbkdUQlNSRVl4eEhpeG5TMmpoS3VHRnpHUGJrb09xeHhFWEczSTJVN09nQXJELVB4enBRQnhralBoMWdvNFlHdjNqajBiR192VzBwMmtOQjM0dlI5SEU3bllvRGdRdlJPZ1A5QjhuUHhRYnZQT3lFY1g2VkRCTVNXRlAwSmVKQQ?oc=5,Eco-Business,2026-02-12T13:24:00+05:30,en,Andaman and Nicobar Islands,,"(heatwave OR ""heat wave"" OR ""severe heatwave"" OR ""extreme heat"" OR ""heat spell"" OR ""scorching heat"" OR ""blistering heat"" OR ""sweltering heat"" OR ""hot winds"" OR loo OR ""hot loo winds"" OR ""intense heat"" OR ""unbearable heat"" OR ""deadly heat"") Andaman and Nicobar Islands","It was 33°C when, during a day of trials for Paraguay’s Cerro Porteño youth team, a 16-year-old collapsed. He was one of hundreds who had arrived on 21 November 2025, dreaming of playing for one of the country’s most popular sports institutions. He suffered a cardiac arrest and had to be saved by the club’s medical staff.
Uruguayan writer Eduardo Galeano called football, not only the most popular sport in the world, but “the music of the body, the festival of the eyes”. It is a beloved hobby of hundreds of thousands of children and teenagers worldwide.
But extreme heat is putting their well-being at risk. Researchers, coaches and scientists are now racing to find solutions, ranging from early warnings and awareness campaigns to banning synthetic pitches that trap heat.
Heat in the home of the world champions
The adult game is also struggling with heat. High temperatures in the United States for the 2024 Copa America forced the South American Football Confederation (Conmebol) to redraw its protocol for medical staff.
A report published last year by Football for Future warned that 14 of the 16 stadiums due to host games at this year’s men’s World Cup in Mexico, Canada and the US exceed “safe-play thresholds” for climate hazards, including extreme heat.
“
It is not enough to issue general alerts in the media or on social networks in the event of extreme temperatures. This information must be strategically communicated to those who have the trust of others in these communities, such as mothers and coaches.
Gregory Wellenius, researcher, Boston University School of Public Health
But children are known to be more vulnerable to heat than adults. In 2023, all summer youth sports matches in Paraguay were suspended between 10 am and 5 pm due to high temperatures. In Argentina, several local leagues made similar decisions, postponing games due to the heat.
The suspensions in these two countries occurred during a heatwave made 60 times more likely by climate change. One of the places affected was the city of Rosario in Argentina, home to a club where two world champions, Diego Maradona and Lionel Messi, played: Newell’s Old Boys.
The coordinator of Newell’s youth divisions, Gustavo Tognarelli, believes the impact of heat “is not yet on the agenda in our institutions” and more clubs need to take it seriously. Tognarelli oversees more than 400 children and adolescents playing for the club and says that the summer heat in Argentina is “difficult”.
According to the latest Lancet Countdown report, the Latin American region has experienced an increase of hundreds of hours per year, as compared to 1991-2000, during which walking and running pose a health risk.
“The impact is noticeable in training. It’s not the same for a child who trains at eight in the morning as it is for another who trains at ten,” Tognarelli told Dialogue Earth.
The recent trend towards synthetic turf pitches has complicated things, he says. They hold up better on rainy days, but “generate much more heat on the pitch”.
Iván Vázquez, director of the youth divisions at Club Olimpia in Paraguay, is even more emphatic: “Synthetic turf pitches should be banned here. The temperatures can hurt the children’s feet, causing burns when they fall.”
In addition to training, a constant challenge for youth teams is children having to play on the same day on the same pitch due to infrastructure and transport issues. This can necessitate some children playing during the hottest part of the day, creating problems for complying with guidance on heat exposure put out by health officials and football federations.
Ariel Ramírez, media coordinator for Conmebol, which governs professional football of all ages in South America, says it “controls high temperatures in its tournaments through strict medical protocols that include monitoring humidity and ambient temperature with specialised equipment”.
Drinks breaks are mandatory above certain temperatures, along with pre-match medical examinations, acclimatisation and education on heatstroke. This protocol also applies to youth tournaments. It was in force when the 16-year-old collapsed in Paraguay last November. But application can be patchy. A 2018 study warned that ambulances were consistently absent during training sessions and youth matches in Paraguay’s local leagues.
Children at risk
Conmebol originally developed its protocol for the 2016 Copa América in the United States.
Successive football tournaments in the Americas have drawn criticism for their approach to extreme heat. The organisation had to update and broaden its protocol for the 2024 Copa América, also in the US, in response to growing evidence on the impact of playing in summer conditions. Despite the new protocol, a referee collapsed in that tournament during one of the nine matches played in dangerously hot conditions.
Gregory Wellenius, a researcher on climate change and environmental health at Boston University School of Public Health, points out that in youth football, the challenge goes beyond having protocols, controlling schedules and playing surfaces.
Cities such as Boston, which will host games at the next World Cup, have protocols and alerts for extreme-heat situations. But these are “designed for the general population” and “certainly not children and young footballers”, he says.
“Children are not small adults; they are thermodynamically different. They sweat differently, and sweating is the mechanism humans have to cool the body,” Wellenius explains.
Places that historically did not have high temperatures face greater problems in adapting their infrastructure, Wellenius says. “What may be common in Houston or Central America is not so common in cities like Boston, which used to be cooler and now experiences heat waves.”
In addition to physiology and infrastructure, Wellenius believes it is essential to remember that children are also “less likely to know when to stop” when they get too hot in competitive environments.
The full impact of heat on children and adolescents is still unknown. “We don’t really know the long-term impact of exposure to extreme heat on children,” says the researcher. “What happens to their bodies if they are constantly under pressure from high temperatures?”
Adapting at home – and in the stands
Philip Jenkins, one of the lead authors of the Football for Future report on the perils of the coming World Cup, says: “Our analysis shows that by 2050, extreme heat in stadiums will become the new normal, with almost 90 per cent needing to adapt to cope.”
The report focussed on stadiums hosting this and the next two World Cups as well as grassroots stadiums linked to World Cup legends, such as those where Lionel Messi and Pelé began their careers. In some of these stadiums, football matches and training will be severely disrupted by extreme temperatures by 2050, for as many as two months per year, the report found.
Faced with this “new normal”, coaches and researchers say there is no silver-bullet solution.
Cooling breaks and leaving behind synthetic turf pitches in favour of natural grass could help. But more broadly “the region needs to develop early-warning systems for extreme heat” says Francisco Chesini, a public health researcher at the University of Buenos Aires and part of the Global Heat Health Information Network.
Such systems are already implemented in countries including Spain, where local-level forecasts and temperature thresholds trigger a comprehensive response from authorities and health officials. The United Nations launched an initiative in 2022 for a worldwide adoption of early-warning systems by the end of 2027. Paraguay already aims to develop one as part of its climate policy, pending funding.
“There is still a long way to go to raise awareness of the need to invest in infrastructure,” says Tognarelli.
But, he adds, “It is an investment, not an expense. Our role must be to protect and provide comprehensive training for these children.”
Wellenius says adapting is not about eliminating risks but about empowering people to make informed decisions. There is an untapped opportunity, he says, to use football communities not only to protect children and adolescents in sport, but also to advance understanding and the need for public policies on heat.
“People know that heat is a problem, but they don’t think it’s their problem,” he says, “It is not enough to issue general alerts in the media or on social networks in the event of extreme temperatures. This information must be strategically communicated to those who have the trust of others in these communities, such as mothers and coaches.”
As well as the music of the body and the festival of the eyes, football may also have the power to change minds on climate risks and the need for action.
This article was originally published on Dialogue Earth under a Creative Commons licence.",1.0
Animals at Sao Paulo Zoo have special conditions during heatwave - TV BRICS,https://news.google.com/rss/articles/CBMimgFBVV95cUxNaEJ0VmI5TnByQWF2UjFpeHg0cU45cGpwNFNrV1JLajRvLV9PNVM4SjducG45cUswempha3BJcEg2MHJJTm5UUTJjWUxHSGFuQ2dxYnZpNTNNbVRaSlFKNVJ0d21Wa09BQWNHT0J5LUdYcDBxZnVHaV9ncUtCcTJ3Y0d6QndXcXpvWGQzbTlHdUlGVmd5YXh3MUtn?oc=5,TV BRICS,2026-02-12T15:31:48+05:30,en,Andaman and Nicobar Islands,,"(heatwave OR ""heat wave"" OR ""severe heatwave"" OR ""extreme heat"" OR ""heat spell"" OR ""scorching heat"" OR ""blistering heat"" OR ""sweltering heat"" OR ""hot winds"" OR loo OR ""hot loo winds"" OR ""intense heat"" OR ""unbearable heat"" OR ""deadly heat"") Andaman and Nicobar Islands",,0.5166666666666666
"Andhra Pradesh, Telangana Weather LATEST Update: Rain, Heatwave Forecast For Summer Issued - Asianet Newsable",https://news.google.com/rss/articles/CBMi2gFBVV95cUxNODVaTlktbnBkR1BPZFdvd21XZ2xwQXJ5bzFIY3hVOTFVekE2RTRoOXdORGg4a0NuYVJlN0ltcWtRcV9VRmpkNktCNnJTZ1RoSzkyQzB4VmZVQlo3eWRoRm1tM2wwUUFSemhmOGRjS01JYXo5bllNTWhlRTI5LWNYZnFXZ3ItT1NuSWpiWUJ0ZTNMZHFweFcwOEo0TV9Uc0JHUThZVVQ0ZFNmdXpNVUR2bDIwQ2ZMQnJNT0steWMxd2JIRUFnWEp1Wm9KQkhyNWxjQ0Y0SktQTHpud9IB3wFBVV95cUxOUWxQQTlVTXg2S2R3MTdEWVRPRFNCYW81TUhTX0txcl9XU3ItZHFTLWEtNGdMVUpwZEJ3dWRER1JXXzhHdnlzdEFTSzFQS3ZQbkJMWFoxdFgzY0dIZU93RnVqTm9SeHVyYW5oVkFzUmlXay1oRjVmYktCYnp1UXhiM1JtRDdfTWd5U09BZ1BDT0V3SXFNTGVDV0ZNTTZja25JOUNfS3NreERBNVdpbUlPU2RNS3ktYWdiVEVmR3hPVEpFcXNkUDBRRVdwMHBrTkxORVZzWTdJVW9Xb3ZlSTYw?oc=5,Asianet Newsable,2026-02-12T08:47:29+05:30,en,Andaman and Nicobar Islands,,"(heatwave OR ""heat wave"" OR ""severe heatwave"" OR ""extreme heat"" OR ""heat spell"" OR ""scorching heat"" OR ""blistering heat"" OR ""sweltering heat"" OR ""hot winds"" OR loo OR ""hot loo winds"" OR ""intense heat"" OR ""unbearable heat"" OR ""deadly heat"") Andaman and Nicobar Islands","Andhra Pradesh, Telangana Weather LATEST Update: Rain, Heatwave Forecast For Summer Issued
Andhra Pradesh, Telangana Weather LATEST Update: Winter is pretty much over.. summer has begun. The Telangana Weatherman predicts that rains will also pick up during this time. Here's what this summer is expected to be like
Rains are inevitable in summer..
Wondering about rain in summer? It happens, and this year it's starting early. The Telangana Weatherman says Feb, Mar, and Apr will see both sun and rain due to the El Niño effect.
Rains this month...
Half of February is already over... the cold has reduced and the heat has started. According to the Telangana Weatherman, in the coming days, not only will the heat intensify, but rains will also start here and there. He warns that there will be rain for three months... and then the real summer will begin. The Weatherman revealed that May and June will see scorching heat with very high temperatures recorded.
SUMMER 2026 PRELIMINARY FORECAST
EL- NINO IS COMING 🔥
The first half of summer which includes Feb 2nd half, March, April will be RAINY and normal summer heat is expected 🌧️
The second half of summer will be DRIER with MASSIVE HEATWAVES expected during May, June 1st half 🔥…— Telangana Weatherman (@balaji25_t) January 16, 2026
2023 situation in 2026...
The Weatherman warns that 2023's weather patterns will repeat, with a longer summer. The southwest monsoon will be delayed, meaning unavoidable heat and humidity until it arrives.
Cold for another two days...
Currently, the Hyderabad Met Centre says minimum temps may drop 2-3 degrees in the next 2 days, with dry weather continuing. On Feb 12, some districts will see 11-15°C temps.
Lowest temperatures in Telangana are here..
On Feb 11, the lowest temperatures were 12.8°C in Medak and 13.7°C in Adilabad. Other areas saw temps from 15.8°C to 18°C. The highest was 32.5°C in Adilabad and Nizamabad.
Stay updated with the Breaking News Today and Latest News from across India and around the world. Get real-time updates, in-depth analysis, and comprehensive coverage of India News, World News, Indian Defence News, Kerala News, and Karnataka News. From politics to current affairs, follow every major story as it unfolds. Get real-time updates from IMDon major cities weather forecasts, including Rain alerts, Cyclonewarnings, and temperature trends. Download the Asianet News Official App from the Android Play Store and iPhone App Store for accurate and timely news updates anytime, anywhere.",0.6833333333333333
"'Heavy, intense rainfall' warning for south-east Qld after sweltering heatwave - Australian Broadcasting Corporation",https://news.google.com/rss/articles/CBMiqgFBVV95cUxNWFZFVi1kOWVpYUtQcWtTalhpVUc3YU56TDM0NW9mRWFXNDNLSzA1c3p0QTdrQlFyTHpCLS1wZU5QTVZwVzdEYzFyOHkzVjZ4bUpuQ3A0RGJwQXVCc0pHUFZIWGQ2UXVkc29FTUV2UkhHUDJ2ejBUNHBScm5uLS0yb25nUm15WUZ6R2c4dUl3R0lMbmExUTExa1d2YTJWTmo0TVFNR1V2WjVmQQ?oc=5,Australian Broadcasting Corporation,2026-02-12T01:35:08+05:30,en,Andaman and Nicobar Islands,,"(heatwave OR ""heat wave"" OR ""severe heatwave"" OR ""extreme heat"" OR ""heat spell"" OR ""scorching heat"" OR ""blistering heat"" OR ""sweltering heat"" OR ""hot winds"" OR loo OR ""hot loo winds"" OR ""intense heat"" OR ""unbearable heat"" OR ""deadly heat"") Andaman and Nicobar Islands","In short:
A severe weather warning for heavy, locally intense rainfall in south-east Queensland has been issued by the weather bureau.
It warns the soaking rains could lead to flash flooding in some areas.
What's next?
The heavy rain is due to begin this afternoon and evening and continue through the weekend.
South-east Queensland is being warned to expect ""heavy, locally intense rainfall"" that will top 150 millimetres in some areas from this afternoon as the region endures scorching hot conditions.
The soaking rains could lead to flash flooding.
The severe weather warning issued at lunchtime covers towns from the Sunshine Coast to the New South Wales border and west beyond Toowoomba.
""Heavy, locally intense rainfall, which may lead to dangerous and life-threatening flash flooding is forecast to develop about the south-east coast from late Thursday evening,"" it reads.
""Six-hourly rainfall totals between 50mm to 90mm are likely, with isolated higher falls to around 150mm possible.""
The warning names the Gold Coast, Toowoomba, Brisbane, Dalby, Kingaroy, Caboolture, Ipswich, Gatton, Cleveland, Cherbourg, Jimboomba and Kilcoy as potentially affected areas.
Parts of Brisbane could cop 150mm
Today, senior forecaster Liam Smart said Brisbane could expect ""isolated totals of upwards of 150mm"" tomorrow.
""We're talking about some big falls on the forecast for tomorrow,"" he said.
""We're currently looking for the Brisbane area, a good 25 per cent chance of 120mm of rainfall.
""There could even be isolated totals of 150mm at times.
""And as that pushes into Saturday, the risk does decrease for higher falls, but they're still generally quite high, especially considering we've had a pretty dry January.""
The Queensland capital could be drenched by up 210mm from Friday to Sunday if rainfall reaches the higher numbers forecast by the weather bureau.
Minor flooding is possible for some catchments across south-east Queensland, as well as in the Wide Bay and Burnett region.
An initial flood warning has been issued.
Catchments likely to be affected include the Dawson and Don Rivers, Mary River, Upper Brisbane River, Lower Brisbane River and Logan and Albert Rivers.
In western Queensland, minor flood warnings have been issued for the Cooper Creek at Windorah and the Diamantina River at Birdsville.
A severe thunderstorm warning has been issued for areas around Tara in the Darling Downs and Granite Belt, along with north-west of Roma in Warrego and the Central Highlands and Coalfields.
South-east swelters
The promise of rain follows heatwave conditions that have pushed temperatures as high as 9 degrees above average.
Surfers Paradise on the Gold Coast hit 35 degrees Celsius at 1pm, and Boonah in the Scenic Rim reached 37 degrees, three above the forecast maximum.
On the Sunshine Coast, Mooloolaba reached 33C, while on the southern downs, Toowoomba is expected to peak at 34C through the afternoon.
Thunderstorms in the west, low brewing off FNQ coast
Shower and storm activity are also anticipated in the state's west, with decent rainfall expected from the border and Mount Isa through to Longreach and moving east to Charleville and Roma.
This morning, the BOM issued a severe thunderstorm warning for far south-west Queensland, with heavy rainfall expected to affect Ballera, Orientos and Nappa Merrie.
Mr Hayes said the activity was being driven by a significant trough lying through inland parts of the state.
""Pushing into the Channel country, we're starting to see shower and storm activity that will deliver increased activity through the day,"" he said.
""That will become fairly widespread and deliver potentially severe thunderstorms through parts of the south-east, particularly on Friday.""
Meteorologists are keeping a close eye on a tropical low building in the Coral Sea east of Townsville.
The system, 23U, is generating thunderstorm activity offshore that is likely to deliver rainfall over the Cape York vicinity.
Mr Hayes said the low itself remained weak for now.
""It could move closer to the Queensland coast over the weekend, which is potentially when we'll see heavier falls around the Townsville to Mackay area,"" he said.",1.0
County Heat Action Plan aims to keep neighborhoods cool - Beverly Press & Park Labrea News,https://news.google.com/rss/articles/CBMikwFBVV95cUxNN1M5bG5hVUxLQ0FQX1dOQzJHSHh1MXFOd2VpRFZPNm1sckQwR0Y0TTBXOHg2UHlZMERtM3FtNEhSaVZqeVRWMS14SHU1RjE3TUVLTVRQNW9EM29paGlQckd1U0FzMXhhVzNNWm9Hb2pDYThqaGNaTEFmMUQwaGhJMUZRTTN5NUtvY09wZlcxVTB2QUU?oc=5,Beverly Press & Park Labrea News,2026-02-12T07:22:50+05:30,en,Andaman and Nicobar Islands,,"(heatwave OR ""heat wave"" OR ""severe heatwave"" OR ""extreme heat"" OR ""heat spell"" OR ""scorching heat"" OR ""blistering heat"" OR ""sweltering heat"" OR ""hot winds"" OR loo OR ""hot loo winds"" OR ""intense heat"" OR ""unbearable heat"" OR ""deadly heat"") Andaman and Nicobar Islands",,0.5166666666666666
Family: Arizona man died after hospital discharge in extreme heat despite mental state - AZ Family,https://news.google.com/rss/articles/CBMiuwFBVV95cUxQdjBLYnE2QUF5ZkdFWkhJRlNiOXZKbVNvWUhXN3BEMmFiUC1nYU5DQ2ppazJ0ZnlQUTA1ZnRId2xORExod1RXeW9FQ21ZX0RNMkFxX083VXczRDNJMWc1QkFvSVJxaTNDdzJPQzJ2a25xQU1xLTYyRjhMbGhVdHBPZmoyTmtsM3ByOVlHUkMxMkIwRHlYYU9MTW0zSHFpeFBMZUk3WkJ6WDdjVHpnRWd5ck9yRGhfRnd3OWNn0gHPAUFVX3lxTFBVT3dEdFQ3eFctQWZkbGxlTmtuemdLMUhyTEVKdDRpUE9GSEVxTW9FRG9pQTJGekJ5MmNWckJFREY0UFFHb1R1SVFKaVQ1VG5UME1sS2wxS2VLRzRyQ3ZUTzg1VGtyUGV0d1h1ZDZaVWFGOVBWVzR1clA0VC1NV3QtRldpSlVKZ2x6Qmx2b3RpVHN6T0xFMHhmVDcyd1lvYklfWmJlZjE4eXk3bnVvYXMxa19Dc1FOM3NGbXl4ako1b2kwSkFrRTc0UDdYNDJBUQ?oc=5,AZ Family,2026-02-12T06:02:00+05:30,en,Andaman and Nicobar Islands,,"(heatwave OR ""heat wave"" OR ""severe heatwave"" OR ""extreme heat"" OR ""heat spell"" OR ""scorching heat"" OR ""blistering heat"" OR ""sweltering heat"" OR ""hot winds"" OR loo OR ""hot loo winds"" OR ""intense heat"" OR ""unbearable heat"" OR ""deadly heat"") Andaman and Nicobar Islands","PHOENIX (AZFamily) — A Valley family is suing a Phoenix-area hospital after their son died hours after being discharged alone in triple-digit heat, despite warnings he was too confused to care for himself.
Kaelen Lachica, who had been battling anorexia for nine years, was showing signs of recovery and rebuilding his life when he was admitted to the hospital in August. But within days, his mental state deteriorated dramatically, according to his parents, Seth and Gayle Lachica.
“I’m sure that he will die if you let him go,” Seth Lachica told hospital staff, making clear he held medical power of attorney and that his son was confused, hallucinating and unable to make his own medical decisions.
Hours later, just before sunrise, Abrazo Medical Center discharged Kaelen anyway; not to his home address clearly listed in his chart, but alone in an Uber to a downtown Phoenix homeless shelter.
Police body camera video shows what happened next. Kaelen was found lying on a Phoenix sidewalk, his core temperature at 107 degrees. He was pronounced dead hours later.
‘Everything Changed’
For years, Seth and Gayle watched their son struggle with anorexia. But in the year leading up to his hospitalization, Kaelen finally appeared to be winning the battle.
“He started to gain weight. He started to do the right things. He started to overcome it,” Seth said. “And his daily routine was driving his golf cart down to the gym.”
Then came August and the hospital admission. Seth said his son’s mental state declined rapidly during his stay.
“He just kept saying, ‘burn the books. You get it, dad, burn the books,’” Seth recalled, describing his son’s confused state and hallucinations.
Seth made his concerns explicit to hospital staff, emphasizing his authority as medical power of attorney and his conviction that discharging Kaelen would be life-threatening.
A Desperate Search
Instead of listening to the father’s warnings, hospital staff discharged Kaelen early in the morning, putting him in an Uber to the shelter rather than allowing him to return home.
“They sent him to Phoenix and dumped him on the sidewalk with an Uber,” the family said in a statement.
Seth, unaware his son had been discharged, spent hours searching downtown Phoenix. He eventually found Kaelen collapsed on a sidewalk.
“I knew, like I could see that he was gone,” Seth said. “They were doing CPR and I knew his heart that it had to have been stopped.”
A Call for Change
The Lachicas’ lawsuit against Abrazo Medical Center centers on what they describe as an inexplicable and preventable tragedy. But their motivation extends beyond seeking accountability.
“This doesn’t need to happen again. This is just inexcusable,” Gayle said.
The family is sharing Kaelen’s story and pursuing legal action in hopes of preventing other families from receiving the same devastating phone call.
“I want them to feel embarrassment and regret at what they did,” Seth said.
When contacted for comment, Abrazo Health did not provide a statement.
See a spelling or grammatical error in our story? Please click here to report it.
Do you have a photo or video of a breaking news story? Send it to us here with a brief description.
Copyright 2026 KTVK/KPHO. All rights reserved.",0.5166666666666666
