title,url,source,date,language,state,district,search_term,full_text,relevance_score
GHMC Issues Heat Wave Precautions - Deccan Chronicle,https://news.google.com/rss/articles/CBMioAFBVV95cUxPTkctRHlXbUZ1ZUo4TE5PY1dwSzRpdldzRzdBSnhiaWtTZjRCdzY5clM5aHBNN3EtT3BJcy05Yjc4VmdlTkVBQ045LVVTZWhiX0hCelBUY1JhdjB2S1RlOW9mbE5WNmF0eUZJdUc5eWFrellUWWVzWDZLWUM2TTZhUGVQdExHZlNvNFV5MlJyX1dYSUhxUXBodnRDNDRZc3BD0gGmAUFVX3lxTFBDUmQ1VFlzZjdzSTdNVzRZOXdlelltWkRSdnNRbFFUTHZrTlAzamZRYkY2QjhKaUNLQVQtLVk4ZmxRRl9DZVJKdHFBWU81Vy1teGczamlHZWlqY3ZVVmx5VWxEMHZRM21Rd2ZZWl9Ed2JnMndISlVXN1Z1WmZTdWRPOC1oTVRBeGx0UGhpTGhmOHJZeWFjSEs3T2QtRVRLMmlSem93U0E?oc=5,Deccan Chronicle,2026-04-17T20:34:39+05:30,en,Telangana,Hyderabad,"(heatwave OR ""heat wave"" OR ""severe heatwave"" OR ""extreme heat"" OR ""heat spell"" OR ""scorching heat"" OR ""blistering heat"" OR ""sweltering heat"" OR ""hot winds"" OR loo OR ""hot loo winds"" OR ""intense heat"" OR ""unbearable heat"" OR ""deadly heat"" OR heat OR ""weather forecast"" OR ""weather update"" OR ""weather alert"" OR ""IMD forecast"" OR ""IMD prediction"" OR ""IMD alert"" OR IMD OR ""rising temperatures"" OR ""temperatures expected to rise"" OR ""relief from heat"" OR ""respite from heat"" OR ""heat respite"" OR ""respite from scorching heat"") Telangana","The Union health ministry has cautioned that insufficient hydration during heatwaves impairs the body’s ability to cool itself, increasing the risk of heat stroke.
Hyderabad: With heatwave conditions intensifying in the city, the Greater Hyderabad Municipal Corporation (GHMC) has urged citizens to stay alert and take precautions. The Corporation advised limiting outdoor activities between 12 pm and 4 pm, staying hydrated, wearing light clothing, and ensuring care for children and the elderly.",1.0
అలర్ట్: తెలంగాణలో నిప్పుల వర్షం.. 45 డిగ్రీల రికార్డ్ బ్రేక్! - hmtvlive.com,https://news.google.com/rss/articles/CBMipAFBVV95cUxOdHRidnZjSnQyYTR4d0lGTXJ6MzFsQkVtVko5UnhSNzFYME1FVkxBWGRCMExQa1Roa0RPTFd2Z0RZa1M0N0xkZXd6VUdTckEwY2lyUDBDQVRPMy12cHJTUVJfNkhJUVRxSVB1WEdnbk9RdVp1c2tieTBONXBxM0loem5uOVRhWllQQVVEN21LUlFySUEtMzh5RG9KUFcwUU12ZzFEUtIBqgFBVV95cUxNZDd6bXU1WWhvTTd3OFFpSmd0ZGs1UURrbFJULWJmakpIYS1fbDhSY3V0ZGhTRG9LTktkRUx3aWRxQ0MtcUd0cmlCUU1tQm5RY0g4cGFqMURWVHhkV2FmLVNHQTF6VjZVSEhCTnd2eThKc29PZnpDUWxsZHlKMEFxZXBzUnFNZ2diWVUzNkJ6ZklBakphMi1vZEI2X2JRRHctUlNKMkhXSUI2Zw?oc=5,hmtvlive.com,2026-04-17T14:40:57+05:30,te,Telangana,Hyderabad,"(""వడ గాలులు"" OR ""ఎండ వేడి"" OR ""భారీ ఎండలు"" OR ""హీట్ వేవ్"" OR ""ఉష్ణ తరంగం"" OR ""కడ ఎండలు"" OR మండుటెండ OR ""ఎండల తీవ్రత"" OR ""అసాధారణ ఎండలు"" OR ""తీవ్ర ఎండలు"") Telangana","అలర్ట్: తెలంగాణలో నిప్పుల వర్షం.. 45 డిగ్రీల రికార్డ్ బ్రేక్!
Telangana: తెలంగాణ రాష్ట్రంలో ఎండల తీవ్రత గరిష్ట స్థాయికి చేరుకుంది. నిన్నటి మాదిరిగానే నేడు కూడా వడగాల్పుల తీవ్రత ఏమాత్రం తగ్గదని, ఉష్ణోగ్రతలు ప్రమాదకర స్థాయిలో నమోదు కావచ్చని వాతావరణ శాఖ హెచ్చరించింది.
Telangana: తెలంగాణ రాష్ట్రంలో ఎండల తీవ్రత గరిష్ట స్థాయికి చేరుకుంది. నిన్నటి మాదిరిగానే నేడు కూడా వడగాల్పుల తీవ్రత ఏమాత్రం తగ్గదని, ఉష్ణోగ్రతలు ప్రమాదకర స్థాయిలో నమోదు కావచ్చని వాతావరణ శాఖ హెచ్చరించింది. ఎండల వేడికి తోడు సాయంత్రం రాబోయే అకాల జల్లులు మరింత ఉక్కపోతను పెంచుతూ ప్రజలను తీవ్ర ఇబ్బందులకు గురిచేసే అవకాశం ఉంది.
నిప్పుల కొలిమిలా మారిన రాష్ట్రం
తెలంగాణవ్యాప్తంగా ఎండలు తీవ్ర రూపం దాల్చాయి. ఉత్తర , దక్షిణ తెలంగాణ జిల్లాల్లో పరిస్థితి అత్యంత ఆందోళనకరంగా ఉంది. ఈ ప్రాంతాల్లో ఉష్ణోగ్రతలు 43 డిగ్రీల నుండి 45 డిగ్రీల సెల్సియస్ వరకు నమోదయ్యే అవకాశం ఉంది. అటు రాజధాని హైదరాబాద్లో కూడా వేడి సెగలు కొనసాగుతున్నాయి. నగరంలో 41 నుండి 43 డిగ్రీల మధ్య ఉష్ణోగ్రతలు నమోదవుతాయని అధికారులు అంచనా వేస్తున్నారు. నిన్నటి కంటే పరిస్థితి మెరుగుపడే సూచనలు కనిపించడం లేదు.
PEAK HEATWAVE conditions to continue even today with no improvement expected similar to yesterday
— Telangana Weatherman (@balaji25_t) April 17, 2026
North, South TG - 43-45°C ⚠️
Hyderabad - 41-43°C
Please avoid afternoon travel as much as possible, stay hydrated 🙏
There will be ISOLATED STORMS in the evening, just adding…
సాయంత్రం వేళ వింత వాతావరణం
ఎండల వేడితో అల్లాడుతున్న ప్రజలకు సాయంత్రం వేళ వచ్చే చిరుజల్లులు కొంత ఉపశమనం కలిగిస్తాయని భావిస్తే పొరపాటే. వాతావరణంలో ఏర్పడిన అనిశ్చితి వల్ల కొన్ని చోట్ల తేలికపాటి వర్షాలు కురిసే అవకాశం ఉన్నప్పటికీ, అది ఉపశమనం కంటే ఇబ్బందినే ఎక్కువగా కలిగిస్తుంది. గాలిలో తేమ (హ్యుమిడిటీ) ఒక్కసారిగా పెరగడం వల్ల ఉక్కపోత తీవ్రమవుతుంది.
ప్రజలకు కీలక సూచనలు
తీవ్రమైన ఎండల నేపథ్యంలో ప్రజలు అప్రమత్తంగా ఉండాలని వైద్య నిపుణులు సూచిస్తున్నారు. మధ్యాహ్నం 12 గంటల నుండి సాయంత్రం 4 గంటల వరకు అత్యవసరమైతే తప్ప బయటకు రాకపోవడమే మంచిది. ప్రయాణాలు చేసేవారు గొడుగులు, టోపీలు ధరించాలని , శరీరంలో నీటి శాతం తగ్గకుండా చూసుకోవాలని కోరుతున్నారు.",0.8
