title,url,source,date,language,state,district,search_term,full_text,relevance_score
"Himachal Weather: हिमाचल में पहाड़ों पर भी चढ़ा पारा, मगर मौसम लेगा करवट, इन इलाकों में बारिश-आंधी - ABP News",https://news.google.com/rss/articles/CBMigwJBVV95cUxObVpjcVNFa2hMQ2MtTFhPTVBoYXFiTnRscFJWRFVzdTNvOENqT1QwOXpMUHR3QXhCUTZraDM0cHNVTzJhZjZHUnl2eS1kY0thdjRvUzZpZU5iX1doYmRZT3JjTkk3cEVOT0hEWllNalJiM1lqcTYxQVd0R2tiOUYycUJ2LVo2TUNSQlNYaWl0MnpnR19ZN3kyMTVoWkpTRlhnTG9GdEViX3dzcDRqaDE1UF9qSzloeW1QWGk5aVVrVVJtR1dFT0NzZHV1RHl6ZjMyb1FhM0F4OVpVakFKVnhTNThoYWgwRE51ektQZTgxUEh1am1KcHJXdFVmOG9Xd3VWSXBZ0gGIAkFVX3lxTE5PcDNOVkVFNmNrZUtUMzdEYi1HdkNRMkJMYllPOXZBcERSYWx0YzdXMjFXeVRGa0pscFVmeVEydjd4SVhHbXpuVDludzNOUVhFNzQ2dl9yTzU1OVFHbzlHcGJSM1d4Qk1rY1pXUEllc2Q0QXJnWEEyVzBZNXp0X3F3TkV0NEN6eENCYzhXalFxemtHd2tnM09kUUc1dDdBQkhOR3hudDVWa0pMVllWZ0V2UW5rLVpVWTlsWGVYTHdsb0Z5N2VPZmd0WEpPY19fRWcyOG9lTk5ZQURtSU1RenpNRG9zQWw0VWdOUEhPRHAxQXpiYnJjVGxGME56RzN0MHNEUGdLYkJfRw?oc=5,ABP News,2026-04-24T14:08:33+05:30,hi,Himachal Pradesh,,"(""हीट एक्शन प्लान"" OR ""गर्मी से राहत"" OR चेतावनी OR ""रेड अलर्ट"" OR ""ऑरेंज अलर्ट"" OR ""येलो अलर्ट"" OR एडवाइजरी OR ""राहत सामग्री"" OR ""राहत शिविर"" OR मुआवजा) Himachal Pradesh","Himachal Weather: हिमाचल में पहाड़ों पर भी चढ़ा पारा, मगर मौसम लेगा करवट, इन इलाकों में बारिश-आंधी का येलो अलर्ट
Himachal News In Hindi: हिमाचल प्रदेश में मैदानी इलाकों के साथ ऊंचाई वाले क्षेत्रों में भी तापमान तेजी से बढ़ रहा है. मगर मौसम विभाग के अनुसार कल (25 अप्रैल ) बारिश को लेकर येलो अलर्ट जारी किया है.
हिमाचल प्रदेश में दिन पर दिन गर्मी बढ़ने लगी है, जिससे मैदानी इलाकों में भीषण गर्मी पड़ रही हैं. शुक्रवार (24 अप्रैल) को प्रदेश के कई हिस्सों में तापमान सामान्य से ऊपर दर्ज किया गया. आज भी हिमाचल के अधिकतर हिस्सों में धूप खिली हुई है, जिससे गर्मी सता रही है. मगर 25 अप्रैल से गर्मी से राहत मिलने के आसार हैं.
मध्यम और ऊंचाई वाले क्षेत्रों में भी तेजी से बढ़ रहा तापमान
ऊना में अधिकतम तापमान 40 डिग्री सेल्सियस तक पहुंच गया, जो सामान्य से 4.1 डिग्री अधिक है. गौरतलब है कि ऊना में अप्रैल महीने का अब तक का रिकॉर्ड तापमान 30 अप्रैल 2022 को 43.2 डिग्री सेल्सियस दर्ज किया गया था. इसी तरह कांगड़ा में तापमान 36.4 डिग्री, धर्मशाला में 33.0 डिग्री और कुल्लू के भुंतर में 33.4 डिग्री सेल्सियस तक पहुंच गया, जो सामान्य से काफी अधिक है.
गर्मी का असर अब केवल मैदानी इलाकों तक सीमित नहीं रहा, बल्कि मध्यम और ऊंचाई वाले क्षेत्रों में भी तापमान तेजी से बढ़ रहा है. शिमला में अधिकतम तापमान 27.2 डिग्री और मनाली में 26.8 डिग्री सेल्सियस दर्ज किया गया, जो सामान्य से कई डिग्री अधिक है. इससे साफ संकेत मिल रहे हैं कि पूरे प्रदेश में मौसम तेजी से बदल रहा है और गर्मी का दायरा बढ़ता जा रहा है.
पूरे प्रदेश में 25 अप्रैल को बारिश का येलो अलर्ट
पिछले एक सप्ताह से लगातार खिल रही तेज धूप के कारण ऊना, कांगड़ा, मंडी, बिलासपुर, हमीरपुर और सिरमौर जिलों के निचले इलाकों में दिन के समय लू जैसे हालात बन गए हैं. लोगों को दोपहर के समय घरों से बाहर निकलने में काफी परेशानी का सामना करना पड़ रहा है. हालांकि राहत की खबर यह है कि मौसम जल्द करवट ले सकता है. मौसम विभाग के अनुसार एक वेस्टर्न डिस्टरबेंस सक्रिय होने जा रहा है, जिसका असर अगले चार दिनों तक प्रदेश में देखने को मिलेगा. इसके चलते चंबा, कांगड़ा और कुल्लू के ऊंचाई वाले क्षेत्रों में हल्की बूंदाबांदी के आसार हैं.
शनिवार 25 अप्रैल को पूरे प्रदेश में बारिश की संभावना जताई गई है और चंबा, कांगड़ा, कुल्लू व मंडी जिलों में आंधी-तूफान को लेकर येलो अलर्ट जारी किया गया है. वहीं 26 अप्रैल को कांगड़ा और कुल्लू में मौसम खराब रहने की चेतावनी दी गई है. यदि बारिश होती है, तो इससे तापमान में गिरावट आएगी और लोगों को भीषण गर्मी से राहत मिलने की उम्मीद है.
PM मोदी पर टिप्पणी को लेकर घमासान, मल्लिकार्जुन खरगे के खिलाफ हिमाचल में शिकायत
Source: IOCL",1.0
"हिमाचल प्रदेश में गर्मी का कहर, पारा 41 डिग्री पार; शनिवार से बदलेगा मौसम, आंधी-बारिश की चेतावनी - Hindustan Hindi News",https://news.google.com/rss/articles/CBMi6gFBVV95cUxOdFpsUXVsdDBGdm5wNjJLWjd4X3gxeTFpNFlJNWdrbDdKM3N6MG5lZDNBUDd1ZGk2el93WFVlR0ZmUEZ1alRJbHd1TXo1RDlaY1AwZzhvbjVreXh1MXg2NEtHVm9rMTZyUHZpUkVUQ2xMRXJmWlJPUlpSRzF0SFRGLWpoTmNFcVFLX1cxMWFpMHVvbThzLVhNS2l0bVVMd0V5dktHb19CUUtxLWRFN0M5SEtfTnowVGZvRkhUUjRkNTVUYzI5bVVjYjhyV2lycTBRdnR1ckJkOXZ2cDBxSGxYb0JTNkJDdlhjVkHSAe8BQVVfeXFMUEpzVzY4WXFpbDhnckI4RzdNRlZRdThlc0xnZjhGUU1rdWY2cTBHVkdBYnNUbThpRmVveFVjcFR0SE9sUFVTTjFWMW1BTGladmpjbjRRNHR5SE9RS1lsa1N1Q3ZRNGE5WVNHckNoOTJfZkxJb1o4VUVDT1F3WE9ZRXRWU2JJbUNFUnNGR2xGWHFCWVg3TEVZNk1uVkhRblRfeU1QX2thdzk4QnJLVWc3Uk50TUFyNHNhWExCZ3VIQ0tzem93a0xWeUdfbUczbXN4ZnZ0bjhPd1VxeXVkRHdSckNJekplMHNWY085OVR0cE0?oc=5,Hindustan Hindi News,2026-04-24T19:29:04+05:30,hi,Himachal Pradesh,,"(""हीट एक्शन प्लान"" OR ""गर्मी से राहत"" OR चेतावनी OR ""रेड अलर्ट"" OR ""ऑरेंज अलर्ट"" OR ""येलो अलर्ट"" OR एडवाइजरी OR ""राहत सामग्री"" OR ""राहत शिविर"" OR मुआवजा) Himachal Pradesh","हिमाचल प्रदेश में गर्मी का कहर, पारा 41 डिग्री पार; शनिवार से बदलेगा मौसम, आंधी-बारिश की चेतावनी
विभाग ने लोगों, खासकर पहाड़ी और संवेदनशील इलाकों में रहने वालों को सतर्क रहने की सलाह दी है। तेज हवाओं और बिजली गिरने की स्थिति में खुले स्थानों से दूर रहने और सुरक्षित जगहों पर रहने की हिदायत दी गई है।
हिमाचल प्रदेश में इन दिनों गर्मी का प्रकोप लगातार बढ़ता जा रहा है और अप्रैल के आखिर हफ्ते में ही बढ़े हुए तापमान ने लोगों का हाल-बेहाल कर दिया है। राज्य के निचले और मैदानी इलाकों में सूरज की तपिश इतनी तेज हो गई है कि दिन में लोगों का घरों से निकलना मुश्किल हो गया है। शुक्रवार को प्रदेश का अधिकतम तापमान 41 डिग्री सेल्सियस के पार पहुंच गया, जो इस सीजन का अब तक का सबसे गर्म दिन माना जा रहा है। हालांकि अच्छी खबर यह है कि मौसम विभाग ने शनिवार से राज्य के मौसम में बदलाव आने का अनुमान लगाया है और इस दौरान कई हिस्सों में गरज के साथ आंधी-तूफान चलने की संभावना जताई गई है।
शुक्रवार को प्रदेश में सबसे ज्यादा गर्मी ऊना में दर्ज की गई, जहां तापमान 41.4 डिग्री सेल्सियस तक पहुंच गया और यह सामान्य से करीब 6 डिग्री ज्यादा रहा। इसके अलावा कांगड़ा में 37.1 डिग्री, सुंदरनगर में 36.3 डिग्री, मंडी में 36.2 डिग्री, बरठीं में 35.7 डिग्री, नाहन में 35.1 डिग्री, भुंतर में 34.5 डिग्री और सोलन में 33.5 डिग्री सेल्सियस तापमान रिकॉर्ड किया गया। पहाड़ी और पर्यटन स्थलों में भी गर्मी का असर साफ दिख रहा है। शिमला में अधिकतम तापमान 27.6 डिग्री और मनाली में 26.8 डिग्री दर्ज किया गया, जबकि कल्पा में 24.5 डिग्री और ताबो में 21.1 डिग्री सेल्सियस तापमान रहा। पूरे प्रदेश का औसतन अधिकतम तापमान सामान्य से करीब 5.1 डिग्री अधिक दर्ज किया गया है।
धूप से बचने छतरी और टोपी लगा रहे लोग
गर्मी के इस बढ़ते असर का असर आम जनजीवन पर भी दिखने लगा है। शिमला जैसे हिल स्टेशन में भी लोग धूप से बचने के लिए छाते और टोपी का सहारा लेते नजर आ रहे हैं, जबकि निचले इलाकों में दोपहर के समय बाजारों में सन्नाटा देखने को मिल रहा है। तेज गर्मी के कारण लोगों की दिनचर्या प्रभावित हो रही है और बिजली व पानी की मांग भी बढ़ने लगी है।
शनिवार से बदलेगा मौसम का मिजाज
हालांकि मौसम विभाग के ताजा पूर्वानुमान के मुताबिक आने वाले दिनों में मौसम का मिजाज बदल सकता है और लोगों को गर्मी से कुछ राहत मिलने की उम्मीद है। 25 अप्रैल को प्रदेश के कई हिस्सों में गरज के साथ आंधी-तूफान चलने की संभावना जताई गई है। इस दौरान 40 से 50 किलोमीटर प्रति घंटे की रफ्तार से तेज हवाएं चल सकती हैं और कुछ जगहों पर बिजली गिरने की भी आशंका है। मध्य पर्वतीय इलाकों में हल्की बारिश हो सकती है, जबकि ऊंचाई वाले क्षेत्रों में बारिश या हल्की बर्फबारी भी संभव है।
बीच में दो दिन फिर पड़ेगी गर्मी, शुष्क रहेगा मौसम
इसके बाद 26 और 27 अप्रैल को ज्यादातर क्षेत्रों में मौसम शुष्क रहने का अनुमान है, जिससे लोगों को थोड़ी राहत मिल सकती है। लेकिन यह राहत ज्यादा दिन टिकने वाली नहीं है। 28 अप्रैल से फिर मौसम करवट लेगा और कई इलाकों में दोबारा आंधी-तूफान और तेज हवाओं का दौर शुरू हो सकता है। 29 और 30 अप्रैल को भी इसी तरह का मौसम बना रहने की संभावना है, जिसमें कुछ स्थानों पर हल्की बारिश और तेज हवाएं चल सकती हैं।
25 से 28 अप्रैल के बीच लोगों को रहना होगा सावधान
मौसम विभाग ने चंबा, कांगड़ा और कुल्लू जैसे जिलों में 25 और 28 अप्रैल के आसपास विशेष सतर्कता बरतने की सलाह दी है, जहां तेज हवाओं और बिजली गिरने से नुकसान का खतरा रह सकता है। वहीं ऊना, बिलासपुर और हमीरपुर जैसे जिलों में ज्यादातर दिनों में मौसम सामान्य रहने का अनुमान है।
विभाग ने लोगों, खासकर पहाड़ी और संवेदनशील इलाकों में रहने वालों को सतर्क रहने की सलाह दी है। तेज हवाओं और बिजली गिरने की स्थिति में खुले स्थानों से दूर रहने और सुरक्षित जगहों पर रहने की हिदायत दी गई है।
रिपोर्ट: यूके शर्मा",1.0
"Kal Ka Mausam: 12 राज्यों में भयंकर बारिश का अलर्ट, दिल्ली और यूपी में लू बरपाएगी कहर; जानिए IMD अपडेट- kal ka Mausam 25th April 2026 thunderstorm snow storm rain alert in delhi up bihar delhi himachal pradesh uttarakhand - News Nation TV",https://news.google.com/rss/articles/CBMi8wFBVV95cUxPRkE5U0xzaEp0MTJBUk5lY1NvbVU1ekltS2ExXzlQMU5CaTMyTVBjSlVWLWR2OXo3Y0Q2dmwxdHNJeVdGQV9wLXR5bGh2MnNtSDZZUnNBUUV4WDM0Q0o4aFN4UTl0M1U1SFZyUi16TVJ4Y0syXzdWbVlOT21scjhrd21rVUtQUHJyd2I3VVZId0Z0ZGxMMS1MaGdBS2p0QWlHLUY2T290Tkc5Q1BoRDU2Rkx3ZWdLSU5rTUw4VGVKMXlOVW9WSXk3elhhZl9Yc2MwTW13YzgwNFlKN25qdXdOSHl6d3UtV0JFRTdHVTBXcWhYTkHSAfMBQVVfeXFMT0ZBOVNMc2hKdDEyQVJOZWNTb21VNXpJbUthMV85UDFOQmkzMk1QY0pVVi1kdjl6N2NENnZsMXRzSXlXRkFfcC10eWxodjJzbUg2WVJzQVFFeFgzNENKOGhTeFE5dDNVNUhWclItek1SeGNLMl83Vm1ZTk9tbHI4a3dta1VLUFBycndiN1VWSHdGdGRsTDEtTGhnQUtqdEFpRy1GNk9vdE5HOUNQaEQ1NkZMd2VnS0lOa01MOFRlSjF5TlVvVkl5N3pYYWZfWHNjME1td2M4MDRZSjduanV3Tkh5end1LVdCRUU3R1UwV3FoWE5B?oc=5,News Nation TV,2026-04-24T22:01:13+05:30,hi,Himachal Pradesh,,"""लू"" Himachal Pradesh","Kal Ka Mausam: भारत के मौसम में इन दिनों दो अलग-अलग रंग देखने को मिल रहे हैं. एक ओर उत्तर भारत और मध्य भारत के मैदानी इलाके भीषण गर्मी और लू की चपेट में हैं, तो दूसरी ओर पूर्वोत्तर भारत के राज्यों में कुदरत का अलग ही रूप दिखाई दे रहा है. भारत मौसम विभाग यानी आईएमडी ने देश के 12 राज्यों के लिए भारी बारिश का अलर्ट जारी किया है. इन इलाकों में आने वाले दिनों में 50 से 70 किलोमीटर प्रति घंटे की रफ्तार से तेज हवाएं चलने की आशंका जताई गई है. मैदानी इलाकों में रहने वाले लोग जहां सूरज की तपिश से बेहाल हैं, वहीं पहाड़ी और पूर्वोत्तर राज्यों में बारिश से राहत मिलने की उम्मीद है.
पूर्वोत्तर राज्यों में भारी बारिश और तूफान की चेतावनी
मौसम विभाग के ताजा अनुमान के मुताबिक, पूर्वोत्तर भारत के असम, मेघालय और अरुणाचल प्रदेश समेत कई राज्यों में इस सप्ताह व्यापक बारिश हो सकती है. आईएमडी ने चेतावनी दी है कि कुछ स्थानों पर बारिश के साथ-साथ तेज तूफान भी आ सकता है. पश्चिम बंगाल, झारखंड और बिहार में भी 25 से 28 अप्रैल के बीच मौसम करवट ले सकता है. इन राज्यों में गरज-चमक के साथ तेज हवाएं चलने की संभावना है. विशेष रूप से झारखंड में 26 अप्रैल को ओलावृष्टि की आशंका जताई गई है, जिससे फसलों को नुकसान पहुंच सकता है.
दिल्ली और उत्तर भारत में लू का प्रचंड प्रकोप
राजधानी दिल्ली समेत पंजाब, हरियाणा, राजस्थान और उत्तर प्रदेश में गर्मी ने लोगों का जीना मुहाल कर दिया है. अगले 3-4 दिनों के दौरान इन राज्यों में भीषण लू चलने की चेतावनी दी गई है. उत्तर-पश्चिम भारत के मैदानी इलाकों में तापमान 40 से 44 डिग्री सेल्सियस तक पहुंच सकता है. दिल्ली में 25 से 27 अप्रैल तक लू का असर सबसे ज्यादा रहेगा. हालांकि, 27 अप्रैल की शाम को हल्की बारिश और गरज-चमक के साथ मौसम में थोड़ा बदलाव आने की उम्मीद है, जिससे तापमान में मामूली गिरावट आ सकती है. लेकिन तब तक लोगों को तपती धूप और गर्म रातों का सामना करना पड़ेगा.
प्रमुख शहरों का तापमान
उत्तर प्रदेश और बिहार में मौसम का मिजाज
उत्तर प्रदेश में गर्मी सारे रिकॉर्ड तोड़ रही है. राज्य के पश्चिमी और पूर्वी हिस्सों में 27 अप्रैल तक लू का रेड अलर्ट जारी किया गया है. यहां अधिकतम तापमान 44 डिग्री सेल्सियस तक जाने का अनुमान है. राहत की बात यह है कि 28 अप्रैल से मौसम थोड़ा नरम पड़ सकता है और कुछ इलाकों में हल्की बूंदाबांदी हो सकती है. वहीं बिहार की बात करें तो यहां अगले चार दिनों में मौसम के दो रूप दिखेंगे. शुरुआत में लू चलेगी, लेकिन 26 और 27 अप्रैल को पटना, गया और मुजफ्फरपुर जैसे शहरों में तेज आंधी और बारिश का अलर्ट है.

पहाड़ों पर बारिश और बर्फबारी का पूर्वानुमान
उत्तराखंड और हिमाचल प्रदेश जैसे पहाड़ी राज्यों में भी मौसम का मिजाज बदलने वाला है. उत्तराखंड के मैदानी इलाकों में अभी गर्मी है, लेकिन पहाड़ी क्षेत्रों में 30 अप्रैल तक हल्की से मध्यम बारिश होने की संभावना है. ऊंचे पहाड़ों पर गरज-चमक के साथ तेज हवाएं चल सकती हैं. हिमाचल प्रदेश में भी 25 अप्रैल से मौसम सक्रिय होगा. शिमला, मनाली और धर्मशाला जैसे पर्यटन स्थलों पर 28 से 30 अप्रैल के बीच अच्छी बारिश हो सकती है. इसके अलावा, ऊंचाई वाले इलाकों में बर्फबारी की भी संभावना जताई गई है, जिससे वहां के तापमान में गिरावट आएगी और पर्यटकों को सुहावने मौसम का आनंद मिलेगा.",1.0
