title,url,source,date,language,state,district,search_term,full_text,relevance_score
"Aaj Ka Mausam: यूपी-बिहार में आंधी-बारिश तो इन 3 राज्यों को करना पड़ेगा लू का सामना, IMD ने जारी किया अलर्ट - in.headtopics.com",https://news.google.com/rss/articles/CBMibEFVX3lxTE5NTkZlcE84TVg1azA5UmhzQzl1MmNyNjlubWxSb2drN2hwa3VGYXRCTHZOTW1NSHBUeEgyMTNvc2wyR2ZlOTZINFpkczV5ZDNEcGVCdGYzc1VSSS0zTmd0Sy1ZaF90SnhmOEp5dw?oc=5,in.headtopics.com,2026-06-07T02:58:00+05:30,hi,Himachal Pradesh,,"""लू"" Himachal Pradesh","आज का मौसम, 7 जून: देश में मौसम की अतरंगी चाल जारी है. आज जहां दिल्ली, यूपी, बिहार और राजस्थान के कई जिलों में बादलों की आवाजाही और बारिश से तापमान में गिरावट आएगी.
Aaj Ka Mausam : यूपी-बिहार में आंधी-बारिश तो इन 3 राज्यों को करना पड़ेगा लू का सामना, IMD ने जारी किया अलर्ट आज का मौसम, 7 जून: देश के मौसम में बड़ा बदलाव देखने को मिल रहा है। मौसम विभाग ने उत्तर प्रदेश और बिहार समेत 17 राज्यों में आंधी के साथ भारी बारिश का अलर्ट जारी किया है.
आज का मौसम, 7 जून: देश के मौसम में बड़ा बदलाव देखने को मिल रहा है। मौसम विभाग ने उत्तर प्रदेश और बिहार समेत 17 राज्यों में आंधी के साथ भारी बारिश का अलर्ट जारी किया है. देशभर में पड़ रही भीषण गर्मी और चिलचिलाती धूप के बीच मौसम विभाग ने राहत और आफत दोनों की बड़ी चेतावनी एक साथ जारी की है.
भारतीय मौसम विज्ञान विभाग के मुताबिक देश के मौसम में इस समय बेहद अतरंगी बदलाव देखने को मिल रहा है. एक तरफ जहां उत्तर प्रदेश और बिहार समेत देश के करीब 17 राज्यों में तेज आंधी के साथ झमाझम बारिश होने की पूरी संभावना बनी हुई है, वहीं दूसरी तरफ कल यानी 8 जून से मैदानी इलाकों में एक बार फिर से सूरज की तपिश बढ़ने वाली है.
मौसम विभाग ने दिल्ली, हरियाणा, पंजाब और पश्चिमी उत्तर प्रदेश के कई हिस्सों में कल से भीषण लू का नया अलर्ट जारी कर दिया है. ऐसे में आज संडे के दिन लोगों को गर्मी से थोड़ी राहत जरूर मिल सकती है, लेकिन आने वाले दिन बेहद चुनौतीपूर्ण होने वाले हैं. राजधानी दिल्ली के लोगों को आज रविवार के दिन गर्मी से थोड़ी राहत मिलने की उम्मीद है.
मौसम विभाग के अनुसार आज 7 जून को दिल्ली के आसमान में हल्के से मध्यम बादल छाए रह सकते हैं. हालांकि आज राजधानी में धूल भरी आंधी चलने या तेज हवाएं बहने की संभावना बेहद कम है. बादलों की वजह से धूप का असर थोड़ा कम रहेगा जिससे तापमान में मामूली गिरावट दर्ज की जा सकती है. दिल्लीवासियों के लिए यह राहत बेहद चंद घंटों की ही मेहमान है.
मौसम विभाग ने चेतावनी दी है कि 8 और 9 जून को दिल्ली के तापमान में एक बार फिर से भारी बढ़ोतरी देखने को मिलेगी और लोगों को प्रचंड लू का सामना करना पड़ेगा. दिल्ली के पड़ोसी राज्य उत्तर प्रदेश में आज मौसम मेहरबान रहने वाला है. पिछले कई दिनों से रिकॉर्ड तोड़ गर्मी और उमस से परेशान यूपी के लोगों के लिए आज राहत भरी खबर है.
मौसम वैज्ञानिकों के अनुसार आज राज्य के कई पूर्वी और मध्य जिलों में बादलों की जोरदार गर्जना के साथ बारिश होने की पूरी संभावना है. उत्तर प्रदेश के आजमगढ़, मऊ, देवरिया, जौनपुर, वाराणसी, संतकबीरनगर, मिर्जापुर, प्रयागराज, सोनभद्र, कौशांबी, प्रतापगढ़, अमेठी, अयोध्या और गोंडा में आसमान में काले बादल छाए रहेंगे और कुछ जगहों पर भारी बारिश भी हो सकती है.
यूपी के इन हिस्सों में बारिश होने से मौसम सुहाना हो जाएगा, लेकिन राज्य के लोगों को यह भी ध्यान रखना होगा कि 9 से 11 जून के बीच कई शहरों में दोबारा भयानक लू चलने की चेतावनी दी गई है. बिहार में भी आज मौसम का मिजाज पूरी तरह से बदलने वाला है. मौसम विभाग ने राज्य के कई जिलों में तेज आंधी और भारी बारिश को लेकर विशेष अलर्ट जारी किया है.
आईएमडी की रिपोर्ट के मुताबिक आज बिहार के सारण, बक्सर, कैमूर, औरंगाबाद, रोहतास, गया, नालंदा, वैशाली, पटना, शेखपुरा, जमुई और लखीसराय में मौसम बहुत खराब हो सकता है. इन जिलों में गरज चमक के साथ तेज बौछारें पड़ने की संभावना है. बारिश के साथ ही इन क्षेत्रों में तूफान जैसी तेज हवाएं भी चल सकती हैं, जिससे लोगों को सुरक्षित स्थानों पर रहने की सलाह दी गई है.
इस मानसूनी हलचल से बिहार के तापमान में भारी गिरावट आएगी और लोगों को उमस भरी गर्मी से बड़ी राहत मिलेगी. राजस्थान के निवासियों को भी आज गर्मी से थोड़ी राहत मिलती हुई दिखाई दे रही है. मौसम विभाग ने आज राज्य के कई इलाकों में धूल भरी आंधी चलने और हल्की बारिश होने की संभावना जताई है.
राजस्थान के कई पूर्वी और मध्य जिलों में बादलों की आवाजाही के साथ ठंडी हवाएं चल सकती हैं जिससे पारे में गिरावट आएगी. मौसम विभाग ने सावधान किया है कि यह राहत पूरे राजस्थान के लिए नहीं है. पश्चिमी राजस्थान के जिलों में सूरज का सितम लगातार जारी रहने वाला है.
मौसम वैज्ञानिकों के अनुसार 8 से 12 जून तक पश्चिमी राजस्थान के अधिकांश हिस्सों में गंभीर लू चलने की चेतावनी जारी की गई है, जिससे आने वाले दिनों में यहां का तापमान फिर से 45 डिग्री के पार जा सकता है. देश में मानसून के आगे बढ़ने को लेकर बेहद अच्छी खबर सामने आ रही है. दक्षिण पश्चिम मानसून अब लगातार मजबूत हो रहा है और तेजी से आगे की तरफ कदम बढ़ा रहा है.
इसके प्रभाव से केरल में अगले दो दिनों के भीतर मानसून की बारिश बहुत ज्यादा तेज होने के आसार दिखाई दे रहे हैं. मौसम विभाग के ताजा बुलेटिन के अनुसार आगामी सात दिनों के दौरान केरल के विभिन्न हिस्सों में 7 से लेकर 20 सेंटीमीटर तक भारी से बहुत भारी बारिश दर्ज की जा सकती है.
केरल के कुछ तटीय और आंतरिक इलाकों में पहले ही 12 से 20 सेंटीमीटर तक की मूसलाधार बारिश रिकॉर्ड की जा चुकी है, जो इस बात का साफ संकेत है कि मानसून इस बार पूरी ताकत के साथ आगे बढ़ रहा है. मौसम वैज्ञानिकों का मानना है कि अगले दो से तीन दिनों के भीतर देश के अन्य हिस्सों में भी मानसून के दस्तक देने के लिए परिस्थितियां पूरी तरह से अनुकूल बन चुकी हैं.
उम्मीद जताई जा रही है कि अगले 48 से 72 घंटों में मानसून कर्नाटक, महाराष्ट्र, आंध्र प्रदेश, गोवा और बंगाल की खाड़ी के कुछ और बचे हुए हिस्सों में प्रवेश कर जाएगा. मानसून के लगातार एक्टिव रहने के कारण केरल और दक्षिण भारत के राज्यों में लगातार भारी बारिश का दौर जारी रहने की संभावना है, जिससे देश के अन्य राज्यों में भी जल्द मानसून पहुंचने की उम्मीदें बढ़ गई हैं.
मैदानी इलाकों की तपिश के बीच आज पहाड़ों पर घूमने गए पर्यटकों और वहां के स्थानीय लोगों के लिए मौसम बेहद सुहावना रहने वाला है. उत्तराखंड से लेकर हिमाचल प्रदेश तक मौसम विभाग ने आंधी और बारिश का बड़ा अलर्ट जारी कर दिया है. उत्तराखंड के देहरादून, हरिद्वार, नैनीताल, उधमसिंह नगर, पौड़ी, टिहरी, अल्मोड़ा, पिथौरागढ़, चमोली और रुद्रप्रयाग जिलों में आज तेज हवाओं के साथ जोरदार बारिश होने की संभावना बनी हुई है.
इसी तरह हिमाचल प्रदेश के शिमला, मंडी, कुल्लू, कांगड़ा, चंबा, सोलन, सिरमौर, ऊना, हमीरपुर और बिलासपुर में भी गरज चमक के साथ बौछारें पड़ने की चेतावनी दी गई है. पहाड़ों पर हो रही इस बर्फबारी और बारिश के कारण मैदानी इलाकों से आ रही गर्म हवाओं का असर कम होगा और तापमान में भारी गिरावट दर्ज की जाएगी. Weather Update: फिर मौसम विभाग ने जारी किया अलर्ट, 18 राज्यों में आंधी-बारिश के आसार, जानें IMD का अपडेट
Imd Alert Weather News Weather Forecast Today Imd Rain Alert Heatwave Delhi Weather Up Rain Bihar Monsoon Update Rajasthan Climate Uttarakhand Snowfall Himachal Weather Temperature News India Metropolitan Weather Trends Summer Season Heavy Rainfall Monsoon Tracking Storms Wind Speed Alerts
United States Latest News, United States Headlines
5 जून का राशिफल: मिथुन राशि वालों को महत्वपूर्ण जिम्मेदारी, कर्क वालों को प्रमोशन और वृष राशि को रुका पैसा मिलने के योग हैंAaj Ka Rashifal (Horoscope Today)| Daily Rashifal Friday (5 June 2026), Daily Zodiac Forecast: Singh Rashi, Kanya, Aries, Taurus, Gemini Cancer Libra, And Other Signs
Read more »
आज का सिंह राशिफल (Aaj Ka Singh Rashifal) 6 जून 2026आज के करियर फैसलों में एक आध्यात्मिक और सहज ज्ञान का पुट रहेगा, जो आपको सहारा देने वाली नींव को नजरअंदाज न करें।
Read more »
UP Weather Today, 6 June: गाजियाबाद समेत 70 जिलों में आंधी-बारिश का अलर्ट, 60 की स्पीड से चलेंगी हवाएंUttar Pradesh Aaj Ka Mausam, 06 June 2026: नोएडा, गाजियाबाद, वाराणसी समेत यूपी के 70 जिलों में आंधी और बारिश का अलर्ट है।
Read more »
Uttarakhand Weather Today, 6 June: पहाड़ों में 40 से 50 Km की रफ्तार से बहेंगी हवाएं, 25 तक मॉनसून की एंट्रीUttarakhand Aaj Ka Mausam, 6 June 2026: उत्तराखंड के पहाड़ी इलाकों में मौसम विभाग ने 40 से 50 किलोमीटर प्रति घंटे की रफ्तार से तेज हवाएं चलने का अलर्ट जारी किया है।
Read more »
Rajasthan Aaj ka mausam: कहीं आंधी-बारिश तो कहीं लौटेगी लू, राजस्थान में बदलते मौसम का हाल जानिएराजस्थान में मौसम में बदलावों का दौर जारी है। लगातार बदलते मौसम के चलते पूर्वी राजस्थान को राहत मिली है। हालांकि पश्चिमी राजस्थान में गर्मी का असर फिलहाल बना हुआ है।
Read more »
6 जून का राशिफल: मकर राशि वालों को नई जिम्मेदारी मिल सकती है और कुंभ राशि वालों की इनकम के सोर्स बनेंगेAaj Ka Rashifal (Horoscope Today)| Daily Rashifal Saturday (6 June 2026), Daily Zodiac Forecast: Singh Rashi, Kanya, Aries, Taurus, Gemini Cancer Libra, And Other Signs
Read more »",1.0
"हिमाचल में 11-12 जून को आंधी-बारिश का अलर्ट, अगले तीन दिन और बढ़ेगी तपिश - himachaldastak.com",https://news.google.com/rss/articles/CBMid0FVX3lxTE5FVHJRMThCOU5UVEZwa3lFakN3SXF1cGlQTzQwYS01eVdBNHlwV3ZJS3dkaVpCUlRYd2VRSTdkZTZqTUhrUXhXS2JQZEQ1R2E5b29mTGRNeUhuUHVGWlBUMlp0dXB3b3ZOZTJBTEVaUkpCNENvU2JR?oc=5,himachaldastak.com,2026-06-07T14:40:30+05:30,hi,Himachal Pradesh,,"लू (Bilaspur OR Chamba OR Hamirpur OR Kangra OR Kinnaur OR Kullu OR ""Lahaul and Spiti"" OR Mandi OR Shimla OR ""Sirmaur (Sirmour)"" OR Solan OR Una) Himachal Pradesh","शिमला। हिमाचल प्रदेश में पिछले दो दिनों से गर्मी का असर लगातार बढ़ रहा है और मौसम विभाग ने अगले तीन दिनों तक तापमान में और बढ़ोतरी की संभावना जताई है। हालांकि 11 और 12 जून को प्रदेश के कुछ हिस्सों में गरज-चमक, तेज हवाओं और हल्की बारिश का दौर देखने को मिल सकता है। मौसम विभाग ने इन दो दिनों के लिए अलग-अलग स्थानों पर 30 से 40 किलोमीटर प्रति घंटा की रफ्तार से चलने वाली तेज हवाओं तथा आंधी-तूफान की चेतावनी जारी की है।
रविवार को भी प्रदेश के अधिकांश क्षेत्रों में मौसम साफ बना हुआ है। मैदानी इलाकों में सुबह से तेज धूप खिली हुई है, जिससे गर्मी का एहसास बढ़ गया है। राजधानी शिमला समेत प्रमुख पर्यटन स्थलों पर भी धूप निकली हुई है और मौसम सामान्य से कुछ अधिक गर्म महसूस किया जा रहा है। मौसम विभाग के अनुसार अगले तीन दिनों तक प्रदेश में मौसम मुख्य रूप से शुष्क रहने की संभावना है, जिससे अधिकतम तापमान में और बढ़ोतरी हो सकती है।
पिछले दो दिनों के दौरान गर्मी का प्रभाव विशेष रूप से मैदानी जिलों में बढ़ा है। कई क्षेत्रों में दिन का तापमान 40 डिग्री सेल्सियस के करीब पहुंच गया है। मौसम विभाग का कहना है कि 7 से 10 जून तक अधिकांश स्थानों पर मौसम साफ रहेगा। उच्च पर्वतीय इलाकों में कहीं-कहीं हल्की वर्षा-बर्फबारी का अनुमान है। इसके बाद पश्चिमी विक्षोभ के प्रभाव से 11 और 12 जून को पूरे राज्य में मौसम खराब होगा। कुछ क्षेत्रों में गरज-चमक के साथ हल्की से मध्यम बारिश और तेज हवाएं चल सकती हैं। विभाग के अनुसार 13 जून को फिर मौसम सामान्य रहने की संभावना है।
इस बीच, रविवार सुबह साढ़े आठ बजे तक दर्ज न्यूनतम तापमान के आंकड़ों पर नजर डालें तो सबसे अधिक न्यूनतम तापमान पांवटा साहिब में 26.0 डिग्री सेल्सियस दर्ज किया गया। इसके बाद देहरा गोपीपुर 24.0 डिग्री, बिलासपुर 23.0 डिग्री, नेरी 22.1 डिग्री, ऊना और जुब्बड़हट्टी 20.2-20.2 डिग्री, कांगड़ा 19.1 डिग्री, मंडी 18.9 डिग्री, धर्मशाला 18.5 डिग्री, नाहन 18.4 डिग्री, सुंदरनगर 17.5 डिग्री, शिमला 17.2 डिग्री, पालमपुर और बरठीं 17.0-17.0 डिग्री, सराहन 16.6 डिग्री, सोलन 15.5 डिग्री, चंबा 15.4 डिग्री, भुंतर 14.9 डिग्री, सेओबाग 14.8 डिग्री, कुफरी 12.2 डिग्री, मनाली 11.9 डिग्री, कल्पा 8.4 डिग्री, केलांग 5.7 डिग्री, कुकुमसेरी 5.6 डिग्री और ताबो में 5.2 डिग्री सेल्सियस न्यूनतम तापमान दर्ज किया गया। प्रदेश में पिछले 24 घंटों के दौरान छिटपुट वर्षा हुई। कांगड़ा में 1.2 मिलीमीटर और बरठीं में 1.0 मिलीमीटर बारिश रिकॉर्ड की गई। मौसम विभाग ने बताया कि वर्तमान में प्रदेश में किसी तरह की हीट वेव की स्थिति नहीं है, लेकिन लगातार साफ मौसम के कारण दिन के तापमान में वृद्धि जारी रह सकती है।",0.8
