title,url,source,date,language,state,district,search_term,full_text,relevance_score
"हिमाचल में कई जगह आंधी और भारी वर्षा, गर्मी से राहत, 16 जून तक बारिश का अलर्ट - himachaldastak.com",https://news.google.com/rss/articles/CBMidkFVX3lxTE9CS3VKN05IeTI3ZmRuSHViUEUtd2xrM3JaVWg0M05Db0dnbFNZbHB6anhmaEs2SXp5VnBsdnQ5M2M4WGNQVmdrX040NUVKdm9KdUdVYjVPRFlPdWxwN0hYVDBpYXpVbU1ISGdHWDJmWkV2UlBVTkE?oc=5,himachaldastak.com,2026-06-12T14:00:08+05:30,hi,Himachal Pradesh,,"(""हीट एक्शन प्लान"" OR ""गर्मी से राहत"" OR चेतावनी OR ""रेड अलर्ट"" OR ""ऑरेंज अलर्ट"" OR ""येलो अलर्ट"" OR एडवाइजरी OR ""राहत सामग्री"" OR ""राहत शिविर"" OR मुआवजा) Himachal Pradesh","शिमला। हिमाचल प्रदेश में बीती रात से मौसम ने करवट ले ली है। राज्य के कई हिस्सों में तेज आंधी, गरज के साथ बारिश और आसमानी बिजली गिरने की घटनाएं दर्ज की गईं। इससे जहां भीषण गर्मी से राहत मिली है, वहीं कुछ इलाकों में जनजीवन प्रभावित हुआ और बिजली आपूर्ति भी बाधित रही। मौसम विभाग ने 16 जून तक राज्य के कई हिस्सों में बारिश और आंधी का अलर्ट जारी किया है।
बीती रात शिमला, कांगड़ा, भुंतर, सुंदरनगर, मनाली और कुफरी सहित कई स्थानों पर आंधी और बिजली गिरने की घटनाएं हुईं। वहीं कुमारसेन और मलाना क्षेत्र में ओलावृष्टि (मध्यम स्तर) दर्ज की गई। हमीरपुर जिला के नेरी में 81 किलोमीटर प्रति घंटा की रफ्तार से तेज हवाएं चलीं। कई स्थानों पर पेड़ गिरने और अस्थायी बाधाएं आने से जनजीवन प्रभावित हुआ। शिमला जिले के रामपुर उपमंडल के झाकड़ी क्षेत्र के ज्यूरी बाजार के पास इनएच-05 पर तेज आंधी से पेड़ उखड़ गया, जिससे कुछ समय के लिए राष्ट्रीय राजमार्ग अवरुद्ध हो गया। बाद में इसे राष्ट्रीय राजमार्ग प्राधिकरण ने कड़ी मशक्कत के बाद बहाल किया। इस घटना में दो वाहनों को हल्का नुकसान हुआ, जबकि किसी प्रकार की जनहानि नहीं हुई।
राज्य में कई स्थानों पर भारी बारिश दर्ज की गई। सोलन जिला के कसौली में सर्वाधिक 105.0 मिमी वर्षा रिकॉर्ड हुई। धर्मपुर में 86.6 मिमी, धौलाकुआं में 43.5 मिमी, पालमपुर में 40.0 मिमी, सोलन में 34.6 मिमी, जोत और सराहन में 30-30 मिमी तथा नाहन में 26.7 मिमी वर्षा दर्ज की गई। बारिश और आंधी के चलते राज्य के तापमान में गिरावट आई है। पिछले 24 घंटों में औसत न्यूनतम तापमान में 2.4 डिग्री की कमी दर्ज की गई, जबकि सामान्य से 1.6 डिग्री नीचे तापमान रहा। मैदानी क्षेत्रों में पिछले दिन अधिकतम तापमान 44 डिग्री सेल्सियस तक पहुंच गया था, जिससे भीषण गर्मी का असर देखा गया था।
राज्य के प्रमुख शहरों के न्यूनतम तापमान पर नजर डालें तो कुकुमसेरी 5.6 डिग्री, केलंग 7.0 डिग्री, कल्पा 8.6 डिग्री, कुफरी 8.9 डिग्री, ताबो 9.6 डिग्री, शिमला 13.4 डिग्री, सराहन 13.5 डिग्री, मनाली 13.6 डिग्री, पलमपुर 15.0 डिग्री, सेओबाग 15.4 डिग्री, जुब्बरहट्टी 15.6 डिग्री, सोलन 16 डिग्री, डलहौजी 16.2 डिग्री, नाहन 16.5 डिग्री, भुंतर 17.3 डिग्री, चंबा 17.8 डिग्री, धर्मशाला 18.4 डिग्री, नेरी 19.2 डिग्री, ऊना 19.4 डिग्री, सुंदरनगर 19.5 डिग्री, मंडी 19.9 डिग्री, बरठीं 20 डिग्री, कांगड़ा 20 डिग्री, बिलासपुर 21 डिग्री, पांवटा साहिब 23 डिग्री और देहरा गोपीपुर 23.1 डिग्री सेल्सियस दर्ज किया गया।
मौसम विभाग के अनुसार आज और 13 जून को राज्य में कई स्थानों पर तेज हवाओं और आंधी के साथ बारिश की संभावना है। 14 से 16 जून तक कुछ स्थानों पर गरज के साथ बारिश का दौर जारी रहेगा, जबकि 17 और 18 जून को केवल अलग-अलग स्थानों पर हल्की बारिश का अनुमान है। विभाग ने 16 जून तक राज्य के कुछ हिस्सों में आंधी-वर्षा व आसमानी बिजली कड़कने का अलर्ट जारी किया है।
पहले दो दिनों में 40-50 किमी प्रति घंटे की रफ्तार से हवाएं चलने और कुछ जगहों पर 60 किमी प्रति घंटे तक झोंके आने की चेतावनी दी गई है। शुरुआती चरण में कुछ स्थानों पर ओलावृष्टि की भी संभावना जताई गई है, जबकि बाद के दिनों में अलर्ट में कमी आएगी। मौसम विज्ञान केंद्र शिमला के अनुसार मानसून की उत्तरी सीमा धीरे-धीरे आगे बढ़ रही है और मध्य भारत व उत्तर भारत के कई हिस्सों में इसके आगे बढ़ने के लिए परिस्थितियां अनुकूल बनी हुई हैं। क्षेत्र में चक्रवाती परिसंचरण और ट्रफ लाइन सक्रिय है, जिससे मौसम में यह बदलाव देखा जा रहा है।",1.0
"झुलसाती लू का सफर हुआ खत्म; उत्तर भारत में बादलों ने डाला डेरा, ओलावृष्टि और बारिश से मौसम हुआ सुहाना - pratahkal.com",https://news.google.com/rss/articles/CBMipAFBVV95cUxNMmhJdjNIdkZBRTdMQXJpcFNKNUZ5YXJHQ3Z1aEpaemY1TFNCdDNsUkVoUHRwdm5tU29SWEk5aWh3VGdmN2tUbkZTbHlqTVdFMWF3WVpzRmpfNUR3ZzBKNElsNk5wdEo0eWhOd1lFZXo5ZDJwNzE4ejc3UVF3a3F2M2wwdnBRWEtaak1mUGJmVkdwWnFzNngwZTFmWWk1ZkR5bFdwVNIBqgFBVV95cUxNWndTU29WRVR0OGtlVlNQMU1PMFItVVNXQ1lJT3NIUXBVTWF5MEhuckZBTFBIdDJ5TWlGU3J0NTNQVXREUk8yazlIeThtOExPYXB0RW1vYXZlSXJqaHZqUDJjUE5sRER6YjN1eFIzRGJKMXZBazZmbzgtZkYzcmlxSWJwMU5BVy0zbFcxa0NYQnZkR1FyalN6Z29ubVh2UDY0N25rQlhSS3k0UQ?oc=5,pratahkal.com,2026-06-12T06:30:58+05:30,hi,Himachal Pradesh,,"""लू"" Himachal Pradesh","झुलसाती लू का सफर हुआ खत्म; उत्तर भारत में बादलों ने डाला डेरा, ओलावृष्टि और बारिश से मौसम हुआ सुहाना
By Lalita RajputPublished on 12 Jun 2026 6:30 AM IST
मौसम विभाग के अनुसार पंजाब, हरियाणा, उत्तर प्रदेश और पहाड़ी राज्यों में तेज आंधी और बारिश से तापमान में आएगी भारी गिरावट।
x
उत्तर भारत के एक राज्य में पश्चिमी विक्षोभ के कारण हुई अचानक बारिश के दौरान सिर ढक कर सड़क पर चलती दो महिलाएं।
नई दिल्ली:
भीषण गर्मी और रिकॉर्ड तोड़ हीटवेव की मार झेल रहे उत्तर भारत के राज्यों के लिए राहत की बड़ी खबर सामने आ रही है। वायुमंडल में आए एक नए और शक्तिशाली मौसमी बदलाव के कारण उत्तर भारत के मौसम ने पूरी तरह से यू-टर्न ले लिया है। भारत मौसम विज्ञान विभाग (IMD) के अनुसार, एक सक्रिय पश्चिमी विक्षोभ (Western Disturbance) के प्रभाव से उत्तर-पश्चिमी और मैदानी राज्यों के वायुमंडलीय तंत्र में तेजी से परिवर्तन देखा जा रहा है। मौसम विभाग ने पंजाब, हरियाणा, उत्तर प्रदेश, हिमाचल प्रदेश, उत्तराखंड और जम्मू-कश्मीर के विस्तृत क्षेत्रों में गरज-चमक के साथ बारिश, धूल भरी आंधी और कुछ मैदानी व पहाड़ी इलाकों में ओलावृष्टि होने की आधिकारिक चेतावनी जारी की है। इस प्राकृतिक बदलाव से लंबे समय से झुलस रहे उत्तर भारतीय राज्यों के निवासियों को चिलचिलाती लू से बड़ी राहत मिलने की उम्मीद बढ़ गई है।
मौसम वैज्ञानिकों द्वारा उपग्रहीय चित्रों और वायुमंडलीय दबाव के विश्लेषण से प्राप्त आंकड़ों के आधार पर यह स्पष्ट किया गया है कि कैस्पियन सागर से उत्पन्न होकर आने वाली ठंडी हवाओं का रुख अब भारतीय उपमहाद्वीप के उत्तरी हिस्सों की तरफ मजबूती से बढ़ चुका है। इस प्रणाली के सक्रिय होने से पहाड़ों पर बर्फबारी और निचले मैदानी इलाकों में तेज हवाओं का दौर शुरू होने जा रहा है। जम्मू-कश्मीर, हिमाचल प्रदेश और उत्तराखंड के पहाड़ी क्षेत्रों में वर्षा के साथ-साथ ओले गिरने की अत्यधिक संभावना है, जबकि पंजाब, हरियाणा और पश्चिमी विक्षोभ के सीधे प्रभाव वाले उत्तर प्रदेश के अधिकांश जिलों में 40 से 60 किलोमीटर प्रति घंटे की रफ्तार से तेज अंधड़ चलने का अनुमान व्यक्त किया गया है। बादलों के इस भारी जमावड़े से सीधे तौर पर सौर विकिरण का प्रभाव घटेगा, जिससे पिछले कई दिनों से आसमान से बरस रही आग पर पूरी तरह विराम लग जाएगा।
सांख्यिकीय और तापमान के बदलावों के संदर्भ में, इस मौसमी उथल-पुथल का सीधा असर पारे पर पड़ेगा। मौसम विभाग के अनुसार, आंधी और वर्षा की इस संयुक्त गतिविधि के चलते उत्तर भारत के मैदानी इलाकों में अधिकतम तापमान में औसतन 4 से 6 डिग्री सेल्सियस तक की उल्लेखनीय गिरावट दर्ज की जा सकती है। हाल के दिनों में जहां तापमान 45 डिग्री के पार दर्ज किया जा रहा था, वहीं इस बदलाव के बाद लू के थपेड़ों की तीव्रता समाप्त हो जाएगी। हालांकि, राहत की इन खबरों के बीच मौसम विभाग ने कृषि क्षेत्र और आम नागरिकों के लिए सुरक्षात्मक दिशा-निर्देश भी जारी किए हैं। अचानक आने वाली तेज आंधी और विशेष रूप से ओलावृष्टि के कारण खेतों में खड़ी फसलों और बागवानी को संभावित नुकसान पहुंच सकता है, जिसको ध्यान में रखते हुए किसानों को सतर्क रहने के लिए कहा गया है।
प्रशासनिक और आधिकारिक स्तर पर, राज्य आपदा प्रबंधन प्राधिकरणों और स्थानीय नागरिक निकायों ने इस अलर्ट के मद्देनजर अपनी तैयारियां तेज कर दी हैं। बिजली निगमों को विशेष तौर पर सतर्क किया गया है क्योंकि आंधी-तूफान के दौरान पेड़ों के गिरने या बिजली के खंभे क्षतिग्रस्त होने से आपूर्ति लाइनों में व्यवधान आने का खतरा सबसे अधिक रहता है। पहाड़ी राज्यों के जिलाधिकारियों ने पर्यटकों और स्थानीय निवासियों को ऊंचे पर्वतीय ट्रैकों पर न जाने और भूस्खलन संभावित क्षेत्रों से दूर रहने की कानूनी हिदायत दी है। इसके अतिरिक्त, नागरिक उड्डयन और रेलवे विभागों को भी दृश्यता कम होने की स्थिति में सुरक्षा प्रोटोकॉल का सख्ती से पालन करने के निर्देश दिए गए हैं ताकि किसी भी अप्रिय स्थिति से समय रहते निपटा जा सके।
उत्तर भारत के पर्यावरण और जनजीवन पर इस मौसमी घटनाक्रम का प्रभाव अत्यंत व्यापक और बहुआयामी सिद्ध होगा। लंबे समय से जारी शुष्क मौसम और अत्यधिक गर्मी के कारण क्षेत्रीय जल स्रोतों पर बढ़ा दबाव इस बारिश के बाद कुछ हद तक कम होने की उम्मीद है। इसके साथ ही, हवा में मौजूद धूल के कणों और प्रदूषण के स्तर में भी इस वर्षा के चलते काफी कमी आएगी, जिससे वायु गुणवत्ता में बड़ा सुधार देखने को मिलेगा। भीषण ग्रीष्मकाल के उस दौर के बाद, जिसने आम लोगों के स्वास्थ्य और दैनिक गतिविधियों को गंभीर रूप से प्रभावित किया था, पश्चिमी विक्षोभ का यह आगमन एक महत्वपूर्ण प्राकृतिक संतुलन के रूप में सामने आया है, जो आगामी दिनों में जनजीवन को सुचारू और आरामदायक बनाने में मददगार साबित होगा।
Lalita Rajput
इन्हें लेखन क्षेत्र में लगभग 5 वर्षों का अनुभव है। इस दौरान इन्होंने फाइनेंस, कैलेंडर और बिज़नेस न्यूज़ को गहराई से कवर किया है। इनकी शैक्षणिक पृष्ठभूमि वित्त से जुड़ी है—इन्होंने एमबीए (फाइनेंस) किया है और वर्तमान में फाइनेंस में पीएचडी कर रही हैं। जनवरी 2026 से ये दै. प्रातःकाल में कार्यरत हैं, जहाँ बिज़नेस, फाइनेंस, मौसम और भारतीय सीमाओं से जुड़े समाचार सरल, सटीक और व्यवस्थित ढंग से प्रस्तुत करती हैं।",1.0
