title,url,source,date,language,state,district,search_term,full_text,relevance_score
"दिल्ली में बदला मौसम, यूपी-राजस्थान से लेकर पहाड़ों तक आंधी-बारिश का खतरा; IMD का ऑरेंज अलर्ट जारी - Janbhawna Times",https://news.google.com/rss/articles/CBMiwgFBVV95cUxNX0R0ck9ZRmk0T3owQXVucTc4b3RYaWJUX1RDSkt3cGNlWlBrOXpNMEg2NkoybmhUMVZqMEhJQVZJc0tVN2p2bHc4SHdrUzg5OVpCbXpOTUlGdlVfdk1XcnVuczVxcEZRYm53QkNtczFlZWhPY3NqOThhSXFOMXVPSWVvdk1jMEt1cHQzTVJnR2NQdEtVQk5XUDd0djhmN09jN1o1Tk1xVUxheUhYbUtHOWN3elFNeFhMZS1sX0xraVFLZw?oc=5,Janbhawna Times,2026-04-07T08:05:00+05:30,hi,Uttar Pradesh,,"(""हीट एक्शन प्लान"" OR ""गर्मी से राहत"" OR चेतावनी OR ""रेड अलर्ट"" OR ""ऑरेंज अलर्ट"" OR ""येलो अलर्ट"" OR एडवाइजरी OR ""राहत सामग्री"" OR ""राहत शिविर"" OR मुआवजा) Uttar Pradesh","दिल्ली में बदला मौसम, यूपी-राजस्थान से लेकर पहाड़ों तक आंधी-बारिश का खतरा; IMD का ऑरेंज अलर्ट जारी
देशभर में मौसम ने अचानक करवट ले ली है. पश्चिमी विक्षोभ के कारण दिल्ली, यूपी समेत कई राज्यों में तेज आंधी, बारिश और ओलावृष्टि का अलर्ट जारी हुआ है, जिससे लोगों और किसानों की चिंता बढ़ गई है.
अप्रैल की शुरुआत आमतौर पर गर्मी के बढ़ने का संकेत देती है, लेकिन इस बार मौसम ने अलग ही रंग दिखा दिया है. देश के कई हिस्सों में अचानक बदलते मौसम ने लोगों को चौंका दिया है. कहीं तेज आंधी चल रही है तो कहीं झमाझम बारिश हो रही है. ऐसा लग रहा है जैसे गर्मी की जगह मानसून ने दस्तक दे दी हो. मौसम विभाग ने आने वाले दिनों में कई राज्यों के लिए अलर्ट जारी किया है, जिससे लोगों की चिंता भी बढ़ गई है, खासकर किसानों की.
मौसम में इस बदलाव की मुख्य वजह एक नया पश्चिमी विक्षोभ है, जो 7 अप्रैल से सक्रिय हो चुका है. इसके कारण उत्तर भारत से लेकर पश्चिमी इलाकों तक मौसम का मिजाज बिगड़ने वाला है. तेज हवाओं के साथ हल्की से मध्यम बारिश की संभावना जताई गई है. वहीं, पहाड़ी क्षेत्रों में कहीं-कहीं भारी बारिश और बर्फबारी भी हो सकती है. कुछ जगहों पर ओलावृष्टि की भी आशंका है, जो फसलों को नुकसान पहुंचा सकती है.
दिल्ली में बदलेगा मौसम का मिजाज
राजधानी दिल्ली में पिछले कुछ दिनों से मौसम थोड़ा शांत था, लेकिन अब यहां भी बदलाव देखने को मिलेगा. मौसम विभाग के अनुसार 7 और 8 अप्रैल को दिल्ली में बादल छाए रहेंगे और गरज-चमक के साथ हल्की बारिश हो सकती है. इसके साथ ही तेज हवाएं और बिजली गिरने की संभावना भी जताई गई है. ऐसे में लोगों को सतर्क रहने और जरूरी काम होने पर ही घर से बाहर निकलने की सलाह दी गई है.
उत्तर प्रदेश में ऑरेंज अलर्ट
उत्तर प्रदेश के लोगों को थोड़ी राहत के बाद फिर से मौसम की मार झेलनी पड़ सकती है. मौसम विभाग ने 7 से 9 अप्रैल के बीच पूरे राज्य में तेज आंधी, बारिश और ओलावृष्टि का ऑरेंज अलर्ट जारी किया है. इस दौरान कई जिलों में 40 से 60 किलोमीटर प्रति घंटे की रफ्तार से हवाएं चल सकती हैं. पश्चिमी यूपी से शुरू होकर यह मौसम पूर्वी हिस्सों तक पहुंच सकता है.
पहाड़ी राज्यों में बारिश और बर्फबारी
जम्मू-कश्मीर, हिमाचल प्रदेश और उत्तराखंड में मौसम और भी ज्यादा खराब हो सकता है. यहां हल्की से मध्यम बारिश के साथ ऊंचाई वाले इलाकों में बर्फबारी की संभावना है. तेज बारिश के कारण भूस्खलन और अचानक बाढ़ का खतरा भी बढ़ गया है. प्रशासन ने लोगों को सतर्क रहने की सलाह दी है.
हरियाणा, पंजाब और मध्य प्रदेश में असर
हरियाणा और पंजाब के कई जिलों में भी मौसम खराब रहने वाला है. यहां तेज हवाओं के साथ बारिश हो सकती है. चंडीगढ़ समेत कई शहरों में अलर्ट जारी किया गया है. मध्य प्रदेश के कुछ हिस्सों में भी तेज हवाएं और बारिश की संभावना जताई गई है, जिससे तापमान में गिरावट आ सकती है.
राजस्थान में ओलावृष्टि का खतरा
राजस्थान में 7 से 9 अप्रैल के बीच मौसम काफी खराब रह सकता है. जयपुर, भरतपुर और आसपास के इलाकों में बारिश के साथ ओले गिरने की संभावना है. जोधपुर, बीकानेर और अजमेर में तेज हवाएं चल सकती हैं, जिसकी रफ्तार 50 से 60 किलोमीटर प्रति घंटा तक पहुंच सकती है.
पश्चिम बंगाल में अलग मिजाज
जहां एक तरफ देश के कई हिस्सों में बारिश हो रही है, वहीं पश्चिम बंगाल में गर्मी बढ़ने के आसार हैं. हालांकि उत्तर बंगाल के कुछ जिलों जैसे दार्जिलिंग, जलपाईगुड़ी और कूच बिहार में हल्की बारिश और गरज-चमक हो सकती है.",1.0
"कई स्थानों पर तापमान 40 डिग्री सेल्सियस से अधिक रहा, और सुबह से रात तक गर्म और शुष्क मौसम बना रहा। - Vietnam.vn",https://news.google.com/rss/articles/CBMijwFBVV95cUxNVW5mZ254a2FheEI1MzYyelBZcFN2SGlkUEpZOVA1QkZraVVOV2ExNE9GQ3gzblNWTGk0eWJpZGYyb0dHWW5VMjUxbndxcmtqa2liZ19DZjBacmVXdmxyanJwblN1eG8xUE14RnItSWs4QjNzLXU1YjdBTmttMENNaUd4eF9TTF9zRHJYLXNBOA?oc=5,Vietnam.vn,2026-04-07T07:09:30+05:30,hi,Uttar Pradesh,,"""लू"" Uttar Pradesh","राष्ट्रीय मौसम विज्ञान और जल विज्ञान पूर्वानुमान केंद्र के अनुसार, 6 अप्रैल को कई स्थानों पर तापमान 40 डिग्री सेल्सियस से अधिक रहा, जैसे कि ताई हिएउ (न्घे आन) में 40.3 डिग्री सेल्सियस, हुआंग सोन ( हा तिन्ह ) में 40.1 डिग्री सेल्सियस और डोंग होई में 40.2 डिग्री सेल्सियस; इन क्षेत्रों में हवा की आर्द्रता केवल 35-40% थी।
मौसम विज्ञान और जल विज्ञान विशेषज्ञों का अनुमान है कि 7 अप्रैल को उपर्युक्त क्षेत्रों में गर्म मौसम जारी रहेगा और तापमान 6 अप्रैल के बराबर या उससे अधिक रहेगा। मध्य वियतनाम और उत्तर-पश्चिमी क्षेत्र में आमतौर पर तापमान 37-39 डिग्री सेल्सियस रहेगा, और कई स्थानों पर यह 40 डिग्री सेल्सियस से भी अधिक हो सकता है। उत्तर-पूर्वी क्षेत्र और हनोई में गर्म मौसम शुरू हो जाएगा और तापमान 35-37 डिग्री सेल्सियस तक पहुंच जाएगा। मध्य उच्चभूमि और दक्षिणी वियतनाम में तापमान 35-37 डिग्री सेल्सियस के बीच बना रहेगा।
यह लू की चरम सीमा है, जिसकी विशेषता यह है कि यह केवल दोपहर तक ही सीमित नहीं रहती बल्कि सुबह से लेकर देर शाम तक बनी रहती है। लू मुख्य रूप से निम्न दबाव प्रणाली और फोहेन प्रभाव (शुष्क, गर्म दक्षिण-पश्चिम हवाएँ) के संयोजन के कारण होती है, जिसके परिणामस्वरूप गर्म, शुष्क मौसम और कम आर्द्रता रहती है।
मौसम विज्ञान एजेंसी का अनुमान है कि अगले एक-दो दिनों तक लू की तीव्रता मौजूदा लू के समान ही बनी रहेगी और तापमान कम करने के लिए व्यापक स्तर पर गरज के साथ बारिश होने की संभावना बहुत कम है। यदि बारिश होती भी है, तो वह केवल कुछ क्षेत्रों में ही होगी और मात्रा में नगण्य होगी।
भीषण गर्मी के साथ-साथ, जंगल में आग लगने और स्थानीय सूखे का खतरा भी बढ़ रहा है, खासकर मध्य वियतनाम और मध्य पर्वतीय क्षेत्रों में। मौसम संबंधी आश्रय स्थल के अंदर मापे गए तापमान की तुलना में बाहर का वास्तविक तापमान 2-4 डिग्री सेल्सियस अधिक हो सकता है।
स्रोत: https://www.sggp.org.vn/nhieu-noi-vuot-40-do-c-nang-nong-kho-keo-dai-tu-sang-den-toi-post846674.html",1.0
"Delhi-NCR weather update: Rain brings relief from rising heat, yellow alert issued for two days; check full forecast - news24online.com",https://news.google.com/rss/articles/CBMi9gFBVV95cUxOOVV3S19rZ0ExdWEySzNaQkxOeUdLVXA4VW1FcWJzNDlCRXJ5NEx0X2ZyZW5UaGlRS3BaMFhsNnBGUW9wY0RxX0hVcUtvX3dMdnN5OElmZ1pqbGEwa1FpeHZyVWJkdHlENmR5cENRZkpmSmJEU2xJRHo5eEp1QWR6cjE5cHdFdEI5YjZiNFkxTUtrLXFsZ1FRcC1RczVCTkR0RmxvSm05NnlXYWlfTFpOdkFVaHNUdFdvaVpqRzNsVldVTzBvMG9EVC16My1MUm9ZMktOQ3kyUjlraHYxZWpLSENpYnhPWlFaQkpxZXJhcVRjUlBTR1HSAfoBQVVfeXFMUE9fUjU2VkNFei1DbURhQ1NkRXBRMWxEUHdIUzBZWWcxbDl2WkxFQUVDenQ0Nl9yd0lDdS03MzB2MEcxWmJoQTNRaDRQd2RTM0ROdE52cm1yZGRXOTVFQzA3YlJHZVNMdk5oNWdBSVdzRFZSUC15dGJXNGUwS0ZKa3ZBNVBpd1M2RXZOZWNfa1k5ZFVLWjc5bW9takpTaDk1ZlFMUE1tVk5PM1huTHpwVnZURVU2WXF6V1NERUF2Q3RwRk1fZnVuTlVLeW05TDdDeUI0SVktSGZDb1dlZjZkU2FSS0hMZHVWRUlERjRXT2E2ZW9NbVh5ckpDUQ?oc=5,news24online.com,2026-04-07T07:19:17+05:30,en,Uttar Pradesh,,"(""heat advisory"" OR ""heat action plan"" OR ""heat alert"" OR ""IMD warning"" OR ""IMD alert"" OR ""red alert"" OR ""orange alert"" OR ""yellow alert"" OR ""NDMA advisory"" OR ""cooling shelter"" OR ""relief measures"" OR ""heat compensation"" OR ""severe weather warning"") Uttar Pradesh","› cities› delhi ncr›delhi ncr weather update rain brings relief from rising heat yellow alert issued for two days check full forecast
Delhi/NCR
Delhi-NCR weather update: Rain brings relief from rising heat, yellow alert issued for two days; check full forecast
Delhi-NCR on Tuesday experienced a shift in weather conditions as rain brought temporary relief from the intensifying early-summer heat. The variations in weather patterns are attributed to an active western disturbance impacting North India.
Highlights
Created by News24 AI • Verified by the editorial team
Delhi-NCR Weather Forecast
The IMD issued a yellow alert for Delhi-NCR on April 7 and 8, predicting rain, thunderstorms, and gusty winds of 30 to 40 kmph.
A western disturbance is causing variations in weather patterns across North India.
Delhi is expected to experience a 2-4°C temperature drop on April 7 and 8.
Upcoming Weather Events
Another fresh western disturbance is likely to affect Northwest India from April 11, 2026.
Delhi-NCR weather update: The Indian Meteorological Department (IMD) has issued a yellow alert for rainfall, thunderstorms, and gusty winds reaching 30 to 40 kmph in Delhi-NCR on April 7 and 8. The national capital and adjoining regions on Tuesday experienced a shift in weather conditions as rain brought temporary relief from the intensifying early-summer heat.
The variations in weather patterns are attributed to an active western disturbance impacting North India. The current temperature in Delhi is 20°C (feels like 22°C). IMD has also predicted another fresh western disturbance likely to affect Northwest India from April 11, 2026.
Delhi-NCR weather forecast today
April 7: Delhi-NCR is expected to see a generally cloudy sky with one to two spells of very light to light rain accompanied by thunderstorms, lightning, and strong winds (30-40 kmph) gusting to 50 kmph during the forenoon to afternoon. Another spell of very light to light rain will lash the city during the evening and night.
April 8: Delhi-NCR will wake up to a generally cloudy sky tomorrow with one to two spells of very light to light rain accompanied by thunderstorms, lightning, and strong winds (30-40 kmph) gusting to 50 kmph during the morning to forenoon. Another spell of very light to light rain will lash the city during the afternoon and evening.
How will weather in Delhi-NCR be over the next four days?
Delhi is likely to witness a noticeable drop in temperature of 2–4°C today and tomorrow. On April 9, 10, and 11, the city will see a mainly clear sky with strong surface winds traveling at a speed of 30 to 40 kmph during the day. Thereafter, on April 12, skies will remain clear.
Delhi-NCR weather update: The Indian Meteorological Department (IMD) has issued a yellow alert for rainfall, thunderstorms, and gusty winds reaching 30 to 40 kmph in Delhi-NCR on April 7 and 8. The national capital and adjoining regions on Tuesday experienced a shift in weather conditions as rain brought temporary relief from the intensifying early-summer heat.
The variations in weather patterns are attributed to an active western disturbance impacting North India. The current temperature in Delhi is 20°C (feels like 22°C). IMD has also predicted another fresh western disturbance likely to affect Northwest India from April 11, 2026.
---Advertisement---
Delhi-NCR weather forecast today
April 7: Delhi-NCR is expected to see a generally cloudy sky with one to two spells of very light to light rain accompanied by thunderstorms, lightning, and strong winds (30-40 kmph) gusting to 50 kmph during the forenoon to afternoon. Another spell of very light to light rain will lash the city during the evening and night.
April 8: Delhi-NCR will wake up to a generally cloudy sky tomorrow with one to two spells of very light to light rain accompanied by thunderstorms, lightning, and strong winds (30-40 kmph) gusting to 50 kmph during the morning to forenoon. Another spell of very light to light rain will lash the city during the afternoon and evening.
---Advertisement---
How will weather in Delhi-NCR be over the next four days?
Delhi is likely to witness a noticeable drop in temperature of 2–4°C today and tomorrow. On April 9, 10, and 11, the city will see a mainly clear sky with strong surface winds traveling at a speed of 30 to 40 kmph during the day. Thereafter, on April 12, skies will remain clear.",1.0
