title,url,source,date,language,state,district,search_term,full_text,relevance_score
"Chhattisgarh Heatwave: Rajnandgaon Hits 45.5°C Temperature, IMD Alert - Dainik Jagran MP CG",https://news.google.com/rss/articles/CBMi2gFBVV95cUxNUXdFdzlfdlAtQ0JXLXF6bmxKVzJoQjBGdWxvYkpPZWlrMDMyWkF2TFhpMjAzMV9qYjJycXJzWUtCMENFME5PUFNNU1dSRlpiN0lBNTc1QWE1OUFaNld4MGlYbjNRZWhkTXV4NWFpWk84WW1ibW1vVzlHaXduc3NsdmRXQ2dTUHFjUUpjY0Z3M2g0OXJIVWFJV0RGYUVEZUEweUs4d1hVQTNUcC1HWFlaeWRCd0xhTm9Oa01zRTJKa0NTdHMzajJtRmUxYm9nQWZiMWZ3c3REd3pidw?oc=5,Dainik Jagran MP CG,2026-04-26T11:38:40+05:30,en,Chhattisgarh,Raipur,"(heatwave OR ""heat wave"" OR ""severe heatwave"" OR ""extreme heat"" OR ""heat spell"" OR ""scorching heat"" OR ""blistering heat"" OR ""sweltering heat"" OR ""hot winds"" OR loo OR ""hot loo winds"" OR ""intense heat"" OR ""unbearable heat"" OR ""deadly heat"" OR heat OR ""weather forecast"" OR ""weather update"" OR ""weather alert"" OR ""IMD forecast"" OR ""IMD prediction"" OR ""IMD alert"" OR IMD OR ""rising temperatures"" OR ""temperatures expected to rise"" OR ""relief from heat"" OR ""respite from heat"" OR ""heat respite"" OR ""respite from scorching heat"") Chhattisgarh","Chhattisgarh Heatwave: Rajnandgaon Hits 45.5°C Temperature, IMD Alert
Raipur (CG)
Chhattisgarh heatwave intensifies as Rajnandgaon records 45.5°C. IMD issues alert for heatwave, thunderstorms and light rain across state.
The Chhattisgarh heatwave conditions have intensified across the state, with soaring daytime temperatures pushing life out of gear in several districts. According to the India Meteorological Department (IMD), the next three days are expected to remain extremely hot, with no significant change in maximum temperatures, followed by a slight dip thereafter. Officials have also issued a heatwave warning across multiple regions, urging residents to take precautions amid rising temperatures.
Rajnandgaon hottest spot
Rajnandgaon emerged as the hottest location in the state, recording a blistering 45.5°C on Friday. The figure marks one of the highest temperatures of the season so far, reflecting the severity of the ongoing Chhattisgarh heatwave. Other districts have also reported above-normal temperatures, contributing to widespread heat stress across the region.
IMD issues alert
The IMD has cautioned that hot and dry conditions will continue, with intermittent heatwave spells likely in several pockets. However, meteorologists have also indicated the possibility of isolated weather activity, including thunderstorms, lightning, and gusty winds reaching speeds of 40–50 kmph in some areas on April 26. Light rainfall cannot be ruled out in select regions, even as the heatwave persists simultaneously.
Raipur under heat
In the state capital Raipur, the maximum temperature is expected to hover around 45°C, while the minimum may remain near 28°C. Weather experts suggest that the city will continue to experience heatwave-like conditions, adding to discomfort for residents. The ongoing Chhattisgarh heatwave has significantly impacted daily life, with reduced outdoor activity during peak afternoon hours.
Weather variation expected
Officials attribute the rising temperatures to a combination of atmospheric conditions, including a trough extending from Vidarbha to South India and cyclonic circulation over the Bay of Bengal–Odisha region. These patterns are driving hot and dry winds over central India. Despite this, sporadic weather changes could bring temporary relief in some pockets through light rain and thunderstorms.
Anganwadi timings revised
In response to the severe heat, the state administration has revised timings for Anganwadi centres across Chhattisgarh. From April 23 to June 30, centres will operate from 7 am to 11 am, while services for children will be limited between 7 am and 9 am. The decision aims to protect children and staff from the peak impact of the Chhattisgarh heatwave. Normal timings will resume from July 1.
Health advisory issued",1.0
"CG Weather update: रायपुर में टूटा पांच वर्षों का रिकॉर्ड, राजनांदगांव में तापमान 45 डिग्री के पार, कुछ जगहों पर आंधी और वज्रपात की भी चेतावनी - naidunia.com",https://news.google.com/rss/articles/CBMivwFBVV95cUxQOHVQSVdoQVFKUEZjb0d3NVpNeG51a0xOUDdwREdXdzhZbU5sZ0NReVVwU2N3SjR0c1hpU0ZQdTFOUF8weXdSTzh5N2loSWc3dnY0S1doZGhnUk00dzlIZThicFg2bFpuaW5nS182QW5Ld1Vwb3QyQ3dreTVodkcyOFRTS3hzaV8tdUI0MWR3ZUY2VEx0VXRqTGtpdGU5LXV6RDAxX0NlWDRGQ1Vta2owOC1iMU1WV25jZXB0WE5Rdw?oc=5,naidunia.com,2026-04-26T09:54:30+05:30,hi,Chhattisgarh,Raipur,"(""हीट एक्शन प्लान"" OR ""गर्मी से राहत"" OR चेतावनी OR ""रेड अलर्ट"" OR ""ऑरेंज अलर्ट"" OR ""येलो अलर्ट"" OR एडवाइजरी OR ""राहत सामग्री"" OR ""राहत शिविर"" OR मुआवजा) Chhattisgarh","रायपुर में टूटा पांच वर्षों का रिकॉर्ड, राजनांदगांव में तापमान 45 डिग्री के पार।
HighLights
अगले तीन दिनों तक राहत के आसार नहीं
रायपुर में अधिकतम तापमान 44.6 डिग्री दर्ज
कहीं-कहीं गरज-चमक के साथ हल्की बारिश के आसार
नईदुनिया प्रतिनिधि, रायपुर। राजधानी रायपुर में अप्रैल की तपिश ने इस बार पांच वर्ष का रिकॉर्ड तोड़ दिया है। शनिवार को अधिकतम तापमान 44.6 डिग्री सेल्सियस दर्ज किया गया, जो वर्ष 2021 के बाद सबसे अधिक है और सामान्य से 4.2 डिग्री ज्यादा है।
प्रदेश में गर्मी ने इस कदर असर दिखाया कि राजनांदगांव 45.5 डिग्री के साथ सबसे गर्म रहा। जबकि रायपुर भी 45 डिग्री के बेहद करीब पहुंच गया।
अगले तीन दिनों तक राहत के आसार नहीं
तेज धूप और गर्म हवा ने दिनचर्या को प्रभावित कर दिया है। दोपहर में सड़कें सूनी नजर आ रही हैं। मौसम विभाग ने साफ संकेत दिए हैं कि अगले तीन दिनों तक राहत के आसार नहीं हैं और मध्य छत्तीसगढ़ में ग्रीष्म लहर जैसी स्थिति बनी रहेगी।
हालांकि बंगाल की खाड़ी से आ रही नमी के चलते कहीं-कहीं गरज-चमक के साथ हल्की बारिश की संभावना है, लेकिन इससे गर्मी के तेवर नरम पड़ने की उम्मीद कम ही है।
बना हुआ है यह सिस्टम
विभाग के अनुसार प्रदेश के मौसम को प्रभावित करने वाले कई सिस्टम एक साथ सक्रिय हैं। पूर्वी उत्तर प्रदेश और उसके आसपास डेढ़ किलोमीटर ऊंचाई तक ऊपरी हवा का चक्रीय चक्रवाती परिसंचरण बना हुआ है। वहीं, उत्तर अंदरूनी कर्नाटक से कोमोरिन क्षेत्र तक 0.9 किलोमीटर ऊंचाई तक द्रोणिका विस्तारित है।
इसके साथ ही अंदरूनी महाराष्ट्र के आसपास 3.1 से 5.8 किलोमीटर ऊंचाई तक प्रति चक्रवात सक्रिय है। इन मौसमी सिस्टम के प्रभाव से बंगाल की खाड़ी से नमी युक्त हवा प्रदेश में पहुंच रही है।
एक-दो स्थानों पर गरज-चमक के साथ छींटे पड़ने की संभावना
इसी के चलते दक्षिण छत्तीसगढ़ के कुछ क्षेत्र में रविवार को प्रदेश के एक-दो स्थानों पर हल्की वर्षा या गरज-चमक के साथ छींटे पड़ने की संभावना जताई गई है। कुछ स्थानों पर अंधड़ और वज्रपात की भी चेतावनी जारी की गई है।
अप्रैल में रायपुर का अधिकतम तापमान (डिग्री सेल्सियस)
प्रदेश के शहरों का तापमान लगातार सामान्य से ऊपर बना हुआ है। बिलासपुर में 43.6, दुर्ग में 43.2 और पेंड्रारोड में 41.7 डिग्री तापमान दर्ज किया गया। वहीं अंबिकापुर में 41.0 और जगदलपुर में 38.0 डिग्री तापमान रहा। सभी शहरों में तापमान सामान्य से दो से चार डिग्री अधिक रहने से लू का असर बढ़ गया है और जनजीवन प्रभावित हो रहा है।
This website uses cookie or similar technologies, to enhance your browsing experience and provide personalised recommendations. By continuing to use our website, you agree to our Privacy Policy and Cookie Policy.",1.0
