title,url,source,date,language,state,district,search_term,full_text,relevance_score
"Gujarat, get ready for more heatwave days in May - The Times of India",https://news.google.com/rss/articles/CBMiwgFBVV95cUxNaW5KZDJmMzFQTWMtQkY0clJUOG1GajZ3b0xsakoxWmwxQjkzUks2T2Z6SEhZMkZjak5PRHg1WU9pdWEwNmVtR2p6ZUNQS2FSUDVZeWpueENtZTAzM3B1andxRmtvamlGeFBBaURwdFJlTU5jLWw3SGZuQjJDbHF3ZFZua214XzlaSWZUNDlmYjRVVWFlVFp4MlVPcWx1MHprYzFOaVZTZ3hHeFJudFV2dXRqbXdoQTFmY0lXcDR6U3cyd9IBxwFBVV95cUxNMlh2dGRzWmd5XzBoVktJNlJZUjRLSHZVMkF2TjV1QUdSYkJVbklXcUNieVRVaFVRV0cyU0toendvemd5eEltQTk3dnFVMHk1WXBZWUFObE5yOFI0aXNHMFZ5bjRsN3I0OEEtUlZfQXdNSXhiS2JYQkZNQ1dJWnZSY3lORjE3dEpFZG1pUGdNckM0NmZ1QXRXMnVfMnQwSFFSMHFwQW5XWlNxcWJJMjVoUm5WNzRVekc3S1I4a1BjX2VVbTBDRWhr?oc=5,The Times of India,2026-05-02T02:15:00+05:30,en,Gujarat,Ahmedabad,"(heatwave OR ""heat wave"" OR ""severe heatwave"" OR ""extreme heat"" OR ""heat spell"" OR ""scorching heat"" OR ""blistering heat"" OR ""sweltering heat"" OR ""hot winds"" OR loo OR ""hot loo winds"" OR ""intense heat"" OR ""unbearable heat"" OR ""deadly heat"" OR heat OR ""weather forecast"" OR ""weather update"" OR ""weather alert"" OR ""IMD forecast"" OR ""IMD prediction"" OR ""IMD alert"" OR IMD OR ""rising temperatures"" OR ""temperatures expected to rise"" OR ""relief from heat"" OR ""respite from heat"" OR ""heat respite"" OR ""respite from scorching heat"") Gujarat","Ahmedabad: If you thought that the April sun was cruel, brace yourself for some bad news. Gujarat is heading into a hotter-than-usual May and weather officials warn of not only higher number of heatwave days, but also more prolonged spells. What's worse is that nights are expected to stay warmer, adding to overall discomfort, according to the long-range forecast (LRF) for May released by the India meteorological department on Friday.
Director general of meteorology, IMD, Mrityunjay Mohapatra, said, ""Minimum temperatures are expected to remain above normal across large parts of the country during May.""
The forecast suggests that maximum temperatures in Gujarat will be above normal in most areas, except for some pockets of northeast Gujarat. Minimum temperatures are expected to be significantly higher in peninsular Saurashtra and south Gujarat, moderately higher in central Gujarat, and close to normal in Kutch and north Gujarat.
The heatwave outlook points to a higher likelihood of heatwave conditions in Saurashtra and Kutch, as well as parts of central and south Gujarat. Officials have cautioned that the combination of higher day and night temperatures could intensify heat stress.
In April, the IMD said, most parts of the country experienced normal to below-normal maximum temperatures. The weather pattern in April showed variability, with most parts of India recording normal to below-normal maximum temperatures. However, southern peninsular India saw above-normal heat. The IMD attributed fluctuations during the month to seven Western Disturbances that influenced weather conditions across the country.
On rainfall, IMD has projected above-normal rainfall across most parts of the country in May. However, some regions in east, northeast and east-central India may receive below-normal rainfall. In Gujarat, most areas are expected to receive above-normal rainfall, except for a few locations in coastal Saurashtra.
On the onset of the southwest monsoon, Mohapatra said, ""The monsoon may arrive over the Andaman and Nicobar Islands around May 14-16.""",1.0
Gujarat Weather Forecast: ગુજરાતમાં હીટવેવ જેવી સ્થિતિ - GujaratFirst,https://news.google.com/rss/articles/CBMinwFBVV95cUxPQlMxOEI3LTFNeUc1VWh4M01TN2FpYWlDc0FHMGxxM0xNSkNmazEwLWM5bzZ4dzhyZUxQWjlhTmVSOXBDR2tleXBmazlIUVhCdi1NcTFMbS03eC1WVVRwWm1Xa0k0eldOQnhWa0dSdUlIMXRZTmQtNjdYaEtXVkFUZnhFUHBSX2NjWjNpX2hRTmozSGd5dUNUVEZyX3psa00?oc=5,GujaratFirst,2026-05-02T07:52:01+05:30,gu,Gujarat,Ahmedabad,"(""ભારે ગરમી"" OR ""આકરી ગરમી"" OR લૂ OR હીટવેવ OR ""ઉષ્ણ મોજું"" OR ""ગરમીનો પ્રકોપ"" OR તાપ OR ""આકરો તાપ"" OR ""અસહ્ય ગરમી"" OR ""ભયાનક ગરમી"") Gujarat","Gujarat Weather Forecast: આગામી 48 કલાક રાજ્યમાં અસહ્ય ઉકળાટ રહેશે, મે મહિનામાં ગરમી તોડશે રેકોર્ડ
Gujarat Weather Forecast: ગુજરાત (Gujarat) માં મે મહિનાની શરૂઆત સાથે જ ગરમીનો પારો આસમાને પહોંચી રહ્યો છે. હવામાન વિભાગ (Meteorological Department) દ્વારા રાજ્યમાં ગરમી અને અસહ્ય ઉકળાટને લઈને નવી આગાહી કરવામાં આવી છે. પવનની દિશામાં થયેલા ફેરફારને કારણે આગામી દિવસોમાં નાગરિકોએ કાળઝાળ ગરમીનો સામનો કરવો પડશે.
Gujarat માં ગરમીનો પ્રકોપ
હવામાન વિભાગના જણાવ્યા અનુસાર, પશ્ચિમ દિશાના પવન (Westerly Winds) ફૂંકાવાને કારણે રાજ્યમાં ગરમીનું પ્રમાણ વધશે. આગામી 48 કલાક સુધી તાપમાન (Temperature) યથાવત રહેવાની શક્યતા છે, પરંતુ ત્યારબાદ ઉકળાટ (Humidity/Discomfort) માં વધારો થઈ શકે છે. વિભાગનું પૂર્વાનુમાન (Forecast) છે કે મે મહિનામાં મહત્તમ તાપમાન સામાન્ય કરતા ઊંચું રહેશે. જોકે, ઉત્તર ગુજરાતના વિસ્તારોમાં લઘુતમ તાપમાન (Minimum Temperature) સામાન્ય કરતા થોડું નીચું રહેવાની શક્યતા છે.
Gujarat ના મોટાભાગના શહેરોમાં પારો 40 ડિગ્રીને પાર
તાપમાનના આંકડાઓ પર નજર કરીએ તો, અમદાવાદ (Ahmedabad) 43.3 ડિગ્રી તાપમાન સાથે રાજ્યનું સૌથી ગરમ શહેર નોંધાયું છે. આ સિવાય અન્ય શહેરોમાં પણ પારો ઊંચો રહ્યો છે:
ગાંધીનગર અને સુરેન્દ્રનગર: 42.6 ડિગ્રી
ભાવનગર અને રાજકોટ: 42.5 ડિગ્રી
અમરેલી, કંડલા અને ભુજ: 41.4 ડિગ્રી
ડીસા, પોરબંદર અને વડોદરા: 40 ડિગ્રી
પવનની દિશા બદલાતા વાતાવરણમાં ભેજ અને ઉકળાટનું પ્રમાણ વધશે, જેના કારણે મે મહિનામાં ગરમીની તીવ્રતા વધુ અનુભવાશે.
હવામાન વિભાગ દ્વારા રાજ્યમાં ગરમીની આગાહી | Gujarat First #GujaratWeather #Heatwave #SummerHeat #WeatherUpdate #IMD #TemperatureRise #HotWeather #BreakingNews #WeatherNews #IndiaWeather #HeatAlert #GujaratFirst pic.twitter.com/LrlSExeAqq
— Gujarat First (@GujaratFirst) May 2, 2026
આ પણ વાંચો: Rajkot : સૌરાષ્ટ્રમાં કાળઝાળ ગરમીનો કહેર, હિટસ્ટ્રોકથી છેલ્લા 48 કલાકમાં 2 ના મોત",1.0
