title,url,source,date,language,state,district,search_term,full_text,relevance_score
"यूपी: प्रदेश में भीषण गर्मी की होगी वापसी, चार से छह डिग्री तक चढ़ेगा पारा; इन जिलों में लू चलने का अलर्ट - Amar Ujala",https://news.google.com/rss/articles/CBMi5wFBVV95cUxQeEZzb003Z2VWaFV5bTktSzZITVpEcFl1Z0VaT0VIdm02bEF0Uzd6dFVtSkJURHNPTjJEUHZnRUpGX3RnYkkzTzlOVkEtdWJUZkdRN1NTc2ZzMlhOZlFzeFVnODlqSTVaR25TNm0yU1YyMG1wTlVGdFJ1XzlNNFhUMHYtOFhlaU1TLUVDUUs5dHVxR0NpM21lY3RRRHZSY1FlemEyZDh0TUJKTWxjTTNWaTd2SXpMNVlKMzBkdHVUVHZtcllHMFJwQUVBYUdESXhZWUl6MHpoMWNuYlVrTllXY0FDMk9EYVHSAewBQVVfeXFMTWZndEVfUkIwLUZPck9ULUt6LXlPSmdPdmp0YWd5cXFVNVBmOTdQZDY3VWxiN1lUSlltT2JvSktsWUhNb1FlMDVYX1FXRlVSbTZzMkw4UHBlQk5rdVpNWV9aay1nN3hRM0JqUDdwbTFUZnF3TUN2TmlJS1B5bWN4R3VTTmQyTElpbUQ1ZVpMMXdBalpqVUtwSEstNTBiUXpxTHlfbkhlTmVyUVBiNlFnQnVpbzNqX2hBdnRRZHF6alpCcU41YU5Lb0g5eWpDY0FnVmVERWxtWFA2ZTlMU0lmMzlKbmJ2UkduaEg0eUs?oc=5,Amar Ujala,2026-06-06T19:40:23+05:30,hi,Uttar Pradesh,,"""लू"" Uttar Pradesh","यूपी: प्रदेश में भीषण गर्मी की होगी वापसी, चार से छह डिग्री तक चढ़ेगा पारा; इन जिलों में लू चलने का अलर्ट
Weather in UP: विक्षोभ का असर कम होते ही प्रदेश में भीषण गर्मी की वापसी होने जा रही है। मौसम विभाग के अनुसार आने वाले दिनों में पारा और चढ़ेगा।
खबरें लगातार पढ़ने के लिए अमर उजाला एप डाउनलोड करें
या
वेबसाइट पर पढ़ना जारी रखने के लिए वीडियो विज्ञापन देखें
अगर आपके पास प्रीमियम मेंबरशिप है तो
विस्तार
उत्तर प्रदेश में बीते कई दिनों के माैसमी उतार चढ़ाव के बाद अब तपिश भरे दिनों की वापसी होने वाली है। माैसम विभाग की ओर से अगले पांच दिनों में प्रदेश भर में 4 से 6 डिग्री सेल्सियस तक की बढ़ोतरी का पूर्वानुमान है।
माैसम विभाग के मुताबिक रविवार से पूरे प्रदेश में धीरे धीरे पारे का चढ़ना शुरू होगा। इसके साथ ही मंगलवार से अगले तीन दिन यानी नाै जून से 11 जून के दाैरान उत्तर प्रदेश के ज्यादातर इलाकों के लू की चपेट में आने की आशंका है।
शनिवार को प्रदेश के बुंदेलखंड और दक्षिणी जिलों में तपिश और तीखी धूप का प्रकोप रहा। वहीं पूर्वांचल और तराई के कुछ जिलों में सुबह बादलों की आवाजाही से साथ तेज हवाएं चलीं। शनिवार को झांसी 45.2 डिग्री सेल्सियस तापमान के साथ प्रदेश का सबसे गर्म शहर रहा। इसके अलावा बांदा, उरई, फतेहपुर और वाराणसी में भी गर्मी का असर तीखा बना रहा।
आंचलिक मौसम विज्ञान केंद्र, लखनऊ के वरिष्ठ वैज्ञानिक अतुल कुमार सिंह ने बताया कि उत्तर प्रदेश में अब माैसम शुष्क रहेगा और तपिश भरे दिनों की वापसी होगी।
सर्वाधिक तापमान वाले जिले
बांदा- 42.2 डिग्री सेल्सियस
उरई- 41.4 डिग्री सेल्सियस
फतेहपुर- 41.4 डिग्री सेल्सियस
वाराणसी- 41.2 डिग्री सेल्सियस",1.0
"12 दिन की राहत के बाद फिर पड़ेगी झुलसाने वाली गर्मी! UP के 43 जिलों में बारिश, 9 जून से लौटेगी लू; मौसम विभाग का बड़ा अलर्ट - IND24",https://news.google.com/rss/articles/CBMiogFBVV95cUxOVV9qT0Vnc3h0NDNCMzNSVjlHMGFISGJ3TFRVeGpoRWlTNzBvdmtMUXE3a3liNUU0WkF1ZmRZVG5mZG1wMmVFZUZqbEkxeWkxZHd5NG5pUVJMeEdOSEVQQ0JNWW5EYmdrZjZuYWtWNGZUVjNubkVvN19haEVpOGR2SFNBOWJqcVgwYmJIXzhGSzk3cVhmZTZsMFVuMVo4SGFiWkE?oc=5,IND24,2026-06-06T20:17:36+05:30,hi,Uttar Pradesh,,"""लू"" Uttar Pradesh","लखनऊ। उत्तर प्रदेश में पिछले कई दिनों से जारी आंधी-बारिश के बीच मौसम ने शनिवार को एक बार फिर करवट ली। मऊ और गाजीपुर में तेज धूप के बाद अचानक झमाझम बारिश शुरू हो गई, जबकि गोरखपुर में धूलभरी आंधी चली। वाराणसी में देर रात गरज-चमक के साथ मूसलाधार बारिश हुई। इस बीच मौसम विभाग ने प्रदेश के 43 जिलों में बारिश और 21 जिलों में आंधी-तूफान का अलर्ट जारी किया है। हालांकि राहत की यह बारिश ज्यादा दिनों तक नहीं रहने वाली। मौसम वैज्ञानिकों का कहना है कि अगले 24 घंटे में पश्चिमी विक्षोभ का असर खत्म हो जाएगा और इसके बाद गर्मी एक बार फिर अपने रौद्र रूप में लौटेगी। 9 जून से प्रदेश में हीटवेव का नया दौर शुरू हो सकता है।
मऊ-गाजीपुर में दोपहर बाद बदला मौसम, 50 KM की रफ्तार से चली हवाएं
शनिवार सुबह तक मऊ और गाजीपुर में तेज धूप और उमस से लोग परेशान थे, लेकिन दोपहर करीब दो बजे अचानक मौसम बदल गया। तेज हवाओं के साथ जोरदार बारिश शुरू हुई, जिससे लोगों को भीषण गर्मी से राहत मिली। गोरखपुर में भी धूलभरी आंधी चली, जबकि वाराणसी में देर रात बिजली की गड़गड़ाहट के साथ करीब आधे घंटे तक तेज बारिश हुई।
43 जिलों में बारिश और 21 जिलों में आंधी का अलर्ट
मौसम विभाग ने प्रदेश के 43 जिलों में बारिश की संभावना जताई है, जबकि 21 जिलों में तेज आंधी और तूफान की चेतावनी जारी की गई है। कई इलाकों में 40 से 50 किलोमीटर प्रति घंटे की रफ्तार से हवाएं चलने की संभावना है। लोगों को खराब मौसम के दौरान सतर्क रहने की सलाह दी गई है।
अब खत्म होगा बारिश का दौर, फिर चढ़ेगा पारा
मौसम वैज्ञानिकों के मुताबिक पिछले 12 दिनों से जारी आंधी-बारिश का सिलसिला अब थमने वाला है। पश्चिमी विक्षोभ का असर खत्म होते ही तापमान में तेजी से बढ़ोतरी होगी। अनुमान है कि अगले कुछ दिनों में तापमान 5 से 6 डिग्री सेल्सियस तक बढ़ सकता है और कई जिलों में पारा 45 डिग्री के पार पहुंच जाएगा।
9 जून से शुरू होगा लू का नया दौर
मौसम विभाग के अनुसार 9 जून से उत्तर प्रदेश में हीटवेव यानी लू का नया दौर शुरू हो सकता है। विशेषज्ञों का कहना है कि लोगों को दोपहर के समय घर से बाहर निकलने से बचना चाहिए और पर्याप्त मात्रा में पानी पीना चाहिए।
वाराणसी सबसे गर्म, हरदोई में सबसे ठंडी रात
पिछले 24 घंटे में वाराणसी प्रदेश का सबसे गर्म शहर रहा, जहां अधिकतम तापमान 42.2 डिग्री सेल्सियस दर्ज किया गया। वहीं हरदोई में न्यूनतम तापमान 22 डिग्री सेल्सियस रिकॉर्ड किया गया, जो प्रदेश में सबसे कम रहा।
गाजियाबाद में गर्म हवाओं ने बढ़ाई परेशानी
गाजियाबाद में शनिवार को 15 किलोमीटर प्रति घंटे की रफ्तार से गर्म हवाएं चलती रहीं। अधिकतम तापमान 40.6 डिग्री सेल्सियस दर्ज किया गया। मौसम विभाग के अनुसार अगले 24 घंटों में बादल छाने और कुछ स्थानों पर हल्की बारिश की संभावना बनी हुई है।
बलिया में बारिश से मिली राहत
बलिया में दोपहर बाद अचानक मौसम बदल गया। घने बादल छा गए और तेज हवाओं के साथ बारिश शुरू हो गई। ठंडी हवाओं और बारिश की वजह से लोगों को गर्मी और उमस से राहत मिली। जिले में अधिकतम तापमान 38 डिग्री सेल्सियस और न्यूनतम तापमान 28 डिग्री सेल्सियस रिकॉर्ड किया गया।
अमेठी में हादसा, मिट्टी की दीवार गिरने से मां-बेटी की मौत
बारिश के बीच अमेठी में एक दर्दनाक हादसा भी हुआ। यहां मिट्टी की दीवार ढहने से मां और बेटी की मौत हो गई, जबकि परिवार का एक अन्य सदस्य गंभीर रूप से घायल हो गया।
फिलहाल राहत, लेकिन फिर सताएगी भीषण गर्मी
प्रदेश में फिलहाल बारिश और तेज हवाओं की वजह से लोगों को राहत जरूर मिली है, लेकिन मौसम विभाग ने साफ संकेत दिए हैं कि आने वाले दिनों में गर्मी और लू का प्रकोप फिर बढ़ सकता है।",1.0
