title,url,source,date,language,state,district,search_term,full_text,relevance_score
"Summer heat triggers sharp rise in gastro cases: Over 3,000 patients hospitalised in Rajkot with severe sto... - Bhaskar English",https://news.google.com/rss/articles/CBMiwgFBVV95cUxQR1VDZU9GbWw3YUgxNVZPTy1IQVh3cHRsVkdUbGJYRDFRRzZlbGU5bUJBRzBEdG5iZnYwcVVQQ2FBS0RpYUwwUjdEa2wyTEVZcG9DTHpFSlNhaE1laXlkZ3hBTUFRWTA2N3JCbXozZFpQbGJuVUtUMGpZNTh5VjBUNHN4aEFMWGx5S1NtdkQwZFdSZ3BkLVFGMURLZVdMTHFYaU9VM3phT0dnMkVJV2tzWndkMHZkWUxyYXJXNlhpT280Z9IBxwFBVV95cUxPZThSVE9sV0lXU1pyQ1pqcGQ0SmU3WTRQLWdsZENmbjJ0UnRjTDFndE0zSWQ3emtPb2hGRkdsMk9zdHROdTg2VEtSaEFLY20wdTBKcnJFRTlpSFlsTHViREtNWks5LUpqeUY2SlBINmdNUUF5U1BVRjdtbm9kWjJSQlRDcE1RUXdhc3pUTkgtSnJieWpFd1RZWnNHRWFsNGtHWFFuSl9GUkNjU2FJMWx4UU5nR3RaNmxPTmxydUprM2pveW1OYWlB?oc=5,Bhaskar English,2026-05-12T10:10:35+05:30,en,Gujarat,Rajkot,"""heatstroke"" Gujarat","- Rajkot: 3059 Hospitalised With Stomach Pain | Summer Heat Triggers Gastro
Summer heat triggers sharp rise in gastro cases:Over 3,000 patients hospitalised in Rajkot with severe stomach pain complaints
- Copy link
As temperatures across the state have crossed 43°C, cases of stomach-related illnesses are rising rapidly. Since March, the heat has intensified continuously, and from the beginning of May, temperatures have remained above 42°C in several cities, including Rajkot.
Along with dehydration and heatstroke, hospitals are also witnessing a sharp increase in patients suffering from stomach pain and gastro-related illnesses.
According to official data, between January and April 2026, as many as 3,059 patients in Rajkot were admitted to hospitals through the ‘108’ ambulance service due to severe stomach pain. Officials believe many more patients may have reached hospitals on their own for treatment.
Poor eating habits increasing gastro cases: Dr Praful Kamani
Former Rajkot Indian Medical Association (IMA) president and noted gastroenterologist Dr Praful Kamani said the combination of extreme heat and the ongoing wedding season has led to people neglecting their diet and hygiene.
Speaking to Divya Bhaskar, he said that over the last two months, hospitals have seen a significant rise in patients complaining of stomach pain, diarrhoea, vomiting, bloating and indigestion.
Check hygiene before consuming food or cold drinks",1.0
