title,url,source,date,language,state,district,search_term,full_text,relevance_score
"Banda News: किसान गश खाकर गिरा, लू लगने से मौत की आशंका - Amar Ujala",https://news.google.com/rss/articles/CBMizgFBVV95cUxNaC1JbE9SeGNmVDd5Z0FkN3M0bGdSZTRraEViSDRQRmZ3TVFjcWRmTnRUSXNvV3BiY0thY1JGTXF3UzJCTDFLa3lYYktZNDhTdy1nSEduLVZKdk95cUE0bEFMWkRENjdWa0UxWXZoNjlmcVY4aHNhQllRaHV1X3ZUa0xDN01ZM2dycEJBNE14VWlDQWY5TmhQdjFiZFJ5YzlVSVNKTnhvNk1FM2doSU84ZGJLRTZOcVphZ1ZkMUNrYng0c0NqNHUxek02M3ZOd9IB0wFBVV95cUxPbU1XZFA2MjVyUlU3ODNBeTBsUWJCRl9iRzQ1MXpQU0pKZExQUGk3RG45TXgtbHU4eWtwVllwYmNYMUpROGZkaGNFUGt2bGV2UWc4T2tsQUt1ZzNHYVlpZVl6ZmlpbjVjRTlIbVhiQjB2ZEdfQUU1YzdsVG1VMGFfN2VxY2NXY2VCaURaLWJNUDhZNzF0UWlKZlBRWGxUMmppVFZ0QXF4bWlCTjQxY2pTaWhXZ21FTWFuN3pFZ2JhQ01mMjBDT2QxUEhaQ1h4d29paVNz?oc=5,Amar Ujala,2026-05-01T00:47:37+05:30,hi,Uttar Pradesh,Banda,"लू (Agra OR Aligarh OR Allahabad OR ""Ambedkar Nagar"" OR ""Amethi (Chatrapati Sahuji Mahraj Nagar)"" OR ""Amroha (J.P. Nagar)"" OR Auraiya OR Azamgarh OR Baghpat OR Bahraich OR Ballia OR Balrampur OR Banda OR Barabanki OR Bareilly OR Basti OR Bhadohi OR Bijnor OR Budaun OR Bulandshahr OR Chandauli OR Chitrakoot OR Deoria OR Etah OR Etawah OR Faizabad OR Farrukhabad OR Fatehpur OR Firozabad OR ""Gautam Buddha Nagar"" OR Ghaziabad OR Ghazipur OR Gonda OR Gorakhpur OR Hamirpur OR ""Hapur (Panchsheel Nagar)"" OR Hardoi OR Hathras OR Jalaun OR Jaunpur OR Jhansi OR Kannauj OR ""Kanpur Dehat"" OR ""Kanpur Nagar"" OR ""Kanshiram Nagar (Kasganj)"" OR Kaushambi OR ""Kushinagar (Padrauna)"" OR ""Lakhimpur - Kheri"" OR Lalitpur OR Lucknow OR Maharajganj OR Mahoba OR Mainpuri OR Mathura OR Mau OR Meerut OR Mirzapur OR Moradabad OR Muzaffarnagar OR Pilibhit OR Pratapgarh OR RaeBareli OR Rampur OR Saharanpur OR ""Sambhal (Bhim Nagar)"" OR ""Sant Kabir Nagar"" OR Shahjahanpur OR ""Shamali (Prabuddh Nagar)"" OR Shravasti OR ""Siddharth Nagar"" OR Sitapur OR Sonbhadra OR Sultanpur OR Unnao OR Varanasi) Uttar Pradesh","{""_id"":""69f3aad19c4f99cb0f07716a"",""slug"":""farmer-faints-feared-dead-from-heatstroke-banda-news-c-212-1-sknp1006-145604-2026-05-01"",""type"":""story"",""status"":""publish"",""title_hn"":""Banda News: किसान गश खाकर गिरा, लू लगने से मौत की आशंका"",""category"":{""title"":""City & states"",""title_hn"":""शहर और राज्य"",""slug"":""city-and-states""}}
Banda News: किसान गश खाकर गिरा, लू लगने से मौत की आशंका
संवाद न्यूज एजेंसी, बांदा
विज्ञापन
विज्ञापन
बांदा। गांव से बांदा आया किसान अचानक गश खाकर गिर गया। राहगीरों ने देखा तो पुलिस और एंबुलेंस को सूचना दी। एंबुलेंस ने उसे जिला अस्पताल में भर्ती कराया। यहां इलाज के दौरान उसने दम तोड़ दिया। परिजन लू लगने से मौत होने की आशंका जता रहे हैं।
देहात कोतवाली क्षेत्र के चटचटगन गांव निवासी उमेश सिंह ने बताया कि उसका मौसेरा भाई राकेश सिंह चंदेल (57) बुधवार को सुबह घर से बांदा जाने की बात कहकर निकले थे। बांदा में आवास विकास स्थित चिल्ला-कानपुर मार्ग पर वह गश खाकर गिर पड़े। राहगीरों की सूचना पर पुलिस और एंबुलेंस से उन्हें जिला अस्पताल में भर्ती कराया गया। यहां इलाज के दौरान उन्होंने दम तोड़ दिया।
देर शाम पुलिस की ओर से उन्हें जानकारी हो सकी। उन्होंने लू से मौत होने की संभावना जताई है। राकेश के दो पुत्र हैं। घर में पत्नी सुषमा देवी हैं। बीघा भर जमीन है। वह मध्य प्रदेश के सतना में प्राइवेट में नौकरी भी करते थे। देहात कोतवाली प्रभारी चंद्रप्रकाश तिवारी ने बताया कि गर्मी की वजह से चक्कर खाकर गिरने से मौत होना प्रतीत हो रहा है। शव का पोस्टमार्टम कराया गया है।
Trending Videos
देहात कोतवाली क्षेत्र के चटचटगन गांव निवासी उमेश सिंह ने बताया कि उसका मौसेरा भाई राकेश सिंह चंदेल (57) बुधवार को सुबह घर से बांदा जाने की बात कहकर निकले थे। बांदा में आवास विकास स्थित चिल्ला-कानपुर मार्ग पर वह गश खाकर गिर पड़े। राहगीरों की सूचना पर पुलिस और एंबुलेंस से उन्हें जिला अस्पताल में भर्ती कराया गया। यहां इलाज के दौरान उन्होंने दम तोड़ दिया।
विज्ञापन
विज्ञापन
देर शाम पुलिस की ओर से उन्हें जानकारी हो सकी। उन्होंने लू से मौत होने की संभावना जताई है। राकेश के दो पुत्र हैं। घर में पत्नी सुषमा देवी हैं। बीघा भर जमीन है। वह मध्य प्रदेश के सतना में प्राइवेट में नौकरी भी करते थे। देहात कोतवाली प्रभारी चंद्रप्रकाश तिवारी ने बताया कि गर्मी की वजह से चक्कर खाकर गिरने से मौत होना प्रतीत हो रहा है। शव का पोस्टमार्टम कराया गया है।",1.0
