title,url,source,date,language,state,district,search_term,full_text,relevance_score
"झारखंड के इन जिलों में 9 मई को मौसम रहेगा खराब, ऑरेंज अलर्ट जारी - Prabhat Khabar",https://news.google.com/rss/articles/CBMilwFBVV95cUxPQTdqRlJUZzYtZ2JxRm9PTFNlcmZPYmc3TEZmanFJMFltWXcyUVFjczc3bWJvay1fdUt3QlJFdmUwOHVpQlNTTHZiX042T1gzS0JHQ1ZCa2NrX2JQYWZOQjBQc0NWT3V6YzNWZ2lydmtwRlJ2aUJqTDdjeTdoTDhpa2trME9BMG02MTNuVXdWVjFOcEJrenpn0gGcAUFVX3lxTE1oRGhtckt4QjN6dmJMVVVsVUdGYU1XbFI5ZmxQbjNyczBVYzZHSEsyZDhBc1dFTWhMQTlqdTdMN2JlZ2dLY2JxZmhETzFUTVI4YWZ0V2xRNjFySE0xZGlRNUJxVnNKdG1BUDlEem1rbDJZYlhWU21OWXBuRUNkeHJfcUxRQ0F1RXZQYUhFZ3o1VUh4SmpWTXFmQ1czYg?oc=5,Prabhat Khabar,2026-05-09T07:56:50+05:30,hi,Jharkhand,,"(""हीट एक्शन प्लान"" OR ""गर्मी से राहत"" OR चेतावनी OR ""रेड अलर्ट"" OR ""ऑरेंज अलर्ट"" OR ""येलो अलर्ट"" OR एडवाइजरी OR ""राहत सामग्री"" OR ""राहत शिविर"" OR मुआवजा) Jharkhand","झारखंड के इन जिलों में 9 मई को मौसम रहेगा खराब, ऑरेंज अलर्ट जारी
झारखंड मौसम सांकेतिक तस्वीर (AI Image)
Jharkhand Weather: झारखंड की राजधानी रांची समेत कई जिलों में आज मौसम बिगड़ने के आसार हैं. मौसम विभाग ने लोगों को सतर्क रहने की सलाह दी है. झारखंड में अगले कई दिनों तक बारिश और तेज हवा का दौर जारी रहने की संभावना हैं.
Jharkhand Weather: झारखंड का मौसम लगातार करवट ले रहा है. मौसम विभाग के अनुसार, 9 मई को रांची, हजारीबाग, रामगढ़, खूंटी और बोकारो में ओलावृष्टि के साथ 50 से 60 किमी प्रतिघंटा की रफ्तार से हवा चलने की संभावना है. कहीं-कहीं वज्रपात भी हो सकता है. इन जिलों में ऑरेंज अलर्ट जारी करते हुए लोगों से सावधानी बरतने की अपील की गई है.
अन्य जिलों का हाल
अन्य जिलों की बात करें तो, बादल छाए रहने, 40 से 50 किमी प्रतिघंटा की रफ्तार से हवा चलने और हल्की बारिश की संभावना जताई गई है. इन जिलों में येलो अलर्ट जारी किया गया है. वहीं, 10 से 14 मई तक राज्य के सभी जिलों में दोपहर बाद आकाश में बादल छाए रहेंगे. वहीं, तेज हवा चलने और कहीं-कहीं हल्की बारिश होने की भी संभावना है. इसे देखते हुए मौसम विभाग ने येलो अलर्ट जारी किया है.
कई जिलों में बारिश
साइक्लोनिक सर्कुलेशन के कारण शुक्रवार को रांची में दो मिमी और जमशेदपुर में लगभग पांच मिमी बारिश हुई. सबसे ज्यादा चाईबासा में 25 मिमी बारिश हुई. देर रात कोडरमा, गिरिडीह, देवघर, जामताड़ा, गोड्डा, दुमका, पाकुड़ और साहिबगंज के कई इलाकों में तेज हवा के साथ बारिश हुई.
रांची के तापमान में गिरावट
रांची के तापमान में गुरुवार की अपेक्षा शुक्रवार को 0.2 डिग्री सेल्सियस की गिरावट आई. रांची का अधिकतम तापमान 32.4 डिग्री सेल्सियस रहा. वहीं, न्यूनतम तापमान 19.4 डिग्री सेल्सियस रहा. मेदिनीनगर का अधिकतम तापमान 38.4 डिग्री सेल्सियस रहा. पिछले 24 घंटे में 0.7 डिग्री सेल्सियस की बढ़ोतरी दर्ज हुई.
इसे भी पढ़ें: ऑक्सफोर्ड पब्लिक स्कूल में बोले प्रभात खबर के प्रधान संपादक अंकित शुक्ला – संवाद का तरीका ही निर्णायक
इसे भी पढ़ें: पलामू में अपराधियों के हौसले बुलंद: रेहला में युवक पर चाकू से ताबड़तोड़ हमला, हालत गंभीर
प्रभात खबर डिजिटल टॉप स्टोरी
श्वेता वैद्य प्रभात खबर में लाइफस्टाइल बीट के लिए कंटेंट लिखती हैं. वह पिछले एक साल से व्यंजन (Recipes), फैशन, ब्यूटी टिप्स, होम डेकोर, किचन टिप्स और लेटेस्ट मेहंदी डिजाइन्स जैसे विषयों पर लेख लिख रही हैं. उनका उद्देश्य पाठकों को रोजमर्रा की जिंदगी को आसान और स्टाइलिश बनाने के लिए प्रैक्टिकल टिप्स देना है.
Prabhat Khabar App :
देश, एजुकेशन, मनोरंजन, बिजनेस अपडेट, धर्म, क्रिकेट, राशिफल की ताजा खबरें पढ़ें यहां. रोजाना की ब्रेकिंग हिंदी न्यूज और लाइव न्यूज कवरेज के लिए डाउनलोड करिए",1.0
