title,url,source,date,language,state,district,search_term,full_text,relevance_score
Heatwaves grip Howrah #Gallery - Social News XYZ,https://news.google.com/rss/articles/CBMid0FVX3lxTFBEb19yUEI2emFFNjA0TVJuTTQ3REpBemZCQ3AtdVBPRllZQWtObkFEYWlrM3NWY1B1aW1tYXlXQ1RoY0FhQjg1V1M4WjFPVzQ5Rno0eGJTR2VSZFhOU3JnNzF6V2FiV21aMGlnWVotT0MwbVZMUThF0gF3QVVfeXFMUERvX3JQQjZ6YUU2MDRNUm5NNDdESkF6ZkJDcC11UE9GWVlBa05uQURhaWszc1ZjUHVpbW1heVdDVGhjQWFCODVXUzhaMU9XNDlGejR4YlNHZVJkWE5Tcmc3MXpXYWJXbVowaWdZWi1PQzBtVkxROEU?oc=5,Social News XYZ,2026-06-04T22:10:12+05:30,en,West Bengal,Howrah,"""heatwave"" West Bengal","Howrah: Women shield themselves with an umbrella amid sweltering heatwave conditions in Howrah district of West Bengal on Thursday, June 04, 2026. (Photo: IANS)
Howrah: A toddler uses a cloth to shield himself from the blazing sun while sitting on his father’s lap amid sweltering heatwave conditions in Howrah district of West Bengal on Thursday, June 04, 2026. (Photo: IANS)
Howrah: A child drinks packed juice seeking relief from the sweltering heatwave conditions in Howrah district of West Bengal on Thursday, June 04, 2026. (Photo: IANS)
Howrah: A man splashes water on himself amid sweltering heatwave conditions in Howrah district of West Bengal on Thursday, June 04, 2026. (Photo: IANS)
An Indo-American News website. It covers Gossips, Politics, Movies, Technolgy, and Sports News and Photo Galleries and Live Coverage of Events via Youtube.
The website is established in 2015 and is owned by AGK FIRE INC.",0.5166666666666666
