title,url,source,date,language,state,district,search_term,full_text,relevance_score
"झारखंड में बढ़ेगी भीषण गर्मी, अगले पांच दिनों में 5 डिग्री तक चढ़ेगा पारा - Jagran",https://news.google.com/rss/articles/CBMiswFBVV95cUxOUGJta3F4WEs2M1Q1WGNHejlseExTRDBoLThXS2luYTVhRUVXV1dqRFd2WWdLdVNDTEh4aHVGWnNRdHBuVXZzejRhajM3MGZybXhnMHVsaG1nejhNazNlaVFudXVBTlNGa0wtRmc1Rl9oVzB3TlMzdnZLbzBaeFRuX1Y3ZTNVMEtDMWExY1dhZVE3N2s1elNuSzlHQlV2anRyUmFuRklPaDVWRTBpclBaVkN3UQ?oc=5,Jagran,2026-04-15T13:56:00+05:30,hi,Jharkhand,Dhanbad,"(लू OR ""लू चलना"" OR ""भीषण गर्मी"" OR ""प्रचंड गर्मी"" OR ""कड़ी धूप"" OR ""तेज धूप"" OR ""गर्म हवा"" OR ""उष्ण लहर"" OR ""ताप लहर"" OR ""हीट वेव"" OR ""झुलसाने वाली गर्मी"" OR ""तपती गर्मी"" OR ""भयंकर गर्मी"" OR ""गर्मी का कहर"" OR ""गर्मी का प्रकोप"" OR ""अत्यधिक गर्मी"" OR मौसम OR ""मौसम अपडेट"" OR ""मौसम का हाल"" OR ""मौसम पूर्वानुमान"" OR ""मौसम अलर्ट"" OR आईएमडी OR ""आईएमडी पूर्वानुमान"" OR ""आईएमडी अलर्ट"" OR ""तापमान में बढ़ोतरी"" OR ""गर्मी से राहत"" OR ""गर्मी से निजात"") Jharkhand","झारखंड में बढ़ेगी भीषण गर्मी, अगले पांच दिनों में 5 डिग्री तक चढ़ेगा पारा
Jharkhand Heatwave Alert: झारखंड में अगले पांच दिनों तक तापमान में 3 से 5 डिग्री सेल्सियस की बढ़ोतरी होगी, जिससे भीषण गर्मी बढ़ने की संभावना है। मौसम ...और पढ़ें
जागरण संवाददाता, धनबाद। झारखंड में अगले पांच दिनों के दौरान तापमान में लगातार बढ़ोतरी के आसार हैं। मौसम विभाग के अनुसार अधिकतम तापमान में 3 से 5 डिग्री सेल्सियस तक वृद्धि हो सकती है, जिससे कई जिलों में भीषण गर्मी का असर देखने को मिलेगा।
कई जिलों में लू का अलर्ट, 17-18 अप्रैल को ज्यादा असर
रांची, खूंटी, पश्चिम सिंहभूम, पूर्वी सिंहभूम, सिमडेगा, गुमला, लोहरदगा, लातेहार, पलामू, गढ़वा, चतरा और सरायकेला-खरसांवा में लू चलने की चेतावनी जारी की है। लोगों को सतर्क रहने और दोपहर में बाहर निकलने से बचने की सलाह दी गई है।
17 अप्रैल को बारिश-गर्जन के आसार, 19 से साफ रहेगा मौसम
काल बैसाखी और पश्चिमी विक्षोभ का असर
सरायकेला का तापमान 40.6°C दर्ज किया गया। आने वाले दिनों में पारा 39-40 डिग्री के बीच रहने की संभावना है।",1.0
