title,url,source,date,language,state,district,search_term,full_text,relevance_score
"Heatwave : पुणेकरांनो, आरोग्य सांभाळा; उन्हाच्या झळांनी वाढले आजार - Lokmat.com",https://news.google.com/rss/articles/CBMizAFBVV95cUxQc1JWbnpMbzdxN0dITXZVdkpnWTRVc1R4bHAxVnJOai1lSndxYzFsdGt1X0JQRy1KYXJGSUNBUzhpMlY2SmVxN0E5WXVhaFg4Yl90bkdRcTJNM3RmRVhfQjhtZlVPb1JVVG5xNUJMNmZrQ0J1VUdKcFpDMGNuMUtVc09fbk8wUXBKcnRXZjVXMGVqaDkxU25XQWIyb0ZYam5ERHFTbnFzR3RfZDRnOW9GOUoxR09IZFg3WF9ENTRmMW8yang2TGlXVkdfbWXSAdIBQVVfeXFMT08wT1lLTXJIZjAzZS1MRXBBUGFfanJrYmpvR045S1lGMEJvU0FjU3YzNEw1N25Ya0JYcXR2Z3RUNXhCY2o0SHNMY2JwVjFEZ0pWQjladmE0ZVhnTVZvZUNsSlo4VFFPWmFUYktaa0ZNdzdPN0U1cUJGY0tNSVZ4NU1JNlJ3SXd6SWlXbnZELWxUeGw4NGdHanFSVE4zUU53Rkh4SWJvSXNGY1Z0NjdVdkdSUWktNUMzQlVKZFowZWV6N2NyUjcwSjNWYmtXdmpjbGdR?oc=5,Lokmat.com,2026-04-30T09:32:00+05:30,mr,Maharashtra,Pune,"(उष्माघात OR ""लू लागणे"" OR ""उष्णतेने मृत्यू"" OR ""ऊन लागणे"" OR ""हीट स्ट्रोक"" OR ""सन स्ट्रोक"" OR निर्जलीकरण OR ""रुग्णालयात दाखल"" OR ""उष्णतेने बेजार"") Maharashtra","Heatwave : पुणेकरांनो, आरोग्य सांभाळा; उन्हाच्या झळांनी वाढले आजार
By ऑनलाइन लोकमत | Updated: April 30, 2026 09:32 IST2026-04-30T09:31:54+5:302026-04-30T09:32:31+5:30
Heatwave - दूषित अन्न-पाण्यामुळे आजारांचा धोका; अतिसार-उलट्या, पोटदुखीचे वाढले रुग्ण
पुणे : शहरातील उन्हाचा पारा ४१ अंशावर पोहोचला असून, वाढत्या उष्णतेचा फटका पुणेकरांना बसत आहे. प्रचंड उष्णतेमुळे शहरात नागरिकांच्या पचनसंस्थेशी संबंधित आजारांचे प्रमाण झपाट्याने वाढले आहे. मागील काही दिवसांत अतिसार, उलट्या आणि पोटदुखीचा त्रास जाणवत असलेल्या रुग्णांच्या संख्येत लक्षणीय वाढ झाली आहे. यामुळे शासकीय रुग्णालयांसह खासगी दवाखान्यांतील ओपीडीमध्ये रुग्णांचे प्रमाण २५ टक्क्यांनी वाढले असल्याचे आरोग्यतज्ज्ञांनी सांगितले.
सध्या तीव्र उकाड्यामुळे शरीरातील पाणी आणि क्षार (सोडियम) झपाट्याने कमी होत असल्यामुळे निर्जलीकरण (डिहायड्रेशन) वाढत आहे. परिणामी अशक्तपणा, थकवा, चक्कर येणे, मळमळ, डोकेदुखी अशी उष्माघाताची लक्षणे दिसून येत आहेत. यासोबतच दूषित अन्न व पाण्यामुळेदेखील संसर्गजन्य आजारांचा धोका अधिक वाढला असल्याचे डॉक्टरांनी नमूद केले आहे. उन्हाळ्यात बाहेरील थंड पेये, पाणी आणि खाद्यपदार्थांचे सेवन वाढते. शाळांना सुट्या, लग्नसराई आणि पर्यटनामुळे नागरिक मोठ्या प्रमाणावर बाहेरचे अन्न सेवन करतात. मात्र, उघड्यावर विक्री होणारे पदार्थ, कापून ठेवलेली फळे, तसेच शिळे अन्न यामध्ये जिवाणूंची वाढ वेगाने होते. अशी फळे आणि अन्नपदार्थ खाण्यास आल्यास अतिसार आणि उलट्यांचे प्रमाण वाढत आहे.
विशेषतः डिलिव्हरी कर्मचारी, मार्केटिंग क्षेत्रातील कामगार, वाहतूक पोलिस, बस-रिक्षा-टॅक्सी चालक, फेरीवाले, लहान मुले, ज्येष्ठ नागरिक आणि आधीपासून आजार असलेले रुग्ण हे अधिक धोक्याच्या गटात असल्याचे तज्ज्ञांनी स्पष्ट केले आहे. उष्णतेमुळे शरीराची प्रतिकारशक्ती कमी होत असल्याने संसर्गाचा धोका वाढतो. वाढत्या रुग्णसंख्येच्या पार्श्वभूमीवर राज्य व महापालिकेच्या आरोग्य विभागाने रुग्णालयांमध्ये विशेष खाटा राखीव ठेवल्या आहेत. नागरिकांनी दुपारी १२ ते २ या वेळेत बाहेर जाणे टाळावे, तसेच आवश्यक असल्यास पुरेशी काळजी घ्यावी, असे आवाहन करण्यात आले आहे.
काय काळजी घ्यावी
नागरिकांनी शक्यतो घरचे स्वच्छ व ताजे अन्न सेवन करावे. उघड्यावर मिळणारे पाणी व खाद्यपदार्थ टाळावेत. भरपूर पाणी व द्रवपदार्थ घ्यावेत. ताजी फळे व भाज्या नीट धुऊनच खाव्यात. लिंबूपाणी, ओआरएस, ताक यासारखे द्रवपदार्थ घ्यावेत. उन्हात जाणे टाळावे; बाहेर पडताना टोपी, छत्री, गॉगल वापरावा. सैलसर, फिकट रंगाचे कपडे परिधान करावेत.
ओपीडीमध्ये दररोज ३ ते ४ रुग्ण अतिसाराच्या तक्रारींसह येत होते, आता ही संख्या १० ते १५ वर पोहोचली आहे. उष्णतेमुळे शरीरातील द्रव आणि क्षारांचे प्रमाण कमी होत असल्याने त्रास वाढतो आहे. उन्हात काम करणारे मजूर, शेतकरी, तसेच बैठ्या पत्र्याच्या घरात राहत असलेल्या नागरिकांनी विशेष काळजी घेण्याची गरज आहे. ऊन व उष्णतेपासून बचाव करणे, भरपूर पाणी, ओआरएस आणि लिंबूपाणी घेणे गरजेचे आहे. - डॉ. अविनाश भोंडवे, आरोग्य सल्लागार व फिजिशियन
उष्णतेत आधीच कापून ठेवलेली फळे, उघड्यावर ठेवलेले खाद्यपदार्थ आणि थंड पेये, आइस्क्रिम, घरात होणारे दुग्धजन्य पदार्थ हे जिवाणूंसाठी पोषक माध्यम ठरतात. त्यामुळे असे पदार्थ टाळणे अत्यावश्यक आहे. तळलेले, तेलकट आणि शिळे अन्न सेवन केल्यास पचनाचे विकार वाढण्याची शक्यता असते. - डॉ. धनंजय ओगले, गॅस्ट्रोलॉजिस्ट",1.0
"Maharashtra Heatwave: ४५ अंशांच्या उंबरठ्यावर तापमान; राज्यात उष्णतेची तीव्रता कमी होणार, तरीही उन्हाचा तडाखा कायम! - Esakal",https://news.google.com/rss/articles/CBMitAFBVV95cUxOcVdZelBpTlVoSENyNVNuT1JqTEdFQzNGVHZVUFlwRmc3NmVBMVluQUhTUkdmZ1BQQTB1WnBsU1FQWEhCOFhUZjhveXVhRWxlRzlqTmhWQTEtd1MydlM0V2ItQjBkd0g3QlZqeXN3bV9RMWcwR2lrVEhvRDg1TXhSa1B6MUNxU2pPR0xIdXc1LXMxaTg2RVlSTUpIelM2WGFNVkN1RnRUQ0dwV1d3d0RoMUNhZGk?oc=5,Esakal,2026-04-30T07:35:06+05:30,mr,Maharashtra,Pune,"""उष्णतेची लाट"" Maharashtra","पुणे : राज्यात वाढलेल्या उन्हाच्या झळा काहीशा कमी होण्याची शक्यता आहे. उष्णतेची लाट कमी होणार असल्याने तापमानात काहीशी घट होण्याचे संकेत आहेत. (ता. ३०) राज्यात उन्हाचा चटका कायम राहण्याची, तसेच तुरळक ठिकाणी आकाश अंशतः ढगाळ राहण्याची शक्यता हवामान विभागाने वर्तविली आहे.",0.6833333333333333
