title,url,source,date,language,state,district,search_term,full_text,relevance_score
Weather Alert: ਪੰਜਾਬ ਤੇ ਹਰਿਆਣਾ 'ਚ 21 ਅਪਰੈਲ ਤੋਂ ਚੱਲਣਗੀਆਂ ਗਰਮ ਹਵਾਵਾਂ - Punjabi Tribune,https://news.google.com/rss/articles/CBMi1AFBVV95cUxOb3hRNEJUNHFmbGtkS3duMFg3SFBqWWxLT3BwQ2I4bjJwOFBPaGpjS1dWQ3UxQ0tqaWtZTE9zUEI1T0FKMlM0RW5wMTZhdEpfdFhHWVVfM1ZOdndFOHhIdDAxVlBnN0ZUd2dLNmtlRUxpZGZJWlk5V2lNenBaU0c2cVEzTDJSbkZzcWZHd1BDWnJ2dFlySU95UTNaRUJCNWlFZTV6MVAxR1RpZ0RCVzFTSzVwLTgzN3ZiMUR6N1QzZXRRSW95dWJHZ3VRLWFfNjJhRjF1eg?oc=5,Punjabi Tribune,2026-04-19T20:25:02+05:30,pa,Punjab,,"(ਲੂ OR ""ਹੀਟ ਵੇਵ"" OR ""ਭਿਆਨਕ ਗਰਮੀ"" OR ""ਕੜਾਕੇ ਦੀ ਗਰਮੀ"" OR ""ਤੱਤੀ ਹਵਾ"" OR ""ਗਰਮੀ ਦਾ ਕਹਿਰ"" OR ""ਸਖ਼ਤ ਗਰਮੀ"" OR ""ਅਸਹਿ ਗਰਮੀ"" OR ""ਤਪਦੀ ਗਰਮੀ"") Punjab","ਭਾਰਤੀ ਮੌਸਮ ਵਿਭਾਗ (IMD) ਨੇ ਚੰਡੀਗੜ੍ਹ, ਪੰਜਾਬ ਅਤੇ ਹਰਿਆਣਾ ਵਿੱਚ 21 ਤੋਂ 23 ਅਪਰੈਲ ਤੱਕ ਲੂ (ਹੀਟ ਵੇਵ) ਚੱਲਣ ਦੀ ਚੇਤਾਵਨੀ ਜਾਰੀ ਕੀਤੀ ਹੈ।
19 ਅਪਰੈਲ ਦੀ ਸ਼ਾਮ ਨੂੰ ਤੇਜ਼ ਹਵਾਵਾਂ ਅਤੇ ਗਰਜ-ਚਮਕ, ਤੂਫ਼ਾਨ ਤੋਂ ਬਾਅਦ ਹੁਣ ਮੌਸਮ ਵਿਭਾਗ ਨੇ ਕਿਹਾ ਹੈ ਕਿ 21 ਤੋਂ 23 ਅਪਰੈਲ ਦੌਰਾਨ ਪੰਜਾਬ, ਹਰਿਆਣਾ ਅਤੇ ਚੰਡੀਗੜ੍ਹ ਦੇ ਕੁੱਝ ਹਿੱਸਿਆਂ ਵਿੱਚ ਲੂ ਵਰਗੇ ਹਾਲਾਤ ਬਣ ਸਕਦੇ ਹਨ।
ਮੌਸਮ ਵਿਭਾਗ ਦੇ ਮੁਤਾਬਿਕ, ਪਿਛਲੇ 24 ਘੰਟਿਆਂ ਦੌਰਾਨ ਪੰਜਾਬ ਦੇ ਕੁੱਝ ਥਾਵਾਂ ’ਤੇ ਹਲਕਾ ਮੀਂਹ ਪਿਆ ਹੈ, ਪਰ ਸੂਬੇ ਵਿੱਚ ਵੱਧ ਤੋਂ ਵੱਧ ਅਤੇ ਘੱਟ ਤੋਂ ਘੱਟ ਤਾਪਮਾਨ ਆਮ ਨਾਲੋਂ ਕਾਫ਼ੀ ਵੱਧ ਰਿਹਾ ਹੈ।
ਜਦੋਂ ਕਿ ਅਪਰੈਲ ਮਹੀਨੇ ਦੌਰਾਨ ਕੁੱਲ ਮੀਂਹ ਆਮ ਨਾਲੋਂ ਕਾਫ਼ੀ ਵੱਧ ਰਿਹਾ ਹੈ। 1 ਅਪਰੈਲ ਤੋਂ 19 ਅਪਰੈਲ ਤੱਕ ਪੰਜਾਬ ਵਿੱਚ 26.2 ਮਿਲੀਮੀਟਰ ਮੀਂਹ ਪਿਆ ਹੈ, ਜਦਕਿ ਲੰਬੇ ਸਮੇਂ ਦੇ ਔਸਤ ਮੁਤਾਬਿਕ ਇਹ 11.2 ਮਿਲੀਮੀਟਰ ਹੋਣਾ ਚਾਹੀਦਾ ਸੀ, ਜਿਸ ਨਾਲ 134 ਫ਼ੀਸਦੀ ਦਾ ਵਾਧਾ ਦਰਜ ਕੀਤਾ ਗਿਆ ਹੈ। 1 ਮਾਰਚ ਤੋਂ ਹੁਣ ਤੱਕ 43.5 ਮਿਲੀਮੀਟਰ ਮੀਂਹ ਪਿਆ ਹੈ, ਜਦਕਿ ਆਮ ਮਾਤਰਾ 33.7 ਮਿਲੀਮੀਟਰ ਹੈ।
ਪਿਛਲੇ 24 ਘੰਟਿਆਂ ਵਿੱਚ ਬਠਿੰਡਾ ਵਿੱਚ 41.1 ਡਿਗਰੀ ਸੈਲਸੀਅਸ ਤਾਪਮਾਨ ਦਰਜ ਕੀਤਾ ਗਿਆ, ਜੋ ਕਿ ਸੂਬੇ ਦਾ ਸਭ ਤੋਂ ਵੱਧ ਤਾਪਮਾਨ ਹੈ। ਜਦਕਿ ਸਭ ਤੋਂ ਘੱਟ ਨਿਊਨਤਮ ਤਾਪਮਾਨ ਆਦਮਪੁਰ ਵਿੱਚ 18.4 ਡਿਗਰੀ ਸੈਲਸੀਅਸ ਰਿਹਾ। ਇਹ ਤਾਪਮਾਨ ਆਮ ਨਾਲੋਂ ਕ੍ਰਮਵਾਰ 4.5 ਡਿਗਰੀ ਅਤੇ 2.7 ਡਿਗਰੀ ਵੱਧ ਹੈ।
ਇਸ ਤੋਂ ਇਲਾਵਾ, ਉੱਤਰੀ ਭਾਰਤ ਉੱਤੇ 12.6 ਕਿਲੋਮੀਟਰ ਉਚਾਈ ’ਤੇ ਲਗਭਗ 150 ਕਿਲੋਮੀਟਰ ਪ੍ਰਤੀ ਘੰਟਾ ਦੀ ਗਤੀ ਵਾਲੀ ਸਬਟ੍ਰਾਪਿਕਲ ਵੈਸਟਰੀ ਜੈਟ ਸਟ੍ਰੀਮ ਹਾਲੇ ਵੀ ਸਰਗਰਮ ਹੈ। 23 ਅਪਰੈਲ ਤੋਂ ਪੱਛਮੀ ਹਿਮਾਲਿਆਈ ਖੇਤਰ ਨੂੰ ਇੱਕ ਨਵਾਂ ਪੱਛਮੀ ਮੌਸਮੀ ਹਰਕਤ (ਵੈਸਟਰਨ ਡਿਸਟਰਬੈਂਸ) ਪ੍ਰਭਾਵਿਤ ਕਰਨ ਦੀ ਸੰਭਾਵਨਾ ਹੈ।
ਪੰਜਾਬ ਵਿੱਚ 20 ਤੋਂ 26 ਅਪਰੈਲ ਤੱਕ ਮੌਸਮ ਖ਼ੁਸ਼ਕ ਰਹਿਣ ਦੀ ਸੰਭਾਵਨਾ ਹੈ ਅਤੇ ਵੱਧ ਤੋਂ ਵੱਧ ਤਾਪਮਾਨ ਵਿੱਚ 2 ਤੋਂ 4 ਡਿਗਰੀ ਸੈਲਸੀਅਸ ਤੱਕ ਵਾਧਾ ਹੋ ਸਕਦਾ ਹੈ। IMD ਨੇ ਕਿਹਾ ਹੈ ਕਿ 21, 22 ਅਤੇ 23 ਅਪਰੈਲ ਨੂੰ ਕੁੱਝ ਥਾਵਾਂ ’ਤੇ ਗਰਮ ਰਾਤਾਂ ਤੇ ਲੂ ਵਰਗੇ ਹਾਲਾਤ ਬਣ ਸਕਦੇ ਹਨ।",1.0
"ਪੰਜਾਬ ਦੇ ਮੌਸਮ ਨੂੰ ਲੈ ਕੇ ਵੱਡੀ ਚਿਤਾਵਨੀ! 21, 22, 23 ਤਾਰੀਖ਼ ਲਈ 12 ਜ਼ਿਲ੍ਹਿਆਂ 'ਚ Alert ਜਾਰੀ - Jagbani",https://news.google.com/rss/articles/CBMiugFBVV95cUxNSlA4STZHYmlXWFJTa01KQjZsb3BxdDMwcXVHc3dXQUpOU3pxeGkyNWdTUTd1TGNYeGtYZmpjNFFhQjJyUDY0RnBnNDBJRENKdFRlWG1sQVNpUzFrZXJrRXI2ZnhKOFZRNFJPc3M2NmxUS1pTaWYxeS10X25rTnpySjRady1hckNwS2JXOGFtQ2plbzI5Qk1yX0xZb2pKQXVLalFjbF9fUzdjUFRnSTQyOUEtU3lWejFHQXfSAcIBQVVfeXFMT3gzZ1BmQXRlQkxHMlp6Y3RrOVhOWmlfQ09OSkhMeGpVdVlEUFRmNTlKX0g0Q3dQeURaVDhqQzN3c0xaZHB5NDVnSGNabWlPbVlOd1JoalhsYVJQdFMwamhDVkJfaGg4MGtScUxLU0QwYXJkRmZfakxMUzg2NGx3ZGJWVlFHdkN5Z2pfTlhyZFRGSkVkdjhLRFNtc2dYSllTTlFXUlJfZTljLTQ0MVJjVVBrZ1hwZXE3M2RuNW9ESm1RcEE?oc=5,Jagbani,2026-04-19T19:12:57+05:30,pa,Punjab,,"(ਰਾਹਤ OR ਐਡਵਾਈਜ਼ਰੀ OR ""ਰੈੱਡ ਅਲਰਟ"" OR ""ਔਰੇਂਜ ਅਲਰਟ"" OR ""ਯੈਲੋ ਅਲਰਟ"" OR ""ਰਾਹਤ ਕੈਂਪ"" OR ਮੁਆਵਜ਼ਾ) Punjab","ਪੰਜਾਬ ਦੇ ਮੌਸਮ ਨੂੰ ਲੈ ਕੇ ਵੱਡੀ ਚਿਤਾਵਨੀ! 21, 22, 23 ਤਾਰੀਖ਼ ਲਈ 12 ਜ਼ਿਲ੍ਹਿਆਂ 'ਚ Alert ਜਾਰੀ
- Edited By Shivani Attri,
- Updated: 19 Apr, 2026 07:20 PM",0.0
