title,url,source,date,language,state,district,search_term,full_text,relevance_score
"AI Data Centres बढ़ा रहे हैं धरती का तापमान, 34 करोड़ लोगों पर पड़ रहा असर - TV9 Bharatvarsh",https://news.google.com/rss/articles/CBMixAFBVV95cUxQcFZPZTJHdWtMWjlCZjBVaWtfLWNLZlk0TXF3OG5VX2JoT3JjUE82VURzS2kyRFZjWEVGeGdOUFhXeVJQalZaR0hWY0Yya20wTE54TmVJb1lITkZiRFhzcGtzTFByUUhMU1JTRC1LUFB6T3JWQVdkTEtSZFY1ejJDaTZBY3VaeGpiVnVYZWtaalk4cEx1dXZHZ3ZMZWxWamU4bGs3TjdTdGVZd3RNNTZOT3JSeC1WcHczeEJaNXlnYVhQZGpU?oc=5,TV9 Bharatvarsh,2026-04-01T16:30:21+05:30,hi,Delhi,,"(""पारा चढ़ा"" OR ""पारा पहुंचा"" OR तापमान OR ""तापमान बढ़ा"" OR ""रिकॉर्ड तोड़ गर्मी"" OR ""डिग्री सेल्सियस"" OR ""पारा उबला"" OR ""अधिकतम तापमान"" OR ""तापमान 40 पार"" OR ""तापमान 45 पार"" OR ""तापमान बढ़ने की संभावना"") Delhi","AI Data Centres बढ़ा रहे हैं धरती का तापमान, 34 करोड़ लोगों पर पड़ रहा असर
आर्टिफिशियल इंटेलिजेंस (AI) डेटा सेंटर पर्यावरण पर गहरा प्रभाव डाल रहे हैं. ये विशालकाय केंद्र न सिर्फ भारी मात्रा में बिजली और पानी का उपभोग करते हैं, बल्कि आस-पास के क्षेत्रों को 'हीट आइलैंड' में भी बदल रहे हैं, जिससे स्थानीय तापमान में वृद्धि हो रही है.
पिछले कुछ सालों में आर्टिफिशियल इंटेलिजेंस (AI) टूल्स के बढ़ने से कंपनियों ने दुनिया भर में बड़े-बड़े डेटा सेंटर बनाए हैं. एक स्टडी के मुताबिक, बहुत ज्यादा पानी और बिजली खर्च करने के अलावा, ये डेटा सेंटर ‘हीट आइलैंड’ भी बना रहे हैं, जिससे उनके आस-पास की जमीन औसतन दो डिग्री सेल्सियस गर्म हो रही है. इससे 34 करोड़ (340 मिलियन) से ज्यादा लोगों की जिंदगी और गर्म हो रही है.
स्टडी में बताया गया, हमारा अनुमान है कि AI डेटा सेंटर के ऑपरेशन शुरू होने के बाद जमीन की सतह का टेम्परेचर औसतन 2 डिग्री सेल्सियस बढ़ जाता है, जिससे लोकल माइक्रोक्लाइमेट जोन बनते हैं, जिसे डेटा हीट आइलैंड इफ़ेक्ट कहते हैं. स्टडी में ये भी बताया गया है कि बहुत मामलों में, यह बढ़ोतरी 9 डिग्री सेल्सियस तक हो सकती है. कैम्ब्रिज यूनिवर्सिटी में अर्थ ऑब्ज़र्वेशन ग्रुप की एसोसिएट प्रोफेसर और स्टडी की लेखक एंड्रिया मैरिनोनी ने बताया कि उन्होंने 6000 से ज्यादा डेटा सेंटर पर फोकस किया.
तापमान में बढ़ोतरी पूरी दुनिया में एक जैसी थी और इसका असर सिर्फ़ डेटा सेंटर के आस-पास तक ही सीमित नहीं था. रिसर्च में पाया गया कि इन AI डेटा सेंटर्स की वजह से तापमान बढ़ने से 9.9 km (6.2 मील) दूर तक के इलाकों पर असर पड़ा, जिससे 340 मिलियन से ज्यादा लोग प्रभावित हुए.
AI कर रहा पानी का इस्तेमाल
एआई डेटा सेंटर ऐसे कूलिंग सिस्टम पर निर्भर करते हैं जो लाखों लीटर पानी इस्तेमाल कर सकते हैं, खासकर गर्म इलाकों में. इससे सस्टेनेबिलिटी पर सवाल उठे हैं, खासकर उन इलाकों में जो पहले से ही पानी की कमी का सामना कर रहे हैं.
यूनिवर्सिटी ऑफ कैलिफोर्निया के साइंटिस्ट के अनुसार, हर 100 शब्दों के AI प्रॉम्प्ट में लगभग एक बोतल पानी (या 519 ml) लगता है. एनवायर्नमेंटल एंड एनर्जी स्टडी इंस्टीट्यूट (EESI) के अनुसार, मीडियम साइज के डेटा सेंटर कूलिंग के लिए हर साल लगभग 110 मिलियन गैलन पानी इस्तेमाल कर सकते हैं. लगभग 1000 घरों के सालाना पानी के इस्तेमाल के बराबर है. बड़े डेटा सेंटर हर दिन 5 मिलियन गैलन तक या सालाना लगभग 1.8 बिलियन पानी “पी” सकते हैं, जो 10,000 से 50,000 लोगों के इस्तेमाल के बराबर है.",1.0
"मौसम: दिल्ली से राजस्थान तक गर्मी से राहत, इन 15 राज्यों में आंधी-बारिश की चेतावनी, IMD ने जारी किया अलर्ट - AajTak",https://news.google.com/rss/articles/CBMigAJBVV95cUxOWDN0aXpqQWZxUjN6cUIwLXdpblFXckg5cXFOQlBQZzJ4WEJGem9CMXhsUGxta1V4Q0F0UjJONndhMnd3a3QzZmVESVVvUmtsU2hvVkhlUE1jX3NaR1ZnV2JhQkJpSWFHVkRHMEZKVko5eXpxMlJtMHJRN2cxOTJUQzV3Y2ZKWW5kWVJoYkFmaEowMnQ2OVhZbW12dWV4QTFPMUdVaURsZWR5eFRKQ1BKd2k3ZGl6aG5pa0ZmYm5FZW1Nek9EU2NxVTdoYm53ZWlvRXhpaEpGWG1XbUwyV3M3Z3BRY280VWJGbm4wT3ZVcm5ndlY3Z2RfbG9BdER0SGkz0gGGAkFVX3lxTE9aQjVMczRaeW5qbVJGejBVajZodUxkN3hPWHFNYWlXLU5WRDdUV2d1cjRUV2VnNEx3YUwxTmRudXNERTFfeVM0OTRianJRWGt1ZjBRUWtFanNLakZOT3dmd2RETFVNYWdLS3ZMb1dxZEt4ckdkb25sbVN2MV9xZWhFZno5M3c1MFlSN0ZldlhBTDIwdWhqVnVvR0RXZlMyenZEY0pnNDVEZlQ0WGhWQkVTVlEtQkpBRVkwOFlMMkhkcHRHMTQxeE9oMnRNby1pT1JSWUpVWE9wQ1pSQ00wUGV3UmZPNFpteUlhaGtoYWN5eFJHWEF1R1hXdF9WLUdoYS1wQkdBYkE?oc=5,AajTak,2026-04-01T17:48:44+05:30,hi,Delhi,,"(""हीट एक्शन प्लान"" OR ""गर्मी से राहत"" OR चेतावनी OR ""रेड अलर्ट"" OR ""ऑरेंज अलर्ट"" OR ""येलो अलर्ट"" OR एडवाइजरी OR ""राहत सामग्री"" OR ""राहत शिविर"" OR मुआवजा) Delhi","अप्रैल के पहले हफ्ते में देश के कई हिस्सों में मौसम एक बार फिर करवट लेने वाला है. सक्रिय पश्चिमी विक्षोभ यानी वेस्टर्न डिस्टर्बेंस के कारण 2 से 5 अप्रैल तक उत्तर-पश्चिम भारत में हल्की से मध्यम बारिश होने की संभावना है. खासकर 3 और 4 अप्रैल को सबसे ज्यादा आंधी-बारिश की गतिविधियां रहेंगी और कई जगहों पर ओलावृष्टि भी हो सकती है. मौसम विभाग ने कई राज्यों के लिए अलर्ट जारी करते हुए लोगों को आंधी, तेज हवाओं और ओलावृष्टि से सतर्क रहने की सलाह दी गई है.
उत्तर-पश्चिम भारत में भारी बारिश-आंधी का दौर
मौसम विभाग के पूर्वानुमान के मुताबिक, 2 अप्रैल को पूर्वी उत्तर प्रदेश और राजस्थान में कहीं-कहीं हल्की से मध्यम बारिश, मेघगर्जन और 30-40 किलोमीटर प्रति घंटे की रफ्तार से हवाएं चल सकती हैं. वहीं, 3 और 4 अप्रैल को जम्मू-कश्मीर, लद्दाख, हिमाचल प्रदेश, उत्तराखंड, पंजाब, हरियाणा, दिल्ली, पश्चिमी उत्तर प्रदेश और राजस्थान में हल्की से मध्यम बारिश, बर्फबारी (पहाड़ों में), आंधी और मेघगर्जन की संभावना है.
वहीं, 3 और 4 अप्रैल को पंजाब, हरियाणा, दिल्ली, राजस्थान, उत्तर प्रदेश और हिमाचल में ओलावृष्टि की भी आशंका है. इस दौरान 40-50 किलोमीटर प्रति घंटे की रफ्तार से तेज हवाएं चलेंगी. जबकि कुछ जगहों पर हवाओं की स्पीड 60-70 किलोमीटर प्रति घंटे तक पहुंच सकती है.
IMD के मुताबिक, उत्तर-पश्चिम भारत में 6 अप्रैल तक दिन का तापमान सामान्य या सामान्य से नीचे बना रहने की उम्मीद है. हालांकि, केरल, पश्चिम बंगाल, झारखंड और ओडिशा के कुछ इलाकों में 4 अप्रैल तक गर्म और नम मौसम बना रहेगा. मौसम विभाग के अनुसार, यह सक्रिय पश्चिमी विक्षोभ 6 अप्रैल तक प्रभावी रहेगा. इसके बाद मौसम में सुधार होने की संभावना है.
इन राज्यों में आंधी-बारिश की संभावना
मौसम विभाग के मुताबिक, पूर्वोत्तर भारत की बात करें तो 2 अप्रैल को अरुणाचल प्रदेश, असम, मेघालय, नगालैंड, मणिपुर, मिजोरम और त्रिपुरा में अच्छी बारिश होने की संभावना है. वहीं, पूर्वी भारत में ओडिशा, झारखंड, बिहार, पश्चिम बंगाल और सिक्किम में छिटपुट बारिश, आंधी और तेज हवाएं चलेंगी. इसके अलावा मध्य भारत की बात करें तो अगले 5 दिनों तक मध्य प्रदेश, विदर्भ और आसपास के इलाकों में गरज-चमक के साथ बारिश होगी. वहीं, पश्चिम भारत में गुजरात, मध्य महाराष्ट्र और मराठवाड़ा में 4 अप्रैल तक बारिश, आंधी की संभावना है.
दिल्ली में कल कैसा रहेगा मौसम?
राष्ट्रीय राजधानी दिल्ली के आसमान में कल यानी गुरुवार को आंशिक रूप से बादल छाए रहने की उम्मीद है. इस दौरान अधिकतम तापमान 36 डिग्री सेल्सियस और न्यूनतम तापमान 19 डिग्री सेल्सियस के आसपास रहने की उम्मीद है. जबकि अगले दो दिनों में यानी 3-4 अप्रैल को गरज-चमक और तेज़ हवाओं के साथ हल्की बारिश होने की संभावना है.
राजस्थान के मौसम का हाल
अप्रैल महीने की शुरुआत होते ही राजस्थान के मौसम में एक बार फिर बदलाव आ रहा है. तेज गर्मी पड़ने की उम्मीद थी, लेकिन पश्चिमी विक्षोभ और बंगाल की खाड़ी से आने वाली नमी ने मौसम को अस्थिर कर दिया है. मौसम विभाग ने अगले 3-4 दिनों में राज्य के कई इलाकों में तेज हवाएं, आंधी, मेघगर्जन और हल्की बारिश की चेतावनी दी है. मौसम विभाग ने कई जिलों के लिए येलो अलर्ट जारी किया है. मौसम विभाग के अनुसार, 2 अप्रैल की रात से नया मौसम सिस्टम सक्रिय हो जाएगा. इसके असर से जैसलमेर, बाड़मेर और फलोदी सहित आसपास के इलाकों में आंधी के साथ हल्की बारिश हो सकती है.
वहीं, 3 और 4 अप्रैल को बीकानेर, अजमेर, जयपुर, भरतपुर और कोटा संभाग के कई क्षेत्रों में तेज मेघगर्जन, आंधी और बारिश की प्रबल संभावना जताई गई है. इस दौरान 30-40 किलोमीटर प्रति घंटे की रफ्तार से हवाएं चल सकती हैं.
क्यों बदल रहा है मौसम?
अप्रैल के पहले सप्ताह में बंगाल की खाड़ी से नमी और पश्चिमी विक्षोभ सक्रिय होने के कारण राजस्थान के ऊपर साइक्लोनिक सर्कुलेशन बन रहा है. यही वजह है कि मौसम बार-बार करवट ले रहा है. राहत की बात है कि मार्च महीने में लगातार पश्चिमी विक्षोभ आने से तापमान नियंत्रित रहने से गर्मी का प्रकोप देखने को नहीं मिला.",1.0
