title,url,source,date,language,state,district,search_term,full_text,relevance_score
"বিকেলে কলকাতা-সহ দক্ষিণবঙ্গে প্রবল ঝড়বৃষ্টি, তীব্র গরম থেকে মিলবে রেহাই? - Dailyhunt",https://news.google.com/rss/articles/CBMigwJBVV95cUxNU05jdE9YcXh5cFV4RG5GbWFCWUM1QW5RTXdQWEFZM0V5WHllRlNHMFN2NHhVbHpjVmZZTE00TVVSVjUyVlg1a2JJWlFnVVJZdUp0aDFLUHN6amsxMk5URUVOSzhyN0hvVTg0dUlsTTNKRWh3dl9JTGFOVG5DOUEyWEF1QTdlVWxGQzQwU09HaFF6b1EwWlNZSl9la2tjX1d4LXFYNXRUVDRybUFJdl9OdHZBS2ZBbW5mV3h6OXZkUUt1aTNFMmJzQ3BQdjhmM2ZXNDNwbVRCcmpoaGtYLVhQblpWMFVSb0tqTXFhRmJUYWhXNmlBbEt1OE9aVEw0Z3FvRU9z?oc=5,Dailyhunt,2026-06-06T10:17:27+05:30,bn,West Bengal,,"(দাবদাহ OR তাপপ্রবাহ OR ""প্রচণ্ড গরম"" OR ""তীব্র গরম"" OR ""ঝলসানো গরম"" OR ""লু হাওয়া"" OR ""গরমের দাপট"" OR দাবানল OR ""অসহ্য গরম"" OR ""হিট ওয়েভ"" OR ""অত্যধিক গরম"" OR ""ভয়াবহ গরম"") West Bengal","কেরলে প্রবেশ করেছে বর্ষা। শুক্রবার সকালে প্রাক বর্ষার বৃষ্টির স্বাদ পেয়েছে বাংলা। আবহাওয়া দপ্তরের পূর্বাভাস অনুযায়ী, শনিবারও বিকেলের দিকে কলকাতা-সহ দক্ষিণবঙ্গে হতে পারে প্রবল ঝড়বৃষ্টি। তার ফলে তীব্র গরম থেকে কি কিছুটা রেহাই মিলবে, তা-ই যেন এখন লাখ টাকার প্রশ্ন।
আলিপুর আবহাওয়া দপ্তরের পূর্বাভাস অনুযায়ী, উত্তরপ্রদেশে একটি ঘূর্ণাবর্ত রয়েছে।
বাংলাদেশ ও সংলগ্ন উত্তরবঙ্গের ঘূর্ণাবর্ত ক্রমশক্তি হারাচ্ছে। কেরল পেরিয়ে দক্ষিণ-পশ্চিম মৌসুমী বায়ু কর্নাটক ও অন্ধ্রপ্রদেশের কিছু অংশে পৌঁছবে। দু’দিনের মধ্যে উত্তর-পূর্ব ভারতের রাজ্যগুলিতেও ঢুকে পড়বে মৌসুমী বায়ু। তার ফলে ভারতের মূল ভূখণ্ডে শুরু বর্ষামঙ্গল। এদিকে, বাংলাতেও শুরু প্রাক বর্ষার বৃষ্টি। তার ফলে শনিবার বিকেলেও কলকাতা-সহ দক্ষিণবঙ্গে ঝড়বৃষ্টির পূর্বাভাস। বুধবার থেকে ঝড়বৃষ্টির সম্ভাবনা আরও বাড়বে। বীরভূম, মুর্শিদাবাদ, নদিয়া, পূর্ব ও পশ্চিম বর্ধমানে বিক্ষিপ্তভাবে ঝড়বৃষ্টির সম্ভাবনা। ৩০ থেকে ৪০ কিলোমিটার কোথাও বা ৪০ থেকে ৬০ কিলোমিটার গতিবেগে বইতে পারে দমকা ঝোড়ো হাওয়া।
বিক্ষিপ্তভাবে ভারী বৃষ্টির সম্ভাবনা উত্তরবঙ্গে। দার্জিলিং, জলপাইগুড়ি ও আলিপুরদুয়ার জেলায় ভারী বৃষ্টির সম্ভাবনা বেশি। উপরের পাঁচ জেলাতেই বিক্ষিপ্তভাবে ভারী বৃষ্টি চলবে আগামী কয়েকদিন। মঙ্গলবার থেকে ঝড়বৃষ্টির পরিমাণ বাড়বে উত্তরবঙ্গে। ৩০ থেকে ৫০ কিলোমিটার গতিবেগে দমকা ঝোড়ো বাতাসের সঙ্গে বজ্রবিদ্যুৎ-সহ বৃষ্টির পূর্বাভাস। তবে এই বৃষ্টির ফলে তাপমাত্রা কতটা কমবে, সেটাই এখন লাখ টাকার প্রশ্ন। শনিবার কলকাতার সর্বনিম্ন তাপমাত্রা ২৯ ডিগ্রি সেলসিয়াস। শুক্রবার দিনের সর্বোচ্চ তাপমাত্রা ছিল ৩২.১ ডিগ্রি। বাতাসে জলীয় বাষ্পের পরিমাণ আপেক্ষিক আর্দ্রতা ৬৯ থেকে ৯৮ শতাংশ। তবে তাপমাত্রার আরও বাড়তে পারে বলেও মনে করা হচ্ছে।",1.0
দক্ষিণবঙ্গে ভ্যাপসা গরম! আজ কোন কোন জেলায় তুমুল বৃষ্টির সতর্কতা? - TheWall,https://news.google.com/rss/articles/CBMixAFBVV95cUxPalpKOHVMWXhIUGNXay1aUkhwZkpWZk1PV0xLSmtjN3lHTm1uZTVaVzlNVUFmRUdJckpnVVJVQUE3WGRaTWFJbUhMWTBoeTlIMXk1aFlCWEhWZzNDaE81bVpwN1pZVS1TVEotWUpXOEFLc0o0TElfLWF1U2lPTEpsS2dDblVXZ1dzdDZiX2lYOUJGZG5SbnRwMW90bjdSMldlcUJyX2JUNm9Mb3FzQjNoSTRiTFlGdjlMekU2VENNNVRtVzNN0gHEAUFVX3lxTE9qWko4dUxZeEhQY1drLVpSSHBmSlZmTU9XTEtKa2M3eUdObW5lNVpXOU1VQWZFR0lySmdVUlVBQTdYZFpNYUltSExZMGh5OUgxeTVoWUJYSFZnM0NoTzVtWnA3WllVLVNUSi1ZSlc4QUtzSjRMSV8tYXVTaU9MSmxLZ0NuVVdnV3N0NmJfaVg5QkZkblJudHAxb3RuN1IyV2VxQnJfYlQ2b0xvcXNCM2hJNGJMWUZ2OUx6RTZUQ001VG1XM00?oc=5,TheWall,2026-06-06T10:41:23+05:30,bn,West Bengal,,"(""সরকারি ত্রাণ"" OR সতর্কতা OR ""রেড অ্যালার্ট"" OR ""অরেঞ্জ অ্যালার্ট"" OR ""ইয়েলো অ্যালার্ট"" OR ""হিট অ্যাকশন প্ল্যান"" OR ""ত্রাণ শিবির"" OR ক্ষতিপূরণ) West Bengal","দ্য ওয়াল ব্যুরো: দক্ষিণবঙ্গবাসী যখন ভ্যাপসা গরমে চাতক পাখির মতো বর্ষার অপেক্ষা করছেন, ঠিক তখনই সুখবর শোনাল আলিপুর আবহাওয়া দফতর (West Bengal Weather)। শুক্রবার সকালের ঝমঝমিয়ে বৃষ্টি আর কালবৈশাখী থিতিয়ে যেতেই বাতাসে চটচটে আর্দ্রতাজনিত অস্বস্তি ফিরলেও, আজ অর্থাৎ শনিবারেও দক্ষিণবঙ্গের জেলাগুলিতে ধেয়ে আসতে পারে ঝড়-বৃষ্টি। সকালের দিকে কলকাতা ও তার পার্শ্ববর্তী এলাকায় মেঘ-রোদের লুকোচুরি এবং জলীয় বাষ্পের কারণে দিনভর গলদঘর্ম পরিস্থিতি তৈরি হতে পারে। তবে বিকেলের পর ছবিটা বদলানোর সম্ভাবনা রয়েছে।
হাওয়া অফিসের পূর্বাভাস অনুযায়ী, আজ হুগলি, উত্তর ২৪ পরগনা, বাঁকুড়া, পূর্ব ও পশ্চিম বর্ধমান, নদীয়া এবং মুর্শিদাবাদ জেলায় বজ্রবিদ্যুৎ-সহ ভালো রকম ঝড়-বৃষ্টি হতে পারে। অন্যদিকে পূর্ব মেদিনীপুর, পশ্চিম মেদিনীপুর এবং ঝাড়গ্রামে বৃষ্টির পরিমাণ তুলনামূলক কম হওয়ায় এই জেলাগুলিতে গরমের অস্বস্তি আজ একটু বেশিই থাকবে।
এদিকে দেশজুড়ে ইতিমধ্যেই দক্ষিণ-পশ্চিম মৌসুমী বায়ু প্রবেশ করে গেলেও বাংলায় তার আগমন নিয়ে এখনও ধোঁয়াশা কাটেনি। আবহাওয়া বিজ্ঞানীরা জানিয়েছেন, আগামী ৪৮ ঘণ্টার মধ্যে বর্ষা গোয়ায় পৌঁছে যাবে এবং একই সঙ্গে মহারাষ্ট্র, অন্ধ্রপ্রদেশ ও কর্ণাটকের একটি বড় অংশে বর্ষা ঢোকার অনুকূল পরিস্থিতি তৈরি হয়েছে।
তবে বাংলায় ঠিক কবে মৌসুমী বায়ুর অফিশিয়াল এন্ট্রি ঘটবে, সে বিষয়ে আলিপুর আবহাওয়া দফতর এখনই স্পষ্ট কোনো উত্তর দিতে পারেনি। ফলে সঠিক তারিখ জানতে রাজ্যবাসীকে আরও কিছুদিন অপেক্ষা করতে হবে। তবে স্বস্তির কথা হলো, বর্ষা আসতে দেরি হলেও প্রাক-বর্ষার এই ঝড়-বৃষ্টির খেলা দক্ষিণবঙ্গে আরও কিছুদিন জারি থাকবে।
অন্য দিকে, দক্ষিণবঙ্গ যখন গরমে ফুটছে, উত্তরবঙ্গে তখন চলছে আবহাওয়ার এক রাজকীয় স্পেল। আপনি যদি এই মুহূর্তে পাহাড় কিংবা উত্তরবঙ্গের ডুয়ার্সে ছুটি কাটিয়ে থাকেন, তবে আপনি নিঃসন্দেহে ভাগ্যবান। আজ উত্তরবঙ্গের দার্জিলিং ও জলপাইগুড়ি জেলায় ভারী থেকে অতি ভারী বৃষ্টির সতর্কতা জারি করেছে হাওয়া অফিস। এর পাশাপাশি আলিপুরদুয়ারেও আজ ভারী বৃষ্টির পূর্বাভাস রয়েছে এবং মালদা-সহ উত্তরবঙ্গের বাকি কয়েকটি জেলাতে হালকা থেকে মাঝারি ধরনের বৃষ্টিপাত হতে পারে।",0.5166666666666666
"বিকেলে কলকাতায় ঝড়বৃষ্টির সতর্কতা, ভ্যাপসা গরম থেকে মিলবে কি স্বস্তি? - Najarbandi",https://news.google.com/rss/articles/CBMijwFBVV95cUxOWXR1OTRhdTlJaTlUd3RtTUZsY1VBSTE1Mzg4SVJFbzJBRVlLekkwRndSTmh4c1VMUDB1a3d2c015ekdnRU9LLXNvMWZVS1ZUUTBWS1JCTDBQNGFkSmFDS083c2dBaXhoVGNQN3JYZGF5Qjl2aUtjaTU4eHBfeDJZV3Znd1JoT0ZGU1BneVRiUQ?oc=5,Najarbandi,2026-06-06T10:39:21+05:30,bn,West Bengal,,"(""সরকারি ত্রাণ"" OR সতর্কতা OR ""রেড অ্যালার্ট"" OR ""অরেঞ্জ অ্যালার্ট"" OR ""ইয়েলো অ্যালার্ট"" OR ""হিট অ্যাকশন প্ল্যান"" OR ""ত্রাণ শিবির"" OR ক্ষতিপূরণ) West Bengal","দক্ষিণবঙ্গে গরম ও অস্বস্তিকর আবহাওয়ার মাঝেই স্বস্তির খবর। আবহাওয়া দপ্তরের পূর্বাভাস বলছে, শনিবার বিকেল থেকে কলকাতা-সহ দক্ষিণবঙ্গের একাধিক জেলায় বজ্রবিদ্যুৎ-সহ ঝড়বৃষ্টির সম্ভাবনা রয়েছে। কেরলে বর্ষার আনুষ্ঠানিক প্রবেশের পর বাংলাতেও প্রাক-বর্ষার কার্যকলাপ জোরদার হচ্ছে, ফলে তাপপ্রবাহের পরিস্থিতি থেকে সাময়িক স্বস্তি মিলতে পারে বলে আশা করা হচ্ছে।
আলিপুর আবহাওয়া দপ্তর জানিয়েছে, উত্তরপ্রদেশের উপর একটি ঘূর্ণাবর্ত সক্রিয় রয়েছে। অন্যদিকে বাংলাদেশ ও সংলগ্ন উত্তরবঙ্গের ঘূর্ণাবর্ত ধীরে ধীরে দুর্বল হচ্ছে। এই আবহেই দক্ষিণ-পশ্চিম মৌসুমী বায়ু আরও উত্তর দিকে অগ্রসর হচ্ছে এবং আগামী কয়েক দিনের মধ্যে উত্তর-পূর্ব ভারতের রাজ্যগুলিতেও পৌঁছে যাবে।
এর প্রভাবে দক্ষিণবঙ্গের আবহাওয়ায় পরিবর্তনের ইঙ্গিত মিলেছে। শনিবার কলকাতা-সহ একাধিক জেলায় বিকেল ও সন্ধ্যার দিকে বজ্রবিদ্যুৎ-সহ বৃষ্টি এবং ঝোড়ো হাওয়া বইতে পারে। বিশেষ করে বীরভূম, মুর্শিদাবাদ, নদিয়া, পূর্ব বর্ধমান ও পশ্চিম বর্ধমানে বিক্ষিপ্ত ঝড়বৃষ্টির সম্ভাবনা রয়েছে।
কিছু এলাকায় ঘণ্টায় ৩০ থেকে ৪০ কিলোমিটার, আবার কোথাও কোথাও ৪০ থেকে ৬০ কিলোমিটার বেগে দমকা হাওয়া বইতে পারে। ফলে খোলা জায়গায় অবস্থান, গাছের নিচে আশ্রয় নেওয়া বা অরক্ষিত বৈদ্যুতিক খুঁটির কাছে দাঁড়ানো থেকে সতর্ক থাকার পরামর্শ দেওয়া হয়েছে।
উত্তরবঙ্গেও বৃষ্টির দাপট বাড়তে চলেছে। দার্জিলিং, জলপাইগুড়ি ও আলিপুরদুয়ারে ভারী বৃষ্টির সম্ভাবনা রয়েছে। পাহাড় এবং ডুয়ার্স অঞ্চলে আগামী কয়েক দিন ধরে বিক্ষিপ্ত ভারী বৃষ্টি চলতে পারে বলে পূর্বাভাস।
আবহাওয়াবিদদের মতে, মঙ্গলবার থেকে উত্তরবঙ্গে ঝড়বৃষ্টির পরিমাণ আরও বৃদ্ধি পাবে। বজ্রবিদ্যুৎ-সহ বৃষ্টির পাশাপাশি ঘণ্টায় ৩০ থেকে ৫০ কিলোমিটার বেগে ঝোড়ো হাওয়া বইতে পারে।
তবে সবচেয়ে বড় প্রশ্ন, এই বৃষ্টি কি গরম কমাবে? আবহাওয়া দপ্তরের তথ্য অনুযায়ী, শনিবার কলকাতার সর্বনিম্ন তাপমাত্রা ২৯ ডিগ্রি সেলসিয়াসের আশেপাশে রয়েছে। বাতাসে জলীয় বাষ্পের পরিমাণ অত্যন্ত বেশি থাকায় ভ্যাপসা অস্বস্তি এখনও বজায় রয়েছে।
বিশেষজ্ঞদের মতে, বৃষ্টির কারণে সাময়িকভাবে তাপমাত্রা কিছুটা কমতে পারে। তবে আর্দ্রতার মাত্রা বেশি থাকায় গরমের অনুভূতি পুরোপুরি কমবে না। বরং বৃষ্টি থামার পর আবারও অস্বস্তি বাড়ার সম্ভাবনা রয়েছে।
সব মিলিয়ে, শনিবারের ঝড়বৃষ্টি দক্ষিণবঙ্গবাসীকে কিছুটা স্বস্তি দিলেও দীর্ঘমেয়াদি তাপমাত্রা পতনের জন্য এখনও অপেক্ষা করতে হবে। বর্ষা আরও সক্রিয় হলে তবেই গরম থেকে স্থায়ী রেহাই মিলতে পারে।
সবচেয়ে আগে সঠিক খবর, প্রতি মুহূর্তে
Google News এবং Google Discover-এ নজরবন্দি-কে Follow করে রাখুন।",1.0
