title,url,source,date,language,state,district,search_term,full_text,relevance_score
"Vijayawada Weather Forecast: ఏపీలో పెరుగుతున్న ఉష్ణోగ్రతలు.. విజయవాడలో ఎండలు, విశాఖలో పొడి వాతావరణం - News18 Telugu",https://news.google.com/rss/articles/CBMijgJBVV95cUxPdVkzWUVueFNfLWNUaGFnbnd2WGp4MzVzQ3Zyc2ZPYlZWVDlOWlVaZWRwYnpzUmZCUEl6SlhZNnVBQklZcXg4eEVOLWxWYjdtNFFvaENYSGo0YXZEWENkUU9EVExScjg2NHl2SHkzS3NLZlp1U1VHZ0RYdFVPZGNHaVhKQTRQTkJSRndQQ2JmMXdPMDM3cVVld0pnM1Zmd0NmcG92cG9MNi1oYjBjNlBTbW9zcjFrY0xEZUUzd3I4dE5TWnJROG1MSC0tcHZoWlYyN3FfZllSSXl0RHdhTWNmcU1Ba2ptXzRhYUxBNnhkMFRKd3Y4cHhrTkFGX0g1REdzQS1xdWZ6bG1BWEVMdlHSAZMCQVVfeXFMTm9yVm8wcTY0TkJ4TmJjQUxhckZUdmh5VEFIZFY2aUFVWVVWNDY1WU9pNlRvRzdUQVoteDRUMkdfSXR4SzNTRmRHckVPb3dCQnFhTlZMb2dLYXJDSlNrQ1VTR3pXMURYUHFrQVNKR3RXdFJwRjZObkJSLVprelBPSWdUbE5sSzY2LTlFdm9wcnlaeGlVczVFdDhWMnZDenVjdGJUUTJqZy1fX1Q4VWkzUnRJc1FMMV83dDZtUUlrM2JGYjNYSHpVeHl0d2NCaFpmNVBhMDJFcFpNaWF6SjgxdXVXTEp4eUZyN0VDcWlxZzNvVVprdlpIM0V0bEEzSzk5eVdYNnR3LU9wTmwzaGU1Qm5YY3M?oc=5,News18 Telugu,2026-02-16T04:11:00+05:30,te,Andhra Pradesh,Krishna,"(""ఎండ దెబ్బ"" OR ""హీట్ స్ట్రోక్"" OR ""సన్ స్ట్రోక్"" OR ""ఎండ వల్ల మరణం"" OR ఉష్ణోగ్రత OR ""వేడి తట్టుకోలేక"" OR నిర్జలీకరణం OR ""ఆసుపత్రిలో చేరిక"") Andhra Pradesh","Vijayawada Weather Forecast: ఏపీలో పెరుగుతున్న ఉష్ణోగ్రతలు.. విజయవాడలో ఎండలు, విశాఖలో పొడి వాతావరణం
Last Updated:
రాష్ట్రంలోని కోస్తా ఆంధ్ర, రాయలసీమ ప్రాంతాల్లో పొడి వాతావరణం నెలకొంటుందని వాతావరణ శాఖ వెల్లడించింది. ముఖ్యంగా విజయవాడ, విశాఖపట్నం వంటి ప్రధాన నగరాల్లో ఎండ ప్రభావం స్పష్టంగా కనిపిస్తోంది.
Vijayawada Weather Forecast: ఆంధ్రప్రదేశ్ రాష్ట్రవ్యాప్తంగా వాతావరణం వేగంగా మారుతోంది. ఫిబ్రవరి మూడవ వారం ప్రారంభం కావడంతో చలి తీవ్రత గణనీయంగా తగ్గి, పగటి ఉష్ణోగ్రతలు క్రమంగా పెరుగుతున్నాయి. సోమవారం (ఫిబ్రవరి 16, 2026) నాడు రాష్ట్రంలోని కోస్తా ఆంధ్ర, రాయలసీమ ప్రాంతాల్లో పొడి వాతావరణం నెలకొంటుందని వాతావరణ శాఖ వెల్లడించింది. ముఖ్యంగా విజయవాడ, విశాఖపట్నం వంటి ప్రధాన నగరాల్లో ఎండ ప్రభావం స్పష్టంగా కనిపిస్తోంది.
విజయవాడలో వేసవి ఛాయలు
రాష్ట్ర రాజధాని ప్రాంతమైన విజయవాడలో ఎండ తీవ్రత అప్పుడే మొదలైంది. సోమవారం నాడు ఇక్కడ గరిష్ట ఉష్ణోగ్రత 34°C గా నమోదయ్యే అవకాశం ఉండగా, కనిష్ట ఉష్ణోగ్రత 20°C ఆవరణలో ఉంటుంది. ఆకాశం పూర్తిగా నిర్మలంగా (Sunny) ఉండి, పగటిపూట ఎండ తీవ్రత ఎక్కువగా ఉంటుంది. గాలిలో తేమ శాతం 44% గా ఉండటం వల్ల కాస్త ఉక్కపోతగా అనిపించవచ్చు. ఆగ్నేయ దిశ నుండి గంటకు సుమారు 9 మైళ్ల వేగంతో గాలులు వీస్తాయి. వర్షం కురిసే అవకాశం అస్సలు లేదని (0%) వాతావరణ నివేదికలు స్పష్టం చేస్తున్నాయి.
advertisement
విశాఖపట్నంలో ఆహ్లాదకరంగా.. కానీ పొడిగా..
సాగర తీర నగరం విశాఖపట్నంలో వాతావరణం కాస్త భిన్నంగా ఉండనుంది. ఇక్కడ గరిష్ట ఉష్ణోగ్రత 27°C గాను, కనిష్ట ఉష్ణోగ్రత 22°C గాను నమోదయ్యే అవకాశం ఉంది. సముద్రపు గాలుల ప్రభావంతో విజయవాడతో పోలిస్తే ఉష్ణోగ్రతలు తక్కువగా ఉన్నప్పటికీ, గాలిలో తేమ శాతం 73% గా ఎక్కువగా ఉండటం వల్ల అసౌకర్యంగా ఉండవచ్చు. ఉదయం వేళల్లో స్వల్పంగా పొగమంచు కురిసే అవకాశం ఉంది, ఆ తర్వాత ఆకాశం నిర్మలంగా మారుతుంది.
advertisement
రాష్ట్రంలోని ఇతర ప్రాంతాల పరిస్థితి
రాయలసీమ: అనంతపురం, కర్నూలు, కడప జిల్లాల్లో ఎండ తీవ్రత ఎక్కువగా ఉంటుంది. ఇక్కడ ఉష్ణోగ్రతలు 35°C దాటే అవకాశం ఉందని అంచనా.
దక్షిణ కోస్తా: నెల్లూరు, ప్రకాశం జిల్లాల్లో కూడా పొడి వాతావరణం కొనసాగుతుంది. బంగాళాఖాతంలో ఏర్పడే అల్పపీడన పరిస్థితులపై నిపుణులు నిఘా ఉంచినప్పటికీ, సోమవారం నాడు వర్ష సూచన లేదు.
ఉత్తర కోస్తా: ఏజెన్సీ ప్రాంతాలైన చింతపల్లి, పాడేరులలో రాత్రి ఉష్ణోగ్రతలు ఇంకా తక్కువగానే (12°C - 15°C) నమోదవుతున్నాయి.
advertisement
వ్యవసాయం, ఆరోగ్యంపై ప్రభావం
పగటిపూట ఉష్ణోగ్రతలు పెరగడం వల్ల కోతకు సిద్ధంగా ఉన్న మిర్చి, వేరుశనగ వంటి పంటలకు మేలు జరుగుతుంది. అయితే, పెరుగుతున్న వేడి దృష్ట్యా పశువులకు, ఆరుతడి పంటలకు తగినంత నీటిని అందించాలని వ్యవసాయ నిపుణులు సూచిస్తున్నారు.
ప్రజలకు సూచనలు
మధ్యాహ్న సమయాల్లో ఎండ తీవ్రత మొదలవుతున్నందున, ప్రయాణాల్లో ఉన్నవారు తగినంత నీరు (Hydration) తీసుకోవాలి. చలి మరియు ఎండల కలయిక వల్ల వైరల్ జ్వరాలు వచ్చే అవకాశం ఉన్నందున ఆరోగ్య విషయంలో జాగ్రత్తగా ఉండాలి. తీర ప్రాంతాల్లో మత్స్యకారులకు ఎటువంటి ప్రమాద హెచ్చరికలు లేవు. మొత్తానికి, ఈ ఏడాది వేసవి ముందుగానే మొదలయ్యే సూచనలు కనిపిస్తున్నాయని, రానున్న రోజుల్లో ఉష్ణోగ్రతలు మరింత పెరిగే అవకాశం ఉందని అమరావతి వాతావరణ కేంద్రం తెలిపింది.
Click here to add News18 as your preferred news source on Google.
ఆంధ్రప్రదేశ్లోని ముఖ్యమైన వార్తలు, లేటెస్ట్ న్యూస్, స్థానిక వార్తలు, ప్రభుత్వ పథకాలు, ప్రభుత్వ ప్రకటనలు, అన్ని రాజకీయ పార్టీలకు సంబంధించిన స్టోరీలను న్యూస్18 తెలుగు ఆంధ్రప్రదేశ్ కేటగిరీలో చదవండి. మరిన్ని వార్తల కోసం న్యూస్ 18 తెలుగు ఫాలో అవండి.",0.0
