title,url,source,date,language,state,district,search_term,full_text,relevance_score
"Heatwave back, Akola sizzles at 45.6°C - The Times of India",https://news.google.com/rss/articles/CBMirwFBVV95cUxQMXZtdjhETzVvelhZX0R2eHdrTW5tMW03Q2xOelZSSW4xZVZGbW5CY0JFbVk3X1g4ZzRvdkxZd1VrUTdmN3F4SE4zZ3Rkd1pnWWZNV0JoSUVjMGZxci1vanVaYktHTlZscGF5NllnQ3YtcWIyb29KRmRSMzd1aGxBOGVwWkF1MjJNY2hCa2dXM2ZidmxmSk1IVGY4clBKTnBZUnpSZ0gwWGZIMUNjU3NB0gG0AUFVX3lxTFBmU2tZZ3lMd3dBbEg4QnRvdEZEa0xDS21WNmp5QldWNGRsdDlCUXJuWk1Ca2JiNTJEWFFpZlZIdTNHTmhmVDB2aUhMV3AxUEdWLUphRlplS3p4TkZIZDEzWnlXbkxzTGF1aHpYdV82eEo3SDlEd0g5cllCRy1fRVhHeXFLU2JCbUQ4NUxqbG5aejJWVEh5NGhrMGFvZERVSE9DUlJSWGVscjI0dWtGdjA3OW1qaQ?oc=5,The Times of India,2026-05-13T03:00:00+05:30,en,Maharashtra,Akola,"(heatwave OR ""heat wave"" OR ""severe heatwave"" OR ""extreme heat"" OR ""heat spell"" OR ""scorching heat"" OR ""blistering heat"" OR ""sweltering heat"" OR ""hot winds"" OR loo OR ""hot loo winds"" OR ""intense heat"" OR ""unbearable heat"" OR ""deadly heat"" OR heat OR ""weather forecast"" OR ""weather update"" OR ""weather alert"" OR ""IMD forecast"" OR ""IMD prediction"" OR ""IMD alert"" OR IMD OR ""rising temperatures"" OR ""temperatures expected to rise"" OR ""relief from heat"" OR ""respite from heat"" OR ""heat respite"" OR ""respite from scorching heat"") Maharashtra","Akola: As Vidarbha faces an intense heatwave, with temperatures in Akola soaring to a scorching 45.6°C, a citizen-led initiative has emerged as a significant effort to protect the city's shrinking green cover.
Along with Amravati, Akola is among the worst-affected regions this summer. Environmental experts attribute the rising temperatures to rapid urbanisation, extensive concretisation, road expansion, and large-scale tree felling over the years.
The consequences are visible across the city. Water bodies are drying up faster due to increased evaporation, and groundwater levels are steadily declining. The lack of tree cover has also reduced natural cooling, making conditions harsher for both residents and existing vegetation.
To mitigate urban heat effect to some extent, the Akola Garden Club has launched a unique grassroots campaign to preserve trees during the peak summer months. The Club has introduced a mobile ""Tree Lifeline Water Chariot"" for watering trees across different parts of the city.
The Club members highlighted that they regularly organise annual exhibitions to promote gardening across the city and district, encouraging residents by showcasing plants and flowers and awarding participants.
""It is our responsibility to ensure that the city remains green and vibrant,"" a member said. They stressed that planting new saplings during such extreme heat is not practical, but preserving existing trees is critical. ""These trees provide shade and oxygen. If they perish now, the environmental impact will be severe in the coming years,"" they added.
The group has also appealed to citizens and the civic administration to take collective responsibility. Residents have been urged to water trees in their surroundings and contribute to maintaining urban greenery. While authorities often claim large-scale plantation drives, concerns remain about the lack of follow-up care and monitoring, with many saplings failing to survive. With temperatures expected to remain high, such community-driven efforts could play a crucial role in protecting urban ecosystems and mitigating the effects of extreme heat.",1.0
Pune records hottest night of summer season; administration issues heatwave safety guidelines | Hindustan Times - Hindustan Times,https://news.google.com/rss/articles/CBMi-AFBVV95cUxPbW1WTTBzUnh2Zkx4QjByRk1lMHFORGNUMWNTQzBOOEhrTEF4MlJ6Ui1DTGRGRl9XNlUzcHlOa2lab05pbjRuQlRHM3h5ZTIyWkxVa0VhMWxVb3BSdlY5UzZiX2VJS2xPTWRtQ1RDQ0tPc3VVN3BvWXVQYlJmX01VRW1FS0I4bWdZWEtpc1FOVHRkUG4wRjZEWE0yZWcxS1hvYXF6NDZwRFJ3VlRQNGpvaXBTdHpyeG1UWEhJcFI2dTBGOUhiUnJ0WFdzcEUtTGxMdTg0LWJjazl4Qm1QV0hqUUJYdzBrZ0tHY25DNG5BQUNHYVFZVlM1QdIB-AFBVV95cUxPbW1WTTBzUnh2Zkx4QjByRk1lMHFORGNUMWNTQzBOOEhrTEF4MlJ6Ui1DTGRGRl9XNlUzcHlOa2lab05pbjRuQlRHM3h5ZTIyWkxVa0VhMWxVb3BSdlY5UzZiX2VJS2xPTWRtQ1RDQ0tPc3VVN3BvWXVQYlJmX01VRW1FS0I4bWdZWEtpc1FOVHRkUG4wRjZEWE0yZWcxS1hvYXF6NDZwRFJ3VlRQNGpvaXBTdHpyeG1UWEhJcFI2dTBGOUhiUnJ0WFdzcEUtTGxMdTg0LWJjazl4Qm1QV0hqUUJYdzBrZ0tHY25DNG5BQUNHYVFZVlM1QQ?oc=5,Hindustan Times,2026-05-13T15:05:24+05:30,en,Maharashtra,Akola,"(heatwave OR ""heat wave"" OR ""severe heatwave"" OR ""extreme heat"" OR ""heat spell"" OR ""scorching heat"" OR ""blistering heat"" OR ""sweltering heat"" OR ""hot winds"" OR loo OR ""hot loo winds"" OR ""intense heat"" OR ""unbearable heat"" OR ""deadly heat"" OR heat OR ""weather forecast"" OR ""weather update"" OR ""weather alert"" OR ""IMD forecast"" OR ""IMD prediction"" OR ""IMD alert"" OR IMD OR ""rising temperatures"" OR ""temperatures expected to rise"" OR ""relief from heat"" OR ""respite from heat"" OR ""heat respite"" OR ""respite from scorching heat"") Maharashtra","Pune records hottest night of summer season; administration issues heatwave safety guidelines
Lohegaon continued to remain one of the hottest locations in Pune district, recording a maximum temperature of 43.2 degrees Celsius for the second consecutive day.
Pune: Pune witnessed its hottest night of the ongoing summer season on Tuesday with Shivajinagar recording a minimum temperature of 26.3 degrees Celsius, according to the India Meteorological Department (IMD). The minimum temperature was four degrees Celsius above normal, indicating persistent heat conditions across the city and surrounding regions. Residents experienced warm and humid conditions through the night, with temperatures remaining significantly above seasonal averages. The unusually high night-time temperature added to the discomfort already caused by intense daytime heat over the past several days.
Meanwhile, Lohegaon continued to remain one of the hottest locations in Pune district, recording a maximum temperature of 43.2 degrees Celsius for the second consecutive day. In Shivajinagar, the maximum temperature was 40.8 degrees Celsius, around 3.3 degrees Celsius above normal despite a marginal drop of one degree Celsius from the previous day.
The rising temperatures are not limited to Pune district alone. Large parts of central Maharashtra continued to reel under severe heatwave-like conditions on Tuesday. Except for Mahabaleshwar which recorded 32.6 degrees Celsius; and Kolhapur which logged 38.7 degrees Celsius; nearly all weather stations recorded temperatures touching or crossing the 40-degrees Celsius mark.
Jalgaon recorded one of the highest maximum temperatures in Maharashtra at 45.5 degrees Celsius, while Akola registered 45.6 degrees Celsius, making it the hottest place in the state. Several districts in Marathwada and Vidarbha also reported above-normal temperatures.
The IMD has forecast that heatwave conditions are likely to continue over central Maharashtra, including Pune city, for the next 48 hours at least. In view of rising temperatures, the weather department has issued a yellow alert for Pune, Nashik, Ahilyanagar, Beed, Nanded, Parbhani, Jalna, Chhatrapati Sambhajinagar, Jalgaon, Hingoli, Akola, Amravati and Wardha districts.
{{/usCountry}}The IMD has forecast that heatwave conditions are likely to continue over central Maharashtra, including Pune city, for the next 48 hours at least. In view of rising temperatures, the weather department has issued a yellow alert for Pune, Nashik, Ahilyanagar, Beed, Nanded, Parbhani, Jalna, Chhatrapati Sambhajinagar, Jalgaon, Hingoli, Akola, Amravati and Wardha districts.
{{/usCountry}}S D Sanap, senior meteorologist at IMD Pune, said that the city is likely to witness mainly dry weather till May 18. He added that both day and night temperatures are expected to remain above normal during this period, increasing the possibility of heat-related health issues among vulnerable groups.
{{/usCountry}}S D Sanap, senior meteorologist at IMD Pune, said that the city is likely to witness mainly dry weather till May 18. He added that both day and night temperatures are expected to remain above normal during this period, increasing the possibility of heat-related health issues among vulnerable groups.
{{/usCountry}}With the heatwave intensifying, the Pune district administration has issued a detailed advisory aimed at protecting workers, labourers and citizens from the adverse effects of extreme heat. Pune district collector and chairman of the district disaster management authority, Jitendra Dudi, said that the administration has released multi-sectoral guidelines following alerts issued by the IMD and state government.
{{/usCountry}}With the heatwave intensifying, the Pune district administration has issued a detailed advisory aimed at protecting workers, labourers and citizens from the adverse effects of extreme heat. Pune district collector and chairman of the district disaster management authority, Jitendra Dudi, said that the administration has released multi-sectoral guidelines following alerts issued by the IMD and state government.
{{/usCountry}}According to the advisory, workers engaged in outdoor and physically demanding jobs are among the most vulnerable during heatwave conditions. Industries and employers have been asked to reschedule work timings, and avoid assigning heavy work during peak afternoon hours when temperatures are at their highest.
The administration has directed industries and establishments to provide adequate drinking water, shaded rest areas and cooling arrangements for workers. Emergency supplies such as ice packs, fans and heat-protection materials should also be made available at workplaces. Employers have additionally been advised to coordinate with the health department for regular health checkups of labourers and workers.",1.0
Maharashtra Weather Forecast: IMD Predicts Heatwave in Several Districts; Mumbai Likely To Remain Warm - lokmattimes.com,https://news.google.com/rss/articles/CBMi3wFBVV95cUxONGJPZ3VXbVBNUm9TdmhmNm1fNEhhNEhYMGxqVUxReUxwX3NRbHZoc3NxRmNZeDI0Z0xWb3phQWwxc0JFbS15ZVhGZi1ENE14Wm9HODF5cTBlOW1RRi1MeWYyaURCNEtmY1pEMTJ3bkVwdFdCTV9tdHdDWGMzU05aVTBCbnZqbVpFbVV6TjVKVWM3REVwRnREbjVEeUxpdHQxaVMwXzVMYWg0Z1BMTnRGSklkUDliNnFPRTJSMk5YTnhPYTUySDRMeVpHbWI2TUNmbHpudERlODNKQWZKd1Rr0gHkAUFVX3lxTE9FUjE5dTZjX3J3c3dlNjJ0dXFnbWE0NzczRUppcllvMlBWa3dleEdVbTNmaExQZDRVS2lwQ29tTXZjZXNHbzJQZVdtVkNrS3pVY056R2U2MGNGZm0xWm44QURYYjRsdlh5ZHVWVlVrM2Fvd3U5dzVFcDFwa0FLNkllNHdZMDBPc05WMkZnRVNvOTVtazkyOTVzWHFCRFlzVm9PZWJYZUhiWmh4UEZhcm1ITVE1N2dqcDE1M0gzZFZwcEZnZ21mV3AxQXNzZ291aDR5cWoybEQyc3lfaHk2d3NIb3pEdw?oc=5,lokmattimes.com,2026-05-13T15:11:58+05:30,en,Maharashtra,Akola,"(heatwave OR ""heat wave"" OR ""severe heatwave"" OR ""extreme heat"" OR ""heat spell"" OR ""scorching heat"" OR ""blistering heat"" OR ""sweltering heat"" OR ""hot winds"" OR loo OR ""hot loo winds"" OR ""intense heat"" OR ""unbearable heat"" OR ""deadly heat"" OR heat OR ""weather forecast"" OR ""weather update"" OR ""weather alert"" OR ""IMD forecast"" OR ""IMD prediction"" OR ""IMD alert"" OR IMD OR ""rising temperatures"" OR ""temperatures expected to rise"" OR ""relief from heat"" OR ""respite from heat"" OR ""heat respite"" OR ""respite from scorching heat"") Maharashtra","Maharashtra Weather Forecast: IMD Predicts Heatwave in Several Districts; Mumbai Likely To Remain Warm
By Lokmat Times Desk | Updated: May 13, 2026 14:54 IST2026-05-13T14:53:52+5:302026-05-13T14:54:06+5:30
The India Meteorological Department (IMD) on Wednesday, May 13 issued a forecast and warned of heatwave conditions in several ...
The India Meteorological Department (IMD) on Wednesday, May 13 issued a forecast and warned of heatwave conditions in several districts of Madhya Maharashtra and Marathwada over the next few days, while parts of southern Maharashtra are likely to witness thunderstorms accompanied by lightning, gusty winds and light to moderate rainfall.
According to the Regional Meteorological Centre (RMC) in Mumbai, heatwave conditions are very likely to prevail in isolated pockets of Madhya Maharashtra and Marathwada on May 13 and 14, 2026. Warm nights are also expected in parts of North Madhya Maharashtra and Marathwada.
Heat wave conditions very likely to prevail in isolated pockets in the districts of Madhya Maharashtra and Marathwada.
— Regional Meteorological Center,Mumbai (@RMC_Mumbai) May 13, 2026
Warm night conditions very likely to prevail in districts of North Madhya Maharashtra and Marathwada.
IMD in its weather forecast stated thunderstorms accompanied by lightning, light to moderate rain and gusty winds with speeds of 40 to 50 kmph are likely at isolated places in South Madhya Maharashtra and Marathwada.

Thunderstorm accompanied with lightning , light to moderate rain, gusty winds with speed 40-50 kmph very likely to occur at a isolated places in the disrticts of South Madhya Maharashtra and Marathwada. pic.twitter.com/DzCYIzrSbK
— Regional Meteorological Center,Mumbai (@RMC_Mumbai) May 13, 2026
On Tuesday, severe heatwave conditions prevailed in isolated pockets of South Gujarat, while warm night conditions were reported in parts of North Madhya Maharashtra and Marathwada. Light rainfall was recorded at isolated places in South Konkan-Goa, Madhya Maharashtra and Marathwada.
Jalgaon recorded the highest maximum temperature in the region at 45.5 degrees Celsius. Strong winds were also reported from several districts, including Nashik, Pune, Solapur, Beed and Hingoli.
Mumbai Weather Update
For Mumbai, the weather department has forecast mainly clear skies over the next 48 hours. The city and suburbs are likely to experience hot and humid conditions, with maximum temperatures around 35 degrees Celsius and minimum temperatures around 26 to 28 degrees Celsius.
Rainfall in These Districts
The IMD has also predicted isolated rainfall and thundershowers in parts of Ratnagiri, Sindhudurg, Kolhapur, Sangli, Solapur, Nanded, Latur and Dharashiv over the coming days. Some areas in Vidarbha, including Akola, Amravati and Wardha, may witness thunderstorms accompanied by hail and gusty winds reaching up to 50 to 60 kmph.
IMD Warning
The weather office has advised people to avoid prolonged exposure to heat, stay hydrated and avoid outdoor activities during peak afternoon hours. Farmers have also been advised to complete harvesting of mature crops and store produce safely due to the possibility of unseasonal rain and thunderstorms.
Meanwhile, the IMD said a well-marked low-pressure area over the southwest and adjoining west-central Bay of Bengal continues to persist and may influence weather conditions in parts of the region over the coming days.
Open in app",1.0
"Maharashtra Heatwave Alert (13 May, 2026): IMD Issues WARNING As Pune Records Temperatures Above 43°C - NewsX",https://news.google.com/rss/articles/CBMi0gFBVV95cUxONV8wZHF0Qi1HLUJJMmJTUjNoRkxpR3VKS242RnE4bXVfQnVPSjlXZFhDRzlQeVRpbDhYbmhCYloyU3czcEtoalkzVS1GWnlJOEtoUmNLWWVwM1FFREZUTVk0Z3ZXLV9uOXJqRVBBSk5lQnNpdDIxUmJTcXIwVHpCYVhram1oUkZVT0UtTnNVbm9vaVJ5dUlidHFHUG14bDdXazlpMkF6N0dDeDlSOVVRM2s5bEg1SXRUdTJDOWFIakFiQ2dsdFh3Mk1pVC1ISDM3eXfSAdcBQVVfeXFMTUo5aWQ0alkyUXZQLXBSX1RBQndMS1hUZFFibmdFYUE3WUxrMXpoZ0M3Ry05b1FVUlFhMFVteWdkRElfRXZkczNldEd5OW9WVXVKN2ZzWkxkM2VjM1dycU93Tk5OYTl4SWZ4M1Q1QUYtbWNRcW1sTVFNMzJ4SUh2MWxZSDN1NmJuWTBiSENvdnJNcVdsbWxaOVd0blB5OWxWTHJSeldycFBzaExHcm1iOUNyb2Vsb1FSd1Jzek91Ri1EQmZpclFzUm0xV0VNazlQbDFfcWFzSTQ?oc=5,NewsX,2026-05-13T16:08:33+05:30,en,Maharashtra,Akola,"""heatwave"" Maharashtra","Maharashtra Heatwave Alert 2026: Maharashtra is currently undergoing one of its worst summer wave, with India Meteorological Department (IMD) raising alerts for several districts in the state. In Pune, Nashik, Jalgaon, Akola and parts of Marathwada, temperatures are soaring to record highs, while the high temperature does not ease during the night.
Pune Heatwave, May 13, 2026
Pune has emerged as one of the worst-hit regions of the ongoing heatwave, with weather stations in the city recording temperatures above 43°C, including at Lohegaon, which saw temperatures in excess of 43.8°C, one of the hottest days recorded in May in recent times. Shivajinagar too saw temperatures above 41°C, while the eastern suburbs like Hadapsar, Magarpatta, Wadgaonsheri and Chinchwad also witnessed extreme daytime temperatures.
Important temperature statistics so far
- Hours of temperatures above 40°C in the eastern parts
IMD throws out the heatwave warnings
The IMD has issued yellow alerts and heatwave warnings for most parts of Maharashtra, especially in Madhya Maharashtra, Marathwada and Vidarbha regions. The officials said that dry and hot weather is expected to persist for next few days, increasing the chances of heat-related illnesses.
Affected districts:-
Why Is temperature Increasing So Fast Like This?
Meteorologists say the heatwave is due to the confluence of several weather systems and the urbanisation of the region. The moisture-carrying systems from Arabian Sea and the Bay of Bengal are weakening, and the dry northerly wind from Rajasthan and Madhya Pradesh have taken control of the weather pattern of Maharashtra. The clear sky is also permitting strong solar heating of the land during day.
Reasons for the Heatwave-
- Concrete and concrete-heavy areas of Pune and less green cover
- Trapping of heat during night
- Heat-related medical emergency cases rising in Maharashtra
Doctors and health experts said that exposure of body to extreme temperature for long periods can cause dehydration, exhaustion, dizziness, heat cramps and even heatstroke. Multiple heat-related medical emergencies have already been reported in Maharashtra this season.

Safety Tips Given by Experts
- Wear caps, use umbrellas or wet cloths while going outside
What’s Next?
The IMD has warned that the heatwave may continue for the next few days in some parts of Maharashtra. The interior portions are expected to remain above normal, whereas Pune may continue with hot nights. Meteorologists say that relief is unlikely till there is a major rainfall spell over the western and central parts.
Disclaimer: Weather forecasts, heatwave alerts, and temperature readings mentioned in this article are based on updates issued by the India Meteorological Department (IMD) and related reports available at the time of publishing. Weather conditions may change rapidly depending on local climatic activity. Readers are advised to follow official IMD advisories and local administration guidelines for the latest updates and safety measures.
I am a content writer with 2.5 years of experience, currently working at ITV Digital. I cover a wide range of topics including entertainment, world news, India news, crime, and astrology, along with writing engaging lifestyle stories and reviews. With a flair for storytelling and a keen eye for trends, I aim to deliver fresh, reader-friendly content across diverse subjects.",1.0
"Temperatures soar across Maharashtra, but heatstroke cases down to 175 after revision; deaths 6 - The Times of India",https://news.google.com/rss/articles/CBMi_gFBVV95cUxOOVNhaVIxVDk2X3I2dHFJbzk0bFc1ZzNKSlVBTkFvLVNOSzUxY05mektLTDh4Tmt2ODNyNlBjVkZmN1Q4cWo1LVZoR0dGajFUdGNlSnlleFV5b21aV05aWl9wbTJKdktfZmJlQmFPemI1YzJpSUltemFqNE41UVh2MmhCVU5jelFxbHA3dkFLWm0ydWNIaVZ0X0JwYlRlTVZ3dDRLUFo5QWg5ZDJKYjdBLWs0OWQ0UW9Bb05fVmpxeU5aLXllcDhzSFhEc1dHano0Zy1vWUQ2TnFQeHd3d19wNnJiMzY3VW5IdDBWdDhMdGNzcE5na2RpQ3ZzakVyd9IB_gFBVV95cUxOOVNhaVIxVDk2X3I2dHFJbzk0bFc1ZzNKSlVBTkFvLVNOSzUxY05mektLTDh4Tmt2ODNyNlBjVkZmN1Q4cWo1LVZoR0dGajFUdGNlSnlleFV5b21aV05aWl9wbTJKdktfZmJlQmFPemI1YzJpSUltemFqNE41UVh2MmhCVU5jelFxbHA3dkFLWm0ydWNIaVZ0X0JwYlRlTVZ3dDRLUFo5QWg5ZDJKYjdBLWs0OWQ0UW9Bb05fVmpxeU5aLXllcDhzSFhEc1dHano0Zy1vWUQ2TnFQeHd3d19wNnJiMzY3VW5IdDBWdDhMdGNzcE5na2RpQ3ZzakVydw?oc=5,The Times of India,2026-05-13T04:26:00+05:30,en,Maharashtra,Akola,"""heatstroke"" Maharashtra","Pune: Maharashtra health department data shows a decline in reported heatstroke cases following a revision despite rising temperatures across the state, raising fresh concerns over the accuracy of reporting systems.
Between March 1 and May 10, the state had reported 236 heatstroke cases and four deaths — both suspected and confirmed. On Tuesday, officials revised the heatstroke figures downward to 175, while the death toll was updated to six — four suspected and two confirmed.
Explaining the revision in heatstroke figures and fatalities, state surveillance officer Dr Raju Sule said some cases had been incorrectly classified as heatstroke. ""Many ground staffers have misreported certain cases as heatstroke, which caused the figures to inflate. The Aurangabad team later withdrew those cases and the number has gone down. Diagnosing heatstroke remains inherently difficult, as it is based on clinical symptoms without any definitive test.""
He acknowledged structural gaps in reporting. ""We have trained our staffers to report cases. But apart from difficulty in diagnosis, lack of reporting staff and nodal officers in medical colleges is also a reason for low reporting,"" he said, noting that cases this season could be higher given the surge in temperatures ""but are not fully captured in official records"".
With a strong El Niño event intensifying heat conditions this year and temperatures consistently remaining above 40°C in many districts of Maharashtra, doctors warn that the official numbers are likely underestimated. Dr Avinash Ignatius, senior nephrologist and transplant physician at Pune's Noble Hospitals and Research Centre, said they were witnessing a sharp increase in heat-related kidney problems as temperatures climb beyond the 40°C-mark.
He said, ""Over the past few weeks, a significant number of patients are visiting OPDs and emergency departments with dehydration-related renal stress, acute kidney injury, worsening chronic kidney disease, urinary tract infections and kidney stone episodes. Many patients report symptoms such as severe weakness, dizziness, reduced urine output, muscle cramps, nausea, burning urination, flank pain, fatigue, and episodes of fainting or near-syncope. Particularly vulnerable are the elderly, diabetics, outdoor workers, hypertensive patients and those with pre-existing kidney disease.""
Questions over accuracy extend to fatalities as well. From March 1 to May 11, six heatstroke deaths were recorded — four suspected (two from Ahilyanagar, one each from Akola and Solapur) and two confirmed (one each from Akola and Latur). However, a May 1 death of a 34-year-old fruit vendor in Pachora of Jalgaon district — reported earlier and confirmed locally as heatstroke — has not yet been included in the state tally.
Officials said the case was under investigation pending autopsy confirmation. Dr Vijay Vasant Patil, medical officer, RH Pachora, Jalgaon, said, ""I have sent the postmortem report to my seniors. When the patient was brought to me, he dead by then. His relatives had reported that the man was exposed in about 43-45°C for a prolonged period.""
Experts warn that under-reporting of heatstroke cases has serious policy implications. Dr Pradipkumar Awate, former state surveillance officer who had drafted the guidelines for heatstroke in Maharashtra, blamed ""the lackadaisical attitude of the administration for the poor reporting of heatstroke cases"".
He said, ""The health department must regularly follow up with the district administration for reporting of cases, especially in Vidarbha which is known for its heat spots. The state has asked the local civic bodies to prepare a heat action plan, but for that we must have enough data. Localised data is important because as though a city temperature might be low, but specific areas may be ‘heat islands'. An effective action plan is possible only when actual numbers are reported"".
Scientific literature indicates that heat-related mortality is frequently misclassified, as extreme heat often aggravates pre-existing conditions rather than appearing as the primary cause of death. Clinically, heatstroke can resemble dehydration, infections, or cardiovascular collapse, particularly when patients present late or without documented heat exposure. India saw a 55% rise in deaths due to extreme heat between 2000-2004 and 2017-2021, a recent study published in a medical journal stated.",1.0
