title,url,source,date,language,state,district,search_term,full_text,relevance_score
"Thunderstorms bring partial relief, but heatwave persists in Andhra Pradesh - The Hindu",https://news.google.com/rss/articles/CBMi6AFBVV95cUxOQUFNYUxKS3R4N1U2SVdnWHhMMnZZLWQ4R2FsSENCYUp6NENVMndfOFM5REt4WG85WC1hUC1tZUZjSHdCOVVacjlka0lndmxtakpwYjhHbTNDZmU4TjgzV2JPUTBOb016ZDhJSUJKRV9aQ3AxaVZQU2lfVjJKcXVicWVWekxIOWVpUnkwNjYzY0prRnhNODNfc2puaFMyUlNTY1V1UTlzNlkzd25nbWpkeG1xbkNMV244RW0yVk1YMDRQUUtPek11Uk1MZF85VGJiRzduMnF3ekg1LUJSYlpDb243bHFhS0h30gHoAUFVX3lxTE5BQU1hTEpLdHg3VTZJV2dYeEwydlktZDhHYWxIQ0JhSno0Q1Uyd184UzlES3hYbzlYLWFQLW1lRmNId0I5VVpyOWRrSWd2bG1qSnBiOEdtM0NmZThOODNXYk9RME5vTXpkOElJQkpFX1pDcDFpVlBTaV9WMkpxdWJxZVZ6TEg5ZWlSeTA2NjNjSmtGeE04M19zam5oUzJSU1NjVXVROXM2WTN3bmdtamR4bXFuQ0xXbjhFbTJWTVgwNFBRS096TXVSTUxkXzlUYmJHN24ycXd6SDUtQlJiWkNvbjdscWFLSHc?oc=5,The Hindu,2026-05-22T21:16:46+05:30,en,Andhra Pradesh,Anantapur,"heatwave (Anantapur OR Chittoor OR ""East Godavari"" OR Guntur OR Krishna OR Kurnool OR Nellore OR Prakasam OR Srikakulam OR Visakhapatnam OR Vizianagaram OR ""West Godavari"" OR ""YSR Kadapa"") Andhra Pradesh","Severe heatwave conditions continued across several parts of Andhra Pradesh on Friday, though isolated thunderstorms and rainfall in some districts brought temporary relief from the intense summer temperatures.
According to data from the Cyclone Warning Centre (CWC) and the Directorate of Economics and Statistics (DES), the highest temperature in the State was registered at Jangamaheswarapuram in Palnadu district at 45°C., Tanuku in West Godavari district followed at 44.75°C, while Torragudipadu in NTR district recorded 44.74°C.
Several other regions in coastal Andhra Pradesh and central districts reported temperatures above 42°C. Devarapalle in Anakapalli district recorded 44.66°C, Kanumole in Krishna district 43.84°C, and Piduguralla in Palnadu district 43.83°C.
Among the major urban centres monitored by the CWC, Amaravati and Gannavaram recorded 42.6°C each, with humidity levels reaching 33%. Kakinada and Tirupati registered 41.2°C each, while Tuni and Narsapuram recorded 41°C.
In north coastal Andhra Pradesh, Puligummi in Vizianagaram district recorded 42.29°C, while Akkireddipalem in Visakhapatnam district registered 37.92°C. At the Visakhapatnam airport observatory, the maximum temperature was 36°C with humidity at 68%, while Waltair recorded 36.5°C with humidity touching 79%, resulting in oppressive conditions.
Officials at the Cyclone Warning Centre said that thunderstorm activity during the previous night resulted in heavy rainfall in some areas including Anantapur, with nearly 7 cm of rain recorded at isolated locations. Ongole, Nellore, Bapatla and adjoining areas also experienced rainfall during the afternoon, leading to a noticeable fall in temperatures. Visakhapatnam too witnessed thunderstorm activity accompanied by lightning and gusty winds late in the evening.
Meteorologists explained that intense surface heating often triggers convective thunderstorm activity during the pre-monsoon season. While rainfall brings down daytime temperatures, humidity levels rise sharply and may occasionally approach saturation levels after showers.
The India Meteorological Department (IMD) has forecast continued heatwave conditions over Coastal Andhra Pradesh and Yanam till May 26, with severe heatwave conditions likely in isolated pockets till May 24. The IMD has also forecast thunderstorms accompanied by lightning and gusty winds over Coastal Andhra Pradesh and Rayalaseema between May 22 and 26. Thundersquall activity with wind speeds reaching 50-60 kmph gusting to 70 kmph likely in isolated places over Coastal Andhra Pradesh and Rayalaseema on May 22 and 23.
Despite intermittent rainfall activity, meteorologists said there is no indication yet of a sustained fall in temperatures across the State.
Published - May 22, 2026 09:16 pm IST
This is a premium article, available exclusively to subscribers.
*This offer is only for first-time subscribers.",1.0
Andhra Pradesh Braces for Severe Heatwave Till May 27 - Deccan Chronicle,https://news.google.com/rss/articles/CBMiwgFBVV95cUxQdWo2UkpoazI1c2swelQ2TDBOX2JuYjUxRWNpcjZ0UlU5R1FfQnFlV09wMmxLT18zWHFqZEpmT3M4bVAyRXhUbUdHOHJ2SUFwbmMwVXltbW1Gc0V5R25jeWNyVVFoLTI3OTZycDRWS2F2aFN5ZW16TVBDREgxOFZSaHZkX01pcGk5eDRuUzB3XzhENnBQbjNxa3RGcGxRQVdLS1N2ejhTNGVBZVV0b3hvVDVKVG55R3BFTHZsellVYzI1d9IBxwFBVV95cUxOcW94clptdWh0cnk1VDZSeUtiNFc5TV9lZEdVdDR0YVM2eFc5alNzcVUyakdTal9OR0pIS19lQjlkcFpDeEJUMlp0NEMyNGNjUnhSQmdZVGdIY1JCbjJHN1dfRURLN1JTMlBOVjV1dnIwb0FXQzU0TnhpNktZVnA0ZTl2amZ5b29PdmFCSHVndUozYzRnVWl6YlZHbkF0RzJEWC1sSnIxR2lLYWJmUHd5WWFQMDAzVWRhQjRLb2pBNmNKRTA4cGI4?oc=5,Deccan Chronicle,2026-05-22T18:35:55+05:30,en,Andhra Pradesh,Anantapur,"""heatwave"" Andhra Pradesh","The SDMA urged people to avoid unnecessary exposure to the sun, stay hydrated and take precautions against both the extreme heat and sudden thunderstorms
Visakhapatnam: Andhra Pradesh continues to reel under an intense heatwave, with temperatures soaring across several districts and severe weather conditions expected to persist until May 27, according to the State Disaster Management Authority (SDMA).
Tanuku in West Godavari district recorded the highest temperature in the state on Friday at 44.8°C, while Devarapalli in Anakapalli district and Thorragudipadu in NTR district registered 44.7°C each. SDMA managing director Prakhar Jain said 67 mandals across 15 districts recorded temperatures above 42°C.
The SDMA warned that severe heatwave conditions are likely to intensify further on Saturday, with 13 mandals expected to face extreme heat and around 221 mandals likely to be affected overall. Temperatures between 46°C and 48°C are forecast in parts of Polavaram, Kakinada, Konaseema, East and West Godavari, Eluru, Krishna, NTR, Guntur, Bapatla, Palnadu, Markapuram, Prakasam and Nellore districts.
Districts including Alluri Sitarama Raju and Anakapalli are likely to record temperatures between 43°C and 45°C, while Srikakulam, Vizianagaram, Parvathipuram Manyam, Visakhapatnam, Kurnool, Nandyal, Anantapur, Sri Sathya Sai, YSR Kadapa, Annamayya, Chittoor and Tirupati districts may experience temperatures ranging between 41°C and 43°C.
Meanwhile, a surface trough is expected to bring light to moderate rainfall accompanied by lightning in Kurnool, Nandyal, Anantapur, Sri Sathya Sai, Kadapa, Annamayya and Chittoor districts. Authorities advised farmers and cattle rearers not to take shelter under trees during thunderstorms and urged them to move to safer buildings immediately during lightning activity.
On Sunday, temperatures between 45°C and 46°C are likely in Polavaram, Kakinada, Konaseema, East and West Godavari, Eluru, Krishna, NTR, Guntur, Bapatla, Palnadu, Markapuram and Prakasam districts. Alluri Sitarama Raju, Anakapalli and Nellore districts may record 43°C to 45°C, while other districts are expected to witness temperatures between 40°C and 42°C.
The SDMA urged people to avoid unnecessary exposure to the sun, stay hydrated and take precautions against both the extreme heat and sudden thunderstorms.",0.8500000000000001
DGP Sanctions `48 Lakh Relief for Traffic Police Amid Heatwave - Deccan Chronicle,https://news.google.com/rss/articles/CBMizAFBVV95cUxQX0pjaDNaY3VQSTVsMlU3YkN1VTFuQlJZUzNFS19GZFAxQkJTclVwbHNCdjVjQ1BhdmhqdnBiNWlDX1hlRjdoTUQ1RnJLWjhiTDBXS1MybnI2R1I2NHpTcXVNOFY5WlQ4Y1FpZ0dueFNfVWdGOWcxUlpuY3ZFVmEyNG9OMU9KSWVqSmt2TGdtV0NuY0FoRGdqaDBsSWtiSU5SVUQ1NFZvMlFhSDl4NW9EQ1hMRjJPNGY5LVhKSGxsSV9yWkttVVhmemloR1HSAdIBQVVfeXFMT2dTbzAtSm0wbEFUTVQwZFdPS1hlTkV3U1FkcU5IczluMGhrM2dud05kYW1BbGwzNmE4eGJiTGtoRzhQeEs0aDdpMlRCNHV1VjVqa0NWbTR6TFlmUE1JT2tQdFJtaHhqS2hUbmFCSUZIZUJKMkxuSVp6Q3Q1X2ZCWVFUcnlJUUZ2eEtkZGsyb0xDQ19ySnMyVTJVdUprTnR4S1JRbTlhak83MFNDS1F6Ul9DTUxRamJJVWJzT1U5MjB4TlpSQXdHZnpTVkhmaWg3N0h3?oc=5,Deccan Chronicle,2026-05-22T22:12:02+05:30,en,Andhra Pradesh,Anantapur,"""heatwave"" Andhra Pradesh","The DGP directed all police commissionerates and district superintendents of police to expedite procurement and ensure immediate distribution of the materials
VIJAYAWADA: Amid soaring temperatures across Andhra Pradesh, Director General of Police Harish Kumar Gupta has sanctioned nearly `48 lakh towards welfare measures to protect traffic police personnel working under severe heatwave conditions.
With temperatures in several urban areas ranging between 42°C and 46°C, traffic police personnel have been facing dehydration, fatigue and other heat-related health problems while performing prolonged road duties.
Taking serious note of the situation, the DGP ordered the immediate release of funds from the police department budget for procurement of essential protective equipment for traffic personnel across the state. He stressed that the health and welfare of police personnel on duty were of utmost importance and said there would be no compromise on their safety.
Under the initiative, traffic personnel will be provided UV-protection goggles, white caps, ORS packets, water bottles and face masks to help them cope with the extreme summer heat and vehicular pollution.
A total of 3,192 personnel, including traffic constables, head constables and sub-inspectors deployed at traffic junctions, highways, bus stands and railway station areas, are expected to benefit from the scheme.
The DGP directed all police commissionerates and district superintendents of police to expedite procurement and ensure immediate distribution of the materials.
Traffic personnel welcomed the move, stating that the department had recognised the hardships faced by frontline staff during the peak summer season.
Two Circle Inspectors Suspended Over Misconduct Charges
Two circle inspectors who earlier served in Tirupati have been suspended after an internal departmental inquiry found them involved in serious misconduct and dereliction of duty.
The suspended officers are former Tirupati East Circle Inspector Srinivasulu and former SVU Police Station Circle Inspector Ramaiah. Prior to the suspension, both officers had been transferred to the Vacancy Reserve in Anantapur following complaints regarding their conduct.
The action followed a departmental inquiry ordered by Tirupati superintendent of police L. Subba Rayudu into allegations relating to mishandling of criminal cases and misuse of authority.
According to the inquiry findings, Srinivasulu was accused of negligence in handling a POCSO case by failing to conduct a proper investigation against the accused. The probe also found allegations that he had interfered in civil disputes and attempted unofficial settlements.
In a separate case, Ramaiah was found to have committed financial irregularities while investigating a cybercrime complaint. The inquiry revealed that ₹6 lakh recovered during the investigation was not returned to the victim and was allegedly used for personal purposes.
Following the inquiry findings, the department placed both officers under suspension.",1.0
