title,url,source,date,language,state,district,search_term,full_text,relevance_score
ఏపీలో ఒకవైపు మండుతున్న ఎండలు.. మరోవైపు పిడుగులతో కూడిన వర్షాలు! - Andhrajyothy,https://news.google.com/rss/articles/CBMi0AFBVV95cUxPNlNoR1Jnajc2OXVjRXl3ZEJQY2lzaEUwNHZHQUpWUzB6ODhBa0ZCeWoyVWxTYUNHZHV2eDFuSVlFeDY1dHVSY0xYa0gxR0hqTFJhRWpmWXZvdkxVdFdPeDhTTEJZZDdwVy00ejhCLXEzNHplYjF4Z19CalpRU0c3NDNGRFV5elI3SVBwd2Y0ekM3eVJsQ01zZE9YVnNxOWJJYTVDYjFwZDRNU2U5NHRob2JvLWtBaThxY1VNMVVIbDJjc3pQdXFRWmk5VzEtLWN1?oc=5,Andhrajyothy,2026-04-05T21:51:59+05:30,te,Andhra Pradesh,,"(""వడ గాలులు"" OR ""ఎండ వేడి"" OR ""భారీ ఎండలు"" OR ""హీట్ వేవ్"" OR ""ఉష్ణ తరంగం"" OR ""కడ ఎండలు"" OR మండుటెండ OR ""ఎండల తీవ్రత"" OR ""అసాధారణ ఎండలు"" OR ""తీవ్ర ఎండలు"") Andhra Pradesh","ఏపీలో ఒకవైపు మండుతున్న ఎండలు.. మరోవైపు పిడుగులతో కూడిన వర్షాలు!
ఆంధ్రప్రదేశ్ లో రానున్న రెండు రోజుల పాటు వాతావరణంలో అనూహ్య మార్పులు చోటు చేసుకోనున్నాయి. అటు తీవ్రమైన ఎండలు, ఇటు అకాల వర్షాలతో ప్రజలకు ఇబ్బంది కలిగే అవకాశం ఉందని రాష్ట్ర విపత్తు నిర్వహణ సంస్థ వెల్లడించింది.
అమరావతి: ఆంధ్రప్రదేశ్ లో రానున్న రెండు రోజుల పాటు వాతావరణంలో అనూహ్య మార్పులు చోటు చేసుకోనున్నాయి. అటు తీవ్రమైన ఎండలు, ఇటు అకాల వర్షాలతో ప్రజలకు ఇబ్బంది కలిగే అవకాశం ఉందని రాష్ట్ర విపత్తు నిర్వహణ సంస్థ వెల్లడించింది. దక్షిణ కోస్తా–బంగాళాఖాతంలో ఉపరితల ఆవర్తనం ప్రభావం తో వాతావరణంలో మార్పులు సంభవిస్తాయని అధికారులు తెలిపారు. దక్షిణ కోస్తా - బంగాళాఖాతం ఏర్పడిన ఉపరితల ఆవర్తనం కారణంగా మేఘావృతమైన పరిస్థితులు నెలకొన్నాయి. రాయలసీమ ప్రాంతంపై మరో ఆవర్తనం కొనసాగుతుండటంతో వర్షాలకు అనుకూల పరిస్థితులు ఏర్పడ్డాయని రాష్ట్ర విపత్తు నిర్వహణ సంస్థ తెలిపింది.
రాష్ట్రంలోని పలు ప్రాంతాల్లో రానున్న 48 గంటల్లో పిడుగులతో కూడిన వర్షాలు కురిసే అవకాశం ఉందని అధికారులు తెలిపారు. ఉత్తర కోస్తా జిల్లాల్లో తేలికపాటి నుంచి మోస్తరు వర్షాలు కురిసే అవకాశం ఉంది. దక్షిణ కోస్తా, రాయలసీమలో అక్కడక్కడ ఉరుములు, మెరుపులతో కూడిన వర్షాలు పడవచ్చని అధికారుల తెలిపారు. పిడుగులు పడే సమయంలో రైతులు, పశు కాపరులు పొలాల్లో ఉండకూడదని, ముఖ్యంగా చెట్ల కింద ఆశ్రయం పొందవద్దని అధికారులు తీవ్రంగా హెచ్చరిస్తున్నారు.
కొనసాగుతున్న ఎండల తీవ్రత..
ఒకవైపు వర్ష సూచన ఉన్నప్పటికీ, రాష్ట్రంలో భానుడి భగభగలు తగ్గడం లేదు. రాష్ట్రవ్యాప్తంగా పలుచోట్ల ఉష్ణోగ్రతలు 40°C దాటాయి. నెల్లూరు, రేణిగుంట ప్రాంతాల్లో గరిష్టంగా 42°C ఉష్ణోగ్రతలు నమోదయ్యాయి. పోలవరం, ఎన్టీఆర్ జిల్లాల్లో వడగాలులు వీచే అవకాశం ఉందని విపత్తు నిర్వహణ సంస్థ హెచ్చరించింది. రాష్ట్రంలోని సుమారు 66 మండలాల్లో ఎండల తీవ్రత అధికంగా ఉంటుందని తెలిపింది.
ఇవి కూడా చదవండి..",0.31666666666666665
ఏపీ ప్రజలకు అలర్ట్: ఎండల వేడి మధ్య వర్షాల చినుకులు - suryaa.com,https://news.google.com/rss/articles/CBMiY0FVX3lxTE9zR2NpUGNNYUlnZEc5UUlCNm1GWnk4NDAwVEZ6dzBrVTZCTF9CaE5ZVUVkbnpvSnBqUkhPN0U5aGg3d1dsQUxwUkRkOEI3WWVvWHdWTEdZcE83T0haQW5hOVRYZw?oc=5,suryaa.com,2026-04-05T20:59:00+05:30,te,Andhra Pradesh,,"(""వడ గాలులు"" OR ""ఎండ వేడి"" OR ""భారీ ఎండలు"" OR ""హీట్ వేవ్"" OR ""ఉష్ణ తరంగం"" OR ""కడ ఎండలు"" OR మండుటెండ OR ""ఎండల తీవ్రత"" OR ""అసాధారణ ఎండలు"" OR ""తీవ్ర ఎండలు"") Andhra Pradesh","వేసవి తాపంతో ఇబ్బందులు పడుతున్న ఆంధ్రప్రదేశ్ ప్రజలకు రాష్ట్ర విపత్తుల నిర్వహణ శాఖ ఒక మంచి వార్త చెప్పింది. రేపటి నుంచి రెండు రోజుల పాటు రాష్ట్రంలో మిశ్రమ వాతావరణం ఉండే అవకాశం ఉందని వెల్లడించింది.కొన్ని ప్రాంతాల్లో వర్షాలు కురిసే అవకాశం ఉండగా, మరికొన్ని చోట్ల వడగాలులు కూడా వీచే అవకాశముందని తెలిపింది. ఈ నేపథ్యంలో ఎక్కడ ఎలాంటి పరిస్థితులు ఉంటాయన్న వివరాలను కూడా వెల్లడించింది.విపత్తుల నిర్వహణ సంస్థ ఎండీ ప్రకార్ జైన్ తెలిపిన వివరాల ప్రకారం, రాబోయే రెండు రోజులు రాష్ట్రంలో భిన్న వాతావరణ పరిస్థితులు కనిపిస్తాయి. మేఘావృత వాతావరణంతో పాటు పిడుగులు, ఉరుములతో కూడిన వర్షాలు కొన్ని ప్రాంతాల్లో కురిసే అవకాశముంది. మరోవైపు కొన్ని జిల్లాల్లో ఎండలు తీవ్రంగా ఉండొచ్చని అన్నారు.దక్షిణ కోస్తాంధ్ర, పశ్చిమ మధ్య బంగాళాఖాతంపై ఉపరితల ఆవర్తనం కొనసాగుతుండగా, రాయలసీమ మరియు పరిసర ప్రాంతాల్లో మరో ఉపరితల ఆవర్తనం ఏర్పడిందని తెలిపారు. వీటి ప్రభావంతో రేపు, ఎల్లుండి వర్షాలు కురిసే అవకాశాలు ఉన్నాయని చెప్పారు.పిడుగులతో కూడిన వర్షాలు పడే సమయంలో రైతులు, పశు కాపరులు జాగ్రత్తగా ఉండాలని హెచ్చరించారు. ముఖ్యంగా చెట్ల కింద నిలబడకూడదని సూచించారు.శ్రీకాకుళం, విజయనగరం, మన్యం, అల్లూరి, పోలవరం, అనకాపల్లి, కాకినాడ, కోనసీమ, తూర్పు గోదావరి, పశ్చిమ గోదావరి జిల్లాల్లో కొన్నిచోట్ల తేలికపాటి నుంచి మోస్తరు వర్షాలు కురిసే అవకాశం ఉంది.అలాగే ఏలూరు, కృష్ణా, ఎన్టీఆర్, గుంటూరు, బాపట్ల, పల్నాడు, మార్కాపురం, ప్రకాశం, నెల్లూరు, అన్నమయ్య, చిత్తూరు, తిరుపతి జిల్లాల్లో అక్కడక్కడ తేలికపాటి వర్షాలు పడే అవకాశం ఉందని తెలిపారు.ఇక పోలవరం జిల్లా చింతూరు, ఎన్టీఆర్ జిల్లా జి.కొండూరు, ఇబ్రహీంపట్నం మండలాల్లో వడగాలులు ప్రభావం చూపే అవకాశం ఉందని వెల్లడించారు.
SURYAA NEWS, synonym with professional journalism, started basically to serve the Telugu language readers. And apart from that we have our own e-portal domains viz,. Suryaa.com and Epaper Suryaa",0.0
AP Weather Update : ఆంధ్రప్రదేశ్‌లోని ఈ జిల్లాలకు వడగాలుల హెచ్చరిక జారీ | Hindustan Times - Hindustan Times,https://news.google.com/rss/articles/CBMi7wFBVV95cUxQLS1iZzV2bkpRNXhHUEtVbkMzV1RPTU1ROWQ4TnNhNzg1SFV1bU9zeXFQSVpSU2VyVDFfcjZXMjZPRDhFZ0RGUmQ3UUNhQWtuNDc2Sjl0dVotMUpiTDkwY0xhb2VGZzJfcVVReS1YUkpaWUpNd1lnRGlCZF9rN1pFMllpNWxOeThMZkkzVkFleEtWLW5CVEtUSjIySDY4MWc1ZTBQN1JHdWhZRFRRSHhpQUZnOWp6TzhWSWdPbFJwVWVaRnBRTWVkd2dGR0ZzZV9kMS1sZEpra3RGLWZVWno0OFJyYkNiUy1rbzRqWWdud9IB9AFBVV95cUxNRkpfY2RpYVowVHJvclhoUXVrVV90RmZEU1ZDZm1pY2FzUmhjV3BWU2VZd2J2XzZQYnVrb3pkVUNkMG5VMWpWTm5qTkJONWhLZkRwUldna3NkNDI5RkdMMVluMzdyZExXYktGSHNhSERTRWZycHBOZEVjYW5Ia2w4Yl9va3otWFBwNEp4aFBUQ1pSb3psRmxaLU1zUkRTY1lmUWRMVUlvZGRDZUsyREVUZHpSMHRMaE1CTXhveGphZzItSFlnYmpmN001b2pwZ1BFbHlkWDNqSnlpODdldS05ZUZkbkNBWmJJNHRBNWNsX1dKWVB3?oc=5,Hindustan Times,2026-04-05T21:26:37+05:30,te,Andhra Pradesh,,"(""ఎండ దెబ్బ"" OR ""హీట్ స్ట్రోక్"" OR ""సన్ స్ట్రోక్"" OR ""ఎండ వల్ల మరణం"" OR ఉష్ణోగ్రత OR ""వేడి తట్టుకోలేక"" OR నిర్జలీకరణం OR ""ఆసుపత్రిలో చేరిక"") Andhra Pradesh","AP Weather Update : ఆంధ్రప్రదేశ్లోని ఈ జిల్లాలకు వడగాలుల హెచ్చరిక జారీ
AP Weather Update : ఆంధ్రప్రదేశ్లోని పలు జిల్లాల్లో అధిక ఉష్ణోగ్రతలు నమోదవుతున్నాయి. మరోవైపు వడగాలుల హెచ్చరికలు జారీ చేసింది ఏపీఎస్డీఎంఏ.
రాష్ట్రంలో రాబోయే కొద్ది రోజుల్లో తీవ్రమైన వాతావరణ పరిస్థితులు నెలకొంటాయని హెచ్చరిస్తూ.. ఏపీ రాష్ట్ర విపత్తు నిర్వహణ అథారిటీ(ఏపీఎస్డీఎంఏ) పలు జిల్లాలకు వడగాలుల హెచ్చరిక జారీ చేసింది. అధికారిక ప్రకటనలో ఏపీఎస్డీఎంఏ మేనేజింగ్ డైరెక్టర్ ప్రఖర్ జైన్ మాట్లాడుతూ.. 17 మండలాల్లో తీవ్రమైన వడగాలుల పరిస్థితులు నెలకొనే అవకాశం ఉందని తెలిపింది.
శ్రీకాకుళం, విజయనగరం, మన్యం, ఏఎస్ఆర్(పోలవరం ప్రాంతం), తూర్పుగోదావరి జిల్లాల్లోని పలు మండలాల్లో తీవ్ర వేడిగాలులు వీస్తాయని అధికారులు ప్రజలను అప్రమత్తం చేశారు. దీనికి అదనంగా శ్రీకాకుళం, విజయనగరం, మన్యం, పోలవరం, కాకినాడ, తూర్పు గోదావరి, ఏలూరు, ఎన్టీఆర్ జిల్లాల్లోని పలు మండలాల్లో మోస్తరు వడగాలుల పరిస్థితులు ఏర్పడే అవకాశం ఉంది. దక్షిణ కోస్తాంధ్ర, దాని ఆనుకోని ప్రాంతాలపై ఉపరితల తుఫాను వలయం ఉన్నట్లు కూడా విపత్తు నిర్వహణ అథారిటీ పేర్కొంది.
దీని ప్రభావంతో సోమవారం నుంచి మూడు రోజుల పాటు ఉత్తర కోస్తా ఆంధ్రప్రదేశ్లోని కొన్ని ప్రాంతాల్లో మెరుపులతో కూడిన తేలికపాటి నుంచి మోస్తరు వర్షాలు కురిసే అవకాశం ఉంది. తూర్పు, పశ్చిమ గోదావరి, ఏలూరు జిల్లాల్లో కూడా ఉరుములతో కూడిన తేలికపాటి వర్షం కురిసే అవకాశం ఉంది. మెరుపులు వచ్చినప్పుడు చెట్ల కింద ఉండకూడదని ప్రజలకు అధికారులు సూచించారు.
ఇదిలా ఉండగా శనివారం రాష్ట్రవ్యాప్తంగా అధిక ఉష్ణోగ్రతలు నమోదయ్యాయి. వీటిలో నెల్లూరు జిల్లాలోని గూడూరులో 41.2డిగ్రీలు, తిరుపతి జిల్లాలోని రేణిగుంటలో 41.1 డిగ్రీల ఉష్ణోగ్రతలు నమోదయ్యాయి. ప్రజలు అప్రమత్తంగా ఉండాలని, తగినంత నీరు తాగాలని, ఎక్కువసేపు ఎండలో ఉండకుండా ఉండాలని అధికారులు కోరారు. మహిళలు, పిల్లలు, వృద్ధులు వంటి బలహీన వర్గాల వారు అదనపు జాగ్రత్తలు తీసుకోవాలని సూచించారు.
ఆనంద్ సాయి మాదాసు ప్రస్తుతం హిందుస్తాన్ టైమ్స్ తెలుగులో డిప్యూటీ చీఫ్ కంటెంట్ ప్రొడ్యూసర్గా బాధ్యతలు నిర్వర్తిస్తున్నారు. డిజిటల్ మీడియాలో 9 ఏళ్లకుపైగా అనుభవం ఉంది. హెచ్టీ తెలుగులో చేరడం కంటే ముందు ఏబీపీ దేశంలో డిజిటల్ కంటెంట్ ప్రొడ్యూసర్గా పని చేశారు. మెుదట నవతెలంగాణ అనే దినపత్రికలో సబ్ఎడిటర్గా జర్నలిజం కెరీర్ మెుదలుపెట్టారు. ఆ తర్వాత కరీంనగర్లో ఈనాడు దినపత్రికలో కొంతకాలం సబ్ఎడిటర్గా బాధ్యతలు చూసుకున్నారు. కాకతీయ యూనివర్సిటీలో 2015-2017 పీజీ మాస్ కమ్యూనికేషన్ అండ్ జర్నలిజం చేశారు. ఈ సమయంలో మేడారం సమ్మక్క-సారలమ్మ జాతర కోసం ప్రత్యేకంగా క్యాంపస్ నుంచి పంపించిన టీమ్లో ఉన్నారు. పీజీ చదివే సమయంలోనే క్యాంపస్ రిక్రూట్మెంట్లో భాగంగా ఈటీవీ భారత్కు సెలక్ట్ అయ్యారు. అక్కడ ఆంధ్రప్రదేశ్ డెస్క్లో పని చేశారు. అంతేకాదు కొన్ని ప్రత్యేక స్టోరీలు కూడా ఈటీవీ భారత్ వెబ్సైట్ కోసం రాసేవారు. 2019 ఎన్నికల్లో ఎలక్షన్ డెస్క్ టీమ్లో ఉన్న నలుగురిలో ఆనంద్ సాయి ఒకరు. ఆ తర్వాత అక్కడ నుంచి ఏబీపీ దేశంలోకి వెళ్లి కొంతకాలం పని చేశారు. ఈ సమయంలో కూడా డిజిటల్ మీడియాకు తగినట్టుగా అనేక ప్రత్యేక కథనాలు రాశారు. హిందూస్తాన్ టైమ్స్ తెలుగులో 2022లో చేరారు. ఇక్కడ గతంలో నేషనల్, బిజినెస్, లైఫ్స్టైల్, ఎంటర్టైన్మెంట్, స్పోర్ట్స్ సెక్షన్లకు పనిచేశారు. ప్రస్తుతం ఆంధ్రప్రదేశ్, తెలంగాణ సెక్షన్లకు వార్తలు రాస్తున్నారు. అన్ని సెక్షన్లకు డిజిటల్ కంటెంట్ రైటర్గా పని చేసిన అనుభవం ఆయనకు ఉంది. అంతేకాదు ఈటీవీ భారత్, ఏబీపీ దేశం, హిందుస్తాన్ టైమ్స్ వెబ్సైట్స్ లాంచ్ టీమ్లో ఈయన ఉన్నారు. ప్రస్తుతం ఆంధ్రప్రదేశ్, తెలంగాణ రాజకీయ పరిణామాలు, విశ్లేషణలు, విద్య, ఉద్యోగ సమాచారంతో పాటు ఆసక్తికరమైన కథనాలను అందిస్తారు. ప్రభుత్వ పథకాలు, ఉద్యోగ నోటిఫికేషన్లు, ఇతర సమాచారం ప్రజలకు సులభంగా అర్థమయ్యే రీతిలో, వీలైనంత త్వరగా కథనాలను ఇవ్వటంలో ప్రత్యేక శైలి కలిగి ఉన్నారు. అనేకసార్లు హిందుస్తాన్ టైమ్స్ సంస్థ నుంచి ఇన్స్టా అవార్డులు అందుకున్నారు. డిజిటల్ మీడియాలో ఎక్కువకాలం పని చేసిన అనుభవం ఉంది. యూజర్లకు ఉపయోగపడే వార్తలను అందించడంలో ముందుంటారు.Read More",0.8333333333333333
