title,url,source,date,language,state,district,search_term,full_text,relevance_score
"School Holiday 2026: Delhi, UP, Haryana, Noida and Gurgaon School Closed Due to Heat Wave; Check State Wise List Here - Jagran Josh",https://news.google.com/rss/articles/CBMi5gFBVV95cUxQMTVqNldxM25zMFNWMHY5NU85UG82OUJQb1QzdG9zRnRKbFE1bGotSmZhUzRuemFxNlVIS3QwUmxNd0V6Yk9zX18yN1dJbHVpTV8xd3d6aEQ5YzhRZXZvZU5uVTA1Mlc0dE9xSl9WV2d6cV9HNVpRQ1V3MDZDNU1USUc0dHAzcWthUGlXNHdSSE5vOWVickJ4RzZ1b212ajVHcUlZck1WY1RQM0k1VmczbENLcnFnenF4bVdwZGtfOFlIYTdlMkNJY1hFVE56YXpUVGstbUM2cE5ILTdDdUpwUkdVR2ZpUQ?oc=5,Jagran Josh,2026-05-16T11:19:05+05:30,en,Haryana,Gurgaon,"(heatwave OR ""heat wave"" OR ""severe heatwave"" OR ""extreme heat"" OR ""heat spell"" OR ""scorching heat"" OR ""blistering heat"" OR ""sweltering heat"" OR ""hot winds"" OR loo OR ""hot loo winds"" OR ""intense heat"" OR ""unbearable heat"" OR ""deadly heat"" OR heat OR ""weather forecast"" OR ""weather update"" OR ""weather alert"" OR ""IMD forecast"" OR ""IMD prediction"" OR ""IMD alert"" OR IMD OR ""rising temperatures"" OR ""temperatures expected to rise"" OR ""relief from heat"" OR ""respite from heat"" OR ""heat respite"" OR ""respite from scorching heat"") Haryana","School Holiday 2026: Delhi, UP, Haryana, Noida and Gurgaon School Closed Due to Heat Wave; Check State Wise List Here
Due to a severe heatwave and warnings from the India Meteorological Department (IMD) that conditions will get worse from mid-May to June, school authorities in several states have announced long summer breaks for students. Temperatures in affected areas, including Delhi, Uttar Pradesh, Rajasthan, Haryana, and Telangana, have already exceeded 45°C.
As it gets really hot in Indian states the governments and school authorities have decided to give students a long summer break. This decision has been made for schools following CBSE, ICSE and private and government schools.The heatwave is expected to get worse. Thats why they are taking this step. The India Meteorological Department or IMD has warned that severe heatwave conditions are coming back to North and Central India.
The IMD says that in areas temperatures have already gone above 45 degrees Celsius. They also think that the heatwave conditions will get worse from mid-May, to June. Delhi, Uttar Pradesh, Rajasthan, Haryana and Telangana are some of the states that are affected the most.The authorities are telling people to stay indoors during the part of the day.
They are especially asking children and senior citizens to avoid going out during peak afternoon hours. The government and school authorities are taking these steps to keep everyone from the heat. The summer break will help students stay safe and avoid the heatwave.
States Expected to face heatwave conditions?
State-Wise Summer Vacation Schedule 2026
Below is the complete schedule of summer vacations for schools across key states/regions, including the specific dates and total duration of the holidays announced in light of the extreme heat conditions.
Note that summer vacation dates may change depending on weather conditions and district-level decisions, so students should stay in contact with their schools for final updates.
Can school holiday dates change?
Summer vacation dates can change depending on weather conditions and district-level decisions. Students are advised to stay in contact with their schools for final updates.
Anisha Mishra is a mass communication professional and content strategist with a total 2.5 years of experience. She's passionate about creating clear, results-driven content—from articles to social media posts—that genuinely connects with audiences. With a proven track record of shaping compelling narratives and boosting engagement for brands like Shiksha.com, she excels in the education sector, handling CBSE, State Boards, NEET, and JEE exams, especially during crucial result seasons. Blending expertise in traditional and new digital media, Anisha constantly explores current content trends. Connect with her on LinkedIn for fresh insights into education content strategy and audience behavior, and let's make a lasting impact together",1.0
