title,url,source,date,language,state,district,search_term,full_text,relevance_score
"Haryana:कांग्रेस ने आठ जुलाई को बुलाई जनरल बॉडी बैठक, नए प्रभारी संजय दत्त कार्यकर्ताओं को करेंगे संबोधित",https://www.amarujala.com/haryana/chandigarh-haryana/haryana-congress-convened-general-body-meeting-on-july-8-new-in-charge-sanjay-dutt-2026-07-02,अमर उजाला,2026-07-02T15:12:29+05:30,hi,Haryana,,"(लू OR ""लू चलना"" OR ""भीषण गर्मी"" OR ""प्रचंड गर्मी"" OR ""कड़ी धूप"" OR ""तेज धूप"" OR ""गर्म हवा"" OR ""उष्ण लहर"" OR ""ताप लहर"" OR ""हीट वेव"" OR ""झुलसाने वाली गर्मी"" OR ""तपती गर्मी"" OR ""भयंकर गर्मी"") Haryana","{""_id"":""6a4632361e473f5e9e03447b"",""slug"":""haryana-congress-convened-general-body-meeting-on-july-8-new-in-charge-sanjay-dutt-2026-07-02"",""type"":""story"",""status"":""publish"",""title_hn"":""Haryana: कांग्रेस ने आठ जुलाई को बुलाई जनरल बॉडी बैठक, नए प्रभारी संजय दत्त कार्यकर्ताओं को करेंगे संबोधित"",""category"":{""title"":""City & states"",""title_hn"":""शहर और राज्य"",""slug"":""city-and-states""}}
Haryana: कांग्रेस ने आठ जुलाई को बुलाई जनरल बॉडी बैठक, नए प्रभारी संजय दत्त कार्यकर्ताओं को करेंगे संबोधित
सार
बैठक में हरियाणा के पूर्व मुख्यमंत्री एवं नेता प्रतिपक्ष भूपेंद्र सिंह हुड्डा, कांग्रेस महासचिव एवं सांसद कुमारी सैलजा, कांग्रेस महासचिव एवं सांसद रणदीप सिंह सुरजेवाला, कांग्रेस कार्य समिति के विशेष आमंत्रित सदस्य माैजूद रहेंगे।
विज्ञापन
खबरें लगातार पढ़ने के लिए अमर उजाला एप डाउनलोड करें
या
वेबसाइट पर पढ़ना जारी रखने के लिए वीडियो विज्ञापन देखें
अगर आपके पास प्रीमियम मेंबरशिप है तो
विस्तार
हरियाणा प्रदेश कांग्रेस कमेटी ने 8 जुलाई को अपनी जनरल बॉडी की महत्वपूर्ण बैठक बुलाई है। बैठक दोपहर 1 बजे प्रदेश कांग्रेस मुख्यालय, सेक्टर-9बी, चंडीगढ़ में आयोजित होगी। प्रदेश कांग्रेस अध्यक्ष राव नरेंद्र सिंह की ओर से जारी पत्र के अनुसार, बैठक में हरियाणा कांग्रेस के नवनियुक्त प्रभारी संजय दत्त मुख्य अतिथि के रूप में शामिल होंगे और पार्टी नेताओं व कार्यकर्ताओं को संबोधित करेंगे।
बैठक में हरियाणा के पूर्व मुख्यमंत्री एवं नेता प्रतिपक्ष भूपेंद्र सिंह हुड्डा, कांग्रेस महासचिव एवं सांसद कुमारी सैलजा, कांग्रेस महासचिव एवं सांसद रणदीप सिंह सुरजेवाला, कांग्रेस कार्य समिति के विशेष आमंत्रित सदस्य एवं सांसद दीपेंद्र सिंह हुड्डा तथा एआईसीसी सचिव एवं हरियाणा मामलों के सह-प्रभारी जितेंद्र बघेल भी विशेष रूप से मौजूद रहेंगे।
प्रदेश नेतृत्व ने पार्टी के सांसदों, विधायकों, पूर्व सांसदों-विधायकों, जिला व ब्लॉक कांग्रेस अध्यक्षों, एआईसीसी पदाधिकारियों, विभिन्न प्रकोष्ठों के प्रमुखों तथा हाल के लोकसभा, विधानसभा और निगम चुनावों के पार्टी प्रत्याशियों सहित सभी संबंधित पदाधिकारियों और कार्यकर्ताओं से समय पर पहुंचकर अपनी सहभागिता सुनिश्चित करने की अपील की है। बैठक को आगामी राजनीतिक रणनीति और संगठनात्मक गतिविधियों के लिहाज से महत्वपूर्ण माना जा रहा है।
विज्ञापन
विज्ञापन
बैठक में हरियाणा के पूर्व मुख्यमंत्री एवं नेता प्रतिपक्ष भूपेंद्र सिंह हुड्डा, कांग्रेस महासचिव एवं सांसद कुमारी सैलजा, कांग्रेस महासचिव एवं सांसद रणदीप सिंह सुरजेवाला, कांग्रेस कार्य समिति के विशेष आमंत्रित सदस्य एवं सांसद दीपेंद्र सिंह हुड्डा तथा एआईसीसी सचिव एवं हरियाणा मामलों के सह-प्रभारी जितेंद्र बघेल भी विशेष रूप से मौजूद रहेंगे।
विज्ञापन
प्रदेश नेतृत्व ने पार्टी के सांसदों, विधायकों, पूर्व सांसदों-विधायकों, जिला व ब्लॉक कांग्रेस अध्यक्षों, एआईसीसी पदाधिकारियों, विभिन्न प्रकोष्ठों के प्रमुखों तथा हाल के लोकसभा, विधानसभा और निगम चुनावों के पार्टी प्रत्याशियों सहित सभी संबंधित पदाधिकारियों और कार्यकर्ताओं से समय पर पहुंचकर अपनी सहभागिता सुनिश्चित करने की अपील की है। बैठक को आगामी राजनीतिक रणनीति और संगठनात्मक गतिविधियों के लिहाज से महत्वपूर्ण माना जा रहा है।
विज्ञापन",0.0
Mau News: बारिश के दो दिन बाद अधिकतम और न्यूनतम तापमान में एक-एक डिग्री सेल्सियस की वृद्धि - Amar Ujala,https://news.google.com/rss/articles/CBMihwJBVV95cUxNTzFrblk3VDFOU3V6dE5aVVVXOUx1M2JqbVlzU3hYcGF0RlAwMUdERnNpdDBtNEVyRzMydXdfRXpqQmdCbmZ5b3h4NVNhcVFkMlhMNU9NTUM2azB1M2NnZnMzQjFvY3MycElYRFVpVlZITWkzV1VmV1FmMlROelg1RGxNNFBwR2lkbmRnNEtsWmQ1QlFlUnQ0NHpVZjB5LUxCTDBleUJyUnFIRTZEY0MxeF93bFl2clJpdnI4MlBmd0IyM3RKQTBEQlZRR1FGSmtiZWtpWWMtZG9ZMU1CWkVrWjVtYUN1TkYyRF9GdjFEcUhRX01VTjl3WlRScl9wem00d3QxLVJzQdIBjAJBVV95cUxNbEZlV05FOHRDbXVpRjlXUW9ORndOR2tsb21FSUFFaTZnTWQxR1RKdUJkbmRnWkNrLW5OZVZiN2JCdlpQYTQzSFVJSHktZXVqLTJyNi0wTXB2XzZWb0xVbWpyM0FseXNOX091TXpxUnZURHRPTVR1NEJZX2d4N1lpX1Z4djdVVDNMb05xdGU5Y2M0NGpsaU1GaDV6ZFItV09sdlhtb2U1TkRIN2x1cXBLTHlBaV8xdXNMWEg1dXdIUXMtcGJhMFFVNE5VdEpLQ2FjSzg2VlVnQ0dtM1hGNUhjdm1YZHRzVkNOU2tEU05qdzFkWWNlNHBOejlpQXlJOEhvOFpWaUJ1QzFnMDVK?oc=5,Amar Ujala,2026-07-02T23:43:06+05:30,hi,Haryana,,"(""पारा चढ़ा"" OR ""पारा पहुंचा"" OR तापमान OR ""तापमान बढ़ा"" OR ""रिकॉर्ड तोड़ गर्मी"" OR ""डिग्री सेल्सियस"" OR ""पारा उबला"" OR ""अधिकतम तापमान"" OR ""तापमान 40 पार"" OR ""तापमान 45 पार"" OR ""तापमान बढ़ने की संभावना"") Haryana","Mau News: बारिश के दो दिन बाद अधिकतम और न्यूनतम तापमान में एक-एक डिग्री सेल्सियस की वृद्धि
विज्ञापन
खबरें लगातार पढ़ने के लिए अमर उजाला एप डाउनलोड करें
या
वेबसाइट पर पढ़ना जारी रखने के लिए वीडियो विज्ञापन देखें
अगर आपके पास प्रीमियम मेंबरशिप है तो
गत सोमवार को जिले के विभिन्न इलाकों में हुई बारिश के दो दिन बाद तापमान बढ़ने लगा है। बृहस्पतिवार को अधिकतम और न्यूनतम तापमान में एक-एक डिग्री सेल्सियस की वृद्धि दर्ज की गई।
दोपहर के समय तेज धूप होने से लोगों को आना-जाना मुश्किल हो रहा था। मौसम बार-बार बदलने के चलते लोग विभिन्न बीमारियों से ग्रसित हो रहे हैं।
बृहस्पतिवार को सुबह से ही आसमान में हल्के बादल छाए रहे। सुबह लगभग सात बजे ही धूप असहनीय हो रही थी। जैसे-जैसे दिन चढ़ता गया, वैसे-वैसे धूप तेज होती गई और दिनभर धूप-छांव का क्रम बना रहा।
दोपहर के समय नगर सहित जिले के प्रमुख मार्गों पर लोगों की आवाजाही कम रही। गर्मी और उमस के चलते लोगों को एक-एक पल बिताना मुश्किल हो रहा था। बाहर निकलने वाले लोग सिर पर टोपी और गमछा लगाकर जाते देखे गए।
विज्ञापन
तापमान की स्थिति देखें तो बृहस्पतिवार को अधिकतम तापमान 35 डिग्री सेल्सियस और न्यूनतम तापमान 29 डिग्री सेल्सियस रहा। आर्द्रता 67 प्रतिशत रही, जबकि 10 किमी प्रति घंटे की रफ्तार से हवा चल रही थी।
बुधवार को अधिकतम तापमान 34 डिग्री सेल्सियस और न्यूनतम तापमान 28 डिग्री सेल्सियस दर्ज किया गया। मौसम में बदलाव के चलते लोग बुखार, उल्टी-दस्त, डिहाइड्रेशन, वायरल संक्रमण और पेट संबंधी बीमारियों से ग्रसित हो रहे हैं।
इस संबंध में कृषि विज्ञान केंद्र पिलखी के वरिष्ठ वैज्ञानिक डॉ. विनय कुमार सिंह ने बताया कि मौसम विभाग की ओर से तीन से पांच जुलाई के बीच बारिश होने की संभावना जताई गई है।
किसानों को धान की रोपाई के 25 दिन बाद खरपतवार नाशी दवा का छिड़काव करना चाहिए। मौसम में बदलाव के चलते लोग बुखार, उल्टी-दस्त, डिहाइड्रेशन, वायरल संक्रमण और पेट संबंधी बीमारियों से ग्रसित हो रहे हैं।
कृषि विज्ञान केंद्र पिलखी के वरिष्ठ वैज्ञानिक डॉ. विनय कुमार सिंह ने बताया कि मौसम विभाग की ओर से तीन से पांच जुलाई के बीच बारिश होने की संभावना जताई गई है। किसानों को धान की रोपाई के 25 दिन बाद खरपतवार नाशी दवा का छिड़काव करना चाहिए।
विज्ञापन
दोपहर के समय तेज धूप होने से लोगों को आना-जाना मुश्किल हो रहा था। मौसम बार-बार बदलने के चलते लोग विभिन्न बीमारियों से ग्रसित हो रहे हैं।
बृहस्पतिवार को सुबह से ही आसमान में हल्के बादल छाए रहे। सुबह लगभग सात बजे ही धूप असहनीय हो रही थी। जैसे-जैसे दिन चढ़ता गया, वैसे-वैसे धूप तेज होती गई और दिनभर धूप-छांव का क्रम बना रहा।
विज्ञापन
दोपहर के समय नगर सहित जिले के प्रमुख मार्गों पर लोगों की आवाजाही कम रही। गर्मी और उमस के चलते लोगों को एक-एक पल बिताना मुश्किल हो रहा था। बाहर निकलने वाले लोग सिर पर टोपी और गमछा लगाकर जाते देखे गए।
विज्ञापन
तापमान की स्थिति देखें तो बृहस्पतिवार को अधिकतम तापमान 35 डिग्री सेल्सियस और न्यूनतम तापमान 29 डिग्री सेल्सियस रहा। आर्द्रता 67 प्रतिशत रही, जबकि 10 किमी प्रति घंटे की रफ्तार से हवा चल रही थी।
बुधवार को अधिकतम तापमान 34 डिग्री सेल्सियस और न्यूनतम तापमान 28 डिग्री सेल्सियस दर्ज किया गया। मौसम में बदलाव के चलते लोग बुखार, उल्टी-दस्त, डिहाइड्रेशन, वायरल संक्रमण और पेट संबंधी बीमारियों से ग्रसित हो रहे हैं।
इस संबंध में कृषि विज्ञान केंद्र पिलखी के वरिष्ठ वैज्ञानिक डॉ. विनय कुमार सिंह ने बताया कि मौसम विभाग की ओर से तीन से पांच जुलाई के बीच बारिश होने की संभावना जताई गई है।
किसानों को धान की रोपाई के 25 दिन बाद खरपतवार नाशी दवा का छिड़काव करना चाहिए। मौसम में बदलाव के चलते लोग बुखार, उल्टी-दस्त, डिहाइड्रेशन, वायरल संक्रमण और पेट संबंधी बीमारियों से ग्रसित हो रहे हैं।
कृषि विज्ञान केंद्र पिलखी के वरिष्ठ वैज्ञानिक डॉ. विनय कुमार सिंह ने बताया कि मौसम विभाग की ओर से तीन से पांच जुलाई के बीच बारिश होने की संभावना जताई गई है। किसानों को धान की रोपाई के 25 दिन बाद खरपतवार नाशी दवा का छिड़काव करना चाहिए।",1.0
"हरियाणा महिला आयोग का बड़ा प्लान, महिला सरपंच खुद संभालेंगी जिम्मेदारी, ""सरपंच पति"" व्यवस्था होगी खत्म, हनीट्रैप मामलों पर भी सख्त चेतावनी - ETV Bharat",https://news.google.com/rss/articles/CBMi6AFBVV95cUxNN3BOa293QVh6XzJrbWl0T29JdTByaGl0aGJ3NmJBRlhFYlVkczAyUU52bFo5OElWSWp5UUs4TWdtTXNKdjVqSDUwZENMWWE1VV9KWHgyLXYwUTdVRnVkaVVZYl9tUTZaX1ZpVnhRZzZjVzd0aGROYXFySVlCblNWZjFXejlKUG9VeGtoNng5Q1NwTFl6RWhVc0FHTnZoenhnX0ZaREFDRUpRZ19rbnpxRnNibHVPdWNlQU1JTUY0X2Rrei1FUHlURkNyMm1GUV9UelRsV2ZESkxSV1MxY1VNaWxPaWxLZHV10gHuAUFVX3lxTE1kMDlzdG50aUpyQ0ZxZHVEYjF1eVlOaGZGUnFINnZ5eGZMNzFZQjZVZkZsZXFVdlZIUlV0Sm1PT0UzQnU4NEtkWUxKYkJ1ZlZBMVVHSzdMM3FzeGNaSmlwSmZSQ1FHOVc3Z1NSQ0ZjTGxpdzJWc2MyRnBscDRZRUwyRHZ5U1pMRE92OU5UNkhKUmprQk9RTW01QmhuR1NMTG9kNm8tcVhVQkkyNTZwWXRqZ2pVWjg4SENCU2R4N19qZEN2X3RJeUJfYmpMRXZxRlRuSnhpYzdCdjQxeEhydmd3ZUxGOEI0MlZyR08wNEE?oc=5,ETV Bharat,2026-07-02T16:19:26+05:30,hi,Haryana,,"(""हीट एक्शन प्लान"" OR ""गर्मी से राहत"" OR चेतावनी OR ""रेड अलर्ट"" OR ""ऑरेंज अलर्ट"" OR ""येलो अलर्ट"" OR एडवाइजरी OR ""राहत सामग्री"" OR ""राहत शिविर"" OR मुआवजा) Haryana","हरियाणा महिला आयोग का बड़ा प्लान, महिला सरपंच खुद संभालेंगी जिम्मेदारी, ""सरपंच पति"" व्यवस्था होगी खत्म, हनीट्रैप मामलों पर भी सख्त चेतावनी
भिवानी दौरे पर पहुंची हरियाणा महिला आयोग वाइस चेयरमैन मीना परमार ने महिला सरपंचों को स्वयं जिम्मेदारी निभाने की बात कही.
भिवानी: हरियाणा महिला आयोग की वाइस चेयरमैन मीना परमार भिवानी पहुंची. इस दौरान मीना परमार ने कहा कि, ""प्रदेश में निर्वाचित महिला प्रतिनिधियों को वास्तविक नेतृत्व देने के लिए आयोग नई कार्ययोजना तैयार कर रहा है. इस योजना का उद्देश्य महिला सरपंचों और अन्य निर्वाचित महिला जनप्रतिनिधियों की जगह उनके पति या अन्य परिजनों द्वारा प्रतिनिधित्व किए जाने की परंपरा को समाप्त करना है. प्रस्ताव तैयार होने के बाद इसे मुख्यमंत्री के समक्ष रखा जाएगा.""
महिला जनप्रतिनिधियों को मिलेगा नेतृत्व का अवसर: दरअसल, भिवानी के एक दिवसीय दौरे पर मीना परमार पहुंची थी. इस दौरान उन्होंने कहा कि, ""हमारी कोशिश है कि जिस महिला को जनता ने चुना है, वही बैठकों और सार्वजनिक कार्यक्रमों में अपनी जिम्मेदारी निभाए. महिला प्रतिनिधियों की जगह उनके पति या अन्य परिजन नहीं, बल्कि स्वयं निर्वाचित महिलाएं ही उपस्थित हों. इस संबंध में महिला आयोग विस्तृत योजना तैयार कर रहा है.""
हनीट्रैप मामलों पर आयोग की सख्त चेतावनी: मीना परमार ने हनीट्रैप मामलों पर कहा कि, ""किसी भी महिला को यह गलतफहमी नहीं होनी चाहिए कि वह महिला आयोग का सहारा लेकर किसी पुरुष के साथ अन्याय कर सकती है. ऐसे मामलों में पुलिस द्वारा किसी का उत्पीड़न न हो, इस पर भी विशेष ध्यान रखा जाएगा.""
सेल्फ डिफेंस और स्वयं सहायता समूहों पर जोर: मीना परमार ने कहा कि, ""महिलाओं को आत्मनिर्भर और आत्मविश्वासी बनाने के लिए स्वयं सहायता समूहों के सहयोग से सेल्फ डिफेंस प्रशिक्षण कार्यक्रम शुरू किए जाएंगे. महिलाएं शारीरिक और मानसिक रूप से सशक्त बनें, यही महिला आयोग का उद्देश्य है. जल्द ही प्रदेश स्तर पर महिला सरपंच सम्मेलन आयोजित किए जाएंगे.""
अस्पताल, महिला थाना और जेल का किया निरीक्षण: दौरे के दौरान वाइस चेयरमैन ने भिवानी के नागरिक अस्पताल, महिला थाना, वन स्टॉप सेंटर और जिला जेल का निरीक्षण किया. उन्होंने महिला कैदियों की स्वास्थ्य, स्वच्छता, भोजन, चिकित्सा सुविधाओं और कौशल प्रशिक्षण की जानकारी ली. वहीं, नागरिक अस्पताल में महिला डॉक्टरों की कमी दूर करने के निर्देश दिए तथा महिला थाना में महिलाओं से जुड़े मामलों की निष्पक्ष जांच सुनिश्चित करने पर बल दिया. उन्होंने कहा कि महिला सशक्तिकरण के लिए प्रशासन के साथ मिलकर व्यापक कार्ययोजना तैयार की जाएगी.",0.5166666666666666
