title,url,source,date,language,state,district,search_term,full_text,relevance_score
"हरियाणा के भिवानी में मासूम की सांसों पर 9 करोड़ का पहरा, 19 महीने की सिया को बचाने के लिए मां ने फैलाई झोली",https://www.khabarfast.com/haryana-bhiwani-mother-in-holds-out-her-hands-to-save-19-month-old-siya,Khabar Fast,2026-07-02T18:38:00+05:30,hi,Haryana,,"(लू OR ""लू चलना"" OR ""भीषण गर्मी"" OR ""प्रचंड गर्मी"" OR ""कड़ी धूप"" OR ""तेज धूप"" OR ""गर्म हवा"" OR ""उष्ण लहर"" OR ""ताप लहर"" OR ""हीट वेव"" OR ""झुलसाने वाली गर्मी"" OR ""तपती गर्मी"" OR ""भयंकर गर्मी"") Haryana","Haryana News: हरियाणा के भिवानी की एक ऐसी मासूम की, जिसकी ज़िंदगी की डोर वक्त और भारी-भरकम रकम के बीच झूल रही है। भिवानी के विद्यानगर की रहने वाली मात्र 19 महीने की मासूम बेटी सिया एक बेहद ही दुर्लभ और गंभीर बीमारी से जूझ रही है।
इस बीमारी का नाम है SMA (स्पाइनल मस्कुलर एट्रोफी) टाइप-1। इस मासूम को बचाने के लिए एक इंजेक्शन की जरूरत है, जिसकी कीमत सुनकर किसी के भी होश उड़ जाएं। टैक्स छूट के बाद भी भारत में इस 'जोल्जेंस्मा' (Zolgensma) इंजेक्शन की कीमत करीब 9 करोड़ रुपए है। एक ऐसा परिवार जो किराए की दुकान चलाकर बमुश्किल गुजारा करता है, उसके लिए यह रकम किसी पहाड़ जैसी है।
सिया जब 6 महीने की थी, तब उसे निमोनिया हुआ था। कई अस्पतालों के चक्कर काटने के बाद जब हालत नहीं सुधरी, तो न्यूरोलॉजिस्ट की सलाह पर जेनेटिक जांच करवाई गई। रिपोर्ट आई तो माता-पिता के पैरों तले जमीन खिसक गई। सिया को SMA टाइप-1 था। डॉक्टरों के मुताबिक, यह इंजेक्शन 2 साल की उम्र से पहले लगना सबसे ज्यादा असरदार होता है। यानी मासूम सिया के पास अब सिर्फ 2 महीने का वक्त बचा है। सिया की हालत लगातार बिगड़ रही है। वह न ठीक से बैठ पाती है, न अपने शरीर को संभाल पाती है। अचानक ऑक्सीजन का लेवल गिर जाता है और सांसें थमने लगती हैं, जिसके बाद उसे तुरंत अस्पताल भागना पड़ता है।

सिया की मां ने बताया कि आजकल समाज में फ्रॉड बहुत बढ़ गए हैं, जिसकी वजह से असल जरूरतमंदों को मदद नहीं मिल पाती। मेरी आप सब से हाथ जोड़कर प्रार्थना है कि मेरी बेटी को बचा लीजिए। जो भी संभव हो, आर्थिक मदद करें। मैं सरकार से भी अपील करती हूं कि ऐसी गंभीर बीमारियों के लिए एक विशेष कोष (फंड) बनाया जाए, ताकि किसी गरीब की औलाद इलाज के बिना न मरे।
मां का दर्द बिल्कुल जायज है। आज एक बेबस मां अपनी 19 महीने की कलेजे के टुकड़े के लिए सरकार और देश की जनता के सामने झोली फैलाकर खड़ी है। 9 करोड़ रुपए एक परिवार के लिए असंभव हो सकते हैं, लेकिन अगर देश की जनता और सरकार ठान ले, तो इस मासूम को एक नई ज़िंदगी मिल सकती है। अगर आप भी सिया की मदद करना चाहते हैं, तो स्क्रीन पर दिए गए क्रेडेंशियल्स पर अपनी इच्छाशक्ति के अनुसार मदद भेज सकते हैं। आपकी एक छोटी सी मदद, इस मासूम को एक नया जीवन दे सकती है।",0.0
"Haryana News: हरियाणा के बहादुरगढ़ में रिश्तों का कत्ल, भाई ने भाई को उतारा मौत के घाट",https://www.khabarfast.com/haryana-bahadurgarh-man-kills-his-brother-in-chhotu-ram-nagar,Khabar Fast,2026-07-02T16:38:00+05:30,hi,Haryana,,"(लू OR ""लू चलना"" OR ""भीषण गर्मी"" OR ""प्रचंड गर्मी"" OR ""कड़ी धूप"" OR ""तेज धूप"" OR ""गर्म हवा"" OR ""उष्ण लहर"" OR ""ताप लहर"" OR ""हीट वेव"" OR ""झुलसाने वाली गर्मी"" OR ""तपती गर्मी"" OR ""भयंकर गर्मी"") Haryana","Haryana News: हरियाणा के बहादुरगढ़ शहर के छोटूराम नगर में रिश्तों को शर्मसार कर देने वाली एक सनसनीखेज वारदात सामने आई है। यहां एक युवक की हत्या का आरोप उसके सगे बड़े भाई पर लगा है। घटना के बाद पूरे इलाके में हड़कंप मच गया। सूचना मिलते ही पुलिस मौके पर पहुंची और शव को कब्जे में लेकर पोस्टमार्टम के लिए नागरिक अस्पताल के शवगृह में भिजवा दिया। फिलहाल पुलिस आरोपी की तलाश में जुटी है।
मृतक की पहचान उत्तर प्रदेश निवासी श्रीकांत के रूप में हुई है। वह अपने बड़े भाई अरुण के साथ छोटूराम नगर में किराये पर रहकर मेहनत-मजदूरी करता था। मृतक की बहन रूबी ने बताया कि रात करीब 12:51 बजे उसके पास बड़े भाई अरुण का फोन आया। फोन पर अरुण ने कहा कि मैंने श्रीकांत को मार दिया है। पहले तो परिवार को इस बात पर विश्वास नहीं हुआ, लेकिन उन्होंने तुरंत बहादुरगढ़ में रहने वाले परिचितों को इसकी सूचना दी। सूचना मिलने पर प्रेम नगर निवासी परिचित सोनू मौके पर पहुंचे तो श्रीकांत का शव कमरे में खून से लथपथ हालत में पड़ा मिला। इसी दौरान पुलिस भी घटनास्थल पर पहुंच गई और जांच शुरू कर दी

बताया जा रहा है कि वारदात के बाद आरोपी अरुण मौके से फरार हो गया। परिजनों ने उससे कई बार संपर्क करने की कोशिश की, लेकिन उसने फोन नहीं उठाया। सुबह एक बार किसी महिला ने उसका फोन उठाया, जिसके बाद मोबाइल स्विच ऑफ हो गया। पुलिस ने शव को कब्जे में लेकर पोस्टमार्टम के लिए नागरिक अस्पताल भेज दिया है। हत्या के पीछे क्या कारण रहे, इसका अभी खुलासा नहीं हो पाया है। पुलिस विभिन्न पहलुओं को ध्यान में रखते हुए मामले की जांच कर रही है और फरार आरोपी की तलाश में दबिश दी जा रही है। पुलिस का कहना है कि आरोपी की गिरफ्तारी के बाद ही हत्या के कारणों का स्पष्ट खुलासा हो सकेगा।",0.0
"Haryana News: अभय चौटाला का बड़ा बयान, पानी विवाद और घोटालों पर सरकार को घेरा",https://www.khabarfast.com/haryana-abhay-chautala-major-statement-corners-the-government-over-the-water-dispute-and-scams,Khabar Fast,2026-07-02T16:06:00+05:30,hi,Haryana,,"(लू OR ""लू चलना"" OR ""भीषण गर्मी"" OR ""प्रचंड गर्मी"" OR ""कड़ी धूप"" OR ""तेज धूप"" OR ""गर्म हवा"" OR ""उष्ण लहर"" OR ""ताप लहर"" OR ""हीट वेव"" OR ""झुलसाने वाली गर्मी"" OR ""तपती गर्मी"" OR ""भयंकर गर्मी"") Haryana","Haryana News: इनेलो के राष्ट्रीय अध्यक्ष अभय चौटाला ने पत्रकारों से बातचीत करते हुए हरियाणा की राजनीति और पानी के मुद्दे पर सरकार को घेरा। उन्होंने कहा कि 5 जुलाई को हिसार में चौधरी देवीलाल की जयंती पर कार्यकर्ताओं के साथ बड़ी बैठक की जाएगी।
अभय चौटाला ने बताया कि पार्टी हर वर्ष चौधरी देवीलाल की जयंती मनाती है और इस बार भी बड़े स्तर पर कार्यक्रम आयोजित किया जाएगा। उन्होंने कहा कि बैठक में जाने से पहले वह चैनेत गांव भी जाएंगे, जहां पानी की समस्या को लेकर ग्रामीण धरने पर बैठे हैं। उन्होंने दावा किया कि वह कम से कम हजार लोगों को अपने साथ धरना स्थल पर लेकर जाएंगे। चौटाला ने कहा कि लोगों को पानी के लिए धरना देना पड़ रहा है, जो सरकार की नाकामी को दर्शाता है।
‘T लगाने और हटाने को लेकर राजनीति’ का आरोप
अभय चौटाला ने आरोप लगाया कि पहले गांव में पानी देने के लिए T लगाने की बात हुई और बाद में उसे हटाया गया। उन्होंने सवाल उठाया कि यह T लगाने और हटाने का निर्णय किसके निर्देश पर हुआ। उन्होंने कहा कि इसे लगाने के लिए मुख्यमंत्री नायब सैनी ने कहा और हटाने के लिए पूर्व मुख्यमंत्री मनोहर लाल खट्टर ने निर्देश दिए। साथ ही उन्होंने आरोप लगाया कि इस मामले को लेकर कुछ नेता दिल्ली भी गए थे और T हटवाने की मांग की गई थी। चौटाला ने कहा कि भाजपा के एक कार्यकर्ता राजकुमार यादव ने धरने पर ₹51,000 देकर घोषणा करवाई कि पैसे की कमी के कारण आंदोलन खत्म नहीं होना चाहिए। उन्होंने इसे राजनीतिक दोहरेपन का उदाहरण बताया।
पानी समझौते और जन आंदोलन की चेतावनी
अभय चौटाला ने कहा कि हरियाणा से राजस्थान को पानी देने का मुद्दा समझौते के खिलाफ है। उन्होंने दावा किया कि समझौते के अनुसार पहले तीन डैम बनने चाहिए थे, लेकिन बिना डैम बनाए पानी दिया जा रहा है। उन्होंने कहा कि पहले कांग्रेस और अब भाजपा दोनों सरकारों ने ऐसे समझौतों पर हस्ताक्षर किए, जिन्हें उन्होंने बिना पूरी जानकारी के लिया गया फैसला बताया। उन्होंने चेतावनी दी कि इस मुद्दे को जनता के बीच ले जाकर बड़ा जन आंदोलन किया जाएगा।
घोटालों की जांच की मांग
अभय चौटाला ने कहा कि उन्होंने मुख्यमंत्री को पत्र लिखकर कांग्रेस सरकार के खिलाफ दी गई 200 पेज की चार्जशीट पर जांच की मांग की है। उन्होंने बताया कि पहले भी भाजपा सरकार से कांग्रेस काल के घोटालों की जांच की मांग की गई थी और शर्त रखी गई थी कि अगर वे गलत साबित होते हैं तो उनके खिलाफ एफआईआर दर्ज की जाए। उन्होंने दावा किया कि अब कई अधिकारियों के भ्रष्टाचार में शामिल होने की बात सामने आ रही है। इसके साथ ही उन्होंने भाजपा सरकार के 20 कथित घोटालों की जांच की मांग को भी दोहराया।",0.31666666666666665
"Haryana News: टोल प्लाजा इंजिनियर के साथ मारपीट और लूट करने के तीन बाउंसर अरेस्ट, लूट की ऱाशि बरामद करने के लिए पुलिस रिमांड पर",https://www.dainiktribuneonline.com/news/haryana/haryana-news-three-bouncers-arrested-for-assaulting-and-robbing-a-toll-plaza-engineer-on-police-remand-to-recover-the-looted-money/,Dainik Tribune,2026-07-02T15:29:26+05:30,hi,Haryana,,"(लू OR ""लू चलना"" OR ""भीषण गर्मी"" OR ""प्रचंड गर्मी"" OR ""कड़ी धूप"" OR ""तेज धूप"" OR ""गर्म हवा"" OR ""उष्ण लहर"" OR ""ताप लहर"" OR ""हीट वेव"" OR ""झुलसाने वाली गर्मी"" OR ""तपती गर्मी"" OR ""भयंकर गर्मी"") Haryana","Haryana News: टोल प्लाजा इंजिनियर के साथ मारपीट और लूट करने के तीन बाउंसर अरेस्ट, लूट की ऱाशि बरामद करने के लिए पुलिस रिमांड पर
Haryana News: दिल्ली-वडौदरा-मुंबई एक्सप्रेस वे किरंज टोल प्लाजा पर इंजिनियर के साथ मारपीट कर 20 हजार रुपये लूटने के आरोपी तीन टोल बाउंसरों को पुलिस ने अरेस्ट कर लिया है। आरोपियों से लूट की राशि और मारपीट में प्रयोग किए...
Haryana News: दिल्ली-वडौदरा-मुंबई एक्सप्रेस वे किरंज टोल प्लाजा पर इंजिनियर के साथ मारपीट कर 20 हजार रुपये लूटने के आरोपी तीन टोल बाउंसरों को पुलिस ने अरेस्ट कर लिया है। आरोपियों से लूट की राशि और मारपीट में प्रयोग किए गए डंडे व हथियार बरामद करने के लिए पुलिस रिमांड पर लिया गया है। लूट के आरोपी बाउंसरों की पहचान फरीदाबाद के सेक्टर 58 अंतर्गत गांव नंगला जोगियान निवासी विनय और दान सिंह तथा गांव दुधौला निवासी तरूण के तौर पर की गई है।
हथीन थाना पुलिस का कहना है कि फरीदाबाद के सेक्टर 11 निवासी कनव मित्तल ने बीती 26 जून को दी शिकायत में कहा कि वह 24 जून को दिल्ली-वडौदरा-मुंबई एक्सप्रेस से जा रहा था। किरंज टोल प्लाजा क्रास करते ही वहां खडे बाउंसरों ने गाडी में डंडा फेंक कर मारा। डंडा मारने से गाडी का शीशा टूट गया। शीशा टूटने पर गाडी को रोका और डंडा फेंककर मारने का कारण पूछने पर कई बाउंसर एकत्र हो गए। बाउंसरों ने लात-घुसों में मारपीट कर 20 हजार रुपये लूट लिए। नेशनल हाईवे आथर्टी आफ इंडिया औऱ पुलिस को शिकायत देने जान से मारने की धमकी दी।
पुलिस का कहना है कि इस बारे में कनव मित्तल ने 26 जून को शिकायत दी थी। पुलिलस ने चार दिन बाद 30 जून की देर रात केस दर्ज किया गया। पुलिस ने सीसीटीवी फुटेज व अन्य साक्ष्यों के आधार पर कार्रवाई करते हुए वारदात में शामिल तीन बाउंसरों को गिरफ्तार किया है। गिरफ्तार किए गए बाउंसरों में विनय, दान सिंह और तरुण शामिल हैं। पुलिस का कहना है कि आरोपियों को अदालत में पेश कर पुलिस रिमांड पर लिया गया है। रिमांड के दौरान आरोपियों के कब्जे से लूटी हुई धनराशि बरामद की जाएगी। मारपीट औऱ लूट में शामिल अन्य फरार आरोपियों की तलाश की जा रही है। घटना में शामिल सभी आरोपियों को अरेस्ट किया जाएगा।",0.0
