title,url,source,date,language,state,district,search_term,full_text,relevance_score
"चरखी दादरी में सफाईकर्मियों का जोरदार प्रदर्शन, झाड़ू लेकर सड़क पर उतरे, सरकार को दी आर-पार की चेतावनी - ETV Bharat",https://news.google.com/rss/articles/CBMiywFBVV95cUxOVFVnTUt0cjhNbG1BellNVG1EWld2eVB4Q1o5YnFDMG5Ka2JsLUhVMnVwY1l3Y2FPakYtQnFCZHExWGFvemJpenczeTVlUGNhM3YxY05jZ29IMXE3SGt4UDFtcVJGYmlkNEhjUDFvSTloNlQyTG1OcFZ2OWZSYWdTdFBad0ZEaGZuR3BLTkl3QWFzMlFHSVhtbWdMbm5JQWRyMUdBc090MHl0TDh6cmM3Nzhoc3VGRERVZ1BSU3pFbGxLOTNfN2QyMV9BWdIB0AFBVV95cUxNY3JPZDlDVlhTZHJScmJEXzVqb2VVR2dUanpiUHM5aHlhMm1yTmV5UjJ3dE9kVjBHaHRLSDgzTEhRZGlJOXBGOW1hLTBWMGhDRGpWdTR1NGx6N1FOc1hGVlFpa2hvR2VIaTdMdHgydmJIOUpMSzA2VDhsZGkzTm1GV0hxeFFIdGV0VlduMkpVajlnNVVJSFZONTRGOTlza3VvaEtLMWViYm9UT0drRzBjWGpiU1l6VGJoLTZMYnZXUjFiSUxoVFFoVGtJWlQydHpF?oc=5,ETV Bharat,2026-07-02T15:41:40+05:30,hi,Haryana,,"(""हीट एक्शन प्लान"" OR ""गर्मी से राहत"" OR चेतावनी OR ""रेड अलर्ट"" OR ""ऑरेंज अलर्ट"" OR ""येलो अलर्ट"" OR एडवाइजरी OR ""राहत सामग्री"" OR ""राहत शिविर"" OR मुआवजा) Haryana","चरखी दादरी में सफाईकर्मियों का जोरदार प्रदर्शन, झाड़ू लेकर सड़क पर उतरे, सरकार को दी आर-पार की चेतावनी
दादरी में सफाई कर्मचारियों ने सड़क पर झाड़ू लेकर सरकार के विरोध में प्रदर्शन किया. इस दौरान सरकार को चेतावनी दी.
चरखी दादरी: चरखी दादरी में अपनी लंबित मांगों और सरकार की कथित वादाखिलाफी के विरोध में नगर परिषद के सफाई कर्मचारियों ने जोरदार प्रदर्शन किया. नगर परिषद सफाई कर्मचारी यूनियन के प्रधान सूरज कुमार के नेतृत्व में कर्मचारियों ने नगर परिषद कार्यालय से परशुराम चौक तक हाथों में उल्टी झाड़ू लेकर रोष मार्च निकाला. इस दौरान कर्मचारियों ने सरकार के खिलाफ नारेबाजी करते हुए जल्द मांगें पूरी करने की मांग उठाई.
समझौते पर अमल नहीं होने का आरोप: प्रदर्शन के दौरान यूनियन ने आरोप लगाया कि सरकार ने कर्मचारी संगठनों के साथ हुए समझौते का पालन नहीं किया. यूनियन का कहना है कि 30 जून तक मांगों को पूरा करने का आश्वासन दिया गया था, लेकिन तय समय बीतने के बाद भी इस संबंध में कोई आधिकारिक पत्र जारी नहीं किया गया. कर्मचारियों ने इसे सरकार की वादाखिलाफी बताते हुए नाराजगी जताई.
साढ़े तीन महीने से वेतन नहीं मिलने का दावा: प्रदर्शन कर रहे यूनियन प्रधान सूरज कुमार ने कहा कि, ""हरियाणा सरकार ने सफाई कर्मचारियों के साथ गंभीर भेदभाव किया है. सरकार ने 30 जून तक मांगें पूरी करने का आश्वासन दिया था, लेकिन अब तक कोई आधिकारिक पत्र जारी नहीं हुआ. एचकेआरएन के तहत कार्यरत सफाई कर्मचारियों को पिछले साढ़े तीन महीने से वेतन भी नहीं मिला है. लंबे समय से वेतन नहीं मिलने से कर्मचारियों और उनके परिवारों को आर्थिक परेशानियों का सामना करना पड़ रहा है.""
अनिश्चितकालीन आंदोलन की चेतावनी: सूरज कुमार ने आगे कहा कि, ""राज्य प्रधान के आदेशानुसार 6, 7 और 8 अगस्त को तीन दिवसीय हड़ताल की जाएगी. यदि इसके बाद भी सरकार ने मांगों पर सकारात्मक कार्रवाई नहीं की, तो 8 अगस्त से आंदोलन अनिश्चितकालीन हड़ताल में बदल दिया जाएगा. मेरी शहरवासियों से सहयोग की अपील है. हड़ताल के दौरान यदि सफाई व्यवस्था प्रभावित होती है, तो इसकी पूरी जिम्मेदारी सरकार की होगी.""",0.5166666666666666
"चरखी दादरी में सफाईकर्मियों का बड़ा ऐलान: हाथों में उल्टी झाड़ू लेकर सड़क पर उतरे, दी बड़ी चेतावनी - Lalluram",https://news.google.com/rss/articles/CBMif0FVX3lxTE4xUVhydE1EeWpLT2pYb1I3c0RrZEEzM1dxYXNfUDNIQ3hjVU54WUthd3R6ZFh5RV9KVk5URmk4cy0wSkVXVy1kbWJFTzE4OG9Kb21CZWJtQ1F6eUZqTXFaVDkwUUEtaFFobkU3a3hmYWFfdHY2S05GTXVpSmIweEk?oc=5,Lalluram,2026-07-02T16:39:04+05:30,hi,Haryana,,"(""हीट एक्शन प्लान"" OR ""गर्मी से राहत"" OR चेतावनी OR ""रेड अलर्ट"" OR ""ऑरेंज अलर्ट"" OR ""येलो अलर्ट"" OR एडवाइजरी OR ""राहत सामग्री"" OR ""राहत शिविर"" OR मुआवजा) Haryana","चरखी दादरी। जिले में अपनी लंबित मांगों और प्रशासन की वादाखिलाफी से नाराज नगर परिषद के सफाई कर्मचारियों ने सरकार के खिलाफ मोर्चा खोलते हुए एक बड़ा प्रदर्शन किया है। नगर परिषद सफाई कर्मचारी यूनियन के प्रधान सूरज कुमार की अगुवाई में भारी संख्या में सफाईकर्मियों ने नगर परिषद कार्यालय से लेकर परशुराम चौक तक हाथों में उल्टी झाड़ू थामकर एक विशाल रोष मार्च निकाला। इस बड़े आंदोलन के दौरान कर्मचारियों ने प्रशासनिक नीतियों के खिलाफ जमकर नारेबाजी की और अपनी जायज मांगों को तुरंत पूरा करने की मांग उठाई। इस प्रदर्शन के कारण स्थानीय प्रशासन में हड़कंप मच गया है और आने वाले दिनों में शहर की सफाई व्यवस्था पूरी तरह चरमराने की आशंका पैदा हो गई है।
प्रशासनिक समझौते और वादाखिलाफी का आरोप
आंदोलनकारी सफाई कर्मचारियों ने प्रदर्शन के दौरान सरकार पर सीधा आरोप लगाया कि कर्मचारी संगठनों के साथ हुए पिछले समझौतों को पूरी तरह ठंडे बस्ते में डाल दिया गया है। यूनियन के पदाधिकारियों के अनुसार प्रशासन ने आगामी 30 जून तक उनकी सभी प्रमुख मांगों को पूरा करने का लिखित आश्वासन दिया था लेकिन यह निर्धारित समय सीमा बीत जाने के बाद भी अब तक कोई आधिकारिक पत्र जारी नहीं किया गया है। कर्मचारियों ने इसे सीधे तौर पर अपने साथ हुआ विश्वासघात बताते हुए भारी नाराजगी जाहिर की है। सरकार की इस बेरुखी के कारण कर्मचारियों के मन में गहरा रोष व्याप्त है जिसके चलते वे अब आर-पार की लड़ाई लड़ने के मूड में आ गए हैं।
साढ़े तीन महीने से वेतन न मिलने की समस्या
यूनियन के प्रधान सूरज कुमार ने वर्तमान स्थिति पर चिंता व्यक्त करते हुए कहा कि हरियाणा सरकार सफाई कर्मचारियों के साथ बहुत गंभीर भेदभाव कर रही है। उन्होंने मीडिया को बताया कि एचकेआरएन के अंतर्गत काम करने वाले सफाई कर्मचारियों को पिछले साढ़े तीन महीने से एक भी रुपया वेतन नहीं मिला है। इतने लंबे समय से पगार न मिलने के कारण इन गरीब परिवारों के सामने रोजी-रोटी का गंभीर संकट खड़ा हो गया है। आर्थिक तंगी से जूझ रहे कर्मचारियों ने साफ कहा है कि अब वे चुप नहीं बैठेंगे। राज्य प्रधान के निर्देशानुसार आगामी 6, 7 और 8 अगस्त को तीन दिवसीय देशव्यापी हड़ताल की जाएगी जो मांगें न मानने पर अनिश्चितकालीन हड़ताल में बदल दी जाएगी।",0.5166666666666666
