title,url,source,date,language,state,district,search_term,full_text,relevance_score
"CG Monsoon 2026: आखिर कब आएगा मानसून? धूप-उमस से परेशान छत्तीसगढ़, IMD ने बताया कब मिलेगी गर्मी से राहत - Patrika News",https://news.google.com/rss/articles/CBMiiAFBVV95cUxQLXNwMmtvYWJlUnNENTJvWERQTWY2c3A4NFktRWx1VUhEWDlQSmk5UU1HNEZXY2dmSmpXbVJVUlBadHdySVJwWTN0LU5SZEt1UjA0OTUzMTI1UmxuRWxzcENQUFZUdUxqYXRxUDNtSk5IS2NnUndWYXlSVlh1RkUyZnBTZ3hUajRz0gGOAUFVX3lxTFBDSkhaUmJ5YXcyQ1llNklGZ3VOQzZXYmd2dWpUa19LMzJvdG9XSHItM2ZaRHUwQkhESDZaNW1MbThnOUZOYW9HY2hYN1YtS2lkSzlOaW1HV3QxbUZCSUdyYjFHOFVxczJiaEVZX1I5dkwwXzNSSDZCRFhHY0oxV0NSek9NbC05TWg0UGZGdnc?oc=5,Patrika News,2026-06-21T14:12:03+05:30,hi,Chhattisgarh,Raipur,"(""हीट एक्शन प्लान"" OR ""गर्मी से राहत"" OR चेतावनी OR ""रेड अलर्ट"" OR ""ऑरेंज अलर्ट"" OR ""येलो अलर्ट"" OR एडवाइजरी OR ""राहत सामग्री"" OR ""राहत शिविर"" OR मुआवजा) Chhattisgarh","CG Monsoon 2026: आज कई जिलों में बारिश के आसार(photo-patrika)
CG Monsoon 2026: छत्तीसगढ़ में गर्मी और उमस का असर लगातार बढ़ रहा है। राजधानी रायपुर में तापमान करीब 40 डिग्री सेल्सियस तक पहुंच गया है, जो सामान्य तापमान से लगभग 7 डिग्री अधिक है। बारिश थमने के बाद गर्मी और ज्यादा महसूस हो रही है। तेज धूप और गर्म हवाओं के कारण लोगों की परेशानी बढ़ गई है। लोग दोपहर के समय बाहर निकलने से बच रहे हैं और लू से बचाव के लिए सावधानी बरत रहे हैं। मौसम में बदलाव और मानसून का इंतजार जारी है।
मौसम विभाग के अनुसार आज प्रदेश में अधिकतम तापमान 38 से 39 डिग्री सेल्सियस के आसपास रहने की संभावना है। दिनभर धूप और बादलों की आवाजाही बनी रह सकती है। दोपहर या शाम के समय कई इलाकों में गरज-चमक के साथ हल्की बारिश या बौछारें पड़ने के आसार हैं। रायपुर में भी आज तापमान करीब 38 डिग्री तक पहुंच सकता है। शाम के समय बादल छाने और हल्की बारिश की संभावना जताई गई है। वहीं उत्तरी छत्तीसगढ़ के कुछ हिस्सों में ओले गिरने की संभावना के साथ कई जिलों में हल्की से मध्यम बारिश हो सकती है।
मौसम विभाग के अनुसार छत्तीसगढ़ में मानसून (Monsoon 2026) 23 जून के आसपास प्रवेश कर सकता है। मानसून पहुंचने की सामान्य तारीख 15 जून है, ऐसे में इस बार करीब 5 दिन की देरी हो रही है। विभाग का कहना है कि अगले 5 दिनों में प्रदेश के कई हिस्सों में अच्छी बारिश होने की संभावना है।
गुरुवार को प्रदेश के कुछ हिस्सों में तेज बारिश हुई थी, लेकिन इसके बाद भी गर्मी और उमस से राहत नहीं मिली। राजधानी रायपुर में शनिवार को लोग तेज धूप से बचने के लिए चेहरे ढककर बाहर निकलते नजर आए। मौसम विशेषज्ञों के अनुसार मानसून के सक्रिय होने के बाद ही तापमान में गिरावट और गर्मी से राहत मिलने की उम्मीद है। फिलहाल लोगों को गर्मी और उमस का सामना करना पड़ रहा है।
Published on:
21 Jun 2026 02:12 pm",1.0
