title,url,source,date,language,state,district,search_term,full_text,relevance_score
"अच्छी खबर: पटना एम्स में बढ़ेंगे 200 बेड, 24 एकड़ जमीन दिलाएगी सरकार; सीएम सम्राट का ऐलान",https://www.livehindustan.com/bihar/good-news-200-beds-more-at-aiims-patna-government-to-provide-24-acres-land-cm-samrat-announces-201783265337467.html,Live Hindustan,2026-07-05T21:18:04+05:30,hi,Bihar,Patna,"(लू OR ""लू चलना"" OR ""भीषण गर्मी"" OR ""प्रचंड गर्मी"" OR ""कड़ी धूप"" OR ""तेज धूप"" OR ""गर्म हवा"" OR ""उष्ण लहर"" OR ""ताप लहर"" OR ""हीट वेव"" OR ""झुलसाने वाली गर्मी"" OR ""तपती गर्मी"" OR ""भयंकर गर्मी"") Bihar","अच्छी खबर: पटना एम्स में बढ़ेंगे 200 बेड, 24 एकड़ जमीन दिलाएगी सरकार; सीएम सम्राट का ऐलान
24 एकड़ भूमि मिलने के बाद पटना एम्स में 200 नये बेड उपलब्ध होंगे। इससे संस्थान की रोगी सेवा क्षमता में वृद्धि होगी।
AIIMS PATNA: मुख्यमंत्री सम्राट चौधरी ने कहा कि राज्य सरकार पटना एम्स के विस्तार एवं विकास के लिए हरसंभव सहयोग प्रदान करेगी। एम्स के विस्तार के लिए 24 एकड़ भूमि जल्द उपलब्ध करायी जाएगी। अतिरिक्त भूमि मिलने के बाद पटना एम्स में 200 नये बेड उपलब्ध होंगे। इससे संस्थान की रोगी सेवा क्षमता में वृद्धि होगी। मुख्यमंत्री ने रविवार को पटना एम्स का निरीक्षण किया और पदाधिकारियों को कई निर्देश दिये। इस दौरान उन्होंने संस्थान में उपलब्ध स्वास्थ्य सेवाओं, आधारभूत संरचनाएं तथा भविष्य की विकास योजनाओं की विस्तृत जानकारी ली।
मुख्यमंत्री ने कहा कि बर्न मरीजों के उपचार के लिए स्किन स्टोरेज (त्वचा भंडारण) की व्यवस्था विकसित करने में भी राज्य सरकार सहयोग करेगी। इससे गंभीर रूप से झुलसे मरीजों को बेहतर एवं समयबद्ध उपचार उपलब्ध कराने में सहायता मिलेगी। मुख्यमंत्री ने बर्न वार्ड जाकर वहां इलाज करा रहे मरीजों से मुलाकात की और उनसे उपलब्ध चिकित्सकीय सुविधाओं की जानकारी ली। मुख्यमंत्री ने मरीजों एवं परिजनों का मनोबल बढ़ाया और शीघ्र स्वस्थ होने की कामना की।
मुख्यमंत्री ने कहा कि राज्य सरकार गुणवत्तापूर्ण स्वास्थ्य सेवाओं सुदृढ़ बनाने के लिए प्रतिबद्ध है तथा एम्स, पटना के विकास से जुड़े सभी आवश्यक कार्यों में राज्य सरकार सक्रिय सहयोग प्रदान करेगी। निरीक्षण के दौरान मुख्यमंत्री के प्रधान सचिव दीपक कुमार, मुख्यमंत्री के सचिव लोकेश कुमार सिंह, स्वास्थ्य विभाग के सचिव कुमार रवि, स्वास्थ्य विभाग के विशेष सचिव अरविंद कुमार चौधरी, बिहार मेडिकल सर्विसेज एंड इंफ्रास्ट्रक्चर कॉर्पोरेशन लिमिटेड के प्रबंधक निदेशक सुब्रत कुमार सेन, एम्स के निदेशक प्रो. (ब्रिग.) डॉ. राजू अग्रवाल सहित अन्य वरीय अधिकारी एवं एम्स, पटना के चिकित्सक उपस्थित थे।
एम्स से नाथूपुर तक चार लेन सड़क का निर्माण शीघ्र
मुख्यमंत्री ने कहा कि एम्स, पटना से नाथूपुर तक 4 लेन सड़क के निर्माण के लिए राज्य सरकार आवश्यक सहयोग एवं समन्वय सुनिश्चित करेगी, ताकि मरीजों, उनके परिजनों तथा आम नागरिकों को बेहतर और सुगम आवागमन की सुविधा उपलब्ध हो सके। निर्माण शीघ्र किया जाएगा। मुख्यमंत्री ने डिपार्टमेंट ऑफ न्यूक्लियर मेडिसिन में पेट-सिटी रूम, स्पेक्ट सिटी रूम, रेडियो फार्मेसी लैब का निरीक्षण किया। साथ ही डिविजन ऑफ ऑन्कोलॉजी, डिपार्टमेंट ऑफ एनॉटोमी सहित ओपीडी का भी निरीक्षण कर वहां की व्यवस्थाओं की जानकारी ली।
तालाब बनेगा खूबसूरत
इस दौरान मुख्यमंत्री ने एम्स परिसर स्थित तालाब का भी जायजा लिया। उन्होंने निर्देश दिया कि तालाब का जीर्णोद्धार कर उसे पर्यटन एवं आकर्षण का केंद्र बनाने की दिशा में कार्य किया जाए, ताकि यह स्थान पर्यावरण संरक्षण के साथ-साथ लोगों के लिए एक सुंदर एवं उपयोगी स्थल के रूप में विकसित हो सके।",0.0
"Bihar:पटना में दनादन फायरिंग, भागने में युवक की छत से गिरकर मौत; दूसरे शख्स को लगी गोली, विवाद की जांच",https://www.amarujala.com/bihar/patna/patna-rajiv-nagar-firing-one-youth-shot-another-dies-after-falling-from-roof-2026-07-05,अमर उजाला,2026-07-05T20:52:16+05:30,hi,Bihar,Patna,"(लू OR ""लू चलना"" OR ""भीषण गर्मी"" OR ""प्रचंड गर्मी"" OR ""कड़ी धूप"" OR ""तेज धूप"" OR ""गर्म हवा"" OR ""उष्ण लहर"" OR ""ताप लहर"" OR ""हीट वेव"" OR ""झुलसाने वाली गर्मी"" OR ""तपती गर्मी"" OR ""भयंकर गर्मी"") Bihar","{""_id"":""6a4a764ff70899e9ea0e50bc"",""slug"":""patna-rajiv-nagar-firing-one-youth-shot-another-dies-after-falling-from-roof-2026-07-05"",""type"":""story"",""status"":""publish"",""title_hn"":""Bihar: पटना में दनादन फायरिंग, भागने में युवक की छत से गिरकर मौत; दूसरे शख्स को लगी गोली, विवाद की जांच"",""category"":{""title"":""City & states"",""title_hn"":""शहर और राज्य"",""slug"":""city-and-states""}}
Bihar: पटना में दनादन फायरिंग, भागने में युवक की छत से गिरकर मौत; दूसरे शख्स को लगी गोली, विवाद की जांच
सार
Patna News: पटना के राजीव नगर थाना क्षेत्र में आपसी विवाद के दौरान गोलीबारी की घटना में एक युवक को गोली लगी, जबकि दूसरा भागने के दौरान छत से गिर गया, जिससे उसकी मौत हो गई। पुलिस ने हथियार बरामद कर एफएसएल टीम की मदद से जांच शुरू कर दी है।
विज्ञापन
खबरें लगातार पढ़ने के लिए अमर उजाला एप डाउनलोड करें
या
वेबसाइट पर पढ़ना जारी रखने के लिए वीडियो विज्ञापन देखें
अगर आपके पास प्रीमियम मेंबरशिप है तो
विस्तार
पटना में आपराधिक घटनाएं कम नहीं हो पा रही हैं। रविवार शाम राजीव नगर इलाके में गोलीबारी हुई। इसमें एक युवक को गोली लगी, जबकि दूसरा युवक भागने के दौरान छत से गिर गया। इस कारण उसकी मौत हो गई। घटना के बाद इलाके में हड़कंप मच गया और आसपास के लोगों की भीड़ जुट गई। दोनों युवकों को तत्काल अस्पताल पहुंचाया गया, जहां डॉक्टरों ने छत से गिरे युवक को मृत घोषित कर दिया। वहीं, गोली लगे युवक का इलाज चल रहा है।
राजीव नगर में चली गोली, इलाके में मचा हड़कंप
घटना राजीव नगर थाना क्षेत्र के रोड नंबर 8बी की है। सूचना मिलते ही पुलिस मौके पर पहुंची और जांच शुरू कर दी। पुलिस ने वैज्ञानिक जांच के लिए एफएसएल (फॉरेंसिक साइंस लेबोरेटरी) टीम को भी बुलाया है। राजीव नगर थाना पुलिस के अनुसार प्रथम दृष्टया मामला आपसी विवाद का प्रतीत होता है। घटना में एक युवक की मौत हो गई है, जबकि दूसरे का इलाज जारी है। आरोपी पक्ष से पूछताछ की जा रही है और घटना में प्रयुक्त हथियार भी बरामद कर लिया गया है। मृतक की पहचान पूर्वी चंपारण निवासी प्रियेश रंजन के रूप में हुई है, जबकि घायल युवक की पहचान राजू के रूप में हुई है।
एसएसपी कार्यालय ने दिए जांच के निर्देश
पटना एसएसपी कार्यालय की ओर से बताया गया कि घटना की गंभीरता को देखते हुए नगर पुलिस अधीक्षक (मध्य) ममता कल्याणी ने स्वयं घटनास्थल का निरीक्षण किया। एफएसएल टीम की सहायता से वैज्ञानिक साक्ष्य जुटाए जा रहे हैं और पुलिस सभी पहलुओं पर गहन जांच कर रही है।
विज्ञापन

एसपी बोलीं- आपसी विवाद का लग रहा मामला
नगर पुलिस अधीक्षक (मध्य) ममता कल्याणी ने कहा कि प्रथम दृष्टया यह मामला दोनों युवकों के बीच किसी बात को लेकर हुए आपसी विवाद से जुड़ा प्रतीत हो रहा है। तथ्यों और उपलब्ध साक्ष्यों के आधार पर आगे की विधिसम्मत कार्रवाई की जा रही है।
विज्ञापन
राजीव नगर में चली गोली, इलाके में मचा हड़कंप
घटना राजीव नगर थाना क्षेत्र के रोड नंबर 8बी की है। सूचना मिलते ही पुलिस मौके पर पहुंची और जांच शुरू कर दी। पुलिस ने वैज्ञानिक जांच के लिए एफएसएल (फॉरेंसिक साइंस लेबोरेटरी) टीम को भी बुलाया है। राजीव नगर थाना पुलिस के अनुसार प्रथम दृष्टया मामला आपसी विवाद का प्रतीत होता है। घटना में एक युवक की मौत हो गई है, जबकि दूसरे का इलाज जारी है। आरोपी पक्ष से पूछताछ की जा रही है और घटना में प्रयुक्त हथियार भी बरामद कर लिया गया है। मृतक की पहचान पूर्वी चंपारण निवासी प्रियेश रंजन के रूप में हुई है, जबकि घायल युवक की पहचान राजू के रूप में हुई है।
विज्ञापन
एसएसपी कार्यालय ने दिए जांच के निर्देश
पटना एसएसपी कार्यालय की ओर से बताया गया कि घटना की गंभीरता को देखते हुए नगर पुलिस अधीक्षक (मध्य) ममता कल्याणी ने स्वयं घटनास्थल का निरीक्षण किया। एफएसएल टीम की सहायता से वैज्ञानिक साक्ष्य जुटाए जा रहे हैं और पुलिस सभी पहलुओं पर गहन जांच कर रही है।
विज्ञापन

एसपी बोलीं- आपसी विवाद का लग रहा मामला
नगर पुलिस अधीक्षक (मध्य) ममता कल्याणी ने कहा कि प्रथम दृष्टया यह मामला दोनों युवकों के बीच किसी बात को लेकर हुए आपसी विवाद से जुड़ा प्रतीत हो रहा है। तथ्यों और उपलब्ध साक्ष्यों के आधार पर आगे की विधिसम्मत कार्रवाई की जा रही है।",0.0
