title,url,source,date,language,state,district,search_term,full_text,relevance_score
સામાન્ય તાપમાન પણ ગરમીની તીવ્રતા 40 ડિગ્રી જેવી અનુભવાઈ‎: ભરૂચમાં વાદળછાયા વાતાવરણ વચ્ચે મહત્તમ તાપમાન 34 ડ... - Divya Bhaskar,https://news.google.com/rss/articles/CBMi5wFBVV95cUxQTFc2NDdQRjRGZzVPRmxhTG5BOWVrN2wxVFJfeF9lank0S2lsTGdIYmhXbXRITVBWaUx5NFRDZ0hfeVNUakVJWXhoNms1TnNnWGJBWVN0a3lqLWJrYjl6OEQ3OHN6d093cTZNM3ZJRGZRZVdlYzktVmxNNDdTc0VlY0ItOGx4bEpkLTNyZTJUYWNWQmFfbThDdUQ3REhLX3NxT2tuZ3IteTlBM001TU9UZmR3c2Fma1F1Wkc2cnd5Ulg3MjE2alUwbjFncm5YaXlpRDdQcGdPajIwWHhiWEJCbGJMWmU3bnPSAewBQVVfeXFMUFJDc1lVaGYyd0E3Y3BWUzBWOUlEQkJPYldCejhHelZ6MXIxVlhkWGpnanQ2eVlGenMtdnJJMzUtR2VlV3RaZ1ZFeTFYemhEcXgzcXVzdW1vQ1hqb2JuT1djSWlQZUlNeFR4b1JIdHF0X2NUMGt3SkpxNzVPUlFiQ3o0WmxmcWtrM0VodDJnME1yWW55U2prRzFQcTEzZG5hVHJWa3pObUZFSTI4QXBLNGs4N3NhR01rTHF6M3hvSHFYaDdLYkRTX0V2YnJBV001NE9aR1g1Vks4bWtfWFRoRDdCWFZJQ01vcE5pWUw?oc=5,Divya Bhaskar,2026-07-17T18:24:00+05:30,gu,Gujarat,Bharuch,"(તાપમાન OR ""તાપમાન વધ્યું"" OR ""પારો ચઢ્યો"" OR ""ડિગ્રી સેલ્સિયસ"" OR ""મહત્તમ તાપમાન"" OR ""વિક્રમી તાપમાન"") Gujarat","- Maximum Temperature Recorded At 34 Degrees Amidst Cloudy Weather In Bharuch
સામાન્ય તાપમાન પણ ગરમીની તીવ્રતા 40 ડિગ્રી જેવી અનુભવાઈ:ભરૂચમાં વાદળછાયા વાતાવરણ વચ્ચે મહત્તમ તાપમાન 34 ડિગ્રીએ નોંધાયું
- કૉપી લિંક
ભરૂચ જિલ્લામાં ચોમાસાની સીઝન વચ્ચે આજે વાતાવરણમાં મિશ્ર પ્રતિક્રિયા જોવા મળી છે. આજે સવારથી જ આકાશમાં વાદળછાયું વાતાવરણ રહ્યું હતું, પરંતુ વરસાદના અભાવે અને હવામાં ભેજનું પ્રમાણ વધુ હોવાને કારણે નાગરિકોએ અસહ્ય ઉકળાટ અને બફારાનો સામનો કરવો પડ્યો છે.
સ્થાનિક હવામાન વિભાગના સત્તાવાર આંકડાઓ મુજબ, આજે ભરૂચનું મહત્તમ તાપમાન 34 ડિગ્રી અને લઘુત્તમ તાપમાન 28 ડિગ્રી નોંધાયું છે. જોકે, હવામાં ભેજનું પ્રમાણ આશરે 62% થી 64% જેટલું ઊંચું રહેવાને કારણે સામાન્ય તાપમાન પણ ગરમીની તીવ્રતા 40 ડિગ્રી જેવી અનુભવાઈ હતી.
દિવસ દરમિયાન દક્ષિણ-પશ્ચિમ દિશામાંથી ફૂંકાયેલા પવનની સરેરાશ ગતિ 18 કિલોમીટર પ્રતિ કલાક નોંધાઈ હતી. પવનની ગતિ સારી હોવા છતાં વાદળોના કારણે સૂર્યપ્રકાશ ઓછો હતો, પણ ઉકળાટથી બચવા લોકોએ એસી અને કુલરનો સહારો લેવો પડ્યો હતો.
પવનની ગતિ સારી હોવા છતાં વાદળોના કારણે સૂર્યપ્રકાશ ઓછો હતો, પણ ઉકળાટથી બચવા લોકોએ એસી અને કુલરનો સહારો લેવો પડ્યો હતો. વરસાદની લાંબી ખેંચ અથવા વિરામને કારણે વાતાવરણમાં ગુમસુમ અજંપો જોવા મળી રહ્યો છે અને લોકો હવે સારા વરસાદી ઝાપટાંની રાહ જોઈ રહ્યા છે જેથી આ અસહ્ય ગરમીથી રાહત મળી શકે છે.",1.0
