title,url,source,date,language,state,district,search_term,full_text,relevance_score
"Andhra Pradesh, Telangana Weather LATEST Update: IMD Issues Heatwave Warning as Temperatures Soar Across States - Asianet Newsable",https://news.google.com/rss/articles/CBMi6gFBVV95cUxQcnMzZm5xQlJQa3BFTWVQVFpSRUpKcEhCVDVfM1g1LUVleXJuUjduOEFZU0RSM0g1aGZqallmcVFTYmFxRjhubFhYRVk0WjZzM1VrSmhHZzEzNTNqOGNrT004ZnB1VlBaeDVWb3U2Vk5pZTBnR2puZzVNWHhpNUtZZkpkOGpKdDRaOG8wM291bWM5UzRGbXJsdVlMNUhTU21EQWM3bUlscWQ2NkoxYUhXSkI2Z3lpOW9zdjEwZGpHWG1oZGZoN1BaMHJFNFNpMjB2OUZmZkdQR2xXYXJUa1dWWXhuVWtyX001aWfSAe8BQVVfeXFMT2NSWTJCVWVoZTU0ZTZWbnlsd040bHI0TnR1bHpmTGE0VmtRdlY2dXBSR2tnUWdVR0VTaGFiSkxHVERmUGh0bmhxM2RSdHoyRTFKandUakV5clYyclFPU3Z1TXBTYnIxNGtXNmd3YV9jWDFuN3d3cndDTHNCNi1pWWJnVnFfRTdXclpJTEcwcTE0Q3l0dGREZ3FyQU9Fa01FVVptenBCWDJINWwtVEE1aU02OEVleXd5OVFkV3h1dWtiN2NmQ2lvdGt2SDc3bFB5ajUwVXRnRTZPRmwxQV82OVlQS3Q2OXhzTXZyQVF4eWM?oc=5,Asianet Newsable,2026-05-21T08:22:21+05:30,en,Andhra Pradesh,Guntur,"""heatwave"" Andhra Pradesh","Andhra Pradesh, Telangana Weather LATEST Update: IMD Issues Heatwave Warning as Temperatures Soar Across States
Andhra Pradesh Weather LATEST Update: Andhra Pradesh continues to reel under an intense heatwave as temperatures soar beyond 47°C in several districts. The IMD has warned that severe hot winds and extreme heat conditions may persist till May 24
Andhra Pradesh Reels Under Extreme Heatwave
Andhra Pradesh has been witnessing relentless heatwave conditions, with temperatures rising sharply across coastal Andhra and Rayalaseema regions. The India Meteorological Department (IMD) warned that severe hot winds are likely to continue in many parts of the state until May 24.
On Wednesday, Palnadu district’s Piduguralla recorded the highest temperature of the season at a scorching 47.6 degrees Celsius. Several other areas also experienced extreme heat. Kankipadu in Krishna district and Nandanamarella in Markapuram district registered 46.1 degrees Celsius, while Tanuku touched 46 degrees Celsius.
Officials from the State Disaster Management Authority urged residents to remain cautious and avoid unnecessary exposure to the sun as the heat intensity is expected to continue over the next few days.
Multiple Districts Expected to Cross 45°C
Weather officials predict temperatures between 45°C and 47°C in districts including Parvathipuram Manyam, Alluri Sitarama Raju, Polavaram, Anakapalli, Kakinada, Dr BR Ambedkar Konaseema, Krishna, NTR, Guntur, Bapatla, Palnadu, and Prakasam.
Temperatures in Vizianagaram and Markapuram are expected to remain between 44°C and 45°C, while Srikakulam, Visakhapatnam, Nellore, and Rayalaseema districts may witness temperatures ranging from 40°C to 43°C.
Authorities also warned that severe heatwave conditions may impact 74 mandals today, while another 232 mandals are likely to experience heatwave conditions. By Friday, severe heatwave conditions may affect 24 mandals, while 270 mandals are expected to remain under heatwave impact.
Monsoon Activity Gains Momentum Over Arabian Sea
In Telangana too, temperatures remained alarmingly high. Nirmal recorded 46.5°C, Hanamkonda 46.4°C, Jagityal 46.3°C, and Adilabad 46.2°C.
Meanwhile, meteorologists noted the formation of an upper-air cyclonic circulation over the Arabian Sea. The weather system currently extends across Lakshadweep, coastal Andhra Pradesh, Kerala, Karnataka, and Rayalaseema at an altitude of 3.1 km to 5.8 km above sea level.
The southwest monsoon is also gradually becoming active. Weather experts expect the monsoon to reach Kerala by May 26, which could eventually bring some relief from the ongoing heatwave conditions across southern India.
Stay updated with the Breaking News Today and Latest News from across India and around the world. Get real-time updates, in-depth analysis, and comprehensive coverage of India News, World News, Indian Defence News, Kerala News, and Karnataka News. From politics to current affairs, follow every major story as it unfolds. Get real-time updates from IMDon major cities weather forecasts, including Rain alerts, Cyclonewarnings, and temperature trends. Download the Asianet News Official App from the Android Play Store and iPhone App Store for accurate and timely news updates anytime, anywhere.",1.0
