title,url,source,date,language,state,district,search_term,full_text,relevance_score
"भीषण गर्मी का सितम जारी, तापमान 42 के पार - Hindustan Hindi News",https://news.google.com/rss/articles/CBMi2AFBVV95cUxNSG9yNjV4NGxyLTJqbVRDZ2wwQktLQ25vbVF3NkgweThfYy1DejV3M3F3S1ZYbzBnR3VXbkUtNVFjeXNsdjFEejBqSXVHUmVXTXFCYnNQSzFodk1zNW5jWXFyaHljLTYwOUFPQ3g5YTJKUzRjVWtabk1mdWJQdjVpYk10SXNHUHd2NmFBbERpd2VGSnROTE1oZjk2SDFkWWJDZjlTdnhkMlp1cXUxOXNIVDl4SGFhYmxzVnd1VGRjM2dMZEJuNXpnVTdSdjZ1NkhaajMzUzZucWnSAd4BQVVfeXFMTnNvaHFsUmh2a0FMVENrTkZqS1hsNi1oZ2t2NG16OExobWNwbmRxdUtuWTg3TEJhSEt2SU1mMmhILVUyOVBUS0c4eEw3MWJkSXJjMlVEYmVfM1BpcmxmX1l2ZVFoYm1jRFhmMVJ3Q25mRWo2Z0pNdW9Kdi13aEVnbVhPenZxY3lBb05ZMktfSXJMNjZQSUtPMVpHUVBZNHhwVDNFR0RENnZWUFpIVUdqWjBONndJZDBMUFF5RjNSeVFUVmlDb20zZ0xhd0F0Y3YtOUg4QW5XYkZGY2xFdC1n?oc=5,Hindustan Hindi News,2026-05-24T02:31:16+05:30,hi,Haryana,,"(लू OR ""लू चलना"" OR ""भीषण गर्मी"" OR ""प्रचंड गर्मी"" OR ""कड़ी धूप"" OR ""तेज धूप"" OR ""गर्म हवा"" OR ""उष्ण लहर"" OR ""ताप लहर"" OR ""हीट वेव"" OR ""झुलसाने वाली गर्मी"" OR ""तपती गर्मी"" OR ""भयंकर गर्मी"" OR ""गर्मी का कहर"" OR ""गर्मी का प्रकोप"" OR ""अत्यधिक गर्मी"" OR मौसम OR ""मौसम अपडेट"" OR ""मौसम का हाल"" OR ""मौसम पूर्वानुमान"" OR ""मौसम अलर्ट"" OR आईएमडी OR ""आईएमडी पूर्वानुमान"" OR ""आईएमडी अलर्ट"" OR ""तापमान में बढ़ोतरी"" OR ""गर्मी से राहत"" OR ""गर्मी से निजात"") Haryana","Basti News - बस्ती जिले में शनिवार को तेज धूप और लू के कारण लोग परेशान हो गए। तापमान 42.5 डिग्री सेल्सियस तक पहुँच गया, जो सामान्य से चार डिग्री अधिक है। बाजार सूने हो गए और लोग गर्मी से बचने के लिए घरों से बाहर कम निकले। मौसम विभाग ने शुष्क मौसम और उष्ण लू की संभावना जताई है।
बस्ती, निज संवाददाता जिले में शनिवार को तेज धूप, उमस और लू के थपेड़ों ने लोगों को बेहाल कर दिया। तापमान में करीब दो डिग्री की बढ़ोतरी दर्ज होने से गर्मी का असर और अधिक बढ़ गया। सुबह से ही आसमान से आग बरसती रही और दोपहर होते-होते सड़कें व बाजार सूने नजर आने लगे।
भीषण गर्मी के चलते लोग बेहद जरूरी काम होने पर ही घरों से बाहर निकले। शनिवार को जिले का अधिकतम तापमान 42.5 डिग्री सेल्सियस दर्ज किया गया, जो सामान्य से चार डिग्री अधिक रहा, जबकि न्यूनतम तापमान 27 डिग्री सेल्सियस रहा, जो सामान्य से 2.5 डिग्री अधिक है। मई माह में ही जून जैसी झुलसाने वाली गर्मी से जनजीवन प्रभावित हो रहा है। दोपहर के समय चल रही गर्म हवाओं ने लोगों की परेशानी और बढ़ा दी।
गर्मी का असर शहर के प्रमुख बाजारों में भी साफ दिखाई दिया। कंपनीबाग, गांधीनगर, रोडवेज, पुरानी बस्ती, मंगल बाजार, रौता चौराहा और कटरा चौराहा समेत कई इलाकों में दोपहर के समय सन्नाटा पसरा रहा। बाजारों में ग्राहकों की आवाजाही कम होने से कारोबार भी प्रभावित हुआ। तेज धूप से बचने के लिए लोग सिर पर गमछा, छाता और चश्मा लगाकर घरों से निकले, जबकि युवतियां स्टॉल और छाते का सहारा लेती दिखीं। कंपनीबाग क्षेत्र में दिहाड़ी मजदूर हैंडपंप से पानी पीकर राहत पाने की कोशिश करते नजर आए। वहीं, गर्मी से बचने के लिए पशु भी छांव की तलाश में इधर-उधर भटकते दिखाई दिए।
स्विमिंग पूल में भीड़
कटेश्वर पार्क स्थित स्विमिंग पूल में बच्चों और बड़ों की भीड़ उमड़ी रही। लोग पानी में नहाकर गर्मी से राहत पाने का प्रयास करते दिखे। मौसम विभाग के अनुसार जिले में अधिकतम सापेक्षिक आर्द्रता 80 प्रतिशत और न्यूनतम 41 प्रतिशत दर्ज की गई। हवा की रफ्तार 3.2 किलोमीटर प्रति घंटा रही तथा दिशा दक्षिण-पश्चिमी रही। पूर्वी यूपी में मौसम शुष्क बने रहने की संभावना है। अधिकांश स्थानों पर उष्ण लू चल सकती है। पश्चिमी एवं पूर्वी दिशा से सामान्य गति से हवाएं चलेंगी और औसत तापमान सामान्य से 3 से 4 डिग्री सेल्सियस अधिक रहने का अनुमान है।
सामान्य प्रश्न
✦बस्ती में शनिवार को अधिकतम तापमान कितना था?−
शनिवार को जिले का अधिकतम तापमान 42.5 डिग्री सेल्सियस दर्ज किया गया।
✦मौसम विभाग के अनुसार जिले में आर्द्रता का स्तर कितना था?+",1.0
"जलवायु परिवर्तन और गर्मी ने उड़ाई नींद: डिहाइड्रेशन के बढ़े मरीज, सूरज ढलने के बाद भी नहीं मिल रही राहत - Amar Ujala",https://news.google.com/rss/articles/CBMi8gFBVV95cUxNVHRIazM1Y29ENFhtUkszU2dyeXFERWtwNmUzWnNjTHNvSGtwSnA2QkdWa2U2TXlwUzdqRm9pc0ZvNkFkZ210ajRfdFlGN3pBM0ZOVUVhS0FyV3kwVmoyTFc2cXVsdi1JcFNDc2h1a1liQ2xXUm5zbWJlcDVleVpBZHNkTGs2MTdfUXVDTUVBSWtUT2VJNUdhSHZuMDBuWVFaMXFRR0kybENzdGZDOHR2djNVYy1SRDA2T1FJTVh1c0hvUXFSNU1WYXFScU5Ga0tKb0psb2FCSDJLY2p3cTlZOFozWGtXaklRLWVGSDg3UzNUZ9IB4wFBVV95cUxPOWN5ZWFUWjBCNUR1OTV2YTEybkEwaFZ0TTdoOERfUXZVU3djZU1Fb1ZwQkV4eG56Z1pSSXBhWlVHeVdRTXlXbmhweElsSzlieFkyMmxLU3hFVFYyWTRLSW1ZMklZLXJTaWJTbUJLcmNKSkwxZWlwUUdHRGZfdkJiM2RkaXlzYnRiVVJXaTdhMWsxUk5RY3UzVzZNczZEckpmbkNOR3M4MHZ0aG52RXI2eUhfakVwUjBYQXJqUFk4Zk1mOE11akU0MTlvLVpKTVA1LTYyWTlHZGpFdWJaUXdfNmdqZw?oc=5,Amar Ujala,2026-05-24T06:18:47+05:30,hi,Haryana,,"(सूर्याघात OR तापाघात OR ""लू लगना"" OR ""लू से मौत"" OR ""गर्मी से मौत"" OR ""हीट स्ट्रोक"" OR ""सन स्ट्रोक"" OR ""लू से मरे"" OR निर्जलीकरण OR डिहाइड्रेशन OR ""अस्पताल में भर्ती"" OR ""गर्मी से बेहाल"" OR ""गर्मी से त्राहि-त्राहि"") Haryana","{""_id"":""6a124ae8ef5040a1000aaad3"",""slug"":""climate-change-heat-cause-sleepless-nights-surge-in-dehydration-cases-no-relief-even-after-sunset-2026-05-24"",""type"":""story"",""status"":""publish"",""title_hn"":""जलवायु परिवर्तन और गर्मी ने उड़ाई नींद: डिहाइड्रेशन के बढ़े मरीज, सूरज ढलने के बाद भी नहीं मिल रही राहत"",""category"":{""title"":""India News"",""title_hn"":""देश"",""slug"":""india-news""}}
न्यूज डेस्क, अमर उजाला, नई दिल्ली
Published by: हिमांशु सिंह चंदेल
Updated Sun, 24 May 2026 06:18 AM IST
विज्ञापन
सार
खबरें लगातार पढ़ने के लिए अमर उजाला एप डाउनलोड करें
या
वेबसाइट पर पढ़ना जारी रखने के लिए वीडियो विज्ञापन देखें
अगर आपके पास प्रीमियम मेंबरशिप है तो
विज्ञापन
विस्तार
भारत में गर्मी अब केवल दोपहर की झुलसाती धूप तक सीमित नहीं रही। हालात ऐसे हो चुके हैं कि दिन में लू लोगों को झुलसा रही है, तो रात में भी तापमान और उमस शरीर को ठंडा नहीं होने दे रहे। पंखे और कूलर के बावजूद लोगों की नींद टूट रही है, जबकि अस्पतालों में हीट स्ट्रेस और डिहाइड्रेशन के मरीज बढ़ रहे हैं। शहर धीरे-धीरे ऐसे हीट ट्रैप में बदलते जा रहे हैं, जहां सूरज ढलने के बाद भी राहत नहीं मिलती।
क्लाइमेट ट्रेंड्स की नई रिपोर्ट व्हाई इंडियाज हीटवेव्स फील मोर ब्रूटल दैन बिफोर ने चेताया है कि जलवायु परिवर्तन, बढ़ती नमी, सूखी मिट्टी और बेतरतीब शहरीकरण मिलकर भारत की गर्मियों को पहले से कहीं ज्यादा लंबा, दमघोंटू और खतरनाक बना रहे हैं। देश इस समय भीषण गर्मी की चपेट में है। उत्तर प्रदेश के बांदा में तापमान 48 डिग्री सेल्सियस तक पहुंच चुका है, जबकि राजस्थान, दिल्ली, मध्य प्रदेश, बिहार, झारखंड और पश्चिम बंगाल समेत कई राज्यों में दिन और रात दोनों असामान्य रूप से गर्म बने हुए हैं।
हर दस साल में 0.21 डिग्री सेल्सियस बढ़ रहा तापमान
कई शहरों में रात का तापमान 30 डिग्री सेल्सियस के करीब दर्ज हो रहा है। इसका मतलब यह है कि सूर्यास्त के बाद भी शरीर को ठंडक नहीं मिल पा रही। क्लाइमेट ट्रेंड्स की रिपोर्ट के अनुसार 2010 से 2024 के बीच भारत में रात के औसत न्यूनतम तापमान में हर दशक करीब 0.21 डिग्री सेल्सियस की वृद्धि दर्ज की गई है। देश के 36 राज्यों और केंद्र शासित प्रदेशों में से 35 में रातें लगातार गर्म होती जा रही हैं।
विज्ञापन
शरीर को ठंडक मिलना जरूरी,1961 के बाद से लगातार बढ़ रही लू की अवधि
विशेषज्ञों के मुताबिक जब रात में शरीर को ठंडा होने का पर्याप्त समय नहीं मिलता, तो हीट स्ट्रेस का खतरा कई गुना बढ़ जाता है। इसका सबसे ज्यादा असर मजदूरों, बुजुर्गों, बच्चों और झुग्गी- झोपड़ियों में रहने वाले लोगों पर पड़ रहा है। रिपोर्ट में भारत के कोर हीटवेव जोन को सबसे ज्यादा संवेदनशील बताया गया है। इसमें राजस्थान, दिल्ली, यूपी, मध्य प्रदेश, छत्तीसगढ़, बिहार, ओडिशा, तेलंगाना, बंगाल और महाराष्ट्र के कुछ हिस्से शामिल हैं। 1961 के बाद से इन इलाकों में लू की अवधि और आवृत्ति दोनों में लगातार बढ़ोतरी हुई है।
क्लाइमेट ट्रेंड्स की नई रिपोर्ट व्हाई इंडियाज हीटवेव्स फील मोर ब्रूटल दैन बिफोर ने चेताया है कि जलवायु परिवर्तन, बढ़ती नमी, सूखी मिट्टी और बेतरतीब शहरीकरण मिलकर भारत की गर्मियों को पहले से कहीं ज्यादा लंबा, दमघोंटू और खतरनाक बना रहे हैं। देश इस समय भीषण गर्मी की चपेट में है। उत्तर प्रदेश के बांदा में तापमान 48 डिग्री सेल्सियस तक पहुंच चुका है, जबकि राजस्थान, दिल्ली, मध्य प्रदेश, बिहार, झारखंड और पश्चिम बंगाल समेत कई राज्यों में दिन और रात दोनों असामान्य रूप से गर्म बने हुए हैं।
विज्ञापन
विज्ञापन
हर दस साल में 0.21 डिग्री सेल्सियस बढ़ रहा तापमान
कई शहरों में रात का तापमान 30 डिग्री सेल्सियस के करीब दर्ज हो रहा है। इसका मतलब यह है कि सूर्यास्त के बाद भी शरीर को ठंडक नहीं मिल पा रही। क्लाइमेट ट्रेंड्स की रिपोर्ट के अनुसार 2010 से 2024 के बीच भारत में रात के औसत न्यूनतम तापमान में हर दशक करीब 0.21 डिग्री सेल्सियस की वृद्धि दर्ज की गई है। देश के 36 राज्यों और केंद्र शासित प्रदेशों में से 35 में रातें लगातार गर्म होती जा रही हैं।
Trending Videos
शरीर को ठंडक मिलना जरूरी,1961 के बाद से लगातार बढ़ रही लू की अवधि
विशेषज्ञों के मुताबिक जब रात में शरीर को ठंडा होने का पर्याप्त समय नहीं मिलता, तो हीट स्ट्रेस का खतरा कई गुना बढ़ जाता है। इसका सबसे ज्यादा असर मजदूरों, बुजुर्गों, बच्चों और झुग्गी- झोपड़ियों में रहने वाले लोगों पर पड़ रहा है। रिपोर्ट में भारत के कोर हीटवेव जोन को सबसे ज्यादा संवेदनशील बताया गया है। इसमें राजस्थान, दिल्ली, यूपी, मध्य प्रदेश, छत्तीसगढ़, बिहार, ओडिशा, तेलंगाना, बंगाल और महाराष्ट्र के कुछ हिस्से शामिल हैं। 1961 के बाद से इन इलाकों में लू की अवधि और आवृत्ति दोनों में लगातार बढ़ोतरी हुई है।",1.0
