title,url,source,date,language,state,district,search_term,full_text,relevance_score
"दिल्ली, पंजाब और हरियाणा में लू का प्रकोप : तापमान में होगी 4 डिग्री तक बढ़ोतरी, किसानों को सिंचाई की सलाह... - Gaon Junction",https://news.google.com/rss/articles/CBMi5AFBVV95cUxPdFBKVHp1VVNtckV2TmJoOEtxYWJ5aC0wYmwyc2ZudU1hYVVRN1c1Q3dmVjA4QUZ0M19IaVNxNVFXNXdMdTYtVTZEQ2lQbWxlZ2xxWEM2bXJmNndfX1RCcjVNUFQ1bXV1NG82QlhOQzQwazFuN0FEUFVYV2syRUxuZmpfSWZfOGJlOTJpOWp2ZVNYMEdWdVNsbkkyWnZ1ZXl5a3pkWlpoeEJRbXNPR1ZfMjVmd3pGVHlHZXV6dEtWUTlEcmJJNWVJWUpydkEyOUcwaUdwMzRsZ015by1uRHlkOGpscGE?oc=5,Gaon Junction,2026-05-24T08:14:02+05:30,hi,Haryana,,"""लू"" Haryana","Home›Khabar Junction›
Heat Wave In Delhi Punjab And Haryana Temperatures To Rise By Up To 4 Degrees Farmers Advised To Irrigate
दिल्ली, पंजाब और हरियाणा में लू का प्रकोप : तापमान में होगी 4 डिग्री तक बढ़ोतरी, किसानों को सिंचाई की सलाह...
गांव जंक्शन डेस्क, नई दिल्लीDevesh Saraswat
Updated Sun, 24 May 2026 08:14 AM IST
सार
पंजाब, हरियाणा, दिल्ली और उत्तर प्रदेश सहित उत्तर भारत के कई हिस्सों में अगले कुछ दिनों तक लू चलने और तापमान में बढ़ोतरी की संभावना है, जबकि कुछ पहाड़ी इलाकों में बारिश की चेतावनी दी गई है।
जानें देश के मौसम का हाल।
- फोटो : AI Image
Link Copied
विज्ञापन
विस्तार
24 मई से 29 मई के दौरान उत्तर भारत के मैदानी इलाकों में लू (हीट वेव) की स्थिति बने रहने की संभावना है। पंजाब, हरियाणा, चंडीगढ़ और दिल्ली में 24 मई से 29 मई के बीच लू की स्थिति बनी रह सकती है, जबकि 24 से 27 मई के दौरान कुछ स्थानों पर भीषण लू चलने के आसार हैं।
लू और तापमान का हाल
उत्तर प्रदेश और राजस्थान में भी 24 से 29 मई के दौरान लू चलने की प्रबल संभावना है। पश्चिमी राजस्थान के कुछ हिस्सों में 24 से 29 मई के बीच भीषण लू का अलर्ट जारी किया गया है। इसके अलावा, पश्चिमी उत्तर प्रदेश में 23 और 24 मई को हल्की बारिश के बाद गर्मी का असर बढ़ सकता है। उत्तर भारत के मैदानी इलाकों में तापमान में 2 से 4 डिग्री सेल्सियस तक की बढ़ोतरी देखी जा सकती है।
पहाड़ी और अन्य राज्यों में बारिश के आसार
लू के प्रकोप के बीच, उत्तर भारत के कुछ पर्वतीय राज्यों में राहत की उम्मीद है। जम्मू-कश्मीर में 23 से 25 मई तक बारिश और तेज हवाओं का पूर्वानुमान है। वहीं, हिमाचल प्रदेश में 23 और 29 मई को बारिश की संभावना जताई गई है, साथ ही 29 मई को ओलावृष्टि (हैलस्टॉर्म) की चेतावनी भी दी गई है। उत्तराखंड में 23 और 25 मई को हल्की से मध्यम बारिश हो सकती है। पंजाब, हरियाणा और चंडीगढ़ में 28 और 29 मई को हल्की बारिश होने के आसार हैं।
किसानों के लिए सलाह
कृषि विशेषज्ञों ने किसानों को सलाह दी है कि गर्मी के असर को कम करने के लिए फसलों में हल्की और नियमित सिंचाई करते रहें। पंजाब में सब्जियों, फलों के बगीचों और प्याज की नर्सरी में सिंचाई करने के निर्देश दिए गए हैं। वहीं, हरियाणा के किसानों को गन्ना और गर्मियों की चारे वाली फसलों में सिंचाई बनाए रखने और मल्चिंग जैसी नमी संरक्षण तकनीकें अपनाने की सलाह दी गई है।
प्रशासन ने लू को देखते हुए लोगों को विशेष सावधानी बरतने को कहा है। अत्यधिक गर्मी के दौरान बाहर निकलने से बचने, पर्याप्त मात्रा में पानी पीने और खुद को हाइड्रेटेड रखने की सलाह दी गई है। बुजुर्गों, बच्चों और पुरानी बीमारियों से जूझ रहे लोगों का विशेष ध्यान रखने को कहा गया है।
हम डाटा संग्रह टूल्स, जैसे की कुकीज के माध्यम से आपकी जानकारी एकत्र करते हैं ताकि आपको बेहतर और व्यक्तिगत अनुभव प्रदान कर सकें और लक्षित विज्ञापन पेश कर सकें। अगर आप साइन-अप करते हैं, तो हम आपका ईमेल पता, फोन नंबर और अन्य विवरण पूरी तरह सुरक्षित तरीके से स्टोर करते हैं। आप कुकीज नीति पृष्ठ से अपनी कुकीज हटा सकते है और रजिस्टर्ड यूजर अपने प्रोफाइल पेज से अपना व्यक्तिगत डाटा हटा या एक्सपोर्ट कर सकते हैं। हमारी Cookies Policy, Privacy Policy और Terms & Conditions के बारे में पढ़ें और अपनी सहमति देने के लिए Agree पर क्लिक करें।",1.0
"Haryana Weather: हरियाणा पर राजस्थान का असर और IMD का अलर्ट जारी, आसमान से बरसेगी आग! जानें ताजा अपडेट - Zee News",https://news.google.com/rss/articles/CBMilwJBVV95cUxNWFUzWG1KZ1d1bjVxTHFqXzRzOEw5cEExRVlvTjgweDhkVEkzSWFZZ1R2TGFOQjNIaXJuYU1LTVZfcFU3RXVSay1VRHU2bUJZMGxpdXE1U0VodENKZ2MwX0Z1VG5pZW5EalMwLVd6dDEtdUpPb2RMdzlKdXRtaUs3WFlFX0dMR2ZZdk14aWtnaGpqRDA1YjdaZmVjQnpQcVo3N2NJajZlUFA3Y2YxRldwUlY1ZGQ3czJ2bFZtLXVXMFN5R0Q1UjA5cUhTYWljTWtKa3NNc1hTUkh4LTAyS09ndWVHNXJ0blBUX3lrRjdpZVN4V1NscGVSSzFobXpzbi1IUURJbzNnY0FsaHB5NzdWZUtCUk5XZ0k?oc=5,Zee News,2026-05-24T02:33:49+05:30,hi,Haryana,,"""लू"" Haryana","Haryana Weather Update: हरियाणा में मौसम लगातार करवट ले रहा है. ताजा मामले में गर्मी बढ़ने और लू-हीटवेव चलने की अलर्ट जारी हुआ है. ऐसे में आने वाले दिनों में हरियाणा में मौसम हाल कैसा रहने वाला है, आइए जानते हैं.
मौसम विभाग के अनुसार पूरे स्पताह हरियाणा में तेज धूप, लू और तापमान में लगातार बढ़ोतरी देखने को मिल सकती है. खासकर दक्षिण और पश्चिमी हरियाणा के जिलों में हीटवेव का असर ज्यादा रहने की संभावना है. IMD के अनुसार, राजस्थान सीमा के साथ सिरसा, फतेहाबाद, हिसार, भिवानी, चरखी दादरी और महेंद्रगढ़ जिलों में लू का अलर्ट जारी किया है. वहीं 19 मई को लू आधे हरियाणा कोअपनी चपेट में लेगी.
18 मई को तेज धूप और गर्म हवाओं के साथ होगी. हिसार, सिरसा, भिवानी और रोहतक जैसे इलाकों में तापमान 42 डिग्री सेल्सियस तक पहुंच सकता है. दिन के समय लू चलने की संभावना है. 19 मई को सुबह से ही गर्मी का असर दिखेगा और दोपहर में तेज गर्म हवाएं लोगों की परेशानी बढ़ा सकती हैं. कई जिलों में तापमान सामान्य से 3 से 4 डिग्री अधिक रह सकता है.
20 मई को गर्मी और बढ़ने के आसार हैं. पश्चिमी और दक्षिणी हरियाणा में हीटवेव जैसी स्थिति बन सकती है. मौसम विभाग ने बुजुर्गों, बच्चों और बाहर काम करने वाले लोगों को सावधानी बरतने की सलाह दी है. 21 मई को सबसे गर्म दिन रह सकता है. कई शहरों में अधिकतम तापमान 42 से 44 डिग्री सेल्सियस तक पहुंचने का अनुमान है. आसमान साफ रहेगा और बारिश की कोई संभावना नहीं है.
22 मई को गर्मी से राहत मिलने के संकेत नहीं है. दोपहर के समय तेज धूप और गर्म हवाएं जारी रहेंगी. किसानो को सुबह या शाम के समय ही खेतों में सिंचाई करने की सलाह दी गई है.
23 मई को तापमान में हल्की गिरावट संभव है, लेकिन उमस और गर्म हवाएं बनी रह सकती है. कुछ इलाकों में शाम के समय हल्के बादल दिखाई दे सकते हैं, हालांकि बारिश की संभावना बेहद कम है.
24 मई को भी प्रदेश के ज्यादातर हिस्सों में मौसम गर्म और शुष्क बना रहेगा. दिन के समय बाहर निकलने वालों को धूप से बचाव करने और पर्याप्त पानी पीने की सलाह दी गई है.",1.0
