title,url,source,date,language,state,district,search_term,full_text,relevance_score
"सावधान! लू से सिर्फ डिहाइड्रेशन नहीं, सीधे दिमाग और आंखों पर हो रहा है हमला; डॉक्टर्स की चेतावनी - Jagran",https://news.google.com/rss/articles/CBMirgFBVV95cUxPWWpraEZCU2dJUmdhWWMxWHh5bWt0djNaVlIzbmhBZGMyMXJIaml4blBBU3I1cXhwNW1GWGhESEhQRWFWSWJwOG0wRWt0RlJsNFgwNU9qU1JIQ1FkRFdpam1MbzhEenc5N0Zob09JUG1fOG5tNXJfVXhFQXZ2bUVNS0RPeVpMVjRPeGtOcG9ySTFBTlp6VFJKRDIzeUlOb3BJNVhQbnJfV3dYaS0xR3c?oc=5,Jagran,2026-05-24T09:58:00+05:30,hi,Haryana,,"(सूर्याघात OR तापाघात OR ""लू लगना"" OR ""लू से मौत"" OR ""गर्मी से मौत"" OR ""हीट स्ट्रोक"" OR ""सन स्ट्रोक"" OR ""लू से मरे"" OR निर्जलीकरण OR डिहाइड्रेशन OR ""अस्पताल में भर्ती"" OR ""गर्मी से बेहाल"" OR ""गर्मी से त्राहि-त्राहि"") Haryana","सावधान! लू से सिर्फ डिहाइड्रेशन नहीं, सीधे दिमाग और आंखों पर हो रहा है हमला; डॉक्टर्स की चेतावनी
समय कम है?
जानिए मुख्य बातें और खबर का सार एक नजर में
(Image Source: AI-Generated)
विज्ञापन हटाएं सिर्फ खबर पढ़ें
Featured storyसावधान! लू से सिर्फ डिहाइड्रेशन नहीं, सीधे दिमाग और आंखों पर हो रहा है हमला; डॉक्टर्स की चेतावनी
डॉक्टरों ने चेतावनी दी है कि भीषण गर्मी से सिर्फ डिहाइड्रेशन ही नहीं, बल्कि दिमाग और आंखों पर भी नकारात्मक प्रभाव पड़ रहा है, खासकर बच्चों और बुजुर्गो ...और पढ़ें
समय कम है?
प्रेट्र, नई दिल्ली। देश के कई हिस्सों में भीषण गर्मी लगातार बढ़ रही है। ऐसे में डॉक्टरों ने चेतावनी दी है कि ज्यादा तापमान के प्रति लंबे समय तक संपर्क न केवल शारीरिक प्रतीकात्मक स्वास्थ्य को प्रभावित कर सकता है, बल्कि आंखों और तंत्रिका तंत्र के कार्यप्रणाली पर भी नकारात्मक प्रभाव डाल सकता है, विशेष रूप से बच्चों, बुजुर्गों और बीमार लोगों में। स्वास्थ्य विशेषज्ञों का कहना है कि बढ़ते तापमान, डिहाइड्रेशन और धूप के प्रति लंबे समय तक संपर्क शरीर के आंतरिक संतुलन को बिगाड़ सकता है।
यह कमजोर व्यक्तियों में थकान, चक्कर, गंभीर सिरदर्द, माइग्रेन, गर्मी से थकावट और यहां तक कि तंत्रिका संबंधी जटिलताओं को भी जन्म दे सकता है। डाक्टरों ने बताया कि एनसीआर के अस्पतालों में गर्मी से संबंधित बीमारियों की रिपोर्ट करने वाले मरीजों की संख्या में वृद्धि देखी जा रही है, जिसमें आंखों में जलन, डिहाइड्रेशन के कारण सिरदर्द और गर्मी से उत्पन्न तंत्रिका संबंधी लक्षण शामिल हैं।
ओपीडी मरीजों में लगभग 20 प्रतिशत की वृद्धि
दिल्ली के इंद्रप्रस्थ अपोलो अस्पताल ने न्यूरोलॉजी के सीनियर कंसल्टेंट डॉ. विनीत सूरी ने कहा कि लू अब सामान्य गर्मी से संबंधित बीमारियों से अलग प्रभाव दिखाने लगी है। ओपीडी में तंत्रिका संबंधी शिकायतों में वृद्धि हो रही है। इसमें अधिक लोग गंभीर सिरदर्द, चक्कर, भ्रम, बेहोशी, मौजूदा तंत्रिका संबंधी स्थितियों का बिगड़ना और विशेष रूप से माइग्रेन के बढ़ने जैसे लक्षणों के साथ आ रहे हैं।
डॉ. सूरी ने कहा कि तेज धूप में लंबे समय तक संपर्क में रहने के बाद कुछ व्यक्तियों में माइग्रेन बढ़ सकता है। उन्होंने स्पष्ट किया कि अत्यधिक गर्मी और डिहाइड्रेशन (पानी की कमी) दिमाग में रक्त प्रवाह को प्रभावित कर सकता है, इलेक्ट्रोलाइट संतुलन को बदल सकता है और तंत्रिका तंत्र पर तनाव डाल सकता है, विशेष रूप से कमजोर व्यक्तियों में। जैसे इसके लक्षणों में लगातार भ्रम, बोलने में कठिनाई, असामान्य नींद, दौरे या बेहोशी शामिल हैं। इन्हें नजरअंदाज नहीं किया जाना चाहिए, क्योंकि ये गंभीर तंत्रिका की आपात स्थिति का संकेत दे सकते हैं और तत्काल ध्यान देने की आवश्यकता हो सकती है।
खबरें और भी
दोपहर में बाहर निकलने से बचें
मारेंगो एशिया अस्पतालों में न्यूरोलाजी विभाग की निदेशक डॉ. सुषमा शर्मा ने कहा कि माइग्रेन, मिर्गी और अन्य तंत्रिका संबंधी विकारों से पीड़ित लोग अत्यधिक गर्मी और गर्म रातों और बिजली कटौती के कारण खराब नींद के दौरान लक्षणों के बिगड़ने का सामना कर सकते हैं। डॉ. शर्मा ने कहा कि अत्यधिक गर्मी के दौरान जब भी संभव हो, दोपहर के पीक समय में बाहर जाने से बचना महत्वपूर्ण है।
यदि बाहर जाना आवश्यक है, तो लोगों को छाता, धूप का चश्मा और सिर को ढकने के लिए सावधानी बरतनी चाहिए गर्म मौसम में पानी पीते रहना भी उतना ही महत्वपूर्ण है क्योंकि अत्यधिक पसीने के कारण डिहाइड्रेशन भी भ्रम और तंत्रिका संबंधी जटिलताओं का कारण बन सकता है। उन्होंने लोगों को अत्यधिक पसीने के कारण तरल पदार्थ की हानि की भरपाई के लिए नारियल पानी, छाछ और ताजे फलों के जूस जैसे प्राकृतिक इलेक्ट्रोलाइट युक्त पेय पदार्थों का सेवन करने की सलाह दी। यह मौसम आंखों में जलन और संक्रमण के जोखिम बढ़ा देता है।
आंखों में सूखापन, जलन, लालिमा और तनाव का बढ़ना
वियान आई और रेटिना सेंटर की निदेशक डॉ. नीरज संधुजा ने कहा कि धूप, गर्म हवाओं, धूल और डिहाइड्रेशन से आमतौर पर आंखों में तनाव और असुविधा होती है। गर्मी का मौसम आंखों के स्वास्थ्य को कई तरीकों से प्रभावित कर सकता है। तेज धूप, गर्म हवाओं, धूल और डिहाइड्रेशन के प्रति लंबे समय तक संपर्क से आंखों में सूखापन, जलन, लालिमा और तनाव हो सकता है। इस मौसम में कई लोगों को जलन, खुजली या पानी वाली आंखों का अनुभव होता है। हमें सूखी आंखों के सिंड्रोम, एलर्जिक कंजंक्टिवाइटिस और कॉर्नियल सनबर्न के मामले भी मिलते हैं।
जानिए मुख्य बातें और खबर का सार एक नजर में
संक्षेप में पढ़ें
(Image Source: AI-Generated)",1.0
"Haryana Weather Alert: हरियाणा में बढ़ेगा गर्मी का सितम, 11 जिलों में हीट वेव का अलर्ट जारी - Dainik Tribune",https://news.google.com/rss/articles/CBMivAFBVV95cUxOUmp5ZklKeEd2QjYzcnNSa1p5THBrelFKQVVSNW5XZFY0TDc5ME1PRmNlNnV5eTF6M1BCUDZZQ1NWdUw2NXhSa1V5aVYyQ1RtcXZKWWpVNHFrSUIxN0gxai1Yd0JNal9HSjFjc2tfU1UzMzNFQk1fanZvS3lXSHVSYURwajB3TTRPQmJvajNUUVgwb1dPRWk5WjhrT1lOVzkxaXhIaVVSaG5aT0JXZVhDSU1BaDN2dVNldDVHTQ?oc=5,Dainik Tribune,2026-05-24T10:40:07+05:30,hi,Haryana,,"(""हीट एक्शन प्लान"" OR ""गर्मी से राहत"" OR चेतावनी OR ""रेड अलर्ट"" OR ""ऑरेंज अलर्ट"" OR ""येलो अलर्ट"" OR एडवाइजरी OR ""राहत सामग्री"" OR ""राहत शिविर"" OR मुआवजा) Haryana","Haryana Weather Alert: हरियाणा में बढ़ेगा गर्मी का सितम, 11 जिलों में हीट वेव का अलर्ट जारी
Haryana Weather Alert: आईएमडी ने 25 से 27 मई तक कई जिलों में येलो और ऑरेंज अलर्ट किया जारी, 28-29 मई को बारिश और तेज हवाओं की संभावना
Haryana Weather Alert: हरियाणा में आने वाले दिनों में गर्मी और अधिक बढ़ने वाली है। भारतीय मौसम विज्ञान विभाग (आईएमडी) ने रविवार के लिए राज्य के 11 जिलों में हीट वेव का येलो अलर्ट जारी किया है। इनमें महेंद्रगढ़, रेवाड़ी, झज्जर, नूंह, पलवल, रोहतक, सिरसा, फतेहाबाद, हिसार, भिवानी और चरखी दादरी शामिल हैं।
मौसम विभाग के अनुसार 25 मई को इन 11 जिलों में हीट वेव का ऑरेंज अलर्ट रहेगा। वहीं अंबाला, कुरुक्षेत्र, कैथल, करनाल, गुरुग्राम, फरीदाबाद, सोनीपत, पानीपत और जींद में येलो अलर्ट जारी किया गया है।
आईएमडी ने बताया कि 26 मई को पंचकूला और यमुनानगर में येलो अलर्ट रहेगा, जबकि हरियाणा के बाकी 20 जिलों में ऑरेंज अलर्ट लागू होगा। 27 मई को पूरे हरियाणा में ऑरेंज हीट वेव अलर्ट जारी किया गया है।
मौसम विभाग के मुताबिक, पश्चिमी विक्षोभ के सक्रिय होने के कारण 28 और 29 मई को हरियाणा के कुछ हिस्सों में हल्की से मध्यम बारिश, गरज-चमक, बिजली गिरने और 40 से 50 किलोमीटर प्रति घंटे की रफ्तार से तेज हवाएं चलने की संभावना है।
शनिवार को प्रदेश में आंधी और गरज के कारण अधिकतम तापमान में औसतन 1.2 डिग्री सेल्सियस की गिरावट दर्ज की गई। इसके बावजूद अधिकांश जिलों में तापमान 40 डिग्री सेल्सियस से ऊपर बना रहा।
रोहतक प्रदेश का सबसे गर्म जिला रहा, जहां अधिकतम तापमान 44.1 डिग्री सेल्सियस दर्ज किया गया। इसके बाद सिरसा में 44 डिग्री, हिसार में 42.4 डिग्री और जींद में 42.1 डिग्री सेल्सियस तापमान रिकॉर्ड किया गया।
आईएमडी चंडीगढ़ के निदेशक सुरेंद्र पाल ने कहा कि 24 से 27 मई के बीच हरियाणा में अधिकतम तापमान में लगातार बढ़ोतरी होने की संभावना है।",1.0
"हरियाणा में 2 दिन बारिश की संभावना, तपती गर्मी से राहत की जगी उम्मीदें - Haryana E Khabar",https://news.google.com/rss/articles/CBMi3wFBVV95cUxORjNfR0ZUVkN4NVJxZXZhM3ZpMHJ2MVlYNlNmZmtoTlNKNzQxNDNvNFcxcUF4aGdQNUpOYlJjd09URHFsaWtLLUc5THcyQjZOblc0cG1oSENKZEZRWkVzUHptX3pLbWFWalR3dm5XSXpMOFNZR2V4cUJlZnFYejhpaXA5V1dLLXF6T1FWWXVJeThlTnUwcklMVzdqRUNfRlZnUVk3blRPWXp3ZmFDTHhLQjVHXzNCOTJGYzVwYlo2dmhia3JqTGJhSUVuQkVuQ0VPUVY1bmZFeGNRaXUwMnc0?oc=5,Haryana E Khabar,2026-05-24T08:36:04+05:30,hi,Haryana,,"(""हीट एक्शन प्लान"" OR ""गर्मी से राहत"" OR चेतावनी OR ""रेड अलर्ट"" OR ""ऑरेंज अलर्ट"" OR ""येलो अलर्ट"" OR एडवाइजरी OR ""राहत सामग्री"" OR ""राहत शिविर"" OR मुआवजा) Haryana","चंडीगढ़ | हरियाणा में गर्मी का सिलसिला लगातार जारी है. दोपहर के समय तेज धूप और गर्म हवाओं से लू लगने और डिहाइड्रेशन का खतरा बढ़ रहा है, जिसके प्रभाव से चक्कर, उल्टी, दस्त और बुखार जैसी समस्याएं आ रही है. मौसम विभाग ने चेतावनी जारी करते हुए कहा है कि कल से नौतपा शुरू होने वाला है, जिससे तापमान में ओर बढ़ोतरी देखने को मिलेगी, इसीलिए लोगों को दोपहर के समय घर पर रहने की सलाह दी गई है.
आज इन 11 जिलों में चलेगी लू
मौसम विभाग ने आज महेंद्रगढ़, मेवात, पलवल, रेवाड़ी, भिवानी, हिसार, चरखी दादरी, झज्जर, सिरसा और फतेहाबाद में लू चलने की संभावना जताई है. मौसम विभाग ने पर्याप्त पानी पीने और स्वास्थ्य के प्रति सचेत रहने की सलाह दी है. इस भयंकर गर्मी का असर इलेक्ट्रानिक आइटम पर भी पड़ रहा है. इस दौरान मोबाइल, लैपटॉप या पावर बैंक जल्दी गर्म हो रहे है, जिससे बैटरी डैमेज, लौ परफोर्मेंस या अचानक डिवाइस बंद होने जैसी समस्याएं आ रही है.
हरियाणा तापमान अपडेट
राज्य में कल कई जिलों में मौसम में बदलाव भी देखने को मिला है, जिसके चलते सिरसा, महेंद्रगढ़ व झज्जर जिलों में बारिश हुई और अन्य कई जिलों में बादल छाए रहे और तेज हवाएं भी चली. इससे लोगों को गर्मी से थोड़ी राहत मिली. वहीं राज्य में सबसे गर्म जिला रोहतक रहा, यहां का तापमान 45 डिग्री सेल्सियस दर्ज किया गया है. फरीदाबाद, फतेहाबाद, सिरसा और हिसार समेत कई जिलों में तापमान 44 डिग्री के आसपास दर्ज किया गया है.
आगे जाने मौसम का हाल
मौसम विशेषज्ञ डॉ. चंद्रमोहन के अनुसार राज्य में 24 मई से 27 मई तक मौसम शुष्क रहने की संभावना है. 26 मई और 27 मई को कई जिलों में हीटवेव की संभावना भी है. 28 मई और 29 मई को प्रदेश के कुछ स्थानों पर हल्की बारिश, गरज- चमक और 40 से 50 किलोमीटर प्रति घंटे की रफ्तार से तेज हवाएं चल सकती है. इसके बाद तापमान में हल्की गिरावट आ सकती है, इससे लोगों को भीषण गर्मी से थोड़ी राहत की संभावना है.",1.0
"हरियाणा में मौसम का U-Turn: पहले लू की चेतावनी, फिर बारिश...तेज हवाओं के साथ छाएगी काली घटा - Punjab Kesari",https://news.google.com/rss/articles/CBMiswFBVV95cUxNam9wdC01RUhVaWxXVHp4WXNPak5wcjc2cEJhQTEtZ3JSY3JnbXdrZVZMLWdtRm0wa0diQ3VRaGVMUThtbGM4c0xHeHdWMTFUOUFTRGJPaW9oalVYeXEyWFNWckpHV3RrbjdHeVpIa0xmSmpkRW9rQV84ak4xMlVmRk1wSTJOdTdGYkVSTjUwejZFOVQwdlQzRjdQN3dKN3pMSzB2MWljdTJmMVpJM2N3N0xfWdIBuAFBVV95cUxPVXhNMGdZVm5KTDNSMlV4aGZuOXRNRm9QOHRiS1dYS3YxSjhweEN2ZVc4M2o1LWZGZnRJbklsQWc3Q0htMmQ4NG1RU3kzZEJuOXlKOW9RUUxiWjJ1NjBsXy1IRDlDSUNlR1FPb3ZWSXR4VTY4RGdmNmNLWlB5QlBHaFRnakpWVEdIQTBDeFRiX3FWaHFCSjNlOVBCc0J0WkFycUw0dGdhNW1LdWNLUEplLXRnN1lmRTZM?oc=5,Punjab Kesari,2026-05-24T07:32:19+05:30,hi,Haryana,,"(""हीट एक्शन प्लान"" OR ""गर्मी से राहत"" OR चेतावनी OR ""रेड अलर्ट"" OR ""ऑरेंज अलर्ट"" OR ""येलो अलर्ट"" OR एडवाइजरी OR ""राहत सामग्री"" OR ""राहत शिविर"" OR मुआवजा) Haryana","हरियाणा में मौसम का U-Turn: पहले लू की चेतावनी, फिर बारिश...तेज हवाओं के साथ छाएगी काली घटा
punjabkesari.in Sunday, May 24, 2026 - 07:33 AM (IST)
हरियाणा डेस्क : हरियाणा में आने वाले दिनों में गर्मी फिर बढ़ जाएगी। प्रदेश में आज से 27 मई तक मौसम शुष्क रहने की संभावना है, जबकि 26 और 27 को कई जिलों में गंभीर हीटवेव चलने का अलर्ट जारी किया गया है। बीते दिन प्रदेश में कई जिलों में मौसम में बदलाव दिखा। सिरसा, महेंद्रगढ़ व झज्जर जिलों में बारिश हुई। वहीं अन्य कई जिलों में बादल छाए रहे।
मौसम विभाग के अनुसार 28 और 29 मई को प्रदेश के कुछ स्थानों पर हल्की बारिश, गरज-चमक और 40 से 50 किलोमीटर प्रति घंटे की रफ्तार से तेज हवा चल सकती हैं। हालांकि इन गतिविधियों के बावजूद अगले चार दिनों तक अधिकतम तापमान में 2 से 4 डिग्री सेल्सियस तक बढ़ोतरी होने की संभावना जताई गई है।
आज इन जिलों में चलेगी हीटवेव
राज्य के कई हिस्सों में तापमान 45°C पार पहुंच गया है। मौसम विभाग ने आज महेंद्रगढ़, रेवाड़ी, झज्जर, मेवात, पलवल, रोहतक, सिरसा, फतेहाबाद, हिसार, भिवानी और चरखी दादरी जिलों में हीटवेव चलने की संभावना जताई है। विभाग ने लोगों को दोपहर के समय धूप में बाहर निकलने से बचने, ज्यादा पानी पीने और बुजुर्गों व बच्चों का विशेष ध्यान रखने की सलाह दी है।
(पंजाब केसरी हरियाणा की खबरें अब क्लिक में Whatsapp एवं Telegram पर जुड़ने के लिए लाल रंग पर क्लिक करें)",1.0
