title,url,source,date,language,state,district,search_term,full_text,relevance_score
"Bihar Braces For Heatwave As Temperatures Near 40°C, IMD Issues Alert - Patna Press",https://news.google.com/rss/articles/CBMihwFBVV95cUxObERVYWRpMThra090RG05X2otRnZvWGlfMGxfbWNxUDVaLXJHdnJHOGxsblc5UVpJSnVSSExjV3QzdDFGSEJSRlZBX2RlZ0ZSdlQ3THpKbGJWY3JvbWt5N0R1TWhGUlFRNnBqbkpZbXhwN0VGN1RYZXhhV0NWWlF3Q216QXBHZnM?oc=5,Patna Press,2026-04-15T10:00:11+05:30,en,Bihar,Aurangabad,"""heatwave"" Bihar","Patna: Bihar is experiencing an early spell of intense summer heat, with temperatures already approaching 40°C in mid-April and conditions resembling peak June weather across several districts.
Dry westerly winds over the past few days have intensified the heat, turning large parts of the state into what residents describe as a furnace, particularly in South Bihar.
Temperatures spike across districts
The highest temperature so far this season was recorded at 39.9°C in Bhabhua, while minimum temperatures dipped to 16.4°C in Ziradei, highlighting a sharp day-night variation.
In cities such as Patna, streets have been seen thinning out by afternoon as residents avoid peak heat hours.
#अधिकतम #तापमान और #परिवर्तन पिछले 24 घंटा #बिहार जिलों से। pic.twitter.com/xbM6SWP7em
— Mausam Bihar- IMD Patna (@imd_patna) April 14, 2026
IMD warns of further rise
The India Meteorological Department has warned that maximum temperatures are likely to increase by another 1–3°C over the next three to four days.
With no rainfall expected until April 16, prolonged dry conditions are likely to persist, increasing the risk of heatwave-like situations during afternoon hours.
Limited relief expected
According to the forecast, only isolated light rainfall is expected on April 17 in parts of the Seemanchal region, including:
However, officials said the impact of this rainfall will be limited and unlikely to bring widespread relief.
Heatwave alert issued
From April 18 onwards, the intensity of heat is expected to increase further across South and Central Bihar.
A ‘yellow alert’ has been issued for districts including Patna, Gaya, Buxar, Rohtas and Aurangabad, where temperatures may cross 40°C, raising concerns over heat-related illnesses such as heatstroke.
Authorities have advised residents to take precautions, avoid exposure during peak hours and stay hydrated as the state braces for a prolonged spell of extreme heat.",1.0
