title,url,source,date,language,state,district,search_term,full_text,relevance_score
"राम मंदिर चढ़ावा चोरी की जांच अब सीबीआई से कराने की तैयारी, इन्वेस्टिगेशन का दायरा बढ़ेगा",https://www.livehindustan.com/uttar-pradesh/preparations-are-underway-to-have-the-cbi-investigate-the-theft-of-offerings-from-the-ram-mandir-201782919499771.html,Live Hindustan,2026-07-01T21:07:34+05:30,hi,Uttar Pradesh,,"(लू OR ""लू चलना"" OR ""भीषण गर्मी"" OR ""प्रचंड गर्मी"" OR ""कड़ी धूप"" OR ""तेज धूप"" OR ""गर्म हवा"" OR ""उष्ण लहर"" OR ""ताप लहर"" OR ""हीट वेव"" OR ""झुलसाने वाली गर्मी"" OR ""तपती गर्मी"") Uttar Pradesh","राम मंदिर चढ़ावा चोरी की जांच अब सीबीआई से कराने की तैयारी, इन्वेस्टिगेशन का दायरा बढ़ेगा
अयोध्या राम मंदिर चढ़ावा चोरी की जांच अब सीबीआई से करने की तैयारी है। एसआईटी की समय सीमा भी बढ़ा दी गई है। ऐसे में मामले की जांच जल्द सीबीआई के हवाले की जा सकती है। इससे जांच का दायरा बढ़ेगा।
अयोध्या राम मंदिर के चढ़ावा चोरी के आठ आरोपितों की गिरफ्तारी के बाद स्टेट बैंक के अधिकारियों व कर्मियों की जांच तेज हुई है। आर्थिक अपराध के इस हाई प्रोफाइल मामले में श्रीराम जन्म भूमि तीर्थ क्षेत्र ट्रस्ट के पदाधिकारियों की संलिप्तता के सवाल भी लगातार गहराते जा रहे हैं। सूत्रों के अनुसार अयोध्या में चल रही जांच पर केंद्रीय जांच एजेंसियां भी अपनी नजर बनाए हैं और इनपुट जुटा रही हैं। एसआईटी की समय सीमा भी बढ़ा दी गई है। ऐसे में मामले की जांच जल्द सीबीआई के हवाले की जा सकती है। इससे जांच का दायरा बढ़ेगा।
अयोध्या और राम मंदिर भाजपा के लिए हमेशा बड़ा एजेंडा रहे हैं। इस परिसर में चढ़ावे में हेराफेरी का मामला सामने आने के बाद विपक्ष इसे रामभक्तों की आस्था पर आघात का मुद्दा बनाने का प्रयास कर रहा है। ट्रस्ट के पदाधिकारियों पर भी लगातार हमलावर है। विधानसभा चुनाव से पहले खासकर सपा व कांग्रेस भाजपा को घेरकर अपनी राह आसान करने की जुगत में हैं। विपक्ष ट्रस्ट के पदाधिकारियों पर कार्रवाई की मांग करने के साथ ही पुलिस कार्रवाई पर भी सवाल उठा रहा है।
वहीं राज्य सरकार मामले में आठ नामजद आरोपितों की तत्काल गिरफ्तारी कर किसी भी दोषी को बख्शे न जाने का संदेश दे चुकी है। मुख्यमंत्री योगी आदित्यनाथ ने ट्रस्ट की मांग पर एसआईटी का गठन किया था, जिसकी जांच के घेरे में अब चढ़ावे की रकम गिनने से लेकर बैंक पहुंचाने तक के लिए बनी एसओपी, उसके जिम्मेदार और लापरवाही की हर एक कड़ी है। पुलिस गिरफ्तार आरोपितों से पूछताछ तथा अब तक की जांच में सामने आए तथ्यों के आधार पर स्टेट बैंक के दो अधिकारियों व ट्रस्ट के एक प्रमुख सदस्य के विरुद्ध गहनता से जांच कर रही है।
पुलिस जांच का दायरा भी बढ़ता जा रहा
मामले में अयोध्या में दर्ज कराई गई एफआईआर में भ्रष्टाचार निवारण अधिनियत की धारा भी शामिल है। मामला पब्लिक मनी में घपले का है और उसमें स्टेट बैंक के अधिकारियों व कर्मियों की संलिप्तता भी सामने आ रही है। लिहाजा पुलिस जांच का दायरा भी बढ़ता जा रहा है। कई बड़ों के नाम भी जल्द सामने आएंगे। सूत्रों का कहना है कि जल्द इस मामले की जांच सीबीआई दिल्ली की ईओडब्ल्यू विंग के हवाले की जा सकती है।
चढ़ावे में हेराफेरी मामले में स्टेट बैंक भी बड़ी कार्रवाई की तैयारी में
वहींराम मंदिर के चढ़ावे में हेराफेरी के मामले में स्टेट बैंक आफ इंडिया अपने अधिकारियों व कर्मचारियों की भूमिका पर सवाल उठने को लेकर गंभीर है। बैंक के वरिष्ठ अधिकारियों ने पूरे मामले में अयोध्या में तैनात रहे बैंक अधिकारियों व कर्मियों की लापरवाही व संलिप्तता को लेकर आंतरिक जांच शुरू कराई है। बैंक भी मामले में दोषियों के विरुद्ध कड़ी कार्रवाई की तैयारी में है।",0.0
"20 सेकंड में 8 बार मारीं चप्पलें, जड़े 11 थप्पड़, बीच सड़क देवर ने भाभी पर किया हमला; कपड़े भी फाड़े",https://www.livehindustan.com/uttar-pradesh/hit-with-slippers-8-times-in-20-seconds-slapped-11-times-devar-attacked-bhabhi-in-middle-of-road-also-tore-her-clothes-201782918394147.html,Live Hindustan,2026-07-01T20:49:20+05:30,hi,Uttar Pradesh,,"(लू OR ""लू चलना"" OR ""भीषण गर्मी"" OR ""प्रचंड गर्मी"" OR ""कड़ी धूप"" OR ""तेज धूप"" OR ""गर्म हवा"" OR ""उष्ण लहर"" OR ""ताप लहर"" OR ""हीट वेव"" OR ""झुलसाने वाली गर्मी"" OR ""तपती गर्मी"") Uttar Pradesh","20 सेकंड में 8 बार मारीं चप्पलें, जड़े 11 थप्पड़, बीच सड़क देवर ने भाभी पर किया हमला; कपड़े भी फाड़े
कानपुर देहात में बीच सड़क पर हंगामा हो गया। एक देवर अपने दोस्त के साथ मिलकर अपनी भाभी और भाई को चप्पलों से पीटने लगा। वह दोनों पर लगातार चप्पलें और थप्पड़ बरसा रहा था। इस दौरान उसने भाभी के कपड़े भी फाड़ डाले।वीडियो वायरल होने के बाद पुलिस ने केस दर्ज कर देवर और उसके दोस्त को गिरफ्तार कर लिया है।
उत्तर प्रदेश के कानपुर देहात में एक देवर ने अपने दोस्त संग बीच सड़क अपनी भाभी और भाई पर हमला बोल दिया। पति और तीन साल की बेटी संग ससुराल गई महिला को दोनों ने सड़क पर चप्पलों से पीटा। इस दौरान महिला के कपड़े तक फाड दिए। बुधवार को घटना का वीडियो सोशल मीडिया पर वायरल हुआ। 20 सेकंड के वायरल वीडियो में आरोपितों ने महिला को ताबड़तोड़ 8 चप्पलें और 11 थप्पड़ जड़े। उसके पति को भी पीटा। मारपीट के दौरान दंपत्ति की तीन साल की बेटी भी गिरकर चुटहिल हो गई। बेरहमी से हुई पिटाई के बाद महिला बेसुध होकर बीच सड़क पर गिर पड़ी। हालांकि ‘लाइव हिन्दुस्तान’ वायरल वीडियो की सत्यता की पुष्टि नहीं करता है। पीड़िता की शिकायत पर पुलिस ने मुकदमा दर्ज कर देवर और उसके दोस्त को गिरफ्तार कर लिया है।
घटना, कानपुर देहात के गुजैनी क्षेत्र की है। यहां की रहने वाली पीड़ित महिला ने बताया कि 15 साल पहले उनकी शादी बर्रा–8 निवासी फर्नीचर कारीगर से हुई थी। महिला के मुताबिक ससुराल के पास रहने वाला संदीप सचान उन पर बुरी नजर रखता था। विरोध करने पर आए दिन ससुरालीजनों से झगड़ा होता था। जिस पर वह डेढ़ साल पहले ससुराल छोड़ कर किराए के मकान में रहने चली गई थीं। पिछले 15 दिनों से पति बीमार चल रहे थे, जिस पर वह ससुराल में रहने के लिए बातचीत करने मंगलवार दोपहर करीब 2 बजे पति और तीन साल की बेटी के साथ गई थी। जब वह पहुंची तो ससुरालीजनों ने विरोध किया। इस दौरान देवर और इलाके में रहने वाले उसके दोस्त संदीप ने उनके साथ मारपीट शुरू कर दी।
विरोध करने पर उनके कपड़े फाड़ कर घर से निकाल दिया। पीड़िता के मुताबिक, वह पति व बेटी के साथ बाइक से शिकायत करने के लिए थाने जा रही थीं, इसी दौरान देवर ने एक के बाद एक दो थप्पड़ जड़ दिए। उसके पीछे संदीप भी दौड़कर आया और फिर दोनों ने उन्हें चप्पलों से पीटना शुरू कर दिया। पति के विरोध करने पर पति पर भी थप्पड़ों की अंधाधुंध बौछार कर दी। मारपीट के दौरान बाइक गिरने से तीन साल की बेटी चुटहिल हो गई। बेरहमी से पिटाई के बाद विवाहिता सड़क पर बेसुध होकर गिर पड़ीं। इस दौरान मौके पर मौजूद एक युवक ने पूरे घटनाक्रम का वीडियो बना लिया। बुधवार को वीडियो सोशल मीडिया पर वायरल होने के बाद गुजैनी पुलिस हरकत में आई। डीसीपी दक्षिण दीपेंद्र नाथ चौधरी ने बताया कि पीड़िता की तहरीर पर आरोपित संदीप सचान और देवर पर मुकदमा दर्ज कर दोनों को गिरफ्तार कर लिया गया है।
घटना से लोग सन्न
जिन लोगों ने भी बीच सड़क देवर और उसके दोस्त द्वारा महिला की पिटाई का वीडियो देखा वो सन्न रह गया। लोग महिला और उसके पति पर हमला करने वालों के खिलाफ सख्त कार्रवाई की जरूरत बता रहे हैं। लोगों का कहना है कि देवर ने अपने दोस्त संग मिलकर भाई-भाभी को दहशतजदा करने के इरादे से हमला बोला। देवर ने ऐसा करने से पहले यह भी नहीं सोचा कि बीच सड़क पर वह अपने ही परिवार का तमाशा बना रहा है। उस पर और उसका साथ देने वाले उसके दोस्त के खिलाफ सख्त कानूनी कार्रवाई की जानी चाहिए।",0.0
"यूपी की हर पंचायत को मिलेंगे सचिव, 13116 पदों पर भर्ती को हरी झंडी; चाक-चौबंद होगी गांव सरकार",https://www.livehindustan.com/uttar-pradesh/every-gram-panchayat-in-up-will-have-a-secretary-recruitment-for-13116-posts-village-government-to-be-fully-operational-201782915887350.html,Live Hindustan,2026-07-01T20:08:48+05:30,hi,Uttar Pradesh,,"(लू OR ""लू चलना"" OR ""भीषण गर्मी"" OR ""प्रचंड गर्मी"" OR ""कड़ी धूप"" OR ""तेज धूप"" OR ""गर्म हवा"" OR ""उष्ण लहर"" OR ""ताप लहर"" OR ""हीट वेव"" OR ""झुलसाने वाली गर्मी"" OR ""तपती गर्मी"") Uttar Pradesh","यूपी की हर पंचायत को मिलेंगे सचिव, 13116 पदों पर भर्ती को हरी झंडी; चाक-चौबंद होगी गांव सरकार
यूपी में 13116 पंचायत सचिवों की भर्ती को हरी झंडी दे दी गई है। यह भर्ती प्रक्रिया पूरी होते ही हर ग्राम पंचायत को उसके स्वतंत्र सचिव मिल जाएंगे।इसके साथ ही पंचायतों के कामों को नई रफ्तार मिल जाएगी। पंचायती राज विभाग, वित्त एवं ग्राम्य विकास विभाग ने इन भर्तियों के लिए सैद्धांतिक सहमति दे दी है।
उत्तर प्रदेश के ग्रामीण इलाकों में एक अच्छी सरकारी नौकरी के साथ-साथ लोगों की सेवा करने की चाहत रखने वाले युवाओं के लिए खुशखबरी है। यूपी सरकार, ग्राम पंचायतों को सशक्त और गांव सरकार को चाक चौबंद बनाने जा रही है। इस मकसद को हासिल करने के लिए प्रदेश में 13116 पंचायत सचिवों की भर्ती की जाएगी। प्रदेश का पंचायती राज विभाग तीन चरणों में यह भर्ती पूरी करेगा। एक बार भर्ती प्रक्रिया पूरी हो गई तो फिर प्रदेश की हर ग्राम पंचायत को स्वतंत्र सचिव मिल जाएंगे और पंचायतों के कामों को नई रफ्तार मिल सकेगी। पहले चरण में 4372 पंचायत सचिवों की भर्तियां की जाएंगी। उसके बाद के दो अन्य चरणों में भी बराबर संख्या में सचिवों की भर्तियां की जाएंगी।
मुख्य सचिव की अध्यक्षता वाली स्टेट एक्ज्यूकेटिव कमेटी के सामने पंचायती राज विभाग के साथ-साथ वित्त और ग्राम्य विकास विभाग ने इन भर्तियों के लिए अपनी सैद्धांतिक सहमति दे दी है। लिहाजा भविष्य में प्रदेश की हर ग्राम पंचायत पर एक सचिव की तैनाती के प्रस्ताव पर भी शासन की ओर से सैद्धांतिक रूप से स्वीकृति दे दी गई है।
बैठक के मिनट्स जारी
नई भर्तियों की प्रक्रिया शुरू करने के लिए पंचायत राज विभाग के प्रमुख सचिव अनिल कुमार की ओर से मुख्य सचिव की अध्यक्षता वाली कमेटी की हुई बैठक में लिए गए निर्णय के बारे में मिनट्स (कार्यवृत) जारी कर दिए गए हैं। पंचायत राज विभाग के दस्तावेजों के अनुसार, प्रदेश में करीब 58 हजार ग्राम पंचायतों में से लगभग 42 हजार ग्राम पंचायतों में पंचायत सचिव के पद खाली हैं।
बाकी पदों पर भी होगी भर्ती
ऐसे में ग्राम पंचायत अधिकारियों से लेकर ग्राम विकास अधिकारियों और पंचायत सचिवों के पास कई ग्राम पंचायतों के सचिव का अतिरिक्त प्रभार है, जिससे ग्राम पंचायतों के काम बुरी तरह से प्रभावित हो रहे हैं। 13116 पदों पर भर्ती प्रक्रिया पूरी होने के बाद शेष पदों पर भी नए सिरे से भर्तियां करने की सरकार की योजना है। इसके लिए स्टेट एक्ज्यूकेटिव कमेटी अलग से विचार करेगी।
सरकार की है यह योजना
-ग्रामीणों के अधिकतर कार्य ग्राम पंचायत स्तर पर ही हो जाए।
-ग्रामीणों को छोटी-बड़ी समस्याओं के निराकरण के लिए जिला मुख्यालय का चक्कर न लगाना पड़े।
-ग्रामीणों को सरकारी योजनाओं का लाभ ग्राम पंचायत स्तर पर ही उपलब्ध हो
-ग्रामीणों के विकास संबंधी शिकायतों का निवारण भी पंचायत स्तर पर ही हो सके।
-पंचायत सचिव ग्रामीणों की जिज्ञासाओं व समस्याओं का निराकरण में मददगार होगा।",0.0
