title,url,source,date,language,state,district,search_term,full_text,relevance_score
"राम मंदिर में बदल सकता है सिस्टम, जाली पार से श्रद्धालु भी देख सकेंगे चढ़ावे की गिनती",https://www.livehindustan.com/uttar-pradesh/ram-temple-system-could-change-with-devotees-able-to-see-the-counting-of-offerings-through-the-grille-201782924297847.html,Live Hindustan,2026-07-01T22:27:53+05:30,hi,Uttar Pradesh,,"(लू OR ""लू चलना"" OR ""भीषण गर्मी"" OR ""प्रचंड गर्मी"" OR ""कड़ी धूप"" OR ""तेज धूप"" OR ""गर्म हवा"" OR ""उष्ण लहर"" OR ""ताप लहर"" OR ""हीट वेव"" OR ""झुलसाने वाली गर्मी"" OR ""तपती गर्मी"") Uttar Pradesh","राम मंदिर में बदल सकता है सिस्टम, जाली पार से श्रद्धालु भी देख सकेंगे चढ़ावे की गिनती
माना जा रहा है कि ज्यादातर व्यवस्थाओं को बदलने का खाका खींचा जा चुका है। इन बदलावों को छह जुलाई की बैठक में लागू कर दिया जाएगा। सूत्र बता रहे हैं कि भवन निर्माण समिति के अध्यक्ष नृपेंद्र मिश्रा ट्रस्ट की बैठक में शामिल होने के एक दिन पहले यानी पांच जुलाई को अयोध्या पहुंच जाएंगे।
Ayodhya Ram Mandir News : अयोध्या राम मंदिर चढ़ावा चोरी विवाद सामने आने के बाद व्यवस्थाओं को लेकर ट्रस्टियों में चिंतन-मंथन का दौर जारी है। चढ़ावे की रकम को गिनने में पारदर्शिता लाने के लिए प्रक्रिया को सार्वजनिक करने की तैयारी है। छह जुलाई होने जा रही श्री राम जन्मभूमि तीर्थ क्षेत्र ट्रस्ट की होने वाली बैठक में व्यवस्थाओं को बदलने पर मुहर लग सकती है। बैठक में बुजुर्ग पदाधिकारी वर्चुअल तरीके से शामिल होंगे। राम जन्मभूमि परिसर में चढ़ावे की रकम गिनने के लिए एक नया हॉल बनाया जा सकता है। जिसके चारों तरफ लोहे की जालियां लगीं होंगी। इससे राम मंदिर में दर्शन करने वाला कोई भी श्रद्धालु प्रक्रिया सामने से देख सकेगा। हॉल के अंदर और बाहर सीसीटीवी कैमरे कुछ-कुछ दूरी पर लगाए जाएंगे। ट्रस्ट के पदाधिकारी देश के बड़े मंदिरों में व्यवस्था का अध्ययन कर उसे राम मंदिर में लागू करने का मन बना चुके हैं। सूत्र बताते हैं कि ट्रस्ट के पदाधिकारी आपस में बातचीत कर नई व्यवस्था को जल्द लागू करने पर एकमत हुए हैं।
हालांकि, अभी ट्रस्ट के सभी सदस्य एक स्थल पर नहीं हैं फिर भी आपस में वार्तालाप जारी है। माना जा रहा है कि ज्यादातर व्यवस्थाओं को बदलने का खाका खींचा जा चुका है। जिसे छह तारीख की बैठक में लागू कर दिया जाएगा। सूत्र बताते हैं कि भवन निर्माण समिति के अध्यक्ष नृपेंद्र मिश्रा श्री राम जन्मभूमि तीर्थ क्षेत्र ट्रस्ट की बैठक में शामिल होने के एक दिन पहले यानी पांच तारीख को अयोध्या पहुंच जाएंगे। चढ़ावे की रकम में हेरफेर का आरोप लगने के बाद नृपेंद्र मिश्रा ने व्यवस्था पर कई सवाल उठाए थे। इसलिए यह बैठक उनके लिए भी महत्वपूर्ण मानी जा रही है।
विहिप और आरएसएस को भेजी रिपोर्ट
पूरे मामले की जानकारी श्री राम जन्मभूमि तीर्थ क्षेत्र ट्रस्ट द्वारा विश्व हिंदू परिषद और राष्ट्रीय स्वयंसेवक संघ के शीर्ष नेतृत्व को भेज दी गई है। मामले में ट्रस्ट के पदाधिकारियों की गलती थी या नहीं इसका भी पूरा ब्योरा लिखित रूप में भेजा गया है। 6 तारीख की बैठक में ट्रस्ट के महासचिव चंपत राय, सदस्य डॉ. अनिल मिश्रा और गोपाल राव को पदाधिकारियों की रजामंदी और बहुमत से ट्रस्ट में रखने या ना रखने पर विचार किया जाएगा। सूत्रों की मानें तो दो पदाधिकारियों का ट्रस्ट से बाहर जाना लगभग तय हो गया है। एक की ताकत को कम किया जा सकता है।
स्टेट बैंक भी बड़ी कार्रवाई की तैयारी में
उधर, राम मंदिर के चढ़ावे में हेराफेरी के मामले में स्टेट बैंक आफ इंडिया अपने अधिकारियों व कर्मचारियों की भूमिका पर सवाल उठने को लेकर गंभीर है। बैंक के वरिष्ठ अधिकारियों ने पूरे मामले में अयोध्या में तैनात रहे बैंक अधिकारियों और कर्मियों की लापरवाही व संलिप्तता को लेकर आंतरिक जांच शुरू कराई है। बैंक भी मामले में दोषियों के विरुद्ध कड़ी कार्रवाई की तैयारी में है।
चढ़ावे की रकम की गिनती व उसे बैंक पहुंचाए जाने की एसओपी बनाए जाने से लेकर आउटसोर्सिंग कर्मचारियों की नियुक्त में उनकी भूमिका को देखा जा रहा है। यह भी देखा जा रहा है कि कुछ आउटसोर्सिंग कर्मचारियों को न हटाने को लेकर दबाव बनाए जाने पर संबंधित बैंक अधिकारियों ने किसी स्तर पर उसकी कोई लिखित शिकायत की थी अथवा नहीं। अयोध्या में तैनात रहे दो तत्कालीन बैंक अधिकारियों की भूमिका खासकर जांच के घेरे में है। हालांकि स्टेट बैंक पूरे मामले में पहले एसआईटी की रिपोर्ट सौंपे जाने की प्रतीक्षा करेगा।
कहीं क्रिप्टो करेंसी में तो नहीं लगे रुपए?
पुलिस को संदेह है कि जांच एजेंसियों से बचने के लिए चढ़ावे में हेराफेरी से जुटाई गई रकम का निवेश क्रिप्टो करेंसी में भी किया गया था। इसे लेकर भी पड़ताल शुरू की गई है। पुलिस ने जांच के के घेरे में आए बैंक अधिकारियों व कर्मियों के साथ ही उनके परिवार के सदस्यों के पैन व आधार कार्ड का ब्योरा जुटाना भी शुरू किया है। उनके खातों और निवेश को लेकर भी जांच होगी। क्रिप्टो करेंसी में निवेश की आशंका को देखते हुए साइबर ट्रेल की पड़ताल होगी। वहीं आउटसोर्स किए गए कर्मचारियों की भर्ती की प्रक्रिया में भी बैंक अधिकारियों व कर्मियों की भूमिका जांच के दायरे में है। यह पता लगाया जा रहा है कि इस प्रक्रिया में कौन-कौन शामिल था। उन्हें लेकर पूरा ब्योरा जुटाया जा रहा है।",0.0
"मधुमिता शुक्ला की बहन निधि शुक्ला दहशत में, बोलीं- रात को घर के बाहर सुना धमाका",https://www.livehindustan.com/uttar-pradesh/madhumita-shukla-s-sister-nidhi-shukla-is-terrified-says-she-heard-an-explosion-outside-the-house-last-night-201782921834379.html,Live Hindustan,2026-07-01T21:43:24+05:30,hi,Uttar Pradesh,,"(लू OR ""लू चलना"" OR ""भीषण गर्मी"" OR ""प्रचंड गर्मी"" OR ""कड़ी धूप"" OR ""तेज धूप"" OR ""गर्म हवा"" OR ""उष्ण लहर"" OR ""ताप लहर"" OR ""हीट वेव"" OR ""झुलसाने वाली गर्मी"" OR ""तपती गर्मी"") Uttar Pradesh","मधुमिता शुक्ला की बहन निधि शुक्ला दहशत में, बोलीं- रात को घर के बाहर सुना धमाका
मधुमिता शुक्ला की बहन निधि शुक्ला ने अपनी जान पर खतरा बताया है। उनका कहना है कि उन्होंने अपने घर के बाहर रात में धमाके की आवाज सुनी। निधि का कहना है कि उनकी जान पर खतरा बना हुआ है। पुलिस को उनकी सुरक्षा बढ़ानी चाहिए। निधि ने लखीमपुर खीरी की कोतवाली में तहरीर भी दी है।
मधुमिता शुक्ला उत्तर प्रदेश की उभरती हई कवयित्री थीं। 9 मई 2003 को लखनऊ की पेपर मिल कॉलोनी में उनकी सनसनीखेज हत्या ने उत्तर प्रदेश के सियासी गलियारों में भी हलचल मचा दी थी। प्रदेश के चर्चित हत्याकांडों में से एक है। मधुमिता को इंसाफ दिलाने की जंग लड़ने वाली उनकी बहन निधि शुक्ला को इन दिनों अपनी जान का डर सता रहा है। निधि का दावा है कि उन्होंने अपने घर के बाहर रात में धमाके की आवाज सुनी है। निधि ने बकायदा लखीमपुर खीरी की कोतवाली में तहरीर दी है। उन्होंने कहा कि रात के तीन बजे उनके घर के बाहर धमाका हुआ। घर के बाहर लोहे का मजबूत जाल होने की वजह से बाहर मौजूद सुरक्षा कर्मी बच गया। निधि ने उनकी सुरक्षा को और मजबूत किए जाने की मांग उठाई है।
निधि शुक्ला ने बताया कि पिछले साल भी उनके घर के बाहर रात को फायरिंग हुई थी। इन घटनाओं के बाद उन्होंने अपना सुरक्षा घेरा मजबूत कर लिया। लेकिन पुलिस की ओर से सुरक्षा में लगातार ढील की जा रही है। उनके घर की सुरक्षा के लिए सिर्फ एक पुलिस कर्मी तैनात है। जबकि पहले चार पुलिस कर्मियों की पुख्ता सुरक्षा होती थी। कई बार गारद की मांग करने के बाद भी पुलिस उनको सुरक्षा नहीं दे रही है। इससे उन पर खतरा गहराता जा रहा है।
निधि ने बताया कि मधुमिता हत्याकांड में शूटर रोहित चतुर्वेदी जेल से बाहर है। वह उसके खिलाफ अदालती लड़ाई लड़ रही हैं। इसके अलावा उनकी बहन मधुमिता की हत्या को लेकर उनकी किताब भी जल्दी आने वाली है। इसकी जानकारी उन्होंने सोशल मीडिया पर दी थी। इससे उनके दुश्मन बौखला गए हैं और हमले की फिराक में हैं। उधर, इस मामले में सदर कोतवाली प्रभारी राजेश सिंह का कहना है कि घटना पूरी तरीके से संदिग्ध है। मामले की जांच की जा रही है। जांच में जो निकलकर सामने आएगा उसी के अनुसार आगे की कार्रवाई की जाएगी।
कैसे हुई थी मधुमिता शुक्ला की हत्या
नौ मई 2003 को लखनऊ की पेपर मिल कॉलोनी में मधुमिता शुक्ला की हत्या उनके घर में गोली मारकर कर दी गई थी। पोस्टमार्टम के दौरान पता चला था कि मधुमिता सात महीने की गर्भवती थी। इस मामले की शुरुआती जांच स्थानीय पुलिस ने की थी लेकिन बाद में यह मामला सीबीआई को सौंप दिया गया था। सुप्रीम कोर्ट ने 2005 में इस मामले को उत्तर प्रदेश से उत्तराखंड स्थानांतरित कर दिया था।
साल-2007 में देहरादून की विशेष सत्र अदालत ने पूर्व मंत्री अमरमणि त्रिपाठी, उनकी पत्नी मधुमणि और दो अन्य लोगों को दोषी करार देते हुए आजीवन कारावास की सजा सुनाई थी। करीब 20 साल जेल में गुजारने के बाद जेल में अच्छे आचरण और उम्र के आधार पर अमरमणि त्रिपाठी और उनकी पत्नी की समयपूर्व रिहाई हुई।",0.0
