title,url,source,date,language,state,district,search_term,full_text,relevance_score
"यूपी पुलिस एनकाउंटर 50 हजार का इनामी बदमाश ढेर, दरोगा और सिपाही भी घायल",https://www.livehindustan.com/uttar-pradesh/up-police-encounter-criminal-with-50000-bounty-killed-sub-inspector-and-constable-also-injured-201782929743946.html,Live Hindustan,2026-07-01T23:57:16+05:30,hi,Uttar Pradesh,,"(लू OR ""लू चलना"" OR ""भीषण गर्मी"" OR ""प्रचंड गर्मी"" OR ""कड़ी धूप"" OR ""तेज धूप"" OR ""गर्म हवा"" OR ""उष्ण लहर"" OR ""ताप लहर"" OR ""हीट वेव"" OR ""झुलसाने वाली गर्मी"" OR ""तपती गर्मी"") Uttar Pradesh","यूपी पुलिस एनकाउंटर 50 हजार का इनामी बदमाश ढेर, दरोगा और सिपाही भी घायल
यूपी पुलिस एनकाउंटर 50 हजार का इनामी बदमाश ढेर हो गया है। बदमाश की ओर से की गई फायरिंग में दरोगा और सिपाही भी गोली लगने से घायल हो गए। दोनों का जिला अस्पताल में इलाज चल रहा है।
यूपी पुलिस एनकाउंटर में इनामी बदमाश ढेर हो गया। डकैती की वारदात में शामिल 50 हजार रुपये का इनामी बदमाश पुलिस मुठभेड़ में ढेर हो गया। बदमाश की ओर से की गई फायरिंग में दरोगा और सिपाही भी गोली लगने से घायल हो गए। दोनों का जिला अस्पताल में इलाज चल रहा है। पुलिस ने बदमाश के शव को कब्जे में लेकर जांच शुरू कर दी है। उसके पास से कुछ जेवर और ऑटोमेटिक पिस्टल बरामद हुई है।
मुठभेड़ सिविल लाइंस कोतवाली क्षेत्र में बदायूं-बिजनौर हाईवे बहेड़ी गांव स्थित प्रस्तावित जेल के पास हुई। दरअसल, 19 मई की रात इस्लामनगर कस्बे में निजाकत के घर एक दर्जन से अधिक बदमाशों ने 19 लाख रुपये की नगदी व जेवरात की डकैती की वारदात को अंजाम दिया था। घटना के दौरान बदमाशों ने निजाकत, उनकी बहू, भतीजे और परिवार के अन्य सदस्यों के साथ मारपीट भी की थी। इसके बाद पुलिस ने बदमाशों की धरपकड़ शुरू की। 26 मई को पुलिस ने मुठभेड़ के दौरान पांच बदमाशों को गिरफ्तार किया था, जिनमें तीन गोली लगने से घायल हुए थे। बाद में दो अन्य बदमाशों को भी गिरफ्तार कर जेल भेज दिया गया था, जबकि मुख्य आरोपी जितेंद्र उर्फ ढालू फरार चल रहा था। उस पर डीआईजी ने 50 हजार रुपये का इनाम घोषित किया था।
एसएसपी अंकिता शर्मा ने बताया कि मुखबिर से सूचना मिली थी कि इनामी बदमाश बाइक से किसी वारदात को अंजाम देने की फिराक में प्रस्तावित जेल के पास मौजूद है। पुलिस टीम ने घेराबंदी की तो बदमाश ने फायरिंग शुरू कर दी, जिसमें शेखूपुर चौकी प्रभारी नीरज और सिपाही अविनाश गोली लगने से घायल हो गए। पुलिस की जवाबी फायरिंग में बदमाश घायल हो गया। उसे गिरफ्तार कर जिला अस्पताल ले जाया गया, जहां डॉक्टर ने मृत घोषित कर दिया। एसएसपी के अनुसार, बदमाश पर बदायूं, संभल, अमरोहा और हापुड़ समेत विभिन्न जिलों में एक दर्जन से अधिक मुकदमे दर्ज थे। उसके कब्जे से ऑटोमेटिक पिस्टल, बाइक और डकैती के कुछ जेवर बरामद किए गए हैं।
मुठभेड़ के बाद कासगंज से बुलाए गए सीओ रजनीश
बदायूं के अफसरों की काबलियत पर उस समय सवालिया निशान लग गये, जब मुख्य आरोपी जितेंद्र उर्फ ढालू के पुलिस मुठभेड़ में मारे जाने की सूचना मिलते ही कासगंज में तैनात क्षेत्राधिकारी रजनीश कुमार उपाध्याय को बदायूं बुलाया गया। रजनीश इससे पहले बदायूं में तैनात रह चुके हैं और हाल ही में उनका तबादला कासगंज हुआ है। मुठभेड़ की संवेदनशीलता को देखते हुए उन्हें मौके पर बुलाकर पूरे घटनाक्रम की निगरानी कराई गई। अधिकारियों की मौजूदगी में पुलिस ने आवश्यक विधिक कार्रवाई पूरी की।
मीडिया से बनाई दूरी, मोबाइल छीनने की भी हुई कोशिश
मुठभेड़ स्थल और जिला अस्पताल में पुलिस अधिकारियों ने मीडिया से दूरी बनाए रखी। इस दौरान कुछ पुलिसकर्मियों ने कवरेज कर रहे पत्रकारों को वीडियो बनाने से रोकने का प्रयास किया। प्रत्यक्षदर्शियों के अनुसार, एक पत्रकार का मोबाइल छीनने की भी कोशिश की गई, जिससे कुछ देर के लिए अफरा-तफरी का माहौल बन गया। बाद में अन्य अधिकारियों के हस्तक्षेप के बाद मामला शांत हुआ और मीडिया कर्मियों ने अपना काम जारी रखा।",0.31666666666666665
"लखनऊ-कानपुर एक्सप्रेसवे का 13 जुलाई को गडकरी और राजनाथ करेंगे लोकार्पण, घंटेभर का होगा सफर",https://www.livehindustan.com/uttar-pradesh/gadkari-and-rajnath-to-inaugurate-lucknow-kanpur-expressway-on-july-13-travel-time-to-be-one-hour-201782927852198.html,Live Hindustan,2026-07-01T23:28:31+05:30,hi,Uttar Pradesh,,"(लू OR ""लू चलना"" OR ""भीषण गर्मी"" OR ""प्रचंड गर्मी"" OR ""कड़ी धूप"" OR ""तेज धूप"" OR ""गर्म हवा"" OR ""उष्ण लहर"" OR ""ताप लहर"" OR ""हीट वेव"" OR ""झुलसाने वाली गर्मी"" OR ""तपती गर्मी"") Uttar Pradesh","काम की बात: लखनऊ-कानपुर एक्सप्रेसवे का 13 जुलाई को गडकरी और राजनाथ करेंगे लोकार्पण, घंटेभर का होगा सफर
लखनऊ-कानपुर एक्सप्रेस-वे का 13 जुलाई को नितिन गडकरी और राजनाथ सिंह लोकार्पण करेंगे। लखनऊ-कानपुर एक्सप्रेस-वे से अब लोगों का सफर आसान होगा। पूरा सफर एक घंटे में पूरा होगा।
बहुप्रतिक्षित लखनऊ-कानपुर एक्सप्रेस वे का शिलान्यास 13 जुलाई को होगा। इसके साथ ही एक्सप्रेस वे को वाहनों के लिए खोल दिया जाएगा। इस दौरान इंजीनियरिंग कॉलेज पर फ्लाईओवर का शिलान्यास भी किया जाएगा। लोकार्पण और शिलान्यास के लिए केंद्रीय सड़क परिवहन और राजमार्ग मंत्री नितिन गडकरी और लखनऊ के सांसद व रक्षामंत्री राजनाथ सिंह संयुक्त रूप से करेंगे। इस दौरान प्रदेश की राज्यपाल आनंदी बेन पटेल और मुख्यमंत्री योगी आदित्यनाथ भी रहेंगे। कानपुर-लखनऊ के बीच सफर आसान होगा। अब लखनऊ कानपुर का सफर अब एक घंटे में सफर पूरा होगा।
लखनऊ-कानपुर एक्सप्रेस वे अप्रैल में बनकर तैयार हो चुका है। प्रधानमंत्री नरेंद्र मोदी द्वारा लोकार्पण किए जाने की संभावना के कारण लोकार्पण रुका हुआ था। एनएचएआई के सूत्रों का कहना है कि दिल्ली स्थित मुख्यालय से 13 को लोकार्पण की तैयारी के लिए बुधवार को निर्देश मिले हैं। सम्भवतः गुरुवार तक लिखित रूप से पूरी डिटेल मिल जाए। उधर, पीडब्लूयुडी की एनएच विंग को भी इंजीनियरिंग कॉलेज के शिलान्यास की तैयारी के लिए निर्देशित किया गया है।
एक्सप्रेस वे 63 किमी लंबा है
लखनऊ -कानपुर एक्सप्रेस वे लगभग 63 किमी लंबा है, जिसमें लगभग 42 किमी का ग्रीन फील्ड है। शेष हिस्सा एलीवेटेड रोड का है, जो कि लखनऊ क्षेत्र में पड़ता है। ग्रीन फील्ड उन्नाव और कानपुर जिले में हैं। 4000 हजार करोड़ से भी अधिक की लागत से पांच साल में इसका निर्माण किया गया है। एक्सप्रेस वे पर चार टोल हैं। लखनऊ में यह अमौसी के पास से शुरू होता है और कानपुर में शुक्लागंज के पास खत्म होता है।
120 की स्पीड से चलेंगे वाहन, एक घंटे में पहुंचेंगे कानपुर
लखनऊ -कानपुर एक्सप्रेस वे पर कार, जीप और एसयूवी वाहनों की अधिकतम गति 120 किमी प्रति घंटा होगी। जिसके कारण कानपुर एक घंटे में पहुंच जाएंगे। बड़े वाहनों की अधिकतम स्पीड 100 किमी प्रति घंटा होगी।
जाम से मुक्ति मिलेगी
इंजीनियरिंग कॉलेज चौराहे पर प्रस्तावित फ्लाई ओवर चार लेन का होगा। इसे 108 करोड़ रूपये की लागत से बनाने की जिम्मेदारी हरियाणा की कंपनी को दी जा चुकी है। इसके बनने से यहां लगने वाले जाम से लोगों को राहत मिलेगी।
हाईटेक है एक्सप्रेस वे
लखनऊ -कानपुर एक्सप्रेस वे पूरी तरह से हाईटेक है। 80 से अधिक हाईटेक कैमरे लगे हुए हैं। जो कि एक्सप्रेस वे से गुजरने वाले वाहनों पर पल -पल नजर रखेंगे। दो कंट्रोल रूम भी बनाए गए हैं। इनसे सभी कैमरे जुड़े हुए हैं। एक्सप्रेस वे पर यदि किसी वाहन में कोई खराबी आ गई या किसी वजह से वह रुके हुए हैं तो कैमरे उनकी गतिविधि को तुरंत कंट्रोल रूम को सूचित करेंगे। वहां से एक्सप्रेस वे पर 24 घंटे पेट्रोलिंग में लगी टीम को सूचना जाएगी। मौका 10 मिनट में टीम पहुंच जाएगी। इसके अलावा कोई हादसा होने पर 10 मिनट में एम्बुलेंस भी मौक़े पहुंच जाएगी। एक्सप्रेस वे पर बने प्राथमिक चिकित्सालय में प्राथमिक उपचार के बाद तुरंत घायलों को पास के अस्पताल पहुंचाया जाएगा।
बिना रुके टोल प्लाजा पार करेंगे वाहन
एक्सप्रेस वे पर टोल प्लाजा को पार करने के लिए वाहनों को रुकना नहीं होगा। टोल प्लाजा से लगभग 500 मीटर पहले लगे हाईटेक कैमरे वाहन पर लगे फास्टैग और वाहन का नंबर प्लेट रीड कर टोल प्लाजा को भेज देंगे। वहां लगे कंप्यूटर तुरंत टोल काट लेंगे। जैसे ही वाहन टोल प्लाजा के करीब पहुंचेगा, बैरियर खुल जाएगा।",0.0
