title,url,source,date,language,state,district,search_term,full_text,relevance_score
Hyderabad Power Demand Surges Amid Heatwave; City Accounts for Major Share of Consumption - NativePlanet,https://news.google.com/rss/articles/CBMiyAFBVV95cUxQWC0weFc1cTJTNEV0bWR1dzlBYWlmd09fRVpUNFl4T2tUNWw2U0ZBMmtmN1lUeGlldnBlanBQdzk5WEdCNThBVFBWWUU4M2xpSlFGUm1NTEJiUXZ0ZmlOVnhrS1RJS1lIdkdINmRVWjlBTm5JOFg1UndFN1FoSnN1N1ZseGpiYU1sWTBMZnlZX2NHODVsdzZ2UXE0eHRRNEtCSVg0YkNqNm1qenE2Rm1hZGZCRXJ2M0p2TWsyN2xLeTVKN29hZk5tYQ?oc=5,NativePlanet,2026-05-01T08:35:48+05:30,en,Telangana,Hyderabad,"(heatwave OR ""heat wave"" OR ""severe heatwave"" OR ""extreme heat"" OR ""heat spell"" OR ""scorching heat"" OR ""blistering heat"" OR ""sweltering heat"" OR ""hot winds"" OR loo OR ""hot loo winds"" OR ""intense heat"" OR ""unbearable heat"" OR ""deadly heat"" OR heat OR ""weather forecast"" OR ""weather update"" OR ""weather alert"" OR ""IMD forecast"" OR ""IMD prediction"" OR ""IMD alert"" OR IMD OR ""rising temperatures"" OR ""temperatures expected to rise"" OR ""relief from heat"" OR ""respite from heat"" OR ""heat respite"" OR ""respite from scorching heat"") Telangana","Hyderabad: Rising temperatures across Telangana have triggered a sharp increase in electricity consumption, with Hyderabad alone accounting for nearly 45% of the state's total power usage, according to official data from the Telangana Southern Power Distribution Company Limited (TGSPDCL).
The state's average daily power demand is currently estimated at around 10,000 MW, down slightly from the peak of 11,300 MW recorded during the recent Rabi season. However, officials note that demand is climbing again as summer intensifies. Within this, Greater Hyderabad's consumption stands at approximately 4,300 MW, and is expected to rise further to 5,500 MW in the coming weeks if temperatures continue to soar.
Heatwave Driving Demand
Telangana is currently experiencing extreme heat conditions, with temperatures ranging between 43°C and 46°C, and several districts under red alert. In Hyderabad, temperatures are already touching 42.5°C to 44°C, with forecasts indicating further increases.
The surge in electricity demand is primarily linked to increased use of cooling appliances, particularly air conditioners and refrigerators. Officials also point to a growing dependence on electricity due to higher usage of electric appliances and a gradual rise in electric vehicle adoption, which is adding to the load on the grid.
High-Consumption Zones in Hyderabad
Within Greater Hyderabad, certain regions are consuming a significantly larger share of electricity due to dense infrastructure and commercial activity. Key high-demand areas include:
Gachibowli, Kondapur, Madhapur and Kokapet - These IT and commercial hubs fall under the city's cyber corridor and account for nearly 25% of total urban consumption due to office spaces, data centres, and residential complexes.
Rajendranagar and Medchal zones - Together contributing close to 30% of the load, these areas have seen rapid residential expansion along with industrial activity.
Emerging urban clusters and new residential layouts are also contributing to the steady rise in electricity usage.
Infrastructure Prepared to Handle Load
Despite the surge, power officials maintain that the system is equipped to manage the increasing demand. TGSPDCL has readied nearly 5,000 distribution transformers to address potential overload situations. In addition, several transformers previously operating above 70% capacity have been upgraded to higher-capacity units.
The city's 33/11 kV substations have also been strengthened with enhanced infrastructure, including 16 MVA high-capacity transformers, ensuring stable supply even during peak demand hours.
Officials further indicated that contingency measures are in place to prevent outages, even if demand spikes suddenly during extreme weather conditions.
Outlook
With summer yet to peak, Hyderabad's electricity consumption is expected to remain high in the coming weeks. Authorities have urged residents to use power judiciously while assuring that no major power disruptions are anticipated under the current preparedness levels.
The rising demand underscores the growing energy needs of a rapidly expanding urban centre, where climate conditions and lifestyle shifts continue to influence consumption patterns.",1.0
"Heatwave continues in Telangana, but relief on horizon - The New Indian Express",https://news.google.com/rss/articles/CBMitgFBVV95cUxQTHJGRERmOE5POWtLOFBFVnJwZlYyeUo1YXRQM2UtNXdGTS03OWZDOTR2RXZ6cTBZMFFxZXhTbHV1VDVndk9yZzJIemJ0QzZLMmxSZC1oZnRwWktUaFB0cF9rR3NwQVQ0WnVMUTNvRmhPV3lhS3MxSDBOWTFZSHo5N05teFMxcGtzNGF5cEZpM3hZeHNoQk5DVDduMjFBUXIwY2lvY3ZMd2dwbjR4LVg1Vy1ZUjB0d9IBwwFBVV95cUxQaHJnV0x4M243Tjh6MmpYUFJfMFJVOEF2OHA3SXplMmx1MWFMUThEbmtzSUVrWEhCdkFLbXNIUmR2Wk5jVGo3OGVXaXJ5cWEwMHlpXzlvMEoxa0FJZ3ZDMjlEaVFKOUIwTHI1cXpXajJLUjA0QUZBQ0ZGd2k5VEFmYm81cEpxWVJPUklnd21IX1pUUTlfd3pMbG10a2tmY1VBcTRxMV80eGJPTkZZZDBSd3hrc3FESEJZRE9TZW5NRGdmQVk?oc=5,The New Indian Express,2026-05-01T10:16:18+05:30,en,Telangana,Hyderabad,"(heatwave OR ""heat wave"" OR ""severe heatwave"" OR ""extreme heat"" OR ""heat spell"" OR ""scorching heat"" OR ""blistering heat"" OR ""sweltering heat"" OR ""hot winds"" OR loo OR ""hot loo winds"" OR ""intense heat"" OR ""unbearable heat"" OR ""deadly heat"" OR heat OR ""weather forecast"" OR ""weather update"" OR ""weather alert"" OR ""IMD forecast"" OR ""IMD prediction"" OR ""IMD alert"" OR IMD OR ""rising temperatures"" OR ""temperatures expected to rise"" OR ""relief from heat"" OR ""respite from heat"" OR ""heat respite"" OR ""respite from scorching heat"") Telangana","HYDERABAD: Telangana continued to reel under intense heat for the third consecutive day, with the highest temperature of 45.9°C recorded at Malyalapalli in Peddapalli district on Thursday. However, the India Meteorological Department (IMD) has issued a three-day alert forecasting rainfall accompanied by thunderstorms and gusty winds across parts of the state.
According to meteorologists, a trough or wind discontinuity currently extends from the south interior Karnataka through Tamil Nadu to the Gulf of Mannar at about 0.9 km above mean sea level. In addition, a cyclonic circulation has formed over interior Maharashtra and adjoining Telangana at a height of around 3.1 km above sea level. The department said light to moderate rainfall is likely at isolated places in several districts over the next three days, while maximum temperatures are expected to remain largely unchanged.
It also warned of thunderstorms accompanied by lightning and gusty winds with speeds of 30–40 kmph at isolated locations across Telangana during this period.",0.8500000000000001
