title,url,source,date,language,state,district,search_term,full_text,relevance_score
"दिल्ली में मार्च में गजब हुआ! हाल के सालों में सबसे गर्म, सबसे नम और सबसे ज्यादा प्रदूषित रहा",https://www.abplive.com/states/delhi-ncr/rain-today-in-delhi-ncr-weather-news-march-has-been-hottest-wettest-most-polluted-in-recent-years-3109114,ABP News,2026-03-31T22:33:16+05:30,hi,Delhi,,"(लू OR ""लू चलना"" OR ""भीषण गर्मी"" OR ""प्रचंड गर्मी"" OR ""कड़ी धूप"" OR ""तेज धूप"" OR ""गर्म हवा"" OR ""उष्ण लहर"" OR ""ताप लहर"" OR ""हीट वेव"" OR ""झुलसाने वाली गर्मी"" OR ""तपती गर्मी"" OR ""भयंकर गर्मी"") Delhi","दिल्ली में मार्च में गजब हुआ! हाल के सालों में सबसे गर्म, सबसे नम और सबसे ज्यादा प्रदूषित रहा
Delhi Weather News: मौसम के लिहाज़ से, मार्च का महीना हाल के सालों के सबसे गर्म महीनों में से एक रहा. औसत अधिकतम तापमान 32.6 डिग्री सेल्सियस रहा.
इस साल देश की राजधानी दिल्ली में मार्च के महीने में मौसम का मिजाज बिल्कुल भी सामान्य नहीं रहा. जहां एक दिन बारिश, दूसरे दिन गर्मी और पूरे महीने प्रदूषण का स्तर ऊंचा रहा. यह महीना दिल्ली में पिछले चार साल में सबसे ज़्यादा प्रदूषित, तीन साल में सबसे ज़्यादा बारिश वाला और 2022 के बाद से सबसे ज़्यादा गर्म महीना दर्ज किया गया.
30 मार्च तक औसत AQI 181 रहा
सेंटर फॉर रिसर्च ऑन एनर्जी एंड क्लीन एयर (सीआरईए) के एक विश्लेषण के अनुसार, 2026 में राष्ट्रीय राजधानी में मार्च का महीना पिछले चार साल में सबसे ज्यादा प्रदूषित रहा. 30 मार्च तक औसत वायु गुणवत्ता सूचकांक (एक्यूआई) 181 रहा, जो 2022 के बाद से सर्वाधिक है. 2022 में यह 217 था. इसकी तुलना में, 2023 में औसत एक्यूआई 170, वर्ष 2024 में 176 और 2025 में 170 था. विश्लेषण में कहा गया कि मार्च 2026 में दिल्ली में एक दिन ‘संतोषजनक’, 22 दिन ‘मध्यम’ और आठ दिन ‘खराब’ श्रेणी में रहे.
केंद्रीय प्रदूषण नियंत्रण बोर्ड के आंकड़ों पर आधारित सीआरईए के विश्लेषण के अनुसार 10 मार्च को दर्ज किया गया एक्यूआई स्तर (266) वर्ष 2023 के बाद से मार्च महीने का उच्चतम स्तर था.
हाल के सालों में सबसे गर्म महीनों में रहा
मौसम के लिहाज़ से, यह महीना हाल के सालों के सबसे गर्म महीनों में से एक रहा. औसत अधिकतम तापमान 32.6 डिग्री सेल्सियस रहा, जो पिछले चार सालों में सर्वाधिक है. इससे पहले 2022 में मार्च में औसत अधिकतम तापमान 33.4 डिग्री सेल्सियस दर्ज किया गया था.
तीन साल में सबसे ज्यादा बारिश वाला मार्च
पिछले तीन साल में मार्च का यह महीना सर्वाधिक बारिश वाला भी रहा. मार्च 2026 में 19.82 मिलीमीटर बारिश दर्ज की गई, जो 2023 के बाद से इस महीने के लिए सबसे ज़्यादा है. वर्ष 2023 में बारिश काफ़ी ज़्यादा यानी 50.4 मिलीमीटर हुई थी, जबकि 2024 और 2025 में बारिश का स्तर 2026 के स्तर से कम रहा.
भारत मौसम विज्ञान विभाग ने बताया कि 11 से 31 मार्च के बीच छह पश्चिमी विक्षोभों ने उत्तर-पश्चिमी भारत को प्रभावित किया, जिसके कारण आंधी-तूफान आने के साथ ही बारिश हुई. एक्सपर्ट्स ने इस महीने प्रदूषण की प्रकृति में आए बदलाव को भी रेखांकित किया है, जिसमें गैसीय प्रदूषकों ने प्रमुख भूमिका निभाई है. सीआरईए के विश्लेषक मनोज कुमार ने कहा कि मार्च का महीना इस बढ़ती अहमियत को दिखाता है कि ओज़ोन, कार्बन मोनोऑक्साइड, सल्फर डाइऑक्साइड और नाइट्रोजन डाइऑक्साइड जैसे गैसीय प्रदूषकों से भी निपटना ज़रूरी है.
Source: IOCL",0.8
"Delhi Weather : राजधानी में प्रदूषण बना रिकॉर्ड ब्रेकर, 4 साल में सबसे ज्यादा पड़ी गर्मी",https://www.dainiktribuneonline.com/news/nation/delhi-weather-pollution-in-the-capital-becomes-a-record-breaker-the-highest-heat-and-rain-in-4-years/,Dainik Tribune,2026-03-31T22:11:52+05:30,hi,Delhi,,"(लू OR ""लू चलना"" OR ""भीषण गर्मी"" OR ""प्रचंड गर्मी"" OR ""कड़ी धूप"" OR ""तेज धूप"" OR ""गर्म हवा"" OR ""उष्ण लहर"" OR ""ताप लहर"" OR ""हीट वेव"" OR ""झुलसाने वाली गर्मी"" OR ""तपती गर्मी"" OR ""भयंकर गर्मी"") Delhi","Delhi Weather : राजधानी में प्रदूषण बना रिकॉर्ड ब्रेकर, 4 साल में सबसे ज्यादा पड़ी गर्मी-बारिश
दिल्ली: हाल के वर्षों में मार्च सबसे गर्म, सबसे नम, सर्वाधिक प्रदूषित महीनों में से एक रहा
Delhi Weather : राष्ट्रीय राजधानी में मार्च के महीने में मौसम का मिजाज बिल्कुल भी सामान्य नहीं रहा, जहां एक दिन बारिश, दूसरे दिन गर्मी और पूरे महीने प्रदूषण का स्तर ऊंचा रहा। यह महीना दिल्ली में पिछले चार साल में सबसे ज्यादा प्रदूषित, तीन साल में सबसे ज्यादा बारिश वाला और 2022 के बाद से सबसे ज्यादा गर्म महीना दर्ज किया गया।
सेंटर फॉर रिसर्च ऑन एनर्जी एंड क्लीन एयर (सीआरईए) के एक विश्लेषण के अनुसार, 2026 में राष्ट्रीय राजधानी में मार्च का महीना पिछले चार साल में सर्वाधिक प्रदूषित रहा। 30 मार्च तक औसत वायु गुणवत्ता सूचकांक (एक्यूआई) 181 रहा, जो 2022 के बाद से सर्वाधिक है। 2022 में यह 217 था। इसकी तुलना में, 2023 में औसत एक्यूआई 170, वर्ष 2024 में 176 और 2025 में 170 था। विश्लेषण में कहा गया कि मार्च 2026 में दिल्ली में एक दिन 'संतोषजनक', 22 दिन 'मध्यम' और आठ दिन 'खराब' श्रेणी में रहे।
केंद्रीय प्रदूषण नियंत्रण बोर्ड के आंकड़ों पर आधारित सीआरईए के विश्लेषण के अनुसार 10 मार्च को दर्ज किया गया एक्यूआई स्तर (266) वर्ष 2023 के बाद से मार्च महीने का उच्चतम स्तर था। मौसम के लिहाज़ से, यह महीना हाल के वर्षों के सबसे गर्म महीनों में से एक रहा। औसत अधिकतम तापमान 32.6 डिग्री सेल्सियस रहा, जो पिछले चार वर्षों में सर्वाधिक है। इससे पहले 2022 में मार्च में औसत अधिकतम तापमान 33.4 डिग्री सेल्सियस दर्ज किया गया था।
पिछले तीन साल में मार्च का यह महीना सर्वाधिक बारिश वाला भी रहा। मार्च 2026 में 19.82 मिलीमीटर बारिश दर्ज की गई, जो 2023 के बाद से इस महीने के लिए सबसे ज्यादा है। वर्ष 2023 में बारिश काफी ज्यादा यानी 50.4 मिलीमीटर हुई थी, जबकि 2024 और 2025 में बारिश का स्तर 2026 के स्तर से कम रहा। भारत मौसम विज्ञान विभाग ने बताया कि 11 से 31 मार्च के बीच छह पश्चिमी विक्षोभों ने उत्तर-पश्चिमी भारत को प्रभावित किया, जिसके कारण आंधी-तूफान आने के साथ ही बारिश हुई।
विशेषज्ञों ने इस महीने प्रदूषण की प्रकृति में आए बदलाव को भी रेखांकित किया है, जिसमें गैसीय प्रदूषकों ने प्रमुख भूमिका निभाई है। सीआरईए के विश्लेषक मनोज कुमार ने पीटीआई-भाषा से कहा कि मार्च का महीना इस बढ़ती अहमियत को दिखाता है कि ओजोन, कार्बन मोनोऑक्साइड, सल्फर डाइऑक्साइड और नाइट्रोजन डाइऑक्साइड जैसे गैसीय प्रदूषकों से भी निपटना जरूरी है।",0.8
"व्यापक स्तर पर भीषण गर्मी की लहरें बढ़ रही हैं, जिससे स्वास्थ्य संबंधी कई जोखिम और आग लगने का खतरा पैदा हो रहा है। - Vietnam.vn",https://news.google.com/rss/articles/CBMinwFBVV95cUxNMkZOWnFkOEpXVTBXb29JZ3lhWmt0Zk5qcVZwTjNKR1h1MThjWkVFREd4bFlTeXZUVm5GcjUwMERxMDg1eF82NVpRUFRvWlgxbFRJMWlwZ2psSUpRbW5fRTVoM25abDg5MnZ3V1I3Y3JhVjNReHBLdjc0NGt5NVpNT2E5REdNOXo0dm5ZM0VaTmhJVHRremR0TWZBbWRUQVE?oc=5,Vietnam.vn,2026-03-31T13:39:20+05:30,hi,Delhi,,"(लू OR ""लू चलना"" OR ""भीषण गर्मी"" OR ""प्रचंड गर्मी"" OR ""कड़ी धूप"" OR ""तेज धूप"" OR ""गर्म हवा"" OR ""उष्ण लहर"" OR ""ताप लहर"" OR ""हीट वेव"" OR ""झुलसाने वाली गर्मी"" OR ""तपती गर्मी"" OR ""भयंकर गर्मी"" OR ""गर्मी का कहर"" OR ""गर्मी का प्रकोप"" OR ""अत्यधिक गर्मी"" OR मौसम OR ""मौसम अपडेट"" OR ""मौसम का हाल"" OR ""मौसम पूर्वानुमान"" OR ""मौसम अलर्ट"" OR आईएमडी OR ""आईएमडी पूर्वानुमान"" OR ""आईएमडी अलर्ट"" OR ""तापमान में बढ़ोतरी"" OR ""गर्मी से राहत"" OR ""गर्मी से निजात"") Delhi","व्यापक स्तर पर भीषण गर्मी की लहरें बढ़ रही हैं, जिससे स्वास्थ्य संबंधी कई जोखिम और आग लगने का खतरा पैदा हो रहा है।
हो ची मिन्ह सिटी और पड़ोसी प्रांतों में भीषण गर्मी की लहर फैल रही है, जिसकी तीव्रता पिछले वर्षों की तुलना में पहले ही बढ़ रही है, जिससे लोगों के स्वास्थ्य की रक्षा करने और आवासीय क्षेत्रों और उत्पादन सुविधाओं में आग के खतरों को रोकने की तत्काल आवश्यकता पैदा हो गई है।
Báo Tin Tức•31/03/2026
31 मार्च को दक्षिणी वियतनाम मौसम विज्ञान एवं जल विज्ञान केंद्र ने बताया कि कई क्षेत्रों में तापमान सामान्य से अधिक था, जो आमतौर पर 35 से 37 डिग्री सेल्सियस के बीच था, और कुछ स्थानों पर 37 डिग्री सेल्सियस से भी अधिक था; आर्द्रता कम थी, केवल 30-40%, जिससे उमस का अनुभव काफी बढ़ गया। सबसे गर्म समय प्रतिदिन सुबह 11 बजे से दोपहर 3 बजे के बीच रहा।
हो ची मिन्ह सिटी में, मुख्य रूप से शहर के मध्य और उत्तरी क्षेत्रों में, स्थानीय लू चल रही है, और अगले 24-48 घंटों में अधिकतम तापमान आमतौर पर 35-36 डिग्री सेल्सियस तक पहुंच सकता है। गौरतलब है कि कंक्रीट, डामर और इमारतों के उच्च घनत्व के कारण वास्तविक बाहरी तापमान पूर्वानुमान से 2-4 डिग्री सेल्सियस अधिक हो सकता है।
मौसम विज्ञान विशेषज्ञों के अनुसार, इस वर्ष की लू पिछले कई वर्षों के औसत से लगभग 10-15 दिन पहले आ गई है, जो आमतौर पर अप्रैल के मध्य में पड़ती है। यह घटनाक्रम जलवायु परिवर्तन के प्रभाव के साथ-साथ ENSO जलवायु दोलन के गर्म परिस्थितियों की ओर बढ़ने के संदर्भ में मौसम के बढ़ते जटिल रुझान को दर्शाता है।
दक्षिणी वियतनाम मौसम विज्ञान एवं जल विज्ञान केंद्र का पूर्वानुमान है कि अगले 3-5 दिनों में हो ची मिन्ह सिटी और दक्षिणी वियतनाम में लू की तीव्रता बढ़ती रहेगी। अधिकतम तापमान आमतौर पर 35-37 डिग्री सेल्सियस तक पहुंच जाएगा, कुछ क्षेत्रों में यह 37 डिग्री सेल्सियस से भी अधिक हो सकता है, और यह कई दिनों तक जारी रह सकता है। बढ़ते तापमान के अलावा, गरज-चमक, बवंडर, बिजली गिरने और स्थानीय स्तर पर भारी बारिश जैसी चरम मौसमी घटनाएं भी मौसम परिवर्तन के दौरान अधिक बार होने की संभावना है।
अवलोकन से पता चलता है कि दोपहर से लेकर दोपहर बाद तक हो ची मिन्ह शहर की कई सड़कों पर तेज धूप और अत्यधिक गर्मी पड़ती है, जिससे यातायात मुश्किल हो जाता है। राइड-हेलिंग ड्राइवर श्री फान मिन्ह टी. ने बताया कि हाल के दिनों में व्यस्त समय में यात्रा करते समय उन्हें अक्सर थकान महसूस होती है। कभी-कभी दोपहर के समय ट्रैफिक सिग्नल पर रुकने पर सड़क की सतह से निकलने वाली गर्मी असहनीय हो जाती है; थोड़ी देर गाड़ी चलाने के बाद ही उन्हें प्यास लगने लगती है और चक्कर आने लगते हैं, अगर वे थोड़ा आराम न करें।
बेन थान वार्ड में काम करने वाली सुश्री गुयेन थी पी., जो अक्सर शहर के केंद्र से होते हुए मोटरसाइकिल से आती-जाती हैं, ने बताया: “मुझे भीषण गर्मी से बचने के लिए अपने यात्रा समय को पहले से ही समायोजित करना पड़ता है। दोपहर में बाहर निकलने की हिम्मत ही नहीं होती, और अगर निकलना ही पड़े तो मुझे खुद को पूरी तरह ढकना पड़ता है और पानी साथ रखना पड़ता है। पिछले वर्षों की तुलना में अब धूप बहुत तेज होती है, और लंबे सफर के बाद मेरी त्वचा जलने लगती है।”
निर्माण स्थलों पर कामगार सीधे तौर पर भीषण गर्मी से प्रभावित होते हैं। लॉन्ग ट्रूंग वार्ड के एक कामगार श्री गुयेन वान एच. ने बताया कि भीषण गर्मी के कारण काम करने की क्षमता काफी कम हो जाती है। थकान से बचने के लिए कामगारों को अपनी शिफ्टों को छोटे-छोटे समूहों में बांटना पड़ता है और शिफ्टों के बीच आराम का समय बढ़ाना पड़ता है। सुबह लगभग 11 बजे से लगातार काम करने पर तेज गर्मी के कारण चक्कर आने लगते हैं, इसलिए वे काम जारी रखने से पहले ताकत जुटाने के लिए बार-बार छोटे-छोटे ब्रेक लेते हैं।
मौसम विज्ञान एजेंसी ने यह भी चेतावनी दी है कि उच्च तापमान और कम आर्द्रता के कारण आवासीय क्षेत्रों, बाजारों, गोदामों और जंगलों में विस्फोट और आग लगने का खतरा बढ़ जाता है। साथ ही, लंबे समय तक तेज गर्मी के संपर्क में रहने से निर्जलीकरण, थकावट और यहां तक कि लू लगने जैसी समस्या भी हो सकती है, खासकर बुजुर्गों और छोटे बच्चों के लिए।
मौजूदा स्थिति को देखते हुए, अधिकारियों ने लोगों को सलाह दी है कि वे सुबह 11 बजे से दोपहर 3 बजे तक व्यस्त समय में घर से बाहर कम निकलें, पर्याप्त मात्रा में पानी पिएं, धूप से बचाव के उपाय अपनाएं और अपने घरेलू बिजली के सिस्टम की नियमित रूप से जांच करते रहें। व्यवसायों और उत्पादन इकाइयों को सुरक्षित दूरी बनाए रखने के लिए सामान की व्यवस्था करनी चाहिए, परिसर में आग बुझाने के उपकरण रखने चाहिए और सुरक्षित निकलने के रास्ते खुले रखने चाहिए।
मौसम की बढ़ती चरम घटनाओं के संदर्भ में, सक्रिय रोकथाम, आग की रोकथाम और नियंत्रण के बारे में जागरूकता बढ़ाना और लोगों के स्वास्थ्य की रक्षा करना, क्षेत्र में नुकसान को कम करने और जीवन और संपत्ति की सुरक्षा सुनिश्चित करने के लिए प्रमुख समाधानों के रूप में पहचाना गया है।",1.0
