title,url,source,date,language,state,district,search_term,full_text,relevance_score
வெப்ப அலை எச்சரிக்கை: பெர்லிஸ் மற்றும் கெடாவின் 6 மாவட்டங்களில் வெயில் அதிகரிக்கும் – MetMalaysia எச்சரிக்கை! - Makkal Osai,https://news.google.com/rss/articles/CBMizwJBVV95cUxOMERNZm1DVk51VVk4Wjd2T0VBMnplT0NBQnhXS2d6UmRDcmt4VTVma1ZNNzFwbENkcVFXRzJtMk1Cd2Z1TDJ5S1RxbzBQVHpYLTNZMFdPcm5kLTNONk1SRUp6VmE1RF9NUDFjS0JaemxJaTNWMnpvZ09aUF81TFdWaWVyTlJ4bXFaMmZGTTlOMDZYZEhCTFYzdnVpb3A0LWJoT2czamVJSjhlY3NBNjdpVHZIajUtYmZVVmNGbjNEZ09Ob19zcHNienVFMXFscmdEYnNyNGpUdUsxOFpBM0FkV2tuUXVhM3JLRTJKU3VySllseUlMbDBIME1LV2dRY0hwOXFpaWRsNkxnSzJNMnlkdEQ0dWNuc1M3TTlXcDUtN3R6SVphX1lVMUNXQlU1NWdVbUpIRy15WURfWENUZ2hvTllxSXBiSUVVMlhWb1NWaw?oc=5,Makkal Osai,2026-02-25T04:17:51+05:30,ta,Puducherry,,"(""வெப்ப அலை"" OR ""அக்னி நட்சத்திரம்"" OR ""கடும் வெயில்"" OR ""கொளுத்தும் வெயில்"" OR ""எரிக்கும் வெயில்"" OR ""கடுமையான வெப்பம்"" OR ""வெயில் கொடுமை"" OR ""ஹீட் வேவ்"" OR ""கொடும் வெயில்"" OR ""வெப்பத்தின் தாக்கம்"" OR ""அசாதாரண வெப்பம்"") Puducherry","கோலாலம்பூர், பிப்ரவரி 25, 2026:
மலேசியாவின் தீபகற்பத்தின் வடக்குப் பகுதிகளில் உள்ள ஏழு பகுதிகளில் முதல் நிலை (Level-one) வெப்ப வானிலை எச்சரிக்கையை மலேசிய வானிலை ஆய்வு மையம் (MetMalaysia) இன்று விடுத்துள்ளது.
MetMalaysia தனது அதிகாரப்பூர்வ முகநூல் பக்கத்தில் வெளியிட்டுள்ள தகவலின்படி, பின்வரும் பகுதிகளில் வெப்பம் அதிகமாக இருக்கும் என எதிர்பார்க்கப்படுகிறது:
பெர்லிஸ் மாநிலம் முழுவதும் மற்றும், கெடாவில் குபாங் பாசு (Kubang Pasu), பாடாங் தெராப் (Padang Terap), போக்கோக் செனா (Pokok Sena), சிக் (Sik), பாலிங் (Baling) மற்றும் பண்டார் பாரு (Bandar Baharu) ஆகிய ஆறு மாவட்டங்கள் இந்த வானிலையை எதிர்நோக்கும்.
இந்தக் குறிப்பிட்ட பகுதிகளில் அடுத்த மூன்று நாட்களுக்குத் தொடர்ந்து தினசரி அதிகபட்ச வெப்பநிலையானது 35°C முதல் 37°C வரை பதிவாகக்கூடும் என்று கணிக்கப்பட்டுள்ளது.
கோடை வெயில் அதிகரித்து வருவதால், பொதுமக்கள் போதுமான அளவு தண்ணீர் குடிக்கவும், தேவையற்ற வெளிப்புற நடவடிக்கைகளைத் தவிர்க்கவும் அறிவுறுத்தப்படுகிறார்கள்.",0.0
