title,url,source,date,language,state,district,search_term,full_text,relevance_score
"बिहार दिनभर- 10 बड़ी खबरें: तेजस्वी आवास में रहेंगे लालू-राबड़ी, लद्दाख में 2 मजदूरों की मौत, 22 जिलों में ... - Dainik Bhaskar",https://news.google.com/rss/articles/CBMi3gFBVV95cUxObjc2SzNXdlVwOV9GbTBUbHBxclFYOTFMVVRxSTl4bnozU25JWTNteGNva01fS2FaZGZVSHpnbzF6TEZjT1A4TzRWMnhZcFBQTEMzNlp4ZWtZc29pNGp2WTZCVC1ZY0hOVkh3Tk9lMEFzaEItSmpQcl9pa0w4WjFyY2x0TEoxTVkxX3pFZkZCR3g0dC1rbnFmMFI3cFptRDZrWklVdUVtUjVuSmtheGRGT2FTaVVSYWw4YTM2Z0wwZE9TUkp2S1hsRzM3cEhuM1R4TERYYTZOZk5UUTBfNUHSAeMBQVVfeXFMTy0zV3FURWp3LU1wTUdkWVV2eEliekRMS0ROWGFXSTc4ZTNKUHVia3YtbDRudGZ5MzhXVlNMOWNraUVreTNRVXRENnB2RFlpQldfM1lLM2tVWkxfdlhpR3V6X1RYa0oycWRVYVVhcG9HS1pna1R4UEt2bU5MNk5ZdXhYd3RTWnlvUms5ZzVxcWtfcTFXZWZiam96djNjWUp0YWE4VlU1VHJhVmg2QVdoUXpxc0E4QlNTdmhHTTdPUWV5X09TN2lZcnBJLUNvNFI5cFFaQVRzNzA0MHFSc0lfVlY3dms?oc=5,Dainik Bhaskar,2026-06-28T18:06:53+05:30,hi,Ladakh,,"(""हीट एक्शन प्लान"" OR ""गर्मी से राहत"" OR चेतावनी OR ""रेड अलर्ट"" OR ""ऑरेंज अलर्ट"" OR ""येलो अलर्ट"" OR एडवाइजरी OR ""राहत सामग्री"" OR ""राहत शिविर"" OR मुआवजा) Ladakh","बिहार दिनभर- 10 बड़ी खबरें:तेजस्वी आवास में रहेंगे लालू-राबड़ी, लद्दाख में 2 मजदूरों की मौत, 22 जिलों में बारिश का ऑरेंज अलर्ट
- कॉपी लिंक
नमस्कार,
आज की सबसे बड़ी खबर बिहार की सियासत से जुड़ी है। नेता प्रतिपक्ष तेजस्वी यादव ने उपमुख्यमंत्री सम्राट चौधरी को 'अंगूठा छाप' बताया। उन्होंने कहा कि टेंडर घोटाले में दो IAS अधिकारी सस्पेड हुए, लेकिन चार्जशीट में उनका नाम क्यों नहीं है। इसके अलावा तेजस्वी ने पूर्व मुख्यमंत्री नीतीश कुमार को भ्रष्टाचार का भीष्म पितामह भी कहा।
इधर, बेगूसराय में केनरा बैंक के असिस्टेंट मैनेजर का शव उनके किराए के कमरे से सड़ी-गली अवस्था में बरामद हुआ। शव पर कपड़े नहीं थे। बताया जा रहा है कि वह करीब एक महीने से बैंक नहीं गए थे। वहीं, राजस्थान के कोटा में JEE की तैयारी कर रही अररिया की 17 साल की छात्रा जया श्री की मौत हो गई। जया श्री, युगेश पंजियार की बेटी थीं और करीब छह महीने पहले ही अररिया से कोटा पढ़ाई के लिए गई थीं।
चलिए सिलसिलेवार पढ़ते हैं, बिहार दिनभर में क्या कुछ खास रहा.
1. तेजस्वी बोले- सम्राट चौधरी अंगूठा छाप CM
नेता प्रतिपक्ष तेजस्वी यादव ने टेंडर घोटाले को लेकर बिहार सरकार को घेरा है। तेजस्वी ने कहा, “बिहार के जो बतोलबाज मुख्यमंत्री हैं। उन्होंने 607 करोड़ रुपए इमरजेंसी फंड की निकासी की है। बिहार के हर बार बड़ा घोटाला होता है। छोटे लोगों को फंसा दिया जाता है। मास्टरमाइंड तक जांच एजेंसी नहीं पहुंच पाती है। पूरी खबर पढ़ें…
2. खान सर ने अवैध हथियार से चलवाई थी गोली
पटना पुलिस की जांच में फैजल खान (खान सर) के दोनों बॉडीगार्ड्स के हथियारों के वेरिफिकेशन के दौरान अहम जानकारियां सामने आई हैं। इस दौरान चौंकाने वाला खुलासा हुआ है। पुलिस सूत्रों के मुताबिक, जिस हथियार से गोली चलवाई गई थी, वह तालेबर सिंह (34), निवासी कासगंज (उत्तर प्रदेश) का है, पूरी खबर पढ़ें…
3. तेजस्वी यादव के आवास में शिफ्ट होंगे लालू-राबड़ी
लालू यादव और राबड़ी देवी अपने बेटे और नेता प्रतिपक्ष के आवास में 1 जून को शिफ्ट करेंगे। राबड़ी देवी फिलहाल 10 सर्कुलर रोड वाला बंगले में रह रही हैं। इसे खाली करने की मियाद सोमवार यानी 29 जून को खत्म हो रही है। सरकार की तरफ से राबड़ी देवी को 39 हार्डिंग रोड स्थित आवास अलॉट हुआ है। पूरी खबर पढ़ें…
4. बिहार सिपाही भर्ती परीक्षा, जूते-चप्पल उतरवा कर चेकिंग
केंद्रीय चयन पर्षद (CSBC) की ओर से आज बिहार पुलिस कॉन्स्टेबल भर्ती परीक्षा पूरे राज्य में हो रही है। एग्जाम के लिए एंट्री 11 बजे बंद हो गई है। परीक्षा सेंटर में कड़ी सुरक्षा के बीच छात्रों को एंट्री दी गई। मेटल डिटेक्टर से जांच की गई। जूते-चप्पल खुलवाकर चेकिंग हुई। लिखित परीक्षा दोपहर 12:00 बजे से 2:00 बजे तक चलेगी। पूरी खबर पढ़ें…
5. बिहार की JEE छात्रा की कोटा में मौत, फ्लाईओवर के नीचे गिरी मिली
राजस्थान के कोटा में JEE की तैयारी कर रही अररिया की एक छात्रा के मौत का मामला सामने आया है। लड़की की पहचान युगेश पंजियार की बेटी जया श्री (17) के रूप में हुई है। वो 6 महीने पहले ही अररिया से कोटा पढ़ने गई थी। पिता का कहना है, शनिवार की रात 11 बजे बेटी गंभीर घायल अवस्था में विज्ञान नगर फ्लाईओवर के नीचे गिरी हुई मिली थी। पूरी खबर पढ़ें…
6. लद्दाख में बिहार के 2 राजमिस्त्रियों की मौत:मलबे के नीचे दबने से हादसा
लद्दाख में एक मकान की मरम्मत के दौरान दीवार और छत गिरने से पश्चिम चंपारण के दो राजमिस्त्रियों की मौत हो गई। यह घटना यंथाग गांव के पास हुई, जहां दोनों मजदूर काम कर रहे थे। मृतकों की पहचान मो. फारूक और साठी थाना क्षेत्र के लछनौता गांव स्थित बौद्ध टोला निवासी ओजीर बैठा के रूप में हुई है। पूरी खबर पढ़ें…
7. बेगूसराय- केनरा बैंक के असिस्टेंट मैनेजर की न्यूड लाश मिली
बेगूसराय में केनरा बैंक के असिस्टेंट मैनेजर की किराए के कमरे में लाश मिली है। लाश सड़ी-गली और न्यूड थी। मृतक की पहचान 34 साल के बृजमोहन गुड्डू के रूप में हुई है, जो पटना सिटी के रहने वाले थे। लाश मिलने की सूचना लोगों को तब हुई, जब रविवार को बंद कमरे से अचानक काफी तेज दुर्गंध आने लगी। पूरी खबर पढ़ें…
8. पूर्णिया में फायरिंग करते युवक का वीडियो वायरल, खुलेआम देसी कट्टा लहरा रहा
पूर्णिया में एक युवक का हथियार लहराते वीडियो सोशल मीडिया पर तेजी से वायरल हो रहा है। वायरल वीडियो में युवक खुलेआम देसी कट्टा लहरा रहा है और हर्ष फायरिंग कर रहा है। वीडियो सामने आने के बाद इलाके में लोग कानून-व्यवस्था को लेकर सवाल उठा रहे हैं। वायरल वीडियो मीरगंज थाना क्षेत्र इलाके का है। पूरी खबर पढ़ें…
खबर हटके…
9. दरभंगा- आपत्तिजनक स्थिति में पकड़ाया शादीशुदा प्रेमी जोड़ा, ग्रामीणों ने पीटा
दरभंगा में शनिवार की देर रात एक बंद कमरे से शादीशुदा महिला और शादीशुदा पुरुष संदिग्ध परिस्थिति में पकड़े गए। घटना की जानकारी मिलते ही बड़ी संख्या में ग्रामीण मौके पर जुट गए और दोनों की पिटाई कर दी। इसका वीडियो भी सामने आया है। स्थानीय लोगों ने मामले की सूचना डायल-112 पुलिस को दी। पूरी खबर पढ़ें..
अब चलते-चलते एक नजर कल के मौसम पर
10. 22 जिलों में कल बारिश को लेकर अलर्ट जारी
बिहार के 22 जिलों में सोमवार को बारिश को लेकर अलर्ट जारी किया गया है। वहीं, अन्य सभी जिलों में मौसम सामान्य रहने का अनुमान है। मौसम विभाग के अनुसार, अधिकतम तापमान 35 से 36 डिग्री सेल्सियस और न्यूनतम तापमान करीब 28 डिग्री सेल्सियस रहने की संभावना है।",1.0
"Ladakh Tourism: लद्दाख में ऑफ-रोडिंग का शौक पड़ा महंगा, पर्यटकों पर ठोका 2 लाख रुपये का जुर्माना - InKhabar",https://news.google.com/rss/articles/CBMi7wFBVV95cUxOQjRYRHVGMXVIaXhWS1ZGVjBTN25EeFJOQ2EwODQ0YWxEM0RlWFNZd0VwLUxqaWh3TTlPRlFqdWhOOEoxTTVZbGJBSVR0ay1WTGo4VjFBS1lFbDVZN3FncVZjdlJwY05QMTdXN1N4TDlkU1lvVERYME1hbnR5cnViSng5WnpaTXNXS0xGYlpLS2pXZjEyLVc2RDlhQ1Axc01EQjA3ZF9OaW1iMF9zd0UyTnlsYkNGSWllbTZ2dk1IQ2dzWHJfMHpqd3RqTVVIQXRoVlVPcEFxUE8wS1hzSDUya2FDYy1ZZU1VRFM1MnkzWdIB7wFBVV95cUxOQjRYRHVGMXVIaXhWS1ZGVjBTN25EeFJOQ2EwODQ0YWxEM0RlWFNZd0VwLUxqaWh3TTlPRlFqdWhOOEoxTTVZbGJBSVR0ay1WTGo4VjFBS1lFbDVZN3FncVZjdlJwY05QMTdXN1N4TDlkU1lvVERYME1hbnR5cnViSng5WnpaTXNXS0xGYlpLS2pXZjEyLVc2RDlhQ1Axc01EQjA3ZF9OaW1iMF9zd0UyTnlsYkNGSWllbTZ2dk1IQ2dzWHJfMHpqd3RqTVVIQXRoVlVPcEFxUE8wS1hzSDUya2FDYy1ZZU1VRFM1MnkzWQ?oc=5,InKhabar,2026-06-28T17:47:12+05:30,hi,Ladakh,,"(""हीट एक्शन प्लान"" OR ""गर्मी से राहत"" OR चेतावनी OR ""रेड अलर्ट"" OR ""ऑरेंज अलर्ट"" OR ""येलो अलर्ट"" OR एडवाइजरी OR ""राहत सामग्री"" OR ""राहत शिविर"" OR मुआवजा) Ladakh","Ladakh Tourism: देश के सबसे खूबसूरत पर्यटन स्थलों में शामिल लद्दाख में अब पर्यावरण को नुकसान पहुंचाने वाले पर्यटकों पर सख्ती शुरू हो गई है. प्रशासन ने प्रतिबंधित और इको-सेंसिटिव जोन में अवैध रूप से गाड़ियां ले जाने वाले लोगों के खिलाफ कड़ा रुख अपनाते हुए भारी जुर्माना लगाने की कार्रवाई शुरू कर दी है. हाल के वर्षों में लद्दाख में ऑफ-रोडिंग और स्टंटबाजी का चलन तेजी से बढ़ा है. कई पर्यटक रोमांच के नाम पर संवेदनशील झीलों, नदी किनारों और वन्यजीव क्षेत्रों में वाहन लेकर पहुंच जाते हैं, जिससे वहां के नाजुक पर्यावरण और जैव विविधता पर खतरा पैदा हो रहा है. इसी को देखते हुए प्रशासन ने अब नियम तोड़ने वालों पर शिकंजा कसना शुरू कर दिया है.
पहली बार हुई इतनी सख्त कार्रवाई
लद्दाख प्रशासन ने उप-राज्यपाल वी.के. सक्सेना के निर्देश पर पहली बार ऐसे वाहन चालकों के खिलाफ कानूनी कार्रवाई शुरू की है, जिन्होंने वन्यजीव संरक्षण नियमों और पर्यावरणीय दिशा-निर्देशों का उल्लंघन किया. 26 जून को लद्दाख के वन्यजीव विभाग ने चार वाहनों पर 50,000 रुपये प्रति वाहन का जुर्माना लगाया. ये वाहन संरक्षित क्षेत्रों में अवैध रूप से प्रवेश करते और ऑफ-रोडिंग करते पाए गए थे. इस कार्रवाई के तहत कुल 2 लाख रुपये का जुर्माना वसूला गया है, जो लद्दाख में इस तरह की गतिविधियों के खिलाफ अब तक की सबसे कड़ी कार्रवाई मानी जा रही है.
किन राज्यों के पर्यटकों पर लगा जुर्माना?
प्रशासन के अनुसार जिन चार वाहनों पर कार्रवाई की गई, उनके मालिक हिमाचल प्रदेश, चंडीगढ़, पंजाब और उत्तर प्रदेश से थे. इन पर्यटकों ने हाल के दिनों में पैंगोंग झील, चांगथांग क्षेत्र और नुब्रा घाटी के संरक्षित वन्यजीव इलाकों में अपनी गाड़ियां चलाई थीं. ये क्षेत्र पर्यावरण और वन्यजीव संरक्षण की दृष्टि से बेहद संवेदनशील माने जाते हैं.
पैंगोंग झील और चांगथांग क्षेत्र क्यों हैं खास?
पैंगोंग झील, चांगथांग और नुब्रा घाटी लद्दाख की सबसे महत्वपूर्ण प्राकृतिक धरोहरों में गिने जाते हैं. ये इलाके कई दुर्लभ और संकटग्रस्त वन्यजीवों का प्राकृतिक आवास हैं. विशेषज्ञों के अनुसार इन क्षेत्रों में वाहनों की अनियंत्रित आवाजाही से मिट्टी का कटाव बढ़ता है, प्राकृतिक आवास प्रभावित होते हैं और वन्यजीवों की गतिविधियों में भी बाधा उत्पन्न होती है. यही वजह है कि इन क्षेत्रों को विशेष संरक्षण प्राप्त है.
प्रशासन ने दिया स्पष्ट संदेश
उपराज्यपाल सचिवालय ने कहा है कि नियमों का उल्लंघन करने वाले वाहन चालकों पर लगाया गया जुर्माना लद्दाख के नाजुक इकोसिस्टम और संकटग्रस्त वन्यजीवों की सुरक्षा के प्रति प्रशासन की गंभीरता को दर्शाता है. प्रशासन का मानना है कि पर्यटन और पर्यावरण संरक्षण के बीच संतुलन बनाए रखना बेहद जरूरी है. यदि पर्यटक नियमों का पालन नहीं करेंगे तो क्षेत्र की प्राकृतिक सुंदरता और जैव विविधता को गंभीर नुकसान पहुंच सकता है.
बढ़ रहे थे ऑफ-रोडिंग और स्टंट के मामले
जानकारी के मुताबिक पिछले कुछ समय से लद्दाख में अवैध ऑफ-रोडिंग, नदी-झीलों में वाहन चलाने और सोशल मीडिया के लिए खतरनाक स्टंट करने के मामलों में लगातार बढ़ोतरी देखी गई है. पर्यावरणविद लंबे समय से ऐसी गतिविधियों पर रोक लगाने की मांग कर रहे थे. प्रशासन की यह कार्रवाई उसी दिशा में उठाया गया एक महत्वपूर्ण कदम मानी जा रही है. उप-राज्यपाल वी.के. सक्सेना ने कहा कि लद्दाख देश और दुनिया भर से आने वाले पर्यटकों का स्वागत करता है, लेकिन हर पर्यटक की जिम्मेदारी है कि वह यहां के पर्यावरण, संस्कृति और प्राकृतिक धरोहरों का सम्मान करे. उन्होंने कहा कि रोमांच और एडवेंचर के नाम पर ऐसे कार्य नहीं किए जाने चाहिए, जिससे स्थानीय पारिस्थितिकी तंत्र को नुकसान पहुंचे. जिम्मेदार पर्यटन ही लद्दाख की प्राकृतिक खूबसूरती को आने वाली पीढ़ियों तक सुरक्षित रख सकता है.
पर्यावरण संरक्षण और पर्यटन के बीच संतुलन जरूरी
लद्दाख प्रशासन की इस कार्रवाई को एक चेतावनी के रूप में देखा जा रहा है कि अब संवेदनशील क्षेत्रों में नियमों की अनदेखी करने वालों को बख्शा नहीं जाएगा. प्रशासन का लक्ष्य केवल जुर्माना वसूलना नहीं, बल्कि पर्यटकों को पर्यावरण संरक्षण के प्रति जागरूक बनाना भी है. यदि समय रहते ऐसे कदम नहीं उठाए गए, तो लद्दाख जैसे संवेदनशील क्षेत्रों की प्राकृतिक पहचान और जैव विविधता पर गंभीर खतरा पैदा हो सकता है.",0.31666666666666665
