title,url,source,date,language,state,district,search_term,full_text,relevance_score
"Dalai Lama Vs China: घुटने की सर्जरी कराकर लद्दाख पहुंच गया 91 साल का यह बुजुर्ग, इनसे पंगा नहीं चाहता है चीन",https://navbharattimes.indiatimes.com/india/dalai-lama-arrived-in-leh-ladakh-india-to-celebrate-his-91th-birthday-on-6th-july-why-this-is-tension-for-china-explained/articleshow/132053736.cms,नवभारत टाइम्स,2026-06-28T21:00:46+05:30,hi,Ladakh,,"(लू OR ""लू चलना"" OR ""भीषण गर्मी"" OR ""प्रचंड गर्मी"" OR ""कड़ी धूप"" OR ""तेज धूप"" OR ""गर्म हवा"" OR ""उष्ण लहर"" OR ""ताप लहर"" OR ""हीट वेव"" OR ""झुलसाने वाली गर्मी"" OR ""तपती गर्मी"" OR ""भयंकर गर्मी"") Ladakh","Dalai Lama in Ladakh: तिब्बतियों के आध्यात्मिक गुरु दलाई लामा अपने ग्रीष्मकालीन प्रवास के लिए लद्दाख पहुंच गए हैं, जहां वह अपना 91वां जन्मदिन मनाएंगे।
कारगिल। तिब्बती आध्यात्मिक गुरु 14वें दलाई लामा, गर्मियों में अपने सालाना लंबे प्रवास के लिए 28 जून को लद्दाख पहुंच गए हैं। वे दिल्ली में घुटनों का इलाज के बाद इस क्षेत्र की यात्रा कर रहे हैं। लद्दाख वह क्षेत्र है, जहां से तिब्बत बेहद नजदीक है, जिसे चीन अपना स्वायत्तशासी क्षेत्र मानता है। यहीं से निकलकर 1959 में दलाई लामा ने भारत में शरण ली थी।
दलाई लामा: धार्मिक शिक्षाएं और जन्मदिन
सरकारी सूत्रों के अनुसार, लद्दाख में दलाई लामा धार्मिक शिक्षाएं देंगे और 6 जुलाई को अपने 91वें जन्मदिन के लिए खास कार्यक्रम शामिल होंगे। उन्होंने बताया कि 14वें दलाई लामा लद्दाख में दो महीने तक रहेंगे। लेह प्रशासन ने लद्दाख बौद्ध संघ (LBA) और लद्दाख गोंपा संघ (LGA) के साथ मिलकर लेह के टेक्निकल आर्मी एयरपोर्ट पर उनके आगमन के लिए एक भव्य पारंपरिक स्वागत समारोह आयोजित किया है।
जुलाई और अगस्त तक रह सकते हैं दलाई लामा
लद्दाख बौद्ध संघ के अध्यक्ष त्सेरिंग दोरजे लाक्रूक ने मीडिया को बताया कि उनके जुलाई के पूरे महीने और अगस्त के लगभग आधे महीने तक लद्दाख में रहने की उम्मीद है। उन्होंने आगे कहा कि इस साल लोगों को आशीर्वाद देने और उनसे मिलने के कार्यक्रम पिछले वर्षों की तुलना में कम हो सकते हैं, क्योंकि हाल ही में उनके घुटने की सर्जरी हुई है और उन्हें अपनी यात्रा के दौरान पर्याप्त आराम की जरूरत है।
उन्होंने यह भी बताया कि उनके माथो गांव जाने की उम्मीद है, जहां वे 'यारचोस चेनमो' की शिक्षाएं देंगे। अन्य शिक्षाओं और सार्वजनिक कार्यक्रमों के बारे में जानकारी उनके लद्दाख पहुंचने के बाद तय और घोषित की जाएगी। उन्होंने यह भी कहा कि 6 जुलाई, 2026 को दलाई लामा का 91वां जन्मदिन पूरे लद्दाख में बहुत उत्साह और धूमधाम से मनाया जाएगा। लाक्रूक ने इस पक्की यात्रा को लेकर भक्तों और शुभचिंतकों की खुशी ज़ाहिर की।
6 जुलाई को 91 साल के हो जाएंगे दलाई लामा
दलाई लामा 6 जुलाई को 91 साल के हो जाएंगे। उन्हें 61 साल पहले 1959 तिब्बत से भागना पड़ा था. तब से वो भारत में रह रहे हैं। 31 मार्च 1959 को तिब्बत के इस धर्मगुरु ने भारत में कदम रखा था। 17 मार्च को वो तिब्बत की राजधानी ल्हासा से पैदल ही निकले थे और हिमालय के पहाड़ों को पार करते हुए 15 दिनों बाद भारतीय सीमा में दाखिल हुए थे।
दलाई लामा चीन की आंखों में धूल झोंककर भारत पहुंचे थे
भारत आते वक्त दलाई लामा के साथ कुछ सैनिक और कैबिनेट के मंत्री थे। चीन की नजरों से बचने के लिए ये लोग सिर्फ रात को सफर करते थे। टाइम मैगजीन के मुताबिक बाद में ऐसी अफवाहें भी फैलीं कि 'बौद्ध धर्म के लोगों की प्रार्थनाओं के कारण धुंध बनी और बादलों ने लाल जहाजों की नजर से उन्हें बचाए रखा।'
चीन के दलाई लामा से चिढ़ने की वजह क्या है
चीन दलाई लामा को अलगाववादी मानता है। वह सोचता है कि दलाई लामा उसके लिए समस्या हैं।
दलाई लामा अमेरिका भी जाते हैं तो चीन के कान खड़े हो जाते हैं. हालांकि 2010 में तत्कालीन अमरीकी राष्ट्रपति बराक ओबामा ने चीन के विरोध के बावजूद दलाई लामा से मुला्कात की थी।
चीन को यह भी खतरा सताता है कि दलाई लामा की वजह से कहीं तिब्बत में चीन के खिलाफ सांस्कृतिक विद्रोह न शुरू हो जाए।
चीन इसी वजह से अरुणाचल प्रदेश को लेकर भी दावा करता है, क्योंकि अरुणालचल का तवांग मठ का तिब्बत के मठ से गहरा नाता है। चीन को यह भी डर सताता है कि ये मठ कहीं उसके खिलाफ बड़े विद्रोह को न जन्म दे दें।
1989 में दलाई लामा को शांति का नोबेल सम्मान मिला। दलाई लामा का अब कहना है कि वह चीन से आजादी नहीं चाहते हैं, लेकिन स्वायतता चाहते हैं।
लेखक के बारे मेंदिनेश मिश्रदिनेश मिश्र, नवभारत टाइम्स (डिजिटल) में असिस्टेंट एडिटर और एक्सप्लेनर एक्सपर्ट हैं। वे अप्रैल-2024 में टाइम्स ऑफ इंडिया ग्रुप के नवभारत टाइम्स, डिजिटल विंग से जुड़े। दिनेश मिश्र NBT डिजिटल में एक्सप्लेनर और स्पेशल स्टोरीज की जिम्मेदारी संभाल रहे हैं। ये एक्सप्लेनर राष्ट्रीय-अंतरराष्ट्रीय, बिजनेस और एंटरटेनमेंट समेत किसी भी कैटेगरी की खबरों से जुडे होते हैं, जिसमें दिनेश मिश्र रणनीतिक रूप से डीप डाइव, रिसर्च, वैल्यु एड, एक्सपर्ट कमेंट्स जैसी जरूरी बातें शामिल होती हैं। इन एक्सप्लेनर को लेकर वीडियो भी करते हैं। साथ ही NBT डिजिटल के स्थायी कॉलम मंडे मोटिवेशन, ट्यूजडे ट्रीविया और वेडनेसडे बिग टिकट के लिए डीप डाइव रोचक स्टोरी भी लिखते हैं। वह हर एक्सप्लेनर स्टोरी में सटीक संपादन के साथ-साथ रियल टाइम का ध्यान रखते हैं। इसके अलावा, वे गूगल ट्रेंड से जुड़ी स्टोरीज भी करते आए हैं, जो अहम टास्क है।
दिनेश मिश्र ने प्रयागराज महाकुंभ की ग्राउंड कवरेज की है। साथ ही 2019 के लोकसभा चुनाव के दौरान खबरों को डेस्क और ग्राउंड दोनों से कवर किया है। 2025 के लोकसभा चुनाव के साथ-साथ स्टेट असेंबली इलेक्शंस (हालिया महाराष्ट्र और बिहार चुनाव) के दौरान भी डेस्क से ओपिनियन पीस लिखने के साथ-साथ रियल टाइम एक्सप्लेनर भी किए। इसके अलावा, सोशल मीडिया पर फर्जी खबरों के खिलाफ एनबीटी फैक्ट चेक भी करते रहे हैं।
दिनेश मिश्र अपने करीब 16 साल के कॅरियर के दौरान प्रिंट मीडिया और डिजिटल मीडिया में डेस्क, ग्राउंड रिपोर्टिंग और इंटरव्यू करने के साथ अलग-अलग भूमिकाओं में काम करते आए हैं। हिंदी और गीत-संगीत में दखल रखने वाले दिनेश मिश्र ने कई किताबों की समीक्षा भी की। दिनेश मिश्र ने जाने-माने गीतकार गुलजार और गोपालदास नीरज का इंटरव्यू किया, हिंदी के महान कवि सूर्यकांत त्रिपाठी निराला के अनुभवों को लेकर ग्राउंड रिपोर्टिंग भी की। दिनेश मिश्र ने शोले के निर्माता-निर्देशक रमेश सिप्पी का इंटरव्यू भी किया। वरिष्ठ पत्रकार कुलदीप नैयर का इमरजेंसी के अनुभव पर इंटरव्यू किए और 1996 से लेकर 2001 तक अमेरिका में भारत के राजदूत रहे नरेश चंद्रा का भी इंटरव्यू किया है। इसके अलावा, हिंदी के बड़े लेखक गिरिराज किशोर और विश्वनाथ त्रिपाठी का इंटरव्यू भी किए।
नेशनल-इंटरनेशनल, बिजनेस और एंटरटेनमेंट की खबरों को लेकर मीडिया और सोशल मीडिया पर नजर रहती है। पहली प्राथमिकता है किसी भी खबर की सच्चाई के साथ विश्लेषण करना। इसके बाद उसका असर कहां और कितना पड़ेगा, इसे लेकर भी अवेयर रहते हैं।
पत्रकारिता का अनुभव
दिनेश मिश्र का पत्रकारिता का कॅरियर हिंदी के प्रतिष्ठित राष्ट्रीय अखबार दैनिक जागरण, नोएडा के सेंट्रल डेस्क के साथ साल 2010 में शुरू हुआ। इसके बाद से यह सफर 2013 में अमर उजाला, नोएडा से होता हुआ 2016 में राजस्थान पत्रिका के नेशनल इंटीग्रेटेड कंटेंट स्टेशन, नोएडा तक पहुंचा, जहां अखबार के साथ-साथ डिजिटल, टीवी और तीनों ही प्लेटफॉर्म पर एकसाथ काम किए। इसके बाद दिनेश मिश्र ने फिर 2019 में अमर उजाला में लौटे, जहां से 2021 में दैनिक भास्कर के डीबी डिजिटल में काम किया और एक्सप्लेनर और डीप डाइव-रिसर्च और स्पेशल स्टोरीज की बारीकियां सीखीं। इसके बाद अप्रैल, 2024 में दिनेश मिश्र देश के प्रतिष्ठित मीडिया समूह टाइम्स ऑफ इंडिया के नवभारत टाइम्स से जुड़े।
दिनेश मिश्र ने कुरुक्षेत्र यूनिवर्सिटी, हरियाणा से पत्रकारिता से एमए किया। उससे पहले महात्मा गांधी अंतरराष्ट्रीय हिंदी विश्वविद्यालय, वर्धा से पत्रकारिता में डिप्लोमा किया। उससे भी पहले वो समाज शास्त्र से भी एमए कर चुके हैं। दिनेश मिश्र ने संघ लोक सेवा आयोग की प्रतिष्ठित सिविल सेवा की मुख्य परीक्षा भी दी है और उत्तर प्रदेश पब्लिक सर्विस कमीशन की कई परीक्षाएं भी दीं। इसके अलावा, मिनिस्ट्री ऑफ सोशल जस्टिस एंड एमपावरमेंट के एक रिसर्च प्रोग्राम 6 महीने का सर्टिफिकेट कोर्स इन जेरियाट्रिक केयर भी किया है।... और पढ़ें
कन्वर्सेशन शुरू करें
Indiaकी ताजा खबरें, ब्रेकिंग न्यूज, अनकही और सच्ची कहानियां, सिर्फ खबरें नहीं उसका विश्लेषण भी। इन सब की जानकारी, सबसे पहले और सबसे सटीक हिंदी में देश के सबसे लोकप्रिय, सबसे भरोसेमंद Hindi Newsडिजिटल प्लेटफ़ॉर्म नवभारत टाइम्स पर",0.0
