title,url,source,date,language,state,district,search_term,full_text,relevance_score
Summer Effect : తెలుగు రాష్ట్రాలకు వాతావరణ శాఖ హెచ్చరిక - Telugu Post,https://news.google.com/rss/articles/CBMijAFBVV95cUxQaHotYVdQQkhEbkRMY3p4YXR0bHFtWVRkTGVXTDNaUjEtTEFSeTFJblNxYnZFWm4wTnFWWU1oMmQ4VWlGLTdZbVRqVDBoMldiY1NhNTBKUG5yczBJdll1WDBLaDdsMGF3eFRYWC1VbXVJcmFiX1V3a3VrdXNxZ0U0WmtGWHh5c3prbHJ5cNIBkgFBVV95cUxNVy10bVdCRmVib09TMS1rd3hweXNqcGVFODhVME9pM2ZOSWoxTkswQXVCbk1ldUtMZjlmRnNIalB1cDlQY2R0SVdnTVlWcmtmYU55ZS1xY2g0bWF2ZFpDMkM1VFVEb0VsZHNXOWxCTEFPOFZldzVQYUwtUjZWZnpzZENEbEZCMTVXVjI4R29ObnVQQQ?oc=5,Telugu Post,2026-03-31T09:51:50+05:30,te,Telangana,,"(""వడ గాలులు"" OR ""ఎండ వేడి"" OR ""భారీ ఎండలు"" OR ""హీట్ వేవ్"" OR ""ఉష్ణ తరంగం"" OR ""కడ ఎండలు"" OR మండుటెండ OR ""ఎండల తీవ్రత"" OR ""అసాధారణ ఎండలు"" OR ""తీవ్ర ఎండలు"") Telangana","ఆంధ్రప్రదేశ్, తెలంగాణ రాష్ట్రాల్లో ఎండల తీవ్రత ఎక్కువగా ఉంది. అయితే భిన్నమైన వాతావరణం కనిపిస్తుంది. ఉదయం నుంచి సాయంత్రం నాలుగు గంటల వరకూ తీవ్రమైన ఎండలు కాస్తున్నాయి. తర్వాత అక్కడక్కడ చిరుజల్లులు కురుస్తున్నాయి. అయితే రేపటి నుంచి ఎండల తీవ్రత ఎక్కువవుతుందని వాతావరణ శాఖ అధికారులు అంచనా వేస్తున్నారు. ద్రోణి, ఉపరితల ఆవర్తనం ప్రభావంతో గత కొద్ది రోజులుగా అడపా దడపా కురుస్తున్న వానలు ఇక పడకపోవచ్చని, ఈ అకాల వానలు మళ్లీ ఏదైనా బంగాళాఖాతంలో అల్పపీడనం ఏర్పడితే తప్ప కురవని చెబుతున్నారు.
దంచి కొడుతున్న ఎండలు...
ఆంధ్రప్రదేశ్ లో ఎండలు దంచి కొడుతున్నాయి. నలభై డిగ్రీలకు పైగానే ఉష్ణోగ్రతలు నమోదవుతున్నాయి. బుధవారం నుంచి ఎండల తీవ్రత మరింత ఎక్కువగా ఉంటుందని అంటున్నారు. అమరావతి వాతావరణ కేంద్రం అధికారుల సూచన మేరకు ఎండల తీవ్రతతో పాటు వేడిగాలుల తీవ్రత కూడా ఎక్కువగా ఉంటుందని, వడదెబ్బ కూడా తగిలే అవకాశముందని, అవసరమైతే తప్ప ప్రజలు పగటి వేళల్లో బయటకు రావద్దని హెచ్చరిస్తుంది. అత్యవసర పనుల కోసం రావాలంటే తప్పనిసరిగా తగిన జాగ్రత్తలు తీసుకోవాలని వైద్యులు చెబుతున్నారు. లేకుంటే ఇబ్బందులు తప్పవన్నారు. పలు జిల్లాలకు పిడుగుపాటు హెచ్చరిక జారీ అయింది. ప్రకాశం, మార్కాపురం, నంద్యాల,చిత్తూరు జిల్లాల్లో పిడుగులతో కూడిన మోస్తరు నుంచి భారీ వర్షాలు కురిసే అవకాశం ఉందని చెప్పింది.
తెలంగాణలోనూ ఎండల తీవ్రత...
తెలంగాణలోనూ ఎండలు ఎక్కువగా ఉంటున్నాయి. గత ఏడాదికి మించిన ఎండల తీవ్రత ఉంటుందని హైదరాబాద్ వాతావరణ శాఖ అధికారులు తెలిపారు. గత వేసవిలో ఎండల తీవ్రత అంతగా లేదు. కానీ ఈ ఏడాది మాత్రం మార్చి నుంచి చుక్కలు కనపడుతున్నాయి. ఎండ వేడిమికి తోడు ఉక్కపోత, వేడిగాలులు ఎక్కువగా వీస్తున్నందున రానున్న రోజుల్లో ఉష్ణోగ్రతలు భారీగా నమోదవుతాయని చెబుతున్నారు. పలు చోట్ల తేలిక పాటి వానలు పడతాయని, గంటకు నలబై నుంచి యాభై కిలోమీటర్ల వేగంతో ఈదురుగాలులు వీస్తాయని తెలిపింది. ప్రజలు అప్రమత్తంగా ఉండాలని చెప్పింది.
Ravi Batchali, with 30 years of experience in print, electronic, and digital media, has built an illustrious career in top news organizations. He served as a senior reporter at Eenadu and news coordinator at Maatv and HMTV. Known for his expertise in political reporting and analysis, Ravi is a tenacious, creative journalist with a reputation for impeccable ethics. His passion for community journalism and storytelling is widely acclaimed, treating news, features, and events with equal priority and dedication.",0.8333333333333333
