title,url,source,date,language,state,district,search_term,full_text,relevance_score
From Delhi’s Choking Heat to Kerala’s Storms: Is Your Travel Plan Safe? - NativePlanet,https://news.google.com/rss/articles/CBMiwwFBVV95cUxQTWtWTUpMNFl1SndIS25rSUEteXVkd1ZZSUtOWlg2QlczNTduVVNwX3QtblUtSVhJTHpOVHNUOUJCS2tuenhkZDdydl9yR1J6RmZKYXZVVGF1ZmxZWVJQZkVOMHN2S3Y4Q0ctLTgyanlORHNzNHIzbUg4cGpmay12OHZGQVgtWFhqTzJ6dW9oLUxpMXV1bWRNU1RLSUxVZ1B3MnEzRVFqNTBjN3k1YVlSd3hYOHZQcEJhUV9hYk1UZFF5NEk?oc=5,NativePlanet,2026-05-11T08:20:05+05:30,en,Delhi,,"(heatwave OR ""heat wave"" OR ""severe heatwave"" OR ""extreme heat"" OR ""heat spell"" OR ""scorching heat"" OR ""blistering heat"" OR ""sweltering heat"" OR ""hot winds"" OR loo OR ""hot loo winds"" OR ""intense heat"" OR ""unbearable heat"" OR ""deadly heat"" OR heat OR ""weather forecast"" OR ""weather update"" OR ""weather alert"" OR ""IMD forecast"" OR ""IMD prediction"" OR ""IMD alert"" OR IMD OR ""rising temperatures"" OR ""temperatures expected to rise"" OR ""relief from heat"" OR ""respite from heat"" OR ""heat respite"" OR ""respite from scorching heat"") Delhi","The India Meteorological Department (IMD) warns of contrasting weather across India today. Residents in Delhi face sweltering heat and poor air quality. Meanwhile, Kerala expects isolated thunderstorms to provide some relief. Bengaluru continues its hot and dry streak with high humidity levels. These conditions could impact local travel and outdoor activities for many commuters.
Delhi is struggling with a high Air Quality Index (AQI) today. The city remains hazy as temperatures rise above normal seasonal averages. Health experts advise wearing masks when stepping outside during peak hours. Tourists should plan indoor visits to avoid the intense midday sun. Staying hydrated is essential while navigating the national capital's busy streets.
IMD forecasts Kerala storms and Bengaluru heat
In Southern India, Kerala anticipates spotty storms throughout the day. The IMD predicts these thunderstorms will offer a brief respite from humidity. Travelers should monitor local flight schedules for any weather-related delays tonight. Coastal areas might see sudden winds and light showers during the evening. This shift follows weeks of intense heat across the coastal state.
Bengaluru remains largely dry and sultry with no rain in sight. The lack of cloud cover makes the heat feel more intense. Commuters have reported dusty conditions while traveling through the city's main corridors. The IMD suggests that this dry spell may persist for another week. Visitors should dress in light fabrics to stay comfortable throughout the day.
Delhi AQI health risks and weather updates
Overall, travelers must stay alert to changing conditions across the country. Whether facing Delhi's haze or Kerala's storms, preparation is key for safety. Check live bulletins for real-time updates on air quality and rain alerts. Planning your journey according to these shifts will ensure a smoother travel experience. Stay cautious and prioritize your health during these volatile weather patterns.",0.8500000000000001
"IMD forecasts thunderstorms in Delhi, heatwave in Rajasthan | Tap to know more | Inshorts - Inshorts",https://news.google.com/rss/articles/CBMipAFBVV95cUxNenBoWDZxUEJzcFFYSWM1cDJfX0VtNzRycFo3WEdPZm90QnFHRFBlSnZkOVNMTE5ha1NHYkI0dV93VjBKYldRQ1lTa1ZsbnI0UzNMd0VZZVh0VUZnbTl5bEc0SXZvRTkya1g4UzRSa3BWZ3pZVUtTT0dQTDJ4c2pzdy05czZVb0V6cFYteGFzd2RocjVPUDVwUkI1akdJT2ptcEpTN9IBqgFBVV95cUxPdnI3d3A3U3NVeDI1N3dEUlIwZ19VMHNXSGQ1TkdPMnlpU0ZsQ2pMb0N5RUE1QTc3QVc3LUFSMV84UG45R0x5MWRHSG1yMG5DVmZxRGZ1YnBtdXpXeU1tZ2JxbVY2X3A1RDRVcTZoX08yWERkV1I2dzRzaUdFOGlvVWdndmsyLUpKelJjZ0NPTVZLaVVQR3lSU0VURnNjQmFkQzJYcU4wSXBuUQ?oc=5,Inshorts,2026-05-11T01:45:21+05:30,en,Delhi,,"(heatwave OR ""heat wave"" OR ""severe heatwave"" OR ""extreme heat"" OR ""heat spell"" OR ""scorching heat"" OR ""blistering heat"" OR ""sweltering heat"" OR ""hot winds"" OR loo OR ""hot loo winds"" OR ""intense heat"" OR ""unbearable heat"" OR ""deadly heat"" OR heat OR ""weather forecast"" OR ""weather update"" OR ""weather alert"" OR ""IMD forecast"" OR ""IMD prediction"" OR ""IMD alert"" OR IMD OR ""rising temperatures"" OR ""temperatures expected to rise"" OR ""relief from heat"" OR ""respite from heat"" OR ""heat respite"" OR ""respite from scorching heat"") Delhi","IMD has issued a wide weather alert for India. Delhi may see thunderstorms with strong winds on Monday evening. Hailstorms are expected in Jammu and Kashmir and Ladakh, with wet weather in northern states. Heavy rain will continue in parts of South India. Heatwave conditions are forecast in West and East Rajasthan and Gujarat, where temperatures may remain very high.",0.8500000000000001
‘Garmi Se Jung’ campaign launches 13 mobile units to aid Delhi residents in heatwave - The News Mill,https://news.google.com/rss/articles/CBMitgFBVV95cUxNSWRUQXNhd29UQ1VvZTJQQ0ZCNlJ4Uk1CRmJkYVJXMUpfZEJ5ckMxUjZubmtSeXlnZ0VOcmFGUjBhUGJxNjhDeExOYmpLMFhQc216MFhDUFZvTWNEb0JneGZINHRWOTBnQ3MtOXB6ODhsbXJLR3k5ME1Wakk4ZFg4SDhFQnBlQ0NYSl85bWgtaTdjX0kyc3BkNURyTXk2RGJfY0Z4MHdPblRHM2FkSHo3OVg2V0FEUQ?oc=5,The News Mill,2026-05-11T04:17:13+05:30,en,Delhi,,"""heatwave"" Delhi","Delhi Chief Minister Rekha Gupta launched a significant summer safety initiative on Wednesday to address the ongoing heatwave, unveiling the ‘Heat Action Plan 2026’ and dispatching 13 Mobile Heat Relief Units across the national capital.
The Chief Minister described the new relief vans as “relief stations on wheels,” designed to offer rapid, direct assistance to individuals in public spaces. These units will move through every district of Delhi, operating from 11 am to 6 pm daily at busy locations such as bus stands, markets, and labour hubs. Each van is equipped with chilled water tanks, first-aid kits, and health supplies including ORS packets, cotton towels, and caps. Over 100 volunteers have been assigned to distribute these items to those in need.
A key aspect of this year’s plan focuses on safeguarding people who work or study outdoors. The government has mandated a pause in outdoor construction work between 1 pm and 4 pm to protect labourers from extreme heat. Additionally, schools have implemented a ‘Water Bell’ system to prompt children to drink water regularly, and have cancelled afternoon assemblies and outdoor sports to ensure student safety and hydration.
To cope with increased medical demand, more than 339 health centres and hospitals have established “cool rooms” and stocked ice packs and medicines for heatstroke patients. The government is also pursuing long-term measures such as planting more trees and installing improved water dispensers in public buildings. Residents are urged to remain indoors when possible and to contact the 112 helpline if they encounter anyone struggling with the heat.
The ‘Garmi Se Jung’ (War Against Heat) campaign is aimed at ensuring the protection of all residents during the extreme summer months. By integrating emergency relief vans with workplace regulations and enhanced medical care, the Delhi Government seeks to maintain city safety. The Chief Minister stressed that protecting the health of every citizen—from street vendors to senior citizens—is the administration’s primary concern this year.",1.0
"दिल्ली से लेकर यूपी तक बदला मौसम का मिजाज, आंधी-बारिश का अलर्ट; राजस्थान-गुजरात में लू से बढ़ेगी परेशानी - weather delhi to up alert for storms and rain heatwave in rajasthan and gujarat - Jagran",https://news.google.com/rss/articles/CBMiygFBVV95cUxPZmJ4bTNqRFphaTM1ZHliaUZ4c0ZLSjhzYVdveFo5OHZkRHFORVFOd3pEQ01WYjVkdk1HaEtGMGtTSWNjMjVUeno1bDQydmJuM3BIOUZVaTVjQ0FubHVGVEdYTHNlSm1uWkNnRldIdkNzZmpyV29kREQtVC15UlNQWFVxMzlDNVJ3aGhVenRUaUNCQ19yWnVjaHVIVnhIdUd4NFJXajFWSkJPUGpwdmxzaWVCTEVvWmFCVEtJY3ItendkVmF2a1g5cTNB?oc=5,Jagran,2026-05-11T05:55:00+05:30,hi,Delhi,,"(लू OR ""लू चलना"" OR ""भीषण गर्मी"" OR ""प्रचंड गर्मी"" OR ""कड़ी धूप"" OR ""तेज धूप"" OR ""गर्म हवा"" OR ""उष्ण लहर"" OR ""ताप लहर"" OR ""हीट वेव"" OR ""झुलसाने वाली गर्मी"" OR ""तपती गर्मी"" OR ""भयंकर गर्मी"" OR ""गर्मी का कहर"" OR ""गर्मी का प्रकोप"" OR ""अत्यधिक गर्मी"" OR मौसम OR ""मौसम अपडेट"" OR ""मौसम का हाल"" OR ""मौसम पूर्वानुमान"" OR ""मौसम अलर्ट"" OR आईएमडी OR ""आईएमडी पूर्वानुमान"" OR ""आईएमडी अलर्ट"" OR ""तापमान में बढ़ोतरी"" OR ""गर्मी से राहत"" OR ""गर्मी से निजात"") Delhi","दिल्ली से लेकर यूपी तक बदला मौसम का मिजाज, आंधी-बारिश का अलर्ट; राजस्थान-गुजरात में लू से बढ़ेगी परेशानी
देशभर में 11 मई को मौसम में बड़ा बदलाव आएगा, उत्तर भारत में आंधी-बारिश की संभावना है। राजस्थान, गुजरात में लू का प्रकोप रहेगा, जबकि दक्षिण भारत में भा ...और पढ़ें
समय कम है?
जानिए मुख्य बातें और खबर का सार एक नजर में
डिजिटल डेस्क, नई दिल्ली। देशभर में मौसम ने एक बार फिर करवट ले ली है। मौसम विभाग के अनुसार सोमवार 11 मई को देश के अलग-अलग हिस्सों में अलग-अलग तरह का मौसम देखने को मिलेगा। उत्तर भारत के कई राज्यों में आंधी और बारिश से गर्मी से राहत मिलने की संभावना है, जबकि राजस्थान, गुजरात और पश्चिमी मध्य प्रदेश में भीषण गर्मी और लू का असर बना रहेगा।
दिल्ली-एनसीआर, उत्तर प्रदेश, पंजाब, हरियाणा और पहाड़ी राज्यों में गरज-चमक के साथ बारिश की संभावना जताई गई है। वहीं दक्षिण भारत के कई राज्यों में भारी बारिश का अलर्ट जारी किया गया है।
दिल्ली-एनसीआर में बदलेगा मौसम
दिल्ली और एनसीआर के इलाकों में रविवार देर शाम या रात से मौसम बदल सकता है। मौसम विभाग ने हल्की से मध्यम बारिश, तेज हवाएं और गरज-चमक की संभावना जताई है। हवा की रफ्तार 40 से 60 किलोमीटर प्रति घंटे तक पहुंच सकती है।
दिन में गर्मी बनी रहेगी, लेकिन शाम के बाद तापमान में गिरावट आ सकती है। नोएडा, गाजियाबाद, गुरुग्राम और फरीदाबाद में भी तेज हवाओं के साथ हल्की बारिश हो सकती है।
यूपी में बारिश और बिजली गिरने की चेतावनी
उत्तर प्रदेश के पश्चिमी और पूर्वी हिस्सों में मौसम सक्रिय रहने वाला है। 11 से 14 मई के बीच कई जिलों में तेज हवाओं के साथ बारिश होने का अनुमान है। लखनऊ, कानपुर, मेरठ, बरेली, प्रयागराज और वाराणसी समेत कई शहरों में बादल छाए रह सकते हैं और गरज-चमक देखने को मिल सकती है। मौसम विभाग ने किसानों और खुले मैदान में काम करने वाले लोगों को सतर्क रहने की सलाह दी है।
पंजाब-हरियाणा में चलेगी तेज आंधी
पंजाब और हरियाणा में पश्चिमी विक्षोभ का असर दिखाई देगा। कई जिलों में धूलभरी आंधी, बादल और हल्की बारिश की संभावना है। चंडीगढ़ और आसपास के इलाकों में भी मौसम खराब रह सकता है। मौसम वैज्ञानिकों के अनुसार 11 से 13 मई तक इन राज्यों में मौसम अस्थिर बना रहेगा।
खबरें और भी
राजस्थान में भीषण लू का अलर्ट
राजस्थान के पश्चिमी हिस्सों में गर्मी का प्रकोप जारी रहेगा। जैसलमेर, बाड़मेर, बीकानेर और जोधपुर में तापमान 44 से 46 डिग्री सेल्सियस तक पहुंच सकता है। मौसम विभाग ने इन इलाकों के लिए हीटवेव अलर्ट जारी किया है। पूर्वी राजस्थान के कुछ हिस्सों में हल्के बादल दिखाई दे सकते हैं, लेकिन गर्मी से राहत मिलने की संभावना कम है।
मध्य प्रदेश और गुजरात में बढ़ेगा तापमान
मध्य प्रदेश के पश्चिमी हिस्सों और गुजरात में भी गर्मी तेज रहने वाली है। इंदौर, उज्जैन, ग्वालियर और भोपाल में गर्म हवाएं चल सकती हैं। गुजरात के अहमदाबाद और कच्छ क्षेत्र में लू की स्थिति बनी रह सकती है। हालांकि कुछ इलाकों में शाम के समय बादल छाने और हल्की बूंदाबांदी की संभावना भी जताई गई है।
उत्तराखंड-हिमाचल में बारिश और बर्फबारी
उत्तराखंड और हिमाचल प्रदेश के पहाड़ी इलाकों में मौसम खराब रह सकता है। ऊंचाई वाले क्षेत्रों में हल्की बर्फबारी और निचले इलाकों में बारिश होने का अनुमान है। मौसम विभाग ने तेज हवाओं और ओलावृष्टि की चेतावनी भी जारी की है। चारधाम यात्रा मार्गों पर जाने वाले यात्रियों को सावधानी बरतने की सलाह दी गई है।
महाराष्ट्र में उमस के बीच बारिश के आसार
महाराष्ट्र के मुंबई, पुणे और मराठवाड़ा क्षेत्र में गर्मी और उमस बनी रहेगी। इसके साथ कुछ इलाकों में हल्की बारिश भी हो सकती है। कोंकण क्षेत्र में बादल छाए रहने और गरज-चमक के साथ तेज हवाएं चलने की संभावना है।
दक्षिण भारत में भारी बारिश का अलर्ट
तमिलनाडु, केरल, कर्नाटक और आंध्र प्रदेश के कई हिस्सों में भारी बारिश की संभावना जताई गई है। तमिलनाडु और केरल के कुछ इलाकों में बहुत भारी बारिश भी हो सकती है। मौसम विभाग ने तेज हवाओं और बिजली गिरने की चेतावनी दी है। साथ ही मछुआरों को समुद्र में न जाने की सलाह भी जारी की गई है।",1.0
"Delhi Weather: दिल्ली में उमस के बीच फिर बदलेगा मौसम, तेज हवाओं के साथ बारिश की संभावना, IMD का येलो अलर्ट! - AajTak",https://news.google.com/rss/articles/CBMilgJBVV95cUxQUTl2MUk2cVplQkM5WGxpdUVVblpkY2tDeGszUWVueE1JN3BmZlIyb2ZnYUxyRFRsR3JzSTNkT0FGNEE1TDR6OHh0Sks0Z1NKSHRBd2lCTnh3R0xQelRUY0ZLdTh3dUhaeTI1dG5lLVpPMWt4MWwzMHV6MWpURTVNM0F4bUhHM2tvejJRYVVzamFKdkZQSDBTQ1BYazlSMVE1LUQzTUswSVJfNDZPVW44bk55aTF4YVVxdEQ3UWUyTFk0M2FJMmQyLUNKajZpWURzYUN4Y2l1R2lmUTUwbTFISlU0SExxMzhEb3QtVnRuMC1uR1ZyaEk4XzAycWlTV3pmbDNqUmk4U1gyMXJ3Mll2d2tEZUJWZ9IBmwJBVV95cUxOT3VUeDJBYW5fUXp5anQwd1Nkak1xNURGb2s3bFhqZjJpdGhhYjFMaVVZQjVfV2ZpTDdzR3p2dmIzbXM2aURCWHFGdnJxaGFoRC1OeV9KcWdHVzhwcjRGd2xnaEpPOGJwZUx6b1J6SVpQT3N0ekJVZWU2OGRQU2swdXhna29Nd2tSNWoxb2V6X0ZJNTQwNGRWMjBVRnh1bWNpOUJpbVpkWEE0S1JvQWxEbEViTDJXQXNtQjctZURjdjFoUmNpbFBZZC03UVZDb3o3bW5GMVFuaHJiS01XaHo0M1dtVkhUWUhuNmlGWUc5YmJieUUxa2FDRDlLTkNmNDVwSWN1WDhHajNTZjVSbEgxUmh2MnhpV1AwSC00?oc=5,AajTak,2026-05-11T11:59:31+05:30,hi,Delhi,,"(""हीट एक्शन प्लान"" OR ""गर्मी से राहत"" OR चेतावनी OR ""रेड अलर्ट"" OR ""ऑरेंज अलर्ट"" OR ""येलो अलर्ट"" OR एडवाइजरी OR ""राहत सामग्री"" OR ""राहत शिविर"" OR मुआवजा) Delhi","दिल्ली में एक बार फिर उमस और गर्मी बढ़ गई है. बीती रात न्यूनतम तापमान सामान्य से ऊपर दर्ज किया गया, जिससे शहर में उमस बढ़ गई है. भारत मौसम विज्ञान विभाग (IMD) ने 11-12 मई के लिए येलो अलर्ट जारी किया है. IMD के अनुसार, शहर के आधार स्टेशन सफदरजंग में न्यूनतम तापमान 27.1 डिग्री सेल्सियस दर्ज किया गया, जो सामान्य से 1.7 डिग्री अधिक है. वहीं, लोधी रोड और अयानगर में भी तापमान 26.4 डिग्री सेल्सियस रहा, जो 2.4 और 1.5 डिग्री सामान्य से ऊपर है.
इसके अलावा पालम में 25.2 डिग्री और रिज स्टेशन पर 24.7 डिग्री सेल्सियस तापमान दर्ज किया गया. सोमवार सुबह 8:30 बजे तक दिल्ली में कहीं भी बारिश दर्ज नहीं की गई, लेकिन IMD ने दोपहर के बाद मौसम बदलने और गरज-चमक के साथ हल्की से बहुत हल्की बारिश का पूर्वानुमान जारी किया है. वहीं, मंगलवार यानी 12 मई को भी तेज हवाओं के साथ बारिश होने की संभावना है.
मौसम विभाग (IMD) के पूर्वानुमान के मुताबिक, दिल्ली में 11 मई को गरज-चमक के साथ हल्की बारिश और 40-50 किमी/घंटा की रफ्तार से तेज हवाएं चल सकती हैं. अधिकतम तापमान 35 डिग्री सेल्सियस के आसपास रहने की संभावना है. जबकि न्यूनतम तापमान 27 डिग्री सेल्सियस रह सकता है.
मौसम विशेषज्ञों के अनुसार, पिछले कुछ दिनों से दिल्ली-NCR में रात के तापमान में लगातार बढ़ोतरी देखी जा रही है, जिससे गर्मी और उमस बढ़ रही है. इसके अलावा एयर क्वालिटी की बात करें तो दिल्ली की वायु गुणवत्ता मध्यम श्रेणी में है. केंद्रीय प्रदूषण नियंत्रण बोर्ड (CPCB) के अनुसार, दिल्ली का औसत AQI 117 दर्ज किया गया. AQI 101-200 के बीच मध्यम माना जाता है.",1.0
