title,url,source,date,language,state,district,search_term,full_text,relevance_score
"पार्क में बढ़ी चहल-पहल: मार्च की गर्मी के बीच बादलों से मिली राहत, पारा 2 डिग्री गिरा, 20 तक टली लू की तपिश - Dainik Bhaskar",https://news.google.com/rss/articles/CBMi-gFBVV95cUxPWjBmc3BuVTV5cm1NYUg5aDFRMjI3R2ZYM0YyQ1ctVUh0TUthdXdVSVdBMHQ1SUV1dkZnMjBwdGVFNmlLZlJmRWZXOXpxUFdoMldnY0xHdlZQQjMwYUh4ZFZtNjBHVU5QNTNSd1FuZUNlMTV0YlF5SFRHTWEtM2s4bmFQZmpUcUZNQVZCR1F5SWpHWkhFTGV3MS0zVGVKWGRET0czR01qQkhxc3NmanVmWk50SjBWeW9KMXo0V1FVaHdLX0pSMXI3aklQU3JDMFBkT1Nmem9IS3pfYkJWbXJoRldvY19BZVczWnNOVGViSHVreWR4Wnd3ampR0gH_AUFVX3lxTE1NcjlIeGRDcVlILVJ2TWNmbmFOc1ZSXzQtZVk3ckFUbWkzZDB1dEdsNFQ5VWVLX0g1dXNFTlFsUVVxc2RSTURNZ0R5SF9zaEJHcDhldlBQYlRpd0JmbHVWQ0hFZkxPYlpHLUZmQTBNc2JMcl85am95UW10WV9CQXI0aEFUM3RIVkowMmhRN2lBUFhrbi1PeG1lbUdWWUVkR21NaE84QUNLRER3Z0VjVXhKeG1nUGxxSGFuM0ZwdFB0YnRneVFyVHN1TWtpek5hMG8yZEo3eTZzWkdWY1ItcXhLNkp3WmNicVZpUmRLeWVjWDlZWWNWRl82VG5xbU1Vdw?oc=5,Dainik Bhaskar,2026-03-27T03:54:59+05:30,hi,Madhya Pradesh,,"""लू"" Madhya Pradesh","- Clouds Bring Relief From The March Heat, Mercury Drops By 2 Degrees, Heat Wave Postponed Until The 20th
पार्क में बढ़ी चहल-पहल:मार्च की गर्मी के बीच बादलों से मिली राहत, पारा 2 डिग्री गिरा, 20 तक टली लू की तपिश
- कॉपी लिंक
मार्च के तीसरे सप्ताह में गर्मी से राहत मिली
मार्च के मध्य में बढ़ती गर्मी के बीच अंचल में मौसम ने अचानक करवट ली है। आसमान में बादलों की आवाजाही और वातावरण में बढ़ी नमी के कारण लोगों को लू जैसी गर्मी से फिलहाल राहत मिल गई है। मौसम विभाग के अनुसार अगले कुछ दिनों तक बादलों का असर बना रहेगा, जिससे तापमान में तेज बढ़ोतरी की संभावना कम है और 20 मार्च तक लू जैसी गर्मी से अंचलवासियों को राहत के आसार हैं।
सोमवार को अधिकतम तापमान पिछले दिन की तुलना में 1.5 डिग्री सेल्सियस बढ़कर 34.1 डिग्री दर्ज किया गया, जो सामान्य से 2.2 डिग्री अधिक रहा। वहीं न्यूनतम तापमान में 2.9 डिग्री की गिरावट दर्ज हुई और यह 17.1 डिग्री सेल्सियस रहा, जो सामान्य से 1.4 डिग्री अधिक है। मौसम में नमी का स्तर भी सामान्य से ज्यादा रहा। सुबह की आर्द्रता 72% जबकि शाम की 29% रही।
पश्चिमी विक्षोभ का असर फिलहाल बादल छाए रहेंगेग्वालियर-चंबल संभाग की ओर नमी आ रही है, जिसके कारण बादल लगातार छाए हैं। अगले 24 घंटे में एक नया पश्चिमी विक्षोभ सक्रिय होने की संभावना है। इसके प्रभाव से क्षेत्र में बादल छाए रह सकते हैं और तापमान में अत्यधिक बढ़ोतरी नहीं होगी। यानी लू जैसी गर्मी से अभी 20 मार्च तक राहत के आसार हैं। -दिव्या ई. सुरेंद्रन, वरिष्ठ मौसम वैज्ञानिक",1.0
