title,url,source,date,language,state,district,search_term,full_text,relevance_score
"मप्र में आंधी और बारिश का अलर्ट: 31 शहरों में चलेगी लू, खजुराहो में पारा 46 डिग्री, जानें अपने शहर का तापमान - Bansal News",https://news.google.com/rss/articles/CBMi6gFBVV95cUxNZ1IyU3hvWDBQNjUwS1NHWlFkRVhCbjgyR2NnaFJDTVVpTlF6YUdWdGc4UXhCOGpJSFNmcGhUbmcwck5mQ1ktcEdNeUdfam9BaU80dFRNeVdCZHFZTW1zTjdxLXZDMTN5eGtBOFJzTmp2VTZzQUdLcTJIWHR1Y1NhMzdWM3JaSTdzZEc5WWN6clNnSWJ5QU03UU0xWGdGQjVFNHpiYl90ZDRUWDBaRHZHcS1XS2stam0zbTltSkNvSkNaZEJEOXB6ajFhdjJmbVFZWUZXa094RG12RnVkTW9kaExucTYwLWZxVWfSAe8BQVVfeXFMUFQzaVV0YXliQkJuUnpDT0tjVnZLVVMxU0Uxd2ZQc2dISEdmZHA5LWhWdjV2OTNnOUxhZVZPYU1JZlVYNE1uUXZvb2daNXY2MkM2RWtKVDJER3hWS3Nyclc0aUZtYW1hRjQwVFJGSHNIRDVIZ19vRnFsa3I3RjM0X1E3NFhFSy1tWmEteWxNeEczNjdCdy1KbUstcDRUeFlza1Q5SnJ6d2toVm9iRk1UR0NPWU4yVDlUSF9Yb2FCSU9NcXVONXRjd1BYUkFZb20xRm5aSTJKOVlQVDhidEZ0OTR1OHF3NEhOd0ltaThYcVE?oc=5,Bansal News,2026-05-29T17:02:58+05:30,hi,Madhya Pradesh,Gwalior,"लू (""Agar Malwa"" OR Alirajpur OR Anuppur OR Ashoknagar OR Balaghat OR Barwani OR Betul OR Bhind OR Bhopal OR Burhanpur OR Chhatarpur OR Chhindwara OR Damoh OR Datia OR Dewas OR Dhar OR Dindori OR Guna OR Gwalior OR Harda OR Hoshangabad OR Indore OR Jabalpur OR Jhabua OR Katni OR Khandwa OR Khargone OR Mandla OR Mandsaur OR Morena OR Narsinghpur OR Neemuch OR Panna OR Raisen OR Rajgarh OR Ratlam OR Rewa OR Sagar OR Satna OR Sehore OR Seoni OR Shahdol OR Shajapur OR Sheopur OR Shivpuri OR Sidhi OR Singrauli OR Tikamgarh OR Ujjain OR Umaria OR Vidisha) Madhya Pradesh","MP weather today 29 May 2026: मध्य प्रदेश में मौसम का मिजाज मिलाजुला नजर आ रहा है।
सीनियर मौसम वैज्ञानिक अरुण शर्मा के मुताबिक, फिलहाल प्रदेश के ग्वालियर, चंबल संभाग और नॉर्थ-इस्ट इलाकों में क्लाउड है। वेस्टर्न डिस्टर्बेंस और मॉईश्वर की वजह से आंधी, बारिश और ओले गिर रहे हैं। जिस वजह से आंधी और बारिश की स्थिति बन रही है। जिस वजह से प्रदेश के कुछ हिस्सों में लू असर अब कम होने लगा है। हालांकि, अभी भी कुछ हिस्से लू की चपेट में है।
प्रदेश के टॉप सबसे गर्म शहर
30 इलाकों में पारा 40 डिग्री या उससे अधिक
प्रदेश के 9 शहरों में अधिकतम तापमान 45 डिग्री सेल्सियस या उससे अधिक रिकॉर्ड किया गया। जबकि 30 शहरों में अधिकतम तापमान 40 या उससे ज्यादा दर्ज किया गया। खजुराहो प्रदेश में सबसे गर्म शहरों की सूची में पहले स्थान पर रहा। यहां गुरुवार को अधिकतम तापमान 46.5 डिग्री सेल्सियस रिकॉर्ड किया। भोपाल में दिन का तापमान 43.8 डिग्री सेल्सियस दर्ज किया है।
जानें अगले चार दिन का मौसम
29 मई 2026 की सुबह 8:30 से 30 मई 2026 की सुबह 8:30 तक।
- छिंदवाड़ा में कहीं-कहीं गरज-चमक के साथ 60 किलोमीटर प्रति घंटे के रफ्तार से हवाएं चलेंगी। यहां दिन में लू चलेगी। रात भी गर्म रहेगी।
- सिवनी, बालाघाट, पांढुर्णा में कहीं-कहीं गरज-चमक के साथ 60 किलोमीटर प्रति घंटे के रफ्तार से हवाएं चलेंगी।
- ग्वालियर, दतिया, मुरैना, श्योपुरकलां, छतरपुर, टीकमगढ़, निवाड़ी में कहीं-कहीं गरज-चमक के साथ 60 किलोमीटर प्रति घंटे के रफ्तार से हवाएं चलेंगी। ओले गिरेंगे और लू चलेगी।
- भोपाल, विदिशा, रायसेन, सिहोर, राजगढ़, बुरहानपुर, खंडवा, खरगोन, शाजापुर, आगर लू का असर है।
- मंदसौर, नीमच, सिंगरौली, सीधी, रीवा, मऊगंज, अनुपपुर, डिंडोरी, मंडला में कहीं-कहीं गरज-चमक के साथ 50 किलोमीटर प्रति घंटे के रफ्तार से हवाएं चलेंगी।
- गुना, अशोकनगर, शिवपुरी, भिंड, सतना, शहडोल, उमरिया, कटनी, जबलपुर, नरसिंहपुर, पन्ना, दमोह, सागर, मैहर में कहीं-कहीं गरज-चमक के साथ 50 किलोमीटर प्रति घंटे के रफ्तार से हवाएं चलेंगी। लू भी चलेगी।
30 मई 2026 की सुबह 8:30 से 31 मई 2026 की सुबह 8:30 तक।
- मंदसौर, नीमच, ग्वालियर, दतिया, भिंड, पन्ना, छतरपुर, टीकमगढ़, निवाड़ी में कहीं-कहीं गरज-चमक के साथ 60 किलोमीटर प्रति घंटे के रफ्तार से हवाएं चलेंगी। ओले गिरेंगे।
- भोपाल, रायसेन, सिहोर, नर्मदापुरम, अलीराजपुर, झाबुआ, धार, इंदौर, रतलाम, उज्जैन, देवास, आगर, गुना, अशोकनगर, शिवपुरी, मुरैना, श्योपुरकलां, सिंगरौली, सीधी, रीवा, मऊगंज, सतना, अनुपपुर, शहडोल, उमरिया, डिंडोरी, कटनी, सिवनी, मंडला, बालाघाट, मैहर, पांढुर्णा में कहीं-कहीं गरज-चमक के साथ 50 किलोमीटर प्रति घंटे के रफ्तार से हवाएं चलेंगी।
- विदिशा, राजगढ़, शाजापुर, जबलपुर, नरसिंहपुर, छिंदवाड़ा, दमोह, सागर में कहीं-कहीं गरज-चमक के साथ 50 किलोमीटर प्रति घंटे के रफ्तार से हवाएं चलेंगी।
31 मई 2026 की सुबह 8:30 से 1 जून 2026 की सुबह 8:30 तक।
- अलीराजपुर, झाबुआ, रतलाम, मंदसौर में कहीं-कहीं गरज-चमक के साथ 60 किलोमीटर प्रति घंटे के रफ्तार से हवाएं चलेंगी।
- राजगढ़, खरगौन, बड़वानी, धार, इंदौर, उज्जैन, देवास, शाजापुर, आगर, नीमच, गुना, शिवपुरी, ग्वालियर, मुरैना, श्योपुरकलां, सतना, कटनी, जबलपुर, पन्ना, दमोह, सागर, छतरपुर, टीकमगढ़, निवाड़ी, मैहर में कहीं-कहीं गरज-चमक के साथ 50 किलोमीटर प्रति घंटे के रफ्तार से हवाएं चलेंगी।
- भोपाल, विदिशा, रायसेन, सिहोर, नर्मदापुरम, बैतूल, हरदा, बुरहानपुर, खंडवा, अशोकनगर, दतिया, भिंड, सिंगरौली, सीधी, रीवा, मऊगंज, अनुपपुर, शहडोल, उमरिया, डिंडोरी में कहीं-कहीं गरज-चमक के साथ 40 किलोमीटर प्रति घंटे के रफ्तार से हवाएं चलेंगी।
1 जून 2026 की सुबह 8:30 से 2 जून 2026 की सुबह 8:30 तक।
- रतलाम,अलीराजपुर, झाबुआ में कहीं-कहीं गरज-चमक के साथ भारी बारिश और 50 किलोमीटर प्रति घंटे के रफ्तार से हवाएं चलेंगी।
- खरगोन, बड़वानी, धार, इंदौर, उज्जैन, शाजापुर, आगर, मंदसौर, नीमच, सिंगरौली, सीधी, रीवा, मऊगंज, सतना, छिंदवाड़ा, पन्ना, छतरपुर, टीकमगढ़, निवाड़ी, पांढुर्णा में कहीं-कहीं गरज-चमक के साथ 50 किलोमीटर प्रति घंटे के रफ्तार से हवाएं चलेंगी।
- भोपाल, विदिशा, रायसेन, सिहोर, राजगढ़, नर्मदापुरम, बैतूल, हरदा, बुरहानपुर, खंडवा, देवास, गुना, अशोकनगर, शिवपुरी, ग्वालियर, दतिया, भिंड, मुरैना, श्योपुरकलां, दमोह, सागर में कहीं-कहीं गरज-चमक के साथ 40 किलोमीटर प्रति घंटे के रफ्तार से हवाएं चलेंगी।
2 जून 2026 की सुबह 8:30 से 3 जून 2026 की सुबह 8:30 तक।
- खरगोन, बड़वानी, अलीराजपुर, झाबुआ, धार, इंदौर, रतलाम, उज्जैन, देवास, शाजापुर, आगर, मंदसौर, नीमच में कहीं-कहीं गरज-चमक के साथ 50 किलोमीटर प्रति घंटे के रफ्तार से हवाएं चलेंगी।
- राजगढ़, गुना, अशोकनगर, शिवपुरी, ग्वालियर, दतिया, भिंड, मुरैना, श्योपुरकलां, सतना, पन्ना, छतरपुर, टीकमगढ़, निवाड़ी में कहीं-कहीं गरज-चमक के साथ 40 किलोमीटर प्रति घंटे के रफ्तार से हवाएं चलेंगी।",1.0
