title,url,source,date,language,state,district,search_term,full_text,relevance_score
"Heatwave persists in Odisha, IMD issues yellow warning for 17 districts - Odisha TV",https://news.google.com/rss/articles/CBMiqgFBVV95cUxOTldwX0lBbzl3bGVRT0ZuYjRabS1wamc2OGtndGxuSlFZUERJVGw3NjkwRGo2Qk42cDZaZTZLTXFyeWpvM29WZlhwTWtMU3JOVXQ0VFZBMVFsNlBXdVlXU19Ga2x0bU5KSEdLWVpmaDMzNElpQnpRX2dnaUpiUUt0ZHV3WTVLU2lwMENVRkRjRG9xSUFBc1VxeHBldnN4cG1JV0duNzVlMjJjd9IBrwFBVV95cUxOT3FZVGRhc0szWlhyb0RoN1BYZFZSM2FQa05adzlGdkwya3h0U3BabHdVS0ZfSm9ZRHN2V0Mtc21OMGVyc2J3VExIZGNsSkZhVGZIQ25IV0ZuS09JRE1CLUR2OWtRVVFDZDNVSWp0dl9SZHNvNnI4V2x0b1ZwakV3SGFjVll3Sm9Ob1VCQUltYVFZSTJlWUdJTTlLZVJScnU2elNCZFoxMVQyUEJtT2RN?oc=5,Odisha TV,2026-04-23T10:51:17+05:30,en,Odisha,Angul,"(heatwave OR ""heat wave"" OR ""severe heatwave"" OR ""extreme heat"" OR ""heat spell"" OR ""scorching heat"" OR ""blistering heat"" OR ""sweltering heat"" OR ""hot winds"" OR loo OR ""hot loo winds"" OR ""intense heat"" OR ""unbearable heat"" OR ""deadly heat"" OR heat OR ""weather forecast"" OR ""weather update"" OR ""weather alert"" OR ""IMD forecast"" OR ""IMD prediction"" OR ""IMD alert"" OR IMD OR ""rising temperatures"" OR ""temperatures expected to rise"" OR ""relief from heat"" OR ""respite from heat"" OR ""heat respite"" OR ""respite from scorching heat"") Odisha","Odisha continues to reel under an intense heatwave, with temperatures breaking records across regions from the coast to the western districts. The India Meteorological Department (IMD) forecasted that the prevailing conditions are likely to continue for the next five days.
For Thursday, heatwave warnings were issued for Jharsuguda, Sambalpur and Bolangir districts. In addition, a yellow warning for severe heat and humid conditions was issued for 17 districts, including Ganjam, Gajapati, Nayagarh, Khordha, Cuttack, Puri, Kendrapara, Jagatsinghpur, Jajpur, Bhadrak, Balasore, Angul, Boudh, Bolangir, Sonepur, Sambalpur and Sundargarh.
Jharsuguda Hottest In Country
Meanwhile, Jharsuguda emerged as the hottest place in the country, recording a maximum temperature of 44.6 degrees Celsius on Wednesday. Dhenkanal followed with a temperature of 43.2 degrees Celsius.
The sustained rise in temperature over the past few days led to discomfort among residents across the state, with heat and humidity levels remaining high.
IMD Forecast And Advisory
Bhubaneswar IMD Director Manorama Mohanty said, “Heatwave will continue. On April 24, humid conditions and warm nights will be experienced in regions like Bolangir and Kandhamal. A yellow alert for humid conditions was also issued for several other regions.”
She added, “Regions like Malkangiri and Koraput might experience rain along with lightning, thunder and wind up to 30–40 kmph. Similar conditions are likely to persist on April 25.”",1.0
"Odisha Heatwave Intensifies: Jharsuguda Hottest In Country At 44.6°C, 41.2°C In Bhubaneswar - OdishaBytes",https://news.google.com/rss/articles/CBMisgFBVV95cUxPbnRxN2dkRDRlRGFIWS1aVkRnU0xETk5oNUpiemtGTnBRWEppay1GLXR3NGd4cDZpcUVXSVRMeHhIdjZ1cVQ4ZVE1WlBaQ1U0UUNUQ0szU29YcWQwMlJjN2VnbEF5SXNIUVY2Z1NwVGZWdVNvOFhKYkF1WmZKY2ZNal9jdXBPcnlETWZYazFSM0REVUlSR2ZLeXl3X3M5aHQzYVFFOFVSUU1SZExrMFdXbGJB0gG3AUFVX3lxTE1RSTYyU1RMSmotMUVuSy1rU3FJRXRRSzhwTHVaMkt3VVJ3RzB6bHN4WHZuYUdCMjVQMXI1aU9qWkdEaU9OSTZLM1VkSWdZVEIwM2M0LTF0U0hWZ3NKbjdHaFFuSGZ4WjlNb0lVTklvVDkza05DczdQckFERlE2N3BGemo2NWY1YVNJamp2bHduYldiWTV1QnN2dmQ1blZYVlQ0YVRhUFotSURDT2NXTF8yakVrQlhUYw?oc=5,OdishaBytes,2026-04-23T10:58:24+05:30,en,Odisha,Angul,"(heatwave OR ""heat wave"" OR ""severe heatwave"" OR ""extreme heat"" OR ""heat spell"" OR ""scorching heat"" OR ""blistering heat"" OR ""sweltering heat"" OR ""hot winds"" OR loo OR ""hot loo winds"" OR ""intense heat"" OR ""unbearable heat"" OR ""deadly heat"" OR heat OR ""weather forecast"" OR ""weather update"" OR ""weather alert"" OR ""IMD forecast"" OR ""IMD prediction"" OR ""IMD alert"" OR IMD OR ""rising temperatures"" OR ""temperatures expected to rise"" OR ""relief from heat"" OR ""respite from heat"" OR ""heat respite"" OR ""respite from scorching heat"") Odisha","Bhubaneswar: As Odisha grapples with an early and intense summer, the western industrial town of Jharsuguda emerged as the hottest place in India on Wednesday, logging a blistering maximum temperature of 44.6 degrees Celsius, 3.4 degrees above normal, according to the India Meteorological Department (IMD).
The mercury soared past 40°C at 25 places in the state. Talcher followed closely at 43.5°C, Sambalpur at 43.3°C, Hirakud at 43.2°C, and Angul at 43.1°C. Even coastal and urban areas felt the pinch, with Bhubaneswar recording its highest temperature of the season at 41.2°C and neighbouring Cuttack reaching 39.8°C.
The extreme heat has disrupted daily life, emptying streets during peak afternoon hours, affecting outdoor workers, and prompting advisories for hydration and caution, particularly for vulnerable groups like the elderly and children. Schools in several districts of the state have also been shut.
Weather experts attribute the prolonged sultry conditions to a decline in Nor’wester (Kalbaishakhi) activity. Reduced moisture incursion from the Bay of Bengal and the prevalence of dry north-westerly to westerly winds have limited pre-monsoon thunderstorms that typically bring temporary relief.
The Regional Meteorological Centre has warned of heatwave conditions at isolated spots in Balangir, Jharsuguda, and Sambalpur districts on Thursday. Hot and humid weather, along with warm night conditions, is likely to persist across parts of the state until at least Sunday.
The forecast indicates continued hot and humid conditions this week in districts including Balangir, Sundargarh, Boudh, Sonepur, Sambalpur, Angul, Balasore, Bhadrak, Jajpur, Kendrapara, Cuttack, Jagatsinghpur, Puri, Khurda, Nayagarh, Ganjam, and Gajapati, with a chance of isolated thunderstorm activity providing some respite in places.",1.0
