title,url,source,date,language,state,district,search_term,full_text,relevance_score
"एनसीआर में फिर बढ़ेगी भीषण गर्मी, 43 डिग्री के पार पहुंचेगा पारा; लू और प्रदूषण की दोहरी मार झेलेंगे लोग - Punjabkesari.com",https://news.google.com/rss/articles/CBMi6wFBVV95cUxPY2tONWtZYUU2U1pFd0J0Vkg3TEVhQlhPb0wzRjFiczNOaTBId09TekxBejBUckRxOWZyWjVsRUhQcjNUTDFac0pWNHJFLUdQSFFSUWJRd0xuQmlaRDh1aG5ERFZLSFhxSDRJVlFwTGZTOENhWFJMZlhoTEN5WDFvdVNvMzJlaHlJN3ViQXcwbmdsN1VoQ0JvTExWV0cxVWhUVEFzU3dQelAwc01WVTUybzJLWmRpYzMtV0dfRS1nSWxRNDB1Wm1DNVJrWjVUVEJFZWw2WnRTdmVtdk9RNWoyTGh5b05iY3RqalB30gGCAkFVX3lxTE15SXVNTmN6d2d3Ti1Ucmc5QkxkU2pYZlJaU3l3Z3ZjN3NySUU0bThLVnQwOFExMGFLSWY0cnQwcjBxSDVoMFI3bFJMcXFUcVlvX1lSSzJfTVBnckdERWRzSGhkd0JCeXJfTzZTNnpzOHVidDBzVkw0X0RzMFR3Yk9lcFM5cE5jVk5ISENfLUx2eWNha3VVWnV2czRJMDFCRTBSQmRjVXhuOWxlcldKUG10Z2FoeDBwM3BneUdoMVhXMXloMTRDd29rV0N4cXJlOFdpZjB4M1EwTW93VnNrX3N4YjVRUGdNSW5UV185X3RxR2NaQ09VcDI1bzJwQXlHMEd6QQ?oc=5,Punjabkesari.com,2026-05-15T09:39:21+05:30,hi,Chandigarh,,"(लू OR ""लू चलना"" OR ""भीषण गर्मी"" OR ""प्रचंड गर्मी"" OR ""कड़ी धूप"" OR ""तेज धूप"" OR ""गर्म हवा"" OR ""उष्ण लहर"" OR ""ताप लहर"" OR ""हीट वेव"" OR ""झुलसाने वाली गर्मी"" OR ""तपती गर्मी"" OR ""भयंकर गर्मी"" OR ""गर्मी का कहर"" OR ""गर्मी का प्रकोप"" OR ""अत्यधिक गर्मी"" OR मौसम OR ""मौसम अपडेट"" OR ""मौसम का हाल"" OR ""मौसम पूर्वानुमान"" OR ""मौसम अलर्ट"" OR आईएमडी OR ""आईएमडी पूर्वानुमान"" OR ""आईएमडी अलर्ट"" OR ""तापमान में बढ़ोतरी"" OR ""गर्मी से राहत"" OR ""गर्मी से निजात"") Chandigarh","नोएडा, 15 मई (आईएएनएस)। एनसीआर के लोगों को आने वाले दिनों में एक बार फिर भीषण गर्मी का सामना करना पड़ेगा। भारतीय मौसम विभाग के ताजा पूर्वानुमान के अनुसार अगले तीन से चार दिनों में तापमान तेजी से बढ़ेगा और अधिकतम पारा 43 डिग्री सेल्सियस तक पहुंच सकता है।
मौसम विभाग ने संकेत दिए हैं कि 15 मई से शुरू होकर अगले कई दिनों तक तेज धूप, गर्म हवाएं और सतही तेज हवाओं का असर देखने को मिलेगा। इसके साथ ही वायु गुणवत्ता सूचकांक (एक्यूआई) में भी बढ़ोतरी दर्ज की जा रही है, जिससे लोगों को गर्मी और प्रदूषण की दोहरी मार झेलनी पड़ेगी।
मौसम विभाग के मुताबिक, 15 मई को एनसीआर में अधिकतम तापमान 41 डिग्री और न्यूनतम तापमान 24 डिग्री सेल्सियस रहने का अनुमान है। इस दिन आसमान आंशिक रूप से बादलों से घिरा रहेगा तथा कहीं-कहीं बहुत हल्की से हल्की बारिश के साथ गरज-चमक की संभावना जताई गई है। सुबह के समय 30 से 40 किलोमीटर प्रति घंटे की रफ्तार से तेज हवाएं चल सकती हैं, जिनकी गति झोंकों में 50 किलोमीटर प्रति घंटे तक पहुंच सकती है।
16 मई को मौसम साफ रहने की संभावना है। तापमान 41 डिग्री अधिकतम और 25 डिग्री न्यूनतम रह सकता है। इसके बाद 17 मई को तेज सतही हवाएं दिनभर चलने का अनुमान है। इस दिन भी अधिकतम तापमान 41 डिग्री और न्यूनतम 25 डिग्री सेल्सियस रहेगा। मौसम विभाग के अनुसार 18 मई से गर्मी और ज्यादा बढ़ जाएगी। इस दिन अधिकतम तापमान 43 डिग्री और न्यूनतम 27 डिग्री सेल्सियस तक पहुंच सकता है। 19 मई को भी गर्मी से राहत मिलने की संभावना नहीं है।
तापमान 42 डिग्री अधिकतम और 28 डिग्री न्यूनतम रहने का अनुमान है। वहीं 20 मई को भी अधिकतम तापमान 42 डिग्री और न्यूनतम 27 डिग्री सेल्सियस रहने की संभावना जताई गई है। लगातार बढ़ते तापमान के चलते दोपहर के समय लू जैसी स्थिति बनने की आशंका है। दूसरी ओर एनसीआर में वायु प्रदूषण का स्तर भी धीरे-धीरे खराब श्रेणी की ओर बढ़ रहा है। दिल्ली के कई इलाकों में एक्यूआई 150 से 185 के बीच दर्ज किया गया।
बुराड़ी क्रॉसिंग में एक्यूआई 185, अशोक विहार में 175, बवाना में 166, अलीपुर में 163 और आया नगर में 159 रिकॉर्ड किया गया। गाजियाबाद के कई इलाकों में स्थिति और ज्यादा खराब दिखाई दी। लोनी में एक्यूआई 288 और वेद विहार-लोनी में 257 दर्ज किया गया, जो खराब श्रेणी में आता है। वहीं वसुंधरा में एक्यूआई 189, इंदिरापुरम में 188 और संजय नगर में 184 रिकॉर्ड किया गया।
विशेषज्ञों का कहना है कि बढ़ते तापमान और हवा की धीमी गति के कारण धूल और प्रदूषक वातावरण में ज्यादा समय तक बने रहते हैं, जिससे एक्यूआई में बढ़ोतरी होती है। स्वास्थ्य विशेषज्ञों ने बच्चों, बुजुर्गों और सांस संबंधी बीमारी से पीड़ित लोगों को दोपहर में घर से बाहर निकलने से बचने की सलाह दी है। लोगों को पर्याप्त मात्रा में पानी पीने, हल्के कपड़े पहनने और तेज धूप से बचाव करने की सलाह दी गई है।
–आईएएनएस
पीकेटी/एएस
(This content is sourced from a syndicated feed and is published as received. Punjab Kesari assumes no responsibility or liability for its accuracy, completeness, or content.)",1.0
"6 जिलों में बारिश और आंधी का ऑरेंज अलर्ट: कल से पांच दिन लू का असर, तापमान सामान्य के करीब; बठिंडा सबसे गर्म - Dainik Bhaskar",https://news.google.com/rss/articles/CBMivgFBVV95cUxOTExna29wNGMxbFctUWZ0WlpKUDhzT0h0Um9mR19rVWZqblNjSEFHZzM0N1pkNW5MNE9GZ1pqeHYwZDR5THdVa2NJa0pKbE1DVVNiOVBBV3pIMFBCcUtRQl83amZEbk5EQ0c2MkNxekFYZFRkVEtQZE5RaE5jSDA5Vk13ZGlNeUR3cXJCWmk1N2xMVU4zYng0SzBYSVdrSFA0UjQwTVhubWliTzZQdzEyOUpSNWF5dzh2Z0FqdG930gG-AUFVX3lxTE5MTGdrb3A0YzFsVy1RZnRaWkpQOHNPSHRSb2ZHX2tVZmpuU2NIQUdnMzQ3WmQ1bkw0T0ZnWmp4djBkNHlMd1VrY0lrSkpsTUNVU2I5UEFXekgwUEJxS1FCXzdqZkRuTkRDRzYyQ3F6QVhkVGRUS1BkTlFoTmNIMDlWTXdkaU15RHdxckJaaTU3bExVTjNieDRLMFhJV2tIUDRSNDBNWG5taWJPNlB3MTI5SlI1YXl3OHZnQWp0b3c?oc=5,Dainik Bhaskar,2026-05-15T07:08:18+05:30,hi,Chandigarh,,"""लू"" Chandigarh","पंजाब के 6 जिलों में बारिश-तूफान का अलर्ट:कल से पांच दिन लू का असर, पहाड़ों की ठंडी हवा रुकने से चढ़ रहा पारा
पंजाब के छह जिलों व चंडीगढ़ में आज (15 मई) आंधी और बारिश का ऑरेंज अलर्ट है। वहीं 16 से लेकर 20 मई तक पांच दिन कई स्थानों पर हीट वेव चलने का यलो अलर्ट है। मौसम विज्ञान केंद्र चंडीगढ़ के मुताबिक वीरवार की तुलना में तापमान में 0.2 डिग्री की वृद्धि हुई है। यह सामान्य के करीब बना हुआ है। बठिंडा में 42.7 डिग्री तापमान दर्ज किया गया है। पहाड़ों की ठंडी हवा रुकने से पारा लगातार चढ़ रहा है।
मौसम विज्ञान केंद्र चंडीगढ़ के मुताबिक पठानकोट, गुरदासपुर, फाजिल्का, अमृतसर, होशियारपुर और मुक्तसर में अलग-अलग स्थानों पर गरज-चमक के साथ तेज आंधी चलने की संभावना है। हवा की रफ्तार 40 से 50 किलोमीटर प्रति घंटा तक रह सकती है।
पश्चिमी विक्षोभ कमजोर पड़ा
16 मई 2026 के आसपास दक्षिण-पश्चिम मानसून के दक्षिण बंगाल की खाड़ी, अंडमान सागर और अंडमान-निकोबार द्वीप समूह के कुछ हिस्सों में पहुंचने के लिए मौसम अनुकूल हो रहा है। एक नया पश्चिमी विक्षोभ उत्तर-पश्चिम भारत में असर दिखा सकता है। लद्दाख और आसपास के इलाकों में ऊपरी हवा में बना पश्चिमी विक्षोभ अब कमजोर पड़ गया है। दक्षिण हरियाणा और आसपास के क्षेत्रों में बना ऊपरी हवा का चक्रवाती सिस्टम भी कमजोर हो गया है।
5 जिलों का तापमान 40 डिग्री से अधिक
14 मई 2026 को पंजाब में 5 जिलों का तापमान 40 डिग्री से अधिक दर्ज किया गया। सबसे ज्यादा तापमान बठिंडा में 42.7 डिग्री रहा। इसके अलावा फाजिल्का में 40.9 डिग्री, पटियाला में 40.4 डिग्री और फरीदकोट में 40.0 डिग्री तापमान दर्ज हुआ। चंडीगढ़ में 38.1 डिग्री, अमृतसर में 38.0 डिग्री, लुधियाना में 38.4 डिग्री, पठानकोट में 37.6 डिग्री, गुरदासपुर में 36.0 डिग्री, होशियारपुर में 36.8 डिग्री, फिरोजपुर में 38.8 डिग्री, मोहाली में 37.4 डिग्री, रोपड़ में 37.9 डिग्री और रूपनगर में 38.5 डिग्री तापमान रिकॉर्ड किया गया। पटियाला में तापमान 1.4 डिग्री, एसबीएस नगर में 1.0 डिग्री और रूपनगर में 1.1 डिग्री बढ़ा। चंडीगढ़, अमृतसर, लुधियाना, बठिंडा, फाजिल्का और फिरोजपुर में तापमान में गिरावट दर्ज की गई।
तीन से चार डिग्री तापमान बढ़ेगा
मौसम विज्ञान केंद्र चंडीगढ़ के डायरेक्टर सुरेंद्र पाल के मुताबिक 15 मई को राज्य में कुछ स्थानों पर हल्की से मध्यम बारिश होने की संभावना है। इसके बाद मौसम शुष्क रहने की उम्मीद है। अगले 7 दिनों के दौरान राज्य में अधिकतम तापमान में धीरे-धीरे 3 से 4 डिग्री सेल्सियस तक बढ़ोतरी हो सकती है। राज्य में कुछ स्थानों पर गरज-चमक के साथ 40 से 50 किलोमीटर प्रति घंटा की रफ्तार से तेज हवाएं चल सकती हैं। 16 से 20 मई के दौरान राज्य के कुछ इलाकों में लू चलने की संभावना है।
तीन दिन इस तरह का मौसम रहेगा
16 मई - बठिंडा और मानसा में कुछ स्थानों पर लू चलने की संभावना है। मौसम शुष्क रहने की पूरी संभावना है।
17 मई - बठिंडा और मानसा में कुछ जगहों पर लू चलने की संभावना है। राज्य में मौसम शुष्क रहने की संभावना है।
18 मई - फिरोजपुर, फाजिल्का, फरीदकोट, मुक्तसर, मोगा, बठिंडा, बरनाला और मानसा में कुछ स्थानों पर लू चलने की संभावना है। मौसम शुष्क रहने की पूरी संभावना है।",1.0
"MAUSAM: उत्तर भारत में 15 मई से लू का अलर्ट, तापमान में 3 से 5 डिग्री उछाल की संभावना... - Gaon Junction",https://news.google.com/rss/articles/CBMi6AFBVV95cUxQakV3V0Jrb2RDc2hfNUVMYUo1UXFhZ2p5RXQ2ZlFhYzRIRHZpQ2lTTEt0MmdXRDBEZFZRUE5ubUduaS1OaE1hajZld2Rmd1JZZnFWeE1acVIwZ2o2Y0ZYTUhyeXRTWDZYTnRWU293RUpZTFFsdEdQVjlGZnhuQWo2djg2NGRIU3Y3UXZkOFVmaVJCVnV1ZHY0UmI0OWNPUlhjOEhKdVV0Z2ZQMnpVaW1lcHVVYVdyYVYwRVpmcVhteWpKVXQ2VlFYUGJiTGdwUzF0dXdFRXB6Ymo0LTdRa0FvV04wVEZyUENB?oc=5,Gaon Junction,2026-05-15T08:18:21+05:30,hi,Chandigarh,,"""लू"" Chandigarh","Home›Khabar Junction›
Weather Heatwave Alert Issued For North India Starting May 15 Temperatures Expected To Surge By 3 To 5 Degre
MAUSAM: उत्तर भारत में 15 मई से लू का अलर्ट, तापमान में 3 से 5 डिग्री उछाल की संभावना...
गांव जंक्शन डेस्क, लखनऊDevesh Saraswat
Updated Fri, 15 May 2026 08:18 AM IST
सार
IMD के अनुसार, उत्तर भारत के राज्यों में 15 मई 2026 और उसके बाद मौसम में बड़े बदलाव देखने को मिलेंगे। ताजा रिपोर्ट के मुताबिक, उत्तर-पश्चिम भारत में 17 मई तक अधिकतम तापमान में 3 से 5 डिग्री सेल्सियस तक की धीरे-धीरे वृद्धि होने की संभावना है। हालांकि, 18 से 20 मई के बीच तापमान में कोई बड़ा बदलाव नहीं देखा जाएगा।
भीषण गर्मी का अलर्ट
- फोटो : AI Image
Link Copied
विज्ञापन
विस्तार
IMD के अनुसार, उत्तर भारत के राज्यों में 15 मई 2026 और उसके बाद मौसम में बड़े बदलाव देखने को मिलेंगे। ताजा रिपोर्ट के मुताबिक, उत्तर-पश्चिम भारत में 17 मई तक अधिकतम तापमान में 3 से 5 डिग्री सेल्सियस तक की धीरे-धीरे वृद्धि होने की संभावना है। हालांकि, 18 से 20 मई के बीच तापमान में कोई बड़ा बदलाव नहीं देखा जाएगा।
15 और 16 मई को आंधी और बारिश का अनुमान
IMD के मुताबिक, जहां एक तरफ तापमान बढ़ेगा, वहीं कुछ राज्यों में तेज हवाएं चलने का भी अनुमान है। 15 मई को पंजाब, हरियाणा, चंडीगढ़, दिल्ली, राजस्थान और जम्मू-कश्मीर-लद्दाख-गिलगित-बाल्टिस्तान-मुजफ्फराबाद में 40 से 50 किलोमीटर प्रति घंटे की रफ्तार से तेज हवाएं चलने, बिजली कड़कने और आंधी (Thunderstorm) आने की संभावना है। इसी दिन हिमाचल प्रदेश और उत्तराखंड में 30 से 40 किलोमीटर प्रति घंटे की रफ्तार से हवाएं चल सकती हैं। 16 मई को भी जम्मू-कश्मीर और इसके आसपास के इलाकों में 40-50 किमी/घंटे और हिमाचल प्रदेश में 30-40 किमी/घंटे की रफ्तार से आंधी और बिजली कड़कने की संभावना है।
IMD के अनुसार, उत्तर भारत के मैदानी इलाकों में भीषण गर्मी और लू का दौर शुरू हो रहा है। पंजाब, हरियाणा, चंडीगढ़ और दिल्ली में 16 मई से 20 मई के बीच लू चलने की पूरी संभावना है। पश्चिमी उत्तर प्रदेश में 15 से 17 मई तक और पूर्वी उत्तर प्रदेश में 15 से 17 मई के साथ-साथ 20 मई को भी हीटवेव का अलर्ट है। पश्चिमी राजस्थान के लिए विशेष अलर्ट जारी किया गया है। यहाँ 17 मई से 19 मई तक कई स्थानों पर गंभीर हीटवेव का प्रकोप रहेगा। इसके अलावा, पश्चिमी राजस्थान में रात के समय भी गर्म हवाएं चलने की संभावना है। पूर्वी राजस्थान में भी 17 से 20 मई के बीच लू चलने के आसार हैं।
लगातार बढ़ रहे तापमान को देखते हुए IMD ने स्वास्थ्य और खेती को लेकर कुछ अहम सुझाव दिए हैं। IMD के अनुसार, धूप में ज्यादा समय बिताने या भारी काम करने वाले लोगों में गर्मी से होने वाली बीमारियों का खतरा बढ़ सकता है। विशेष रूप से बच्चों, बुजुर्गों और बीमार लोगों का ध्यान रखने की सलाह दी गई है। शरीर में पानी की कमी न होने दें; प्यास न लगने पर भी पर्याप्त पानी पिएं। ओआरएस (ORS) और घरेलू पेय जैसे लस्सी, नींबू पानी, छाछ और चावल के पानी (तोरानी) का उपयोग करें।IMD के अनुसार, राजस्थान में गर्मी के असर को कम करने के लिए किसानों को सब्जियों और फलों के पौधों (जैसे आम, आंवला, लौकी, कद्दू, पालक आदि) में जरूरत के हिसाब से सिंचाई करने की सलाह दी गई है। आंधी-तूफान के दौरान कटी हुई फसलों को सुरक्षित स्थानों पर रखने या तिरपाल से ढकने को कहा गया है।
हम डाटा संग्रह टूल्स, जैसे की कुकीज के माध्यम से आपकी जानकारी एकत्र करते हैं ताकि आपको बेहतर और व्यक्तिगत अनुभव प्रदान कर सकें और लक्षित विज्ञापन पेश कर सकें। अगर आप साइन-अप करते हैं, तो हम आपका ईमेल पता, फोन नंबर और अन्य विवरण पूरी तरह सुरक्षित तरीके से स्टोर करते हैं। आप कुकीज नीति पृष्ठ से अपनी कुकीज हटा सकते है और रजिस्टर्ड यूजर अपने प्रोफाइल पेज से अपना व्यक्तिगत डाटा हटा या एक्सपोर्ट कर सकते हैं। हमारी Cookies Policy, Privacy Policy और Terms & Conditions के बारे में पढ़ें और अपनी सहमति देने के लिए Agree पर क्लिक करें।",1.0
