title,url,source,date,language,state,district,search_term,full_text,relevance_score
Nabarangpur Schools and Colleges Closed from April 20 Amid Heatwave - Pragativadi,https://news.google.com/rss/articles/CBMilwFBVV95cUxNVkYzZ1pkcDFzbXVqTlU1MHlTbGl0MDJubkpCeG1sQTFSSmVtQUpGeTFuUG44T1FFSW9HRTh0S004czVOVUpENDJyeVZ5Z1lnQWw3bjZGNFFKU1J6MXJMRjZxd2xCMEFZUGVfRkVBLVdLWmdqWlBiRFpjcERzb3lxVzdtZzJKb0hZb09RMkFDc2psQUdBTmMw?oc=5,Pragativadi,2026-04-18T17:30:43+05:30,en,Odisha,Nabarangpur,"(heatwave OR ""heat wave"" OR ""severe heatwave"" OR ""extreme heat"" OR ""heat spell"" OR ""scorching heat"" OR ""blistering heat"" OR ""sweltering heat"" OR ""hot winds"" OR loo OR ""hot loo winds"" OR ""intense heat"" OR ""unbearable heat"" OR ""deadly heat"" OR heat OR ""weather forecast"" OR ""weather update"" OR ""weather alert"" OR ""IMD forecast"" OR ""IMD prediction"" OR ""IMD alert"" OR IMD OR ""rising temperatures"" OR ""temperatures expected to rise"" OR ""relief from heat"" OR ""respite from heat"" OR ""heat respite"" OR ""respite from scorching heat"") Odisha","Nabarangpur district administration announced a holiday for all educational institutions starting April 20 as temperatures touched 44°C.
District Collector issued an official order directing Anganwadi Centres, schools, colleges, and technical institutions to remain closed until further instructions. The decision came after the district recorded extreme heatwave conditions that posed risks to students and staff.
Authorities confirmed that examinations already scheduled during this period will continue. Institutions may shift exam timings to morning hours to avoid peak heat. The Collector instructed heads of institutions to ensure adequate drinking water facilities and provide heatstroke prevention arrangements for students appearing in exams.
The administration emphasised strict compliance with the directive. Schools and colleges must maintain shaded areas and hydration points. The move aims to safeguard children and staff from heat-related illnesses.
Western Odisha districts, including Nabarangpur, continue to experience soaring temperatures above 40°C. Similar closures have been announced in other districts to protect students from extreme weather.",1.0
