title,url,source,date,language,state,district,search_term,full_text,relevance_score
"Line of fire from the hills to Punjab: Faridkot a fiery 45.9°C, Una 44.3°C - The Times of India",https://news.google.com/rss/articles/CBMi4gFBVV95cUxQaHNnc3NBLTAybU9xVWFpZ2dFS2tvcjBGUUxpUlZfbnBONDAtNzRBa2h3M3RQd2Y3T19NNEtKLV9ENlpJaGM3WDBWRVRZZGxTcTdhcTlBNVVhTHdWUXVNc2NlYlhSSWlFU3RfQzh1a2NSVTZKcVU5akdSdDhzSjJ4UF9CdnZQT1RZOXJ0Y2dNSVFZZHJSc2ZQaTd2R3dNRDVoNV9kUFNKRGZXdUI5bXF6VEh5UlprdktmcjRmRHlLVEdBa2ZYcWI5QUZMWS1CNUx0WGdVNXV4WWxzNWQ4NmVNWVZ30gHnAUFVX3lxTE91RTB0YVV6aXVtX3RmZVRlU2RiaG44U3NvRVpjOExCOWt0T3ROS3JZQ1RobVg3RGNxOTF3S2J3eTkzdk91aHhkV1E5ZnkyNWpRYWkxNzdBVHZVenRnRTdyMXpvYWcyTzBNOTRoVzI2SVhjbWlfNk1ZZXdZaTJ6Q1hXbE9RdmtUb2NBR0FlV09QTmRwU1JiaVFYd3ZfdHpyNTRqT01zUEdKMm16OHlmVTFKel9UWURWbXJiY1l2eEtySnFlV1lPbnI4b0laelFNWmZaSURpdjNFdjFFenoxbXYwYVV4WExqUQ?oc=5,The Times of India,2026-05-21T23:20:00+05:30,en,Himachal Pradesh,Una,"heatwave (Bilaspur OR Chamba OR Hamirpur OR Kangra OR Kinnaur OR Kullu OR ""Lahaul and Spiti"" OR Mandi OR Shimla OR ""Sirmaur (Sirmour)"" OR Solan OR Una) Himachal Pradesh","Bathinda/Kullu: Heat wave conditions continued across Punjab, Haryana and Himachal Pradesh on Thursday, with temperatures soaring well above normal and outdoor activity taking a hit across the region.
Faridkot recorded Punjab's highest maximum temperature at 45.9°C, while Sirsa in Haryana touched 45.8°C. In Himachal Pradesh, Una remained the hottest place at 44.3°C, nearly 6°C above normal. The India Meteorological Department (IMD) said temperatures in several places ranged between 40°C and 47°C, markedly above normal by over 5°C in isolated pockets across Punjab, Haryana and Himachal Pradesh.
Punjab and Haryana both recorded a marginal fall of 0.9°C in average maximum temperatures compared with Wednesday, though temperatures remained appreciably above normal.
The IMD said heat wave to severe heat wave conditions were likely to continue in many parts of Haryana till May 27, while Punjab would continue to experience heat wave conditions during the same period.
The intense heat affected outdoor workers and farmers engaged in cotton sowing and direct seeding of rice. Municipal election campaigning was also impacted, with candidates preferring morning and evening outreach while avoiding afternoon heat.
The weather department has issued advisories asking people to avoid prolonged exposure to heat and remain hydrated. Punjab may, however, get some relief on May 22, with isolated to scattered light rain, thunderstorms and gusty winds of 40-50 kmph likely at some places. Dust storm activity is also expected in isolated pockets.
Strong winds were reported from several places on Thursday, including gusts of 61 kmph in Sonipat, 48 kmph in Seobagh and 39 kmph in Hoshiarpur.
In Himachal Pradesh, Neri in Hamirpur recorded 41°C, while Sundernagar touched 39.9°C. Mandi, Nahan and Kangra also witnessed temperatures nearing 39°C.
Shimla recorded 30.5°C, around 5.5°C above normal, while Dharamshala touched 36.1°C. Minimum temperatures too remained above normal across the state.
The meteorological centre in Shimla issued an orange alert for thunderstorms, hail, lightning and gusty winds in parts of Chamba, Kangra, Kullu, Mandi and Shimla districts for May 22.",0.8
"Weather Update: भीषण गर्मी का प्रकोप, कई इलाकों में चली लू, फिर बदलेगा मौसम - Punjab Kesari",https://news.google.com/rss/articles/CBMiiAFBVV95cUxPdGROaXB0RGMxMWYtR2JZdHg5ekxPUjRVS2NKNWhfbzRaZGJvT1pONXFucTVGNVVkY18zaGVtY0psSHo2aUoyeFp0RVB0RWpDOXNXakdGdU8xY0I2U3hna1JjVlV3R2JQYzU4OHpEbDZnV0Q1T1lkM0RFV1lPMUw1YUxGOGlkUlpz?oc=5,Punjab Kesari,2026-05-21T19:30:00+05:30,hi,Himachal Pradesh,Una,"""लू"" Himachal Pradesh","Edited By Kuldeep, Updated: 21 May, 2026 07:30 PM
हिमाचल में मई की गर्मी ने अब विकराल रूप ले लिया है। मैदानी इलाकों से लेकर ऊंचाई वाले पहाड़ी क्षेत्रों तक लोग भीषण गर्मी और लू का सामना कर रहे हैं।
शिमला (संतोष): हिमाचल में मई की गर्मी ने अब विकराल रूप ले लिया है। मैदानी इलाकों से लेकर ऊंचाई वाले पहाड़ी क्षेत्रों तक लोग भीषण गर्मी और लू का सामना कर रहे हैं। वीरवार को प्रदेश के अधिकांश हिस्सों में तापमान सामान्य से काफी अधिक दर्ज किया गया, जिससे जनजीवन बुरी तरह प्रभावित हुआ है। ऊना सबसे गर्म रहा, जहां अधिकतम तापमान 44.3 डिग्री रिकार्ड किया गया। इसके अलावा नेरी में 41, सुंदरनगर में 39.9, मंडी में 38.8, नाहन में 38.7, सोलन में 36 डिग्री रहा। हिल स्टेशनों का हाल भी बेहाल रहा। शिमला में 30.5, मनाली में 28.6 और कल्पा में 26.5 डिग्री जैसे ठंडे स्थानों पर भी सामान्य से अधिक तापमान दर्ज किया गया, जिससे पर्यटकों और स्थानीय लोगों को गर्मी का सामना करना पड़ा।
मौसम विज्ञान केंद्र शिमला के अनुसार शिमला, धर्मशाला, पालमपुर, सोलन व ऊना में लू यानी हीट वेव चली है। भीषण गर्मी और लू के चलते निचले क्षेत्रों में जनजीवन पर बुरा असर पड़ा है। सिरमौर के पांवटा साहिब और ऊना जैसे जिलों में प्रशासन ने स्कूली समय में बदलाव किया है, ताकि बच्चों को दोपहर की चिलचिलाती धूप और लू से बचाया जा सके। लोगों को दोपहर के समय घरों के अंदर रहने की सलाह दी गई है।
अगले 3 दिन राहत की उम्मीद
मौसम विभाग ने राहत भरी खबर देते हुए बताया है कि पश्चिमी विक्षोभ के सक्रिय होने से मौसम में जल्द ही बदलाव आएगा। 22 से 23 मई बारिश और आंधी चलेगी। प्रदेश के कई इलाकों में गरज-चमक के साथ बारिश और ऊंचाई वाले क्षेत्रों में बर्फबारी की संभावना है। विभाग ने 22 मई को चंबा, कांगड़ा, कुल्लू, मंडी और शिमला जिलों के लिए 40-50 किमी प्रति घंटे की रफ्तार से तेज आंधी चलने का ऑरैंज अलर्ट जारी किया है। अगले दो से तीन दिनों में न्यूनतम तापमान में 2 से 5 डिग्री सैल्सियस तक की गिरावट दर्ज की जा सकती है, जिससे लोगों को गर्मी से राहत मिलने की उम्मीद है।",1.0
