title,url,source,date,language,state,district,search_term,full_text,relevance_score
"बलरामपुर में तेज धूप और लू से जनजीवन प्रभावित: तापमान 38°C पहुंचा, बाजार और सड़कों पर सन्नाटा छाया - Dainik Bhaskar",https://news.google.com/rss/articles/CBMiuwFBVV95cUxQZmF0S0dvTHZrbkRWdlBxMFVpSlE4Y2ZjMWpjZE9mZ2J0VzRyMHd0R1NFdDQzWjFJSklad3Q5SWlYTjdWMFhzUmVTT3BvLUxFdHZkdjVLMlhnakVCdGhyRmY4d0pCNXdIUnluckozaExPSWVTZ3U3QzZheEtOeDJzOThlaG9XOWVIX0hlMG51TnRNeHZuTzFJOUV4Mm5GOG5RdzNzbUJtX0FlRmhtYkZWUUNKQXBGSlZRTkhn0gHAAUFVX3lxTE5yMkFaMi14VXVuc3ZFaF8wMV9RNDVSbnVfZERrTC0tOHhla25qNmxISWhpc0xYVk15cUlXNHpXc2ppWGtmUTBNcnJiMmFtUzZ0cE80QTJUN2lPM2oyZndRQzJvUlZCRV9zLUNwR1h6RWNxZVBtQk9mb3ZtdTFobkdtUTZabVNQMmxta0NsUzQyWUNGNTNpb2NXMXRBTE9EUXFxQ1RXUk1kUFhjWnlVX2FwblAtalUyVW5SZGZoam1lcg?oc=5,Dainik Bhaskar,2026-04-02T16:21:37+05:30,hi,Haryana,,"(लू OR ""लू चलना"" OR ""भीषण गर्मी"" OR ""प्रचंड गर्मी"" OR ""कड़ी धूप"" OR ""तेज धूप"" OR ""गर्म हवा"" OR ""उष्ण लहर"" OR ""ताप लहर"" OR ""हीट वेव"" OR ""झुलसाने वाली गर्मी"" OR ""तपती गर्मी"" OR ""भयंकर गर्मी"" OR ""गर्मी का कहर"" OR ""गर्मी का प्रकोप"" OR ""अत्यधिक गर्मी"" OR मौसम OR ""मौसम अपडेट"" OR ""मौसम का हाल"" OR ""मौसम पूर्वानुमान"" OR ""मौसम अलर्ट"" OR आईएमडी OR ""आईएमडी पूर्वानुमान"" OR ""आईएमडी अलर्ट"" OR ""तापमान में बढ़ोतरी"" OR ""गर्मी से राहत"" OR ""गर्मी से निजात"") Haryana","Balrampur Heatwave & Loo Impact Life; Temp Reaches 38°C
बलरामपुर में तेज धूप और लू से जनजीवन प्रभावित:तापमान 38°C पहुंचा, बाजार और सड़कों पर सन्नाटा छाया
सुजीत कुमार | बलरामपुर22 घंटे पहले
कॉपी लिंक
बलरामपुर में गुरुवार को तापमान में अचानक वृद्धि दर्ज की गई। मौसम विभाग के अनुसार, जिले में अधिकतम तापमान 37-38 डिग्री सेल्सियस तक पहुंच गया है, जबकि न्यूनतम तापमान 20 डिग्री सेल्सियस के आसपास बना हुआ है। तेज धूप और लू के कारण जनजीवन प्रभावित हुआ है।
सुबह से ही तेज धूप और गर्म हवाओं के कारण दोपहर तक बाजार और सड़कों पर सन्नाटा छा जाता है। पिछले कुछ दिनों से तापमान में लगातार बढ़ोतरी हो रही है, जिससे लोगों का दिन में घरों से बाहर निकलना मुश्किल हो गया है।
इस भीषण गर्मी का सर्वाधिक असर छोटे बच्चों, बुजुर्गों और दिहाड़ी मजदूरों पर पड़ रहा है। जिला अस्पतालों में डिहाइड्रेशन, चक्कर आने और लू लगने जैसे गर्मी संबंधी मामलों में वृद्धि हुई है। चिकित्सकों ने लोगों को धूप में निकलने से बचने और पर्याप्त मात्रा में पानी पीने की सलाह दी है।
दोपहर के समय बाजारों में ग्राहकों की संख्या कम होने से व्यापार प्रभावित हो रहा है। वहीं, किसान भी तेज गर्मी के कारण केवल सुबह और शाम के समय ही खेतों में काम कर पा रहे हैं।
प्रशासन ने नागरिकों से अपील की है कि वे अत्यधिक गर्मी के दौरान सावधानी बरतें। अनावश्यक रूप से बाहर निकलने से बचें और शरीर को हाइड्रेटेड रखें, ताकि लू के प्रभाव से बचा जा सके।",1.0
