title,url,source,date,language,state,district,search_term,full_text,relevance_score
Heatwave Persists in Rajasthan as Delhi Braces for Thunderstorm Relief - Devdiscourse,https://news.google.com/rss/articles/CBMiwwFBVV95cUxNVHAtM1ZkNlhWNUR6c0JmWWMtc1Z2ekZERl9MUlU4aTUyX3ZsSU85d2poZnlNUFYxSGY1ZHkyNmR4akwwb1lndWU2bjA4ekY3bXFPWXQ1T241T3l1eTZOTmxCNC1qR0VlNWlrdktweDhyU1pHb1ZOU2I4R0ZWVnRTMVRoeEhrbE1sbmFvcWxyVVhFN21XWTVMdGVIbUxqeVU2d1VQZmF3N3V3OGo1S21EdU15LVBoNjVHWXFQbGx1dTVjUFXSAcgBQVVfeXFMTU80UFFkcWtrZHpTeHlkRmc3SjNrWGFiQTZ5SVc1TmhXTWxBdHFPcU5wX2ZHSy11QUk5R2FNVWZQWkZfWHh0bDlwSzk2OF9TSGIxMXZGYW50T2dnTnpXeGt0NDJjUU1wbTBWQmNkU1d5blN1WkU4bWVBRy1ZRGJhbTJ6bmhiZDBlcER0eVJKcVBBQm9iWnZhd0Q1cDJ1LXJzeVpsZnpTNXZTRDJHUW1fRXh4SjM2UkVKaXc5dTdRSWJYQ0pDTU5HNU4?oc=5,Devdiscourse,2026-05-28T22:18:30+05:30,en,Rajasthan,Alwar,"""heatwave"" Rajasthan","Heatwave Persists in Rajasthan as Delhi Braces for Thunderstorm Relief
Sri Ganganagar hit a scorching 47.1°C, leading Rajasthan's extreme heat wave as Delhi prepares for thunderstorms after days of oppressive heat. The India Meteorological Department has issued a Red alert, warning of severe weather disruptions, including possible flight delays at Delhi Airport.
Sri Ganganagar recorded a blistering 47.1 degrees Celsius on Thursday, marking the highest temperature in Rajasthan as severe heat conditions persisted across the state. Many districts saw temperatures consistently soar to 45 degrees Celsius and above, underscoring the relentless heatwave gripping the region.
Heat-spell extended with temperatures exceeding 46 degrees Celsius in cities like Kota, Phalodi, Alwar, and Jaisalmer. Meanwhile, a western disturbance brought heavy rain and thunderstorms to Delhi and the National Capital Region (NCR), offering much-needed relief after enduring a scorching heatwave for several days.
The India Meteorological Department had initially issued an 'orange' alert for Delhi, forecasting moderate to severe thunderstorms with lightning and isolated hailstorms across the city, later escalating it to a 'Red' alert. The department predicts intense thunderstorms will impact South Haryana, adjoining Delhi, and the NCR, with gusty winds up to 80 kmph potentially accompanied by hail and dust storms.
Due to the anticipated severe weather conditions, Delhi International Airport Limited (DIAL) announced potential flight disruptions. Passengers were advised to confirm flight details with airlines and consider alternative transportation, such as the Delhi Metro, to mitigate travel disruptions.
The onset of rain led to a marked drop in temperature, offering reprieve from the oppressive heat as daytime figures in Delhi ranged between 44 and 46 degrees Celsius. Maximum temperatures are forecasted to decline by 8 to 10 degrees Celsius by May 29. Residents are urged by the IMD to exercise caution, avoid vulnerable areas during storm conditions, and brace for continued rainfall heading into Friday morning.
(With inputs from agencies.)",1.0
Rajasthan heatwave: Sri Ganganagar sizzles at 47.1 degrees Celsius - Asianet Newsable,https://news.google.com/rss/articles/CBMiwAFBVV95cUxOOEkxOGZRQ2RLc3FIME9yYzNqLV9uOXN6XzVaNFQxcVpqbG9oTGFfSzRaQ0d5VzZubERlQWFlQ0dZLUgwWjBQTC1BQWdQckswM01WalNEZGxvS0lhU3JVREtqOXdiOU5xdlZhWjhNVkw5ZXhybWZVN1BZc1p6bFAzRUtWOEhveEwzMWxVcU1Eb3EwazFSeXZzTlVkbDgwdTNtWHgxbDNzVWlKVm1kSkc4Nm95QUhOYW16RTdYZndXTUTSAcYBQVVfeXFMT3U0MG5QQ3A0UU1hbEFfRU1Id0MzemVVQlBWQWIwT3VQWG9LRHRsZnZzTF9jd0Q0T1BaZEpmYmt2V1dYODktUGRUMjNwVjc5Um5Hd3hwSUZReTc4MWFRN0NENGRyakdSQW9ybWhOZnBHWUdxaDUzMFh4TGxFT1V0dWVOU2phcmZ5Z2pDZUh4Sldtb3B5cmVMZnBEVTZtLUc4ZnB6NEZIYWVZREpNLWctcks4SXItR0FsaTVGU2xDNm1SbTN6SnhB?oc=5,Asianet Newsable,2026-05-28T22:30:45+05:30,en,Rajasthan,Alwar,"""heatwave"" Rajasthan","Sri Ganganagar hit 47.1°C, leading Rajasthan's severe heatwave. Meanwhile, a western disturbance brought heavy rain and thunderstorms to Delhi-NCR, offering relief from scorching heat and prompting an IMD 'Red' alert and flight disruptions.
Sri Ganganagar recorded the highest temperature in Rajasthan on Thursday at 47.1 degrees Celsius, as most districts in the state continued to experience severe heat conditions.
Temperatures in several parts of the state remained at 45 degrees Celsius and above, indicating persistent intense heat across the region.
In addition to Sri Ganganagar, temperatures crossed 46 degrees Celsius in Kota, Phalodi, Alwar and Jaisalmer.
Relief for Delhi as Thunderstorms Lash City
Meanwhile, heavy rain and thunderstorms triggered by a western disturbance provided much-needed relief to people in Delhi and the national capital region (NCR), which was in the grip of a scorching heatwave for the past many days.
IMD Upgrades Warning to 'Red' Alert
The India Meteorological Department earlier today issued an 'orange' alert for Delhi, predicting ""moderate to severe thunderstorms accompanied by lightning and isolated hailstorms"" likely at many places across the city. It later upgraded the warning to 'Red'.
""Intense thunderstorm activity over several parts of South Haryana, adjoining Delhi and the entire NCR is likely to be affected due to strong winds reaching upto 80 kmph accompanied by hail and duststorm,"" the Met Department said.
Flights Impacted at Delhi Airport
Delhi International Airport Limited (DIAL) this evening announced that due to the inclement weather conditions and expected thunderstorms, some flights could be impacted at Delhi Airport.
""Due to inclement weather conditions and expected thunderstorms in Delhi, some flights might be impacted at Delhi Airport... Passengers are requested to contact the airline concerned for updated flight information. Passengers can consider alternative modes of transport, including the Delhi Metro, to get to the Airport to avoid potential delays,"" DIAL posted on its social media account X.
Temperature Plunges, IMD Issues Advisory
The rain brought with it a plunge in mercury, offering residents a respite from blistering summer conditions. Daytime temperatures hovered between 44 degrees C and 46 degrees C in the national capital.
Maximum temperatures are projected to experience a massive 8 degrees C to 10 degrees C by May 29.
The IMD has advised residents to remain cautious, avoid standing under fragile structures or trees during peak squall windows, and prepare for consecutive spells of rain moving into Friday morning. (ANI)
(Except for the headline, this story has not been edited by Asianet Newsable English staff and is published from a syndicated feed.)",1.0
