title,url,source,date,language,state,district,search_term,full_text,relevance_score
"MP में प्री-मानसून की धूम... भोपाल-इंदौर में तेजी से लुढ़का पारा, विदिशा-गुना समेत 3 जिलों में ऑरेंज और 50 में येलो अलर्ट - Nai Dunia",https://news.google.com/rss/articles/CBMi0wFBVV95cUxOWFBwcEk4b3UtRTJvSjVqcXN4TFNreUVEdVlPTi1nNTk5QXR3RGZvWlVGdS1KMl9OYWtkTDNDeVl5ODY5bWFCM3BCTWd1cy1fUmNUXzNXdzRKSUZ3MXl2SFMtSnZDZ3Nrd2p6WVdQWENWOVRxUjBYbkNfTDlxMGlpeFM0TUp1WlpHZThEZWtGSU0zUTI1ZkI2TVNDdEsxWDJkcl90dkFKdHhCbXY4LVM2YTFGU2NiM2NkcWhFN0RCX09Uc3NnQ1RIYjFQdlhIMkFsTUU0?oc=5,Nai Dunia,2026-06-05T20:36:42+05:30,hi,Madhya Pradesh,,"(""हीट एक्शन प्लान"" OR ""गर्मी से राहत"" OR चेतावनी OR ""रेड अलर्ट"" OR ""ऑरेंज अलर्ट"" OR ""येलो अलर्ट"" OR एडवाइजरी OR ""राहत सामग्री"" OR ""राहत शिविर"" OR मुआवजा) Madhya Pradesh","नईदुनिया प्रतिनिधि, भोपाल। प्रदेश में प्री-मानसून गतिविधियां लगातार तेज बनी हुई हैं। शुक्रवार को मध्य प्रदेश के कई हिस्सों में बारिश और धूलभरी आंधी का असर देखने को मिला। रतलाम में 12 मिलीमीटर और धार में 8 मिलीमीटर वर्षा दर्ज की गई। वहीं श्योपुर, मुरैना, शिवपुरी, नीमच, मंदसौर और रायसेन सहित दो दर्जन से अधिक जिलों में 40 किलोमीटर प्रतिघंटा की रफ्तार से धूलभरी आंधी चली।
गुरुवार रात हुई बारिश का असर शुक्रवार को तापमान पर भी साफ दिखाई दिया। प्रदेश के पश्चिमी हिस्सों में दिन और रात दोनों के तापमान में गिरावट दर्ज की गई। राजधानी भोपाल में अधिकतम तापमान सामान्य से 5.3 डिग्री कम होकर 35.2 डिग्री सेल्सियस दर्ज किया गया, जबकि न्यूनतम तापमान सामान्य से 7.2 डिग्री नीचे 20.2 डिग्री सेल्सियस रहा।
इंदौर में भी मौसम सुहावना
इंदौर में भी मौसम सुहावना बना रहा। यहां अधिकतम तापमान 35.1 डिग्री सेल्सियस दर्ज किया गया, जो सामान्य से 4.1 डिग्री कम है। श्योपुर में तापमान में सबसे अधिक गिरावट दर्ज की गई, जहां दिन का पारा सामान्य से 10.7 डिग्री नीचे आकर 32 डिग्री सेल्सियस पर पहुंच गया।
अगले तीन दिनों तक तापमान में किसी बड़े बदलाव की संभावना नहीं
हालांकि प्रदेश के कुछ हिस्सों में गर्मी का असर बरकरार रहा। छिंदवाड़ा, छतरपुर जिले के खजुराहो, खंडवा और खरगोन में अधिकतम तापमान 40 डिग्री सेल्सियस दर्ज किया गया। मौसम विज्ञानी एच.एस. पांडे के अनुसार अगले तीन दिनों तक तापमान में किसी बड़े बदलाव की संभावना नहीं है। इसके बाद अधिकतम तापमान में दो से तीन डिग्री सेल्सियस तक वृद्धि हो सकती है।
आज तीन जिलों में ऑरेंज और अधिकांश प्रदेश में येलो अलर्ट
ऑरेंज अलर्ट
विदिशा, गुना और अशोकनगर जिलों में वज्रपात के साथ 50 से 60 किलोमीटर प्रतिघंटा की रफ्तार से तेज आंधी चलने की चेतावनी जारी की गई है।
येलो अलर्ट
भोपाल, इंदौर, उज्जैन, ग्वालियर, जबलपुर और रीवा सहित करीब 50 जिलों में गरज-चमक के साथ 40 से 50 किलोमीटर प्रतिघंटा की रफ्तार से हवाएं चलने और हल्की बारिश होने की संभावना जताई गई है।
प्रदेश के प्रमुख शहरों का तापमान
This website uses cookie or similar technologies, to enhance your browsing experience and provide personalised recommendations. By continuing to use our website, you agree to our Privacy Policy and Cookie Policy.",1.0
MP में आंधी-बारिश से गिरा पारा-गर्मी से राहत: 6 जून को भोपाल-इंदौर-ग्वालियर-जबलपुर-सागर में तेज हवाओं के साथ हल्की बारिश के आसार - Bansal News,https://news.google.com/rss/articles/CBMi9wFBVV95cUxOOHM3SFdnakROb00xOTNGSFg2MktSaXgwbW5lRUw1anVvaDM0YzExbzVMNXRKb1NPZ1RKRmVCNFE1cUpIczVrUXllSDEzckhaVGtDd0prSmtGVVZSVi1LZFpZVWxTQWpLUkNuQnZMd3hKeW0yWmctY25fN0U4STRweWpTX1FXdVl0NWozZmJ4cFVwYi14VFZjbzNZWnBfQUlyZnZ6eHJJbTE1S0RBVDc2ZjlCMFRPQk9nQUhERzdSbjRKeWlIdTFBcUhSV3h1MFoxUy1ULUNxbUNieWdRWTdnSmsyRW5qZ1R5N2hpSkh0SFlaVmFob3lv0gH8AUFVX3lxTE5VdDQ0TkpWV194V3lBVFJ4YTJTVHkxZzU4M1J5dEphdDZFWTgwX3U1WGVENUgwNWV3c2V5WVItMUV5VVVXZ3pwckloM241QTJiNGdTMkVrbFZMM3BJcHNJVVBoN05ucklQbHUzUkJJN1ZLaTVCTjE3d1B0SVlZbllPRzZ4QlRiR0hSS0k4SFVjd1ZOWFljOG5qekdsYmUzZktaNS1ULXRaTjV5cC05eDhib3Vyb1FYbEJ0NVJlUWRlNFJERC12ZXIxQXBGbEpxeFpIcnJZamE3UVloY3JCeHhINXo0LThRcnUtOS0ydEhPMFlLUnl4b0ctMnZIRQ?oc=5,Bansal News,2026-06-05T21:25:30+05:30,hi,Madhya Pradesh,,"(""हीट एक्शन प्लान"" OR ""गर्मी से राहत"" OR चेतावनी OR ""रेड अलर्ट"" OR ""ऑरेंज अलर्ट"" OR ""येलो अलर्ट"" OR एडवाइजरी OR ""राहत सामग्री"" OR ""राहत शिविर"" OR मुआवजा) Madhya Pradesh","MP Weather Today 5 June 2026: मध्यप्रदेश के अधिकांश शहरों में आंधी और बारिश से मौसम का मिजाज बदल गया है।
मौसम विभाग के ताजा आंकड़ों के अनुसार, प्रदेश के भोपाल, इंदौर, उज्जैन समेत 26 से अधिक शहरों में दिन और रात के तापमान में भारी गिरावट दर्ज की गई है। खंडवा में 0.1 डिग्री तो गुना में 6.4 डिग्री तक तापमान लुढ़का है। इससे पहले के मुकाबले गर्मी से काफी राहत मिली है।
7 जून से कम होगी प्री-मानसून एक्टिविटी, बढ़ेगा पारा
मौसम विभाग के सीनियर वैज्ञानिक अरुण शर्मा ने बताया कि 6 जून को भोपाल, इंदौर, ग्वालियर, जबलपुर और सागर संभाग के क्षेत्रों में तेज हवाओं के साथ हल्की बारिश के आसार हैं। 7 जून से प्री-मानसून एक्टिविटी कम हो जाएगी। 8 जून से हवाओं की गति में भी कमी आएगी। इसके साथ ही, तापमान में 2 से 3 डिग्री तक बढ़ सकता है।
6 जून की सुबह तक यहां आंधी-बारिश का अलर्ट जारी
- प्रदेश के इंदौर संभाग में बड़वानी, खरगोन में बिजली चमकने के साथ 60 किमी प्रति घंटे तक रफ्तार से हवाएं चलेंगी।
- खंडवा, बुरहानपुर, भोपाल, विदिशा, रायसेन, ग्वालियर, छतरपुर के खजुराहो, बालाघाट, मंडला के कान्हा, सागर, टीकमगढ़, सिवनी, मुरैना, भिंड, डिंडोरी, सिंगरौली, दमोह में बिजली गरजेगी और 40 किमी प्रति घंटे तक की आंधी के साथ हल्की बारिश होगी।
एमपी के सबसे गर्म शहर
भोपाल समेत आसपास इलाकों में तेज आंधी-बारिश
भोपाल समेत आसपास इलाकों में शुक्रवार रात 8 बजे फिर मौसम का मिजाज अचानक से बदला। शहर सहित आसपास तेज आंधी के साथ बारिश से सड़कों से पानी बह निकला। कुछ समय के लिए कुछ इलाकों में बिजली गुल हुई। हालांकि, फिर बिजली बहाल की गई। भोपाल में दिन का तापमान 35.2 डिग्री सेल्सियस दर्ज किया गया।
प्रदेश के 29 शहरों में दिन का पारा 39 डिग्री से नीचे
प्रदेश के 26 शहरों में दिन और रात के तापमान में करीब 7 डिग्री सेल्सियस तक की गिरावट दर्ज की गई है। ऐसे में 27 शहरों में दिन का तापमान 39 डिग्री या उससे नीचे रिकॉर्ड किया गया है।
जानें एमपी में पांच दिन का मौसम
5 जून 2026 की सुबह 8:30 बजे से 6 जून 2026 की सुबह 8:30 तक।
- मंदसौर, नीमच, छिंदवाड़ा, सिवनी में कहीं-कहीं गरज-चमक के साथ ओलावृष्टि होगी। 60 किलो मीटर प्रति घंटा की रफ्तार से हवाएं चलेंगी।
- अशोकनगर, शिवपुरी, श्योपुरकलां, दमोह, सागर में कहीं-कहीं गरज-चमक के साथ 60 किलो मीटर प्रति घंटा की रफ्तार से हवाएं चलेंगी।
- भोपाल, विदिशा, रायसेन, सिहोर, राजगढ़, नर्मदापुरम, बैतूल, हरदा, बुरहानपुर, खंडवा, खरगोन, बड़वानी, अलीराजपुर, झाबुआ, धार, इंदौर, रतलाम, उज्जैन, देवास, शाजापुर, आगर, गुना, ग्वालियर, दतिया, भिंड, मुरैना, सतना, जबलपुर, नरसिंहपुर, मंडला, बालाघाट, पन्ना, छतरपुर, टीकमगढ़, निवाड़ी, पांढुर्णा में कहीं-कहीं गरज-चमक के साथ 50 किलो मीटर प्रति घंटा की रफ्तार से हवाएं चलेंगी।
6 जून 2026 की सुबह 8:30 बजे से 7 जून 2026 की सुबह 8:30 तक।
- विदिशा, गुना, अशोकनगर में कहीं-कहीं गरज-चमक के साथ 60 किलो मीटर प्रति घंटा की रफ्तार से हवाएं चलेंगी।
- भोपाल, रायसेन, राजगढ़, नर्मदापुरम, बुरहानपुर, खंडवा, खरगोन, बड़वानी, धार, इंदौर, उज्जैन, शाजापुर, आगर, मंदसौर, नीमच, शिवपुरी, ग्वालियर, दतिया, भिंड, मुरैना, श्योपुरकलां, सिंगरौली, सीधी, रीवा, मऊगंज, सतना, अनुपपुर, शहडोल, उमरिया, डिंडोरी, कटनी, जबलपुर, नरसिंहपुर, छिंदवाड़ा, सिवनी, मंडला, बालाघाट, पन्ना, दमोह, सागर, छतरपुर, टीकमगढ़, निवाड़ी, मैहर, पांढुर्णा, सिहोर, बैतूल, हरदा, देवास में कहीं-कहीं गरज-चमक के साथ 50 किलो मीटर प्रति घंटा की रफ्तार से हवाएं चलेंगी।
7 जून 2026 की सुबह 8:30 बजे से 8 जून 2026 की सुबह 8:30 तक।
- सिहोर, नर्मदापुरम, बैतूल, हरदा, बुरहानपुर, खंडवा, खरगोन, बड़वानी, धार, इंदौर, देवास, अनुपपुर, डिंडोरी, नरसिंहपुर, छिंदवाड़ा, सिवनी, मंडला, बालाघाट, सागर, छतरपुर, टीकमगढ़, निवाड़ी, पांढुर्णा में कहीं-कहीं गरज-चमक के साथ 50 किलो मीटर प्रति घंटा की रफ्तार से हवाएं चलेंगी।
8 जून 2026 की सुबह 8:30 बजे से 9 जून 2026 की सुबह 8:30 तक।
- नर्मदापुरम, बैतूल, हरदा, बुरहानपुर, खंडवा, खरगोन, बड़वानी, छिंदवाड़ा, सिवनी, मंडला, बालाघाट, पांढुर्णा में कहीं-कहीं गरज-चमक के साथ 50 किलो मीटर प्रति घंटा की रफ्तार से हवाएं चलेंगी।
9 जून 2026 की सुबह 8:30 बजे से 10 जून 2026 की सुबह 8:30 तक।
- भोपाल, विदिशा, रायसेन, राजगढ़, नर्मदापुरम, बैतूल, गुना, अशोकनगर, सिंगरौली, सीधी, रीवा, मऊगंज, सतना, अनुपपुर, शहडोल, उमरिया, डिंडोरी, छिंदवाड़ा, सिवनी, मंडला, बालाघाट, मैहर, पांढुर्णा में कहीं-कहीं गरज-चमक के साथ 50 किलो मीटर प्रति घंटा की रफ्तार से हवाएं चलेंगी।",1.0
