title,url,source,date,language,state,district,search_term,full_text,relevance_score
"हरियाणा में बारिश-ओले के बावजूद नहीं थमी गर्मी, लू जैसे हालात, 41.7°C तक पहुंचा तापमान - ETV Bharat",https://news.google.com/rss/articles/CBMi2AFBVV95cUxPcEFOanBCejZRS1J4Q3JwSEdWZjJleGUzTDFsMTI1SWNmU1dQc29pZVNlQnNDMWZ6bVliOVdVZHltT0RKY2NOVVJ0R2NOWTRrLUNZdEUtQlFZNEMtdFFxQ0dCWURhd1o5Wm1URDRLcVNNWTdXOEw4Tml2Nm12QmxCS0JtdmF0bXpHT0VoQy1NOWMxUEJwRXRrdGhOQWZfMnhSeW5iczFaOV9jakZVYTNZalVyUDI2dVN3OENoNlpYMlVUY0ZJNGtCWlRBRVNGdndXeDlBNkZDUjHSAd4BQVVfeXFMUE44dmhLZHJFZjNHM1FHWnMya0hxMUt2V0tHYTA1eDh2LUVLU1p6QUJpTHI3MlAyejlzMWFKdTRnQjlaWThfOWtHNURZN29CcmVITUtJZ0E2UWhyc3lGVnFFYkZqdHRScEs3SXg0a2Q1Q3dzb0x1ZXltRHpJN2RLWXhteXBEcktkclZTeE16SU9IeTlYOHA1U0pIREx0YjRVc0p6UEJfaXg4MVlkdmh6ay1nYU14Yk13Y3gxLUpDbmMxVGJ4cExqZ05DalF2YkV4aVVncDkzLXBoUE1kZ3pB?oc=5,ETV Bharat,2026-04-18T09:45:59+05:30,hi,Chandigarh,Chandigarh,"(लू OR ""लू चलना"" OR ""भीषण गर्मी"" OR ""प्रचंड गर्मी"" OR ""कड़ी धूप"" OR ""तेज धूप"" OR ""गर्म हवा"" OR ""उष्ण लहर"" OR ""ताप लहर"" OR ""हीट वेव"" OR ""झुलसाने वाली गर्मी"" OR ""तपती गर्मी"" OR ""भयंकर गर्मी"" OR ""गर्मी का कहर"" OR ""गर्मी का प्रकोप"" OR ""अत्यधिक गर्मी"" OR मौसम OR ""मौसम अपडेट"" OR ""मौसम का हाल"" OR ""मौसम पूर्वानुमान"" OR ""मौसम अलर्ट"" OR आईएमडी OR ""आईएमडी पूर्वानुमान"" OR ""आईएमडी अलर्ट"" OR ""तापमान में बढ़ोतरी"" OR ""गर्मी से राहत"" OR ""गर्मी से निजात"") Chandigarh","हरियाणा में बारिश-ओले के बावजूद नहीं थमी गर्मी, लू जैसे हालात, 41.7°C तक पहुंचा तापमान
हरियाणा में तापमान 41.7°C पहुंच गया. बीते दिन हुई बारिश और ओलावृष्टि के बावजूद गर्मी का सितम जारी है.
चंडीगढ़/चरखी दादरी: हरियाणा में गर्मी ने अप्रैल के मध्य में ही अपने तीखे तेवर दिखाने शुरू कर दिए हैं. शुक्रवार को राज्य के पांच प्रमुख शहरों रोहतक, नारनौल, गुरुग्राम, पलवल और मेवात में अधिकतम तापमान 40 डिग्री सेल्सियस के पार पहुंच गया. सबसे ज्यादा तापमान 41.7°C रोहतक और नारनौल में दर्ज किया गया, जो इस सीजन का अब तक का उच्चतम स्तर है. लगातार बढ़ती गर्मी ने लोगों की दिनचर्या को प्रभावित करना शुरू कर दिया है और दोपहर के समय सड़कों पर आवाजाही कम हो गई है.
बारिश और आंधी से मिली थोड़ी राहत: कई जिलों में शुक्रवार शाम को अचानक मौसम में बदलाव हुआ. हल्की बारिश के साथ तेज आंधी चली. कुछ जगहों पर 30–40 किलोमीटर प्रति घंटे की रफ्तार से हवाएं दर्ज की गईं. इस बदलाव के चलते अधिकतम तापमान में औसतन 1.3°C की गिरावट दर्ज की गई, लेकिन यह राहत बहुत ही अस्थायी साबित हुई. उमस और गर्मी का असर अब भी बरकरार है, जिससे लोगों को खास राहत नहीं मिल पाई.
ओलावृष्टि से बढ़ी किसानों की चिंता: हिसार, हांसी और चरखी दादरी जैसे इलाकों में बारिश के साथ ओलावृष्टि भी हुई, जिसने किसानों की मुश्किलें बढ़ा दी हैं. खेतों में खड़ी गेहूं, सरसों और सब्जियों की फसलों को नुकसान पहुंचने की आशंका जताई जा रही है. तेज बारिश के कारण कई जगहों पर जलभराव भी हुआ, जिससे ग्रामीण और शहरी दोनों क्षेत्रों में आवागमन प्रभावित हुआ. कृषि विशेषज्ञों के अनुसार यह मौसम परिवर्तन फसलों के लिए नुकसानदेह हो सकता है.
तात्कालिक पूर्वानुमान हरियाणा :17/04/2026 19:42:2) चरखी दादरी, झज्जर, रोहतक, सोनीपत, में मेघगर्जन / आकाशीय बिजली / अचानक तेज हवाएं/ आंधी(40-60 KMPH) की संभावना pic.twitter.com/ui4eimna1d
— IMD Chandigarh (@IMD_Chandigarh) April 17, 2026
तापमान में और बढ़ोतरी के संकेत: मौसम विभाग ने चेतावनी दी है कि आने वाले दिनों में तापमान में 2 से 3 डिग्री सेल्सियस तक और बढ़ोतरी हो सकती है. इससे प्रदेश में हीटवेव जैसे हालात बनने की संभावना है. दिन के साथ-साथ रात का तापमान भी लगातार बढ़ रहा है, जिससे लोगों को चौबीसों घंटे गर्मी का सामना करना पड़ रहा है. गर्म हवाएं और तेज धूप आने वाले दिनों में और परेशानी बढ़ा सकती हैं.
गर्म रातें बढ़ा रहीं हीट स्ट्रेस का खतरा: न्यूनतम तापमान में भी वृद्धि दर्ज की गई है. औसतन 3.2°C बढ़कर यह सामान्य से 2.2°C ऊपर पहुंच गया है. कई शहरों में रात का तापमान 24–25°C तक पहुंच चुका है, जिससे रात में भी गर्मी से राहत नहीं मिल रही. सबसे कम न्यूनतम तापमान 20.4°C हथिनीकुंड में रिकॉर्ड किया गया. विशेषज्ञों के अनुसार लगातार गर्म रातें हीट स्ट्रेस का खतरा बढ़ा सकती हैं, खासकर बुजुर्गों और बच्चों के लिए.
किसानों के लिए मौसम विभाग की एडवाइजरी: मौसम में लगातार हो रहे उतार-चढ़ाव को देखते हुए कृषि मौसम विभाग ने किसानों को सतर्क रहने की सलाह दी है. सरसों की कटाई और मढ़ाई को 3-4 दिन तक टालने की सलाह दी गई है. इसके अलावा कपास, मूंग और उड़द की बुवाई फिलहाल न करने को कहा गया है. सब्जियों की बुवाई और कीटनाशक छिड़काव भी रोकने की सलाह दी गई है. पशुओं को छाया में रखने और उनके लिए पर्याप्त पानी की व्यवस्था सुनिश्चित करने पर जोर दिया गया है, ताकि बदलते मौसम के असर से बचाव हो सके.",1.0
"पंजाब-चंडीगढ़ में आज बढ़ेगी गर्मी: 16 से बारिश-आंधी की संभावना; 30-40 किमी की रफ्तार से चलेंगी हवाएं, येलो ... - Dainik Bhaskar",https://news.google.com/rss/articles/CBMiwwFBVV95cUxQWVpVQURUaGxjRHkyTmdHYjJxMGVXOXViQ2Rxem10eDZLa1U1LTZROUZ1ZWk1Z1V2WDdLaXRCWWd0b3BwMjdQREdQUGIxcDVEd2stb1dNYU1la0Y4V3VTM3RES0ZhYjRpcjk1U3BNZkR4VEJOdXAtVlZMMzFVSXItbURZU3VCMXZmblNqd2tBVi1HYjIxYjBycWlNZTRsdUEwYXVZaUNNYWdPS3dQMFE4cWR3eGJ6aXBqR0JMbGdkQnlYcTDSAcgBQVVfeXFMTWlBQ0pkd0ZfSExDUElVaDlQN2xnYkozcV8wVlBKdno4WGZiWmhsRHRYVHBlMzlTbmloRE1ESVk4SzVWVy1kUGtSQjY5NW8xTzJYdkVnc3VsM2hqc3ZiUEFYbldLNFJ1OFpDcEZja0dvVFlPVFUyVmxad2ZuUTdoeWcyeFc5M2dlR2NpVmxiZmd4Rlp5ZVFrbjhkOGdRUlpYODFPTy00YXhQWGw2a2hfYWoyQzVMYS1mai11clFScTZ1Q3JOVDBVcW8?oc=5,Dainik Bhaskar,2026-04-18T03:10:10+05:30,hi,Chandigarh,Chandigarh,"(""हीट एक्शन प्लान"" OR ""गर्मी से राहत"" OR चेतावनी OR ""रेड अलर्ट"" OR ""ऑरेंज अलर्ट"" OR ""येलो अलर्ट"" OR एडवाइजरी OR ""राहत सामग्री"" OR ""राहत शिविर"" OR मुआवजा) Chandigarh","पंजाब-चंडीगढ़ में आज बढ़ेगी गर्मी:16 से बारिश-आंधी की संभावना; 30-40 किमी की रफ्तार से चलेंगी हवाएं, येलो अलर्ट जारी
- कॉपी लिंक
पंजाब और चंडीगढ़ में अब दिन में गर्मी बढ़ने लगी है। बुधवार यानि 15 अप्रैल को मौसम ड्राई रहेगा, लेकिन 16 से लगातार चार दिन बारिश और आंधी की संभावना है। पिछले 24 घंटे में तापमान में 1.7 डिग्री की बढ़ोतरी दर्ज की गई है। अब यह सामान्य के करीब पहुंच गया ह
चार दिन इस तरह का रहेगा मौसम
मौसम विभाग के मुताबिक, वैसे तो आज शाम से मौसम में बदलाव देखने को मिलेगा। 16 अप्रैल को राज्य में कुछ जगह बारिश की संभावना है, जबकि 17 और 18 को आंधी, तूफान और बिजली गर्जने का येलो अलर्ट है। इस दौरान हवाएं 30 से 40 किलोमीटर की रफ्तार से चलेंगी। बारिश की भी संभावना है। 19 अप्रैल को भी कुछ जगह बारिश के आसार हैं।
आज रात से बदलेगा मौसम
उत्तर-पश्चिम भारत के ऊपर आसमान में करीब 12.6 किलोमीटर की ऊंचाई पर बहुत तेज रफ्तार से चलने वाली जेट स्ट्रीम बनी हुई है, जिसकी गति लगभग 110 नॉट यानी करीब 200 किलोमीटर प्रति घंटा है। बुधवार को पश्चिमी हिमालयी क्षेत्रों जैसे जम्मू-कश्मीर, लद्दाख, हिमाचल प्रदेश और उत्तराखंड में एक नया लेकिन कमजोर पश्चिमी विक्षोभ सक्रिय होने की संभावना है। इससे इन इलाकों में हल्की बारिश या बर्फबारी देखने को मिल सकती है।
पांच डिग्री तक बढ़ेगा तापमान
मौसम विभाग के डायरेक्टर सुरेंद्र पाल बताते हैं कि 16 से 19 तारीख के बीच कुछ एक स्थानों पर हल्की बारिश होने की संभावना है। अगले 5 दिनों में अधिकतम तापमान में धीरे-धीरे 4 से 5 डिग्री सेल्सियस तक बढ़ोतरी होगी, इसके बाद तापमान में कोई खास बदलाव नहीं होगा। 17 और 18 तारीख को कुछ जगहों पर गरज-चमक के साथ 30 से 40 किलोमीटर प्रति घंटे की रफ्तार से तेज हवाएं चल सकती हैं।",0.8
