title,url,source,date,language,state,district,search_term,full_text,relevance_score
Rains bring respite from heatwave in J-K - Dailyhunt,https://news.google.com/rss/articles/CBMizAFBVV95cUxOSkMycWMzeHhMX3RKMVBJVTM0ZDgyc1NXU1NKU0JEVC1IaTRCUkVNTVV0dkhvaHlqaG9pZnZtTm5YWXZsejRmR2hXVmJRdEhXeHZsQVVINFlET05iR282aE5CYXp1TGk4TC1OY0FnaDNhSTRZNXM0cW8yNllFTUVwbnVCcC12clhXUlNwNlVaLXpFX2VnR3c3NGE2ZmowREFDVFVNajJzcW8wLUdtSlEyYklwV3lDc2RLcjZhcTAwOVFBSUdyd2pNSjFOUXQ?oc=5,Dailyhunt,2026-06-13T22:26:49+05:30,en,Jammu and Kashmir,Jammu,"""heatwave"" Jammu and Kashmir","Temperatures across Jammu and Kashmir, which saw an unprecedented rise in the past week, witnessed a sudden drop as rains lashed widespread parts of the Kashmir Valley on Saturday, officials said.
The ongoing wet spell has not only brought down the maximum temperatures but also brought much-needed respite from the heatwave.
Daytime temperatures in Jammu had gone up to 45 degrees Celsius over the past week. Similar hot and humid conditions prevailed in the Kashmir plains except for a few tourist destinations.
The maximum temperatures in the summer capital also came down significantly. Daytime temperatures are now hovering around 17 degrees Celsius.
The Meteorological Centre, Srinagar, said the weather will remain generally cloudy with light to moderate rain or thundershowers at most places in Jammu and Kashmir during the next 24 hours.
A spell of light to moderate rain or thundershowers is likely to occur at many places on June 14, while from June 17 there is a possibility of a brief spell of rain or thundershower at many places.
Meanwhile, the Met has warned of inclement weather conditions likely to continue, with the possibility of thunderstorms, gusty winds and hailstorms over widespread parts of south and north Kashmir.
The inclement weather conditions, according to the weather monitoring department, are expected to continue throughout the day.",0.8333333333333333
