title,url,source,date,language,state,district,search_term,full_text,relevance_score
Weather today: Gujarat on IMD's heat wave alert as mercury hits 42°C; rains to bring relief soon in multiple states - Mint,https://news.google.com/rss/articles/CBMi_AFBVV95cUxPS21lQ0x3bndiOF9FZWZib3IxcmYyVE1QYXhjTE03MUhzVXc3aU9iV19JTnJSbjZBa0JleXdpR1J0ektEUFZRWUUyVUFjcUpUYW1JaG9qanYydEVvTUJkV3FJMmJiSTVEMWNKMXFLbXFHVjlRUjNNeGMwVk9Cck91RWhlM0dJNmpWSTU3ejZINnpMY0ozUnpJdDdrbkxDYk96QVViU0YxOFNseE5aZE9IUzJSaUhoc1UtcUo2RTI5c1UxQjkwNzZZRmpMaENRejc0R3lnbVJRcmVKRk50X0FnMFNxd1FDdVZaeTJyUHZOMGl5MWFTMnhMa0tRTGzSAYICQVVfeXFMTXFWV01OM3E3c3BwTE1sai1Qb0FpVElYZmNacEgyQndVYllKUVBvYm9UdE01YVZIZmE4a0w4eVZ4c09UN0E0UFRGSHhoanduOUVXUUU0OU5TQXgtSlI0Q2dseDdzajBnbXQwLV8xaW9NTmRiRnlUOGhwS3dmVDdLcmJoVDlTVGxieUFkVWdMOVFlaVp6OUhKcVlJcDRqM0d2aVFxRTNGdG9tMDZGYl9sQ0gyYjVvblA0dGlUS2Q0eGZXTXdwcDdoekpwUkNGa1ZzaFFnNHR3Mmo2VzZLZ2NsYW80T3hIMUZlVkFXOC1UbTlmbEhyS1d2R1M0WXJYX2xPM3hR?oc=5,Mint,2026-03-12T06:47:41+05:30,en,Gujarat,,"(heatwave OR ""heat wave"" OR ""severe heatwave"" OR ""extreme heat"" OR ""heat spell"" OR ""scorching heat"" OR ""blistering heat"" OR ""sweltering heat"" OR ""hot winds"" OR loo OR ""hot loo winds"" OR ""intense heat"" OR ""unbearable heat"" OR ""deadly heat"") Gujarat","The India Meteorological Department issued orange alert for Gujarat, predicting heat wave conditions on 12 March. According to IMD, several places in Gujarat, Rajasthan, Maharashtra, Madhya Pradesh, Odisha and Chhattisgarh reported maximum temperature as high as 42 degrees Celsius on 11 March. Even in Delhi, Haryana, Jharkhand and Uttar Pradesh, the mercury touched 38 degrees Celsius.
Nandurbar located in Madhya Maharashtra reported highest maximum temperature of 42.4°C on Wednesday.
As most of India sees record high temperatures in March, IMD predicted that some relief is likely in the coming days with rainfall expected in several north Indian and northeastern states. Furthermore, fresh western disturbance is likely to affect northwest India from 14 March.
IMD in its latest weather bulletin said, “Heat wave to severe heat wave conditions likely to continue over Gujarat state during 11th-13th March and abating thereafter.”
IMD predicted rainfall over Jammu and Kashmir, Himachal Pradesh and Uttarakhand until 17 March. “Isolated light rainfall with thunderstorm, lightning & gusty winds speed reaching (30-50 kmph) also likely over Punjab, Haryana, Chandigarh during 14th-16th; Uttar Pradesh on 15th & 16th and Rajasthan on 14th & 15th March,” the weather office said. Gradual fall in maximum temperature by 4-6°C is likely over Western Himalayan region during next 7 days, IMD said.
The Meteorological Department predicted “scattered to fairly widespread light/moderate rainfall with thunderstorm & lightning likely over Northeast India” till 17 March. Meanwhile, Assam and Meghalaya may see heavy precipitation between 13 and 15 March while Arunachal Pradesh can expect downpour from 12 March till 14 March.
Rainfall is likely in Chhattisgarh between 13 and 15 March, in Madhya Pradesh on 14 and 15 March, in West Bengal and Sikkim till 16 March. In Jharkhand, rain is likely on 12 March and between 15 and 17 March and in Odisha on 12 and 15 March. IMD predicted gradual rise in maximum temperatures by 2-3°C during subsequent 2 days. Over coastal Maharashtra, 2-4°C fall in maximum temperature is likely over the coming 4 days.
Isolated light to moderate rainfall with thunderstorm is likely in Telangana on 15 March.
IMD predicted mainly clear sky with maximum temperature to be over 5 degrees Celsius above normal and is likely to hover around 34°C to 36°C. The minimum temperature will be 3.1°C to 5.0°C above normal and is likely to settle around 16°C to 18°C.",1.0
"IMD Issues Orange Warning for Severe Heat Wave in Gujarat, Saurashtra, and Kutch - The Right News",https://news.google.com/rss/articles/CBMiugFBVV95cUxPR0pBbzF0WUFzbWNxT1ZDVjQ0dlpMTTl2SmlOaEwtTnYwUExwRnlhSmRBdEFudU9lNEc2LVRlMVIzandrdkdDS0lYSDJVb3JVQ1I3TVZTUWYtQ0c0dzVWVEgyd3lLMTNiOElDWG9xQjJRTlNyY0pjN1lBRFZkWWNCb1JLRjdwa3QyRjlZVkxLTmJYaW1FbmdhUW5qbmF6STBreHFYN0pZbm51dC1ISjRFa3lIY0FuWlg4Smc?oc=5,The Right News,2026-03-12T11:05:20+05:30,en,Gujarat,,"(heatwave OR ""heat wave"" OR ""severe heatwave"" OR ""extreme heat"" OR ""heat spell"" OR ""scorching heat"" OR ""blistering heat"" OR ""sweltering heat"" OR ""hot winds"" OR loo OR ""hot loo winds"" OR ""intense heat"" OR ""unbearable heat"" OR ""deadly heat"") Gujarat","The India Meteorological Department (IMD) has issued an orange-colour warning for severe heat wave conditions at isolated places over Gujarat, Saurashtra and Kutch today. The Weather Department has also predicted heavy rainfall over Arunachal Pradesh till tomorrow.
IMD said that thunderstorms accompanied with lightning and gusty winds is very likely at Himachal Pradesh, Sub Himalayan West Bengal, Sikkim, Jharkhand, Odisha, Uttarakhand, Jammu and Kashmir and Ladakh during the next two days. It has also predicted hot and humid weather conditions over Coastal Karnataka, Kerala, Mahe and Gujarat till tomorrow.",0.5166666666666666
"MP-રાજસ્થાનમાં તાપમાન 39° સુધી પહોંચ્યું: હિમાચલ, ગુજરાત, ઓડિશા અને આંધ્ર પ્રદેશમાં હીટવેવનું એલર્ટ; પહાડો ... - Divya Bhaskar",https://news.google.com/rss/articles/CBMi3AFBVV95cUxQLWtONjh5cFVoaEZsenVKakh5Z2lITmZkbUNPRUlxUVpDV2d6UUpEWV9IR3lKR2E5S0FfamdSLW5pcDN5VUxQS3FQdW56eGlNSE0zR0dVUVRFYkxsNWszNzhOTGVjU0M1S3d5TmpVaVhLQjRLblFBSjAwdDN2cWY3WDdCekhSbFJLNVVKTUtoZ2hfM0dBY3dqUmkyRGdfc0tmTkxhdmsyeVJhSF9XVHlURUk5WHRxcTE5dld6WUtjWHQ2R2xuMkN5MGpwRC1zYkdYanljcU9fZlp3MXli0gHiAUFVX3lxTE92U0liTVhHX3ozbnNiTklTa1JlQVBBQ3M0NFRtd21WTzRkdzZfMVJhRExrakt1eURWd25OejRxYmgwQ3BxZGZfUDJrT3ZPak5WLUV5WlFJR0ttWGdYdENhQm9odkZ1dlhYVkc2WWRNdkFuclAxVzhHazRuUm9kRzlYVVlzWHdrQm1kVkhKLTJuclVNbktmb2RTbjZONkFJbjVxdVE2bE9BNXpjYno2X3ZDaXc5Wi0ydWY0ckZ1LTlndkpPTmNOU01DaUpzVEFBUS1LUkdack5nVGlJbjN3dlJHT1E?oc=5,Divya Bhaskar,2026-03-12T08:03:30+05:30,gu,Gujarat,,"(""ભારે ગરમી"" OR ""આકરી ગરમી"" OR લૂ OR હીટવેવ OR ""ઉષ્ણ મોજું"" OR ""ગરમીનો પ્રકોપ"" OR તાપ OR ""આકરો તાપ"" OR ""અસહ્ય ગરમી"" OR ""ભયાનક ગરમી"") Gujarat","- Himachal, Gujarat, Odisha, Andhra Heatwave Alert | Snowfall Likely In Mountains
MP-રાજસ્થાનમાં તાપમાન 39° સુધી પહોંચ્યું:હિમાચલ, ગુજરાત, ઓડિશા અને આંધ્ર પ્રદેશમાં હીટવેવનું એલર્ટ; પહાડો પર કાલથી બરફવર્ષાની શક્યતા
- કૉપી લિંક
હવામાન વિભાગ મુજબ અરબ સાગરમાં લાંબા સમયથી સક્રિય એન્ટી સાયક્લોન સિસ્ટમને કારણે રાજસ્થાન, ગુજરાત, હરિયાણા અને મધ્યપ્રદેશ સહિત અન્ય રાજ્યોમાં સમય પહેલા ગરમીની શરૂઆત થઈ ગઈ છે.
માર્ચની શરૂઆત સાથે જ હવામાન ઝડપથી બદલાવા લાગ્યું છે. મેદાની રાજ્યોના ઘણા શહેરોમાં પારો 35°C થી 39°C સુધી નોંધાઈ રહ્યો છે.
IMD મુજબ આગામી 3-4 દિવસમાં તે 40°Cને પાર જઈ શકે છે. રાજસ્થાન-ગુજરાત અને મધ્યપ્રદેશમાં હીટવેવનું એલર્ટ છે. ગુજરાતમાં શનિવારે લૂ ફૂંકાઈ શકે છે.
હિમાચલ પ્રદેશમાં પણ હીટવેવની સંભાવના છે, જોકે, ઊંચાઈવાળા વિસ્તારોમાં હિમવર્ષા થઈ શકે છે. ઉત્તરાખંડના મેદાની વિસ્તારોમાં પણ તાપમાન સામાન્ય કરતાં વધુ થઈ ગયું છે.
સ્કાયમેટ અનુસાર 7 થી 11 માર્ચની વચ્ચે એક વેસ્ટર્ન ડિસ્ટર્બન્સ સક્રિય થશે, જેના કારણે જમ્મુ-કાશ્મીર, લદ્દાખ, હિમાચલ પ્રદેશ અને ઉત્તરાખંડમાં હળવો વરસાદ અને હિમવર્ષા થઈ શકે છે.
હીટવેવ ક્યારે ગણાય છે
હવામાન વિભાગના મતે, હીટવેવ ત્યારે ગણાય છે જ્યારે મેદાનોમાં તાપમાન 40 ડિગ્રી કે તેથી વધુ પહોંચી જાય. જો સામાન્ય તાપમાન કરતાં 4 થી 6 ડિગ્રી વધુ નોંધાય. આવી સ્થિતિમાં લોકોના સ્વાસ્થ્ય પર પણ અસર પડી શકે છે અને લૂ લાગવાનું જોખમ વધી જાય છે.
આગામી 2 દિવસ હવામાનની સ્થિતિ-
રાજ્યોમાંથી હવામાનના સમાચાર…
મધ્ય પ્રદેશ: આકરા તાપથી ગરમી વધી; બપોરે 3 કલાક છાંયડામાં રહેવાની સલાહ
રાજ્યમાં માર્ચની શરૂઆતમાં જ પારો ઉછળ્યો છે. સાગર, ગ્વાલિયર-ચંબલ પછી ઇન્દોર અને ઉજ્જૈન સંભાગમાં પણ ગરમી વધી ગઈ છે. હવામાન વિભાગ અનુસાર, રાજ્યના પૂર્વીય ભાગમાંથી એક ટ્રફ પસાર થઈ રહી છે. આકાશ સ્વચ્છ હોવાને કારણે ગરમીની અસર વધી છે.
રાજસ્થાન: હીટવેવનું એલર્ટ:જેસલમેરમાં પારો 38 ડિગ્રી પર પહોંચ્યો
રાજ્યમાં ગરમી તેજ બની ગઈ છે. દિવસનું તાપમાન સામાન્ય કરતાં 9 ડિગ્રી ઉપર નોંધાઈ રહ્યું છે. શુક્રવારે જેસલમેરમાં મહત્તમ તાપમાન 38 ડિગ્રી પર પહોંચી ગયું. તેમજ, હવામાન વિભાગે આગામી સપ્તાહથી પશ્ચિમ રાજસ્થાનમાં તીવ્ર હીટવેવની સંભાવના વ્યક્ત કરતા 9 અને 10 માર્ચ માટે યલો એલર્ટ જાહેર કર્યું છે.
પંજાબ: પંજાબ-ચંદીગઢમાં ગરમી વધી, તાપમાન સામાન્ય કરતાં 7.5°C વધારે, પટિયાલામાં 33.2°C રેકોર્ડ
24 કલાકમાં રાજ્યના સરેરાશ મહત્તમ તાપમાનમાં 0.3 ડિગ્રીનો નજીવો ઘટાડો નોંધાયો. જોકે, તે સામાન્ય કરતાં 7.5°C વધુ નોંધાયું હતું. સૌથી વધુ તાપમાન પટિયાલામાં 33.2°C નોંધાયું હતું. જ્યારે, 12 માર્ચ સુધી હવામાન સૂકું રહેવાની શક્યતા છે.
છત્તીસગઢ: 7 દિવસ હવામાન સૂકું, મેદાની વિસ્તારોમાં પારો 38 ડિગ્રીને પાર, રાત્રે હળવી ઠંડી
છત્તીસગઢમાં હવામાન સૂકું રહ્યું છે. આગામી 7 દિવસ સુધી હવામાનમાં કોઈ મોટા ફેરફારની શક્યતા નથી. મેદાનીય વિસ્તારોમાં તાપમાન સતત વધી રહ્યું છે અને પારો 38 ડિગ્રીને પાર પહોંચી ગયો છે. જ્યારે ઉત્તર છત્તીસગઢના જિલ્લાઓમાં રાત્રિના સમયે હજુ પણ હળવી ઠંડી અનુભવાઈ રહી છે.
ઉત્તરાખંડ: 3 જિલ્લામાં આજે વરસાદ-બરફવર્ષાની શક્યતા, મેદાની વિસ્તારોમાં સવાર-સાંજ હળવી ઠંડી
ઉત્તરાખંડના ત્રણ જિલ્લામાં આજે વરસાદ-બરફવર્ષા થઈ શકે છે. આમાં ઉત્તરકાશી, ચમોલી અને પિથોરાગઢ શામેલ છે. હવામાન વિજ્ઞાન કેન્દ્ર દેહરાદૂન અનુસાર આ જિલ્લાઓમાં 4000 મીટર કે તેથી વધુ ઊંચાઈવાળા વિસ્તારોમાં બરફવર્ષા થઈ શકે છે.
બિહાર: માર્ચના અંતથી લૂ ફૂંકાવા લાગશે, મોતિહારીમાં 33.4 અને પટનામાં 32.6 ડિગ્રી તાપમાન
હવામાન વિભાગ, પટના કેન્દ્ર અનુસાર આ સમયે ઉત્તર-પશ્ચિમ દિશામાંથી સૂકી અને ગરમ હવાઓ ફુંકાઈ રહી છે. વરસાદ માટે કોઈ મજબૂત હવામાન સિસ્ટમ સક્રિય નથી. વાદળો અને વરસાદની કમીને કારણે સૂર્યના કિરણો સીધા જમીનને ગરમ કરી રહ્યા છે. આનાથી તાપમાન ઝડપથી વધી રહ્યું છે.",0.31666666666666665
