title,url,source,date,language,state,district,search_term,full_text,relevance_score
IMD issues thunderstorm alert amid rising heatwave conditions in Odisha - Odisha TV,https://news.google.com/rss/articles/CBMiqwFBVV95cUxOU2RzV2FDQnpIUTFLUnQyZ0lvendpSTRxNDFVZkJVUW5ERDJ2QldHVURpUTFTZGRkd1g2Y3loZDFRdEhCX08tZDJoenVfWHVrLTdnTFFWaWhCbnJvT0pEU1FIbU1xSXdWS3BnTk1YR0FjcmVFYTZuVE92c0t1ZW5WZHZlN3BPMHF2YnBoN2hfY1VzaXlHZUczRFZySXZRYVE0RWFtbXZtSDd2anfSAbABQVVfeXFMTlh6NVpNRXJPQ1VvZ1JRZUZsWFg2UkwxdVFMdlBvbXpwR3REQlY5TjI2LWd3U3lQdk5oSF9KNnM3Q2ZDZ0FCalpnVF81SE1WZXJUV0tEcXctbnZIMGd5SXBmTzRIN0V4ZklLcThJcUdRWVZXdUNScE1TQlBraWljdUtJZk9zMl9hQ19ZdXh0ZzdlWm9lazd4MHZURVBEUUZtOXN3cGJodExBVEhhc3BRNG8?oc=5,Odisha TV,2026-04-21T07:58:38+05:30,en,Odisha,Angul,"(heatwave OR ""heat wave"" OR ""severe heatwave"" OR ""extreme heat"" OR ""heat spell"" OR ""scorching heat"" OR ""blistering heat"" OR ""sweltering heat"" OR ""hot winds"" OR loo OR ""hot loo winds"" OR ""intense heat"" OR ""unbearable heat"" OR ""deadly heat"" OR heat OR ""weather forecast"" OR ""weather update"" OR ""weather alert"" OR ""IMD forecast"" OR ""IMD prediction"" OR ""IMD alert"" OR IMD OR ""rising temperatures"" OR ""temperatures expected to rise"" OR ""relief from heat"" OR ""respite from heat"" OR ""heat respite"" OR ""respite from scorching heat"") Odisha","The India Meteorological Department (IMD) has issued a multi-day weather advisory for Odisha, warning of a mix of thunderstorms, gusty winds, and emerging heatwave conditions across the state over the next several days.
Thunderstorm Activity Intensifies
According to IMD forecasts, light to moderate rain accompanied by thunderstorms and lightning is expected across several districts beginning April 21. An Orange Warning has been issued for districts like Mayurbhanj and Keonjhar, where gusty winds up to 50–60 kmph are likely during afternoon and evening hours.
Meanwhile, a Yellow Warning covers a wider region including Cuttack, Khordha, Puri, Ganjam, Balasore, and others, with wind speeds ranging between 30–50 kmph and the risk of lightning strikes.
Gradual Shift in Weather Pattern
While thunderstorms will persist in parts of northern, coastal, and southern Odisha over the next two days, rainfall activity is expected to gradually reduce, becoming limited mostly to southern districts such as Ganjam, Koraput, Rayagada, and Malkangiri from April 22 onward.
Heatwave Warning Emerges
Simultaneously, IMD has flagged the onset of heatwave conditions, particularly from April 22 onwards, with districts like Jharsuguda and Balangir likely to experience extreme heat.
In addition, hot and humid conditions are expected to persist across coastal and adjoining districts including Khordha, Puri, Jagatsinghpur, and Kendrapara, increasing discomfort levels.
Warm Nights Add to Discomfort
The IMD has also warned of warm night conditions in districts such as Sundargarh, Sambalpur, and Angul, where temperatures may remain unusually high even after sunset.
Outlook for the Next 5–6 Days
Thunderstorms: Likely in scattered pockets, mainly afternoon/evening
Heatwave: Intensifying from Day 3 onwards in western Odisha
Humidity: Persisting across coastal belt
Dry Conditions: Gradually dominating most districts after initial rainfall phase
Advisory

The IMD has urged residents to stay alert during thunderstorms and avoid open areas during lightning and take precautions against heat exposure, especially during peak daytime.",0.8500000000000001
