title,url,source,date,language,state,district,search_term,full_text,relevance_score
Eastern Rajasthan experiences drizzle; Sri Ganganagar reels at 47 degrees Celsius | Hindustan Times - Hindustan Times,https://news.google.com/rss/articles/CBMi6wFBVV95cUxOaW1PdFU3bHNsVG5iMFJROUEtZ2JaQm03VnlfNTctQ2NIRDRsVmc2ajR1QnVFcTU2VUtpMGJnVzZRZ3Y3UXFCdklyd2M2Wkw2cjYtaGxzUDk3NTN3dDhmTTVKcVppVWkwTFBWbDJHTlNfYXdhTzZPX3pwY21pRFpVRHRCQ2ZkaEhiWnBvNV9MeGdjYXkyV3BzR3J5S2NrdzN1cF9LOFJRUE1NNUJabVBoMWYzN0lkTjZjbklwdHRPMkMtcVo2TFZLRjJmXzlSNDRmelRvVjhoQkZEQW1EbFlsZ0RQVDV3YlRxTmx30gHrAUFVX3lxTE5pbU90VTdsc2xUbmIwUlE5QS1nYlpCbTdWeV81Ny1DY0hENGxWZzZqNHVCdUVxNTZVS2kwYmdXNlFndjdRcUJ2SXJ3YzZaTDZyNi1obHNQOTc1M3d0OGZNNUpxWmlVaTBMUFZsMkdOU19hd2FPNk9fenBjbWlEWlVEdEJDZmRoSGJacG81X0x4Z2NheTJXcHNHcnlLY2t3M3VwX0s4UlFQTU01QlptUGgxZjM3SWRONmNuSXB0dE8yQy1xWjZMVktGMmZfOVI0NGZ6VG9WOGhCRkRBbURsWWxnRFBUNXdiVHFObHc?oc=5,Hindustan Times,2026-05-27T13:47:26+05:30,en,Rajasthan,Ajmer,"""heatwave"" Rajasthan","Jaipur, Thunderstorm accompanied by light drizzle was recorded in eastern Rajasthan during the past 24 hours, with dry weather conditions prevailing in the western parts of the state, a met official said on Wednesday.
Heatwave conditions also prevailed at isolated places in eastern Rajasthan, while parts of western Rajasthan experienced heatwave and warm night conditions, the Jaipur met centre said.
Sri Ganganagar recorded the highest maximum temperature in the state at 47 degrees Celsius during the last 24 hours ending Wednesday morning, while Sirohi, with 22.8 degrees Celsius, recorded the lowest minimum temperature.
The department said that Rajasthan is likely to continue experiencing heatwave and severe heatwave conditions along with warm nights for the next two to three days, with maximum temperatures expected to range between 44-46 degrees Celsius across most parts of the state.
""Some areas in the Bikaner and Kota divisions and the Shekhawati region may record temperatures between 46 and 47 degrees Celsius, while border areas of western Rajasthan could witness temperatures touching around 48 degrees Celsius on May 27 and 28,"" Jaipur Met centre director Radheyshayam Sharma said.
The Met department has issued an orange alert for severe heatwave and warm night conditions for May 27 and 28.
{{/usCountry}}The Met department has issued an orange alert for severe heatwave and warm night conditions for May 27 and 28.
{{/usCountry}}Meanwhile, under the influence of a fresh western disturbance, thunderstorm and rain activity is likely to commence in parts of the state from May 28m, it said.
The officer said that the intensity of thunderstorms and rain activity is expected to increase from May 30, which might continue in some areas during the first week of June as well.
The maximum impact of the western disturbance is likely between May 29 and 31, when parts of Jaipur, Bharatpur, Kota, Ajmer, Udaipur, Jodhpur and Bikaner divisions may witness dust storms, strong winds and rainfall at isolated places.
Temperatures are likely to dip by 2-3 degrees Celsius from May 29 due to thunderstorms and rainfall, bringing relief from heatwave conditions.
This article was generated from an automated news agency feed without modifications to text.",1.0
Rajasthan weather: Sri Ganganagar hits 47°C as IMD issues orange alert before western disturbance brings rain relief - Zee News,https://news.google.com/rss/articles/CBMiyAFBVV95cUxOZWsyQnJhRlk1RnVVaWNGc1ZaVVF5MGVRcFVvR0dZOUwyRU5GdnhtZUJxSk9EdEtVWmZPMU9md3NTbnhGdHVucDZHeVhkdXNwanBRMVE1U3VSWExCYXduckdldWJzU2VKdlFTcFItT0F2VlQ4UjJkQ0t4eGZZeENqd0plTWtfcUJuV1ZUVG1aaFI1Sy1XWUdMUE5qTWRvXzFWVWFIR19yX3czUWFPdl85R1d4YXdtZzk2S0MzdjNzczJleTJ1M1BwV9IBzgFBVV95cUxNYnNhSlViNjVybVdIb0RSdThiaEphbkZxdVZyU0dlLTJoNkMxSXo0SHhidDBSZHdYWHlQNHJ3YlpUZ2Q3VU05VzNSbURfcmRmc1hMZU41VzlFTWlFcHBQY1pHaVgzNGtURFp2dGgyY1lpczdsMFpPNzloc1h1V1FRVno0NDhRNHVfa3ZsUDdtZzR6ckFRT29NeDRWRDJzR0JfSE1HZDBUZjJfd2l1M29EdUlxeVNBNjg0S3BJdHFOTDdMWmVxYWhNTE9TRmt1QQ?oc=5,Zee News,2026-05-27T14:11:01+05:30,en,Rajasthan,Ajmer,"""heatwave"" Rajasthan","Rajasthan weather: Sri Ganganagar hits 47°C as IMD issues orange alert before western disturbance brings rain relief
Rajasthan weather: Sri Ganganagar recorded a scorching 47°C as a severe heatwave grips Rajasthan. IMD Jaipur has issued an Orange Alert before a Western Disturbance brings dust storms and rain.
Trending Photos
Rajasthan weather: Rajasthan continues to reel under an intense heat wave, with Sri Ganganagar recording the highest maximum temperature of 47 degrees Celsius in the past 24 hours, the weather department has said. Kota registered the highest minimum temperature at 33.6 degrees Celsius, while Sirohi recorded the lowest minimum at 22.8 degrees Celsius.
The India Meteorological Department (IMD), Jaipur, has issued an Orange Alert for severe heat and warm night conditions over the next two to three days. It said the prevailing spell of heatwave and severe heatwave conditions is likely to continue across large parts of the state until May 28. During this period, maximum temperatures are expected to remain between 44 degrees Celsius and 46 degrees Celsius in most districts. In isolated areas of the Bikaner, Kota, and Shekhawati divisions, temperatures may rise further to 46 degrees Celsius to 47 degrees Celsius.
Border regions of western Rajasthan are expected to witness the most intense conditions, with temperatures likely to touch around 48 degrees Celsius on May 27 and 28, said Radhshyam Sharma, director, IMC, Jaipur.

The weather department has also warned of warm night conditions, which may intensify heat stress and discomfort, particularly among children, senior citizens, and individuals with pre-existing health conditions, he added. However, relief from the scorching heat is expected under the influence of a new Western Disturbance. The IMD has forecast the commencement of thunderstorms and rainfall activity in parts of Rajasthan beginning May 28.
The impact of this weather system is expected to intensify between May 29 and May 31, bringing the likelihood of strong dust storms, gusty winds reaching speeds of 60-70 kmph, and isolated rainfall across several divisions. Areas likely to be affected include the Jaipur, Bharatpur, Kota, Ajmer, Udaipur, Jodhpur, and Bikaner divisions, he added.
According to the IMD, the combined effect of thunderstorms and rainfall is expected to lower temperatures by 2 degrees Celsius to 3 degrees Celsius beginning May 29, offering significant relief from prevailing heatwave conditions from May 29-30 onwards.
The Meteorological Department has advised citizens to take necessary precautions against extreme heat and remain alert for rapidly changing weather conditions, including dust storms and strong winds.

Live Tv",1.0
"Rajasthan sizzles under extreme heat as IMD warns of severe heatwave, dust storms ahead - Daijiworld",https://news.google.com/rss/articles/CBMid0FVX3lxTE1qV2xhUUV2UzAxRVozemdlYXk5ZHFoclYxeUJKWWZlYXpDdkdLc0YtdmNaYlE3SlFSWEloQnJFWng0NVhTRGN2dXFiX0drQmhxR0hzRjV6V0o4UjRjVkhLcXVGRFlaQ3BMYnlsNmY0WTRzR0JlVHpF?oc=5,Daijiworld,2026-05-27T15:48:15+05:30,en,Rajasthan,Ajmer,"""heatwave"" Rajasthan","Daijiworld Media Network - Jaipur
Jaipur, May 27: Rajasthan remains in the grip of an intense heatwave, with several districts witnessing dangerously high temperatures over the last 24 hours. According to the India Meteorological Department (IMD), Sri Ganganagar emerged as the hottest location in the state, recording a scorching maximum temperature of 47 degrees Celsius.
Kota registered the highest night temperature at 33.6 degrees Celsius, while Sirohi remained relatively cooler with the lowest minimum temperature of 22.8 degrees Celsius.
The IMD’s Jaipur centre has issued an Orange Alert, cautioning residents about severe heatwave conditions and unusually warm nights likely to persist for the next two to three days. Officials stated that most parts of Rajasthan are expected to continue experiencing temperatures between 44 degrees Celsius and 46 degrees Celsius until May 28.
In some isolated pockets of the Bikaner, Kota, and Shekhawati regions, temperatures could climb further to 46–47 degrees Celsius. Border areas in western Rajasthan are likely to face the harshest conditions, with mercury levels potentially touching 48 degrees Celsius on May 27 and 28, said Radheshyam Sharma, Director of IMD Jaipur.
The department also warned that elevated nighttime temperatures could worsen heat-related stress, especially for children, elderly people, and those with existing medical conditions.
However, weather officials indicated that relief may soon arrive due to the influence of a fresh Western Disturbance. The IMD has forecast thunderstorm and rainfall activity in parts of Rajasthan beginning May 28.
The weather system is expected to become more active between May 29 and May 31, bringing strong dust storms, gusty winds of 60–70 kmph, and scattered rainfall across several divisions, including Jaipur, Bharatpur, Kota, Ajmer, Udaipur, Jodhpur, and Bikaner.
Meteorologists believe the combined impact of rain and thunderstorms could bring down temperatures by around 2–3 degrees Celsius from May 29 onward, providing much-needed respite from the prolonged heatwave.
The weather department has urged residents to stay hydrated, avoid prolonged exposure to the sun, and remain cautious of sudden weather changes such as dust storms and high-speed winds.",1.0
