title,url,source,date,language,state,district,search_term,full_text,relevance_score
CG Weather Update: Chhattisgarh में बढ़ी गर्मी की तपिश Raipur समेत कई जिलों में Heatwave जैसे हालात | - IBC24 News,https://news.google.com/rss/articles/CBMibkFVX3lxTE9BWlZfUWJlcnJaM3BneldYNlc0N0hVQlZkWnB6VHh1MHNrN2xrd3pEbHk4blV0ZUkwd0NqemJiemdtSlB1MmZqQ1Rtd1cxR2ZsOHJNbFZ5YXgtQmZoWTNUcEZUSnZTRHlyWXY4QlNB0gFzQVVfeXFMTV9DcWtvUWU1TnRHYXVDWEY3dXJlZW42U0dDc1VIcTZDbGtYUGNhRy1memx2ZEJ5YW00Uk5oRXdsaS0walFiYVVKZXRvZGI2VG02OXFYUDFncXBWZGViY3lpSEQ1Q1pqZ2pLTDFMWWlaQkVSTQ?oc=5,IBC24 News,2026-05-16T13:17:00+05:30,en,Chhattisgarh,Raipur,"""heatwave"" Chhattisgarh","Home /
Videos / CG Weather Update: The intensity of the heat has risen in Chhattisgarh; heatwave-like conditions prevail in several districts, including Raipur.
CG Weather Update: Chhattisgarh में बढ़ी गर्मी की तपिश Raipur समेत कई जिलों में Heatwave जैसे हालात |
Priyanshu Singh is a distinguished professional with over 5 years of experience in journalism and digital marketing. Presently serving as the Digital Marketing Manager and News Journalist at IBC24 News, he skillfully manages the digital operations of IBC24 News and Khabar Bebak. Priyanshu is renowned for his coverage of major sports events, including the World Cup 2022 and 2023, where his insightful reporting has captivated audiences. Notably, he has also conducted interviews with key political figures, including the Chief Minister and Deputy Chief Minister of Chhattisgarh. With a passion for news, a commitment to excellence, and a diverse portfolio of experiences, Priyanshu Singh continues to be a prominent name in the ever-evolving media landscape.
Web Title: CG Weather Update: The intensity of the heat has risen in Chhattisgarh; heatwave-like conditions prevail in several districts, including Raipur.",0.8500000000000001
