title,url,source,date,language,state,district,search_term,full_text,relevance_score
"AP Heatwave Alert: Several Mandals Brace For Severe Conditions, Warns APSDMA - ABP News",https://news.google.com/rss/articles/CBMi2wFBVV95cUxPS3VFdWxmR2EydzRZUGtLZ3ZoMWt0OERoSGJ1VW5ZOWhkRWpvbWtabF84LUNUSlZ2T2hwMzdZaUpuY2tKQk0xWE1IaGRORlRSWjMtaXZKSW56bG0wRE5aZnVuejFFbXc2Z0lETzBlM09GSWFLN0VTTnkwSkpGSkljNUFScmpuY2ZEZlNnOFUyNUhFdkFaVU9rcTV1NjRuVWU1eWw2MkpzZG5paFNkcDN6cHFoTXlRemtCUHJubXJLb3ljNFZ2SUNSaU50U2JySEJrVUdvN0R6UXFOYTjSAdsBQVVfeXFMT0t1RXVsZkdhMnc0WVBrS2d2aDFrdDhEaEhidVVuWTloZEVqb21rWmxfOC1DVEpWdk9ocDM3WWlKbmNrSkJNMVhNSGhkTkZUUlozLWl2SkluemxtMEROWmZ1bnoxRW13NmdJRE8wZTNPRklhSzdFU055MEpKRkpJYzVBUnJqbmNmRGZTZzhVMjVIRXZBWlVPa3E1dTY0blVlNXlsNjJKc2RuaWhTZHAzenBxaE15UXprQlBybm1yS295YzRWdklDUmlOdFNickhCa1VHbzdEelFxTmE4?oc=5,ABP News,2026-04-15T14:10:57+05:30,en,Andhra Pradesh,Anantapur,"""heatwave"" Andhra Pradesh","Amaravati, Apr 15 (PTI) The APSDMA has warned of severe heat waves across several parts of the state on Wednesday.
According to the Andhra Pradesh State Disaster Management Authority (APSDMA), a severe heat wave was likely in 46 mandals and a heat wave in 73 mandals, mainly in the north coastal districts, while high temperatures were expected in coastal and Rayalaseema regions.
""Severe heatwave conditions are likely to prevail across several parts of the state today,"" APSDMA Managing Director Prakhar Jain said in an official press release.
Jain further said that maximum temperatures up to 44 degrees Celsius are likely in Rayalaseema and coastal districts.
On Wednesday, severe heatwaves are likely in Srikakulam, Vizianagaram, Parvathipuram Manyam, Alluri Sitarama Raju, Polavaram, Anakapalli, Kakinada and East Godavari mandals, while heatwaves were expected in Srikakulam, Vizianagaram, Polavaram, Anakapalli, Kakinada, East Godavari, Eluru, NTR, Guntur, Palnadu, Markapuram, Prakasam, Nellore, Kadapa and Tirupati mandals.
Meanwhile, he noted that on Tuesday, the maximum temperature was recorded at 45 degrees Celsius in Ontimitta in Kadapa district, 44.2 degrees in Laddagiri in Kurnool district and Sanjamala in Nandyal district, and 43.8 degrees in Varadayyapalem in Tirupati district.
Other places where high temperature recorded are: 43 degrees in Anumalapalli in Markapuram district and Kommipadu in Nellore district, 42.8 degrees in Rayadurg in Anantapur district, Durgi in Palnadu district and Talupula in Sri Sathya Sai district, 42.6 degrees in Kambhamvaripalle in Annamayya district, 42 degrees in Kopparapadu in Prakasam district, 41.1 degrees in Kankipadu in Krishna district and 41 degrees in Nagari in Chittoor district.
The APSDMA advised people to take precautions, wear caps and light-coloured cotton clothes, use sunglasses, avoid exposure to heat, and consume sufficient water, lemon water, buttermilk and coconut water. PTI MS ADB
(This report has been published as part of the auto-generated syndicate wire feed. Apart from the headline, no editing has been done in the copy by ABP Live.)",1.0
