title,url,source,date,language,state,district,search_term,full_text,relevance_score
"झांसी में 34 डिग्री के पार पहुंचा तापमान, यूपी में अब गर्मी मचाने वाली है तांडव, IMD ने किया अलर्ट - News18 Hindi",https://news.google.com/rss/articles/CBMi-wFBVV95cUxQQ2tfemRXemJaelRrU2N3UXRqajY3OXJqQWtJdjUxNVVIUVVtazRTUWtsdHhUV2hYZ3RPei1jSnBvNG1mZV93V0YzTW1uZHA1MzJXN3p2RVBTQUJvcEFpLTJGNkVBWldnUGhic2tfaEhYNGp6czJKbENxTk1hVjJUQWVpbko2eU1xcE93aHBndm16RlB0UGhOQkhqQndwR0hwYXhVY0hSeC1IdTRCZXdQZ1V0NGJBaDJ4MDluM1ZLZE45U3hpUmhDWjFYUE1KXy1RUmNBVDQ2SUNFX01ZWTBCdnNpbnNTd0NBMENIYUduaHBQWEVsMnZfSmFHb9IBgAJBVV95cUxOR2pEaFBHck96NzNkUFh2QUhZWmM2a1ZoYnNmc1BHYzV0NlJfcU9oUlVOQS01WFB4OEpvc3ItOVVqOTc1SzIxcHpKX1k4Z1k3Z0ZTOXBvbVBVbGs2VENsSWFmNmhQR0c5X1YtaEdBdDFNWXpoWnI4RWI0WVdwQ296SDFCbGU4RmRVdmVhRzNJWU13Z2l2ZW5TamoyMGg3ZUNSdm9jWkRoMF9zaHNiQ2ttRmxZeldVNGtZZk1OaGF2ejRtZHY2MGYzc0dnODkwaGVlSEVHZGNRSWhWUjhTeWdsZmNuX3pITm0xeEpCZmJlNWNlUm5EYVJaUFRNcVdEZ0hY?oc=5,News18 Hindi,2026-03-01T05:42:53+05:30,hi,Uttar Pradesh,,"(""पारा चढ़ा"" OR ""पारा पहुंचा"" OR तापमान OR ""तापमान बढ़ा"" OR ""रिकॉर्ड तोड़ गर्मी"" OR ""डिग्री सेल्सियस"" OR ""पारा उबला"" OR ""अधिकतम तापमान"") Uttar Pradesh","होमताजा खबरउत्तर प्रदेशवाराणसी
झांसी में 34 डिग्री के पार पहुंचा तापमान, यूपी में गर्मी मचाने वाली है तांडव
झांसी में 34 डिग्री के पार पहुंचा तापमान, यूपी में अब गर्मी मचाने वाली है तांडव, IMD ने किया अलर्ट
Last Updated:
वाराणसी समेत पूरे उत्तर प्रदेश में मार्च की शुरुआत के साथ गर्मी बढ़ने लगी है. अधिकतम तापमान 34°C के पार पहुंच गया है और दोपहर की धूप तेज महसूस हो रही है. लखनऊ में आज 17°C न्यूनतम व 32°C अधिकतम तापमान रहने का अनुमान है. झांसी में 34.6°C तापमान दर्ज हुआ. मौसम विभाग के अनुसार 4 मार्च के बाद तापमान में 2–4°C और बढ़ोतरी हो सकती है.
वाराणसी: मार्च महीने की शुरुआत के साथ ही गर्मी ने दस्तक दे दी है. प्रदेश में अब अधिकतम तापमान 34 डिग्री सेल्सियस को पार कर लिया है. तापमान में उछाल के साथ ही दोपहर के वक्त भगवान भाष्कर की तीखी धूप अब चुभने लगी है. रजाई कम्बल पैक हो गए हैं और पंखे वाले दिन की शुरुआत भी हो गई है. मौसम विभाग का अनुमान है कि अगले 4 दिनों तक अधिकतम और न्यूनतम तापमान में फिलहाल कोई खास उतार चढ़ाव नहीं होगा, लेकिन उसके बाद फिर इसमें 2 से 4 डिग्री सेल्सियस का क्रमिक उछाल आ सकता है.
राजधानी लखनऊ के अमौसी स्थित आंचलिक मौसम केंद्र से मिली जानकारी के मुताबिक रविवार (1 मार्च) को यूपी के पूर्वी और पश्चिमी संभाग में मौसम शुष्क रहेगा. इस दौरान सभी 75 जिलों को आईएमडी ने ग्रीन जोन में रखा है. ऐसे में सभी जिलों में दिन की शुरुआत खिली धूप से ही होगी. इस दौरान 15 से 25 किलोमीटर प्रति घंटे की रफ्तार से कई जिलों में तेज हवाएं भी चलेंगी. 2 और 3 मार्च को भी प्रदेश के दोनों ही संभाग में मौसम ऐसा ही रहने का अनुमान जताया गया है.
यहां दोपहर के वक्त चुभेगी धूप
रविवार को वाराणसी से लेकर गोरखपुर और झांसी से गाजियाबाद तक दोपहर के वक्त धूप की तल्खी लोगों को गर्मी का अहसास कराएगी. अनुमान है आज मेरठ, आगरा, मथुरा, अलीगढ़, बरेली, रामपुर, मुरादाबाद, श्रावस्ती, प्रयागराज, प्रतापगढ़, अमेठी, रायबरेली, देवरिया, बस्ती, कुशीनगर, अयोध्या, ललितपुर, मुजफ्फरनगर, इटावा, कन्नौज, मैनपुरी, आजमगढ़, मिर्जापुर, सोनभद्र, चंदौली, जौनपुर, गाजीपुर, बलिया, मऊ और आस पास के जिलों में सुबह से धूप खिली रहेगी. अनुमान है ज्यादातर जिलो में अधिकतम तापमान 30 से 34 डिग्री सेल्सियस के करीब होगा.
रविवार को वाराणसी से लेकर गोरखपुर और झांसी से गाजियाबाद तक दोपहर के वक्त धूप की तल्खी लोगों को गर्मी का अहसास कराएगी. अनुमान है आज मेरठ, आगरा, मथुरा, अलीगढ़, बरेली, रामपुर, मुरादाबाद, श्रावस्ती, प्रयागराज, प्रतापगढ़, अमेठी, रायबरेली, देवरिया, बस्ती, कुशीनगर, अयोध्या, ललितपुर, मुजफ्फरनगर, इटावा, कन्नौज, मैनपुरी, आजमगढ़, मिर्जापुर, सोनभद्र, चंदौली, जौनपुर, गाजीपुर, बलिया, मऊ और आस पास के जिलों में सुबह से धूप खिली रहेगी. अनुमान है ज्यादातर जिलो में अधिकतम तापमान 30 से 34 डिग्री सेल्सियस के करीब होगा.
नोएडा-लखनऊ में भी चढ़ेगा पारा
दिल्ली से सटे नोएडा में भी अब तापमान में पहले से उछाल देखने को मिलेगा. अगले 48 घंटे बाद यहां अधिकतम तापमान में 1 से 2 डिग्री सेल्सियस का उछाल आ सकता है. वहीं लखनऊ की दोपहर भी अब तीखी होगी.धीरे धीरे यहां पंखे कूलर वाले दिन आएंगे. मौसम विभाग का अनुमान है आज लखनऊ में न्यूनतम तापमान 17 और अधिकतम तापमान 32 डिग्री सेल्सियस के करीब रहने की उम्मीद है.
4 मार्च को नया पश्चिमी विक्षोभ करेगा प्रभावित
बनारस हिन्दू यूनिवर्सिटी के मौसम वैज्ञानिक प्रोफेसर मनोज कुमार श्रीवास्तव ने बताया की 4 मार्च को नया पश्चिमी विक्षोभ हिमालयी क्षेत्र को प्रभावित करेगा.उसके बाद फिर तापमान में थोड़ा उछाल भी देखा जाएगा.अनुमान है मार्च के पहले सप्ताह तक प्रदेश के कई जिलों में अधिकतम तापमान 36 डिग्री सेल्सियस के आस पास होगा.
झांसी में तापमान 34 के पार
बताते चलें कि अब बीते 24 घंटे में प्रदेश में सर्वाधिक तापमान 34.6 डिग्री सेल्सियस झांसी में रिकॉर्ड हुआ. वहीं सबसे कम न्यूनतम तापमान अयोध्या में 12.0 डिग्री सेल्सियस रहा.
दिल्ली से सटे नोएडा में भी अब तापमान में पहले से उछाल देखने को मिलेगा. अगले 48 घंटे बाद यहां अधिकतम तापमान में 1 से 2 डिग्री सेल्सियस का उछाल आ सकता है. वहीं लखनऊ की दोपहर भी अब तीखी होगी.धीरे धीरे यहां पंखे कूलर वाले दिन आएंगे. मौसम विभाग का अनुमान है आज लखनऊ में न्यूनतम तापमान 17 और अधिकतम तापमान 32 डिग्री सेल्सियस के करीब रहने की उम्मीद है.
4 मार्च को नया पश्चिमी विक्षोभ करेगा प्रभावित
बनारस हिन्दू यूनिवर्सिटी के मौसम वैज्ञानिक प्रोफेसर मनोज कुमार श्रीवास्तव ने बताया की 4 मार्च को नया पश्चिमी विक्षोभ हिमालयी क्षेत्र को प्रभावित करेगा.उसके बाद फिर तापमान में थोड़ा उछाल भी देखा जाएगा.अनुमान है मार्च के पहले सप्ताह तक प्रदेश के कई जिलों में अधिकतम तापमान 36 डिग्री सेल्सियस के आस पास होगा.
झांसी में तापमान 34 के पार
बताते चलें कि अब बीते 24 घंटे में प्रदेश में सर्वाधिक तापमान 34.6 डिग्री सेल्सियस झांसी में रिकॉर्ड हुआ. वहीं सबसे कम न्यूनतम तापमान अयोध्या में 12.0 डिग्री सेल्सियस रहा.
About the Author
Lalit Bhatt
पिछले एक दशक से अधिक समय से पत्रकारिता के क्षेत्र में सक्रिय हूं. 2010 में प्रिंट मीडिया से अपने पत्रकारिता करियर की शुरुआत की, जिसके बाद यह सफर निरंतर आगे बढ़ता गया. प्रिंट, टीवी और डिजिटल-तीनों ही माध्यमों म...और पढ़ें
और पढ़ें",0.0
"UP WEATHER UPDATE: होली आते ही मौसम के चढ़े तेवर, वाराणसी सबसे गर्म, जानिए आज के मौसम का हाल - ETV Bharat",https://news.google.com/rss/articles/CBMi7wFBVV95cUxQM01tM0gtc0tDVnZqbk10Z2RhbDU2aWVuZkpBRFRKTVRxc0xpa1RXTk1Tci1tQmZYS1gtVEY1dWkwU2VnRXd2VVM5UHg1WVNDY1RVQWdDdFl3QkNZRnhYTXpCV1lhaUVyUVl0anpkOXpoeWFOWTZ6aXNvOVc5RmQxQUMwVk5fekM3SmpodS1mcVNNcGpMWW16MWp4NlUxM2puMHdsYVRaZkRlRFBLbDBvWGp6VExENFlHbVhBQ21xNV9hQWZOYWExRGN1ckJlejlQSHBoRUVSell4djY0X2VFdzFaVjlHdGhMdEpLQUxFc9IB9AFBVV95cUxQbG41d2hiTUtGaXIzM2FwU01YampILTNha2F5cVBNUzByb3EzaHN4TVRLWTJJTlY2SUdaV2RtV1F1aDBMRkdEb1VpUThYTUo5blJva3BWYVVVSlFaZ3d1VXpPczBhMlNrZ09kUWhnYk1YUmVMcjFQRl9uMVA2eWJya0lKbDlYQW1sSHRJMm02UUVEWV9TYm9qbUFvUUdBbGFYMmhrajFZZ0ZsTlA5dkUzZEM1aDd3Q0YtMDJmQ3hnYW1jWXQzcl92TDhSMEl2aEhQVm5UazBIYTJtOHppTERYR0Vsc3hzbFZXLWVObFlQRlQzM3A3?oc=5,ETV Bharat,2026-03-01T09:54:20+05:30,hi,Uttar Pradesh,,"(""पारा चढ़ा"" OR ""पारा पहुंचा"" OR तापमान OR ""तापमान बढ़ा"" OR ""रिकॉर्ड तोड़ गर्मी"" OR ""डिग्री सेल्सियस"" OR ""पारा उबला"" OR ""अधिकतम तापमान"") Uttar Pradesh","UP WEATHER UPDATE: होली आते ही मौसम के चढ़े तेवर, वाराणसी सबसे गर्म, जानिए आज के मौसम का हाल
मौसम विज्ञानियों ने फिर जारी किया अलर्ट, मार्च में अब तेजी से बढ़ेगा अधिकतम तापमान.
लखनऊः पिछले 24 घंटे में उत्तर प्रदेश में मौसम शुष्क बना रहा. मौसम विज्ञानियों की मानें तो होली से पहले तापमान में इजाफा होना शुरू हो जाएगा. यूपी के कई जिलों में अधिकतम तापमान में 4 डिग्री सेल्सियस तक की बढ़ोत्तरी हो सकती है.
मौसम विभाग ने क्या कहा: मौसम विज्ञानियों की मानें तो पश्चिमी उत्तर प्रदेश 1-2 जिलों में हल्का कोहरा छाया रहेगा. मार्च की शुरुआत में प्रदेश के ज्यादातर हिस्सों में 25 से लेकर 35 किलोमीटर प्रति घंटा की तेज रफ्तार से हवा चलेगी. इससे अधिकतम-न्यूनतम तापमान में विशेष वृद्धि नहीं होगी. अधिकतम तापमान में 3 से 4 डिग्री सेल्सियस तक की वृद्धि दर्ज की जाएगी. इस माह में अधिकतम तापमान सामान्य से अधिक रहेगा. मौसम विभाग के मुताबिक अधिकतम तापमान सामान्य से अधिक रहेगा.
लखनऊ के मौसम पर एक नजर: लखनऊ में मौसम लगातार शुष्क बना हुआ है. शनिवार को तेज धूप खिलने के साथ ही दिन में कई बार बादलों की आवाजाही भी रही. वहीं, 20 से लेकर 30 किलोमीटर प्रति घंटा की तेज रफ्तार से हवाएं भी चली. अधिकतम तापमान में वृद्धि जारी है. शुक्रवार को अधिकतम तापमान 31 डिग्री सेल्सियस रिकार्ड किया गया था वहीं शनिवार को अधिकतम तापमान 32 डिग्री सेल्सियस रिकार्ड किया गया जो की सामान्य से चार डिग्री सेल्सियस अधिक है. वहीं, न्यूनतम तापमान 15 डिग्री सेल्सियस रिकार्ड किया गया जो की सामान्य से 3 डिग्री सेल्सियस अधिक है.
प्रमुख जिलों में आज अधिकतम तापमान की संभावना
वाराणसी बीते 24 घंटे में सबसे गर्म: वाराणसी सबसे गर्म शनिवार को उत्तर प्रदेश का वाराणसी जिला सबसे अधिक गर्म रहा. यहां पर अधिकतम तापमान 34.4 डिग्री सेल्सियस रिकार्ड किया गया जो की सामान्य से 5.5 डिग्री सेल्सियस अधिक है. वहीं, सबसे कम न्यूनतम तापमान अयोध्या जिले में 12 डिग्री सेल्सियस रिकार्ड किया गया जो की सामान्य है.
मौसम वैज्ञानिक क्या बोले: डॉक्टर अतुल सिंह ने बताया कि मार्च के दौरान प्रदेश के ज्यादातर भाग में अधिकतम तापमान सामान्य से अधिक रहेगा. पूर्वांचल समेत प्रदेश के तराई इलाकों में लू के दिनों की संख्या में बढ़ोत्तरी की संभावना है. मार्च के प्रथम सप्ताह के शुरुआती 3-4 दिनों के दौरान प्रदेश में 25-35 किमी/घंटा की रफ्तार से हवाएं चलेंगी.",0.0
