title,url,source,date,language,state,district,search_term,full_text,relevance_score
"UP Weather: सुबह छाए बादल फिर दोपहर में चढ़ा पारा, एक हफ्ते में तापमान होगा 40 डिग्री के पार - Hindustan Hindi News",https://news.google.com/rss/articles/CBMi-gFBVV95cUxNS3dxWm1vS3lxbXVVRUppZTZ2SWh0bXk2VGZhSnp5TjAtRjcwNkRUTUFtb01YTTdiMGl0TGpkNTM5dDh0dGZuZGhlR0QycE1qTlN3dnlzQnkwRDd2UkN5ZFBObDQxMVpLXzZkZnZwUUpEM0d4UXRPQVU3WVFMaFZBVlVhMkhkdlNPUFkwQ01ZRGZzdV9UV0g0UkpTYngtejNXSDJvaHdUQWFOMkJQUUd1ZzlPUGZwYmt1emkxeDJGOWtyMGtHeVZ0TzZxR0owcHhqQVM3eHNUX2lPNWpfQi1LaGtPRzBubjF0T0pTRFJLcENyNEU1eVJYN0VR0gH_AUFVX3lxTE9MTzU5SVdVUEdOc2g1LXVRZTVIeTFMcnZqUVZhcUI3N3pPRjVXb0YwM3h4N0VBbHdvWmoteEU0dFBiYWg3RUhWcWFwZ1pOQmpzNUN4bjVBOHFhNlRSTWo3d1MyaE01S0QwUU5iV0hQS2lTRkhwWHVDQ25DV2pnalRMNkVQb1lic0pBTDBWMzdibWNIRmVENWFrOHNOQjhmWGhXNVZQQzFrRG0wTlMyTE1BVzRPOFRTOGJvTmNmdlIyTGtuMGhUU2JkYVR3dlpnTmVwZnVWMGRkT200aW01U3BNUGYzU21FVUdvWkZLX1FGU05hdGNBWU5EU2JzdHhtMA?oc=5,Hindustan Hindi News,2026-03-01T06:40:26+05:30,hi,Uttar Pradesh,,"(""पारा चढ़ा"" OR ""पारा पहुंचा"" OR तापमान OR ""तापमान बढ़ा"" OR ""रिकॉर्ड तोड़ गर्मी"" OR ""डिग्री सेल्सियस"" OR ""पारा उबला"" OR ""अधिकतम तापमान"") Uttar Pradesh","UP Weather: सुबह छाए बादल फिर दोपहर में चढ़ा पारा, एक हफ्ते में तापमान होगा 40 डिग्री के पार
यूपी में एक बार फिर मौसम करवट लेते लेते रह गया। शनिवार को यूपी के कई इलाकों में बादलों के साथ सुबह की शुरुआत हुई। पर जैसे जैसे दिन चढ़ा पारा भी चढ़ता नजर आया। दिन का न्यूनतम तापमान 17 और अधिकतम तापमान 33 दर्ज किया गया।
यूपी में एक बार फिर मौसम करवट लेते लेते रह गया। शनिवार को यूपी के कई इलाकों में बादलों के साथ सुबह की शुरुआत हुई। पर जैसे जैसे दिन चढ़ा पारा भी चढ़ता नजर आया। दिन का न्यूनतम तापमान 17 और अधिकतम तापमान 33 दर्ज किया गया। होली के त्योहार के साथ साथ मौसम का पारा भी चढ़ने लगा है। शनिवार सुबह इंद्र देव बारिश के मूड में नजर आए। करीब चार घंटे बादल छाने के बाद मौसम साफ हो गया। जैसे जैसे दिन चढ़ा मौसम का पारा भी चढ़ता नजर आया।
होली के बाद मौसम अलग ही मूड नजर आने वाला है। आने वाले दिनों में न्यूनतम तापमान 14-16 और अधिकतम 32 से 40 डिग्री होने वाला है। शनिवार को दिन और रात के तापमान में उल्लेखनीय वृद्धि दर्ज की गई है। मौसम विभाग से प्राप्त जानकारी के अनुसार शनिवार को दिन का अधिकतम तापमान 33 डिग्री सेल्सियस दर्ज किया गया यह सामान्य से 6.4 डिग्री सेल्सियस अधिक था जबकि न्यूनतम तापमान 17 डिग्री सेल्सियस दर्ज किया गया और यह सामान्य से 3.9 डिग्री सेल्सियस अधिक दर्ज किया गया। मौसम विभाग से प्राप्त जानकारी के अनुसार शनिवार बेहद गर्म दिन रहा।
पतझड़ के साथ होली
फरवरी का महीना समाप्त होते ही यूपी में ऋतु परिवर्तन का असर साफ दिखने लगा है। पिछले एक सप्ताह से तापमान में लगातार हो रही वृद्धि के साथ ही जिले में पतझड़ के मौसम की विधिवत शुरुआत हो गई है। पेड़ों से गिरते सूखे पत्ते और दोपहर की बढ़ती तपिश इस बात का संकेत दे रही है कि जिले में अब कड़ाके की ठंड बीते दिनों की बात हो गई है। बता दें के शहरी इलाकों से लेकर ग्रामीण क्षेत्रों तक प्रकृति के मिजाज में बदलाव देखा जा रहा है। बढ़ती धूप के कारण वातावरण में आर्द्रता कम हुई है। इससे पेड़ों ने पुराने पत्तों को त्यागना शुरू कर दिया है।
अधिकतम तापमान अब 30 से 32 डिग्री सेल्सियस के बीच पहुंच रहा है। जबकि न्यूनतम तापमान में भी बढ़ोत्तरी दर्ज की गई है। बता दें कि इस समय फागुनी बयार बहने लगी है। एक ओर जहां पतझड़ प्रकृति को नए श्रृंगार के लिए तैयार कर रहा है, वहीं दूसरी ओर लोग होली के स्वागत के लिए पूरी तरह उत्साहित नजर आ रहे हैं।
शनिवार को मौसम शुष्क बना रहा। एक सप्ताह में अधिकतम तापमान एवं न्यूनतम तापमान में बढ़ोतरी होने की संभावनाएं हैं। अधिकतम तापमान 40 डिग्री सेल्सियस तक जा सकता है। मार्च के शुरुआत में तापमान में दिनों-दिन बढ़ोतरी होने की संभावनाएं हैं। शनिवार को पछुआ हवा 7 किलोमीटर प्रति घंटे की रफ्तार से बही। पछुआ हवा बहने से खेतों में नमी की कमी देखी गई। नमी बरकरार रखने के लिए किसान लगातार सिंचाई करने में लगे हुए हैं। आने वाले दिनों में बरसात की संभावना नहीं है।
लेखक के बारे में
Srishti Kunjसृष्टि कुंज लाइव हिन्दुस्तान में लगभग 6 वर्षों से यूपी की टीम संग काम कर रही हैं। एक दशक से डिजिटल पत्रकारिता में सक्रिय सृष्टि ने जर्नलिज्म एंड मास कॉम में डिग्री लेकर पंजाब केसरी ग्रुप की डिजिटल टीम के साथ अपने करियर की शुरुआत की थी। सृष्टि ने इंडिया न्यूज के साथ भी लंबे समय तक काम किया। 2020 से वह उत्तर प्रदेश की राजनीति, क्राइम, स्वास्थ्य, शिक्षा और अन्य बीटों से जुड़ीं खबरें लिखती हैं।
और पढ़ें",0.0
"उत्तर प्रदेश का मौसम (1 Mar 2026) UP Weather Today: तेज हवाओं के बीच चढ़ने लगा पारा, जानिए आपके शहर में कब से श - Times Now Navbharat",https://news.google.com/rss/articles/CBMitgJBVV95cUxPMlRnWDZGaHlXRC15NzVTdGN2Y2RMM1Eyakd1dU52eUtidTNST1ROMUdmWjVnUm5qa3VhbTBGWVA4WEYzcXItOU5xaEhFSTdESzNnajMtdE9Ock5vcW80YkFqeWp3cHlkY2RJN0diSEF0UkpkMkdDMS11dUh1bW5QVlV5UV9zRVdld0JyV3paZVBKTVZtbFY4S1U3MWVoMDNweTJtcjZ2Yi1BcHBPNVcxZDlvWGIzMWROMU02bGNOMUtZdzlNQW14cEZ6b3BnNmFPYUdqMWNGVHE1Q1ZKUHBFVmVyaEVOVVFrSlBTQU5rTkZ1dlJ1N3kzV0dmVW1kQzhRV1pud2haczRrSmlkWFJXaWNDc3N4c0cwc045bkNKTGZ6dXN1aC1mR0JsaGhKN0J6NXBUdzBn0gG7AkFVX3lxTE5IQ2JfVlRjSlFzVUpzTWxqR1lBSTU4MlpWM0RfMmkyZ1FsWUI1U19VRzVGbEhUU0tuXzJVNE1fLWhKcW14OHFySmxZZEh2blFxSnBwa2JBVUNBc00yWGljQmVhM3NYSTltYWluZ3REV25tUUN4LWlqOVlzMG9MREpacUozWFE1RTVXMk01VGVfQ2tZNkRveEZpcXNoWG4ycm5wMHZwWHVNMVJ1Ym91R25ZNWlPWWo4a3pKZTVDT2R4VjJiUzlBUHZwMlEwMTAxSDBFUHo4Rzg1UGdobTdYd21QRHcwbzhodmEyYl9wVWZwSVJKY01ia3JOSS1HemwwRk5FYjhWc1U0NzZMcGhQUm1PNUMxMFBPNUZ0NFNUTWtOcHEwdkZqbG9pdVUtelB4TExnMlBRN0lGY01YNA?oc=5,Times Now Navbharat,2026-03-01T06:35:25+05:30,hi,Uttar Pradesh,,"(""पारा चढ़ा"" OR ""पारा पहुंचा"" OR तापमान OR ""तापमान बढ़ा"" OR ""रिकॉर्ड तोड़ गर्मी"" OR ""डिग्री सेल्सियस"" OR ""पारा उबला"" OR ""अधिकतम तापमान"") Uttar Pradesh","उत्तर प्रदेश का मौसम (1 Mar 2026) UP Weather Today: तेज हवाओं के बीच चढ़ने लगा पारा, जानिए आपके शहर में कब से शुरू होगी 'भीषण गर्मी'
उत्तर प्रदेश का मौसम (यूपी में आज का मौसम कैसा रहेगा) 1 Mar 2026: आज से मार्च की शुरुआत हो गई है और इसके साथ उत्तर प्रदेश में तापमान में बड़ा उछाल आया है। बीते दिन शनिवार को वाराणसी और झांसी सबसे गर्म रहे। मौसम विभाग ने आने वाले दिनों में पारा 36 डिग्री तक पहुंचने और लू चलने की चेतावनी दी है। आइए जानते हैं यूपी के मौसम का हाल।
यूपी में इसबार ज्यादा चलेगी लू
यूपी में आज का मौसम (1 Mar 2026): उत्तर प्रदेश में होली के पहले ही मौसम के मिजाज में बड़ा बदलाव आ गया है। मार्च की शुरुआत होते ही सूरज के तेवर तल्ख होने लगे हैं और रजाई-कंबल अब अलमारियों में सिमटने लगे हैं। सुबह और रात की हल्की गुलाबी ठंड अभी पूरी तरह विदा नहीं हुई है, लेकिन दोपहर की तीखी धूप अब बदन जलाने लगी है। मौसम विभाग ने संकेत दिए हैं कि इस बार उत्तर प्रदेश के लोगों को सामान्य से अधिक गर्मी झेलनी पड़ सकती है।
वाराणसी और झांसी में 'तपिश' की शुरुआत
यूपी में गर्मी ने अपना सबसे ज्यादा असर पूर्वांचल और बुंदेलखंड में दिखाना शुरू कर दिया है। शनिवार को वाराणसी 34.3 डिग्री सेल्सियस के साथ राज्य का सबसे गर्म शहर रहा, जबकि झांसी में पारा 34.6 डिग्री तक पहुंच गया। प्रयागराज और बांदा में भी तापमान 33.8 डिग्री दर्ज किया गया, जिससे यह साफ है कि प्रदेश के दक्षिणी और पूर्वी हिस्से अब तेजी से गर्म हो रहे हैं। राजधानी लखनऊ में भी अधिकतम तापमान 32 डिग्री के आसपास बना हुआ है।
तेज हवाओं का पहरा, फिर चढ़ेगा पारा
आंचलिक मौसम विज्ञान केंद्र के अनुसार, मार्च के शुरुआती 3-4 दिनों में उत्तर-पश्चिमी हवाएं 25 से 35 किलोमीटर प्रति घंटे की रफ्तार से चलेंगी। इन हवाओं के कारण फिलहाल तापमान में कोई अचानक बड़ा उछाल तो नहीं आएगा, लेकिन जैसे ही हवा की गति धीमी होगी, गर्मी अपना असली रंग दिखाएगी। सप्ताहांत तक अधिकतम तापमान में 2 से 4 डिग्री सेल्सियस की क्रमिक वृद्धि होने का अनुमान है, जिससे पारा 36 डिग्री तक पहुंच सकता है।
इस बार क्यों सताएगी ज्यादा गर्मी?
मौसम विभाग का कहना है कि इस साल सर्दी के दौरान पश्चिमी विक्षोभ (Western Disturbances) कम सक्रिय रहे और बारिश भी सामान्य से कम हुई। इसके अलावा, 'ला-निना' की स्थितियों में बदलाव और 'नीनो' परिस्थितियों के प्रभाव के कारण मार्च, अप्रैल और मई के दौरान औसत अधिकतम तापमान सामान्य से अधिक रहने की संभावना है। इसका सीधा मतलब है कि इस साल तराई के इलाकों और पूर्वांचल में लू (Heatwave) के दिनों की संख्या बढ़ सकती है।
4 मार्च से नया विक्षोभ और बढ़ती धूप
मौसम विभाग के अनुसार, 4 मार्च को एक नया पश्चिमी विक्षोभ हिमालयी क्षेत्र को प्रभावित करेगा। इसके बाद तापमान में और उछाल देखा जाएगा। फिलहाल 5 मार्च तक पूरे उत्तर प्रदेश में मौसम शुष्क बना रहेगा और बारिश की कोई संभावना नहीं है। नोएडा, गाजियाबाद और मेरठ जैसे पश्चिमी जिलों में भी अब दोपहर की धूप चुभने लगी है और आने वाले 48 घंटों में यहां तापमान 1-2 डिग्री और बढ़ सकता है।
देश और दुनिया की ताजा ख़बरें (Hindi News) पढ़ें हिंदी में और देखें छोटी बड़ी सभी न्यूज़ Times Now Navbharat Live TV पर। शहर (Cities News) अपडेट और चुनाव (Elections) की ताजा समाचार के लिए जुड़े रहे Times Now Navbharat से।",0.31666666666666665
