title,url,source,date,language,state,district,search_term,full_text,relevance_score
Rain brings relief across Uttar Pradesh; IMD issues orange alert for west UP | Hindustan Times - Hindustan Times,https://news.google.com/rss/articles/CBMi4AFBVV95cUxNVDJ1Y29qY1A3UUdFOTJOMWpGNmJXNXgwWmYzeHA2UWpoM1JORlJSdGJubi1aeVNaT1AyY2lpekF0YkNoZUo3RmxhT0M2eC1vRF9DQW1xb2xPdmZ5aElVYmlnZEdYczRrS0Ewa2Q5enZkSFIySGh5X1VYSWRfOVNIbElCQ2wxZUktMHhMaTBVZ080WkpKXzVXOVl1bUszbDJCWWVicFY0UmQxTlI2WU1XaE9aRGg1V2JRWDJVTFB2TmdzYUVsZjFsU3FsaDQ1OUdlQWV1WjBpNy03ZEVKRkx2c9IB5gFBVV95cUxNMGp5UXlWSndyVnU1OEh1aDVkY1NITUNrc0JjRFhySzE3ajVBTERpdGlpZzNOdWl1b2V1YTNLbW1ReTVrcG9EQU1OLUVLTVBQeHRZSnpYZDFjaFY0QXJGZUtqckszUjd2S3I5ZVJnTzl0T3p1dmNLcVBhZmRROVRORzRhZkwyM2lXODJjNjhfZC1lUWtwWEtVcDZfaVp5RmNKQmZLZm54OFNpREJla0o4Z3RmWDRmU0tob05VbjhOUVRXOGhtTXFnd2xGUjNtNy1aeGZVRjJ3cVhYekN0d0VoQzExOE1VQQ?oc=5,Hindustan Times,2026-06-01T20:11:23+05:30,en,Uttar Pradesh,Agra,"(""heat advisory"" OR ""heat action plan"" OR ""heat alert"" OR ""IMD warning"" OR ""IMD alert"" OR ""red alert"" OR ""orange alert"" OR ""yellow alert"" OR ""NDMA advisory"" OR ""cooling shelter"" OR ""relief measures"" OR ""heat compensation"" OR ""severe weather warning"") Uttar Pradesh","Rain brings relief across Uttar Pradesh; IMD issues orange alert for west UP
The forecast for Lucknow indicates a partly cloudy sky with the possibility of thunderstorm activity.
The state capital continued to experience pleasant weather on Monday, with considerable cloud cover for the second consecutive day. Some areas of the old city witnessed brief spells of rain and drizzle in isolated pockets of Lucknow. The maximum and minimum temperatures were recorded at 34.1°C and 24.4°C, respectively.
The forecast for Lucknow indicates a partly cloudy sky with the possibility of thunderstorm activity. The maximum and minimum temperatures are expected to be around 36°C and 24°C, respectively.
According to the state weather forecast, rain and thundershowers are very likely at isolated places across west UP, while weather conditions are expected to remain largely dry over east Uttar Pradesh. The India Meteorological Department (IMD) has issued a warning for thunderstorms accompanied by lightning and gusty winds, with speeds of 40–50 kmph and gusts reaching up to 60 kmph, at isolated locations in parts of West Uttar Pradesh.
The India Meteorological Department (IMD) has issued an orange alert for parts of west UP, forecasting another spell of rain on Wednesday and Thursday. A Yellow Alert has also been issued for Tuesday, warning of rain accompanied by gusty winds in the region.
The weathermen predicted thunderstorms and lightning accompanied by gusty winds, with speeds of 40–50 kmph and gusts reaching up to 60 kmph, at isolated places across West Uttar Pradesh on Tuesday. The intensity of the weather activity is expected to increase on June 3 and 4, with thunderstorms and lightning likely to be accompanied by stronger winds of 50–60 kmph, gusting up to 70 kmph, at isolated locations in the region.
Owing to rainfall in several parts of Uttar Pradesh, the maximum temperature remained below 40°C at almost all weather observatories across the state. Varanasi (BHU) recorded the highest maximum temperature at 39.8°C, followed by Orai at 39.4°C. Maximum temperatures of 39°C were recorded in Prayagraj, Varanasi Airport, Ghazipur and Churk, while Banda registered 38.5°C, which was about five degrees below the seasonal normal.",1.0
"तापमान बढ़ने के साथ ज्यादा खूंखार हो रहे कुत्ते, हाथरस में एक दिन में 400 से ज्यादा पहुंचे काटने के केस - Jagran",https://news.google.com/rss/articles/CBMiswFBVV95cUxNeTRaMS01Q0VFZE13dGxCUld1TGVKLTJjUlhEMnNsRU56UUMwQWJ3Y2JKZUtjRUNLSnhqMERyQ1ZUVzNTUlNEMlVubXdwWXRzaklkSjQ1Ny1LSTlhVXVqVUpVUFdWNHVGVi1waEpnbHpmNWh1UkEyZ280SVdsUEZBTzE1V3RmQm41MzZZZ0ZncVNBRWJVVF9Lblo5c0dJUzUtNWN3b2ZnV0VkWEx6emFGbnBJUQ?oc=5,Jagran,2026-06-01T17:31:00+05:30,hi,Uttar Pradesh,Agra,"(""पारा चढ़ा"" OR ""पारा पहुंचा"" OR तापमान OR ""तापमान बढ़ा"" OR ""रिकॉर्ड तोड़ गर्मी"" OR ""डिग्री सेल्सियस"" OR ""पारा उबला"" OR ""अधिकतम तापमान"" OR ""तापमान 40 पार"" OR ""तापमान 45 पार"" OR ""तापमान बढ़ने की संभावना"") Uttar Pradesh","तापमान बढ़ने के साथ ज्यादा खूंखार हो रहे कुत्ते, हाथरस में एक दिन में 400 से ज्यादा पहुंचे काटने के केस
हाथरस में बढ़ती गर्मी के साथ कुत्तों के काटने की घटनाओं में तेजी आई है, जहां प्रतिदिन 400 से अधिक लोग एंटी-रेबीज वैक्सीन लगवा रहे हैं। चिकित्सक कुत्तो ...और पढ़ें
संवाद सहयोगी, हाथरस। गर्मी बढ़ने के साथ ही कुत्तों के काटने की घटनाओं में इजाफा हो रहा है। रोजाना सैकड़ों लोगों को शिकार बना रहे हैं। जिला अस्पताल और सामुदायिक स्वास्थ्य केंद्रों पर प्रतिदिन 400 से अधिक लोग एंटी रेबीज वैक्सीन लगवाने पहुंच रहे हैं। इनमें बड़ी संख्या ग्रामीण क्षेत्रों से आने वाले लोगों की होती है।
एंटी रेबीज वैक्सीन लगवाने वाले मरीजों की लगातार बढ़ती संख्या ने चिकित्सकों को हैरान कर दिया है। हालात इतने खराब हैं कि रात के समय शहर की कालोनियों और मुख्य मार्गों पर दोपहिया वाहन चालकों का गुजरना भी जोखिम भरा हो गया है। झुंड में घूमने वाले कुत्ते महिलाओं, बुजुर्गों और बच्चों पर विशेष रूप से हमला कर रहे हैं।
नगर पालिका की ओर से इन कुत्तों से निपटने के लिए अब तक कोई ठोस कदम नहीं उठाया गया है, जिससे लोगों में दहशत है। रविवार को भी जिला अस्पताल की इमरजेंसी और विभिन्न सीएचसी पर वैक्सीन लगवाने के लिए मरीजों की भीड़ देखी गई, जिनमें बच्चों और बुजुर्गों की संख्या अधिक रही।
ऐसे करें बचाव
- गर्मी में कुत्तों को परेशान न करें, इनसे बच्चों को दूर रखें।
- कुत्तों के काटने पर शरीर की उस जगह को 10 से 12 बार साबुन-पानी से धोएं।
- घर के आसपास रहने वाले कुत्तों के लिए पानी की व्यवस्था करें।
- पालतू कुत्तों को समय-समय पर एंटी रेबीज का वैक्सीन लगवाएं।
खबरें और भी
मौसम में बदलाव से बदल रहा कुत्तों का व्यवहार
पशु चिकित्सा अधिकारी डा. विजय सिंह ने बताया कि मौसम में बदलाव से कुत्तों में तनाव की स्थिति पैदा हो जाती है। इससे कुत्तों का व्यवहार हिंसक हो रहा है। लोगों के व्यवहार से भी कुत्तों के व्यवहार पर प्रभाव पड़ता है। लोग कुत्तों के साथ अच्छा व्यवहार नहीं करते। इससे भी कुत्तों के व्यवहार पर दुष्प्रभाव पड़ रहा है।
जिले के स्वास्थ्य केंद्रों पर एंटी रेबीज की कोई कमी नहीं है। यदि किसी को कुत्ता व बंदर काटता है, तो जिला अस्पताल सहित सीएचसी, पीएचसी पर तुरंत टीका लगवाएं।
डा. राजीव राय, सीएमओ",0.8333333333333333
