title,url,source,date,language,state,district,search_term,full_text,relevance_score
IMD issues heatwave warning to multiple districts - Telangana Today,https://news.google.com/rss/articles/CBMiggFBVV95cUxPUWZjcUEyU19CVmNyUDBLTEhybDJueW5ySW80akpRSVAtSTJEUElSd25idUhFS3BtX0Z4VnlZVXctZTBCVGdsRjNDOGVxZEYtYzFmMjVDa0NGOHlueng4cUV2d3pKVjJUWERQT0JjbU5ndlRpazlPOTU0Nnp6NjZoYVdn?oc=5,Telangana Today,2026-06-12T18:16:14+05:30,en,Telangana,Bhadradri Kothagudem,"(heatwave OR ""heat wave"" OR ""severe heatwave"" OR ""extreme heat"" OR ""heat spell"" OR ""scorching heat"" OR ""blistering heat"" OR ""sweltering heat"" OR ""hot winds"" OR loo OR ""hot loo winds"" OR ""intense heat"" OR ""unbearable heat"" OR ""deadly heat"" OR heat OR ""weather forecast"" OR ""weather update"" OR ""weather alert"" OR ""IMD forecast"" OR ""IMD prediction"" OR ""IMD alert"" OR IMD OR ""rising temperatures"" OR ""temperatures expected to rise"" OR ""relief from heat"" OR ""respite from heat"" OR ""heat respite"" OR ""respite from scorching heat"") Telangana","Home |Hyderabad |Imd Issues Heatwave Warning To Multiple Districts
IMD issues heatwave warning to multiple districts
The IMD Hyderabad has issued a heatwave warning for ten districts, expecting temperatures up to 44°C. Simultaneously, a heavy rainfall alert and thunderstorm warnings with gusty winds have been issued for several other Telangana districts over the next three days
Hyderabad: The India Meteorological Department (IMD), Hyderabad on Friday issued a heatwave warning to multiple districts with the mercury in at least ten districts expected to range from 41 degree Celsius to 44 degrees Celsius over the next two to three days.
The alert has been issued to KomuramBheem Asifabad, Mancherial, Nirmal, Nizamabad, Jagtial, Karimnagar, Peddapalli and Jayashankar Bhupalpally districts.
A one-day heavy rainfall warning was also issued for Mahabubabad, Warangal, Hanumakonda, Mahabubnagar and Nagarkurnool districts, which are likely to witness rainfall between 64.5 mm and 115.6 mm.
Apart from heat wave and heavy rainfall warnings, the IMD also issued thunderstorms with lightning and gusty winds warning to several districts for next two-days. The districts include Jayashankar Bhupalpally, Mulugu, Bhadradri Kothagudem, Khammam, Nalgonda, Suryapet, Mahabubabad, Warangal, Hanumakonda, Jangaon, Siddipet, Yadadri Bhuvanagiri, Rangareddy, Hyderabad, Medchal-Malkajgiri, Vikarabad, Sangareddy, Medak, Kamareddy, Mahabubnagar, Nagarkurnool, Wanaparthy, Narayanpet and Jogulamba Gadwal districts.",1.0
