title,url,source,date,language,state,district,search_term,full_text,relevance_score
"ਪੰਜਾਬ ਅਤੇ ਚੰਡੀਗੜ੍ਹ 'ਚ ਚਾਰ ਦਿਨਾਂ ਲਈ ਹੀਟਵੇਵ ਦਾ ਅਲਰਟ ਜਾਰੀ, ਇਨ੍ਹਾਂ ਜ਼ਿਲ੍ਹਿਆਂ 'ਚ ਵਧੇਗਾ ਤਾਪਮਾਨ - ABP Sanjha",https://news.google.com/rss/articles/CBMiogFBVV95cUxOSThib2xWUUk3aENRXzRmUXFLaU15aGdtNkdqUndDUGlQNkEyd0NadmNiTmhYcjJUOHpoaUVPVTJQa3FQVFBiZjVySUp1eEdoOHhWVTdDZWo5QW9XRUJRdWRaT2hWbmFCQ3dqc2VqaVZMVWk3aXJUV25YRE5ueWh3U2JjV1hlNVd6N2VhYTRNRXlwWlFSb3lJT0I3UUNmM2tYamfSAacBQVVfeXFMTk5qS3ZhY0U2MjE4cE80aVltNG9CM1dtQWhXeHp4QkdLZlBYdG4tU1pVUmdScjRiMV9JVks3bW5uSUplSXNzTHJ0YnFnb1J2VjdMc1hpQ2FQRDRhUG01bHZTRW9WSGhXMjRPVDdUVjFoWlBXWmlPcDRLUUxYZ2p4U2N1d1J3SkZzLVk0WVdRa2o1VlM4UG81UHloQkF0d3NTdkJuWkhFRjA?oc=5,ABP Sanjha,2026-04-21T07:37:11+05:30,pa,Punjab,Ludhiana,"(ਲੂ OR ""ਹੀਟ ਵੇਵ"" OR ""ਭਿਆਨਕ ਗਰਮੀ"" OR ""ਕੜਾਕੇ ਦੀ ਗਰਮੀ"" OR ""ਤੱਤੀ ਹਵਾ"" OR ""ਗਰਮੀ ਦਾ ਕਹਿਰ"" OR ""ਸਖ਼ਤ ਗਰਮੀ"" OR ""ਅਸਹਿ ਗਰਮੀ"" OR ""ਤਪਦੀ ਗਰਮੀ"") Punjab","ਪੰਜਾਬ ਅਤੇ ਚੰਡੀਗੜ੍ਹ 'ਚ ਚਾਰ ਦਿਨਾਂ ਲਈ ਹੀਟਵੇਵ ਦਾ ਅਲਰਟ ਜਾਰੀ, ਇਨ੍ਹਾਂ ਜ਼ਿਲ੍ਹਿਆਂ 'ਚ ਵਧੇਗਾ ਤਾਪਮਾਨ
Ludhiana News: ਪੰਜਾਬ ਅਤੇ ਚੰਡੀਗੜ੍ਹ ਹਾਲੇ ਤੋਂ ਹੀ ਕੜਾਕੇ ਦੀ ਗਰਮੀ ਪੈ ਰਹੀ ਹੈ। ਮੌਸਮ ਵਿਭਾਗ ਨੇ ਮੰਗਲਵਾਰ (21 ਅਪ੍ਰੈਲ ਤੋਂ 24 ਅਪ੍ਰੈਲ) ਤੱਕ ਚਾਰ ਦਿਨਾਂ ਲਈ ਹੀਟਵੇਵ ਲਈ ਯੈਲੋ ਅਲਰਟ ਜਾਰੀ ਕੀਤਾ ਹੈ।
Ludhiana News: ਪੰਜਾਬ ਅਤੇ ਚੰਡੀਗੜ੍ਹ ਹਾਲੇ ਤੋਂ ਹੀ ਕੜਾਕੇ ਦੀ ਗਰਮੀ ਪੈ ਰਹੀ ਹੈ। ਮੌਸਮ ਵਿਭਾਗ ਨੇ ਮੰਗਲਵਾਰ (21 ਅਪ੍ਰੈਲ ਤੋਂ 24 ਅਪ੍ਰੈਲ) ਤੱਕ ਚਾਰ ਦਿਨਾਂ ਲਈ ਹੀਟਵੇਵ ਲਈ ਯੈਲੋ ਅਲਰਟ ਜਾਰੀ ਕੀਤਾ ਹੈ। ਇਸ ਦੌਰਾਨ ਕੁਝ ਇਲਾਕਿਆਂ ਵਿੱਚ ਰਾਤਾਂ ਵੀ ਗਰਮ ਰਹਿਣਗੀਆਂ। ਸੋਮਵਾਰ ਦੇ ਮੁਕਾਬਲੇ ਤਾਪਮਾਨ 0.1 ਡਿਗਰੀ ਵਧਿਆ ਹੈ, ਜੋ ਆਮ ਨਾਲੋਂ 3.2 ਡਿਗਰੀ ਵੱਧ ਹੈ।
21 ਜ਼ਿਲ੍ਹਿਆਂ ਵਿੱਚ ਤਾਪਮਾਨ 35 ਡਿਗਰੀ ਸੈਲਸੀਅਸ ਤੋਂ ਵੱਧ ਹੈ, ਜਿਸ ਵਿੱਚ ਸਭ ਤੋਂ ਵੱਧ ਤਾਪਮਾਨ 41 ਡਿਗਰੀ ਸੈਲਸੀਅਸ ਦਰਜ ਕੀਤਾ ਗਿਆ ਹੈ। ਸਿਹਤ ਵਿਭਾਗ ਨੇ ਲੋਕਾਂ ਨੂੰ ਗਰਮੀ ਤੋਂ ਬਚਣ ਲਈ ਐਡਵਾਈਜ਼ਰੀ ਜਾਰੀ ਕੀਤੀ ਹੈ। ਇਸ ਤੋਂ ਇਲਾਵਾ, ਹਸਪਤਾਲਾਂ ਵਿੱਚ ਵਿਸ਼ੇਸ਼ ਵਾਰਡ ਬਣਾਏ ਗਏ ਹਨ ਅਤੇ ਸਟਾਫ ਨੂੰ 24 ਘੰਟੇ ਤਾਇਨਾਤ ਕੀਤਾ ਗਿਆ ਹੈ।
7 ਜ਼ਿਲ੍ਹਿਆਂ ਵਿੱਚ ਹੀਟਵੇਵ ਵਰਗੀ ਸਥਿਤੀ ਹੋਣ ਦੀ ਸੰਭਾਵਨਾ
ਲੁਧਿਆਣਾ, ਨਵਾਂਸ਼ਹਿਰ, ਰੂਪਨਗਰ, ਸੰਗਰੂਰ, ਫਤਿਹਗੜ੍ਹ ਸਾਹਿਬ, ਮੋਹਾਲੀ ਅਤੇ ਪਟਿਆਲਾ ਦੇ ਅਲੱਗ-ਥਲੱਗ ਇਲਾਕਿਆਂ ਵਿੱਚ ਹੀਟਵੇਵ ਵਰਗੀ ਸਥਿਤੀ ਪੈਦਾ ਹੋ ਸਕਦੀ ਹੈ। ਸੂਰਜ ਸਵੇਰ ਤੋਂ ਹੀ ਤੇਜ਼ ਹੋ ਜਾਵੇਗਾ, ਜਦੋਂ ਕਿ ਹੀਟਵੇਵ ਦਾ ਪ੍ਰਭਾਵ ਦੁਪਹਿਰ 12 ਵਜੇ ਤੋਂ ਸ਼ਾਮ 4 ਵਜੇ ਤੱਕ ਵੱਧ ਤੋਂ ਵੱਧ ਰਹੇਗਾ।
23 ਅਪ੍ਰੈਲ ਤੋਂ ਪੱਛਮੀ ਗੜਬੜੀ ਹੁੰਦੀ ਸਰਗਰਮ
ਪੱਛਮੀ ਗੜਬੜ ਇਸ ਵੇਲੇ ਜੰਮੂ ਅਤੇ ਕਸ਼ਮੀਰ ਅਤੇ ਆਸ ਪਾਸ ਦੇ ਖੇਤਰਾਂ ਵਿੱਚ ਸਮੁੰਦਰ ਤਲ ਤੋਂ ਲਗਭਗ 3.1 ਕਿਲੋਮੀਟਰ ਦੀ ਉਚਾਈ 'ਤੇ ਇੱਕ ਉੱਪਰੀ ਹਵਾ ਚੱਕਰਵਾਤੀ ਸਰਕੂਲੇਸ਼ਨ ਦੇ ਰੂਪ ਵਿੱਚ ਬਣੀ ਹੋਈ ਹੈ। ਪਹਾੜਾਂ ਤੋਂ ਤੇਜ਼ ਹਵਾਵਾਂ ਚੱਲ ਰਹੀਆਂ ਹਨ, ਜਿਨ੍ਹਾਂ ਦੀ ਗਤੀ 110 ਗੰਢਾਂ ਤੱਕ ਹੈ। 23 ਅਪ੍ਰੈਲ ਤੋਂ ਇੱਕ ਨਵੀਂ ਪੱਛਮੀ ਗੜਬੜ ਪੱਛਮੀ ਹਿਮਾਲੀਅਨ ਖੇਤਰ ਨੂੰ ਪ੍ਰਭਾਵਿਤ ਕਰਨ ਦੀ ਸੰਭਾਵਨਾ ਹੈ।
ਸੂਬੇ ਦੇ 21 ਜ਼ਿਲ੍ਹਿਆਂ ਵਿੱਚ 35 ਡਿਗਰੀ ਸੈਲਸੀਅਸ ਤੋਂ ਵੱਧ ਤਾਪਮਾਨ ਦਰਜ ਕੀਤਾ ਗਿਆ, ਜਿਸ ਕਾਰਨ ਪੰਜਾਬ ਭਰ ਵਿੱਚ ਹੀਟਵੇਵ ਤੇਜ਼ ਹੋ ਗਈ। ਚੰਡੀਗੜ੍ਹ ਵਿੱਚ ਵੱਧ ਤੋਂ ਵੱਧ ਤਾਪਮਾਨ 38.1 ਡਿਗਰੀ ਸੈਲਸੀਅਸ ਦਰਜ ਕੀਤਾ ਗਿਆ। ਜਲੰਧਰ ਵਿੱਚ 37.0 ਡਿਗਰੀ ਸੈਲਸੀਅਸ, ਅੰਮ੍ਰਿਤਸਰ ਵਿੱਚ 37.1 ਡਿਗਰੀ ਸੈਲਸੀਅਸ, ਲੁਧਿਆਣਾ ਵਿੱਚ 39.4 ਡਿਗਰੀ ਸੈਲਸੀਅਸ ਅਤੇ ਪਟਿਆਲਾ ਵਿੱਚ 39.8 ਡਿਗਰੀ ਸੈਲਸੀਅਸ ਦਰਜ ਕੀਤਾ ਗਿਆ। ਪਠਾਨਕੋਟ ਵਿੱਚ ਵੱਧ ਤੋਂ ਵੱਧ ਤਾਪਮਾਨ 37.2 ਡਿਗਰੀ ਸੈਲਸੀਅਸ ਦਰਜ ਕੀਤਾ ਗਿਆ, ਜਦੋਂ ਕਿ ਬਠਿੰਡਾ ਵਿੱਚ ਸਭ ਤੋਂ ਵੱਧ ਤਾਪਮਾਨ 41.0 ਡਿਗਰੀ ਸੈਲਸੀਅਸ ਦਰਜ ਕੀਤਾ ਗਿਆ।
ਫਰੀਦਕੋਟ ਵਿੱਚ ਵੱਧ ਤੋਂ ਵੱਧ ਤਾਪਮਾਨ 38.0 ਡਿਗਰੀ ਸੈਲਸੀਅਸ, ਗੁਰਦਾਸਪੁਰ ਵਿੱਚ 37.5 ਡਿਗਰੀ ਸੈਲਸੀਅਸ, ਐਸਬੀਐਸ ਨਗਰ (ਨਵਾਂਸ਼ਹਿਰ) ਵਿੱਚ 36.7 ਡਿਗਰੀ ਸੈਲਸੀਅਸ, ਫਰੀਦਕੋਟ (ਏਡਬਲਯੂਐਸ) ਵਿੱਚ 40.9 ਡਿਗਰੀ ਸੈਲਸੀਅਸ, ਫਾਜ਼ਿਲਕਾ ਵਿੱਚ 36.6 ਡਿਗਰੀ ਸੈਲਸੀਅਸ, ਫਿਰੋਜ਼ਪੁਰ ਵਿੱਚ 36.5 ਡਿਗਰੀ ਸੈਲਸੀਅਸ ਅਤੇ ਹੁਸ਼ਿਆਰਪੁਰ ਵਿੱਚ 36.2 ਡਿਗਰੀ ਸੈਲਸੀਅਸ ਦਰਜ ਕੀਤਾ ਗਿਆ।
ਮਲੇਰਕੋਟਲਾ ਵਿੱਚ 35.8 ਡਿਗਰੀ ਸੈਲਸੀਅਸ, ਕਪੂਰਥਲਾ ਵਿੱਚ 36.5 ਡਿਗਰੀ ਸੈਲਸੀਅਸ, ਪਠਾਨਕੋਟ (AWS) ਵਿੱਚ 36.5 ਡਿਗਰੀ ਸੈਲਸੀਅਸ, ਪਟਿਆਲਾ (AWS) ਵਿੱਚ 37.4 ਡਿਗਰੀ ਸੈਲਸੀਅਸ, ਰੋਪੜ ਵਿੱਚ 36.5 ਡਿਗਰੀ ਸੈਲਸੀਅਸ ਅਤੇ ਭਾਖੜਾ ਡੈਮ (ਨੰਗਲ) ਵਿੱਚ 39.5 ਡਿਗਰੀ ਸੈਲਸੀਅਸ ਤਾਪਮਾਨ ਦਰਜ ਕੀਤਾ ਗਿਆ।",0.8
