title,url,source,date,language,state,district,search_term,full_text,relevance_score
"Indore Water Crisis: दोपहर की भीषण गर्मी में पानी का संघर्ष, रिंग रोड से सटे इलाकों में रहवासियों की फजीहत - Amar Ujala",https://news.google.com/rss/articles/CBMihgJBVV95cUxPcWsxMlhHdWExdTVhWm01enNDQjFKOTJZQjdmY0FpUmZhOGFlZnVfU2NwU2lsaUNNRVc5MHNQQmFtSzlEUU5ocEVBZ1hjT3RKZ254TXJDeVhRM1hKajJlN3NXeHhwRGptcEFYa3ZuWnZxemhXalA3OFRnMTg4dklqaUJZdWxBTEF2dm1CdTdNUENrN0dpV093SUVnSmtsMUMtRTktSF9zMWprM1NycHYxcThJcGs1NzNVOXZYT1B2d1FOTlRrVEllcWc1STZLdThIbHllbzl3MFpNSGFjREtJN1RHb2Y0UkNpWEMwdjRoNWRiS0E0QVlRejJ0VXotdG45VzdJSW9n0gGLAkFVX3lxTE1sdEJjMHBobUpPRGpkX3BQVlpiZG0ybWVHdzFjVFVhTFBpd2lZbnZSc1JNcVJaR3R0MHpTeUE4QWdaWmVrWmQ0WmZiaWRoVlBtYXdKajZoSV9kZjV6ZWVSOUZkdVFpM0l2bUxQb1Jra3I0aEtQS0toeExpVEZEZ2FuZEhvM2FFSnJBZEt4dmJzWXZuRXB0TWhZR0lUbzNhSWZFUTBtRU5pWWRDWWsyTm5aZmtuVFljMUl2Qm10QlhmVnF5aWs5eVVaZ0R2a3p0LW11bTZiaDlBNkktX0tjZUFYbFFVOXhMUmR6TUZ2UEhvZUxyck5Xc21HbVBJM2x3NFNOc0Rac0dPSDBJWQ?oc=5,Amar Ujala,2026-05-02T06:31:02+05:30,hi,Madhya Pradesh,Indore,"(लू OR ""लू चलना"" OR ""भीषण गर्मी"" OR ""प्रचंड गर्मी"" OR ""कड़ी धूप"" OR ""तेज धूप"" OR ""गर्म हवा"" OR ""उष्ण लहर"" OR ""ताप लहर"" OR ""हीट वेव"" OR ""झुलसाने वाली गर्मी"" OR ""तपती गर्मी"" OR ""भयंकर गर्मी"" OR ""गर्मी का कहर"" OR ""गर्मी का प्रकोप"" OR ""अत्यधिक गर्मी"" OR मौसम OR ""मौसम अपडेट"" OR ""मौसम का हाल"" OR ""मौसम पूर्वानुमान"" OR ""मौसम अलर्ट"" OR आईएमडी OR ""आईएमडी पूर्वानुमान"" OR ""आईएमडी अलर्ट"" OR ""तापमान में बढ़ोतरी"" OR ""गर्मी से राहत"" OR ""गर्मी से निजात"") Madhya Pradesh","{""_id"":""69f4e79709364665f10d0da8"",""slug"":""struggle-for-water-in-the-scorching-afternoon-heat-residents-of-areas-adjacent-to-the-ring-road-are-suffering-2026-05-01"",""type"":""photo-gallery"",""status"":""publish"",""title_hn"":""Indore Water Crisis: दोपहर की भीषण गर्मी में पानी का संघर्ष, रिंग रोड से सटे इलाकों में रहवासियों की फजीहत"",""category"":{""title"":""City & states"",""title_hn"":""शहर और राज्य"",""slug"":""city-and-states""}}
Indore Water Crisis: दोपहर की भीषण गर्मी में पानी का संघर्ष, रिंग रोड से सटे इलाकों में रहवासियों की फजीहत
सार
इंदौर में भीषण गर्मी और गिरते भूजल स्तर से जल संकट गहरा गया है। बोरिंग सूख रहे हैं, टैंकर कम पड़ रहे हैं और लोग दूर-दूर से पानी ला रहे हैं। यशवंत सागर सहित जलाशयों का स्तर घटा है। प्रशासन टैंकर आपूर्ति, मैपिंग और नर्मदा परियोजना से राहत देने की कोशिश कर रहा है।
विज्ञापन",1.0
