title,url,source,date,language,state,district,search_term,full_text,relevance_score
"2 areas in Rizal, Cavite log dangerous heat index - Inquirer.net",https://news.google.com/rss/articles/CBMijwFBVV95cUxNMUU2NnhzZmpMcUhsbmxscXJLUnpVTDZNdFg5X2YzNGNJSjFKWTRfYjh1cktFdWdQYklua1JHam5iQkx0cmtwUlg2VHFoSEt6cmlKZU9kam54SzVwNEZOQTBrbW5Fd09QUkduT2ZScXNuVnkzSVQ0MmwwVUtkeE5yYlY1WXk5akVqajNOUElYY9IBlAFBVV95cUxNNU9QR3dtVWNpYVJJczU5bDViWjdvNWtZWUcxaGpnMlNIaGIzVW9pa0laRFNfN0JlZXZ5bHpTckRBQ0M4RlprZGxIUEY4M3dFdU5JcklTZWtMZ25QWnl1RmpwRFlLNW9abjJ5dWhObl9GWE55ZUpBdWRWYWhxYTd6MHBJajdnYzROMTFwcnJfd3paakZH?oc=5,Inquirer.net,2026-06-29T12:50:00+05:30,en,Assam,,"(heatstroke OR ""heat stroke"" OR sunstroke OR ""heat exhaustion"" OR ""heat-related death"" OR ""heat casualty"" OR ""heat fatality"" OR ""suspected heat death"" OR dehydration OR ""heat cramps"" OR ""heat illness"") Assam","LUCENA CITY – The local governments of Taytay, Rizal, and Imus City, Cavite, urged their residents to take precautionary measures after the two localities recorded “dangerous” heat index levels on Monday.
In an advisory posted on its official Facebook page, the Taytay Public Information Office (PIO) said the town’s heat index reached 44.32°C as of 10:14 a.m.
The advisory warned that prolonged exposure to extreme heat could cause heat cramps, heat exhaustion, and heat stroke, prompting authorities to advise residents to exercise extra caution.
In Imus City, Cavite, local authorities also reminded residents to observe safety measures after the heat index reached 42.2°C as of 1:05 p.m.
According to the Philippine Atmospheric, Geophysical and Astronomical Services Administration (Pagasa), the heat index measures the level of discomfort people experience due to the combined effects of air temperature and humidity.
The weather bureau classifies heat index levels into four categories: “caution” (27°C to 32°C), “extreme caution” (33°C to 41°C), “danger” (42°C to 51°C), and “extreme danger” (52°C and above).
Peak heat conditions are usually experienced from midday until late afternoon.
Article continues after this advertisement
Authorities advised the public to limit outdoor activities during peak hours, drink plenty of water to stay hydrated, wear light-colored, loose-fitting clothing, avoid leaving children or pets inside parked vehicles, and regularly check on vulnerable individuals, including children, senior citizens, and those with existing medical conditions.
Pagasa suspended the issuance of heat index forecasts beginning June 5 to prioritize accurate and timely weather advisories during the rainy season.
Article continues after this advertisement
However, the state weather bureau advised areas still experiencing hot conditions to remain updated through official channels and continue observing health and safety precautions.
Meanwhile, Pagasa said the low-pressure area (LPA) being monitored inside the Philippine Area of Responsibility (PAR) has a medium chance of developing into a tropical cyclone and may intensify as early as Wednesday./coa
Your subscription could not be saved. Please try again.
Your subscription could not be saved. Please try again.
Your subscription has been successful.
Disclaimer: Comments do not represent the views of INQUIRER.net. We reserve the right to exclude comments which are inconsistent with our editorial standards. FULL DISCLAIMER",1.0
"IMD issues orange alert for Mumbai, forecasts heavy rain - Rediff",https://news.google.com/rss/articles/CBMi1gFBVV95cUxQbEhVeExtNGRma3RKVmZGMy1TbWFCVURyV0ZfbXAxSUZUYnVnRnVRV0tEcEh5LXZyWU56LVdkSkdtSTYyM1BXZVJPYU9jdHA4TmRQZnFUWEp5UFl5RUJic2NsZlZpRDRjU0xfWV9JVGVIRUNoeENTbU9SaVN0SmZEelBMbXNUemFVTzFaNXB0WjZ1U0NibEVCRGx5NUhqS0tpa3F5c2tKdkRXbl9sZmxmTUc0aUttdHhGc1ItS2FRbkJpNXBZOXh5ZzNxam1wZGU0eC0zdF9R?oc=5,Rediff,2026-06-29T16:17:06+05:30,en,Assam,,"(""heat advisory"" OR ""heat action plan"" OR ""heat alert"" OR ""IMD warning"" OR ""IMD alert"" OR ""red alert"" OR ""orange alert"" OR ""yellow alert"" OR ""NDMA advisory"" OR ""cooling shelter"" OR ""relief measures"" OR ""heat compensation"" OR ""severe weather warning"") Assam","The India Meteorological Department (IMD) on Monday issued an orange alert for Mumbai for the next few days, forecasting heavy to very heavy rainfall accompanied by thunderstorms, lightning, and gusty winds.
According to the weather bureau's latest district-wise forecast, Mumbai is expected to experience heavy to very heavy rainfall at isolated to a few places through Friday, with a brief respite on Tuesday, when the city moves to a yellow alert for thunderstorms and gusty winds reaching up to 40 kmph
For Monday and Wednesday, the IMD has predicted heavy to very heavy rainfall at isolated to a few places, thunderstorms with lightning and gusty winds, while heavy to very heavy rainfall at a few places on Thursday and Friday.
The department has issued a red alert for the neighbouring Palghar district for Monday, warning of extremely heavy showers and thunderstorms, and an orange alert for Raigad for five days. PTI
According to the weather bureau's latest district-wise forecast, Mumbai is expected to experience heavy to very heavy rainfall at isolated to a few places through Friday, with a brief respite on Tuesday, when the city moves to a yellow alert for thunderstorms and gusty winds reaching up to 40 kmph
For Monday and Wednesday, the IMD has predicted heavy to very heavy rainfall at isolated to a few places, thunderstorms with lightning and gusty winds, while heavy to very heavy rainfall at a few places on Thursday and Friday.
The department has issued a red alert for the neighbouring Palghar district for Monday, warning of extremely heavy showers and thunderstorms, and an orange alert for Raigad for five days. PTI",1.0
"Heavy Rain Hits Mumbai, Yellow Alert Issued - Mumbai Live",https://news.google.com/rss/articles/CBMilAFBVV95cUxOallwTHpVdmk1TjB5OFlEdlpaZkRpd1JYaElqRnhTRndsR011RzNkRm1jZ3VLRmZYUHljZ2x2TXlGSG1ybzQ0cEc3eE5hOHJnVlo2YVBFZkM5RWdZLVRfUzk5a0xCUnBzWXd3S3FBUG1GVVhqV1BYODJfT0JYcDhTSG9TX09IcnQ3dVBPaEpVUnlnTTFo0gGaAUFVX3lxTE5QNkFBYTZySlZ4eDJ0c3lPRHZ0SzgyUGl6cjJyVEJlTUxobDdxQXNkVV9XQ2VweC15YjBwT203am1GR3FYc21EcEtaX182dUk1dzdELUlBTC1lMUNfWjBPYlRmcVRkeFc1eVJ1bU9SZ24yZ3dMT0ZoZ0RyMjNUQkFSMkQ2Q3hGUmdCV2xubVlRbjdHVTJUcmY2S2c?oc=5,Mumbai Live,2026-06-29T10:18:44+05:30,en,Assam,,"(""heat advisory"" OR ""heat action plan"" OR ""heat alert"" OR ""IMD warning"" OR ""IMD alert"" OR ""red alert"" OR ""orange alert"" OR ""yellow alert"" OR ""NDMA advisory"" OR ""cooling shelter"" OR ""relief measures"" OR ""heat compensation"" OR ""severe weather warning"") Assam","Advertisement
The IMD has advised residents to remain cautious, avoid unnecessary travel during periods of intense rainfall, and stay updated with official weather advisories
Mumbai and its suburbs witnessed heavy rainfall on Monday, leading to waterlogging in several low-lying areas and slowing traffic during the morning rush hour. The India Meteorological Department (IMD) has issued a Yellow Alert for Mumbai, forecasting more spells of moderate to heavy rain over the next 24 hours.
Several suburban areas received intense rainfall overnight, causing water to accumulate on roads and disrupting the movement of vehicles. Civic authorities deployed teams to clear waterlogged stretches and monitor flood-prone locations.
Local train services continued to operate, although commuters experienced delays due to the heavy rain and reduced visibility in some areas. Bus services were also affected by traffic congestion caused by waterlogging.
The IMD has advised residents to remain cautious, avoid unnecessary travel during periods of intense rainfall, and stay updated with official weather advisories. The weather department has warned that isolated heavy showers, accompanied by gusty winds, are likely across Mumbai and adjoining districts.
Authorities have urged citizens living in low-lying areas to be alert as intermittent heavy rain may continue throughout the day. Emergency response teams remain on standby to deal with any rain-related incidents.
RELATED TOPICS
Latest News
MumbaiLive would like to send you latest news updates",0.8333333333333333
Nick's Sunday night forecast: heat advisory begins Monday - WTVA,https://news.google.com/rss/articles/CBMimgFBVV95cUxON2FjTDVOV1c4S3NMQl9VZ2xtLV9xQlVHN2tQTUhLeWhPWEV2Um95eFo3NHZXdGpEOGZZd3lqSVNQRFZJcFdadnhubFB0blVQZVEzX2hyZGQxYkFoa1BVc0FHTkFET3llNVJSSm9ncEpSY284VjNJRWlPTE9FNWVydklTSVRXVFRRa25mSjJfOFBiMzRJdHgtY2NR?oc=5,WTVA,2026-06-29T09:01:00+05:30,en,Assam,,"(""heat advisory"" OR ""heat action plan"" OR ""heat alert"" OR ""IMD warning"" OR ""IMD alert"" OR ""red alert"" OR ""orange alert"" OR ""yellow alert"" OR ""NDMA advisory"" OR ""cooling shelter"" OR ""relief measures"" OR ""heat compensation"" OR ""severe weather warning"") Assam","Updated: 2 hours ago
Updated: Jun. 27, 2026 at 11:30 PM EDT
Sunday will be the beginning of a dangerous heat wave that will last the entire week.
Updated: Jun. 27, 2026 at 7:32 PM EDT
Updated: Jun. 26, 2026 at 11:49 PM EDT
Warm weekend with mostly dry conditions.
Updated: Jun. 26, 2026 at 6:33 PM EDT
The weekend will be hot and humid so stay cool.",1.0
🚨Heat Advisory: Very hot again this afternoon - WCTV,https://news.google.com/rss/articles/CBMiiwFBVV95cUxPVzRsYnAyVGFZNy1Pbk5mbS03OU1SRHFoRDhfNkhwWktXN2pwdFd6WHZFcUJRMmk4U2tQaFF1XzExZVRIZU9nUElqOWFrSDNLTV85emMwOVFvN1VpbDFMdmhXQ2ZHdGRvM2RUa2tTcG8xNFZkYWh5b0ZtUVBKaVdyTmoxVldfNjN3NmZj?oc=5,WCTV,2026-06-29T16:15:00+05:30,en,Assam,,"(""heat advisory"" OR ""heat action plan"" OR ""heat alert"" OR ""IMD warning"" OR ""IMD alert"" OR ""red alert"" OR ""orange alert"" OR ""yellow alert"" OR ""NDMA advisory"" OR ""cooling shelter"" OR ""relief measures"" OR ""heat compensation"" OR ""severe weather warning"") Assam","Updated: 2 hours ago
Dangerous heat this afternoon as highs approach 100.
Updated: 16 hours ago
Recording of WCTV's 6 p.m. weekend show.
Updated: 16 hours ago
Recording of WCTV's 6 p.m. weekend show.
Updated: 16 hours ago
Early summer sizzle is underway 🥵
Updated: Jun. 28, 2026 at 7:55 AM EDT
Extreme heat is here to stay for the weekend and the upcoming holiday week.",1.0
Heat Advisory in place for Monday beginning at noon - News4JAX,https://news.google.com/rss/articles/CBMipAFBVV95cUxQM2U1VDNiS0l1MU81NE5oNTB6ZDFEMGdXQkttQUltWGtxaksxMEhQV1ZxWFdLOUlVbHBsMXAyOWdFYXl0UF9PNm1pR2FnUHd3dnp5dnRKcTh2a0NCWjFwNmlRa3ZQTnVWSWVhWmVLcGc2NVIwZWs0ekJnOVFkRlZEM1hiY2tEUWZObVhzQUVtXzNNcU83UXBYLUxDZHBhakZmbnlDWQ?oc=5,News4JAX,2026-06-29T14:53:43+05:30,en,Assam,,"(""heat advisory"" OR ""heat action plan"" OR ""heat alert"" OR ""IMD warning"" OR ""IMD alert"" OR ""red alert"" OR ""orange alert"" OR ""yellow alert"" OR ""NDMA advisory"" OR ""cooling shelter"" OR ""relief measures"" OR ""heat compensation"" OR ""severe weather warning"") Assam","WEATHERHeat Advisory in place for Monday beginning at noonPublished: June 29, 2026 at 5:23 AMHeat Advisory in place for Monday beginning at noon
No description availableJSO searching for shooter after man found dead on playground at apartment complex Read full article: JSO searching for shooter after man found dead on playground at apartment complex
No description available1 dead, 1 critical after double shooting during large gathering: JSORead full article: 1 dead, 1 critical after double shooting during large gathering: JSO
No description availableThis Jacksonville-based musician balances talent, personality to make songs that serve their purposeRead full article: This Jacksonville-based musician balances talent, personality to make songs that serve their purpose
No description availableFamily lay to rest Savannah, Edwin Barber after Jacksonville triple stabbingRead full article: Family lay to rest Savannah, Edwin Barber after Jacksonville triple stabbing
No description available2 days agoClay County mom says arrested wrestling coach made her uneasy with his camera at matchesRead full article: Clay County mom says arrested wrestling coach made her uneasy with his camera at matches
No description available2 days agoNearly all Clay County deputies equipped with bodycams after staffing priorities, tech issuesRead full article: Nearly all Clay County deputies equipped with bodycams after staffing priorities, tech issues
No description available2 days agoMedia attorney questions redactions in Kevin Carrico text messages regarding JEA board appointmentRead full article: Media attorney questions redactions in Kevin Carrico text messages regarding JEA board appointment
No description available2 days agoUnredacted texts show Carrico discussed potential JEA land deal with Boys & Girls ClubsRead full article: Unredacted texts show Carrico discussed potential JEA land deal with Boys & Girls Clubs
No description available2 days agoJoy Purdy learns how the Clay County Sheriff's Office's bodycam system worksRead full article: Joy Purdy learns how the Clay County Sheriff's Office's bodycam system works
No description available2 days agoExtended interview with Clay County Sheriff Michelle Cook on bodycam updatesRead full article: Extended interview with Clay County Sheriff Michelle Cook on bodycam updates
No description available2 days agoDeSantis vetoes new e-bike rules, citing concerns over ‘enhanced surveillance by local governments’Read full article: DeSantis vetoes new e-bike rules, citing concerns over ‘enhanced surveillance by local governments’
No description available2 days agoFriday is National Food Truck Day. Here's why you should supportRead full article: Friday is National Food Truck Day. Here's why you should support",0.8333333333333333
The AI boom is colliding with a new threat: severe weather - CNBC,https://news.google.com/rss/articles/CBMiigFBVV95cUxPVnp4aVAteERtY051Uk45TUhZbUZFT0loMmFkMDZuOTAxdEFtRUY0VzNxdk54QU9YbXNoVzJkcTk1NHQxU3B4RzkwUWtXdk5pZmpYQ2V6ZXREdHd0ZC1HcVRkZG9NdjdhTThzQjdnc3hXSnZHektFbUY2Mi1xN1IxWlR2QXVtMDctTHfSAY8BQVVfeXFMUDJzNDI3Mzc0WWhGVWZlcUJsRXg4eGtMQlZFX2pobTREdXJGMC1fWUM5VVBYRXEteEhWY3ZOdl9BcURHcENPM3QzOXdCclF1WndUQVRFMlI4Q01RZjFBdDAxaGtEZDFtYXVsM21RdHVwNmhidkE5ZzhRVlhWVVlYR1FqX0xlcmtvNkg5ZEp5bzA?oc=5,CNBC,2026-06-29T10:30:01+05:30,en,Assam,,"(heatwave OR ""heat wave"" OR ""severe heatwave"" OR ""extreme heat"" OR ""heat spell"" OR ""scorching heat"" OR ""blistering heat"" OR ""sweltering heat"" OR ""hot winds"" OR loo OR ""hot loo winds"" OR ""intense heat"" OR ""unbearable heat"" OR ""deadly heat"" OR heat OR ""weather forecast"" OR ""weather update"" OR ""weather alert"" OR ""IMD forecast"" OR ""IMD prediction"" OR ""IMD alert"" OR IMD OR ""rising temperatures"" OR ""temperatures expected to rise"" OR ""relief from heat"" OR ""respite from heat"" OR ""heat respite"" OR ""respite from scorching heat"") Assam","It's not just the data center that could be impacted by extreme heat.
- Extreme heat and severe weather is putting already hot AI data centers under pressure.
- Severe weather has become the leading cause of loss in Zurich's U.S. data center builders' risk portfolio.
- Data center operators are racing to future-proof their designs to mitigate against risks and improve efficiencies.",0.4833333333333333
Intense heat & high humidity all week - KCTV,https://news.google.com/rss/articles/CBMigAFBVV95cUxQWDh2SUNFVVdFdXZidDV0VDFtXzJPWnpzQllwRHNMTGVRUk05TjlPUU4tTUF0LUNjV0QtVU1wQmtfY3JsSzhiTGNKejVueGxZeEFUYzFFYjJzQlU4b0NUcERnb0MxY1FENDFFc0RvaC02NFJISmtSUkkxSVJaWTZPQw?oc=5,KCTV,2026-06-29T16:50:00+05:30,en,Assam,,"(heatwave OR ""heat wave"" OR ""severe heatwave"" OR ""extreme heat"" OR ""heat spell"" OR ""scorching heat"" OR ""blistering heat"" OR ""sweltering heat"" OR ""hot winds"" OR loo OR ""hot loo winds"" OR ""intense heat"" OR ""unbearable heat"" OR ""deadly heat"" OR heat OR ""weather forecast"" OR ""weather update"" OR ""weather alert"" OR ""IMD forecast"" OR ""IMD prediction"" OR ""IMD alert"" OR IMD OR ""rising temperatures"" OR ""temperatures expected to rise"" OR ""relief from heat"" OR ""respite from heat"" OR ""heat respite"" OR ""respite from scorching heat"") Assam","Plan on rain at times this afternoon and evening. We'll likely catch lulls and mix in dry hours between showers, but waves of rain with occasional brief downpours are likely. We will likely get most events in today, but they will be damp, and quick delays may occur.
Plan on rain at times this afternoon and evening. We likely catch lulls and mix in dry hours between the showers, but waves of rain with occasional brief downpours are a likely outcome. We will likely get most events in today, but they will be damp and quick delays may occur.",0.6833333333333333
Heat advisory in effect for Sangamon County June 29-July 3 | Video - The State Journal-Register,https://news.google.com/rss/articles/CBMiwgFBVV95cUxOUGVyS3J1bnhWOW52c1JtbUZEcU53RWlsM3BRMUJLRGhPV2t6M0VyUTBiMTdMZ0JHTG5WNVlTenRWOGFaWjJ1ZEVtYk1KV3VCTG94MkRRNTFhNkxlZlhDYnAxbGtsRy1RU0ZxcnVsbkRUSXN4YVF1QUhXWl84OUFlRm5jZGJUS0N6SzFHNFlYSXMteGt2cEpWaEEyRUlrRzJqaERQOFBfX2FmRTRuU0JydnEwdTg0NzBlQjdtUGlMLXUwdw?oc=5,The State Journal-Register,2026-06-29T14:52:57+05:30,en,Assam,,"(""heat advisory"" OR ""heat action plan"" OR ""heat alert"" OR ""IMD warning"" OR ""IMD alert"" OR ""red alert"" OR ""orange alert"" OR ""yellow alert"" OR ""NDMA advisory"" OR ""cooling shelter"" OR ""relief measures"" OR ""heat compensation"" OR ""severe weather warning"") Assam","Heat advisory in effect for Sangamon County June 29-July 3 | Video
The National Weather Service cautioned that heat indices could top 105 degrees.",0.8333333333333333
"Rain alert: Heavy monsoon downpour over Northeast, North to sizzle in heat - India Today",https://news.google.com/rss/articles/CBMi1wFBVV95cUxOU3hmOW9STldfaWdRUDZNYkJYNkNtdlh5Rm9INDhZWnpHM1ctSk0zSG1ieEk2NzhEMmF4UlpIRklJTmI2TXBjLVdXRlJnLVRIYW11eTBBZTVpODJCQWdTdGNBOERySmZ6eE02N2pjTjhTdDV4VC1DdDR1S2UtbGs0c1ZMZXAzREYwcHVlVC0wNlhPRldQX2tPbkVPVGFsdGlaUFlienB4Ylc1d3Vpa1ROcmxHcWw3Mmw0dnVuUlVuNjljakhubnZOVU9lN3NKYVByNGtobDNHY9IB3AFBVV95cUxQNUQ5MkVEY1VfS3pRTW9NTGdXTm4zX1FaTkhKOU85Q1V3UFJrMVJwT0VLQzFvdldQT2JQX2s1SzRxQWg0eWxrLVNnRDJ6ZzNWNHl3VXEwSERxbUppMDloRUtFdjUtUWJkRl9IenplNDFxRHBGbkVnZTVHaUtoUzU1WTJmbzFKWXhuMWRWay1GSWFBV1lxTEtHRVFKZERzOGtPcElRcmd5RWdkMTFlUjFYOXMtSTF4LTNQbERyaUxIUWszVGVwTm0xbEFpamcxUDFIRXRFQm1hendwTVps?oc=5,India Today,2026-06-29T16:35:07+05:30,en,Assam,,"""heatwave"" Assam","Rain alert: Heavy monsoon downpour over Northeast, North to sizzle in heat
As monsoon arrives in some parts of India, others are forecast to face heatwaves as signs of seasonal transition are beginning to show.
India is set to witness two sharply contrasting weather patterns over the next few days, with the India Meteorological Department (IMD) forecasting heavy to extremely heavy monsoon rainfall across the Northeast even as heatwave conditions continue to grip parts of northern India.
According to the IMD, heavy to very heavy rainfall is likely over Northeast India and Sub-Himalayan West Bengal and Sikkim over the next five days.
Isolated places in Assam, Meghalaya and Sikkim are expected to receive extremely heavy rainfall, raising the risk of flooding, waterlogging and landslides, particularly in vulnerable hilly regions.
The weather office also said conditions remain favourable for the southwest monsoon to advance further into parts of Gujarat, Madhya Pradesh, Chhattisgarh, Jharkhand, Bihar, Uttar Pradesh and Uttarakhand over the next two days, signalling the monsoon's further progress.
NORTH INDIA CONTINUES TO BATTLE HEAT
While monsoon rains intensify elsewhere, much of North India continues to face unusually high temperatures.
The IMD has warned of heatwave to severe heatwave conditions over Uttar Pradesh and adjoining areas during the next two days.
Heatwave conditions are also likely over Delhi, Haryana and Chandigarh on June 29 and 30.
The warning comes after maximum temperatures climbed to 40-43°C across several parts of Uttar Pradesh, Haryana, Bihar and neighbouring states in recent days.
For Delhi-NCR, the IMD has forecast maximum temperatures of 41-43°C on Monday, June 29, along with the possibility of very light to light rain, thunderstorms, dust storms and gusty winds during the afternoon and evening.
Rainfall activity is expected to increase from June 30 onwards, with temperatures gradually falling to 39-41°C on June 30, 36-38°C on July 1 and 34-36°C by July 2 as monsoon conditions strengthen over the region.
The IMD also warned that heavy rain could trigger localised flooding, waterlogging, traffic disruptions, reduced visibility and landslides in susceptible areas.
Thunderstorms accompanied by lightning and gusty winds may also damage trees, power lines and vulnerable structures.
The weather agency has also warned fishermen to not venture into parts of the Arabian Sea and Bay of Bengal because of rough sea conditions.
The latest IMD forecast has made it apparent that the seasonal transition is now underway across northern India, with the advancing southwest monsoon expected to bring relief from prolonged heat.",0.8500000000000001
Assam's Hargila Conservation Efforts Gain National Recognition - Devdiscourse,https://news.google.com/rss/articles/CBMivAFBVV95cUxPODRWa0tMTjZCU2JMYk9XdkpHemlVY3ZSYlh3RjRpWnd5UkdpRHlBY0tDdGZ4VXVZNk9rUDVSdjZVbzc1ZkdxV0hLM1VaTldpMUFxSy1nUEJsdGJrNkpaTy1VZ3RCeHhtczRLbC12ZS1CUDdIT19mRnNJdEpENlgzUmE0QmhPczI4UGg2dWE2SVJ1aWxjU3FFYjRZTXp0ZEgtTVlEVmRBbG1xd2ZHV1ctckRnMXhBQlQtZmJVSdIBvAFBVV95cUxPODRWa0tMTjZCU2JMYk9XdkpHemlVY3ZSYlh3RjRpWnd5UkdpRHlBY0tDdGZ4VXVZNk9rUDVSdjZVbzc1ZkdxV0hLM1VaTldpMUFxSy1nUEJsdGJrNkpaTy1VZ3RCeHhtczRLbC12ZS1CUDdIT19mRnNJdEpENlgzUmE0QmhPczI4UGg2dWE2SVJ1aWxjU3FFYjRZTXp0ZEgtTVlEVmRBbG1xd2ZHV1ctckRnMXhBQlQtZmJVSQ?oc=5,Devdiscourse,2026-06-29T15:06:05+05:30,en,Assam,,"""heatwave"" Assam","Devdiscourse News Desk | India
Assam's Forest Minister Jayanta Mallabaruah held a pivotal meeting with internationally acclaimed wildlife conservationist Dr. Purnima Devi Barman on Monday. They discussed current and future initiatives for the conservation of the endangered Greater Adjutant Stork, a species that has benefited immensely from Dr. Barman's dedicated efforts.
The meeting followed praise from Prime Minister Narendra Modi, who lauded Dr. Barman's work during his Mann Ki Baat program. Modi highlighted her role in transforming traditional views on the Hargila, breaking superstitions, and enhancing the bird's public image through community engagement.
Dr. Barman expressed gratitude for this national recognition, thanking both the Prime Minister and the Assam Forest Minister for their support. She reiterated the community's ongoing challenges and presented new strategies to bolster conservation efforts. Minister Mallabaruah pledged that the department would review these suggestions and highlighted the state's growing influence in global conservation as evidenced by Dr. Barman's achievements.
(With inputs from agencies.)
{{#source}}{{source}}
{{/source}}{{#isBlog}}
{{disclaimer}}
{{/disclaimer}}",0.0
Britain Boosts Defense Tech with £580 Million Investment - Devdiscourse,https://news.google.com/rss/articles/CBMiwgFBVV95cUxOYWhhdkxDRThHWUlEMGRuQjdydU9TaWlIQlhOdXNCc21WWElUY0RwYVg3X0RMa0NCbTZNR2x3UmlCbmE0TE8xUU1JdnpxSDlHQ1dpdVJFZ0pVTmJGU0ZTQVFOdVlEYzNFSFVGMk5zdTdXdW9rQ24wblo4d25mVDZBRWNtNk5aNFlQdGlqcTU2QlAzTVluNGRwcW9jVUtQTzN6R3l4UmJNLVlLLXc2Z1JOeEQya3Fzb2k1Z09HTWpOWlpYd9IBwgFBVV95cUxOYWhhdkxDRThHWUlEMGRuQjdydU9TaWlIQlhOdXNCc21WWElUY0RwYVg3X0RMa0NCbTZNR2x3UmlCbmE0TE8xUU1JdnpxSDlHQ1dpdVJFZ0pVTmJGU0ZTQVFOdVlEYzNFSFVGMk5zdTdXdW9rQ24wblo4d25mVDZBRWNtNk5aNFlQdGlqcTU2QlAzTVluNGRwcW9jVUtQTzN6R3l4UmJNLVlLLXc2Z1JOeEQya3Fzb2k1Z09HTWpOWlpYdw?oc=5,Devdiscourse,2026-06-29T13:40:39+05:30,en,Assam,,"""heatwave"" Assam","Devdiscourse News Desk | Britain Will Invest Million In Its Defence Science And Technology Laboratory
The UK government has announced a significant £580 million investment in its Defence Science and Technology Laboratory. This facility plays a crucial role in addressing biological threats, advancing artificial intelligence, and enhancing underwater systems.
The recently unveiled Defence Investment Plan underscores the importance of technological advancements in national security.
According to the government statement, a new laboratory is slated to be constructed in Porton Down, solidifying its strategic position in protecting the nation.
(With inputs from agencies.)
{{#source}}{{source}}
{{/source}}{{#isBlog}}
{{disclaimer}}
{{/disclaimer}}",0.0
