title,url,source,date,language,state,district,search_term,full_text,relevance_score
India Weather: North Heatwave and East Rains Impact Sectors - Whalesbook,https://news.google.com/rss/articles/CBMiyAFBVV95cUxNTzZFRWJXUFV5VUFSWklMcUt4eTF2cVVjcjFGMnhFcVg0TnJLdXhTR01STkFhLXl5enUyYmdHcGN4MldzbUZtYmR3a2o1SWxlVXNKWUNhQkc4SUR2eTU2c0RyOU9mb2R0am1tX00zTFZxUmlKbG5tSF80LXZKekZOcW8zQXU0dWRIYko4Z2hZdnBTRWE0ZDNvTTlGci02Z3V2eUh0M1M3LVcwWTdCVi1saU5hcFdRNE5Zcnp1SzROSXUyaHBCZHBDUA?oc=5,Whalesbook,2026-06-29T15:36:03+05:30,en,Assam,,"""heatwave"" Assam","India faces a split weather crisis as northern states endure heatwaves while the northeast and coast battle heavy rainfall. This climate divergence affects electricity demand, agricultural output, and logistics efficiency, potentially influencing food inflation and regional economic activity.
What Happened
India is experiencing a sharp contrast in weather patterns. Northern states, including Delhi-NCR, Haryana, Rajasthan, Uttar Pradesh, and Bihar, are suffering from a severe heatwave with temperatures nearing 41 degrees Celsius. The monsoon arrival in Delhi has been delayed, now expected between July 2 and July 8. Meanwhile, the northeastern and coastal states are facing heavy to extremely heavy rainfall, with the India Meteorological Department (IMD) issuing red and orange alerts for regions including Assam, Meghalaya, and parts of the Konkan coast due to the threat of flash floods and landslides.
Agriculture and Food Inflation Risks
The dual weather stress poses risks to the agricultural sector. In the North, prolonged high temperatures can lead to heat stress for standing crops, potentially affecting yields. Conversely, excessive rainfall in the Northeast and coastal regions may cause waterlogging, disrupt harvesting, and delay sowing for the Kharif season. For investors, these conditions serve as a monitorable for food inflation trends. Significant damage to crops in these regions can lead to supply chain disruptions, impacting the pricing of essential commodities like vegetables and grains, which often influences broader inflation data tracked by the Reserve Bank of India (RBI).
The Power Demand Equation
Heatwave conditions in northern India typically correlate with a spike in power consumption. As residential and commercial sectors increase the use of cooling appliances like air conditioners and refrigerators to manage the extreme heat, electricity demand surges. This often leads to higher revenue visibility for power distribution companies and generators during peak summer months. However, the impact on profit margins depends on their ability to manage fuel costs and the availability of power supply to meet this heightened demand. Investors may monitor power sector demand data to gauge how companies are performing during these peak usage periods.
Logistics and Supply Chain Pressures
In the Northeast and coastal areas, the IMD’s warnings regarding flash floods and landslides highlight potential risks for logistics and infrastructure firms. Heavy rainfall and waterlogging can cause significant delays in the movement of goods, damaging road and rail connectivity. For companies involved in manufacturing, retail, or supply chain management in these regions, such weather events can lead to operational delays and increased transportation costs. These factors can temporarily affect inventory turnover and project execution timelines for companies operating in the affected states.
What Investors Should Track Next
The primary monitorable for investors is the progression of the monsoon. A uniform and timely distribution of rain is crucial for agricultural recovery and stabilizing food prices. Additionally, investors may look out for management commentary from companies in the power, consumer goods, and logistics sectors regarding any weather-induced operational disruptions or changes in demand patterns. The IMD’s periodic updates on temperature and rainfall distribution will remain key to understanding how these weather conditions may shape economic performance in the coming quarter.",1.0
"Varanasi heatwave: Ganga water level drops, experts warn of deeper causes - Mathrubhumi English",https://news.google.com/rss/articles/CBMiygFBVV95cUxPN1FlbGRDdnNtT0tnWEUwSWVpMjVHdFR2cTVXaW1HY1J0SWJVSTFhbk4tSGxuMkFYbm0wM1BwSzBnTkNGTFd6UDRuUjVTd2VKR3pWVUh4cXlkMHh6MjlwMHNEZURzTEwzUWVSS1JhbldhMklTTzRyOUdEa0wxY2tVOUpLczNVRFdHN0dMWGhDUV9qYzAzbWN2NHp2cEZfYkZEcEIzMnZOYVFMSVhaRTRZd1NQeEpmUHlZaXlVZExBWFl1N0FvMjJWWUVB0gHPAUFVX3lxTE5TSUk4cTVuNHNfVEZEdUxBcVpXN2NWX0pNckYxSnpLVDJmYVB6NzZaQXJCY2lrSVplT3ZJZU5vZEY5LW1KbkJUTDJwUGw4VzhSQlhoMk8wU08zZE1fVV8yZXJrVHFsRWlFOFY0am1HVE9iWGlfX19yN0psXzlicF8zcDVYT1k0VURKR0Z0TTRkeEpGN0c1ZzZwVzMxWjhFN0JwYTFPaHgzbVBESlJXNWM5d0lUeU1XTTlMLTNSN0hGVWtKS3J2SU5QTzhnV2M1dw?oc=5,Mathrubhumi English,2026-06-29T16:24:27+05:30,en,Assam,,"""heatwave"" Assam","Heatwave and reduced water flow expose sandbanks at Varanasi ghats as experts warn multiple factors are lowering Ganga levels.
Varanasi’s famous ghats are witnessing a striking transformation as falling water levels in the Ganga River expose broad stretches of sand and leave parts of the riverfront without their usual flow. Amid intense summer heat conditions, many locals dependent on the river say the change has become increasingly visible.
However, experts caution that rising temperatures alone do not explain the situation. According to river expert B D Tripathi, reduced water release from dams in Uttarakhand and diversion of river water through irrigation canals are also contributing factors.",0.8500000000000001
