title,url,source,date,language,state,district,search_term,full_text,relevance_score
Heatwave alert in Karnataka as temperatures rise across state - Udayavani,https://news.google.com/rss/articles/CBMinwFBVV95cUxOQ3FDRjRLN0lndWRvNm4wWkpkMEtONUxaTUd0OUUzVS16Z1BPLVRpNi1QckpEY3dRSEtHa1lkV2RtaWZqWGM2Y2lXeUhpM2xvTWQwc2xxeXpiS21DVnp6czVSV0lQcC1Ec28wU0p0SlF5dGhxSkQyc0hWZlUyV21BdjdJelY2SVhjMWwteVNGQ1BoN20taDB2Wk0yQnVaN2c?oc=5,Udayavani,2026-04-15T05:59:22+05:30,en,Karnataka,,"(heatwave OR ""heat wave"" OR ""severe heatwave"" OR ""extreme heat"" OR ""heat spell"" OR ""scorching heat"" OR ""blistering heat"" OR ""sweltering heat"" OR ""hot winds"" OR loo OR ""hot loo winds"" OR ""intense heat"" OR ""unbearable heat"" OR ""deadly heat"" OR heat OR ""weather forecast"" OR ""weather update"" OR ""weather alert"" OR ""IMD forecast"" OR ""IMD prediction"" OR ""IMD alert"" OR IMD OR ""rising temperatures"" OR ""temperatures expected to rise"" OR ""relief from heat"" OR ""respite from heat"" OR ""heat respite"" OR ""respite from scorching heat"") Karnataka","Mangaluru: 85 percent of boats anchored
Koolur bridge girders ready, completion before monsoon uncertain
CCTV cameras needed at Besant Junction amid rising traffic concerns
Kali lake becomes a life saver for Polali
Plastic menace in Karkala: Waste piles found around historic Chaturmukha Basadi
PM Modi appeals to people to take nine pledges on health, conservation of nature, service, others
CM Siddaramaiah warmly receives PM Modi in Bengaluru
Supreme Court stays Telangana HC’s transit anticipatory bail to Congress leader Pawan Khera in Assam case",0.5166666666666666
