title,url,source,date,language,state,district,search_term,full_text,relevance_score
"Gujarat Weather Today: ગરમીનો પારો 3થી 5 ડિગ્રી સુધી વધશે, ચાર જિલ્લામાં માવઠાની શક્યતા, જાણો કયા શહેરમાં કેટલું રહ્યું મહત્તમ તાપમાન - Gujarat Weather: Temperature May Rise by 3–5 C, Heatwave Alert Iss - Gujarati Jagran",https://news.google.com/rss/articles/CBMiwAFBVV95cUxPTm9DYlhpdTJfX1BnZk5HR0RjZHdSejZ1TjRVX1hCMnFrWm1FLUVMSFRtQ0N6cjNSaDFCcGN5dkNOYkZiUFkwNEFSdFJlTWVjbWpqaUxPaVNIS0ZyMnA1eWpHZ2dlOXF0elhWaVZnSDVGbDNlUFVpclZrenh6cUJXelRncFdfUUtJM3h6UVY3aGhjVms3Q21WVmxGNEY2SjdCNm1Qd1VlVmJXaXVjbjRGUVA2N21zbnMxbmhLZjY1bWI?oc=5,Gujarati Jagran,2026-03-20T20:09:00+05:30,gu,Gujarat,,"(તાપમાન OR ""તાપમાન વધ્યું"" OR ""પારો ચઢ્યો"" OR ""ડિગ્રી સેલ્સિયસ"" OR ""મહત્તમ તાપમાન"" OR ""વિક્રમી તાપમાન"") Gujarat","Gujarat Weather: ગુજરાતના વાતાવરણમાં પલટો આવતા રાજ્યના મોટાભાગના વિસ્તારોમાં કમોસમી વરસાદ થયો હતો. વાવાઝોડા સાથે વરસાદ વરસતા ખેડૂતોના ઉભા પાકને નુકસાન પહોંચ્યું છે. માવઠાના કારણે રાજ્યમાં તાપમાનનો પારો નીચો ગયો હતો જોકે આવતીકાલથી ચાર દિવસ સુધી મહત્તમ અને લઘુત્તમ તાપમાન ઉંચાકતા ગરમીમાં વધારો થઇ શકે છે. તેમજ આવતીકાલે ચાર જિલ્લામાં માવઠાની શક્યતા વ્યક્ત કરવામાં આવી છે. અમદાવાદમાં મહત્તમ તાપમાન 31.4 ડિગ્રી અને લઘુત્તમ તાપમાન 18.5 ડિગ્રી નોંધાયું છે.
હવામાન વિભાગની શું છે આગાહી
હવામાન વિભાગની આગાહી અનુસાર, આગામી ત્રણ દિવસ દરમિયાન મહત્તમ તાપમાન 3થી 5 ડિગ્રી સુધી મહત્તમ તાપમાન વધી શકે છે. જ્યારે આગામી ચાર દિવસ દરમિયાન લઘુત્તમ તાપમાન 2થી 3 ડિગ્રી વધી શકે છે. ત્યારબાદ તાપમાનમાં કોઇ મોટો ફેરફાર જોવા મળશે નહીં. એટલે કે આવતીકાલથી ફરી ગરમીનો પારો ઉંચકાઇ શકે છે અને ગરમીનું પ્રમાણ વધી શકે છે.
કયા શહેરમાં કેટલું રહ્યું મહત્તમ તાપમાન
આજે નોંધાયેલા મહત્તમ તાપમાનની વાત કરીએ કંડલા પોર્ટમાં 34.2 ડિગ્રી, રાજકોટમાં 33.9, કેશોદમાં 32.3, વડોદરામાં 32.2, અમરેલીમાં 32.1, સુરતમાં 32, ભુજમાં 32, પોરબંદરમાં 31.9, મહુવામાં 31.6, અમદાવાદમાં 31.4, ગાંધીનગરમાં 31, નલિયામાં 31, ભાવનગરમાં 30.9, ડીસામાં 30.6, વલ્લભ વિદ્યાનગરમાં 30.5, વેરાવળમાં 30.2, ઓખામાં 29, દ્વારકામાં 28.2 ડિગ્રી મહત્તમ તાપમાન નોંધાયું હતું.
કયા શહેરમાં કેટલું રહ્યું લઘુત્તમ તાપમાન
આજે નોંધાયેલા લઘુત્તમ તાપમાનની વાત કરીએ તો અમરેલીમાં 16.6 ડિગ્રી, ડીસામાં 17.5, રાજકોટમાં 17.6, ગાંધીનગરમાં 17.6, નલિયામાં 17.8, વલ્લભ વિદ્યાનગરમાં 17.8, મહુવામાં 18.1, ભુજમાં 18.2, સુરેન્દ્રનગરમાં 18.3, અમદાવાદમાં 18.5, વડોદરામાં 18.6, પોરબંદરમાં 18.6, ભાવનગરમાં 19, કંડલા પોર્ટમાં 19.4, કેશોદમાં 19.6, સુરતમાં 20, ઓખામાં 20.5, વેરાવળમાં 21.1, દ્વારકામાં 21.2 ડિગ્રી લઘુત્તમ તાપમાન નોંધાયું હતું.",1.0
