title,url,source,date,language,state,district,search_term,full_text,relevance_score
Heatwave Kills 20 Lakh Poultry Birds In Godavari Districts - Deccan Chronicle,https://news.google.com/rss/articles/CBMiyAFBVV95cUxQVmxSWk5Ca0NyMUlfb000TGFDVmRKRTBabHExalJjb0VBWl9oVzFieEstWUZ2OWJtM08tQ1NMaHU1Rk9OaXhzQklTallESTc0NHU3dmJMZnJBYUlHUmJobFgtbl9MbWptWmFQaVhhU0lLQW5kYlBEQzVmV1dQRGdSdzdtbU42SE9ETWkzZW8xblg5LTVzMlhEQ2NrRkdKWWYwTUFGUWpSajlMZVBnX3hHd1FZZXZuVTJMUlpFd1luQVdEblUtV3dQUNIBzgFBVV95cUxQamt5UUpxZEYtN29ZMjVLMy1PdlBQV1FYam41T0dVQV9VME5ETnp5S2Yya29nN01oenZUTGJud1hpUTRMUjM1ZnMtTFlZZS05RHJXV05tbHBGaXBHZUZIMGROU0VTeVczcDFsSHdaRHB4M3ZwUlNjSG5tOUNhVklHQktWd00yTUFkQ1BpRWI0SkZNM1VZaFUwX0FZYk50elVBUFpIYWRuc2xQYXNqSDRuel92LUJRVUFuaFZVdWxValNZZWNUc2duX1hQUGxldw?oc=5,Deccan Chronicle,2026-05-24T22:05:32+05:30,en,Andhra Pradesh,West Godavari,"""heatwave"" Andhra Pradesh","KAKINADA: Rising temperatures in erstwhile East and West Godavari districts have badly hit the poultry sector over the past 10 days. According to those in the poultry trade, nearly 20 lakh birds, including broilers and layers, have died in the Godavari districts unable to withstand the heat.
Traders are highly disappointed, saying they have been facing continuous losses over the past seven months, early to diseases and now to heat waves.
Andhra Pradesh Poultry Federation general secretary Padala Subba Reddy said in the past, poultry birds could be insured when taken on loans from banks. However, after the bird flu disease, there is no insurance. Insurance is not available though the federation has submitted representations to the union government several times.
Subba Reddy said the poultry industry has suffered a loss of ₹50 crore during the past one week. He said even the eggs are weak, as birds are unable to feed due to heat wave conditions.
In the interim, people of Godavari districts are experiencing unbearable heat waves. There are no winds and humidity is high, making the people suffer. Vendors of sugarcane juice, lemon juice, coconut water and palm fruit are doing good business. But they are closing their business by 1 p.m., as no customers are on the roads or streets thereafter.
On Sunday evening, however, heavy winds and gales prevailed in the Godavari districts.",0.8500000000000001
