title,url,source,date,language,state,district,search_term,full_text,relevance_score
Heatwave Alert Issued To 14 Mandals In Kakinada - Deccan Chronicle,https://news.google.com/rss/articles/CBMiugFBVV95cUxPamtIN3VkcVczbEw0SUotbDBuT2ZUeFVENUhnazY5d1ZMcWZJSkNQTTJRSmk3OHBCMTMtWUdEWHc3R1E2MGJBTGl6MlVEVi1GUnZHWEozV2N1Tk9jclJWTEV5WFFuYjkyRy1nbDhQVmZscGJQUVI2MDdQZlBWeVpQVWQyWFZkYWQ5REpWVE91cHp5anBXVHRhZFZ1eDlzVkRTTVZhTUtOVmV2T0tkalJxcDdleGhIeHE4NFHSAb8BQVVfeXFMTUo4MnRGUmtVR25zMVB0ekJFV3VfLTJoN1dISzJXUVlsbHh4YWt3R0pkZEJQV2s4c1VNXy1lUzFGeWExMWdpQWZCNXd6emNCalM4bWhDcXBfRmtZUnBzOG1vbWlPWXp4TDdNRGRKTXZBdFl5UlFEU05lRW5USXZRMDNTcFpoVzVOcFpnSkV4RUlDVjBGQTR3emRRSm0teFJrQlF4aWpTOWFzblBFMDI2elRNQWdlTFZsNmZUNGNJMWc?oc=5,Deccan Chronicle,2026-04-08T02:54:37+05:30,en,Andhra Pradesh,,"(heatwave OR ""heat wave"" OR ""severe heatwave"" OR ""extreme heat"" OR ""heat spell"" OR ""scorching heat"" OR ""blistering heat"" OR ""sweltering heat"" OR ""hot winds"" OR loo OR ""hot loo winds"" OR ""intense heat"" OR ""unbearable heat"" OR ""deadly heat"" OR heat OR ""weather forecast"" OR ""weather update"" OR ""weather alert"" OR ""IMD forecast"" OR ""IMD prediction"" OR ""IMD alert"" OR IMD OR ""rising temperatures"" OR ""temperatures expected to rise"" OR ""relief from heat"" OR ""respite from heat"" OR ""heat respite"" OR ""respite from scorching heat"") Andhra Pradesh","District collector M.N. Harendhira Prasad said several mandals, including Tallarevu, Karapa, Kajuluru, Kakinada Urban, Kakinada Rural, Pithapuram, U. Kothapalli, Gollaprolu, Gandepalli, Jaggampeta, Kirlampudi, Pedapudi, Samalkot and Peddapuram, are expected to experience high temperatures.
KAKINADA: Authorities have issued a heatwave alert in Kakinada district, with temperatures likely to exceed 41°C over the next five days starting Tuesday, following a warning from the meteorological department.
District collector M.N. Harendhira Prasad said several mandals, including Tallarevu, Karapa, Kajuluru, Kakinada Urban, Kakinada Rural, Pithapuram, U. Kothapalli, Gollaprolu, Gandepalli, Jaggampeta, Kirlampudi, Pedapudi, Samalkot and Peddapuram, are expected to experience high temperatures. He urged residents to remain vigilant and take necessary precautions to avoid heat-related illnesses.",0.6833333333333333
"Andhra Pradesh, Telangana Weather LATEST Update: Rain Forecast Issued For Two Days; Heatwave to Follow Next - Asianet Newsable",https://news.google.com/rss/articles/CBMi6gFBVV95cUxOV2dTZENEbDQzNVM5M3RRdXg5X0dDYzU2SnFTNnJNaHRMRXRfWk5sbkotMW9yc3FyTDZQSXBXdExhZFBxMGJrNUJGZDEwRkcyLWRrQllUeFJoMWlJSmszblVYX2pZQWZNaUhrbTZHeUsyckZzS0hYaTVxUTJ1MXNZWENkM19VYThPOW5XLWpwcEgzdjF5cUQ5ZGREZmxSUkRBQnNXaTZqNlpDRVVLUjJPdS1EZ2duWkdWZGd5UHdUQmdXbjE2Y2RHSjhRT0oxN2lQWEllWXlzRnFWQS1EM3lRSnNPZU9WLVhIMWfSAe8BQVVfeXFMUGwzS3ZhNnAxQ3VEU2ZQMXdfUEgyd1VHdjJUSUI4LVNVS2o2aTNQbTF0TzhteVYyOWlJQjVDMkhpOTJPbDg2eUoxODBRcENHbDdZTnhma0J3UmJOSDFjMTdjY1lOUzRvd0FscEtRbjVBNzNyaUM2YjJRTFk4d0FIRmdMVW44dUxIcFZfOWpSSmhLS1FGbk0yM0dWSkhZWjl0MXZBNHR6UFlKODhKRG5xcmRwWFkzbUZQWTlkYXFwLVZnOU01VjhnODA5WEV0VkhkZDNzdWVja2daTVVVZ2pEclk3Y25teldrQW1DZGdjcE0?oc=5,Asianet Newsable,2026-04-08T08:32:17+05:30,en,Andhra Pradesh,,"(heatwave OR ""heat wave"" OR ""severe heatwave"" OR ""extreme heat"" OR ""heat spell"" OR ""scorching heat"" OR ""blistering heat"" OR ""sweltering heat"" OR ""hot winds"" OR loo OR ""hot loo winds"" OR ""intense heat"" OR ""unbearable heat"" OR ""deadly heat"" OR heat OR ""weather forecast"" OR ""weather update"" OR ""weather alert"" OR ""IMD forecast"" OR ""IMD prediction"" OR ""IMD alert"" OR IMD OR ""rising temperatures"" OR ""temperatures expected to rise"" OR ""relief from heat"" OR ""respite from heat"" OR ""heat respite"" OR ""respite from scorching heat"") Andhra Pradesh","Andhra Pradesh, Telangana Weather LATEST Update: Rain Forecast Issued For Two Days; Heatwave to Follow Next
Andhra Pradesh, Telangana Weather LATEST Update: Telangana is seeing some really strange weather right now. While some parts are burning up with heat, others are getting surprise rains. The Hyderabad Weather Centre has just put out a fresh update
Rain forecast for the next two days
The weather department predicts rain across parts of Telangana for the next two days, specifically on April 8 and 9. Officials say some areas can expect light to moderate showers. People are hoping these rains will bring some much-needed relief from the scorching heat.
Moderate rains in several districts
The weather department has listed the districts likely to get rain starting Tuesday. These include Mulugu, Jayashankar Bhupalpally, Khammam, Bhadradri Kothagudem, Nalgonda, Warangal, Mahabubabad, Siddipet, Rajanna Sircilla, and Suryapet. Officials have warned that the rainfall could be quite intense in some of these places.
Chance of gusty winds and hailstorms
Some areas might experience thunderstorms with lightning. The weather department is also warning about strong, gusty winds and even hailstorms in a few places. They have advised everyone to be careful, as there's a real risk of lightning strikes.
Precautions to take during rains
Officials are advising people to stay indoors during thunderstorms. They've specifically told farmers working in the fields to take proper precautions against lightning. They also warned everyone not to take shelter under trees during strong winds.
Heat will increase after April 10
After two days of rain, the heat is set to make a comeback. The weather centre says temperatures will start rising again from April 10. They expect the heat to increase by 2 to 3 degrees more than current levels. The elderly and children are advised to be extra careful. People stepping out in the afternoon must take necessary precautions.
Stay updated with the Breaking News Today and Latest News from across India and around the world. Get real-time updates, in-depth analysis, and comprehensive coverage of India News, World News, Indian Defence News, Kerala News, and Karnataka News. From politics to current affairs, follow every major story as it unfolds. Get real-time updates from IMDon major cities weather forecasts, including Rain alerts, Cyclonewarnings, and temperature trends. Download the Asianet News Official App from the Android Play Store and iPhone App Store for accurate and timely news updates anytime, anywhere.",0.8500000000000001
