title,url,source,date,language,state,district,search_term,full_text,relevance_score
"Champawat News: लू के लिए जिला प्रशासन अलर्ट, विभागों को दिए निर्देश - Amar Ujala",https://news.google.com/rss/articles/CBMihAJBVV95cUxOZzJxV2Q3RVp4WnBnZ20yQy1sTGRnVjBhVGJybmpwNXBiN3pCM3ZhWFNsQjREY1ZhVW5qTS1xSGRIbmVhYnlMUFNjT1ZBODMtM3BQVXpfUGFjTmlHUWdNSjVod0FaMXlLQ19jcFFVZmhGVFR3NUVPU21qNnlJdW4wZ0lOWU1xMHlNYzdJQzBzNEJpTzZtYzRPM25WczI3UGpjaEdacDBrNjUzNWZYZ0JFREhZR3JuUGpBS2d4QlROM1g2eVRHS1BIeWYzU09NMlZGemNOamlNZXhPYnRCSS0wYUlDM3BqdEMxVDNoVHpzUHFaU0RyR2V6dklYbUw0cWRMSVo3btIBigJBVV95cUxPQVJPUlZrSHg2c05ENGlta1hmWHM0ai1fTFp3bVF5T3d3bGZzbUVuYl9vSGNiQnpuU1VEYld6Q3kyOUVESnFnSC03LXVGTnVwMEN0VVZOSUlpNWwzaGpZdXdVd0xPV0l0ZjNoTmVMa0ZjbGZCYW9nOGhqSDBEY2Q3TGgxNTlqeFZwbHJDRUdPcHp4M1AzeGtUNHhGUGxud0JFSGMyeVFZQWtpZzREaW9QTGpIa3FGQ1hjSUxxYVJDemctcWpSUEkwQUtibWFnZ1MtZHlGQzBHeXl6MG9qaEc4MXo5YjUwd3NTcXZhWlVlWXJBT1pzWUpKaGtjeDRhUDRxM0ZpRHVFU0ppZw?oc=5,Amar Ujala,2026-05-02T22:57:43+05:30,hi,Uttarakhand,Champawat,"""लू"" Uttarakhand","{""_id"":""69f6340fbf197eaec00b5458"",""slug"":""district-administration-alert-for-heat-wave-instructions-given-to-departments-champawat-news-c-229-1-cpt1009-138675-2026-05-02"",""type"":""story"",""status"":""publish"",""title_hn"":""Champawat News: लू के लिए जिला प्रशासन अलर्ट, विभागों को दिए निर्देश"",""category"":{""title"":""City & states"",""title_hn"":""शहर और राज्य"",""slug"":""city-and-states""}}
Champawat News: लू के लिए जिला प्रशासन अलर्ट, विभागों को दिए निर्देश
संवाद न्यूज एजेंसी, चम्पावत
विज्ञापन
विज्ञापन
चंपावत। बढ़ते तापमान और संभावित लू को देखते हुए जिले में प्रशासन सतर्क हो गया है। डीएम मनीष कुमार ने सभी विभागों को समन्वित कार्ययोजना बनाकर प्रभावी कार्रवाई के निर्देश दिए हैं। प्रशासन की ओर से आपातकालीन सहायता नंबर भी जारी किए गए हैं।
नगर पालिका और पेयजल विभाग को सार्वजनिक स्थलों पर पेयजल की व्यवस्था सुनिश्चित करने के निर्देश दिए। स्वास्थ्य विभाग को दवाओं का पर्याप्त भंडारण और क्विक मेडिकल टीम सक्रिय रखने को कहा गया है। शिक्षा विभाग को स्कूल समय में बदलाव और छात्रों के लिए पेयजल और छाया की व्यवस्था के निर्देश दिए गए हैं।
वनाग्नि की रोकथाम के लिए वन और अग्निशमन विभाग को अलर्ट मोड पर रहने को कहा गया है। डीएम ने निर्देशों का सख्ती से पालन सुनिश्चित करने और लापरवाही पर कार्रवाई की चेतावनी दी है। जनसुविधा, आपातकालीन सहायता के लिए जिला आपातकालीन परिचालन केंद्र के टोल फ्री नंबर 1077 और 05965-230703 को सक्रिय कर दिया गया है। उन्होंने कहा कि इसके अतिरिक्त नागरिक 78953-18895, 75790-60090 और 95281-35726 मोबाइल नंबरों पर भी संपर्क कर सकते हैं। संवाद
Trending Videos
नगर पालिका और पेयजल विभाग को सार्वजनिक स्थलों पर पेयजल की व्यवस्था सुनिश्चित करने के निर्देश दिए। स्वास्थ्य विभाग को दवाओं का पर्याप्त भंडारण और क्विक मेडिकल टीम सक्रिय रखने को कहा गया है। शिक्षा विभाग को स्कूल समय में बदलाव और छात्रों के लिए पेयजल और छाया की व्यवस्था के निर्देश दिए गए हैं।
विज्ञापन
विज्ञापन
वनाग्नि की रोकथाम के लिए वन और अग्निशमन विभाग को अलर्ट मोड पर रहने को कहा गया है। डीएम ने निर्देशों का सख्ती से पालन सुनिश्चित करने और लापरवाही पर कार्रवाई की चेतावनी दी है। जनसुविधा, आपातकालीन सहायता के लिए जिला आपातकालीन परिचालन केंद्र के टोल फ्री नंबर 1077 और 05965-230703 को सक्रिय कर दिया गया है। उन्होंने कहा कि इसके अतिरिक्त नागरिक 78953-18895, 75790-60090 और 95281-35726 मोबाइल नंबरों पर भी संपर्क कर सकते हैं। संवाद",1.0
