title,url,source,date,language,state,district,search_term,full_text,relevance_score
Rooster Finds ‘Coolest Spot’ Inside Police Lockup Amid Heatwave In Chhatarpur; SDOP Says Bird Walked In - Free Press Journal,https://news.google.com/rss/articles/CBMi6gFBVV95cUxPOVlzdkV5Q0tJcmkzUHFfWC1IMXdSZmtLZmc3VFJFUWwzbWZKSER5T0ZMOVFleVFTSjN6cFhZRmpOM3VRamhidldjN0Vxbm4tSHR3N3Ftb0JsdUFOMWJhVE9aMnhjS010eXJ4NnFDdV9wQ0l3UWYwTnJST21rckEyOURQTVVqTHVlNThWODRFRmJRTS1wZFV6VFNRN09rNkEzRE10cnhZd1dkTWtab2llYzdDdEFFRFEwZ3FiOVRLZEZHbHFacW5WVlVodnkzNFlraXJVWkRRTXAxTmhOcC1DUXBWWDAtQk01TEHSAe8BQVVfeXFMTnlKQzlQbWYtX19VejNSZlpVcWRWTXFnaUtJNklFX3lOYUc0dHhyTzV5MTluZ2lOVlh6eGxweWJkQlBSTzU5ZzU0REhLTjUwaUdHbnIxSXAteEJuNzhieXQ5SWhwaHBwY0RzNkhRZzRfMXh2RDZJbUU0SmxlYm1XUTI0RTVEZlBPcTNhNTZIQkdXZlhDUHpZOUJON2hYby1DeTdhSXpNaEZPRWdXMnZtQzBiZENFRnIxMGRfUUxQb01Md3ljOV95NmxjZURGWUY0VGhsVG4yY1d1REJxanI5UTFVZGItdmdpTHlXektGaHM?oc=5,Free Press Journal,2026-05-16T13:55:03+05:30,en,Madhya Pradesh,Chhatarpur,"heatwave (""Agar Malwa"" OR Alirajpur OR Anuppur OR Ashoknagar OR Balaghat OR Barwani OR Betul OR Bhind OR Bhopal OR Burhanpur OR Chhatarpur OR Chhindwara OR Damoh OR Datia OR Dewas OR Dhar OR Dindori OR Guna OR Gwalior OR Harda OR Hoshangabad OR Indore OR Jabalpur OR Jhabua OR Katni OR Khandwa OR Khargone OR Mandla OR Mandsaur OR Morena OR Narsinghpur OR Neemuch OR Panna OR Raisen OR Rajgarh OR Ratlam OR Rewa OR Sagar OR Satna OR Sehore OR Seoni OR Shahdol OR Shajapur OR Sheopur OR Shivpuri OR Sidhi OR Singrauli OR Tikamgarh OR Ujjain OR Umaria OR Vidisha) Madhya Pradesh","Chhatarpur (Madhya Pradesh): While social media users are busy questioning how a rooster landed inside a police lockup in Chhatarpur, the bird itself seemed completely unbothered, quietly enjoying what may have been the coolest and safest place around during the extreme heat.
The video, which is being widely shared online, shows a rooster inside the lockup at the Atkoha police outpost under Lavkushnagar police station area.
However, Lavkushnagar SDOP said the rooster had accidentally entered the lockup while the outpost was being cleaned.
In the clip, the rooster can be seen moving around inside the cell, seemingly trying to find a way out, while someone records the unusual moment on camera.
Watch the video below :
As the video went viral, people came up with all kinds of reactions and jokes online. Some social media users even sarcastically claimed that the rooster had been locked up by police for a “chicken party.”
However, Lavkushnagar SDOP Naveen Dubey dismissed such claims and said the rooster had accidentally entered the lockup while the outpost was being cleaned.
According to Dubey, cleaning work was underway at the police outpost when the rooster walked inside the lockup on its own.
He said the person doing the cleaning then shut the gate and recorded the video. He clearly stated that there was no truth to claims related to any party.
Meanwhile, outpost in-charge Sohan Singh Saiyam and Lavkushnagar police station in-charge Ajay Ambe did not respond to the matter.
Despite the clarification from police officials, the unusual video continues to circulate widely on social media and has become a major talking point in the district.",0.8500000000000001
