title,url,source,date,language,state,district,search_term,full_text,relevance_score
"Weather Update, June 26: 70 km wind, rain, thunderstorm alert for 22 states till…, Check IMD forecast for Delhi, Noida, Gurugram, Rajasthan, Punjab, Haryana, Bihar, West Bengal, Assam, Kerala, J-K - news24online.com",https://news.google.com/rss/articles/CBMiowJBVV95cUxPSFl5S2ptMTdLUXJfV0k5NjF6UVloLXRUQ2ExNnpCTjY1NGVoRG1KN0NlSW43dEhFbWNyRmxvVUdKMzAzQ2NZbWpTaEoxSl82Xzd1bTdvTUlEUjhiZHlOcnBEVHBoYy00RGJBWTFOYmctOUFJOS1sVjlsWHZDVi00MUJ6aDgzWjdqQV80VXBDTVNJcmRFMTh5RFNoZUNMcHdqYlRTUWZTeWpHak5KZF92XzQ5djlSOW91LUFweGE3RmVIdTVWOGN3Q01BU0ZQT25qZW9BbERCbGVFRm81RGxieXFjdjZiX1IwMkJWVGtISU1RUFQtQ2tPMFVqWERuSHlvbGRzb0V4MGplZlJmUE9saVpONjBWcWdINlVNenBFZGlTd0E?oc=5,news24online.com,2026-06-26T07:13:49+05:30,en,Assam,,"""heatwave"" Assam","Weather Update, June 26: 70 km wind, rain, thunderstorm alert for 22 states till…, Check IMD forecast for Delhi, Noida, Gurugram, Rajasthan, Punjab, Haryana, Bihar, West Bengal, Assam, Kerala, J-K
The IMD has forecast monsoon advancement over several states, issuing rain alerts for 22 states with thunderstorms and strong winds. Heavy rainfall is expected in many regions, while some areas may continue to face heatwave conditions.
While several parts of India continue to struggle with intense heat, the India Meteorological Department (IMD) has brought some welcome news. The southwest monsoon has picked up speed once again and is expected to advance across more parts of Gujarat, West Bengal, Madhya Pradesh, Chhattisgarh, Bihar, Uttar Pradesh and Uttarakhand over the next three to four days. The IMD has also issued a rain alert for 22 states, forecasting light to heavy rainfall accompanied by strong winds of 40 to 70 kmph in many regions.
Heavy Rainfall Likely in Several Regions
According to the IMD, the northern limit of the monsoon as of 25 June passes through Surat, Indore, Mandla and Motihari. The weather department has warned of heavy rainfall this week along the west coast, across the north-eastern states, and in Sub-Himalayan West Bengal and Sikkim. Extremely heavy rainfall is likely at isolated places in Sub-Himalayan West Bengal and Sikkim between 27 and 29 June, while Assam and Meghalaya could receive very heavy rain on 28 June.
Thunderstorm and Rain Alert for 22 States
The IMD has forecast thunderstorms, rain and gusty winds across 22 states, including Jammu and Kashmir, Ladakh, Himachal Pradesh, Bihar, Uttar Pradesh, Rajasthan, Delhi, Jharkhand, West Bengal and the Andaman and Nicobar Islands. Wind speeds may reach between 40 and 70 kmph in many areas. However, eastern Uttar Pradesh may continue to experience heatwave conditions in isolated places over the next three to four days.
Delhi Weather Forecast (26-28 June)
Delhi is expected to witness partly cloudy skies on Thursday. Light rain accompanied by thunderstorms and lightning is likely during the afternoon, with winds reaching 40 to 50 kmph. The maximum temperature is expected to touch around 41°C. Similar weather conditions are likely on 27 June. However, no rainfall warning has been issued for 28 June, although the weather is expected to become slightly more stable.
Uttar Pradesh Weather Forecast (26 June-1 July)
The IMD has predicted light rain with thunderstorms in several parts of Uttar Pradesh on 26 June. Eastern Uttar Pradesh is also likely to receive rain accompanied by thunder and lightning. Rain alerts have been issued for Lucknow, Kanpur Nagar, Kanpur Dehat, Unnao, Hardoi, Raebareli, Barabanki, Ayodhya, Amethi, Sultanpur, Prayagraj, Kaushambi, Pratapgarh, Fatehpur, Jhansi, Jalaun, Hamirpur, Banda, Chitrakoot, Agra, Mathura, Aligarh, Meerut, Ghaziabad, Gautam Buddha Nagar (Noida), Bulandshahr, Bareilly, Shahjahanpur, Pilibhit, Moradabad, Rampur, Bijnor and Sambhal. From 27 to 28 June, most parts of western Uttar Pradesh are expected to remain dry, while isolated showers may continue in eastern districts. Rainfall is likely at isolated places in western Uttar Pradesh and at several places in eastern Uttar Pradesh on 29 June. Between 30 June and 1 July, widespread rainfall is expected across many districts of eastern Uttar Pradesh, while isolated showers are also likely in western parts of the state.
Maximum and Minimum Temperatures (26 June)
Bihar and Jharkhand Weather Forecast
Bihar is expected to experience mixed weather conditions on 26 June. Thunderstorms, lightning, strong winds and light rain are likely in several districts, while southern parts of the state may continue to face heatwave conditions. Districts in south-eastern and south-central Bihar could witness strong winds of 50 to 60 kmph along with thunderstorms and lightning. Jharkhand is expected to remain under a heatwave alert for the next two days. However, widespread rainfall is likely from 28 June to 1 July, bringing relief from the high temperatures.
Himachal Pradesh and Uttarakhand Weather Forecast
Rainfall is expected across Himachal Pradesh from 25 to 29 June, with widespread showers likely on 30 June and 1 July. Strong winds of 40 to 60 kmph may accompany the rainfall. Heavy rain is also expected at several places on 30 June and 1 July. The IMD expects the southwest monsoon to advance further across Uttarakhand over the next three to four days. Rain is likely between 26 and 28 June, while widespread rainfall is expected on 29 June and 1 July. Heavy rain accompanied by thunderstorms and lightning is possible in several districts, including Dehradun, Haridwar, Nainital, Udham Singh Nagar, Tehri, Pauri, Almora, Pithoragarh, Chamoli and Rudraprayag.
Rajasthan Weather Forecast
Weather conditions are expected to change across Jaipur, Jodhpur, Udaipur, Kota, Bikaner, Ajmer, Alwar, Bharatpur, Sri Ganganagar and Jaisalmer. The IMD has forecast rainfall in several parts of the state between 26 June and 1 July. Strong winds of 30 to 50 kmph are also likely during this period.
Jammu and Kashmir Weather Forecast
According to the IMD, Jammu and Kashmir is likely to witness widespread rain accompanied by thunderstorms and lightning on 26 June, 30 June and 1 July. Strong winds of 40 to 60 kmph are also expected in several areas during this period.
---Advertisement---
Live News
-
12:07 (IST) 26 Jun 2026
Manipur Police organises awareness run to promote message of 'drug-free society'
-
11:01 (IST) 26 Jun 2026
ICAR 2026 Update: NTA releases advance city intimation slip, scribe portal opens for PwD candidates
-
10:44 (IST) 26 Jun 2026
Haryana: India's first hydrogen train leaves from Jind for final 120 kmph speed trial
SHORTS
View All Shorts
---Advertisement---",1.0
