title,url,source,date,language,state,district,search_term,full_text,relevance_score
Rain stopped play? Biggest worry now in British sport is extreme heat | Emma John - The Guardian,https://news.google.com/rss/articles/CBMiowFBVV95cUxNY2Y1R1ZjU19oVWQxMlIxWENTeXJLNmd6Q292SXF4VkhXb0NDdXdlT0JKZUNNdHNQYlNWM08wOTRSREluYVpDZUNuU05DUnZ5c3JuZGN1TlVMa2xxMW02b2hyS2NZbWZEdDFuU0IxZHpsNkxQbmNaXy03a2I5UXdra0djdVR6UThRenc2VWE1ZmNRWXhxWnJKVnU4ckZiTjh4Zmhz?oc=5,The Guardian,2026-06-26T13:38:00+05:30,en,Assam,,"(heatwave OR ""heat wave"" OR ""severe heatwave"" OR ""extreme heat"" OR ""heat spell"" OR ""scorching heat"" OR ""blistering heat"" OR ""sweltering heat"" OR ""hot winds"" OR loo OR ""hot loo winds"" OR ""intense heat"" OR ""unbearable heat"" OR ""deadly heat"" OR heat OR ""weather forecast"" OR ""weather update"" OR ""weather alert"" OR ""IMD forecast"" OR ""IMD prediction"" OR ""IMD alert"" OR IMD OR ""rising temperatures"" OR ""temperatures expected to rise"" OR ""relief from heat"" OR ""respite from heat"" OR ""heat respite"" OR ""respite from scorching heat"") Assam","Climate crisis is on show every day when sportspeople do their thing and the rest of us suffer on the sofa or in the stands
Nothing sharpens the distinction between professional athletes and the rest of us like a week of truly hot weather. While we’re apologetically crying off long‑in‑the-diary engagements – so sorry, just can’t face it in this weather – elite sportspeople are blinking the rivulets of sweat out of their eyes while squinting under a hot and heavy helmet, then doing 22-yard sprints with a couple of kilos of padding strapped to their legs.
As one of nature’s non-athletes, I speak not only with admiration but with genuine wonder. My experience of the past week has been working out how not to do things, or, if forced, doing them half‑heartedly because, you know, I haven’t slept. My friends and I message each other the latest innovations in fan strategy (“Apparently putting a frozen bottle of water in front of it helps”) and talk about our journeys on public transport as if we’ve just survived the Somme.
Since it’s now potentially fatal to cycle to the office – at least, that’s how I interpret the Met Office warning – I have largely stayed at home with the curtains closed and watched others exert themselves while wondering if they and I really belong to the same species.
I started with the tennis at Eastbourne, marvelling as the players sat coolly beneath their brollies, sipping electrolytes and managing their heart rates like unusually ripped Buddhas. They didn’t look half as uncomfortable as me and I was doing nothing except lie on a sofa and carp about the lack of air-conditioning in period conversions.
Jack Draper said after his first-round victory that the conditions were nothing compared with the enervating humidity on the North American circuit in late summer. “It makes me laugh a little bit when in the UK we talk about weather warnings … when it’s just hot, it’s usually pretty manageable.”
Fair point, but it makes me wonder: is this the week that British sport began to normalise extreme heat? As I sweat into my sofa I can’t help but notice the red alerts haven’t put off spectators – neither at Eastbourne nor at Roehampton, where the Wimbledon qualifiers are taking place. The TV cameras capture the heroic crowds: long, lingering shots of long, lingering queues for ice cream, fans fannying about with fans. Plenty of folk are taking a leaf from Wimbledon’s own “beau geste” protocol for ballboys and girls and draping towels down their necks beneath peaked caps, so that some sections of the stands resemble units from the French Foreign Legion.
I flick over to the cricket in Bristol, where a Women’s T20 World Cup double-header is taking place and the temperatures are a mere 31C. What was supposed to be a sell-out crowd is missing about 2,000 children after some councils closed their schools. But for the 3,500 who have shown up, special measures are in place: sprinklers for children to run through and a dedicated cool room in the pavilion that’s in constant use (it’s what Gilbert Jessop would have wanted). The County Ground’s preventive measures seem to pay off: St John Ambulance has five visits in the day.
Sports fans are famously hardy. Usually in Britain it’s the cold they’re braving – think John Motson reporting from Adams Park in the middle of a snowstorm or county cricket diehards huddled under blankets during the early games of the season. Now the mercury’s rising, perhaps sticking it out in the heat will become the new badge of honour. Instead of rain stopped play, now it’s the heat: at Roehampton this week Dan Evans was forced off court for more than an hour during his final appearance at SW19 when power to the electronic line calling system went out and play on all courts was suspended.
There have been moments this week when it felt as if there was nothing to do but give in to the new normal. On Tuesday evening, the moon rose on sultry streets where drinkers who would normally be in the pub to watch England v Ghana preferred to gather on the pavement and follow through the window, if just to catch an occasional breeze. Life felt so European that pints became aperitivos and the late-night kick‑offs in the World Cup suddenly made perfect sense. If this is the future, one wondered treasonously, how soon can we start taking siestas and lengthening licensing hours?
The All England Club has absorbed the lessons of last year, when Wimbledon began and ended on days with amber weather warnings in place and Carlos Alcaraz paused his first match to deliver water to a courtside spectator who had collapsed from the heat. Changes are in place at this week’s qualifiers, additional water stations and an entire new “guest village” providing shade and shelter. The operations director, Michelle Dite, says the most important thing is helping people to prepare, and behave, appropriately for the conditions. “We’re providing an environment where people are very safe. We just ask them to take personal responsibility.”
The heatwave is due to be over by the time the tournament proper starts next week and predicted temperatures of 27C – what the tabloids might once have described as a SCORCHER – now seem relatively tame. But then, as Dite says, dealing with extreme heat is now “business as usual”.
That’s probably the most confronting element in all of this. Sports fans are a peculiar blend of optimists and fatalists: we consistently predict unrealistic happy outcomes for ourselves and our teams, while knowing, deep down, that the worst is inevitable. You could say that sums up humanity’s attitude to the climate crisis.",0.8500000000000001
"Country diary: Even in a heatwave, haymaking is a race against time | Nicola Chester - The Guardian",https://news.google.com/rss/articles/CBMiuAFBVV95cUxPQWpQMTdsZUpqNzZ2b0JzUXROZ2hJdmh4OHc2S1hodG5aX0JPQkR2S2V6NHZfdjhkVm9SVlpCbVJpbi1WRWowcVF2TG1LNFJFVXBsZlVXTGdmQmFxaHdjbjBlV1FucTZ4clI1d183ZmtMbnpoMFZranBUcDdOOWV0aDZtV0ZEN2EtSEtIQjdwc0cwaDJTSTZxU3E4VTZpbW5UOE1jTncya2FKY3IzeEZtT3dicGtRLUZm?oc=5,The Guardian,2026-06-26T10:08:00+05:30,en,Assam,,"(heatwave OR ""heat wave"" OR ""severe heatwave"" OR ""extreme heat"" OR ""heat spell"" OR ""scorching heat"" OR ""blistering heat"" OR ""sweltering heat"" OR ""hot winds"" OR loo OR ""hot loo winds"" OR ""intense heat"" OR ""unbearable heat"" OR ""deadly heat"" OR heat OR ""weather forecast"" OR ""weather update"" OR ""weather alert"" OR ""IMD forecast"" OR ""IMD prediction"" OR ""IMD alert"" OR IMD OR ""rising temperatures"" OR ""temperatures expected to rise"" OR ""relief from heat"" OR ""respite from heat"" OR ""heat respite"" OR ""respite from scorching heat"") Assam","Country diary: Even in a heatwave, haymaking is a race against time
Inkpen, Berkshire: Mow, tedder, rake and bale – it all has to be done before the next rainfall, which is increasingly hard to predict
With the weather set fair and a heatwave under way, all around are literally making hay while the sun shines. Last year’s drought produced very little grass to make hay with, resulting in high prices and scarcity over winter. This year, the grass has received good amounts of both sun and rain – the ideal conditions.
Foxglove Farm and Manor Farm are busy at it, but it seems Rolf’s may have sold its crop standing, for someone else to make and take. Other farms on lower-lying, lusher fields made their first crop during the late May heatwave, but the fields here on the higher chalk needed more time to grow.
Haymaking can’t be hurried. The grass is mown, then “tedded” or raked with rotary tines to spread in a sweet-smelling duvet over the field to dry. The field will be passed over and tedded again, after a day or more of drying, to flick and fluff up the swathe to dry it further. Then the tines are set to “row up” the grass into long, heaped lines, or windrows, that the wind continues to dry, before it’s time for the baling machine.
The increasingly unsteady, alarming weather of climate change can disrupt everything. The unforecast West Country storm, which delivered more than 18,500 lightning strikes on the evening of 22 June, passed its skirts over us with some thunder and a dousing, and some fields needed tedding and drying again.
Yet the heat returned so rapidly, baling continued into the following night. Damp-baled hay is to be avoided at all costs for the risk of mould and overheating: a deep-smouldering bale can spontaneously combust. The sickly green, caramelising smell of this process beginning is one that you don’t forget.
Haymaking here is usually done by farmers in older tractors without air conditioning in the hot and shadeless fields. Our days and nights are scented with sweet coumarin from the cut grasses and honeysuckle from the hedges, in a headiness I adore. It unlocks memories of the sweaty, filthy, scratchy glory that comes with a process that combines work, community, weather and nature, and knowledge just beyond our weather apps.",1.0
Heat Stroke or Acute Coronary Syndrome? A Summer Collapse With an Unexpected Cardiac Twist - Cureus,https://news.google.com/rss/articles/CBMixwFBVV95cUxNZ0hCUGc3M0FUM1R2VU55MTAyMEtzQU5BOGZDTXZCTjJYVmw3Nzh6NE40dkpqOXhRZWRIRWRLZXFOcFlsVzhEeWZPVkdOeW81TGEzTGRCcWhpT3BaVmttQ1RCQWQ3WUFybUhxRlN6UHdYVldfc0NELWdlTzRrVFNIWXBGRGJWd2w5UHRZd1VDclBoQ0JNTzd6RzdGNE92ZUliT1ZFVDVUUEpWSDVhbHpYV19yR1NrMWZhaWVzT25sRHQ2R1dPQmVB?oc=5,Cureus,2026-06-26T13:17:08+05:30,en,Assam,,"(heatstroke OR ""heat stroke"" OR sunstroke OR ""heat exhaustion"" OR ""heat-related death"" OR ""heat casualty"" OR ""heat fatality"" OR ""suspected heat death"" OR dehydration OR ""heat cramps"" OR ""heat illness"") Assam","Offering a variety of advertising and sponsorship options for reaching influential specialists from targeted demographic splits.
Cureus provides an equitable, efficient publishing and peer reviewing experience without sacrificing publication times.
Generate broad awareness and deliver relevant, peer-reviewed clinical experiences directly to potential customers.
Dedicated Cranial Radiosurgery: Clinical Experience with New & Innovative SRS Technologies
Sponsored by Zap Surgical Systems
Real-Time Adaptive Motion Management on Helical and Robotic RT Platforms
Sponsored by Accuray, Inc.
Cureus Journal of Medical Science
Please note that by doing so you agree to be added to our monthly email newsletter distribution list.
By joining Cureus, you agree to our Privacy Policy and Terms of Use.",0.8333333333333333
How to treat heat exhaustion - BBC,https://news.google.com/rss/articles/CBMiWkFVX3lxTE8wWXVBVlBpVmwxQ0FtTWhqWm9PRVNpWXpvX0p1c1BtbW9iVjNWMlc3SWJVdTVYOEdObEh1QVFHNHN6amFSWk1XM1Z3LU9VcGktV2N5RFhwOTl6dw?oc=5,BBC,2026-06-26T00:07:40+05:30,en,Assam,,"(heatstroke OR ""heat stroke"" OR sunstroke OR ""heat exhaustion"" OR ""heat-related death"" OR ""heat casualty"" OR ""heat fatality"" OR ""suspected heat death"" OR dehydration OR ""heat cramps"" OR ""heat illness"") Assam","How to treat heat exhaustion
Related topics
- Updates from your News topics will appear in My News and in a collection on the News homepage.
- Updates from your News topics will appear in My News and in a collection on the News homepage.
How to treat heat exhaustion
- HealthYou are now following HealthUpdates from your News topics will appear in My News and in a collection on the News homepage.
- HeatwavesYou are now following HeatwavesUpdates from your News topics will appear in My News and in a collection on the News homepage.",0.8333333333333333
Heatstroke vs heat exhaustion: Symptoms to watch for and when to seek help - Wales Online,https://news.google.com/rss/articles/CBMikwFBVV95cUxOY3pGUjFlUzhQOUpqeE05bzB2eEpzMXlnTTRmUHNSRFNfVHpXN2lPMlVGOFk5dWF3aTNuVFA3N09ZUDRJWnRSTXdzQmJ4aHNJNU43U1lNbS1VVTFoYVFnV3VhZFBvTjJWQTZrM2tLd3FRS0dqSEZ1SDBMSmhZcnFzUkJBQTdiY1M3MDBUQ0E4SXFJclHSAZgBQVVfeXFMT3dQS21taU5ibHIxejBmMTF4ckZ4ZkVhZldCTWU5Yy1Bejg3QTNNRG9aaWlkckFNWW5vUkFreWZ0dDFRY3lacU9KWERhYlpjMVVWWnRYZnpJQnkxVXFjUS0yYUFyV0lCUGZEamYyc2M3VzlMNU45bFdySG5LTHVhYlJoMWx6Z1lUeFQzbzQtdDJmaWIwMWtFd2w?oc=5,Wales Online,2026-06-26T13:04:00+05:30,en,Assam,,"(heatstroke OR ""heat stroke"" OR sunstroke OR ""heat exhaustion"" OR ""heat-related death"" OR ""heat casualty"" OR ""heat fatality"" OR ""suspected heat death"" OR dehydration OR ""heat cramps"" OR ""heat illness"") Assam","Heatstroke vs heat exhaustion: Symptoms to watch for and when to seek help
As the UK bakes in a heatwave, it's important to know the difference between heat exhaustion and heatstroke symptoms - and when to seek urgent medical help if you or someone else is affected
Ketsuda Phoutinane Spare Time Content Editor and Talya Honebeek Content Editor - Spare Time
08:34, 26 Jun 2026Updated 12:42, 26 Jun 2026
A surge of extreme heat has been sweeping across the UK this week. For only the second time ever, a Met Office red warning for extreme heat is in place for parts of England and Wales.
As temperatures edge towards 40C, it's crucial to understand the distinction between heat exhaustion and heatstroke.
The consequences are very real. On Wednesday, the London Ambulance Service recorded its highest-ever number of life-threatening emergencies ""driven by the extreme heat"", reports the Express.
Part of that is recognising the warning signs - and differences - between these conditions.
Difference between heat exhaustion and heatstroke
Both conditions are forms of heat-related illness. The most severe of the two is heatstroke, which can prove potentially fatal.
Anybody can fall victim to heat illness during hot weather, though certain groups are particularly vulnerable, including:
Older people
Babies
Young children
People with long-term health conditions like diabetes or heart problems.
Here's how to recognise the signs and what to do if you or someone else is affected.
What is heatstroke?
Heatstroke occurs when the body's capacity to regulate its temperature is overwhelmed by heat, resulting in reduced blood flow and damage to vital organs. The NHS urges people with symptoms of heatstroke to seek urgent medical care.
Heatstroke symptoms can include:
High body temperature or fever – usually more than 40C
Fainting or losing consciousness
A seizure or fit
Severe difficulty breathing – for example, struggling to speak without pausing, gasping or choking
Confusion
Lack of coordination
Skin that’s cold to the touch, even with a high body temperature
Article continues below
What is heat exhaustion?
Heat exhaustion occurs when your body overheats — specifically when it loses excessive quantities of water and salt, typically through perspiration. Fatigue, muscle cramps and heat rash are among the indicators of the condition.
The symptoms are generally consistent across both children and adults, although children may additionally display unusual behaviour. NHS Inform has outlined the following symptoms of heat exhaustion:",1.0
Heatstroke vs heat exhaustion: Urgent symptoms and treatment explained - My London,https://news.google.com/rss/articles/CBMiiwFBVV95cUxPbjVJRkdXaFJRWWNDRkRGYzFPU29oREZWYkVxMTVzUDRoUjA4MWcyYWxlMTl5bmpGU0xaeXIxQWd5YVc1NFhFT09laThkdUpQVmt3M1F1MkN3LWtveC1tUjUzVjlzQjluanBIdXR2dFJrMGhSR1NrRkV4bjgzVHNTX2xBY2d3ellLOVpN0gGQAUFVX3lxTE9VOGZIdjR1UFVEZGJWbXc0Q2RZaGxuS3ZZRVJxVS04ZERhMEIxbW16Vy1kNk9PZEw1dmtGZHh3NDhteGswMmJreVRnQjBrQnVZVmRHVzdQMkQwMGdHclBZYXJESVRhUWI0QmZrdnYtdmdLSzluNU42TGF5NE1YT0RsWHVEa2NRWS14Y0J0U09Ibw?oc=5,My London,2026-06-26T13:13:35+05:30,en,Assam,,"(heatstroke OR ""heat stroke"" OR sunstroke OR ""heat exhaustion"" OR ""heat-related death"" OR ""heat casualty"" OR ""heat fatality"" OR ""suspected heat death"" OR dehydration OR ""heat cramps"" OR ""heat illness"") Assam","Heatstroke vs heat exhaustion: Urgent symptoms and treatment explained
As the UK heatwave continues, it's vital to know the difference between heat exhaustion and heatstroke symptoms - and what to do if you or someone else is affected
Ketsuda Phoutinane Spare Time Content Editor and Talya Honebeek Content Editor - Spare Time
08:43, 26 Jun 2026Updated 08:49, 26 Jun 2026
A surge of extreme heat is sweeping across the UK this week. For only the second time in history, a Met Office red warning for extreme heat has been issued for parts of England and Wales.
With temperatures soaring towards 40C, it's crucial to understand the distinction between heat exhaustion and heatstroke.
The risks are serious. On Wednesday, the London Ambulance Service recorded its highest-ever number of life-threatening emergencies ""driven by the extreme heat"".
A key part of staying safe is recognising the warning signs - and distinctions - between these conditions, reports the Express.
Difference between heat exhaustion and heatstroke
Both conditions are forms of heat illness. At the most severe end of the scale is heatstroke, as it can be life-threatening.
Everyone faces the risk of heat illness during hot weather, but certain groups are particularly vulnerable, including:
Older people
Babies
Young children
People with long-term health conditions like diabetes or heart problems.
Here's how to identify the signs and what steps to take if you or someone nearby is affected.
What is heatstroke?
Heatstroke occurs when heat overwhelms the body's capacity to regulate its temperature, leading to reduced blood flow and damage to vital organs. The NHS advises anyone experiencing symptoms of heatstroke to seek urgent medical attention.
Heatstroke symptoms can include:
High body temperature or fever – usually more than 40C
Fainting or losing consciousness
A seizure or fit
Severe difficulty breathing – for example, struggling to speak without pausing, gasping or choking
Confusion
Lack of coordination
Skin that’s cold to the touch, even with a high body temperature
Article continues below
What is heat exhaustion?
Heat exhaustion occurs when the body overheats - essentially when it loses excessive quantities of water and salt, typically through perspiration. Fatigue, muscle cramps and heat rash are amongst the warning signs of the condition.
The symptoms are generally identical in children and adults, although children may additionally display unusual behaviour. NHS Inform has outlined the following symptoms of heat exhaustion:",1.0
Karnataka Weather on Orange Alert: IMD Issues Very Heavy Rain Warning Amid 40% Rainfall Deficit - Goodreturns,https://news.google.com/rss/articles/CBMi1AFBVV95cUxQeWZzSzhjZE9RQzJfS0VSWVg4MHZ2b2dFcUhOM2NpekJTWFpZc0xkVzh1UmR5a2hONVFqLXRVODgySkprVHlBZFZXOThJLWdFNUNnd09NVXVEY0d6MHpKMGdvZ3g4TUpUTk51NkkzRVZzY05KMFhGMWhiSk1VXzVYRi12QTNWWXg5VjI4ckRlc1ZKSjdEdl9CemQ4clFiZWVtM29vMkQ2RTF0OHdleGx2U1RKS0pydkJFZnp3clJUX2c2RmhVYWlZaHVxWDlhQ181N05qLQ?oc=5,Goodreturns,2026-06-26T12:06:21+05:30,en,Assam,,"(""heat advisory"" OR ""heat action plan"" OR ""heat alert"" OR ""IMD warning"" OR ""IMD alert"" OR ""red alert"" OR ""orange alert"" OR ""yellow alert"" OR ""NDMA advisory"" OR ""cooling shelter"" OR ""relief measures"" OR ""heat compensation"" OR ""severe weather warning"") Assam","Karnataka weather is going to turn super rainy as the India Meteorological Department (IMD) has issued an Orange Alert for parts of the state, warning of heavy to very heavy rainfall over the next 24 hours. The orange alert has been issued for Udupi and Uttara Kannada districts, where heavy rain along with 30-40 kmph winds is likely at one or two places.
Meanwhile, weather in Bengaluru Urban, Bengaluru Rural, Mysuru, Shivamogga, Hassan, Chikkamagaluru and several other districts are expected to receive light to moderate rainfall during the forecast period.
IMD Orange Alert for Coastal Karnataka
According to the IMD, Udupi and Uttara Kannada are under an Orange Alert, with the likelihood of heavy to very heavy rainfall. Residents have been advised to remain alert, as intense showers could cause waterlogging, flooding in some areas, and traffic disruptions.
Moderate Rain Expected Across North Karnataka
Weather in North Karnataka is expected to be moderately rainy as per KSNMDC. The weather department has forecast rainfall with sustained winds of 30-40 kmph at places including Gadag, Haveri, Koppal, Raichur, Vijayapura, Yadgir
Bengaluru Weather Today
For Bengaluru Urban and Bengaluru Rural, the IMD has predicted light rain with gusty winds of 30-40 kmph over the next 24 hours. Light showers are also likely in, Ballari, Chamarajanagara, Chikkaballapura, Chitradurga, Davanagere, Kodagu, Kolar, Mandya, Mysuru, Ramanagara, Tumakuru, and Vijayanagara
Bengaluru, where today is expected to be pleasant with cloudy skies, occasional rain spells and breezy throughout the day.
Rainfall Deficit In Karnataka
This monsoon season in the state has been satisfactory in terms of rainfall received. Karnataka has seen a sharp decline in rainfall this June, with precipitation remaining below normal across all regions, including Bengaluru. According to IMD, there is a rainfall deficit of more than 40% in the state. Coastal Karnataka has been the worst affected, receiving just 191 mm of rain against the normal 418 mm, resulting in a 54% rainfall deficit. The main reason behind this shortfall is El Nino along with other factors.The rainfall deficit could impact agriculture and the economy,
Notifications
Settings
Clear Notifications
No New Notifications
Notifications
Use the toggle to switch on notifications
Block for 8 hours
Block for 12 hours
Block for 24 hours
Don't block
To start receiving timely alerts, as shown below click on the Green “lock” icon next to the address bar
Click it and Unblock the Notifications
Close X
Close X
To Start receiving timely alerts please follow the below steps:
Click on the Menu icon of the browser, it opens up a list of options.
Click on the “Options ”, it opens up the settings page,
Here click on the “Privacy & Security” options listed on the left hand side of the page.
Scroll down the page to the “Permission” section .
Here click on the “Settings” tab of the Notification option.
A pop up will open with all listed sites, select the option “ALLOW“, for the respective site under the status head to allow the notification.
Once the changes is done, click on the “Save Changes” option to save the changes.",0.8333333333333333
