title,url,source,date,language,state,district,search_term,full_text,relevance_score
"Rain forecast in Delhi, Mumbai; red alert in Bengal as Monsoon pushes on amid El Niño - The Indian Express",https://news.google.com/rss/articles/CBMiuAFBVV95cUxOd2Q3Yl91TVhzMFQyV1ZrdHhXSndnUGVoQ1NhakF4eEE5anZoc3Q0V0Z3VS1fNnlnWWRGMjc0WG43TUZHUDF2cmZsd2FReDUzSTd1M3dIM1NnaTB4R2tXcjRlcEo0NnF2RFNibHJJMzhmcjFZMlpyakVCbjRMZURBTlRzdWtVdjIzSklXZWNpVmRxN1BDcFgtQzEwZVRUVk9hYVhZRnBiTW01eVN2VHV0bWI2bWtiNjlq0gG_AUFVX3lxTE54Vk5CWHE2YmJhZ1FEOVRCeDM4VDIwTXNGQkZVUTFDWDdQcmRfYVgzVmdPbnVoVk5rREhaNmxaMUlyRTFQd21MM0xESy0tbFAtc0laSjh1X3E4a1pGX3lnMWdJcWVTdVp1Yjlpd3BOTzh2NTIzZjBUcU5SaXVtZng2SVVtU3hEUi14QkQyR19WTWhuZm93VzBvZC1RUHNSRlYyQ1h3T2JBMW5hYVY4UEUzcDNNVXZ0SW1OUWNVRXhZ?oc=5,The Indian Express,2026-06-26T11:40:54+05:30,en,Assam,,"(""heat advisory"" OR ""heat action plan"" OR ""heat alert"" OR ""IMD warning"" OR ""IMD alert"" OR ""red alert"" OR ""orange alert"" OR ""yellow alert"" OR ""NDMA advisory"" OR ""cooling shelter"" OR ""relief measures"" OR ""heat compensation"" OR ""severe weather warning"") Assam","Even as El Niño conditions continue to strengthen over the Pacific Ocean, the southwest monsoon is steadily advancing across the country, with the India Meteorological Department (IMD) forecasting fresh progress over large parts of north and central India over the next two weeks.
According to IMD’s extended long-range forecast covering June 26 to July 8, conditions are favourable for the monsoon to advance into more parts of Gujarat, Madhya Pradesh, Chhattisgarh, Jharkhand, Bihar, Uttar Pradesh, Uttarakhand and Himachal Pradesh during the coming week. By early July, the monsoon system is expected to cover the remaining parts of Madhya Pradesh, Uttar Pradesh, Uttarakhand and Himachal Pradesh, while also making further inroads into Punjab, Haryana, Delhi, Rajasthan and parts of Jammu and Kashmir.
The IMD said the atmosphere has now fully responded to warming sea surface temperatures over the equatorial Pacific, with the ocean-atmosphere system now showing clear signs of El Niño conditions. Forecasts suggest the El Niño pattern is likely to strengthen further during the southwest monsoon season.
However, the Indian Ocean Dipole (IOD) remains neutral and is expected to stay that way throughout the season.
The Madden-Julian Oscillation (MJO), a tropical weather pattern that influences rainfall, is currently in a phase that should help trigger stronger thunderstorms over the north Bay of Bengal, which could support increased rainfall during the first week of the forecast period.
During the week ending July 1, light to moderate rainfall is expected over most parts of central, eastern and peninsular India, with isolated heavy to very heavy showers over Sub-Himalayan West Bengal, Sikkim, Bihar and the Northeast.
Thunderstorms accompanied by lightning and gusty winds are also likely over central, eastern, northeastern and northwestern India, besides parts of the west coast and peninsular region. Dust storms may occur over isolated pockets of the northwest plains.
While rainfall is expected to remain below normal over several parts of the country during the first week, southern peninsular India and the Northeast are likely to receive normal to above-normal rainfall.
From July 2 to July 8, rain is expected to become more widespread as the low-level Somali Jet strengthens and favourable monsoon systems develop over the Bay of Bengal. Western disturbances may also bring rain to the western Himalayan region.
North Bengal is set to bear the brunt of the upcoming wet spell, with IMD issuing ‘red’ alerts for several districts.
Jalpaiguri will remain under an ‘orange’ alert on June 26 and 27, when thunderstorms, lightning, gusty winds of 30-40 kmph and heavy to very heavy rainfall are expected. The district has been upgraded to a ‘red’ alert from June 28 to June 30, with forecasts of extremely heavy rainfall exceeding 20 cm at isolated places.
Darjeeling, Kalimpong, Alipurduar and Cooch Behar have also been placed under ‘red’ alert for the same period, with forecasts warning of widespread heavy to very heavy rainfall, thunderstorms and strong winds.
Meanwhile, North Dinajpur, South Dinajpur and Malda remain under ‘orange’ alert for heavy rainfall and thunderstorms.
The weather office has cautioned that intense rainfall could lead to waterlogging, flash floods in low-lying areas and landslides in the Himalayan districts.
Heavy rain accompanied by thunderstorms and gusty winds battered Kolkata and adjoining districts on Thursday, leaving several roads waterlogged, disrupting traffic and causing widespread inconvenience. Waterlogging was also reported at SSKM Hospital, affecting movement within the premises.
The IMD has forecast thunderstorms with lightning and gusty winds to continue across parts of south Bengal, including North and South 24 Parganas, Purulia, Birbhum, Bankura, Murshidabad and Jhargram, till June 30.
VIDEO | West Bengal: Waterlogging at SSKM hospital as rain lashes several parts of Kolkata.
(Full video available on PTI Videos – https://t.co/n147TvrpG7)#WestBengal pic.twitter.com/TPdoSQ4zxZ
— Press Trust of India (@PTI_News) June 25, 2026
Mumbai woke up to heavy rain on Friday. Cloudy skies are likely to persist throughout over the next two days, with rain continuing. IMD has forecast maximum temperatures around 33 degrees celsius and minimum temperatures near 24 degrees Celsius.
VIDEO | Mumbai wake up to a pleasant morning after couple of days of heavy rainfall. Visuals from Marine Drive, Nariman Point. #MumbaiNews #WeatherUpdate
(Full video available on PTI Videos – https://t.co/n147TvrpG7) pic.twitter.com/Eg1n0M1TMg
— Press Trust of India (@PTI_News) June 26, 2026
Some areas of the Maharashtra capital, however, reported waterlogging on June 24 and 25. Heavy rain could worsen flooding in some city pockets.
Across Maharashtra, light to moderate rain or thundershowers are expected over most districts of Konkan-Goa, Marathwada and south Madhya Maharashtra, with rain likely to continue until July 1. Temperatures are expected to remain largely stable over the next couple of days before rising slightly.
The national capital is expected to witness a partly cloudy sky with chances of light rain, thunderstorms and lightning on Friday. Gusty winds reaching 40-50 kmph, with occasional gusts up to 60 kmph, are likely during the afternoon and evening.
The unsettled weather is expected to continue through the weekend and into next week, with intermittent light rain and strong surface winds. Daytime temperatures are forecast to hover between 39 degrees celsius and 41 degrees celsius, while minimum temperatures are expected to remain around 26 degrees celsius to 28 degrees celsius.
The IMD has also forecast rainfall over Konkan & Goa, coastal Gujarat, Kerala and Coastal Karnataka, with isolated heavy to very heavy rainfall during the coming week. Heavy showers are also likely over parts of Madhya Maharashtra and south interior Karnataka towards the end of June.
In the Northeast, Arunachal Pradesh, Assam and Meghalaya are expected to receive repeated spells of heavy to very heavy rain through the week.
Heatwave conditions are likely to persist briefly over isolated parts of Bihar, Jharkhand and eastern Uttar Pradesh, with severe heatwave conditions possible in some areas until June 27.",1.0
"Odisha Braces for Heavy Rain Fury: Orange Alert in 6 Districts, Weather Warning Extended Till June 28 - pragativadi.com",https://news.google.com/rss/articles/CBMiwgFBVV95cUxQUEVMbGxPeHVRUzBTUk9Bd2d5WmZrUnRmQlRJU0RLZHdxZXJaaHpVYzhzYWF0MkJiZWNZWFRyNlM3M290MjJiMzZiX0tIU1JHRDZGbm1mQ2VVY2ZlX2lFVEhmY2xaLXZ5R08tZjJzQUQ2UlBQRm9seWs3YWw3dkJUNUFHdFhwQ042bmZWLTlCRmc1aVlYLTFpZ0VUbW9VZ3luNlIwVkZMWUxhYklUTVhKQ0Q3LWp6SzFON21UQkJTRG1jZw?oc=5,pragativadi.com,2026-06-26T06:27:43+05:30,en,Assam,,"(""heat advisory"" OR ""heat action plan"" OR ""heat alert"" OR ""IMD warning"" OR ""IMD alert"" OR ""red alert"" OR ""orange alert"" OR ""yellow alert"" OR ""NDMA advisory"" OR ""cooling shelter"" OR ""relief measures"" OR ""heat compensation"" OR ""severe weather warning"") Assam","The Regional Meteorological Centre (RMC), Bhubaneswar, has issued an Orange Warning for six districts in Odisha as heavy rainfall, thunderstorms, lightning, and gusty winds are expected to impact several parts of the state over the next few days.
With the southwest monsoon now covering the entire state, weather conditions have turned increasingly active, bringing widespread rain and unstable atmospheric conditions across Odisha.
Orange Warning Issued for Six Districts
According to the latest forecast, the following districts have been placed under an Orange Alert for the next 24 hours:
Koraput
Malkangiri
Nabarangpur
Rayagada
Nuapada
Kalahandi
These districts are likely to experience heavy to very heavy rainfall, accompanied by thunderstorms, lightning activity, and strong surface winds reaching speeds of 40 to 50 kmph.
Weather officials have advised residents to remain cautious, especially in low-lying and vulnerable areas prone to waterlogging and localized flooding.
Rain and Thunderstorm Activity to Continue
The Meteorological Centre has warned that the active monsoon system may trigger continuous rainfall across southern, western, and interior Odisha.
Several regions have already witnessed moderate to heavy rainfall following the full advancement of the southwest monsoon over the state.
Experts believe the current weather pattern could result in temporary disruptions to transportation, farming activities, and daily life in some districts.
Yellow Warning for Several Districts
Apart from the Orange Alert districts, the weather office has also issued a Yellow Warning for multiple districts due to the possibility of thunderstorms, lightning, and moderate rainfall.
Overall, weather advisories have been issued for 24 districts across Odisha, indicating a widespread impact of the monsoon system.
Heavy Rainfall Likely Till June 28
The Regional Meteorological Centre has extended its rainfall warning for several districts, including:
Nuapada
Balangir
Kalahandi
These districts are expected to continue receiving heavy rainfall until June 28, raising concerns about water accumulation and localized flooding in vulnerable pockets.
Advisory for Residents
Authorities have urged residents to:
Avoid sheltering under trees during thunderstorms.
Stay indoors during lightning activity.
Follow updates issued by local administrations and weather agencies.
Exercise caution while travelling in rain-affected areas.
Farmers should take necessary precautions to protect crops and livestock.
Monsoon Gains Strength Across Odisha
The complete advancement of the southwest monsoon has significantly increased rainfall activity across Odisha. Weather experts expect intermittent showers, thunderstorms, and strong winds to continue in several districts over the coming days.
Citizens are advised to stay updated with official weather bulletins as the monsoon system remains active across the state.",0.5166666666666666
"Monsoon tracker: IMD warns of heavy rain in Bihar, Odisha, Sikkim, Bengal; issues orange alert — full forecast here - Mint",https://news.google.com/rss/articles/CBMi9wFBVV95cUxOVEpVdWlVOHNaVGxfZGl1YW9ib3BvYXc2TGp3MVY5VGxKYTR6bWZUd0dvckVmdGRwSEpFWFhCR2hOVWpRaHRUdmFQOWw1Wlpyd0c3cVV2RGdoQUxQc0h0WkxBZnMtZmZMMDlULVExWkowNFZiWUVNS1drQS1nVUlBeFNmcTktc3VsbXVpcW84dks5SHhKdUFCM1RWSlpGbVF0MEd5RHc2UkVFazdPYk8ySXBjc3VuR2ZHRFdPQ19tMF9fbkZtVEtlanJpTmkwbFFDU0tqUVpzaGc2d1N4RVhnd0VJUEVJZUY0bGdlZzlYMWptU1J3VW5R0gH8AUFVX3lxTE9rX2hQM2IyNzVNRzZLclZVc1FUVDdyWllvVlhWNFVCNXV0NkgwdkR4RUJxUTE4NWtGV28tdGdwUldubkl0QVR4cVh0MnRRS25rZktkSS0xc0ROakZzTV80dWxUVXUwOHJUdXhNVG0xT2xRZkNaTmItS3NnaTlVRnN1RWpLMm0yYk1uam9FMU1MbTN3X3NHczVrb0hJeGx1c2dOOUdmVS1aZGJXblRUZ3prTkJQNUJfR0pQa3BkZVhDNkRnWTJRUXM1d1hzdWtXcHBwTExnTFFtM3NuQy1RQ21FbS1KcE1BTk9CUGlaYmh4eEdXN0FwS0tVcGEtRg?oc=5,Mint,2026-06-26T10:18:47+05:30,en,Assam,,"(""heat advisory"" OR ""heat action plan"" OR ""heat alert"" OR ""IMD warning"" OR ""IMD alert"" OR ""red alert"" OR ""orange alert"" OR ""yellow alert"" OR ""NDMA advisory"" OR ""cooling shelter"" OR ""relief measures"" OR ""heat compensation"" OR ""severe weather warning"") Assam","Monsoon tracker: IMD warns of heavy rain in Bihar, Odisha, Sikkim, Bengal; issues orange alert — full forecast here
Monsoon tracker: IMD issued orange alert for multiple states as it informed about further advancement of southwest monsoon. Check full weather cast here.
Monsoon update: Bihar, Odisha, Sikkim, parts of west Bengal, East Rajasthan and West Madhya Pradesh are on orange alert today due to possibility of heavy rains, the India Meteorological Department (IMD) said. Over monsoon update, the weather agency said conditions are favourable for further advance of southwest monsoon into some more parts of Gujarat, Madhya Pradesh, remaining parts of Chhattisgarh, Jharkhand, Bihar, some parts of Uttar Pradesh and Uttarakhand during the next three days.
IMD in its latest press release warned against “heavy to very heavy rainfall” along the west coast, over northeast India and Sub-Himalayan West Bengal and Sikkim during the week. “Isolated extremely heavy rainfall also likely over Sub-Himalayan West Bengal & Sikkim on 27th to 29th and over Assam & Meghalaya on 28th June, 2026,” the report stated. Additionally, heavy downpour is likely in Bihar till 30 June and in Odisha from 28 June to 1 July.
IMD predicts heavy showers for Northwest India in the coming days
The weather bulletin suggested possibility of isolated heavy rainfall likely in Himachal Pradesh between 30 June and 1 July and in Uttarakhand from 29 June to 1 July.
Moving to weather forecast for Central India, IMD said, “Isolated heavy rainfall likely over… Vidarbha during 27th-28th June; Chhattisgarh during 27th-28th June.”
Weather forecast for Northeast India
Weather forecast for Northeast India states, ""Isolated heavy rainfall likely over Arunachal Pradesh on 26th June and during 30th June-1st July; Assam & Meghalaya on 26th June and on 28th June; Nagaland, Manipur, Mizoram & Tripura during 26th-29th June with isolated very heavy rainfall also likely over Arunachal Pradesh during 27th-29th June; Assam & Meghalaya on 27th June and during 29th June-1st July.
The weather agency in its latest bulletin stated, “Isolated heavy rainfall likely over Konkan & Goa during 26th June-1st July; Madhya Maharashtra during 26th-29th June.”
Forecast for South Peninsular India
Predicting very heavy precipitation in Kerala on 29 June, Coastal Karnataka from 29 June to 1 July and in South Interior Karnataka between 29 and 30 June, the Met Department said, “Isolated heavy rainfall likely over Tamil Nadu, Puducherry & Karaikal during 27th-30th June; Kerala & Mahe during 27th-28th June and during 30th June-1st July; Lakshadweep during 28th-29th June; Coastal Karnataka during 25th 28th June; North Interior Karnataka during 29th June-1st July; South Interior Karnataka on 28th June and on 1st July; Coastal Andhra Pradesh & Yanam during 26th-30th June; Telangana during 25th June-1st July.”
Heat wave and maximum temperature forecast
Northwest India is set to witness 2-3°C spike in maximum temperature till 28 June and a fall by 3-5°C thereafter. Weather conditions for Central India indicate 2-4°C rise in mercury till Sunday. Meanwhile, heat wave conditions are likely over East Uttar Pradesh, Bihar and Jharkhand today. “Heat wave conditions very likely in isolated pockets over Jharkhand on 26th June; East Uttar Pradesh during 26th-28th June with severe heat wave conditions in isolated pockets during 26th-27th June,” IMD said.
Delhi weather today
Delhi residents can expect partly cloudy sky conditions today with a spell of very light to light rain, thunderstorm, lightning and strong surface winds. “The maximum and minimum temperatures in the national capital are likely to be in the range of 39°C to 41°C and 25°C to 27°C, respectively.
Fareha Naaz is a Delhi-based journalist and Content Producer at LiveMint, where she has built nearly three years of experience in digital journalism. She covers a diverse range of topics, including national news, education, entertainment, lifestyle trends science, global health and international news.<br><br>
With a background in Economics and Education, she focuses on providing insightful, thoroughly researched coverage that bridges the gap between breaking news and in-depth analysis. In addition to breaking copies, legal and political news, her reporting blends editorial rigour with search-driven storytelling. With a keen eye-on-global events, she provides insightful coverage on latest developments. Her reporting combines editorial rigour with in-depth coverage and search-driven storytelling provide valuable insight and context to readers, ensuring accuracy and relevance.<br><br>
Her newsroom experience helped her in combining her critical thinking skills with real-time editorial decision-making. Over the years, she has been presenting complex stories with clarity for a digital-first audience amid fast-paced news cycles. Her thoroughly researched stories, with well-structured and engaging content, provide readers with clear understanding of the context and background.<br><br>
Fareha holds a Master’s degree in Economics, in addition to a Bachelor of Education degree.<br><br>
When not in the newsroom, she enjoys painting and sports, reading books and current developments.",1.0
Britain's 35°C vs India's 45°C: Why UK feels like an oven despite low temperatures - India Today,https://news.google.com/rss/articles/CBMi2gFBVV95cUxOQ1FidVhyRFUxSXlrWWw2YS13WWxQYW1GUU15ZGxsbExXM0VxTFN2Z2Nvb2ItYnROazA2aGNZU2N3ME1GLThQci1YSUZEa2hndUNwcGI4YVYxUXFFVFdjY2RfbUNocHEwVnVYa3BmaDNtdnV1cEgzUHU3clVOS0RPNFFVNDhadzZxa2wtNGx5TjNHekxoRFpJT2VTUm1SNy1Fb1FrSW9LZU1NSDJDZGkyNTZtOHhBY1BuZ2FlblpVRkg2bmVzWDdOcjVKUklLMl8yYkRWMkR6U05PUdIB3wFBVV95cUxQb0dka3ZMZk1neU9Bd0JEVFpCSEdnM1c3eEwzNUluc291bzhwV1lqN2lBVC11N2pmMklDV04xVXJWUjU1SllwZE1JLVZyUm05ZW02M0piNjF5c294ZmRmWGtqS20zTDc0cVB4TzBqMU1qajNZc0o2cDNXbERjdlA1aUo4MExMcTRXUkhVYUZ4a2lPenRiRi0ta1M0TmxKRExDd1k3c0lDODJQMGhyVEQ3TENHc0x3dXBjem9wbndCOFdONFZLRGswTl9ORE9KRzkzZzBrcjByZS1JeXRXSExn?oc=5,India Today,2026-06-26T12:23:58+05:30,en,Assam,,"(heatwave OR ""heat wave"" OR ""severe heatwave"" OR ""extreme heat"" OR ""heat spell"" OR ""scorching heat"" OR ""blistering heat"" OR ""sweltering heat"" OR ""hot winds"" OR loo OR ""hot loo winds"" OR ""intense heat"" OR ""unbearable heat"" OR ""deadly heat"" OR heat OR ""weather forecast"" OR ""weather update"" OR ""weather alert"" OR ""IMD forecast"" OR ""IMD prediction"" OR ""IMD alert"" OR IMD OR ""rising temperatures"" OR ""temperatures expected to rise"" OR ""relief from heat"" OR ""respite from heat"" OR ""heat respite"" OR ""respite from scorching heat"") Assam","Britain melts at 35°C while India endures 45°C: Why UK heat feels so unbearable
That extra moisture makes a significant difference to how the human body experiences heat.
However, humidity is only one part of the story.
HOW DOES BRITISH HOMES MAKE HEAT WORSE?
The seasonal evolution of heat also differs dramatically.
Another factor is Britain's unusually long summer days.",0.31666666666666665
Paris pride parade postponed following intense heatwave and threats to ban | World News - Hindustan Times,https://news.google.com/rss/articles/CBMi0wFBVV95cUxQVzNiazRHNmpPQWFETE1KcjJOaUctMVA5RERxWFVkNjdMWVJyRGNYWGwzRzVSbk5aT2VwTHFhbktra1J4cVZheW9QT2hDZGVyXzZVYzB0TGZ3dUh0T1FJV3BjNFpQZE45NHRaZlBhcU1Zd2JjOWFra18zbkpiWkN3YnRjUTNhbFdHeXJfeFY5U1hVVGw4VTlmczB1akxTZ3A0UTNlRExPTVhMelhWRnVsMVJWTkFhZThOVnJ4V1ZubU9HaWpiSWsyZ1EwQ1NWZjR5cHRN0gHYAUFVX3lxTFBvZDdPeFQ0ZEdsb2ZhNHpTUm1TWnpxaWh4eEFYY05Seks1QlVXUmhJamctWFZITVpNUzRnaVBPa2JSdmlIVzFvNjlSeFFnSWF6dkVQeHdELUEtNXUwLUxQcEtaTGhZd0kwcDEwUy1BOE5XeVBsaFpGeXNZZ2xFV1ZCVFpYNXNpOXpTOXB2S2ttLXprQjV0QlBZVGVoenZfN29OWTdEby1COW1PanpLMk9tTEVaTzVPeU1JYTU2M1RPRjJEZmxLYTk5b1E4ODloLWk0TEJXSjlsUg?oc=5,Hindustan Times,2026-06-26T15:11:36+05:30,en,Assam,,"(heatwave OR ""heat wave"" OR ""severe heatwave"" OR ""extreme heat"" OR ""heat spell"" OR ""scorching heat"" OR ""blistering heat"" OR ""sweltering heat"" OR ""hot winds"" OR loo OR ""hot loo winds"" OR ""intense heat"" OR ""unbearable heat"" OR ""deadly heat"" OR heat OR ""weather forecast"" OR ""weather update"" OR ""weather alert"" OR ""IMD forecast"" OR ""IMD prediction"" OR ""IMD alert"" OR IMD OR ""rising temperatures"" OR ""temperatures expected to rise"" OR ""relief from heat"" OR ""respite from heat"" OR ""heat respite"" OR ""respite from scorching heat"") Assam","Paris pride parade postponed following intense heatwave and threats to ban
""The march has been postponed,"" said Anouk Veyret, co-president of the Inter-LGBT association.",0.5166666666666666
It could be more dangerous inside your house during a heat wave - Fortune,https://news.google.com/rss/articles/CBMiigFBVV95cUxNd2wxWFdDYmo0bmtabjJjYUhlYTJmWjlaSFRWNEJBd3RObE9vemhZWE1YaWtNRXF2TzBVSmNkSHUyWmZQWHFPQ3ppZ2VDQWowU3M4Znl1YjZCb1dOVUlsWG0tcURzdmVidTM2Zk5iZUhoRFI5UHhvQVVQUG5TaWpwUWFJeUJlQWViQ3c?oc=5,Fortune,2026-06-26T12:50:00+05:30,en,Assam,,"(heatwave OR ""heat wave"" OR ""severe heatwave"" OR ""extreme heat"" OR ""heat spell"" OR ""scorching heat"" OR ""blistering heat"" OR ""sweltering heat"" OR ""hot winds"" OR loo OR ""hot loo winds"" OR ""intense heat"" OR ""unbearable heat"" OR ""deadly heat"" OR heat OR ""weather forecast"" OR ""weather update"" OR ""weather alert"" OR ""IMD forecast"" OR ""IMD prediction"" OR ""IMD alert"" OR IMD OR ""rising temperatures"" OR ""temperatures expected to rise"" OR ""relief from heat"" OR ""respite from heat"" OR ""heat respite"" OR ""respite from scorching heat"") Assam","We found that even younger, healthy adults face far more risk than they realize.
How hot is too hot for a human body?
Why homes heat up more than people expect
People tend to underestimate indoor heat for a few reasons.
What we found in Austin
We found three types of buildings and accompanying risks:
- Critical-risk buildings, which are mostly older homes, became dangerous almost immediately.
What you can do to stay safe
If you can’t get cooling at home, there are steps you can take that can help.
Zoltan Nagy, Professor of Building Services, Eindhoven University of Technology",0.6833333333333333
El Dorado Fire Department warns of high heat in the coming days - El Dorado News-Times,https://news.google.com/rss/articles/CBMimgFBVV95cUxNcHVacm9MU2xMaGJGUVIzZm5OcFJYbW16NXc1Q3VQREVLSzhvWTZhUkhEWkpZSjJsM2R4Njdjbmp1azRNQm1MQ25sQXlzMTRENWtiX2lPUlZzdWFXNkhMYmF3V3ZpUV92VlRHZ0JZUEhkSjgtOWV1anllRjlQWTV5RGFvR1VyeGR2VHZOcnM5Q2dOZHZBR1hWS1RR?oc=5,El Dorado News-Times,2026-06-26T01:30:00+05:30,en,Assam,,"(heatstroke OR ""heat stroke"" OR sunstroke OR ""heat exhaustion"" OR ""heat-related death"" OR ""heat casualty"" OR ""heat fatality"" OR ""suspected heat death"" OR dehydration OR ""heat cramps"" OR ""heat illness"") Assam","Safety Precautions listed by the EFD for the high heat include:
- Drinking water frequently --don't wait until you're thirsty.
- Avoid excessive caffeine and alcohol which can contribute to dehydration.
Warning signs of heat exhaustion and heat stroke include:
- Heat Exhaustion: Heavy sweating, weakness, dizziness, nausea, headache, cool clammy skin.",1.0
France Records Hottest Day Ever - The Onion,https://news.google.com/rss/articles/CBMiY0FVX3lxTE1IZUlSTFJyQjdMcnpiWUxIdE00R25Sa2NDMDdxbVNkU0lkVU13TEQyY2FidFdaRGlBRW9oVDN0LU02Y0dTaFdoLWM1Ym5zeGxvVGk2cTYxalNfa0tWUGJ4RmhWcw?oc=5,The Onion,2026-06-26T00:56:05+05:30,en,Assam,,"(""mercury soars"" OR ""mercury crosses"" OR ""temperature soars"" OR ""record temperature"" OR ""all-time high"" OR ""degrees Celsius"" OR ""maximum temperature"" OR ""hottest day"" OR ""temperature crosses 40"" OR ""temperature crosses 45"" OR ""temperature likely to rise"") Assam","“Heat stroke has never sounded so romantic!”
Ruby Olguin, Casino Custodian
“No human being should have to live like an Australian.”
Chris Eyre, Sauce Taster
“And thousands of miles from the nearest Speed Stick.”
Russ Brockmeyer, Elbow Patcher
“Heat stroke has never sounded so romantic!”
Ruby Olguin, Casino Custodian
“No human being should have to live like an Australian.”
Chris Eyre, Sauce Taster
“And thousands of miles from the nearest Speed Stick.”
Russ Brockmeyer, Elbow Patcher",1.0
