title,url,source,date,language,state,district,search_term,full_text,relevance_score
Udhampur poultry farms implement heatwave precautions to protect birds - The News Mill,https://news.google.com/rss/articles/CBMipgFBVV95cUxOTEpNNzlrMU1NdEs4bU10eU5iSDFoSkhEUjFTVktaeWo5aDV6YnI2aDFRTEpxcGxuVjJLdHZlckZ6NFNQWTVUZDF1Z1lVU1NrMmdCWnBXOWhnYXhtOExUZ1JtQUoyZlBMa0NOVEt0ZWtyX3VEMEVfekxlN2k5UHNCU0o0dTd4TnFyZEozVHNSNXZRTHY1Zm5GNUQ1cThmNGhVSHlOdndB?oc=5,The News Mill,2026-04-26T08:52:08+05:30,en,Jammu and Kashmir,Jammu,"(heatwave OR ""heat wave"" OR ""severe heatwave"" OR ""extreme heat"" OR ""heat spell"" OR ""scorching heat"" OR ""blistering heat"" OR ""sweltering heat"" OR ""hot winds"" OR loo OR ""hot loo winds"" OR ""intense heat"" OR ""unbearable heat"" OR ""deadly heat"" OR heat OR ""weather forecast"" OR ""weather update"" OR ""weather alert"" OR ""IMD forecast"" OR ""IMD prediction"" OR ""IMD alert"" OR IMD OR ""rising temperatures"" OR ""temperatures expected to rise"" OR ""relief from heat"" OR ""respite from heat"" OR ""heat respite"" OR ""respite from scorching heat"") Jammu and Kashmir","As a heatwave affects parts of Jammu and Kashmir, the Animal Husbandry Department in Udhampur district has introduced preventive measures to protect poultry at the Government Hatchery and Poultry Farm in Kallar. Officials reported on Saturday that efforts are focused on mitigating the impact of increasing temperatures on birds by maintaining suitable environmental conditions and nutrition.
Assistant Manager of Poultry in Udhampur, Dr Surbhi Bharti, outlined important precautions for poultry farmers to follow amid the heatwave. “We should provide proper ventilation to birds in this heat wave. Keep the windows open. Provide fans from both sides so the heat escapes outside. Provide the birds with cold water. Feed the birds either early morning or late evening. Provide them a proper balance of vitamins and minerals,” she said.
The department stressed that these measures are vital to prevent heat stress, which can negatively affect the health and productivity of poultry.
Meanwhile, the Government Veterinary Hospital in the Kallar area marked World Veterinary Day with a programme honouring veterinary professionals and reaffirming their commitment to animal welfare. Participants paid tribute to the historical contributions of the veterinary community and pledged to provide dedicated care for animals.
District Veterinary Hospital Superintendent Dr Anwar Hussain Nagoo emphasised the significance of this year’s theme while addressing the audience. “The World Veterinary Association has selected the theme ‘Veterinarians: Guardians of Food and Health’ for this year. We had called many doctors and experts here… We felicitate the distinguished veterinarians today…” he said.
The event included several doctors and experts who gathered to recognise the role of veterinarians in protecting both animal and public health.
World Veterinary Day is observed annually on April 25 to acknowledge the essential role of veterinarians in animal welfare, food safety, and public health worldwide. This year’s theme highlighted the critical role of vets in the “One Health” approach, particularly in relation to zoonotic diseases, climate change, and food security.",1.0
"Weather update J&K: Dry spell today, rain & thunder showers likely from April 27; heatwave conditions to persist in Jammu division, advisory issued for farmers and Public - Kashmir Indepth",https://news.google.com/rss/articles/CBMi3wFBVV95cUxOZlAxVDZNcXZXZWFzakVSekNrLU9kcDhvWHB0SS1QX1BSVzlOOWswdk5POGZJUnRPdzBZOHVSM1FsWGZNZThsbVZZSm04eF9hMzA5Z0g5ZE4zaE9PN19sZGUxcHVUN0EtRno3UnlyeWFsWmVoenpiR1pueWItSmU5WlBOa2dLSE96dDl3bU80X0NGbVpPWGdxbzdBZDd5ZjN3S1ZwdlZJTi1VVUlJdllYZHFOSG51MC0ySEdwakhLNjJnUnQ1THpZT2JPamdDcDAxOTFYMXFqQno5dVZfN3NJ?oc=5,Kashmir Indepth,2026-04-26T11:26:46+05:30,en,Jammu and Kashmir,Jammu,"""heatwave"" Jammu and Kashmir","According to the forecast, April 26 is expected to remain generally dry across the Union Territory. However, weather conditions are set to change from April 27 to 28, with generally cloudy skies and light rain, thundershowers, and gusty winds likely at scattered to many places, particularly during the afternoon and evening hours.
On April 29 and 30, the region will witness partly cloudy skies, with brief spells of light rain or thunder expected at a few locations, mainly during late afternoon hours. Dry weather conditions are likely to return on May 1 and 2.
From May 3 to 4, the weather is again expected to turn generally cloudy, with brief spells of light rain and thunderstorms at scattered to many places, especially in the afternoon and evening.
Advisory Issued:
The MeT department has advised farmers to resume agricultural operations during the relatively stable weather window between April 26 and the afternoon of April 27.
Meanwhile, hot and dry weather conditions are likely to persist over the districts of Jammu, Kathua, Samba, Reasi, and Udhampur over the next two days. Isolated areas may experience heatwave conditions on April 26 and 27.
Residents in these areas have been urged to avoid heat exposure during peak hours and stay hydrated by consuming adequate fluids, including ORS and traditional drinks like lassi.
Authorities have advised the public to remain updated with official forecasts and take necessary precautions amid changing weather conditions.(KINS)",0.8500000000000001
Intermittent rain brings relief from heatwave in Kashmir Valley - The Tribune,https://news.google.com/rss/articles/CBMiqAFBVV95cUxNcHdCT3hZX1RvNjE4VnQtUUZPZVUwUjhpbzdFRWdYb2d2cXFRREdKRm56TVFuUkJVMzFObFpVUkJ2RS1jVkpJaWFld1dqQUxmZWFncTFERzFCaTdGNHU1RXZ6NXVrRUNzRURuYTFKS3dKODhiUEI5MmJPSENuS2RyY2N4WFI5aGlXcnNZVnJoQ3V2d1Y1ZDNKcktPYW9mdWcweDVjZllWQjLSAagBQVVfeXFMTXB3Qk94WV9UbzYxOFZ0LVFGT2VVMFI4aW83RUVnWG9ndnFxUURHSkZuek1RblJCVTMxTmxaVVJCdkUtY1ZKSWlhZXdXakFMZmVhZ3ExREcxQmk3RjR1NUV2ejV1a0VDc0VEbmExSkt3Sjg4YlBCOTJiT0hDbktkcmNjeFhSOWhpV3JzWVZyaEN1dndWNWQzSnJLT2FvZnVnMHg1Y2ZZVkIy?oc=5,The Tribune,2026-04-26T03:45:41+05:30,en,Jammu and Kashmir,Jammu,"""heatwave"" Jammu and Kashmir","Unlock Exclusive Insights with The Tribune Premium
Take your experience further with Premium access. Thought-provoking Opinions, Expert Analysis, In-depth Insights and other Member Only BenefitsIntermittent rains lashed most parts of Kashmir on Saturday, bringing relief from the heatwave conditions, even as the Meteorological Department forecast another spell of wet weather early next week, officials said.
Overnight, the plains of Kashmir, including the summer capital Srinagar, experienced continuous rain that persisted until late morning on Saturday. There were also reports of light snowfall in Zojila Pass, which connects Kashmir valley to Ladakh.
As the weather improved in the afternoon, the rain brought down temperatures, alleviating the heatwave that had been prevalent in the Valley over the past few days.
Srinagar recorded a maximum temperature of 28.1 degrees Celsius on Friday, which was over six degrees higher than the seasonal norm. The minimum temperature was also nearly five degrees above average.
In general, temperatures at most locations in Kashmir were over six degrees above normal on Friday.
However, following the rainfall and overcast conditions on Saturday, the temperature dropped to 21.2 degrees Celsius—approximately seven degrees lower than the previous day and nearly one degree below the seasonal average, officials noted.
All weather stations in the Valley reported below-normal day temperatures on Saturday.
The MeT office said that while the weather is expected to be generally dry on Sunday, there is a chance of light rain, thunder showers, and gusty winds in scattered areas from Monday onwards.
A brief spell of light rain and thunder is likely at a few locations on April 29-30 in the late afternoon.
Jammu sizzles at 39.5° C, advisory issued
Jammu, April 25
Jammu sweltered on Saturday as heatwave conditions gripped the plains, with the city recording a high of 39.5° Celsius — 5.1 notches above normal, officials said. The minimum temperature in the city also remained above average at 22.8° Celsius, 2 degrees above normal, a meteorological department spokesperson said.
Katra town, the base camp for pilgrims visiting the Mata Vaishno Devi shrine atop Trikuta hills in Reasi district, also witnessed a sharp rise in temperatures, recording a maximum of 36° Celsius, 6.2 degrees above normal, while the minimum temperature settled at 23° Celsius, 5.4 degrees above normal.
The persistent rise in both day and night temperatures has led to uncomfortable conditions, particularly during afternoon hours.
The Meteorological Department predicted that hot and dry weather with isolated heatwave conditions is likely to continue over the plains of Jammu division for the next four days.
Residents have been advised to take precautions, avoid prolonged sun exposure, and stay hydrated amid the prevailing sweltering conditions.",1.0
J-K: Udhampur poultry farms take preventive steps amid heatwave - ANI News,https://news.google.com/rss/articles/CBMivwFBVV95cUxQN0x1OVFFZGF4d3hWTW1BdUJJVmFhZUEtVXJ4aU1aTTY5NVJQT3VWR0d4MUFieVE0RWhjSmMwdUVrRmdwellKWnZmcWVkcFFhUTQ4TDV1NkpBV1NzOFRrTVRVc2hTa3JWSWpUbWxua2JsUFlaaUYyUms1cW9UX003anIxRUo1dmRlaV9TZndkamh4S2doOVRuS0puNDZ0RGZfSnVlWWdrRTJoNjk1SGM4ZzE1RDhkcS1yS1dIbEd2TQ?oc=5,ANI News,2026-04-26T08:50:00+05:30,en,Jammu and Kashmir,Jammu,"""heatwave"" Jammu and Kashmir","Udhampur (Jammu and Kashmir) [India], April 26 (ANI): As a heatwave grips parts of Jammu and Kashmir, the Animal Husbandry Department in Udhampur district has initiated preventive measures to safeguard poultry at the Government Hatchery and Poultry Farm in Kallar.
Officials said on Saturday that steps are being taken to mitigate the impact of rising temperatures on birds, with a focus on maintaining proper environmental conditions and nutrition.
Assistant Manager of Poultry in Udhampur, Dr Surbhi Bharti, highlighted key precautions for poultry farmers to follow during the ongoing heatwave.
""We should provide proper ventilation to birds in this heat wave. Keep the windows open. Provide fans from both sides so the heat escapes outside. Provide the birds with cold water. Feed the birds either early morning or late evening. Provide them a proper balance of vitamins and minerals,"" she said.
The department has emphasised that such measures are crucial to prevent heat stress among poultry, which can adversely affect their health and productivity.
Meanwhile, the Government Veterinary Hospital in the Kallar area of Udhampur marked World Veterinary Day with a programme honouring the contributions of veterinary professionals and reaffirming their commitment to animal welfare.
During the event, veterinary doctors paid tribute to the historical contributions of the veterinary community and took a solemn pledge to ensure dedicated and consistent care for animals.
District Veterinary Hospital Superintendent Dr Anwar Hussain Nagoo highlighted the significance of this year's theme while addressing the gathering.
""The World Veterinary Association has selected the theme 'Veterinarians: Guardians of Food and Health' for this year. We had called many doctors and experts here... We felicitate the distinguished veterinarians today..."" he said.
The programme also witnessed the participation of several doctors and experts from the field, who were invited to commemorate the occasion and recognise the role of veterinarians in safeguarding both animal and public health.
World Veterinary Day is observed annually to acknowledge the vital role played by veterinarians in ensuring animal welfare, food safety, and public health across the globe. It is celebrated on April 25 every year with the theme ""Veterinarians: Guardians of Food and Health"".
The day highlighted the critical role of vets in ensuring food safety, animal welfare, and public health under the ""One Health"" approach, particularly concerning zoonotic diseases, climate change, and food security. (ANI)
J-K: Udhampur poultry farms take preventive steps amid heatwave
ANI | Updated: Apr 26, 2026 08:50 IST",1.0
"Jammu News: प्रचंड गर्मी के बीच जीएमसी
में 40 से अधिक बेड आरक्षित - Amar Ujala",https://news.google.com/rss/articles/CBMijgFBVV95cUxONUdsemhwV0s2MXBtMW5DNVJnT3JqYmxCMDhzelR1T05tTmpsOGlYaXlFSVA2aUZmMjVJWVpWTFpFVXcySkdZSkVnckRZclBhaWpmQm1SS0J5LVRfREV0c09qZU5NT0ZYcVItcWZ4YlNjU2ZJNTRTQ2dYelR4VGgzSVdDRF92Yll6enBLc2Z30gGTAUFVX3lxTE5FaG4zNGs2QkktTDRHdTJxZ0dlSkRiankxWDRpSmI2SUNmdS1fNFdzN2RKV0tKLXhsZXBaZTg3R1lDTmRCa196bnZHUVB6dnNmcW5mTVYzZXdVdkJNZ2pjVkpWU0Jpa3dCNHdBTVFNOGNhZENleVFrSHp0aW82WGxrZGpCT21GTmgzY1pIbjM0TnpFYw?oc=5,Amar Ujala,2026-04-26T02:56:11+05:30,hi,Jammu and Kashmir,Jammu,"""लू"" Jammu and Kashmir","Jammu News: प्रचंड गर्मी के बीच जीएमसी में 40 से अधिक बेड आरक्षित
विज्ञापन
विज्ञापन
-इमरजेंसी वार्ड-1 और 7 में की गई व्यवस्था
अमर उजाला ब्यूरो
जम्मू। बढ़ती गर्मी और लू के खतरे को देखते हुए राजकीय मेडिकल काॅलेज (जीएमसी) प्रशासन ने इमरजेंसी सेवाओं को मजबूत कर दिया है। लू और डिहाइड्रेशन के बढ़ते मामलों से निपटने के लिए इमरजेंसी वार्ड में 40 से अधिक बेड आरक्षित किए गए हैं।
अस्पताल प्रबंधन के अनुसार यह व्यवस्था वार्ड-1 और वार्ड-7 में की गई है जहां मरीजों के लिए आवश्यक जीवनरक्षक उपकरण भी उपलब्ध कराए गए हैं।
लगातार बढ़ रही गर्मी का असर अब लोगों के स्वास्थ्य पर दिखने लगा है। डिहाइड्रेशन, उल्टी और दस्त के मरीजों की संख्या बढ़ने लगी है। खासकर बच्चों में पानी की कमी और उल्टी-दस्त की शिकायतें अधिक सामने आ रही हैं।
अस्पताल में रोज 30 से 40 मरीज केवल गर्मी से जुड़ी समस्याओं के चलते उपचार के लिए पहुंच रहे हैं। प्राथमिक इलाज के बाद अधिकांश मरीजों को घर भेज दिया जाता है। ओपीडी में रोज 1,000 से अधिक और इमरजेंसी में 600 से ज्यादा मरीजों को चिकित्सा सेवाएं दी जा रही हैं।
सुपरिंटेंडेंट डॉ. बीरेंद्र त्रिशल ने बताया कि मौसम में लगातार बदलाव और तेज गर्मी से मरीजों की संख्या बढ़ रही है इसलिए पहले से ही पर्याप्त इंतजाम किए गए हैं ताकि किसी भी आपात स्थिति से निपटा जा सके।
-- -- -- --
खानपान और दिनचर्या में बरतें सावधानी
विशेषज्ञों ने गर्मी में खानपान और दिनचर्या को लेकर सावधानी बरतने की सलाह दी है। वरिष्ठ फिजीशियन डॉ. परवीन जोगराज के अनुसार
- ताजे फल और घर का बना भोजन ही करें।
-जंक फूड और बासी खाने से परहेज रखें।
-तेज धूप से आने के तुरंत बाद पानी न पिएं।
-कुछ देर आराम करने के बाद ही धीरे-धीरे पानी पिएं।
Trending Videos
अमर उजाला ब्यूरो
जम्मू। बढ़ती गर्मी और लू के खतरे को देखते हुए राजकीय मेडिकल काॅलेज (जीएमसी) प्रशासन ने इमरजेंसी सेवाओं को मजबूत कर दिया है। लू और डिहाइड्रेशन के बढ़ते मामलों से निपटने के लिए इमरजेंसी वार्ड में 40 से अधिक बेड आरक्षित किए गए हैं।
अस्पताल प्रबंधन के अनुसार यह व्यवस्था वार्ड-1 और वार्ड-7 में की गई है जहां मरीजों के लिए आवश्यक जीवनरक्षक उपकरण भी उपलब्ध कराए गए हैं।
लगातार बढ़ रही गर्मी का असर अब लोगों के स्वास्थ्य पर दिखने लगा है। डिहाइड्रेशन, उल्टी और दस्त के मरीजों की संख्या बढ़ने लगी है। खासकर बच्चों में पानी की कमी और उल्टी-दस्त की शिकायतें अधिक सामने आ रही हैं।
विज्ञापन
विज्ञापन
अस्पताल में रोज 30 से 40 मरीज केवल गर्मी से जुड़ी समस्याओं के चलते उपचार के लिए पहुंच रहे हैं। प्राथमिक इलाज के बाद अधिकांश मरीजों को घर भेज दिया जाता है। ओपीडी में रोज 1,000 से अधिक और इमरजेंसी में 600 से ज्यादा मरीजों को चिकित्सा सेवाएं दी जा रही हैं।
सुपरिंटेंडेंट डॉ. बीरेंद्र त्रिशल ने बताया कि मौसम में लगातार बदलाव और तेज गर्मी से मरीजों की संख्या बढ़ रही है इसलिए पहले से ही पर्याप्त इंतजाम किए गए हैं ताकि किसी भी आपात स्थिति से निपटा जा सके।
खानपान और दिनचर्या में बरतें सावधानी
विशेषज्ञों ने गर्मी में खानपान और दिनचर्या को लेकर सावधानी बरतने की सलाह दी है। वरिष्ठ फिजीशियन डॉ. परवीन जोगराज के अनुसार
- ताजे फल और घर का बना भोजन ही करें।
-जंक फूड और बासी खाने से परहेज रखें।
-तेज धूप से आने के तुरंत बाद पानी न पिएं।
-कुछ देर आराम करने के बाद ही धीरे-धीरे पानी पिएं।",1.0
