title,url,source,date,language,state,district,search_term,full_text,relevance_score
"जम्मू में गर्मी का कहर जारी, तापमान 39.5 डिग्री पहुंचा; इस हफ्ते कैसा रहेगा मौसम? - Jagran",https://news.google.com/rss/articles/CBMi0gFBVV95cUxOeFg4b2h4eDMzdlhIXzVIRHdqQXdGcFhPYkR5UzRUaEhvZkF5WTdxaUpwNWRpYlZMNkY1N0V4VGQ2S3ljTWx4cFhYV3Q3T2l3OVRZSms0N1MtYXpGNjFBVHplblhXT2k5Q3V0RlQzMnRrOEtZZmN0dk9aT2tQYkk3WUdpenc5RU00UWs3MV9iOHdrMWw2VWtDUzhJU1VITTc5LW9aNDVITVhZdVlSclBtcU9LR3MwSi00N0pRYmJjLXpoeXBDNVhIa1h1eG41QjQ5d0E?oc=5,Jagran,2026-04-26T07:00:00+05:30,hi,Jammu and Kashmir,Jammu,"(""पारा चढ़ा"" OR ""पारा पहुंचा"" OR तापमान OR ""तापमान बढ़ा"" OR ""रिकॉर्ड तोड़ गर्मी"" OR ""डिग्री सेल्सियस"" OR ""पारा उबला"" OR ""अधिकतम तापमान"" OR ""तापमान 40 पार"" OR ""तापमान 45 पार"" OR ""तापमान बढ़ने की संभावना"") Jammu and Kashmir","जम्मू में गर्मी का कहर जारी, तापमान 39.5 डिग्री पहुंचा; इस हफ्ते कैसा रहेगा मौसम?
जम्मू-कश्मीर में अगले कुछ दिनों तक मौसम में उतार-चढ़ाव रहेगा, जिसमें हल्की बारिश और गरज-चमक की संभावना है। जम्मू में शनिवार को 39.5 डिग्री सेल्सियस ता ...और पढ़ें
जागरण संवादददाता, जम्मू। जम्मू-कश्मीर में अगले कुछ दिनों के दौरान मौसम में उतार-चढ़ाव बना रहने की संभावना है। कल मौसम आमतौर पर शुष्क रहेगा, जबकि 27 और 28 अप्रैल को फिर से मौसम करवट ले सकता है।
इन दिनों प्रदेश के कई हिस्सों में हल्की बारिश, गरज-चमक और तेज हवाओं के आसार जताए गए हैं। 29 और 30 अप्रैल को आंशिक बादल छाए रहने के साथ कुछ स्थानों पर हल्की बारिश या गर्जना हो सकती है। 1 और 2 मई को मौसम शुष्क रहने का अनुमान है, जबकि 3 और 4 मई को कुछ स्थानों पर दोपहर या शाम के समय हल्की बारिश संभव है।
जम्मू में तापमान बढ़ने का सिलसिला लगातार जारी है और शनिवार को भी गर्मी ने लोगों को बेहाल रखा। मौसम विज्ञान केंद्र के अनुसार जम्मू का अधिकतम तापमान 39.5 डिग्री सेल्सियस दर्ज किया गया, जो सामान्य से 5.1 डिग्री अधिक रहा। वहीं न्यूनतम तापमान 22.8 डिग्री सेल्सियस रिकॉर्ड किया गया।
जम्मू-कश्मीर में कैसा रहा मौसम
प्रदेश भर में अधिकतम तापमान सामान्य से 2 से 5 डिग्री सेल्सियस ऊपर बना हुआ है, जबकि न्यूनतम तापमान भी सामान्य से अधिक दर्ज किया जा रहा है। अन्य प्रमुख स्थानों में बनिहाल का अधिकतम तापमान 22.0 डिग्री और न्यूनतम 13.4 डिग्री सेल्सियस दर्ज किया गया। बटोत में अधिकतम 27.1 डिग्री तथा न्यूनतम 15.1 डिग्री सेल्सियस रिकॉर्ड हुआ। माता वैष्णो देवी के आधार शिविर कटड़ा में अधिकतम तापमान 36.0 डिग्री सेल्सियस रहा।
कश्मीर घाटी में श्रीनगर का अधिकतम तापमान 21.2 डिग्री और न्यूनतम 13.5 डिग्री सेल्सियस दर्ज किया गया। काजीगुंड में अधिकतम तापमान 20.0 डिग्री और न्यूनतम 10.0 डिग्री सेल्सियस रहा, जबकि पहलगाम में अधिकतम 16.4 डिग्री तथा न्यूनतम 10.0 डिग्री सेल्सियस रिकॉर्ड किया गया।
मौसम विज्ञान केंद्र, श्रीनगर के अनुसार आने वाले दिनों में तापमान में और बढ़ोतरी की संभावना बनी हुई है। लगातार बढ़ती गर्मी के चलते लोगों को दोपहर के समय अनावश्यक बाहर निकलने से बचने और पर्याप्त पानी पीने की सलाह दी गई है।",1.0
