title,url,source,date,language,state,district,search_term,full_text,relevance_score
"Avoid direct exposure, keep hydrated: Ganga Ram Hospital doctor's advice amid prevailing heatwave - The Hans India",https://news.google.com/rss/articles/CBMi4wFBVV95cUxOMUdQQ3N5YkR2S1Z6ZW94cG0wRUhxR0xORmdBT1dKOTliQTVQZnZRZXpoRmV2Szh5bkZRQUZiU3JrYUs2SVctOHZpa1VJS3hjN3FsR3ljYW85SE9nVWhvckZzQVhBejdtTTBGLWU1QXhwSDZIQUl0OWFXWGZpQlE4SFcxN3RwRHNEYTJlMC1MalR5X3gxdWtscU5vZ1pOZmE1ZXdGdzlCWFNkUjJRMDhMZHFVWlhXdlJOWkRzRHBjT0ptQU5Bc3p3R003NFJaR3ZfVDNncjFjWG4xYmo2V243SlREc9IB4wFBVV95cUxOMUdQQ3N5YkR2S1Z6ZW94cG0wRUhxR0xORmdBT1dKOTliQTVQZnZRZXpoRmV2Szh5bkZRQUZiU3JrYUs2SVctOHZpa1VJS3hjN3FsR3ljYW85SE9nVWhvckZzQVhBejdtTTBGLWU1QXhwSDZIQUl0OWFXWGZpQlE4SFcxN3RwRHNEYTJlMC1MalR5X3gxdWtscU5vZ1pOZmE1ZXdGdzlCWFNkUjJRMDhMZHFVWlhXdlJOWkRzRHBjT0ptQU5Bc3p3R003NFJaR3ZfVDNncjFjWG4xYmo2V243SlREcw?oc=5,The Hans India,2026-05-20T20:07:35+05:30,en,Andaman and Nicobar Islands,,"(heatstroke OR ""heat stroke"" OR sunstroke OR ""heat exhaustion"" OR ""heat-related death"" OR ""heat casualty"" OR ""heat fatality"" OR ""suspected heat death"" OR dehydration OR ""heat cramps"" OR ""heat illness"") Andaman and Nicobar Islands","Avoid direct exposure, keep hydrated: Ganga Ram Hospital doctor's advice amid prevailing heatwave
New Delhi: A top doctor of Sir Ganga Ram Hospital's Department of Internal Medicine on Wednesday advised people to avoid direct exposure to the sun and keep themselves hydrated as much as possible, amid the prevailing heatwave conditions in different parts of the country.
According to the India Meteorological Department (IMD), Delhi-NCR, along with Punjab, Haryana, and Chandigarh, is expected to face severe heat during the week. The weather agency has issued an orange alert for Delhi-NCR, warning residents of prolonged heatwave-like conditions over the coming days.
Speaking to IANS, Sir Ganga Ram Hospital's senior consultant Dr Atul Kakar said that there are three types of heat-related problems that are being faced by people.
""One is heat exhaustion, where a person feels weak, lethargic, gets a fever, and experiences an overall lack of energy,"" he said.
He noted that the second one is heat-related cramps, like muscle cramps.
""Finally, the severe form of heat-related complication is heat stroke, which is a medical emergency,"" the doctor added.
He mentioned that this year, Sir Ganga Ram Hospital has so far witnessed complaints of heat cramps and heat exhaustion.
""Patients are coming in with complaints of exhaustion, muscle pain, and fever. All these are problems related to excess heat,"" the doctor said.
D Kakar also prescribes ways to escape the impact of the heatwave.
""Direct exposure to the sun should be as little as possible. The Sun is at its peak from 12 to 3 p.m. If people need to go outdoors during this time, they must cover themselves properly.""
""Use an umbrella or something to cover your head. Also, keep taking ORS water, lassi, etc. to keep yourself hydrated. Such measures will help people to protect themselves,"" he urged.
Further, Dr Kakar advised senior citizens and people facing medical issues like cancer, kidney and heart-related diseases, to protect themselves from direct exposure to the sun at all costs.
""Such patients get severely affected due to the heat. So, they should maintain hydration and keep taking medicines on time,"" he said.
He also emphasised that any kind of extra medicines should be taken only after a doctor's recommendation.",1.0
India on weather edge: Scorching heat to continue on Thursday,https://www.indiatoday.in/science/story/india-heatwave-48-degree-delhi-red-alert-monsoon-kerala-rain-imd-weather-forecast-2914555-2026-05-20,India Today,2026-05-20T19:30:00+05:30,en,Andaman and Nicobar Islands,,"heatwave (Nicobar OR ""North and Middle Andaman"" OR ""South Andaman"") Andaman and Nicobar Islands","India on weather edge: Thursday to witness scorching heat, intense temperatures
As North India bakes in one of the worst heat spells of the season, the South braces for more storms. India's weather department has warned the country of a day of weather extremes, with multiple alerts issued.
Down south and in the islands, it was a different picture entirely.
The lowest minimum temperature recorded today was 19.9°C at Koraput in Odisha.
HOW WILL THE WEATHER BE ON THURSDAY?
The double story continues into Thursday.
MONSOON CONTINUES TO KNOCK
Amidst all of this, India's most anticipated annual weather event is almost here.",0.6833333333333333
"कल का मौसम, 21 मई: जारी रहेगा भीषण गर्मी और लू का कहर, इन राज्यों में बारिश देगी राहत; IMD अलर्ट - Hindustan Hindi News",https://news.google.com/rss/articles/CBMi1gFBVV95cUxNRWszN09oakdlWWVFenpjcDFQLTBjbVlKR2hGcHBtbFBHU1hEWnU4czRwN1dPVXVkLWpUV1hRUTBfdHdLRWUxYi03US1hV3FDOXMwNF90UTNiNXZoVzJWT3V2U2Q2clp0bnJHa0ZkMDQtS3h0SVg1eVNxcG00d3RtcXhRZDM5Ry1VRjAxckMybjlnWDhKb1ZhcmFRVTJwSXNSSmxxdWxtcmsydDRzajJXaXlyUmFLR3lXV1BQaHFxUmlJajFZUE1uODJ0X1N5OXVnR1k2b2530gHbAUFVX3lxTE1vQzA5OERzZ1YtNm5kRTMyenB0R1JsVzhtZ0l0VU5xR3BpNDRDQ1RYR0JwcXhwcEhJNVl3ZFFyVG80WW5MUmZKY1BrbmtDelFONy1SNFJrcEFtWnZPa0MzLVIyLTFQRGhJQUl1RlNTTFp2VFpSQm52MnY1eHY0aE9uTjZ6U3NudHo2S2ZhVnp5dFRPZ2ktUnBIQXVpb0hvV0RzVUtzTm54cUlNeS0tT0tXZGxyM2RBZS1oSGJYU2ttNzlLaEV0Zm9YSUo0enp4blQ1eWQzNjF3UGZNMA?oc=5,Hindustan Hindi News,2026-05-20T21:07:33+05:30,hi,Andaman and Nicobar Islands,,"(लू OR ""लू चलना"" OR ""भीषण गर्मी"" OR ""प्रचंड गर्मी"" OR ""कड़ी धूप"" OR ""तेज धूप"" OR ""गर्म हवा"" OR ""उष्ण लहर"" OR ""ताप लहर"" OR ""हीट वेव"" OR ""झुलसाने वाली गर्मी"" OR ""तपती गर्मी"" OR ""भयंकर गर्मी"" OR ""गर्मी का कहर"" OR ""गर्मी का प्रकोप"" OR ""अत्यधिक गर्मी"" OR मौसम OR ""मौसम अपडेट"" OR ""मौसम का हाल"" OR ""मौसम पूर्वानुमान"" OR ""मौसम अलर्ट"" OR आईएमडी OR ""आईएमडी पूर्वानुमान"" OR ""आईएमडी अलर्ट"" OR ""तापमान में बढ़ोतरी"" OR ""गर्मी से राहत"" OR ""गर्मी से निजात"") Andaman and Nicobar Islands","कल का मौसम, 21 मई: जारी रहेगा भीषण गर्मी और लू का कहर, इन राज्यों में बारिश देगी राहत; IMD अलर्ट
मौसम विभाग की रिपोर्ट के मुताबिक गुरुवार 21 मई को दिल्ली-एनसीआर, राजस्थान और पश्चिमी उत्तर प्रदेश भीषण गर्मी से जूझते हुए नजर आएंगे। मध्य-प्रदेश, महाराष्ट्र के कई इलाकों में हीटवेव का अलर्ट है। पूर्वोत्तर भारत के राज्यों में बारिश का अलर्ट है।
देश के कई राज्य इस समय भीषण गर्मी से जूझ रहे हैं। लेकिन इसके साथ ही कई इलाकों में बारिश भी लोगों को राहत दे रही है। मौसम विभाग की रिपोर्ट के 21 मई, गुरुवार को देश के अलग-अलग हिस्सों का मिजाज काफी बदला हुआ रहने वाला है। पश्चिमी और मध्य भारत जहां गर्मी से जूझता हुआ नजर आएगा, तो वहीं दक्षिण और पूर्वोत्तर भारत में तेज हवाओं और गरज के साथ बारिश अपना असर दिखाएगी। दक्षिण भारत के कई राज्यों में भी बारिश और उमस अपना असर दिखाएगी।
IMD की रिपोर्ट के मुताबिक, पिछले कई दिनों की तरह दिल्ली एनसीआर से लेकर मध्य प्रदेश के कई इलाकों और ऊपर पंजाब, राजस्थान, पश्चिमी उत्तर प्रदेश में गुरुवार को भी हीववेव और भीषण गर्मी का कहर बना रहेगा। मध्य प्रदेश में उत्तरी जिलों में कल भीषण लू चलने की आशंका है। राजस्थान की तपते रेगिस्तान से आने वाली हवाएं अब दिल्ली और मध्य प्रदेश के इलाकों को और भी गर्म करने लगी है। दिन के समय दिल्ली समेत आस पास के राज्यों का तापमान 45 डिग्री सेल्सियस से भी ज्यादा रह सकता है।
उत्तर-पश्चिम राज्यों में एक तरफ जहां गर्मी अपना असर दिखा रही है, वहीं पहाड़ी राज्यों में इस वक्त ठंडक का माहौल है। मौसम विभाग की रिपोर्ट के मुताबिक हिमाचल, जम्मू-कश्मीर और उत्तराखंड के कुछ इलाकों में गुरुवार को हल्की बारिश देखने को मिल सकती है।
पूर्वोत्तर राज्यों में बारिश मेहरबान
उत्तर पश्चिम और मध्य भारत गर्मी से जूझ रहा है, तो दूसरी तरफ पूर्वोत्तर भारत बारिश से परेशान है। अरुणाचल प्रदेश, नागालैंड मणिपुर जैसे राज्यों में पिछले काफी वक्त से लगातार बारिश हो रही है। IMD की रिपोर्ट के मुताबिक गुरुवार को भी पूर्वोत्तर के इन राज्यों में बारिश ही संभावना है। इस दौरान तेज हवाओं के साथ बिजली गिरने की भी संभावना बनी हुई है।
बिहार, झारखंड में उमस करेगी परेशान
पूर्वोत्तर भारत से पश्चिम की तरफ आने पर बिहार, पश्चिम बंगाल और झारखंड जैसे राज्यों में उमस अपना असर दिखाएगी। मौसम के शुष्क होने की वजह से इन राज्यों के कई क्षेत्रों में मौसम अपना असर दिखाएगा। उत्तर भारत की गर्मी और पूर्वोत्तर भारत की बारिश के बीच यह क्षेत्र उमस का शिकार रहेगा। हालांकि, उत्तरी पश्चिम बंगाल और सिक्किम के पर्वतीय इलाकों में पिछले कुछ दिनों की तरह ही बारिश की संभावना बनी हुई है।
दक्षिण भारत में गर्मी, मानसून पर क्या अपडेट
मौसम विभाग की रिपोर्ट के मुताबिक दक्षिण से मानसूनी हवाओं में तेजी बनी हुई है। दक्षिण भारत के राज्यों में इसकी वजह से गर्मी बनी हुई है। हालांकि तटीय इलाकों में बारिश की भी संभावना है। तमिलनाडु, कर्नाटक में बादल छाए रहने की संभावना है। हालांकि इसकी वजह से उमस भी बढ़ेगी। मानसून पर अलर्ट देते हुए मौसम विभाग ने कहा कि मानसून अपनी तेजी बनाए हुए है। 26 मई को इसके केरल के तट पर आने की उम्मीद है।
कैसा रहेगा आपके शहर का मौसम, जानें
लेखक के बारे में
Upendra Thapakउपेंद्र ने डिजिटल पत्रकारिता की शुरुआत लाइव हिन्दुस्तान से की है। पिछले एक साल से वे होम टीम में कंटेंट प्रोड्यूसर के तौर पर कार्यरत हैं। उन्होंने लोकसभा चुनाव 2024, ऑपरेशन सिंदूर और कई राज्यों के विधानसभा चुनावों की कवरेज की है। पत्रकारिता की पढ़ाई भारतीय जनसंचार संस्थान (IIMC), नई दिल्ली (बैच 2023-24) से पूरी करने वाले उपेंद्र को इतिहास, अंतर्राष्ट्रीय संबंध, राजनीति, खेल, विज्ञान और समसामयिक घटनाओं से जुड़े विषयों में गहरी रुचि है। स्नातक स्तर पर बायोटेक्नोलॉजी की पढ़ाई करने के कारण उन्हें मेडिकल और वैज्ञानिक विषयों की भाषा की भी अच्छी समझ है। वे मूल रूप से मध्यप्रदेश के भिंड जिले के निवासी हैं।
और पढ़ें",1.0
"Bharatpur News: 47 डिग्री पहुंचा पारा, भीषण गर्मी से हाहाकार, अस्पताल की OPD में बढ़ी मरीजों - ABP News",https://news.google.com/rss/articles/CBMi2gFBVV95cUxOa2R5cTl5UW9ZN3hQTHo2MjZrTFJocGJCUnlaTE0yS0xqUlE3ZlFXZkM2S3dpYllaallxYzljYlJ5cUM1eDgwczV3VW5TaGJkenVnY29POVBfUkFxUjlDZ0V2ck9jeXJMSWRMN3UzS20tbXZJU0xUOVI4bzcwUDJ5YjdJMlFTazh3NkRfM29EbWZaSFNMbDg5TF9DTXBKNGtSZ09NTEFpbWJtdWd1QTNXTE04OEFvYVllS2ViNjNmZ0dYRzhwS1dCbFcwbVludEZuQ1B5SWhORFdOUdIB3wFBVV95cUxNb1dxVElTT3c3R3k3WEVzY09hRERVSVN0MlFFUG9hZ2VOb1RUenA4X3c1YUkyajFFeGdabjUxWXBCM0RXMm41RWF4TW5QVGpwaFNXcWpLcnhST294VVJQQTN6MkJzaTRGc0xxMmJmbjJPcTVDbHFhTHZOV3hZV3lKMndyX01uMEE0UVRrc0ZvTTlLZ21makdOaWtPc0NGNTZpeGtEZ1VTZk13NHpHMU04ZHF3elAyQzd6TEpRdUd4UFN4QmRaN1J4cF9odWg4ejI2RWQ3WEpZN1l2WkRBRS1z?oc=5,ABP News,2026-05-20T21:02:08+05:30,hi,Andaman and Nicobar Islands,,"(लू OR ""लू चलना"" OR ""भीषण गर्मी"" OR ""प्रचंड गर्मी"" OR ""कड़ी धूप"" OR ""तेज धूप"" OR ""गर्म हवा"" OR ""उष्ण लहर"" OR ""ताप लहर"" OR ""हीट वेव"" OR ""झुलसाने वाली गर्मी"" OR ""तपती गर्मी"" OR ""भयंकर गर्मी"" OR ""गर्मी का कहर"" OR ""गर्मी का प्रकोप"" OR ""अत्यधिक गर्मी"" OR मौसम OR ""मौसम अपडेट"" OR ""मौसम का हाल"" OR ""मौसम पूर्वानुमान"" OR ""मौसम अलर्ट"" OR आईएमडी OR ""आईएमडी पूर्वानुमान"" OR ""आईएमडी अलर्ट"" OR ""तापमान में बढ़ोतरी"" OR ""गर्मी से राहत"" OR ""गर्मी से निजात"") Andaman and Nicobar Islands","Bharatpur News: 47 डिग्री पहुंचा पारा, भीषण गर्मी से हाहाकार, अस्पताल की OPD में बढ़ी मरीजों की संख्या
Bharatpur Heatwave: राजस्थान के भरतपुर में 47°C तापमान के साथ भीषण गर्मी और हीटवेव से जनजीवन अस्त-व्यस्त है. दिन में सड़कें वीरान, वहीं आरबीएम अस्पताल मरीजों से भरा है.
राजस्थान के भरतपुर जिले में सूरज आग उगल रहा है. बढ़ते तापमान और झुलसा देने वाली हीटवेव (Heatwave) से जनजीवन पूरी तरह से अस्त-व्यस्त हो गया है. जिले का तापमान 47 डिग्री सेल्सियस के करीब पहुंच चुका है, जिसके चलते दिन के समय बाजारों और सड़कों पर वीरानी छाई रहती है. झुलसाने वाली इस गर्मी के खौफ से लोग अपने घरों में कैद होने को मजबूर हैं.
इस भीषण गर्मी और मौसम में हो रहे लगातार उतार-चढ़ाव का सीधा असर अब आम जनमानस की सेहत पर दिखने लगा है. तेज धूप और उमस की वजह से शहर के अस्पताल मरीजों से पटे पड़े हैं.
RBM अस्पताल में उमड़ी मरीजों की भीड़, OPD में भारी इजाफा
चिलचिलाती गर्मी के कारण वायरल संक्रमण और पेट संबंधी बीमारियों के मरीजों की संख्या में अचानक भारी उछाल आया है. भरतपुर के सबसे बड़े जिला आरबीएम (RBM) अस्पताल में इन दिनों मरीजों की लंबी कतारें देखी जा रही हैं.
अस्पताल के अधीक्षक डॉ. नागेंद्र भदौरिया ने बताया कि सामान्य दिनों में अस्पताल की ओपीडी (OPD) में करीब 2500 से 3000 मरीज आते थे. लेकिन पिछले कुछ दिनों की भीषण गर्मी के कारण यह आंकड़ा तेजी से बढ़कर 4000 से 4500 को पार कर गया है.
बदलते मौसम से बढ़ा बीमारियों का खतरा
डॉ. भदौरिया के मुताबिक, पिछले एक महीने के भीतर मौसम में काफी उतार-चढ़ाव देखने को मिला है. बीच में बारिश होने से तापमान थोड़ा गिरा था, लेकिन पिछले तीन-चार दिनों से अचानक भयंकर गर्मी बढ़ गई है और पारा 47 डिग्री के आस-पास पहुंच रहा है.
उन्होंने बताया कि ऐसे उमस भरे और गर्म मौसम में वायरल इंफेक्शन सबसे तेजी से फैलता है. अस्पताल में इन दिनों सबसे ज्यादा मरीज उल्टी, दस्त, डिहाइड्रेशन (शरीर में पानी की कमी) और वायरल फीवर के पहुंच रहे हैं. इसके अलावा तेज गर्मी के कारण खाने-पीने से जुड़ी बीमारियों के मामलों में भी भारी बढ़ोतरी दर्ज की गई है.
अस्पताल अधीक्षक की अपील
हालात की गंभीरता को देखते हुए डॉ. नागेंद्र भदौरिया ने जिले के लोगों से गर्मी के दौरान विशेष सावधानी बरतने की अपील की है. हीटवेव और मौसमी बीमारियों से बचने के लिए उन्होंने कुछ अहम सुझाव दिए हैं:
- समय का रखें ध्यान: सुबह 10 बजे से लेकर शाम 4 बजे तक धूप सबसे तेज होती है, इसलिए बहुत ज्यादा जरूरी काम होने पर ही इस दौरान घर से बाहर निकलें.
- खुद को हाइड्रेटेड रखें: गर्मी में पसीने से पानी शरीर से बाहर निकल जाता है. इसलिए पर्याप्त मात्रा में पानी, नींबू पानी या अन्य तरल पदार्थों का लगातार सेवन करते रहें.
- धूप से बचाव: यदि धूप में बाहर निकलना मजबूरी हो, तो सिर और चेहरे को सूती कपड़े या गमछे से अच्छी तरह ढककर रखें और छाते का इस्तेमाल करें.
- खान-पान में सावधानी: गर्मी में हल्का और सुपाच्य भोजन ही लें. बासी या खुले में रखा खाना बिल्कुल न खाएं, ताकि फूड पॉइजनिंग और पेट के संक्रमण से बचा जा सके.
Source: IOCL",1.0
