title,url,source,date,language,state,district,search_term,full_text,relevance_score
"भीषण गर्मी से बेहाल जनजीवन, 44 डिग्री तापमान ने झुलसाया शहर - Hindustan Hindi News",https://news.google.com/rss/articles/CBMixgFBVV95cUxQaGVoUldvclZSbjNtZGNTeGRmMHdacUs3cFg0anBadnkxZDh6LUpzTTVVU2tNbUFlRXhEMmJBT1MzMkNMenNuaTd1Q2oxb3hpRjYxZmNkXzVJMWs2eld2Q3NXN3NCaEZzX3RURk9hT2xxcE5GUkJNVTFNWU51aEpXZmxLM00tMFRMUFFWQ2FnUDFpQXFUMFVKN1BRMldaZ3RZRFNIVkE4c2RGcXlxMVpYNlBTRmNqQXVXaV82WjhPLWV2ZXdDQnfSAcsBQVVfeXFMTkxXZ1d2OUNoLWxKaU84NGZyMWlWMy15VkplLVFPMUJVeXBIVUQzQ0hBYlZHSEdwUzNIWWM1UFE3VWZUc2FMTnoyQW94dFcxcDZXeWdvSHNZQ2tYMzlnUi1QeGdNSWZFZ1JSYndaMGhtWXpyeXhhNHJpcnFYTEU2aVVOYlNrdHVPTjh1Z1JrbF92akRFUXZEaEFyQVRHUkJBeEJTRXJYNXZyQk1WZFBkZFY0bFAyV0MwNWdCN1RQNEx3dUo5R2E5TnJ0TTg?oc=5,Hindustan Hindi News,2026-05-20T23:13:35+05:30,hi,Andaman and Nicobar Islands,,"(सूर्याघात OR तापाघात OR ""लू लगना"" OR ""लू से मौत"" OR ""गर्मी से मौत"" OR ""हीट स्ट्रोक"" OR ""सन स्ट्रोक"" OR ""लू से मरे"" OR निर्जलीकरण OR डिहाइड्रेशन OR ""अस्पताल में भर्ती"" OR ""गर्मी से बेहाल"" OR ""गर्मी से त्राहि-त्राहि"") Andaman and Nicobar Islands","भीषण गर्मी से बेहाल जनजीवन, 44 डिग्री तापमान ने झुलसाया शहर
Shamli News - शामली में भीषण गर्मी ने जनजीवन को प्रभावित किया है। अधिकतम तापमान 44 डिग्री सेल्सियस तक पहुँच गया है। लोग घरों में कैद रहने को मजबूर हैं। रात में भी गर्मी से राहत नहीं मिल रही है। चिकित्सकों ने सावधानी बरतने की सलाह दी है। ठंडे पेय पदार्थों की मांग बढ़ी है।
शामली। जनपद में पड़ रही भीषण गर्मी ने लोगों का जनजीवन पूरी तरह प्रभावित कर दिया है। आसमान से बरस रही आग और तेज धूप के कारण दोपहर के समय सड़कें और बाजार सूने नजर आने लगे हैं। बुधवार को अधिकतम तापमान 44 डिग्री सेल्सियस तक पहुंच गया, जबकि न्यूनतम तापमान भी 27 डिग्री सेल्सियस दर्ज किया गया। दिनभर चल रही गर्म हवाओं और चिलचिलाती धूप ने लोगों को घरों में कैद रहने पर मजबूर कर दिया। बुधवार को सुबह से ही तेज धूप का असर शुरू हो गया था। दोपहर होते-होते सड़कों पर सन्नाटा पसर गया और जरूरी काम से निकलने वाले लोग भी सिर और चेहरे को कपड़ों से ढककर निकलते दिखाई दिए। बाजारों में आम दिनों की तुलना में काफी कम भीड़ रही। गर्मी के चलते सबसे अधिक परेशानी दिहाड़ी मजदूरों, रिक्शा चालकों और राहगीरों को उठानी पड़ रही है। रात में भी लोगों को गर्मी से राहत नहीं मिल पा रही है। न्यूनतम तापमान अधिक होने तथा उमस बढ़ने से लोगों की नींद पूरी नहीं हो पा रही है। ऊपर से बिजली की लो वोल्टेज समस्या ने परेशानियों को और बढ़ा दिया है। लो वोल्टेज के कारण कई क्षेत्रों में एसी, कूलर और पंखे ठीक से नहीं चल पा रहे हैं, जिससे लोग रातभर गर्मी से बेहाल रहे।
ठंडे पेय पदार्थों की मांग बढ़ी
चिकित्सकों ने भीषण गर्मी को देखते हुए लोगों को दोपहर के समय घरों से बाहर न निकलने, अधिक से अधिक पानी पीने और धूप से बचाव करने की सलाह दी है। वहीं गर्मी बढ़ने के साथ शीतल पेय, जूस, नींबू पानी और ठंडे पेय पदार्थों की मांग में भी तेजी आ गई है। मौसम विशेषज्ञों का कहना है कि फिलहाल गर्मी से राहत मिलने के आसार कम हैं और आने वाले दिनों में तापमान में और बढ़ोतरी हो सकती है। ऐसे में लोगों को सावधानी बरतने की जरूरत है।",1.0
"बढ़ते तापमान को लेकर जारी की एडवाजरी, लू से बचाव को लेकर बरतें सावधानी - Dnewsnetwork",https://news.google.com/rss/articles/CBMivwJBVV95cUxQNWZQZnRDUExvNEYyRi1WamZzcU5MSlJ4a0Y4Q3pJdnA2cmt2bm9JLTk2TVhoeHdjcW5CVkRzRTY0RXBFQmxHTU1iVFdYYktNcnE5TWZMekxpeTMxZXBCbktCV3cwUDlGekRwandFTW5KbTk3aEFONmtudnZxTF9VX3BhVEJsS2FJSWxmUWh3Nlh5YXBxUUxRLXpEcmdQQ19wS2ZmNXlkU05XWHFjczZVU0l4SkZ0STBqeXI0UHpiZnFwSFJsR0JpbUJXcWY0UDZjdWt5VnVaTXp0cjJvaGNkWkJ0Q0dNTTZDUFQ1OTlhdDhCeFZzLTFobzZEM3lTX1VSaHpkdWNsTmpZZmZlQVowR3B5WTduZWI2MUh5SExDUWxWaXZYdDdWZlBFTXlsQkhsU0dYckpGdkM1SmwwNWdv?oc=5,Dnewsnetwork,2026-05-20T17:31:08+05:30,hi,Andaman and Nicobar Islands,,"(""पारा चढ़ा"" OR ""पारा पहुंचा"" OR तापमान OR ""तापमान बढ़ा"" OR ""रिकॉर्ड तोड़ गर्मी"" OR ""डिग्री सेल्सियस"" OR ""पारा उबला"" OR ""अधिकतम तापमान"" OR ""तापमान 40 पार"" OR ""तापमान 45 पार"" OR ""तापमान बढ़ने की संभावना"") Andaman and Nicobar Islands","Dnewsnetwork
ऊना, 20 मई। जिला ऊना में बढ़ते तापमान( हीट स्ट्रोक) से बचाव को लेकर मुख्य चिकित्सा अधिकारी ऊना डॉ संजीव कुमार वर्मा ने एडवायजरी जारी की है। उन्होंने बताया कि जंगलों में आग लगने के चलते तापमान में वृद्धि हो रही है। इससे हीट स्ट्रोक जानलेवा हो सकता है इसलिए हीट स्ट्रोक/लू लगने व गर्मी से बचाब के लिए सावधानियां बरतना बेहद आवश्यक है।
सुरक्षा उपाय
सीएमओ ने बताया कि गर्मियों के मौसम में भरपूर पानी पीयें, चाहे आपको प्यास न भी हो, जब भी यात्रा करें पानी साथ लेकर जाएँ, ओ आर एस का प्रयोग करें, निम्बू पानी, लस्सी आदि लेते रहें ताकि शरीर में पानी की कमी न हो, हल्के सूती व ढीले कपड़े पहनें, धूप में निकलने पर छाता, तौलिया, व टोपी का सिर ढकने के लिए प्रयोग करें, धूप में जाते समय जूते चप्पल पहनकर निकलें, दिन के समय धूप आने वाली जगह की खिड़कियाँ बंद रखें व पर्दा लगा कर रखें, रात के समय खिड़कियां खुली रखें, सुरक्षित वातावरण बनाएं, ठन्डे पानी से छींटे मारें, पंखे का प्रयोग करें, रेडियो, टीवी व अखबार के माध्यम से मौसम की अपडेट लेते रहें।
क्या न करें
उन्होंने बताया कि जरूरत न हो तो बाहर न निकलें, विशेषकर दिन में 12 बजे से 4 बजे के बीच में, भारी कार्य जैसे कसरत इत्यादि न करें, शराब, चाय, कॉफी, अत्यधिक मीठे पेय पदार्थ, कोल्ड ड्रिंक गैस वाले पदार्थों का सेवन न करें, धूप में बच्चों को न खेलने दें, बासी खाना न खाएं, गर्मी की चरम सीमा में खाना ना बनाएं, धूप में बच्चों और पालतू जानवरों को गाड़ी में अकेला न छोड़ें।
लक्षणों के प्रति रहें सचेत
डॉ वर्मा ने बताया कि तेज सिर दर्द, शारीर का तापमान 104 डिग्री फारेनहाइट, जी मचलाना और उलटी होना, घबराहट होना, सिर चकराना, बेहोशी और चक्कर आना सांस का फूलना, दिल की धड़कन तेज होना, गर्म लाल और सूखी त्वचा,हीट स्ट्रोक व लू लगने से बचाव के लिए सावधानियां बरतना अति आवश्यक है।
इसके अतिरिक्त गर्मी व लू लगने पर प्राथमिक चिकित्सा के रूप में मरीज को तुरंत अंदर या छाया में रखें, पैरों को थोड़ा ऊँचा करके लिटाएं, पंखे का इस्तेमाल करके हवा के प्रवाह को तेज करें, गीले कपड़े से शरीर पौंछें या पानी से छिड़काव करें, बेहोशी की हालत में खाने पीने को कुछ न दें, होश आने पर ठंडा पानी या तरल पदार्थ पीने को दें, बेहोशी की हालत में अगर उल्टियां हो तो करवट के बल लिटायें, गंभीर लक्षण होने पर नजदीकी स्वास्थ्य केंद्र पर जाएँ या एम्बुलेंस को कॉल करें। साथ ही छोटे बच्चे, गर्भवती महिलाएं, बाहर काम करने वाले लोग, मानसिक रूप से अस्वस्थ व दिव्यांग व्यक्ति गर्मी के मौसम में सावधानियां अवश्य बरतें।",1.0
