title,url,source,date,language,state,district,search_term,full_text,relevance_score
MP Weather Today: लू की चपेट में मध्य प्रदेश - rajexpress.com,https://news.google.com/rss/articles/CBMirgFBVV95cUxPZ1phMXMxQlBOcTRKblQ4RVZGeVZvUEZMTU5MdC1rMVBHeWNRWnhkb1NtLUQ4cGhXX1JPbGl3aklmdk9yeV9FcVdNeUt4Tm03UmFwejY0Q0NZQndZYmdSUE50WTcwU3IzQmtVdVRhSWFfemtHYWZvTXRKUDBlQTUzRm9uNnBuOWktLVRsY2R2TE5EX3pmaVVnTjlvOXo2OVk4ZWlWSUdKMEFjbXh4RkE?oc=5,rajexpress.com,2026-04-24T10:47:35+05:30,hi,Madhya Pradesh,Khandwa,"""लू"" Madhya Pradesh","सुप्रीम कोर्ट में छाया रिकॉर्डतोड़ वोटिंग का मुद्दा: CJI बोले- मतदान का प्रतिशत देखकर खुशी हो रही; SIR पर हो रही थी सुनवाई
MI पर इंजरी नियमों के मिसयूज का आरोप: सैंटनर की जगह शार्दुल को मैदान में उतारने पर कंट्रोवर्सी, काेच जयवर्धने बोले- रूल्स फॉलो हुए
खंडवा में नकली घी फैक्ट्री पर छापा: भारी मात्रा में चर्बी और संदिग्ध सामग्री जब्त, इमलीपुरा क्षेत्र में प्रशासन की कार्रवाई
सुनीता आहूजा बोलीं- मुझे नहीं पता गोविंदा कहां हैं: अपने घर पर होंगे; कृष्णा अभिषेक सुलह पर कहा- पापी पेट के लिए गिले-शिकवे दूर किए
यूनियन कार्बाइड की 900 मीट्रिक टन जहरीली राख पर हाईकोर्ट सख्त,: टॉक्सिसिटी रिपोर्ट तलब, अगली सुनवाई 22 जून को",0.5166666666666666
