title,url,source,date,language,state,district,search_term,full_text,relevance_score
"भीषण गर्मी और लू से जनजीवन बेहाल, 40 डिग्री पहुंचा पारा - Hindustan Hindi News",https://news.google.com/rss/articles/CBMizAFBVV95cUxPYkpNbjcyNThPXy14UmtVWk5fc2R2eW4yZTQ1cUd1S2NRQUxVTU8yelNpa1FVQllHQXpURFNlMjNkbGFjNnZzRlA0UjM1NFJrb01UcWhsc0IzcE1UanZpeDI0c0JYTVFNT3ZuR3lGWldoWUt0ZnYzV3FjV2dTM2txUkg0aC04MmZ4N0VSQUdIaVpSSnlGNlI5NjVfZlJ4R0NZb19rdVVfMmFXdGV1QUJKcUhNTzZxZUR0b0JpcG1zY3M2NEJhQ1d3aElfV0HSAdIBQVVfeXFMTVRMVllFVmY1YjNnVnc0ZndyU29oMHNMVGNiSHMyN2U0TTh0VTBld09OT0hqc3JPTy1MSWgxRmlWV003UHhLZU5zd2RxS2YtLU4wWFc3bEl5QkN1NUhRcDI1bm5Fb3dVSzVoS3pSS29COE5kTkZ2RDlPeHA4YUxZTlVsd2NVV3lsN1NOemFQTkhDZ0k2YUJtTk9iY3EtSm85QndiQ0xXdGYyaUN0NGVFaklaZlZxWmtSNnZ1djg0aGxCS204cFZwN1lXQ2kxSm1VVmN3?oc=5,Hindustan Hindi News,2026-05-22T15:14:36+05:30,hi,Haryana,,"(लू OR ""लू चलना"" OR ""भीषण गर्मी"" OR ""प्रचंड गर्मी"" OR ""कड़ी धूप"" OR ""तेज धूप"" OR ""गर्म हवा"" OR ""उष्ण लहर"" OR ""ताप लहर"" OR ""हीट वेव"" OR ""झुलसाने वाली गर्मी"" OR ""तपती गर्मी"" OR ""भयंकर गर्मी"" OR ""गर्मी का कहर"" OR ""गर्मी का प्रकोप"" OR ""अत्यधिक गर्मी"" OR मौसम OR ""मौसम अपडेट"" OR ""मौसम का हाल"" OR ""मौसम पूर्वानुमान"" OR ""मौसम अलर्ट"" OR आईएमडी OR ""आईएमडी पूर्वानुमान"" OR ""आईएमडी अलर्ट"" OR ""तापमान में बढ़ोतरी"" OR ""गर्मी से राहत"" OR ""गर्मी से निजात"") Haryana","नारायणपुर प्रखंड क्षेत्र में कड़ाके की धूप और गर्म हवाओं का दौर जारी है। अधिकतम तापमान 40 डिग्री सेल्सियस और न्यूनतम 27 डिग्री सेल्सियस दर्ज किया गया है। गर्मी से जनजीवन प्रभावित हुआ है, और जलस्रोतों का जलस्तर घट रहा है। पानी की कमी से लोगों और पशु-पक्षियों को दिक्कतें हो रही हैं।
नारायणपुर। नारायणपुर प्रखंड क्षेत्र में इन दिनों कड़ाके की धूप और गर्म हवाओं का दौर लगातार जारी है। शुक्रवार को प्रखंड क्षेत्र में अधिकतम तापमान 40 डिग्री सेल्सियस तथा न्यूनतम तापमान 27 डिग्री सेल्सियस दर्ज किया गया। भीषण गर्मी और आग उगलती धूप से आम जनजीवन पूरी तरह प्रभावित हो गया है।
स्थिति यह है कि सुबह 11 बजे के बाद से शाम करीब 4 बजे तक हाट-बाजारों और सड़कों पर सन्नाटा पसरा रहता है। तेज धूप और गर्म हवा के कारण लोग जरूरी काम होने पर ही घरों से बाहर निकल रहे हैं। दोपहर के समय बाजारों में आवाजाही काफी कम देखी जा रही है। मौसम विभाग के अनुसार आने वाले कुछ दिनों तक तापमान में और बढ़ोतरी होने की संभावना है। इस वर्ष गर्मी ने शुरुआती दौर में ही कई वर्षों का रिकॉर्ड तोड़ दिया है। लगातार बढ़ते तापमान और लू जैसी स्थिति से लोगों की परेशानी बढ़ गई है।
भीषण गर्मी का असर जलस्रोतों पर भी साफ दिखाई देने लगा है। क्षेत्र के अधिकतर नदी, तालाब और कुओं का जलस्तर तेजी से घट रहा है तथा कई जलस्रोत सूखने की कगार पर पहुंच गए हैं। पानी की कमी के कारण आम लोगों के साथ-साथ पशु-पक्षियों को भी काफी दिक्कतों का सामना करना पड़ रहा है।
अक्सर पूछे जाने वाले प्रश्न
✦नारायणपुर में अधिकतम तापमान कितना दर्ज किया गया?−
नारायणपुर में अधिकतम तापमान 40 डिग्री सेल्सियस दर्ज किया गया।",1.0
