title,url,source,date,language,state,district,search_term,full_text,relevance_score
"लू के बढ़ते खतरे पर DM कविता मीना सख्त, हापुड़ के सभी विभागों को दिए कड़े निर्देश - Jagran",https://news.google.com/rss/articles/CBMipgJBVV95cUxOWjNtUnVzaFVTc0pHTFd5cDQxbkt0RU5tVURsc0FNOHdsQ3dPcEF2cjUtT01DVkFiTkJ1Y0ZpdkxpakJEcHBCdG03LWc5U1ZxbGJLNGJxbHAxSXpkR0tRRVdrejVfQ3NHSUR5VEhVdElVTk9UM1JRRUlpVmI2bXlvOWNuOGRXRjZnNl8tOThTcXQ5R1pFcWN5M0R6LWhIbHVPTzVISW9LaVlnbFlydWphNmNoVUZ3MzhuTW4wTlk0dmR2Q0lBVFJNVV8yclBFd2xkbnc5X09yN2ZLRGw3QnZLQTRsTUNBLUxCTktVN3RsRndob1pLa0N6aVNTOVBael9HVVdyT0NmYWVMYkZ1MnNLV2dYbVV6YnpOTXhaRXdFT3NIdzI0OHc?oc=5,Jagran,2026-05-09T16:47:00+05:30,hi,Uttar Pradesh,Agra,"""लू"" Uttar Pradesh","लू के बढ़ते खतरे पर DM कविता मीना सख्त, हापुड़ के सभी विभागों को दिए कड़े निर्देश
हापुड़ में लगातार बढ़ते तापमान और संभावित लू के खतरे को देखते हुए जिला प्रशासन पूरी तरह सतर्क हो गया है। ...और पढ़ें
जागरण संवाददाता, हापुड़। हापुड़ जिले में लगातार बढ़ते तापमान और संभावित हीट वेव के खतरे को देखते हुए जिला प्रशासन पूरी तरह सतर्क हो गया है।
बृहस्पतिवार को कलेक्ट्रेट सभागार में जिलाधिकारी कविता मीना की अध्यक्षता में आयोजित समीक्षा बैठक में सभी विभागों को अलर्ट मोड पर रहते हुए हीट वेव एक्शन प्लान के तहत प्रभावी कार्रवाई करने के निर्देश दिए गए।
बैठक में जिला आपदा विशेषज्ञ गजेंद्र सिंह बघेल ने विभिन्न विभागों की तैयारियों और लू से बचाव के उपायों को लेकर विस्तृत प्रस्तुतीकरण दिया। उन्होंने बताया कि भीषण गर्मी के दौरान स्वास्थ्य सेवाओं, पेयजल आपूर्ति, बिजली व्यवस्था और जनजागरूकता अभियान को मजबूत रखना बेहद जरूरी है।
कर्मियों को अलर्ट मोड पर रखने के निर्देश
जिलाधिकारी कविता मीना ने स्वास्थ्य विभाग को निर्देशित किया कि जिला अस्पताल, सामुदायिक स्वास्थ्य केंद्र और प्राथमिक स्वास्थ्य केंद्रों पर हीट स्ट्रोक से संबंधित दवाइयों, ओआरएस, आइस पैक और पर्याप्त पेयजल की उपलब्धता सुनिश्चित की जाए। चिकित्सकों और स्वास्थ्य कर्मियों को भी अलर्ट मोड पर रखने के निर्देश दिए गए हैं, ताकि किसी भी आपात स्थिति में तत्काल उपचार उपलब्ध कराया जा सके।
नगर पालिका, नगर पंचायतों और पंचायती राज विभाग को सार्वजनिक स्थलों, बाजारों, बस स्टैंड, रेलवे स्टेशन तथा अन्य भीड़भाड़ वाले क्षेत्रों में पेयजल की समुचित व्यवस्था करने के निर्देश दिए गए।
इसके अलावा लोगों को राहत देने के लिए छायादार स्थानों और अस्थायी शेड की व्यवस्था सुनिश्चित करने को कहा गया। साफ-सफाई व्यवस्था बनाए रखने और जलभराव जैसी समस्याओं को तुरंत दूर करने के निर्देश भी दिए गए।
विद्युत विभाग को गर्मी के मौसम में निर्बाध बिजली आपूर्ति बनाए रखने के निर्देश दिए गए। जिलाधिकारी ने कहा कि किसी भी क्षेत्र में बिजली खराबी की शिकायत मिलने पर तत्काल टीम भेजकर समस्या का समाधान किया जाए, जिससे लोगों को परेशानी का सामना न करना पड़े।
शिक्षा विभाग को स्कूलों में बच्चों को लू से बचाव के उपायों के प्रति जागरूक करने के निर्देश दिए गए। छात्रों को अधिक धूप में बाहर न निकलने, पर्याप्त पानी पीने और हल्के कपड़े पहनने की सलाह देने को कहा गया।
खबरें और भी
जिलाधिकारी कविता मीना ने कहा कि श्रमिकों, वृद्धजनों, बच्चों और बीमार लोगों की सुरक्षा को प्राथमिकता दी जाए। सभी विभाग आपसी समन्वय बनाकर कार्य करें और हीट वेव एक्शन प्लान को प्रभावी ढंग से लागू करें। उन्होंने अधिकारियों को गांवों और शहरों में लगातार जनजागरूकता अभियान चलाने के निर्देश भी दिए। बैठक में विभिन्न विभागों के अधिकारी मौजूद रहे।
इसके अलावा नागरिक सुरक्षा कोर से मोहित शर्मा, गजवीर सिंह, नवराज, अंकित तथा आपदा मित्र आरती, प्रभजोत, नीरज और हिमानी भी उपस्थित रहे।",1.0
