title,url,source,date,language,state,district,search_term,full_text,relevance_score
"Saran Weather Update: लू के थपेड़ों से झुलसा सारण, 44 डिग्री पहुंचा पारा; मानसून की नो-एंट्री? - Jagran",https://news.google.com/rss/articles/CBMitgFBVV95cUxPSEVpbFFDbTZZSWxHR0NNeTYxOUdrbHFHSXktVDJNcDZxM1BzREFrdGNoOVd2b1Zndk1MVFIzMGhBYnI3aUROUEpVSTdQUmxybExYeS11LXIwejBncjM3bVoyMXFNX2s1V2JhRnNVQ092TFpVMW5UUzdtQTRad0hYWGw0bGQxbTFSeXdjdW5DTUJNdHNTeFlPa1FzZEgxbHRGaTQ2VTVuRFBVeUtMQkN1ZnBjTDB3dw?oc=5,Jagran,2026-06-18T14:13:00+05:30,hi,Bihar,Saran,"(लू OR ""लू चलना"" OR ""भीषण गर्मी"" OR ""प्रचंड गर्मी"" OR ""कड़ी धूप"" OR ""तेज धूप"" OR ""गर्म हवा"" OR ""उष्ण लहर"" OR ""ताप लहर"" OR ""हीट वेव"" OR ""झुलसाने वाली गर्मी"" OR ""तपती गर्मी"" OR ""भयंकर गर्मी"" OR ""गर्मी का कहर"" OR ""गर्मी का प्रकोप"" OR ""अत्यधिक गर्मी"" OR मौसम OR ""मौसम अपडेट"" OR ""मौसम का हाल"" OR ""मौसम पूर्वानुमान"" OR ""मौसम अलर्ट"" OR आईएमडी OR ""आईएमडी पूर्वानुमान"" OR ""आईएमडी अलर्ट"" OR ""तापमान में बढ़ोतरी"" OR ""गर्मी से राहत"" OR ""गर्मी से निजात"") Bihar","Saran Weather Update: लू के थपेड़ों से झुलसा सारण, 44 डिग्री पहुंचा पारा; मानसून की नो-एंट्री?
सारण में मानसून की देरी से भीषण गर्मी पड़ रही है, पारा 44 डिग्री सेल्सियस तक पहुंच गया है, जिससे जनजीवन प्रभावित है। अस्पतालों में गर्मी से संबंधित बी ...और पढ़ें
HighLights
सारण में पारा 44 डिग्री सेल्सियस पहुंचा, उमस बढ़ी।
मानसून की देरी से जनजीवन प्रभावित, सड़कें सूनी।
अस्पतालों में गर्मी के मरीजों की संख्या में वृद्धि।
जागरण संवाददाता, छपरा। मानसून की बाट जोह रहे सारणवासियों के लिए गर्मी हर दिन नई चुनौती बनकर सामने आ रही है। बुधवार को पारा 44 डिग्री पर पहुंच गया, जबकि उमस ने लोगों की परेशानी को कई गुना बढ़ा दिया। हालत यह है कि इंसान ही नहीं, पशु-पक्षी भी राहत की तलाश में भटकते नजर आ रहे हैं।
मौसम विभाग के अनुसार, अगले एक सप्ताह तक तापमान और उमस में और बढ़ोतरी की संभावना है। भीषण गर्मी और लू के थपेड़ों ने जिले में जनजीवन को प्रभावित कर दिया है।
सुबह 10 बजे के बाद ही सड़कों पर आवाजाही कम होने लगती है और दोपहर तक प्रमुख बाजारों तथा चौक-चौराहों पर सन्नाटा पसर जाता है।
जरूरी काम होने पर ही लोग घरों से बाहर निकल रहे हैं। गर्म हवाओं के कारण राहगीरों, रिक्शा चालकों और दिहाड़ी मजदूरों को सबसे अधिक परेशानी झेलनी पड़ रही है।
मानसून की राह देख रहे जिलेवासी:
जून के मध्य तक मानसून के आगमन की उम्मीद रहती है, लेकिन अब तक जिले में मानसून ने दस्तक नहीं दी है। बरसात नहीं होने से धरती तप रही है और वातावरण में गर्मी लगातार बढ़ रही है।
किसान भी आसमान की ओर टकटकी लगाए हुए हैं। लोगों का कहना है कि बरसात होने के बाद ही इस भीषण गर्मी से राहत मिलने की उम्मीद है।
अस्पतालों में बढ़ी मरीजों की संख्या:
गर्मी का असर लोगों के स्वास्थ्य पर भी दिखाई देने लगा है। सदर अस्पताल सहित निजी क्लीनिकों में गर्मी, डिहाइड्रेशन और बुखार के मरीजों की संख्या बढ़ रही है।
विशेष रूप से छोटे बच्चों और बुजुर्गों को अधिक परेशानी का सामना करना पड़ रहा है। चिकित्सकों ने लोगों को धूप से बचने और पर्याप्त मात्रा में पानी पीने की सलाह दी है।
शहर के शिशु रोग विशेषज्ञ डा. संदीप यादव ने बताया कि गर्मी के मौसम में नवजात और छोटे बच्चों को विशेष देखभाल की जरूरत होती है। बच्चों को ठंडे और हवादार स्थान पर रखें तथा शरीर में पानी की कमी नहीं होने दें। तेज धूप के संपर्क से बचाना भी जरूरी है।
गर्मी में बच्चों का ऐसे रखें ख्याल:
- बुखार, उल्टी या सुस्ती होने पर चिकित्सक से संपर्क करें।
- सुबह और शाम के समय ही बच्चों को बाहर खेलने दें।",1.0
