title,url,source,date,language,state,district,search_term,full_text,relevance_score
"स्वास्थ्य विभाग ने जारी की एडवाइजरी, बच्चों और बुजुर्गों को खास सावधानी की सलाह - Arth Parkash",https://news.google.com/rss/articles/CBMifEFVX3lxTE1hdUpleVZrNFRDMUlnMTFCZklPOWJWY005QnR2TnVLSnlkY0dQazYyTjhNSnpLZHZORzA1V2JpcHNzN2E4VDRzS0k5Qmp3UTE0TUFFeF9RQVRBcmxkR3RUMVQ0bHlBdWtBVGh6bTNXcDZMaTFXMkdiZXhzSTA?oc=5,Arth Parkash,2026-05-20T04:16:10+05:30,hi,Chandigarh,Chandigarh,"(""हीट एक्शन प्लान"" OR ""गर्मी से राहत"" OR चेतावनी OR ""रेड अलर्ट"" OR ""ऑरेंज अलर्ट"" OR ""येलो अलर्ट"" OR एडवाइजरी OR ""राहत सामग्री"" OR ""राहत शिविर"" OR मुआवजा) Chandigarh","स्वास्थ्य विभाग ने जारी की एडवाइजरी, बच्चों और बुजुर्गों को खास सावधानी की सलाह
The Health Department has issued an advisory, advising special caution for children and the elderly
बढ़ती गर्मी और हीट वेव को देखते हुए स्वास्थ्य एवं परिवार कल्याण विभाग की ओर से एडवाइजरी जारी की गई है। विभाग ने लोगों को गर्मी और लू से बचाव के लिए पर्याप्त मात्रा में पानी पीने, धूप से बचने और खानपान में सावधानी बरतने की सलाह दी है।
एडवाइजरी के अनुसार लोगों को बार-बार पानी पीना चाहिए, भले ही प्यास न लगे। यात्रा के दौरान अपने साथ पीने का पानी जरूर रखें। इसके अलावा नींबू पानी, लस्सी, छाछ, जलजीरा, आम पन्ना और नारियल पानी जैसे प्राकृतिक पेय पदार्थों का सेवन करने की सलाह दी गई है। तरबूज, खरबूजा, खीरा और संतरे जैसे पानी से भरपूर मौसमी फलों को खाने पर भी जोर दिया गया है।
स्वास्थ्य विभाग ने लोगों को दोपहर के समय तेज धूप में बाहर निकलने से बचने की सलाह दी है। हल्के रंग के सूती कपड़े पहनने, सिर को टोपी या छाते से ढकने और घरों की खिड़कियां दिन में बंद तथा रात में खुली रखने के निर्देश दिए गए हैं।
विभाग ने छोटे बच्चों, गर्भवती महिलाओं, बाहर काम करने वाले मजदूरों, बीमार और बुजुर्ग लोगों को ज्यादा सावधानी बरतने को कहा है। साथ ही चाय, कॉफी, शराब और ज्यादा शक्कर वाले पेय पदार्थों से दूरी बनाने की सलाह दी गई है, क्योंकि इससे शरीर में पानी की कमी हो सकती है।
एडवाइजरी में बासी भोजन से बचने और बच्चों या पालतू जानवरों को बंद वाहनों में अकेला न छोड़ने की भी अपील की गई है।
क्या करें
- नींबू पानी, लस्सी, छाछ, जलजीरा, आम पन्ना और नारियल पानी का सेवन करें
- बच्चों, बुजुर्गों और बीमार लोगों का विशेष ध्यान रखें
क्या न करें
- शराब, ज्यादा चाय-कॉफी और कोल्ड ड्रिंक का सेवन न करें
- बासी भोजन खाने से बचें
- बच्चों या पालतू जानवरों को बंद वाहन में अकेला न छोड़ें
- खाली पेट और बिना पानी के बाहर न जाएं",1.0
"पंजाब-चंडीगढ़ में 6 दिन हीटवेव का अलर्ट: टेंपरेचर 43 डिग्री पार, बारिश के नहीं आसार; बिजली की डिमांड 10738 म... - Dainik Bhaskar",https://news.google.com/rss/articles/CBMisAFBVV95cUxOTU9HRWxGaDBiSjJLOUN5NXhBYWZTT1Qwc2lWel9RVVJfUER4a25nUHR2ZzRsN1M3bVcyZUkxekMtRjl2UUdLUzd6bkJhb1RnWWcxbGZPQzQ1MWVIV1JWcnFxcl9lMjA4Y0FjMXdzM3k2aWlHLXNNVnRaMXA0eTJUQm9VbTZPOG5YNWVZcjBtbVhGbXZYQWYyX3V6M3dBTklBV1JGeHhDUGJleFBGcmlrWtIBtgFBVV95cUxOSW5BRmtEWHpMd3VBVURlUXlwQUw5WmUxZmt2bXBmd3ZpVVZGc2tDTmktd1N6S0o1TXo0VUQ2SjREcnJ4NGp2LTRsUWVPal9salR3U3VjQVdqRVBwazJ1Vlcxell6czJjU0Q1T3BVX01kbG1uSldXZ05sT04yRE9CQ1ZScGV2WnBZd2lBOWo2TkFHeU9haTRWRlZmOUtiTDJLVmNHNGxxSHIwclE4UzRteXV0QV9rZw?oc=5,Dainik Bhaskar,2026-05-20T03:07:11+05:30,hi,Chandigarh,Chandigarh,लू (Chandigarh) Chandigarh,"पंजाब-चंडीगढ़ में 6 दिन हीटवेव का अलर्ट:टेंपरेचर 43 डिग्री पार, बारिश के नहीं आसार; बिजली की डिमांड 10738 मेगावाट पर पहुंची
- कॉपी लिंक
पंजाब और चंडीगढ़ में गर्मी ने तेवर दिखाने शुरू कर दिए है। आज से अगले 6 दिन लगातार हीटवेव चलेगी। मौसम विज्ञान केंद्र चंडीगढ़ ने पांच जिलों फाजिल्का, फरीदकोट, मुक्तसर, बठिंडा और मानसा में हीटवेव का यलो अलर्ट जारी किया है। इस दौरान मौसम ड्राई बना रहेगा।
तापमान में रविवार की तुलना में 1.2 डिग्री की बढ़ोतरी हुई है। अब यह सामान्य के करीब बना हुआ है। सबसे अधिक तापमान बठिंडा में 43.1 डिग्री दर्ज किया गया है। वहीं, गर्मी बढ़ने के साथ ही बिजली की डिमांड भी बढ़ गई है। राज्य में सुबह ही बिजली की डिमांड 10738 मेगावाट पर पहुंच गई है। इस दौरान 7412 मैगावाट बिजली केंद्रीय पूल और 3343 मेगावाट बिजली पंजाब खुद उत्पादन कर रहा है।
22 से 30 मई के बीच दस्तक दे सकता मानसून
मौसम विभाग के मुताबिक, इस साल मानसून के 26 मई के आसपास केरल पहुंचने की संभावना है। हालांकि इसमें 4 दिन आगे-पीछे का फर्क हो सकता है। यानी मानसून 22 से 30 मई के बीच कभी भी दस्तक दे सकता है। साथ ही, एक पश्चिमी विक्षोभ ईरान के ऊपर सक्रिय है।
इसका असर आगे चलकर उत्तर भारत के मौसम पर पड़ सकता है, जिससे कुछ इलाकों में आंधी, बारिश या तेज हवाएं चलने की संभावना बन सकती है। उत्तर-पश्चिमी दिशा से गर्म हवाएं आ रही हैं। इस वजह से गर्मी बढ़ेगी।
पठानकोट के तापमान में सबसे ज्यादा बढ़ोतरी
राज्य में रविवार को 6 जिलों का तापमान 40 डिग्री से अधिक दर्ज किया गया, जबकि 4 जिलों का तापमान 35 से 40 डिग्री के बीच रहा। सबसे अधिक तापमान बठिंडा एयरपोर्ट पर 43.1 डिग्री दर्ज किया गया। चंडीगढ़ में 40.3 डिग्री, लुधियाना में 41.6 डिग्री, पटियाला में 42 डिग्री, पठानकोट में 40.6 डिग्री और बठिंडा में 41.2 डिग्री दर्ज किया गया। वहीं अमृतसर में 39.9 डिग्री, फाजिल्का में 39.5 डिग्री, मोहाली में 38.9 डिग्री और रूपनगर में 39.2 डिग्री तापमान दर्ज किया गया।
तापमान में सबसे ज्यादा 3.2 डिग्री की बढ़ोतरी पठानकोट में दर्ज की गई। इसके अलावा चंडीगढ़ में 1.3 डिग्री, अमृतसर में 1.7 डिग्री, लुधियाना में 1.8 डिग्री, पटियाला में 1.2 डिग्री, बठिंडा में 0.6 डिग्री, फाजिल्का में 0.5 डिग्री, मोहाली में 1.4 डिग्री और रूपनगर में 0.5 डिग्री की बढ़ोतरी हुई। वहीं फरीदकोट में 0.7 डिग्री की गिरावट दर्ज की गई।
अगले 4 दिन तापमान बढ़ेगा
मौसम विज्ञान केंद्र के डायरेक्टर सुरेंद्र पाल के मुताबिक, राज्य में अगले कुछ दिनों तक मौसम शुष्क रहने की संभावना है, यानी बारिश के आसार नहीं हैं। अगले चार दिनों में दिन के तापमान में करीब 3 से 4 डिग्री तक धीरे-धीरे बढ़ोतरी हो सकती है। इसके बाद तापमान में ज्यादा बदलाव नहीं होगा। कुछ इलाकों में लू चलने की संभावना है।
अगले 3 दिन ऐसा रहेगा मौसम
19 मई - फिरोजपुर, फाजिल्का, फरीदकोट, मुक्तसर, मोगा, बठिंडा, लुधियाना, बरनाला, मानसा और संगरूर जिलों के कुछ इलाकों में लू चलने की संभावना है।
20 मई - फिरोजपुर, फाजिल्का, फरीदकोट, मुक्तसर, मोगा, बठिंडा, बरनाला, मानसा, संगरूर, पठानकोट, गुरदासपुर, अमृतसर, तरनतारन, होशियारपुर, नवांशहर, कपूरथला, जालंधर, लुधियाना, फतेहगढ़ साहिब, रूपनगर, पटियाला और एसएएस नगर (मोहाली) के कुछ इलाकों में लू चलने की संभावना है।
21 मई - फिरोजपुर, फाजिल्का, फरीदकोट, मुक्तसर, मोगा, बठिंडा, बरनाला, मानसा और संगरूर जिलों के कुछ इलाकों में लू चलने की संभावना है।",0.8
