title,url,source,date,language,state,district,search_term,full_text,relevance_score
"MP-राजस्थान समेत 9 राज्यों में आज 45°C पार जाएगा पारा: UP का बांदा देश में सबसे गर्म, तापमान 46.4°C; बिहार ... - Dainik Bhaskar",https://news.google.com/rss/articles/CBMiwgFBVV95cUxNaVFRY1dBT0ozdGhDdXA1Y1FrN0s0OWtRQ1htTmlwc25ONTVOWG9WdDNxNDZoZW1pckduZmwzUm11SDFiTDkyem1WMFhHcnlSOHZyNVZNMFBEajljcUc4R18weVRBemYweFg2VW9VdW5LMjhjTGdwdlRKSjBscG9WZ2ZhTl9WMW1GZ25QNWlDYjFaYlFoU045LXJWTGl3dVBPTlZOeE1kUjRxb3BtcVY1S050dDFPQXhCd3RkbGlVR09fQdIBxwFBVV95cUxQMkFkSFFDRnBET0U3RmpYb0Myakt2bjJPOUtpNGR0emRvZDJFLUFadjczM2tGUEdFSnpMVW05bVBUMkg2dkd2X1d0dXRWbkxwdHFGUTVsUE1kb25nZjlIbkNXYlFUNldVbFNIeFZtbjBRRTRwSUZiY1E2eHU2WVlhSXB6TmFlRFpGeW84VlJJYUpNdnR6R2h3bWtGN2dLOG55RFFyNE1jRFhmbFNLSWdLTEZlb1JkTTRzbVdLXzVLQVZfNFd6UHNF?oc=5,Dainik Bhaskar,2026-05-20T01:39:28+05:30,hi,Chandigarh,Chandigarh,"""लू"" Chandigarh","- IMD Weather Alert Update; Rajasthan MP Heatwave | Haryana Chandigarh Delhi Maharashtra Temperature
MP-राजस्थान समेत 9 राज्यों में आज 45°C पार जाएगा पारा:UP का बांदा देश में सबसे गर्म, तापमान 46.4°C; बिहार में गर्मी से 27 छात्राएं बेहोश
- कॉपी लिंक
राजस्थान, मध्य प्रदेश समेत मैदानी इलाकों के 9 राज्यों में आज भीषण गर्मी का अलर्ट जारी किया गया है। पंजाब, हरियाणा, चंडीगढ़, दिल्ली, महाराष्ट्र का विदर्भ-मराठवाड़ा और तेलंगाना भी आज यलो अलर्ट पर है। मौसम विभाग के मुताबिक इन राज्यों में कई जिलों का तापमान 45°C का आंकड़ा पार कर जाएगा।
गर्मी का यह दौर पिछले एक हफ्ते से जारी है। रविवार को UP का बांदा 46.4°C के साथ देश का सबसे गर्म शहर रहा। राजस्थान के बीकानेर-बाड़मेर में पारा 45°C और MP के खंडवा में 44.5°C रिकॉर्ड किया गया।
इधर, बिहार में कई जिलों में उमस भरी गर्मी है तो कुछ जगह बारिश हो रही है। शेखपुरा के कस्तूरबा स्कूल में गर्मी के कारण 27 छात्राएं बेहोश होकर गिर पड़ीं। सभी को शेखपुरा सदर अस्पताल में भर्ती कराया गया है।
देश के बाकी हिस्सों की बात करें तो केरलम, तमिलनाडु, कर्नाटक, असम, मेघालय, अरुणाचल प्रदेश, नगालैंड, मणिपुर, मिजोरम और त्रिपुरा में भारी बारिश हो सकती है।
अगले दो दिन के मौसम का हाल
19 मई:
20 मई:
देशभर में मौसम की तस्वीरें…
राज्यों से मौसम की खबरें…
1. राजस्थान: 19 जिलों में हीटवेव का अलर्ट, रातें भी गर्म, लू से बचाने के लिए गायों पर पानी की बौछारें
गर्मी ने तेवर दिखाने शुरू कर दिए हैं। दिन के साथ रात भी तपने लगी है। इस सप्ताह राज्य के पश्चिमी के साथ उत्तरी और पूर्वी हिस्सों में भी गर्मी तेज होगी। मौसम विभाग ने 18 और 19 मई को 19 जिलों में हीटवेव का यलो अलर्ट जारी किया है। इन शहरों का तापमान 42 से 45°C तक पहुंचने की संभावना है। इधर, कोटा में गायों को गर्मी से बचाने के लिए पानी की बौछार की जा रही है। पढ़ें पूरी खबर…
2. मध्य प्रदेश: पारा 45°C पार, राजगढ़ सबसे गर्म; आधे हिस्से में लू का अलर्ट
प्रदेश का आधा हिस्सा भीषण गर्मी की चपेट में है। यहां तापमान 42°C के पार चल रहा है। रविवार को राजगढ़ में तापमान रिकॉर्ड 45°C रहा, जबकि 11 में 43 और 4 जिलों में पारा 44°C पार पहुंच गया। मौसम विभाग ने अगले 3 दिन भीषण गर्मी का अलर्ट जारी किया है। साथ ही दोपहर 12 से 3 बजे तक घरों से बाहर न निकलने की चेतावनी दी है। पढ़ें पूरी खबर…
3. उत्तर प्रदेश: 33 जिलों में हीटवेव का अलर्ट, मौसम विभाग की चेतावनी- दोपहर में घर से न निकलें
बुंदेलखंड समेत प्रदेश के कई जिले भीषण लू की चपेट में हैं। IMD ने प्रदेश के 33 जिलों में लू का अलर्ट जारी किया है। मौसम विभाग ने सलाह दी है कि दोपहर के वक्त घर से बाहर न निकलें। बुजुर्गों, बच्चों और बीमार लोगों का खास ख्याल रखें। अधिक से अधिक पानी पीएं और हल्के सूती कपड़े पहनें। सीएम योगी ने भी सभी को अलर्ट मोड में रहने के निर्देश दिए हैं। पढ़ें पूरी खबर…
4. हरियाणा: आज से हीटवेव का अलर्ट, 7 जिलों में 4 डिग्री तक बढ़ेगा तापमान
मौसम विभाग ने आज प्रदेश के कई जिलों में हीटवेव की चेतावनी जारी की है। अगले चार दिनों के दौरान तापमान में 3 से 4 डिग्री तक बढ़ोतरी होने का अनुमान है। रविवार को प्रदेश में सबसे ज्यादा 44 डिग्री तापमान सिरसा में रिकॉर्ड किया गया। मौसम विभाग ने भी लोगों को पर्याप्त मात्रा में पानी पीने, हल्के कपड़े पहनने और बच्चों व बुजुर्गों का विशेष ध्यान रखने की सलाह दी है। पढ़ें पूरी खबर…
5. बिहार: 9 जिलों का का तापमान 40°C के पार; ककोलत वाटर फॉल में उमड़ी भीड़
प्रदेश के 9 जिलों का तापमान 40 डिग्री के पार चला गया है। रोहतास में रविवार को पारा 44°C के करीब दर्ज किया गया है। जबकि बक्सर, कैमूर और शेखपुरा का तापमान 42 डिग्री से ज्यादा रहा। मौसम विभाग ने आज 3 जिलों में हीटवेव का अलर्ट जारी किया है। गर्म हवा से लोगों को बचने की सलाह दी गई है। बढ़ती गर्मी के बीच रविवार को नवादा के ककोलत वाटर फॉल में भारी भीड़ उमड़ पड़ी। पढ़ें पूरी खबर…
6. झारखंड: बार-बार बदल रहा मौसम: 20 जिलों में बारिश का अलर्ट
झारखंड में इन दिनों मौसम का मिजाज पूरी तरह बदला हुआ है। सुबह तेज धूप और उमस लोगों को परेशान कर रही है, जबकि दोपहर बाद कई जिलों में आंधी, तेज हवा और बारिश हो रही है। 20 मई को रांची सहित हजारीबाग, कोडरमा, रामगढ़, बोकारो और खूंटी में ऑरेंज अलर्ट जारी किया गया है। इस दौरान तापमान 37 डिग्री के आसपास रहेगा। पढ़ें पूरी खबर….
7. उत्तराखंड: मैदानी इलाकों में पारा 40°C पार पहुंचने के आसार, चारधाम में सुबह-शाम रहेगी ठंड
मैदानी जिलों में तेज धूप और गर्म हवाओं के चलते तापमान 40 डिग्री सेल्सियस पार पहुंच सकता है। वहीं पहाड़ी क्षेत्रों में भी दिन के तापमान में बढ़ोतरी के आसार हैं। चारधाम यात्रा मार्गों पर भी आज मौसम साफ रहने का अनुमान है। मौसम विभाग के मुताबिक केदारनाथ, बद्रीनाथ, यमुनोत्री और गंगोत्री धाम में सुबह और शाम के समय ठंड महसूस हो सकती है। पढ़ें पूरी खबर…
8. हिमाचल प्रदेश: 3 दिन बारिश के आसार, तेज हवाएं चलेंगी; तापमान भी 3॰C तक बढ़ेगा
प्रदेश में दो दिन की धूप के बाद कल से मौसम फिर बदलने वाला है। मौसम विभाग के अनुसार 19 मई से वेस्टर्न डिस्टरबेंस एक्टिव हो रहा है। राज्य के अधिकांश भागों में इसका असर 23 मई तक देखने को मिलेगा। इस दौरान 40kmph की रफ्तार से तेज हवाएं चल सकती हैं। हालांकि आज पूरे प्रदेश में कई शहरों के तापमान में दो से तीन डिग्री का उछाल आ सकता है। पढ़ें पूरी खबर…
9. ओडिशा: गर्मी फिर लौटी, बौध में पारा 42.9°C पर
ओडिशा में कुछ समय की राहत के बाद एक बार फिर गर्मी का दौर लौट आया है। राज्य के 11 जगहों पर तापमान 40°C और उससे ज्यादा दर्ज किया गया। पश्चिमी ओडिशा के बौध शहर में तापमान 42.9°C दर्ज किया गया, जो राज्य में सबसे गर्म रहा। मौसम विभाग ने सोमवार को क्योंझर, मयूरभंज, बालासोर, गजपति और गंजाम जिलों के लिए आंधी-तूफान की चेतावनी भी जारी की है।
मौसम से जुड़ी ये ग्राउंड रिपोर्ट भी पढ़ें…
केरलम में CM समेत 21 मंत्री बनेंगे, सभी नाम फाइनल: इनमें कांग्रेस के 12, IUML के 5 विधायक; कल सुबह 10 बजे सतीशन सरकार की शपथ
राहुल बोले-PM ने शिक्षा मंत्री को बर्खास्त क्यों नहीं किया: बार-बार NEET पेपर कराने में फेल; 9वीं आरोपी मंधारे CBI कस्टडी में भेजी गई
भारत में घुसपैठ के बाद आतंकी ने हेयर ट्रांसप्लांट कराया: स्लीपर सेल नेटवर्क बनाने आया था; जांच एजेंसी से बोला- कश्मीर देखकर मकसद बदल गए
रजनीकांत बोले-विजय मुझसे 25 साल जूनियर, मैं उनसे नहीं जलता: अगर 2021 में चुनाव लड़ता तो जीत जाता; स्टालिन पुराने दोस्त, उनसे मुलाकात राजनीतिक नहीं",1.0
"Chandigarh Weather Update: चंडीगढ़ में भीषण गर्मी के बीच इस दिन से हो सकती है मानसून एंट्री, गर्मी से मिलेगी राहत! - Zee News",https://news.google.com/rss/articles/CBMiiwJBVV95cUxQS2x4YURCS1JtNWZxRHdfelNBWWtWa0V4M1EybnFycTZ0dHFVVHdaMVNhLXBWemwycExpQU95UERvbWlJbmppekxoaUx0OW1hbVBSanFEbUVGUWFYUXJ2QlNOWnBUNm5jLW5idTdfaFhoRVVUaGwtQi1NY1dyRE80RXJ1QXZxYnFybWQ0ZGVyMkdIcGQzcjJZMWFFMXpoNGhlU0xNOVpPNUNFdTc1VlJkU0tRQS15T3puelJmTjlFaC1uTzhyQkhzTVZ2TG5wQkNLc1d3VFhXODQ4TExpcV9fZy03MlRZTlJ2NHNfOUdjZHNxSS1HWGFDX05yOGwxRENJaVBhN1ZwSHdncHM?oc=5,Zee News,2026-05-20T07:36:56+05:30,hi,Chandigarh,Chandigarh,"""लू"" Chandigarh","Chandigarh Weather Update: चंडीगढ़ में गर्मी का कहर लगातार बढ़ता जा रहा है. मौसम विभाग ने 23 मई तक भीषण लू का अलर्ट जारी किया है. शहर में तापमान 43 डिग्री सेल्सियस तक पहुंचने की संभावना है, जिससे लोगों का घर से बाहर निकलना मुश्किल हो गया है. खासकर दोपहर 12 बजे से 3 बजे के बीच सड़कों पर सन्नाटा देखने को मिल रहा है.
चंडीगढ़ में गर्मी लगातार बढ़ रही है. यहां दिन ब दिन लोगों का गर्मी से जीना दूभर हो रहा है. यहां तक कि मौसम विज्ञान केंद्र चंडीगढ़ ने 23 मई तक सीवियर हीटवेव यानी भीषण लू का अलर्ट जारी किया है.
चंडीगढ़ में आज अधिकतम तापमान 43 डिग्री तक जा सकता है, जबकि न्यूनतम तापमान 27 डिग्री तक रहने की उम्मीद है. लोगों का गर्मी के कारण हालत खराब हो गया है. दोपहर में 12 बजे से 3 बजे के बीच तो बाहर निकलने लायक भी नहीं रह रहा है.
वहीं चंडीगढ़ के पास स्थित पंचकूला और मोहाली में मौसम ने लोगों को परेशान कर दिया है. मई की शुरुआत में हुई बारिश के बाद से यहां किसी तरह के बारिश का अलर्ट नहीं है. यहां तक हर रोज तापमान में बढ़ोतरी ही हो रही है.
मौसम विभाग के अनुसार, अगले एक हफ्ते तक चंडीगढ़ में बारिश की कोई संभावना नहीं है. चंडीगढ़ में टेंपरेचर 42 से 45 डिग्री सेल्सियस के बीच रहने की संभावना है. लोगों को अभी फिलहाल गर्मी से राहत के आसार नहीं दिख रहे हैं. इसके साथ चंडीगढ़ के स्कूलों में गर्मी की छुट्टियां 23 मई से 30 जून 2026 तक रहेंगी (कुल 39 दिन). हालांकि 29 और 30 जून को टीचर स्कूल आएंगे.
यहां तक की चंडीगढ़ स्वास्थ्य विभाग ने 14 दिन में मंगलवार (19 मई) को दूसरी एडवाइजरी जारी की है. इसमें लोगों को बताया गया है कि उन्हें लू से बचने के लिए किस तरह के कपड़े पहनने हैं और किस तरह का खाना-पीना लेना है.
वहीं अभी फिलहाल चंडीगढ़ में मानसून की कोई एंट्री के आसार नहीं है. चंडीगढ़ में जून के लास्ट सप्ताह में मानसून के आगमन के साथ बारिश शुरू होने की संभावना है. इससे पहले, जून के तीसरे सप्ताह तक प्री-मानसून बौछारें पड़ने की उम्मीद है. महीने के शुरुआती और बीच में भीषण गर्मी और उमस बनी रहती है और छुटपुट गरज के साथ छींटे ही पड़ते हैं.",1.0
"Punjab Weather Update: पंजाब में भीषण गर्मी और लू का अलर्ट, अगले कुछ दिन पड़ेंगे भारी - dainiksaveratimes.com",https://news.google.com/rss/articles/CBMikgFBVV95cUxPT1FndHlpaUg5OTZVcTRwZG01LXhvSDJianl3NDdQR3I2Uk5vc2FUd2lscFRWQ1k4VHBJdkxzc3ZKdW9RZ3EtZHprR08ya2tYcGxOUzUyUjRpeXpPdi1jVGQ1V2haVVVka25iNWN6ZHJvcm9vZ3NTYXZhYktZYks1anE0QmNRRjVxVGhkRkViYTlIUdIBkgFBVV95cUxPT1FndHlpaUg5OTZVcTRwZG01LXhvSDJianl3NDdQR3I2Uk5vc2FUd2lscFRWQ1k4VHBJdkxzc3ZKdW9RZ3EtZHprR08ya2tYcGxOUzUyUjRpeXpPdi1jVGQ1V2haVVVka25iNWN6ZHJvcm9vZ3NTYXZhYktZYks1anE0QmNRRjVxVGhkRkViYTlIUQ?oc=5,dainiksaveratimes.com,2026-05-20T08:50:02+05:30,hi,Chandigarh,Chandigarh,लू (Chandigarh) Chandigarh,"Punjab Weather Update: पंजाब इस समय तेज गर्मी और लू की चपेट में हैं। मौसम विभाग ने 23 मई तक गंभीर हीटवेव का अलर्ट जारी किया है। लगातार बढ़ते तापमान ने लोगों की परेशानी बढ़ा दी है और आने वाले दिनों में राहत मिलने की संभावना भी कम दिखाई दे रही है।
मौसम विज्ञान केंद्र चंडीगढ़ के अनुसार, पंजाब में तापमान सामान्य से करीब 4.6 डिग्री सेल्सियस अधिक दर्ज किया गया है। मंगलवार की तुलना में तापमान में 1.1 डिग्री की बढ़ोतरी हुई। सबसे ज्यादा गर्मी फरीदकोट में रिकॉर्ड की गई, जहां पारा 47.3 डिग्री सेल्सियस तक पहुंच गया। राज्य के कई जिलों में तापमान 40 डिग्री से ऊपर बना हुआ है।
इन जिलों में ज्यादा असर
आज फिरोजपुर, मोगा, बरनाला, संगरूर, फाजिल्का, फरीदकोट, मुक्तसर, बठिंडा और मानसा में भीषण लू चलने की संभावना जताई गई है। वहीं बाकी जिलों में भी गर्म हवाएं लोगों को परेशान करेंगी।
मौसम विभाग का कहना है कि अगले एक सप्ताह तक बारिश की कोई संभावना नहीं है। पंजाब में तापमान 45 से 47 डिग्री सेल्सियस तक पहुंच सकता है, जबकि चंडीगढ़ में पारा 42 से 45 डिग्री के बीच रहने का अनुमान है।
स्कूलों की छुट्टियों का ऐलान
भीषण गर्मी को देखते हुए चंडीगढ़ प्रशासन ने स्कूलों में गर्मियों की छुट्टियों की घोषणा कर दी है। 23 मई से 30 जून 2026 तक स्कूल बंद रहेंगे। हालांकि शिक्षकों को 29 और 30 जून को स्कूल आना होगा।
अगले तीन दिनों का मौसम अपडेट
21 मई
पठानकोट, गुरदासपुर, अमृतसर, तरनतारन, होशियारपुर, नवांशहर, कपूरथला, जालंधर, लुधियाना, फतेहगढ़ साहिब, रूपनगर, पटियाला और मोहाली में हीटवेव चलने की संभावना है। वहीं फिरोजपुर, मोगा, बरनाला, संगरूर, फाजिल्का, फरीदकोट, मुक्तसर, बठिंडा और मानसा में गंभीर लू का असर देखने को मिल सकता है।
22 और 23 मई
पठानकोट के कुछ इलाकों को छोड़कर पंजाब के लगभग सभी जिलों में गंभीर हीटवेव का खतरा बना रहेगा। मौसम विभाग ने लोगों को दोपहर के समय घर से बाहर निकलने से बचने की सलाह दी है।

स्वास्थ्य विभाग की सलाह
दोपहर 12 बजे से 4 बजे तक धूप में निकलने से बचें।
अधिक से अधिक पानी पिएं।
हल्के और सूती कपड़े पहनें।
बच्चों और बुजुर्गों का विशेष ध्यान रखें।
बाहर निकलते समय सिर और चेहरे को ढककर रखें।",1.0
