title,url,source,date,language,state,district,search_term,full_text,relevance_score
Punjab Heatwave Alert: पंजाब और चंडीगढ़ में हीटवेव से हाहाकार... जानिए अगले 3 दिन में कितना बढ़ेगा - ABP News,https://news.google.com/rss/articles/CBMi0wFBVV95cUxQZ0FfLTVGN2hzdEY1TnJmOG5UajQ0OWhGaC1DZFlBM0pTLUxlOTN4NDZtWkh1bllMcF9CcDJOdVVOLW5Vbl93dmFMSGtVZWExa3JTR2ZrMWYzRkVuTzZjdXF1TWFmbi05QTNHV0NMZ2o3enc4eThpZ29UMW40UWExckhsQWcxQWRlcm5FMjMxU1RHYzJXT1lSWDVfUXVJakFSY1hrVEpFRWVMNjZrTTQwY2swaHV5SFlrQmJlY2VsSjRfaE9UTkRTWi04T2puMFNna2NV0gHYAUFVX3lxTFBvaVZJZ2RINF9OcmpfU2xxZGo5aE0ySkJ3Y2E3QTV2M1cyQlZCQmpEMUU0U3RNU1JlM0cxNF90aF9lWmVsQ1RUa2tXME5Tcm90T2cwWWNNZmpuVXZ4cVQ2aXVxQTFNRnpjTUdfZThaQWNjenAwcWNVS1lZR0dHUVJ1VXVydnhldzNXU2NIQTVGRzQ0S0FUbllQeGctaDhVQUwtcmpJc0FsTEl0dmV6cFlmaG00d3E3aEN4MndRU08xOTVTbFNzNXRkNzNWUk84ZERXeXJMUDBWUw?oc=5,ABP News,2026-05-20T13:29:28+05:30,hi,Chandigarh,Chandigarh,"(""पारा चढ़ा"" OR ""पारा पहुंचा"" OR तापमान OR ""तापमान बढ़ा"" OR ""रिकॉर्ड तोड़ गर्मी"" OR ""डिग्री सेल्सियस"" OR ""पारा उबला"" OR ""अधिकतम तापमान"" OR ""तापमान 40 पार"" OR ""तापमान 45 पार"" OR ""तापमान बढ़ने की संभावना"") Chandigarh","Punjab Heatwave Alert: पंजाब और चंडीगढ़ में हीटवेव से हाहाकार... जानिए अगले 3 दिन में कितना बढ़ेगा तापमान?
Punjab Weather News: पंजाब और चंडीगढ़ में भीषण गर्मी के बीच 23 मई तक गंभीर हीटवेव अलर्ट जारी है, जबकि फरीदकोट में तापमान 47.3 डिग्री पहुंचने से लोगों की परेशानियां बढ़ गई हैं.
Punjab-Chandigarh Weather Update: पंजाब और चंडीगढ़ इस समय तेज गर्मी की चपेट में हैं. मौसम विज्ञान केंद्र चंडीगढ़ ने 23 मई तक गंभीर हीटवेव अलर्ट जारी किया है. मंगलवार के मुकाबले पंजाब में तापमान 1.1 डिग्री सेल्सियस की बढ़ोतरी दर्ज की गई है, जो सामान्य से करीब 4.6 डिग्री ज्यादा है.
सबसे ज्यादा गर्मी फरीदकोट में रिकॉर्ड की गई, जहां तापमान 47.3 डिग्री सेल्सियस तक पहुंच गया. राज्य के कई अन्य जिलों में भी तापमान 40 डिग्री सेल्सियस से ऊपर बना हुआ है, जिससे लोगों को भारी परेशानी का सामना करना पद रहा है.
इन जिलों में गंभीर लू का अलर्ट
मौसम विभाग के मुताबिक, आज इन नौ जिलों में गर्मी की स्थिति बिगड़ सकती है: जैसे- फिरोजपुर, मोगा, बरनाला, संगरूर, फाजिल्का, फरीदकोट, मुक्तसर, बठिंडा और मानसा में लू से लेकर गंभीर हीटवेव की स्थिति बन सकती है. वहीं बाकी जिलों में भी गर्म हवाएं लोगों की परेशानी बढ़ाएंगी.
मौसम विभाग का कहना है कि अगले हफ्ते तक पंजाब में बारिश की कोई संभावना नहीं है. आने वाले दिनों में पंजाब के कई हिस्सों में तापमान 45 से 47 डिग्री सेल्सियस तक पहुंच सकता है, जबकि चंडीगढ़ में यह तापमान 42 से 45 डिग्री सेल्सियस के बीच रहने की उम्मीद है.
अगले तीन दिन कैसा रहेगा मौसम?
21 मई - पठानकोट, गुरदासपुर, अमृतसर, तरनतारन, होशियारपुर, नवांशहर, कपूरथला, जालंधर, लुधियाना, फतेहगढ़ साहिब, रूपनगर, पटियाला और एसएएस नगर (मोहाली) में हीटवेव की संभावना जताई गई है, जबकि दक्षिणी और पश्चिमी जिले- फिरोजपुर, मोगा, बरनाला, संगरूर, फाजिल्का, फरीदकोट, मुक्तसर, बठिंडा और मानसा में गर्मी की लहर से लेकर गंभीर लू चलने की संभावना है.
22 और 23 मई - पठानकोट को छोड़कर पंजाब के ज्यादातर जिलों में गंभीर हीटवेव जारी रहने की संभावना है. इसी बीच चंडीगढ़ प्रशासन ने स्कूलों में 23 मई से 30 जून 2026 तक गर्मियों की छुट्टियों का ऐलान कर दिया है. हालांकि शिक्षकों को 29 और 30 जून को स्कूल आना होगा.
Source: IOCL",1.0
"पंजाब लू की चपेट में, आज भीषण गर्मी का अलर्ट: चंडीगढ़ के स्कूलों में छुटि्टयां, धूप से बचने को 14 दिन में दू... - Dainik Bhaskar",https://news.google.com/rss/articles/CBMisgFBVV95cUxQbFdMSjE0dUZzVnpEY3NGSjVONk53ejZST19FMl9ieGlpNThtTmw1SU9YVjBXVnFwXzN2X19pOWdzVjd6eTI5VzZHNWFGd2M4cWRvMDhkY3M4OWRCTVNoajRuZWNjbVdnS1ptVnNUMHZBOHZTSXU5Nkllb1IzLU5DTnE4TjNReVpwdVdheDJSOGpuejYxa3dOenFFRlY3MUFRV1gwSHkyWVh2YUlmSFd2TmJR0gGyAUFVX3lxTFBsV0xKMTR1RnNWekRjc0ZKNU42Tnd6NlJPX0UyX2J4aWk1OG1ObDVJT1hWMFdWcXBfM3ZfX2k5Z3NWN3p5MjlXNkc1YUZ3YzhxZG8wOGRjczg5ZEJNU2hqNG5lY2NtV2dLWm1Wc1QwdkE4dlNJdTk2SWVvUjMtTkNOcThOM1F5WnB1V2F4MlI4am56NjFrd056cUVGVjcxQVFXWDBIeTJZWHZhSWZIV3ZOYlE?oc=5,Dainik Bhaskar,2026-05-20T05:25:00+05:30,hi,Chandigarh,Chandigarh,"(""हीट एक्शन प्लान"" OR ""गर्मी से राहत"" OR चेतावनी OR ""रेड अलर्ट"" OR ""ऑरेंज अलर्ट"" OR ""येलो अलर्ट"" OR एडवाइजरी OR ""राहत सामग्री"" OR ""राहत शिविर"" OR मुआवजा) Chandigarh","पंजाब लू की चपेट में, सीवियर हीटवेव का अलर्ट:चंडीगढ़ के स्कूलों में गर्मी की छुटि्टयां, धूप से बचने को 14 दिन में दूसरी हेल्थ एडवाइजरी
पंजाब और चंडीगढ़ में इस समय भीषण गर्मी की चपेट में है। मौसम विज्ञान केंद्र चंडीगढ़ ने 23 मई तक सीवियर हीटवेव यानी भीषण लू का अलर्ट जारी किया है। पंजाब में मंगलवार के मुकाबले टेंपरेचर में 1.1 डिग्री की बढ़ोतरी हुई है।
यह सामान्य तापमान से 4.6 डिग्री अधिक है। मंगलवार को फरीदकोट सबसे गर्म जिला रहा, जहां टेंपरेचर 47.3 डिग्री तक पहुंच गया। बाकी जिलों में भी टेंपरेचर 40 डिग्री से ज्यादा चल रहा है।
मौसम विभाग का कहना है कि अगले एक हफ्ते तक पंजाब में बारिश की कोई संभावना नहीं है। पंजाब में टेंपरेचर 45 से 47 डिग्री सेल्सियस तक पहुंच सकता है। चंडीगढ़ में टेंपरेचर 42 से 45 डिग्री सेल्सियस के बीच रहने की संभावना है।
इसके साथ चंडीगढ़ के स्कूलों में 23 मई से 30 जून 2026 तक यानी कुल 39 दिन गर्मी की छुट्टियां रहेंगी। हालांकि 29 और 30 जून को टीचर स्कूल आएंगे। पंजाब में भी इसी हफ्ते छुटि्टयों की घोषणा हो सकती है।
गर्मी बढ़ने के 2 बड़े असर..
- पंजाब में बिजली की डिमांड दोपहर में बढ़ी: पंजाब में बढ़ती गर्मी के साथ बिजली की डिमांड भी तेजी से बढ़ रही है। मंगलवार को दिन में बिजली की डिमांड 12,244 मेगावाट तक पहुंच गई। हालांकि शाम 5 बजे यह डिमांड 7 हजार मेगावाट तक रह गई। इस दौरान पंजाब ने अपनी उत्पादन क्षमता साढ़े 3 हजार मेगावाट के बाद बाकी 9 हजार मेगावाट बिजली सेंट्रल पूल से खरीदी।
- चंडीगढ़ में 14 दिन में दूसरी एडवाइजरी: चंडीगढ़ स्वास्थ्य विभाग ने 14 दिन में मंगलवार (19 मई) को दूसरी एडवाइजरी जारी की है। जिसमें लोगों को बताया गया है कि उन्हें लू से बचने के लिए किस तरह के कपड़े पहनने हैं और किस तरह का खाना-पीना लेना है। इससे पहले 6 मई को अस्पतालों में गर्मी की बीमारियों को लेकर स्पेशल स्टाफ की तैनाती की जा चुकी है।
अगले 3 दिन कैसा रहेगा मौसम:-
- 21 मई - पठानकोट, गुरदासपुर, अमृतसर, तरनतारन, होशियारपुर, नवांशहर, कपूरथला, जालंधर, लुधियाना, फतेहगढ़ साहिब, रूपनगर, पटियाला और एसएएस नगर (मोहाली) में हीट वेव, जबकि फिरोजपुर, मोगा, बरनाला, संगरूर, फाजिल्का, फरीदकोट, मुक्तसर, बठिंडा और मानसा में हीट वेव से लेकर सीवियर हीट वेव चलने की संभावना है।
- 22 और 23 मई - पठानकोट में कुछ स्थानों पर हीट वेव व अन्य सभी जिलों में सीवियर हीट वेव चलने की संभावना है।
एक्सपर्ट बोले- अब लगातार गर्मी बढ़ेगी मौसम विज्ञान केंद्र, चंडीगढ़ के डायरेक्टर सुरेंद्र पाल ने कहा- 3-4 दिन टेंपरेचर बढ़ेगा। पंजाब में फिरोजपुर, फाजिल्का, बठिंडा, मुक्तसर, मानसा, संगरूर और फिर नॉर्थ-वेस्टर्न में तरनतारन, अमृतसर, यहां पर टेंपरेचर 45 डिग्री के करीब तक जाएगा। फिलहाल बारिश की कोई संभावना नहीं है। ड्राई कंडीशन रहेंगी। चंडीगढ़ समेत ट्राईसिटी में लू की स्थिति बनेगी।
चंडीगढ़ के स्कूलों में गर्मी की छुटि्टयों का ऑर्डर…
*************
ये खबर भी पढ़ें:
जरूरत की खबर- गर्मियों के लिए वर्कआउट सेफ्टी टिप्स: इन 9 संकेतों को न करें इग्नोर, बरतें 11 जरूरी सावधानियां, बता रहे हैं डॉक्टर
गर्मियों में फिटनेस रूटीन बनाए रखना चैलेंजिंग होता है। इस दौरान पसीना ज्यादा आता है, जल्दी थकान होती है और डिहाइड्रेशन का रिस्क बढ़ जाता है, जिससे वर्कआउट मुश्किल होता है। कुछ लोग इस वजह से एक्सरसाइज अवॉइड करते हैं, जबकि कुछ बिना सावधानी के वर्कआउट करते हैं। इससे सेहत को नुकसान हो सकता है। पढ़ें पूरी खबर…",1.0
"चंडीगढ़ के स्कूलों में गर्मी की छुट्टियों को लेकर आदेश; 42 डिग्री तापमान में तप रहा शहर, भीषण लू का अलर्ट जारी, लोग हुए बेहाल - Arth Parkash",https://news.google.com/rss/articles/CBMimwFBVV95cUxQeE5BMmFwOVJNdFJQX3QzblhyakFtU1FueG1PRTFQS1dlNGhMcnlvNGFRY2Z3WUYtN0FBMVoxTVRTeTFhc1I2VjRreWVUQTV0alE4ZHZrWVFZVWRsNm80ZS14LUw1aEY2Q1RDeXd2QXVRRm01cGpzTkIzbFdfTmJrUkJWbVY5Umh6U0VsOHNVLXowMF9sdk5GUkF3WQ?oc=5,Arth Parkash,2026-05-20T12:34:00+05:30,hi,Chandigarh,Chandigarh,"(""हीट एक्शन प्लान"" OR ""गर्मी से राहत"" OR चेतावनी OR ""रेड अलर्ट"" OR ""ऑरेंज अलर्ट"" OR ""येलो अलर्ट"" OR एडवाइजरी OR ""राहत सामग्री"" OR ""राहत शिविर"" OR मुआवजा) Chandigarh","चंडीगढ़ के स्कूलों में गर्मी की छुट्टियों को लेकर आदेश; 42 डिग्री तापमान में तप रहा शहर, भीषण लू का अलर्ट जारी, लोग हुए बेहाल
Schools Summer Holidays 2026 In Chandigarh IMD Excessive Heat Alert
Chandigarh Schools Summer Holidays: उत्तर भारत में गर्मी ने अपना कहर बरपाना शुरू कर दिया है। जहां तेज धूप तन को झुलसाते हुए पसीने छुटा दे रही है तो वहीं भीषण लू ने अलग से बुरा हाल कर रखा है। ऐसे में स्कूली बच्चों को गर्मी के सितम (Excessive Heat) से बचाने के लिए चंडीगढ़ के स्कूलों में छुट्टियों को लेकर आदेश सामने आया है। आदेश के मुताबिक, 23 मई से चंडीगढ़ के स्कूलों में गर्मी की छुट्टियां शुरू होंगी और 30 जून 2026 तक रहेंगी।
चंडीगढ़ के स्कूलों में 39 दिनों की गर्मी की छुट्टियां
चंडीगढ़ प्रशासन के शिक्षा विभाग से जारी आदेश में कहा गया है कि शहर के सभी सरकारी, सरकारी सहायता प्राप्त स्कूलों में 23 मई से 30 जून 2026 तक 39 दिनों की गर्मी की छुट्टियां रखी जाएंगी। हालांकि इस बीच 29 जून और 30 जून को शिक्षकों को स्कूल आना होगा। बता दें कि चंडीगढ़ प्रशासन के स्कूलों से संबन्धित छुट्टियों के जारी कैलेंडर में साल 2026 के ग्रीष्मकालीन अवकाश के अलावा शीतकालीन अवकाश की भी जानकारी दी गई है। इसके अलावा हर महीने के दूसरे शनिवार को स्कूलों में छुट्टी रखने को कहा गया है।
42 डिग्री तापमान में तप रहा चंडीगढ़
पंजाब, चंडीगढ़ समेत उत्तर भारत के अलग-अलग हिस्सों में पिछले 3 दिनों से तापमान में बढ़ोतरी देखी जा रही है। कहीं-कहीं तापमान 45 डिग्री को भी पार कर गया है। 23 मई तक सीवियर हीटवेव यानी भीषण लू का अलर्ट जारी किया गया है। वहीं चंडीगढ़ इस समय 42 डिग्री तापमान में तप रहा है। भयंकर तेज धूप के साथ गर्म सूखी हवाओं के थपेड़ों ने लोगों को बेहाल कर दिया है। वहीं चंडीगढ़ में आज तापमान 43 डिग्री सेल्सियस तक पहुंचने की संभावना है। जबकि न्यूनतम तापमान 27 डिग्री तक रहने की उम्मीद है।

मई की शुरुआत में हुई बारिश ने लोगों को गर्मी से राहत दे दी थी लेकिन मौसम विभाग के अनुसार, अभी कुछ दिनों तक चंडीगढ़ में भीषण गर्मी और लू से राहत के आसार नहीं हैं। चंडीगढ़ में बारिश की कोई संभावना नहीं है। जबकि इस बीच चंडीगढ़ में टेंपरेचर 42 से 45 डिग्री सेल्सियस के बीच रहने की संभावना है। मसलन लोगों को अभी फिलहाल गर्मी से दो-चार होना पड़ेगा। बताया जा रहा है कि चंडीगढ़ में जून के लास्ट सप्ताह में मानसून के आगमन के साथ बारिश शुरू होने की संभावना है। हालांकि इससे पहले, जून के तीसरे सप्ताह तक प्री-मानसून बौछारें पड़ने की उम्मीद है। शुरुआती जून और बीच में गर्मी और उमस के साथ छुटपुट गरज के साथ बारिश के छींटे पड़ सकते हैं।
दोपहर 12 से 3 बजे तक धूप में न जायें
गर्मी के प्रकोप का आलम यह है कि दोपहर के समय सड़कों पर सन्नाटा देखने को मिल रहा है। वहीं मौसम विभाग ने कहा है कि लोग 2-3 दिनों तक ज्यादा धूप में ना जाएं और पानी का ज्यादा इस्तेमाल करें। लोगों को खासकर दोपहर 12 बजे से 3 बजे के बीच सीधे शूप के संपर्क में आने से सावधान रहने को कहा गया है क्योंकि वह गर्मी और लू से हीट स्ट्रोक का शिकार हो सकते हैं। वहीं चंडीगढ़ स्वास्थ्य विभाग ने मंगलवार (19 मई) को हेल्थ एडवाइजरी जारी की है। जिसमें लोगों को बताया गया है कि उन्हें गर्मी और लू से किस तरह से अपना बचाव करना है और किस तरह का खाना-पीना लेना है।
यह पढ़ें",1.0
