title,url,source,date,language,state,district,search_term,full_text,relevance_score
You may face extreme heat for these 9 days. Know why Nautapa feels so intense - India Today,https://news.google.com/rss/articles/CBMiuwFBVV95cUxNVk9ZMUZTVTNjOTMtTXI4ckdYeEVQZWxIOTFtTlVlUFlRdUVQX0dJN0I4d2tFZlZEemF6b1hMdjF2Vy1WWWpzRWNlMlpCT3dBQVVqNHlmTkpmQ3NwY1liQ3hnZHRQT0h0Z1loeWloYU4wbHRJUHpZakE4TUx5UExHMDYwNTRHNjRkRHlacXBuOVVQcmRNM3J4TnltQ3VDejRwbFVfdmhUQ2VuTVBwblNDZjQyOGtnVVVLSTBn0gHAAUFVX3lxTE1lOUJES1pyM2N3NDZhQ2dsR0Q1MXdmclgzY0RieW5ZTGdZd00xWFdfLS1pR0hHVTBwTkdDaXdRdUdpMGJTakkzbnFMVnZ5X2tHdE5YQjQ0RFBveHFYTkVmQlNHVHJJTURWczgtbFdDbkN0Sm02bnRpZzdLRExXOGJQQU5HaVBRLUFQV3Frb200RXQxdWJZaDA4V1plNUduM3otUmF4VG1YT193Q2paOEdfSE9jamhFaHA5czRXN1N4cA?oc=5,India Today,2026-05-20T12:57:07+05:30,en,Chandigarh,Chandigarh,"(heatwave OR ""heat wave"" OR ""severe heatwave"" OR ""extreme heat"" OR ""heat spell"" OR ""scorching heat"" OR ""blistering heat"" OR ""sweltering heat"" OR ""hot winds"" OR loo OR ""hot loo winds"" OR ""intense heat"" OR ""unbearable heat"" OR ""deadly heat"" OR heat OR ""weather forecast"" OR ""weather update"" OR ""weather alert"" OR ""IMD forecast"" OR ""IMD prediction"" OR ""IMD alert"" OR IMD OR ""rising temperatures"" OR ""temperatures expected to rise"" OR ""relief from heat"" OR ""respite from heat"" OR ""heat respite"" OR ""respite from scorching heat"") Chandigarh","NewsInformationYou may face extreme heat for these 9 days. Know why Nautapa feels so intense
You may face extreme heat for these 9 days. Know why Nautapa feels so intense
Nautapa is the traditional term used for the harshest stretch of pre-monsoon heat in India, when dry winds, strong sunshine and rising temperatures make late May and early June especially uncomfortable.
Advertisement
Nautapa is the traditional nine-day period linked with extreme pre-monsoon heat in India, when dry weather, heatwaves and strong sunshine push temperatures sharply higher across several regions.: Photo: PTI
As temperatures climb across several parts of India every summer, one term quickly starts trending again, Nautapa. The traditional phrase is used for a roughly nine-day stretch of intense heat that usually falls between late May and early June. It is popularly linked with the Sun entering Rohini Nakshatra, but weather experts explain that the scorching conditions are mainly caused by normal pre-monsoon summer patterns.
The intense heat during Nautapa is mostly linked to seasonal weather conditions. By the end of May, the land has already absorbed weeks of strong summer sunshine. Moisture levels remain very low and hot winds continue blowing across inland regions.
Clear skies during the pre-monsoon season also allow stronger solar radiation to reach the ground, causing temperatures to rise even further. This is why heatwave conditions often become more severe around this period.
In some years, several North Indian states record prolonged heatwave days during Nautapa, leading to health warnings and weather alerts.
THE LINK WITH ROHINI NAKSHATRA
In traditional belief, Nautapa begins when the Sun enters Rohini Nakshatra. Many people connect this phase with the year’s harshest summer heat.
However, scientists and meteorologists explain that the rising temperatures are caused by seasonal atmospheric conditions rather than any mystical event.
A careful way to describe it is that Nautapa is a traditional term associated with extreme pre-monsoon heat, while the actual weather conditions are explained by normal summer heating and heatwave patterns.
WHEN DOES NAUTAPA START?
The dates of Nautapa are not scientifically fixed and can vary depending on calendar interpretations and regional traditions.
In recent years, many reports have placed Nautapa between May 25 and June 2, while some regions extend the period slightly further into early June.
Even though the exact dates may differ, the phrase continues to be widely used across India to describe the most uncomfortable stretch of summer before the monsoon begins to arrive.
Simply put, Nautapa is India’s traditional name for the harshest phase of pre-monsoon heat, when blazing sunshine, dry air and heatwave conditions combine to make daily life especially exhausting.",0.8500000000000001
"Delhi to hit 46°C today amid severe heatwave, no relief for next 3 days - India Today",https://news.google.com/rss/articles/CBMiyAFBVV95cUxNT2JvZ2xndWRxVG5aMmh4dnBOMFU4bkswcUxJWS14d1pmVkZubEJnWmFGWWw1NXBfLXREVjU3endrcDVURmJpalhlV0ZRaEdfSUs1ZU9tZkVRTmZvTXBRbUoxSlFTczMwRGo0VTR1dDlja3Y2SzM2N3EyRlhtN29taUxPVFpxRGhlSVNuaTJmTVRLMkx5dUVHSVJrX0tGYVduTE0tWmhuVGJObWJrQzFNUGJsWExKbDBrb29TU0ZDaGFQWFN6RXJLa9IBzgFBVV95cUxNemNnTXViZy1XQnhZZ1NmWTZJMEZDRVZ6djFwa2tWdDctdDVBNkhkU3hZbkw0YkQ1VnJoQTMtX2pqUHMxWWszTkk1Z0dXWEtjM1BaaTY4MjdYM0JtcXEzVld0SWZZSmNKRFZvZHNwUlpWNzVnN2FlYUxVcEUxSk9YSGE3T09fN2laLVNlSk00dDJPVERHSFN4b1ZpRUN5UlEyYWxwMDdiTXRQZHBza0FvaWl1ZVdlOWQxVC1fVk4zajQ0OUwtLU5Jb0N6aVhGdw?oc=5,India Today,2026-05-20T10:07:23+05:30,en,Chandigarh,Chandigarh,"(heatwave OR ""heat wave"" OR ""severe heatwave"" OR ""extreme heat"" OR ""heat spell"" OR ""scorching heat"" OR ""blistering heat"" OR ""sweltering heat"" OR ""hot winds"" OR loo OR ""hot loo winds"" OR ""intense heat"" OR ""unbearable heat"" OR ""deadly heat"" OR heat OR ""weather forecast"" OR ""weather update"" OR ""weather alert"" OR ""IMD forecast"" OR ""IMD prediction"" OR ""IMD alert"" OR IMD OR ""rising temperatures"" OR ""temperatures expected to rise"" OR ""relief from heat"" OR ""respite from heat"" OR ""heat respite"" OR ""respite from scorching heat"") Chandigarh","Delhi to hit 46°C today amid severe heatwave, no relief for next 3 days
With an orange alert in place and temperatures closing in on 46°C, Delhi-NCR is having its most brutal stretch of summer in years.
Delhi-NCR is hurtling towards one of its most punishing days of the year.
The India Meteorological Department (IMD) has warned that temperatures in the capital are likely to touch nearly 46°C on Wednesday, May 20, and has issued an orange alert, meaning residents should be prepared to act to protect themselves from the heat.
The IMD has confirmed that Delhi, along with Punjab, Haryana and Chandigarh, is likely to face severe heat during the week, with strong surface winds expected during the afternoon and evening hours.
TUESDAY'S WARNING
Tuesday was already a sign of things to come. The Safdarjung observatory, considered Delhi's official weather station, recorded a maximum temperature of 45.1°C, around 4.7°C above the seasonal average, the highest recorded so far this year.
Several pockets of the city ran even hotter.
Ridge station registered 46.5°C, Ayanagar recorded 45.5°C, and Lodhi Road touched 45.2°C.
The heat also thickened the air as Delhi's Air Quality Index (AQI) climbed to 208 by 4 pm, marking the poorest air quality recorded since April 28. Tuesday also marked the fourth heatwave day of the year for Delhi.
A heatwave in India is officially declared when temperatures cross 45°C, or when they run more than 4.5°C above what is normal for that time and place. Delhi is currently ticking both boxes simultaneously.
Delhi's suffering is intense, but it is far from alone.
Across the country, a prolonged and punishing pre-monsoon season is making itself felt in very different ways. Here's what India's regions are facing.
WESTERN, CENTRAL INDIA FACE EXTREME HEAT
The states of Madhya Pradesh, eastern Maharashtra, Rajasthan, and Chhattisgarh are bearing the brunt alongside Delhi.
Banda in Uttar Pradesh recorded a staggering 47.6°C on May 19, making it the hottest spot in the entire country that day.
Heatwave to severe heatwave conditions are expected to persist across West and East Uttar Pradesh and Madhya Pradesh through May 25, with nights offering little comfort as minimum temperatures in these regions are running well above normal.
Gujarat, though spared the worst of the heat for now, is expected to see a gradual temperature dip of 2-3°C from May 20 onwards.
MONSOON KNOCKING ON SOUTH INDIA'S DOOR
While northern and central regions are baking, southern parts of India are being lashed by storms and heavy rain.
Kerala is receiving widespread to heavy rainfall almost daily, as the southwest monsoon is slated to arrive ahead of schedule around May 26.
Tamil Nadu's Kanyakumari district recorded 16 cm of rain in a single day on May 19, while coastal Karnataka, Lakshadweep, and the Andaman & Nicobar Islands are also seeing heavy rainfall with strong squally winds.
Coastal Andhra Pradesh, however, is an outlier in the south, facing both heat wave warnings and thundersqualls with gusting winds up to 70 kmph simultaneously.
NORTHEAST STAYS WET
The northeast is currently seeing scattered to isolated rainfall, but that is about to change significantly.
From around May 22, the IMD expects rainfall to increase sharply across Assam, Meghalaya, Arunachal Pradesh, and the Nagaland-Manipur-Mizoram-Tripura cluster, turning widespread through May 25.
Very heavy rainfall warnings have been issued for Arunachal Pradesh and Assam & Meghalaya from May 23 onwards, raising concerns about localised flooding, landslides, and crop damage in hilly and low-lying areas.
Sub-Himalayan West Bengal and Sikkim are also expected to receive very heavy rainfall from May 22, a reminder that as the monsoon advances, India's northeastern flank tends to feel it first and hardest.
India's sheer size means it rarely experiences one season at a time.
On any given day in late May, a farmer in Kerala could be ankle-deep in pre-monsoon rain while a labourer in Uttar Pradesh struggles to breathe in 47°C heat, and a villager in Arunachal Pradesh braces for a landslide warning.
This is simply India. But what climate scientists increasingly warn is that the extremes on both ends are getting sharper. The heat is becoming unforgiving, the rains more sudden and violent.
This May, more than most, that reality is impossible to ignore.",1.0
"Delhi-NCR faces severe heatwave, mercury may touch 46°C; orange alert issued - National Herald",https://news.google.com/rss/articles/CBMi2AFBVV95cUxPcm11Yk55ZmpWcDF5SVZGQ3p5ZUtiNzVvQzBscWdHY2FZSGlhRFNPaVpvZjJSTW5GbWhsV3prYTI4czZwazBUNUY2ZnRORWt1aTZ2MC05TFFsdUNZb09FT3JIZk5YU1RFaG5BSHdxMVlnTnJKcFF2ME1VQXpNS2FnMXNzTHRIVjhSVlZPWWVsQ1UyQ0owRnVYZC1sVndxUEdDSnV4YXU4cm44N3R1R012MVRFMXF3TnhmVjZRUW1RQkVLMm1oYzBmT3JucmZvLXRVb0dxNHE2R2vSAeYBQVVfeXFMTmtLMktfSkZ1WF93Mnc5cWZUZHV4LTN6S2tfZEY3dXcyUmVLTGhwVWVQUmR1a1hnUXVtWFV0dzBPdm5GdUdXUFA2emgzSWJrT0o3OXhEVzdUbEVfcy1DTVBnQmNCWkFsZzRDUXpiZUVOX1J5SXZ2MHpDM2p4T0VkTWdTVVVIeWttcUU0alFpRHY5bGJUb3ZVcC1oQ1M5REVMN0NaSm9XbU9pVV9BYVhJVUJINUZWS2R6X08xX1FNWUpyOXJ0X2xUNmREaDVLZ0poUHR2V0tPUm9HMl9IWExBcnN1WE1CSXc?oc=5,National Herald,2026-05-20T09:58:39+05:30,en,Chandigarh,Chandigarh,"(""heat advisory"" OR ""heat action plan"" OR ""heat alert"" OR ""IMD warning"" OR ""IMD alert"" OR ""red alert"" OR ""orange alert"" OR ""yellow alert"" OR ""NDMA advisory"" OR ""cooling shelter"" OR ""relief measures"" OR ""heat compensation"" OR ""severe weather warning"") Chandigarh","Delhi-NCR faces severe heatwave, mercury may touch 46°C; orange alert issued
IMD warns of prolonged heatwave conditions across Delhi, Punjab, Haryana and Chandigarh in the coming days
Delhi-NCR is set to endure an intense spell of heat this week, with temperatures likely to touch nearly 46 degrees Celsius on Wednesday, prompting the India Meteorological Department (IMD) to issue an orange alert for the region.
The weather agency warned that prolonged heatwave-like conditions are expected to persist across Delhi, Punjab, Haryana and Chandigarh over the coming days. It also flagged unusually warm nights in parts of Uttar Pradesh, Madhya Pradesh and Vidarbha, where temperatures are expected to remain abnormally high even after sunset.
On Tuesday, Delhi recorded its hottest day of the season so far, with the Safdarjung observatory — the city’s official weather station — logging a maximum temperature of 45.1 degrees Celsius, nearly 4.7 degrees above normal.
Several parts of the national capital experienced even harsher conditions. The Ridge station recorded the highest temperature at 46.5 degrees Celsius, while Ayanagar touched 45.5 degrees and Lodhi Road registered 45.2 degrees Celsius.
Meteorologists said Tuesday marked Delhi’s fourth heatwave day of the year after similar conditions on 23, 24 and 25 April.
The IMD has forecast daytime temperatures hovering around 44 degrees Celsius till 25 May, accompanied by strong surface winds during afternoon and evening hours.
The soaring temperatures also pushed Delhi’s air quality into the “poor” category. According to the Central Pollution Control Board (CPCB), the city’s Air Quality Index (AQI) rose to 208 by 4 pm on Tuesday — the worst reading since 28 April.
Following the deterioration in air quality, the Commission for Air Quality Management (CAQM) imposed Stage 1 restrictions under the Graded Response Action Plan (GRAP).
Authorities have advised residents to avoid prolonged outdoor exposure during peak afternoon hours, stay hydrated and remain alert to symptoms of heat-related illnesses such as dehydration and heatstroke.
With IANS inputs",1.0
"Delhi-NCR Weather Update: Temperature in Delhi to hit 46°C today amid severe heatwave, IMD issues orange alert, warns of..., check full forecast here - news24online.com",https://news.google.com/rss/articles/CBMizwJBVV95cUxQTHRmSXZhME9XOTNBYjgtcDltaHF6blRILUpBY3hGVlExZ0NMTW5vcFU3TllfR3o5SmoyelhMQ18zMDk4bG9TVzB4dUVkd2I2OU1jdlRoamJaWTZqM2EwaXMxNl9fYjF2MWdUMGNlMnNOZ2l2Z3htdFAySmcwbkV3N1NoR2xXVndreUMxX3ZYMTU2NlRWeEJOSFJZM1AxR2o0WFdqbzlWWkNwSUpDeFB2eDgtZHBrN2Z0MEZsakdsa013R2hyZVd4Ny16VWJKNUM1cElOZDg0aC1Vb3ZXdS1nMExTSFdCNjNNRGZ5TEtjWnk2YjV1d0tqcmJTZWxOZ3F3X05ZM190WThacy1lWWZEekZOYlhtRUtVS0xGYUJBT1lycXliY0lYS3BEal9wRVc1RWc3UG5UNElFQ2R5WUNuOFZIeEFONVp2SFZsS2RvSQ?oc=5,news24online.com,2026-05-20T11:00:43+05:30,en,Chandigarh,Chandigarh,"(""heat advisory"" OR ""heat action plan"" OR ""heat alert"" OR ""IMD warning"" OR ""IMD alert"" OR ""red alert"" OR ""orange alert"" OR ""yellow alert"" OR ""NDMA advisory"" OR ""cooling shelter"" OR ""relief measures"" OR ""heat compensation"" OR ""severe weather warning"") Chandigarh","Delhi-NCR Weather Update: Temperature in Delhi to hit 46°C today amid severe heatwave, IMD issues orange alert, warns of…, check full forecast here
Delhi-NCR is heading towards one of the harshest days of the season as temperatures continue to rise sharply. The India Meteorological Department (IMD) has issued an orange alert for Wednesday, warning residents to take precautions as the mercury is expected to touch nearly 46°C.
The weather department has also warned that the intense heat will not be limited to Delhi alone. Neighbouring regions including Punjab, Haryana and Chandigarh are likely to experience similar severe conditions throughout the week. Along with extreme temperatures, strong surface winds are expected during the afternoon and evening hours.
Worsening situation
Tuesday already gave a glimpse of the worsening situation. The Safdarjung observatory, which is considered Delhi’s official weather station, recorded a maximum temperature of 45.1°C. This was about 4.7°C above the seasonal average and the highest temperature recorded so far this year.
Higher temperatures
Different parts of the city recorded even higher temperatures. Ridge station reported 46.5°C, Aya Nagar saw 45.5°C, while Lodhi Road touched 45.2°C. These readings clearly show that several areas are already experiencing extreme heatwave conditions.
Air quality
The rising heat has also affected air quality. Delhi’s Air Quality Index (AQI) reached 208 by 4 pm on Tuesday, making it the worst air quality recorded since April 28. The day also marked the fourth heatwave day of the year in the national capital.
IMD guidelines
As per IMD guidelines, a heatwave is declared when temperatures cross 45°C or remain more than 4.5°C above normal levels. At present, Delhi meets both these conditions, making the situation more serious.
---Advertisement---
Live News
-
16:43 (IST) 20 May 2026
PI Industries and PTC India shares witnessed sharp declines
-
14:26 (IST) 20 May 2026
Bharat Petroleum Corporation Limited under pressure
-
14:25 (IST) 20 May 2026
Bharat Electronics Limited shares fell more than 2%
SHORTS
View All Shorts
---Advertisement---",1.0
"Punjab, Chandigarh Reel Under Severe Heatwave; Faridkot Sizzles at 47.3°C - Punjab Newsline",https://news.google.com/rss/articles/CBMipgFBVV95cUxPYTd4di1oMnN6UnExa0pNRXdBcjRoeVBQSGJWSUE3T0NiVVVqVE5pRThmLThGb3FtZWhfd0xjbVVlMTVqaFBHcjJPc0Y0WEtkTkdySWt2VVhvV1pHTXBuVzBBY05WeHJ6X0tBRGlqelBmeGNMRV9kaTR2VlhOOU5IdlFMYjFkMDhPTjctS3pfMzJoWUdSdlJrZ2NDc3pCTFhHc1Y1S3Fn?oc=5,Punjab Newsline,2026-05-20T13:33:45+05:30,en,Chandigarh,Chandigarh,"""heatwave"" Chandigarh","Punjab Newsline | Chandigarh
Punjab and Chandigarh continue to grapple with an intense heatwave, with the Meteorological Centre in Chandigarh issuing a severe heatwave alert till May 23. Temperatures across the region have surged sharply, pushing daily life out of gear.
According to the weather department, Punjab recorded a rise of 1.1 degrees Celsius compared to Tuesday, with temperatures remaining 4.6 degrees above normal. Faridkot emerged as the hottest district in the state on Tuesday, recording a scorching 47.3 degrees Celsius. Most other districts also witnessed temperatures crossing the 40-degree mark.
Officials have warned that there is little relief in sight, as no rainfall is expected in Punjab over the next week. The mercury in several parts of the state is likely to hover between 45 and 47 degrees Celsius, while Chandigarh may experience temperatures ranging from 42 to 45 degrees Celsius.
Amid the soaring temperatures, authorities in Chandigarh have announced summer vacations in schools from May 23 to June 30, 2026, amounting to a 39-day break. However, teachers will be required to report to schools on June 29 and 30. Punjab is also expected to announce summer holidays for schools later this week as the heatwave intensifies.",1.0
Chandigarh Schools Announce Early Summer Vacation from May 23 Amid Heatwave - True Scoop,https://news.google.com/rss/articles/CBMivwFBVV95cUxPcFNZWDZjbGNUNnVzYkxVLUpDSVRWckV2TU9QVFVNbEFYRXVEWEdwd2lnVDA2M3lsNEJDVEU5ajg5blg3bEo2cFJGeEJuU3BRejVkRWZaVTI3WEh4alJEbG01REE2RUVkek1RY1ZHdjUwLTRrME43WnMwVHlfcUp0SzFLYklMaVhzSUVMV2pEWGZiWk10Q1huMjU3Yi15OWlxUVZCMDRCaXNnYjNUNEFJaHIzdnU0Sk9EQmpONDNkb9IBvwFBVV95cUxPcFNZWDZjbGNUNnVzYkxVLUpDSVRWckV2TU9QVFVNbEFYRXVEWEdwd2lnVDA2M3lsNEJDVEU5ajg5blg3bEo2cFJGeEJuU3BRejVkRWZaVTI3WEh4alJEbG01REE2RUVkek1RY1ZHdjUwLTRrME43WnMwVHlfcUp0SzFLYklMaVhzSUVMV2pEWGZiWk10Q1huMjU3Yi15OWlxUVZCMDRCaXNnYjNUNEFJaHIzdnU0Sk9EQmpONDNkbw?oc=5,True Scoop,2026-05-20T07:55:26+05:30,en,Chandigarh,Chandigarh,"""heatwave"" Chandigarh","Chandigarh schools will remain closed for an extended summer vacation starting May 23, 2026, as the city faces rising temperatures and a severe heatwave warning issued by the India Meteorological Department.
The District Education Office, UT Chandigarh, has officially confirmed that all government and government-aided schools will observe summer break from May 23, 2026 (Saturday) to June 30, 2026 (Tuesday), giving students a total of 39 days of holidays.
Early Decision Due to Heatwave
The decision has been taken in view of continuously increasing temperatures and health risks associated with prolonged exposure to extreme heat. Authorities have prioritized student safety as heatwave conditions intensify across the region.
Teacher Reporting Days
While students will remain on vacation throughout the period, school staff will be required to attend on June 29 and June 30, 2026, for administrative and academic planning duties.
Complete Academic Break Schedule
Along with summer vacations, the UT Education Department has also released the full academic holiday calendar:
Summer Vacation: May 23 – June 30, 2026
Autumn Break: Nov 7 – Nov 11, 2026
Winter Break: Dec 26, 2026 – Jan 7, 2027
Local holidays: Raksha Bandhan and Karwa Chauth",0.8500000000000001
Peak power demand in city zooms past 400MW as mercury soars - The Times of India,https://news.google.com/rss/articles/CBMi0wFBVV95cUxOeW1fb1FVaURrQ01JMXVxZkowTE01cWwxbjdpaHdDZ3ZZZkZSMlhVSm9LUFNqX3preHBnSWNXN3FyWGduX0VXQl92TnB0Z1AwY1ZQbzVCREROZzE1QTJpTTBjREVQOE5kS1BxdDhkRUQ3X3lWZjdJN3AwLXVhaHdiQVZqb1ZwMmNCLUxNQmxoWERuYTlCM0wyajloM1ZvTC1tejFVSFpROGV6ZW5nRW5PamxBUEpMblVULUxOZXY3UFlxZUlBekdidkpPM2trek1TZHd30gHYAUFVX3lxTE5QaHFpUmhmcEZGYmVDSXIxdjRlWHZ3ZERqQlotbU5RSnlDTE54SE5OMlFXMW9kX1RCRldvdzRkcHRGbEhoTV90SnRkRjMxdWViUmh6ZkRCUnNCVHFTWXBOVVZfNGtENTJiQVpfcXV3SEthYUJOM1BYLTMwc1k0cm9yWWpWR1FUdWgzZVpyMkVOdHByVVdUT084dDVyR2hVU2JQOFNsZXVZZmN4MXFKOG9iTHNqdVN1akxIUVNzTUlzd1RXV2RyVnV5RkxmaVZYSnhjVXVGQ01QaQ?oc=5,The Times of India,2026-05-20T00:56:00+05:30,en,Chandigarh,Chandigarh,heatwave (Chandigarh) Chandigarh,"Chandigarh: With the heat wave intensifying, power demand is reaching its peak. Between May 1 and May 17, peak power demand increased from 265MW to 326MW. On May 18, it reached 386 MW and on May 19, it was recorded at 414 MW.
Last year, on May 20, peak power demand was 425 MW and on May 21 it was 434 MW.
“Use of heavy power consuming appliances like air conditioners increases with increasing temperature. Also, this usage spreads all over the day rather than a few periods of the day,” said a UT official.
Peak power demand crossed the 300 MW mark on May 11. Since then, it has remained above 300 MW. Generally, power demand cross the 400 MW mark in June.
Last June, the city witnessed unprecedented spike in electricity consumption, with power demand reaching an all-time high of 465 MW on June 12. On June 11, peak demand reached a staggering 452 MW, an all-time record for the city.
Box:
A day after recording the season’s hottest day at 42 degrees Celsius, Chandigarh turned even hotter on Tuesday, with maximum temperature rising to 43 degrees Celsius. The India Meteorological Department (IMD) has issued an orange alert for heatwave conditions and warned residents of tougher days ahead.
BOX: Peak power demand in May 2025, 2026
May 2026
Date | Peak Demand
May 1 - 265 MW
May 2- 269 MW
May 3- 237 MW
May 4- 252 MW
May 5- 239 MW
Mat 6- 249 MW
May 7- 242 MW
May 8- 260 MW
May 9- 269 MW
May 10- 271 MW
May 11- 315 MW
May 12- 303 MW
May 13- 323 MW
May 14- 313 MW
May 15- 320 MW
May 16- 307 MW
May 17- 326 MW
May 18 - 386 MW
May 19 - 414 MW
-----------------------------
May 2025
May 1 - 315
May 2 - 249
May 3 - 263
May 4 - 231
May 5 - 245
May 6 - 247
May 7 - 254
May 8 - 271
May 9 - 269
May 10 - 250
May 11 - 253
May 12 - 279
May 13 - 325
May 14 - 338
May 15 - 365
May 16 - 330
May 17 - 333
May 18 - 348",1.0
