title,url,source,date,language,state,district,search_term,full_text,relevance_score
"भीषण गर्मी में श्रमिकों को राहत देने के लिए योगी सरकार का बड़ा फैसला, अब दो शिफ्टों में करेंगे काम - Jagran",https://news.google.com/rss/articles/CBMiwwFBVV95cUxQaEZ2YTFUa1RkMzdQR3dld0dVNGJZdVZNNXphZjV3WXFtMU5IZWNJWWhkWm9rWGNwa1ZZOEpZV3Y5SFZuaUhYR1pfNUcxSWdMUW9sM1dWZV85dkhJTXFqZ0kxM3hmQ0cyb19ERUhBMEV1SUg5N0ttT19ETVdoQ2xOMmszbFV0NGlIcHdFbWpvMFdKUEI2WUIwRUhCWndGUVZHZ2FQcWZra0duUEZtQU1pUUdZSjBMVWQzbElGeXNLbENwQ00?oc=5,Jagran,2026-05-17T22:19:00+05:30,hi,Arunachal Pradesh,,"(लू OR ""लू चलना"" OR ""भीषण गर्मी"" OR ""प्रचंड गर्मी"" OR ""कड़ी धूप"" OR ""तेज धूप"" OR ""गर्म हवा"" OR ""उष्ण लहर"" OR ""ताप लहर"" OR ""हीट वेव"" OR ""झुलसाने वाली गर्मी"" OR ""तपती गर्मी"" OR ""भयंकर गर्मी"" OR ""गर्मी का कहर"" OR ""गर्मी का प्रकोप"" OR ""अत्यधिक गर्मी"" OR मौसम OR ""मौसम अपडेट"" OR ""मौसम का हाल"" OR ""मौसम पूर्वानुमान"" OR ""मौसम अलर्ट"" OR आईएमडी OR ""आईएमडी पूर्वानुमान"" OR ""आईएमडी अलर्ट"" OR ""तापमान में बढ़ोतरी"" OR ""गर्मी से राहत"" OR ""गर्मी से निजात"") Arunachal Pradesh","भीषण गर्मी में श्रमिकों को राहत देने के लिए योगी सरकार का बड़ा फैसला, अब दो शिफ्टों में करेंगे काम
उत्तर प्रदेश में भीषण गर्मी के कारण जी रामजी योजना श्रमिकों के कार्य समय में बदलाव किया गया है। ...और पढ़ें
समय कम है?
जानिए मुख्य बातें और खबर का सार एक नजर में
राज्य ब्यूरो, लखनऊ। भीषण गर्मी को देखते हुए विकसित भारत गारंटी फॉर रोजगार एंड आजीविका मिशन ग्रामीण (जी रामजी योजना -पूर्व मनरेगा) के तहत कार्य समय में बदलाव किया गया है।
अब श्रमिक सुबह छह बजे से 11 बजे तक और शाम तीन बजे से छह बजे तक ही काम करेंगे। दोपहर के सबसे गर्म समय में काम पूरी तरह बंद रहेगा, ताकि श्रमिकों को लू और तेज धूप से राहत मिल सके। उप मुख्यमंत्री केशव प्रसाद मौर्य ने ग्राम विकास विभाग के अधिकारियों को निर्देश दिए हैं कि प्रदेश में कार्यरत सभी मनरेगा श्रमिकों को गर्मी और लू से सुरक्षित रखने के लिए पुख्ता इंतजाम किए जाएं।
सभी कार्यस्थलों पर स्वच्छ पेयजल, छायादार स्थान, प्राथमिक उपचार किट और जरूरी सुविधाएं अनिवार्य रूप से उपलब्ध कराई जाएं। साथ ही यह भी सुनिश्चित किया जाए कि किसी भी श्रमिक को लू या गर्मी से संबंधित समस्या होने पर तुरंत चिकित्सा सहायता मिले।
स्पष्ट किया है कि श्रमिकों की सुरक्षा सर्वोच्च प्राथमिकता है और गर्मी के मौसम में किसी भी तरह की लापरवाही बर्दाश्त नहीं की जाएगी।
भीषण गर्मी में श्रमिकों की सुरक्षा को लेकर निर्देश जारी
भीषण गर्मी को देखते हुए महात्मा गांधी नेशनल रुरल इप्लायमेंट गारंटी स्कीम (पूर्व में मनरेगा) के अंतर्गत कार्य समय में बदलाव किया गया है। अब श्रमिक सुबह छह बजे से 11 बजे तक और शाम तीन बजे से छह बजे तक ही कार्य करेंगे, ताकि दिन के सबसे गर्म समय में उन्हें राहत मिल सके।
उप मुख्यमंत्री केशव प्रसाद मौर्य ने ग्राम विकास विभाग के उच्च स्तरीय अधिकारियों को निर्देश दिया कि प्रदेश में कार्यरत श्रमिकों को लू और गर्मी के प्रभाव से सुरक्षित रखने के लिए ठोस व्यवस्था की जाए।
सभी कार्यस्थलों पर स्वच्छ पेयजल, छाया, प्राथमिक उपचार और अन्य जरूरी सुविधाएं अनिवार्य रूप से उपलब्ध कराने के निर्देश दिए गए हैं। अधिकारियों को यह भी सुनिश्चित करने को कहा गया है कि किसी भी श्रमिक को गर्मी या लू से संबंधित समस्या होने पर तत्काल चिकित्सा सहायता मिले।
खबरें और भी
उप मुख्यमंत्री ने भीषण गर्मी को देखते हुए श्रमिकों की सुरक्षा के दिए निर्देश
उत्तर प्रदेश के उप मुख्यमंत्री श्री केशव प्रसाद मौर्य जी ने आज ग्राम विकास विभाग के उच्च स्तरीय अधिकारियों को निर्देश देते हुए कहा कि भीषण गर्मी के इस दौर में श्रमिकों की सुरक्षा, स्वास्थ्य और सम्मान सर्वोपरि है। उन्होंने अधिकारियों को स्पष्ट निर्देश दिए कि प्रदेश में कार्यरत श्रमिकों को बढ़ते तापमान और लू के प्रभाव से बचाने के लिए सभी आवश्यक व्यवस्थाएं सुनिश्चित की जाएं।
उप मुख्यमंत्री ने कहा कि वर्तमान समय में प्रदेश के विभिन्न जनपदों में तापमान लगातार बढ़ रहा है, जिसके कारण श्रमिकों के स्वास्थ्य पर प्रतिकूल प्रभाव पड़ने की आशंका रहती है।
इसे ध्यान में रखते हुए राज्य सरकार द्वारा श्रमिकों की सुरक्षा एवं स्वास्थ्य संरक्षण के लिए विशेष प्रबंध किए जा रहे हैं, ताकि किसी भी श्रमिक को कार्यस्थल पर असुविधा या स्वास्थ्य संबंधी जोखिम का सामना न करना पड़े।
उन्होंने बताया कि जी राम जी योजना (पूर्व योजना– मनरेगा) के अंतर्गत संचालित कार्यस्थलों पर श्रमिकों के कार्य समय में आवश्यक संशोधन करने का निर्णय लिया गया है।
बढ़ते तापमान और लू की स्थिति को देखते हुए श्रमिकों से कार्य प्रातः 6 बजे से 11 बजे तक तथा सायं 3 बजे से 6 बजे तक कराए जाने का सुझाव दिया गया है, ताकि दिन के अत्यधिक गर्म समय में श्रमिकों को कार्य न करना पड़े और उनका स्वास्थ्य सुरक्षित रहे।
श्री मौर्य ने अधिकारियों को यह भी निर्देशित किया कि सभी जी राम जी योजना (पूर्व योजना– मनरेगा) कार्यस्थलों पर श्रमिकों के लिए स्वच्छ पेयजल, पर्याप्त छाया, प्राथमिक उपचार की व्यवस्था तथा अन्य आवश्यक सुविधाएं अनिवार्य रूप से उपलब्ध कराई जाएं।
इसके साथ ही श्रमिकों की नियमित निगरानी की जाए और यदि किसी श्रमिक को गर्मी या लू से संबंधित समस्या होती है तो उसे तत्काल चिकित्सा सहायता उपलब्ध कराई जाए।
उप मुख्यमंत्री ने कहा कि प्रदेश सरकार श्रमिकों के कल्याण के लिए पूरी तरह प्रतिबद्ध है। श्रमिक प्रदेश की विकास यात्रा के महत्वपूर्ण सहभागी हैं और उनके परिश्रम से ही गांवों में विकास कार्य गति प्राप्त करते हैं। इसलिए उनकी सुरक्षा और स्वास्थ्य का विशेष ध्यान रखना सरकार का कर्तव्य है।
उन्होंने कहा कि सुरक्षित और स्वस्थ श्रमिक ही सशक्त विकास की आधारशिला होते हैं। राज्य सरकार का प्रयास है कि विकास कार्यों के साथ-साथ श्रमिकों की गरिमा, सुरक्षा और स्वास्थ्य का भी पूरा ध्यान रखा जाए, ताकि प्रदेश की प्रगति में उनका योगदान निरंतर बना रहे।",1.0
"मौसम का डबल अटैक: लू की चपेट में दिल्ली-यूपी-बिहार, केरलम-तमिलनाडु में बारिश की फुहार - weather double attack delhi up bihar rajasthan under heatwave temperature cross 45 degree kerala tamil nadu receive drizzle rain alert - Jagran",https://news.google.com/rss/articles/CBMikwJBVV95cUxNTjNqY3JBYjBOTjRIcHNZTnJOaHZUZGtHOVZBRlFhQ2hmVUdVVEQycFRfNmRZYndOQWlOZmpNdndUTnB4UVNKRUlqOTFXbUVMZ1QyM2xEbzc2dTF2Ti1jT1lqdUR2UlFBOXNjQkgtY1FpdnBSLWlhVGRuOTNGVjFZcTlaNnZxTWluXzlBXzJjWGRCbHJhYnZSSEZwYkVTQ3pza05lMjZzN1hORXFuYUpkZDItNFB1LTBTcmc4S2F6RlYtYmw2TFRCOEczM1pTakwyM1dnMHlDRkMzZTZBOC1GZTl3dE9FZ0lTUDN1UGFVMU9zeVYwd2hpVnhDZjlabkwwenZZaC1iQ3N1em01ZHVKWTluZw?oc=5,Jagran,2026-05-17T17:25:00+05:30,hi,Arunachal Pradesh,,"(लू OR ""लू चलना"" OR ""भीषण गर्मी"" OR ""प्रचंड गर्मी"" OR ""कड़ी धूप"" OR ""तेज धूप"" OR ""गर्म हवा"" OR ""उष्ण लहर"" OR ""ताप लहर"" OR ""हीट वेव"" OR ""झुलसाने वाली गर्मी"" OR ""तपती गर्मी"" OR ""भयंकर गर्मी"" OR ""गर्मी का कहर"" OR ""गर्मी का प्रकोप"" OR ""अत्यधिक गर्मी"" OR मौसम OR ""मौसम अपडेट"" OR ""मौसम का हाल"" OR ""मौसम पूर्वानुमान"" OR ""मौसम अलर्ट"" OR आईएमडी OR ""आईएमडी पूर्वानुमान"" OR ""आईएमडी अलर्ट"" OR ""तापमान में बढ़ोतरी"" OR ""गर्मी से राहत"" OR ""गर्मी से निजात"") Arunachal Pradesh","मौसम का डबल अटैक: लू की चपेट में दिल्ली-यूपी-बिहार, केरलम-तमिलनाडु में बारिश की फुहार
देश में मौसम इस समय दो अलग-अलग तस्वीरें पेश कर रहा है, जहां उत्तर भारत भीषण गर्मी और लू की चपेट में है, वहीं पूर्वोत्तर और दक्षिण के कई राज्यों में ते ...और पढ़ें
समय कम है?
जानिए मुख्य बातें और खबर का सार एक नजर में
जागरण ब्यूरो, नई दिल्ली। देश में मौसम इस समय दो अलग-अलग तस्वीरें पेश कर रहा है। एक ओर उत्तर भारत भीषण गर्मी और लू की चपेट में है तो दूसरी ओर पूर्वोत्तर और दक्षिण के कई राज्यों में तेज बारिश और आंधी का दौर जारी है।
उत्तर भारत के राज्यों में राहत का दौर फिलहाल खत्म हो गया है। अगले पांच से सात दिनों तक यह इलाका भीषण गर्मी की चपेट में आने वाला है।
45-डिग्री के पार जाएगा पारा
भारतीय मौसम विभाग (आइएमडी) के अनुसार 18 से 22 मई के बीच उत्तर-पश्चिम और मध्य भारत में गर्मी का प्रकोप और तेज हो सकता है।
दिल्ली, राजस्थान, पंजाब, हरियाणा, उत्तर प्रदेश और मध्य प्रदेश के कई हिस्सों में तापमान 44 से 45 डिग्री सेल्सियस तक पहुंचने की आशंका है।
दक्षिण भारत में मानसून
दक्षिण भारत में भी मानसून पूर्व गतिविधियां तेज हो गई हैं। केरलम, तमिलनाडु और कर्नाटक के कई हिस्सों में बारिश और तेज हवाओं का दौर जारी है।
मौसम विभाग का अनुमान है कि दक्षिण-पश्चिम मानसून 26 मई तक केरलम पहुंच सकता है, जो सामान्य समय से पहले की स्थिति मानी जा रही है।
IMD ने दी चेतावनी
आइएमडी ने राजस्थान में 21 और 22 मई को गंभीर लू की चेतावनी जारी की है। दिल्ली-एनसीआर, हरियाणा और पश्चिमी उत्तर प्रदेश में भी लू चलने की चेतावनी है।
मौसम विशेषज्ञों के अनुसार इस बार मई के दूसरे पखवाड़े में तापमान सामान्य से अधिक बना हुआ है, जिससे बिजली की मांग, जल संकट और स्वास्थ्य संबंधी जोखिम तेजी से बढ़ सकते हैं। खासकर दोपहर का समय सबसे अधिक जोखिम भरा माना जा रहा है
दिल्ली में अगले दो दिनों तक अधिकतम तापमान 43 से 44 डिग्री सेल्सियस तक पहुंच सकता है। हालांकि आंशिक बादल और तेज सतही हवाओं के कारण शाम के समय कुछ राहत मिलने की संभावना जताई गई है।
मौसम विभाग ने 20 से 30 किलोमीटर प्रति घंटे की रफ्तार से हवाएं चलने का अनुमान लगाया है। बावजूद गर्म हवाओं के कारण तापमान अपनी वास्तविकता से अधिक महसूस हो सकता है।
उत्तर प्रदेश, राजस्थान और मध्य प्रदेश में गर्मी का असर सबसे ज्यादा कृषि और श्रम आधारित गतिविधियों पर पड़ने की आशंका है। खेतों में खड़ी गर्मी की फसलें और पशुधन भी इस तापमान से प्रभावित हो सकते हैं।
विशेषज्ञों का कहना है कि लगातार बढ़ती गर्मी संकेत दे रही है कि जलवायु परिवर्तन अब सीधे तौर पर मौसम के चरित्र को प्रभावित कर रहा है। पिछले कुछ वर्षों में लू की अवधि और तीव्रता दोनों बढ़ी हैं।
उत्तर भारत के राज्यों से अलग बिहार, झारखंड और पूर्वी भारत के कई हिस्सों में मौसम का दूसरा रूप दिख सकता है। वहां गरज-चमक के साथ बारिश और तेज हवाओं का अनुमान है।
पूर्वोत्तर राज्यों असम, मेघालय और अरुणाचल प्रदेश में भारी बारिश हो सकती है। इससे निचले क्षेत्रों में जलभराव और भूस्खलन का खतरा भी बढ़ सकता है।",1.0
