title,url,source,date,language,state,district,search_term,full_text,relevance_score
"मौसम का डबल अटैक: देश के इस राज्य में 23 मई तक “सीवियर हीटवेव” यानी भीषण लू की स्थिति, दूसरे राज्यों में बहुत भारी बारिश का अलर्ट - Gaon Connection",https://news.google.com/rss/articles/CBMikgJBVV95cUxOOWRvSFFGMTBUbXFMQ2NyeHkyTGphUExuZ2p2VXdtLXlzMG9VWFVuUDFFN0FEVFN3cmNsd2w4ZkloMkMxMm12Q2p1TW5iY3E1YWs0WGVCR0cyeVVhWUpVZDl0V0NZdlRTTE13X1o4NklmUV8yeUt2a0x6eVB6YkRwc1V3b2E3SmJoajQxQmxWNTBaczdwN1kza25zRDQzVXpYLWdjbFVyeXV4RkxSQjBnOVBicURrQUJadVdKQmpBay1WVVViSnJ0aEVpbVQ1LWFTMWs4STdsNHdkdGppZVJQZVdxSzJsa1dtd0FHTUZjUFBWd1VXd1gzbEJYZ241TnRHVDlmTkNQaTllcGwzbF9WZ2F30gGXAkFVX3lxTE9NakN1RUotZW92UThMbEJvVHVDa2JvTl9hLXRDZDZsN1hYbE1zLVNUeS01MHhhMC1PcmZ3b0daQlB6QWVXT2pmMkFEajVhTjhTdEl1cC1sU3lwYnlLUHRINGdkZnNwRTlXbVFyQ09tU2lDRUdoTExrNGR2dkdhNzZzTWhOZ2lKQkxVcTRmMHQ5RGJYOXNNaFB0SVBDV19EYm9ISWdudVdvak5CdXdZckdEclpRZXVYWUJjcG5CYXRTdWVZMkdYZ1FzMVowVkFWbjJEbHp1V1NIRVRZc1dYMXB1YWdOVW5oZDhfdld1QnZLVzFkSVg3NlJLZC1kOHJBWjVBaXc5VkxSMlNUTEp1bWJ5MkxpeEZOSQ?oc=5,Gaon Connection,2026-05-17T17:29:50+05:30,hi,Arunachal Pradesh,,"""लू"" Arunachal Pradesh","मौसम का डबल अटैक: देश के इस राज्य में 23 मई तक “सीवियर हीटवेव” यानी भीषण लू की स्थिति, दूसरे राज्यों में बहुत भारी बारिश का अलर्ट
देश के कई हिस्सों में मौसम का मिजाज बदल रहा है। उत्तर भारत में भीषण गर्मी और लू का अलर्ट जारी किया गया है। वहीं, दक्षिण और पूर्वोत्तर राज्यों में भारी बारिश लोगों की मुश्किलें बढ़ा सकती है। मौसम विभाग ने लोगों को सतर्क रहने की सलाह दी है। तापमान में बढ़ोतरी और तेज हवाओं का दौर जारी रहेगा।
उत्तर भारत में भीषण गर्मी और लू का अलर्ट
देशभर में मौसम तेजी से करवट ले रहा है। एक तरफ उत्तर-पश्चिम और मध्य भारत के बड़े हिस्से भीषण गर्मी और लू की चपेट में आने वाले हैं, तो दूसरी तरफ दक्षिण भारत, पूर्वोत्तर और पूर्वी राज्यों में भारी से बहुत भारी बारिश का दौर जारी रहने की संभावना है। मौसम विभाग के अनुसार अगले कई दिनों तक देश के अलग-अलग हिस्सों में अत्यधिक मौसम गतिविधियां देखने को मिल सकती हैं। खासतौर पर उत्तर प्रदेश, राजस्थान, दिल्ली, पंजाब और मध्य प्रदेश में तापमान तेजी से बढ़ेगा, जबकि असम, मेघालय, केरल और तमिलनाडु में भारी बारिश लोगों की मुश्किलें बढ़ा सकती है।
मौसम विभाग ने उत्तर-पश्चिम भारत और मध्य भारत के मैदानी इलाकों में कई दिनों तक हीटवेव से लेकर गंभीर हीटवेव की चेतावनी जारी की है। राजस्थान में 17 से 23 मई तक लू चलने की संभावना है। वहीं पंजाब, हरियाणा, चंडीगढ़ और दिल्ली में 18 से 23 मई के बीच गर्म हवाएं लोगों को परेशान करेंगी।
उत्तर प्रदेश में स्थिति और गंभीर हो सकती है। विभाग के अनुसार 17 से 23 मई तक राज्य के कई हिस्सों में लू चलेगी, जबकि 19 से 23 मई के बीच कुछ इलाकों में “सीवियर हीटवेव” यानी भीषण लू की स्थिति बन सकती है। तेज धूप और बढ़ते तापमान के कारण दिन के साथ-साथ रातें भी गर्म रहने की आशंका है। पश्चिम राजस्थान में “वार्म नाइट” की स्थिति भी बन सकती है।
अगले कुछ दिनों में उत्तर-पश्चिम भारत के कई हिस्सों में अधिकतम तापमान 3 से 5 डिग्री सेल्सियस तक बढ़ सकता है। मौसम विभाग के मुताबिक 21 मई तक गर्मी लगातार बढ़ेगी। इसके अलावा पूर्वोत्तर भारत और तेलंगाना में भी तापमान में 2 से 3 डिग्री तक वृद्धि की संभावना जताई गई है। हालांकि महाराष्ट्र और गुजरात में 20 मई के बाद तापमान में हल्की गिरावट दर्ज की जा सकती है।
असम, मेघालय, अरुणाचल प्रदेश, नागालैंड, मणिपुर, मिजोरम और त्रिपुरा में अगले 6 से 7 दिनों तक लगातार बारिश की संभावना है। कई इलाकों में गरज-चमक, बिजली गिरने और 40 से 50 किलोमीटर प्रति घंटे की रफ्तार से तेज हवाएं चल सकती हैं। अरुणाचल प्रदेश, असम और मेघालय में कुछ स्थानों पर बहुत भारी बारिश का अलर्ट जारी किया गया है। मौसम विभाग ने लोगों को पहाड़ी और भूस्खलन प्रभावित क्षेत्रों में सतर्क रहने की सलाह दी है।
तमिलनाडु, पुडुचेरी, केरल, माहे, लक्षद्वीप और दक्षिण आंतरिक कर्नाटक में अगले 3 दिनों तक भारी से बहुत भारी बारिश हो सकती है। केरल और माहे में 17 मई को अत्यधिक भारी बारिश की संभावना जताई गई है। आंध्र प्रदेश, तेलंगाना और कर्नाटक के कई हिस्सों में गरज-चमक और तेज हवाओं के साथ बारिश हो सकती है। कुछ क्षेत्रों में हवा की रफ्तार 50 से 60 किलोमीटर प्रति घंटे तक पहुंच सकती है। आंतरिक कर्नाटक में ओलावृष्टि की भी चेतावनी जारी की गई है।
पूर्वी भारत के राज्यों बिहार, झारखंड, ओडिशा और पश्चिम बंगाल में भी मौसम सक्रिय रहेगा। कई इलाकों में गरज-चमक के साथ बारिश और तेज हवाएं चल सकती हैं। बिहार और ओडिशा में 20 मई को 70 किलोमीटर प्रति घंटे तक की रफ्तार वाली तेज आंधी आने की संभावना है। उप-हिमालयी पश्चिम बंगाल और सिक्किम में भारी से बहुत भारी बारिश का अलर्ट जारी किया गया है।
जम्मू-कश्मीर, हिमाचल प्रदेश और उत्तराखंड में 19 मई के बाद मौसम बदलने के संकेत हैं। इन राज्यों में हल्की से मध्यम बारिश, गरज-चमक और तेज हवाएं चल सकती हैं। इससे कुछ इलाकों में तापमान में हल्की राहत मिलने की संभावना है।
मौसम विभाग ने लू प्रभावित इलाकों में लोगों को दोपहर के समय घर से बाहर निकलने से बचने, पर्याप्त पानी पीने और हल्के कपड़े पहनने की सलाह दी है। वहीं भारी बारिश वाले क्षेत्रों में बिजली गिरने, जलभराव और भूस्खलन जैसी घटनाओं को लेकर सतर्क रहने को कहा गया है।
उत्तर भारत में भीषण लू का खतरा
उत्तर प्रदेश में स्थिति और गंभीर हो सकती है। विभाग के अनुसार 17 से 23 मई तक राज्य के कई हिस्सों में लू चलेगी, जबकि 19 से 23 मई के बीच कुछ इलाकों में “सीवियर हीटवेव” यानी भीषण लू की स्थिति बन सकती है। तेज धूप और बढ़ते तापमान के कारण दिन के साथ-साथ रातें भी गर्म रहने की आशंका है। पश्चिम राजस्थान में “वार्म नाइट” की स्थिति भी बन सकती है।",1.0
"उत्तर भारत भीषण लू चलने की आशंका, तापमान 45 डिग्री के आसपास रहने के आसार - bhaskarhindi.com",https://news.google.com/rss/articles/CBMi3wFBVV95cUxOR3pPT0YwMnM5c2p6N0otbW5EUjl4b3lBTjl1SDlsdG9sd20xSnBXbURPWW5xVGNfdzQwaC1PNkVBR0QwcHY2VzlENHlKeHVvOEtBOTM2ZHo5cU5JN0UtYkdaMlJFZXBvMXM4S05UQWF5T3lLd3JYOWgzTDdGTTl0eE1aZXkxTEZnYzdMOHk5MzBqcDhYYmg5MlpNMHBDcmVSSy1NZlkxcmRWMVJyNjM0VHoxSm9uOENhMHhid1lDb0c0eWViUWgyM0FXSzRWd2ZrTFZ3Q3Rra3diNTNnQ2p3?oc=5,bhaskarhindi.com,2026-05-17T18:26:17+05:30,hi,Arunachal Pradesh,,"""लू"" Arunachal Pradesh","उत्तर भारत भीषण लू चलने की आशंका, तापमान 45 डिग्री के आसपास रहने के आसार
By - |17 May 2026 6:26 PM IST
भारत मौसम विज्ञान विभाग (आईएमडी) ने रविवार को बताया कि दिल्ली और उत्तर भारत के कई हिस्सों में अगले कुछ दिनों में भीषण गर्मी पड़ने की आशंका है, तापमान में 3 से 5 डिग्री सेल्सियस की वृद्धि हो सकती है।
नई दिल्ली, 17 मई (आईएएनएस)। भारत मौसम विज्ञान विभाग (आईएमडी) ने रविवार को बताया कि दिल्ली और उत्तर भारत के कई हिस्सों में अगले कुछ दिनों में भीषण गर्मी पड़ने की आशंका है, तापमान में 3 से 5 डिग्री सेल्सियस की वृद्धि हो सकती है।
आईएमडी ने एक बयान में कहा कि उत्तर-पश्चिम भारत और मध्य भारत के मैदानी इलाकों में सप्ताह के कई दिनों तक लू से लेकर भीषण लू की स्थिति रहने की संभावना है।
मौसम विभाग ने उत्तर, उत्तर-पश्चिम और मध्य भारत के मैदानी इलाकों के लिए गंभीर पूर्वानुमान जारी करते हुए पूरे सप्ताह भीषण गर्मी पड़ने की आशंका जताई है। विभाग का कहना है कि इन क्षेत्रों में लोगों को लू से राहत मिलने की कोई उम्मीद नहीं है।
दिल्ली और एनसीआर में बढ़ते तापमान का असर दिखना शुरू हो गया है, पारा सामान्य से ऊपर चढ़ गया है। शनिवार को सफदरजंग (जो शहर के मौसम का प्रतिनिधित्व करता है) में अधिकतम तापमान 40 डिग्री सेल्सियस दर्ज किया गया, जो सामान्य से 0.4 डिग्री अधिक है।
उत्तर-पश्चिम भारत के कई हिस्सों, जिनमें राजस्थान, पंजाब और हरियाणा शामिल हैं, में पूरे सप्ताह तापमान में धीरे-धीरे वृद्धि होने की संभावना है।
मौसम विभाग ने अगले सप्ताह के मौसम पूर्वानुमान में कहा कि उत्तर-पश्चिम भारत के कई हिस्सों में 21 मई तक अधिकतम तापमान में 3-5 डिग्री सेल्सियस की क्रमिक वृद्धि होने की संभावना है और 22-23 मई के दौरान इसमें कोई खास बदलाव नहीं होगा।
मौसम विभाग ने आगे कहा कि राजस्थान में 17 से 23 मई तक लू चलने की संभावना है, जबकि पंजाब, हरियाणा, चंडीगढ़ और दिल्ली के कुछ क्षेत्रों में 18 से 23 मई तक तापमान में तेजी आने की आशंका है। मध्य प्रदेश और छत्तीसगढ़ में 17 से 21 मई तक लू चलने की संभावना है।
उत्तर प्रदेश के कुछ हिस्सों में अगले सप्ताह मध्यम से लेकर भीषण लू चलने की संभावना है, जबकि दक्षिणी भाग में तेलंगाना भी भीषण गर्मी की चपेट में आएगा।
मौसम विज्ञान विभाग ने 17 और 18 मई को मध्य प्रदेश और विदर्भ के कुछ हिस्सों और पश्चिमी भारत के कुछ भागों में तेज हवाओं और ओलावृष्टि के साथ मध्यम बारिश का पूर्वानुमान लगाया है।
पूर्वोत्तर के कई राज्यों, जिनमें असम और मेघालय, नागालैंड, मणिपुर, मिजोरम और त्रिपुरा शामिल हैं, में 18 मई को बिजली और गरज के साथ बारिश होने की संभावना है, जबकि अरुणाचल प्रदेश में इसी दौरान भारी बारिश की आशंका है।
अस्वीकरण: यह न्यूज़ ऑटो फ़ीड्स द्वारा स्वतः प्रकाशित हुई खबर है। इस न्यूज़ में BhaskarHindi.com टीम के द्वारा किसी भी तरह का कोई बदलाव या परिवर्तन (एडिटिंग) नहीं किया गया है| इस न्यूज की एवं न्यूज में उपयोग में ली गई सामग्रियों की सम्पूर्ण जवाबदारी केवल और केवल न्यूज़ एजेंसी की है एवं इस न्यूज में दी गई जानकारी का उपयोग करने से पहले संबंधित क्षेत्र के विशेषज्ञों (वकील / इंजीनियर / ज्योतिष / वास्तुशास्त्री / डॉक्टर / न्यूज़ एजेंसी / अन्य विषय एक्सपर्ट) की सलाह जरूर लें। अतः संबंधित खबर एवं उपयोग में लिए गए टेक्स्ट मैटर, फोटो, विडियो एवं ऑडिओ को लेकर BhaskarHindi.com न्यूज पोर्टल की कोई भी जिम्मेदारी नहीं है|",1.0
IMD forecasts severe heat wave conditions over North India on May 18 - News On AIR,https://news.google.com/rss/articles/CBMinwFBVV95cUxNWE5wTUptc2VuSnBCc0V3Q3RmUmlxaTJDdUZqU3JDT3JIWlNQelMzX0poSUtFNFVkRW5jb2N5M2NkclIwanU4bEh3ZWRQaVlTS2JJSFRFRkZPbE9fTXEwRHNRMFNfTkZYS0k2T2xGWGlwMmFQYUo1TlY4ZmZhdE1NNXNrNEhtYlhUUktFWXJoSUFsR3pISW1aWFNFS3EwNGs?oc=5,News On AIR,2026-05-17T20:06:00+05:30,en,Arunachal Pradesh,,"(heatwave OR ""heat wave"" OR ""severe heatwave"" OR ""extreme heat"" OR ""heat spell"" OR ""scorching heat"" OR ""blistering heat"" OR ""sweltering heat"" OR ""hot winds"" OR loo OR ""hot loo winds"" OR ""intense heat"" OR ""unbearable heat"" OR ""deadly heat"" OR heat OR ""weather forecast"" OR ""weather update"" OR ""weather alert"" OR ""IMD forecast"" OR ""IMD prediction"" OR ""IMD alert"" OR IMD OR ""rising temperatures"" OR ""temperatures expected to rise"" OR ""relief from heat"" OR ""respite from heat"" OR ""heat respite"" OR ""respite from scorching heat"") Arunachal Pradesh","The India Meteorological Department (IMD) has said that the Southwest Monsoon is likely to set in over Keralam on 26th of this month with a model error of plus or minus four days. IMD said, conditions are favourable for further advance of southwest monsoon into some more parts of southeast Arabian Sea, southwest and southeast Bay of Bengal, remaining parts of Andaman Islands and Andaman Sea, and some parts of east central Bay of Bengal during the next two to three days.
IMD has forecast Heat Wave to Severe Heat Wave conditions over West Uttar Pradesh for tomorrow. Similar weather conditions are also expected over Delhi, Haryana, Chandigarh, Madhya Pradesh, Punjab, Rajasthan, Telangana and Vidarbha during the next two days. Meanwhile warm night conditions have been predicted for West Rajasthan for tomorrow.
According to the Met Department a gradual rise in maximum temperatures by three to five degrees Celsius is expected over many parts of Northwest India during the next three to four days.
The Weather Agency has also issued an orange colour warning for thunderstorms accompanied by hailstorm over Karnataka tomorrow. Thunderstorms accompanied by lightning and gusty winds are also expected over Chhattisgarh, West Bengal, Jharkhand, Lakshadweep, Madhya Maharashtra, Odisha and Andhra Pradesh tomorrow. IMD further predicted heavy rainfall over Andaman and Nicobar Islands, Kerala, Mahe, Tamil Nadu, Puducherry, Karaikal and parts of North East India during the next two days.",1.0
