title,url,source,date,language,state,district,search_term,full_text,relevance_score
"Madhya Pradesh May 25, 2026, Weather Update: Nautapa Begins With Severe Heatwave In State; Red Alert Issued In - Free Press Journal",https://news.google.com/rss/articles/CBMilAJBVV95cUxPbnljcDdEVkYzTXlCSjJaMU5tN1RoZ3FGVzdLclkxTFJiR25xSnI2emo1MFYtSVBkV3pOWG9McXNEcXpjRlBpUGhZNHBrY0JkVzVCTFJjQnBpeS1hQTJCY2Zrd0xBcTBxSS1tMVRNWVh1Tkhna3BIcUdoOENYdUt2MmIyaEtTZ3AwN0lCMFFIX0hyN2w0RnJSS0h6T0FPZ2pndHVuWjFLNy1vbTN2WWNVS2VUeVV5RG40WDlYYlZicF8xeUNoYmZvdmx3ZXAyeDdhRVN5YldJMGlwRDZuRTQ0OXlBRDVibTdoQkpTMUxmZlY1eXhsenByX3lLT2NfWk5aVWVrWmx4aXpwdUZEeUVnejJpNUHSAZQCQVVfeXFMT255Y3A3RFZGM015QkoyWjFObTdUaGdxRlc3S3JZMUxSYkducUpyNnpqNTBWLUlQZFd6TlhvTHFzRHF6Y0ZQaVBoWTRwa2NCZFc1QkxSY0JwaXktYUEyQmNma3dMQXEwcUktbTFUTVlYdU5IZ2twSHFHaDhDWHVLdjJiMmhLU2dwMDdJQjBRSF9IcjdsNEZyUktIek9BT2dqZ3R1bloxSzctb20zdlljVUtlVHlVeURuNFg5WGJWYnBfMXlDaGJmb3Zsd2VwMng3YUVTeWJXSTBpcEQ2bkU0NDl5QUQ1Ym03aEJKUzFMZmZWNXl4bHpwcl95S09jX1pOWlVla1pseGl6cHVGRHlFZ3oyaTVB?oc=5,Free Press Journal,2026-05-25T09:30:28+05:30,en,Madhya Pradesh,Barwani,"""heatwave"" Madhya Pradesh","Madhya Pradesh May 25, 2026, Weather Update: Nautapa Begins With Severe Heatwave In State; Red Alert Issued In 5 Districts As Temperature Nears 46°C
Nautapa began on May 25 with severe heatwave conditions across Madhya Pradesh. The IMD issued heatwave alerts in 44 districts, including red alert in five districts — Niwari, Tikamgarh, Chhatarpur, Panna and Satna. Naugaon and Khajuraho recorded 45.8°C. Officials warned that extreme heat will continue till May 31 and advised people to stay hydrated and avoid afternoon sun exposure.
Bhopal (Madhya Pradesh): Nautapa, considered the hottest period of summer, began on Monday, May 25, and will continue till June 2.
The India Meteorological Department (IMD) in Bhopal has warned that Madhya Pradesh will remain under severe heatwave conditions from May 25 to May 28.
According to the weather department, 44 districts are expected to witness heatwave conditions on Monday. Five districts — Niwari, Tikamgarh, Chhatarpur, Panna and Satna — are under red alert for severe heatwave, with temperatures likely to remain extremely high.
Cities like Bhopal, Gwalior and Ujjain are also expected to face intense heat during the beginning of Nautapa, with temperatures reaching around 44 degrees Celsius.
Before the start of Nautapa, several parts of the state already recorded very high temperatures on Sunday. Naugaon and Khajuraho were the hottest cities, both recording 45.8 degrees Celsius. Datia recorded 45 degrees, while Tikamgarh and Shajapur touched 44 degrees Celsius.
Among the major cities, Gwalior recorded the highest temperature at 44.1 degrees Celsius. Bhopal recorded 42.7 degrees, Jabalpur 43.3 degrees, Ujjain 41.5 degrees and Indore 40.9 degrees Celsius.
The IMD has issued orange alert for severe heatwave conditions in 18 districts, including Bhind, Datia, Sagar, Jabalpur, Rewa, Sidhi and Singrauli.
Yellow alert has been issued in 21 districts, including Bhopal, Gwalior, Ujjain, Neemuch, Ratlam, Morena and Khandwa.
Meanwhile, districts like Indore, Dewas, Dhar, Chhindwara and Barwani are expected to witness very hot weather conditions even without an official heatwave warning.
Weather scientist HS Pandey advised people to avoid going outside between 12 PM and 3 PM unless necessary. He asked people to drink enough water, stay hydrated and wear light cotton clothes. Special care has been advised for children and elderly people.
The weather department said the heatwave conditions are expected to remain at peak till May 31, and people are unlikely to get relief from the heat during the next few days.
Officials also warned that extreme heat can lead to health problems like acidity, dehydration, nose bleeding and heatstroke. Doctors advised people to avoid oily and spicy food and take extra precautions during the daytime heat.
RECENT STORIES
-
‘Luteri Dulhan’ Gang Busted After Groom Checks Wife’s WhatsApp Chats 3 Days After Marriage In... -
Fourth Fuel Price Hike In 11 Days; Petrol Costs ₹114.65/L In Bhopal, ₹114.54/L In Indore -
Dehradun Chaos Caught On Camera: Drunk Man Blocks Traffic, Allegedly Threatens Police With Knife At... -
Maa Behen OTT Release Date: When And Where To Watch Madhuri Dixit, Dharna Durga And Triptii... -
Sikkim State Lottery Result: May 25, 2026, 6 PM Live - Watch Streaming Of Winners List Of Dear...",1.0
