title,url,source,date,language,state,district,search_term,full_text,relevance_score
"Mulberry crop dries up amid intense heat, silk cocoon farmers feel the pinch - The New Indian Express",https://news.google.com/rss/articles/CBMi4gFBVV95cUxQQ1ZuUXpqMVp5VjNCaDRmRVBsNFh3VnlOTG8teFhKYnpFSWhaQzluaG1BYUprVEVHTEtpdzh6R3pMOG8tYnVseEtCMzJpdndJZXZaTzVMWkhSNUhvUUxpTlZMMDJfTnJEVkl6enJlX3ZySlhvaTZ0NEhuUTd0YnZDdHpUNlB2SnJBNnpnSUYxb21KeXBHLXdnTzRBVzk2UTVvZFJlUnpkMG1iNFNlRDVsb3lRWDdkTEpIRFhVWl93SGtGVkxJVy1abVdabFZhYlF5ZWM4a3ZrMmVLYXlheEhJV2FB0gHiAUFVX3lxTFBDVm5RemoxWnlWM0JoNGZFUGw0WHdWeU5Mby14WEpiekVJaFpDOW5obUFhSmtURUdMS2l3OHpHekw4by1idWx4S0IzMml2d0lldlpPNUxaSFI1SG9RTGlOVkwwMl9OckRWSXp6cmVfdnJKWG9pNnQ0SG5RN3RidkN0elQ2UHZKckE2emdJRjFvbUp5cEctd2dPNEFXOTZRNW9kUmVSemQwbWI0U2VENWxveVFYN2RMSkhEWFVaX3dIa0ZWTElXLVptV1psVmFiUXllYzhrdmsyZUtheWF4SElXYUE?oc=5,The New Indian Express,2026-05-01T08:58:00+05:30,en,Assam,,"(heatwave OR ""heat wave"" OR ""severe heatwave"" OR ""extreme heat"" OR ""heat spell"" OR ""scorching heat"" OR ""blistering heat"" OR ""sweltering heat"" OR ""hot winds"" OR loo OR ""hot loo winds"" OR ""intense heat"" OR ""unbearable heat"" OR ""deadly heat"" OR heat OR ""weather forecast"" OR ""weather update"" OR ""weather alert"" OR ""IMD forecast"" OR ""IMD prediction"" OR ""IMD alert"" OR IMD OR ""rising temperatures"" OR ""temperatures expected to rise"" OR ""relief from heat"" OR ""respite from heat"" OR ""heat respite"" OR ""respite from scorching heat"") Assam","Representative image File Photo | Express
DHARMAPURI: With the intensifying summer heat, mulberry farmers have reportedly been struggling to keep their mulberry trees alive. The lack of water affects not only the trees but also the silkworms and the cocoons they produce. Sericulturists in Dharmapuri say production could decline by up to 20% in the upcoming month due to the intense heatwave.
Dharmapuri district has about 724.25 acres of mulberry plantations dedicated to aiding sericulturist trade, with production of over 17 lakh tonnes of silk cocoons annually. Due to the apt climatic conditions, the district has a sericulture market at four roads junction, where 1-3 tonnes of silk cocoons are auctioned on a daily basis on average, with the participation of 50 to 90 farmers.
However, the intense heatwave this summer has left farmers disappointed, as the price of silk cocoons and the quality of the cocoons have dropped.
MG Manivannan, a sericulturist from Madhikonpalayam, said, ""In the heat, the quality of mulberry we get is affected. The trees are affected by the heatwave and the lack of moisture is affecting production. This has led to a drop in the quality of mulberry nursing the silkworms, which affects the quality of the silk cocoon.""
Another sericulturist, B Mahalingam from Pennagaram, said, ""We could manage the situation if we had more water. Right now, the entire district is facing acute shortage of water for cultivation and this has impacted sericulture trade too. Usually in the summer, the dry climate improves the quality of our cocoons, but the intense heatwave this year has stunted the silkworms and directly impacted the quality of the cocoons. We need more water to improve the production of mulberry.""
On Wednesday, the average price of a kilo of silk cocoon was Rs 537, while the maximum price was Rs 674. Earlier, the average price was around Rs 650 and the highest price auctioned had crossed Rs 725.
Commenting on the situation, officials in the sericulture department said, ""With proper heat management, the issue could be resolved. We have offered training to farmers, but the heatwave is too intense and the moisture is very low. At present, we have an average trade of 50 tonnes in the Dharmapuri silk cocoon market. We expect the production to drop by at least 10 to 20%.
Due to the lack of minimum moisture levels in the cocoon, reelers would face problems while extracting silk threads. In some cases, there are small black spots on the cocoons caused by the heat. Further, the low moisture causes a slight discoloration on the threads produced. So the trade has reduced. This season's impacts would be eliminated after the summer passes. """,0.8500000000000001
"Heatwave rules: Schools allow cotton clothing, ban outdoor activities - The Times of India",https://news.google.com/rss/articles/CBMi2AFBVV95cUxOel9OWWFQbGlfYzMzUGVNb241RFNXOVE1VE8xRDdLT1FtazlacklXWkoweFhzeThCUW83YTluWktDcTR2TV9aR0UwSXFLVi11ZlRnSzk5WDBIRHVZZjhjLXlCU1BhdHhaa3NLZWxUUDBSVklVN2RkcWk2VmdrSnE4YUtpYXhrUFhEblR5dnpRZFlqRFhnbjVsNGRDS1dQeHA1MmduLUlUdW90V2phaUZCalVPd1BRRzZZaG1nVzJMSUxzUjhOMXFEQnUwMjNRamJCY29fa004SHbSAd4BQVVfeXFMUDhlRThpT2xGOWs2ek5ObHlfRjhHOE1xcWNRTV9fTUhIYmRsUEFERm1pTktWSmhVcWltVFg2M3pfQ3FWSFIxVFdEUFFPM2VhcklGaTVQREc0WnN5YWdHdnNGeE5wYUlVaG9GMUNtUnZ4SFRvLWljdlJTcm9pT1RFeEo5RTZkTHFrM3BKaEpWTW1Mci1aa2lVMTEydHUySURWVVVNRUJlQXg4UjhoNDNRNkdId0k4X1pQSzN2eTZGZC1CajI5OXljZHZhMUZuLWtxeGVYUm5mcVNlMXJNVThB?oc=5,The Times of India,2026-05-01T02:19:00+05:30,en,Assam,,"(heatwave OR ""heat wave"" OR ""severe heatwave"" OR ""extreme heat"" OR ""heat spell"" OR ""scorching heat"" OR ""blistering heat"" OR ""sweltering heat"" OR ""hot winds"" OR loo OR ""hot loo winds"" OR ""intense heat"" OR ""unbearable heat"" OR ""deadly heat"" OR heat OR ""weather forecast"" OR ""weather update"" OR ""weather alert"" OR ""IMD forecast"" OR ""IMD prediction"" OR ""IMD alert"" OR IMD OR ""rising temperatures"" OR ""temperatures expected to rise"" OR ""relief from heat"" OR ""respite from heat"" OR ""heat respite"" OR ""respite from scorching heat"") Assam","- Heatwave rules: Schools allow cotton clothing, ban outdoor activities
Trending
Jaipur: Amid an intense heatwave, the state education department, Wednesday, directed all govt and private schools to suspend outdoor activities and allow students to wear light cotton clothes instead of uniforms, while ruling out early summer vacations.The Directorate of Secondary Education has asked schools to shorten morning assemblies and hold them in shaded areas or inside classrooms to minimise heat exposure. Institutions have also been told to ensure adequate drinking water, especially for students leaving school at dispersal time.The decision comes even as teachers expressed resentment over a shorter summer break this year. While the college education department has declared vacations from May 1 to June 30, school holidays will run from May 16 to June 21.Education minister Madan Dilawar said schools will remain open as planned to ensure academic targets are met. “Our aim is to complete 20% of the syllabus before the summer break and conduct a test. Students can then revise during the holidays,” he said, adding that the academic session began on April 1 with results declared in March for the first time.The department has also advised students to cover their heads with caps or cloth while commuting and to stay hydrated to prevent heatstroke.Vipin Prakash Sharma, president of the Rajasthan Primary and Secondary Teachers Association, criticised the move, citing inadequate cooling facilities in many schools.
You Can Also Check: Gold Rate in Jaipur | Silver Rate in Jaipur | Bank Holidays in Jaipur | Public Holidays in Jaipur | Jaipur AQI | Weather in Jaipur
End of Article
Follow Us On Social Media",1.0
Health teams deployed to dists amid heatwave alert - The Times of India,https://news.google.com/rss/articles/CBMiwgFBVV95cUxPczVIWWxRT3E2bTFGOFZfR3VZWU5nbFhWOXlQYmJ3eHdyOE5GT2tha1JYb1ZtNFV6NHNwaHJRcWVSYmxtYkVIMHRueURUSTFDenQ2ODdSU3B2Y3B3VXNOMWNvR3JFUHpKUEFwTjFmTDRMTE81VUJsUW9rd0ZYekxEeWhZT3cybUp4NE1USDI5T1NyY0xnODhMaEYtQ3U3ZUN5SU9kQWN3SVY5YmpBV1dxRTBuYjhzVU03YUZtVExnYzgtd9IBxwFBVV95cUxQUFZ2clFuLU5sSUNqYXVfVko0R09XUzFDTHF0RGZTczNuRDRZZmlSdGhYanAtdFM2YmVqODFZUWpwaGsyYUpIaVNsejJOZDhzNDVLUWZ1UmMxd0hMeEsxUjZ3YVdHenZBVmlKUlZkc2JrM2JKNV9sMXI1SzBqVWVkWU0xV2RCRTJSVjdvTnNLYlBmdExsLThuVDYybnpCQXNfZkpOVF9BVzRxUVJZdGNrMDJ2djlvOXBxeW85REJpNDZWd1dpZktN?oc=5,The Times of India,2026-05-01T02:06:00+05:30,en,Assam,,"(heatwave OR ""heat wave"" OR ""severe heatwave"" OR ""extreme heat"" OR ""heat spell"" OR ""scorching heat"" OR ""blistering heat"" OR ""sweltering heat"" OR ""hot winds"" OR loo OR ""hot loo winds"" OR ""intense heat"" OR ""unbearable heat"" OR ""deadly heat"" OR heat OR ""weather forecast"" OR ""weather update"" OR ""weather alert"" OR ""IMD forecast"" OR ""IMD prediction"" OR ""IMD alert"" OR IMD OR ""rising temperatures"" OR ""temperatures expected to rise"" OR ""relief from heat"" OR ""respite from heat"" OR ""heat respite"" OR ""respite from scorching heat"") Assam","Trending
You Can Also Check: Gold Rate in Jaipur | Silver Rate in Jaipur | Bank Holidays in Jaipur | Public Holidays in Jaipur | Jaipur AQI | Weather in Jaipur
End of Article
Follow Us On Social Media
Tired of too many ads?go ad free now
In City
Entire Website
- Big relief for Karisma Kapoor’s children as Delhi HC freezes Sunjay Kapur’s assets in India
- Chlorine gas leaks at defunct water purification plant in Pune; 24 hospitalised
- 'What the hell is wrong?': Chaos at Mumbai airport due to inordinate SpiceJet flight cancellations
- Bengaluru rain havoc: How sudden storm turned shelter into killing zone; 7 crushed to death
- West Bengal polls: VIP treatment for 104-year-old who fought SIR & won
- 4 deaths trigger watermelon scare in Mumbai; probe slows, traders pull fruit off shelves
- Heat to havoc: 1hr of hailstorm, heavy winds unleash chaos on Central Business District in Bengaluru; IMD warns more rain in next 48 hours
- 10 dead in Bengaluru rains: Hailstorm, heavy winds unleash chaos in city; watch
- First in India: AI-powered Namma 112 goes multilingual
- Delhi weather: Rain keeps pollution and mercury in check in April
- AP SSC Class 10 Result 2026 Live Updates: BSEAP 10th results releasing shortly at bse.ap.gov.in; list of official websites, how to check and download marks memo
- Exit Polls For Five States: Bengal on knife-edge BJP–TMC fight; TVK, BJP, UDF, NDA gain
- CBSE Class 12th Result Live Updates: When will class 12 scorecards be released? Check latest updates, steps to download from DigiLocker and UMANG app here
- Board Exam Results 2026 Live Updates: ICSE, ISC results declared; CBSE Class 12 result awaited, check state-wise status here
- Maharashtra HSC Result 2026 Live Updates: Expected next week after Buddha Purnima and weekend gap, DigiLocker shows coming soon status
- Delhi CM SHRI school entrance test results to be released shortly at edudel.nic.in: Here are official websites to check
- 'Imagine the pain, humiliation': Supreme Court urges Centre to allow abortion beyond 20 weeks for rape survivors
- Trump Renames Strait Map: US blockade strains Iran and oil markets; Tehran hardliners dig in
- ISC, ICSE Result 2026 Live Updates: Class 10th, 12th scorecards to be released shortly, check how to download from results.cisce.org, DigiLocker, Careers UMANG portal, keep checking for latest updates here
- IPL 2026 playoff scenarios: What Mumbai Indians need to do and why time is running out
Tired of too many ads?go ad free now
Explore Every Corner
Across The Globe
US Iran War NewsPat McAfeeImmanuel KantNHL Trade RumorsVenus WilliamsWest Bengal Election 2026Exit Poll Result 2026Jason WhitlockDianna Russini RumorsMike VrabelCardi BVirat KohliWho is Ines GarciaJapan Bodybuilders RecruitmentMegan Thee StallionGraphene ToothbrushesBengal Exit Polls 2026Bengal Elections EVM TamperingTyson FuryRCB vs GT HighlightsBrady TkachukCandace OwensMary Kay CabotChina Robot DeploymentIPL 2026 Orange CapCristiano RonaldoImmanuel KantKobbie MainooOrange Cap Holder in IPL 2026IShowSpeed
Hot on the Web
Buddha Purnima WishesR MadhavanSundar PichaiKareena Kapoor KhanKarishma KapoorRahul RoySalman KhanAbhijeet BhattacharyaMaryna ViazovskaRaja ShivajiMilk Dessert RecipesMaharashtra Day 2026Olivia RodrigoHema MaliniUS National ParksBhooth Bangla Box Office CollectionSantosh KumarLewis CarrollLIK CollectionSidharth BhardwajAntonio VicenteIra KhanDhurandhar 2 Box Office CollectionBhooth Bangla Movie ReviewJustin BaldoniCriminal Record Season 2 ReviewDhurandhar 2 ReviewDhurandhar 2 CollectionMovierulzHoroscope TodayToday Gold Rate in ChennaiDelhi Weather TodayDelhi AQI TodayMumbai AQI TodayMaharashtra Public Holidays 2026Vinod KhoslaSam AltmanKing Legacy CodesGenshin Impact CodesGarena Free Fire Max Redeem CodesEU Warns Meta
Trending Topics
Exit Poll Result 2026Angkrish RaghuvanshiWest Bengal Assembly ElectionsPrasidh KrishnaJannik SinnerWest Bengal exit pollNMMS Kerala Result 2026Ritika SajdehShikhar DhawanIndia Post GDS 3rd Merit ListOdisha Class 10th ResultRory McIlroyBo NixMegan Thee StallionWest Bengal Opinion Poll 2026Assam Opinion Poll 2026Puducherry Opinion Poll 2026Tamil Nadu Opinion Poll 2026Kerala Opinion Poll 2026Puducherry Election Result 2026Kerala Election Result 2026Tamil Nadu Election Result 2026Assam Election Result 2026West Bengal Election Result 2026Rohit SharmaQuinton de KockICSE ISC Result 2026Ryan RickeltonClavicularExit PollSam AltmaniOS 27Fortnite Server DownElon MuskSwami JnananandaJohn TernusBillionaires Turned AI DogsSundar PichaiNyt ConnectionsSridhar VembuBlue Lock Rivals Codes
Popular Categories
HeadlinesSports NewsBusiness NewsIndia NewsWorld NewsBollywood NewsHealth+ TipsIndian TV ShowsTechnologyTravelEtimesHealth & FitnessAstrologyInternational SportsDeorhiTechnology NewsAutoWeather TodayGold Rate Today DelhiSilver Rate TodayPlatinum Rate TodayIs Bank open todayVirat Kohli IPL StatsHardik Pandya IPL StatsBank HolidaysPublic HolidaysBank Holidays MayPublic Holidays MayGold Price in DelhiGold Price in Mumbai
Trending Videos
‘KICK U.S. OUT OF HORMUZ!’: Iran’s ‘Direct Warning’ To US Military In Gulf; ‘Future Free Of America’’12 Israeli Casualties…’: Iran Ally Unleashes ‘Undetectable Monster Weapon’ On IDF In Shock AttackTrump Explodes Over ‘86 47’ Post, Calls Comey ‘Dirty Cop’ In Deadly Code Row Trump Explodes Over ‘86 47’ Post, Calls Comey ‘Dirty Cop’ In Deadly Code Row Trump Explodes Over ‘86 47’ Post, Calls Comey ‘Dirty Cop’ In Deadly Code Row Keir Starmer Faces Furious Heckling In Golders Green Amid Jewish Stabbing Outrage'Brace Yourselves!': Shocking Footage Shows NATO Troops 'Ducking In Fear' As Iran Missile Hits Base'Rial Payments, Tolls For Hostile Nations': Iran Sets New Rules For Crossing Hormuz, Rejects US RoleKing Charles Jokes US Would Speak French BUT Macron’s 4-Word Comeback STEALS THE SHOWKing Charles Accused Of Quietly 'Wheeling And Dealing' Over Andrew DramaTMC Stages Protest Outside EVM Strong Room In Kolkata, Shares CCTV Footage Alleging IrregularitiesChanakya Exit Poll: BJP Set For Big Win In Bengal, DMK Leads TN, NDA Dominates AssamErika Kirk’s Podcast Turns Controversial: ‘Death Threat’ Claims and ‘Sniper’ Comparisons EXPLODEDMK To Win Tamil Nadu; Close Fight In Kerala, BJP To Sweep Assam: Today's Chanakya Exit PollMamata Banerjee Set To Lose West Bengal, BJP To Win 192 Seats: Today's Chanakya Exit PollHegseth GRILLED In House For Sending 3 US Carriers To Mideast | Iran WarWhy Indian Airlines Are Under Cost Pressure Due To Rising Fuel PricesNaval Anti-ship Missile : Navy, Drdo Demonstrate Salvo Launch That Can Sink Ships
Latest News
Hazaribag man drowns while fishing in lake""Behen Darr Gayi!"": Fans relive ‘Bhagam Bhag’ era after watching Akshay Kumar's 'Bhooth Bangla' trailerMBOSE HSLC result 2026 to release tomorrow: Check details hereIran war risk: JPMorgan CEO Jamie Dimon warns of oil shocks, sticky inflation and higher interest ratesMake your clutch last longer with these easy driving tips“Three-against-one situation”: El Rubius opens up on being “targeted” in MrBeast’s viral $1M challengeBihar BTSC lab assistant notification released for 1091 posts at btsc.bihar.gov.in; apply hereIPL craze costs techie Rs 1.46 lakh in fake RCB vs CSK ticket scamRaising “robot-proof” kids: Why creativity and curiosity matter more than everInside ‘Satguru Sharan’: Exploring Saif Ali Khan and Kareena Kapoor Khan’s Rs 100 crore Bandra homeHow selling Alaska in 1867 was a costly mistake for Russia'Hera Pheri 3 is coming': Paresh Rawal dismisses delay reports and reveals he will 'start shooting soon'US-Iran War: A daring rescue Hollywood blockbuster is on its way. Till then, pick your favourite from these 10 films on bringing someone home against all oddsKolkata team unveils fan mural at Rash Behari Avenue, celebrating city’s first loveHow US spread a lie to rescue a pilot of a jet shot down in IranNetflix unveils ‘VOID’, an AI model that can change a movie plotAI data centers are causing 'stress' not just to tech companies, but also private insurers""Trans women are....."": Clavicular’s viral moment with trans women sparks fresh conversation on internet culture",0.8500000000000001
