title,url,source,date,language,state,district,search_term,full_text,relevance_score
Kerala to experience extreme heat over next few days - NewsBytes,https://news.google.com/rss/articles/CBMingFBVV95cUxPV2FvOUhPUU40d2E5VlJmWjJCUUt2UFlBczM4dzU3ZWhDWWR1OVFmTThqWVd4c3FXU0hJdHRkZXpDN1dSSEVOaGVOb1cybUNhZldsdmJDVGJJOHVLdE1XZzhxcWNoVFFreWNSbDJER1FZSHVLaDRrVVpVODUxY0dmVlJsdEFtTXItNnZFMTQzN0ZoWllVMTQwTHhoNGYxdw?oc=5,NewsBytes,2026-03-26T16:00:21+05:30,en,Kerala,Kollam,"(heatwave OR ""heat wave"" OR ""severe heatwave"" OR ""extreme heat"" OR ""heat spell"" OR ""scorching heat"" OR ""blistering heat"" OR ""sweltering heat"" OR ""hot winds"" OR loo OR ""hot loo winds"" OR ""intense heat"" OR ""unbearable heat"" OR ""deadly heat"" OR heat OR ""weather forecast"" OR ""weather update"" OR ""weather alert"" OR ""IMD forecast"" OR ""IMD prediction"" OR ""IMD alert"" OR IMD OR ""rising temperatures"" OR ""temperatures expected to rise"" OR ""relief from heat"" OR ""respite from heat"" OR ""heat respite"" OR ""respite from scorching heat"") Kerala","Kerala to experience extreme heat over next few days
Kerala is in for a few more days of sweltering heat, with temperatures set to reach up to 38 degrees Celsius in places like Kollam and Palakkad.
Kottayam and Kozhikode aren't far behind, expecting highs around 37-38 degrees Celsius, and even Thiruvananthapuram and Malappuram will be a couple degrees hotter than usual.
The good news? There's a chance of thunderstorms and winds over the weekend that could finally cool things down.
KSDMA issues advisory for extreme heat
The Kerala State Disaster Management Authority (KSDMA) is urging everyone to drink plenty of water, avoid being out in the sun from 11am to 3pm and stick to loose, light-colored cotton clothes.
If you start feeling dizzy or unwell, find some shade right away. Don't hesitate to get medical help if needed.
Employers have also been asked to adjust work hours so people aren't stuck outside during peak heat.",1.0
