title,url,source,date,language,state,district,search_term,full_text,relevance_score
"Chandigarh Weather Update: चंडीगढ़ में झमाझम बारिश, 6 जुलाई तक येलो अलर्ट; तापमान में बड़ी गिरावट - Amar Ujala",https://news.google.com/rss/articles/CBMi_gFBVV95cUxNRko1ZmpNTFlnel9ZZGJUZnF2SHBKUEk3Sk9YQWJSX0NIWTBEa0VheFR0TEtDZDFteUNKOURwb3BfNjNxb1ZJdzZaQ2ZqNVRPWk5CRkRBVnRHeUxTRHhTamFXYzJlZnJZa1laVTk5dlVkUFgxREgtb2Nia3NpU19RNFlPanE5RGtySDJ3eG5IcU81azVjTzBIZnlUSFM5N2dsLUJqYm5PLV9aS0dCbzY5a3JMTnJaUXVUZXh0NF8yRWd5bERIOEFhT2k4N2ZVc1FFRmFManZDZ18tdFcyTEZUZXh1d2JLbWFLYjlMWHpZeThVT3FabTREZzVwbnY1UdIBgwJBVV95cUxQSjloYUx0T1hPU1lXb0lYakwxUVlma0hBVlZtT280cUdsb0szanI1NGRpX1VIU01GMnF5SldVb255aXNxNVZyOVp4RGhhbUtGOFBiMGdERzA1bVByYTh2UHRGUHZNdFZSU19UVU95SEE1bU9OaDFKRUNva0I2RUlpVDdpVkxnTHhBM3RvNUJJOVkyMTFVZjYtVlctU3ctMGVYQ3dlUVczN21XOGJaTlBvT1ZxVk9zQ3hhVGNFdjVRRV95MVIzVl9ic1gzTFhXUDFXbzhadmVVckoydk5CalpFMG5Kd1A5ZGRkMkREZzYwY29wckJ0enBUQTJkcENKUmxIOWdN?oc=5,Amar Ujala,2026-07-01T15:47:40+05:30,hi,Chandigarh,Chandigarh,"(""हीट एक्शन प्लान"" OR ""गर्मी से राहत"" OR चेतावनी OR ""रेड अलर्ट"" OR ""ऑरेंज अलर्ट"" OR ""येलो अलर्ट"" OR एडवाइजरी OR ""राहत सामग्री"" OR ""राहत शिविर"" OR मुआवजा) Chandigarh","{""_id"":""6a44e8a7bacd8e37010bc30f"",""slug"":""chandigarh-weather-update-heavy-rain-in-chandigarh-yellow-alert-till-july-6-major-drop-in-temperature-2026-07-01"",""type"":""video"",""status"":""publish"",""title_hn"":""Chandigarh Weather Update: चंडीगढ़ में झमाझम बारिश, 6 जुलाई तक येलो अलर्ट; तापमान में बड़ी गिरावट"",""category"":{""title"":""City & states"",""title_hn"":""शहर और राज्य"",""slug"":""city-and-states""}}
Chandigarh Weather Update: चंडीगढ़ में झमाझम बारिश, 6 जुलाई तक येलो अलर्ट; तापमान में बड़ी गिरावट
Video Desk Amar Ujala Dot Com Chandra Prakash Neeraj Updated Wed, 01 Jul 2026 03:47 PM IST
Link Copied
चंडीगढ़ में बुधवार को सुबह गरज-चमक के साथ बारिश हुई। इससे मौसम का मिजाज पूरी तरह बदल दिया है, जिससे लोगों को भीषण हीटवेव से राहत मिली है।मौसम विभाग के अनुसार, शहर का अधिकतम तापमान जो पिछले दिनों 40 डिग्री से ऊपर बना हुआ था, वह आज करीब 29 से 31 डिग्री सेल्सियस के बीच आ गया है। चंडीगढ़ में 6 जुलाई तक भारी बारिश और 40-50 किलोमीटर प्रति घंटे की रफ्तार से तेज हवाओं का येलो अलर्ट जारी किया गया है। मौसम केंद्र चंडीगढ़ के अनुसार मानसून की सक्रियता बढ़ने से अगले कुछ दिनों तक झमाझम बारिश का दौर जारी रहेगा। दो जुलाई को अधिकतम तापमान 33 डिग्री सेल्सियस रहेगा, जबकि न्यूनतम तापमान 25 डिग्री सेल्सियस रहने की संभावना है। 3 जुलाई को अधिकतम तापमान 35 डिग्री सेल्सियस और न्यूनतम तापमान 25 डिग्री सेल्सियस रहेगा। वहीं, 4 जुलाई को अधिकतम तापमान 36 डिग्री सेल्सियस और न्यूनतम तापमान 26 डिग्री सेल्सियस रहने का पूर्वानुमान है।
एड फ्री अनुभव के लिए अमर उजाला प्रीमियम सब्सक्राइब करें
अमर उजाला प्रीमियम वीडियो सिर्फ सब्सक्राइबर्स के लिए उपलब्ध है
प्रीमियम वीडियो
सभी विशेष आलेख
फ्री इ-पेपर
सब्सक्राइब करें
Next Article
Disclaimer
हम डाटा संग्रह टूल्स, जैसे की कुकीज के माध्यम से आपकी जानकारी एकत्र करते हैं ताकि आपको बेहतर और व्यक्तिगत अनुभव प्रदान कर सकें और लक्षित विज्ञापन पेश कर सकें। अगर आप साइन-अप करते हैं, तो हम आपका ईमेल पता, फोन नंबर और अन्य विवरण पूरी तरह सुरक्षित तरीके से स्टोर करते हैं। आप कुकीज नीति पृष्ठ से अपनी कुकीज हटा सकते है और रजिस्टर्ड यूजर अपने प्रोफाइल पेज से अपना व्यक्तिगत डाटा हटा या एक्सपोर्ट कर सकते हैं। हमारी Cookies Policy, Privacy Policy और Terms & Conditions के बारे में पढ़ें और अपनी सहमति देने के लिए Agree पर क्लिक करें।",1.0
"Chandigarh Bomb Threat: चंडीगढ़ के स्कूलों और हरियाणा के सीएम और रेलवे ट्रैक को बम से उड़ाने की धमकी, ईमेल से मचा हड़कंप - Khabar Fast",https://news.google.com/rss/articles/CBMizAFBVV95cUxPQjI2VXU4ZDZEbDVJWi1xN3dsZHBkQ2tWTG9jWjRFMW5OQmxib3lLQXpEaDVraFIxSjJBTlhrYlQyQlVYZi1GT1Z1Q3lweUwxMVdPcWExSWI0b1VNRnFsQUFyRjVTdWNwcmlDSnctVVUxMlowQXZyNkYzSE1VaWNra2VrTHJvV1o0eG5Ub0xwYmFfeFZBODFrZzF1ZVBKWEVfaVJVQ0JiS2M2UWRiNDVJb1BiOGx2Xzhzd0pNVmJLbTc2Tm5DWGUwei1NV0k?oc=5,Khabar Fast,2026-07-01T12:11:00+05:30,hi,Chandigarh,Chandigarh,"(""हीट एक्शन प्लान"" OR ""गर्मी से राहत"" OR चेतावनी OR ""रेड अलर्ट"" OR ""ऑरेंज अलर्ट"" OR ""येलो अलर्ट"" OR एडवाइजरी OR ""राहत सामग्री"" OR ""राहत शिविर"" OR मुआवजा) Chandigarh","Bomb Threat: चंडीगढ़ के कई स्कूलों और हरियाणा के रेलवे ट्रैक को एक बार फिर बम से उड़ाने की धमकी मिली है। इसके प्रशासन में हड़ंकप मच गया है। ईमेल के जरिए धमकी दी गई है। मेल में दावा किया गया है कि 1 जुलाई को बम धमाके होंगे। इसके साथ ही ईमेल भेजने वाले ने 15 अगस्त की स्वतंत्रता दिवस परेड में बच्चों को शामिल नहीं होने की चेतावनी भी दी है।
धमकी मिलने के बाद चंडीगढ़ और हरियाणा में सुरक्षा एजेंसियां अलर्ट मोड पर आ गई हैं। पुलिस, रेलवे सुरक्षा बल (RPF), जीआरपी और अन्य जांच एजेंसियों ने मामले की जांच शुरू कर दी है। ईमेल भेजने वाले की पहचान करने के लिए साइबर विशेषज्ञों की भी मदद ली जा रही है।

15 अगस्त को लेकर भी दी चेतावनी
धमकी भरे ईमेल में यह भी लिखा गया है कि 15 अगस्त की परेड में बच्चों को शामिल न किया जाए। इस चेतावनी को गंभीरता से लेते हुए सुरक्षा एजेंसियां स्वतंत्रता दिवस समारोहों की सुरक्षा व्यवस्था की भी समीक्षा कर रही हैं।
मेल में सीएम सैनी और गृह मंत्री अमित शाह के नाम का उल्लेख
जानकारी के अनुसार, धमकी भरे ईमेल में हरियाणा के मुख्यमंत्री नायब सिंह सैनी, केंद्रीय गृह मंत्री अमित शाह, विदेश मंत्री एस. जयशंकर, अंबाला-दिल्ली रेलवे ट्रैक समेत कई अन्य स्थानों का भी उल्लेख किया गया है। ईमेल में किए गए दावों को सुरक्षा एजेंसियां गंभीरता से ले रही हैं।",0.31666666666666665
"Chandigarh tricity gets first relief from heatwave as thunderstorm, rain arrive; heavy rain from Thursday to Monday - The Tribune",https://news.google.com/rss/articles/CBMi8AFBVV95cUxNamp3LTRacnRxUEM1X0UwZUlzM205RlE3MzJURTJ1QmxUQkk2YVJwNHhHWXJEUkVOYkFhRW5BSHZXdzh1dkhfY2hibDgzdmJjclRoWDBKUUZMYXhobmMyVkEwcHU3TFBVN2gzUFRWUF83bk0tNTA0eWVWNk9UdVdBc2NfN2xFaDEyMko2NXNYWU4wdmpNb3k3WTR3UE9Ma3hDWktyamVRVnhnbWdYUG13REp0MXYtbXdCejIycDUyQjFjNFJTSjJ3OUV0bnpkdXJMRzBLNWQtMHI2VEduNGFsWHFzcktuRy0ySWNqZThhZWrSAfQBQVVfeXFMTndrbVFJWlZOSzc3OUJEQjlpdmZGX3JLUU9PTGFxSkJVdGFsMldYUGdLR1FlMUVrUWl6WVBmeEZGWllsRW1yUVkxSUw4c2luWFRJTU96S3M3RHRvQ1gyU3ZCamhZVjdDQWk4aURRTU84QXcyNl9lNXJ0anJsZmlKenYtNEVrY2NoNlJUaFRDOG93ckxjMFZfYnh0OGl4MGNzdEVXVlF5VDBxTTkxVDNMM3UwT2dpa2gwZk5HajUyeVNOSDZYeHNjeHQzNVMtR3l6R2F3UUZBVVZETVhZNDJGdThxY21tWWJoZDZBVmtBQy01YjJuQQ?oc=5,The Tribune,2026-07-01T10:49:56+05:30,en,Chandigarh,Chandigarh,"""heatwave"" Chandigarh","Chandigarh tricity gets first relief from heatwave as thunderstorm, rain arrive; heavy rain from Thursday to Monday
After days of relentless, sapping heat, residents of Chandigarh, Mohali and Panchkula finally woke up on Wednesday to overcast skies and a light breeze, heralding a long-awaited but decisive break in the weather. By mid-morning, light to medium rain and thundery showers had begun lashing different parts of the tricity, the first meaningful relief from the acute hot and humid conditions that had gripped the region over the past several days, and the IMD has now warned of heavy rain continuing from Thursday right through Monday.
Tracking the rapidly changing conditions, the Meteorological Centre Chandigarh issued a Nowcast Yellow Alert for the tricity, warning of light rain and thunderstorm with gusty winds of 30-40 kmph and lightning over parts of Chandigarh, Mohali and Panchkula and adjoining areas during the next 2-3 hours. Residents were advised to stay in safer places during thunderstorm activity and to avoid taking shelter under trees.
Within minutes of the alert, thunderstorm and lightning with gusty winds and light to medium rain began sweeping through different parts of the tricity around 10:15 am. Doppler Weather Radar imagery from Patiala, captured at 08:52 IST, showed active convective cells approaching the region, with radar reflectivities in the higher intensity ranges clearly visible over and around the tricity, confirming the onset of the first significant weather activity of the approaching monsoon season.
“After one of the driest and hottest Junes in recent memory, the atmosphere has finally started responding to the advancing Southwest Monsoon. What we are seeing this morning is just the beginning, pre-monsoonal thunderstorm activity that will progressively give way to organised monsoon rainfall. Residents should not be misled by today’s relatively light activity. From Thursday onward, the intensity will increase significantly, with heavy rain and gusty winds likely at isolated places through Monday. People are advised to remain alert, avoid waterlogged roads and stay away from open areas during thunderstorm episodes,” said a meteorologist.
Monsoon knocking at the door
The arrival of Wednesday’s showers is no isolated event. The IMD’s special weather bulletin issued Monday evening had already flagged that conditions were turning favourable for the Southwest Monsoon to advance into parts of Haryana, Chandigarh and Punjab within the next 3-4 days, placing the monsoon's arrival over the tricity as early as Thursday or Friday.
The five-day daily forecast for Chandigarh projects light to moderate rain at most places from Thursday through Saturday, with each of those days carrying a warning for thunderstorm, lightning, gusty winds of 40-50 kmph and heavy rain at isolated places. Temperatures are expected to ease sharply: the maximum is forecast to drop from around 40°C on Wednesday to 36-38°C by Thursday-Saturday, while minimums are expected to settle in the mid-to-upper 20s as monsoon cloud cover takes hold.
The district-wise colour-coded warnings for Chandigarh and Haryana show yellow “be updated” advisories running through July 4, with thunderstorm-with-heavy-rain symbols covering most districts of Haryana on Days 3, 4 and 5 (July 2-4). The Punjab maps similarly show widespread yellow to orange coverage from July 2 onward, with northern districts, Pathankot, Gurdaspur, Hoshiarpur and Nawanshahar, most likely to see the heaviest rainfall in the initial days.
Tuesday night temperatures drop sharply
The overnight temperature data released by the IMD on Wednesday morning confirmed that the heat had already begun moderating before Wednesday’s showers arrived. The minimum temperature at Chandigarh city came in at 27.4°C, a sharp fall of 2.4°C from the previous night’s 29.8°C, and just 0.3°C above normal, a dramatic shift after several consecutive nights when the city’s low had hovered well above 30°C. Chandigarh airport recorded a minimum of 28.0°C, down 2.8°C from the night before, and 0.9°C above normal with a trace of rainfall.
Across Punjab, the fall in overnight temperatures was consistent: average minimum temperatures in the state dropped by 1.5°C compared to the previous night, though they remained 2.5°C above normal overall. The lowest minimum in Punjab was 23.5°C, recorded at Pathankot, lashed by 61 mm rain, a sign of the moistening and cooling approaching from the hills. Mohali recorded 28.3°C and Amritsar 29.0°C, the latter still 3.2°C above normal.
In Haryana, the average minimum temperature fell by 1.8°C overnight and was near normal across the state, with the lowest reading, 25.7°C, coming from Karnal. Chandigarh city’s 27.4°C put it just 0.3°C above normal, while pockets of Haryana such as Rohtak (27.6°C, 3.0 mm rain) and Yamunanagar (26.5°C, 10.5 mm rain) had already received some overnight rainfall, a sign that the monsoon’s moisture was beginning to percolate northward even before Wednesday’s showers hit the tricity.
June 2026: Third driest in 14 years, 75% rain deficit
The relief could not have come soon enough. Chandigarh’s June 2026 ended with just 39.3 mm of rainfall against a normal of 155.5 mm, a crippling 75% deficit, marking the month as “deficient” in IMD’s classification. It was the third driest June in 14 years, behind only June 2024 (11.9 mm, 92% deficit) and June 2019 (24.8 mm, 81% below normal). In sharp contrast, June 2025 had seen 213 mm of rain, a 37% surplus, making this year’s reversal even more stark. The city’s heaviest single-day rainfall this June was a modest 21.7 mm on June 12.
A June of exceptional heat
The dry June was also a hot one. The highest maximum temperature this June reached 42.1°C on June 10 at the city observatory (42.7°C at the airport on June 11), with an average maximum of 38.1°C for the month and an average minimum of 24.9°C. Tuesday, June 30, had seen a maximum of 39.6°C, still 3.3°C above normal, and nights had been relentlessly warm, with the city's low touching 29.8°C and the airport recording 30.8°C on Tuesday night before Wednesday morning’s dramatic fall. The days of 40-41°C highs and 30°C-plus lows over the past week left residents badly in need of the break that Wednesday finally began to deliver.
Safety advisory
The IMD has urged residents to exercise caution over the coming days: avoid keeping harvested crops in the open, stay away from waterlogged areas, do not stand under trees or near weak structures during thunderstorms, drive carefully in rain, and avoid water bodies during the heavy rain episodes expected from Thursday through Monday.",1.0
"Heavy rainfall likely in Punjab, Haryana and Chandigarh from tomorrow - News On AIR",https://news.google.com/rss/articles/CBMimgFBVV95cUxPVTM0ek5RbzJmZndjclQ4MnZFVUdoVGtoTXJyT28zbVpETVVtWHJHd21MM1B0R2x3bHI4T2g4X0VKSjNOcmQ0ekRINVpYbHphbUlWU0lVSWRORmo4OElMT3ZqdEdhOUlJWFBmdUc2X2tGYmFCVk5rWm9QX0R1eUZLNml6YWpNSE5MWDdMd3Vxb3o2V3VubnJ0Mk1B?oc=5,News On AIR,2026-07-01T14:59:18+05:30,en,Chandigarh,Chandigarh,"""heatwave"" Chandigarh","Parts of Punjab, Haryana and Chandigarh are likely to experience heavy rainfall with lightning and gusty winds from tomorrow bringing relief from prevailing above normal temperatures and isolated heatwave conditions.
The Chandigarh-based Met Department has issued yellow alert of the heavy rainfall at isolated places in both the states and the union territory. The predicted rain would not only help farmers who are ready with Paddy fields but is also likely to ease the electricity crisis in Punjab where the power demand has hit this year’s highest at over 16, 000 MegaWatts.
In the last 24-hours, Punjab’s Bathinda had the maximum temperature of 44.4 degree Celsius whereas Rohtak in Haryana experienced 43.5 degree Celsius. Chadnigarh recorded a maximum of 39.6 degree Celsius.",0.8
Cross-complaints filed after brawl at Chandigarh Club - The Tribune,https://news.google.com/rss/articles/CBMipAFBVV95cUxNeV8zNk9Mc1gtWWUxMENicUZxMWd5NW1VTXNDUEh2T3AtdlhrWllxalIzSllVRWlzZGRESi1Hb3JlRWJhZ3pYbGxRZUt6NXcwa2c4Mlh5OGJHTTBKTVF4WDNzWHZPUGd2aEY5VHdud3lDak5YbEczNl9FYVBXVmhFOFJoOUdSb1FudkVDdVlSSEM0MVFqUmRNQlExX1drQkhzQUptRtIBpAFBVV95cUxNeV8zNk9Mc1gtWWUxMENicUZxMWd5NW1VTXNDUEh2T3AtdlhrWllxalIzSllVRWlzZGRESi1Hb3JlRWJhZ3pYbGxRZUt6NXcwa2c4Mlh5OGJHTTBKTVF4WDNzWHZPUGd2aEY5VHdud3lDak5YbEczNl9FYVBXVmhFOFJoOUdSb1FudkVDdVlSSEM0MVFqUmRNQlExX1drQkhzQUptRg?oc=5,The Tribune,2026-07-01T01:39:23+05:30,en,Chandigarh,Chandigarh,"""heatwave"" Chandigarh","Unlock Exclusive Insights with The Tribune Premium
Take your experience further with Premium access. Thought-provoking Opinions, Expert Analysis, In-depth Insights and other Member Only BenefitsA no-holds-barred brawl between Karan Nanda, son of NK Nanda, former District Bar Association president, and Sajanpreet Singh, son of former Chandigarh Mayor Ravinder Pal Singh Pali, in the bar at the Chandigarh Club yesterday evening has created ripples in the city.
Eyewitnesses said beer bottles were hurled and punches exchanged after a prolonged verbal altercation in full public view. Both sides have filed counter-complaints to the police, but cops are hesitating to register an FIR due to pressure from both sides, sources said.
Karan, an advocate at the Punjab and Haryana High Court, said, “He was sitting on the adjacent table and was staring at me for some time after which an argument ensued. I do not know him, nor do I have any enmity with him. A complaint was lodged, but after the intervention of senior members of the club the matter has been resolved.”
Meanwhile, the police remained tightlipped about the incident.
A few members have also written to the Chandigarh Club president to cancel the membership of both members over their ‘shameful behaviour’.
Eyewitnesses said the immediate trigger for the brawl was not known, but a feud had been simmering between the two for the past two-three years after Karan had contested for the post of the club vice-president in November 2024 and Pali had reportedly supported Karan Nanda’s rival faction.",0.0
