title,url,source,date,language,state,district,search_term,full_text,relevance_score
Chhattisgarh Heat Wave: तप रहा है छत्तीसगढ़! Raipur समेत इन ज़िलों में अलर्ट | - IBC24 News,https://news.google.com/rss/articles/CBMicEFVX3lxTFBJNnJZX09rS2l3NmNmc3o5Yy0yQTdLZDFnVW92MkkxSFlKaDB2RS1MTUduUzhVYnQyeGhXUGpuTTVqTXpfTHp6WVZTYjJsY1BOQ0xtdzB3OWhnZDlTQUNMYzQzNDNxLWlQeHFPVTZDR0nSAXZBVV95cUxOc3lmUHdlaEdaek5nb3NtVTZrbXdyU0wtZ01pWEM2MzFOTi1EWkFVbnBKVU1HUURQV0RGQmthQXVaT0FqY2Z3aDVNcXl0cWdsaEd2RzRpc3kxMFl5RGEwbnNqM2hJdk5saWR5ZzgweE0tUkZibllB?oc=5,IBC24 News,2026-04-19T17:06:00+05:30,en,Chhattisgarh,Raipur,"""heatwave"" Chhattisgarh","Priyanshu Singh is a distinguished professional with over 5 years of experience in journalism and digital marketing. Presently serving as the Digital Marketing Manager and News Journalist at IBC24 News, he skillfully manages the digital operations of IBC24 News and Khabar Bebak. Priyanshu is renowned for his coverage of major sports events, including the World Cup 2022 and 2023, where his insightful reporting has captivated audiences. Notably, he has also conducted interviews with key political figures, including the Chief Minister and Deputy Chief Minister of Chhattisgarh. With a passion for news, a commitment to excellence, and a diverse portfolio of experiences, Priyanshu Singh continues to be a prominent name in the ever-evolving media landscape.",0.6833333333333333
"छत्तीसगढ़: छात्रों को भीषण गर्मी से राहत, अब 20 अप्रैल से ग्रीष्मकालीन अवकाश, 55 दिन तक बंद रहेंगे स्कूल - Palpal India",https://news.google.com/rss/articles/CBMizgFBVV95cUxPSmNaUXViZVJFaUJjMUFHSXk5RDRLTG9FSXEyYzR1R3NuR1h2Rlp3aUxiOWhjdjN4Ym9HbGctTEQ5ZjN5WlZxWnIwV3RPVklkWG1QRVM1bHVwaTA5NGhzeExmd1BZdWpzdUNlTkxvQzJMWFhGdTJNMjhIanljS3BRU01HNUpLMXpxRWVYbnFoRmlIRktyQVQ5Nld1YTF2UGJuYmtIWmxHelhEQkd1T2hpVFFOVFgxaTBoRTlhLU5CTkp5eHlJT09Qc0t1c2t5dw?oc=5,Palpal India,2026-04-19T17:07:38+05:30,hi,Chhattisgarh,Raipur,"(""हीट एक्शन प्लान"" OR ""गर्मी से राहत"" OR चेतावनी OR ""रेड अलर्ट"" OR ""ऑरेंज अलर्ट"" OR ""येलो अलर्ट"" OR एडवाइजरी OR ""राहत सामग्री"" OR ""राहत शिविर"" OR मुआवजा) Chhattisgarh","रायपुर. छत्तीसगढ़ में तेज गर्मी और बढ़ते तापमान को देखते हुए विष्णुदेव साय सरकार ने स्कूली छात्रों के लिए ग्रीष्मकालीन अवकाश की नई तारीखों का ऐलान कर दिया है. अब राज्य के स्कूलों में 20 अप्रैल से 15 जून तक यानी 55 दिन की गर्मी की छुट्टी रहेगी. पिछले साल छुट्टियां 25 अप्रैल 2025 से शुरू हुई थीं.
स्कूल शिक्षा विभाग, छत्तीसगढ़ शासन द्वारा जारी आदेश के अनुसार, सभी स्कूलों में अब 20 अप्रैल 2026 से 15 जून 2026 तक ग्रीष्मकालीन अवकाश रहेगा. पहले यह छुट्टियां 1 मई से शुरू होने वाली थीं, लेकिन बढ़ते तापमान को देखते हुए इन्हें लगभग 10 दिन पहले ही शुरू करने का निर्णय लिया गया है.
यह आदेश प्रदेश के समस्त शासकीय, अनुदान प्राप्त, गैर अनुदान प्राप्त एवं अशासकीय शालाओं पर लागू होगा. यह अवकाश केवल छात्रों के लिए है. शिक्षकों को निर्धारित शैक्षणिक कैलेंडर और प्रशासनिक कार्यों के अनुसार स्कूल में अपनी उपस्थिति देनी होगी. पूर्व में जारी आदेश की अन्य सभी शर्तें यथावत रहेंगी. बता दें कि अप्रैैल महीने में ही छत्तीसगढ़ के कई जिलों 42डिसे से ऊपर जा चुका है. आने वाले दिनों में तापमान में और भी बढ़ोतरी की संभावना जताई गई है.
एमपी में 1 मई से गर्मी की छुट्टियां
छत्तीसगढ़ में भले ही गर्मी की छुट्टियों में संशोधन किया गया है लेकिन इस बार प्रदेश के सभी सरकारी और निजी स्कूलों में 1 मई 2026 से 15 जून 2026 तक ग्रीष्मकालीन अवकाश रहेगा यानी करीब डेढ़ महीने तक स्कूल बंद रहेंगे. हालांकि, शिक्षकों के लिए यह अवकाश केवल 31 मई तक ही रहेगा, उन्हें जून के पहले सप्ताह से स्कूल में उपस्थित होना होगा.
Source : palpalindia ये भी पढ़ें :-",1.0
"छत्तीसगढ़ में बढ़ा तापमान, लू के आसार, लोगों को नहीं मिल रही राहत - Webvarta News Agency",https://news.google.com/rss/articles/CBMipgFBVV95cUxPVGszLXd2RFNiUlRJemJnLVNpa2szNERsaXd0ZWJjY2lZdzZNMEtKWk11Qmg0RHVLS2lGaEwyeFlteXpZQk5udTZtZW9uRVN1VmxBYkRYWkN4alFFVUhsVzVLVk9LWEw5QnR1aUpNNjJrMzE2bzJpWko1UTFRcW9DNHVVRTktcTBVRUhHcDRxRWhBbTI2MHlGNHRXZThSempDZF9tRmxn?oc=5,Webvarta News Agency,2026-04-19T15:09:31+05:30,hi,Chhattisgarh,Raipur,"""लू"" Chhattisgarh","रायपुर, 19 अप्रैल (वेब वार्ता)। छत्तीसगढ़ के मध्य हिस्सों में गर्मी ने विकराल रूप धारण कर लिया है। दिन के साथ-साथ रातें भी अत्यधिक गर्म बनी हुई हैं, जिससे लोगों को किसी भी समय राहत नहीं मिल पा रही है। शहरी क्षेत्रों में न्यूनतम तापमान सामान्य से लगभग 5 डिग्री अधिक दर्ज किया जा रहा है।
मौसम विभाग के अनुसार, प्रदेश के मध्य भागों में तापमान लगातार बढ़ रहा है और फिलहाल इसमें कमी के कोई स्पष्ट संकेत नहीं हैं। रविवार को प्रदेश में शुष्क मौसम रहने की संभावना जताई गई है, वहीं कुछ स्थानों पर लू चलने के भी आसार हैं।
हालांकि मौसम विभाग ने अगले दो दिनों के बाद कुछ क्षेत्रों में हल्की राहत की उम्मीद जताई है। अनुमान है कि कुछ इलाकों में हल्की बारिश, गरज-चमक और तेज हवाएं चल सकती हैं, जिससे तापमान में आंशिक गिरावट संभव है।
मौसम वैज्ञानिकों के अनुसार, विभिन्न द्रोणिकाओं और चक्रवाती परिसंचरण के सक्रिय होने के कारण प्रदेश में गर्म और शुष्क हवाएं चल रही हैं। इसके चलते तापमान में ज्यादा बदलाव की संभावना नहीं है और लू जैसी स्थिति बनी रह सकती है। हालांकि बस्तर क्षेत्र में तापमान में हल्की गिरावट देखने को मिल सकती है।
राजधानी रायपुर में रविवार को अधिकतम तापमान करीब 44 डिग्री और न्यूनतम 29 डिग्री सेल्सियस रहने का अनुमान है। दिन और रात दोनों समय गर्मी का प्रभाव स्पष्ट रूप से महसूस किया जाएगा।
शनिवार को राजनांदगांव प्रदेश का सबसे गर्म स्थान रहा, जहां अधिकतम तापमान 45 डिग्री सेल्सियस दर्ज किया गया। वहीं रायपुर और दुर्ग में भी तापमान 43 डिग्री तक पहुंच गया, जिससे जनजीवन प्रभावित हो रहा है। अंबिकापुर में न्यूनतम तापमान 20.4 डिग्री सेल्सियस दर्ज किया गया।
लगातार बढ़ती गर्मी और लू के खतरे को देखते हुए प्रशासन और स्वास्थ्य विभाग ने लोगों को दोपहर के समय बाहर निकलने से बचने, पर्याप्त पानी पीने और सावधानी बरतने की सलाह दी है।",1.0
