title,url,source,date,language,state,district,search_term,full_text,relevance_score
UP Weather: मार्च में ही चलने लगी लू? गेहूं की फसल को लेकर बांदा के किसान परेशान - Jagran,https://news.google.com/rss/articles/CBMirAFBVV95cUxOaGtoX2liYjlqc3p0SUh5Rmk4eVVZcHpLak5aR3pCNTE2TG13ZF9MZEU0THlfMlhIbElOZ29iWmtFc1RFVUdyQ0tTVUlMSEdEQUI1bEs4V1gwODJ6U0xXcUtWaEk2NHREQVgzd19vNlR1UHhINXJmUEIyWXdMdTZKeWNVSDl2cUNtQng0b1lLQ0JjTE1Tck9aUFY4bWFEdlhGcXNVaWRwZkE4MmR0?oc=5,Jagran,2026-03-19T17:54:00+05:30,hi,Uttar Pradesh,Agra,"लू (Agra OR Aligarh OR Allahabad OR ""Ambedkar Nagar"" OR ""Amethi (Chatrapati Sahuji Mahraj Nagar)"" OR ""Amroha (J.P. Nagar)"" OR Auraiya OR Azamgarh OR Baghpat OR Bahraich OR Ballia OR Balrampur OR Banda OR Barabanki OR Bareilly OR Basti OR Bhadohi OR Bijnor OR Budaun OR Bulandshahr OR Chandauli OR Chitrakoot OR Deoria OR Etah OR Etawah OR Faizabad OR Farrukhabad OR Fatehpur OR Firozabad OR ""Gautam Buddha Nagar"" OR Ghaziabad OR Ghazipur OR Gonda OR Gorakhpur OR Hamirpur OR ""Hapur (Panchsheel Nagar)"" OR Hardoi OR Hathras OR Jalaun OR Jaunpur OR Jhansi OR Kannauj OR ""Kanpur Dehat"" OR ""Kanpur Nagar"" OR ""Kanshiram Nagar (Kasganj)"" OR Kaushambi OR ""Kushinagar (Padrauna)"" OR ""Lakhimpur - Kheri"" OR Lalitpur OR Lucknow OR Maharajganj OR Mahoba OR Mainpuri OR Mathura OR Mau OR Meerut OR Mirzapur OR Moradabad OR Muzaffarnagar OR Pilibhit OR Pratapgarh OR RaeBareli OR Rampur OR Saharanpur OR ""Sambhal (Bhim Nagar)"" OR ""Sant Kabir Nagar"" OR Shahjahanpur OR ""Shamali (Prabuddh Nagar)"" OR Shravasti OR ""Siddharth Nagar"" OR Sitapur OR Sonbhadra OR Sultanpur OR Unnao OR Varanasi)","UP Weather: मार्च में ही चलने लगी लू? गेहूं की फसल को लेकर बांदा के किसान परेशान
बांदा में मार्च से ही भीषण गर्मी पड़ रही है, जिससे अधिकतम तापमान 36 डिग्री सेल्सियस तक पहुंच गया है। ...और पढ़ें
जागरण संवाददाता, बांदा। सूरज के तल्ख तेवर से आसमान से आग बरस रही है। तेज धूप के कारण मार्च में ही लू के थपेड़ों से जूझना पड़ रहा है। बीते एक पखवाड़े से कई बार सूबे में बांदा का तापमान सबसे अधिक रहा है। हालांकि आसमान में हल्के बादलों के चलते मौसम कुछ राहत है।
गुरुवार सुबह से धूप निकली, हल्के बादलों के बीचे तेज धूप से लोग परेशान रहे। बीते दिनों से गर्मी दिन प्रतिदिन लगातार बढ़ती जा रही है। तापमान अधिकतम 36 डिग्री व न्यूनतम 21 डिग्री सेल्सियस रहा। वहीं तेज धूप के कारण गेहूं जल्दी पकने लगा है, जिसको लेकर किसान चिन्तित है। कृषि विज्ञानी भी तेज धूप से पैदावार कम होने का अंदेश जता रहे हैं।
जिले में इस वर्ष कुछ ज्यादा ही गर्मी पड़ने के आसार नजर आ रहे हैं। बीते दिनों से मार्च माह में ही भीषण गर्मी पड़ने लगी है। बुधवार को अधिकतम तापमान 38 डिग्री सेल्सियस रहा। लू के थपेड़ों से आमजन बेहाल रहा, लेकिन हल्के बादलों के चलते गुरुवार गर्मी से थोड़ा राहत रही।
हालांकि दोपहर होते होते जिले भर की ज्यादातर सड़कों में सन्नाटा पसर गया। आवश्यक कार्य से ही लोग आवागमन करते दिखे। वहीं गन्ने व जूस आदि के स्टालों में लोगों की भीड़ नजर आई। मौसम विभाग के अनुसार गुरुवार का अधिकतम तापमान 36 डिग्री सेल्सियस रिकार्ड किया गया, जो कि बुधवार से 2 डिग्री सेल्सियस कम रहा।
गर्म पछुआ हवाओं के थपेड़ों से राहगीर परेशान रहे। चिलचिलाती धूप के कारण राहगीर छाया की तलाश में रहे। धूप से बचने को छायादार स्थान व पेड़ों का सहारा लेना पड़ा। घर से बाहर निकले लोगों को चेहरा ढककर निकलना। स्कूली बच्चों को दोहपर के समय घर जाने में परेशानी हुई।
गर्मी से राहत पाने के लिए ठंडा पेय पदार्थ का सहारा लेना पड़ा। कचहरी, न्यायालय गेट समेत विभिन्न चौराहों में गन्ने व जूस आदि के स्टालों में भीड़ रही। मौसम विभाग ने गर्मी बढ़ने की संभावना जताई है। उधर तेज धूप के कारण गेहूं की फसल जल्दी पकने लगी है।
हालांकि गेहूं के पकने का सही समय आ गया है, लेकिन जिन खेतों में धान कटने के बाद गेहूं की फसल की बुआई की गई थी, उन खेतों में गेहूं अभी पूरी तरह से तैयार नहीं हुआ है। बालियों में गेहूं के बीज पूरी तरह से विकसित नहीं हो पाए हैं। ऐसे में तेज धूप में गेहूं अविकसित अवस्था में ही सूखने लगा है। जिससे उत्पादन घटने को लेकर किसान परेशान हैं।
वर्षा के कारण धान की फसल बर्बाद हो गई थी, खेतों काे किसी तरह खाली कर गेहूं की बुआई की थी। उम्मीद थी कि गेहूं की ही पैदावार ठीक हो जाएगी। लेकिन तेज धूप के कारण अभी गेहूं की बालियां पूरी तरह से भरी नहीं है और फसल अभी से ही पकने लगी है। इसमें गेहूं कमजोर हो जाएगा। -शिवबहादुर, तिंदवारी
तेज धूप के कारण असमय ही फसलें पकने लगी हैं। यदि यह तापमान 15 दिन बाद बढ़ता तो फसलें पूरी तरह से विकसित हो जाती। फसलों की पैदावार कमजोर हाे जाएगी। ऐसे में किसानों की उम्मीदों पर पानी फिर रहा है। वहीं बादल होने से वर्षा की आशंका से भी किसान परेशान है। -रामखेलावन, अतर्रा
मार्च से ही गर्मी शुरू हाे गई है, तेज धूप व आसमान में बादल छाए रहेंगे, वर्षा होने की संभावना है। आगे आने वाले समय में तापमान में वृद्धि के साथ-साथ हवाएं भी चल सकती है। -दिनेश साहा, मौसम विज्ञानी, बांदा कृषि एवं प्रौद्योगिकी विश्वविद्यालय, बांदा
वैसे तो रबी फसलों के पकने का सही समय है, लेकिन जो फसलें देरी से बोई गई हैं, उन्हें पकने में अभी समय चाहिए था, लेकिन तेज धूप के कारण यह जल्दी पक जाएंगीं और पैदावार प्रभावित होगी। -डा. श्याम सिंह, कृषि वैज्ञानिक, बांदा कृषि एवं प्रौद्योगिकी विश्वविद्यालय, बांदा",0.0
