title,url,source,date,language,state,district,search_term,full_text,relevance_score
भीषण गर्मी में स्कूल खुलने से छात्र हो रहे परेशान : वोरा - Dainik Bhaskar,https://news.google.com/rss/articles/CBMi6AFBVV95cUxQeEJMWG1kWXVJaXpnY1lTei1KcjMzRlZMcE8temgtR2k0SjVrVDNxTnh4OS11SmFFbl9EUGV2T1d0VVA2UmZJaFB2STRMaXo0c0ZSQmE0cU0tM1FLVV8wX3FrN3RReGE2Z1BacjByN2RRajNHa2UtdDRHb0hBNnVuSGpXak53SmxDbk1JLWtkeGJzbTNJbHNVMkwxWmYyVS1lSVJ2TC0wbFd5MnpIbGgxWTRFSkQ4MHBmdXZLMngyLVV6VmxGSW1kSVA0a2x2cUd3NlJpdy1HcllwMmVIMkVaVGZwX1R2Xzkx0gHuAUFVX3lxTFBwQ29tWHFjR19XaFMxeUYxcHJWRzZKWUxiamNrS05MakZiV3M1dGM4ZHNpZWtXSHE2VktyMHFMUC1ENnVvNFpHZ2hLUTJ5VDltbEVuSUptaUJGd05PYnlYYmxNOVdKb2VHa09BQWlCb0ZZVWhpRDdwajU3TXBvQ2xtU1EycE1DeUQyNDJsNExwc3JKYi1TZ3BFYXdwb0lzY0ZLRVE0Q2FYZmVIMXVfOUtMNncxbk9CNUtpaExZempWcFBRVlM1R25UWTN0d1lMRi0wdEsyeHZHRW5WLUs2Sm95UGZKa09LZG1KZm55a1E?oc=5,Dainik Bhaskar,2026-06-18T21:46:32+05:30,hi,Chhattisgarh,Durg,"""लू"" Chhattisgarh","- Opening Of Schools In Scorching Heat Is Causing Problems For Students: Vora
भीषण गर्मी में स्कूल खुलने से छात्र हो रहे परेशान : वोरा
- कॉपी लिंक
सिटी रिपोर्टर |दुर्ग
पूर्व विधायक अरुण वोरा ने कहा कि जिले में भीषण गर्मी के बीच स्कूल खुलने के पहले ही दिन प्रार्थना सभा के दौरान एक छात्र के बेहोश होने की घटना अत्यंत दुर्भाग्यपूर्ण और चिंताजनक है। यह घटना शासन एवं शिक्षा विभाग की तैयारियों पर गंभीर प्रश्नचिन्ह खड़े करती है।
जब पूरा प्रदेश भीषण गर्मी और लू की चपेट में है, तब छोटे बच्चों को लंबे समय तक खुले मैदान में खड़ा करना उनके स्वास्थ्य के साथ सीधा खिलवाड़ है। वरिष्ठ कांग्रेस नेता अरुण वोरा ने कहा कि विद्यार्थियों की सुरक्षा और स्वास्थ्य सर्वोच्च प्राथमिकता होनी चाहिए। मौसम विभाग द्वारा लगातार अत्यधिक तापमान और लू की चेतावनी जारी की जा रही है, इसके बावजूद स्कूलों के संचालन को लेकर आवश्यक सावधानियां नहीं बरती जा रही हैं। इसका खामियाजा मासूम बच्चों को भुगतना पड़ रहा है। वोरा ने छग में लगातार बढ़ रही बिजली दरों को लेकर राज्य सरकार पर कड़ा प्रहार किया है। उन्होंने कहा कि एक तरफ जनता पहले से ही कमरतोड़ महंगाई से परेशान है। वहीं दूसरी तरफ बिजली के बढ़ते बिलों ने आम उपभोक्ताओं, मध्यम वर्ग, छोटे व्यापारियों और किसानों पर दोहरी मार दी है।",1.0
