title,url,source,date,language,state,district,search_term,full_text,relevance_score
"வெப்ப அலை ஆபத்தில் சென்னை, மதுரை: ஆக்ஸ்போர்டு பல்கலை ஆய்வில் அதிர்ச்சி - Dinamalar",https://news.google.com/rss/articles/CBMi2wFBVV95cUxPcWdrOHRKcWJpS20wd2lHZEdJVHlsdUJQeEtaRlY4aWNON0w5S2JGVFRoeFFWWlhKQjVDWV9XNjlOakdkWVpFRGRvaEloUlg3TjlCc1FTU0NweXBSM09fRWsyd095TDlfdHJYdzhfaTc5aXhxMnFiRXZzWHdIUWd1ckZiOWhXSUhHZno1UTZuZkp6N1E5YUVXSjVfLUVfa1ExRVdOZ1pKNkpRTGstSHNER25nRGdLMkh4ekdGX0d1WFpqc3BvUEZzNF9XSGU1Ukp3bE9GTFY5cHZxRjA?oc=5,Dinamalar,2026-07-11T03:19:00+05:30,ta,Tamil Nadu,,"(""வெப்ப அலை"" OR ""அக்னி நட்சத்திரம்"" OR ""கடும் வெயில்"" OR ""கொளுத்தும் வெயில்"" OR ""எரிக்கும் வெயில்"" OR ""கடுமையான வெப்பம்"" OR ""வெயில் கொடுமை"" OR ""ஹீட் வேவ்"" OR ""கொடும் வெயில்"" OR ""வெப்பத்தின் தாக்கம்"" OR ""அசாதாரண வெப்பம்"") Tamil Nadu","வெப்ப அலை ஆபத்தில் சென்னை, மதுரை: ஆக்ஸ்போர்டு பல்கலை ஆய்வில் அதிர்ச்சி
வெப்ப அலை ஆபத்தில் சென்னை, மதுரை: ஆக்ஸ்போர்டு பல்கலை ஆய்வில் அதிர்ச்சி
ADDED : ஜூலை 11, 2026 03:19 AM
புதுடில்லி: உலகளவில் கடும் வெப்ப அலை அபாயம் அதிகம் உள்ள நகரங்கள் குறித்த ஆக்ஸ்போர்டு பல்கலை ஆய்வில், தமிழகத்தின் சென்னை, மதுரை உள்ளிட்ட 14 நகரங்கள் முதல் 50 இடங்களில் இடம்பெற்றுள்ளன.
பருவநிலை மாற்றத்தால் உலகம் வெப்பமடைந்து வரும் நிலையில், 10 லட்சத்துக்கும் அதிகமான மக்கள் தொகை கொண்ட 205 நகரங்களில் வெப்ப அலை அபாயம் குறித்து ஐரோப்பிய நாடான பிரிட்டனைச் சேர்ந்த ஆக்ஸ்போர்டு பல்கலை ஆய்வாளர்கள் ஆய்வு நடத்தினர். இந்த ஆய்வு, 'சஸ்டெயினபிள் சிட்டீஸ் அண்டு சொசைட்டி' என்ற அறிவியல் இதழில் வெளியாகியுள்ளது.
அதன் விபரம்:
மக்களின் வயது குறிப்பாக முதியோர், குழந்தைகள் அதிகம் இருப்பது, பொருளாதார நிலை, உடல்நல பாதிப்பு ஏற்படும் வாய்ப்பு, குளிரூட்டும் வசதிகள், மரங்களின் அடர்த்தி உள்ளிட்ட அம்சங்களும் ஒரு நகரின் வெப்ப அபாயத் தின் அளவை தீர்மானிக்கின்றன.
உலகளவில் வெப்ப அலையால் அதிக ஆபத்தில் உள்ள நகரமாக மேற்காசிய நாடான ஈராக்கின் அல் பஸ்ரா முதலிடத்திலும், குஜராத்தின் ஆமதாபாத் இரண்டாவது இடத்திலும் உள்ளன. மூன்றாவது இடத்தில் மேற்கு ஆப்ரிக்க நாடான மாலியின் பமாகோ உள்ளது. இந்த பட்டியலில், சென்னை, மதுரை உள்ளிட்ட 14 இந்திய நகரங்கள் முதல் 50 இடங்களை பிடித்துள்ளன. இவ்வாறு கூறப்பட்டுள்ளது.",0.5166666666666666
"ஹை அலர்ட்! சென்னை, மதுரைக்கு வெப்பஅலை ஆபத்து!? ஆக்ஸ்போர்டு பல்கலை ஆய்வில் பகீர்! - TamilWire",https://news.google.com/rss/articles/CBMioAFBVV95cUxPMnNiU09hUlZ1bmRXSFVZUU5TY1hHb3F5ajA0UDNpcjVxeWd1ZnNPTWotaWFzZUZSNjR5dExyd3kwMHZSWGpscURRTzYyem05SDZRalNESl9JS0RKSHV1NkVsYm9nTVc3Mng2STNiTl80ZjJBOG80V2loSnpsR2pWV29NMWJtb05OMnZVY3NQaG9jRllOM0VUNUdqU2kzeTRI0gGgAUFVX3lxTE8yc2JTT2FSVnVuZFdIVVlRTlNjWEdvcXlqMDRQM2lyNXF5Z3Vmc09Nai1pYXNlRlI2NHl0THJ3eTAwdlJYamxxRFFPNjJ6bTlINlFqU0RKX0lLREpIdXU2RWxib2dNVzcyeDZJM2JOXzRmMkE4bzRXaWhKemxHalZXb00xYm1vTk4ydlVjc1Bob2NGWU4zRVQ1R2pTaTN5NEg?oc=5,TamilWire,2026-07-11T10:54:37+05:30,ta,Tamil Nadu,,"வெப்ப அலை (Ariyalur OR Chennai OR Coimbatore OR Cuddalore OR Dharmapuri OR Dindigul OR Erode OR Kanchipuram OR Kanyakumari OR Karur OR Krishnagiri OR Madurai OR Nagapattinam OR Namakkal OR Nilgiris OR Perambalur OR Pudukkottai OR Ramanathapuram OR Salem OR Sivaganga OR Thanjavur OR Theni OR ""Thoothukudi (Tuticorin)"" OR Tiruchirappalli OR Tirunelveli OR Tiruppur OR Tiruvallur OR Tiruvannamalai OR Tiruvarur OR Vellore OR Viluppuram OR Virudhunagar) Tamil Nadu","ஹை அலர்ட்! சென்னை, மதுரைக்கு வெப்பஅலை ஆபத்து!? ஆக்ஸ்போர்டு பல்கலை ஆய்வில் பகீர்!
உலகளவில் கடும் வெப்ப அலை அபாயம் அதிகம் உள்ள நகரங்கள் குறித்த ஆக்ஸ்போர்டு பல்கலை ஆய்வில், தமிழகத்தின் சென்னை, மதுரை உள்ளிட்ட 14 நகரங்கள் முதல் 50 இடங்களில் இடம்பெற்றுள்ளன.
உலகம் முழுவதும் பருவநிலை மாற்றத்தின் தாக்கம் தீவிரமடைந்து வரும் நிலையில், கடும் வெப்ப அலை அபாயம் அதிகம் உள்ள நகரங்கள் குறித்த ஆக்ஸ்போர்டு பல்கலைக்கழக ஆய்வு புதிய எச்சரிக்கையை வெளியிட்டுள்ளது. அந்த ஆய்வில், தமிழகத்தின் சென்னை, மதுரை உள்ளிட்ட 14 இந்திய நகரங்கள் உலகின் அதிக வெப்ப அபாயம் உள்ள முதல் 50 நகரங்களின் பட்டியலில் இடம்பெற்றிருப்பது கவலை ஏற்படுத்தியுள்ளது.
பிரிட்டனைச் சேர்ந்த ஆக்ஸ்போர்டு பல்கலைக்கழக ஆராய்ச்சியாளர்கள், உலகம் முழுவதும் 10 லட்சத்துக்கும் அதிகமான மக்கள் தொகை கொண்ட 205 நகரங்களை ஆய்வுக்கு உட்படுத்தினர்.
வெப்ப அலை காரணமாக மக்களுக்கு ஏற்படும் பாதிப்புகள், நகரங்களின் சுற்றுச்சூழல், மக்கள் அடர்த்தி மற்றும் அடிப்படை வசதிகள் உள்ளிட்ட பல்வேறு அம்சங்களை மதிப்பீடு செய்து இந்த ஆய்வு மேற்கொள்ளப்பட்டது. இதன் முடிவுகள், 'சஸ்டெயினபிள் சிட்டீஸ் அண்டு சொசைட்டி' என்ற சர்வதேச அறிவியல் இதழில் வெளியாகியுள்ளன.
இதையும் படிங்க: கடும் நிதி நெருக்கடியில் திணறும் சென்னை மாநகராட்சி! சம்பளம் போடவே திண்டாட்டம்!!
ஆய்வில், ஒரு நகரின் வெப்ப அபாயத்தை வெறும் அதிக வெப்பநிலை மட்டுமே தீர்மானிக்காது என்றும், அங்கு வாழும் முதியோர் மற்றும் குழந்தைகளின் எண்ணிக்கை, பொருளாதார சூழல், உடல்நல பாதிப்புகளுக்கு உள்ளாகும் அபாயம், குளிரூட்டும் வசதிகளின் கிடைக்கும் நிலை, நகரில் உள்ள மரங்களின் அடர்த்தி மற்றும் பசுமைப் பரப்பு போன்ற காரணிகளும் முக்கிய பங்கு வகிப்பதாக ஆராய்ச்சியாளர்கள் தெரிவித்துள்ளனர்.
உலக அளவில் வெப்ப அலையால் மிக அதிக ஆபத்து உள்ள நகரமாக ஈராக் நாட்டின் அல் பஸ்ரா முதலிடத்தைப் பிடித்துள்ளது. இந்தியாவின் குஜராத் மாநிலம் ஆமதாபாத் இரண்டாவது இடத்திலும், மேற்கு ஆப்பிரிக்க நாடான மாலியின் பமாகோ மூன்றாவது இடத்திலும் இடம்பெற்றுள்ளன.
மேலும், இந்தியாவிலிருந்து சென்னை, மதுரை உள்ளிட்ட மொத்தம் 14 நகரங்கள் முதல் 50 இடங்களுக்குள் இடம்பெற்றிருப்பது, நாட்டின் நகர்ப்புறங்களில் வெப்ப அலை அபாயம் அதிகரித்து வருவதை வெளிப்படுத்துகிறது.
நிபுணர்களின் கருத்துப்படி, நகரங்களில் மரங்களை அதிகரித்தல், நீர்நிலைகளை பாதுகாத்தல், பசுமைப் பகுதிகளை விரிவுபடுத்தல், வெப்ப அலை முன்னெச்சரிக்கை திட்டங்களை வலுப்படுத்தல் மற்றும் முதியோர், குழந்தைகள் உள்ளிட்ட பாதிக்கப்படக்கூடிய மக்களுக்கு கூடுதல் பாதுகாப்பு ஏற்பாடுகளை மேற்கொள்ளுதல் அவசியமாகியுள்ளது.
பருவநிலை மாற்றத்தின் தாக்கம் தொடர்ந்து அதிகரித்து வரும் நிலையில், எதிர்கால நகர திட்டமிடலில் வெப்ப அபாயத்தை குறைக்கும் நடவடிக்கைகளுக்கு முன்னுரிமை வழங்க வேண்டும் என ஆய்வாளர்கள் வலியுறுத்தியுள்ளனர்.
இதையும் படிங்க: தலைமை செயலகமா? தவெக அலுவலகமா? முதல்வர் விஜய்க்கு வானதி சீனிவாசன் கேள்வி!",0.6333333333333333
