title,url,source,date,language,state,district,search_term,full_text,relevance_score
Jyotiraditya Scindia advises onion remedy amid heatwave in India - The News Mill,https://news.google.com/rss/articles/CBMitwFBVV95cUxQTmJCUS10RlJDbTcxZXM4V3pBTFhveHhVbWZMaTExU3BnQlpBdXI4UTEyT3pfVnFIRTQ5d2VwUTQ4TnIwbTVESjhxUFJSdk5PUjg1MEFNeDlxSUpKMUFoR3h5Wjdnek1tY1Fsc1d0SkJ0bVdRM2FOd1k2TkY1Sk9FNnVEYTZGT2xtZTg2cGN5ZExReTJMc1BYVGJBVHZCOW9lcXp6WTF0NXpZNG9IYklMcFhDZDFpNFk?oc=5,The News Mill,2026-05-04T09:02:22+05:30,en,Madhya Pradesh,Shivpuri,"""heatwave"" Madhya Pradesh","Union Minister Jyotiraditya Scindia has advised people to carry an onion as a traditional remedy during the ongoing heatwave, while stating that he avoids using air conditioning even in extreme summer temperatures. Speaking to the public in Shivpuri, Madhya Pradesh, on April 26, Scindia said, “I don’t use air conditioning in my car, nor do I sit in an air-conditioned environment. And when people ask me, even in the 51-degree heat of May and June, I say, ‘This is Chambal skin.’ And let me tell you something else: I look a little young, but my soul is very old. Keep an onion in your pocket.”
He added, “Nothing will happen to you. And in today’s times, everyone is carrying boxes. The communication minister is carrying onions. These are old things. And as Ayurveda progresses, we shouldn’t forget these things.”
The India Meteorological Department (IMD) has issued warnings of heatwave conditions across several parts of India. Maximum temperatures are ranging from 40 to 46 degrees Celsius over most of the country, except in the western Himalayan region, northeast Bihar, and northeast India, where temperatures remain below 36 degrees Celsius. The highest recorded temperature was 46.9 degrees Celsius at Akola.
The IMD forecasted heatwave to severe heatwave conditions in isolated pockets of Himachal Pradesh on April 26, and heatwave conditions on April 27. Further, heatwave conditions are very likely in isolated areas of Jammu and Kashmir on April 26 and 27, and across Punjab, Haryana, Chandigarh, Uttar Pradesh, Rajasthan, Madhya Pradesh, Bihar, and Gujarat during the same period. Similar conditions are expected in parts of Chhattisgarh until April 28.
Additionally, hot and humid weather is anticipated in isolated pockets over Tripura, coastal Maharashtra, and coastal areas of Gujarat on April 26, with similar conditions expected over Tamil Nadu, Puducherry, coastal Andhra Pradesh, Rayalaseema, and Kerala during the specified timeframe.",1.0
