title,url,source,date,language,state,district,search_term,full_text,relevance_score
"IMD Issues Yellow Alert for Coastal Karnataka; Heat, Rain Likely Over Next Four Days - Mangalore Today",https://news.google.com/rss/articles/CBMiwAFBVV95cUxPeXdtNDJ1a0lVcVowS2Z2SDEwZG1LMEtub3ZISGxuaFBNRUNwWWRNUEFOTktoeHllcDltQVBZOERXXzlSV1ZDakktY014WTRDUjBTVm1GN0cwZEhmWkJRRmNtdFZDMUFYNWlwZ0s2YnVXWS1OM0xBM2tLV0gyd0xFcUdocDFrOTNUeWIxTGZUQ0NVejE4aWIyVUw2WXRyTkE1bktxeFlQNjJYUjZnbWtpUUZQUmU2ZTJsSW9DU1lCV20?oc=5,Mangalore Today,2026-04-26T10:56:15+05:30,en,Karnataka,Dakshina Kannada,"(""heat advisory"" OR ""heat action plan"" OR ""heat alert"" OR ""IMD warning"" OR ""IMD alert"" OR ""red alert"" OR ""orange alert"" OR ""yellow alert"" OR ""NDMA advisory"" OR ""cooling shelter"" OR ""relief measures"" OR ""heat compensation"" OR ""severe weather warning"") Karnataka","Mangaluru/Udupi, Apr 26, 2026: The India Meteorological Department (IMD) has forecast a mix of weather conditions across coastal Karnataka over the next four days, with a Yellow Alert in place from April 26 to 29 for moderate rain accompanied by thunder and lightning.
While rainfall is expected, heat and humidity will continue to persist in Dakshina Kannada and Udupi districts, with the possibility of heatwave-like conditions during the afternoon hours.
The region witnessed moderate rainfall on the night of April 24, followed by mostly cloudy skies and intermittent sunshine on Friday and Saturday. Rain was also reported in parts of Byndoor late Friday night.
In Mangaluru, the maximum temperature on Saturday was recorded at 34.7°C, 0.3°C above normal, while the minimum stood at 25.3°C, slightly above the seasonal average. High humidity levels continued to affect daily life.
The IMD has advised fishermen and coastal residents to exercise caution during periods of thunder and lightning. Residents have also been urged to stay hydrated and take precautions against the combined impact of heat and sudden thundershowers.",1.0
