title,url,source,date,language,state,district,search_term,full_text,relevance_score
"Mumbai Weather LATEST Update: Rain, Hailstorm Alert in Vidarbha and Marathwada; Konkan Faces Heatwave - Asianet Newsable",https://news.google.com/rss/articles/CBMi4wFBVV95cUxNb1o5UF9VbUdmQUZjY2RQY3RydnlRRGw2b0JGUHpxRFNQcXJJNjRBRFFIOXc3UXlQSHNfMld4dXFPVHVxWTNvT0xuQUxLdVdNSDFVdDFtdGREMzYwM0JOOXVfWnRSa0doZ1M5N0JPUnhoYzJhM0FSYjZSSDJXMXZTUTJjbk1UdXVMOU1kS3piOTlSTkV5cEllVlJlMHRMWUw1bERHN012YlUzaVNqdDdvMmE3OTF4ZHdzX2IxNzVKc19GN0NjTERrU3p3cWhHRjJfVDJIa0djLXBMUnhmb29sb0tMc9IB6AFBVV95cUxNQzdDZDd1WUxhUEo2c25iNWNCU0wwYnFUNWtTcUo2eTNmRFFoTndhNUtOWllHOUJxcVpxNkV1aGJqdmMydEdrNjE5ak9NUmZFRGNmdHRZMk9QRktHU2lGby1wSldCeTRhTnVrcmNlMmotSHl4aHB3LTE3SlRYY2RJY0R6WF9xODBXRlpLWnI4M3VTY0FXcGNwNnphOTluWExSd1B5c2UzeHVOTTYteW9POEdMYmxuUHZPQklDWlM2eDJhZTJoc2ZZMnd0Q0c3bFhCMWNEdzZwai1jc1htNVpmUVF4MGlxbDBo?oc=5,Asianet Newsable,2026-05-08T08:27:27+05:30,en,Dadra and Nagar Haveli and Daman and Diu,,"(heatwave OR ""heat wave"" OR ""severe heatwave"" OR ""extreme heat"" OR ""heat spell"" OR ""scorching heat"" OR ""blistering heat"" OR ""sweltering heat"" OR ""hot winds"" OR loo OR ""hot loo winds"" OR ""intense heat"" OR ""unbearable heat"" OR ""deadly heat"" OR heat OR ""weather forecast"" OR ""weather update"" OR ""weather alert"" OR ""IMD forecast"" OR ""IMD prediction"" OR ""IMD alert"" OR IMD OR ""rising temperatures"" OR ""temperatures expected to rise"" OR ""relief from heat"" OR ""respite from heat"" OR ""heat respite"" OR ""respite from scorching heat"") Dadra and Nagar Haveli and Daman and Diu","Mumbai Weather LATEST Update: Rain, Hailstorm Alert in Vidarbha and Marathwada; Konkan Faces Heatwave
Mumbai Weather LATEST Update: Maharashtra is witnessing extreme weather swings, with thunderstorms and hail likely in Vidarbha and Marathwada, while Mumbai and the Konkan region continue to battle intense heat and humidity
Thunderstorms and Hail Likely in Vidarbha and Marathwada
The IMD has warned of thunderstorms accompanied by lightning and possible hailstorms in parts of Vidarbha and Marathwada. Several districts in these regions have been placed under an orange alert due to the possibility of intense weather activity.
Cities and districts in Vidarbha that recently recorded temperatures close to 46 degrees Celsius are now expected to see a slight dip in mercury levels because of cloud cover and rainfall. However, the changing weather pattern has raised concerns among farmers, especially in districts such as Beed, Latur and Dharashiv, where hailstorms could damage standing crops.
Mumbai and Konkan Continue to Struggle With Heat and Humidity
While inland Maharashtra experiences rain, Mumbai and the Konkan coast are dealing with uncomfortable heat and rising humidity. Residents across Mumbai, Thane, Palghar, Raigad and Sindhudurg are facing sticky and exhausting weather conditions.
The IMD has issued a yellow alert for heatwave-like conditions in the Konkan belt. The next two days are expected to remain extremely warm and humid. Some southern Konkan areas could witness light rain, but it is unlikely to bring significant relief from the oppressive weather.
Strong Winds and Rising Temperatures Expected Across Other Regions
Western Maharashtra districts including Pune, Satara and Kolhapur are likely to experience gusty winds reaching speeds of 40 to 50 kmph, along with moderate rainfall in ghat areas. Meanwhile, North Maharashtra continues to face intense summer heat.
Temperatures in Jalgaon and Dhule may cross 44 degrees Celsius, according to weather forecasts. Although rainfall activity may continue in a few regions till Saturday, meteorologists predict that maximum temperatures across Maharashtra could rise again by 2 to 3 degrees Celsius over the following days.
Authorities have urged people to avoid stepping outdoors between noon and 4 pm unless necessary and to stay hydrated as fluctuating weather conditions may lead to heat-related health issues.
Stay updated with the Breaking News Today and Latest News from across India and around the world. Get real-time updates, in-depth analysis, and comprehensive coverage of India News, World News, Indian Defence News, Kerala News, and Karnataka News. From politics to current affairs, follow every major story as it unfolds. Get real-time updates from IMDon major cities weather forecasts, including Rain alerts, Cyclonewarnings, and temperature trends. Download the Asianet News Official App from the Android Play Store and iPhone App Store for accurate and timely news updates anytime, anywhere.",1.0
