title,url,source,date,language,state,district,search_term,full_text,relevance_score
"UP Weather Update: पूर्वांचल में लू का तांडव! 16 से 19 मई तक यलो अलर्ट, घर से निकलने से पहले पढ़ लें ये खबर - UPUKLive",https://news.google.com/rss/articles/CBMi5wFBVV95cUxPQWZ3dmZnRUVfRXloeGtMRDdHdWhITUdraGpjOExoUm1ob3JlUFBXbVFrYkZoeE5WRXhUYXF3ZTdKQmhqTVdQOWcwTTBEZTR2SWdlNG9ZajBzeG03bHoyRVFIUk1xcEljWnZSR1lWMGtjQjJHVjJkTk1qSDQycGJEVk5mN3JTRjdtZW9za2lMaXM4bGJCdGJ3bnFnUkpmbll6VDJfeUx0QVlneExPY0R1UUQ2OUhoSGQtVXNqSmV0dEowOVZtS3lUSnltMWZJUFhoQ0h0MkhtSm1FcVl0RE9DOWlwU2RtVU0?oc=5,UPUKLive,2026-05-15T15:35:35+05:30,hi,Uttar Pradesh,Varanasi,"""लू"" Uttar Pradesh","वाराणसी: उत्तर प्रदेश में मौसम का मिजाज अब खतरनाक रुख अख्तियार करने वाला है। बीते दिनों हुई आंधी और बारिश से मिली राहत अब पूरी तरह खत्म हो गई है और अब भीषण गर्मी के साथ लू (Heatwave) का टॉर्चर शुरू होने वाला है। मौसम विभाग ने काशी समेत पूरे पूर्वांचल के लिए खतरे की घंटी बजा दी है, जिससे अगले कुछ दिनों में आम जनजीवन बुरी तरह प्रभावित हो सकता है।
16 से 19 मई तक यलो अलर्ट जारी
आंचलिक मौसम विज्ञान केंद्र ने वाराणसी और आसपास के जिलों के लिए ‘यलो अलर्ट’ जारी किया है। मौसम वैज्ञानिकों के मुताबिक, 16 मई से 19 मई के बीच सूरज की तपिश और तेज गर्म हवाएं लोगों को बेहाल करेंगी। आज की बात करें तो अधिकतम तापमान 41 डिग्री सेल्सियस और न्यूनतम 28 डिग्री सेल्सियस के करीब रहा। हवा की रफ्तार धीमी है, जिससे उमस और गर्मी का असर ज्यादा महसूस हो रहा है। इससे पहले गुरुवार को पारा 40 डिग्री था, लेकिन अब इसमें तेजी से उछाल आने वाला है।
47 डिग्री के पार जाएगा पारा, टूटेगा रिकॉर्ड
वरिष्ठ मौसम विज्ञानी डॉ. अतुल कुमार सिंह ने चेतावनी दी है कि अगले एक-दो दिनों में काशी क्षेत्र पूरी तरह लू की चपेट में आ जाएगा। अनुमान है कि अगले एक हफ्ते के भीतर तापमान में 5 से 7 डिग्री सेल्सियस की भारी बढ़ोतरी होगी। 20 मई तक दिन का अधिकतम तापमान 47 डिग्री सेल्सियस तक पहुंच सकता है। अगर ऐसा हुआ तो यह इस सीजन की सबसे भयंकर गर्मी होगी, जो पिछले कई रिकॉर्ड तोड़ सकती है। विशेषज्ञों ने सलाह दी है कि दोपहर के समय घर से बाहर न निकलें और शरीर में पानी की कमी न होने दें।
आंधी-बारिश से हुए नुकसान की रिपोर्ट
गर्मी की इस चेतावनी के बीच बीते बुधवार को आई आंधी और बारिश ने जिले में काफी तबाही मचाई है। जिला प्रशासन की रिपोर्ट के अनुसार, इस प्राकृतिक आपदा में एक व्यक्ति गंभीर रूप से घायल हुआ है, जिसका अस्पताल में इलाज चल रहा है। इसके अलावा, बेजुबान पशुओं पर भी कहर टूटा है, जिसमें छह पशुओं की जान चली गई। जिले में 14 मकान क्षतिग्रस्त हुए हैं और चार पशुबाड़ों को भी भारी नुकसान पहुंचा है। प्रशासन अब राहत और बचाव कार्य के साथ-साथ नुकसान के आकलन में जुटा है।",1.0
