title,url,source,date,language,state,district,search_term,full_text,relevance_score
"दिल्ली में मौसम का यू-टर्न, तेज आंधी के साथ हुई बारिश तो गर्मी से मिली राहत, जानें IMD का अपडेट",https://www.abplive.com/states/delhi-ncr/delhi-weather-today-rain-accompanied-by-a-storm-today-18th-march-delhi-weather-ann-3103754,ABP News,2026-03-19T20:09:47+05:30,hi,Delhi,,"(लू OR ""लू चलना"" OR ""भीषण गर्मी"" OR ""प्रचंड गर्मी"" OR ""कड़ी धूप"" OR ""तेज धूप"" OR ""गर्म हवा"" OR ""उष्ण लहर"" OR ""ताप लहर"" OR ""हीट वेव"" OR ""झुलसाने वाली गर्मी"" OR ""तपती गर्मी"" OR ""भयंकर गर्मी"") Delhi","दिल्ली में मौसम का यू-टर्न, तेज आंधी के साथ हुई बारिश तो गर्मी से मिली राहत, जानें IMD का अपडेट
Delhi Weather Update: दिल्ली में गुरुवार (18 मार्च 2026) को तेज हवाओं के साथ हुई बारिश ने लोगों को गर्मी से राहत दिलाई है, बारिश का असर ट्रैफिक के साथ-साथ हवाई सेवाओं पर भी पड़ा है.
राजधानी दिल्ली में गुरुवार एक बार फिर मौसम ने करवट ली है, जिससे लोगों को चिल-चिलाती गर्मी से थोड़ी राहत मिली है. दिल्ली में तेज हवाओं के साथ शुरू हुई बारिश ने पूरे शहर का मिजाज ठंडा कर दिया. हल्की से मध्यम बारिश के बीच कई इलाकों में ट्रैफिक की रफ्तार भी धीमी पड़ गई. साथ ही खराब मौसम की वजह से 22 उड़ानों को डायवर्ट करना पड़ा.
पश्चिमी विक्षोभ के असर से मौसम का यह बदलाव देखने को मिला. बारिश के साथ तेज हवाओं ने ज्यादा प्रभाव डाला. करीब 60 किलोमीटर प्रति घंटे की रफ्तार से चली हवाओं ने कई जगह लोगों को असहज कर दिया. धूल भरी आंधी ने भी दृश्यता कम कर दी और लोगों को दिक्कतों का सामना करना पड़ा.
मौसम विभाग का अलर्ट, दो दिन और ऐसा ही रहेगा हाल
मौसम विभाग ने आने वाले दिनों को लेकर भी चेतावनी जारी की है. 19 और 20 मार्च तक इसी तरह का मौसम बने रहने की संभावना जताई गई है. येलो अलर्ट जारी करते हुए लोगों को सतर्क रहने की सलाह दी गई है. खासतौर पर तेज हवा और आंधी के दौरान खुले स्थानों से दूर रहने को कहा गया है. खराब मौसम का असर हवाई सेवाओं पर भी पड़ा और 22 उड़ानों को डायवर्ट करना पड़ा.
दिल्ली के अलग-अलग इलाकों में दर्ज हुई अलग-अलग बारिश
राजधानी के विभिन्न हिस्सों में बारिश का स्तर अलग-अलग रहा. सफदरजंग और लोधी रोड में 8.2 मिमी बारिश दर्ज की गई, जबकि रिज इलाके में 8.6 मिमी बारिश हुई. पालम में 6.2 मिमी और आयानगर में 7.2 मिमी बारिश रिकॉर्ड की गई. पीतमपुरा में 5.5 मिमी, मयूर विहार में 3 मिमी और जनकपुरी में 12.5 मिमी बारिश दर्ज की गई.
तापमान में मामूली गिरावट
बारिश के चलते तापमान में हल्की गिरावट दर्ज की गई है. न्यूनतम तापमान सामान्य से थोड़ा ऊपर 17.6 डिग्री सेल्सियस रहा. वहीं अधिकतम तापमान करीब 29 डिग्री सेल्सियस तक रहने का अनुमान है.
हवा में सुधार, AQI मध्यम श्रेणी में पहुंचा
बारिश और तेज हवाओं का असर वायु गुणवत्ता पर भी देखने को मिला. सुबह के समय एयर क्वालिटी इंडेक्स 153 दर्ज किया गया, जो ‘मध्यम’ श्रेणी में आता है. इससे पहले के मुकाबले हवा में थोड़ी राहत महसूस की गई.
जल्द खत्म होगी ठंडक, फिर लौटेगी गर्मी
मौसम में आई यह राहत ज्यादा दिनों तक टिकने वाली नहीं है. मौसम विभाग के अनुसार 22 मार्च के बाद तापमान में फिर बढ़ोतरी शुरू हो सकती है. यानी कुछ दिनों की ठंडक के बाद दिल्ली एक बार फिर गर्मी की चपेट में आ सकती है.
Source: IOCL",0.6833333333333333
"Delhi Weather Update: तेज हवाएं-धूल भरी आंधी, ऑरेंज अलर्ट जारी - Tez Tarrar News",https://news.google.com/rss/articles/CBMiqgFBVV95cUxOeGVVMkdoaG9hdzhLc28tblJBeVBEWU5WUTBDbUlKdFFpY2xSUVl2djZCUkgtcjBMVGs0RUVXMWtlWEM3MzItYUtLTUhtTlJtRzdjaGxMNEJrR1dwd3dHemppTTBfV0pqSWc0Ujc0cTBpMFdzdHVZRm9yRS1rWG5xMlNfbUotY3p2VFF4VXV2QjRFVWJpRTNwT0NMVFgzSW83eWZfUnRPcEgxQQ?oc=5,Tez Tarrar News,2026-03-19T13:35:00+05:30,hi,Delhi,,"(""हीट एक्शन प्लान"" OR ""गर्मी से राहत"" OR चेतावनी OR ""रेड अलर्ट"" OR ""ऑरेंज अलर्ट"" OR ""येलो अलर्ट"" OR एडवाइजरी OR ""राहत सामग्री"" OR ""राहत शिविर"" OR मुआवजा) Delhi","Delhi Weather Update: तेज हवाएं-धूल भरी आंधी, ऑरेंज अलर्ट जारी
Delhi Weather Update: राजधानी दिल्ली-NCR में मौसम ने बदला मिजाज, लोगों को सतर्क रहने की सलाह
दिल्ली-NCR में मौसम ने अचानक करवट ले ली है। गुरुवार को तेज हवाओं के साथ धूल भरी आंधी आने की संभावना जताई गई है। भारतीय मौसम विभाग (IMD) ने इस स्थिति को देखते हुए Orange Alert जारी किया है, जिससे साफ है कि हालात सामान्य नहीं हैं और लोगों को सावधानी बरतने की जरूरत है। मौसम विभाग के मुताबिक, आने वाले कुछ घंटों में हवा की रफ्तार काफी तेज हो सकती है, जिससे visibility कम होने का खतरा है। खासकर खुले इलाकों और सड़कों पर चलने वाले लोगों को अतिरिक्त सावधान रहने की सलाह दी गई है।
इस बदलाव की वजह पश्चिमी विक्षोभ को माना जा रहा है, जो उत्तर भारत के मौसम को प्रभावित कर रहा है। इसके चलते तापमान में गिरावट भी दर्ज की जा सकती है और हल्की बारिश की संभावना से भी इनकार नहीं किया जा सकता। प्रशासन ने भी लोगों से अपील की है कि बिना जरूरी काम के बाहर न निकलें और यदि बाहर जाना पड़े तो safety का ध्यान रखें। खासतौर पर पेड़ों, बिजली के खंभों और कमजोर ढांचों के पास खड़े होने से बचें।
मौसम का यह बदला हुआ रूप कुछ समय के लिए राहत जरूर दे सकता है, लेकिन तेज हवाएं और धूल भरी आंधी कई जगह परेशानी भी खड़ी कर सकती हैं। इसलिए alert रहना ही सबसे बेहतर विकल्प है।",1.0
