title,url,source,date,language,state,district,search_term,full_text,relevance_score
Karnataka Rains: Relief From Heatwave! Karnataka To Witness Thunderstorms Heavy Rain Till May 12 - Asianet Newsable,https://news.google.com/rss/articles/CBMi4wFBVV95cUxPUTNtWVdzanBXVEJDSlk0Y3lhbUk2d1QtZlJlaEZlbVZ2V0Z4Nno0WHNET0xQY0dXa3Y3RjJmd2otUDVZODdoZnhGbTFJamlLRzhNXzYweE1ZXzRFUUcxVE5aQ3Nzdk5YaUI1VXM4NFF3cVBHXzJGaE15TFJ0T01aSkRvYWxBN2hfN3VtLVdtR25iajN0bVBvTEJDWGFIRkRBX09paXRodGhpMmdCMl9SVWRqSDVxd0RlTXFOR2VCX2xiNzBYMjJBM2lpNEdpbnFYVTN3UE9nbnBCQURzTHg1U01Ob9IB6AFBVV95cUxQdXpLR1NFY3BmLWVoS2xvM1MtTmhVU0dfUlVLUG4xRks3Wjd3RDZqNmtkc1JEUTJuWmxKR0ZtNFJrRjJYaENKRWZ6SXFVMkZPYVRWeGJOWHh1cWJMX3ViU0xGaTRRTzdUR3NEbFpyR1JndlJYempNeFhpTjlGcDZIRkhmLVE1dkdfbmRRMWYyU2I5S2c1NTJXX29ZSjFpeXhUSEI2c1V0TUVXbHNqRGExRUtpZUZ3SHZiMXA5Y0tBZlhDZEJkaTNfcmIweUdOZE1TV1Z5LVZyU181SlJaMXB2MTltcE5idTBj?oc=5,Asianet Newsable,2026-05-07T11:00:59+05:30,en,Karnataka,Bagalkot,"(heatwave OR ""heat wave"" OR ""severe heatwave"" OR ""extreme heat"" OR ""heat spell"" OR ""scorching heat"" OR ""blistering heat"" OR ""sweltering heat"" OR ""hot winds"" OR loo OR ""hot loo winds"" OR ""intense heat"" OR ""unbearable heat"" OR ""deadly heat"" OR heat OR ""weather forecast"" OR ""weather update"" OR ""weather alert"" OR ""IMD forecast"" OR ""IMD prediction"" OR ""IMD alert"" OR IMD OR ""rising temperatures"" OR ""temperatures expected to rise"" OR ""relief from heat"" OR ""respite from heat"" OR ""heat respite"" OR ""respite from scorching heat"") Karnataka","Karnataka Rains: Relief From Heatwave! Karnataka To Witness Thunderstorms Heavy Rain Till May 12
Karnataka Rains: After days of intense heat, Karnataka is set to receive widespread rainfall over the next seven days. The IMD has predicted thunderstorms, lightning and strong winds across coastal, south interior and north interior districts
Rain Relief Likely Across Karnataka For The Next 7 Days
The India Meteorological Department has forecast light to moderate rainfall across several parts of Karnataka till May 12. Thunderstorms accompanied by lightning and gusty winds are expected in many districts as temperatures continue to remain high during the daytime.
According to weather officials, dry mornings may continue in most places, but cloud cover is expected to build up during the afternoon hours. This could trigger evening or night showers in several regions. Some districts in South Interior Karnataka may also witness heavy rainfall over the next two days.
The Karnataka State Natural Disaster Management Centre has warned that wind speeds could touch 40 to 50 kmph in isolated areas during thunderstorms.
Coastal And Interior Districts Under Rain And Wind Alert
Moderate rainfall is likely in coastal districts including Mangaluru, Udupi and Uttara Kannada till May 12. These areas are expected to experience cloudy weather after noon along with thunderstorms and winds reaching 30 to 40 kmph.
In North Interior Karnataka, districts such as Belagavi, Vijayapura, Bagalkote, Dharwad and Gadag are also expected to receive rain with strong winds.
Meanwhile, South Interior Karnataka districts including Bengaluru, Mysuru, Mandya, Hassan, Chikkamagaluru and Shivamogga are likely to witness thunderstorms and moderate to heavy rain between May 7 and May 12.
IMD Issues Safety Advisory As Temperatures Remain High
Weather experts say the current spell of thunderstorms is linked to changing local weather patterns triggered by rising temperatures across the state. While rainfall may offer temporary relief from the heat, officials clarified that the southwest monsoon has not officially arrived yet.
The Meteorological Department has advised people to remain cautious during thunderstorms. Residents have been asked to avoid standing under trees, near electric poles or close to water bodies during strong winds and lightning activity.
Farmers and fishermen have also been urged to closely monitor weather forecasts and take necessary precautions before stepping out for work.
Several districts in North Karnataka continue to record high temperatures. Areas like Ballari, Raichur and Kalaburagi are witnessing temperatures close to 38°C, while Vijayanagara recorded one of the highest temperatures at 40°C.
Stay updated with the Breaking News Today and Latest News from across India and around the world. Get real-time updates, in-depth analysis, and comprehensive coverage of India News, World News, Indian Defence News, Kerala News, and Karnataka News. From politics to current affairs, follow every major story as it unfolds. Get real-time updates from IMDon major cities weather forecasts, including Rain alerts, Cyclonewarnings, and temperature trends. Download the Asianet News Official App from the Android Play Store and iPhone App Store for accurate and timely news updates anytime, anywhere.",0.8500000000000001
